West Virginia,Oklahoma State,86,66,37,26,0,Jawun Evans missed Free Throw.
West Virginia,Oklahoma State,86,66,37,26,0,Mitchell Solomon Offensive Rebound.
West Virginia,Oklahoma State,86,66,37,27,0,Foul on Nathan Adrian.
West Virginia,Oklahoma State,86,66,37,27,0,Mitchell Solomon missed Free Throw.
West Virginia,Oklahoma State,86,66,37,27,0,Oklahoma St Deadball Team Rebound.
West Virginia,Oklahoma State,86,67,37,27,1,Mitchell Solomon made Free Throw.
West Virginia,Oklahoma State,88,67,37,51,1,Jevon Carter made Layup.
West Virginia,Oklahoma State,88,67,38,9,0,Jawun Evans missed Layup.
West Virginia,Oklahoma State,88,67,38,11,0,West Virginia Offensive Rebound.
West Virginia,Oklahoma State,88,70,38,16,1,Phil Forte III made Three Point Jumper. Assisted by Jawun Evans.
West Virginia,Oklahoma State,88,70,38,52,0,Daxter Miles Jr. missed Layup.
West Virginia,Oklahoma State,88,70,38,52,0,Mitchell Solomon Defensive Rebound.
West Virginia,Oklahoma State,88,70,39,0,0,Jawun Evans missed Three Point Jumper.
West Virginia,Oklahoma State,88,70,39,8,0,Cameron McGriff Offensive Rebound.
West Virginia,Oklahoma State,88,70,39,8,0,Cameron McGriff Turnover.
West Virginia,Oklahoma State,88,70,39,8,0,Jevon Carter Steal.
West Virginia,Oklahoma State,90,70,39,10,1,Esa Ahmad made Layup. Assisted by Jevon Carter.
West Virginia,Oklahoma State,90,72,39,23,1,Mitchell Solomon made Dunk. Assisted by Jawun Evans.
West Virginia,Oklahoma State,92,72,39,43,1,Daxter Miles Jr. made Dunk. Assisted by Jevon Carter.
West Virginia,Oklahoma State,92,75,39,50,1,Phil Forte III made Three Point Jumper.
West Virginia,Oklahoma State,92,75,40,0,0,End of Game
