Away Team,Home Team,Away Score, Home Score,Minute,Second,isScoringPosession,Desc.
West Virginia,Oklahoma State,0,0,0,0,0,Jump Ball won by Oklahoma St
West Virginia,Oklahoma State,0,0,0,28,0,Phil Forte III missed Three Point Jumper.
West Virginia,Oklahoma State,0,0,0,28,0,Esa Ahmad Defensive Rebound.
West Virginia,Oklahoma State,0,0,0,51,0,Brandon Watkins Turnover.
West Virginia,Oklahoma State,0,0,0,58,0,Foul on Daxter Miles Jr..
West Virginia,Oklahoma State,0,2,1,18,1,Lucas N'Guessan made Dunk. Assisted by Jawun Evans.
West Virginia,Oklahoma State,0,2,1,35,0,Foul on Lucas N'Guessan.
West Virginia,Oklahoma State,1,2,1,35,1,Nathan Adrian made Free Throw.
West Virginia,Oklahoma State,2,2,1,35,1,Nathan Adrian made Free Throw.
West Virginia,Oklahoma State,2,2,1,42,0,Foul on Jevon Carter.
West Virginia,Oklahoma State,2,2,1,46,0,Leyton Hammonds missed Three Point Jumper.
West Virginia,Oklahoma State,2,2,1,46,0,Esa Ahmad Defensive Rebound.
West Virginia,Oklahoma State,4,2,2,6,1,Daxter Miles Jr. made Layup. Assisted by Nathan Adrian.
West Virginia,Oklahoma State,4,2,2,17,0,Phil Forte III missed Layup.
West Virginia,Oklahoma State,4,2,2,17,0,Esa Ahmad Block.
West Virginia,Oklahoma State,4,2,2,17,0,Brandon Watkins Defensive Rebound.
West Virginia,Oklahoma State,4,2,2,28,0,Foul on Lucas N'Guessan.
West Virginia,Oklahoma State,6,2,2,31,1,Sagaba Konate made Dunk. Assisted by Jevon Carter.
West Virginia,Oklahoma State,6,4,2,41,1,Leyton Hammonds made Layup. Assisted by Jawun Evans.
West Virginia,Oklahoma State,6,4,2,55,0,Nathan Adrian missed Layup.
West Virginia,Oklahoma State,6,4,2,55,0,Sagaba Konate Offensive Rebound.
West Virginia,Oklahoma State,8,4,2,59,1,Sagaba Konate made Layup.
West Virginia,Oklahoma State,8,4,3,12,0,Foul on Esa Ahmad.
West Virginia,Oklahoma State,8,5,3,12,1,Jawun Evans made Free Throw.
West Virginia,Oklahoma State,8,5,3,12,0,Jawun Evans missed Free Throw.
West Virginia,Oklahoma State,8,5,3,12,0,Leyton Hammonds Offensive Rebound.
West Virginia,Oklahoma State,8,5,3,19,0,Jawun Evans missed Jumper.
West Virginia,Oklahoma State,8,5,3,19,0,West Virginia Deadball Team Rebound.
West Virginia,Oklahoma State,10,5,3,32,1,Tarik Phillip made Layup.
West Virginia,Oklahoma State,10,5,4,0,0,Foul on Jeffrey Carroll.
West Virginia,Oklahoma State,10,5,4,0,0,Jeffrey Carroll Turnover.
West Virginia,Oklahoma State,10,5,4,16,0,Esa Ahmad Turnover.
West Virginia,Oklahoma State,10,5,4,16,0,Official TV Timeout
West Virginia,Oklahoma State,10,5,4,42,0,Brandon Averette missed Layup.
West Virginia,Oklahoma State,10,5,4,42,0,Leyton Hammonds Offensive Rebound.
West Virginia,Oklahoma State,10,7,4,42,1,Leyton Hammonds made Two Point Tip Shot.
West Virginia,Oklahoma State,10,7,5,10,0,Tarik Phillip missed Layup.
West Virginia,Oklahoma State,10,7,5,10,0,Jeffrey Carroll Defensive Rebound.
West Virginia,Oklahoma State,10,7,5,20,0,Thomas Dziagwa missed Three Point Jumper.
West Virginia,Oklahoma State,10,7,5,20,0,Jeffrey Carroll Offensive Rebound.
West Virginia,Oklahoma State,10,7,5,26,0,Jeffrey Carroll missed Layup.
West Virginia,Oklahoma State,10,7,5,26,0,Nathan Adrian Block.
West Virginia,Oklahoma State,10,7,5,26,0,Nathan Adrian Defensive Rebound.
West Virginia,Oklahoma State,12,7,5,31,1,Daxter Miles Jr. made Layup.
West Virginia,Oklahoma State,12,7,5,31,0,Foul on Brandon Averette.
West Virginia,Oklahoma State,12,7,5,31,0,Daxter Miles Jr. missed Free Throw.
West Virginia,Oklahoma State,12,7,5,31,0,Davon Dillard Defensive Rebound.
West Virginia,Oklahoma State,12,7,5,48,0,Foul on Teyvon Myers.
West Virginia,Oklahoma State,12,7,5,50,0,Foul on Esa Ahmad.
West Virginia,Oklahoma State,12,7,5,56,0,Jawun Evans Turnover.
West Virginia,Oklahoma State,12,7,5,56,0,Jevon Carter Steal.
West Virginia,Oklahoma State,14,7,5,59,1,Daxter Miles Jr. made Layup. Assisted by Jevon Carter.
West Virginia,Oklahoma State,14,7,6,20,0,Davon Dillard missed Three Point Jumper.
West Virginia,Oklahoma State,14,7,6,20,0,Jevon Carter Defensive Rebound.
West Virginia,Oklahoma State,16,7,6,25,1,Daxter Miles Jr. made Layup. Assisted by Tarik Phillip.
West Virginia,Oklahoma State,16,7,6,28,0,Sagaba Konate Turnover.
West Virginia,Oklahoma State,16,7,6,28,0,Davon Dillard Steal.
West Virginia,Oklahoma State,16,7,7,25,0,Jawun Evans missed Layup.
West Virginia,Oklahoma State,16,7,7,25,0,Sagaba Konate Defensive Rebound.
West Virginia,Oklahoma State,16,7,7,35,0,Foul on Jawun Evans.
West Virginia,Oklahoma State,17,7,7,35,1,Jevon Carter made Free Throw.
West Virginia,Oklahoma State,18,7,7,35,1,Jevon Carter made Free Throw.
West Virginia,Oklahoma State,19,7,7,35,1,Jevon Carter made Free Throw.
West Virginia,Oklahoma State,19,9,7,40,1,Phil Forte III made Jumper. Assisted by Jawun Evans.
West Virginia,Oklahoma State,21,9,7,58,1,Jevon Carter made Jumper. Assisted by Daxter Miles Jr..
West Virginia,Oklahoma State,21,11,8,14,1,Jawun Evans made Layup.
West Virginia,Oklahoma State,21,11,8,33,0,Brandon Watkins missed Jumper.
West Virginia,Oklahoma State,21,11,8,33,0,West Virginia Offensive Rebound.
West Virginia,Oklahoma State,21,11,8,38,0,Official TV Timeout
West Virginia,Oklahoma State,21,11,8,38,0,Foul on Lindy Waters III.
West Virginia,Oklahoma State,23,11,8,45,1,Daxter Miles Jr. made Jumper.
West Virginia,Oklahoma State,23,11,9,6,0,Mitchell Solomon missed Jumper.
West Virginia,Oklahoma State,23,11,9,6,0,Lamont West Defensive Rebound.
West Virginia,Oklahoma State,23,11,9,20,0,Daxter Miles Jr. missed Layup.
West Virginia,Oklahoma State,23,11,9,20,0,Mitchell Solomon Block.
West Virginia,Oklahoma State,23,11,9,20,0,Phil Forte III Defensive Rebound.
West Virginia,Oklahoma State,23,11,9,40,0,Foul on Lamont West.
West Virginia,Oklahoma State,23,11,9,40,0,Cameron McGriff missed Free Throw.
West Virginia,Oklahoma State,23,11,9,40,0,Oklahoma St Deadball Team Rebound.
West Virginia,Oklahoma State,23,12,9,40,1,Cameron McGriff made Free Throw.
West Virginia,Oklahoma State,26,12,9,59,1,Lamont West made Three Point Jumper. Assisted by Teyvon Myers.
West Virginia,Oklahoma State,26,14,10,21,1,Cameron McGriff made Layup. Assisted by Jawun Evans.
West Virginia,Oklahoma State,26,14,10,21,0,Foul on Brandon Watkins.
West Virginia,Oklahoma State,26,15,10,21,1,Cameron McGriff made Free Throw.
West Virginia,Oklahoma State,26,15,10,32,0,Tarik Phillip missed Three Point Jumper.
West Virginia,Oklahoma State,26,15,10,32,0,West Virginia Offensive Rebound.
West Virginia,Oklahoma State,26,15,10,49,0,Nathan Adrian missed Three Point Jumper.
West Virginia,Oklahoma State,26,15,10,49,0,Nathan Adrian Offensive Rebound.
West Virginia,Oklahoma State,26,15,10,54,0,Nathan Adrian Turnover.
West Virginia,Oklahoma State,26,15,10,54,0,Phil Forte III Steal.
West Virginia,Oklahoma State,26,17,11,0,1,Phil Forte III made Layup.
West Virginia,Oklahoma State,29,17,11,21,1,Jevon Carter made Three Point Jumper. Assisted by Nathan Adrian.
West Virginia,Oklahoma State,29,20,11,42,1,Leyton Hammonds made Three Point Jumper. Assisted by Jawun Evans.
West Virginia,Oklahoma State,29,20,12,4,0,Jevon Carter missed Three Point Jumper.
West Virginia,Oklahoma State,29,20,12,4,0,Cameron McGriff Defensive Rebound.
West Virginia,Oklahoma State,29,20,12,12,0,Official TV Timeout
West Virginia,Oklahoma State,29,20,12,12,0,Jump Ball won by Oklahoma St
West Virginia,Oklahoma State,29,20,12,14,0,Jeffrey Carroll Turnover.
West Virginia,Oklahoma State,29,20,12,14,0,Jevon Carter Steal.
West Virginia,Oklahoma State,29,20,12,23,0,Jevon Carter missed Layup.
West Virginia,Oklahoma State,29,20,12,23,0,Leyton Hammonds Defensive Rebound.
West Virginia,Oklahoma State,29,20,12,25,0,Oklahoma St  Timeout
West Virginia,Oklahoma State,29,23,12,44,1,Leyton Hammonds made Three Point Jumper. Assisted by Brandon Averette.
West Virginia,Oklahoma State,29,23,13,5,0,Tarik Phillip missed Three Point Jumper.
West Virginia,Oklahoma State,29,23,13,5,0,Brandon Averette Defensive Rebound.
West Virginia,Oklahoma State,29,23,13,13,0,Brandon Averette missed Layup.
West Virginia,Oklahoma State,29,23,13,13,0,Daxter Miles Jr. Block.
West Virginia,Oklahoma State,29,23,13,13,0,Jevon Carter Defensive Rebound.
West Virginia,Oklahoma State,31,23,13,35,1,Sagaba Konate made Dunk. Assisted by Daxter Miles Jr..
West Virginia,Oklahoma State,31,23,13,49,0,Cameron McGriff Turnover.
West Virginia,Oklahoma State,31,23,14,10,0,Foul on Leyton Hammonds.
West Virginia,Oklahoma State,32,23,14,10,1,Daxter Miles Jr. made Free Throw.
West Virginia,Oklahoma State,32,23,14,10,0,Daxter Miles Jr. missed Free Throw.
West Virginia,Oklahoma State,32,23,14,10,0,Jeffrey Carroll Defensive Rebound.
West Virginia,Oklahoma State,32,23,14,13,0,Jeffrey Carroll Turnover.
West Virginia,Oklahoma State,32,23,14,13,0,Jevon Carter Steal.
West Virginia,Oklahoma State,32,23,14,18,0,Daxter Miles Jr. missed Layup.
West Virginia,Oklahoma State,32,23,14,18,0,Brandon Watkins Offensive Rebound.
West Virginia,Oklahoma State,32,23,14,18,0,Brandon Watkins missed Two Point Tip Shot.
West Virginia,Oklahoma State,32,23,14,18,0,Leyton Hammonds Defensive Rebound.
West Virginia,Oklahoma State,32,23,14,27,0,Leyton Hammonds missed Three Point Jumper.
West Virginia,Oklahoma State,32,23,14,27,0,Jeffrey Carroll Offensive Rebound.
West Virginia,Oklahoma State,32,25,14,31,1,Jeffrey Carroll made Layup.
West Virginia,Oklahoma State,32,25,14,38,0,Daxter Miles Jr. missed Three Point Jumper.
West Virginia,Oklahoma State,32,25,14,38,0,Oklahoma St Defensive Rebound.
West Virginia,Oklahoma State,32,25,14,58,0,Brandon Averette Turnover.
West Virginia,Oklahoma State,34,25,15,4,1,Brandon Watkins made Layup. Assisted by Tarik Phillip.
West Virginia,Oklahoma State,34,25,15,10,0,Foul on Jawun Evans.
West Virginia,Oklahoma State,34,25,15,10,0,Jawun Evans Turnover.
West Virginia,Oklahoma State,34,25,15,26,0,Brandon Watkins Turnover.
West Virginia,Oklahoma State,34,25,15,39,0,Jeffrey Carroll Turnover.
West Virginia,Oklahoma State,36,25,15,48,1,Jevon Carter made Layup.
West Virginia,Oklahoma State,36,25,16,3,0,Jeffrey Carroll Turnover.
West Virginia,Oklahoma State,36,25,16,3,0,Official TV Timeout
West Virginia,Oklahoma State,36,25,16,18,0,Teyvon Myers missed Jumper.
West Virginia,Oklahoma State,36,25,16,18,0,Nathan Adrian Offensive Rebound.
West Virginia,Oklahoma State,36,25,16,32,0,Jevon Carter missed Jumper.
West Virginia,Oklahoma State,36,25,16,32,0,Leyton Hammonds Defensive Rebound.
West Virginia,Oklahoma State,36,25,16,42,0,Phil Forte III missed Three Point Jumper.
West Virginia,Oklahoma State,36,25,16,42,0,Brandon Watkins Defensive Rebound.
West Virginia,Oklahoma State,39,25,16,54,1,Jevon Carter made Three Point Jumper. Assisted by Tarik Phillip.
West Virginia,Oklahoma State,39,25,16,59,0,Oklahoma St  Timeout
West Virginia,Oklahoma State,39,25,17,12,0,Mitchell Solomon missed Jumper.
West Virginia,Oklahoma State,39,25,17,12,0,Jevon Carter Defensive Rebound.
West Virginia,Oklahoma State,41,25,17,40,1,Sagaba Konate made Dunk. Assisted by Teyvon Myers.
West Virginia,Oklahoma State,41,27,18,7,1,Mitchell Solomon made Dunk. Assisted by Lindy Waters III.
West Virginia,Oklahoma State,41,27,18,25,0,Foul on Mitchell Solomon.
West Virginia,Oklahoma State,41,27,18,25,0,Teyvon Myers missed Free Throw.
West Virginia,Oklahoma State,41,27,18,25,0,Phil Forte III Defensive Rebound.
West Virginia,Oklahoma State,41,27,18,39,0,Lindy Waters III missed Layup.
West Virginia,Oklahoma State,41,27,18,39,0,Nathan Adrian Block.
West Virginia,Oklahoma State,41,27,18,39,0,Lindy Waters III Offensive Rebound.
West Virginia,Oklahoma State,41,27,18,44,0,Lindy Waters III missed Layup.
West Virginia,Oklahoma State,41,27,18,44,0,Tarik Phillip Defensive Rebound.
West Virginia,Oklahoma State,41,27,18,52,0,West Virginia  Timeout
West Virginia,Oklahoma State,41,27,18,52,0,Foul on Tarik Phillip.
West Virginia,Oklahoma State,41,27,19,2,0,Tarik Phillip Turnover.
West Virginia,Oklahoma State,41,27,19,19,0,Foul on Daxter Miles Jr..
West Virginia,Oklahoma State,41,27,19,19,0,Lindy Waters III missed Free Throw.
West Virginia,Oklahoma State,41,27,19,19,0,Oklahoma St Deadball Team Rebound.
West Virginia,Oklahoma State,41,28,19,19,1,Lindy Waters III made Free Throw.
West Virginia,Oklahoma State,41,28,19,42,0,Nathan Adrian missed Jumper.
West Virginia,Oklahoma State,41,28,19,42,0,Sagaba Konate Offensive Rebound.
West Virginia,Oklahoma State,41,28,20,0,0,End of 1st half
West Virginia,Oklahoma State,41,28,20,0,0,Jump Ball won by Oklahoma St
West Virginia,Oklahoma State,41,28,20,6,0,Foul on Nathan Adrian.
West Virginia,Oklahoma State,41,30,20,14,1,Jawun Evans made Layup.
West Virginia,Oklahoma State,41,30,20,23,0,Jevon Carter missed Layup.
West Virginia,Oklahoma State,41,30,20,23,0,Lucas N'Guessan Defensive Rebound.
West Virginia,Oklahoma State,41,30,20,30,0,Foul on Jevon Carter.
West Virginia,Oklahoma State,41,33,20,34,1,Leyton Hammonds made Three Point Jumper. Assisted by Jawun Evans.
West Virginia,Oklahoma State,41,33,21,6,0,Jump Ball won by West Virginia
West Virginia,Oklahoma State,41,33,21,7,0,Foul on Phil Forte III.
West Virginia,Oklahoma State,42,33,21,7,1,Daxter Miles Jr. made Free Throw.
West Virginia,Oklahoma State,43,33,21,7,1,Daxter Miles Jr. made Free Throw.
West Virginia,Oklahoma State,43,33,21,7,0,Oklahoma St  Timeout
West Virginia,Oklahoma State,43,35,21,12,1,Leyton Hammonds made Dunk. Assisted by Jawun Evans.
West Virginia,Oklahoma State,43,35,21,17,0,Foul on Jevon Carter.
West Virginia,Oklahoma State,43,35,21,17,0,Jevon Carter Turnover.
West Virginia,Oklahoma State,43,35,21,30,0,Foul on Nathan Adrian.
West Virginia,Oklahoma State,43,35,21,37,0,Jawun Evans Turnover.
West Virginia,Oklahoma State,43,35,21,55,0,Foul on Phil Forte III.
West Virginia,Oklahoma State,43,35,21,59,0,Foul on Lucas N'Guessan.
West Virginia,Oklahoma State,44,35,21,59,1,Brandon Watkins made Free Throw.
West Virginia,Oklahoma State,44,35,21,59,0,Brandon Watkins missed Free Throw.
West Virginia,Oklahoma State,44,35,21,59,0,Daxter Miles Jr. Offensive Rebound.
West Virginia,Oklahoma State,46,35,22,10,1,Nathan Adrian made Dunk. Assisted by Tarik Phillip.
West Virginia,Oklahoma State,46,35,22,21,0,Jeffrey Carroll missed Three Point Jumper.
West Virginia,Oklahoma State,46,35,22,21,0,Tarik Phillip Defensive Rebound.
West Virginia,Oklahoma State,46,35,22,28,0,Tarik Phillip Turnover.
West Virginia,Oklahoma State,46,35,22,28,0,Lindy Waters III Steal.
West Virginia,Oklahoma State,46,37,22,37,1,Jeffrey Carroll made Layup. Assisted by Lindy Waters III.
West Virginia,Oklahoma State,46,37,22,37,0,Foul on Esa Ahmad.
West Virginia,Oklahoma State,46,38,22,37,1,Jeffrey Carroll made Free Throw.
West Virginia,Oklahoma State,46,38,22,55,0,Nathan Adrian missed Three Point Jumper.
West Virginia,Oklahoma State,46,38,22,55,0,Nathan Adrian Offensive Rebound.
West Virginia,Oklahoma State,46,38,23,1,0,Nathan Adrian missed Layup.
West Virginia,Oklahoma State,46,38,23,1,0,Nathan Adrian Offensive Rebound.
West Virginia,Oklahoma State,46,38,23,5,0,Foul on Mitchell Solomon.
West Virginia,Oklahoma State,47,38,23,5,1,Nathan Adrian made Free Throw.
West Virginia,Oklahoma State,48,38,23,5,1,Nathan Adrian made Free Throw.
West Virginia,Oklahoma State,48,38,23,15,0,Jeffrey Carroll missed Jumper.
West Virginia,Oklahoma State,48,38,23,15,0,Daxter Miles Jr. Defensive Rebound.
West Virginia,Oklahoma State,48,38,23,42,0,Foul on Mitchell Solomon.
West Virginia,Oklahoma State,48,38,23,42,0,Sagaba Konate missed Layup.
West Virginia,Oklahoma State,48,38,23,42,0,Jeffrey Carroll Block.
West Virginia,Oklahoma State,48,38,23,42,0,Mitchell Solomon Defensive Rebound.
West Virginia,Oklahoma State,48,38,23,49,0,Foul on Daxter Miles Jr..
West Virginia,Oklahoma State,48,38,23,49,0,Davon Dillard missed Free Throw.
West Virginia,Oklahoma State,48,38,23,49,0,Oklahoma St Deadball Team Rebound.
West Virginia,Oklahoma State,48,38,23,49,0,Davon Dillard missed Free Throw.
West Virginia,Oklahoma State,48,38,23,49,0,Jeffrey Carroll Offensive Rebound.
West Virginia,Oklahoma State,48,38,24,5,0,Foul on Teyvon Myers.
West Virginia,Oklahoma State,48,38,24,5,0,Official TV Timeout
West Virginia,Oklahoma State,48,39,24,5,1,Jawun Evans made Free Throw.
West Virginia,Oklahoma State,48,40,24,5,1,Jawun Evans made Free Throw.
West Virginia,Oklahoma State,50,40,24,16,1,Brandon Watkins made Layup. Assisted by Nathan Adrian.
West Virginia,Oklahoma State,50,40,24,32,0,Oklahoma St  Turnover.
West Virginia,Oklahoma State,50,40,24,37,0,Teyvon Myers missed Layup.
West Virginia,Oklahoma State,50,40,24,37,0,Mitchell Solomon Block.
West Virginia,Oklahoma State,50,40,24,37,0,West Virginia Offensive Rebound.
West Virginia,Oklahoma State,52,40,24,40,1,Daxter Miles Jr. made Layup.
West Virginia,Oklahoma State,52,40,25,19,0,Leyton Hammonds missed Three Point Jumper.
West Virginia,Oklahoma State,52,40,25,19,0,Tarik Phillip Block.
West Virginia,Oklahoma State,52,40,25,19,0,Cameron McGriff Offensive Rebound.
West Virginia,Oklahoma State,52,40,25,26,0,Leyton Hammonds missed Jumper.
West Virginia,Oklahoma State,52,40,25,26,0,Phil Forte III Offensive Rebound.
West Virginia,Oklahoma State,52,40,25,32,0,Phil Forte III Turnover.
West Virginia,Oklahoma State,52,40,25,32,0,Daxter Miles Jr. Steal.
West Virginia,Oklahoma State,54,40,25,39,1,Teyvon Myers made Layup.
West Virginia,Oklahoma State,54,40,25,39,0,Foul on Brandon Averette.
West Virginia,Oklahoma State,55,40,25,39,1,Teyvon Myers made Free Throw.
West Virginia,Oklahoma State,55,42,25,44,1,Phil Forte III made Layup.
West Virginia,Oklahoma State,55,42,26,11,0,Teyvon Myers Turnover.
West Virginia,Oklahoma State,55,42,26,25,0,Jawun Evans missed Jumper.
West Virginia,Oklahoma State,55,42,26,25,0,Brandon Watkins Defensive Rebound.
West Virginia,Oklahoma State,55,42,26,35,0,Foul on Mitchell Solomon.
West Virginia,Oklahoma State,55,42,26,35,0,Esa Ahmad missed Free Throw.
West Virginia,Oklahoma State,55,42,26,35,0,West Virginia Deadball Team Rebound.
West Virginia,Oklahoma State,56,42,26,35,1,Esa Ahmad made Free Throw.
West Virginia,Oklahoma State,56,42,26,45,0,Foul on Sagaba Konate.
West Virginia,Oklahoma State,56,42,26,45,0,Jeffrey Carroll missed Free Throw.
West Virginia,Oklahoma State,56,42,26,45,0,Oklahoma St Deadball Team Rebound.
West Virginia,Oklahoma State,56,43,26,45,1,Jeffrey Carroll made Free Throw.
West Virginia,Oklahoma State,56,43,26,45,0,Foul on Leyton Hammonds.
West Virginia,Oklahoma State,57,43,26,45,1,Sagaba Konate made Free Throw.
West Virginia,Oklahoma State,58,43,26,45,1,Sagaba Konate made Free Throw.
West Virginia,Oklahoma State,58,43,26,55,0,Phil Forte III missed Jumper.
West Virginia,Oklahoma State,58,43,26,55,0,Esa Ahmad Defensive Rebound.
West Virginia,Oklahoma State,58,43,27,4,0,Teyvon Myers Turnover.
West Virginia,Oklahoma State,58,43,27,22,0,Thomas Dziagwa Turnover.
West Virginia,Oklahoma State,58,43,27,22,0,Sagaba Konate Steal.
West Virginia,Oklahoma State,58,43,27,29,0,Teyvon Myers missed Three Point Jumper.
West Virginia,Oklahoma State,58,43,27,29,0,Jawun Evans Defensive Rebound.
West Virginia,Oklahoma State,58,43,27,36,0,Thomas Dziagwa missed Layup.
West Virginia,Oklahoma State,58,43,27,36,0,Jawun Evans Offensive Rebound.
West Virginia,Oklahoma State,58,43,27,39,0,Foul on Sagaba Konate.
West Virginia,Oklahoma State,58,43,27,39,0,Jawun Evans missed Free Throw.
West Virginia,Oklahoma State,58,43,27,39,0,Lamont West Defensive Rebound.
West Virginia,Oklahoma State,61,43,27,57,1,Lamont West made Three Point Jumper. Assisted by Tarik Phillip.
West Virginia,Oklahoma State,61,45,28,20,1,Jeffrey Carroll made Layup.
West Virginia,Oklahoma State,61,45,28,20,0,Foul on Tarik Phillip.
West Virginia,Oklahoma State,61,45,28,20,0,Official TV Timeout
West Virginia,Oklahoma State,61,46,28,20,1,Jeffrey Carroll made Free Throw.
West Virginia,Oklahoma State,64,46,28,44,1,Daxter Miles Jr. made Three Point Jumper. Assisted by Tarik Phillip.
West Virginia,Oklahoma State,64,46,29,14,0,Foul on Daxter Miles Jr..
West Virginia,Oklahoma State,64,47,29,14,1,Jawun Evans made Free Throw.
West Virginia,Oklahoma State,64,48,29,14,1,Jawun Evans made Free Throw.
West Virginia,Oklahoma State,64,48,29,21,0,Foul on Jeffrey Carroll.
West Virginia,Oklahoma State,65,48,29,21,1,Tarik Phillip made Free Throw.
West Virginia,Oklahoma State,66,48,29,21,1,Tarik Phillip made Free Throw.
West Virginia,Oklahoma State,66,50,29,36,1,Leyton Hammonds made Jumper. Assisted by Jawun Evans.
West Virginia,Oklahoma State,66,50,30,5,0,Tarik Phillip missed Jumper.
West Virginia,Oklahoma State,66,50,30,5,0,Brandon Watkins Offensive Rebound.
West Virginia,Oklahoma State,66,50,30,9,0,Teyvon Myers missed Three Point Jumper.
West Virginia,Oklahoma State,66,50,30,9,0,Jeffrey Carroll Defensive Rebound.
West Virginia,Oklahoma State,66,50,30,20,0,Foul on Tarik Phillip.
West Virginia,Oklahoma State,66,51,30,20,1,Jawun Evans made Free Throw.
West Virginia,Oklahoma State,66,51,30,20,0,Jawun Evans missed Free Throw.
West Virginia,Oklahoma State,66,51,30,20,0,Brandon Watkins Defensive Rebound.
West Virginia,Oklahoma State,68,51,30,32,1,Brandon Watkins made Dunk. Assisted by Teyvon Myers.
West Virginia,Oklahoma State,68,51,31,8,0,Jawun Evans missed Three Point Jumper.
West Virginia,Oklahoma State,68,51,31,8,0,Esa Ahmad Defensive Rebound.
West Virginia,Oklahoma State,68,51,31,23,0,Foul on Jeffrey Carroll.
West Virginia,Oklahoma State,69,51,31,23,1,Esa Ahmad made Free Throw.
West Virginia,Oklahoma State,70,51,31,23,1,Esa Ahmad made Free Throw.
West Virginia,Oklahoma State,70,51,31,28,0,Foul on Teyvon Myers.
West Virginia,Oklahoma State,70,52,31,28,1,Jawun Evans made Free Throw.
West Virginia,Oklahoma State,70,53,31,28,1,Jawun Evans made Free Throw.
West Virginia,Oklahoma State,72,53,31,37,1,Sagaba Konate made Dunk. Assisted by Jevon Carter.
West Virginia,Oklahoma State,72,56,32,1,1,Phil Forte III made Three Point Jumper. Assisted by Jawun Evans.
West Virginia,Oklahoma State,72,56,32,24,0,Jevon Carter missed Three Point Jumper.
West Virginia,Oklahoma State,72,56,32,24,0,Oklahoma St Defensive Rebound.
West Virginia,Oklahoma State,72,56,32,28,0,Official TV Timeout
West Virginia,Oklahoma State,72,56,32,28,0,Brandon Averette Turnover.
West Virginia,Oklahoma State,72,56,32,34,0,Foul on Nathan Adrian.
West Virginia,Oklahoma State,72,56,32,34,0,Nathan Adrian Turnover.
West Virginia,Oklahoma State,72,56,32,43,0,Jawun Evans Turnover.
West Virginia,Oklahoma State,72,56,32,43,0,Esa Ahmad Steal.
West Virginia,Oklahoma State,74,56,32,47,1,Nathan Adrian made Layup. Assisted by Teyvon Myers.
West Virginia,Oklahoma State,74,56,33,6,0,Foul on Sagaba Konate.
West Virginia,Oklahoma State,74,57,33,6,1,Mitchell Solomon made Free Throw.
West Virginia,Oklahoma State,74,58,33,6,1,Mitchell Solomon made Free Throw.
West Virginia,Oklahoma State,74,58,33,10,0,Teyvon Myers Turnover.
West Virginia,Oklahoma State,74,61,33,12,1,Phil Forte III made Three Point Jumper. Assisted by Jeffrey Carroll.
West Virginia,Oklahoma State,74,61,33,37,0,Tarik Phillip missed Three Point Jumper.
West Virginia,Oklahoma State,74,61,33,37,0,Nathan Adrian Offensive Rebound.
West Virginia,Oklahoma State,74,61,33,44,0,Foul on Jawun Evans.
West Virginia,Oklahoma State,74,61,33,44,0,Nathan Adrian missed Free Throw.
West Virginia,Oklahoma State,74,61,33,44,0,West Virginia Deadball Team Rebound.
West Virginia,Oklahoma State,75,61,33,44,1,Nathan Adrian made Free Throw.
West Virginia,Oklahoma State,75,61,33,59,0,Jawun Evans Turnover.
West Virginia,Oklahoma State,75,61,33,59,0,Esa Ahmad Steal.
West Virginia,Oklahoma State,77,61,34,2,1,Esa Ahmad made Dunk. Assisted by Jevon Carter.
West Virginia,Oklahoma State,77,61,34,25,0,Jeffrey Carroll missed Layup.
West Virginia,Oklahoma State,77,61,34,25,0,Esa Ahmad Block.
West Virginia,Oklahoma State,77,61,34,25,0,Leyton Hammonds Offensive Rebound.
West Virginia,Oklahoma State,77,61,34,26,0,Foul on Jevon Carter.
West Virginia,Oklahoma State,77,61,34,26,0,Jeffrey Carroll missed Free Throw.
West Virginia,Oklahoma State,77,61,34,26,0,Oklahoma St Deadball Team Rebound.
West Virginia,Oklahoma State,77,61,34,26,0,Jeffrey Carroll missed Free Throw.
West Virginia,Oklahoma State,77,61,34,26,0,Oklahoma St Offensive Rebound.
West Virginia,Oklahoma State,77,61,34,31,0,Lindy Waters III Turnover.
West Virginia,Oklahoma State,80,61,34,49,1,Lamont West made Three Point Jumper. Assisted by Tarik Phillip.
West Virginia,Oklahoma State,80,61,35,10,0,Phil Forte III missed Three Point Jumper.
West Virginia,Oklahoma State,80,61,35,10,0,Nathan Adrian Defensive Rebound.
West Virginia,Oklahoma State,82,61,35,39,1,Daxter Miles Jr. made Layup.
West Virginia,Oklahoma State,82,61,35,51,0,Foul on Lamont West.
West Virginia,Oklahoma State,82,62,35,51,1,Lindy Waters III made Free Throw.
West Virginia,Oklahoma State,82,63,35,51,1,Lindy Waters III made Free Throw.
West Virginia,Oklahoma State,82,63,36,9,0,Daxter Miles Jr. missed Jumper.
West Virginia,Oklahoma State,82,63,36,9,0,Leyton Hammonds Defensive Rebound.
West Virginia,Oklahoma State,82,63,36,21,0,Foul on Brandon Watkins.
West Virginia,Oklahoma State,82,63,36,21,0,Official TV Timeout
West Virginia,Oklahoma State,82,63,36,21,0,Jawun Evans missed Free Throw.
West Virginia,Oklahoma State,82,63,36,21,0,Oklahoma St Deadball Team Rebound.
West Virginia,Oklahoma State,82,64,36,21,1,Jawun Evans made Free Throw.
West Virginia,Oklahoma State,84,64,36,28,1,Brandon Watkins made Layup. Assisted by Daxter Miles Jr..
West Virginia,Oklahoma State,84,64,36,56,0,Leyton Hammonds missed Three Point Jumper.
West Virginia,Oklahoma State,84,64,36,56,0,Tarik Phillip Defensive Rebound.
West Virginia,Oklahoma State,86,64,37,16,1,Esa Ahmad made Layup. Assisted by Tarik Phillip.
West Virginia,Oklahoma State,86,66,37,26,1,Jawun Evans made Layup.
West Virginia,Oklahoma State,86,66,37,26,0,Foul on Brandon Watkins.
