Away Team,Home Team,Away Score, Home Score,Minute,Second,isScoringPosession,Desc.
Bucknell,Butler,0,0,0,16,0,Foul on Zach Thomas.
Bucknell,Butler,0,0,0,16,0,Zach Thomas Turnover.
Bucknell,Butler,0,2,0,27,1,Tyler Wideman made Layup. Assisted by Andrew Chrabascz.
Bucknell,Butler,0,2,0,27,0,Foul on Kimbal Mackenzie.
Bucknell,Butler,0,3,0,27,1,Tyler Wideman made Free Throw.
Bucknell,Butler,0,3,0,35,0,Zach Thomas missed Three Point Jumper.
Bucknell,Butler,0,3,0,35,0,Avery Woodson Defensive Rebound.
Bucknell,Butler,0,3,0,55,0,Tyler Wideman missed Layup.
Bucknell,Butler,0,3,0,55,0,Zach Thomas Defensive Rebound.
Bucknell,Butler,2,3,1,1,1,Kimbal Mackenzie made Layup.
Bucknell,Butler,2,6,1,18,1,Avery Woodson made Three Point Jumper. Assisted by Andrew Chrabascz.
Bucknell,Butler,2,6,1,39,0,Nana Foulland Turnover.
Bucknell,Butler,2,8,2,1,1,Kelan Martin made Jumper.
Bucknell,Butler,4,8,2,23,1,Nana Foulland made Layup.
Bucknell,Butler,4,8,2,31,0,Avery Woodson missed Three Point Jumper.
Bucknell,Butler,4,8,2,31,0,Kelan Martin Offensive Rebound.
Bucknell,Butler,4,8,2,44,0,Foul on Stephen Brown.
Bucknell,Butler,4,8,2,44,0,Tyler Wideman missed Free Throw.
Bucknell,Butler,4,8,2,44,0,Butler Deadball Team Rebound.
Bucknell,Butler,4,9,2,44,1,Tyler Wideman made Free Throw.
Bucknell,Butler,4,9,2,59,0,Nate Jones missed Three Point Jumper.
Bucknell,Butler,4,9,2,59,0,Kelan Martin Defensive Rebound.
Bucknell,Butler,4,11,3,16,1,Tyler Lewis made Layup.
Bucknell,Butler,4,11,3,42,0,Zach Thomas missed Layup.
Bucknell,Butler,4,11,3,42,0,Tyler Wideman Defensive Rebound.
Bucknell,Butler,4,11,3,48,0,Foul on Kimbal Mackenzie.
Bucknell,Butler,4,14,3,56,1,Avery Woodson made Three Point Jumper. Assisted by Kelan Martin.
Bucknell,Butler,4,14,4,13,0,Foul on Stephen Brown.
Bucknell,Butler,4,14,4,13,0,Stephen Brown Turnover.
Bucknell,Butler,4,14,4,13,0,Official TV Timeout
Bucknell,Butler,4,16,4,33,1,Avery Woodson made Jumper.
Bucknell,Butler,4,16,4,59,0,Nate Sestina missed Layup.
Bucknell,Butler,4,16,4,59,0,Avery Woodson Defensive Rebound.
Bucknell,Butler,4,16,5,27,0,Tyler Wideman missed Layup.
Bucknell,Butler,4,16,5,27,0,Nate Sestina Defensive Rebound.
Bucknell,Butler,6,16,5,50,1,Nana Foulland made Jumper.
Bucknell,Butler,6,16,6,9,0,Tyler Lewis missed Three Point Jumper.
Bucknell,Butler,6,16,6,9,0,Nate Jones Defensive Rebound.
Bucknell,Butler,6,16,6,17,0,Foul on Tyler Wideman.
Bucknell,Butler,6,16,6,33,0,John Azzinaro missed Layup.
Bucknell,Butler,6,16,6,33,0,Kamar Baldwin Block.
Bucknell,Butler,6,16,6,37,0,Andrew Chrabascz Defensive Rebound.
Bucknell,Butler,6,16,6,41,0,Foul on Nate Sestina.
Bucknell,Butler,6,17,6,41,1,Kelan Martin made Free Throw.
Bucknell,Butler,6,18,6,41,1,Kelan Martin made Free Throw.
Bucknell,Butler,6,18,7,4,0,Nate Sestina missed Layup.
Bucknell,Butler,6,18,7,4,0,Kelan Martin Block.
Bucknell,Butler,6,18,7,5,0,Bruce Moore Offensive Rebound.
Bucknell,Butler,8,18,7,5,1,Bruce Moore made Layup.
Bucknell,Butler,8,18,7,5,0,Foul on Kelan Martin.
Bucknell,Butler,8,18,7,5,0,Bruce Moore missed Free Throw.
Bucknell,Butler,8,18,7,5,0,Kelan Martin Defensive Rebound.
Bucknell,Butler,8,18,7,22,0,Nate Fowler missed Layup.
Bucknell,Butler,8,18,7,22,0,Nate Sestina Block.
Bucknell,Butler,8,18,7,25,0,Nate Fowler Offensive Rebound.
Bucknell,Butler,8,20,7,34,1,Kamar Baldwin made Jumper.
Bucknell,Butler,11,20,8,2,1,John Azzinaro made Three Point Jumper.
Bucknell,Butler,11,23,8,19,1,Kelan Martin made Three Point Jumper. Assisted by Andrew Chrabascz.
Bucknell,Butler,11,23,8,44,0,Bruce Moore missed Jumper.
Bucknell,Butler,11,23,8,44,0,Kelan Martin Defensive Rebound.
Bucknell,Butler,11,25,8,56,1,Nate Fowler made Layup. Assisted by Andrew Chrabascz.
Bucknell,Butler,11,25,9,4,0,Bucknell  Timeout
Bucknell,Butler,14,25,9,16,1,Nate Jones made Three Point Jumper.
Bucknell,Butler,14,25,9,16,0,Foul on Kelan Martin.
Bucknell,Butler,15,25,9,16,1,Nate Jones made Free Throw.
Bucknell,Butler,15,25,9,37,0,Nate Fowler Turnover.
Bucknell,Butler,15,25,9,40,0,Stephen Brown Steal.
Bucknell,Butler,15,25,10,6,0,D.J. MacLeay missed Jumper.
Bucknell,Butler,15,25,10,6,0,Kamar Baldwin Defensive Rebound.
Bucknell,Butler,15,25,10,15,0,Andrew Chrabascz missed Three Point Jumper.
Bucknell,Butler,15,25,10,15,0,Nate Jones Defensive Rebound.
Bucknell,Butler,15,25,10,29,0,Nate Jones Turnover.
Bucknell,Butler,15,27,10,42,1,Andrew Chrabascz made Layup.
Bucknell,Butler,17,27,11,0,1,Nana Foulland made Layup.
Bucknell,Butler,17,27,11,0,0,Foul on Andrew Chrabascz.
Bucknell,Butler,18,27,11,0,1,Nana Foulland made Free Throw.
Bucknell,Butler,18,30,11,8,1,Sean McDermott made Three Point Jumper. Assisted by Tyler Lewis.
Bucknell,Butler,18,30,11,31,0,Nana Foulland missed Layup.
Bucknell,Butler,18,30,11,31,0,Avery Woodson Defensive Rebound.
Bucknell,Butler,18,30,11,44,0,Andrew Chrabascz Turnover.
Bucknell,Butler,18,30,12,0,0,Zach Thomas missed Layup.
Bucknell,Butler,18,30,12,0,0,Tyler Wideman Defensive Rebound.
Bucknell,Butler,18,32,12,7,1,Andrew Chrabascz made Layup. Assisted by Tyler Lewis.
Bucknell,Butler,18,32,12,23,0,Stephen Brown Turnover.
Bucknell,Butler,18,32,12,25,0,Andrew Chrabascz Steal.
Bucknell,Butler,18,32,12,27,0,Andrew Chrabascz Turnover.
Bucknell,Butler,18,32,12,28,0,Kimbal Mackenzie Steal.
Bucknell,Butler,18,32,12,32,0,Zach Thomas Turnover.
Bucknell,Butler,18,32,12,32,0,Official TV Timeout
Bucknell,Butler,18,32,12,41,0,Andrew Chrabascz missed Layup.
Bucknell,Butler,18,32,12,41,0,Nate Sestina Defensive Rebound.
Bucknell,Butler,18,32,12,52,0,Foul on Andrew Chrabascz.
Bucknell,Butler,20,32,13,0,1,Nana Foulland made Jumper.
Bucknell,Butler,20,34,13,17,1,Tyler Wideman made Layup. Assisted by Tyler Lewis.
Bucknell,Butler,20,34,13,40,0,Zach Thomas Turnover.
Bucknell,Butler,20,34,13,42,0,Sean McDermott Steal.
Bucknell,Butler,20,36,13,49,1,Tyler Wideman made Layup. Assisted by Tyler Lewis.
Bucknell,Butler,20,36,14,4,0,Foul on Tyler Wideman.
Bucknell,Butler,23,36,14,11,1,Zach Thomas made Three Point Jumper.
Bucknell,Butler,23,38,14,28,1,Nate Fowler made Layup. Assisted by Tyler Lewis.
Bucknell,Butler,26,38,14,48,1,Kimbal Mackenzie made Three Point Jumper.
Bucknell,Butler,26,38,15,12,0,Foul on Nate Sestina.
Bucknell,Butler,26,39,15,12,1,Nate Fowler made Free Throw.
Bucknell,Butler,26,39,15,12,0,Nate Fowler missed Free Throw.
Bucknell,Butler,26,39,15,12,0,Nana Foulland Defensive Rebound.
Bucknell,Butler,26,39,15,26,0,Ben Robertson missed Jumper.
Bucknell,Butler,26,39,15,26,0,Butler Defensive Rebound.
Bucknell,Butler,26,39,15,35,0,Tyler Lewis Turnover.
Bucknell,Butler,26,39,15,37,0,Zach Thomas Steal.
Bucknell,Butler,28,39,15,40,1,Ben Robertson made Layup. Assisted by Zach Thomas.
Bucknell,Butler,28,39,16,0,0,Foul on Ben Robertson.
Bucknell,Butler,28,39,16,0,0,Avery Woodson missed Free Throw.
Bucknell,Butler,28,39,16,0,0,Butler Deadball Team Rebound.
Bucknell,Butler,28,39,16,0,0,Avery Woodson missed Free Throw.
Bucknell,Butler,28,39,16,0,0,Nana Foulland Defensive Rebound.
Bucknell,Butler,28,39,16,22,0,Bruce Moore Turnover.
Bucknell,Butler,28,39,16,23,0,Official TV Timeout
Bucknell,Butler,28,41,16,46,1,Kamar Baldwin made Jumper.
Bucknell,Butler,28,41,16,55,0,Zach Thomas missed Three Point Jumper.
Bucknell,Butler,28,41,16,55,0,Henry Baddley Defensive Rebound.
Bucknell,Butler,28,41,17,5,0,Kamar Baldwin missed Jumper.
Bucknell,Butler,28,41,17,5,0,Nana Foulland Defensive Rebound.
Bucknell,Butler,31,41,17,30,1,Zach Thomas made Three Point Jumper.
Bucknell,Butler,31,43,18,3,1,Henry Baddley made Jumper.
Bucknell,Butler,31,43,18,25,0,Foul on Kamar Baldwin.
Bucknell,Butler,32,43,18,25,1,Stephen Brown made Free Throw.
Bucknell,Butler,33,43,18,25,1,Stephen Brown made Free Throw.
Bucknell,Butler,33,43,18,40,0,Foul on Nate Jones.
Bucknell,Butler,33,43,18,40,0,Avery Woodson missed Free Throw.
Bucknell,Butler,33,43,18,40,0,Zach Thomas Defensive Rebound.
Bucknell,Butler,33,43,18,59,0,Zach Thomas Turnover.
Bucknell,Butler,33,43,19,1,0,Henry Baddley Steal.
Bucknell,Butler,33,43,19,17,0,Foul on John Azzinaro.
Bucknell,Butler,33,44,19,17,1,Avery Woodson made Free Throw.
Bucknell,Butler,33,44,19,17,0,Avery Woodson missed Free Throw.
Bucknell,Butler,33,44,19,17,0,Zach Thomas Defensive Rebound.
Bucknell,Butler,33,44,19,47,0,Bucknell  Turnover.
Bucknell,Butler,33,44,19,47,0,Butler  Timeout
Bucknell,Butler,33,44,20,0,0,Kelan Martin missed Three Point Jumper.
Bucknell,Butler,33,44,20,0,0,Nana Foulland Defensive Rebound.
Bucknell,Butler,33,44,20,0,0,End of 1st half
Bucknell,Butler,33,44,20,7,0,Andrew Chrabascz missed Layup.
Bucknell,Butler,33,44,20,7,0,Nana Foulland Block.
Bucknell,Butler,33,44,20,10,0,Zach Thomas Defensive Rebound.
Bucknell,Butler,33,44,20,13,0,Foul on Tyler Lewis.
Bucknell,Butler,33,44,20,26,0,Zach Thomas missed Three Point Jumper.
Bucknell,Butler,33,44,20,26,0,Kelan Martin Defensive Rebound.
Bucknell,Butler,33,44,20,38,0,Foul on Nate Jones.
Bucknell,Butler,33,44,20,48,0,Kelan Martin missed Jumper.
Bucknell,Butler,33,44,20,48,0,Zach Thomas Defensive Rebound.
Bucknell,Butler,33,44,20,54,0,Stephen Brown Turnover.
Bucknell,Butler,33,44,20,56,0,Kelan Martin Steal.
Bucknell,Butler,33,47,21,3,1,Andrew Chrabascz made Three Point Jumper. Assisted by Tyler Lewis.
Bucknell,Butler,33,47,21,22,0,Stephen Brown Turnover.
Bucknell,Butler,33,49,21,52,1,Tyler Wideman made Jumper. Assisted by Kelan Martin.
Bucknell,Butler,33,49,22,6,0,Zach Thomas missed Three Point Jumper.
Bucknell,Butler,33,49,22,6,0,Butler Deadball Team Rebound.
Bucknell,Butler,33,49,22,8,0,Foul on Nana Foulland.
Bucknell,Butler,33,49,22,9,0,Bucknell  Timeout
Bucknell,Butler,33,51,22,18,1,Avery Woodson made Dunk. Assisted by Tyler Wideman.
Bucknell,Butler,35,51,22,36,1,Nana Foulland made Jumper.
Bucknell,Butler,35,53,22,51,1,Tyler Wideman made Layup. Assisted by Tyler Lewis.
Bucknell,Butler,37,53,23,22,1,Nana Foulland made Jumper.
Bucknell,Butler,37,53,23,35,0,Tyler Wideman Turnover.
Bucknell,Butler,37,53,23,50,0,Foul on Nana Foulland.
Bucknell,Butler,37,53,23,50,0,Nana Foulland Turnover.
Bucknell,Butler,37,55,24,6,1,Kelan Martin made Layup.
Bucknell,Butler,37,55,24,19,0,Kimbal Mackenzie Turnover.
Bucknell,Butler,37,55,24,19,0,Official TV Timeout
Bucknell,Butler,37,55,24,27,0,Tyler Lewis missed Jumper.
Bucknell,Butler,37,55,24,27,0,Nate Sestina Defensive Rebound.
Bucknell,Butler,37,55,24,43,0,Nate Sestina missed Three Point Jumper.
Bucknell,Butler,37,55,24,43,0,Kelan Martin Defensive Rebound.
Bucknell,Butler,37,57,24,52,1,Kelan Martin made Jumper.
Bucknell,Butler,37,57,25,21,0,Foul on Nate Sestina.
Bucknell,Butler,37,57,25,21,0,Nate Sestina Turnover.
Bucknell,Butler,37,57,25,39,0,Kelan Martin missed Jumper.
Bucknell,Butler,37,57,25,39,0,Bucknell Defensive Rebound.
Bucknell,Butler,37,57,26,3,0,Zach Thomas missed Layup.
Bucknell,Butler,37,57,26,3,0,Sean McDermott Block.
Bucknell,Butler,37,57,26,5,0,Bucknell Offensive Rebound.
Bucknell,Butler,37,57,26,9,0,Foul on Kelan Martin.
Bucknell,Butler,39,57,26,21,1,Zach Thomas made Layup.
Bucknell,Butler,39,57,26,46,0,Sean McDermott missed Three Point Jumper.
Bucknell,Butler,39,57,26,46,0,Butler Offensive Rebound.
Bucknell,Butler,39,59,26,57,1,Nate Fowler made Layup. Assisted by Sean McDermott.
Bucknell,Butler,41,59,27,14,1,Bruce Moore made Jumper.
Bucknell,Butler,41,62,27,36,1,Kamar Baldwin made Three Point Jumper. Assisted by Nate Fowler.
Bucknell,Butler,41,62,27,46,0,Foul on Andrew Chrabascz.
Bucknell,Butler,41,62,27,51,0,Kimbal Mackenzie missed Layup.
Bucknell,Butler,41,62,27,51,0,Andrew Chrabascz Defensive Rebound.
Bucknell,Butler,41,64,28,4,1,Joey Brunk made Jumper.
Bucknell,Butler,44,64,28,24,1,Bruce Moore made Three Point Jumper. Assisted by Nate Sestina.
Bucknell,Butler,44,64,28,47,0,Joey Brunk missed Jumper.
Bucknell,Butler,44,64,28,47,0,Andrew Chrabascz Offensive Rebound.
Bucknell,Butler,44,67,28,56,1,Kamar Baldwin made Three Point Jumper.
Bucknell,Butler,44,67,29,8,0,Kimbal Mackenzie Turnover.
Bucknell,Butler,44,67,29,10,0,Avery Woodson Steal.
Bucknell,Butler,44,67,29,37,0,Andrew Chrabascz missed Layup.
Bucknell,Butler,44,67,29,37,0,Bruce Moore Defensive Rebound.
Bucknell,Butler,44,67,30,4,0,Matt O'Reilly missed Three Point Jumper.
Bucknell,Butler,44,67,30,4,0,Avery Woodson Defensive Rebound.
Bucknell,Butler,44,67,30,12,0,Butler  Timeout
Bucknell,Butler,44,67,30,12,0,Official TV Timeout
Bucknell,Butler,44,70,30,26,1,Avery Woodson made Three Point Jumper. Assisted by Kamar Baldwin.
Bucknell,Butler,44,70,30,42,0,Stephen Brown Turnover.
Bucknell,Butler,44,70,30,43,0,Kamar Baldwin Steal.
Bucknell,Butler,44,70,30,47,0,Kamar Baldwin Turnover.
Bucknell,Butler,44,70,30,49,0,Stephen Brown Steal.
Bucknell,Butler,44,70,31,3,0,Stephen Brown missed Three Point Jumper.
Bucknell,Butler,44,70,31,3,0,Kamar Baldwin Defensive Rebound.
Bucknell,Butler,44,70,31,13,0,Foul on Matt O'Reilly.
Bucknell,Butler,44,72,31,14,1,Joey Brunk made Layup. Assisted by Kamar Baldwin.
Bucknell,Butler,44,72,31,35,0,Matt O'Reilly missed Three Point Jumper.
Bucknell,Butler,44,72,31,35,0,Kamar Baldwin Defensive Rebound.
Bucknell,Butler,44,72,31,54,0,Avery Woodson missed Jumper.
Bucknell,Butler,44,72,31,54,0,Nana Foulland Defensive Rebound.
Bucknell,Butler,44,72,32,3,0,Matt O'Reilly missed Three Point Jumper.
Bucknell,Butler,44,72,32,3,0,Butler Deadball Team Rebound.
Bucknell,Butler,44,72,32,6,0,Foul on Bruce Moore.
Bucknell,Butler,44,72,32,6,0,Official TV Timeout
Bucknell,Butler,44,72,32,17,0,Kelan Martin Turnover.
Bucknell,Butler,44,72,32,28,0,Foul on Avery Woodson.
Bucknell,Butler,44,72,32,28,0,Nana Foulland missed Free Throw.
Bucknell,Butler,44,72,32,28,0,Bucknell Deadball Team Rebound.
Bucknell,Butler,45,72,32,28,1,Nana Foulland made Free Throw.
Bucknell,Butler,45,72,32,55,0,Kelan Martin missed Layup.
Bucknell,Butler,45,72,32,55,0,Stephen Brown Defensive Rebound.
Bucknell,Butler,45,72,33,3,0,Foul on Avery Woodson.
Bucknell,Butler,46,72,33,3,1,Zach Thomas made Free Throw.
Bucknell,Butler,47,72,33,3,1,Zach Thomas made Free Throw.
Bucknell,Butler,47,72,33,25,0,Tyler Lewis Turnover.
Bucknell,Butler,47,72,33,27,0,Zach Thomas Steal.
Bucknell,Butler,47,72,33,38,0,Foul on Tyler Wideman.
Bucknell,Butler,47,72,33,57,0,Zach Thomas missed Layup.
Bucknell,Butler,47,72,33,57,0,Sean McDermott Defensive Rebound.
Bucknell,Butler,47,74,34,10,1,Tyler Lewis made Jumper.
Bucknell,Butler,49,74,34,25,1,Nana Foulland made Dunk. Assisted by Avi Toomer.
Bucknell,Butler,49,76,34,43,1,Henry Baddley made Jumper.
Bucknell,Butler,49,76,34,51,0,Foul on Henry Baddley.
Bucknell,Butler,50,76,34,51,1,Stephen Brown made Free Throw.
Bucknell,Butler,51,76,34,51,1,Stephen Brown made Free Throw.
Bucknell,Butler,51,78,35,13,1,Tyler Wideman made Dunk. Assisted by Henry Baddley.
Bucknell,Butler,51,78,35,28,0,Avi Toomer missed Layup.
Bucknell,Butler,51,78,35,28,0,Henry Baddley Defensive Rebound.
Bucknell,Butler,51,80,35,46,1,Kelan Martin made Jumper.
Bucknell,Butler,51,80,36,5,0,Foul on Kelan Martin.
Bucknell,Butler,51,80,36,5,0,Official TV Timeout
Bucknell,Butler,52,80,36,5,1,Zach Thomas made Free Throw.
Bucknell,Butler,53,80,36,5,1,Zach Thomas made Free Throw.
Bucknell,Butler,53,82,36,10,1,Joey Brunk made Layup.
Bucknell,Butler,56,82,36,29,1,Ben Robertson made Three Point Jumper. Assisted by Bruce Moore.
Bucknell,Butler,56,82,37,14,0,Henry Baddley missed Three Point Jumper.
Bucknell,Butler,56,82,37,14,0,Bucknell Defensive Rebound.
Bucknell,Butler,58,82,37,28,1,Ben Robertson made Layup.
Bucknell,Butler,58,82,37,41,0,Trey Pettus missed Layup.
Bucknell,Butler,58,82,37,41,0,John Azzinaro Defensive Rebound.
Bucknell,Butler,58,82,37,52,0,D.J. MacLeay Turnover.
Bucknell,Butler,58,84,38,20,1,Trey Pettus made Jumper.
Bucknell,Butler,58,84,38,41,0,Bruce Moore missed Three Point Jumper.
Bucknell,Butler,58,84,38,41,0,Steven Bennett Defensive Rebound.
Bucknell,Butler,58,84,38,51,0,Trey Pettus missed Three Point Jumper.
Bucknell,Butler,58,84,38,51,0,John Azzinaro Defensive Rebound.
Bucknell,Butler,58,84,39,1,0,D.J. MacLeay missed Three Point Jumper.
Bucknell,Butler,58,84,39,1,0,Nate Fowler Defensive Rebound.
Bucknell,Butler,58,84,39,18,0,Joey Brunk missed Jumper.
Bucknell,Butler,58,84,39,18,0,John Azzinaro Defensive Rebound.
Bucknell,Butler,58,84,39,29,0,Bruce Moore Turnover.
Bucknell,Butler,58,84,39,30,0,Henry Baddley Steal.
Bucknell,Butler,58,86,39,33,1,Henry Baddley made Dunk.
Bucknell,Butler,60,86,39,43,1,Ben Robertson made Layup.
Bucknell,Butler,60,86,40,0,0,End of Game
