Away Team,Home Team,Away Score,Home Score,Minute,Second,isScoringPosession,Desc.
Hofstra,George Washington,0,0,0,22,0,Kevin Larsen missed Jumper.
Hofstra,George Washington,0,0,0,22,0,Moussa Kone Defensive Rebound.
Hofstra,George Washington,0,0,0,47,0,Taran Buie Turnover.
Hofstra,George Washington,0,0,0,48,0,Patricio Garino Steal.
Hofstra,George Washington,0,0,0,56,0,Lasan Kromah missed Layup.
Hofstra,George Washington,0,0,0,56,0,Kevin Larsen Offensive Rebound.
Hofstra,George Washington,0,0,1,0,0,Kevin Larsen missed Layup.
Hofstra,George Washington,0,0,1,0,0,Jimmy Hall Defensive Rebound.
Hofstra,George Washington,0,0,1,23,0,Jimmy Hall Turnover.
Hofstra,George Washington,0,0,1,24,0,Kevin Larsen Steal.
Hofstra,George Washington,0,2,1,29,1,Lasan Kromah made Layup.  Assisted by Isaiah Armwood.
Hofstra,George Washington,0,2,1,42,0,Foul on Taran Buie
Hofstra,George Washington,0,2,1,42,0,Taran Buie Turnover.
Hofstra,George Washington,0,2,1,48,0,Joe McDonald Turnover.
Hofstra,George Washington,0,2,1,49,0,Stevie Mejia Steal.
Hofstra,George Washington,0,2,1,50,0,Foul on Joe McDonald
Hofstra,George Washington,1,2,1,50,1,Stevie Mejia made Free Throw.
Hofstra,George Washington,1,2,1,50,0,Stevie Mejia missed Free Throw.
Hofstra,George Washington,1,2,1,50,0,Isaiah Armwood Defensive Rebound.
Hofstra,George Washington,1,2,2,12,0,Patricio Garino Turnover.
Hofstra,George Washington,1,2,2,12,0,Shaquille Stokes Steal.
Hofstra,George Washington,1,2,2,23,0,Taran Buie missed Layup.
Hofstra,George Washington,1,2,2,23,0,Kevin Larsen Defensive Rebound.
Hofstra,George Washington,1,4,2,31,1,Lasan Kromah made Layup.  Assisted by Patricio Garino.
Hofstra,George Washington,1,4,2,45,0,Shaquille Stokes missed Jumper.
Hofstra,George Washington,1,4,2,45,0,Kevin Larsen Defensive Rebound.
Hofstra,George Washington,1,4,3,1,0,Patricio Garino missed Jumper.
Hofstra,George Washington,1,4,3,1,0,Lasan Kromah Offensive Rebound.
Hofstra,George Washington,1,4,3,4,0,Lasan Kromah Turnover.
Hofstra,George Washington,3,4,3,22,1,Jimmy Hall made Jumper.
Hofstra,George Washington,3,4,3,30,0,Nemanja Mikic missed Three Point Jumper.
Hofstra,George Washington,3,4,3,30,0,Kevin Larsen Offensive Rebound.
Hofstra,George Washington,3,6,3,36,1,Lasan Kromah made Layup.  Assisted by Kevin Larsen.
Hofstra,George Washington,3,6,3,59,0,Stevie Mejia missed Jumper.
Hofstra,George Washington,3,6,3,59,0,Isaiah Armwood Block.
Hofstra,George Washington,3,6,4,0,0,Taran Buie Offensive Rebound.
Hofstra,George Washington,3,6,4,2,0,Taran Buie missed Three Point Jumper.
Hofstra,George Washington,3,6,4,2,0,Joe McDonald Defensive Rebound.
Hofstra,George Washington,3,6,4,15,0,Isaiah Armwood missed Jumper.
Hofstra,George Washington,3,6,4,15,0,Taran Buie Defensive Rebound.
Hofstra,George Washington,3,6,4,26,0,Moussa Kone missed Layup.
Hofstra,George Washington,3,6,4,26,0,Isaiah Armwood Defensive Rebound.
Hofstra,George Washington,3,6,4,44,0,Foul on Stevie Mejia
Hofstra,George Washington,3,6,4,44,0,Official TV Timeout.
Hofstra,George Washington,3,6,5,16,0,Kevin Larsen missed Layup.
Hofstra,George Washington,3,6,5,16,0,Jimmy Hall Block.
Hofstra,George Washington,3,6,5,18,0,Taran Buie Defensive Rebound.
Hofstra,George Washington,6,6,5,22,1,Taran Buie made Three Point Jumper.
Hofstra,George Washington,6,8,5,44,1,Kevin Larsen made Jumper.
Hofstra,George Washington,8,8,6,10,1,Jordan Allen made Jumper.  Assisted by Shaquille Stokes.
Hofstra,George Washington,8,8,6,27,0,Dwayne Smith missed Three Point Jumper.
Hofstra,George Washington,8,8,6,27,0,Patricio Garino Offensive Rebound.
Hofstra,George Washington,8,8,6,56,0,Lasan Kromah missed Jumper.
Hofstra,George Washington,8,8,6,57,0,Dallas Anglin Defensive Rebound.
Hofstra,George Washington,8,8,6,58,0,Foul on Patricio Garino
Hofstra,George Washington,8,8,7,13,0,Taran Buie missed Jumper.
Hofstra,George Washington,8,8,7,13,0,Kethan Savage Defensive Rebound.
Hofstra,George Washington,8,8,7,23,0,Kethan Savage missed Layup.
Hofstra,George Washington,8,8,7,23,0,Jordan Allen Block.
Hofstra,George Washington,8,8,7,25,0,Jimmy Hall Defensive Rebound.
Hofstra,George Washington,8,8,7,37,0,Jimmy Hall missed Jumper.
Hofstra,George Washington,8,8,7,37,0,Dwayne Smith Defensive Rebound.
Hofstra,George Washington,8,8,7,40,0,Technical Foul on Jimmy Hall
Hofstra,George Washington,8,8,7,40,0,null
Hofstra,George Washington,8,8,7,40,0,Dwayne Smith missed Free Throw.
Hofstra,George Washington,8,8,7,40,0,Foul on Jimmy Hall
Hofstra,George Washington,8,8,7,40,0,Dwayne Smith missed Free Throw.
Hofstra,George Washington,8,8,7,40,0,null
Hofstra,George Washington,8,10,7,54,1,Paris Maragkos made Layup.  Assisted by Isaiah Armwood.
Hofstra,George Washington,8,10,8,16,0,Taran Buie missed Jumper.
Hofstra,George Washington,8,10,8,16,0,Isaiah Armwood Block.
Hofstra,George Washington,8,10,8,18,0,Patricio Garino Defensive Rebound.
Hofstra,George Washington,8,10,8,22,0,Foul on Bryan Bynes
Hofstra,George Washington,8,10,8,22,0,Bryan Bynes Turnover.
Hofstra,George Washington,8,10,8,22,0,Official TV Timeout.
Hofstra,George Washington,8,10,8,41,0,Shaquille Stokes Turnover.
Hofstra,George Washington,8,10,8,42,0,Patricio Garino Steal.
Hofstra,George Washington,8,12,8,46,1,John Kopriva made Layup.  Assisted by Patricio Garino.
Hofstra,George Washington,11,12,9,0,1,Dallas Anglin made Three Point Jumper.  Assisted by Stevie Mejia.
Hofstra,George Washington,11,15,9,19,1,Joe McDonald made Three Point Jumper.  Assisted by Kethan Savage.
Hofstra,George Washington,11,15,9,35,0,Moussa Kone missed Jumper.
Hofstra,George Washington,11,15,9,35,0,Joe McDonald Defensive Rebound.
Hofstra,George Washington,11,17,9,44,1,Kethan Savage made Jumper.
Hofstra,George Washington,11,17,10,8,0,Jordan Allen Turnover.
Hofstra,George Washington,11,17,10,8,0,Patricio Garino Steal.
Hofstra,George Washington,11,17,10,8,0,Foul on Shaquille Stokes
Hofstra,George Washington,11,17,10,24,0,Paris Maragkos missed Jumper.
Hofstra,George Washington,11,17,10,24,0,Jimmy Hall Block.
Hofstra,George Washington,11,17,10,25,0,Paris Maragkos Offensive Rebound.
Hofstra,George Washington,11,17,10,29,0,Paris Maragkos missed Layup.
Hofstra,George Washington,11,17,10,29,0,Jimmy Hall Defensive Rebound.
Hofstra,George Washington,11,17,10,39,0,Shaquille Stokes missed Jumper.
Hofstra,George Washington,11,17,10,39,0,Shaquille Stokes Offensive Rebound.
Hofstra,George Washington,11,17,10,43,0,Shaquille Stokes missed Jumper.
Hofstra,George Washington,11,17,10,43,0,Kethan Savage Block.
Hofstra,George Washington,11,17,10,46,0,Lasan Kromah Defensive Rebound.
Hofstra,George Washington,11,17,10,58,0,John Kopriva missed Jumper.
Hofstra,George Washington,11,17,10,58,0,Jimmy Hall Defensive Rebound.
Hofstra,George Washington,11,17,10,59,0,Foul on Lasan Kromah
Hofstra,George Washington,13,17,11,13,1,Moussa Kone made Dunk.  Assisted by Stevie Mejia.
Hofstra,George Washington,13,19,11,32,1,Kevin Larsen made Layup.  Assisted by Lasan Kromah.
Hofstra,George Washington,15,19,11,39,1,Moussa Kone made Layup.  Assisted by Shaquille Stokes.
Hofstra,George Washington,15,19,11,55,0,Bryan Bynes Turnover.
Hofstra,George Washington,15,19,11,56,0,Shaquille Stokes Steal.
Hofstra,George Washington,15,19,11,58,0,Foul on Bryan Bynes
Hofstra,George Washington,15,19,11,59,0,Moussa Kone missed Dunk.
Hofstra,George Washington,15,19,11,59,0,Stevie Mejia Offensive Rebound.
Hofstra,George Washington,15,19,12,8,0,Taran Buie missed Layup.
Hofstra,George Washington,15,19,12,8,0,Isaiah Armwood Block.
Hofstra,George Washington,15,19,12,10,0,Moussa Kone Offensive Rebound.
Hofstra,George Washington,15,19,12,12,0,Moussa Kone missed Layup.
Hofstra,George Washington,15,19,12,12,0,Isaiah Armwood Defensive Rebound.
Hofstra,George Washington,15,19,12,13,0,Official TV Timeout.
Hofstra,George Washington,15,21,12,18,1,Bryan Bynes made Layup.  Assisted by Joe McDonald.
Hofstra,George Washington,15,21,12,37,0,Stevie Mejia missed Jumper.
Hofstra,George Washington,15,21,12,37,0,Isaiah Armwood Defensive Rebound.
Hofstra,George Washington,15,23,12,52,1,Kevin Larsen made Layup.
Hofstra,George Washington,15,23,13,15,0,Foul on Isaiah Armwood
Hofstra,George Washington,15,23,13,15,0,Jimmy Hall missed Free Throw.
Hofstra,George Washington,15,23,13,15,0,null
Hofstra,George Washington,16,23,13,15,1,Jimmy Hall made Free Throw.
Hofstra,George Washington,16,25,13,36,1,Isaiah Armwood made Jumper.  Assisted by Joe McDonald.
Hofstra,George Washington,16,25,14,1,0,Moussa Kone Turnover.
Hofstra,George Washington,16,25,14,13,0,Foul on Moussa Kone
Hofstra,George Washington,16,27,14,15,1,Kevin Larsen made Layup.  Assisted by Joe McDonald.
Hofstra,George Washington,16,27,14,34,0,Foul on Bryan Bynes
Hofstra,George Washington,16,27,14,34,0,Taran Buie missed Free Throw.
Hofstra,George Washington,16,27,14,34,0,Isaiah Armwood Defensive Rebound.
Hofstra,George Washington,16,29,14,52,1,Patricio Garino made Jumper.  Assisted by Lasan Kromah.
Hofstra,George Washington,16,29,14,57,0,Hofstra Full Timeout.
Hofstra,George Washington,16,29,15,22,0,Dallas Anglin missed Jumper.
Hofstra,George Washington,16,29,15,22,0,Isaiah Armwood Defensive Rebound.
Hofstra,George Washington,16,31,15,34,1,Isaiah Armwood made Layup.  Assisted by Joe McDonald.
Hofstra,George Washington,16,31,15,45,0,Stevie Mejia missed Three Point Jumper.
Hofstra,George Washington,16,31,15,45,0,Joe McDonald Defensive Rebound.
Hofstra,George Washington,16,31,16,0,0,Isaiah Armwood Turnover.
Hofstra,George Washington,16,31,16,2,0,Jimmy Hall Steal.
Hofstra,George Washington,16,31,16,6,0,Jimmy Hall missed Layup.
Hofstra,George Washington,16,31,16,6,0,Jimmy Hall Offensive Rebound.
Hofstra,George Washington,16,31,16,12,0,Dallas Anglin Turnover.
Hofstra,George Washington,16,31,16,14,0,Patricio Garino Steal.
Hofstra,George Washington,16,31,16,15,0,Foul on Moussa Kone
Hofstra,George Washington,16,31,16,15,0,Official TV Timeout.
Hofstra,George Washington,16,31,16,15,0,Kevin Larsen missed Free Throw.
Hofstra,George Washington,16,31,16,15,0,null
Hofstra,George Washington,16,32,16,15,1,Kevin Larsen made Free Throw.
Hofstra,George Washington,16,32,16,23,0,Stevie Mejia Turnover.
Hofstra,George Washington,16,32,16,39,0,Nemanja Mikic Turnover.
Hofstra,George Washington,16,32,16,39,0,Dallas Anglin Steal.
Hofstra,George Washington,16,32,16,54,0,Jordan Allen missed Jumper.
Hofstra,George Washington,16,32,16,54,0,Isaiah Armwood Block.
Hofstra,George Washington,16,32,16,55,0,Jordan Allen Offensive Rebound.
Hofstra,George Washington,16,32,16,57,0,Jordan Allen missed Layup.
Hofstra,George Washington,16,32,16,57,0,Jimmy Hall Offensive Rebound.
Hofstra,George Washington,16,32,17,4,0,Jimmy Hall missed Jumper.
Hofstra,George Washington,16,32,17,4,0,Isaiah Armwood Block.
Hofstra,George Washington,16,32,17,5,0,Joe McDonald Defensive Rebound.
Hofstra,George Washington,16,34,17,10,1,Lasan Kromah made Layup.  Assisted by Joe McDonald.
Hofstra,George Washington,18,34,17,38,1,Jimmy Hall made Layup.
Hofstra,George Washington,18,36,17,56,1,Lasan Kromah made Layup.  Assisted by Dwayne Smith.
Hofstra,George Washington,18,36,18,3,0,Foul on Dwayne Smith
Hofstra,George Washington,19,36,18,3,1,Taran Buie made Free Throw.
Hofstra,George Washington,20,36,18,3,1,Taran Buie made Free Throw.
Hofstra,George Washington,20,36,18,24,0,Foul on Joe McDonald
Hofstra,George Washington,20,36,18,24,0,Joe McDonald Turnover.
Hofstra,George Washington,20,36,18,33,0,Taran Buie missed Jumper.
Hofstra,George Washington,20,36,18,33,0,John Kopriva Defensive Rebound.
Hofstra,George Washington,20,36,18,38,0,George Washington Full Timeout.
Hofstra,George Washington,20,36,18,46,0,Patricio Garino Turnover.
Hofstra,George Washington,20,36,18,47,0,Jordan Allen Steal.
Hofstra,George Washington,20,36,18,51,0,Stevie Mejia Turnover.
Hofstra,George Washington,20,36,18,52,0,Patricio Garino Steal.
Hofstra,George Washington,20,36,19,13,0,Isaiah Armwood missed Jumper.
Hofstra,George Washington,20,36,19,14,0,Lasan Kromah Offensive Rebound.
Hofstra,George Washington,20,36,19,45,0,Foul on Jordan Allen
Hofstra,George Washington,20,37,19,45,1,Patricio Garino made Free Throw.
Hofstra,George Washington,20,38,19,45,1,Patricio Garino made Free Throw.
Hofstra,George Washington,22,38,19,56,1,Shaquille Stokes made Jumper.
Hofstra,George Washington,22,38,20,0,0,End of the 1st Half.
Hofstra,George Washington,22,40,20,20,1,Lasan Kromah made Layup.  Assisted by Kevin Larsen.
Hofstra,George Washington,24,40,20,43,1,Jimmy Hall made Layup.
Hofstra,George Washington,24,40,20,43,0,Foul on Kevin Larsen
Hofstra,George Washington,25,40,20,43,1,Jimmy Hall made Free Throw.
Hofstra,George Washington,25,40,21,8,0,Foul on Jimmy Hall
Hofstra,George Washington,25,41,21,8,1,Patricio Garino made Free Throw.
Hofstra,George Washington,25,42,21,8,1,Patricio Garino made Free Throw.
Hofstra,George Washington,25,42,21,23,0,Shaquille Stokes Turnover.
Hofstra,George Washington,25,42,21,24,0,Joe McDonald Steal.
Hofstra,George Washington,25,42,21,27,0,Lasan Kromah missed Layup.
Hofstra,George Washington,25,42,21,28,0,Kevin Larsen Offensive Rebound.
Hofstra,George Washington,25,44,21,29,1,Kevin Larsen made Tip Shot.
Hofstra,George Washington,25,44,21,48,0,Shaquille Stokes missed Layup.
Hofstra,George Washington,25,44,21,48,0,Patricio Garino Block.
Hofstra,George Washington,25,44,21,50,0,Kevin Larsen Defensive Rebound.
Hofstra,George Washington,25,44,21,55,0,Patricio Garino missed Jumper.
Hofstra,George Washington,25,44,21,55,0,Isaiah Armwood Offensive Rebound.
Hofstra,George Washington,25,44,22,12,0,Foul on Moussa Kone
Hofstra,George Washington,25,44,22,12,0,Joe McDonald missed Free Throw.
Hofstra,George Washington,25,44,22,12,0,null
Hofstra,George Washington,25,45,22,12,1,Joe McDonald made Free Throw.
Hofstra,George Washington,25,45,22,35,0,Jimmy Hall missed Jumper.
Hofstra,George Washington,25,45,22,35,0,Patricio Garino Defensive Rebound.
Hofstra,George Washington,25,45,22,47,0,Joe McDonald missed Layup.
Hofstra,George Washington,25,45,22,47,0,Shaquille Stokes Defensive Rebound.
Hofstra,George Washington,25,45,22,54,0,Shaquille Stokes missed Layup.
Hofstra,George Washington,25,45,22,54,0,John Kopriva Defensive Rebound.
Hofstra,George Washington,25,45,23,2,0,Isaiah Armwood missed Layup.
Hofstra,George Washington,25,45,23,2,0,Jimmy Hall Defensive Rebound.
Hofstra,George Washington,25,45,23,16,0,Taran Buie missed Three Point Jumper.
Hofstra,George Washington,25,45,23,16,0,Moussa Kone Offensive Rebound.
Hofstra,George Washington,25,45,23,18,0,Foul on John Kopriva
Hofstra,George Washington,25,45,23,24,0,Dallas Anglin missed Three Point Jumper.
Hofstra,George Washington,25,45,23,24,0,Kethan Savage Defensive Rebound.
Hofstra,George Washington,25,45,23,36,0,Paris Maragkos missed Jumper.
Hofstra,George Washington,26,45,23,36,0,Moussa Kone Defensive Rebound.
Hofstra,George Washington,26,45,23,50,1,Taran Buie made Free Throw.
Hofstra,George Washington,27,45,23,50,1,Taran Buie made Free Throw.
Hofstra,George Washington,28,45,23,50,1,Taran Buie made Free Throw.
Hofstra,George Washington,28,45,24,9,0,Foul on Jordan Allen
Hofstra,George Washington,28,45,24,9,0,Official TV Timeout.
Hofstra,George Washington,28,46,24,9,1,Kevin Larsen made Free Throw.
Hofstra,George Washington,28,46,24,9,0,Kevin Larsen missed Free Throw.
Hofstra,George Washington,28,46,24,9,0,Jordan Allen Defensive Rebound.
Hofstra,George Washington,28,46,24,43,0,Jimmy Hall missed Jumper.
Hofstra,George Washington,28,46,24,43,0,Jordan Allen Offensive Rebound.
Hofstra,George Washington,28,46,24,45,0,Foul on Dwayne Smith
Hofstra,George Washington,28,46,24,45,0,Jordan Allen missed Free Throw.
Hofstra,George Washington,28,46,24,45,0,null
Hofstra,George Washington,28,46,24,45,0,Jordan Allen missed Free Throw.
Hofstra,George Washington,28,46,24,45,0,John Kopriva Defensive Rebound.
Hofstra,George Washington,28,48,24,56,1,Kethan Savage made Jumper.
Hofstra,George Washington,28,48,25,5,0,Stevie Mejia missed Layup.
Hofstra,George Washington,28,48,25,5,0,Bryan Bynes Defensive Rebound.
Hofstra,George Washington,28,50,25,19,1,Kevin Larsen made Jumper.  Assisted by John Kopriva.
Hofstra,George Washington,30,50,25,37,1,Stevie Mejia made Layup.
Hofstra,George Washington,30,50,25,37,0,Hofstra Full Timeout.
Hofstra,George Washington,30,50,25,51,0,Nemanja Mikic missed Three Point Jumper.
Hofstra,George Washington,30,50,25,51,0,Kentrell Washington Defensive Rebound.
Hofstra,George Washington,33,50,26,2,1,Taran Buie made Three Point Jumper.  Assisted by Dallas Anglin.
Hofstra,George Washington,33,50,26,26,0,Kevin Larsen Turnover.
Hofstra,George Washington,33,50,26,29,0,Jordan Allen Steal.
Hofstra,George Washington,33,50,26,32,0,Foul on Nemanja Mikic
Hofstra,George Washington,33,50,26,32,0,Jordan Allen missed Free Throw.
Hofstra,George Washington,33,50,26,32,0,null
Hofstra,George Washington,34,50,26,32,1,Jordan Allen made Free Throw.
Hofstra,George Washington,34,52,27,2,1,Dwayne Smith made Jumper.  Assisted by Patricio Garino.
Hofstra,George Washington,34,52,27,32,0,Jimmy Hall missed Jumper.
Hofstra,George Washington,34,52,27,32,0,Isaiah Armwood Defensive Rebound.
Hofstra,George Washington,34,55,27,55,1,Patricio Garino made Three Point Jumper.  Assisted by Bryan Bynes.
Hofstra,George Washington,34,55,28,8,0,Foul on Joe McDonald
Hofstra,George Washington,34,55,28,8,0,Official TV Timeout.
Hofstra,George Washington,34,55,28,20,0,Taran Buie missed Jumper.
Hofstra,George Washington,34,55,28,21,0,Kentrell Washington Offensive Rebound.
Hofstra,George Washington,36,55,28,22,1,Kentrell Washington made Layup.
Hofstra,George Washington,36,57,28,47,1,Isaiah Armwood made Layup.  Assisted by Kethan Savage.
Hofstra,George Washington,38,57,29,9,1,Jimmy Hall made Layup.
Hofstra,George Washington,38,57,29,26,0,Foul on Kentrell Washington
Hofstra,George Washington,38,59,29,40,1,Dwayne Smith made Layup.  Assisted by Kethan Savage.
Hofstra,George Washington,38,59,30,2,0,Shaquille Stokes missed Layup.
Hofstra,George Washington,38,59,30,2,0,Isaiah Armwood Defensive Rebound.
Hofstra,George Washington,38,61,30,23,1,Isaiah Armwood made Jumper.
Hofstra,George Washington,38,61,30,35,0,Stevie Mejia missed Layup.
Hofstra,George Washington,38,61,30,39,0,George Washington Defensive Rebo.
Hofstra,George Washington,38,63,30,42,1,Kethan Savage made Dunk.  Assisted by Kevin Larsen.
Hofstra,George Washington,38,63,30,43,0,Hofstra Full Timeout.
Hofstra,George Washington,38,63,31,4,0,Foul on Patricio Garino
Hofstra,George Washington,38,63,31,4,0,Stevie Mejia missed Free Throw.
Hofstra,George Washington,38,63,31,4,0,Isaiah Armwood Defensive Rebound.
Hofstra,George Washington,38,63,31,36,0,Bryan Bynes missed Layup.
Hofstra,George Washington,38,63,31,36,0,Jimmy Hall Block.
Hofstra,George Washington,38,63,31,38,0,Moussa Kone Defensive Rebound.
Hofstra,George Washington,38,63,31,42,0,Stevie Mejia missed Layup.
Hofstra,George Washington,38,63,31,43,0,Jimmy Hall Offensive Rebound.
Hofstra,George Washington,40,63,31,44,1,Jimmy Hall made Layup.
Hofstra,George Washington,40,63,31,44,0,Foul on Isaiah Armwood
Hofstra,George Washington,41,63,31,44,1,Jimmy Hall made Free Throw.
Hofstra,George Washington,41,63,32,10,0,Official TV Timeout.
Hofstra,George Washington,41,65,32,18,1,Joe McDonald made Jumper.
Hofstra,George Washington,44,65,32,44,1,Taran Buie made Three Point Jumper.  Assisted by Kentrell Washington.
Hofstra,George Washington,44,67,33,1,1,Isaiah Armwood made Dunk.  Assisted by Lasan Kromah.
Hofstra,George Washington,44,67,33,15,0,Jimmy Hall Turnover.
Hofstra,George Washington,44,67,33,17,0,Isaiah Armwood Steal.
Hofstra,George Washington,44,67,33,44,0,Lasan Kromah Turnover.
Hofstra,George Washington,44,67,33,45,0,Jimmy Hall Steal.
Hofstra,George Washington,46,67,33,48,1,Stevie Mejia made Layup.  Assisted by Jimmy Hall.
Hofstra,George Washington,46,70,34,20,1,Lasan Kromah made Three Point Jumper.  Assisted by Bryan Bynes.
Hofstra,George Washington,46,70,34,34,0,Foul on Lasan Kromah
Hofstra,George Washington,47,70,34,34,1,Stevie Mejia made Free Throw.
Hofstra,George Washington,48,70,34,34,1,Stevie Mejia made Free Throw.
Hofstra,George Washington,48,72,34,50,1,Nemanja Mikic made Jumper.  Assisted by Dwayne Smith.
Hofstra,George Washington,48,72,35,24,0,Jimmy Hall missed Jumper.
Hofstra,George Washington,48,72,35,24,0,Kentrell Washington Offensive Rebound.
Hofstra,George Washington,50,72,35,29,1,Kentrell Washington made Layup.
Hofstra,George Washington,50,72,35,41,0,Joe McDonald Turnover.
Hofstra,George Washington,50,72,35,42,0,Stevie Mejia Steal.
Hofstra,George Washington,50,72,35,44,0,Stevie Mejia missed Layup.
Hofstra,George Washington,50,72,35,44,0,Joe McDonald Defensive Rebound.
Hofstra,George Washington,50,72,35,46,0,Foul on Stevie Mejia
Hofstra,George Washington,50,72,36,0,0,Isaiah Armwood Turnover.
Hofstra,George Washington,50,72,36,0,0,Jimmy Hall Steal.
Hofstra,George Washington,50,72,36,8,0,Jimmy Hall missed Jumper.
Hofstra,George Washington,50,72,36,8,0,Dwayne Smith Block.
Hofstra,George Washington,50,72,36,9,0,Bryan Bynes Defensive Rebound.
Hofstra,George Washington,50,74,36,13,1,Isaiah Armwood made Dunk.  Assisted by Joe McDonald.
Hofstra,George Washington,50,74,36,43,0,Taran Buie missed Three Point Jumper.
Hofstra,George Washington,50,74,36,43,0,Dwayne Smith Defensive Rebound.
Hofstra,George Washington,50,74,36,49,0,Nemanja Mikic Turnover.
Hofstra,George Washington,50,74,36,49,0,Official TV Timeout.
Hofstra,George Washington,50,74,37,5,0,Foul on Paris Maragkos
Hofstra,George Washington,51,74,37,5,1,Taran Buie made Free Throw.
Hofstra,George Washington,52,74,37,5,1,Taran Buie made Free Throw.
Hofstra,George Washington,52,74,37,18,0,Foul on Jordan Allen
Hofstra,George Washington,52,75,37,18,1,Dwayne Smith made Free Throw.
Hofstra,George Washington,52,76,37,18,1,Dwayne Smith made Free Throw.
Hofstra,George Washington,52,76,37,45,0,Moussa Kone missed Dunk.
Hofstra,George Washington,52,76,37,45,0,John Kopriva Defensive Rebound.
Hofstra,George Washington,52,78,38,3,1,Paris Maragkos made Jumper.
Hofstra,George Washington,52,78,38,15,0,Dallas Anglin missed Three Point Jumper.
Hofstra,George Washington,52,78,38,15,0,Jordan Allen Offensive Rebound.
Hofstra,George Washington,54,78,38,21,1,Jordan Allen made Layup.
Hofstra,George Washington,54,78,38,46,0,Lasan Kromah Turnover.
Hofstra,George Washington,57,78,39,2,1,Dallas Anglin made Three Point Jumper.
Hofstra,George Washington,57,80,39,22,1,Jonathan Davis made Layup.  Assisted by Nemanja Mikic.
Hofstra,George Washington,57,80,39,38,0,Matt Grogan missed Three Point Jumper.
Hofstra,George Washington,57,80,39,41,0,George Washington Defensive Rebo.
Hofstra,George Washington,57,80,40,0,0,End Game
