Away Team,Home Team,Away Score, Home Score,Minute,Second,isScoringPosession,Desc.
Hiwassee College,Chattanooga,0,3,0,22,1,Johnathan Burroughs-Cook made Three Point Jumper. Assisted by Tre' McLean.
Hiwassee College,Chattanooga,0,3,0,49,0,Naequon Newman missed Jumper.
Hiwassee College,Chattanooga,0,3,0,49,0,Justin Tuoyo Block.
Hiwassee College,Chattanooga,0,3,0,50,0,Tre' McLean Defensive Rebound.
Hiwassee College,Chattanooga,0,6,0,55,1,Greg Pryor made Three Point Jumper. Assisted by Justin Tuoyo.
Hiwassee College,Chattanooga,0,6,1,20,0,Aario Johnson missed Jumper.
Hiwassee College,Chattanooga,0,6,1,20,0,Justin Tuoyo Block.
Hiwassee College,Chattanooga,0,6,1,22,0,Justin Tuoyo Defensive Rebound.
Hiwassee College,Chattanooga,0,9,1,32,1,Greg Pryor made Three Point Jumper. Assisted by Tre' McLean.
Hiwassee College,Chattanooga,0,9,1,40,0,Hiwassee  Timeout
Hiwassee College,Chattanooga,0,9,1,58,0,Naequon Newman Turnover.
Hiwassee College,Chattanooga,0,9,2,0,0,Justin Tuoyo Steal.
Hiwassee College,Chattanooga,0,9,2,4,0,Makinde London missed Three Point Jumper.
Hiwassee College,Chattanooga,0,9,2,4,0,Tevin Henry Defensive Rebound.
Hiwassee College,Chattanooga,0,9,2,18,0,Ben Snider Turnover.
Hiwassee College,Chattanooga,0,9,2,20,0,Greg Pryor Steal.
Hiwassee College,Chattanooga,0,9,2,24,0,Justin Tuoyo missed Three Point Jumper.
Hiwassee College,Chattanooga,0,9,2,24,0,Aario Johnson Defensive Rebound.
Hiwassee College,Chattanooga,0,9,2,56,0,Aario Johnson missed Layup.
Hiwassee College,Chattanooga,0,9,2,56,0,Justin Tuoyo Block.
Hiwassee College,Chattanooga,0,9,2,56,0,Chattanooga Defensive Rebound.
Hiwassee College,Chattanooga,0,9,3,8,0,Foul on Naequon Newman.
Hiwassee College,Chattanooga,0,12,3,14,1,Tre' McLean made Three Point Jumper. Assisted by Greg Pryor.
Hiwassee College,Chattanooga,0,12,3,29,0,Tevin Henry Turnover.
Hiwassee College,Chattanooga,0,12,3,40,0,Nat Dixon missed Three Point Jumper.
Hiwassee College,Chattanooga,0,12,3,40,0,Jeulian High Defensive Rebound.
Hiwassee College,Chattanooga,0,12,3,56,0,Jeulian High missed Jumper.
Hiwassee College,Chattanooga,0,12,3,56,0,Ben Snider Offensive Rebound.
Hiwassee College,Chattanooga,2,12,4,3,1,Ben Snider made Layup.
Hiwassee College,Chattanooga,2,12,4,18,0,Foul on Aario Johnson.
Hiwassee College,Chattanooga,2,12,4,18,0,Official TV Timeout
Hiwassee College,Chattanooga,2,13,4,18,1,Justin Tuoyo made Free Throw.
Hiwassee College,Chattanooga,2,14,4,18,1,Justin Tuoyo made Free Throw.
Hiwassee College,Chattanooga,2,14,4,20,0,Ben Snider Turnover.
Hiwassee College,Chattanooga,2,14,4,21,0,Johnathan Burroughs-Cook Steal.
Hiwassee College,Chattanooga,2,16,4,23,1,Johnathan Burroughs-Cook made Layup.
Hiwassee College,Chattanooga,2,16,4,43,0,Jay Cade Turnover.
Hiwassee College,Chattanooga,2,16,4,44,0,Rodney Chatman Steal.
Hiwassee College,Chattanooga,2,18,4,49,1,Justin Tuoyo made Dunk. Assisted by Tre' McLean.
Hiwassee College,Chattanooga,2,18,5,2,0,Daniel Graves Turnover.
Hiwassee College,Chattanooga,2,18,5,4,0,Johnathan Burroughs-Cook Steal.
Hiwassee College,Chattanooga,2,18,5,8,0,Tre' McLean missed Three Point Jumper.
Hiwassee College,Chattanooga,2,18,5,8,0,Daniel Graves Defensive Rebound.
Hiwassee College,Chattanooga,2,18,5,27,0,Jay Cade missed Jumper.
Hiwassee College,Chattanooga,2,18,5,27,0,Rodney Chatman Defensive Rebound.
Hiwassee College,Chattanooga,2,18,5,37,0,Nat Dixon Turnover.
Hiwassee College,Chattanooga,2,18,5,38,0,Jay Cade Steal.
Hiwassee College,Chattanooga,2,18,5,46,0,Daniel Graves missed Three Point Jumper.
Hiwassee College,Chattanooga,2,18,5,46,0,Tre' McLean Defensive Rebound.
Hiwassee College,Chattanooga,2,20,5,52,1,Justin Tuoyo made Dunk. Assisted by Tre' McLean.
Hiwassee College,Chattanooga,2,20,5,55,0,Hiwassee  Timeout
Hiwassee College,Chattanooga,2,20,5,59,0,Ben Snider missed Three Point Jumper.
Hiwassee College,Chattanooga,2,20,5,59,0,Kevis Jackson Offensive Rebound.
Hiwassee College,Chattanooga,2,20,6,4,0,Daniel Graves missed Three Point Jumper.
Hiwassee College,Chattanooga,2,20,6,4,0,Tre' McLean Defensive Rebound.
Hiwassee College,Chattanooga,2,20,6,18,0,Makinde London missed Three Point Jumper.
Hiwassee College,Chattanooga,2,20,6,18,0,Nat Dixon Offensive Rebound.
Hiwassee College,Chattanooga,2,20,6,29,0,Rodney Chatman missed Jumper.
Hiwassee College,Chattanooga,2,20,6,29,0,Ben Snider Defensive Rebound.
Hiwassee College,Chattanooga,2,20,6,36,0,Ben Snider Turnover.
Hiwassee College,Chattanooga,2,20,6,48,0,Rodney Chatman missed Jumper.
Hiwassee College,Chattanooga,2,20,6,48,0,Kevis Jackson Defensive Rebound.
Hiwassee College,Chattanooga,4,20,7,23,1,Jay Cade made Jumper.
Hiwassee College,Chattanooga,4,20,7,33,0,Nat Dixon missed Layup.
Hiwassee College,Chattanooga,4,20,7,33,0,Kevis Jackson Block.
Hiwassee College,Chattanooga,4,20,7,33,0,Chattanooga Offensive Rebound.
Hiwassee College,Chattanooga,4,20,7,45,0,Rodney Chatman missed Layup.
Hiwassee College,Chattanooga,4,20,7,45,0,Kevis Jackson Block.
Hiwassee College,Chattanooga,4,20,7,49,0,Daniel Graves Defensive Rebound.
Hiwassee College,Chattanooga,4,20,7,54,0,Daniel Graves missed Three Point Jumper.
Hiwassee College,Chattanooga,4,20,7,54,0,Nat Dixon Defensive Rebound.
Hiwassee College,Chattanooga,4,23,8,3,1,Peyton Woods made Three Point Jumper. Assisted by Greg Pryor.
Hiwassee College,Chattanooga,4,23,8,19,0,Kevis Jackson missed Three Point Jumper.
Hiwassee College,Chattanooga,4,23,8,19,0,Nat Dixon Defensive Rebound.
Hiwassee College,Chattanooga,4,23,8,33,0,Peyton Woods missed Three Point Jumper.
Hiwassee College,Chattanooga,4,23,8,33,0,Daniel Graves Defensive Rebound.
Hiwassee College,Chattanooga,4,23,8,53,0,Daniel Graves missed Layup.
Hiwassee College,Chattanooga,4,23,8,53,0,Nat Dixon Block.
Hiwassee College,Chattanooga,4,23,8,54,0,Hiwassee Offensive Rebound.
Hiwassee College,Chattanooga,4,23,8,55,0,Official TV Timeout
Hiwassee College,Chattanooga,4,23,8,57,0,Dess Culpepper missed Layup.
Hiwassee College,Chattanooga,4,23,8,57,0,Makinde London Block.
Hiwassee College,Chattanooga,4,23,8,59,0,Tre' McLean Defensive Rebound.
Hiwassee College,Chattanooga,4,23,8,59,0,Foul on Toure Fudge.
Hiwassee College,Chattanooga,4,23,9,8,0,Greg Pryor missed Three Point Jumper.
Hiwassee College,Chattanooga,4,23,9,8,0,Hiwassee Defensive Rebound.
Hiwassee College,Chattanooga,4,23,9,21,0,Foul on Justin Tuoyo.
Hiwassee College,Chattanooga,5,23,9,21,1,Jay Cade made Free Throw.
Hiwassee College,Chattanooga,6,23,9,21,1,Jay Cade made Free Throw.
Hiwassee College,Chattanooga,6,23,9,28,0,Foul on Toure Fudge.
Hiwassee College,Chattanooga,6,23,9,35,0,Foul on Dess Culpepper.
Hiwassee College,Chattanooga,6,24,9,35,1,Tre' McLean made Free Throw.
Hiwassee College,Chattanooga,6,24,9,35,0,Tre' McLean missed Free Throw.
Hiwassee College,Chattanooga,6,24,9,35,0,Makinde London Offensive Rebound.
Hiwassee College,Chattanooga,6,26,9,43,1,Makinde London made Dunk.
Hiwassee College,Chattanooga,6,26,9,57,0,Toure Fudge missed Three Point Jumper.
Hiwassee College,Chattanooga,6,26,9,57,0,Johnathan Burroughs-Cook Defensive Rebound.
Hiwassee College,Chattanooga,6,26,10,7,0,Makinde London missed Layup.
Hiwassee College,Chattanooga,6,26,10,7,0,Kevis Jackson Block.
Hiwassee College,Chattanooga,6,26,10,10,0,Toure Fudge Defensive Rebound.
Hiwassee College,Chattanooga,8,26,10,13,1,Dess Culpepper made Layup. Assisted by Toure Fudge.
Hiwassee College,Chattanooga,8,26,10,29,0,Greg Pryor Turnover.
Hiwassee College,Chattanooga,8,26,10,52,0,Jay Cade Turnover.
Hiwassee College,Chattanooga,8,26,10,54,0,Johnathan Burroughs-Cook Steal.
Hiwassee College,Chattanooga,8,26,11,14,0,Tre' McLean missed Three Point Jumper.
Hiwassee College,Chattanooga,8,26,11,14,0,Toure Fudge Defensive Rebound.
Hiwassee College,Chattanooga,8,26,11,37,0,Foul on Dess Culpepper.
Hiwassee College,Chattanooga,8,28,11,37,1,Justin Tuoyo made Layup.
Hiwassee College,Chattanooga,8,28,12,5,0,Tevin Henry missed Jumper.
Hiwassee College,Chattanooga,8,28,12,5,0,Nat Dixon Block.
Hiwassee College,Chattanooga,8,28,12,8,0,Rodney Chatman Defensive Rebound.
Hiwassee College,Chattanooga,8,30,12,14,1,Johnathan Burroughs-Cook made Layup.
Hiwassee College,Chattanooga,8,30,12,27,0,Jeulian High missed Layup.
Hiwassee College,Chattanooga,8,30,12,27,0,Justin Tuoyo Block.
Hiwassee College,Chattanooga,8,30,12,29,0,Jeulian High Offensive Rebound.
Hiwassee College,Chattanooga,10,30,12,31,1,Tevin Henry made Dunk.
Hiwassee College,Chattanooga,10,33,12,45,1,Johnathan Burroughs-Cook made Three Point Jumper. Assisted by Justin Tuoyo.
Hiwassee College,Chattanooga,10,33,13,9,0,Jay Johnson missed Jumper.
Hiwassee College,Chattanooga,10,33,13,9,0,Justin Tuoyo Defensive Rebound.
Hiwassee College,Chattanooga,10,33,13,18,0,Rodney Chatman Turnover.
Hiwassee College,Chattanooga,10,33,13,18,0,Official TV Timeout
Hiwassee College,Chattanooga,10,33,13,24,0,Naequon Newman missed Layup.
Hiwassee College,Chattanooga,10,33,13,24,0,Nat Dixon Block.
Hiwassee College,Chattanooga,10,33,13,27,0,Peyton Woods Defensive Rebound.
Hiwassee College,Chattanooga,10,33,13,40,0,Peyton Woods missed Three Point Jumper.
Hiwassee College,Chattanooga,10,33,13,40,0,Tre' McLean Offensive Rebound.
Hiwassee College,Chattanooga,10,33,14,10,0,Tre' McLean missed Three Point Jumper.
Hiwassee College,Chattanooga,10,33,14,10,0,Ben Snider Defensive Rebound.
Hiwassee College,Chattanooga,10,33,14,33,0,Foul on Tevin Henry.
Hiwassee College,Chattanooga,10,33,14,33,0,Tevin Henry Turnover.
Hiwassee College,Chattanooga,10,33,14,44,0,Rodney Chatman Turnover.
Hiwassee College,Chattanooga,10,33,14,52,0,Tevin Henry missed Layup.
Hiwassee College,Chattanooga,10,33,14,52,0,Rodney Chatman Defensive Rebound.
Hiwassee College,Chattanooga,10,36,15,10,1,Peyton Woods made Three Point Jumper. Assisted by Greg Pryor.
Hiwassee College,Chattanooga,10,36,15,41,0,Naequon Newman Turnover.
Hiwassee College,Chattanooga,10,36,15,43,0,Rodney Chatman Steal.
Hiwassee College,Chattanooga,10,36,15,50,0,Foul on Ben Snider.
Hiwassee College,Chattanooga,10,36,15,50,0,Greg Pryor missed Free Throw.
Hiwassee College,Chattanooga,10,36,15,50,0,Makinde London Offensive Rebound.
Hiwassee College,Chattanooga,10,38,15,51,1,Makinde London made Layup.
Hiwassee College,Chattanooga,10,38,16,4,0,Daniel Graves missed Jumper.
Hiwassee College,Chattanooga,10,38,16,4,0,Makinde London Defensive Rebound.
Hiwassee College,Chattanooga,10,40,16,16,1,Makinde London made Layup.
Hiwassee College,Chattanooga,10,40,16,30,0,Foul on Greg Pryor.
Hiwassee College,Chattanooga,10,40,16,30,0,Official TV Timeout
Hiwassee College,Chattanooga,10,40,16,46,0,Daniel Graves missed Jumper.
Hiwassee College,Chattanooga,10,40,16,46,0,Makinde London Defensive Rebound.
Hiwassee College,Chattanooga,10,40,17,14,0,Makinde London missed Three Point Jumper.
Hiwassee College,Chattanooga,10,40,17,14,0,Johnathan Burroughs-Cook Offensive Rebound.
Hiwassee College,Chattanooga,10,40,17,25,0,Foul on Makinde London.
Hiwassee College,Chattanooga,10,40,17,25,0,Makinde London Turnover.
Hiwassee College,Chattanooga,10,40,17,28,0,Dess Culpepper missed Jumper.
Hiwassee College,Chattanooga,10,40,17,28,0,Justin Tuoyo Defensive Rebound.
Hiwassee College,Chattanooga,10,43,17,38,1,Johnathan Burroughs-Cook made Three Point Jumper. Assisted by Tre' McLean.
Hiwassee College,Chattanooga,12,43,18,7,1,Aario Johnson made Jumper. Assisted by Jay Cade.
Hiwassee College,Chattanooga,12,43,18,24,0,Justin Tuoyo Turnover.
Hiwassee College,Chattanooga,12,43,18,35,0,Foul on Tre' McLean.
Hiwassee College,Chattanooga,12,43,18,35,0,Jay Cade missed Free Throw.
Hiwassee College,Chattanooga,12,43,18,35,0,Hiwassee Deadball Team Rebound.
Hiwassee College,Chattanooga,13,43,18,35,1,Jay Cade made Free Throw.
Hiwassee College,Chattanooga,14,43,18,35,1,Jay Cade made Free Throw.
Hiwassee College,Chattanooga,14,43,18,54,0,Makinde London missed Three Point Jumper.
Hiwassee College,Chattanooga,14,43,18,54,0,Aario Johnson Defensive Rebound.
Hiwassee College,Chattanooga,17,43,19,6,1,Daniel Graves made Three Point Jumper.
Hiwassee College,Chattanooga,17,46,19,15,1,Greg Pryor made Three Point Jumper.
Hiwassee College,Chattanooga,17,46,19,27,0,Daniel Graves missed Jumper.
Hiwassee College,Chattanooga,17,46,19,27,0,Johnathan Burroughs-Cook Defensive Rebound.
Hiwassee College,Chattanooga,17,46,19,59,0,Chattanooga  Turnover.
Hiwassee College,Chattanooga,17,46,20,0,0,End of 1st half
Hiwassee College,Chattanooga,17,46,20,10,0,Jeulian High missed Jumper.
Hiwassee College,Chattanooga,17,46,20,10,0,Justin Tuoyo Defensive Rebound.
Hiwassee College,Chattanooga,17,49,20,49,1,Tre' McLean made Three Point Jumper. Assisted by Greg Pryor.
Hiwassee College,Chattanooga,17,49,21,12,0,Aario Johnson Turnover.
Hiwassee College,Chattanooga,17,49,21,13,0,Greg Pryor Steal.
Hiwassee College,Chattanooga,17,49,21,17,0,Tre' McLean missed Dunk.
Hiwassee College,Chattanooga,17,49,21,17,0,Greg Pryor Offensive Rebound.
Hiwassee College,Chattanooga,17,49,21,19,0,Greg Pryor missed Layup.
Hiwassee College,Chattanooga,17,49,21,19,0,Naequon Newman Defensive Rebound.
Hiwassee College,Chattanooga,17,49,21,23,0,Naequon Newman Turnover.
Hiwassee College,Chattanooga,17,49,21,24,0,Greg Pryor Steal.
Hiwassee College,Chattanooga,17,49,21,28,0,Foul on Aario Johnson.
Hiwassee College,Chattanooga,17,51,21,38,1,Justin Tuoyo made Dunk. Assisted by Greg Pryor.
Hiwassee College,Chattanooga,17,51,21,53,0,Foul on Makinde London.
Hiwassee College,Chattanooga,17,51,21,54,0,Foul on Greg Pryor.
Hiwassee College,Chattanooga,18,51,21,54,1,Ben Snider made Free Throw.
Hiwassee College,Chattanooga,18,51,21,54,0,Ben Snider missed Free Throw.
Hiwassee College,Chattanooga,18,51,21,54,0,Makinde London Defensive Rebound.
Hiwassee College,Chattanooga,18,53,22,9,1,Justin Tuoyo made Layup.
Hiwassee College,Chattanooga,18,53,22,23,0,Naequon Newman Turnover.
Hiwassee College,Chattanooga,18,53,22,25,0,Greg Pryor Steal.
Hiwassee College,Chattanooga,18,53,22,35,0,Justin Tuoyo Turnover.
Hiwassee College,Chattanooga,18,53,22,48,0,Foul on Greg Pryor.
Hiwassee College,Chattanooga,18,53,22,55,0,Ben Snider missed Three Point Jumper.
Hiwassee College,Chattanooga,18,53,22,55,0,Tevin Henry Offensive Rebound.
Hiwassee College,Chattanooga,20,53,22,59,1,Tevin Henry made Layup.
Hiwassee College,Chattanooga,20,56,23,26,1,Makinde London made Three Point Jumper. Assisted by Greg Pryor.
Hiwassee College,Chattanooga,20,56,23,44,0,Dess Culpepper missed Three Point Jumper.
Hiwassee College,Chattanooga,20,56,23,44,0,Greg Pryor Defensive Rebound.
Hiwassee College,Chattanooga,20,59,23,53,1,Peyton Woods made Three Point Jumper. Assisted by Tre' McLean.
Hiwassee College,Chattanooga,20,59,24,12,0,Ben Snider Turnover.
Hiwassee College,Chattanooga,20,59,24,15,0,Makinde London Steal.
Hiwassee College,Chattanooga,20,61,24,15,1,Justin Tuoyo made Dunk. Assisted by Makinde London.
Hiwassee College,Chattanooga,20,61,24,16,0,Foul on Dess Culpepper.
Hiwassee College,Chattanooga,20,61,24,16,0,Official TV Timeout
Hiwassee College,Chattanooga,20,62,24,16,1,Justin Tuoyo made Free Throw.
Hiwassee College,Chattanooga,22,62,24,30,1,Jay Cade made Jumper.
Hiwassee College,Chattanooga,22,65,24,50,1,Makinde London made Three Point Jumper. Assisted by Rodney Chatman.
Hiwassee College,Chattanooga,22,65,25,17,0,Jay Cade missed Jumper.
Hiwassee College,Chattanooga,22,65,25,17,0,Hiwassee Offensive Rebound.
Hiwassee College,Chattanooga,22,65,25,27,0,Jay Cade missed Three Point Jumper.
Hiwassee College,Chattanooga,22,65,25,27,0,Tevin Henry Offensive Rebound.
Hiwassee College,Chattanooga,22,65,25,36,0,Daniel Graves Turnover.
Hiwassee College,Chattanooga,22,65,25,38,0,Peyton Woods Steal.
Hiwassee College,Chattanooga,22,65,25,39,0,Foul on Jay Cade.
Hiwassee College,Chattanooga,22,65,25,39,0,Rodney Chatman missed Free Throw.
Hiwassee College,Chattanooga,22,65,25,39,0,Chattanooga Deadball Team Rebound.
Hiwassee College,Chattanooga,22,66,25,39,1,Rodney Chatman made Free Throw.
Hiwassee College,Chattanooga,22,66,25,55,0,Daniel Graves missed Three Point Jumper.
Hiwassee College,Chattanooga,22,66,25,55,0,Hiwassee Offensive Rebound.
Hiwassee College,Chattanooga,22,66,25,58,0,Daniel Graves Turnover.
Hiwassee College,Chattanooga,22,66,25,59,0,Rodney Chatman Steal.
Hiwassee College,Chattanooga,22,66,26,1,0,Foul on Kevis Jackson.
Hiwassee College,Chattanooga,22,68,26,19,1,Nat Dixon made Layup.
Hiwassee College,Chattanooga,22,68,26,20,0,Jeulian High missed Jumper.
Hiwassee College,Chattanooga,22,68,26,21,0,Kevis Jackson Offensive Rebound.
Hiwassee College,Chattanooga,22,68,26,31,0,Foul on Rodney Chatman.
Hiwassee College,Chattanooga,23,68,26,44,1,Kevis Jackson made Free Throw.
Hiwassee College,Chattanooga,24,68,26,44,1,Kevis Jackson made Free Throw.
Hiwassee College,Chattanooga,24,68,26,48,0,Makale Foreman missed Three Point Jumper.
Hiwassee College,Chattanooga,24,68,26,48,0,Makinde London Offensive Rebound.
Hiwassee College,Chattanooga,24,68,26,51,0,Makinde London Turnover.
Hiwassee College,Chattanooga,24,68,27,7,0,Dess Culpepper Turnover.
Hiwassee College,Chattanooga,24,68,27,8,0,Nat Dixon Steal.
Hiwassee College,Chattanooga,24,68,27,11,0,Nat Dixon missed Dunk.
Hiwassee College,Chattanooga,24,68,27,11,0,Peyton Woods Offensive Rebound.
Hiwassee College,Chattanooga,24,68,27,23,0,Nat Dixon Turnover.
Hiwassee College,Chattanooga,24,68,27,25,0,Dess Culpepper Steal.
Hiwassee College,Chattanooga,24,68,27,33,0,Jay Cade missed Jumper.
Hiwassee College,Chattanooga,24,68,27,33,0,Rodney Chatman Defensive Rebound.
Hiwassee College,Chattanooga,24,70,27,49,1,Rodney Chatman made Layup.
Hiwassee College,Chattanooga,24,70,28,9,0,Foul on Peyton Woods.
Hiwassee College,Chattanooga,24,70,28,9,0,Official TV Timeout
Hiwassee College,Chattanooga,24,70,28,22,0,Jay Cade Turnover.
Hiwassee College,Chattanooga,24,70,28,36,0,Foul on Trayvond Massenburg.
Hiwassee College,Chattanooga,24,70,28,36,0,Trayvond Massenburg Turnover.
Hiwassee College,Chattanooga,24,70,28,51,0,Daniel Graves missed Three Point Jumper.
Hiwassee College,Chattanooga,24,70,28,51,0,Jay Cade Offensive Rebound.
Hiwassee College,Chattanooga,26,70,28,56,1,Jay Cade made Layup.
Hiwassee College,Chattanooga,26,72,29,12,1,Rodney Chatman made Layup.
Hiwassee College,Chattanooga,26,72,29,35,0,Toure Fudge missed Three Point Jumper.
Hiwassee College,Chattanooga,26,72,29,35,0,Peyton Woods Defensive Rebound.
Hiwassee College,Chattanooga,26,75,29,41,1,Rodney Chatman made Three Point Jumper.
Hiwassee College,Chattanooga,28,75,29,56,1,Daniel Graves made Jumper.
Hiwassee College,Chattanooga,28,75,30,6,0,Peyton Woods missed Three Point Jumper.
Hiwassee College,Chattanooga,28,75,30,6,0,Trayvond Massenburg Offensive Rebound.
Hiwassee College,Chattanooga,28,77,30,10,1,Trayvond Massenburg made Two Point Tip Shot.
Hiwassee College,Chattanooga,28,77,30,22,0,Foul on Peyton Woods.
Hiwassee College,Chattanooga,28,77,30,22,0,Daniel Graves missed Free Throw.
Hiwassee College,Chattanooga,28,77,30,22,0,Kevis Jackson Offensive Rebound.
Hiwassee College,Chattanooga,28,77,30,23,0,Kevis Jackson missed Layup.
Hiwassee College,Chattanooga,28,77,30,23,0,Aario Johnson Offensive Rebound.
Hiwassee College,Chattanooga,30,77,30,32,1,Aario Johnson made Layup.
Hiwassee College,Chattanooga,30,77,30,42,0,Rodney Chatman missed Jumper.
Hiwassee College,Chattanooga,30,77,30,42,0,Daniel Graves Defensive Rebound.
Hiwassee College,Chattanooga,32,77,30,48,1,Daniel Graves made Jumper.
Hiwassee College,Chattanooga,32,77,31,5,0,Foul on Naequon Newman.
Hiwassee College,Chattanooga,32,77,31,21,0,Dylan Brewster missed Three Point Jumper.
Hiwassee College,Chattanooga,32,77,31,21,0,Aario Johnson Defensive Rebound.
Hiwassee College,Chattanooga,32,77,31,44,0,Foul on Rodney Chatman.
Hiwassee College,Chattanooga,32,77,31,44,0,Daniel Graves missed Free Throw.
Hiwassee College,Chattanooga,32,77,31,44,0,Hiwassee Deadball Team Rebound.
Hiwassee College,Chattanooga,33,77,31,44,1,Daniel Graves made Free Throw.
Hiwassee College,Chattanooga,33,77,31,53,0,Nat Dixon missed Layup.
Hiwassee College,Chattanooga,33,77,31,53,0,Trayvond Massenburg Offensive Rebound.
Hiwassee College,Chattanooga,33,79,31,56,1,Trayvond Massenburg made Dunk.
Hiwassee College,Chattanooga,36,79,32,8,1,Daniel Graves made Three Point Jumper. Assisted by Toure Fudge.
Hiwassee College,Chattanooga,36,79,32,27,0,Makale Foreman missed Three Point Jumper.
Hiwassee College,Chattanooga,36,79,32,27,0,Dylan Brewster Offensive Rebound.
Hiwassee College,Chattanooga,36,79,32,35,0,Makale Foreman Turnover.
Hiwassee College,Chattanooga,36,79,32,37,0,Toure Fudge Steal.
Hiwassee College,Chattanooga,36,79,32,39,0,Daniel Graves missed Three Point Jumper.
Hiwassee College,Chattanooga,36,79,32,39,0,Toure Fudge Offensive Rebound.
Hiwassee College,Chattanooga,36,79,32,40,0,Foul on Nat Dixon.
Hiwassee College,Chattanooga,36,79,32,41,0,Official TV Timeout
Hiwassee College,Chattanooga,37,79,32,41,1,Toure Fudge made Free Throw.
Hiwassee College,Chattanooga,38,79,32,41,1,Toure Fudge made Free Throw.
Hiwassee College,Chattanooga,38,81,33,5,1,Nat Dixon made Layup.
Hiwassee College,Chattanooga,38,81,33,5,0,Foul on Aario Johnson.
Hiwassee College,Chattanooga,38,81,33,5,0,Nat Dixon missed Free Throw.
Hiwassee College,Chattanooga,38,81,33,5,0,Naequon Newman Defensive Rebound.
Hiwassee College,Chattanooga,38,81,33,22,0,Naequon Newman missed Layup.
Hiwassee College,Chattanooga,38,81,33,22,0,Aario Johnson Offensive Rebound.
Hiwassee College,Chattanooga,38,81,33,27,0,Aario Johnson missed Jumper.
Hiwassee College,Chattanooga,38,81,33,27,0,Trayvond Massenburg Block.
Hiwassee College,Chattanooga,38,81,33,28,0,Aario Johnson Offensive Rebound.
Hiwassee College,Chattanooga,38,81,33,28,0,Foul on Nat Dixon.
Hiwassee College,Chattanooga,38,81,33,28,0,Aario Johnson missed Free Throw.
Hiwassee College,Chattanooga,38,81,33,28,0,Hiwassee Deadball Team Rebound.
Hiwassee College,Chattanooga,39,81,33,28,1,Aario Johnson made Free Throw.
Hiwassee College,Chattanooga,39,81,33,42,0,Makale Foreman missed Three Point Jumper.
Hiwassee College,Chattanooga,39,81,33,42,0,Jay Johnson Defensive Rebound.
Hiwassee College,Chattanooga,39,81,33,53,0,Toure Fudge missed Three Point Jumper.
Hiwassee College,Chattanooga,39,81,33,53,0,Rodney Chatman Defensive Rebound.
Hiwassee College,Chattanooga,39,81,34,17,0,Foul on Aario Johnson.
Hiwassee College,Chattanooga,39,82,34,17,1,Rodney Chatman made Free Throw.
Hiwassee College,Chattanooga,39,83,34,17,1,Rodney Chatman made Free Throw.
Hiwassee College,Chattanooga,42,83,34,35,1,Jay Johnson made Three Point Jumper. Assisted by Toure Fudge.
Hiwassee College,Chattanooga,42,86,34,55,1,Makale Foreman made Three Point Jumper. Assisted by Dylan Brewster.
Hiwassee College,Chattanooga,45,86,35,12,1,Toure Fudge made Three Point Jumper. Assisted by Kobe Clisby.
Hiwassee College,Chattanooga,45,86,35,25,0,Foul on Naequon Newman.
Hiwassee College,Chattanooga,45,87,35,25,1,Rodney Chatman made Free Throw.
Hiwassee College,Chattanooga,45,88,35,25,1,Rodney Chatman made Free Throw.
Hiwassee College,Chattanooga,45,88,35,39,0,Kobe Clisby missed Layup.
Hiwassee College,Chattanooga,45,88,35,39,0,Toure Fudge Offensive Rebound.
Hiwassee College,Chattanooga,45,88,35,43,0,Toure Fudge missed Three Point Jumper.
Hiwassee College,Chattanooga,45,88,35,43,0,Naequon Newman Offensive Rebound.
Hiwassee College,Chattanooga,45,88,35,47,0,Kobe Clisby missed Jumper.
Hiwassee College,Chattanooga,45,88,35,47,0,Makale Foreman Defensive Rebound.
Hiwassee College,Chattanooga,45,90,36,14,1,Rodney Chatman made Jumper.
Hiwassee College,Chattanooga,48,90,36,34,1,Daniel Graves made Three Point Jumper.
Hiwassee College,Chattanooga,48,93,36,51,1,Dylan Brewster made Three Point Jumper. Assisted by Nat Dixon.
Hiwassee College,Chattanooga,48,93,37,4,0,Toure Fudge missed Jumper.
Hiwassee College,Chattanooga,48,93,37,4,0,Trayvond Massenburg Defensive Rebound.
Hiwassee College,Chattanooga,48,93,37,8,0,Foul on Kobe Clisby.
Hiwassee College,Chattanooga,48,93,37,8,0,Official TV Timeout
Hiwassee College,Chattanooga,48,93,37,8,0,Trayvond Massenburg missed Free Throw.
Hiwassee College,Chattanooga,48,93,37,8,0,Kobe Clisby Defensive Rebound.
Hiwassee College,Chattanooga,48,93,37,18,0,Foul on Trayvond Massenburg.
Hiwassee College,Chattanooga,49,93,37,18,1,Kobe Clisby made Free Throw.
Hiwassee College,Chattanooga,49,93,37,18,0,Kobe Clisby missed Free Throw.
Hiwassee College,Chattanooga,49,93,37,18,0,Nat Dixon Defensive Rebound.
Hiwassee College,Chattanooga,49,96,37,25,1,Makale Foreman made Three Point Jumper. Assisted by Rodney Chatman.
Hiwassee College,Chattanooga,49,98,37,43,1,Rodney Chatman made Layup.
Hiwassee College,Chattanooga,49,98,37,58,0,Justice Almada missed Three Point Jumper.
Hiwassee College,Chattanooga,49,98,37,58,0,Nat Dixon Defensive Rebound.
Hiwassee College,Chattanooga,49,98,38,17,0,Makale Foreman missed Three Point Jumper.
Hiwassee College,Chattanooga,49,98,38,17,0,Dylan Tredway Defensive Rebound.
Hiwassee College,Chattanooga,49,98,38,28,0,Foul on Trayvond Massenburg.
Hiwassee College,Chattanooga,50,98,38,28,1,Kobe Clisby made Free Throw.
Hiwassee College,Chattanooga,51,98,38,28,1,Kobe Clisby made Free Throw.
Hiwassee College,Chattanooga,51,100,38,46,1,Nat Dixon made Layup. Assisted by Makale Foreman.
Hiwassee College,Chattanooga,51,100,38,57,0,Toure Fudge missed Layup.
Hiwassee College,Chattanooga,51,100,38,57,0,Trayvond Massenburg Defensive Rebound.
Hiwassee College,Chattanooga,51,100,39,5,0,Rodney Chatman Turnover.
Hiwassee College,Chattanooga,51,100,39,6,0,Kobe Clisby Steal.
Hiwassee College,Chattanooga,54,100,39,12,1,Toure Fudge made Three Point Jumper. Assisted by Justice Almada.
Hiwassee College,Chattanooga,54,102,39,23,1,Nat Dixon made Layup.
Hiwassee College,Chattanooga,54,102,39,40,0,Toure Fudge missed Three Point Jumper.
