Away Team,Home Team,Away Score,Home Score,Minute,Second,isScoringPosession,Desc.
SIU-Edwardsville,Southern Illinois,0,2,0,11,1,Sean O'Brien made Layup. Assisted by Desmar Jackson.
SIU-Edwardsville,Southern Illinois,3,2,0,26,1,Rozell Nunn made Three Point Jumper. Assisted by Maurice Wiltz.
SIU-Edwardsville,Southern Illinois,3,4,0,46,1,Anthony Beane made Jumper.
SIU-Edwardsville,Southern Illinois,3,4,0,55,0,Foul on Anthony Beane.
SIU-Edwardsville,Southern Illinois,4,4,0,55,1,Maurice Wiltz made Free Throw.
SIU-Edwardsville,Southern Illinois,5,4,0,55,1,Maurice Wiltz made Free Throw.
SIU-Edwardsville,Southern Illinois,5,6,1,18,1,Davante Drinkard made Layup. Assisted by Tyler Smithpeters.
SIU-Edwardsville,Southern Illinois,5,6,1,30,0,Tim Johnson missed Three Point Jumper.
SIU-Edwardsville,Southern Illinois,5,6,1,30,0,Sean O'Brien Defensive Rebound.
SIU-Edwardsville,Southern Illinois,5,8,1,50,1,Davante Drinkard made Jumper. Assisted by Marcus Fillyaw.
SIU-Edwardsville,Southern Illinois,7,8,2,17,1,Rozell Nunn made Jumper.
SIU-Edwardsville,Southern Illinois,7,8,2,36,0,Sean O'Brien Turnover.
SIU-Edwardsville,Southern Illinois,7,8,2,36,0,Foul on Sean O'Brien.
SIU-Edwardsville,Southern Illinois,7,8,2,55,0,Tim Johnson missed Three Point Jumper.
SIU-Edwardsville,Southern Illinois,7,8,2,55,0,Jalen Pendleton Defensive Rebound.
SIU-Edwardsville,Southern Illinois,7,8,3,8,0,Desmar Jackson missed Three Point Jumper.
SIU-Edwardsville,Southern Illinois,7,8,3,8,0,Rozell Nunn Defensive Rebound.
SIU-Edwardsville,Southern Illinois,7,8,3,17,0,Rozell Nunn Turnover.
SIU-Edwardsville,Southern Illinois,7,8,3,28,0,Foul on Christian Salecich.
SIU-Edwardsville,Southern Illinois,7,10,3,49,1,Jalen Pendleton made Layup.
SIU-Edwardsville,Southern Illinois,7,10,4,11,0,Christian Salecich missed Jumper.
SIU-Edwardsville,Southern Illinois,7,10,4,11,0,Desmar Jackson Defensive Rebound.
SIU-Edwardsville,Southern Illinois,7,10,4,35,0,Jalen Pendleton missed Layup.
SIU-Edwardsville,Southern Illinois,7,10,4,35,0,Jalen Pendleton Offensive Rebound.
SIU-Edwardsville,Southern Illinois,7,10,4,40,0,Bronson Verhines missed Jumper.
SIU-Edwardsville,Southern Illinois,7,10,4,40,0,Kris Davis Defensive Rebound.
SIU-Edwardsville,Southern Illinois,7,10,5,4,0,Donivine Stewart missed Three Point Jumper.
SIU-Edwardsville,Southern Illinois,7,10,5,4,0,Desmar Jackson Defensive Rebound.
SIU-Edwardsville,Southern Illinois,7,12,5,13,1,Bronson Verhines made Layup.
SIU-Edwardsville,Southern Illinois,7,12,5,13,0,Foul on Kris Davis.
SIU-Edwardsville,Southern Illinois,7,12,5,13,0,Official TV Timeout
SIU-Edwardsville,Southern Illinois,7,13,5,13,1,Bronson Verhines made Free Throw.
SIU-Edwardsville,Southern Illinois,7,13,5,46,0,Christian Salecich missed Jumper.
SIU-Edwardsville,Southern Illinois,7,13,5,46,0,Sean O'Brien Defensive Rebound.
SIU-Edwardsville,Southern Illinois,7,15,6,18,1,Jalen Pendleton made Layup.
SIU-Edwardsville,Southern Illinois,7,15,6,36,0,Donivine Stewart missed Layup.
SIU-Edwardsville,Southern Illinois,7,15,6,36,0,Bronson Verhines Block.
SIU-Edwardsville,Southern Illinois,7,15,6,36,0,Bronson Verhines Defensive Rebound.
SIU-Edwardsville,Southern Illinois,7,15,7,11,0,Anthony Beane missed Jumper.
SIU-Edwardsville,Southern Illinois,7,15,7,11,0,SIU-Edwardsville Defensive Rebound.
SIU-Edwardsville,Southern Illinois,7,15,7,25,0,Foul on Bronson Verhines.
SIU-Edwardsville,Southern Illinois,7,15,7,38,0,Tim Johnson missed Dunk.
SIU-Edwardsville,Southern Illinois,7,15,7,38,0,Desmar Jackson Defensive Rebound.
SIU-Edwardsville,Southern Illinois,7,17,7,44,1,Jalen Pendleton made Layup. Assisted by Desmar Jackson.
SIU-Edwardsville,Southern Illinois,7,17,8,10,0,Tim Johnson Turnover.
SIU-Edwardsville,Southern Illinois,7,17,8,11,0,Anthony Beane Steal.
SIU-Edwardsville,Southern Illinois,7,19,8,23,0,Official TV Timeout
SIU-Edwardsville,Southern Illinois,7,19,8,23,1,Jalen Pendleton made Layup. Assisted by Desmar Jackson.
SIU-Edwardsville,Southern Illinois,7,19,8,38,0,Foul on Davante Drinkard.
SIU-Edwardsville,Southern Illinois,7,19,8,49,0,Maurice Wiltz missed Jumper.
SIU-Edwardsville,Southern Illinois,7,19,8,49,0,Davante Drinkard Defensive Rebound.
SIU-Edwardsville,Southern Illinois,7,19,9,27,0,Marcus Fillyaw Turnover.
SIU-Edwardsville,Southern Illinois,7,19,9,29,0,Ray Lester Steal.
SIU-Edwardsville,Southern Illinois,7,19,9,42,0,Rozell Nunn missed Jumper.
SIU-Edwardsville,Southern Illinois,7,19,9,42,0,Davante Drinkard Defensive Rebound.
SIU-Edwardsville,Southern Illinois,7,19,9,51,0,Foul on Tim Johnson.
SIU-Edwardsville,Southern Illinois,7,19,9,51,0,Desmar Jackson missed Free Throw.
SIU-Edwardsville,Southern Illinois,7,19,9,51,0,Southern Illinois Deadball Team Rebound.
SIU-Edwardsville,Southern Illinois,7,19,9,51,0,Desmar Jackson missed Free Throw.
SIU-Edwardsville,Southern Illinois,7,19,9,51,0,Rozell Nunn Defensive Rebound.
SIU-Edwardsville,Southern Illinois,7,19,10,7,0,Donivine Stewart Turnover.
SIU-Edwardsville,Southern Illinois,7,19,10,8,0,Desmar Jackson Steal.
SIU-Edwardsville,Southern Illinois,7,21,10,13,1,Desmar Jackson made Layup.
SIU-Edwardsville,Southern Illinois,7,21,10,26,0,Donivine Stewart Turnover.
SIU-Edwardsville,Southern Illinois,7,21,10,27,0,Desmar Jackson Steal.
SIU-Edwardsville,Southern Illinois,7,21,10,30,0,Desmar Jackson missed Dunk.
SIU-Edwardsville,Southern Illinois,7,21,10,30,0,Tim Johnson Block.
SIU-Edwardsville,Southern Illinois,7,21,10,30,0,Cameron Craig Defensive Rebound.
SIU-Edwardsville,Southern Illinois,7,21,10,39,0,Rozell Nunn missed Layup.
SIU-Edwardsville,Southern Illinois,7,21,10,39,0,Davante Drinkard Defensive Rebound.
SIU-Edwardsville,Southern Illinois,7,21,10,52,0,Foul on Ray Lester.
SIU-Edwardsville,Southern Illinois,7,23,11,2,1,Jalen Pendleton made Layup.
SIU-Edwardsville,Southern Illinois,7,23,11,4,0,SIU-Edwardsville  Timeout
SIU-Edwardsville,Southern Illinois,9,23,11,12,1,Rozell Nunn made Layup.
SIU-Edwardsville,Southern Illinois,9,23,11,31,0,Foul on Rozell Nunn.
SIU-Edwardsville,Southern Illinois,9,23,11,35,0,Foul on Donivine Stewart.
SIU-Edwardsville,Southern Illinois,9,23,11,45,0,Jalen Pendleton Turnover.
SIU-Edwardsville,Southern Illinois,9,23,11,47,0,Ray Lester Steal.
SIU-Edwardsville,Southern Illinois,9,23,11,56,0,Rozell Nunn missed Three Point Jumper.
SIU-Edwardsville,Southern Illinois,9,23,11,56,0,Anthony Beane Defensive Rebound.
SIU-Edwardsville,Southern Illinois,9,23,12,5,0,Jalen Pendleton missed Layup.
SIU-Edwardsville,Southern Illinois,9,23,12,8,0,SIU-Edwardsville Defensive Rebound.
SIU-Edwardsville,Southern Illinois,9,23,12,8,0,Official TV Timeout
SIU-Edwardsville,Southern Illinois,9,23,12,22,0,Rozell Nunn missed Jumper.
SIU-Edwardsville,Southern Illinois,9,23,12,22,0,Desmar Jackson Defensive Rebound.
SIU-Edwardsville,Southern Illinois,9,23,12,41,0,Mike Balogun missed Layup.
SIU-Edwardsville,Southern Illinois,9,23,12,41,0,Rozell Nunn Defensive Rebound.
SIU-Edwardsville,Southern Illinois,9,23,12,49,0,Foul on Sean O'Brien.
SIU-Edwardsville,Southern Illinois,9,23,12,52,0,Ray Lester Turnover.
SIU-Edwardsville,Southern Illinois,9,23,12,53,0,Marcus Fillyaw Steal.
SIU-Edwardsville,Southern Illinois,9,23,12,56,0,Foul on Cameron Craig.
SIU-Edwardsville,Southern Illinois,9,24,12,56,1,Desmar Jackson made Free Throw.
SIU-Edwardsville,Southern Illinois,9,25,12,56,1,Desmar Jackson made Free Throw.
SIU-Edwardsville,Southern Illinois,12,25,13,19,1,Christian Salecich made Three Point Jumper. Assisted by Cameron Craig.
SIU-Edwardsville,Southern Illinois,12,25,13,40,0,Mike Balogun missed Three Point Jumper.
SIU-Edwardsville,Southern Illinois,12,25,13,40,0,Ray Lester Defensive Rebound.
SIU-Edwardsville,Southern Illinois,15,25,13,57,1,Cameron Craig made Three Point Jumper. Assisted by Michael Messer.
SIU-Edwardsville,Southern Illinois,15,28,14,26,1,Marcus Fillyaw made Three Point Jumper. Assisted by Mike Balogun.
SIU-Edwardsville,Southern Illinois,15,28,14,46,0,Kris Davis missed Jumper.
SIU-Edwardsville,Southern Illinois,15,28,14,46,0,Desmar Jackson Defensive Rebound.
SIU-Edwardsville,Southern Illinois,15,28,14,57,0,Foul on Ray Lester.
SIU-Edwardsville,Southern Illinois,15,29,14,57,1,Desmar Jackson made Free Throw.
SIU-Edwardsville,Southern Illinois,15,29,14,57,0,Desmar Jackson missed Free Throw.
SIU-Edwardsville,Southern Illinois,15,29,14,57,0,Keaton Jackson Defensive Rebound.
SIU-Edwardsville,Southern Illinois,15,29,15,21,0,Tim Johnson Turnover.
SIU-Edwardsville,Southern Illinois,15,29,15,41,0,Anthony Beane missed Layup.
SIU-Edwardsville,Southern Illinois,15,29,15,41,0,Keaton Jackson Defensive Rebound.
SIU-Edwardsville,Southern Illinois,15,29,15,48,0,Foul on Anthony Beane.
SIU-Edwardsville,Southern Illinois,15,29,16,19,0,Cameron Craig missed Three Point Jumper.
SIU-Edwardsville,Southern Illinois,15,29,16,19,0,Jalen Pendleton Defensive Rebound.
SIU-Edwardsville,Southern Illinois,15,29,16,19,0,Foul on Keaton Jackson.
SIU-Edwardsville,Southern Illinois,15,29,16,19,0,Official TV Timeout
SIU-Edwardsville,Southern Illinois,15,29,16,19,0,Jalen Pendleton missed Free Throw.
SIU-Edwardsville,Southern Illinois,15,29,16,19,0,Keaton Jackson Defensive Rebound.
SIU-Edwardsville,Southern Illinois,15,29,16,30,0,Foul on Jalen Pendleton.
SIU-Edwardsville,Southern Illinois,16,29,16,30,1,Michael Messer made Free Throw.
SIU-Edwardsville,Southern Illinois,17,29,16,30,1,Michael Messer made Free Throw.
SIU-Edwardsville,Southern Illinois,17,31,16,37,1,Mike Balogun made Jumper.
SIU-Edwardsville,Southern Illinois,17,31,16,47,0,Michael Messer Turnover.
SIU-Edwardsville,Southern Illinois,17,31,16,48,0,Jalen Pendleton Steal.
SIU-Edwardsville,Southern Illinois,17,33,16,50,1,Jalen Pendleton made Dunk.
SIU-Edwardsville,Southern Illinois,17,33,17,10,0,Maurice Wiltz missed Three Point Jumper.
SIU-Edwardsville,Southern Illinois,17,33,17,10,0,Marcus Fillyaw Defensive Rebound.
SIU-Edwardsville,Southern Illinois,17,33,17,33,0,Davante Drinkard missed Layup.
SIU-Edwardsville,Southern Illinois,17,33,17,33,0,Keaton Jackson Block.
SIU-Edwardsville,Southern Illinois,17,33,17,33,0,Keaton Jackson Defensive Rebound.
SIU-Edwardsville,Southern Illinois,19,33,17,42,1,Kris Davis made Layup.
SIU-Edwardsville,Southern Illinois,19,35,18,5,1,Desmar Jackson made Dunk. Assisted by Marcus Fillyaw.
SIU-Edwardsville,Southern Illinois,19,35,18,30,0,Keaton Jackson Turnover.
SIU-Edwardsville,Southern Illinois,19,35,18,32,0,Marcus Fillyaw Steal.
SIU-Edwardsville,Southern Illinois,19,37,18,35,1,Jalen Pendleton made Layup. Assisted by Marcus Fillyaw.
SIU-Edwardsville,Southern Illinois,19,37,18,39,0,SIU-Edwardsville  Timeout
SIU-Edwardsville,Southern Illinois,19,37,18,51,0,Grant Fiorentinos missed Layup.
SIU-Edwardsville,Southern Illinois,19,37,18,51,0,Desmar Jackson Defensive Rebound.
SIU-Edwardsville,Southern Illinois,19,37,18,59,0,Foul on Tim Johnson.
SIU-Edwardsville,Southern Illinois,19,38,18,59,1,Desmar Jackson made Free Throw.
SIU-Edwardsville,Southern Illinois,19,39,18,59,1,Desmar Jackson made Free Throw.
SIU-Edwardsville,Southern Illinois,19,39,19,10,0,Foul on Desmar Jackson.
SIU-Edwardsville,Southern Illinois,19,39,19,10,0,Donivine Stewart missed Free Throw.
SIU-Edwardsville,Southern Illinois,19,39,19,10,0,SIU-Edwardsville Deadball Team Rebound.
SIU-Edwardsville,Southern Illinois,20,39,19,10,1,Donivine Stewart made Free Throw.
SIU-Edwardsville,Southern Illinois,20,39,19,36,0,Mike Balogun missed Three Point Jumper.
SIU-Edwardsville,Southern Illinois,20,39,19,36,0,Donivine Stewart Defensive Rebound.
SIU-Edwardsville,Southern Illinois,20,39,19,44,0,Donivine Stewart missed Jumper.
SIU-Edwardsville,Southern Illinois,20,39,19,44,0,Bronson Verhines Block.
SIU-Edwardsville,Southern Illinois,20,39,19,44,0,Bronson Verhines Defensive Rebound.
SIU-Edwardsville,Southern Illinois,20,39,19,46,0,Southern Illinois  Timeout
SIU-Edwardsville,Southern Illinois,20,39,19,56,0,Colby Long missed Three Point Jumper.
SIU-Edwardsville,Southern Illinois,20,39,19,56,0,Rozell Nunn Defensive Rebound.
SIU-Edwardsville,Southern Illinois,20,39,20,0,0,End of 1st half
SIU-Edwardsville,Southern Illinois,20,39,20,20,0,Donivine Stewart missed Layup.
SIU-Edwardsville,Southern Illinois,20,39,20,20,0,Ray Lester Offensive Rebound.
SIU-Edwardsville,Southern Illinois,22,39,20,23,1,Ray Lester made Layup.
SIU-Edwardsville,Southern Illinois,22,39,20,23,0,Foul on Davante Drinkard.
SIU-Edwardsville,Southern Illinois,22,39,20,23,0,Rozell Nunn missed Free Throw.
SIU-Edwardsville,Southern Illinois,22,39,20,23,0,Desmar Jackson Defensive Rebound.
SIU-Edwardsville,Southern Illinois,22,39,20,43,0,Anthony Beane Turnover.
SIU-Edwardsville,Southern Illinois,24,39,20,57,1,Ray Lester made Layup. Assisted by Tim Johnson.
SIU-Edwardsville,Southern Illinois,24,41,21,34,1,Desmar Jackson made Jumper.
SIU-Edwardsville,Southern Illinois,24,41,21,48,0,Ray Lester Turnover.
SIU-Edwardsville,Southern Illinois,24,41,21,48,0,Foul on Ray Lester.
SIU-Edwardsville,Southern Illinois,24,44,22,10,1,Anthony Beane made Three Point Jumper. Assisted by Desmar Jackson.
SIU-Edwardsville,Southern Illinois,24,44,22,27,0,Foul on Marcus Fillyaw.
SIU-Edwardsville,Southern Illinois,24,44,22,27,0,Maurice Wiltz missed Free Throw.
SIU-Edwardsville,Southern Illinois,24,44,22,27,0,SIU-Edwardsville Deadball Team Rebound.
SIU-Edwardsville,Southern Illinois,25,44,22,27,1,Maurice Wiltz made Free Throw.
SIU-Edwardsville,Southern Illinois,25,44,22,47,0,Jalen Pendleton Turnover.
SIU-Edwardsville,Southern Illinois,25,44,22,47,0,Foul on Jalen Pendleton.
SIU-Edwardsville,Southern Illinois,27,44,23,7,1,Grant Fiorentinos made Jumper.
SIU-Edwardsville,Southern Illinois,27,44,23,20,0,Marcus Fillyaw Turnover.
SIU-Edwardsville,Southern Illinois,27,44,23,22,0,Maurice Wiltz Steal.
SIU-Edwardsville,Southern Illinois,30,44,23,28,1,Tim Johnson made Three Point Jumper. Assisted by Rozell Nunn.
SIU-Edwardsville,Southern Illinois,30,44,24,6,0,Desmar Jackson missed Three Point Jumper.
SIU-Edwardsville,Southern Illinois,30,44,24,6,0,Donivine Stewart Defensive Rebound.
SIU-Edwardsville,Southern Illinois,30,44,24,23,0,Grant Fiorentinos missed Jumper.
SIU-Edwardsville,Southern Illinois,30,44,24,23,0,Bronson Verhines Defensive Rebound.
SIU-Edwardsville,Southern Illinois,30,44,24,45,0,Jalen Pendleton missed Layup.
SIU-Edwardsville,Southern Illinois,30,44,24,45,0,Jalen Pendleton Offensive Rebound.
SIU-Edwardsville,Southern Illinois,30,44,24,46,0,Foul on Rozell Nunn.
SIU-Edwardsville,Southern Illinois,30,44,24,48,0,Official TV Timeout
SIU-Edwardsville,Southern Illinois,30,46,24,56,1,Marcus Fillyaw made Layup.
SIU-Edwardsville,Southern Illinois,30,46,25,25,0,Donivine Stewart missed Layup.
SIU-Edwardsville,Southern Illinois,30,46,25,25,0,Marcus Fillyaw Defensive Rebound.
SIU-Edwardsville,Southern Illinois,30,46,25,34,0,Foul on Maurice Wiltz.
SIU-Edwardsville,Southern Illinois,30,46,25,46,0,Jalen Pendleton Turnover.
SIU-Edwardsville,Southern Illinois,30,46,25,47,0,Kris Davis Steal.
SIU-Edwardsville,Southern Illinois,30,46,25,50,0,Foul on Desmar Jackson.
SIU-Edwardsville,Southern Illinois,30,46,25,50,0,Kris Davis missed Free Throw.
SIU-Edwardsville,Southern Illinois,30,46,25,50,0,SIU-Edwardsville Deadball Team Rebound.
SIU-Edwardsville,Southern Illinois,30,46,25,50,0,Kris Davis missed Free Throw.
SIU-Edwardsville,Southern Illinois,30,46,25,50,0,Southern Illinois Defensive Rebound.
SIU-Edwardsville,Southern Illinois,30,48,26,13,1,Jalen Pendleton made Layup. Assisted by Desmar Jackson.
SIU-Edwardsville,Southern Illinois,30,48,26,23,0,Michael Messer missed Jumper.
SIU-Edwardsville,Southern Illinois,30,48,26,23,0,Desmar Jackson Defensive Rebound.
SIU-Edwardsville,Southern Illinois,30,48,26,31,0,Bronson Verhines Turnover.
SIU-Edwardsville,Southern Illinois,30,48,26,31,0,Foul on Bronson Verhines.
SIU-Edwardsville,Southern Illinois,30,48,26,49,0,Michael Messer missed Three Point Jumper.
SIU-Edwardsville,Southern Illinois,30,48,26,49,0,Marcus Fillyaw Defensive Rebound.
SIU-Edwardsville,Southern Illinois,30,50,26,59,1,Bola Olaniyan made Layup. Assisted by Jalen Pendleton.
SIU-Edwardsville,Southern Illinois,30,50,27,5,0,SIU-Edwardsville  Timeout
SIU-Edwardsville,Southern Illinois,30,50,27,35,0,Grant Fiorentinos missed Jumper.
SIU-Edwardsville,Southern Illinois,30,50,27,35,0,Sean O'Brien Defensive Rebound.
SIU-Edwardsville,Southern Illinois,30,50,27,48,0,Jalen Pendleton Turnover.
SIU-Edwardsville,Southern Illinois,30,50,28,2,0,Cameron Craig Turnover.
SIU-Edwardsville,Southern Illinois,30,50,28,2,0,Official TV Timeout
SIU-Edwardsville,Southern Illinois,30,50,28,25,0,Bola Olaniyan missed Layup.
SIU-Edwardsville,Southern Illinois,30,50,28,25,0,Jalen Pendleton Offensive Rebound.
SIU-Edwardsville,Southern Illinois,30,52,28,26,1,Jalen Pendleton made Layup.
SIU-Edwardsville,Southern Illinois,30,52,28,45,0,Cameron Craig missed Layup.
SIU-Edwardsville,Southern Illinois,30,52,28,45,0,Desmar Jackson Block.
SIU-Edwardsville,Southern Illinois,30,52,28,45,0,Rozell Nunn Offensive Rebound.
SIU-Edwardsville,Southern Illinois,30,52,28,50,0,Rozell Nunn missed Layup.
SIU-Edwardsville,Southern Illinois,30,52,28,50,0,Southern Illinois Defensive Rebound.
SIU-Edwardsville,Southern Illinois,30,54,28,55,1,Bola Olaniyan made Layup. Assisted by Desmar Jackson.
SIU-Edwardsville,Southern Illinois,30,54,29,27,0,Rozell Nunn Turnover.
SIU-Edwardsville,Southern Illinois,30,54,29,28,0,Sean O'Brien Steal.
SIU-Edwardsville,Southern Illinois,30,56,29,32,1,Anthony Beane made Layup.
SIU-Edwardsville,Southern Illinois,32,56,29,42,1,Christian Salecich made Jumper.
SIU-Edwardsville,Southern Illinois,32,56,30,1,0,Foul on Grant Fiorentinos.
SIU-Edwardsville,Southern Illinois,32,56,30,11,0,Jalen Pendleton missed Jumper.
SIU-Edwardsville,Southern Illinois,32,56,30,11,0,Jalen Pendleton Offensive Rebound.
SIU-Edwardsville,Southern Illinois,32,56,30,14,0,Jalen Pendleton missed Layup.
SIU-Edwardsville,Southern Illinois,32,56,30,14,0,Grant Fiorentinos Defensive Rebound.
SIU-Edwardsville,Southern Illinois,32,56,30,26,0,Maurice Wiltz Turnover.
SIU-Edwardsville,Southern Illinois,32,56,30,29,0,Bola Olaniyan Steal.
SIU-Edwardsville,Southern Illinois,32,56,30,38,0,Anthony Beane missed Three Point Jumper.
SIU-Edwardsville,Southern Illinois,32,56,30,38,0,Rozell Nunn Defensive Rebound.
SIU-Edwardsville,Southern Illinois,32,56,30,53,0,Kris Davis missed Layup.
SIU-Edwardsville,Southern Illinois,32,56,30,53,0,Bola Olaniyan Defensive Rebound.
SIU-Edwardsville,Southern Illinois,32,58,31,11,1,Jalen Pendleton made Layup.
SIU-Edwardsville,Southern Illinois,32,58,31,30,0,Maurice Wiltz missed Three Point Jumper.
SIU-Edwardsville,Southern Illinois,32,58,31,30,0,Bola Olaniyan Defensive Rebound.
SIU-Edwardsville,Southern Illinois,32,60,31,39,1,Anthony Beane made Layup. Assisted by Desmar Jackson.
SIU-Edwardsville,Southern Illinois,32,60,31,49,0,SIU-Edwardsville  Timeout
SIU-Edwardsville,Southern Illinois,32,60,32,0,0,Maurice Wiltz missed Layup.
SIU-Edwardsville,Southern Illinois,32,60,32,0,0,Dawson Verhines Defensive Rebound.
SIU-Edwardsville,Southern Illinois,32,60,32,4,0,Official TV Timeout
SIU-Edwardsville,Southern Illinois,32,60,32,39,0,Southern Illinois  Turnover.
SIU-Edwardsville,Southern Illinois,34,60,32,51,1,Tim Johnson made Layup.
SIU-Edwardsville,Southern Illinois,34,60,32,51,0,Foul on Dawson Verhines.
SIU-Edwardsville,Southern Illinois,35,60,32,51,1,Tim Johnson made Free Throw.
SIU-Edwardsville,Southern Illinois,35,60,33,10,0,Mike Balogun missed Three Point Jumper.
SIU-Edwardsville,Southern Illinois,35,60,33,10,0,Ray Lester Defensive Rebound.
SIU-Edwardsville,Southern Illinois,35,60,33,13,0,Foul on Davante Drinkard.
SIU-Edwardsville,Southern Illinois,36,60,33,13,1,Ray Lester made Free Throw.
SIU-Edwardsville,Southern Illinois,37,60,33,13,1,Ray Lester made Free Throw.
SIU-Edwardsville,Southern Illinois,37,62,33,22,1,Sean O'Brien made Layup. Assisted by Marcus Fillyaw.
SIU-Edwardsville,Southern Illinois,37,62,33,28,0,Foul on Bronson Verhines.
SIU-Edwardsville,Southern Illinois,38,62,33,28,1,Ray Lester made Free Throw.
SIU-Edwardsville,Southern Illinois,38,62,33,28,0,Ray Lester missed Free Throw.
SIU-Edwardsville,Southern Illinois,38,62,33,28,0,Donivine Stewart Offensive Rebound.
SIU-Edwardsville,Southern Illinois,38,62,33,37,0,Tim Johnson Turnover.
SIU-Edwardsville,Southern Illinois,38,62,33,37,0,Sean O'Brien Steal.
SIU-Edwardsville,Southern Illinois,38,62,33,38,0,Foul on Ray Lester.
SIU-Edwardsville,Southern Illinois,38,62,33,58,0,Foul on Michael Messer.
SIU-Edwardsville,Southern Illinois,38,64,34,23,1,Sean O'Brien made Layup.
SIU-Edwardsville,Southern Illinois,38,64,34,34,0,Foul on Sean O'Brien.
SIU-Edwardsville,Southern Illinois,39,64,34,34,1,Grant Fiorentinos made Free Throw.
SIU-Edwardsville,Southern Illinois,40,64,34,34,1,Grant Fiorentinos made Free Throw.
SIU-Edwardsville,Southern Illinois,40,64,34,47,0,Dawson Verhines Turnover.
SIU-Edwardsville,Southern Illinois,40,64,35,5,0,Kris Davis missed Layup.
SIU-Edwardsville,Southern Illinois,40,64,35,5,0,Kris Davis Offensive Rebound.
SIU-Edwardsville,Southern Illinois,42,64,35,9,1,Kris Davis made Layup.
SIU-Edwardsville,Southern Illinois,42,64,35,20,0,Colby Long Turnover.
SIU-Edwardsville,Southern Illinois,42,64,35,21,0,Grant Fiorentinos Steal.
SIU-Edwardsville,Southern Illinois,42,64,35,22,0,Foul on Mike Balogun.
SIU-Edwardsville,Southern Illinois,43,64,35,22,1,Christian Salecich made Free Throw.
SIU-Edwardsville,Southern Illinois,44,64,35,22,1,Christian Salecich made Free Throw.
SIU-Edwardsville,Southern Illinois,44,64,35,38,0,Anthony Beane Turnover.
SIU-Edwardsville,Southern Illinois,44,64,35,38,0,Michael Messer Steal.
SIU-Edwardsville,Southern Illinois,46,64,35,48,1,Michael Messer made Layup.
SIU-Edwardsville,Southern Illinois,46,64,35,56,0,Anthony Beane Turnover.
SIU-Edwardsville,Southern Illinois,46,64,35,56,0,Foul on Anthony Beane.
SIU-Edwardsville,Southern Illinois,46,64,35,56,0,Technical Foul on Anthony Beane.
SIU-Edwardsville,Southern Illinois,47,64,35,58,1,Kris Davis made Free Throw.
SIU-Edwardsville,Southern Illinois,48,64,35,58,1,Kris Davis made Free Throw.
SIU-Edwardsville,Southern Illinois,48,64,35,58,0,Christian Salecich missed Three Point Jumper.
SIU-Edwardsville,Southern Illinois,48,64,35,58,0,SIU-Edwardsville Offensive Rebound.
SIU-Edwardsville,Southern Illinois,48,64,36,11,0,Official TV Timeout
SIU-Edwardsville,Southern Illinois,48,64,36,22,0,Kris Davis missed Three Point Jumper.
SIU-Edwardsville,Southern Illinois,48,64,36,22,0,Southern Illinois Defensive Rebound.
SIU-Edwardsville,Southern Illinois,48,64,36,29,0,Foul on Donivine Stewart.
SIU-Edwardsville,Southern Illinois,48,64,36,29,0,Desmar Jackson missed Free Throw.
SIU-Edwardsville,Southern Illinois,48,64,36,29,0,Ray Lester Defensive Rebound.
SIU-Edwardsville,Southern Illinois,48,64,36,39,0,Foul on Bola Olaniyan.
SIU-Edwardsville,Southern Illinois,48,64,37,2,0,Ray Lester missed Free Throw.
SIU-Edwardsville,Southern Illinois,48,64,37,2,0,SIU-Edwardsville Deadball Team Rebound.
SIU-Edwardsville,Southern Illinois,49,64,37,5,1,Ray Lester made Free Throw.
SIU-Edwardsville,Southern Illinois,49,66,37,29,1,Marcus Fillyaw made Layup.
SIU-Edwardsville,Southern Illinois,52,66,37,29,1,Tim Johnson made Three Point Jumper. Assisted by Donivine Stewart.
SIU-Edwardsville,Southern Illinois,52,66,37,29,0,Foul on Keaton Jackson.
SIU-Edwardsville,Southern Illinois,52,67,37,29,1,Desmar Jackson made Free Throw.
SIU-Edwardsville,Southern Illinois,52,68,37,29,1,Desmar Jackson made Free Throw.
SIU-Edwardsville,Southern Illinois,52,68,37,36,0,Tim Johnson missed Three Point Jumper.
SIU-Edwardsville,Southern Illinois,52,68,37,36,0,Donivine Stewart Offensive Rebound.
SIU-Edwardsville,Southern Illinois,52,68,37,40,0,Foul on Bronson Verhines.
SIU-Edwardsville,Southern Illinois,53,68,37,40,1,Keaton Jackson made Free Throw.
SIU-Edwardsville,Southern Illinois,54,68,37,40,1,Keaton Jackson made Free Throw.
SIU-Edwardsville,Southern Illinois,54,68,37,58,0,Foul on Maurice Wiltz.
SIU-Edwardsville,Southern Illinois,54,68,37,58,0,Marcus Fillyaw missed Free Throw.
SIU-Edwardsville,Southern Illinois,54,68,37,58,0,Tim Johnson Defensive Rebound.
SIU-Edwardsville,Southern Illinois,54,68,38,12,0,Donivine Stewart missed Three Point Jumper.
SIU-Edwardsville,Southern Illinois,54,68,38,12,0,Mike Balogun Defensive Rebound.
SIU-Edwardsville,Southern Illinois,54,68,38,39,0,Colby Long missed Three Point Jumper.
SIU-Edwardsville,Southern Illinois,54,68,38,39,0,Tim Johnson Defensive Rebound.
SIU-Edwardsville,Southern Illinois,57,68,38,47,1,Maurice Wiltz made Three Point Jumper. Assisted by Tim Johnson.
SIU-Edwardsville,Southern Illinois,57,68,38,49,0,SIU-Edwardsville  Timeout
SIU-Edwardsville,Southern Illinois,57,68,38,52,0,Foul on Donivine Stewart.
SIU-Edwardsville,Southern Illinois,57,69,38,52,1,Marcus Fillyaw made Free Throw.
SIU-Edwardsville,Southern Illinois,57,70,38,52,1,Marcus Fillyaw made Free Throw.
SIU-Edwardsville,Southern Illinois,57,70,39,1,0,Tim Johnson missed Jumper.
SIU-Edwardsville,Southern Illinois,57,70,39,1,0,Bola Olaniyan Defensive Rebound.
SIU-Edwardsville,Southern Illinois,57,70,39,18,0,Foul on Michael Messer.
SIU-Edwardsville,Southern Illinois,57,71,39,18,1,Marcus Fillyaw made Free Throw.
SIU-Edwardsville,Southern Illinois,57,72,39,18,1,Marcus Fillyaw made Free Throw.
SIU-Edwardsville,Southern Illinois,57,72,39,21,0,Maurice Wiltz missed Three Point Jumper.
SIU-Edwardsville,Southern Illinois,57,72,39,21,0,Bola Olaniyan Defensive Rebound.
SIU-Edwardsville,Southern Illinois,57,74,39,59,1,Bola Olaniyan made Layup. Assisted by Colby Long.
SIU-Edwardsville,Southern Illinois,57,74,40,0,0,End of 2nd half
