Away Team,Home Team,Away Score,Home Score,Minute,Second,isScoringPosession,Desc.
Bowling Green,Cleveland State,0,3,0,28,1,Andre Yates made Three Point Jumper. Assisted by Rob Edwards.
Bowling Green,Cleveland State,0,3,0,51,0,Rasheed Worrell Turnover.
Bowling Green,Cleveland State,0,3,1,5,0,Demonte Flannigan missed Jumper.
Bowling Green,Cleveland State,0,3,1,5,0,Zack Denny Defensive Rebound.
Bowling Green,Cleveland State,0,3,1,18,0,Wesley Alcegaire missed Three Point Jumper.
Bowling Green,Cleveland State,0,3,1,18,0,Spencer Parker Offensive Rebound.
Bowling Green,Cleveland State,0,3,1,23,0,Spencer Parker missed Layup.
Bowling Green,Cleveland State,0,3,1,23,0,Vinny Zollo Defensive Rebound.
Bowling Green,Cleveland State,0,3,1,24,0,Foul on Spencer Parker.
Bowling Green,Cleveland State,0,5,1,53,1,Andre Yates made Jumper.
Bowling Green,Cleveland State,3,5,2,18,1,Spencer Parker made Three Point Jumper. Assisted by David Joseph.
Bowling Green,Cleveland State,3,5,2,39,0,Rob Edwards missed Jumper.
Bowling Green,Cleveland State,3,5,2,39,0,Rasheed Worrell Defensive Rebound.
Bowling Green,Cleveland State,3,5,2,40,0,Foul on Demonte Flannigan.
Bowling Green,Cleveland State,3,5,2,47,0,Foul on Spencer Parker.
Bowling Green,Cleveland State,3,5,2,47,0,Spencer Parker Turnover.
Bowling Green,Cleveland State,3,5,2,56,0,Rob Edwards missed Three Point Jumper.
Bowling Green,Cleveland State,3,5,2,56,0,Terrell Hales Offensive Rebound.
Bowling Green,Cleveland State,3,5,3,1,0,Vinny Zollo missed Layup.
Bowling Green,Cleveland State,3,5,3,1,0,Zack Denny Defensive Rebound.
Bowling Green,Cleveland State,3,5,3,26,0,Zack Denny missed Jumper.
Bowling Green,Cleveland State,3,5,3,26,0,Rasheed Worrell Offensive Rebound.
Bowling Green,Cleveland State,3,5,3,29,0,Rasheed Worrell missed Layup.
Bowling Green,Cleveland State,3,5,3,29,0,Zack Denny Offensive Rebound.
Bowling Green,Cleveland State,3,5,3,33,0,Foul on Andre Yates.
Bowling Green,Cleveland State,3,5,3,44,0,David Joseph missed Jumper.
Bowling Green,Cleveland State,3,5,3,44,0,Jibri Blount Defensive Rebound.
Bowling Green,Cleveland State,3,5,3,51,0,Rob Edwards missed Three Point Jumper.
Bowling Green,Cleveland State,3,5,3,51,0,Bowling Green Defensive Rebound.
Bowling Green,Cleveland State,5,5,4,11,1,Wesley Alcegaire made Layup.
Bowling Green,Cleveland State,5,5,4,26,0,Vinny Zollo missed Three Point Jumper.
Bowling Green,Cleveland State,5,5,4,26,0,Zack Denny Defensive Rebound.
Bowling Green,Cleveland State,5,5,4,40,0,Zack Denny missed Jumper.
Bowling Green,Cleveland State,5,5,4,40,0,Vinny Zollo Defensive Rebound.
Bowling Green,Cleveland State,5,5,4,46,0,Jibri Blount missed Layup.
Bowling Green,Cleveland State,5,5,4,46,0,Wesley Alcegaire Block.
Bowling Green,Cleveland State,5,5,4,49,0,JD Tisdale Defensive Rebound.
Bowling Green,Cleveland State,5,5,4,55,0,Foul on Vinny Zollo.
Bowling Green,Cleveland State,5,5,4,55,0,Official TV Timeout
Bowling Green,Cleveland State,6,5,4,55,1,JD Tisdale made Free Throw.
Bowling Green,Cleveland State,7,5,4,55,1,JD Tisdale made Free Throw.
Bowling Green,Cleveland State,7,5,5,23,0,Vinny Zollo missed Jumper.
Bowling Green,Cleveland State,7,5,5,23,0,Demajeo Wiggins Defensive Rebound.
Bowling Green,Cleveland State,9,5,5,41,1,Antwon Lillard made Layup. Assisted by Ismail Ali.
Bowling Green,Cleveland State,9,5,6,2,0,Andre Yates missed Three Point Jumper.
Bowling Green,Cleveland State,9,5,6,2,0,Antwon Lillard Defensive Rebound.
Bowling Green,Cleveland State,9,5,6,15,0,Demajeo Wiggins missed Layup.
Bowling Green,Cleveland State,9,5,6,15,0,Zack Denny Offensive Rebound.
Bowling Green,Cleveland State,11,5,6,19,1,Zack Denny made Layup.
Bowling Green,Cleveland State,11,5,6,21,0,Tim Hasbargen missed Three Point Jumper.
Bowling Green,Cleveland State,11,5,6,48,0,Tim Hasbargen Offensive Rebound.
Bowling Green,Cleveland State,11,5,6,52,0,Foul on Zack Denny.
Bowling Green,Cleveland State,11,5,7,14,0,Andre Yates Turnover.
Bowling Green,Cleveland State,11,5,7,16,0,JD Tisdale Steal.
Bowling Green,Cleveland State,11,5,7,42,0,Demajeo Wiggins Turnover.
Bowling Green,Cleveland State,11,5,8,5,0,Demonte Flannigan missed Layup.
Bowling Green,Cleveland State,11,5,8,5,0,JD Tisdale Defensive Rebound.
Bowling Green,Cleveland State,11,5,8,12,0,JD Tisdale missed Layup.
Bowling Green,Cleveland State,11,5,8,12,0,Tim Hasbargen Defensive Rebound.
Bowling Green,Cleveland State,11,5,8,15,0,Foul on JD Tisdale.
Bowling Green,Cleveland State,11,5,8,15,0,Official TV Timeout
Bowling Green,Cleveland State,11,5,8,33,0,Rob Edwards missed Layup.
Bowling Green,Cleveland State,11,5,8,33,0,Andre Yates Offensive Rebound.
Bowling Green,Cleveland State,11,5,8,37,0,Rob Edwards Turnover.
Bowling Green,Cleveland State,11,5,8,56,0,JD Tisdale missed Layup.
Bowling Green,Cleveland State,11,5,8,56,0,Demonte Flannigan Defensive Rebound.
Bowling Green,Cleveland State,11,7,9,6,1,Demonte Flannigan made Layup.
Bowling Green,Cleveland State,11,7,9,26,0,Demajeo Wiggins missed Layup.
Bowling Green,Cleveland State,11,7,9,26,0,Demonte Flannigan Defensive Rebound.
Bowling Green,Cleveland State,11,7,9,33,0,Kenny Carpenter missed Jumper.
Bowling Green,Cleveland State,11,7,9,33,0,JD Tisdale Defensive Rebound.
Bowling Green,Cleveland State,11,7,9,45,0,Antwon Lillard missed Three Point Jumper.
Bowling Green,Cleveland State,11,7,9,45,0,Cleveland St Defensive Rebound.
Bowling Green,Cleveland State,11,9,10,11,1,Demonte Flannigan made Layup. Assisted by Andre Yates.
Bowling Green,Cleveland State,11,9,10,31,0,Foul on Demonte Flannigan.
Bowling Green,Cleveland State,12,9,10,31,1,Rasheed Worrell made Free Throw.
Bowling Green,Cleveland State,13,9,10,31,1,Rasheed Worrell made Free Throw.
Bowling Green,Cleveland State,13,9,10,46,0,Rob Edwards missed Three Point Jumper.
Bowling Green,Cleveland State,13,9,10,46,0,Zack Denny Defensive Rebound.
Bowling Green,Cleveland State,15,9,10,56,1,Wesley Alcegaire made Jumper.
Bowling Green,Cleveland State,15,9,11,11,0,Kenny Carpenter missed Jumper.
Bowling Green,Cleveland State,15,9,11,11,0,Kenny Carpenter Offensive Rebound.
Bowling Green,Cleveland State,15,9,11,23,0,Kenny Carpenter missed Three Point Jumper.
Bowling Green,Cleveland State,15,9,11,23,0,Myles Hamilton Offensive Rebound.
Bowling Green,Cleveland State,15,11,11,38,1,Kenny Carpenter made Jumper.
Bowling Green,Cleveland State,15,11,11,56,0,Wesley Alcegaire Turnover.
Bowling Green,Cleveland State,15,11,12,11,0,Daniel Levitt missed Three Point Jumper.
Bowling Green,Cleveland State,15,11,12,11,0,Aaron Scales Offensive Rebound.
Bowling Green,Cleveland State,15,11,12,18,0,Foul on David Joseph.
Bowling Green,Cleveland State,15,11,12,18,0,Official TV Timeout
Bowling Green,Cleveland State,15,12,12,18,1,Myles Hamilton made Free Throw.
Bowling Green,Cleveland State,15,12,12,18,0,Myles Hamilton missed Free Throw.
Bowling Green,Cleveland State,15,12,12,18,0,Bowling Green Defensive Rebound.
Bowling Green,Cleveland State,15,12,12,43,0,JD Tisdale missed Layup.
Bowling Green,Cleveland State,15,12,12,43,0,Myles Hamilton Defensive Rebound.
Bowling Green,Cleveland State,15,12,12,49,0,Andre Yates missed Jumper.
Bowling Green,Cleveland State,15,12,12,49,0,Aaron Scales Offensive Rebound.
Bowling Green,Cleveland State,15,14,12,53,1,Aaron Scales made Layup.
Bowling Green,Cleveland State,15,14,13,17,0,Wesley Alcegaire missed Layup.
Bowling Green,Cleveland State,15,14,13,17,0,JD Tisdale Offensive Rebound.
Bowling Green,Cleveland State,15,14,13,32,0,JD Tisdale missed Layup.
Bowling Green,Cleveland State,15,14,13,32,0,Demajeo Wiggins Offensive Rebound.
Bowling Green,Cleveland State,15,14,13,35,0,Foul on Vinny Zollo.
Bowling Green,Cleveland State,16,14,13,35,1,Demajeo Wiggins made Free Throw.
Bowling Green,Cleveland State,17,14,13,35,1,Demajeo Wiggins made Free Throw.
Bowling Green,Cleveland State,17,14,14,0,0,Andre Yates missed Jumper.
Bowling Green,Cleveland State,17,14,14,0,0,Zack Denny Defensive Rebound.
Bowling Green,Cleveland State,17,14,14,9,0,David Joseph missed Jumper.
Bowling Green,Cleveland State,17,14,14,9,0,Jibri Blount Defensive Rebound.
Bowling Green,Cleveland State,17,16,14,14,1,Andre Yates made Layup. Assisted by Myles Hamilton.
Bowling Green,Cleveland State,17,16,14,34,0,Wesley Alcegaire Turnover.
Bowling Green,Cleveland State,17,16,14,35,0,Myles Hamilton Steal.
Bowling Green,Cleveland State,17,19,14,40,1,Daniel Levitt made Three Point Jumper. Assisted by Myles Hamilton.
Bowling Green,Cleveland State,17,19,14,45,0,Bowling Green  Timeout
Bowling Green,Cleveland State,19,19,15,1,1,Demajeo Wiggins made Layup. Assisted by Zack Denny.
Bowling Green,Cleveland State,19,21,15,9,1,Myles Hamilton made Layup.
Bowling Green,Cleveland State,21,21,15,25,1,Zack Denny made Jumper.
Bowling Green,Cleveland State,21,21,15,38,0,Jibri Blount missed Layup.
Bowling Green,Cleveland State,21,21,15,38,0,Cleveland St Offensive Rebound.
Bowling Green,Cleveland State,21,21,16,0,0,Rob Edwards missed Jumper.
Bowling Green,Cleveland State,21,21,16,0,0,Antwon Lillard Block.
Bowling Green,Cleveland State,21,21,16,2,0,Demajeo Wiggins Defensive Rebound.
Bowling Green,Cleveland State,21,21,16,2,0,Foul on Aaron Scales.
Bowling Green,Cleveland State,21,21,16,17,0,Official TV Timeout
Bowling Green,Cleveland State,21,21,16,17,0,Foul on Myles Hamilton.
Bowling Green,Cleveland State,21,21,16,17,0,Zack Denny missed Free Throw.
Bowling Green,Cleveland State,21,21,16,17,0,Rob Edwards Defensive Rebound.
Bowling Green,Cleveland State,21,23,16,42,1,Myles Hamilton made Jumper.
Bowling Green,Cleveland State,21,23,17,6,0,Antwon Lillard Turnover.
Bowling Green,Cleveland State,21,23,17,13,0,Terrell Hales Steal.
Bowling Green,Cleveland State,21,23,17,26,0,Myles Hamilton missed Three Point Jumper.
Bowling Green,Cleveland State,21,23,17,26,0,Zack Denny Defensive Rebound.
Bowling Green,Cleveland State,21,23,17,35,0,Antwon Lillard missed Layup.
Bowling Green,Cleveland State,21,23,17,35,0,Antwon Lillard Offensive Rebound.
Bowling Green,Cleveland State,23,23,17,41,1,Antwon Lillard made Layup.
Bowling Green,Cleveland State,23,23,18,7,0,Myles Hamilton missed Layup.
Bowling Green,Cleveland State,23,23,18,7,0,Aaron Scales Offensive Rebound.
Bowling Green,Cleveland State,23,23,18,11,0,Aaron Scales missed Layup.
Bowling Green,Cleveland State,23,23,18,11,0,Demajeo Wiggins Block.
Bowling Green,Cleveland State,23,23,18,14,0,Aaron Scales Offensive Rebound.
Bowling Green,Cleveland State,23,25,18,16,1,Aaron Scales made Layup.
Bowling Green,Cleveland State,23,25,18,30,0,Demajeo Wiggins missed Dunk.
Bowling Green,Cleveland State,23,25,18,30,0,Terrell Hales Defensive Rebound.
Bowling Green,Cleveland State,23,25,18,39,0,Foul on Rob Edwards.
Bowling Green,Cleveland State,23,25,18,40,0,Rob Edwards Turnover.
Bowling Green,Cleveland State,25,25,18,47,1,Zack Denny made Jumper.
Bowling Green,Cleveland State,25,25,19,1,0,Andre Yates missed Three Point Jumper.
Bowling Green,Cleveland State,25,25,19,1,0,Andre Yates Offensive Rebound.
Bowling Green,Cleveland State,25,25,19,6,0,Foul on Jibri Blount.
Bowling Green,Cleveland State,25,25,19,6,0,Jibri Blount Turnover.
Bowling Green,Cleveland State,27,25,19,23,1,Rasheed Worrell made Dunk. Assisted by Ismail Ali.
Bowling Green,Cleveland State,27,25,19,59,0,Myles Hamilton missed Three Point Jumper.
Bowling Green,Cleveland State,27,25,19,59,0,Jibri Blount Offensive Rebound.
Bowling Green,Cleveland State,27,25,20,0,0,End of 1st half
Bowling Green,Cleveland State,29,25,20,18,1,Rasheed Worrell made Jumper. Assisted by Spencer Parker.
Bowling Green,Cleveland State,29,27,20,41,1,Vinny Zollo made Layup.
Bowling Green,Cleveland State,31,27,21,7,1,Spencer Parker made Jumper.
Bowling Green,Cleveland State,31,27,21,26,0,Demonte Flannigan missed Jumper.
Bowling Green,Cleveland State,31,27,21,26,0,Zack Denny Defensive Rebound.
Bowling Green,Cleveland State,31,27,21,33,0,Zack Denny missed Layup.
Bowling Green,Cleveland State,31,27,21,33,0,Demonte Flannigan Block.
Bowling Green,Cleveland State,31,27,21,33,0,Bowling Green Offensive Rebound.
Bowling Green,Cleveland State,31,27,21,47,0,Foul on Spencer Parker.
Bowling Green,Cleveland State,31,27,21,47,0,Spencer Parker Turnover.
Bowling Green,Cleveland State,31,27,22,5,0,Foul on Rasheed Worrell.
Bowling Green,Cleveland State,31,27,22,5,0,Vinny Zollo missed Free Throw.
Bowling Green,Cleveland State,31,27,22,5,0,Cleveland St Deadball Team Rebound.
Bowling Green,Cleveland State,31,28,22,5,1,Vinny Zollo made Free Throw.
Bowling Green,Cleveland State,31,28,22,25,0,Zack Denny missed Three Point Jumper.
Bowling Green,Cleveland State,31,28,22,25,0,Rob Edwards Defensive Rebound.
Bowling Green,Cleveland State,31,28,22,39,0,Andre Yates Turnover.
Bowling Green,Cleveland State,31,28,22,54,0,David Joseph missed Layup.
Bowling Green,Cleveland State,31,28,22,54,0,Andre Yates Defensive Rebound.
Bowling Green,Cleveland State,31,28,23,1,0,Foul on Wesley Alcegaire.
Bowling Green,Cleveland State,31,29,23,1,1,Terrell Hales made Free Throw.
Bowling Green,Cleveland State,31,30,23,1,1,Terrell Hales made Free Throw.
Bowling Green,Cleveland State,31,30,23,19,0,Wesley Alcegaire missed Layup.
Bowling Green,Cleveland State,31,30,23,19,0,Vinny Zollo Defensive Rebound.
Bowling Green,Cleveland State,31,30,23,47,0,Andre Yates missed Layup.
Bowling Green,Cleveland State,31,30,23,47,0,Rasheed Worrell Defensive Rebound.
Bowling Green,Cleveland State,31,30,24,8,0,Rasheed Worrell Turnover.
Bowling Green,Cleveland State,31,30,24,10,0,Demonte Flannigan Steal.
Bowling Green,Cleveland State,31,30,24,33,0,Official TV Timeout
Bowling Green,Cleveland State,31,30,24,39,0,Rob Edwards missed Jumper.
Bowling Green,Cleveland State,31,30,24,39,0,Spencer Parker Block.
Bowling Green,Cleveland State,31,30,24,43,0,Spencer Parker Defensive Rebound.
Bowling Green,Cleveland State,31,30,25,7,0,Foul on Aaron Scales.
Bowling Green,Cleveland State,31,30,25,7,0,Spencer Parker missed Free Throw.
Bowling Green,Cleveland State,31,30,25,7,0,Bowling Green Deadball Team Rebound.
Bowling Green,Cleveland State,31,30,25,7,0,Spencer Parker missed Free Throw.
Bowling Green,Cleveland State,31,30,25,7,0,Vinny Zollo Defensive Rebound.
Bowling Green,Cleveland State,31,30,25,28,0,Andre Yates missed Three Point Jumper.
Bowling Green,Cleveland State,31,30,25,28,0,Zack Denny Defensive Rebound.
Bowling Green,Cleveland State,31,30,25,39,0,Foul on Terrell Hales.
Bowling Green,Cleveland State,32,30,25,39,1,Spencer Parker made Free Throw.
Bowling Green,Cleveland State,33,30,25,39,1,Spencer Parker made Free Throw.
Bowling Green,Cleveland State,33,30,26,2,0,Daniel Levitt missed Three Point Jumper.
Bowling Green,Cleveland State,33,30,26,2,0,Aaron Scales Offensive Rebound.
Bowling Green,Cleveland State,33,30,26,4,0,Foul on Spencer Parker.
Bowling Green,Cleveland State,33,32,26,9,1,Vinny Zollo made Jumper. Assisted by Daniel Levitt.
Bowling Green,Cleveland State,33,32,26,27,0,Ismail Ali Turnover.
Bowling Green,Cleveland State,33,32,26,29,0,Vinny Zollo Steal.
Bowling Green,Cleveland State,33,32,26,32,0,Foul on Demajeo Wiggins.
Bowling Green,Cleveland State,33,33,26,32,1,Andre Yates made Free Throw.
Bowling Green,Cleveland State,33,34,26,32,1,Andre Yates made Free Throw.
Bowling Green,Cleveland State,33,34,26,49,0,JD Tisdale Turnover.
Bowling Green,Cleveland State,33,34,27,14,0,Andre Yates missed Three Point Jumper.
Bowling Green,Cleveland State,33,34,27,14,0,Ismail Ali Defensive Rebound.
Bowling Green,Cleveland State,35,34,27,25,1,Ismail Ali made Layup.
Bowling Green,Cleveland State,35,34,27,40,0,Daniel Levitt Turnover.
Bowling Green,Cleveland State,35,34,27,42,0,Antwon Lillard Steal.
Bowling Green,Cleveland State,35,34,27,46,0,Ismail Ali Turnover.
Bowling Green,Cleveland State,35,34,27,47,0,Andre Yates Steal.
Bowling Green,Cleveland State,35,34,27,53,0,Daniel Levitt missed Three Point Jumper.
Bowling Green,Cleveland State,35,34,27,53,0,Vinny Zollo Offensive Rebound.
Bowling Green,Cleveland State,35,34,28,0,0,Rob Edwards Turnover.
Bowling Green,Cleveland State,35,34,28,2,0,JD Tisdale Steal.
Bowling Green,Cleveland State,35,34,28,4,0,Foul on Andre Yates.
Bowling Green,Cleveland State,35,34,28,4,0,Official TV Timeout
Bowling Green,Cleveland State,36,34,28,4,1,Zack Denny made Free Throw.
Bowling Green,Cleveland State,37,34,28,4,1,Zack Denny made Free Throw.
Bowling Green,Cleveland State,37,34,28,4,0,Andre Yates Turnover.
Bowling Green,Cleveland State,39,34,28,18,1,Zack Denny made Layup.
Bowling Green,Cleveland State,39,34,28,36,0,Rob Edwards Turnover.
Bowling Green,Cleveland State,39,34,28,38,0,Antwon Lillard Steal.
Bowling Green,Cleveland State,41,34,29,0,1,Rasheed Worrell made Layup. Assisted by Zack Denny.
Bowling Green,Cleveland State,41,34,29,6,0,Cleveland St  Timeout
Bowling Green,Cleveland State,41,34,29,33,0,Kenny Carpenter missed Jumper.
Bowling Green,Cleveland State,41,34,29,33,0,Antwon Lillard Defensive Rebound.
Bowling Green,Cleveland State,41,34,29,42,0,Ismail Ali missed Layup.
Bowling Green,Cleveland State,41,34,29,42,0,Kenny Carpenter Defensive Rebound.
Bowling Green,Cleveland State,41,34,29,46,0,Kenny Carpenter Turnover.
Bowling Green,Cleveland State,41,34,30,1,0,JD Tisdale missed Jumper.
Bowling Green,Cleveland State,41,34,30,1,0,Bowling Green Offensive Rebound.
Bowling Green,Cleveland State,41,34,30,6,0,Foul on Demonte Flannigan.
Bowling Green,Cleveland State,41,34,30,32,0,Ismail Ali missed Jumper.
Bowling Green,Cleveland State,41,34,30,32,0,Vinny Zollo Defensive Rebound.
Bowling Green,Cleveland State,41,34,30,39,0,Foul on Antwon Lillard.
Bowling Green,Cleveland State,41,34,31,0,0,Myles Hamilton missed Jumper.
Bowling Green,Cleveland State,41,34,31,0,0,Demonte Flannigan Offensive Rebound.
Bowling Green,Cleveland State,41,36,31,5,1,Demonte Flannigan made Layup.
Bowling Green,Cleveland State,41,36,31,10,0,Antwon Lillard Turnover.
Bowling Green,Cleveland State,41,36,31,38,0,Demonte Flannigan missed Jumper.
Bowling Green,Cleveland State,41,36,31,38,0,Demajeo Wiggins Defensive Rebound.
Bowling Green,Cleveland State,41,36,31,47,0,Zack Denny missed Jumper.
Bowling Green,Cleveland State,41,36,31,47,0,Vinny Zollo Defensive Rebound.
Bowling Green,Cleveland State,41,36,31,49,0,Foul on Wesley Alcegaire.
Bowling Green,Cleveland State,41,36,31,49,0,Vinny Zollo missed Free Throw.
Bowling Green,Cleveland State,41,36,31,49,0,Kenny Carpenter Offensive Rebound.
Bowling Green,Cleveland State,41,36,32,11,0,Myles Hamilton Turnover.
Bowling Green,Cleveland State,41,36,32,11,0,Official TV Timeout
Bowling Green,Cleveland State,41,36,32,23,0,Demajeo Wiggins missed Layup.
Bowling Green,Cleveland State,41,36,32,23,0,Demajeo Wiggins Offensive Rebound.
Bowling Green,Cleveland State,43,36,32,27,1,Demajeo Wiggins made Layup.
Bowling Green,Cleveland State,43,36,32,46,0,Rob Edwards missed Jumper.
Bowling Green,Cleveland State,43,36,32,46,0,Wesley Alcegaire Defensive Rebound.
Bowling Green,Cleveland State,43,36,32,51,0,Ismail Ali Turnover.
Bowling Green,Cleveland State,43,36,33,19,0,Rob Edwards Turnover.
Bowling Green,Cleveland State,43,36,33,21,0,JD Tisdale Steal.
Bowling Green,Cleveland State,43,36,33,29,0,JD Tisdale missed Layup.
Bowling Green,Cleveland State,43,36,33,29,0,Wesley Alcegaire Offensive Rebound.
Bowling Green,Cleveland State,45,36,33,53,1,Wesley Alcegaire made Layup.
Bowling Green,Cleveland State,45,36,34,9,0,Andre Yates missed Three Point Jumper.
Bowling Green,Cleveland State,45,36,34,9,0,Andre Yates Offensive Rebound.
Bowling Green,Cleveland State,45,36,34,25,0,Vinny Zollo missed Layup.
Bowling Green,Cleveland State,45,36,34,25,0,Wesley Alcegaire Block.
Bowling Green,Cleveland State,45,36,34,27,0,Vinny Zollo Offensive Rebound.
Bowling Green,Cleveland State,45,36,34,28,0,Foul on JD Tisdale.
Bowling Green,Cleveland State,45,36,34,28,0,Vinny Zollo missed Free Throw.
Bowling Green,Cleveland State,45,36,34,28,0,Cleveland St Deadball Team Rebound.
Bowling Green,Cleveland State,45,36,34,28,0,Vinny Zollo missed Free Throw.
Bowling Green,Cleveland State,45,36,34,28,0,Demajeo Wiggins Defensive Rebound.
Bowling Green,Cleveland State,47,36,34,42,1,Demajeo Wiggins made Layup. Assisted by Ismail Ali.
Bowling Green,Cleveland State,47,36,34,51,0,Cleveland St  Timeout
Bowling Green,Cleveland State,47,36,35,13,0,Foul on Demajeo Wiggins.
Bowling Green,Cleveland State,47,37,35,13,1,Andre Yates made Free Throw.
Bowling Green,Cleveland State,47,38,35,13,1,Andre Yates made Free Throw.
Bowling Green,Cleveland State,47,38,35,28,0,Foul on Derek Sloan.
Bowling Green,Cleveland State,50,38,35,37,1,Spencer Parker made Three Point Jumper. Assisted by Ismail Ali.
Bowling Green,Cleveland State,50,38,36,2,0,Andre Yates missed Jumper.
Bowling Green,Cleveland State,50,38,36,2,0,Wesley Alcegaire Defensive Rebound.
Bowling Green,Cleveland State,52,38,36,16,1,Demajeo Wiggins made Layup. Assisted by Ismail Ali.
Bowling Green,Cleveland State,52,38,36,23,0,Cleveland St  Timeout
Bowling Green,Cleveland State,52,38,36,34,0,Daniel Levitt missed Three Point Jumper.
Bowling Green,Cleveland State,52,38,36,34,0,David Joseph Defensive Rebound.
Bowling Green,Cleveland State,52,38,36,58,0,Wesley Alcegaire missed Three Point Jumper.
Bowling Green,Cleveland State,52,38,36,58,0,Demajeo Wiggins Offensive Rebound.
Bowling Green,Cleveland State,52,38,37,0,0,Foul on Jibri Blount.
Bowling Green,Cleveland State,52,38,37,8,0,Demajeo Wiggins Turnover.
Bowling Green,Cleveland State,52,38,37,8,0,Jibri Blount Steal.
Bowling Green,Cleveland State,52,38,37,28,0,Foul on Demajeo Wiggins.
Bowling Green,Cleveland State,52,39,37,28,1,Daniel Levitt made Free Throw.
Bowling Green,Cleveland State,52,40,37,28,1,Daniel Levitt made Free Throw.
Bowling Green,Cleveland State,54,40,37,52,1,Spencer Parker made Layup. Assisted by Ismail Ali.
Bowling Green,Cleveland State,54,40,37,52,0,Foul on Myles Hamilton.
Bowling Green,Cleveland State,55,40,37,52,1,Spencer Parker made Free Throw.
Bowling Green,Cleveland State,55,40,38,1,0,Foul on Ismail Ali.
Bowling Green,Cleveland State,55,41,38,1,1,Myles Hamilton made Free Throw.
Bowling Green,Cleveland State,55,42,38,1,1,Myles Hamilton made Free Throw.
Bowling Green,Cleveland State,55,42,38,20,0,Foul on Myles Hamilton.
Bowling Green,Cleveland State,56,42,38,20,1,Ismail Ali made Free Throw.
Bowling Green,Cleveland State,57,42,38,20,1,Ismail Ali made Free Throw.
Bowling Green,Cleveland State,57,42,38,31,0,Andre Yates missed Jumper.
Bowling Green,Cleveland State,57,42,38,31,0,David Joseph Defensive Rebound.
Bowling Green,Cleveland State,57,42,38,35,0,Foul on Jibri Blount.
Bowling Green,Cleveland State,58,42,38,35,1,David Joseph made Free Throw.
Bowling Green,Cleveland State,59,42,38,35,1,David Joseph made Free Throw.
Bowling Green,Cleveland State,59,42,38,48,0,Myles Hamilton missed Jumper.
Bowling Green,Cleveland State,59,42,38,48,0,Myles Hamilton Offensive Rebound.
Bowling Green,Cleveland State,59,44,39,5,1,Jibri Blount made Layup. Assisted by Andre Yates.
Bowling Green,Cleveland State,62,44,39,40,1,Zack Denny made Three Point Jumper.
Bowling Green,Cleveland State,62,47,39,51,1,Daniel Levitt made Three Point Jumper. Assisted by Andre Yates.
Bowling Green,Cleveland State,62,47,40,0,0,End of Game
