Away Team,Home Team,Away Score,Home Score,Minute,Second,isScoringPosession,Desc.
Denver,IUPUI,0,0,0,30,0,Evan Hall Turnover.
Denver,IUPUI,0,0,0,32,0,Marcus Byrd Steal.
Denver,IUPUI,0,0,0,39,0,Foul on Mason Archie II.
Denver,IUPUI,2,0,0,48,1,C.J. Bobbitt made Jumper. Assisted by Nate Engesser.
Denver,IUPUI,2,0,1,12,0,Mason Archie II missed Three Point Jumper.
Denver,IUPUI,2,0,1,12,0,Denver Defensive Rebound.
Denver,IUPUI,4,0,1,37,1,C.J. Bobbitt made Layup.
Denver,IUPUI,4,3,2,4,1,Darell Combs made Three Point Jumper. Assisted by Marcellus Barksdale.
Denver,IUPUI,4,3,2,39,0,Marcus Byrd missed Layup.
Denver,IUPUI,4,3,2,39,0,Marcellus Barksdale Defensive Rebound.
Denver,IUPUI,4,5,2,52,1,Matt O'Leary made Jumper.
Denver,IUPUI,4,5,3,14,0,Foul on Evan Hall.
Denver,IUPUI,4,5,3,14,0,Nate Engesser Turnover.
Denver,IUPUI,4,5,3,32,0,Marcellus Barksdale missed Jumper.
Denver,IUPUI,4,5,3,32,0,C.J. Bobbitt Defensive Rebound.
Denver,IUPUI,4,5,3,50,0,Nate Engesser missed Layup.
Denver,IUPUI,4,5,3,50,0,Evan Hall Defensive Rebound.
Denver,IUPUI,4,5,4,7,0,Matt O'Leary Turnover.
Denver,IUPUI,4,5,4,10,0,Nate Engesser Steal.
Denver,IUPUI,4,5,4,14,0,Marcus Byrd missed Layup.
Denver,IUPUI,4,5,4,14,0,Darell Combs Block.
Denver,IUPUI,4,5,4,14,0,Denver Offensive Rebound.
Denver,IUPUI,4,5,4,15,0,Official TV Timeout
Denver,IUPUI,7,5,4,20,1,Marcus Byrd made Three Point Jumper. Assisted by Joe Rosga.
Denver,IUPUI,7,5,4,34,0,Marcellus Barksdale Turnover.
Denver,IUPUI,7,5,4,57,0,Joe Rosga missed Layup.
Denver,IUPUI,7,5,4,57,0,Marcellus Barksdale Block.
Denver,IUPUI,7,5,4,58,0,Darell Combs Defensive Rebound.
Denver,IUPUI,7,5,5,3,0,Foul on Marcus Byrd.
Denver,IUPUI,7,5,5,3,0,Darell Combs missed Free Throw.
Denver,IUPUI,7,5,5,3,0,IUPUI Deadball Team Rebound.
Denver,IUPUI,7,6,5,3,1,Darell Combs made Free Throw.
Denver,IUPUI,7,6,5,24,0,Bryant Rucker missed Layup.
Denver,IUPUI,7,6,5,24,0,Marcellus Barksdale Block.
Denver,IUPUI,7,6,5,26,0,Marcellus Barksdale Defensive Rebound.
Denver,IUPUI,7,9,5,31,1,Jordan Pickett made Three Point Jumper. Assisted by Aaron Brennan.
Denver,IUPUI,7,9,5,53,0,Foul on Marcellus Barksdale.
Denver,IUPUI,7,9,5,53,0,Marcus Byrd Turnover.
Denver,IUPUI,7,9,5,53,0,Foul on Marcus Byrd.
Denver,IUPUI,7,9,6,9,0,Mason Archie II Turnover.
Denver,IUPUI,7,9,6,11,0,Duke Douglas Steal.
Denver,IUPUI,7,9,6,28,0,Foul on Christian Mackey.
Denver,IUPUI,7,9,6,28,0,Christian Mackey Turnover.
Denver,IUPUI,7,9,6,38,0,T.J. Henderson Turnover.
Denver,IUPUI,7,9,7,1,0,Duke Douglas missed Layup.
Denver,IUPUI,7,9,7,1,0,T.J. Henderson Block.
Denver,IUPUI,7,9,7,3,0,Duke Douglas Offensive Rebound.
Denver,IUPUI,7,9,7,7,0,Thomas Neff missed Three Point Jumper.
Denver,IUPUI,7,9,7,7,0,Aaron Brennan Defensive Rebound.
Denver,IUPUI,7,9,7,12,0,Foul on Duke Douglas.
Denver,IUPUI,7,11,7,26,1,Aaron Brennan made Jumper. Assisted by Jordan Pickett.
Denver,IUPUI,7,11,8,0,0,Joe Rosga missed Jumper.
Denver,IUPUI,7,11,8,0,0,T.J. Henderson Defensive Rebound.
Denver,IUPUI,7,13,8,13,1,Evan Hall made Layup. Assisted by Aaron Brennan.
Denver,IUPUI,7,13,8,43,0,Foul on Mason Archie II.
Denver,IUPUI,7,13,8,43,0,Official TV Timeout
Denver,IUPUI,7,13,8,43,0,Denver  Turnover.
Denver,IUPUI,7,13,9,1,0,Foul on Christian Mackey.
Denver,IUPUI,7,13,9,1,0,Evan Hall missed Free Throw.
Denver,IUPUI,7,13,9,1,0,IUPUI Deadball Team Rebound.
Denver,IUPUI,7,13,9,1,0,Evan Hall missed Free Throw.
Denver,IUPUI,7,13,9,1,0,Jake Pemberton Defensive Rebound.
Denver,IUPUI,10,13,9,23,1,Christian Mackey made Three Point Jumper. Assisted by Joe Rosga.
Denver,IUPUI,10,15,9,46,1,Marcellus Barksdale made Layup. Assisted by Darell Combs.
Denver,IUPUI,10,15,10,15,0,Foul on Evan Hall.
Denver,IUPUI,10,15,10,15,0,Christian Mackey missed Free Throw.
Denver,IUPUI,10,15,10,15,0,Denver Deadball Team Rebound.
Denver,IUPUI,11,15,10,15,1,Christian Mackey made Free Throw.
Denver,IUPUI,11,15,10,45,0,T.J. Henderson missed Three Point Jumper.
Denver,IUPUI,11,15,10,45,0,C.J. Bobbitt Defensive Rebound.
Denver,IUPUI,11,15,11,10,0,Foul on T.J. Henderson.
Denver,IUPUI,11,15,11,18,0,Foul on Matt O'Leary.
Denver,IUPUI,12,15,11,18,1,Marcus Byrd made Free Throw.
Denver,IUPUI,12,15,11,18,0,Marcus Byrd missed Free Throw.
Denver,IUPUI,12,15,11,18,0,Matt O'Leary Defensive Rebound.
Denver,IUPUI,12,15,11,27,0,Aaron Brennan Turnover.
Denver,IUPUI,12,15,11,27,0,Foul on Aaron Brennan.
Denver,IUPUI,12,15,11,51,0,Jake Pemberton Turnover.
Denver,IUPUI,12,15,11,52,0,Matt O'Leary Steal.
Denver,IUPUI,12,17,11,55,1,Marcellus Barksdale made Layup.
Denver,IUPUI,12,17,12,7,0,C.J. Bobbitt Turnover.
Denver,IUPUI,12,17,12,12,0,T.J. Henderson Steal.
Denver,IUPUI,12,17,12,16,0,Marcellus Barksdale missed Layup.
Denver,IUPUI,12,17,12,16,0,Marcus Byrd Defensive Rebound.
Denver,IUPUI,14,17,12,27,1,Nate Engesser made Layup.
Denver,IUPUI,14,17,12,53,0,T.J. Henderson Turnover.
Denver,IUPUI,14,17,12,53,0,C.J. Bobbitt Steal.
Denver,IUPUI,14,17,12,53,0,Official TV Timeout
Denver,IUPUI,16,17,13,11,1,Nate Engesser made Layup. Assisted by Jake Holtzmann.
Denver,IUPUI,16,19,13,28,1,Matt O'Leary made Layup.
Denver,IUPUI,18,19,13,56,1,Nate Engesser made Jumper.
Denver,IUPUI,18,19,14,27,0,Matt O'Leary Turnover.
Denver,IUPUI,18,19,14,29,0,Thomas Neff Steal.
Denver,IUPUI,21,19,14,50,1,Marcus Byrd made Three Point Jumper. Assisted by Jake Holtzmann.
Denver,IUPUI,21,19,15,13,0,Matt O'Leary Turnover.
Denver,IUPUI,21,19,15,13,0,Foul on Matt O'Leary.
Denver,IUPUI,21,19,15,42,0,Jake Holtzmann missed Three Point Jumper.
Denver,IUPUI,21,19,15,42,0,Aaron Brennan Defensive Rebound.
Denver,IUPUI,21,19,15,45,0,Foul on Christian Mackey.
Denver,IUPUI,21,19,16,8,0,Jordan Pickett missed Three Point Jumper.
Denver,IUPUI,21,19,16,8,0,Thomas Neff Defensive Rebound.
Denver,IUPUI,21,19,16,23,0,Thomas Neff Turnover.
Denver,IUPUI,21,19,16,23,0,Official TV Timeout
Denver,IUPUI,21,22,16,35,1,Darell Combs made Three Point Jumper.
Denver,IUPUI,21,22,17,7,0,Nate Engesser Turnover.
Denver,IUPUI,21,24,17,27,1,Marcellus Barksdale made Layup.
Denver,IUPUI,21,24,17,45,0,C.J. Bobbitt missed Layup.
Denver,IUPUI,21,24,17,45,0,John Hubler Defensive Rebound.
Denver,IUPUI,21,24,17,52,0,Aaron Brennan Turnover.
Denver,IUPUI,21,24,17,52,0,Foul on Aaron Brennan.
Denver,IUPUI,21,24,18,14,0,Foul on Darell Combs.
Denver,IUPUI,22,24,18,14,1,Joe Rosga made Free Throw.
Denver,IUPUI,23,24,18,14,1,Joe Rosga made Free Throw.
Denver,IUPUI,23,24,18,14,0,Denver  Timeout
Denver,IUPUI,23,27,18,30,1,John Hubler made Three Point Jumper. Assisted by Matt O'Leary.
Denver,IUPUI,23,27,19,2,0,Joe Rosga missed Three Point Jumper.
Denver,IUPUI,23,27,19,2,0,Matt O'Leary Defensive Rebound.
Denver,IUPUI,23,27,19,11,0,Matt O'Leary Turnover.
Denver,IUPUI,23,27,19,13,0,C.J. Bobbitt Steal.
Denver,IUPUI,23,27,19,29,0,Jake Pemberton missed Three Point Jumper.
Denver,IUPUI,23,27,19,29,0,John Hubler Defensive Rebound.
Denver,IUPUI,23,30,19,58,1,Matt O'Leary made Three Point Jumper. Assisted by Jordan Pickett.
Denver,IUPUI,23,30,20,0,0,End of 1st half
Denver,IUPUI,23,33,20,16,1,Darell Combs made Three Point Jumper. Assisted by Marcellus Barksdale.
Denver,IUPUI,23,33,20,33,0,C.J. Bobbitt Turnover.
Denver,IUPUI,23,33,20,34,0,Evan Hall Steal.
Denver,IUPUI,23,35,20,42,1,Mason Archie II made Layup. Assisted by Evan Hall.
Denver,IUPUI,23,35,20,43,0,Foul on C.J. Bobbitt.
Denver,IUPUI,23,35,20,43,0,Mason Archie II missed Free Throw.
Denver,IUPUI,23,35,20,43,0,Marcus Byrd Defensive Rebound.
Denver,IUPUI,23,35,21,3,0,Foul on Evan Hall.
Denver,IUPUI,23,35,21,14,0,Marcus Byrd missed Three Point Jumper.
Denver,IUPUI,23,35,21,14,0,Matt O'Leary Defensive Rebound.
Denver,IUPUI,23,37,21,22,1,Darell Combs made Layup.
Denver,IUPUI,23,37,21,23,0,Foul on Nate Engesser.
Denver,IUPUI,23,37,21,23,0,Darell Combs missed Free Throw.
Denver,IUPUI,23,37,21,23,0,C.J. Bobbitt Defensive Rebound.
Denver,IUPUI,23,37,21,46,0,C.J. Bobbitt missed Jumper.
Denver,IUPUI,23,37,21,46,0,Darell Combs Defensive Rebound.
Denver,IUPUI,23,39,21,57,1,Matt O'Leary made Layup.
Denver,IUPUI,23,39,22,11,0,Nate Engesser missed Three Point Jumper.
Denver,IUPUI,23,39,22,11,0,Denver Offensive Rebound.
Denver,IUPUI,23,39,22,31,0,Jake Pemberton Turnover.
Denver,IUPUI,23,39,22,32,0,Mason Archie II Steal.
Denver,IUPUI,23,39,22,34,0,Foul on Jake Pemberton.
Denver,IUPUI,23,40,22,34,1,Mason Archie II made Free Throw.
Denver,IUPUI,23,41,22,34,1,Mason Archie II made Free Throw.
Denver,IUPUI,23,41,22,47,0,Denver  Timeout
Denver,IUPUI,23,41,22,47,0,Official TV Timeout
Denver,IUPUI,25,41,23,4,1,Duke Douglas made Layup.
Denver,IUPUI,25,41,23,25,0,Aaron Brennan missed Layup.
Denver,IUPUI,25,41,23,25,0,Marcellus Barksdale Offensive Rebound.
Denver,IUPUI,25,43,23,30,1,Matt O'Leary made Layup. Assisted by Mason Archie II.
Denver,IUPUI,27,43,23,49,1,Jake Pemberton made Layup. Assisted by Bryant Rucker.
Denver,IUPUI,27,45,24,16,1,Marcellus Barksdale made Jumper.
Denver,IUPUI,27,45,24,16,0,Foul on Duke Douglas.
Denver,IUPUI,27,45,24,16,0,Official TV Timeout
Denver,IUPUI,27,46,24,16,1,Marcellus Barksdale made Free Throw.
Denver,IUPUI,27,46,24,45,0,Foul on Aaron Brennan.
Denver,IUPUI,27,46,24,58,0,Jake Pemberton missed Jumper.
Denver,IUPUI,27,46,24,58,0,Marcellus Barksdale Defensive Rebound.
Denver,IUPUI,27,48,25,7,1,Marcellus Barksdale made Layup.
Denver,IUPUI,30,48,25,33,1,Bryant Rucker made Three Point Jumper. Assisted by Jake Pemberton.
Denver,IUPUI,30,48,25,35,0,Denver  Timeout
Denver,IUPUI,30,50,25,56,1,Jordan Pickett made Jumper.
Denver,IUPUI,33,50,26,32,1,Bryant Rucker made Three Point Jumper. Assisted by Duke Douglas.
Denver,IUPUI,33,50,26,43,0,T.J. Henderson Turnover.
Denver,IUPUI,33,50,26,55,0,Jake Holtzmann Turnover.
Denver,IUPUI,33,50,26,55,0,T.J. Henderson Steal.
Denver,IUPUI,33,50,26,57,0,Foul on Jake Holtzmann.
Denver,IUPUI,33,50,27,20,0,Jordan Pickett missed Jumper.
Denver,IUPUI,33,50,27,20,0,Bryant Rucker Defensive Rebound.
Denver,IUPUI,33,50,27,52,0,Foul on Evan Hall.
Denver,IUPUI,34,50,27,52,1,Marcus Byrd made Free Throw.
Denver,IUPUI,35,50,27,52,1,Marcus Byrd made Free Throw.
Denver,IUPUI,35,50,28,9,0,Mason Archie II missed Jumper.
Denver,IUPUI,35,50,28,9,0,Matt O'Leary Offensive Rebound.
Denver,IUPUI,35,50,28,19,0,IUPUI  Timeout
Denver,IUPUI,35,50,28,19,0,Official TV Timeout
Denver,IUPUI,35,53,28,37,1,T.J. Henderson made Three Point Jumper. Assisted by Matt O'Leary.
Denver,IUPUI,35,53,29,10,0,Joe Rosga missed Layup.
Denver,IUPUI,35,53,29,10,0,Marcus Byrd Offensive Rebound.
Denver,IUPUI,38,53,29,15,1,Thomas Neff made Three Point Jumper. Assisted by Marcus Byrd.
Denver,IUPUI,38,53,29,23,0,Aaron Brennan Turnover.
Denver,IUPUI,38,53,29,38,0,Duke Douglas missed Three Point Jumper.
Denver,IUPUI,38,53,29,38,0,Matt O'Leary Defensive Rebound.
Denver,IUPUI,38,53,29,51,0,Matt O'Leary Turnover.
Denver,IUPUI,38,53,29,52,0,Bryant Rucker Steal.
Denver,IUPUI,41,53,30,10,1,Joe Rosga made Three Point Jumper. Assisted by Marcus Byrd.
Denver,IUPUI,41,53,30,26,0,Foul on Marcus Byrd.
Denver,IUPUI,41,54,30,26,1,Marcellus Barksdale made Free Throw.
Denver,IUPUI,41,55,30,26,1,Marcellus Barksdale made Free Throw.
Denver,IUPUI,44,55,30,46,1,Nate Engesser made Three Point Jumper. Assisted by Marcus Byrd.
Denver,IUPUI,44,55,31,2,0,Foul on Duke Douglas.
Denver,IUPUI,44,56,31,2,1,T.J. Henderson made Free Throw.
Denver,IUPUI,44,57,31,2,1,T.J. Henderson made Free Throw.
Denver,IUPUI,44,57,31,31,0,Joe Rosga missed Layup.
Denver,IUPUI,44,57,31,31,0,Matt O'Leary Defensive Rebound.
Denver,IUPUI,44,57,31,46,0,Mason Archie II Turnover.
Denver,IUPUI,44,57,32,4,0,Nate Engesser missed Three Point Jumper.
Denver,IUPUI,44,57,32,4,0,Thomas Neff Offensive Rebound.
Denver,IUPUI,44,57,32,8,0,Official TV Timeout
Denver,IUPUI,46,57,32,33,1,Duke Douglas made Layup.
Denver,IUPUI,46,57,32,34,0,Foul on Jordan Pickett.
Denver,IUPUI,47,57,32,34,1,Duke Douglas made Free Throw.
Denver,IUPUI,47,57,32,43,0,Foul on Joe Rosga.
Denver,IUPUI,47,58,32,43,1,Jordan Pickett made Free Throw.
Denver,IUPUI,47,59,32,43,1,Jordan Pickett made Free Throw.
Denver,IUPUI,49,59,33,4,1,Joe Rosga made Layup.
Denver,IUPUI,49,61,33,37,1,Darell Combs made Layup.
Denver,IUPUI,51,61,33,46,1,Thomas Neff made Layup. Assisted by Duke Douglas.
Denver,IUPUI,51,61,33,46,0,Foul on Darell Combs.
Denver,IUPUI,52,61,33,46,1,Thomas Neff made Free Throw.
Denver,IUPUI,52,64,34,6,1,Marcellus Barksdale made Three Point Jumper. Assisted by Jordan Pickett.
Denver,IUPUI,55,64,34,27,1,Joe Rosga made Three Point Jumper. Assisted by Duke Douglas.
Denver,IUPUI,55,64,34,56,0,Aaron Brennan missed Layup.
Denver,IUPUI,55,64,34,56,0,Duke Douglas Block.
Denver,IUPUI,55,64,34,58,0,Jordan Pickett Offensive Rebound.
Denver,IUPUI,55,66,35,2,1,Marcellus Barksdale made Layup. Assisted by Jordan Pickett.
Denver,IUPUI,55,66,35,3,0,Foul on Thomas Neff.
Denver,IUPUI,55,67,35,3,1,Marcellus Barksdale made Free Throw.
Denver,IUPUI,55,67,35,28,0,Foul on Marcellus Barksdale.
Denver,IUPUI,56,67,35,28,1,Jake Holtzmann made Free Throw.
Denver,IUPUI,57,67,35,28,1,Jake Holtzmann made Free Throw.
Denver,IUPUI,57,67,35,36,0,Darell Combs missed Layup.
Denver,IUPUI,57,67,35,36,0,Marcus Byrd Defensive Rebound.
Denver,IUPUI,57,67,36,0,0,Jake Holtzmann missed Three Point Jumper.
Denver,IUPUI,57,67,36,0,0,Marcellus Barksdale Block.
Denver,IUPUI,57,67,36,3,0,Aaron Brennan Defensive Rebound.
Denver,IUPUI,57,69,36,31,1,Aaron Brennan made Jumper. Assisted by Evan Hall.
Denver,IUPUI,57,69,36,44,0,Joe Rosga Turnover.
Denver,IUPUI,57,69,36,44,0,Official TV Timeout
Denver,IUPUI,57,71,36,52,1,Jordan Pickett made Layup.
Denver,IUPUI,57,71,36,52,0,Foul on Joe Rosga.
Denver,IUPUI,57,72,36,52,1,Jordan Pickett made Free Throw.
Denver,IUPUI,57,72,37,3,0,Denver  Turnover.
Denver,IUPUI,57,72,37,24,0,Aaron Brennan missed Jumper.
Denver,IUPUI,57,72,37,24,0,Jake Holtzmann Defensive Rebound.
Denver,IUPUI,57,72,37,49,0,Foul on Evan Hall.
Denver,IUPUI,58,72,37,49,1,Joe Rosga made Free Throw.
Denver,IUPUI,59,72,37,49,1,Joe Rosga made Free Throw.
Denver,IUPUI,59,72,38,4,0,Foul on Nate Engesser.
Denver,IUPUI,59,73,38,4,1,Darell Combs made Free Throw.
Denver,IUPUI,59,74,38,4,1,Darell Combs made Free Throw.
Denver,IUPUI,59,74,38,27,0,Christian Mackey Turnover.
Denver,IUPUI,59,74,38,28,0,T.J. Henderson Steal.
Denver,IUPUI,59,74,38,47,0,John Hubler Turnover.
Denver,IUPUI,59,74,38,48,0,Jake Pemberton Steal.
Denver,IUPUI,59,74,39,7,0,Nate Engesser Turnover.
Denver,IUPUI,59,74,39,8,0,T.J. Henderson Steal.
Denver,IUPUI,59,76,39,10,1,Mason Archie II made Layup. Assisted by T.J. Henderson.
Denver,IUPUI,59,76,39,23,0,Foul on T.J. Henderson.
Denver,IUPUI,60,76,39,23,1,Jake Pemberton made Free Throw.
Denver,IUPUI,61,76,39,23,1,Jake Pemberton made Free Throw.
Denver,IUPUI,61,76,39,32,0,Grant Sinn missed Three Point Jumper.
Denver,IUPUI,61,76,39,32,0,Jake Pemberton Defensive Rebound.
Denver,IUPUI,61,76,39,49,0,Jake Holtzmann missed Three Point Jumper.
Denver,IUPUI,61,76,39,49,0,Matt O'Leary Defensive Rebound.
Denver,IUPUI,61,76,40,0,0,End of Game
