Away Team,Home Team,Away Score,Home Score,Minute,Second,isScoringPosession,Desc.
Trinity (FL),Bethune-Cookman,48,101,38,8,1,Quinton Forrest made Layup.
Trinity (FL),Bethune-Cookman,48,101,38,20,0,Da-Vonte Lamar Turnover.
Trinity (FL),Bethune-Cookman,48,104,38,25,1,Marquel Ingram made Three Point Jumper.
Trinity (FL),Bethune-Cookman,48,104,38,38,0,Dante Mitchell Turnover.
Trinity (FL),Bethune-Cookman,48,104,38,39,0,Jackie Saucer Steal.
Trinity (FL),Bethune-Cookman,48,104,38,41,0,Jackie Saucer Turnover.
Trinity (FL),Bethune-Cookman,48,104,38,41,0,Dante Mitchell Steal.
Trinity (FL),Bethune-Cookman,50,104,38,49,1,Dante Mitchell made Layup.
Trinity (FL),Bethune-Cookman,50,104,38,57,0,Quinton Forrest missed Layup.
Trinity (FL),Bethune-Cookman,50,104,38,57,0,LaRon Smith Offensive Rebound.
Trinity (FL),Bethune-Cookman,50,106,39,0,1,LaRon Smith made Jumper.
Trinity (FL),Bethune-Cookman,52,106,39,18,1,Dante Mitchell made Jumper.
Trinity (FL),Bethune-Cookman,52,106,39,43,0,Marquel Ingram missed Three Point Jumper.
Trinity (FL),Bethune-Cookman,52,106,39,43,0,LaRon Smith Offensive Rebound.
Trinity (FL),Bethune-Cookman,52,108,39,49,1,Augustinas Navickas made Jumper. Assisted by LaRon Smith.
Trinity (FL),Bethune-Cookman,52,108,39,59,0,Da-Vonte Lamar missed Layup.
Trinity (FL),Bethune-Cookman,52,108,39,59,0,Jaymeke Smith Offensive Rebound.
Trinity (FL),Bethune-Cookman,54,108,40,0,1,Jaymeke Smith made Layup.
Trinity (FL),Bethune-Cookman,54,108,40,0,0,End of Game
