Away Team,Home Team,Away Score,Home Score,Minute,Second,isScoringPosession,Desc.
Trinity (FL),Bethune-Cookman,0,0,0,29,0,LaRon Smith Turnover.
Trinity (FL),Bethune-Cookman,0,0,0,35,0,Chris Kolaxis Turnover.
Trinity (FL),Bethune-Cookman,0,0,0,36,0,Mario Moody Steal.
Trinity (FL),Bethune-Cookman,0,0,0,40,0,Mario Moody missed Dunk.
Trinity (FL),Bethune-Cookman,0,0,0,40,0,Ricky Johnson Offensive Rebound.
Trinity (FL),Bethune-Cookman,0,2,0,47,1,Mario Moody made Jumper. Assisted by Ricky Johnson.
Trinity (FL),Bethune-Cookman,0,2,1,3,0,Dante Mitchell missed Jumper.
Trinity (FL),Bethune-Cookman,0,2,1,3,0,Mario Moody Defensive Rebound.
Trinity (FL),Bethune-Cookman,0,2,1,14,0,Ricky Johnson missed Three Point Jumper.
Trinity (FL),Bethune-Cookman,0,2,1,14,0,Trinity College (FL) Defensive Rebound.
Trinity (FL),Bethune-Cookman,0,2,1,16,0,Foul on LaRon Smith.
Trinity (FL),Bethune-Cookman,0,2,1,25,0,Chris Kolaxis missed Three Point Jumper.
Trinity (FL),Bethune-Cookman,0,2,1,25,0,Bethune-Cookman Defensive Rebound.
Trinity (FL),Bethune-Cookman,0,2,1,43,0,Foul on LaRon Smith.
Trinity (FL),Bethune-Cookman,0,2,1,43,0,LaRon Smith Turnover.
Trinity (FL),Bethune-Cookman,2,2,2,14,1,Chris Aristide made Jumper.
Trinity (FL),Bethune-Cookman,2,5,2,23,1,Jordan Potts made Three Point Jumper.
Trinity (FL),Bethune-Cookman,2,5,2,43,0,Chris Kolaxis missed Jumper.
Trinity (FL),Bethune-Cookman,2,5,2,43,0,LaRon Smith Defensive Rebound.
Trinity (FL),Bethune-Cookman,2,8,2,51,1,Ricky Johnson made Three Point Jumper. Assisted by Jordan Potts.
Trinity (FL),Bethune-Cookman,2,8,3,4,0,Foul on Mario Moody.
Trinity (FL),Bethune-Cookman,2,8,3,7,0,Dante Mitchell missed Jumper.
Trinity (FL),Bethune-Cookman,2,8,3,7,0,Brandan Fisher Offensive Rebound.
Trinity (FL),Bethune-Cookman,2,8,3,10,0,Brandan Fisher missed Layup.
Trinity (FL),Bethune-Cookman,2,8,3,10,0,Mario Moody Block.
Trinity (FL),Bethune-Cookman,2,8,3,12,0,Mario Moody Defensive Rebound.
Trinity (FL),Bethune-Cookman,2,8,3,18,0,Ricky Johnson missed Three Point Jumper.
Trinity (FL),Bethune-Cookman,2,8,3,18,0,Dante Mitchell Defensive Rebound.
Trinity (FL),Bethune-Cookman,2,8,3,38,0,Dante Mitchell missed Jumper.
Trinity (FL),Bethune-Cookman,2,8,3,38,0,LaRon Smith Defensive Rebound.
Trinity (FL),Bethune-Cookman,2,8,3,48,0,Randy Holmes missed Three Point Jumper.
Trinity (FL),Bethune-Cookman,2,8,3,48,0,LaRon Smith Offensive Rebound.
Trinity (FL),Bethune-Cookman,2,8,4,8,0,Foul on John Coleman.
Trinity (FL),Bethune-Cookman,2,8,4,8,0,Official TV Timeout
Trinity (FL),Bethune-Cookman,2,8,4,23,0,Randy Holmes Turnover.
Trinity (FL),Bethune-Cookman,2,8,4,24,0,John Coleman Steal.
Trinity (FL),Bethune-Cookman,2,8,4,33,0,Brandan Fisher Turnover.
Trinity (FL),Bethune-Cookman,2,8,4,33,0,Randy Holmes Steal.
Trinity (FL),Bethune-Cookman,2,8,4,37,0,Ricky Johnson Turnover.
Trinity (FL),Bethune-Cookman,2,8,4,37,0,Foul on Randy Holmes.
Trinity (FL),Bethune-Cookman,2,8,4,55,0,Jaymeke Smith missed Three Point Jumper.
Trinity (FL),Bethune-Cookman,2,8,4,55,0,Mario Moody Defensive Rebound.
Trinity (FL),Bethune-Cookman,2,8,5,3,0,Ricky Johnson missed Three Point Jumper.
Trinity (FL),Bethune-Cookman,2,8,5,3,0,Mario Moody Offensive Rebound.
Trinity (FL),Bethune-Cookman,2,10,5,6,1,Mario Moody made Two Point Tip Shot.
Trinity (FL),Bethune-Cookman,2,10,5,33,0,Foul on Randy Holmes.
Trinity (FL),Bethune-Cookman,3,10,5,33,1,Kenneth White made Free Throw.
Trinity (FL),Bethune-Cookman,3,10,5,33,0,Kenneth White missed Free Throw.
Trinity (FL),Bethune-Cookman,3,10,5,33,0,Mario Moody Defensive Rebound.
Trinity (FL),Bethune-Cookman,3,10,5,49,0,Quinton Forrest Turnover.
Trinity (FL),Bethune-Cookman,3,10,6,5,0,Da-Vonte Lamar missed Layup.
Trinity (FL),Bethune-Cookman,3,10,6,5,0,Da-Vonte Lamar Offensive Rebound.
Trinity (FL),Bethune-Cookman,3,10,6,16,0,Maurice Thompson Turnover.
Trinity (FL),Bethune-Cookman,3,10,6,30,0,Mario Moody missed Three Point Jumper.
Trinity (FL),Bethune-Cookman,3,10,6,30,0,Da-Vonte Lamar Defensive Rebound.
Trinity (FL),Bethune-Cookman,5,10,6,42,1,Maurice Thompson made Jumper. Assisted by Rajiv Prabhakar.
Trinity (FL),Bethune-Cookman,5,10,6,59,0,Jordan Potts missed Three Point Jumper.
Trinity (FL),Bethune-Cookman,5,10,6,59,0,Rajiv Prabhakar Defensive Rebound.
Trinity (FL),Bethune-Cookman,7,10,7,14,1,Rajiv Prabhakar made Jumper. Assisted by Jaymeke Smith.
Trinity (FL),Bethune-Cookman,7,12,7,23,1,Ricky Johnson made Layup.
Trinity (FL),Bethune-Cookman,7,12,7,53,0,Maurice Thompson Turnover.
Trinity (FL),Bethune-Cookman,7,12,7,53,0,LaRon Smith Steal.
Trinity (FL),Bethune-Cookman,7,12,8,0,0,Foul on Chris Aristide.
Trinity (FL),Bethune-Cookman,7,12,8,5,0,Mario Moody missed Jumper.
Trinity (FL),Bethune-Cookman,7,12,8,5,0,LaRon Smith Offensive Rebound.
Trinity (FL),Bethune-Cookman,7,14,8,11,1,LaRon Smith made Dunk.
Trinity (FL),Bethune-Cookman,7,14,8,18,0,Official TV Timeout
Trinity (FL),Bethune-Cookman,9,14,8,27,1,Jaymeke Smith made Jumper.
Trinity (FL),Bethune-Cookman,9,14,8,55,0,Randy Holmes missed Three Point Jumper.
Trinity (FL),Bethune-Cookman,9,14,8,55,0,Mario Moody Offensive Rebound.
Trinity (FL),Bethune-Cookman,9,14,9,3,0,Mario Moody Turnover.
Trinity (FL),Bethune-Cookman,9,14,9,9,0,Rajiv Prabhakar missed Three Point Jumper.
Trinity (FL),Bethune-Cookman,9,14,9,9,0,Jerome Harris Offensive Rebound.
Trinity (FL),Bethune-Cookman,9,14,9,20,0,Foul on Marquel Ingram.
Trinity (FL),Bethune-Cookman,9,14,9,32,0,Rajiv Prabhakar missed Jumper.
Trinity (FL),Bethune-Cookman,9,14,9,32,0,Mario Moody Defensive Rebound.
Trinity (FL),Bethune-Cookman,9,17,9,39,1,Jordan Potts made Three Point Jumper.
Trinity (FL),Bethune-Cookman,9,17,9,54,0,Jerome Harris Turnover.
Trinity (FL),Bethune-Cookman,9,17,9,55,0,Quinton Forrest Steal.
Trinity (FL),Bethune-Cookman,9,17,9,59,0,Quinton Forrest missed Layup.
Trinity (FL),Bethune-Cookman,9,17,9,59,0,LaRon Smith Offensive Rebound.
Trinity (FL),Bethune-Cookman,9,19,10,2,1,LaRon Smith made Dunk.
Trinity (FL),Bethune-Cookman,9,19,10,4,0,Trinity College (FL)  Timeout
Trinity (FL),Bethune-Cookman,9,19,10,17,0,Jerome Harris missed Jumper.
Trinity (FL),Bethune-Cookman,9,19,10,17,0,Chris Aristide Offensive Rebound.
Trinity (FL),Bethune-Cookman,9,19,10,21,0,Chris Aristide missed Jumper.
Trinity (FL),Bethune-Cookman,9,19,10,21,0,Trinity College (FL) Offensive Rebound.
Trinity (FL),Bethune-Cookman,11,19,10,36,1,Dante Mitchell made Jumper. Assisted by Chris Kolaxis.
Trinity (FL),Bethune-Cookman,11,19,10,57,0,Marquel Ingram missed Three Point Jumper.
Trinity (FL),Bethune-Cookman,11,19,10,57,0,Maurice Thompson Defensive Rebound.
Trinity (FL),Bethune-Cookman,13,19,11,6,1,Chris Kolaxis made Jumper. Assisted by John Coleman.
Trinity (FL),Bethune-Cookman,13,22,11,24,1,Mario Moody made Three Point Jumper. Assisted by Marquel Ingram.
Trinity (FL),Bethune-Cookman,13,22,11,56,0,John Coleman missed Layup.
Trinity (FL),Bethune-Cookman,13,22,11,56,0,Jordan Potts Defensive Rebound.
Trinity (FL),Bethune-Cookman,13,22,12,3,0,Foul on Brandan Fisher.
Trinity (FL),Bethune-Cookman,13,22,12,3,0,Official TV Timeout
Trinity (FL),Bethune-Cookman,13,24,12,9,1,LaRon Smith made Layup. Assisted by Marquel Ingram.
Trinity (FL),Bethune-Cookman,13,24,12,9,0,Foul on Brandan Fisher.
Trinity (FL),Bethune-Cookman,13,24,12,9,0,LaRon Smith missed Free Throw.
Trinity (FL),Bethune-Cookman,13,24,12,9,0,Maurice Thompson Defensive Rebound.
Trinity (FL),Bethune-Cookman,13,24,12,23,0,Chris Kolaxis Turnover.
Trinity (FL),Bethune-Cookman,13,24,12,24,0,Marquel Ingram Steal.
Trinity (FL),Bethune-Cookman,13,24,12,26,0,LaRon Smith missed Dunk.
Trinity (FL),Bethune-Cookman,13,24,12,26,0,Dante Mitchell Defensive Rebound.
Trinity (FL),Bethune-Cookman,13,24,12,36,0,Dante Mitchell Turnover.
Trinity (FL),Bethune-Cookman,13,24,12,37,0,Ricky Johnson Steal.
Trinity (FL),Bethune-Cookman,13,24,12,38,0,Foul on John Coleman.
Trinity (FL),Bethune-Cookman,13,24,12,45,0,Ricky Johnson missed Jumper.
Trinity (FL),Bethune-Cookman,13,24,12,45,0,Kenneth White Defensive Rebound.
Trinity (FL),Bethune-Cookman,13,24,12,46,0,Foul on LaRon Smith.
Trinity (FL),Bethune-Cookman,13,24,12,46,0,Kenneth White missed Free Throw.
Trinity (FL),Bethune-Cookman,13,24,12,46,0,Mario Moody Defensive Rebound.
Trinity (FL),Bethune-Cookman,13,24,13,8,0,Quinton Forrest Turnover.
Trinity (FL),Bethune-Cookman,13,24,13,21,0,Chris Kolaxis missed Three Point Jumper.
Trinity (FL),Bethune-Cookman,13,24,13,21,0,Mario Moody Defensive Rebound.
Trinity (FL),Bethune-Cookman,13,27,13,31,1,Marquel Ingram made Three Point Jumper. Assisted by Mario Moody.
Trinity (FL),Bethune-Cookman,15,27,13,53,1,Dante Mitchell made Jumper.
Trinity (FL),Bethune-Cookman,15,29,14,15,1,Randy Holmes made Jumper. Assisted by Marquel Ingram.
Trinity (FL),Bethune-Cookman,15,29,14,30,0,Kenneth White missed Layup.
Trinity (FL),Bethune-Cookman,15,29,14,30,0,Randy Holmes Defensive Rebound.
Trinity (FL),Bethune-Cookman,15,31,14,38,1,Ricky Johnson made Jumper. Assisted by Randy Holmes.
Trinity (FL),Bethune-Cookman,15,31,14,54,0,Trinity College (FL)  Timeout
Trinity (FL),Bethune-Cookman,15,31,15,4,0,Foul on Josue Salaam.
Trinity (FL),Bethune-Cookman,16,31,15,4,1,Dante Mitchell made Free Throw.
Trinity (FL),Bethune-Cookman,17,31,15,4,1,Dante Mitchell made Free Throw.
Trinity (FL),Bethune-Cookman,17,33,15,21,1,Ricky Johnson made Jumper.
Trinity (FL),Bethune-Cookman,17,33,15,46,0,Chris Kolaxis Turnover.
Trinity (FL),Bethune-Cookman,17,33,15,57,0,Jordan Potts missed Three Point Jumper.
Trinity (FL),Bethune-Cookman,17,33,15,57,0,Rajiv Prabhakar Defensive Rebound.
Trinity (FL),Bethune-Cookman,17,33,16,8,0,Dante Mitchell missed Jumper.
Trinity (FL),Bethune-Cookman,17,33,16,8,0,Randy Holmes Defensive Rebound.
Trinity (FL),Bethune-Cookman,17,33,16,15,0,Josue Salaam missed Three Point Jumper.
Trinity (FL),Bethune-Cookman,17,33,16,15,0,Mario Moody Offensive Rebound.
Trinity (FL),Bethune-Cookman,17,33,16,21,0,Foul on Maurice Thompson.
Trinity (FL),Bethune-Cookman,17,33,16,21,0,Official TV Timeout
Trinity (FL),Bethune-Cookman,17,34,16,21,1,Mario Moody made Free Throw.
Trinity (FL),Bethune-Cookman,17,35,16,21,1,Mario Moody made Free Throw.
Trinity (FL),Bethune-Cookman,17,35,16,26,0,Jerome Harris Turnover.
Trinity (FL),Bethune-Cookman,17,37,16,44,1,Mario Moody made Dunk. Assisted by Randy Holmes.
Trinity (FL),Bethune-Cookman,17,37,16,44,0,Foul on Jerome Harris.
Trinity (FL),Bethune-Cookman,17,38,16,44,1,Mario Moody made Free Throw.
Trinity (FL),Bethune-Cookman,17,38,16,52,0,Da-Vonte Lamar Turnover.
Trinity (FL),Bethune-Cookman,17,38,16,53,0,Randy Holmes Steal.
Trinity (FL),Bethune-Cookman,17,38,16,55,0,Mario Moody Turnover.
Trinity (FL),Bethune-Cookman,19,38,17,3,1,Da-Vonte Lamar made Layup.
Trinity (FL),Bethune-Cookman,19,38,17,10,0,Foul on Rajiv Prabhakar.
Trinity (FL),Bethune-Cookman,19,39,17,10,1,Ricky Johnson made Free Throw.
Trinity (FL),Bethune-Cookman,19,40,17,10,1,Ricky Johnson made Free Throw.
Trinity (FL),Bethune-Cookman,21,40,17,22,1,Jerome Harris made Layup. Assisted by Rajiv Prabhakar.
Trinity (FL),Bethune-Cookman,21,40,17,26,0,Foul on Jaymeke Smith.
Trinity (FL),Bethune-Cookman,21,41,17,26,1,Jordan Potts made Free Throw.
Trinity (FL),Bethune-Cookman,21,42,17,26,1,Jordan Potts made Free Throw.
Trinity (FL),Bethune-Cookman,21,42,17,43,0,Jerome Harris missed Layup.
Trinity (FL),Bethune-Cookman,21,42,17,43,0,Randy Holmes Defensive Rebound.
Trinity (FL),Bethune-Cookman,21,45,17,47,1,Josue Salaam made Three Point Jumper. Assisted by Jordan Potts.
Trinity (FL),Bethune-Cookman,21,45,18,7,0,Da-Vonte Lamar missed Jumper.
Trinity (FL),Bethune-Cookman,21,45,18,7,0,Jerome Harris Offensive Rebound.
Trinity (FL),Bethune-Cookman,21,45,18,12,0,Jerome Harris missed Layup.
Trinity (FL),Bethune-Cookman,21,45,18,12,0,Mario Moody Block.
Trinity (FL),Bethune-Cookman,21,45,18,13,0,Ricky Johnson Defensive Rebound.
Trinity (FL),Bethune-Cookman,21,45,18,17,0,Ricky Johnson missed Jumper.
Trinity (FL),Bethune-Cookman,21,45,18,17,0,Da-Vonte Lamar Defensive Rebound.
Trinity (FL),Bethune-Cookman,21,45,18,30,0,Chris Kolaxis Turnover.
Trinity (FL),Bethune-Cookman,21,45,18,32,0,Jordan Potts Steal.
Trinity (FL),Bethune-Cookman,21,47,18,35,1,Randy Holmes made Layup. Assisted by Jordan Potts.
Trinity (FL),Bethune-Cookman,21,47,18,35,0,Foul on Rajiv Prabhakar.
Trinity (FL),Bethune-Cookman,21,48,18,35,1,Randy Holmes made Free Throw.
Trinity (FL),Bethune-Cookman,21,48,18,47,0,Rajiv Prabhakar Turnover.
Trinity (FL),Bethune-Cookman,21,50,18,59,1,Mario Moody made Dunk. Assisted by Jordan Potts.
Trinity (FL),Bethune-Cookman,21,50,19,12,0,Jerome Harris Turnover.
Trinity (FL),Bethune-Cookman,21,50,19,14,0,Josue Salaam Steal.
Trinity (FL),Bethune-Cookman,21,52,19,16,1,Quinton Forrest made Dunk. Assisted by Jordan Potts.
Trinity (FL),Bethune-Cookman,21,52,19,32,0,Chris Kolaxis Turnover.
Trinity (FL),Bethune-Cookman,21,52,19,33,0,Jordan Potts Steal.
Trinity (FL),Bethune-Cookman,21,54,19,36,1,Mario Moody made Dunk. Assisted by Jordan Potts.
Trinity (FL),Bethune-Cookman,23,54,19,48,1,Da-Vonte Lamar made Layup.
Trinity (FL),Bethune-Cookman,23,54,19,48,0,Foul on Jordan Potts.
Trinity (FL),Bethune-Cookman,24,54,19,48,1,Da-Vonte Lamar made Free Throw.
Trinity (FL),Bethune-Cookman,24,54,19,59,0,Jordan Potts Turnover.
Trinity (FL),Bethune-Cookman,24,54,19,59,0,Foul on Jordan Potts.
Trinity (FL),Bethune-Cookman,24,54,20,0,0,End of 1st half
Trinity (FL),Bethune-Cookman,24,54,20,9,0,Foul on Randy Holmes.
Trinity (FL),Bethune-Cookman,24,54,20,18,0,John Coleman missed Jumper.
Trinity (FL),Bethune-Cookman,24,54,20,18,0,LaRon Smith Defensive Rebound.
Trinity (FL),Bethune-Cookman,24,54,20,24,0,LaRon Smith Turnover.
Trinity (FL),Bethune-Cookman,24,54,20,26,0,John Coleman Steal.
Trinity (FL),Bethune-Cookman,24,54,20,27,0,John Coleman missed Jumper.
Trinity (FL),Bethune-Cookman,24,54,20,27,0,LaRon Smith Block.
Trinity (FL),Bethune-Cookman,24,54,20,28,0,Bethune-Cookman Defensive Rebound.
Trinity (FL),Bethune-Cookman,24,54,20,45,0,Ricky Johnson Turnover.
Trinity (FL),Bethune-Cookman,24,54,20,57,0,John Coleman Turnover.
Trinity (FL),Bethune-Cookman,24,54,20,58,0,Jordan Potts Steal.
Trinity (FL),Bethune-Cookman,24,54,21,2,0,Ricky Johnson missed Layup.
Trinity (FL),Bethune-Cookman,24,54,21,2,0,Mario Moody Offensive Rebound.
Trinity (FL),Bethune-Cookman,24,56,21,4,1,Mario Moody made Layup.
Trinity (FL),Bethune-Cookman,26,56,21,23,1,Dante Mitchell made Jumper.
Trinity (FL),Bethune-Cookman,26,58,21,50,1,Mario Moody made Dunk. Assisted by Jordan Potts.
Trinity (FL),Bethune-Cookman,26,58,22,12,0,Dante Mitchell missed Jumper.
Trinity (FL),Bethune-Cookman,26,58,22,12,0,Jordan Potts Defensive Rebound.
Trinity (FL),Bethune-Cookman,26,58,22,22,0,Jordan Potts missed Three Point Jumper.
Trinity (FL),Bethune-Cookman,26,58,22,22,0,Chris Aristide Defensive Rebound.
Trinity (FL),Bethune-Cookman,28,58,22,30,1,Da-Vonte Lamar made Jumper.
Trinity (FL),Bethune-Cookman,28,58,22,48,0,Ricky Johnson missed Jumper.
Trinity (FL),Bethune-Cookman,28,58,22,48,0,Dante Mitchell Defensive Rebound.
Trinity (FL),Bethune-Cookman,28,58,23,3,0,John Coleman Turnover.
Trinity (FL),Bethune-Cookman,28,58,23,4,0,Randy Holmes Steal.
Trinity (FL),Bethune-Cookman,28,60,23,6,1,Jordan Potts made Layup. Assisted by Randy Holmes.
Trinity (FL),Bethune-Cookman,28,60,23,6,0,Foul on Brandan Fisher.
Trinity (FL),Bethune-Cookman,28,60,23,6,0,Jordan Potts missed Free Throw.
Trinity (FL),Bethune-Cookman,28,60,23,6,0,Chris Aristide Defensive Rebound.
Trinity (FL),Bethune-Cookman,28,60,23,15,0,Da-Vonte Lamar Turnover.
Trinity (FL),Bethune-Cookman,28,62,23,27,1,Mario Moody made Dunk. Assisted by Ricky Johnson.
Trinity (FL),Bethune-Cookman,28,62,23,43,0,Dante Mitchell Turnover.
Trinity (FL),Bethune-Cookman,28,62,23,44,0,Jordan Potts Steal.
Trinity (FL),Bethune-Cookman,28,62,23,47,0,Jordan Potts Turnover.
Trinity (FL),Bethune-Cookman,28,62,23,50,0,Chris Aristide Steal.
Trinity (FL),Bethune-Cookman,28,62,23,55,0,Chris Aristide Turnover.
Trinity (FL),Bethune-Cookman,28,65,23,59,1,Ricky Johnson made Three Point Jumper. Assisted by Jordan Potts.
Trinity (FL),Bethune-Cookman,28,65,24,8,0,Trinity College (FL)  Timeout
Trinity (FL),Bethune-Cookman,28,65,24,25,0,Chris Aristide Turnover.
Trinity (FL),Bethune-Cookman,28,65,24,26,0,Marquel Ingram Steal.
Trinity (FL),Bethune-Cookman,28,65,24,43,0,Quinton Forrest Turnover.
Trinity (FL),Bethune-Cookman,28,65,24,43,0,Official TV Timeout
Trinity (FL),Bethune-Cookman,28,65,25,4,0,Kenneth White Turnover.
Trinity (FL),Bethune-Cookman,28,68,25,14,1,Randy Holmes made Three Point Jumper. Assisted by Josue Salaam.
Trinity (FL),Bethune-Cookman,28,68,25,27,0,Da-Vonte Lamar missed Three Point Jumper.
Trinity (FL),Bethune-Cookman,28,68,25,27,0,Marquel Ingram Defensive Rebound.
Trinity (FL),Bethune-Cookman,28,68,25,43,0,Randy Holmes missed Three Point Jumper.
Trinity (FL),Bethune-Cookman,28,68,25,43,0,Quinton Forrest Offensive Rebound.
Trinity (FL),Bethune-Cookman,28,70,25,47,1,Quinton Forrest made Two Point Tip Shot.
Trinity (FL),Bethune-Cookman,28,70,26,9,0,Jaymeke Smith missed Jumper.
Trinity (FL),Bethune-Cookman,28,70,26,9,0,Jaymeke Smith Offensive Rebound.
Trinity (FL),Bethune-Cookman,30,70,26,12,1,Jaymeke Smith made Jumper.
Trinity (FL),Bethune-Cookman,30,70,26,20,0,Foul on Kenneth White.
Trinity (FL),Bethune-Cookman,30,71,26,20,1,Jordan Potts made Free Throw.
Trinity (FL),Bethune-Cookman,30,72,26,20,1,Jordan Potts made Free Throw.
Trinity (FL),Bethune-Cookman,30,72,26,35,0,Foul on Randy Holmes.
Trinity (FL),Bethune-Cookman,31,72,26,35,1,Jaymeke Smith made Free Throw.
Trinity (FL),Bethune-Cookman,32,72,26,35,1,Jaymeke Smith made Free Throw.
Trinity (FL),Bethune-Cookman,32,75,26,46,1,Marquel Ingram made Three Point Jumper. Assisted by Jordan Potts.
Trinity (FL),Bethune-Cookman,32,75,27,10,0,Rajiv Prabhakar missed Three Point Jumper.
Trinity (FL),Bethune-Cookman,32,75,27,10,0,Augustinas Navickas Defensive Rebound.
Trinity (FL),Bethune-Cookman,32,78,27,18,1,Josue Salaam made Three Point Jumper. Assisted by Quinton Forrest.
Trinity (FL),Bethune-Cookman,34,78,27,41,1,Maurice Thompson made Dunk.
Trinity (FL),Bethune-Cookman,34,78,27,41,0,Foul on Augustinas Navickas.
Trinity (FL),Bethune-Cookman,34,78,27,41,0,Maurice Thompson missed Free Throw.
Trinity (FL),Bethune-Cookman,34,78,27,41,0,Augustinas Navickas Defensive Rebound.
Trinity (FL),Bethune-Cookman,34,78,27,46,0,Jordan Potts Turnover.
Trinity (FL),Bethune-Cookman,34,78,27,48,0,John Coleman Steal.
Trinity (FL),Bethune-Cookman,36,78,27,52,1,John Coleman made Layup.
Trinity (FL),Bethune-Cookman,36,80,28,16,1,Jordan Potts made Jumper.
Trinity (FL),Bethune-Cookman,36,80,28,31,0,Foul on Josue Salaam.
Trinity (FL),Bethune-Cookman,36,80,28,31,0,Official TV Timeout
Trinity (FL),Bethune-Cookman,36,80,28,39,0,Jerome Harris missed Jumper.
Trinity (FL),Bethune-Cookman,36,80,28,39,0,Marquel Ingram Defensive Rebound.
Trinity (FL),Bethune-Cookman,36,80,28,55,0,Foul on John Coleman.
Trinity (FL),Bethune-Cookman,36,80,29,1,0,Augustinas Navickas Turnover.
Trinity (FL),Bethune-Cookman,36,80,29,15,0,Foul on Josue Salaam.
Trinity (FL),Bethune-Cookman,36,80,29,15,0,Jerome Harris missed Free Throw.
Trinity (FL),Bethune-Cookman,36,80,29,15,0,Trinity College (FL) Deadball Team Rebound.
Trinity (FL),Bethune-Cookman,36,80,29,15,0,Jerome Harris missed Free Throw.
Trinity (FL),Bethune-Cookman,36,80,29,15,0,Augustinas Navickas Defensive Rebound.
Trinity (FL),Bethune-Cookman,36,82,29,33,1,Augustinas Navickas made Layup. Assisted by Jordan Potts.
Trinity (FL),Bethune-Cookman,36,82,29,46,0,Rajiv Prabhakar Turnover.
Trinity (FL),Bethune-Cookman,36,82,29,47,0,Jordan Potts Steal.
Trinity (FL),Bethune-Cookman,36,84,29,49,1,Quinton Forrest made Dunk. Assisted by Marquel Ingram.
Trinity (FL),Bethune-Cookman,36,84,30,4,0,Rajiv Prabhakar missed Three Point Jumper.
Trinity (FL),Bethune-Cookman,36,84,30,4,0,Marquel Ingram Defensive Rebound.
Trinity (FL),Bethune-Cookman,36,84,30,7,0,Foul on Jerome Harris.
Trinity (FL),Bethune-Cookman,36,84,30,24,0,Marquel Ingram missed Three Point Jumper.
Trinity (FL),Bethune-Cookman,36,84,30,24,0,Jackie Saucer Offensive Rebound.
Trinity (FL),Bethune-Cookman,36,84,30,28,0,Jackie Saucer Turnover.
Trinity (FL),Bethune-Cookman,36,84,30,39,0,Foul on Jackie Saucer.
Trinity (FL),Bethune-Cookman,36,84,30,51,0,Foul on Jackie Saucer.
Trinity (FL),Bethune-Cookman,37,84,30,51,1,John Coleman made Free Throw.
Trinity (FL),Bethune-Cookman,38,84,30,51,1,John Coleman made Free Throw.
Trinity (FL),Bethune-Cookman,38,84,30,56,0,Foul on Dante Mitchell.
Trinity (FL),Bethune-Cookman,38,84,30,56,0,Quinton Forrest missed Free Throw.
Trinity (FL),Bethune-Cookman,38,84,30,56,0,Bethune-Cookman Deadball Team Rebound.
Trinity (FL),Bethune-Cookman,38,85,30,56,1,Quinton Forrest made Free Throw.
Trinity (FL),Bethune-Cookman,40,85,31,24,1,Chris Aristide made Jumper.
Trinity (FL),Bethune-Cookman,40,85,31,49,0,Jackie Saucer missed Three Point Jumper.
Trinity (FL),Bethune-Cookman,40,85,31,49,0,Quinton Forrest Offensive Rebound.
Trinity (FL),Bethune-Cookman,40,87,31,52,1,Quinton Forrest made Jumper.
Trinity (FL),Bethune-Cookman,40,87,32,7,0,Chris Kolaxis missed Three Point Jumper.
Trinity (FL),Bethune-Cookman,40,87,32,7,0,Marquel Ingram Defensive Rebound.
Trinity (FL),Bethune-Cookman,40,87,32,13,0,Marquel Ingram Turnover.
Trinity (FL),Bethune-Cookman,40,87,32,13,0,Foul on Marquel Ingram.
Trinity (FL),Bethune-Cookman,40,87,32,13,0,Official TV Timeout
Trinity (FL),Bethune-Cookman,40,87,32,29,0,Maurice Thompson missed Jumper.
Trinity (FL),Bethune-Cookman,40,87,32,29,0,Chris Aristide Offensive Rebound.
Trinity (FL),Bethune-Cookman,40,87,32,41,0,Dante Mitchell missed Jumper.
Trinity (FL),Bethune-Cookman,40,87,32,41,0,Brandan Fisher Offensive Rebound.
Trinity (FL),Bethune-Cookman,40,87,32,48,0,Brandan Fisher missed Jumper.
Trinity (FL),Bethune-Cookman,40,87,32,48,0,Marquel Ingram Defensive Rebound.
Trinity (FL),Bethune-Cookman,40,90,32,56,1,Quinton Forrest made Three Point Jumper. Assisted by Marquel Ingram.
Trinity (FL),Bethune-Cookman,40,90,33,10,0,John Coleman missed Three Point Jumper.
Trinity (FL),Bethune-Cookman,40,90,33,10,0,Marquel Ingram Defensive Rebound.
Trinity (FL),Bethune-Cookman,40,90,33,19,0,Foul on Marquel Ingram.
Trinity (FL),Bethune-Cookman,40,90,33,19,0,Marquel Ingram Turnover.
Trinity (FL),Bethune-Cookman,40,90,33,23,0,Brandan Fisher Turnover.
Trinity (FL),Bethune-Cookman,40,90,33,26,0,Quinton Forrest Steal.
Trinity (FL),Bethune-Cookman,40,92,33,28,1,Quinton Forrest made Layup.
Trinity (FL),Bethune-Cookman,40,92,33,37,0,Brandan Fisher missed Three Point Jumper.
Trinity (FL),Bethune-Cookman,40,92,33,37,0,Augustinas Navickas Defensive Rebound.
Trinity (FL),Bethune-Cookman,40,92,33,45,0,Augustinas Navickas Turnover.
Trinity (FL),Bethune-Cookman,40,92,33,47,0,Brandan Fisher Steal.
Trinity (FL),Bethune-Cookman,40,92,33,50,0,Dante Mitchell missed Jumper.
Trinity (FL),Bethune-Cookman,40,92,33,50,0,Chris Aristide Offensive Rebound.
Trinity (FL),Bethune-Cookman,40,92,33,52,0,Chris Aristide missed Jumper.
Trinity (FL),Bethune-Cookman,40,92,33,52,0,LaRon Smith Defensive Rebound.
Trinity (FL),Bethune-Cookman,40,92,34,2,0,Jackie Saucer Turnover.
Trinity (FL),Bethune-Cookman,40,92,34,3,0,Dante Mitchell Steal.
Trinity (FL),Bethune-Cookman,42,92,34,19,1,Dante Mitchell made Layup.
Trinity (FL),Bethune-Cookman,42,92,34,40,0,LaRon Smith missed Jumper.
Trinity (FL),Bethune-Cookman,42,92,34,40,0,Brandan Fisher Defensive Rebound.
Trinity (FL),Bethune-Cookman,44,92,34,54,1,John Coleman made Jumper.
Trinity (FL),Bethune-Cookman,44,94,35,12,1,LaRon Smith made Jumper. Assisted by Augustinas Navickas.
Trinity (FL),Bethune-Cookman,44,94,35,36,0,Dante Mitchell missed Jumper.
Trinity (FL),Bethune-Cookman,44,94,35,36,0,Maurice Thompson Offensive Rebound.
Trinity (FL),Bethune-Cookman,44,94,35,39,0,Maurice Thompson missed Jumper.
Trinity (FL),Bethune-Cookman,44,94,35,39,0,LaRon Smith Defensive Rebound.
Trinity (FL),Bethune-Cookman,44,96,35,45,1,Quinton Forrest made Dunk. Assisted by LaRon Smith.
Trinity (FL),Bethune-Cookman,44,96,36,5,0,John Coleman missed Layup.
Trinity (FL),Bethune-Cookman,44,96,36,5,0,LaRon Smith Defensive Rebound.
Trinity (FL),Bethune-Cookman,44,96,36,14,0,Foul on Brandan Fisher.
Trinity (FL),Bethune-Cookman,44,96,36,14,0,Official TV Timeout
Trinity (FL),Bethune-Cookman,44,97,36,14,1,Marquel Ingram made Free Throw.
Trinity (FL),Bethune-Cookman,44,97,36,14,0,Marquel Ingram missed Free Throw.
Trinity (FL),Bethune-Cookman,44,97,36,14,0,Maurice Thompson Defensive Rebound.
Trinity (FL),Bethune-Cookman,46,97,36,38,1,Dante Mitchell made Jumper.
Trinity (FL),Bethune-Cookman,46,97,36,43,0,Foul on Da-Vonte Lamar.
Trinity (FL),Bethune-Cookman,46,98,36,43,1,Marquel Ingram made Free Throw.
Trinity (FL),Bethune-Cookman,46,99,36,43,1,Marquel Ingram made Free Throw.
Trinity (FL),Bethune-Cookman,46,99,37,8,0,Jaymeke Smith missed Layup.
Trinity (FL),Bethune-Cookman,46,99,37,8,0,Augustinas Navickas Block.
Trinity (FL),Bethune-Cookman,46,99,37,9,0,Dante Mitchell Offensive Rebound.
Trinity (FL),Bethune-Cookman,46,99,37,12,0,Dante Mitchell missed Layup.
Trinity (FL),Bethune-Cookman,46,99,37,12,0,Jaymeke Smith Offensive Rebound.
Trinity (FL),Bethune-Cookman,46,99,37,15,0,Jaymeke Smith missed Layup.
Trinity (FL),Bethune-Cookman,46,99,37,15,0,LaRon Smith Block.
Trinity (FL),Bethune-Cookman,46,99,37,16,0,Da-Vonte Lamar Offensive Rebound.
Trinity (FL),Bethune-Cookman,48,99,37,18,1,Chris Aristide made Layup. Assisted by Da-Vonte Lamar.
Trinity (FL),Bethune-Cookman,48,99,37,34,0,Jackie Saucer missed Three Point Jumper.
Trinity (FL),Bethune-Cookman,48,99,37,34,0,Trinity College (FL) Defensive Rebound.
Trinity (FL),Bethune-Cookman,48,99,38,3,0,Da-Vonte Lamar Turnover.
Trinity (FL),Bethune-Cookman,48,99,38,4,0,Quinton Forrest Steal.
