Away Team,Home Team,Away Score, Home Score,Minute,Second,isScoringPosession,Desc.
Northwestern State,Oklahoma,0,0,0,13,0,Foul on Josh Boyd.
Northwestern State,Oklahoma,0,1,0,13,1,Jordan Woodard made Free Throw.
Northwestern State,Oklahoma,0,2,0,13,1,Jordan Woodard made Free Throw.
Northwestern State,Oklahoma,0,2,0,21,0,Josh Boyd Turnover.
Northwestern State,Oklahoma,0,4,0,30,1,Khadeem Lattin made Dunk. Assisted by Kristian Doolittle.
Northwestern State,Oklahoma,2,4,1,10,1,Zeek Woodley made Jumper. Assisted by Devonte Hall.
Northwestern State,Oklahoma,2,4,1,20,0,Foul on Devonte Hall.
Northwestern State,Oklahoma,2,5,1,20,1,Jordan Woodard made Free Throw.
Northwestern State,Oklahoma,2,6,1,20,1,Jordan Woodard made Free Throw.
Northwestern State,Oklahoma,2,6,1,23,0,Foul on Christian James.
Northwestern State,Oklahoma,2,6,1,40,0,Josh Boyd Turnover.
Northwestern State,Oklahoma,2,6,1,41,0,Rashard Odomes Steal.
Northwestern State,Oklahoma,2,6,1,42,0,Rashard Odomes Turnover.
Northwestern State,Oklahoma,2,6,1,43,0,Devonte Hall Steal.
Northwestern State,Oklahoma,2,6,1,45,0,Iziahiah Sweeney missed Three Point Jumper.
Northwestern State,Oklahoma,2,6,1,45,0,Iziahiah Sweeney Offensive Rebound.
Northwestern State,Oklahoma,2,6,1,51,0,Iziahiah Sweeney Turnover.
Northwestern State,Oklahoma,2,6,1,51,0,Foul on Iziahiah Sweeney.
Northwestern State,Oklahoma,2,6,1,58,0,Christian James missed Jumper.
Northwestern State,Oklahoma,2,6,1,58,0,Josh Boyd Defensive Rebound.
Northwestern State,Oklahoma,2,6,2,12,0,Ishmael Lane missed Jumper.
Northwestern State,Oklahoma,2,6,2,12,0,Khadeem Lattin Block.
Northwestern State,Oklahoma,2,6,2,14,0,Jordan Woodard Defensive Rebound.
Northwestern State,Oklahoma,2,8,2,17,1,Kristian Doolittle made Dunk. Assisted by Jordan Woodard.
Northwestern State,Oklahoma,2,8,2,18,0,Northwestern St  Timeout
Northwestern State,Oklahoma,2,8,2,49,0,Northwestern St  Turnover.
Northwestern State,Oklahoma,2,8,2,56,0,Christian James missed Three Point Jumper.
Northwestern State,Oklahoma,2,8,2,56,0,Malik Metoyer Defensive Rebound.
Northwestern State,Oklahoma,2,8,3,26,0,Foul on Rashard Odomes.
Northwestern State,Oklahoma,2,8,3,26,0,Malik Metoyer missed Free Throw.
Northwestern State,Oklahoma,2,8,3,26,0,Northwestern St Deadball Team Rebound.
Northwestern State,Oklahoma,2,8,3,26,0,Malik Metoyer missed Free Throw.
Northwestern State,Oklahoma,2,8,3,26,0,Jordan Woodard Defensive Rebound.
Northwestern State,Oklahoma,2,10,3,32,1,Khadeem Lattin made Layup. Assisted by Christian James.
Northwestern State,Oklahoma,2,10,3,45,0,Sabri Thompson missed Layup.
Northwestern State,Oklahoma,2,10,3,45,0,Khadeem Lattin Defensive Rebound.
Northwestern State,Oklahoma,2,10,3,50,0,Rashard Odomes missed Layup.
Northwestern State,Oklahoma,2,10,3,50,0,Kristian Doolittle Offensive Rebound.
Northwestern State,Oklahoma,2,13,4,1,1,Christian James made Three Point Jumper. Assisted by Rashard Odomes.
Northwestern State,Oklahoma,2,13,4,11,0,Tra'von Joseph missed Layup.
Northwestern State,Oklahoma,2,13,4,11,0,Khadeem Lattin Defensive Rebound.
Northwestern State,Oklahoma,2,16,4,23,1,Kristian Doolittle made Three Point Jumper. Assisted by Rashard Odomes.
Northwestern State,Oklahoma,2,16,4,27,0,Northwestern St  Timeout
Northwestern State,Oklahoma,2,16,4,27,0,Official TV Timeout
Northwestern State,Oklahoma,2,16,4,43,0,Ishmael Lane Turnover.
Northwestern State,Oklahoma,2,16,4,43,0,Khadeem Lattin Steal.
Northwestern State,Oklahoma,2,16,4,47,0,Rashard Odomes missed Dunk.
Northwestern State,Oklahoma,2,16,4,47,0,Ishmael Lane Defensive Rebound.
Northwestern State,Oklahoma,2,16,4,54,0,Josh Boyd missed Layup.
Northwestern State,Oklahoma,2,16,4,54,0,Josh Boyd Offensive Rebound.
Northwestern State,Oklahoma,2,16,4,57,0,Josh Boyd missed Layup.
Northwestern State,Oklahoma,2,16,4,57,0,Devonte Hall Offensive Rebound.
Northwestern State,Oklahoma,2,16,5,14,0,Josh Boyd missed Three Point Jumper.
Northwestern State,Oklahoma,2,16,5,14,0,Jordan Woodard Defensive Rebound.
Northwestern State,Oklahoma,2,16,5,28,0,Jordan Woodard missed Jumper.
Northwestern State,Oklahoma,2,16,5,28,0,Iziahiah Sweeney Defensive Rebound.
Northwestern State,Oklahoma,2,16,5,34,0,Iziahiah Sweeney missed Layup.
Northwestern State,Oklahoma,2,16,5,34,0,Khadeem Lattin Defensive Rebound.
Northwestern State,Oklahoma,2,16,5,39,0,Kameron McGusty Turnover.
Northwestern State,Oklahoma,2,16,5,40,0,Josh Boyd Steal.
Northwestern State,Oklahoma,2,16,5,50,0,Josh Boyd missed Three Point Jumper.
Northwestern State,Oklahoma,2,16,5,50,0,Rashard Odomes Defensive Rebound.
Northwestern State,Oklahoma,2,18,6,0,1,Jordan Woodard made Layup.
Northwestern State,Oklahoma,2,18,6,15,0,Josh Boyd Turnover.
Northwestern State,Oklahoma,2,18,6,17,0,Rashard Odomes Steal.
Northwestern State,Oklahoma,2,18,6,28,0,Kristian Doolittle missed Three Point Jumper.
Northwestern State,Oklahoma,2,18,6,28,0,Ishmael Lane Defensive Rebound.
Northwestern State,Oklahoma,4,18,6,56,1,Ishmael Lane made Jumper. Assisted by Josh Boyd.
Northwestern State,Oklahoma,4,18,7,11,0,Kameron McGusty missed Three Point Jumper.
Northwestern State,Oklahoma,4,18,7,11,0,Ishmael Lane Defensive Rebound.
Northwestern State,Oklahoma,4,18,7,30,0,Iziahiah Sweeney missed Layup.
Northwestern State,Oklahoma,4,18,7,30,0,Khadeem Lattin Defensive Rebound.
Northwestern State,Oklahoma,4,18,7,36,0,Kameron McGusty missed Layup.
Northwestern State,Oklahoma,4,18,7,36,0,Devonte Hall Defensive Rebound.
Northwestern State,Oklahoma,4,18,7,38,0,Foul on Kristian Doolittle.
Northwestern State,Oklahoma,4,18,7,50,0,Zeek Woodley missed Three Point Jumper.
Northwestern State,Oklahoma,4,18,7,50,0,Kameron McGusty Defensive Rebound.
Northwestern State,Oklahoma,4,20,8,1,1,Jamuni McNeace made Dunk. Assisted by Jordan Shepherd.
Northwestern State,Oklahoma,4,20,8,9,0,Devonte Hall Turnover.
Northwestern State,Oklahoma,4,20,8,9,0,Official TV Timeout
Northwestern State,Oklahoma,4,20,8,17,0,Foul on Tanner Hamilton.
Northwestern State,Oklahoma,4,20,8,17,0,Jamuni McNeace missed Free Throw.
Northwestern State,Oklahoma,4,20,8,17,0,Oklahoma Deadball Team Rebound.
Northwestern State,Oklahoma,4,20,8,17,0,Jamuni McNeace missed Free Throw.
Northwestern State,Oklahoma,4,20,8,17,0,Sabri Thompson Defensive Rebound.
Northwestern State,Oklahoma,4,20,8,29,0,Sabri Thompson missed Three Point Jumper.
Northwestern State,Oklahoma,4,20,8,29,0,Jordan Shepherd Defensive Rebound.
Northwestern State,Oklahoma,4,22,8,35,1,Kameron McGusty made Layup. Assisted by Jordan Shepherd.
Northwestern State,Oklahoma,6,22,9,1,1,Malik Metoyer made Layup. Assisted by Sabri Thompson.
Northwestern State,Oklahoma,6,22,9,26,0,Matt Freeman Turnover.
Northwestern State,Oklahoma,6,22,9,27,0,Sabri Thompson Steal.
Northwestern State,Oklahoma,9,22,9,47,1,Sabri Thompson made Three Point Jumper.
Northwestern State,Oklahoma,9,24,10,10,1,Jamuni McNeace made Layup.
Northwestern State,Oklahoma,9,24,10,19,0,Foul on Jordan Shepherd.
Northwestern State,Oklahoma,9,24,10,34,0,Foul on Matt Freeman.
Northwestern State,Oklahoma,9,24,10,50,0,Malik Metoyer missed Layup.
Northwestern State,Oklahoma,9,24,10,50,0,Malik Metoyer Offensive Rebound.
Northwestern State,Oklahoma,11,24,10,52,1,Malik Metoyer made Two Point Tip Shot.
Northwestern State,Oklahoma,11,27,11,7,1,Darrion Strong-Moore made Three Point Jumper.
Northwestern State,Oklahoma,13,27,11,27,1,Zeek Woodley made Layup. Assisted by Malik Metoyer.
Northwestern State,Oklahoma,13,30,11,46,1,Matt Freeman made Three Point Jumper. Assisted by Darrion Strong-Moore.
Northwestern State,Oklahoma,13,30,11,53,0,Zeek Woodley missed Layup.
Northwestern State,Oklahoma,13,30,11,53,0,Jamuni McNeace Defensive Rebound.
Northwestern State,Oklahoma,13,30,12,5,0,Kameron McGusty missed Three Point Jumper.
Northwestern State,Oklahoma,13,30,12,5,0,Malik Metoyer Defensive Rebound.
Northwestern State,Oklahoma,13,30,12,11,0,Foul on Matt Freeman.
Northwestern State,Oklahoma,13,30,12,11,0,Official TV Timeout
Northwestern State,Oklahoma,13,30,12,23,0,Foul on Jordan Woodard.
Northwestern State,Oklahoma,14,30,12,23,1,Zeek Woodley made Free Throw.
Northwestern State,Oklahoma,15,30,12,23,1,Zeek Woodley made Free Throw.
Northwestern State,Oklahoma,15,30,12,23,0,Darrion Strong-Moore missed Three Point Jumper.
Northwestern State,Oklahoma,15,30,12,23,0,Khadeem Lattin Offensive Rebound.
Northwestern State,Oklahoma,15,30,12,23,0,Khadeem Lattin missed Two Point Tip Shot.
Northwestern State,Oklahoma,15,30,12,47,0,C.J. Cole Offensive Rebound.
Northwestern State,Oklahoma,15,30,12,47,0,Foul on Tra'von Joseph.
Northwestern State,Oklahoma,15,30,12,53,0,C.J. Cole missed Free Throw.
Northwestern State,Oklahoma,15,30,12,53,0,Oklahoma Deadball Team Rebound.
Northwestern State,Oklahoma,15,30,12,56,0,C.J. Cole missed Free Throw.
Northwestern State,Oklahoma,15,30,12,56,0,Khadeem Lattin Offensive Rebound.
Northwestern State,Oklahoma,15,30,12,56,0,Foul on Reggie Kissoonlal.
Northwestern State,Oklahoma,15,31,12,56,1,Khadeem Lattin made Free Throw.
Northwestern State,Oklahoma,15,32,12,56,1,Khadeem Lattin made Free Throw.
Northwestern State,Oklahoma,17,32,13,12,1,Zeek Woodley made Layup. Assisted by Ishmael Lane.
Northwestern State,Oklahoma,17,35,13,20,1,Jordan Woodard made Three Point Jumper.
Northwestern State,Oklahoma,17,35,13,38,0,Josh Boyd Turnover.
Northwestern State,Oklahoma,17,35,13,46,0,Darrion Strong-Moore Turnover.
Northwestern State,Oklahoma,17,35,13,58,0,Foul on Khadeem Lattin.
Northwestern State,Oklahoma,18,35,13,58,1,Ishmael Lane made Free Throw.
Northwestern State,Oklahoma,19,35,13,58,1,Ishmael Lane made Free Throw.
Northwestern State,Oklahoma,19,35,14,13,0,Khadeem Lattin Turnover.
Northwestern State,Oklahoma,19,35,14,13,0,Ishmael Lane Steal.
Northwestern State,Oklahoma,19,35,14,20,0,Devonte Hall Turnover.
Northwestern State,Oklahoma,19,35,14,30,0,Jordan Woodard missed Three Point Jumper.
Northwestern State,Oklahoma,19,35,14,30,0,Northwestern St Defensive Rebound.
Northwestern State,Oklahoma,19,35,14,40,0,Foul on Jordan Woodard.
Northwestern State,Oklahoma,20,35,14,40,1,Devonte Hall made Free Throw.
Northwestern State,Oklahoma,21,35,14,40,1,Devonte Hall made Free Throw.
Northwestern State,Oklahoma,21,35,14,56,0,Rashard Odomes Turnover.
Northwestern State,Oklahoma,21,35,14,56,0,Foul on Rashard Odomes.
Northwestern State,Oklahoma,24,35,15,20,1,Zeek Woodley made Three Point Jumper.
Northwestern State,Oklahoma,24,35,15,35,0,Jordan Shepherd missed Layup.
Northwestern State,Oklahoma,24,35,15,35,0,Khadeem Lattin Offensive Rebound.
Northwestern State,Oklahoma,24,37,15,37,1,Khadeem Lattin made Two Point Tip Shot.
Northwestern State,Oklahoma,26,37,15,53,1,Zeek Woodley made Dunk. Assisted by Ishmael Lane.
Northwestern State,Oklahoma,26,39,16,8,1,Khadeem Lattin made Jumper. Assisted by Rashard Odomes.
Northwestern State,Oklahoma,26,39,16,13,0,Northwestern St  Timeout
Northwestern State,Oklahoma,26,39,16,13,0,Official TV Timeout
Northwestern State,Oklahoma,26,39,16,30,0,Zeek Woodley Turnover.
Northwestern State,Oklahoma,26,39,16,31,0,Jordan Shepherd Steal.
Northwestern State,Oklahoma,26,41,16,34,1,Christian James made Layup.
Northwestern State,Oklahoma,26,41,16,51,0,Sabri Thompson missed Three Point Jumper.
Northwestern State,Oklahoma,26,41,16,51,0,Rashard Odomes Defensive Rebound.
Northwestern State,Oklahoma,26,41,17,4,0,Kristian Doolittle missed Jumper.
Northwestern State,Oklahoma,26,41,17,4,0,Sabri Thompson Defensive Rebound.
Northwestern State,Oklahoma,26,41,17,12,0,Ishmael Lane missed Jumper.
Northwestern State,Oklahoma,26,41,17,12,0,Christian James Defensive Rebound.
Northwestern State,Oklahoma,26,41,17,22,0,Jordan Shepherd missed Jumper.
Northwestern State,Oklahoma,26,41,17,22,0,Khadeem Lattin Offensive Rebound.
Northwestern State,Oklahoma,26,41,17,24,0,Foul on Zeek Woodley.
Northwestern State,Oklahoma,26,41,17,24,0,Khadeem Lattin missed Free Throw.
Northwestern State,Oklahoma,26,41,17,24,0,Oklahoma Deadball Team Rebound.
Northwestern State,Oklahoma,26,42,17,24,1,Khadeem Lattin made Free Throw.
Northwestern State,Oklahoma,26,42,17,52,0,Zeek Woodley missed Jumper.
Northwestern State,Oklahoma,26,42,17,52,0,Bailey Walker Offensive Rebound.
Northwestern State,Oklahoma,26,42,17,57,0,Devonte Hall missed Layup.
Northwestern State,Oklahoma,26,42,17,57,0,Khadeem Lattin Block.
Northwestern State,Oklahoma,26,42,17,58,0,Oklahoma Defensive Rebound.
Northwestern State,Oklahoma,26,44,18,20,1,Christian James made Layup. Assisted by Rashard Odomes.
Northwestern State,Oklahoma,26,44,18,58,0,Tra'von Joseph missed Layup.
Northwestern State,Oklahoma,26,44,18,58,0,Oklahoma Deadball Team Rebound.
Northwestern State,Oklahoma,26,44,19,3,0,Northwestern St  Turnover.
Northwestern State,Oklahoma,26,46,19,20,1,Jordan Shepherd made Jumper.
Northwestern State,Oklahoma,26,46,19,38,0,Devonte Hall missed Jumper.
Northwestern State,Oklahoma,26,46,19,38,0,Jordan Bell Offensive Rebound.
Northwestern State,Oklahoma,26,46,19,39,0,Foul on Christian James.
Northwestern State,Oklahoma,26,46,19,44,0,Jordan Bell missed Free Throw.
Northwestern State,Oklahoma,26,46,19,44,0,Northwestern St Deadball Team Rebound.
Northwestern State,Oklahoma,27,46,19,44,1,Jordan Bell made Free Throw.
Northwestern State,Oklahoma,27,46,20,0,0,End of 1st half
Northwestern State,Oklahoma,27,48,20,9,1,Khadeem Lattin made Jumper.
Northwestern State,Oklahoma,27,48,20,38,0,Ishmael Lane missed Jumper.
Northwestern State,Oklahoma,27,48,20,38,0,Iziahiah Sweeney Offensive Rebound.
Northwestern State,Oklahoma,27,48,20,42,0,Iziahiah Sweeney missed Layup.
Northwestern State,Oklahoma,27,48,20,42,0,Ishmael Lane Offensive Rebound.
Northwestern State,Oklahoma,29,48,20,47,1,Ishmael Lane made Two Point Tip Shot.
Northwestern State,Oklahoma,29,50,21,3,1,Christian James made Jumper.
Northwestern State,Oklahoma,29,50,21,25,0,Ishmael Lane missed Jumper.
Northwestern State,Oklahoma,29,50,21,25,0,Oklahoma Defensive Rebound.
Northwestern State,Oklahoma,29,50,21,43,0,Christian James Turnover.
Northwestern State,Oklahoma,29,50,21,46,0,Devonte Hall Steal.
Northwestern State,Oklahoma,31,50,21,48,1,Ishmael Lane made Layup.
Northwestern State,Oklahoma,31,52,22,13,1,Jordan Woodard made Layup.
Northwestern State,Oklahoma,31,52,22,16,0,Foul on Ishmael Lane.
Northwestern State,Oklahoma,31,53,22,16,1,Jordan Woodard made Free Throw.
Northwestern State,Oklahoma,31,53,22,22,0,Foul on Kristian Doolittle.
Northwestern State,Oklahoma,31,53,22,48,0,Ishmael Lane missed Layup.
Northwestern State,Oklahoma,31,53,22,48,0,Sabri Thompson Offensive Rebound.
Northwestern State,Oklahoma,33,53,22,48,1,Ishmael Lane made Two Point Tip Shot.
Northwestern State,Oklahoma,33,55,22,53,1,Jordan Woodard made Jumper.
Northwestern State,Oklahoma,33,55,23,0,0,Ishmael Lane missed Jumper.
Northwestern State,Oklahoma,33,55,23,20,0,Christian James Defensive Rebound.
Northwestern State,Oklahoma,33,57,23,25,1,Rashard Odomes made Layup.
Northwestern State,Oklahoma,33,57,23,39,0,Foul on Khadeem Lattin.
Northwestern State,Oklahoma,33,57,23,39,0,Iziahiah Sweeney missed Free Throw.
Northwestern State,Oklahoma,33,57,23,39,0,Northwestern St Deadball Team Rebound.
Northwestern State,Oklahoma,34,57,23,39,1,Iziahiah Sweeney made Free Throw.
Northwestern State,Oklahoma,34,60,23,55,1,Matt Freeman made Three Point Jumper. Assisted by Christian James.
Northwestern State,Oklahoma,37,60,24,11,1,Josh Boyd made Three Point Jumper. Assisted by Malik Metoyer.
Northwestern State,Oklahoma,37,62,24,19,1,Khadeem Lattin made Dunk. Assisted by Christian James.
Northwestern State,Oklahoma,37,62,24,35,0,Josh Boyd missed Three Point Jumper.
Northwestern State,Oklahoma,37,62,24,35,0,Jordan Woodard Defensive Rebound.
Northwestern State,Oklahoma,37,62,24,50,0,Jordan Woodard missed Three Point Jumper.
Northwestern State,Oklahoma,37,62,24,50,0,Christian James Offensive Rebound.
Northwestern State,Oklahoma,37,62,24,53,0,Foul on Bailey Walker.
Northwestern State,Oklahoma,37,62,24,53,0,Official TV Timeout
Northwestern State,Oklahoma,37,62,24,53,0,Rashard Odomes missed Free Throw.
Northwestern State,Oklahoma,37,62,24,53,0,Oklahoma Deadball Team Rebound.
Northwestern State,Oklahoma,37,62,24,53,0,Rashard Odomes missed Free Throw.
Northwestern State,Oklahoma,37,62,24,53,0,Reggie Kissoonlal Defensive Rebound.
Northwestern State,Oklahoma,37,62,25,10,0,Reggie Kissoonlal missed Three Point Jumper.
Northwestern State,Oklahoma,37,62,25,10,0,Sabri Thompson Offensive Rebound.
Northwestern State,Oklahoma,37,62,25,16,0,Sabri Thompson missed Layup.
Northwestern State,Oklahoma,37,62,25,16,0,Northwestern St Offensive Rebound.
Northwestern State,Oklahoma,37,62,25,18,0,Tra'von Joseph missed Layup.
Northwestern State,Oklahoma,37,62,25,18,0,Tra'von Joseph Offensive Rebound.
Northwestern State,Oklahoma,39,62,25,22,1,Tra'von Joseph made Layup.
Northwestern State,Oklahoma,39,62,25,35,0,Christian James Turnover.
Northwestern State,Oklahoma,41,62,25,46,1,Malik Metoyer made Layup.
Northwestern State,Oklahoma,41,62,25,57,0,Jordan Woodard missed Layup.
Northwestern State,Oklahoma,41,62,25,57,0,Khadeem Lattin Offensive Rebound.
Northwestern State,Oklahoma,41,64,25,59,1,Khadeem Lattin made Dunk.
Northwestern State,Oklahoma,41,64,26,17,0,Bailey Walker Turnover.
Northwestern State,Oklahoma,41,64,26,18,0,Rashard Odomes Steal.
Northwestern State,Oklahoma,41,64,26,19,0,Foul on Zeek Woodley.
Northwestern State,Oklahoma,41,64,26,21,0,Kameron McGusty Turnover.
Northwestern State,Oklahoma,41,64,26,34,0,Foul on Jordan Shepherd.
Northwestern State,Oklahoma,42,64,26,34,1,Zeek Woodley made Free Throw.
Northwestern State,Oklahoma,43,64,26,34,1,Zeek Woodley made Free Throw.
Northwestern State,Oklahoma,43,64,26,50,0,Jamuni McNeace missed Jumper.
Northwestern State,Oklahoma,43,64,26,50,0,Malik Metoyer Defensive Rebound.
Northwestern State,Oklahoma,43,64,27,6,0,Sabri Thompson missed Three Point Jumper.
Northwestern State,Oklahoma,43,64,27,6,0,Jamuni McNeace Defensive Rebound.
Northwestern State,Oklahoma,43,67,27,14,1,Matt Freeman made Three Point Jumper. Assisted by Darrion Strong-Moore.
Northwestern State,Oklahoma,43,67,27,24,0,Sabri Thompson missed Layup.
Northwestern State,Oklahoma,43,67,27,24,0,Matt Freeman Defensive Rebound.
Northwestern State,Oklahoma,43,67,27,43,0,Jamuni McNeace missed Jumper.
Northwestern State,Oklahoma,43,67,27,43,0,Tra'von Joseph Defensive Rebound.
Northwestern State,Oklahoma,45,67,28,4,1,Zeek Woodley made Jumper.
Northwestern State,Oklahoma,45,67,28,19,0,Darrion Strong-Moore Turnover.
Northwestern State,Oklahoma,45,67,28,20,0,Zeek Woodley Steal.
Northwestern State,Oklahoma,45,67,28,24,0,Foul on Jamuni McNeace.
Northwestern State,Oklahoma,45,67,28,24,0,Official TV Timeout
Northwestern State,Oklahoma,45,67,28,24,0,Iziahiah Sweeney missed Free Throw.
Northwestern State,Oklahoma,45,67,28,24,0,Northwestern St Deadball Team Rebound.
Northwestern State,Oklahoma,45,67,28,24,0,Iziahiah Sweeney missed Free Throw.
Northwestern State,Oklahoma,45,67,28,24,0,Jamuni McNeace Defensive Rebound.
Northwestern State,Oklahoma,45,67,28,39,0,Jordan Shepherd Turnover.
Northwestern State,Oklahoma,45,67,28,40,0,Bailey Walker Steal.
Northwestern State,Oklahoma,47,67,28,43,1,Zeek Woodley made Layup. Assisted by Malik Metoyer.
Northwestern State,Oklahoma,47,69,28,56,1,Matt Freeman made Layup. Assisted by Darrion Strong-Moore.
Northwestern State,Oklahoma,47,69,29,29,0,Iziahiah Sweeney missed Jumper.
Northwestern State,Oklahoma,47,69,29,29,0,Jamuni McNeace Block.
Northwestern State,Oklahoma,47,69,29,29,0,Oklahoma Deadball Team Rebound.
Northwestern State,Oklahoma,47,69,29,29,0,Northwestern St  Turnover.
Northwestern State,Oklahoma,47,71,29,44,1,Darrion Strong-Moore made Layup.
Northwestern State,Oklahoma,50,71,30,10,1,Jordan Bell made Three Point Jumper. Assisted by Devonte Hall.
Northwestern State,Oklahoma,50,71,30,29,0,Foul on Darrion Strong-Moore.
Northwestern State,Oklahoma,50,71,30,32,0,Darrion Strong-Moore Turnover.
Northwestern State,Oklahoma,50,71,30,37,0,Sabri Thompson Turnover.
Northwestern State,Oklahoma,50,71,30,37,0,Matt Freeman Steal.
Northwestern State,Oklahoma,50,73,30,37,1,Matt Freeman made Dunk.
Northwestern State,Oklahoma,50,73,30,59,0,Ishmael Lane Turnover.
Northwestern State,Oklahoma,50,73,31,20,0,Foul on Josh Boyd.
Northwestern State,Oklahoma,50,73,31,20,0,Kameron McGusty missed Free Throw.
Northwestern State,Oklahoma,50,73,31,20,0,Oklahoma Deadball Team Rebound.
Northwestern State,Oklahoma,50,74,31,20,1,Kameron McGusty made Free Throw.
Northwestern State,Oklahoma,50,74,31,23,0,Foul on Jordan Shepherd.
Northwestern State,Oklahoma,50,74,31,28,0,Foul on Ishmael Lane.
Northwestern State,Oklahoma,50,74,31,28,0,Ishmael Lane Turnover.
Northwestern State,Oklahoma,50,74,31,42,0,Khadeem Lattin Turnover.
Northwestern State,Oklahoma,50,74,32,3,0,Ishmael Lane missed Jumper.
Northwestern State,Oklahoma,50,74,32,3,0,Khadeem Lattin Defensive Rebound.
Northwestern State,Oklahoma,50,74,32,16,0,Kameron McGusty missed Layup.
Northwestern State,Oklahoma,50,74,32,16,0,C.J. Cole Offensive Rebound.
Northwestern State,Oklahoma,50,77,32,20,1,Jordan Shepherd made Three Point Jumper. Assisted by C.J. Cole.
Northwestern State,Oklahoma,50,77,32,36,0,Josh Boyd Turnover.
Northwestern State,Oklahoma,50,77,32,37,0,Jordan Shepherd Steal.
Northwestern State,Oklahoma,50,77,32,41,0,Foul on Ishmael Lane.
Northwestern State,Oklahoma,50,77,32,41,0,Official TV Timeout
Northwestern State,Oklahoma,50,78,32,41,1,Jordan Shepherd made Free Throw.
Northwestern State,Oklahoma,50,79,32,41,1,Jordan Shepherd made Free Throw.
Northwestern State,Oklahoma,50,79,33,6,0,Iziahiah Sweeney missed Layup.
Northwestern State,Oklahoma,50,79,33,6,0,Kristian Doolittle Defensive Rebound.
Northwestern State,Oklahoma,50,82,33,15,1,Christian James made Three Point Jumper. Assisted by Jordan Woodard.
Northwestern State,Oklahoma,50,82,33,38,0,Foul on Khadeem Lattin.
Northwestern State,Oklahoma,51,82,33,38,1,Iziahiah Sweeney made Free Throw.
Northwestern State,Oklahoma,52,82,33,38,1,Iziahiah Sweeney made Free Throw.
Northwestern State,Oklahoma,52,82,33,53,0,Khadeem Lattin missed Jumper.
Northwestern State,Oklahoma,52,82,33,53,0,Tra'von Joseph Defensive Rebound.
Northwestern State,Oklahoma,52,82,34,17,0,Bailey Walker missed Three Point Jumper.
Northwestern State,Oklahoma,52,82,34,17,0,Kristian Doolittle Defensive Rebound.
Northwestern State,Oklahoma,52,82,34,26,0,Jordan Woodard missed Jumper.
Northwestern State,Oklahoma,52,82,34,26,0,Jordan Woodard Offensive Rebound.
Northwestern State,Oklahoma,52,82,34,29,0,Jordan Woodard missed Layup.
Northwestern State,Oklahoma,52,82,34,29,0,Khadeem Lattin Offensive Rebound.
Northwestern State,Oklahoma,52,82,34,32,0,Foul on Malik Metoyer.
Northwestern State,Oklahoma,52,83,34,32,1,Khadeem Lattin made Free Throw.
Northwestern State,Oklahoma,52,84,34,32,1,Khadeem Lattin made Free Throw.
Northwestern State,Oklahoma,52,84,34,40,0,Zeek Woodley missed Three Point Jumper.
Northwestern State,Oklahoma,52,84,34,40,0,Rashard Odomes Defensive Rebound.
Northwestern State,Oklahoma,52,86,34,45,1,Jordan Woodard made Layup. Assisted by Rashard Odomes.
Northwestern State,Oklahoma,54,86,34,50,1,Malik Metoyer made Dunk. Assisted by Iziahiah Sweeney.
Northwestern State,Oklahoma,54,88,34,54,1,Rashard Odomes made Dunk. Assisted by Jordan Woodard.
Northwestern State,Oklahoma,54,88,35,16,0,Zeek Woodley missed Layup.
Northwestern State,Oklahoma,54,88,35,16,0,Northwestern St Deadball Team Rebound.
Northwestern State,Oklahoma,54,88,35,40,0,Sabri Thompson missed Jumper.
Northwestern State,Oklahoma,54,88,35,40,0,Malik Metoyer Offensive Rebound.
Northwestern State,Oklahoma,54,88,35,41,0,Foul on Jamuni McNeace.
Northwestern State,Oklahoma,55,88,35,41,1,Malik Metoyer made Free Throw.
Northwestern State,Oklahoma,56,88,35,41,1,Malik Metoyer made Free Throw.
Northwestern State,Oklahoma,56,90,36,0,1,Darrion Strong-Moore made Layup.
Northwestern State,Oklahoma,56,90,36,13,0,Foul on Matt Freeman.
Northwestern State,Oklahoma,56,90,36,13,0,Official TV Timeout
Northwestern State,Oklahoma,56,90,36,15,0,Sabri Thompson missed Free Throw.
Northwestern State,Oklahoma,56,90,36,15,0,Jamuni McNeace Defensive Rebound.
Northwestern State,Oklahoma,56,92,36,15,1,Darrion Strong-Moore made Layup.
Northwestern State,Oklahoma,56,92,36,19,0,Reggie Kissoonlal missed Jumper.
Northwestern State,Oklahoma,56,92,36,19,0,Jamuni McNeace Block.
Northwestern State,Oklahoma,56,92,36,23,0,Northwestern St Offensive Rebound.
Northwestern State,Oklahoma,56,92,36,30,0,Ishmael Lane missed Jumper.
Northwestern State,Oklahoma,56,92,36,30,0,Jamuni McNeace Defensive Rebound.
Northwestern State,Oklahoma,56,92,36,59,0,Jordan Shepherd missed Three Point Jumper.
Northwestern State,Oklahoma,56,92,36,59,0,Jamuni McNeace Offensive Rebound.
Northwestern State,Oklahoma,56,94,37,3,1,Jamuni McNeace made Layup.
Northwestern State,Oklahoma,56,94,37,31,0,Josh Boyd missed Layup.
Northwestern State,Oklahoma,56,94,37,31,0,Jamuni McNeace Block.
Northwestern State,Oklahoma,56,94,37,32,0,Northwestern St Offensive Rebound.
Northwestern State,Oklahoma,56,94,37,47,0,Ishmael Lane missed Layup.
Northwestern State,Oklahoma,56,94,37,47,0,Marshall Thorpe Block.
Northwestern State,Oklahoma,56,94,37,47,0,Daniel Harper Defensive Rebound.
Northwestern State,Oklahoma,56,96,37,49,1,Matt Freeman made Dunk. Assisted by Daniel Harper.
Northwestern State,Oklahoma,56,96,37,55,0,Sabri Thompson missed Jumper.
Northwestern State,Oklahoma,56,96,37,55,0,Jordan Shepherd Block.
Northwestern State,Oklahoma,56,96,38,7,0,Sabri Thompson Offensive Rebound.
Northwestern State,Oklahoma,56,96,38,7,0,Foul on Marshall Thorpe.
Northwestern State,Oklahoma,56,96,38,7,0,Ishmael Lane missed Free Throw.
Northwestern State,Oklahoma,56,96,38,7,0,Northwestern St Deadball Team Rebound.
