Northwestern State,Oklahoma,57,96,38,7,1,Ishmael Lane made Free Throw.
Northwestern State,Oklahoma,57,96,38,18,0,Matt Freeman missed Three Point Jumper.
Northwestern State,Oklahoma,57,96,38,18,0,Oklahoma Offensive Rebound.
Northwestern State,Oklahoma,57,96,38,26,0,Daniel Harper Turnover.
Northwestern State,Oklahoma,57,96,38,28,0,Josh Boyd Steal.
Northwestern State,Oklahoma,59,96,38,31,1,Sabri Thompson made Layup.
Northwestern State,Oklahoma,59,96,38,45,0,Foul on Sabri Thompson.
Northwestern State,Oklahoma,59,96,38,45,0,Jordan Shepherd missed Free Throw.
Northwestern State,Oklahoma,59,96,38,45,0,Oklahoma Deadball Team Rebound.
Northwestern State,Oklahoma,59,97,38,45,1,Jordan Shepherd made Free Throw.
Northwestern State,Oklahoma,59,97,38,53,0,Foul on Marshall Thorpe.
Northwestern State,Oklahoma,59,97,38,53,0,Tanner Hamilton missed Free Throw.
Northwestern State,Oklahoma,59,97,38,53,0,Northwestern St Deadball Team Rebound.
Northwestern State,Oklahoma,59,97,38,53,0,Tanner Hamilton missed Free Throw.
Northwestern State,Oklahoma,59,97,38,53,0,Oklahoma Defensive Rebound.
Northwestern State,Oklahoma,59,97,39,23,0,Daniel Harper missed Layup.
Northwestern State,Oklahoma,59,97,39,23,0,Malik Metoyer Defensive Rebound.
Northwestern State,Oklahoma,61,97,39,46,1,Josh Boyd made Jumper.
Northwestern State,Oklahoma,59,97,40,0,0,End of Game
