Away Team,Home Team,Away Score,Home Score,Minute,Second,isScoringPosession,Desc.
Arizona Christian,Southern Utah,0,0,0,20,0,Chris Nsenki missed Jumper.
Arizona Christian,Southern Utah,0,0,0,20,0,Jayson Cheesman Offensive Rebound.
Arizona Christian,Southern Utah,0,2,0,24,1,Jayson Cheesman made Layup.
Arizona Christian,Southern Utah,0,2,0,37,0,Foul on Jaren Jeffery.
Arizona Christian,Southern Utah,0,2,0,44,0,Talib Uqdah missed Three Point Jumper.
Arizona Christian,Southern Utah,0,2,0,44,0,A.J. Hess Defensive Rebound.
Arizona Christian,Southern Utah,0,2,0,58,0,A.J. Hess missed Three Point Jumper.
Arizona Christian,Southern Utah,0,2,0,58,0,Talib Uqdah Defensive Rebound.
Arizona Christian,Southern Utah,0,2,1,15,0,Foul on Trey Kennedy.
Arizona Christian,Southern Utah,0,2,1,15,0,Jackson Helms missed Free Throw.
Arizona Christian,Southern Utah,0,2,1,15,0,Arizona Christian Deadball Team Rebound.
Arizona Christian,Southern Utah,1,2,1,15,1,Jackson Helms made Free Throw.
Arizona Christian,Southern Utah,1,2,1,28,0,Jaren Jeffery Turnover.
Arizona Christian,Southern Utah,1,2,1,28,0,Foul on Jaren Jeffery.
Arizona Christian,Southern Utah,1,2,1,37,0,Brandon Newman missed Three Point Jumper.
Arizona Christian,Southern Utah,1,2,1,37,0,Brandon Newman Offensive Rebound.
Arizona Christian,Southern Utah,1,2,1,42,0,Jason Timpf Turnover.
Arizona Christian,Southern Utah,1,4,1,55,1,Casey Oliverson made Layup.
Arizona Christian,Southern Utah,1,4,2,11,0,Jackson Helms missed Layup.
Arizona Christian,Southern Utah,1,4,2,11,0,Jayson Cheesman Defensive Rebound.
Arizona Christian,Southern Utah,1,4,2,16,0,Chris Nsenki missed Three Point Jumper.
Arizona Christian,Southern Utah,1,4,2,16,0,Brandon Newman Defensive Rebound.
Arizona Christian,Southern Utah,1,4,2,24,0,Jason Timpf missed Three Point Jumper.
Arizona Christian,Southern Utah,1,4,2,24,0,Arizona Christian Offensive Rebound.
Arizona Christian,Southern Utah,1,4,2,47,0,Foul on Chris Nsenki.
Arizona Christian,Southern Utah,2,4,2,47,1,Mike Navar made Free Throw.
Arizona Christian,Southern Utah,3,4,2,47,1,Mike Navar made Free Throw.
Arizona Christian,Southern Utah,3,4,3,9,0,Chris Nsenki missed Jumper.
Arizona Christian,Southern Utah,3,4,3,9,0,Talib Uqdah Defensive Rebound.
Arizona Christian,Southern Utah,3,4,3,16,0,Talib Uqdah missed Three Point Jumper.
Arizona Christian,Southern Utah,3,4,3,16,0,Casey Oliverson Defensive Rebound.
Arizona Christian,Southern Utah,3,4,3,52,0,Trey Kennedy missed Jumper.
Arizona Christian,Southern Utah,3,4,3,52,0,Race Parsons Offensive Rebound.
Arizona Christian,Southern Utah,3,4,3,56,0,Foul on Jordan Block.
Arizona Christian,Southern Utah,3,4,4,7,0,Trey Kennedy missed Jumper.
Arizona Christian,Southern Utah,3,4,4,7,0,Jordan Block Defensive Rebound.
Arizona Christian,Southern Utah,5,4,4,22,1,Talib Uqdah made Jumper.
Arizona Christian,Southern Utah,5,4,4,51,0,Foul on Jordan Block.
Arizona Christian,Southern Utah,5,4,4,51,0,Official TV Timeout
Arizona Christian,Southern Utah,5,5,4,51,1,Race Parsons made Free Throw.
Arizona Christian,Southern Utah,5,6,4,51,1,Race Parsons made Free Throw.
Arizona Christian,Southern Utah,5,6,5,2,0,Mason Jones Turnover.
Arizona Christian,Southern Utah,5,6,5,4,0,Race Parsons Steal.
Arizona Christian,Southern Utah,5,6,5,6,0,Race Parsons missed Three Point Jumper.
Arizona Christian,Southern Utah,5,6,5,6,0,Mike Navar Defensive Rebound.
Arizona Christian,Southern Utah,5,6,5,13,0,Mason Jones missed Layup.
Arizona Christian,Southern Utah,5,6,5,13,0,Jordan Block Offensive Rebound.
Arizona Christian,Southern Utah,7,6,5,19,1,Jordan Block made Layup.
Arizona Christian,Southern Utah,7,6,5,29,0,John Marshall Turnover.
Arizona Christian,Southern Utah,7,6,5,30,0,Jordan Block Steal.
Arizona Christian,Southern Utah,7,6,5,32,0,Foul on John Marshall.
Arizona Christian,Southern Utah,8,6,5,32,1,Jordan Block made Free Throw.
Arizona Christian,Southern Utah,9,6,5,32,1,Jordan Block made Free Throw.
Arizona Christian,Southern Utah,9,6,5,47,0,Casey Oliverson Turnover.
Arizona Christian,Southern Utah,11,6,5,58,1,Daniel Cornelius made Jumper. Assisted by Rod Hudson.
Arizona Christian,Southern Utah,11,6,6,13,0,Jayson Cheesman missed Layup.
Arizona Christian,Southern Utah,11,6,6,13,0,Mateus Oliveira Block.
Arizona Christian,Southern Utah,11,6,6,16,0,McKay Anderson Offensive Rebound.
Arizona Christian,Southern Utah,11,6,6,28,0,Cal Hanks missed Jumper.
Arizona Christian,Southern Utah,11,6,6,28,0,Jason Timpf Defensive Rebound.
Arizona Christian,Southern Utah,11,6,6,49,0,Jason Timpf missed Three Point Jumper.
Arizona Christian,Southern Utah,11,6,6,49,0,McKay Anderson Defensive Rebound.
Arizona Christian,Southern Utah,11,8,7,0,1,Juwan Major made Jumper.
Arizona Christian,Southern Utah,11,8,7,15,0,Foul on Cal Hanks.
Arizona Christian,Southern Utah,12,8,7,15,1,Jason Timpf made Free Throw.
Arizona Christian,Southern Utah,12,8,7,15,0,Jason Timpf missed Free Throw.
Arizona Christian,Southern Utah,12,8,7,15,0,McKay Anderson Defensive Rebound.
Arizona Christian,Southern Utah,12,8,7,29,0,McKay Anderson missed Jumper.
Arizona Christian,Southern Utah,12,8,7,29,0,Cal Hanks Offensive Rebound.
Arizona Christian,Southern Utah,12,8,7,43,0,Cal Hanks missed Jumper.
Arizona Christian,Southern Utah,12,8,7,43,0,Mateus Oliveira Defensive Rebound.
Arizona Christian,Southern Utah,12,8,7,55,0,Foul on Juwan Major.
Arizona Christian,Southern Utah,13,8,7,55,1,Brandon Newman made Free Throw.
Arizona Christian,Southern Utah,14,8,7,55,1,Brandon Newman made Free Throw.
Arizona Christian,Southern Utah,14,8,8,11,0,Trey Kennedy Turnover.
Arizona Christian,Southern Utah,14,8,8,12,0,Jackson Helms Steal.
Arizona Christian,Southern Utah,14,8,8,14,0,Jason Timpf Turnover.
Arizona Christian,Southern Utah,14,8,8,16,0,Trey Kennedy Steal.
Arizona Christian,Southern Utah,14,8,8,24,0,Foul on Jason Timpf.
Arizona Christian,Southern Utah,14,8,8,24,0,Official TV Timeout
Arizona Christian,Southern Utah,14,9,8,24,1,Juwan Major made Free Throw.
Arizona Christian,Southern Utah,14,9,8,24,0,Juwan Major missed Free Throw.
Arizona Christian,Southern Utah,14,9,8,24,0,Talib Uqdah Defensive Rebound.
Arizona Christian,Southern Utah,16,9,8,52,1,Daniel Cornelius made Jumper. Assisted by Brandon Newman.
Arizona Christian,Southern Utah,16,12,9,11,1,Trey Kennedy made Three Point Jumper. Assisted by Juwan Major.
Arizona Christian,Southern Utah,16,12,9,29,0,Brandon Newman Turnover.
Arizona Christian,Southern Utah,16,12,9,31,0,Juwan Major Steal.
Arizona Christian,Southern Utah,16,12,9,34,0,Foul on Jackson Helms.
Arizona Christian,Southern Utah,16,12,9,43,0,Jayson Cheesman missed Layup.
Arizona Christian,Southern Utah,16,12,9,43,0,Rod Hudson Defensive Rebound.
Arizona Christian,Southern Utah,18,12,9,54,1,Jackson Helms made Layup. Assisted by Brandon Newman.
Arizona Christian,Southern Utah,18,12,10,8,0,Foul on Talib Uqdah.
Arizona Christian,Southern Utah,18,12,10,19,0,Foul on Jackson Helms.
Arizona Christian,Southern Utah,18,12,10,33,0,Jayson Cheesman missed Jumper.
Arizona Christian,Southern Utah,18,12,10,33,0,Jayson Cheesman Offensive Rebound.
Arizona Christian,Southern Utah,18,14,10,36,1,Jayson Cheesman made Layup.
Arizona Christian,Southern Utah,20,14,10,42,1,Jason Timpf made Dunk. Assisted by Talib Uqdah.
Arizona Christian,Southern Utah,20,14,10,45,0,Southern Utah  Timeout
Arizona Christian,Southern Utah,20,14,11,7,0,A.J. Hess missed Three Point Jumper.
Arizona Christian,Southern Utah,20,14,11,7,0,Jaren Jeffery Offensive Rebound.
Arizona Christian,Southern Utah,20,14,11,11,0,Jaren Jeffery missed Layup.
Arizona Christian,Southern Utah,20,14,11,11,0,Jason Timpf Defensive Rebound.
Arizona Christian,Southern Utah,20,14,11,18,0,Jason Timpf missed Layup.
Arizona Christian,Southern Utah,20,14,11,18,0,A.J. Hess Defensive Rebound.
Arizona Christian,Southern Utah,20,16,11,25,1,A.J. Hess made Jumper.
Arizona Christian,Southern Utah,20,16,11,25,0,Foul on Mateus Oliveira.
Arizona Christian,Southern Utah,20,17,11,25,1,A.J. Hess made Free Throw.
Arizona Christian,Southern Utah,20,17,11,39,0,Foul on Jaren Jeffery.
Arizona Christian,Southern Utah,20,17,11,39,0,Mason Jones missed Free Throw.
Arizona Christian,Southern Utah,20,17,11,39,0,A.J. Hess Defensive Rebound.
Arizona Christian,Southern Utah,20,20,11,42,1,Chris Nsenki made Three Point Jumper. Assisted by Trey Kennedy.
Arizona Christian,Southern Utah,20,20,11,49,0,Arizona Christian  Timeout
Arizona Christian,Southern Utah,20,20,12,0,0,Foul on Casey Oliverson.
Arizona Christian,Southern Utah,21,20,12,0,1,Jason Timpf made Free Throw.
Arizona Christian,Southern Utah,22,20,12,0,1,Jason Timpf made Free Throw.
Arizona Christian,Southern Utah,22,20,12,7,0,Trey Kennedy missed Three Point Jumper.
Arizona Christian,Southern Utah,22,20,12,7,0,Arizona Christian Defensive Rebound.
Arizona Christian,Southern Utah,22,20,12,12,0,Official TV Timeout
Arizona Christian,Southern Utah,22,20,12,21,0,Jason Timpf Turnover.
Arizona Christian,Southern Utah,22,20,12,23,0,Chris Nsenki Steal.
Arizona Christian,Southern Utah,22,20,12,32,0,Race Parsons missed Three Point Jumper.
Arizona Christian,Southern Utah,22,20,12,32,0,Mateus Oliveira Defensive Rebound.
Arizona Christian,Southern Utah,22,20,12,49,0,Talib Uqdah Turnover.
Arizona Christian,Southern Utah,22,20,12,51,0,Casey Oliverson Steal.
Arizona Christian,Southern Utah,22,20,12,56,0,Race Parsons Turnover.
Arizona Christian,Southern Utah,25,20,13,0,1,Talib Uqdah made Three Point Jumper.
Arizona Christian,Southern Utah,25,20,13,3,0,Foul on Chris Nsenki.
Arizona Christian,Southern Utah,26,20,13,3,1,Talib Uqdah made Free Throw.
Arizona Christian,Southern Utah,26,20,13,15,0,Casey Oliverson Turnover.
Arizona Christian,Southern Utah,26,20,13,33,0,Mateus Oliveira missed Jumper.
Arizona Christian,Southern Utah,26,20,13,33,0,Cal Hanks Defensive Rebound.
Arizona Christian,Southern Utah,26,20,13,47,0,Chris Nsenki missed Jumper.
Arizona Christian,Southern Utah,26,20,13,47,0,Race Parsons Offensive Rebound.
Arizona Christian,Southern Utah,26,20,14,7,0,A.J. Hess missed Jumper.
Arizona Christian,Southern Utah,26,20,14,7,0,Mateus Oliveira Block.
Arizona Christian,Southern Utah,26,20,14,9,0,Brandon Newman Defensive Rebound.
Arizona Christian,Southern Utah,26,20,14,13,0,Foul on A.J. Hess.
Arizona Christian,Southern Utah,27,20,14,13,1,Talib Uqdah made Free Throw.
Arizona Christian,Southern Utah,28,20,14,13,1,Talib Uqdah made Free Throw.
Arizona Christian,Southern Utah,28,22,14,28,1,Jayson Cheesman made Dunk.
Arizona Christian,Southern Utah,28,22,14,47,0,Rod Hudson missed Layup.
Arizona Christian,Southern Utah,28,22,14,47,0,Jayson Cheesman Defensive Rebound.
Arizona Christian,Southern Utah,28,22,14,58,0,Juwan Major missed Three Point Jumper.
Arizona Christian,Southern Utah,28,22,14,58,0,Arizona Christian Defensive Rebound.
Arizona Christian,Southern Utah,28,22,15,21,0,Brandon Newman missed Jumper.
Arizona Christian,Southern Utah,28,22,15,21,0,Martin Kim Offensive Rebound.
Arizona Christian,Southern Utah,31,22,15,45,1,Brandon Newman made Three Point Jumper. Assisted by Martin Kim.
Arizona Christian,Southern Utah,31,24,16,4,1,Cal Hanks made Jumper. Assisted by Jayson Cheesman.
Arizona Christian,Southern Utah,31,24,16,22,0,Rod Hudson missed Layup.
Arizona Christian,Southern Utah,31,24,16,22,0,Daniel Cornelius Offensive Rebound.
Arizona Christian,Southern Utah,31,24,16,25,0,Daniel Cornelius missed Layup.
Arizona Christian,Southern Utah,31,24,16,25,0,Daniel Cornelius Offensive Rebound.
Arizona Christian,Southern Utah,33,24,16,32,1,Daniel Cornelius made Two Point Tip Shot.
Arizona Christian,Southern Utah,33,27,16,44,1,Juwan Major made Three Point Jumper.
Arizona Christian,Southern Utah,36,27,17,4,1,Rod Hudson made Three Point Jumper. Assisted by Mateus Oliveira.
Arizona Christian,Southern Utah,36,27,17,27,0,Juwan Major Turnover.
Arizona Christian,Southern Utah,36,27,17,28,0,Rod Hudson Steal.
Arizona Christian,Southern Utah,36,27,17,32,0,Brandon Newman missed Layup.
Arizona Christian,Southern Utah,36,27,17,32,0,Southern Utah Defensive Rebound.
Arizona Christian,Southern Utah,36,27,17,34,0,Official TV Timeout
Arizona Christian,Southern Utah,36,29,17,53,1,Cal Hanks made Layup. Assisted by Trey Kennedy.
Arizona Christian,Southern Utah,38,29,18,8,1,Talib Uqdah made Jumper.
Arizona Christian,Southern Utah,38,29,18,27,0,McKay Anderson missed Layup.
Arizona Christian,Southern Utah,38,29,18,27,0,Casey Oliverson Offensive Rebound.
Arizona Christian,Southern Utah,38,31,18,30,1,Casey Oliverson made Layup.
Arizona Christian,Southern Utah,38,31,18,39,0,Talib Uqdah missed Three Point Jumper.
Arizona Christian,Southern Utah,38,31,18,39,0,McKay Anderson Defensive Rebound.
Arizona Christian,Southern Utah,38,33,18,53,1,McKay Anderson made Layup.
Arizona Christian,Southern Utah,38,33,19,0,0,Mason Jones Turnover.
Arizona Christian,Southern Utah,38,33,19,14,0,Chris Nsenki missed Three Point Jumper.
Arizona Christian,Southern Utah,38,33,19,14,0,Paul King Defensive Rebound.
Arizona Christian,Southern Utah,40,33,19,26,1,Mateus Oliveira made Layup. Assisted by Talib Uqdah.
Arizona Christian,Southern Utah,40,35,19,56,1,Cal Hanks made Jumper. Assisted by Trey Kennedy.
Arizona Christian,Southern Utah,40,35,20,0,0,End of 1st half
Arizona Christian,Southern Utah,40,35,20,29,0,Jason Timpf Turnover.
Arizona Christian,Southern Utah,40,35,20,31,0,Jaren Jeffery Steal.
Arizona Christian,Southern Utah,40,37,20,38,1,Jayson Cheesman made Layup. Assisted by Trey Kennedy.
Arizona Christian,Southern Utah,40,37,20,56,0,Talib Uqdah Turnover.
Arizona Christian,Southern Utah,40,39,21,15,1,Chris Nsenki made Layup. Assisted by Jayson Cheesman.
Arizona Christian,Southern Utah,42,39,21,25,1,Mike Navar made Jumper. Assisted by Talib Uqdah.
Arizona Christian,Southern Utah,42,39,21,32,0,Foul on Jaren Jeffery.
Arizona Christian,Southern Utah,42,39,21,32,0,Mike Navar missed Layup.
Arizona Christian,Southern Utah,42,39,21,32,0,Cal Hanks Block.
Arizona Christian,Southern Utah,42,39,21,32,0,Cal Hanks Defensive Rebound.
Arizona Christian,Southern Utah,42,39,21,43,0,Cal Hanks missed Layup.
Arizona Christian,Southern Utah,42,39,21,43,0,Talib Uqdah Defensive Rebound.
Arizona Christian,Southern Utah,42,39,21,52,0,Foul on A.J. Hess.
Arizona Christian,Southern Utah,42,39,21,52,0,Brandon Newman missed Free Throw.
Arizona Christian,Southern Utah,42,39,21,52,0,Arizona Christian Deadball Team Rebound.
Arizona Christian,Southern Utah,42,39,21,52,0,Brandon Newman missed Free Throw.
Arizona Christian,Southern Utah,42,39,21,52,0,A.J. Hess Defensive Rebound.
Arizona Christian,Southern Utah,42,41,22,7,1,Chris Nsenki made Layup. Assisted by Jayson Cheesman.
Arizona Christian,Southern Utah,42,41,22,21,0,Jason Timpf missed Three Point Jumper.
Arizona Christian,Southern Utah,42,41,22,21,0,Jason Timpf Offensive Rebound.
Arizona Christian,Southern Utah,42,41,22,28,0,Foul on Cal Hanks.
Arizona Christian,Southern Utah,42,41,22,30,0,Foul on Chris Nsenki.
Arizona Christian,Southern Utah,42,41,22,31,0,Jackson Helms Turnover.
Arizona Christian,Southern Utah,42,41,22,31,0,Foul on Jackson Helms.
Arizona Christian,Southern Utah,42,41,23,5,0,Trey Kennedy missed Jumper.
Arizona Christian,Southern Utah,42,41,23,5,0,Cal Hanks Offensive Rebound.
Arizona Christian,Southern Utah,42,43,23,8,1,Cal Hanks made Layup.
Arizona Christian,Southern Utah,42,43,23,8,0,Foul on Jason Timpf.
Arizona Christian,Southern Utah,42,43,23,8,0,Cal Hanks missed Free Throw.
Arizona Christian,Southern Utah,42,43,23,8,0,Jordan Block Defensive Rebound.
Arizona Christian,Southern Utah,42,43,23,15,0,Foul on Juwan Major.
Arizona Christian,Southern Utah,42,43,23,20,0,Talib Uqdah missed Three Point Jumper.
Arizona Christian,Southern Utah,42,43,23,20,0,Southern Utah Defensive Rebound.
Arizona Christian,Southern Utah,42,43,23,37,0,Cal Hanks Turnover.
Arizona Christian,Southern Utah,44,43,23,51,1,Mateus Oliveira made Jumper. Assisted by Mike Navar.
Arizona Christian,Southern Utah,44,43,24,27,0,Trey Kennedy Turnover.
Arizona Christian,Southern Utah,44,43,24,28,0,Mateus Oliveira Steal.
Arizona Christian,Southern Utah,44,43,24,37,0,Jordan Block missed Layup.
Arizona Christian,Southern Utah,44,43,24,37,0,Trey Kennedy Block.
Arizona Christian,Southern Utah,44,43,24,39,0,Cal Hanks Defensive Rebound.
Arizona Christian,Southern Utah,44,43,24,45,0,Cal Hanks Turnover.
Arizona Christian,Southern Utah,44,43,24,45,0,Official TV Timeout
Arizona Christian,Southern Utah,46,43,25,3,1,Mateus Oliveira made Layup. Assisted by Daniel Cornelius.
Arizona Christian,Southern Utah,46,43,25,16,0,Juwan Major missed Jumper.
Arizona Christian,Southern Utah,46,43,25,16,0,Daniel Cornelius Defensive Rebound.
Arizona Christian,Southern Utah,46,43,25,27,0,Jordan Block Turnover.
Arizona Christian,Southern Utah,46,43,25,28,0,John Marshall Steal.
Arizona Christian,Southern Utah,46,45,25,35,1,McKay Anderson made Layup. Assisted by John Marshall.
Arizona Christian,Southern Utah,46,45,26,0,0,Jordan Block Turnover.
Arizona Christian,Southern Utah,46,45,26,0,0,Jaren Jeffery Steal.
Arizona Christian,Southern Utah,46,47,26,21,1,Jaren Jeffery made Jumper. Assisted by Casey Oliverson.
Arizona Christian,Southern Utah,46,47,26,34,0,Talib Uqdah Turnover.
Arizona Christian,Southern Utah,46,47,26,34,0,John Marshall Steal.
Arizona Christian,Southern Utah,46,47,26,34,0,Foul on Talib Uqdah.
Arizona Christian,Southern Utah,46,47,27,8,0,Southern Utah  Turnover.
Arizona Christian,Southern Utah,46,47,27,21,0,Mateus Oliveira Turnover.
Arizona Christian,Southern Utah,46,47,27,21,0,Foul on Mateus Oliveira.
Arizona Christian,Southern Utah,46,47,27,27,0,John Marshall missed Jumper.
Arizona Christian,Southern Utah,46,47,27,27,0,Mateus Oliveira Defensive Rebound.
Arizona Christian,Southern Utah,46,47,27,33,0,Foul on McKay Anderson.
Arizona Christian,Southern Utah,46,47,27,49,0,Rod Hudson missed Layup.
Arizona Christian,Southern Utah,46,47,27,49,0,McKay Anderson Block.
Arizona Christian,Southern Utah,46,47,27,51,0,Jaren Jeffery Defensive Rebound.
Arizona Christian,Southern Utah,46,47,27,55,0,Foul on Mateus Oliveira.
Arizona Christian,Southern Utah,46,48,27,55,1,Juwan Major made Free Throw.
Arizona Christian,Southern Utah,46,49,27,55,1,Juwan Major made Free Throw.
Arizona Christian,Southern Utah,49,49,28,10,1,Jason Timpf made Three Point Jumper. Assisted by Mike Navar.
Arizona Christian,Southern Utah,49,51,28,24,1,Jayson Cheesman made Layup. Assisted by Juwan Major.
Arizona Christian,Southern Utah,51,51,28,39,1,Brandon Newman made Layup.
Arizona Christian,Southern Utah,51,51,28,56,0,Juwan Major missed Three Point Jumper.
Arizona Christian,Southern Utah,51,51,28,56,0,Casey Oliverson Offensive Rebound.
Arizona Christian,Southern Utah,51,53,29,0,1,Casey Oliverson made Layup.
Arizona Christian,Southern Utah,53,53,29,11,1,Brandon Newman made Jumper.
Arizona Christian,Southern Utah,53,53,29,33,0,Casey Oliverson missed Jumper.
Arizona Christian,Southern Utah,53,53,29,33,0,Jason Timpf Defensive Rebound.
Arizona Christian,Southern Utah,53,53,29,49,0,Foul on Casey Oliverson.
Arizona Christian,Southern Utah,53,53,29,49,0,Official TV Timeout
Arizona Christian,Southern Utah,53,53,29,49,0,Brandon Newman missed Free Throw.
Arizona Christian,Southern Utah,53,53,29,49,0,A.J. Hess Defensive Rebound.
Arizona Christian,Southern Utah,53,53,30,2,0,Foul on Mike Navar.
Arizona Christian,Southern Utah,53,53,30,2,0,Jayson Cheesman missed Free Throw.
Arizona Christian,Southern Utah,53,53,30,2,0,Southern Utah Deadball Team Rebound.
Arizona Christian,Southern Utah,53,54,30,2,1,Jayson Cheesman made Free Throw.
Arizona Christian,Southern Utah,55,54,30,15,1,Mike Navar made Jumper. Assisted by Talib Uqdah.
Arizona Christian,Southern Utah,55,54,30,43,0,Jayson Cheesman missed Jumper.
Arizona Christian,Southern Utah,55,54,30,43,0,Talib Uqdah Defensive Rebound.
Arizona Christian,Southern Utah,55,54,30,48,0,Talib Uqdah missed Three Point Jumper.
Arizona Christian,Southern Utah,55,54,30,48,0,Race Parsons Defensive Rebound.
Arizona Christian,Southern Utah,55,56,31,6,1,A.J. Hess made Layup.
Arizona Christian,Southern Utah,55,56,31,6,0,Foul on Jackson Helms.
Arizona Christian,Southern Utah,55,57,31,6,1,A.J. Hess made Free Throw.
Arizona Christian,Southern Utah,57,57,31,17,1,Mason Jones made Jumper.
Arizona Christian,Southern Utah,57,60,31,36,1,A.J. Hess made Three Point Jumper. Assisted by Trey Kennedy.
Arizona Christian,Southern Utah,57,60,31,37,0,Foul on Jason Timpf.
Arizona Christian,Southern Utah,57,61,31,37,1,A.J. Hess made Free Throw.
Arizona Christian,Southern Utah,59,61,31,51,1,Talib Uqdah made Jumper.
Arizona Christian,Southern Utah,59,61,32,1,0,Foul on Mike Navar.
Arizona Christian,Southern Utah,59,62,32,1,1,Trey Kennedy made Free Throw.
Arizona Christian,Southern Utah,59,63,32,1,1,Trey Kennedy made Free Throw.
Arizona Christian,Southern Utah,61,63,32,13,1,Talib Uqdah made Jumper.
Arizona Christian,Southern Utah,61,63,32,30,0,Chris Nsenki missed Jumper.
Arizona Christian,Southern Utah,61,63,32,30,0,Mateus Oliveira Defensive Rebound.
Arizona Christian,Southern Utah,61,63,32,37,0,Mason Jones Turnover.
Arizona Christian,Southern Utah,61,63,32,37,0,Official TV Timeout
Arizona Christian,Southern Utah,61,63,32,57,0,Casey Oliverson Turnover.
Arizona Christian,Southern Utah,61,63,33,3,0,Mason Jones Turnover.
Arizona Christian,Southern Utah,61,63,33,11,0,A.J. Hess Turnover.
Arizona Christian,Southern Utah,61,63,33,13,0,Mateus Oliveira Steal.
Arizona Christian,Southern Utah,61,63,33,19,0,Jordan Block missed Layup.
Arizona Christian,Southern Utah,61,63,33,19,0,Southern Utah Defensive Rebound.
Arizona Christian,Southern Utah,61,65,33,56,1,Juwan Major made Layup.
Arizona Christian,Southern Utah,61,65,34,2,0,Foul on John Marshall.
Arizona Christian,Southern Utah,62,65,34,6,1,Brandon Newman made Free Throw.
Arizona Christian,Southern Utah,63,65,34,6,1,Brandon Newman made Free Throw.
Arizona Christian,Southern Utah,63,65,34,21,0,Juwan Major missed Jumper.
Arizona Christian,Southern Utah,63,65,34,21,0,Mateus Oliveira Defensive Rebound.
Arizona Christian,Southern Utah,63,65,34,29,0,Brandon Newman missed Jumper.
Arizona Christian,Southern Utah,63,65,34,29,0,Mateus Oliveira Offensive Rebound.
Arizona Christian,Southern Utah,63,65,34,42,0,Talib Uqdah Turnover.
Arizona Christian,Southern Utah,63,65,34,43,0,Trey Kennedy Steal.
Arizona Christian,Southern Utah,63,65,35,2,0,A.J. Hess missed Jumper.
Arizona Christian,Southern Utah,63,65,35,2,0,Juwan Major Offensive Rebound.
Arizona Christian,Southern Utah,63,67,35,7,1,Juwan Major made Jumper.
Arizona Christian,Southern Utah,63,67,35,27,0,Brandon Newman missed Jumper.
Arizona Christian,Southern Utah,63,67,35,27,0,Mateus Oliveira Offensive Rebound.
Arizona Christian,Southern Utah,65,67,35,37,1,Brandon Newman made Layup.
Arizona Christian,Southern Utah,65,67,35,53,0,Foul on Mateus Oliveira.
Arizona Christian,Southern Utah,65,67,35,53,0,Jayson Cheesman missed Free Throw.
Arizona Christian,Southern Utah,65,67,35,53,0,Southern Utah Deadball Team Rebound.
Arizona Christian,Southern Utah,65,68,35,53,1,Jayson Cheesman made Free Throw.
Arizona Christian,Southern Utah,65,68,36,4,0,Official TV Timeout
Arizona Christian,Southern Utah,65,68,36,10,0,Brandon Newman Turnover.
Arizona Christian,Southern Utah,65,68,36,11,0,Cal Hanks Steal.
Arizona Christian,Southern Utah,65,70,36,13,1,Cal Hanks made Dunk.
Arizona Christian,Southern Utah,65,70,36,37,0,Mateus Oliveira Turnover.
Arizona Christian,Southern Utah,65,70,36,38,0,John Marshall Steal.
Arizona Christian,Southern Utah,65,70,36,41,0,Foul on Brandon Newman.
Arizona Christian,Southern Utah,65,71,36,41,1,John Marshall made Free Throw.
Arizona Christian,Southern Utah,65,72,36,41,1,John Marshall made Free Throw.
Arizona Christian,Southern Utah,65,72,37,0,0,Foul on Cal Hanks.
Arizona Christian,Southern Utah,66,72,37,0,1,Jordan Block made Free Throw.
Arizona Christian,Southern Utah,66,72,37,0,0,Jordan Block missed Free Throw.
Arizona Christian,Southern Utah,66,72,37,0,0,Chris Nsenki Defensive Rebound.
Arizona Christian,Southern Utah,66,72,37,10,0,Cal Hanks missed Jumper.
Arizona Christian,Southern Utah,66,72,37,10,0,Jackson Helms Defensive Rebound.
Arizona Christian,Southern Utah,68,72,37,23,1,Jackson Helms made Layup. Assisted by Brandon Newman.
Arizona Christian,Southern Utah,68,74,37,43,1,A.J. Hess made Layup.
Arizona Christian,Southern Utah,68,74,37,51,0,Foul on A.J. Hess.
Arizona Christian,Southern Utah,68,74,37,52,0,Jordan Block missed Free Throw.
Arizona Christian,Southern Utah,68,74,37,52,0,Arizona Christian Deadball Team Rebound.
Arizona Christian,Southern Utah,68,74,37,52,0,Jordan Block missed Free Throw.
Arizona Christian,Southern Utah,68,74,37,52,0,Cal Hanks Defensive Rebound.
Arizona Christian,Southern Utah,68,74,38,14,0,Chris Nsenki missed Three Point Jumper.
Arizona Christian,Southern Utah,68,74,38,14,0,Cal Hanks Offensive Rebound.
Arizona Christian,Southern Utah,68,74,38,19,0,Chris Nsenki missed Jumper.
Arizona Christian,Southern Utah,68,74,38,19,0,Jason Timpf Defensive Rebound.
Arizona Christian,Southern Utah,68,74,38,23,0,Foul on Cal Hanks.
Arizona Christian,Southern Utah,69,74,38,23,1,Jason Timpf made Free Throw.
Arizona Christian,Southern Utah,70,74,38,23,1,Jason Timpf made Free Throw.
Arizona Christian,Southern Utah,70,74,38,23,0,Arizona Christian  Timeout
Arizona Christian,Southern Utah,70,77,38,42,1,A.J. Hess made Three Point Jumper.
Arizona Christian,Southern Utah,70,77,38,51,0,Brandon Newman missed Three Point Jumper.
Arizona Christian,Southern Utah,70,77,38,51,0,Trey Kennedy Defensive Rebound.
Arizona Christian,Southern Utah,70,77,39,1,0,Foul on Brandon Newman.
Arizona Christian,Southern Utah,70,78,39,1,1,Trey Kennedy made Free Throw.
