Away Team,Home Team,Away Score,Home Score,Minute,Second,isScoringPosession,Desc.
Arizona Christian,Southern Utah,70,79,39,1,1,Trey Kennedy made Free Throw.
Arizona Christian,Southern Utah,70,79,39,1,0,Southern Utah  Timeout
Arizona Christian,Southern Utah,72,79,39,8,1,Martin Kim made Layup.
Arizona Christian,Southern Utah,72,79,39,8,0,Arizona Christian  Timeout
Arizona Christian,Southern Utah,72,79,39,17,0,Foul on Rod Hudson.
Arizona Christian,Southern Utah,72,80,39,17,1,Trey Kennedy made Free Throw.
Arizona Christian,Southern Utah,72,81,39,17,1,Trey Kennedy made Free Throw.
Arizona Christian,Southern Utah,72,81,39,24,0,Jason Timpf missed Three Point Jumper.
Arizona Christian,Southern Utah,72,81,39,24,0,Daniel Cornelius Offensive Rebound.
Arizona Christian,Southern Utah,72,81,39,27,0,Arizona Christian  Timeout
Arizona Christian,Southern Utah,74,81,39,34,1,Talib Uqdah made Layup.
Arizona Christian,Southern Utah,74,81,39,34,0,Foul on Cal Hanks.
Arizona Christian,Southern Utah,75,81,39,34,1,Talib Uqdah made Free Throw.
Arizona Christian,Southern Utah,75,81,39,34,0,Southern Utah  Timeout
Arizona Christian,Southern Utah,75,81,39,36,0,Foul on Talib Uqdah.
Arizona Christian,Southern Utah,75,82,39,36,1,Trey Kennedy made Free Throw.
Arizona Christian,Southern Utah,75,83,39,36,1,Trey Kennedy made Free Throw.
Arizona Christian,Southern Utah,75,83,39,40,0,Brandon Newman missed Three Point Jumper.
Arizona Christian,Southern Utah,75,83,39,40,0,A.J. Hess Defensive Rebound.
Arizona Christian,Southern Utah,75,83,39,45,0,Foul on Jason Timpf.
Arizona Christian,Southern Utah,75,84,39,45,1,A.J. Hess made Free Throw.
Arizona Christian,Southern Utah,75,85,39,45,1,A.J. Hess made Free Throw.
Arizona Christian,Southern Utah,78,85,39,52,1,Brandon Newman made Three Point Jumper. Assisted by Martin Kim.
Arizona Christian,Southern Utah,78,85,39,57,0,Juwan Major Turnover.
Arizona Christian,Southern Utah,78,85,40,0,0,Talib Uqdah missed Jumper.
Arizona Christian,Southern Utah,78,85,40,0,0,Casey Oliverson Defensive Rebound.
Arizona Christian,Southern Utah,78,85,40,0,0,End of Game
