Away Team,Home Team,Away Score, Home Score,Minute,Second,isScoringPosession,Desc.
Cumberland TENN,Tenn-Martin,0,0,0,15,0,Joseph Wilbert missed Jumper.
Cumberland TENN,Tenn-Martin,0,0,0,15,0,Javier Martinez Defensive Rebound.
Cumberland TENN,Tenn-Martin,0,0,0,26,0,Kedar Edwards missed Three Point Jumper.
Cumberland TENN,Tenn-Martin,0,0,0,26,0,Diondrey Holt Jr. Defensive Rebound.
Cumberland TENN,Tenn-Martin,0,0,0,35,0,Telvin Wilkerson missed Three Point Jumper.
Cumberland TENN,Tenn-Martin,0,0,0,35,0,Matthew Butler Defensive Rebound.
Cumberland TENN,Tenn-Martin,0,0,1,3,0,Matthew Butler missed Three Point Jumper.
Cumberland TENN,Tenn-Martin,0,0,1,3,0,Jamonte Graham Defensive Rebound.
Cumberland TENN,Tenn-Martin,0,0,1,21,0,Diondrey Holt Jr. missed Jumper.
Cumberland TENN,Tenn-Martin,0,0,1,21,0,Matthew Butler Defensive Rebound.
Cumberland TENN,Tenn-Martin,0,3,1,37,1,Jacolby Mobley made Three Point Jumper. Assisted by Matthew Butler.
Cumberland TENN,Tenn-Martin,3,3,2,0,1,Jamonte Graham made Three Point Jumper. Assisted by Diondrey Holt Jr..
Cumberland TENN,Tenn-Martin,3,5,2,14,1,Javier Martinez made Layup. Assisted by Kedar Edwards.
Cumberland TENN,Tenn-Martin,5,5,2,23,1,Drexler Davis made Layup. Assisted by Telvin Wilkerson.
Cumberland TENN,Tenn-Martin,5,5,2,35,0,Foul on Drexler Davis.
Cumberland TENN,Tenn-Martin,5,5,2,40,0,Matthew Butler missed Three Point Jumper.
Cumberland TENN,Tenn-Martin,5,5,2,40,0,Fatodd Lewis Offensive Rebound.
Cumberland TENN,Tenn-Martin,5,5,2,43,0,Foul on Jamonte Graham.
Cumberland TENN,Tenn-Martin,5,6,2,43,1,Fatodd Lewis made Free Throw.
Cumberland TENN,Tenn-Martin,5,7,2,43,1,Fatodd Lewis made Free Throw.
Cumberland TENN,Tenn-Martin,5,7,2,49,0,Jamonte Graham Turnover.
Cumberland TENN,Tenn-Martin,5,7,3,0,0,Javier Martinez missed Layup.
Cumberland TENN,Tenn-Martin,5,7,3,0,0,Javier Martinez Offensive Rebound.
Cumberland TENN,Tenn-Martin,5,10,3,6,1,Jacolby Mobley made Three Point Jumper. Assisted by Fatodd Lewis.
Cumberland TENN,Tenn-Martin,5,10,3,20,0,Jamonte Graham Turnover.
Cumberland TENN,Tenn-Martin,5,10,3,21,0,Jacolby Mobley Steal.
Cumberland TENN,Tenn-Martin,5,12,3,24,1,Javier Martinez made Layup. Assisted by Kedar Edwards.
Cumberland TENN,Tenn-Martin,5,12,3,36,0,Drexler Davis Turnover.
Cumberland TENN,Tenn-Martin,5,12,3,37,0,Matthew Butler Steal.
Cumberland TENN,Tenn-Martin,5,15,3,42,1,Jacolby Mobley made Three Point Jumper. Assisted by Matthew Butler.
Cumberland TENN,Tenn-Martin,5,15,4,8,0,Diondrey Holt Jr. missed Jumper.
Cumberland TENN,Tenn-Martin,5,15,4,8,0,Fatodd Lewis Defensive Rebound.
Cumberland TENN,Tenn-Martin,5,17,4,17,1,Javier Martinez made Layup. Assisted by Kedar Edwards.
Cumberland TENN,Tenn-Martin,7,17,4,42,1,Joseph Wilbert made Jumper. Assisted by Jamonte Graham.
Cumberland TENN,Tenn-Martin,7,20,4,58,1,Jacolby Mobley made Three Point Jumper. Assisted by Javier Martinez.
Cumberland TENN,Tenn-Martin,7,20,5,12,0,Foul on Kedar Edwards.
Cumberland TENN,Tenn-Martin,7,20,5,12,0,Official TV Timeout
Cumberland TENN,Tenn-Martin,8,20,5,12,1,Drexler Davis made Free Throw.
Cumberland TENN,Tenn-Martin,9,20,5,12,1,Drexler Davis made Free Throw.
Cumberland TENN,Tenn-Martin,9,20,5,29,0,Jacolby Mobley missed Jumper.
Cumberland TENN,Tenn-Martin,9,20,5,29,0,Joseph Wilbert Defensive Rebound.
Cumberland TENN,Tenn-Martin,9,20,5,31,0,Foul on Fatodd Lewis.
Cumberland TENN,Tenn-Martin,11,20,5,39,1,DeQuan Bond made Layup. Assisted by Diondrey Holt Jr..
Cumberland TENN,Tenn-Martin,11,20,5,55,0,Foul on DeQuan Bond.
Cumberland TENN,Tenn-Martin,11,20,6,25,0,Dante Bailey missed Three Point Jumper.
Cumberland TENN,Tenn-Martin,11,20,6,25,0,Javier Martinez Offensive Rebound.
Cumberland TENN,Tenn-Martin,11,20,6,30,0,Javier Martinez missed Jumper.
Cumberland TENN,Tenn-Martin,11,20,6,30,0,Delaryn Dodd Defensive Rebound.
Cumberland TENN,Tenn-Martin,11,20,6,38,0,Rhyan Townes Turnover.
Cumberland TENN,Tenn-Martin,11,23,6,55,1,Dante Bailey made Three Point Jumper. Assisted by Matthew Butler.
Cumberland TENN,Tenn-Martin,11,23,7,14,0,Rhyan Townes Turnover.
Cumberland TENN,Tenn-Martin,11,23,7,15,0,Jalen Jackson Steal.
Cumberland TENN,Tenn-Martin,11,25,7,18,1,Matthew Butler made Layup. Assisted by Jalen Jackson.
Cumberland TENN,Tenn-Martin,11,25,7,18,0,Foul on Marquel Hickerson.
Cumberland TENN,Tenn-Martin,11,26,7,18,1,Matthew Butler made Free Throw.
Cumberland TENN,Tenn-Martin,11,26,7,27,0,Will Shelton missed Layup.
Cumberland TENN,Tenn-Martin,11,26,7,27,0,Fatodd Lewis Block.
Cumberland TENN,Tenn-Martin,11,26,7,27,0,Cumberland (TN) Offensive Rebound.
Cumberland TENN,Tenn-Martin,11,26,7,36,0,Marquel Hickerson missed Three Point Jumper.
Cumberland TENN,Tenn-Martin,11,26,7,36,0,Will Shelton Offensive Rebound.
Cumberland TENN,Tenn-Martin,13,26,7,39,1,Will Shelton made Two Point Tip Shot.
Cumberland TENN,Tenn-Martin,13,26,7,58,0,Mike Fofana Turnover.
Cumberland TENN,Tenn-Martin,13,26,8,6,0,Foul on Dante Bailey.
Cumberland TENN,Tenn-Martin,13,26,8,6,0,Official TV Timeout
Cumberland TENN,Tenn-Martin,13,26,8,16,0,Ronell Abaekobe missed Jumper.
Cumberland TENN,Tenn-Martin,13,26,8,16,0,Mike Fofana Defensive Rebound.
Cumberland TENN,Tenn-Martin,13,28,8,42,1,Jalen Jackson made Jumper.
Cumberland TENN,Tenn-Martin,13,28,9,2,0,DeQuan Bond missed Jumper.
Cumberland TENN,Tenn-Martin,13,28,9,2,0,Matthew Butler Defensive Rebound.
Cumberland TENN,Tenn-Martin,13,30,9,28,1,Kedar Edwards made Jumper.
Cumberland TENN,Tenn-Martin,13,30,9,50,0,Ronell Abaekobe Turnover.
Cumberland TENN,Tenn-Martin,13,30,9,51,0,Kedar Edwards Steal.
Cumberland TENN,Tenn-Martin,13,32,10,9,1,Kedar Edwards made Layup.
Cumberland TENN,Tenn-Martin,13,32,10,9,0,Foul on Telvin Wilkerson.
Cumberland TENN,Tenn-Martin,13,32,10,9,0,Kedar Edwards missed Free Throw.
Cumberland TENN,Tenn-Martin,13,32,10,9,0,Ronell Abaekobe Defensive Rebound.
Cumberland TENN,Tenn-Martin,13,32,10,29,0,Trent Perry missed Three Point Jumper.
Cumberland TENN,Tenn-Martin,13,32,10,29,0,Kedar Edwards Defensive Rebound.
Cumberland TENN,Tenn-Martin,13,32,10,37,0,Foul on Telvin Wilkerson.
Cumberland TENN,Tenn-Martin,13,34,10,41,1,Fatodd Lewis made Layup. Assisted by Matthew Butler.
Cumberland TENN,Tenn-Martin,13,34,10,52,0,Ronell Abaekobe missed Three Point Jumper.
Cumberland TENN,Tenn-Martin,13,34,10,52,0,Matthew Butler Defensive Rebound.
Cumberland TENN,Tenn-Martin,13,34,11,0,0,Kedar Edwards Turnover.
Cumberland TENN,Tenn-Martin,13,34,11,0,0,Cumberland (TN)  Timeout
Cumberland TENN,Tenn-Martin,15,34,11,22,1,Drexler Davis made Dunk. Assisted by Jamonte Graham.
Cumberland TENN,Tenn-Martin,15,34,11,47,0,Fatodd Lewis missed Jumper.
Cumberland TENN,Tenn-Martin,15,34,11,47,0,Jamonte Graham Defensive Rebound.
Cumberland TENN,Tenn-Martin,15,34,11,51,0,Foul on Jamonte Graham.
Cumberland TENN,Tenn-Martin,15,34,11,51,0,Jamonte Graham Turnover.
Cumberland TENN,Tenn-Martin,15,37,12,3,1,Matthew Butler made Three Point Jumper. Assisted by Jacolby Mobley.
Cumberland TENN,Tenn-Martin,17,37,12,17,1,Cameron Johnson made Jumper.
Cumberland TENN,Tenn-Martin,17,40,12,38,1,Kedar Edwards made Three Point Jumper. Assisted by Chandler Rowe.
Cumberland TENN,Tenn-Martin,20,40,12,47,1,Trent Perry made Three Point Jumper. Assisted by Diondrey Holt Jr..
Cumberland TENN,Tenn-Martin,20,40,13,6,0,Jacolby Mobley missed Three Point Jumper.
Cumberland TENN,Tenn-Martin,20,40,13,6,0,Cumberland (TN) Defensive Rebound.
Cumberland TENN,Tenn-Martin,20,40,13,10,0,Official TV Timeout
Cumberland TENN,Tenn-Martin,23,40,13,25,1,Trent Perry made Three Point Jumper. Assisted by Diondrey Holt Jr..
Cumberland TENN,Tenn-Martin,23,40,13,49,0,Matthew Butler missed Three Point Jumper.
Cumberland TENN,Tenn-Martin,23,40,13,49,0,Javier Martinez Offensive Rebound.
Cumberland TENN,Tenn-Martin,23,42,13,57,1,Chandler Rowe made Dunk. Assisted by Javier Martinez.
Cumberland TENN,Tenn-Martin,23,42,14,10,0,Delaryn Dodd missed Layup.
Cumberland TENN,Tenn-Martin,23,42,14,10,0,Chandler Rowe Block.
Cumberland TENN,Tenn-Martin,23,42,14,12,0,Joseph Wilbert Offensive Rebound.
Cumberland TENN,Tenn-Martin,25,42,14,14,1,Joseph Wilbert made Jumper.
Cumberland TENN,Tenn-Martin,25,42,14,35,0,Kedar Edwards missed Layup.
Cumberland TENN,Tenn-Martin,25,42,14,35,0,Chandler Rowe Offensive Rebound.
Cumberland TENN,Tenn-Martin,25,44,14,37,1,Kedar Edwards made Layup. Assisted by Javier Martinez.
Cumberland TENN,Tenn-Martin,25,44,14,37,0,Foul on Joseph Wilbert.
Cumberland TENN,Tenn-Martin,25,45,14,37,1,Kedar Edwards made Free Throw.
Cumberland TENN,Tenn-Martin,25,45,14,54,0,Foul on Malik London.
Cumberland TENN,Tenn-Martin,25,45,15,4,0,Diondrey Holt Jr. missed Jumper.
Cumberland TENN,Tenn-Martin,25,45,15,4,0,Mike Fofana Defensive Rebound.
Cumberland TENN,Tenn-Martin,25,47,15,10,1,Kedar Edwards made Layup. Assisted by Matthew Butler.
Cumberland TENN,Tenn-Martin,27,47,15,27,1,Delaryn Dodd made Layup. Assisted by Cameron Johnson.
Cumberland TENN,Tenn-Martin,27,47,15,30,0,Mike Fofana Turnover.
Cumberland TENN,Tenn-Martin,27,47,15,39,0,Joseph Wilbert missed Layup.
Cumberland TENN,Tenn-Martin,27,47,15,39,0,Malik London Block.
Cumberland TENN,Tenn-Martin,27,47,15,40,0,Marquel Hickerson Offensive Rebound.
Cumberland TENN,Tenn-Martin,27,47,15,43,0,Marquel Hickerson Turnover.
Cumberland TENN,Tenn-Martin,27,50,16,7,1,Kedar Edwards made Three Point Jumper.
Cumberland TENN,Tenn-Martin,27,50,16,16,0,Cameron Johnson missed Layup.
Cumberland TENN,Tenn-Martin,27,50,16,16,0,Cameron Johnson Offensive Rebound.
Cumberland TENN,Tenn-Martin,27,50,16,21,0,Cameron Johnson missed Jumper.
Cumberland TENN,Tenn-Martin,27,50,16,21,0,Matthew Butler Defensive Rebound.
Cumberland TENN,Tenn-Martin,27,50,16,27,0,Fatodd Lewis missed Layup.
Cumberland TENN,Tenn-Martin,27,50,16,27,0,DeQuan Bond Block.
Cumberland TENN,Tenn-Martin,27,50,16,29,0,Cameron Johnson Defensive Rebound.
Cumberland TENN,Tenn-Martin,29,50,16,57,1,Joseph Wilbert made Layup. Assisted by Marquel Hickerson.
Cumberland TENN,Tenn-Martin,29,53,17,23,1,Fatodd Lewis made Three Point Jumper. Assisted by Matthew Butler.
Cumberland TENN,Tenn-Martin,29,53,17,39,0,Trent Perry missed Three Point Jumper.
Cumberland TENN,Tenn-Martin,29,53,17,39,0,DeQuan Bond Offensive Rebound.
Cumberland TENN,Tenn-Martin,29,53,17,42,0,DeQuan Bond missed Jumper.
Cumberland TENN,Tenn-Martin,29,53,17,42,0,Fatodd Lewis Defensive Rebound.
Cumberland TENN,Tenn-Martin,29,53,17,51,0,Fatodd Lewis Turnover.
Cumberland TENN,Tenn-Martin,29,53,17,52,0,DeQuan Bond Steal.
Cumberland TENN,Tenn-Martin,29,53,17,52,0,Official TV Timeout
Cumberland TENN,Tenn-Martin,29,53,18,1,0,Foul on Nick Detlev.
Cumberland TENN,Tenn-Martin,29,53,18,1,0,Marquel Hickerson missed Free Throw.
Cumberland TENN,Tenn-Martin,29,53,18,1,0,UT Martin Deadball Team Rebound.
Cumberland TENN,Tenn-Martin,30,53,18,1,1,Marquel Hickerson made Free Throw.
Cumberland TENN,Tenn-Martin,30,53,18,21,0,Nick Detlev Turnover.
Cumberland TENN,Tenn-Martin,30,53,18,34,0,Joseph Wilbert Turnover.
Cumberland TENN,Tenn-Martin,30,53,18,45,0,Matthew Butler Turnover.
Cumberland TENN,Tenn-Martin,30,53,18,46,0,DeQuan Bond Steal.
Cumberland TENN,Tenn-Martin,32,53,18,50,1,DeQuan Bond made Layup.
Cumberland TENN,Tenn-Martin,32,53,19,11,0,Fatodd Lewis missed Jumper.
Cumberland TENN,Tenn-Martin,32,53,19,11,0,DeQuan Bond Defensive Rebound.
Cumberland TENN,Tenn-Martin,34,53,19,39,1,Will Shelton made Jumper. Assisted by Marquel Hickerson.
Cumberland TENN,Tenn-Martin,34,53,19,58,0,Jacolby Mobley missed Three Point Jumper.
Cumberland TENN,Tenn-Martin,34,53,19,58,0,Kedar Edwards Offensive Rebound.
Cumberland TENN,Tenn-Martin,34,53,20,0,0,End of 1st half
Cumberland TENN,Tenn-Martin,34,53,20,11,0,Foul on Jamonte Graham.
Cumberland TENN,Tenn-Martin,34,55,20,26,1,Jacolby Mobley made Layup.
Cumberland TENN,Tenn-Martin,34,55,20,50,0,Foul on Matthew Butler.
Cumberland TENN,Tenn-Martin,34,55,21,6,0,Diondrey Holt Jr. missed Three Point Jumper.
Cumberland TENN,Tenn-Martin,34,55,21,6,0,Javier Martinez Defensive Rebound.
Cumberland TENN,Tenn-Martin,34,55,21,8,0,Foul on Joseph Wilbert.
Cumberland TENN,Tenn-Martin,34,55,21,27,0,Kedar Edwards Turnover.
Cumberland TENN,Tenn-Martin,34,55,21,29,0,Joseph Wilbert Steal.
Cumberland TENN,Tenn-Martin,36,55,21,51,1,Jamonte Graham made Layup.
Cumberland TENN,Tenn-Martin,36,57,22,4,1,Javier Martinez made Layup. Assisted by Kedar Edwards.
Cumberland TENN,Tenn-Martin,38,57,22,20,1,Joseph Wilbert made Layup. Assisted by Jamonte Graham.
Cumberland TENN,Tenn-Martin,38,57,22,47,0,Matthew Butler missed Three Point Jumper.
Cumberland TENN,Tenn-Martin,38,57,22,47,0,Javier Martinez Offensive Rebound.
Cumberland TENN,Tenn-Martin,38,59,22,51,1,Javier Martinez made Layup. Assisted by Jacolby Mobley.
Cumberland TENN,Tenn-Martin,38,59,23,9,0,Telvin Wilkerson missed Three Point Jumper.
Cumberland TENN,Tenn-Martin,38,59,23,9,0,Jacolby Mobley Defensive Rebound.
Cumberland TENN,Tenn-Martin,38,61,23,16,1,Kedar Edwards made Layup. Assisted by Jacolby Mobley.
Cumberland TENN,Tenn-Martin,38,61,23,32,0,Jamonte Graham missed Jumper.
Cumberland TENN,Tenn-Martin,38,61,23,32,0,Cumberland (TN) Offensive Rebound.
Cumberland TENN,Tenn-Martin,40,61,23,42,1,Telvin Wilkerson made Jumper. Assisted by Jamonte Graham.
Cumberland TENN,Tenn-Martin,40,61,24,10,0,Kedar Edwards missed Jumper.
Cumberland TENN,Tenn-Martin,40,61,24,10,0,Javier Martinez Offensive Rebound.
Cumberland TENN,Tenn-Martin,40,61,24,12,0,Javier Martinez missed Layup.
Cumberland TENN,Tenn-Martin,40,61,24,12,0,Joseph Wilbert Block.
Cumberland TENN,Tenn-Martin,40,61,24,14,0,Kedar Edwards Offensive Rebound.
Cumberland TENN,Tenn-Martin,40,61,24,15,0,Kedar Edwards missed Jumper.
Cumberland TENN,Tenn-Martin,40,61,24,15,0,Joseph Wilbert Defensive Rebound.
Cumberland TENN,Tenn-Martin,40,61,24,19,0,Diondrey Holt Jr. missed Layup.
Cumberland TENN,Tenn-Martin,40,61,24,19,0,Kedar Edwards Block.
Cumberland TENN,Tenn-Martin,40,61,24,20,0,Cumberland (TN) Offensive Rebound.
Cumberland TENN,Tenn-Martin,40,61,24,21,0,Official TV Timeout
Cumberland TENN,Tenn-Martin,40,61,24,27,0,Jamonte Graham missed Three Point Jumper.
Cumberland TENN,Tenn-Martin,40,61,24,27,0,Jacolby Mobley Defensive Rebound.
Cumberland TENN,Tenn-Martin,40,63,24,36,1,Fatodd Lewis made Dunk. Assisted by Javier Martinez.
Cumberland TENN,Tenn-Martin,40,63,24,58,0,Telvin Wilkerson missed Jumper.
Cumberland TENN,Tenn-Martin,40,63,24,58,0,Javier Martinez Defensive Rebound.
Cumberland TENN,Tenn-Martin,40,63,25,7,0,Fatodd Lewis missed Three Point Jumper.
Cumberland TENN,Tenn-Martin,40,63,25,7,0,Cumberland (TN) Defensive Rebound.
Cumberland TENN,Tenn-Martin,42,63,25,35,1,Delaryn Dodd made Jumper. Assisted by Rhyan Townes.
Cumberland TENN,Tenn-Martin,42,63,25,45,0,Fatodd Lewis Turnover.
Cumberland TENN,Tenn-Martin,42,63,25,46,0,DeQuan Bond Steal.
Cumberland TENN,Tenn-Martin,42,63,25,50,0,DeQuan Bond missed Layup.
Cumberland TENN,Tenn-Martin,42,63,25,50,0,Fatodd Lewis Block.
Cumberland TENN,Tenn-Martin,42,63,25,50,0,Cumberland (TN) Offensive Rebound.
Cumberland TENN,Tenn-Martin,42,63,25,54,0,Foul on Javier Martinez.
Cumberland TENN,Tenn-Martin,42,63,25,54,0,Will Shelton missed Free Throw.
Cumberland TENN,Tenn-Martin,42,63,25,54,0,UT Martin Deadball Team Rebound.
Cumberland TENN,Tenn-Martin,43,63,25,54,1,Will Shelton made Free Throw.
Cumberland TENN,Tenn-Martin,43,66,26,9,1,Dante Bailey made Three Point Jumper. Assisted by Javier Martinez.
Cumberland TENN,Tenn-Martin,46,66,26,26,1,Rhyan Townes made Three Point Jumper. Assisted by Will Shelton.
Cumberland TENN,Tenn-Martin,46,69,26,43,1,Dante Bailey made Three Point Jumper. Assisted by Matthew Butler.
Cumberland TENN,Tenn-Martin,46,69,27,3,0,Will Shelton missed Three Point Jumper.
Cumberland TENN,Tenn-Martin,46,69,27,3,0,Will Shelton Offensive Rebound.
Cumberland TENN,Tenn-Martin,46,69,27,7,0,Foul on Fatodd Lewis.
Cumberland TENN,Tenn-Martin,47,69,27,7,1,Will Shelton made Free Throw.
Cumberland TENN,Tenn-Martin,48,69,27,7,1,Will Shelton made Free Throw.
Cumberland TENN,Tenn-Martin,48,69,27,21,0,Dante Bailey missed Three Point Jumper.
Cumberland TENN,Tenn-Martin,48,69,27,21,0,Fatodd Lewis Offensive Rebound.
Cumberland TENN,Tenn-Martin,48,69,27,24,0,Fatodd Lewis missed Layup.
Cumberland TENN,Tenn-Martin,48,69,27,24,0,Dante Bailey Offensive Rebound.
Cumberland TENN,Tenn-Martin,48,69,27,25,0,Dante Bailey missed Two Point Tip Shot.
Cumberland TENN,Tenn-Martin,48,69,27,25,0,Rhyan Townes Defensive Rebound.
Cumberland TENN,Tenn-Martin,48,69,27,25,0,Foul on Dante Bailey.
Cumberland TENN,Tenn-Martin,48,69,27,49,0,Rhyan Townes missed Layup.
Cumberland TENN,Tenn-Martin,48,69,27,49,0,Dante Bailey Block.
Cumberland TENN,Tenn-Martin,48,69,27,50,0,Fatodd Lewis Defensive Rebound.
Cumberland TENN,Tenn-Martin,48,72,28,2,1,Matthew Butler made Three Point Jumper. Assisted by Dante Bailey.
Cumberland TENN,Tenn-Martin,51,72,28,21,1,DeQuan Bond made Three Point Jumper. Assisted by Rhyan Townes.
Cumberland TENN,Tenn-Martin,51,72,28,41,0,Matthew Butler Turnover.
Cumberland TENN,Tenn-Martin,51,72,28,41,0,Official TV Timeout
Cumberland TENN,Tenn-Martin,51,72,29,9,0,Will Shelton missed Jumper.
Cumberland TENN,Tenn-Martin,51,72,29,9,0,Dante Bailey Defensive Rebound.
Cumberland TENN,Tenn-Martin,51,75,29,15,1,Jacolby Mobley made Three Point Jumper. Assisted by Matthew Butler.
Cumberland TENN,Tenn-Martin,51,75,29,41,0,Will Shelton missed Jumper.
Cumberland TENN,Tenn-Martin,51,75,29,41,0,Dante Bailey Defensive Rebound.
Cumberland TENN,Tenn-Martin,51,75,29,57,0,Matthew Butler Turnover.
Cumberland TENN,Tenn-Martin,51,75,30,13,0,Cameron Johnson missed Jumper.
Cumberland TENN,Tenn-Martin,51,75,30,13,0,Drexler Davis Offensive Rebound.
Cumberland TENN,Tenn-Martin,53,75,30,16,1,Drexler Davis made Two Point Tip Shot.
Cumberland TENN,Tenn-Martin,53,75,30,44,0,Jacolby Mobley missed Three Point Jumper.
Cumberland TENN,Tenn-Martin,53,75,30,44,0,Fatodd Lewis Offensive Rebound.
Cumberland TENN,Tenn-Martin,53,77,30,45,1,Fatodd Lewis made Layup.
Cumberland TENN,Tenn-Martin,55,77,31,17,1,Ronell Abaekobe made Jumper.
Cumberland TENN,Tenn-Martin,55,79,31,42,1,Jacolby Mobley made Layup. Assisted by Javier Martinez.
Cumberland TENN,Tenn-Martin,55,79,31,52,0,Cameron Johnson missed Jumper.
Cumberland TENN,Tenn-Martin,55,79,31,52,0,Javier Martinez Defensive Rebound.
Cumberland TENN,Tenn-Martin,55,81,31,59,1,Kedar Edwards made Layup.
Cumberland TENN,Tenn-Martin,55,81,32,0,0,UT Martin  Timeout
Cumberland TENN,Tenn-Martin,55,81,32,12,0,Garrett Kirkland missed Layup.
Cumberland TENN,Tenn-Martin,55,81,32,12,0,Ronell Abaekobe Offensive Rebound.
Cumberland TENN,Tenn-Martin,57,81,32,12,1,Ronell Abaekobe made Layup.
Cumberland TENN,Tenn-Martin,57,81,32,27,0,Dante Bailey missed Three Point Jumper.
Cumberland TENN,Tenn-Martin,57,81,32,27,0,Ronell Abaekobe Defensive Rebound.
Cumberland TENN,Tenn-Martin,57,81,32,38,0,Cameron Johnson Turnover.
Cumberland TENN,Tenn-Martin,57,81,32,38,0,Official TV Timeout
Cumberland TENN,Tenn-Martin,57,83,33,6,1,Kedar Edwards made Jumper.
Cumberland TENN,Tenn-Martin,60,83,33,29,1,Cameron Johnson made Three Point Jumper. Assisted by Trent Perry.
Cumberland TENN,Tenn-Martin,60,83,33,46,0,Foul on Garrett Kirkland.
Cumberland TENN,Tenn-Martin,60,83,33,46,0,Fatodd Lewis missed Free Throw.
Cumberland TENN,Tenn-Martin,60,83,33,46,0,Cumberland (TN) Deadball Team Rebound.
Cumberland TENN,Tenn-Martin,60,83,33,46,0,Fatodd Lewis missed Free Throw.
Cumberland TENN,Tenn-Martin,60,83,33,46,0,Drexler Davis Defensive Rebound.
Cumberland TENN,Tenn-Martin,60,83,34,4,0,Trent Perry missed Three Point Jumper.
Cumberland TENN,Tenn-Martin,60,83,34,4,0,Dante Bailey Defensive Rebound.
Cumberland TENN,Tenn-Martin,60,83,34,10,0,Kedar Edwards missed Three Point Jumper.
Cumberland TENN,Tenn-Martin,60,83,34,10,0,Fatodd Lewis Offensive Rebound.
Cumberland TENN,Tenn-Martin,60,85,34,13,1,Fatodd Lewis made Jumper.
Cumberland TENN,Tenn-Martin,60,85,34,37,0,Cameron Johnson missed Layup.
Cumberland TENN,Tenn-Martin,60,85,34,37,0,Chandler Rowe Block.
Cumberland TENN,Tenn-Martin,60,85,34,38,0,Cumberland (TN) Offensive Rebound.
Cumberland TENN,Tenn-Martin,60,85,34,50,0,Cumberland (TN)  Turnover.
Cumberland TENN,Tenn-Martin,60,85,35,7,0,Kedar Edwards missed Layup.
Cumberland TENN,Tenn-Martin,60,85,35,7,0,Kedar Edwards Offensive Rebound.
Cumberland TENN,Tenn-Martin,60,87,35,10,1,Kedar Edwards made Layup.
Cumberland TENN,Tenn-Martin,60,87,35,22,0,Trent Perry Turnover.
Cumberland TENN,Tenn-Martin,60,87,35,24,0,Mike Fofana Steal.
Cumberland TENN,Tenn-Martin,60,87,35,29,0,Dante Bailey missed Three Point Jumper.
Cumberland TENN,Tenn-Martin,60,87,35,29,0,Cameron Johnson Defensive Rebound.
Cumberland TENN,Tenn-Martin,60,87,35,53,0,Cameron Johnson Turnover.
Cumberland TENN,Tenn-Martin,60,87,36,4,0,Kahari Beaufort Turnover.
Cumberland TENN,Tenn-Martin,60,87,36,4,0,Official TV Timeout
Cumberland TENN,Tenn-Martin,60,87,36,24,0,Ronell Abaekobe missed Three Point Jumper.
Cumberland TENN,Tenn-Martin,60,87,36,24,0,Dante Bailey Defensive Rebound.
Cumberland TENN,Tenn-Martin,60,87,36,50,0,Foul on Drexler Davis.
Cumberland TENN,Tenn-Martin,60,88,36,50,1,Chandler Rowe made Free Throw.
Cumberland TENN,Tenn-Martin,60,89,36,50,1,Chandler Rowe made Free Throw.
Cumberland TENN,Tenn-Martin,60,89,37,3,0,Cameron Johnson missed Three Point Jumper.
Cumberland TENN,Tenn-Martin,60,89,37,3,0,Mike Fofana Defensive Rebound.
Cumberland TENN,Tenn-Martin,60,91,37,18,1,Mike Fofana made Layup. Assisted by Dante Bailey.
Cumberland TENN,Tenn-Martin,60,91,37,40,0,Foul on Mike Fofana.
Cumberland TENN,Tenn-Martin,60,91,37,47,0,Ronell Abaekobe missed Jumper.
Cumberland TENN,Tenn-Martin,60,91,37,47,0,Chandler Rowe Block.
Cumberland TENN,Tenn-Martin,60,91,37,47,0,Cumberland (TN) Offensive Rebound.
Cumberland TENN,Tenn-Martin,60,91,38,1,0,Trent Perry Turnover.
Cumberland TENN,Tenn-Martin,60,91,38,2,0,Malik Pugh Steal.
Cumberland TENN,Tenn-Martin,60,91,38,11,0,Jalen Jackson missed Three Point Jumper.
Cumberland TENN,Tenn-Martin,60,91,38,11,0,Cumberland (TN) Defensive Rebound.
Cumberland TENN,Tenn-Martin,63,91,38,33,1,Ronell Abaekobe made Three Point Jumper. Assisted by Trent Perry.
Cumberland TENN,Tenn-Martin,63,93,38,43,1,Malik London made Layup. Assisted by Jalen Jackson.
Cumberland TENN,Tenn-Martin,63,93,38,58,0,Cameron Johnson missed Three Point Jumper.
Cumberland TENN,Tenn-Martin,63,93,38,58,0,Drexler Davis Offensive Rebound.
Cumberland TENN,Tenn-Martin,63,93,39,2,0,Drexler Davis missed Layup.
Cumberland TENN,Tenn-Martin,63,93,39,2,0,Malik London Defensive Rebound.
Cumberland TENN,Tenn-Martin,63,95,39,13,1,Nick Detlev made Layup. Assisted by Jalen Jackson.
Cumberland TENN,Tenn-Martin,63,95,39,20,0,Foul on Nick Detlev.
Cumberland TENN,Tenn-Martin,63,95,39,20,0,Ronell Abaekobe missed Free Throw.
Cumberland TENN,Tenn-Martin,63,95,39,20,0,UT Martin Deadball Team Rebound.
Cumberland TENN,Tenn-Martin,64,95,39,20,1,Ronell Abaekobe made Free Throw.
Cumberland TENN,Tenn-Martin,64,95,39,34,0,Jalen Jackson missed Three Point Jumper.
Cumberland TENN,Tenn-Martin,64,95,39,34,0,Cameron Johnson Defensive Rebound.
Cumberland TENN,Tenn-Martin,64,95,39,41,0,Ronell Abaekobe missed Layup.
Cumberland TENN,Tenn-Martin,64,95,39,41,0,Malik Pugh Defensive Rebound.
Cumberland TENN,Tenn-Martin,64,95,40,0,0,End of Game
