Away Team,Home Team,Away Score,Home Score,Minute,Second,isScoringPosession,Desc.
Savannah State,Eastern Kentucky,0,0,0,33,0,Eric Stutz missed Three Point Jumper.
Savannah State,Eastern Kentucky,0,0,0,33,0,Ja'Mill Powell Offensive Rebound.
Savannah State,Eastern Kentucky,0,2,0,42,1,Eric Stutz made Jumper. Assisted by Isaac McGlone.
Savannah State,Eastern Kentucky,0,2,1,11,0,Khaleen Pinkett Turnover.
Savannah State,Eastern Kentucky,0,2,1,24,0,Corey Walden Turnover.
Savannah State,Eastern Kentucky,0,2,1,24,0,Terel Hall Steal.
Savannah State,Eastern Kentucky,2,2,1,26,1,Terel Hall made Layup.
Savannah State,Eastern Kentucky,2,4,1,48,1,Eric Stutz made Dunk. Assisted by Corey Walden.
Savannah State,Eastern Kentucky,2,4,2,14,0,Foul on Ja'Mill Powell.
Savannah State,Eastern Kentucky,2,4,2,29,0,Savannah St  Timeout
Savannah State,Eastern Kentucky,2,4,2,43,0,Terel Hall Turnover.
Savannah State,Eastern Kentucky,2,4,2,59,0,Isaac McGlone missed Three Point Jumper.
Savannah State,Eastern Kentucky,2,4,2,59,0,Timmy Knipp Offensive Rebound.
Savannah State,Eastern Kentucky,2,6,3,2,1,Timmy Knipp made Two Point Tip Shot.
Savannah State,Eastern Kentucky,2,6,3,15,0,Foul on Terel Hall.
Savannah State,Eastern Kentucky,2,6,3,15,0,Terel Hall Turnover.
Savannah State,Eastern Kentucky,2,6,3,42,0,Ja'Mill Powell Turnover.
Savannah State,Eastern Kentucky,2,6,3,42,0,Keierre Richards Steal.
Savannah State,Eastern Kentucky,2,6,3,52,0,Khaleen Pinkett missed Jumper.
Savannah State,Eastern Kentucky,2,6,3,52,0,Brian Pearson Offensive Rebound.
Savannah State,Eastern Kentucky,2,6,3,57,0,Brian Pearson missed Two Point Tip Shot.
Savannah State,Eastern Kentucky,2,6,3,57,0,Demarcus Bryant Offensive Rebound.
Savannah State,Eastern Kentucky,2,6,4,0,0,Demarcus Bryant missed Two Point Tip Shot.
Savannah State,Eastern Kentucky,2,6,4,0,0,Treyvon Francis Offensive Rebound.
Savannah State,Eastern Kentucky,2,6,4,12,0,Treyvon Francis Turnover.
Savannah State,Eastern Kentucky,2,6,4,13,0,Corey Walden Steal.
Savannah State,Eastern Kentucky,2,8,4,14,1,Corey Walden made Layup.
Savannah State,Eastern Kentucky,2,8,4,15,0,Foul on Treyvon Francis.
Savannah State,Eastern Kentucky,2,8,4,15,0,Official TV Timeout
Savannah State,Eastern Kentucky,2,9,4,15,1,Corey Walden made Free Throw.
Savannah State,Eastern Kentucky,2,9,4,24,0,Demarcus Bryant Turnover.
Savannah State,Eastern Kentucky,2,9,4,39,0,Timmy Knipp missed Three Point Jumper.
Savannah State,Eastern Kentucky,2,9,4,39,0,Saadiq Muhammad Defensive Rebound.
Savannah State,Eastern Kentucky,2,9,4,46,0,Foul on Corey Walden.
Savannah State,Eastern Kentucky,5,9,5,3,1,Demarcus Bryant made Three Point Jumper. Assisted by Terel Hall.
Savannah State,Eastern Kentucky,5,11,5,29,1,Jonathan Hood made Layup.
Savannah State,Eastern Kentucky,5,11,5,36,0,Alante Fenner Turnover.
Savannah State,Eastern Kentucky,5,11,5,37,0,Jonathan Hood Steal.
Savannah State,Eastern Kentucky,5,11,5,46,0,Isaac McGlone missed Three Point Jumper.
Savannah State,Eastern Kentucky,5,11,5,46,0,Timmy Knipp Offensive Rebound.
Savannah State,Eastern Kentucky,5,11,6,0,0,Isaac McGlone missed Layup.
Savannah State,Eastern Kentucky,5,11,6,0,0,Saadiq Muhammad Defensive Rebound.
Savannah State,Eastern Kentucky,5,11,6,9,0,Alante Fenner missed Jumper.
Savannah State,Eastern Kentucky,5,11,6,9,0,Timmy Knipp Defensive Rebound.
Savannah State,Eastern Kentucky,5,13,6,14,1,Corey Walden made Layup.
Savannah State,Eastern Kentucky,5,13,6,26,0,Terel Hall Turnover.
Savannah State,Eastern Kentucky,5,13,6,28,0,Eric Stutz Steal.
Savannah State,Eastern Kentucky,5,13,6,30,0,Eric Stutz Turnover.
Savannah State,Eastern Kentucky,7,13,6,38,1,Khaleen Pinkett made Layup.
Savannah State,Eastern Kentucky,7,13,6,38,0,Foul on Jaylen Babb-Harrison.
Savannah State,Eastern Kentucky,8,13,6,38,1,Khaleen Pinkett made Free Throw.
Savannah State,Eastern Kentucky,8,13,6,55,0,Daniel Norl missed Three Point Jumper.
Savannah State,Eastern Kentucky,8,13,6,55,0,Denzel Richardson Offensive Rebound.
Savannah State,Eastern Kentucky,8,13,7,0,0,Foul on Jamal Norman.
Savannah State,Eastern Kentucky,8,14,7,0,1,Denzel Richardson made Free Throw.
Savannah State,Eastern Kentucky,8,14,7,0,0,Denzel Richardson missed Free Throw.
Savannah State,Eastern Kentucky,8,14,7,0,0,Javaris Jenkins Defensive Rebound.
Savannah State,Eastern Kentucky,10,14,7,13,1,Javaris Jenkins made Layup. Assisted by Keierre Richards.
Savannah State,Eastern Kentucky,10,14,7,36,0,Jaylen Babb-Harrison missed Three Point Jumper.
Savannah State,Eastern Kentucky,10,14,7,36,0,Jonathan Hood Offensive Rebound.
Savannah State,Eastern Kentucky,10,17,7,48,1,Jonathan Hood made Three Point Jumper. Assisted by Jaylen Babb-Harrison.
Savannah State,Eastern Kentucky,10,17,8,12,0,Khaleen Pinkett Turnover.
Savannah State,Eastern Kentucky,10,17,8,14,0,Corey Walden Steal.
Savannah State,Eastern Kentucky,10,17,8,17,0,Jaylen Babb-Harrison missed Three Point Jumper.
Savannah State,Eastern Kentucky,10,17,8,17,0,Keierre Richards Defensive Rebound.
Savannah State,Eastern Kentucky,13,17,8,36,1,Demarcus Bryant made Three Point Jumper. Assisted by Keierre Richards.
Savannah State,Eastern Kentucky,13,17,8,59,0,Corey Walden missed Three Point Jumper.
Savannah State,Eastern Kentucky,13,17,8,59,0,Keierre Richards Defensive Rebound.
Savannah State,Eastern Kentucky,13,17,9,18,0,Javaris Jenkins missed Jumper.
Savannah State,Eastern Kentucky,13,17,9,18,0,Denzel Richardson Defensive Rebound.
Savannah State,Eastern Kentucky,13,17,9,36,0,Foul on Javaris Jenkins.
Savannah State,Eastern Kentucky,13,17,9,36,0,Official TV Timeout
Savannah State,Eastern Kentucky,13,18,9,36,1,Denzel Richardson made Free Throw.
Savannah State,Eastern Kentucky,13,19,9,36,1,Denzel Richardson made Free Throw.
Savannah State,Eastern Kentucky,13,19,9,37,0,Alante Fenner missed Layup.
Savannah State,Eastern Kentucky,13,19,9,37,0,Ja'Mill Powell Block.
Savannah State,Eastern Kentucky,13,19,9,39,0,Isaac McGlone Defensive Rebound.
Savannah State,Eastern Kentucky,13,19,9,52,0,Denzel Richardson missed Jumper.
Savannah State,Eastern Kentucky,13,19,9,52,0,Saadiq Muhammad Block.
Savannah State,Eastern Kentucky,13,19,9,54,0,Denzel Richardson Offensive Rebound.
Savannah State,Eastern Kentucky,13,21,9,55,1,Denzel Richardson made Two Point Tip Shot.
Savannah State,Eastern Kentucky,13,21,10,19,0,Terel Hall Turnover.
Savannah State,Eastern Kentucky,13,21,10,19,0,Eric Stutz Steal.
Savannah State,Eastern Kentucky,13,21,10,41,0,Corey Walden Turnover.
Savannah State,Eastern Kentucky,13,21,10,42,0,Alante Fenner Steal.
Savannah State,Eastern Kentucky,15,21,10,53,1,Brian Pearson made Layup. Assisted by Demarcus Bryant.
Savannah State,Eastern Kentucky,15,21,11,10,0,Ja'Mill Powell missed Three Point Jumper.
Savannah State,Eastern Kentucky,15,21,11,10,0,Savannah St Defensive Rebound.
Savannah State,Eastern Kentucky,15,21,11,14,0,Savannah St  Turnover.
Savannah State,Eastern Kentucky,15,21,11,30,0,Eric Stutz Turnover.
Savannah State,Eastern Kentucky,15,21,11,31,0,Terel Hall Steal.
Savannah State,Eastern Kentucky,15,21,11,45,0,Brian Pearson Turnover.
Savannah State,Eastern Kentucky,15,21,12,0,0,Eric Stutz missed Jumper.
Savannah State,Eastern Kentucky,15,21,12,0,0,Eric Stutz Offensive Rebound.
Savannah State,Eastern Kentucky,15,21,12,15,0,Jaylen Babb-Harrison missed Jumper.
Savannah State,Eastern Kentucky,15,21,12,15,0,Alante Fenner Defensive Rebound.
Savannah State,Eastern Kentucky,15,21,12,30,0,Treyvon Francis Turnover.
Savannah State,Eastern Kentucky,15,21,12,31,0,Jaylen Babb-Harrison Steal.
Savannah State,Eastern Kentucky,15,21,12,31,0,Jaylen Babb-Harrison Turnover.
Savannah State,Eastern Kentucky,15,21,12,31,0,Official TV Timeout
Savannah State,Eastern Kentucky,15,21,12,42,0,Demarcus Bryant missed Three Point Jumper.
Savannah State,Eastern Kentucky,15,21,12,42,0,Deverin Muff Defensive Rebound.
Savannah State,Eastern Kentucky,15,21,13,7,0,Foul on Brian Pearson.
Savannah State,Eastern Kentucky,15,21,13,9,0,Foul on Terel Hall.
Savannah State,Eastern Kentucky,15,22,13,9,1,Timmy Knipp made Free Throw.
Savannah State,Eastern Kentucky,15,23,13,9,1,Timmy Knipp made Free Throw.
Savannah State,Eastern Kentucky,17,23,13,26,1,Demarcus Bryant made Jumper. Assisted by Terel Hall.
Savannah State,Eastern Kentucky,17,25,13,53,1,Corey Walden made Layup.
Savannah State,Eastern Kentucky,17,25,13,59,0,Terel Hall Turnover.
Savannah State,Eastern Kentucky,17,25,14,0,0,Timmy Knipp Steal.
Savannah State,Eastern Kentucky,17,25,14,11,0,Daniel Norl missed Jumper.
Savannah State,Eastern Kentucky,17,25,14,11,0,Brian Pearson Block.
Savannah State,Eastern Kentucky,17,25,14,13,0,Khaleen Pinkett Defensive Rebound.
Savannah State,Eastern Kentucky,19,25,14,17,1,Terel Hall made Layup. Assisted by Khaleen Pinkett.
Savannah State,Eastern Kentucky,19,25,14,43,0,Daniel Norl missed Three Point Jumper.
Savannah State,Eastern Kentucky,19,25,14,43,0,Saadiq Muhammad Defensive Rebound.
Savannah State,Eastern Kentucky,19,25,14,56,0,Foul on Daniel Norl.
Savannah State,Eastern Kentucky,19,25,15,5,0,Foul on Jonathan Hood.
Savannah State,Eastern Kentucky,20,25,15,5,1,Khaleen Pinkett made Free Throw.
Savannah State,Eastern Kentucky,21,25,15,5,1,Khaleen Pinkett made Free Throw.
Savannah State,Eastern Kentucky,21,25,15,30,0,Corey Walden missed Three Point Jumper.
Savannah State,Eastern Kentucky,21,25,15,30,0,Javaris Jenkins Defensive Rebound.
Savannah State,Eastern Kentucky,21,25,15,46,0,Keierre Richards missed Three Point Jumper.
Savannah State,Eastern Kentucky,21,25,15,46,0,Alante Fenner Offensive Rebound.
Savannah State,Eastern Kentucky,23,25,15,50,1,Alante Fenner made Two Point Tip Shot.
Savannah State,Eastern Kentucky,23,28,16,8,1,Isaac McGlone made Three Point Jumper. Assisted by Corey Walden.
Savannah State,Eastern Kentucky,23,28,16,26,0,Khaleen Pinkett Turnover.
Savannah State,Eastern Kentucky,23,28,16,29,0,Corey Walden Steal.
Savannah State,Eastern Kentucky,23,28,16,30,0,Foul on Keierre Richards.
Savannah State,Eastern Kentucky,23,28,16,30,0,Official TV Timeout
Savannah State,Eastern Kentucky,23,29,16,30,1,Corey Walden made Free Throw.
Savannah State,Eastern Kentucky,23,30,16,30,1,Corey Walden made Free Throw.
Savannah State,Eastern Kentucky,23,30,16,35,0,Foul on Tommy Matthews.
Savannah State,Eastern Kentucky,23,30,16,35,0,Saadiq Muhammad missed Free Throw.
Savannah State,Eastern Kentucky,23,30,16,35,0,Savannah St Deadball Team Rebound.
Savannah State,Eastern Kentucky,23,30,16,35,0,Saadiq Muhammad missed Free Throw.
Savannah State,Eastern Kentucky,23,30,16,35,0,Eastern Kentucky Deadball Team Rebound.
Savannah State,Eastern Kentucky,23,30,16,35,0,Eastern Kentucky  Timeout
Savannah State,Eastern Kentucky,23,32,17,8,1,Timmy Knipp made Layup. Assisted by Eric Stutz.
Savannah State,Eastern Kentucky,23,32,17,22,0,Keierre Richards missed Jumper.
Savannah State,Eastern Kentucky,23,32,17,22,0,Ja'Mill Powell Defensive Rebound.
Savannah State,Eastern Kentucky,23,32,17,34,0,Foul on Brian Pearson.
Savannah State,Eastern Kentucky,23,33,17,34,1,Ja'Mill Powell made Free Throw.
Savannah State,Eastern Kentucky,23,34,17,34,1,Ja'Mill Powell made Free Throw.
Savannah State,Eastern Kentucky,23,34,18,4,0,Keierre Richards Turnover.
Savannah State,Eastern Kentucky,23,34,18,5,0,Denzel Richardson Steal.
Savannah State,Eastern Kentucky,23,36,18,8,1,Denzel Richardson made Layup.
Savannah State,Eastern Kentucky,25,36,18,23,1,Saadiq Muhammad made Dunk. Assisted by Alante Fenner.
Savannah State,Eastern Kentucky,25,36,18,48,0,Denzel Richardson missed Three Point Jumper.
Savannah State,Eastern Kentucky,25,36,18,48,0,Brian Pearson Defensive Rebound.
Savannah State,Eastern Kentucky,25,36,19,7,0,Demarcus Bryant missed Three Point Jumper.
Savannah State,Eastern Kentucky,25,36,19,7,0,Saadiq Muhammad Offensive Rebound.
Savannah State,Eastern Kentucky,25,36,19,10,0,Saadiq Muhammad missed Two Point Tip Shot.
Savannah State,Eastern Kentucky,25,36,19,10,0,Brian Pearson Offensive Rebound.
Savannah State,Eastern Kentucky,25,36,19,10,0,Foul on Isaac McGlone.
Savannah State,Eastern Kentucky,25,36,19,10,0,Brian Pearson missed Free Throw.
Savannah State,Eastern Kentucky,25,36,19,10,0,Savannah St Deadball Team Rebound.
Savannah State,Eastern Kentucky,25,36,19,10,0,Brian Pearson missed Free Throw.
Savannah State,Eastern Kentucky,25,36,19,10,0,Denzel Richardson Defensive Rebound.
Savannah State,Eastern Kentucky,25,36,19,41,0,Corey Walden missed Three Point Jumper.
Savannah State,Eastern Kentucky,25,36,19,41,0,Keierre Richards Defensive Rebound.
Savannah State,Eastern Kentucky,25,36,19,51,0,Javaris Jenkins missed Jumper.
Savannah State,Eastern Kentucky,25,36,19,51,0,Brian Pearson Offensive Rebound.
Savannah State,Eastern Kentucky,27,36,19,55,1,Brian Pearson made Two Point Tip Shot.
Savannah State,Eastern Kentucky,27,36,20,0,0,Corey Walden missed Three Point Jumper.
Savannah State,Eastern Kentucky,27,36,20,0,0,Savannah St Defensive Rebound.
Savannah State,Eastern Kentucky,27,36,20,0,0,End of 1st half
Savannah State,Eastern Kentucky,29,36,20,34,1,Saadiq Muhammad made Jumper.
Savannah State,Eastern Kentucky,29,36,21,3,0,Ja'Mill Powell missed Jumper.
Savannah State,Eastern Kentucky,29,36,21,3,0,Saadiq Muhammad Defensive Rebound.
Savannah State,Eastern Kentucky,29,36,21,15,0,Foul on Khaleen Pinkett.
Savannah State,Eastern Kentucky,29,36,21,15,0,Khaleen Pinkett Turnover.
Savannah State,Eastern Kentucky,29,36,21,32,0,Isaac McGlone missed Jumper.
Savannah State,Eastern Kentucky,29,36,21,32,0,Javaris Jenkins Defensive Rebound.
Savannah State,Eastern Kentucky,29,36,21,51,0,Keierre Richards Turnover.
Savannah State,Eastern Kentucky,29,36,22,0,0,Timmy Knipp missed Three Point Jumper.
Savannah State,Eastern Kentucky,29,36,22,0,0,Eastern Kentucky Offensive Rebound.
Savannah State,Eastern Kentucky,29,36,22,8,0,Timmy Knipp missed Jumper.
Savannah State,Eastern Kentucky,29,36,22,8,0,Javaris Jenkins Block.
Savannah State,Eastern Kentucky,29,36,22,11,0,Saadiq Muhammad Defensive Rebound.
Savannah State,Eastern Kentucky,31,36,22,13,1,Saadiq Muhammad made Layup.
Savannah State,Eastern Kentucky,31,36,22,38,0,Ja'Mill Powell missed Three Point Jumper.
Savannah State,Eastern Kentucky,31,36,22,38,0,Khaleen Pinkett Defensive Rebound.
Savannah State,Eastern Kentucky,33,36,23,1,1,Saadiq Muhammad made Dunk. Assisted by Keierre Richards.
Savannah State,Eastern Kentucky,33,36,23,9,0,Eastern Kentucky  Timeout
Savannah State,Eastern Kentucky,33,36,23,27,0,Denzel Richardson Turnover.
Savannah State,Eastern Kentucky,33,36,23,48,0,Alante Fenner missed Layup.
Savannah State,Eastern Kentucky,33,36,23,48,0,Ja'Mill Powell Block.
Savannah State,Eastern Kentucky,33,36,23,50,0,Eric Stutz Defensive Rebound.
Savannah State,Eastern Kentucky,33,36,24,14,0,Foul on Saadiq Muhammad.
Savannah State,Eastern Kentucky,33,37,24,14,1,Eric Stutz made Free Throw.
Savannah State,Eastern Kentucky,33,38,24,14,1,Eric Stutz made Free Throw.
Savannah State,Eastern Kentucky,33,38,24,20,0,Foul on Corey Walden.
Savannah State,Eastern Kentucky,33,38,24,29,0,Brian Pearson Turnover.
Savannah State,Eastern Kentucky,33,38,24,30,0,Corey Walden Steal.
Savannah State,Eastern Kentucky,33,38,24,34,0,Corey Walden missed Jumper.
Savannah State,Eastern Kentucky,33,38,24,34,0,Alante Fenner Defensive Rebound.
Savannah State,Eastern Kentucky,33,38,24,40,0,Alante Fenner Turnover.
Savannah State,Eastern Kentucky,33,38,24,41,0,Isaac McGlone Steal.
Savannah State,Eastern Kentucky,33,38,24,44,0,Foul on Keierre Richards.
Savannah State,Eastern Kentucky,33,38,24,54,0,Eric Stutz missed Jumper.
Savannah State,Eastern Kentucky,33,38,24,54,0,Alante Fenner Defensive Rebound.
Savannah State,Eastern Kentucky,33,38,24,59,0,Alante Fenner Turnover.
Savannah State,Eastern Kentucky,33,38,25,1,0,Corey Walden Steal.
Savannah State,Eastern Kentucky,33,38,25,2,0,Eric Stutz Turnover.
Savannah State,Eastern Kentucky,33,38,25,4,0,Khaleen Pinkett Steal.
Savannah State,Eastern Kentucky,33,38,25,5,0,Foul on Denzel Richardson.
Savannah State,Eastern Kentucky,33,38,25,5,0,Khaleen Pinkett missed Free Throw.
Savannah State,Eastern Kentucky,33,38,25,5,0,Savannah St Deadball Team Rebound.
Savannah State,Eastern Kentucky,33,38,25,5,0,Khaleen Pinkett missed Free Throw.
Savannah State,Eastern Kentucky,33,38,25,5,0,Denzel Richardson Defensive Rebound.
Savannah State,Eastern Kentucky,33,38,25,8,0,Foul on Terel Hall.
Savannah State,Eastern Kentucky,33,38,25,9,0,Foul on Treyvon Francis.
Savannah State,Eastern Kentucky,33,38,25,39,0,Eric Stutz missed Jumper.
Savannah State,Eastern Kentucky,33,38,25,39,0,Treyvon Francis Defensive Rebound.
Savannah State,Eastern Kentucky,33,38,25,55,0,Foul on Isaac McGlone.
Savannah State,Eastern Kentucky,33,38,26,16,0,Demarcus Bryant Turnover.
Savannah State,Eastern Kentucky,33,38,26,17,0,Eric Stutz Steal.
Savannah State,Eastern Kentucky,33,38,26,21,0,Isaac McGlone missed Three Point Jumper.
Savannah State,Eastern Kentucky,33,38,26,21,0,Denzel Richardson Offensive Rebound.
Savannah State,Eastern Kentucky,33,38,26,26,0,Denzel Richardson missed Two Point Tip Shot.
Savannah State,Eastern Kentucky,33,38,26,26,0,Javaris Jenkins Defensive Rebound.
Savannah State,Eastern Kentucky,33,38,26,42,0,Foul on Eric Stutz.
Savannah State,Eastern Kentucky,33,38,26,46,0,Alante Fenner Turnover.
Savannah State,Eastern Kentucky,33,38,26,53,0,Jaylen Babb-Harrison Turnover.
Savannah State,Eastern Kentucky,33,38,26,54,0,Alante Fenner Steal.
Savannah State,Eastern Kentucky,33,38,27,0,0,Foul on Isaac McGlone.
Savannah State,Eastern Kentucky,34,38,27,0,1,Keierre Richards made Free Throw.
Savannah State,Eastern Kentucky,35,38,27,0,1,Keierre Richards made Free Throw.
Savannah State,Eastern Kentucky,35,38,27,7,0,Denzel Richardson Turnover.
Savannah State,Eastern Kentucky,35,38,27,15,0,Demarcus Bryant missed Three Point Jumper.
Savannah State,Eastern Kentucky,35,38,27,15,0,Savannah St Deadball Team Rebound.
Savannah State,Eastern Kentucky,35,38,27,18,0,Foul on Eric Stutz.
Savannah State,Eastern Kentucky,35,38,27,19,0,Demarcus Bryant missed Three Point Jumper.
Savannah State,Eastern Kentucky,35,38,27,19,0,Saadiq Muhammad Offensive Rebound.
Savannah State,Eastern Kentucky,35,38,27,24,0,Saadiq Muhammad Turnover.
Savannah State,Eastern Kentucky,35,38,27,25,0,Corey Walden Steal.
Savannah State,Eastern Kentucky,35,40,27,27,1,Corey Walden made Layup.
Savannah State,Eastern Kentucky,35,40,27,28,0,Foul on Alante Fenner.
Savannah State,Eastern Kentucky,35,41,27,28,1,Corey Walden made Free Throw.
Savannah State,Eastern Kentucky,35,41,27,38,0,Savannah St  Turnover.
Savannah State,Eastern Kentucky,35,41,27,43,0,Jaylen Babb-Harrison missed Jumper.
Savannah State,Eastern Kentucky,35,41,27,43,0,Brian Pearson Defensive Rebound.
Savannah State,Eastern Kentucky,35,41,27,58,0,Khaleen Pinkett Turnover.
Savannah State,Eastern Kentucky,35,41,28,0,0,Corey Walden Steal.
Savannah State,Eastern Kentucky,35,41,28,9,0,Timmy Knipp missed Jumper.
Savannah State,Eastern Kentucky,35,41,28,9,0,Brian Pearson Block.
Savannah State,Eastern Kentucky,35,41,28,10,0,Deverin Muff Offensive Rebound.
Savannah State,Eastern Kentucky,35,43,28,11,1,Deverin Muff made Two Point Tip Shot.
Savannah State,Eastern Kentucky,37,43,28,29,1,Saadiq Muhammad made Layup. Assisted by Alante Fenner.
Savannah State,Eastern Kentucky,37,43,28,30,0,Savannah St  Timeout
Savannah State,Eastern Kentucky,37,45,28,36,1,Ja'Mill Powell made Jumper.
Savannah State,Eastern Kentucky,37,45,28,54,0,Foul on Demarcus Bryant.
Savannah State,Eastern Kentucky,37,45,28,54,0,Demarcus Bryant Turnover.
Savannah State,Eastern Kentucky,37,45,28,54,0,Official TV Timeout
Savannah State,Eastern Kentucky,37,45,29,17,0,Ja'Mill Powell missed Three Point Jumper.
Savannah State,Eastern Kentucky,37,45,29,17,0,Timmy Knipp Offensive Rebound.
Savannah State,Eastern Kentucky,37,45,29,26,0,Corey Walden missed Three Point Jumper.
Savannah State,Eastern Kentucky,37,45,29,26,0,Eric Stutz Offensive Rebound.
Savannah State,Eastern Kentucky,37,48,29,48,1,Ja'Mill Powell made Three Point Jumper. Assisted by Corey Walden.
Savannah State,Eastern Kentucky,37,48,29,52,0,Eastern Kentucky  Timeout
Savannah State,Eastern Kentucky,37,48,30,25,0,Demarcus Bryant Turnover.
Savannah State,Eastern Kentucky,37,48,30,27,0,Isaac McGlone Steal.
Savannah State,Eastern Kentucky,37,50,30,29,1,Corey Walden made Layup. Assisted by Ja'Mill Powell.
Savannah State,Eastern Kentucky,37,50,30,30,0,Foul on Terel Hall.
Savannah State,Eastern Kentucky,37,50,30,30,0,Corey Walden missed Free Throw.
Savannah State,Eastern Kentucky,37,50,30,30,0,Demarcus Bryant Defensive Rebound.
Savannah State,Eastern Kentucky,37,50,30,45,0,Foul on Deverin Muff.
Savannah State,Eastern Kentucky,38,50,30,45,1,Terel Hall made Free Throw.
Savannah State,Eastern Kentucky,38,50,30,45,0,Terel Hall missed Free Throw.
Savannah State,Eastern Kentucky,38,50,30,45,0,Denzel Richardson Defensive Rebound.
Savannah State,Eastern Kentucky,38,53,30,59,1,Denzel Richardson made Three Point Jumper. Assisted by Corey Walden.
Savannah State,Eastern Kentucky,38,53,31,11,0,Foul on Ja'Mill Powell.
Savannah State,Eastern Kentucky,38,53,31,11,0,Alante Fenner missed Free Throw.
Savannah State,Eastern Kentucky,38,53,31,11,0,Denzel Richardson Defensive Rebound.
Savannah State,Eastern Kentucky,38,55,31,21,1,Ja'Mill Powell made Jumper.
Savannah State,Eastern Kentucky,38,55,31,38,0,Alante Fenner missed Jumper.
Savannah State,Eastern Kentucky,38,55,31,38,0,Javaris Jenkins Offensive Rebound.
Savannah State,Eastern Kentucky,40,55,31,41,1,Javaris Jenkins made Two Point Tip Shot.
Savannah State,Eastern Kentucky,40,55,32,4,0,Isaac McGlone missed Three Point Jumper.
Savannah State,Eastern Kentucky,40,55,32,4,0,Ja'Mill Powell Offensive Rebound.
Savannah State,Eastern Kentucky,40,55,32,9,0,Ja'Mill Powell missed Two Point Tip Shot.
Savannah State,Eastern Kentucky,40,55,32,9,0,Saadiq Muhammad Block.
Savannah State,Eastern Kentucky,40,55,32,11,0,Terel Hall Defensive Rebound.
Savannah State,Eastern Kentucky,40,55,32,26,0,Official TV Timeout
Savannah State,Eastern Kentucky,40,55,32,35,0,Foul on Khaleen Pinkett.
Savannah State,Eastern Kentucky,40,55,32,35,0,Khaleen Pinkett Turnover.
Savannah State,Eastern Kentucky,40,55,32,54,0,Corey Walden Turnover.
Savannah State,Eastern Kentucky,40,55,32,55,0,Jamal Norman Steal.
Savannah State,Eastern Kentucky,40,55,33,0,0,Foul on Jamal Norman.
Savannah State,Eastern Kentucky,40,55,33,0,0,Jamal Norman Turnover.
Savannah State,Eastern Kentucky,40,55,33,27,0,Isaac McGlone missed Layup.
Savannah State,Eastern Kentucky,40,55,33,27,0,Eastern Kentucky Offensive Rebound.
Savannah State,Eastern Kentucky,40,57,33,30,1,Corey Walden made Layup. Assisted by Isaac McGlone.
Savannah State,Eastern Kentucky,42,57,33,44,1,Brian Pearson made Layup. Assisted by Jamal Norman.
Savannah State,Eastern Kentucky,42,60,33,55,1,Ja'Mill Powell made Three Point Jumper. Assisted by Timmy Knipp.
Savannah State,Eastern Kentucky,42,60,34,14,0,Jamal Norman missed Jumper.
Savannah State,Eastern Kentucky,42,60,34,14,0,Jamal Norman Offensive Rebound.
Savannah State,Eastern Kentucky,42,60,34,18,0,Jamal Norman missed Two Point Tip Shot.
Savannah State,Eastern Kentucky,42,60,34,18,0,Eric Stutz Defensive Rebound.
Savannah State,Eastern Kentucky,42,60,34,25,0,Foul on Brian Pearson.
Savannah State,Eastern Kentucky,42,60,34,25,0,Eric Stutz missed Free Throw.
Savannah State,Eastern Kentucky,42,60,34,25,0,Eastern Kentucky Deadball Team Rebound.
Savannah State,Eastern Kentucky,42,61,34,25,1,Eric Stutz made Free Throw.
Savannah State,Eastern Kentucky,44,61,34,38,1,Brian Pearson made Layup. Assisted by Saadiq Muhammad.
Savannah State,Eastern Kentucky,44,63,34,51,1,Eric Stutz made Layup. Assisted by Denzel Richardson.
Savannah State,Eastern Kentucky,44,63,35,4,0,Demarcus Bryant missed Three Point Jumper.
Savannah State,Eastern Kentucky,44,63,35,4,0,Eric Stutz Defensive Rebound.
Savannah State,Eastern Kentucky,44,63,35,15,0,Foul on Saadiq Muhammad.
Savannah State,Eastern Kentucky,44,64,35,15,1,Corey Walden made Free Throw.
Savannah State,Eastern Kentucky,44,65,35,15,1,Corey Walden made Free Throw.
Savannah State,Eastern Kentucky,46,65,35,28,1,Brian Pearson made Layup. Assisted by Terel Hall.
Savannah State,Eastern Kentucky,46,65,35,30,0,Savannah St  Timeout
Savannah State,Eastern Kentucky,46,65,35,44,0,Ja'Mill Powell Turnover.
Savannah State,Eastern Kentucky,46,65,35,45,0,Alante Fenner Steal.
Savannah State,Eastern Kentucky,46,65,35,48,0,Alante Fenner missed Layup.
Savannah State,Eastern Kentucky,46,65,35,48,0,Brian Pearson Offensive Rebound.
Savannah State,Eastern Kentucky,46,65,35,53,0,Brian Pearson missed Two Point Tip Shot.
Savannah State,Eastern Kentucky,46,65,35,53,0,Denzel Richardson Defensive Rebound.
Savannah State,Eastern Kentucky,46,65,35,59,0,Denzel Richardson Turnover.
Savannah State,Eastern Kentucky,46,65,36,0,0,Saadiq Muhammad Steal.
Savannah State,Eastern Kentucky,46,65,36,16,0,Saadiq Muhammad missed Dunk.
Savannah State,Eastern Kentucky,46,65,36,16,0,Corey Walden Defensive Rebound.
Savannah State,Eastern Kentucky,46,65,36,28,0,Ja'Mill Powell missed Three Point Jumper.
Savannah State,Eastern Kentucky,46,65,36,28,0,Denzel Richardson Offensive Rebound.
Savannah State,Eastern Kentucky,46,65,36,30,0,Foul on Terel Hall.
Savannah State,Eastern Kentucky,46,65,36,30,0,Official TV Timeout
Savannah State,Eastern Kentucky,46,66,36,30,1,Denzel Richardson made Free Throw.
Savannah State,Eastern Kentucky,46,66,36,30,0,Denzel Richardson missed Free Throw.
Savannah State,Eastern Kentucky,46,66,36,30,0,Saadiq Muhammad Defensive Rebound.
Savannah State,Eastern Kentucky,46,66,36,43,0,Brian Pearson missed Layup.
Savannah State,Eastern Kentucky,46,66,36,43,0,Eric Stutz Block.
