Away Team,Home Team,Away Score,Home Score,Minute,Second,isScoringPosession,Desc.
Savannah State,Eastern Kentucky,46,66,36,45,0,Saadiq Muhammad Offensive Rebound.
Savannah State,Eastern Kentucky,46,66,36,46,0,Foul on Jaylen Babb-Harrison.
Savannah State,Eastern Kentucky,47,66,36,46,1,Saadiq Muhammad made Free Throw.
Savannah State,Eastern Kentucky,47,66,36,46,0,Saadiq Muhammad missed Free Throw.
Savannah State,Eastern Kentucky,47,66,36,46,0,Eric Stutz Defensive Rebound.
Savannah State,Eastern Kentucky,47,66,36,48,0,Foul on Demarcus Bryant.
Savannah State,Eastern Kentucky,47,67,36,48,1,Eric Stutz made Free Throw.
Savannah State,Eastern Kentucky,47,68,36,48,1,Eric Stutz made Free Throw.
Savannah State,Eastern Kentucky,49,68,36,57,1,Saadiq Muhammad made Dunk. Assisted by Alante Fenner.
Savannah State,Eastern Kentucky,49,68,37,29,0,Denzel Richardson Turnover.
Savannah State,Eastern Kentucky,49,68,37,39,0,Khaleen Pinkett Turnover.
Savannah State,Eastern Kentucky,49,68,37,41,0,Corey Walden Steal.
Savannah State,Eastern Kentucky,49,68,37,42,0,Foul on Khaleen Pinkett.
Savannah State,Eastern Kentucky,49,69,37,42,1,Corey Walden made Free Throw.
Savannah State,Eastern Kentucky,49,70,37,42,1,Corey Walden made Free Throw.
Savannah State,Eastern Kentucky,49,70,37,53,0,Foul on Deverin Muff.
Savannah State,Eastern Kentucky,50,70,37,53,1,Alante Fenner made Free Throw.
Savannah State,Eastern Kentucky,51,70,37,53,1,Alante Fenner made Free Throw.
Savannah State,Eastern Kentucky,51,70,38,12,0,Ja'Mill Powell missed Layup.
Savannah State,Eastern Kentucky,51,70,38,12,0,Brian Pearson Block.
Savannah State,Eastern Kentucky,51,70,38,14,0,Alante Fenner Defensive Rebound.
Savannah State,Eastern Kentucky,53,70,38,18,1,Alante Fenner made Layup.
Savannah State,Eastern Kentucky,53,70,38,20,0,Foul on Denzel Richardson.
Savannah State,Eastern Kentucky,53,70,38,20,0,Alante Fenner Turnover.
Savannah State,Eastern Kentucky,53,72,38,30,1,Ja'Mill Powell made Layup. Assisted by Corey Walden.
Savannah State,Eastern Kentucky,53,72,38,57,0,Demarcus Bryant Turnover.
Savannah State,Eastern Kentucky,53,74,38,59,1,Eric Stutz made Layup. Assisted by Timmy Knipp.
Savannah State,Eastern Kentucky,53,74,39,10,0,Foul on Isaac McGlone.
Savannah State,Eastern Kentucky,53,74,39,10,0,Treyvon Francis missed Free Throw.
Savannah State,Eastern Kentucky,53,74,39,10,0,Savannah St Deadball Team Rebound.
Savannah State,Eastern Kentucky,53,74,39,10,0,Treyvon Francis missed Free Throw.
Savannah State,Eastern Kentucky,53,74,39,10,0,Eastern Kentucky Defensive Rebound.
Savannah State,Eastern Kentucky,53,76,39,33,1,Jaylen Babb-Harrison made Jumper. Assisted by Tommy Matthews.
Savannah State,Eastern Kentucky,53,76,39,51,0,Foul on Alante Fenner.
Savannah State,Eastern Kentucky,53,76,39,51,0,Alante Fenner Turnover.
Savannah State,Eastern Kentucky,53,76,40,0,0,End of Game
