Away Team,Home Team,Away Score, Home Score,Minute,Second,isScoringPosession,Desc.
Radford,West Virginia,0,0,0,13,0,Ed Polite Jr. missed Layup.
Radford,West Virginia,0,0,0,13,0,Radford Offensive Rebound.
Radford,West Virginia,0,0,0,21,0,Ed Polite Jr. Turnover.
Radford,West Virginia,0,0,0,24,0,Jevon Carter Steal.
Radford,West Virginia,0,0,0,26,0,Daxter Miles Jr. missed Three Point Jumper.
Radford,West Virginia,0,0,0,26,0,Christian Bradford Defensive Rebound.
Radford,West Virginia,0,0,0,50,0,Christian Bradford Turnover.
Radford,West Virginia,0,0,0,51,0,Nathan Adrian Steal.
Radford,West Virginia,0,2,1,4,1,Elijah Macon made Jumper.
Radford,West Virginia,2,2,1,27,1,Donald Hicks made Jumper. Assisted by Christian Bradford.
Radford,West Virginia,2,2,1,51,0,Elijah Macon missed Jumper.
Radford,West Virginia,2,2,1,51,0,Randy Phillips Defensive Rebound.
Radford,West Virginia,2,2,1,59,0,Justin Cousin missed Layup.
Radford,West Virginia,2,2,1,59,0,Jevon Carter Defensive Rebound.
Radford,West Virginia,2,2,2,6,0,Foul on Christian Bradford.
Radford,West Virginia,2,3,2,6,1,Esa Ahmad made Free Throw.
Radford,West Virginia,2,4,2,6,1,Esa Ahmad made Free Throw.
Radford,West Virginia,2,4,2,19,0,Donald Hicks missed Three Point Jumper.
Radford,West Virginia,2,4,2,19,0,Darius Bolstad Offensive Rebound.
Radford,West Virginia,2,4,2,20,0,Foul on Daxter Miles Jr..
Radford,West Virginia,5,4,2,36,1,Justin Cousin made Three Point Jumper.
Radford,West Virginia,5,6,2,54,1,Nathan Adrian made Layup.
Radford,West Virginia,5,6,3,4,0,Donald Hicks Turnover.
Radford,West Virginia,5,6,3,5,0,Brandon Watkins Steal.
Radford,West Virginia,5,8,3,20,1,Brandon Watkins made Jumper.
Radford,West Virginia,5,8,3,27,0,Ed Polite Jr. Turnover.
Radford,West Virginia,5,8,3,28,0,Brandon Watkins missed Jumper.
Radford,West Virginia,5,8,3,28,0,Darius Bolstad Defensive Rebound.
Radford,West Virginia,5,8,3,37,0,Justin Cousin Turnover.
Radford,West Virginia,5,8,3,50,0,Foul on Darius Bolstad.
Radford,West Virginia,5,9,3,50,1,Jevon Carter made Free Throw.
Radford,West Virginia,5,10,3,50,1,Jevon Carter made Free Throw.
Radford,West Virginia,5,10,3,50,0,Donald Hicks Turnover.
Radford,West Virginia,5,12,4,10,1,Esa Ahmad made Jumper. Assisted by Jevon Carter.
Radford,West Virginia,8,12,4,28,1,Caleb Tanner made Three Point Jumper. Assisted by Ed Polite Jr..
Radford,West Virginia,8,15,4,49,1,Nathan Adrian made Three Point Jumper. Assisted by Jevon Carter.
Radford,West Virginia,8,15,5,5,0,Justin Cousin missed Three Point Jumper.
Radford,West Virginia,8,15,5,5,0,Ed Polite Jr. Offensive Rebound.
Radford,West Virginia,10,15,5,9,1,Ed Polite Jr. made Layup.
Radford,West Virginia,10,15,5,27,0,Foul on Darius Bolstad.
Radford,West Virginia,10,15,5,27,0,Official TV Timeout
Radford,West Virginia,10,15,5,41,0,Sagaba Konate Turnover.
Radford,West Virginia,10,15,5,43,0,Christian Bradford Steal.
Radford,West Virginia,10,15,6,1,0,Caleb Tanner missed Three Point Jumper.
Radford,West Virginia,10,15,6,1,0,Tarik Phillip Defensive Rebound.
Radford,West Virginia,10,17,6,9,1,Teyvon Myers made Layup. Assisted by Tarik Phillip.
Radford,West Virginia,10,17,6,24,0,Donald Hicks missed Jumper.
Radford,West Virginia,10,17,6,24,0,Tarik Phillip Defensive Rebound.
Radford,West Virginia,10,19,6,30,1,Lamont West made Layup. Assisted by Tarik Phillip.
Radford,West Virginia,10,19,6,30,0,Foul on Caleb Tanner.
Radford,West Virginia,10,19,6,30,0,Lamont West missed Free Throw.
Radford,West Virginia,10,19,6,30,0,Sterling Christy Defensive Rebound.
Radford,West Virginia,13,19,6,41,1,Christian Lutete made Three Point Jumper. Assisted by Sterling Christy.
Radford,West Virginia,13,21,7,6,1,Sagaba Konate made Jumper.
Radford,West Virginia,13,21,7,20,0,Foul on Teyvon Myers.
Radford,West Virginia,13,21,7,39,0,Foul on Lamont West.
Radford,West Virginia,14,21,7,39,1,Caleb Tanner made Free Throw.
Radford,West Virginia,15,21,7,39,1,Caleb Tanner made Free Throw.
Radford,West Virginia,15,21,7,53,0,Elijah Macon missed Jumper.
Radford,West Virginia,15,21,7,53,0,Sterling Christy Defensive Rebound.
Radford,West Virginia,15,21,8,13,0,Randy Phillips Turnover.
Radford,West Virginia,15,21,8,13,0,Foul on Randy Phillips.
Radford,West Virginia,15,21,8,13,0,Official TV Timeout
Radford,West Virginia,15,21,8,38,0,Elijah Macon missed Layup.
Radford,West Virginia,15,21,8,38,0,Elijah Macon Offensive Rebound.
Radford,West Virginia,15,21,8,40,0,Elijah Macon missed Layup.
Radford,West Virginia,15,21,8,40,0,Nathan Adrian Offensive Rebound.
Radford,West Virginia,15,21,8,42,0,Nathan Adrian missed Layup.
Radford,West Virginia,15,21,8,42,0,Nathan Adrian Offensive Rebound.
Radford,West Virginia,15,23,8,45,1,Nathan Adrian made Layup.
Radford,West Virginia,15,23,9,19,0,Christian Lutete Turnover.
Radford,West Virginia,15,23,9,21,0,Elijah Macon Steal.
Radford,West Virginia,15,23,9,23,0,Elijah Macon missed Layup.
Radford,West Virginia,15,23,9,23,0,Teyvon Myers Offensive Rebound.
Radford,West Virginia,15,23,9,35,0,Teyvon Myers Turnover.
Radford,West Virginia,15,23,9,36,0,Randy Phillips Steal.
Radford,West Virginia,18,23,9,42,1,Justin Cousin made Three Point Jumper. Assisted by Ed Polite Jr..
Radford,West Virginia,18,23,9,56,0,Jevon Carter Turnover.
Radford,West Virginia,18,23,9,57,0,Ed Polite Jr. Steal.
Radford,West Virginia,18,23,10,5,0,Randy Phillips Turnover.
Radford,West Virginia,18,25,10,16,1,Tarik Phillip made Layup.
Radford,West Virginia,18,25,10,37,0,Randy Phillips Turnover.
Radford,West Virginia,18,25,10,57,0,Nathan Adrian Turnover.
Radford,West Virginia,18,25,10,58,0,Donald Hicks Steal.
Radford,West Virginia,18,25,11,10,0,Christian Bradford Turnover.
Radford,West Virginia,18,25,11,28,0,Foul on Donald Hicks.
Radford,West Virginia,18,27,11,35,1,Jevon Carter made Layup.
Radford,West Virginia,18,27,11,48,0,Devonnte Holland missed Layup.
Radford,West Virginia,18,27,11,48,0,Brandon Watkins Block.
Radford,West Virginia,18,27,11,49,0,Ed Polite Jr. Offensive Rebound.
Radford,West Virginia,18,27,11,51,0,Ed Polite Jr. Turnover.
Radford,West Virginia,18,27,11,52,0,Daxter Miles Jr. Steal.
Radford,West Virginia,18,27,11,54,0,Foul on Donald Hicks.
Radford,West Virginia,18,28,11,54,1,Daxter Miles Jr. made Free Throw.
Radford,West Virginia,18,29,11,54,1,Daxter Miles Jr. made Free Throw.
Radford,West Virginia,18,29,11,54,0,Justin Cousin Turnover.
Radford,West Virginia,18,29,12,10,0,Daxter Miles Jr. missed Layup.
Radford,West Virginia,18,29,12,10,0,Brandon Watkins Offensive Rebound.
Radford,West Virginia,18,29,12,11,0,Foul on Devonnte Holland.
Radford,West Virginia,18,29,12,11,0,Official TV Timeout
Radford,West Virginia,18,29,12,11,0,Brandon Watkins missed Free Throw.
Radford,West Virginia,18,29,12,11,0,West Virginia Deadball Team Rebound.
Radford,West Virginia,18,29,12,11,0,Brandon Watkins missed Free Throw.
Radford,West Virginia,18,29,12,11,0,Sterling Christy Defensive Rebound.
Radford,West Virginia,18,29,12,25,0,Foul on Brandon Watkins.
Radford,West Virginia,18,29,12,25,0,Devonnte Holland missed Free Throw.
Radford,West Virginia,18,29,12,25,0,Radford Deadball Team Rebound.
Radford,West Virginia,18,29,12,25,0,Devonnte Holland missed Free Throw.
Radford,West Virginia,18,29,12,25,0,Brandon Watkins Defensive Rebound.
Radford,West Virginia,18,29,12,37,0,Foul on Sterling Christy.
Radford,West Virginia,18,30,12,37,1,Jevon Carter made Free Throw.
Radford,West Virginia,18,30,12,37,0,Jevon Carter missed Free Throw.
Radford,West Virginia,18,30,12,37,0,Caleb Tanner Defensive Rebound.
Radford,West Virginia,18,30,12,50,0,Caleb Tanner missed Jumper.
Radford,West Virginia,18,30,12,50,0,Brandon Watkins Defensive Rebound.
Radford,West Virginia,18,30,12,57,0,Foul on Christian Bradford.
Radford,West Virginia,18,31,12,57,1,Jevon Carter made Free Throw.
Radford,West Virginia,18,31,12,57,0,Jevon Carter missed Free Throw.
Radford,West Virginia,18,31,12,57,0,Devonnte Holland Defensive Rebound.
Radford,West Virginia,18,31,13,13,0,Devonnte Holland Turnover.
Radford,West Virginia,18,31,13,14,0,Jevon Carter Steal.
Radford,West Virginia,18,33,13,17,1,Jevon Carter made Layup. Assisted by Tarik Phillip.
Radford,West Virginia,18,33,13,21,0,Radford  Timeout
Radford,West Virginia,18,33,13,33,0,Justin Cousin Turnover.
Radford,West Virginia,18,36,13,48,1,Tarik Phillip made Three Point Jumper.
Radford,West Virginia,18,36,14,0,0,Sterling Christy Turnover.
Radford,West Virginia,18,38,14,5,1,Jevon Carter made Jumper. Assisted by Esa Ahmad.
Radford,West Virginia,18,38,14,21,0,Randy Phillips Turnover.
Radford,West Virginia,18,38,14,22,0,Tarik Phillip Steal.
Radford,West Virginia,18,40,14,25,1,Tarik Phillip made Layup.
Radford,West Virginia,18,40,14,26,0,Radford  Timeout
Radford,West Virginia,18,40,14,39,0,Ed Polite Jr. Turnover.
Radford,West Virginia,18,40,14,41,0,Tarik Phillip Steal.
Radford,West Virginia,18,42,14,43,1,Esa Ahmad made Dunk. Assisted by Tarik Phillip.
Radford,West Virginia,18,42,15,1,0,Christian Bradford missed Layup.
Radford,West Virginia,18,42,15,1,0,Christian Lutete Offensive Rebound.
Radford,West Virginia,18,42,15,5,0,Foul on Brandon Watkins.
Radford,West Virginia,18,42,15,7,0,Christian Lutete missed Three Point Jumper.
Radford,West Virginia,18,42,15,7,0,Tarik Phillip Defensive Rebound.
Radford,West Virginia,18,42,15,14,0,Nathan Adrian missed Three Point Jumper.
Radford,West Virginia,18,42,15,14,0,Radford Defensive Rebound.
Radford,West Virginia,18,42,15,19,0,Ed Polite Jr. Turnover.
Radford,West Virginia,18,44,15,39,1,Esa Ahmad made Dunk. Assisted by Nathan Adrian.
Radford,West Virginia,18,44,16,13,0,Sterling Christy missed Three Point Jumper.
Radford,West Virginia,18,44,16,13,0,Jevon Carter Defensive Rebound.
Radford,West Virginia,18,46,16,19,1,Daxter Miles Jr. made Layup. Assisted by Nathan Adrian.
Radford,West Virginia,18,46,16,42,0,Ed Polite Jr. missed Three Point Jumper.
Radford,West Virginia,18,46,16,42,0,Sterling Christy Offensive Rebound.
Radford,West Virginia,20,46,16,55,1,Christian Lutete made Jumper.
Radford,West Virginia,20,46,17,16,0,Daxter Miles Jr. missed Layup.
Radford,West Virginia,20,46,17,16,0,Randy Phillips Defensive Rebound.
Radford,West Virginia,20,46,17,17,0,Foul on Sagaba Konate.
Radford,West Virginia,20,46,17,17,0,Official TV Timeout
Radford,West Virginia,20,46,17,32,0,Donald Hicks Turnover.
Radford,West Virginia,20,46,17,38,0,Tarik Phillip Turnover.
Radford,West Virginia,20,46,17,39,0,Ed Polite Jr. Steal.
Radford,West Virginia,20,46,17,42,0,Ed Polite Jr. missed Layup.
Radford,West Virginia,20,46,17,42,0,Lamont West Block.
Radford,West Virginia,20,46,17,42,0,Radford Offensive Rebound.
Radford,West Virginia,20,46,17,58,0,Foul on Elijah Macon.
Radford,West Virginia,20,46,17,58,0,Donald Hicks missed Free Throw.
Radford,West Virginia,20,46,17,58,0,Jevon Carter Defensive Rebound.
Radford,West Virginia,20,46,18,6,0,Foul on Randy Phillips.
Radford,West Virginia,20,47,18,6,1,Esa Ahmad made Free Throw.
Radford,West Virginia,20,47,18,6,0,Esa Ahmad missed Free Throw.
Radford,West Virginia,20,47,18,6,0,Lamont West Offensive Rebound.
Radford,West Virginia,20,47,18,6,0,Lamont West missed Layup.
Radford,West Virginia,20,47,18,6,0,Esa Ahmad Offensive Rebound.
Radford,West Virginia,20,50,18,11,1,Jevon Carter made Three Point Jumper. Assisted by Lamont West.
Radford,West Virginia,20,50,18,46,0,Donald Hicks missed Jumper.
Radford,West Virginia,20,50,18,46,0,Esa Ahmad Defensive Rebound.
Radford,West Virginia,20,50,18,57,0,Foul on Ed Polite Jr..
Radford,West Virginia,20,50,18,57,0,Esa Ahmad missed Free Throw.
Radford,West Virginia,20,50,18,57,0,West Virginia Deadball Team Rebound.
Radford,West Virginia,20,51,18,57,1,Esa Ahmad made Free Throw.
Radford,West Virginia,20,51,18,58,0,Randy Phillips Turnover.
Radford,West Virginia,20,51,19,20,0,Tarik Phillip missed Jumper.
Radford,West Virginia,20,51,19,20,0,Daxter Miles Jr. Offensive Rebound.
Radford,West Virginia,20,53,19,22,1,Daxter Miles Jr. made Dunk.
Radford,West Virginia,22,53,19,41,1,Randy Phillips made Layup. Assisted by Christian Bradford.
Radford,West Virginia,22,53,19,58,0,Teyvon Myers missed Jumper.
Radford,West Virginia,22,53,19,58,0,Randy Phillips Defensive Rebound.
Radford,West Virginia,22,53,20,0,0,End of 1st half
Radford,West Virginia,22,53,20,7,0,Esa Ahmad missed Three Point Jumper.
Radford,West Virginia,22,53,20,7,0,Radford Defensive Rebound.
Radford,West Virginia,22,53,20,30,0,Foul on Esa Ahmad.
Radford,West Virginia,23,53,20,30,1,Christian Bradford made Free Throw.
Radford,West Virginia,24,53,20,30,1,Christian Bradford made Free Throw.
Radford,West Virginia,24,53,20,43,0,Nathan Adrian Turnover.
Radford,West Virginia,27,53,20,54,1,Justin Cousin made Three Point Jumper. Assisted by Ed Polite Jr..
Radford,West Virginia,27,53,21,13,0,Esa Ahmad missed Layup.
Radford,West Virginia,27,53,21,13,0,Esa Ahmad Offensive Rebound.
Radford,West Virginia,27,55,21,15,1,Esa Ahmad made Layup.
Radford,West Virginia,27,55,21,40,0,Foul on Elijah Macon.
Radford,West Virginia,27,55,21,40,0,Randy Phillips missed Free Throw.
Radford,West Virginia,27,55,21,40,0,Radford Deadball Team Rebound.
Radford,West Virginia,27,55,21,40,0,Randy Phillips missed Free Throw.
Radford,West Virginia,27,55,21,40,0,Radford Offensive Rebound.
Radford,West Virginia,27,55,21,57,0,Donald Hicks Turnover.
Radford,West Virginia,27,55,21,58,0,Teyvon Myers Steal.
Radford,West Virginia,27,55,22,4,0,Teyvon Myers missed Jumper.
Radford,West Virginia,27,55,22,4,0,Brandon Watkins Offensive Rebound.
Radford,West Virginia,27,55,22,6,0,Foul on Ed Polite Jr..
Radford,West Virginia,27,56,22,6,1,Brandon Watkins made Free Throw.
Radford,West Virginia,27,56,22,6,0,Ed Polite Jr. Turnover.
Radford,West Virginia,27,56,22,7,0,Foul on Christian Bradford.
Radford,West Virginia,27,58,22,7,1,Brandon Watkins made Layup.
Radford,West Virginia,27,58,22,17,0,Brandon Watkins Turnover.
Radford,West Virginia,27,58,22,18,0,Randy Phillips Steal.
Radford,West Virginia,27,58,22,27,0,Christian Bradford missed Jumper.
Radford,West Virginia,27,58,22,27,0,Brandon Watkins Defensive Rebound.
Radford,West Virginia,27,58,22,37,0,Teyvon Myers missed Layup.
Radford,West Virginia,27,58,22,37,0,Maciej Bender Offensive Rebound.
Radford,West Virginia,27,58,22,39,0,Maciej Bender missed Layup.
Radford,West Virginia,27,58,22,39,0,James Long Offensive Rebound.
Radford,West Virginia,27,58,22,58,0,Foul on Christian Lutete.
Radford,West Virginia,27,58,23,3,0,James Long missed Three Point Jumper.
Radford,West Virginia,27,58,23,3,0,Christian Lutete Defensive Rebound.
Radford,West Virginia,27,58,23,9,0,Christian Lutete Turnover.
Radford,West Virginia,27,60,23,21,1,Brandon Watkins made Dunk. Assisted by Jevon Carter.
Radford,West Virginia,27,60,23,36,0,Justin Cousin Turnover.
Radford,West Virginia,27,60,23,47,0,Tarik Phillip missed Three Point Jumper.
Radford,West Virginia,27,60,23,47,0,Maciej Bender Offensive Rebound.
Radford,West Virginia,27,60,23,58,0,Foul on Darius Bolstad.
Radford,West Virginia,27,61,23,58,1,Maciej Bender made Free Throw.
Radford,West Virginia,27,61,23,58,0,Maciej Bender missed Free Throw.
Radford,West Virginia,27,61,23,58,0,Caleb Tanner Defensive Rebound.
Radford,West Virginia,27,61,24,17,0,Darius Bolstad missed Layup.
Radford,West Virginia,27,61,24,17,0,Maciej Bender Defensive Rebound.
Radford,West Virginia,27,61,24,21,0,Tarik Phillip Turnover.
Radford,West Virginia,27,61,24,23,0,Official TV Timeout
Radford,West Virginia,27,61,24,38,0,Foul on Brandon Watkins.
Radford,West Virginia,28,61,24,38,1,Darius Bolstad made Free Throw.
Radford,West Virginia,29,61,24,38,1,Darius Bolstad made Free Throw.
Radford,West Virginia,29,61,24,53,0,Foul on Darius Bolstad.
Radford,West Virginia,29,61,24,53,0,Sagaba Konate missed Free Throw.
Radford,West Virginia,29,61,24,53,0,West Virginia Deadball Team Rebound.
Radford,West Virginia,29,62,24,53,1,Sagaba Konate made Free Throw.
Radford,West Virginia,31,62,24,58,1,Christian Lutete made Jumper. Assisted by Sterling Christy.
Radford,West Virginia,31,62,25,23,0,Maciej Bender missed Layup.
Radford,West Virginia,31,62,25,23,0,Sterling Christy Defensive Rebound.
Radford,West Virginia,31,62,25,34,0,Caleb Tanner missed Layup.
Radford,West Virginia,31,62,25,34,0,Sagaba Konate Block.
Radford,West Virginia,31,62,25,36,0,Tarik Phillip Defensive Rebound.
Radford,West Virginia,31,64,25,49,1,Tarik Phillip made Jumper.
Radford,West Virginia,34,64,26,15,1,Caleb Tanner made Three Point Jumper. Assisted by Christian Bradford.
Radford,West Virginia,34,64,26,51,0,Nathan Adrian Turnover.
Radford,West Virginia,36,64,27,5,1,Caleb Tanner made Jumper.
Radford,West Virginia,36,64,27,20,0,Sagaba Konate missed Jumper.
Radford,West Virginia,36,64,27,20,0,Radford Defensive Rebound.
Radford,West Virginia,36,64,27,30,0,Foul on Elijah Macon.
Radford,West Virginia,37,64,27,30,1,Ed Polite Jr. made Free Throw.
Radford,West Virginia,37,64,27,30,0,Ed Polite Jr. missed Free Throw.
Radford,West Virginia,37,64,27,30,0,Nathan Adrian Defensive Rebound.
Radford,West Virginia,37,64,27,59,0,Nathan Adrian missed Jumper.
Radford,West Virginia,37,64,27,59,0,Ed Polite Jr. Defensive Rebound.
Radford,West Virginia,37,64,28,0,0,Foul on Nathan Adrian.
Radford,West Virginia,37,64,28,26,0,Caleb Tanner missed Three Point Jumper.
Radford,West Virginia,37,64,28,26,0,West Virginia Defensive Rebound.
Radford,West Virginia,37,64,28,30,0,Official TV Timeout
Radford,West Virginia,37,64,28,45,0,Elijah Macon missed Jumper.
Radford,West Virginia,37,64,28,45,0,Randy Phillips Defensive Rebound.
Radford,West Virginia,37,64,28,54,0,Caleb Tanner missed Three Point Jumper.
Radford,West Virginia,37,64,28,54,0,Randy Phillips Offensive Rebound.
Radford,West Virginia,39,64,28,58,1,Randy Phillips made Layup.
Radford,West Virginia,39,64,29,8,0,Daxter Miles Jr. missed Three Point Jumper.
Radford,West Virginia,39,64,29,8,0,Nathan Adrian Offensive Rebound.
Radford,West Virginia,39,64,29,13,0,Foul on Ed Polite Jr..
Radford,West Virginia,39,64,29,14,0,James Bolden missed Jumper.
Radford,West Virginia,39,64,29,14,0,Sterling Christy Defensive Rebound.
Radford,West Virginia,39,64,29,28,0,Foul on Esa Ahmad.
Radford,West Virginia,40,64,29,28,1,Devonnte Holland made Free Throw.
Radford,West Virginia,40,64,29,28,0,Devonnte Holland missed Free Throw.
Radford,West Virginia,40,64,29,28,0,Nathan Adrian Defensive Rebound.
Radford,West Virginia,40,66,29,45,1,Jevon Carter made Layup.
Radford,West Virginia,40,66,29,57,0,Donald Hicks Turnover.
Radford,West Virginia,40,68,29,57,1,Daxter Miles Jr. made Layup. Assisted by Jevon Carter.
Radford,West Virginia,40,68,30,12,0,Christian Bradford Turnover.
Radford,West Virginia,40,68,30,13,0,Daxter Miles Jr. Steal.
Radford,West Virginia,40,68,30,17,0,James Bolden missed Three Point Jumper.
Radford,West Virginia,40,68,30,17,0,Nathan Adrian Offensive Rebound.
Radford,West Virginia,40,68,30,23,0,Foul on Devonnte Holland.
Radford,West Virginia,40,68,30,23,0,Nathan Adrian missed Free Throw.
Radford,West Virginia,40,68,30,23,0,Sterling Christy Defensive Rebound.
Radford,West Virginia,40,68,30,30,0,Christian Lutete Turnover.
Radford,West Virginia,40,70,30,58,1,Nathan Adrian made Jumper.
Radford,West Virginia,40,70,31,11,0,Devonnte Holland missed Layup.
Radford,West Virginia,40,70,31,11,0,Sterling Christy Offensive Rebound.
Radford,West Virginia,40,70,31,15,0,Sterling Christy missed Layup.
Radford,West Virginia,40,70,31,15,0,Jevon Carter Defensive Rebound.
Radford,West Virginia,40,70,31,25,0,Nathan Adrian missed Layup.
Radford,West Virginia,40,70,31,25,0,Daxter Miles Jr. Offensive Rebound.
Radford,West Virginia,40,70,31,26,0,Foul on Donald Hicks.
Radford,West Virginia,40,70,31,26,0,Daxter Miles Jr. missed Free Throw.
Radford,West Virginia,40,70,31,26,0,West Virginia Deadball Team Rebound.
Radford,West Virginia,40,70,31,26,0,Daxter Miles Jr. missed Free Throw.
Radford,West Virginia,40,70,31,26,0,Randy Phillips Defensive Rebound.
Radford,West Virginia,42,70,31,40,1,Donald Hicks made Jumper.
Radford,West Virginia,42,70,32,1,0,Daxter Miles Jr. Turnover.
Radford,West Virginia,42,70,32,30,0,Justin Cousin missed Three Point Jumper.
Radford,West Virginia,42,70,32,30,0,Esa Ahmad Defensive Rebound.
Radford,West Virginia,42,73,32,44,1,Esa Ahmad made Three Point Jumper. Assisted by Jevon Carter.
Radford,West Virginia,45,73,33,6,1,Justin Cousin made Three Point Jumper. Assisted by Ed Polite Jr..
Radford,West Virginia,45,75,33,31,1,Maciej Bender made Layup.
Radford,West Virginia,45,75,33,45,0,Caleb Tanner Turnover.
Radford,West Virginia,45,75,33,46,0,Jevon Carter Steal.
Radford,West Virginia,45,75,33,56,0,Foul on Randy Phillips.
Radford,West Virginia,45,75,33,56,0,Esa Ahmad missed Free Throw.
Radford,West Virginia,45,75,33,56,0,West Virginia Deadball Team Rebound.
Radford,West Virginia,45,75,33,56,0,Esa Ahmad missed Free Throw.
Radford,West Virginia,45,75,33,56,0,Ed Polite Jr. Defensive Rebound.
Radford,West Virginia,45,75,33,56,0,Foul on Jevon Carter.
Radford,West Virginia,45,75,33,56,0,Ed Polite Jr. missed Free Throw.
Radford,West Virginia,45,75,33,56,0,Donald Hicks Offensive Rebound.
Radford,West Virginia,45,75,33,59,0,Foul on Maciej Bender.
Radford,West Virginia,45,75,33,59,0,Donald Hicks missed Free Throw.
Radford,West Virginia,45,75,33,59,0,Radford Deadball Team Rebound.
Radford,West Virginia,46,75,33,59,1,Donald Hicks made Free Throw.
Radford,West Virginia,46,75,34,27,0,Foul on Caleb Tanner.
Radford,West Virginia,46,75,34,27,0,Tarik Phillip missed Free Throw.
Radford,West Virginia,46,75,34,27,0,West Virginia Deadball Team Rebound.
Radford,West Virginia,46,76,34,27,1,Tarik Phillip made Free Throw.
Radford,West Virginia,46,76,34,37,0,Foul on Esa Ahmad.
Radford,West Virginia,47,76,34,37,1,Darius Bolstad made Free Throw.
Radford,West Virginia,48,76,34,37,1,Darius Bolstad made Free Throw.
Radford,West Virginia,48,76,34,54,0,Chase Harler missed Layup.
Radford,West Virginia,48,76,34,54,0,Darius Bolstad Block.
Radford,West Virginia,48,76,34,56,0,Darius Bolstad Defensive Rebound.
Radford,West Virginia,48,76,35,10,0,Darius Bolstad missed Layup.
Radford,West Virginia,48,76,35,10,0,Maciej Bender Block.
Radford,West Virginia,48,76,35,11,0,Ed Polite Jr. Offensive Rebound.
Radford,West Virginia,50,76,35,14,1,Ed Polite Jr. made Layup.
Radford,West Virginia,50,76,35,35,0,Maciej Bender missed Three Point Jumper.
Radford,West Virginia,50,76,35,35,0,James Bolden Offensive Rebound.
Radford,West Virginia,50,78,35,50,1,Chase Harler made Layup. Assisted by Tarik Phillip.
Radford,West Virginia,50,78,36,17,0,Darius Bolstad missed Layup.
Radford,West Virginia,50,78,36,17,0,James Bolden Defensive Rebound.
Radford,West Virginia,50,81,36,27,1,Tarik Phillip made Three Point Jumper.
Radford,West Virginia,50,81,36,55,0,Foul on James Bolden.
Radford,West Virginia,50,81,36,58,0,Official TV Timeout
Radford,West Virginia,50,81,36,58,0,Donald Hicks missed Free Throw.
Radford,West Virginia,50,81,36,58,0,Radford Deadball Team Rebound.
Radford,West Virginia,51,81,36,58,1,Donald Hicks made Free Throw.
Radford,West Virginia,51,83,37,16,1,Esa Ahmad made Layup.
Radford,West Virginia,51,83,37,50,0,Foul on James Bolden.
Radford,West Virginia,52,83,37,50,1,Christian Bradford made Free Throw.
Radford,West Virginia,53,83,37,50,1,Christian Bradford made Free Throw.
Radford,West Virginia,54,83,37,50,1,Christian Bradford made Free Throw.
Radford,West Virginia,54,83,38,17,0,James Bolden missed Jumper.
Radford,West Virginia,54,83,38,17,0,Sterling Christy Defensive Rebound.
Radford,West Virginia,54,83,38,24,0,Caleb Tanner missed Layup.
Radford,West Virginia,54,83,38,24,0,Maciej Bender Defensive Rebound.
Radford,West Virginia,54,83,38,53,0,Chase Harler missed Three Point Jumper.
Radford,West Virginia,54,83,38,53,0,Christian Bradford Defensive Rebound.
Radford,West Virginia,54,83,39,3,0,Christian Lutete missed Layup.
Radford,West Virginia,54,83,39,3,0,James Bolden Block.
Radford,West Virginia,54,83,39,3,0,Radford Offensive Rebound.
Radford,West Virginia,57,83,39,17,1,Sterling Christy made Three Point Jumper. Assisted by Christian Bradford.
Radford,West Virginia,57,83,39,41,0,Foul on Christian Lutete.
Radford,West Virginia,57,83,39,41,0,Logan Routt missed Free Throw.
Radford,West Virginia,57,83,39,41,0,West Virginia Deadball Team Rebound.
Radford,West Virginia,57,84,39,41,1,Logan Routt made Free Throw.
Radford,West Virginia,57,84,39,51,0,Devonnte Holland missed Layup.
Radford,West Virginia,57,84,39,51,0,Maciej Bender Block.
Radford,West Virginia,57,84,39,52,0,Christian Bradford Offensive Rebound.
Radford,West Virginia,57,84,39,54,0,Christian Bradford missed Three Point Jumper.
Radford,West Virginia,57,84,39,54,0,Sterling Christy Offensive Rebound.
Radford,West Virginia,57,84,39,58,0,Brian Rodriguez missed Three Point Jumper.
Radford,West Virginia,57,84,39,58,0,Logan Routt Defensive Rebound.
Radford,West Virginia,57,84,40,0,0,End of Game
