Away Team,Home Team,Away Score,Home Score,Minute,Second,isScoringPosession,Desc.
Oakwood,Alabama A&M;,0,2,0,6,1,Tyler Davis made Layup. Assisted by Jeremy Crutcher.
Oakwood,Alabama A&M;,0,2,0,28,0,Tim Wright missed Jumper.
Oakwood,Alabama A&M;,0,2,0,28,0,Jose Long Defensive Rebound.
Oakwood,Alabama A&M;,0,2,1,5,0,Alabama A&M;  Turnover.
Oakwood,Alabama A&M;,0,2,1,14,0,Simon Jacob Turnover.
Oakwood,Alabama A&M;,0,2,1,25,0,Jose Long Turnover.
Oakwood,Alabama A&M;,0,2,1,27,0,Ronnie Clark Steal.
Oakwood,Alabama A&M;,0,2,1,39,0,Oakwood  Timeout
Oakwood,Alabama A&M;,0,2,2,0,0,Tim Wright missed Jumper.
Oakwood,Alabama A&M;,0,2,2,0,0,Jose Long Defensive Rebound.
Oakwood,Alabama A&M;,0,2,2,7,0,Tyler Davis missed Three Point Jumper.
Oakwood,Alabama A&M;,0,2,2,17,0,Cory McLean Defensive Rebound.
Oakwood,Alabama A&M;,0,2,2,17,0,Ronnie Clark missed Jumper.
Oakwood,Alabama A&M;,0,2,2,17,0,Oakwood Offensive Rebound.
Oakwood,Alabama A&M;,0,2,2,20,0,Foul on Jerome Hunter.
Oakwood,Alabama A&M;,0,2,2,20,0,Simon Jacob Turnover.
Oakwood,Alabama A&M;,0,2,2,20,0,Jeremy Crutcher Steal.
Oakwood,Alabama A&M;,0,2,2,27,0,Foul on Ronnie Clark.
Oakwood,Alabama A&M;,0,3,2,35,1,Jeremy Crutcher made Free Throw.
Oakwood,Alabama A&M;,0,4,2,46,1,Jeremy Crutcher made Free Throw.
Oakwood,Alabama A&M;,0,4,3,13,0,Ronnie Clark missed Jumper.
Oakwood,Alabama A&M;,0,4,3,13,0,Alabama A&M; Defensive Rebound.
Oakwood,Alabama A&M;,0,4,3,13,0,Jeremy Crutcher missed Three Point Jumper.
Oakwood,Alabama A&M;,0,4,3,13,0,Tim Wright Defensive Rebound.
Oakwood,Alabama A&M;,3,4,3,18,1,Ed Pekote made Three Point Jumper. Assisted by Ronnie Clark.
Oakwood,Alabama A&M;,3,4,3,32,0,Jerome Hunter missed Jumper.
Oakwood,Alabama A&M;,3,4,3,32,0,Alabama A&M; Offensive Rebound.
Oakwood,Alabama A&M;,3,6,3,37,1,Jerome Hunter made Layup. Assisted by Jeremy Crutcher.
Oakwood,Alabama A&M;,3,6,4,4,0,Cory McLean Turnover.
Oakwood,Alabama A&M;,3,6,4,5,0,Tyler Davis Steal.
Oakwood,Alabama A&M;,3,8,4,9,1,Brandon Ellis made Layup. Assisted by Jeremy Crutcher.
Oakwood,Alabama A&M;,3,8,4,30,0,Foul on Tim Wright.
Oakwood,Alabama A&M;,3,8,4,30,0,Tim Wright Turnover.
Oakwood,Alabama A&M;,3,8,4,30,0,Official TV Timeout
Oakwood,Alabama A&M;,3,10,4,45,1,Jeremy Crutcher made Layup. Assisted by Brandon Ellis.
Oakwood,Alabama A&M;,3,10,5,13,0,Ed Pekote missed Three Point Jumper.
Oakwood,Alabama A&M;,3,10,5,13,0,Jerome Hunter Defensive Rebound.
Oakwood,Alabama A&M;,3,12,5,21,1,Brandon Ellis made Layup.
Oakwood,Alabama A&M;,3,12,5,21,0,Foul on Ronnie Clark.
Oakwood,Alabama A&M;,3,13,5,21,1,Brandon Ellis made Free Throw.
Oakwood,Alabama A&M;,3,13,5,39,0,Tim Wright missed Jumper.
Oakwood,Alabama A&M;,3,13,5,39,0,Brandon Ellis Block.
Oakwood,Alabama A&M;,3,13,5,39,0,Oakwood Offensive Rebound.
Oakwood,Alabama A&M;,3,13,5,48,0,Frank Hyppolite missed Jumper.
Oakwood,Alabama A&M;,3,13,5,48,0,Justan Banks Defensive Rebound.
Oakwood,Alabama A&M;,3,16,6,2,1,Tyler Davis made Three Point Jumper. Assisted by Demarquelle Tabb.
Oakwood,Alabama A&M;,3,16,6,22,0,Foul on Tyler Davis.
Oakwood,Alabama A&M;,3,16,6,36,0,Dominic Pierre Louis Turnover.
Oakwood,Alabama A&M;,3,16,6,37,0,Justin Colvin Turnover.
Oakwood,Alabama A&M;,3,16,6,39,0,Frank Hyppolite Steal.
Oakwood,Alabama A&M;,5,16,6,41,1,Jordan Riley made Layup. Assisted by Frank Hyppolite.
Oakwood,Alabama A&M;,5,18,7,5,1,Demarquelle Tabb made Jumper. Assisted by Green Hill.
Oakwood,Alabama A&M;,5,18,7,25,0,Max Caines missed Jumper.
Oakwood,Alabama A&M;,5,18,7,25,0,Tim Wright Offensive Rebound.
Oakwood,Alabama A&M;,5,18,7,32,0,Tim Wright missed Layup.
Oakwood,Alabama A&M;,5,18,7,32,0,Demarquelle Tabb Block.
Oakwood,Alabama A&M;,5,18,7,33,0,Arthur Capers Defensive Rebound.
Oakwood,Alabama A&M;,5,18,7,37,0,Foul on Max Caines.
Oakwood,Alabama A&M;,5,20,7,50,1,Justan Banks made Dunk. Assisted by Demarquelle Tabb.
Oakwood,Alabama A&M;,5,20,8,11,0,Official TV Timeout
Oakwood,Alabama A&M;,5,20,8,23,0,Dominic Pierre Louis missed Layup.
Oakwood,Alabama A&M;,5,20,8,23,0,Dominic Pierre Louis Offensive Rebound.
Oakwood,Alabama A&M;,5,20,8,27,0,Dominic Pierre Louis missed Layup.
Oakwood,Alabama A&M;,5,20,8,27,0,Justan Banks Block.
Oakwood,Alabama A&M;,5,20,8,29,0,Justan Banks Defensive Rebound.
Oakwood,Alabama A&M;,5,20,8,35,0,Justin Colvin Turnover.
Oakwood,Alabama A&M;,8,20,9,1,1,Jordan Riley made Three Point Jumper. Assisted by Frank Hyppolite.
Oakwood,Alabama A&M;,8,20,9,12,0,Justan Banks Turnover.
Oakwood,Alabama A&M;,8,20,9,14,0,Tim Wright Steal.
Oakwood,Alabama A&M;,8,20,9,29,0,Max Caines missed Jumper.
Oakwood,Alabama A&M;,8,20,9,29,0,Demarquelle Tabb Defensive Rebound.
Oakwood,Alabama A&M;,8,20,9,39,0,Justin Colvin missed Three Point Jumper.
Oakwood,Alabama A&M;,8,20,9,39,0,Ed Pekote Defensive Rebound.
Oakwood,Alabama A&M;,8,20,10,4,0,Ed Pekote missed Three Point Jumper.
Oakwood,Alabama A&M;,8,20,10,4,0,Jordan Riley Offensive Rebound.
Oakwood,Alabama A&M;,8,20,10,16,0,Jordan Riley missed Three Point Jumper.
Oakwood,Alabama A&M;,8,20,10,16,0,Arthur Capers Defensive Rebound.
Oakwood,Alabama A&M;,8,20,10,17,0,Foul on Ronnie Clark.
Oakwood,Alabama A&M;,8,20,10,30,0,Demarquelle Tabb missed Jumper.
Oakwood,Alabama A&M;,8,20,10,30,0,Max Caines Defensive Rebound.
Oakwood,Alabama A&M;,11,20,10,42,1,Ronnie Clark made Three Point Jumper. Assisted by Simon Jacob.
Oakwood,Alabama A&M;,11,20,10,58,0,Justin Colvin missed Jumper.
Oakwood,Alabama A&M;,11,20,10,58,0,Justin Colvin Offensive Rebound.
Oakwood,Alabama A&M;,11,22,11,4,1,Justin Colvin made Layup.
Oakwood,Alabama A&M;,11,22,11,12,0,Jordan Riley Turnover.
Oakwood,Alabama A&M;,11,22,11,13,0,Justin Colvin Steal.
Oakwood,Alabama A&M;,11,24,11,15,1,Justin Colvin made Dunk.
Oakwood,Alabama A&M;,11,24,11,26,0,Technical Foul on Cory McLean.
Oakwood,Alabama A&M;,12,24,11,34,1,Ronnie Clark made Free Throw.
Oakwood,Alabama A&M;,13,24,11,34,1,Ronnie Clark made Free Throw.
Oakwood,Alabama A&M;,15,24,11,34,1,Max Caines made Dunk. Assisted by Simon Jacob.
Oakwood,Alabama A&M;,15,24,11,39,0,Foul on Max Caines.
Oakwood,Alabama A&M;,15,24,11,40,0,Green Hill missed Three Point Jumper.
Oakwood,Alabama A&M;,15,24,11,40,0,Justan Banks Offensive Rebound.
Oakwood,Alabama A&M;,15,26,11,44,1,Justan Banks made Layup.
Oakwood,Alabama A&M;,15,26,12,11,0,Jordan Riley Turnover.
Oakwood,Alabama A&M;,15,26,12,11,0,Official TV Timeout
Oakwood,Alabama A&M;,15,26,12,18,0,Justan Banks missed Layup.
Oakwood,Alabama A&M;,15,26,12,18,0,Simon Jacob Defensive Rebound.
Oakwood,Alabama A&M;,15,26,12,35,0,Ryan Johnson Turnover.
Oakwood,Alabama A&M;,15,26,12,40,0,Baryn Houston Steal.
Oakwood,Alabama A&M;,15,28,12,44,1,Baryn Houston made Dunk.
Oakwood,Alabama A&M;,15,28,12,55,0,Tim Wright Turnover.
Oakwood,Alabama A&M;,15,28,12,55,0,Oakwood  Timeout
Oakwood,Alabama A&M;,15,28,13,5,0,Baryn Houston missed Three Point Jumper.
Oakwood,Alabama A&M;,15,28,13,5,0,Green Hill Offensive Rebound.
Oakwood,Alabama A&M;,15,28,13,22,0,Green Hill missed Jumper.
Oakwood,Alabama A&M;,15,28,13,22,0,Justan Banks Offensive Rebound.
Oakwood,Alabama A&M;,15,30,13,25,1,Justan Banks made Dunk.
Oakwood,Alabama A&M;,15,30,13,31,0,John Davis missed Jumper.
Oakwood,Alabama A&M;,15,30,13,31,0,Nicholas West Defensive Rebound.
Oakwood,Alabama A&M;,15,30,13,38,0,Nicholas West Turnover.
Oakwood,Alabama A&M;,15,30,13,38,0,Ryan Johnson Turnover.
Oakwood,Alabama A&M;,15,30,13,46,0,Foul on Cory McLean.
Oakwood,Alabama A&M;,15,30,13,46,0,Justan Banks missed Free Throw.
Oakwood,Alabama A&M;,15,30,13,46,0,Alabama A&M; Deadball Team Rebound.
Oakwood,Alabama A&M;,15,30,13,46,0,Justan Banks missed Free Throw.
Oakwood,Alabama A&M;,15,30,13,46,0,Oakwood Defensive Rebound.
Oakwood,Alabama A&M;,15,30,14,4,0,Cory McLean missed Jumper.
Oakwood,Alabama A&M;,15,30,14,4,0,Justan Banks Defensive Rebound.
Oakwood,Alabama A&M;,15,33,14,32,1,Baryn Houston made Three Point Jumper. Assisted by Green Hill.
Oakwood,Alabama A&M;,15,33,15,5,0,Cory McLean missed Layup.
Oakwood,Alabama A&M;,15,33,15,5,0,Justan Banks Block.
Oakwood,Alabama A&M;,15,33,15,7,0,Justan Banks Defensive Rebound.
Oakwood,Alabama A&M;,15,33,15,22,0,Green Hill Turnover.
Oakwood,Alabama A&M;,15,33,15,23,0,Brandon Daniels Steal.
Oakwood,Alabama A&M;,17,33,15,28,1,Frank Hyppolite made Layup.
Oakwood,Alabama A&M;,17,33,15,45,0,Baryn Houston missed Three Point Jumper.
Oakwood,Alabama A&M;,17,33,15,45,0,Cory McLean Defensive Rebound.
Oakwood,Alabama A&M;,17,33,15,50,0,Rakia Battle Turnover.
Oakwood,Alabama A&M;,19,33,15,50,1,Simon Jacob made Layup.
Oakwood,Alabama A&M;,19,33,15,50,0,Baryn Houston missed Layup.
Oakwood,Alabama A&M;,19,33,15,50,0,Ed Pekote Defensive Rebound.
Oakwood,Alabama A&M;,19,33,15,50,0,Frank Hyppolite Turnover.
Oakwood,Alabama A&M;,19,33,15,50,0,Matthew Cotton Steal.
Oakwood,Alabama A&M;,19,33,15,50,0,Nicholas West missed Three Point Jumper.
Oakwood,Alabama A&M;,19,33,15,50,0,Xavier Williams Offensive Rebound.
Oakwood,Alabama A&M;,19,33,15,50,0,Foul on Frank Hyppolite.
Oakwood,Alabama A&M;,19,33,15,51,0,Xavier Williams missed Free Throw.
Oakwood,Alabama A&M;,19,33,15,51,0,Alabama A&M; Deadball Team Rebound.
Oakwood,Alabama A&M;,19,34,15,55,1,Xavier Williams made Free Throw.
Oakwood,Alabama A&M;,21,34,16,0,1,Ronnie Clark made Layup.
Oakwood,Alabama A&M;,21,34,16,10,0,Nicholas West Turnover.
Oakwood,Alabama A&M;,21,36,18,25,1,Baryn Houston made Jumper.
Oakwood,Alabama A&M;,21,36,18,38,0,Jordan Riley missed Jumper.
Oakwood,Alabama A&M;,21,36,18,38,0,Nicholas West Defensive Rebound.
Oakwood,Alabama A&M;,21,36,18,44,0,Matthew Cotton missed Three Point Jumper.
Oakwood,Alabama A&M;,21,36,18,44,0,Jordan Riley Defensive Rebound.
Oakwood,Alabama A&M;,21,36,19,5,0,Tim Wright missed Jumper.
Oakwood,Alabama A&M;,21,36,19,5,0,Xavier Williams Defensive Rebound.
Oakwood,Alabama A&M;,21,36,19,17,0,Rakia Battle Turnover.
Oakwood,Alabama A&M;,21,36,19,53,0,Caleb Blount missed Jumper.
Oakwood,Alabama A&M;,21,36,19,53,0,Rakia Battle Defensive Rebound.
Oakwood,Alabama A&M;,21,36,19,58,0,Rakia Battle missed Three Point Jumper.
Oakwood,Alabama A&M;,21,36,19,58,0,Oakwood Defensive Rebound.
Oakwood,Alabama A&M;,21,36,20,0,0,End of 1st half
Oakwood,Alabama A&M;,25,38,20,35,1,Ronnie Clark made Three Point Jumper.
Oakwood,Alabama A&M;,25,38,20,40,0,Jose Long missed Jumper.
Oakwood,Alabama A&M;,25,38,20,40,0,Jerome Hunter Offensive Rebound.
Oakwood,Alabama A&M;,25,40,20,45,1,Jerome Hunter made Layup.
Oakwood,Alabama A&M;,25,40,20,49,0,Tim Wright missed Jumper.
Oakwood,Alabama A&M;,25,40,20,49,0,Jerome Hunter Defensive Rebound.
Oakwood,Alabama A&M;,25,40,20,53,0,Jeremy Crutcher missed Jumper.
Oakwood,Alabama A&M;,25,40,20,53,0,Jeremy Crutcher Offensive Rebound.
Oakwood,Alabama A&M;,25,40,21,4,0,Brandon Ellis missed Layup.
Oakwood,Alabama A&M;,25,40,21,4,0,Ed Pekote Defensive Rebound.
Oakwood,Alabama A&M;,25,40,21,12,0,Tim Wright missed Dunk.
Oakwood,Alabama A&M;,25,40,21,12,0,Jeremy Crutcher Defensive Rebound.
Oakwood,Alabama A&M;,25,42,21,15,1,Jeremy Crutcher made Layup.
Oakwood,Alabama A&M;,25,42,22,26,0,Tim Wright missed Layup.
Oakwood,Alabama A&M;,25,42,22,26,0,Jerome Hunter Defensive Rebound.
Oakwood,Alabama A&M;,25,42,22,31,0,Jeremy Crutcher missed Layup.
Oakwood,Alabama A&M;,25,42,22,31,0,Brandon Ellis Offensive Rebound.
Oakwood,Alabama A&M;,25,42,22,41,0,Brandon Ellis missed Dunk.
Oakwood,Alabama A&M;,25,42,22,41,0,Simon Jacob Block.
Oakwood,Alabama A&M;,25,42,22,51,0,Jerome Hunter Offensive Rebound.
Oakwood,Alabama A&M;,25,42,22,54,0,Jerome Hunter Turnover.
Oakwood,Alabama A&M;,25,42,22,54,0,Tim Wright Steal.
Oakwood,Alabama A&M;,25,42,22,54,0,Foul on Jeremy Crutcher.
Oakwood,Alabama A&M;,26,42,22,54,1,Tim Wright made Free Throw.
Oakwood,Alabama A&M;,27,42,22,54,1,Tim Wright made Free Throw.
Oakwood,Alabama A&M;,27,42,23,8,0,Brandon Ellis missed Three Point Jumper.
Oakwood,Alabama A&M;,27,42,23,8,0,Jerome Hunter Offensive Rebound.
Oakwood,Alabama A&M;,27,44,23,12,1,Jerome Hunter made Two Point Tip Shot.
Oakwood,Alabama A&M;,29,44,23,26,1,Max Caines made Layup.
Oakwood,Alabama A&M;,29,44,23,47,0,Foul on Ed Pekote.
Oakwood,Alabama A&M;,29,45,23,47,1,Jerome Hunter made Free Throw.
Oakwood,Alabama A&M;,29,45,23,47,0,Jerome Hunter missed Free Throw.
Oakwood,Alabama A&M;,29,45,23,47,0,Max Caines Defensive Rebound.
Oakwood,Alabama A&M;,29,45,24,12,0,Max Caines missed Jumper.
Oakwood,Alabama A&M;,29,45,24,12,0,Brandon Ellis Defensive Rebound.
Oakwood,Alabama A&M;,29,45,24,22,0,Tyler Davis missed Three Point Jumper.
Oakwood,Alabama A&M;,29,45,24,22,0,John Davis Defensive Rebound.
Oakwood,Alabama A&M;,29,45,24,37,0,Max Caines missed Jumper.
Oakwood,Alabama A&M;,29,45,24,37,0,Alabama A&M; Defensive Rebound.
Oakwood,Alabama A&M;,29,45,24,46,0,Official TV Timeout
Oakwood,Alabama A&M;,29,45,24,48,0,Foul on Dominic Pierre Louis.
Oakwood,Alabama A&M;,29,45,24,55,0,Jeremy Crutcher missed Layup.
Oakwood,Alabama A&M;,29,45,24,55,0,Oakwood Defensive Rebound.
Oakwood,Alabama A&M;,29,45,25,5,0,Max Caines Turnover.
Oakwood,Alabama A&M;,29,45,25,5,0,Jeremy Crutcher Steal.
Oakwood,Alabama A&M;,29,45,25,5,0,Jeremy Crutcher missed Three Point Jumper.
Oakwood,Alabama A&M;,29,45,25,5,0,Ronnie Clark Defensive Rebound.
Oakwood,Alabama A&M;,29,45,25,5,0,Brandon Ellis missed Layup.
Oakwood,Alabama A&M;,29,45,25,5,0,Dominic Pierre Louis Defensive Rebound.
Oakwood,Alabama A&M;,29,45,25,15,0,John Davis missed Jumper.
Oakwood,Alabama A&M;,29,45,25,15,0,Justan Banks Defensive Rebound.
Oakwood,Alabama A&M;,29,45,25,19,0,Jeremy Crutcher missed Jumper.
Oakwood,Alabama A&M;,29,45,25,19,0,Max Caines Defensive Rebound.
Oakwood,Alabama A&M;,32,45,25,23,1,Jordan Riley made Three Point Jumper. Assisted by Ronnie Clark.
Oakwood,Alabama A&M;,32,45,26,26,0,Foul on John Davis.
Oakwood,Alabama A&M;,32,45,26,26,0,Foul on Tim Wright.
Oakwood,Alabama A&M;,32,45,26,37,0,Demarquelle Tabb missed Jumper.
Oakwood,Alabama A&M;,32,45,26,37,0,Justan Banks Offensive Rebound.
Oakwood,Alabama A&M;,32,45,26,44,0,Justan Banks missed Layup.
Oakwood,Alabama A&M;,32,45,26,44,0,Dominic Pierre Louis Defensive Rebound.
Oakwood,Alabama A&M;,32,45,26,50,0,Cory McLean missed Jumper.
Oakwood,Alabama A&M;,32,45,26,50,0,Brandon Ellis Defensive Rebound.
Oakwood,Alabama A&M;,32,47,26,57,1,Jeremy Crutcher made Layup.
Oakwood,Alabama A&M;,32,47,27,19,0,Jordan Riley Turnover.
Oakwood,Alabama A&M;,32,47,27,20,0,Brandon Ellis Steal.
Oakwood,Alabama A&M;,32,49,27,22,1,Brandon Ellis made Layup.
Oakwood,Alabama A&M;,32,49,27,36,0,Ronnie Clark Turnover.
Oakwood,Alabama A&M;,32,49,27,38,0,Brandon Ellis Steal.
Oakwood,Alabama A&M;,32,49,27,49,0,Foul on Jordan Riley.
Oakwood,Alabama A&M;,32,49,27,49,0,Brandon Ellis missed Free Throw.
Oakwood,Alabama A&M;,32,49,27,49,0,Alabama A&M; Deadball Team Rebound.
Oakwood,Alabama A&M;,32,49,27,49,0,Brandon Ellis missed Free Throw.
Oakwood,Alabama A&M;,32,49,27,49,0,Ed Pekote Defensive Rebound.
Oakwood,Alabama A&M;,32,49,28,6,0,Ed Pekote missed Three Point Jumper.
Oakwood,Alabama A&M;,32,49,28,6,0,Justan Banks Defensive Rebound.
Oakwood,Alabama A&M;,32,49,28,11,0,Justan Banks Turnover.
Oakwood,Alabama A&M;,32,49,28,13,0,Simon Jacob Steal.
Oakwood,Alabama A&M;,34,49,28,14,1,Simon Jacob made Layup.
Oakwood,Alabama A&M;,34,49,28,31,0,Demarquelle Tabb missed Layup.
Oakwood,Alabama A&M;,34,49,28,31,0,Max Caines Block.
Oakwood,Alabama A&M;,34,49,28,33,0,Oakwood Defensive Rebound.
Oakwood,Alabama A&M;,34,49,28,34,0,Official TV Timeout
Oakwood,Alabama A&M;,34,49,28,49,0,Max Caines missed Three Point Jumper.
Oakwood,Alabama A&M;,34,49,28,49,0,Green Hill Defensive Rebound.
Oakwood,Alabama A&M;,34,51,29,2,1,Demarquelle Tabb made Dunk. Assisted by Justan Banks.
Oakwood,Alabama A&M;,36,51,29,18,1,Frank Hyppolite made Layup.
Oakwood,Alabama A&M;,36,51,29,30,0,Foul on Max Caines.
Oakwood,Alabama A&M;,36,51,29,30,0,Demarquelle Tabb missed Free Throw.
Oakwood,Alabama A&M;,36,51,29,30,0,Alabama A&M; Deadball Team Rebound.
Oakwood,Alabama A&M;,36,51,29,30,0,Demarquelle Tabb missed Free Throw.
Oakwood,Alabama A&M;,36,51,29,30,0,Tim Wright Defensive Rebound.
Oakwood,Alabama A&M;,36,51,29,48,0,Foul on Justan Banks.
Oakwood,Alabama A&M;,36,51,29,48,0,Dominic Pierre Louis missed Free Throw.
Oakwood,Alabama A&M;,36,51,29,48,0,Oakwood Deadball Team Rebound.
Oakwood,Alabama A&M;,37,51,29,48,1,Dominic Pierre Louis made Free Throw.
Oakwood,Alabama A&M;,37,51,30,15,0,Green Hill missed Jumper.
Oakwood,Alabama A&M;,37,51,30,15,0,Demarquelle Tabb Offensive Rebound.
Oakwood,Alabama A&M;,37,51,30,15,0,Foul on Frank Hyppolite.
Oakwood,Alabama A&M;,37,51,30,15,0,Demarquelle Tabb missed Free Throw.
Oakwood,Alabama A&M;,37,51,30,15,0,Tim Wright Defensive Rebound.
Oakwood,Alabama A&M;,39,51,30,26,1,Dominic Pierre Louis made Layup.
Oakwood,Alabama A&M;,39,51,30,44,0,Nicholas West Turnover.
Oakwood,Alabama A&M;,39,51,30,46,0,Ryan Johnson Steal.
Oakwood,Alabama A&M;,39,51,30,46,0,Ryan Johnson Turnover.
Oakwood,Alabama A&M;,39,53,31,2,1,Demarquelle Tabb made Layup. Assisted by Jeremy Crutcher.
Oakwood,Alabama A&M;,39,53,31,18,0,Simon Jacob missed Layup.
Oakwood,Alabama A&M;,39,53,31,18,0,Demarquelle Tabb Block.
Oakwood,Alabama A&M;,39,53,31,19,0,Green Hill Defensive Rebound.
Oakwood,Alabama A&M;,39,55,31,36,1,Jerome Hunter made Dunk. Assisted by Green Hill.
Oakwood,Alabama A&M;,41,55,31,52,1,Frank Hyppolite made Jumper.
Oakwood,Alabama A&M;,41,55,32,6,0,Green Hill missed Jumper.
Oakwood,Alabama A&M;,41,55,32,6,0,Brandon Ellis Offensive Rebound.
Oakwood,Alabama A&M;,41,55,32,12,0,Brandon Ellis missed Layup.
Oakwood,Alabama A&M;,41,55,32,12,0,Max Caines Defensive Rebound.
Oakwood,Alabama A&M;,41,55,32,17,0,Dominic Pierre Louis missed Layup.
Oakwood,Alabama A&M;,41,55,32,17,0,Jeremy Crutcher Defensive Rebound.
Oakwood,Alabama A&M;,41,55,32,44,0,Jeremy Crutcher Turnover.
Oakwood,Alabama A&M;,41,55,32,44,0,Official TV Timeout
Oakwood,Alabama A&M;,41,55,32,44,0,Frank Hyppolite Turnover.
Oakwood,Alabama A&M;,41,55,32,45,0,Tyler Davis Steal.
Oakwood,Alabama A&M;,41,55,32,47,0,Foul on Max Caines.
Oakwood,Alabama A&M;,41,56,32,47,1,Jerome Hunter made Free Throw.
Oakwood,Alabama A&M;,41,57,32,47,1,Jerome Hunter made Free Throw.
Oakwood,Alabama A&M;,43,57,33,2,1,Max Caines made Jumper. Assisted by Ed Pekote.
Oakwood,Alabama A&M;,43,60,33,24,1,Brandon Ellis made Three Point Jumper. Assisted by Demarquelle Tabb.
Oakwood,Alabama A&M;,46,60,33,51,1,Frank Hyppolite made Three Point Jumper.
Oakwood,Alabama A&M;,46,60,34,13,0,Foul on Ed Pekote.
Oakwood,Alabama A&M;,46,60,34,13,0,Demarquelle Tabb missed Free Throw.
Oakwood,Alabama A&M;,46,60,34,13,0,Alabama A&M; Deadball Team Rebound.
Oakwood,Alabama A&M;,46,61,34,13,1,Demarquelle Tabb made Free Throw.
Oakwood,Alabama A&M;,46,61,34,27,0,Foul on Jeremy Crutcher.
Oakwood,Alabama A&M;,46,61,34,42,0,Foul on Jeremy Crutcher.
Oakwood,Alabama A&M;,47,61,34,42,1,Max Caines made Free Throw.
Oakwood,Alabama A&M;,48,61,34,42,1,Max Caines made Free Throw.
Oakwood,Alabama A&M;,48,61,34,57,0,Jeremy Crutcher missed Three Point Jumper.
Oakwood,Alabama A&M;,48,61,34,57,0,Ronnie Clark Defensive Rebound.
Oakwood,Alabama A&M;,48,61,35,16,0,Max Caines missed Three Point Jumper.
Oakwood,Alabama A&M;,48,61,35,16,0,Tim Wright Offensive Rebound.
Oakwood,Alabama A&M;,48,61,35,28,0,Foul on Tyler Davis.
Oakwood,Alabama A&M;,48,61,35,41,0,Ronnie Clark missed Three Point Jumper.
Oakwood,Alabama A&M;,48,61,35,41,0,Arthur Capers Defensive Rebound.
Oakwood,Alabama A&M;,48,61,36,3,0,Tyler Davis Turnover.
Oakwood,Alabama A&M;,48,61,36,4,0,Ronnie Clark Steal.
Oakwood,Alabama A&M;,50,61,36,9,1,Tim Wright made Layup.
Oakwood,Alabama A&M;,50,61,36,9,0,Official TV Timeout
Oakwood,Alabama A&M;,50,61,36,9,0,Foul on Brandon Ellis.
Oakwood,Alabama A&M;,51,61,36,9,1,Tim Wright made Free Throw.
Oakwood,Alabama A&M;,51,61,36,25,0,Foul on Ed Pekote.
Oakwood,Alabama A&M;,51,62,36,25,1,Arthur Capers made Free Throw.
Oakwood,Alabama A&M;,51,63,36,25,1,Arthur Capers made Free Throw.
Oakwood,Alabama A&M;,51,63,36,34,0,Simon Jacob Turnover.
Oakwood,Alabama A&M;,51,65,37,3,1,Green Hill made Jumper.
Oakwood,Alabama A&M;,51,65,37,28,0,Max Caines missed Jumper.
Oakwood,Alabama A&M;,51,65,37,28,0,Tim Wright Offensive Rebound.
Oakwood,Alabama A&M;,51,65,37,34,0,Tim Wright missed Layup.
Oakwood,Alabama A&M;,51,65,37,34,0,Demarquelle Tabb Block.
Oakwood,Alabama A&M;,51,65,37,37,0,Demarquelle Tabb Defensive Rebound.
Oakwood,Alabama A&M;,51,65,37,40,0,Foul on Arthur Capers.
Oakwood,Alabama A&M;,51,65,37,40,0,Arthur Capers Turnover.
Oakwood,Alabama A&M;,51,65,37,59,0,Ronnie Clark Turnover.
Oakwood,Alabama A&M;,51,65,38,0,0,Demarquelle Tabb Steal.
Oakwood,Alabama A&M;,51,67,38,4,1,Green Hill made Layup. Assisted by Demarquelle Tabb.
Oakwood,Alabama A&M;,51,67,38,25,0,Max Caines missed Layup.
Oakwood,Alabama A&M;,51,67,38,25,0,Oakwood Offensive Rebound.
Oakwood,Alabama A&M;,51,67,38,26,0,Oakwood  Timeout
Oakwood,Alabama A&M;,54,67,38,33,1,Ronnie Clark made Three Point Jumper. Assisted by Ed Pekote.
Oakwood,Alabama A&M;,54,67,38,40,0,Foul on Tim Wright.
Oakwood,Alabama A&M;,54,68,38,40,1,Green Hill made Free Throw.
Oakwood,Alabama A&M;,54,68,38,40,0,Green Hill missed Free Throw.
Oakwood,Alabama A&M;,54,68,38,40,0,Max Caines Defensive Rebound.
Oakwood,Alabama A&M;,54,68,38,54,0,Ed Pekote missed Layup.
Oakwood,Alabama A&M;,54,68,38,54,0,Oakwood Offensive Rebound.
Oakwood,Alabama A&M;,54,68,39,6,0,Ed Pekote missed Three Point Jumper.
Oakwood,Alabama A&M;,54,68,39,6,0,Tim Wright Offensive Rebound.
Oakwood,Alabama A&M;,56,68,39,10,1,Tim Wright made Layup.
Oakwood,Alabama A&M;,56,68,39,10,0,Foul on Brandon Ellis.
Oakwood,Alabama A&M;,57,68,39,10,1,Tim Wright made Free Throw.
Oakwood,Alabama A&M;,57,68,39,14,0,Foul on Frank Hyppolite.
Oakwood,Alabama A&M;,57,69,39,14,1,Jose Long made Free Throw.
Oakwood,Alabama A&M;,57,69,39,23,0,Foul on Demarquelle Tabb.
Oakwood,Alabama A&M;,58,69,39,23,1,Frank Hyppolite made Free Throw.
Oakwood,Alabama A&M;,58,69,39,23,0,Frank Hyppolite missed Free Throw.
Oakwood,Alabama A&M;,58,69,39,23,0,Jose Long Defensive Rebound.
Oakwood,Alabama A&M;,58,69,39,25,0,Foul on Tim Wright.
Oakwood,Alabama A&M;,58,69,39,25,0,Jose Long missed Free Throw.
Oakwood,Alabama A&M;,58,69,39,25,0,Alabama A&M; Deadball Team Rebound.
Oakwood,Alabama A&M;,58,69,39,25,0,Jose Long missed Free Throw.
Oakwood,Alabama A&M;,58,69,39,25,0,Frank Hyppolite Defensive Rebound.
Oakwood,Alabama A&M;,58,69,39,43,0,Foul on Ronnie Clark.
Oakwood,Alabama A&M;,58,69,39,43,0,Green Hill missed Free Throw.
Oakwood,Alabama A&M;,58,69,39,43,0,Alabama A&M; Deadball Team Rebound.
Oakwood,Alabama A&M;,58,70,39,43,1,Green Hill made Free Throw.
Oakwood,Alabama A&M;,58,70,40,0,0,End of Game
