Away Team,Home Team,Away Score,Home Score,Minute,Second,isScoringPosession,Desc.
Arkansas State,Florida Intl,0,2,0,23,1,Tymell Murphy made Jumper.
Arkansas State,Florida Intl,0,2,0,40,0,Trey Finn Turnover.
Arkansas State,Florida Intl,0,2,0,49,0,Tola Akomolafe Turnover.
Arkansas State,Florida Intl,0,2,0,49,0,Foul on Tola Akomolafe
Arkansas State,Florida Intl,0,2,1,6,0,Marcus Hooten missed Three Point Jumper.
Arkansas State,Florida Intl,0,2,1,6,0,Trey Finn Offensive Rebound.
Arkansas State,Florida Intl,0,2,1,9,0,Trey Finn missed Jumper.
Arkansas State,Florida Intl,0,2,1,9,0,Arkansas State Offensive Rebound.
Arkansas State,Florida Intl,3,2,1,22,1,Cameron Golden made Three Point Jumper.
Arkansas State,Florida Intl,3,2,1,42,0,Gaby Belardo Turnover.
Arkansas State,Florida Intl,3,2,1,44,0,Brandon Peterson Steal.
Arkansas State,Florida Intl,3,2,2,4,0,Cameron Golden missed Three Point Jumper.
Arkansas State,Florida Intl,3,2,2,4,0,Kendrick Washington Offensive Rebound.
Arkansas State,Florida Intl,3,2,2,14,0,Marcus Hooten missed Layup.
Arkansas State,Florida Intl,3,2,2,14,0,Marcus Hooten Offensive Rebound.
Arkansas State,Florida Intl,3,2,2,18,0,Marcus Hooten missed Layup.
Arkansas State,Florida Intl,3,2,2,18,0,Joey La Rosa Block.
Arkansas State,Florida Intl,3,2,2,19,0,Joey La Rosa Defensive Rebound.
Arkansas State,Florida Intl,3,2,2,23,0,Malik Smith missed Three Point Jumper.
Arkansas State,Florida Intl,3,2,2,23,0,Tymell Murphy Offensive Rebound.
Arkansas State,Florida Intl,3,2,2,27,0,Tymell Murphy missed Tip Shot.
Arkansas State,Florida Intl,3,2,2,27,0,Joey La Rosa Offensive Rebound.
Arkansas State,Florida Intl,3,2,2,31,0,Joey La Rosa missed Jumper.
Arkansas State,Florida Intl,3,2,2,31,0,Brandon Peterson Block.
Arkansas State,Florida Intl,3,2,2,32,0,Cameron Golden Defensive Rebound.
Arkansas State,Florida Intl,3,2,2,35,0,Trey Finn missed Three Point Jumper.
Arkansas State,Florida Intl,3,2,2,35,0,Kendrick Washington Offensive Rebound.
Arkansas State,Florida Intl,5,2,2,38,1,Kendrick Washington made Layup.
Arkansas State,Florida Intl,5,2,2,51,0,Gaby Belardo Turnover.
Arkansas State,Florida Intl,5,2,2,52,0,Kendrick Washington Steal.
Arkansas State,Florida Intl,5,2,2,53,0,Kendrick Washington Turnover.
Arkansas State,Florida Intl,5,2,2,53,0,Tymell Murphy Steal.
Arkansas State,Florida Intl,5,5,3,3,1,Juan Ferrales made Three Point Jumper.  Assisted by Gaby Belardo.
Arkansas State,Florida Intl,5,5,3,29,0,Marcus Hooten missed Layup.
Arkansas State,Florida Intl,5,5,3,29,0,Juan Ferrales Defensive Rebound.
Arkansas State,Florida Intl,5,7,3,41,1,Joey La Rosa made Jumper.
Arkansas State,Florida Intl,5,7,3,56,0,Kendrick Washington missed Jumper.
Arkansas State,Florida Intl,5,7,3,56,0,Trey Finn Offensive Rebound.
Arkansas State,Florida Intl,7,7,3,59,1,Trey Finn made Layup.
Arkansas State,Florida Intl,7,7,3,59,0,Foul on Tymell Murphy
Arkansas State,Florida Intl,7,7,4,1,0,Official TV Timeout.
Arkansas State,Florida Intl,8,7,4,1,1,Trey Finn made Free Throw.
Arkansas State,Florida Intl,8,7,4,15,0,Jerome Frink missed Layup.
Arkansas State,Florida Intl,8,7,4,15,0,Jerome Frink Offensive Rebound.
Arkansas State,Florida Intl,8,9,4,17,1,Jerome Frink made Layup.
Arkansas State,Florida Intl,8,9,4,45,0,Rakeem Dickerson missed Three Point Jumper.
Arkansas State,Florida Intl,8,9,4,45,0,Jerome Frink Defensive Rebound.
Arkansas State,Florida Intl,8,9,4,54,0,Malik Smith missed Three Point Jumper.
Arkansas State,Florida Intl,8,9,4,54,0,Malik Smith Offensive Rebound.
Arkansas State,Florida Intl,8,9,4,56,0,Malik Smith Turnover.
Arkansas State,Florida Intl,8,9,5,2,0,Foul on Ivan Jurkovic
Arkansas State,Florida Intl,8,9,5,2,0,Marcus Hooten missed Free Throw.
Arkansas State,Florida Intl,8,9,5,2,0,null
Arkansas State,Florida Intl,8,9,5,2,0,Marcus Hooten missed Free Throw.
Arkansas State,Florida Intl,8,9,5,2,0,Jerome Frink Defensive Rebound.
Arkansas State,Florida Intl,8,12,5,31,1,Marco Porcher Jimenez made Three Point Jumper.  Assisted by Juan Ferrales.
Arkansas State,Florida Intl,8,12,5,49,0,Marcus Hooten Turnover.
Arkansas State,Florida Intl,8,12,5,50,0,Marco Porcher Jimenez Steal.
Arkansas State,Florida Intl,8,12,5,53,0,Malik Smith Turnover.
Arkansas State,Florida Intl,8,12,5,53,0,Foul on Malik Smith
Arkansas State,Florida Intl,11,12,6,5,1,Ed Townsel made Three Point Jumper.  Assisted by Trey Finn.
Arkansas State,Florida Intl,11,12,6,21,0,Ivan Jurkovic missed Jumper.
Arkansas State,Florida Intl,11,12,6,21,0,Ivan Jurkovic Offensive Rebound.
Arkansas State,Florida Intl,11,12,6,37,0,Juan Ferrales missed Three Point Jumper.
Arkansas State,Florida Intl,11,12,6,37,0,Rakeem Dickerson Defensive Rebound.
Arkansas State,Florida Intl,11,12,6,57,0,Brandon Peterson missed Jumper.
Arkansas State,Florida Intl,11,12,6,57,0,Ivan Jurkovic Defensive Rebound.
Arkansas State,Florida Intl,11,12,7,13,0,Foul on Kendrick Washington
Arkansas State,Florida Intl,11,14,7,33,1,Jerome Frink made Dunk.  Assisted by Deric Hill.
Arkansas State,Florida Intl,11,14,7,57,0,Trey Finn missed Jumper.
Arkansas State,Florida Intl,11,14,7,57,0,Brandon Peterson Offensive Rebound.
Arkansas State,Florida Intl,13,14,8,0,1,Brandon Peterson made Layup.
Arkansas State,Florida Intl,13,14,8,18,0,Jerome Frink Turnover.
Arkansas State,Florida Intl,13,14,8,18,0,Official TV Timeout.
Arkansas State,Florida Intl,16,14,8,42,1,Ed Townsel made Three Point Jumper.  Assisted by Brandon Peterson.
Arkansas State,Florida Intl,16,16,9,7,1,Joey La Rosa made Layup.  Assisted by Tola Akomolafe.
Arkansas State,Florida Intl,16,16,9,33,0,Ed Townsel missed Three Point Jumper.
Arkansas State,Florida Intl,16,16,9,33,0,Deric Hill Defensive Rebound.
Arkansas State,Florida Intl,16,16,9,40,0,Deric Hill Turnover.
Arkansas State,Florida Intl,16,16,9,41,0,Trey Finn Steal.
Arkansas State,Florida Intl,16,16,9,44,0,Ed Townsel missed Three Point Jumper.
Arkansas State,Florida Intl,16,16,9,44,0,Tymell Murphy Defensive Rebound.
Arkansas State,Florida Intl,16,16,10,3,0,Joey La Rosa missed Layup.
Arkansas State,Florida Intl,16,16,10,3,0,Raeford Worsham Block.
Arkansas State,Florida Intl,16,16,10,7,0,Raeford Worsham Defensive Rebound.
Arkansas State,Florida Intl,16,16,10,12,0,Ed Townsel missed Three Point Jumper.
Arkansas State,Florida Intl,16,16,10,12,0,Joey La Rosa Defensive Rebound.
Arkansas State,Florida Intl,16,16,10,22,0,Deric Hill missed Three Point Jumper.
Arkansas State,Florida Intl,16,16,10,22,0,Cameron Golden Defensive Rebound.
Arkansas State,Florida Intl,19,16,10,28,1,Trey Finn made Three Point Jumper.  Assisted by Cameron Golden.
Arkansas State,Florida Intl,19,16,10,31,0,Florida Internationa Full Timeout.
Arkansas State,Florida Intl,19,16,10,45,0,Deric Hill missed Layup.
Arkansas State,Florida Intl,19,16,10,45,0,Trey Finn Block.
Arkansas State,Florida Intl,19,16,10,48,0,Cameron Golden Defensive Rebound.
Arkansas State,Florida Intl,19,16,10,53,0,Ed Townsel missed Three Point Jumper.
Arkansas State,Florida Intl,19,16,10,53,0,Florida Internationa Defensive R.
Arkansas State,Florida Intl,19,18,11,6,1,Malik Smith made Jumper.
Arkansas State,Florida Intl,19,18,11,19,0,Cameron Golden missed Jumper.
Arkansas State,Florida Intl,19,18,11,19,0,Deric Hill Defensive Rebound.
Arkansas State,Florida Intl,19,18,11,28,0,Foul on Raeford Worsham
Arkansas State,Florida Intl,19,19,11,28,1,Tymell Murphy made Free Throw.
Arkansas State,Florida Intl,19,20,11,28,1,Tymell Murphy made Free Throw.
Arkansas State,Florida Intl,19,20,12,1,0,Ed Townsel missed Jumper.
Arkansas State,Florida Intl,19,20,12,1,0,Brandon Peterson Offensive Rebound.
Arkansas State,Florida Intl,19,20,12,5,0,Brandon Peterson Turnover.
Arkansas State,Florida Intl,19,20,12,6,0,Malik Smith Steal.
Arkansas State,Florida Intl,19,22,12,11,1,Tymell Murphy made Layup.  Assisted by Malik Smith.
Arkansas State,Florida Intl,19,22,12,25,0,Foul on Deric Hill
Arkansas State,Florida Intl,19,22,12,25,0,Official TV Timeout.
Arkansas State,Florida Intl,19,22,12,52,0,Trey Finn Turnover.
Arkansas State,Florida Intl,19,22,12,53,0,Jerome Frink Steal.
Arkansas State,Florida Intl,19,22,12,55,0,Tymell Murphy Turnover.
Arkansas State,Florida Intl,19,22,13,30,0,Ed Townsel missed Jumper.
Arkansas State,Florida Intl,19,22,13,30,0,Brandon Peterson Offensive Rebound.
Arkansas State,Florida Intl,19,22,13,35,0,Trey Finn missed Three Point Jumper.
Arkansas State,Florida Intl,19,22,13,35,0,Tola Akomolafe Defensive Rebound.
Arkansas State,Florida Intl,19,24,13,42,1,Tymell Murphy made Layup.  Assisted by Jerome Frink.
Arkansas State,Florida Intl,19,24,14,24,0,Arkansas State Turnover.
Arkansas State,Florida Intl,19,26,14,44,1,Deric Hill made Jumper.
Arkansas State,Florida Intl,19,26,15,2,0,Kendrick Washington missed Layup.
Arkansas State,Florida Intl,19,26,15,2,0,Tymell Murphy Defensive Rebound.
Arkansas State,Florida Intl,19,29,15,24,1,Malik Smith made Three Point Jumper.
Arkansas State,Florida Intl,19,29,15,59,0,Kendrick Washington missed Jumper.
Arkansas State,Florida Intl,19,29,15,59,0,Jerome Frink Defensive Rebound.
Arkansas State,Florida Intl,19,29,16,6,0,Tymell Murphy Turnover.
Arkansas State,Florida Intl,19,29,16,6,0,Official TV Timeout.
Arkansas State,Florida Intl,19,29,16,40,0,Brandon Peterson missed Layup.
Arkansas State,Florida Intl,19,29,16,40,0,Brandon Peterson Offensive Rebound.
Arkansas State,Florida Intl,21,29,16,43,1,Brandon Peterson made Tip Shot.
Arkansas State,Florida Intl,21,29,17,0,0,Marco Porcher Jimenez Turnover.
Arkansas State,Florida Intl,21,29,17,2,0,Marcus Hooten Steal.
Arkansas State,Florida Intl,23,29,17,4,1,Marcus Hooten made Layup.
Arkansas State,Florida Intl,23,29,17,11,0,Florida Internationa Full Timeout.
Arkansas State,Florida Intl,23,29,17,22,0,Foul on Kendrick Washington
Arkansas State,Florida Intl,23,31,17,22,1,Juan Ferrales made Layup.
Arkansas State,Florida Intl,25,31,17,59,1,Ed Townsel made Jumper.
Arkansas State,Florida Intl,25,31,18,0,0,Arkansas State Full Timeout.
Arkansas State,Florida Intl,25,31,18,21,0,Malik Smith missed Three Point Jumper.
Arkansas State,Florida Intl,25,31,18,21,0,Brandon Peterson Defensive Rebound.
Arkansas State,Florida Intl,25,31,18,29,0,Ed Townsel missed Jumper.
Arkansas State,Florida Intl,25,31,18,29,0,Brandon Peterson Offensive Rebound.
Arkansas State,Florida Intl,25,31,18,32,0,Brandon Peterson missed Tip Shot.
Arkansas State,Florida Intl,25,31,18,32,0,Malik Smith Defensive Rebound.
Arkansas State,Florida Intl,25,31,18,44,0,Jerome Frink Turnover.
Arkansas State,Florida Intl,25,31,19,8,0,Foul on Malik Smith
Arkansas State,Florida Intl,25,31,19,8,0,Marcus Hooten missed Free Throw.
Arkansas State,Florida Intl,25,31,19,8,0,null
Arkansas State,Florida Intl,26,31,19,8,1,Marcus Hooten made Free Throw.
Arkansas State,Florida Intl,26,33,19,23,1,Jerome Frink made Layup.  Assisted by Tymell Murphy.
Arkansas State,Florida Intl,26,33,19,34,0,Marcus Hooten missed Three Point Jumper.
Arkansas State,Florida Intl,26,33,19,34,0,Florida Internationa Defensive R.
Arkansas State,Florida Intl,26,33,19,57,0,Juan Ferrales missed Jumper.
Arkansas State,Florida Intl,26,33,19,57,0,Marcus Hooten Defensive Rebound.
Arkansas State,Florida Intl,26,33,20,0,0,End of the 1st Half.
Arkansas State,Florida Intl,26,33,20,21,0,Juan Ferrales missed Layup.
Arkansas State,Florida Intl,26,33,20,21,0,Cameron Golden Defensive Rebound.
Arkansas State,Florida Intl,28,33,20,24,1,Marcus Hooten made Layup.  Assisted by Cameron Golden.
Arkansas State,Florida Intl,28,35,20,53,1,Juan Ferrales made Layup.
Arkansas State,Florida Intl,28,35,21,26,0,Marcus Hooten Turnover.
Arkansas State,Florida Intl,28,35,21,31,0,Tymell Murphy Steal.
Arkansas State,Florida Intl,28,37,21,36,1,Tymell Murphy made Layup.  Assisted by Gaby Belardo.
Arkansas State,Florida Intl,28,37,22,1,0,Marcus Hooten missed Layup.
Arkansas State,Florida Intl,28,37,22,1,0,Tola Akomolafe Block.
Arkansas State,Florida Intl,28,37,22,4,0,Kendrick Washington Offensive Rebound.
Arkansas State,Florida Intl,30,37,22,8,1,Kendrick Washington made Layup.
Arkansas State,Florida Intl,30,40,22,21,1,Gaby Belardo made Three Point Jumper.  Assisted by Juan Ferrales.
Arkansas State,Florida Intl,30,42,22,23,1,Tola Akomolafe made Jumper.
Arkansas State,Florida Intl,32,42,22,43,1,Brandon Peterson made Layup.  Assisted by Trey Finn.
Arkansas State,Florida Intl,32,42,22,52,0,Marcus Hooten Turnover.
Arkansas State,Florida Intl,32,45,23,3,1,Tymell Murphy made Three Point Jumper.  Assisted by Gaby Belardo.
Arkansas State,Florida Intl,32,45,23,15,0,Arkansas State Full Timeout.
Arkansas State,Florida Intl,35,45,23,34,1,Trey Finn made Three Point Jumper.  Assisted by Ed Townsel.
Arkansas State,Florida Intl,35,47,24,11,1,Deric Hill made Layup.
Arkansas State,Florida Intl,35,47,24,22,0,Cameron Golden missed Jumper.
Arkansas State,Florida Intl,35,47,24,22,0,Marco Porcher Jimenez Defensive Reboun.
Arkansas State,Florida Intl,35,49,24,55,1,Deric Hill made Jumper.
Arkansas State,Florida Intl,38,49,25,22,1,Cameron Golden made Three Point Jumper.  Assisted by Kendrick Washington.
Arkansas State,Florida Intl,38,49,25,49,0,Deric Hill Turnover.
Arkansas State,Florida Intl,38,49,25,52,0,Ed Townsel Steal.
Arkansas State,Florida Intl,38,49,25,53,0,Ed Townsel Turnover.
Arkansas State,Florida Intl,38,49,25,54,0,Deric Hill Steal.
Arkansas State,Florida Intl,38,52,25,56,1,Malik Smith made Three Point Jumper.  Assisted by Marco Porcher Jimenez.
Arkansas State,Florida Intl,38,52,26,2,0,Foul on Jerome Frink
Arkansas State,Florida Intl,38,52,26,2,0,Official TV Timeout.
Arkansas State,Florida Intl,38,52,26,24,0,Ed Townsel missed Three Point Jumper.
Arkansas State,Florida Intl,38,52,26,24,0,Arkansas State Offensive Rebound.
Arkansas State,Florida Intl,38,52,26,24,0,Foul on Ivan Jurkovic
Arkansas State,Florida Intl,38,52,26,25,0,Rakeem Dickerson Turnover.
Arkansas State,Florida Intl,38,52,26,29,0,Jerome Frink Steal.
Arkansas State,Florida Intl,38,52,26,40,0,Malik Smith Turnover.
Arkansas State,Florida Intl,38,52,26,40,0,Foul on Malik Smith
Arkansas State,Florida Intl,38,52,26,59,0,Rakeem Dickerson Turnover.
Arkansas State,Florida Intl,38,52,27,0,0,Jerome Frink Steal.
Arkansas State,Florida Intl,38,54,27,35,1,Gaby Belardo made Layup.
Arkansas State,Florida Intl,41,54,27,47,1,Trey Finn made Three Point Jumper.
Arkansas State,Florida Intl,41,54,27,54,0,Florida Internationa Full Timeout.
Arkansas State,Florida Intl,41,54,28,8,0,Juan Ferrales missed Jumper.
Arkansas State,Florida Intl,41,54,28,8,0,Brandon Peterson Block.
Arkansas State,Florida Intl,41,54,28,11,0,Brandon Peterson Defensive Rebound.
Arkansas State,Florida Intl,41,54,28,14,0,Trey Finn missed Layup.
Arkansas State,Florida Intl,41,54,28,14,0,Gaby Belardo Defensive Rebound.
Arkansas State,Florida Intl,41,56,28,28,1,Tymell Murphy made Layup.  Assisted by Gaby Belardo.
Arkansas State,Florida Intl,41,56,28,40,0,Foul on Gaby Belardo
Arkansas State,Florida Intl,41,56,28,40,0,Official TV Timeout.
Arkansas State,Florida Intl,43,56,28,47,1,Brandon Peterson made Layup.  Assisted by Kendrick Washington.
Arkansas State,Florida Intl,43,56,28,47,0,Foul on Joey La Rosa
Arkansas State,Florida Intl,43,56,28,47,0,Tymell Murphy Defensive Rebound.
Arkansas State,Florida Intl,43,56,29,18,0,Juan Ferrales Turnover.
Arkansas State,Florida Intl,45,56,29,35,1,Kendrick Washington made Layup.  Assisted by Rakeem Dickerson.
Arkansas State,Florida Intl,45,56,29,39,0,Kendrick Washington missed Jumper.
Arkansas State,Florida Intl,45,56,29,39,0,Tymell Murphy Defensive Rebound.
Arkansas State,Florida Intl,45,56,29,42,0,Tymell Murphy Turnover.
Arkansas State,Florida Intl,45,56,29,43,0,Rakeem Dickerson Steal.
Arkansas State,Florida Intl,45,59,29,54,1,Juan Ferrales made Three Point Jumper.  Assisted by Tymell Murphy.
Arkansas State,Florida Intl,45,59,30,25,0,Brandon Peterson missed Jumper.
Arkansas State,Florida Intl,45,59,30,25,0,Tymell Murphy Defensive Rebound.
Arkansas State,Florida Intl,45,59,30,35,0,Gaby Belardo missed Three Point Jumper.
Arkansas State,Florida Intl,45,59,30,35,0,Florida Internationa Offensive R.
Arkansas State,Florida Intl,45,59,30,37,0,Foul on Kendrick Washington
Arkansas State,Florida Intl,45,59,30,52,0,Foul on Trey Finn
Arkansas State,Florida Intl,45,59,31,12,0,Foul on Rakeem Dickerson
Arkansas State,Florida Intl,45,59,31,26,0,Gaby Belardo missed Three Point Jumper.
Arkansas State,Florida Intl,45,59,31,26,0,Trey Finn Defensive Rebound.
Arkansas State,Florida Intl,45,59,31,34,0,Brandon Peterson Turnover.
Arkansas State,Florida Intl,45,59,31,34,0,Foul on Brandon Peterson
Arkansas State,Florida Intl,45,61,31,46,1,Tola Akomolafe made Jumper.  Assisted by Deric Hill.
Arkansas State,Florida Intl,45,61,32,14,0,Ed Townsel missed Jumper.
Arkansas State,Florida Intl,45,61,32,14,0,Malik Smith Defensive Rebound.
Arkansas State,Florida Intl,45,61,32,47,0,Tola Akomolafe missed Layup.
Arkansas State,Florida Intl,45,61,32,47,0,Jerome Frink Offensive Rebound.
Arkansas State,Florida Intl,45,61,32,48,0,Foul on Raeford Worsham
Arkansas State,Florida Intl,45,61,32,48,0,Official TV Timeout.
Arkansas State,Florida Intl,45,61,33,4,0,Jerome Frink missed Jumper.
Arkansas State,Florida Intl,45,61,33,4,0,Trey Finn Defensive Rebound.
Arkansas State,Florida Intl,45,61,33,10,0,Foul on Jerome Frink
Arkansas State,Florida Intl,45,61,33,10,0,Raeford Worsham missed Free Throw.
Arkansas State,Florida Intl,45,61,33,10,0,null
Arkansas State,Florida Intl,45,61,33,10,0,Raeford Worsham missed Free Throw.
Arkansas State,Florida Intl,45,61,33,10,0,Tymell Murphy Defensive Rebound.
Arkansas State,Florida Intl,45,61,33,44,0,Foul on Ed Townsel
Arkansas State,Florida Intl,45,62,33,44,1,Tola Akomolafe made Free Throw.
Arkansas State,Florida Intl,45,62,33,44,0,Tola Akomolafe missed Free Throw.
Arkansas State,Florida Intl,45,62,33,44,0,Trey Finn Defensive Rebound.
Arkansas State,Florida Intl,45,62,33,51,0,Trey Finn missed Jumper.
Arkansas State,Florida Intl,45,62,33,51,0,Ivan Jurkovic Defensive Rebound.
Arkansas State,Florida Intl,45,64,33,59,1,Ivan Jurkovic made Layup.  Assisted by Tola Akomolafe.
Arkansas State,Florida Intl,45,64,34,15,0,Arkansas State Full Timeout.
Arkansas State,Florida Intl,45,64,34,31,0,Kendrick Washington missed Layup.
Arkansas State,Florida Intl,45,64,34,31,0,Jerome Frink Block.
Arkansas State,Florida Intl,45,64,34,34,0,Kendrick Washington Offensive Rebound.
Arkansas State,Florida Intl,45,64,34,34,0,Foul on Ivan Jurkovic
Arkansas State,Florida Intl,46,64,34,34,1,Kendrick Washington made Free Throw.
Arkansas State,Florida Intl,46,64,34,34,0,null
Arkansas State,Florida Intl,47,64,34,34,1,Kendrick Washington made Free Throw.
Arkansas State,Florida Intl,47,64,34,48,0,Foul on Kendrick Washington
Arkansas State,Florida Intl,47,65,34,48,1,Jerome Frink made Free Throw.
Arkansas State,Florida Intl,47,65,34,48,0,Jerome Frink missed Free Throw.
Arkansas State,Florida Intl,47,65,34,48,0,Jerome Frink Offensive Rebound.
Arkansas State,Florida Intl,47,65,34,50,0,Jerome Frink missed Jumper.
Arkansas State,Florida Intl,47,65,34,50,0,Kendrick Washington Defensive Rebound.
Arkansas State,Florida Intl,49,65,35,4,1,Ed Townsel made Jumper.
Arkansas State,Florida Intl,49,65,35,5,0,Arkansas State Full Timeout.
Arkansas State,Florida Intl,49,65,35,8,0,Deric Hill Turnover.
Arkansas State,Florida Intl,49,65,35,9,0,Rakeem Dickerson Steal.
Arkansas State,Florida Intl,51,65,35,11,1,Jordan Weaver made Layup.  Assisted by Rakeem Dickerson.
Arkansas State,Florida Intl,51,65,35,18,0,Foul on Kelvin Downs
Arkansas State,Florida Intl,51,66,35,18,1,Deric Hill made Free Throw.
Arkansas State,Florida Intl,51,67,35,18,1,Deric Hill made Free Throw.
Arkansas State,Florida Intl,51,67,35,24,0,Rakeem Dickerson Turnover.
Arkansas State,Florida Intl,51,67,35,25,0,Malik Smith Steal.
Arkansas State,Florida Intl,51,69,35,26,1,Tymell Murphy made Layup.  Assisted by Malik Smith.
Arkansas State,Florida Intl,51,70,35,26,1,Tymell Murphy made Free Throw.
Arkansas State,Florida Intl,51,70,35,31,0,Foul on Ed Townsel
Arkansas State,Florida Intl,51,70,35,32,0,Jordan Weaver Turnover.
Arkansas State,Florida Intl,51,72,35,46,1,Tymell Murphy made Layup.
Arkansas State,Florida Intl,54,72,35,53,1,Ed Townsel made Three Point Jumper.
Arkansas State,Florida Intl,54,75,36,17,1,Malik Smith made Three Point Jumper.  Assisted by Tymell Murphy.
Arkansas State,Florida Intl,54,75,36,41,0,Kelvin Downs missed Jumper.
Arkansas State,Florida Intl,54,75,36,41,0,Kendrick Washington Offensive Rebound.
Arkansas State,Florida Intl,54,75,37,0,0,Foul on Ivan Jurkovic
Arkansas State,Florida Intl,54,75,37,0,0,Official TV Timeout.
Arkansas State,Florida Intl,55,75,37,0,1,Kendrick Washington made Free Throw.
Arkansas State,Florida Intl,55,75,37,0,0,Kendrick Washington missed Free Throw.
Arkansas State,Florida Intl,55,75,37,0,0,Tola Akomolafe Defensive Rebound.
Arkansas State,Florida Intl,55,75,37,19,0,Malik Smith Turnover.
Arkansas State,Florida Intl,55,75,37,20,0,Kendrick Washington Steal.
Arkansas State,Florida Intl,55,75,37,29,0,Kendrick Washington missed Layup.
Arkansas State,Florida Intl,55,75,37,29,0,Kendrick Washington Offensive Rebound.
Arkansas State,Florida Intl,55,75,37,32,0,Kendrick Washington missed Tip Shot.
Arkansas State,Florida Intl,55,75,37,32,0,Tola Akomolafe Defensive Rebound.
Arkansas State,Florida Intl,55,75,37,36,0,Florida Internationa Full Timeout.
Arkansas State,Florida Intl,55,75,37,57,0,Jerome Frink missed Layup.
Arkansas State,Florida Intl,55,75,37,57,0,Kelvin Downs Defensive Rebound.
Arkansas State,Florida Intl,55,75,38,11,0,Foul on Malik Smith
Arkansas State,Florida Intl,55,75,38,11,0,Trey Finn missed Free Throw.
Arkansas State,Florida Intl,55,75,38,11,0,null
Arkansas State,Florida Intl,55,75,38,11,0,Trey Finn missed Free Throw.
Arkansas State,Florida Intl,55,75,38,11,0,null
Arkansas State,Florida Intl,55,75,38,13,0,Juan Ferrales Turnover.
Arkansas State,Florida Intl,55,75,38,28,0,Foul on Juan Ferrales
Arkansas State,Florida Intl,55,75,38,28,0,Rakeem Dickerson missed Free Throw.
Arkansas State,Florida Intl,55,75,38,28,0,null
Arkansas State,Florida Intl,56,75,38,28,1,Rakeem Dickerson made Free Throw.
Arkansas State,Florida Intl,56,77,38,32,1,Jerome Frink made Dunk.  Assisted by Gaby Belardo.
Arkansas State,Florida Intl,56,77,38,42,0,Rakeem Dickerson missed Three Point Jumper.
Arkansas State,Florida Intl,56,77,38,42,0,Brandon Peterson Offensive Rebound.
Arkansas State,Florida Intl,58,77,38,45,1,Brandon Peterson made Layup.
Arkansas State,Florida Intl,58,79,38,46,1,Tymell Murphy made Layup.  Assisted by Tola Akomolafe.
Arkansas State,Florida Intl,58,79,38,59,0,Ed Townsel missed Three Point Jumper.
Arkansas State,Florida Intl,58,79,38,59,0,Brandon Peterson Offensive Rebound.
Arkansas State,Florida Intl,58,79,39,5,0,Brandon Peterson Turnover.
Arkansas State,Florida Intl,58,79,39,5,0,Gaby Belardo Turnover.
Arkansas State,Florida Intl,58,79,39,5,0,Rakeem Dickerson Steal.
Arkansas State,Florida Intl,60,79,39,8,1,Rakeem Dickerson made Layup.
Arkansas State,Florida Intl,60,79,39,32,0,Malik Smith missed Jumper.
Arkansas State,Florida Intl,60,79,39,32,0,Jerome Frink Offensive Rebound.
Arkansas State,Florida Intl,60,79,39,36,0,Foul on Kelvin Downs
Arkansas State,Florida Intl,60,79,39,36,0,Jerome Frink missed Free Throw.
Arkansas State,Florida Intl,60,79,39,36,0,null
Arkansas State,Florida Intl,60,80,39,36,1,Jerome Frink made Free Throw.
Arkansas State,Florida Intl,60,80,39,39,0,Brandon Peterson missed Three Point Jumper.
Arkansas State,Florida Intl,60,80,39,39,0,Arkansas State Offensive Rebound.
Arkansas State,Florida Intl,60,80,39,41,0,Foul on Manuel Nunez
Arkansas State,Florida Intl,61,80,39,47,1,Rakeem Dickerson made Free Throw.
Arkansas State,Florida Intl,61,80,39,50,0,Rakeem Dickerson missed Free Throw.
Arkansas State,Florida Intl,61,80,39,50,0,Dee Lewis Defensive Rebound.
Arkansas State,Florida Intl,61,80,40,0,0,End Game
