Away Team,Home Team,Away Score,Home Score,Minute,Second,isScoringPosession,Desc.
Northwestern State,Houston Baptist,79,88,34,23,0,Foul on Marvin Frazier.
Northwestern State,Houston Baptist,79,89,34,23,1,Rob Lewis made Free Throw.
Northwestern State,Houston Baptist,79,90,34,23,1,Rob Lewis made Free Throw.
Northwestern State,Houston Baptist,79,90,34,26,0,Foul on Marcel Smith.
Northwestern State,Houston Baptist,80,90,34,26,1,Jalan West made Free Throw.
Northwestern State,Houston Baptist,81,90,34,26,1,Jalan West made Free Throw.
Northwestern State,Houston Baptist,81,92,34,42,1,Rob Lewis made Layup.
Northwestern State,Houston Baptist,83,92,34,50,1,Jalan West made Layup.
Northwestern State,Houston Baptist,83,94,35,17,1,Tyler Russell made Jumper.
Northwestern State,Houston Baptist,83,94,35,32,0,Foul on Marcel Smith.
Northwestern State,Houston Baptist,84,94,35,32,1,Jalan West made Free Throw.
Northwestern State,Houston Baptist,85,94,35,32,1,Jalan West made Free Throw.
Northwestern State,Houston Baptist,85,94,36,0,0,Tyler Russell missed Jumper.
Northwestern State,Houston Baptist,85,94,36,0,0,Dauson Womack Offensive Rebound.
Northwestern State,Houston Baptist,85,94,36,4,0,Dauson Womack missed Layup.
Northwestern State,Houston Baptist,85,94,36,4,0,Jalan West Defensive Rebound.
Northwestern State,Houston Baptist,85,94,36,11,0,Foul on Rob Lewis.
Northwestern State,Houston Baptist,85,94,36,11,0,Official TV Timeout
Northwestern State,Houston Baptist,86,94,36,11,1,Jalan West made Free Throw.
Northwestern State,Houston Baptist,87,94,36,11,1,Jalan West made Free Throw.
Northwestern State,Houston Baptist,87,94,36,18,0,Houston Baptist  Timeout
Northwestern State,Houston Baptist,87,94,36,38,0,Foul on Patrick Robinson.
Northwestern State,Houston Baptist,87,94,36,38,0,Cody Joyce missed Free Throw.
Northwestern State,Houston Baptist,87,94,36,38,0,Zikiteran Woodley Defensive Rebound.
Northwestern State,Houston Baptist,87,94,36,48,0,Patrick Robinson Turnover.
Northwestern State,Houston Baptist,87,94,36,49,0,Rob Lewis Steal.
Northwestern State,Houston Baptist,87,94,36,53,0,Rob Lewis missed Layup.
Northwestern State,Houston Baptist,87,94,36,53,0,Northwestern St Defensive Rebound.
Northwestern State,Houston Baptist,89,94,37,1,1,Jalan West made Jumper.
Northwestern State,Houston Baptist,89,94,37,4,0,Northwestern St  Timeout
Northwestern State,Houston Baptist,89,94,37,30,0,Foul on Zikiteran Woodley.
Northwestern State,Houston Baptist,89,95,37,30,1,Dauson Womack made Free Throw.
Northwestern State,Houston Baptist,89,96,37,30,1,Dauson Womack made Free Throw.
Northwestern State,Houston Baptist,91,96,37,37,1,Jalan West made Jumper.
Northwestern State,Houston Baptist,91,96,37,41,0,Northwestern St  Timeout
Northwestern State,Houston Baptist,91,96,37,47,0,Dauson Womack missed Layup.
Northwestern State,Houston Baptist,91,96,37,47,0,Zikiteran Woodley Defensive Rebound.
Northwestern State,Houston Baptist,93,96,37,53,1,Patrick Robinson made Layup. Assisted by Zikiteran Woodley.
Northwestern State,Houston Baptist,93,96,38,27,0,Rob Lewis Turnover.
Northwestern State,Houston Baptist,93,96,38,28,0,Patrick Robinson Steal.
Northwestern State,Houston Baptist,95,96,38,33,1,DeQuan Hicks made Layup. Assisted by Jalan West.
Northwestern State,Houston Baptist,95,96,39,1,0,Rob Lewis missed Jumper.
Northwestern State,Houston Baptist,95,96,39,1,0,Reveal Chukwujekwu Offensive Rebound.
Northwestern State,Houston Baptist,95,96,39,4,0,Foul on Tyler Washington.
Northwestern State,Houston Baptist,95,96,39,4,0,Reveal Chukwujekwu missed Free Throw.
Northwestern State,Houston Baptist,95,96,39,4,0,Houston Baptist Deadball Team Rebound.
Northwestern State,Houston Baptist,95,96,39,4,0,Reveal Chukwujekwu missed Free Throw.
Northwestern State,Houston Baptist,95,96,39,4,0,Dauson Womack Offensive Rebound.
Northwestern State,Houston Baptist,95,96,39,33,0,Foul on Marcel Smith.
Northwestern State,Houston Baptist,95,96,39,33,0,Marcel Smith Turnover.
Northwestern State,Houston Baptist,95,96,39,33,0,Houston Baptist  Timeout
Northwestern State,Houston Baptist,97,96,39,44,1,DeQuan Hicks made Layup. Assisted by Jalan West.
Northwestern State,Houston Baptist,97,96,39,54,0,Tyler Russell missed Jumper.
Northwestern State,Houston Baptist,97,96,39,54,0,Marcel Smith Offensive Rebound.
Northwestern State,Houston Baptist,97,98,39,58,1,Tyler Russell made Jumper.
Northwestern State,Houston Baptist,97,98,39,59,0,Northwestern St  Timeout
Northwestern State,Houston Baptist,97,98,40,0,0,End of Game
