Away Team,Home Team,Away Score,Home Score,Minute,Second,isScoringPosession,Desc.
Northwestern State,Houston Baptist,2,0,0,9,1,DeQuan Hicks made Jumper. Assisted by Jalan West.
Northwestern State,Houston Baptist,2,0,0,21,0,Dauson Womack missed Jumper.
Northwestern State,Houston Baptist,2,0,0,21,0,DeQuan Hicks Defensive Rebound.
Northwestern State,Houston Baptist,4,0,0,29,1,Zikiteran Woodley made Jumper.
Northwestern State,Houston Baptist,4,2,0,42,1,Ricmonds Vilde made Layup. Assisted by Marcel Smith.
Northwestern State,Houston Baptist,4,2,0,56,0,Marvin Frazier missed Three Point Jumper.
Northwestern State,Houston Baptist,4,2,0,56,0,Caleb Crayton Defensive Rebound.
Northwestern State,Houston Baptist,4,2,1,2,0,Caleb Crayton Turnover.
Northwestern State,Houston Baptist,6,2,1,13,1,Jalan West made Jumper.
Northwestern State,Houston Baptist,6,2,1,35,0,Foul on Zikiteran Woodley.
Northwestern State,Houston Baptist,6,3,1,35,1,Rob Lewis made Free Throw.
Northwestern State,Houston Baptist,6,4,1,35,1,Rob Lewis made Free Throw.
Northwestern State,Houston Baptist,6,4,1,41,0,DeQuan Hicks missed Jumper.
Northwestern State,Houston Baptist,6,4,1,41,0,Rob Lewis Defensive Rebound.
Northwestern State,Houston Baptist,6,6,1,47,1,Rob Lewis made Layup.
Northwestern State,Houston Baptist,6,6,1,53,0,Foul on Caleb Crayton.
Northwestern State,Houston Baptist,6,6,1,53,0,Zikiteran Woodley missed Free Throw.
Northwestern State,Houston Baptist,6,6,1,53,0,Northwestern St Deadball Team Rebound.
Northwestern State,Houston Baptist,6,6,1,53,0,Marvin Frazier Turnover.
Northwestern State,Houston Baptist,6,6,1,57,0,Ricmonds Vilde Turnover.
Northwestern State,Houston Baptist,6,6,2,5,0,Foul on Dauson Womack.
Northwestern State,Houston Baptist,6,6,2,17,0,Jalan West missed Three Point Jumper.
Northwestern State,Houston Baptist,6,6,2,17,0,Ricmonds Vilde Defensive Rebound.
Northwestern State,Houston Baptist,6,6,2,26,0,Rob Lewis Turnover.
Northwestern State,Houston Baptist,6,6,2,27,0,Jalan West Steal.
Northwestern State,Houston Baptist,8,6,2,30,1,Jalan West made Layup.
Northwestern State,Houston Baptist,8,8,2,34,1,Caleb Crayton made Layup.
Northwestern State,Houston Baptist,8,8,2,34,0,Foul on Marvin Frazier.
Northwestern State,Houston Baptist,8,9,2,34,1,Caleb Crayton made Free Throw.
Northwestern State,Houston Baptist,8,9,2,49,0,Matt Killian missed Three Point Jumper.
Northwestern State,Houston Baptist,8,9,2,49,0,DeQuan Hicks Offensive Rebound.
Northwestern State,Houston Baptist,10,9,2,58,1,Zikiteran Woodley made Jumper.
Northwestern State,Houston Baptist,10,11,3,26,1,Ricmonds Vilde made Jumper. Assisted by Rob Lewis.
Northwestern State,Houston Baptist,10,11,3,38,0,DeQuan Hicks missed Jumper.
Northwestern State,Houston Baptist,10,11,3,38,0,Zikiteran Woodley Offensive Rebound.
Northwestern State,Houston Baptist,12,11,3,41,1,Zikiteran Woodley made Layup.
Northwestern State,Houston Baptist,12,11,3,54,0,Foul on Sabri Thompson.
Northwestern State,Houston Baptist,12,11,4,2,0,Rob Lewis missed Jumper.
Northwestern State,Houston Baptist,12,11,4,2,0,Dauson Womack Offensive Rebound.
Northwestern State,Houston Baptist,12,11,4,6,0,Dauson Womack missed Jumper.
Northwestern State,Houston Baptist,12,11,4,6,0,Caleb Crayton Offensive Rebound.
Northwestern State,Houston Baptist,12,13,4,8,1,Caleb Crayton made Layup.
Northwestern State,Houston Baptist,14,13,4,18,1,Zikiteran Woodley made Jumper.
Northwestern State,Houston Baptist,14,13,4,21,0,Technical Foul on Northwestern St.
Northwestern State,Houston Baptist,14,13,4,21,0,Official TV Timeout
Northwestern State,Houston Baptist,14,14,4,21,1,Marcel Smith made Free Throw.
Northwestern State,Houston Baptist,14,15,4,21,1,Marcel Smith made Free Throw.
Northwestern State,Houston Baptist,14,18,4,51,1,Rob Lewis made Three Point Jumper.
Northwestern State,Houston Baptist,16,18,5,9,1,Jalan West made Jumper.
Northwestern State,Houston Baptist,16,20,5,26,1,Caleb Crayton made Jumper. Assisted by Rob Lewis.
Northwestern State,Houston Baptist,16,20,5,42,0,Foul on Caleb Crayton.
Northwestern State,Houston Baptist,17,20,5,42,1,DeQuan Hicks made Free Throw.
Northwestern State,Houston Baptist,18,20,5,42,1,DeQuan Hicks made Free Throw.
Northwestern State,Houston Baptist,18,20,6,15,0,Marcel Smith missed Jumper.
Northwestern State,Houston Baptist,18,20,6,15,0,Tyler Russell Offensive Rebound.
Northwestern State,Houston Baptist,18,22,6,31,1,Cody Joyce made Layup. Assisted by Marcel Smith.
Northwestern State,Houston Baptist,21,22,6,42,1,Tyler Washington made Three Point Jumper.
Northwestern State,Houston Baptist,21,22,7,1,0,Foul on Patrick Robinson.
Northwestern State,Houston Baptist,21,23,7,1,1,Rob Lewis made Free Throw.
Northwestern State,Houston Baptist,21,24,7,1,1,Rob Lewis made Free Throw.
Northwestern State,Houston Baptist,23,24,7,14,1,Brison White made Layup. Assisted by Patrick Robinson.
Northwestern State,Houston Baptist,23,26,7,37,1,Cody Joyce made Layup. Assisted by Dauson Womack.
Northwestern State,Houston Baptist,23,26,7,49,0,Brison White missed Jumper.
Northwestern State,Houston Baptist,23,26,7,49,0,Cody Joyce Defensive Rebound.
Northwestern State,Houston Baptist,23,26,7,52,0,Foul on Brison White.
Northwestern State,Houston Baptist,23,26,7,55,0,Jimmy Barton Turnover.
Northwestern State,Houston Baptist,23,26,7,57,0,Tyler Washington Steal.
Northwestern State,Houston Baptist,23,26,7,59,0,Tra'von Joseph missed Jumper.
Northwestern State,Houston Baptist,23,26,7,59,0,Reveal Chukwujekwu Defensive Rebound.
Northwestern State,Houston Baptist,23,26,8,6,0,Alex Fountain Turnover.
Northwestern State,Houston Baptist,23,26,8,7,0,Patrick Robinson Steal.
Northwestern State,Houston Baptist,23,26,8,10,0,Brison White missed Jumper.
Northwestern State,Houston Baptist,23,26,8,10,0,Tra'von Joseph Offensive Rebound.
Northwestern State,Houston Baptist,25,26,8,14,1,Tra'von Joseph made Layup.
Northwestern State,Houston Baptist,25,26,8,14,0,Foul on Cody Joyce.
Northwestern State,Houston Baptist,25,26,8,14,0,Official TV Timeout
Northwestern State,Houston Baptist,25,26,8,14,0,Tra'von Joseph missed Free Throw.
Northwestern State,Houston Baptist,25,26,8,14,0,Reveal Chukwujekwu Defensive Rebound.
Northwestern State,Houston Baptist,25,26,8,20,0,Foul on Patrick Robinson.
Northwestern State,Houston Baptist,25,26,8,20,0,Reveal Chukwujekwu missed Free Throw.
Northwestern State,Houston Baptist,25,26,8,20,0,Houston Baptist Deadball Team Rebound.
Northwestern State,Houston Baptist,25,26,8,20,0,Reveal Chukwujekwu missed Free Throw.
Northwestern State,Houston Baptist,25,26,8,20,0,Patrick Robinson Defensive Rebound.
Northwestern State,Houston Baptist,25,26,8,28,0,Patrick Robinson Turnover.
Northwestern State,Houston Baptist,25,29,8,37,1,Jimmy Barton made Three Point Jumper. Assisted by Cody Joyce.
Northwestern State,Houston Baptist,25,29,8,49,0,Marvin Frazier missed Three Point Jumper.
Northwestern State,Houston Baptist,25,29,8,49,0,Houston Baptist Defensive Rebound.
Northwestern State,Houston Baptist,25,29,9,3,0,Tyler Russell missed Jumper.
Northwestern State,Houston Baptist,25,29,9,3,0,DeQuan Hicks Defensive Rebound.
Northwestern State,Houston Baptist,27,29,9,22,1,Jalan West made Jumper.
Northwestern State,Houston Baptist,27,31,9,40,1,Cody Joyce made Layup. Assisted by Reveal Chukwujekwu.
Northwestern State,Houston Baptist,27,31,9,53,0,Foul on Alex Fountain.
Northwestern State,Houston Baptist,27,31,10,3,0,DeQuan Hicks missed Layup.
Northwestern State,Houston Baptist,27,31,10,3,0,Reveal Chukwujekwu Defensive Rebound.
Northwestern State,Houston Baptist,27,31,10,15,0,Alex Fountain Turnover.
Northwestern State,Houston Baptist,27,31,10,15,0,Sabri Thompson Steal.
Northwestern State,Houston Baptist,27,31,10,16,0,Foul on Alex Fountain.
Northwestern State,Houston Baptist,27,31,10,31,0,DeQuan Hicks Turnover.
Northwestern State,Houston Baptist,27,31,10,41,0,Cody Joyce missed Jumper.
Northwestern State,Houston Baptist,27,31,10,41,0,DeQuan Hicks Block.
Northwestern State,Houston Baptist,27,31,10,42,0,Houston Baptist Offensive Rebound.
Northwestern State,Houston Baptist,27,31,10,49,0,Foul on DeQuan Hicks.
Northwestern State,Houston Baptist,27,32,10,49,1,Marcel Smith made Free Throw.
Northwestern State,Houston Baptist,27,32,10,49,0,Marcel Smith missed Free Throw.
Northwestern State,Houston Baptist,27,32,10,49,0,DeQuan Hicks Defensive Rebound.
Northwestern State,Houston Baptist,27,32,10,55,0,Sabri Thompson Turnover.
Northwestern State,Houston Baptist,27,32,10,56,0,Cody Joyce Steal.
Northwestern State,Houston Baptist,27,32,11,2,0,Marcel Smith missed Layup.
Northwestern State,Houston Baptist,27,32,11,2,0,Reveal Chukwujekwu Offensive Rebound.
Northwestern State,Houston Baptist,27,34,11,4,1,Reveal Chukwujekwu made Layup.
Northwestern State,Houston Baptist,27,34,11,19,0,Jalan West missed Jumper.
Northwestern State,Houston Baptist,27,34,11,19,0,Reveal Chukwujekwu Defensive Rebound.
Northwestern State,Houston Baptist,27,36,11,32,1,Cody Joyce made Layup. Assisted by Tyler Russell.
Northwestern State,Houston Baptist,27,36,11,58,0,Sabri Thompson missed Three Point Jumper.
Northwestern State,Houston Baptist,27,36,11,58,0,Reveal Chukwujekwu Defensive Rebound.
Northwestern State,Houston Baptist,27,36,12,9,0,Tyler Russell missed Jumper.
Northwestern State,Houston Baptist,27,36,12,9,0,Dauson Womack Offensive Rebound.
Northwestern State,Houston Baptist,27,39,12,14,1,Marcel Smith made Three Point Jumper. Assisted by Reveal Chukwujekwu.
Northwestern State,Houston Baptist,27,39,12,20,0,Northwestern St  Timeout
Northwestern State,Houston Baptist,29,39,12,32,1,DeQuan Hicks made Layup. Assisted by Zikiteran Woodley.
Northwestern State,Houston Baptist,29,41,12,51,1,Ricmonds Vilde made Layup. Assisted by Rob Lewis.
Northwestern State,Houston Baptist,31,41,13,1,1,Zikiteran Woodley made Layup. Assisted by Jalan West.
Northwestern State,Houston Baptist,31,41,13,1,0,Foul on Dauson Womack.
Northwestern State,Houston Baptist,31,41,13,1,0,Official TV Timeout
Northwestern State,Houston Baptist,31,41,13,1,0,Zikiteran Woodley missed Free Throw.
Northwestern State,Houston Baptist,31,41,13,1,0,Rob Lewis Defensive Rebound.
Northwestern State,Houston Baptist,31,44,13,29,1,Marcel Smith made Three Point Jumper. Assisted by Rob Lewis.
Northwestern State,Houston Baptist,33,44,13,38,1,Brison White made Dunk.
Northwestern State,Houston Baptist,33,46,13,57,1,Tyler Russell made Jumper.
Northwestern State,Houston Baptist,33,46,14,16,0,Foul on Ricmonds Vilde.
Northwestern State,Houston Baptist,34,46,14,16,1,DeQuan Hicks made Free Throw.
Northwestern State,Houston Baptist,35,46,14,16,1,DeQuan Hicks made Free Throw.
Northwestern State,Houston Baptist,35,46,14,34,0,Ricmonds Vilde missed Jumper.
Northwestern State,Houston Baptist,35,46,14,34,0,Tra'von Joseph Defensive Rebound.
Northwestern State,Houston Baptist,35,46,14,41,0,Foul on Brison White.
Northwestern State,Houston Baptist,35,46,14,41,0,Brison White Turnover.
Northwestern State,Houston Baptist,35,46,14,50,0,Rob Lewis missed Three Point Jumper.
Northwestern State,Houston Baptist,35,46,14,50,0,DeQuan Hicks Defensive Rebound.
Northwestern State,Houston Baptist,37,46,14,58,1,Zikiteran Woodley made Dunk. Assisted by Jalan West.
Northwestern State,Houston Baptist,37,49,15,20,1,Tyler Russell made Three Point Jumper. Assisted by Marcel Smith.
Northwestern State,Houston Baptist,37,49,15,32,0,Jalan West missed Three Point Jumper.
Northwestern State,Houston Baptist,37,49,15,32,0,Tyler Russell Defensive Rebound.
Northwestern State,Houston Baptist,37,51,15,49,1,Ricmonds Vilde made Jumper.
Northwestern State,Houston Baptist,37,51,15,50,0,Foul on DeQuan Hicks.
Northwestern State,Houston Baptist,37,52,15,50,1,Ricmonds Vilde made Free Throw.
Northwestern State,Houston Baptist,37,52,16,0,0,Sabri Thompson missed Three Point Jumper.
Northwestern State,Houston Baptist,37,52,16,0,0,Jalan West Offensive Rebound.
Northwestern State,Houston Baptist,39,52,16,5,1,Jalan West made Jumper.
Northwestern State,Houston Baptist,39,52,16,20,0,Cody Joyce missed Layup.
Northwestern State,Houston Baptist,39,52,16,20,0,Colter Lasher Offensive Rebound.
Northwestern State,Houston Baptist,39,52,16,26,0,Cody Joyce Turnover.
Northwestern State,Houston Baptist,39,52,16,27,0,Jalan West Steal.
Northwestern State,Houston Baptist,39,52,16,30,0,Foul on Marcel Smith.
Northwestern State,Houston Baptist,39,52,16,30,0,Official TV Timeout
Northwestern State,Houston Baptist,41,52,16,30,1,Zikiteran Woodley made Jumper.
Northwestern State,Houston Baptist,41,52,16,30,0,Alex Fountain missed Free Throw.
Northwestern State,Houston Baptist,41,52,16,30,0,Jalan West Defensive Rebound.
Northwestern State,Houston Baptist,41,52,16,53,0,Foul on Zikiteran Woodley.
Northwestern State,Houston Baptist,41,53,16,53,1,Marcel Smith made Free Throw.
Northwestern State,Houston Baptist,41,54,16,53,1,Marcel Smith made Free Throw.
Northwestern State,Houston Baptist,41,54,16,58,0,Jalan West missed Layup.
Northwestern State,Houston Baptist,41,54,16,58,0,Houston Baptist Defensive Rebound.
Northwestern State,Houston Baptist,41,54,17,14,0,Colter Lasher Turnover.
Northwestern State,Houston Baptist,41,54,17,25,0,Jalan West missed Jumper.
Northwestern State,Houston Baptist,41,54,17,25,0,Rob Lewis Defensive Rebound.
Northwestern State,Houston Baptist,41,54,17,35,0,Foul on Jalan West.
Northwestern State,Houston Baptist,41,55,17,35,1,Marcel Smith made Free Throw.
Northwestern State,Houston Baptist,41,56,17,35,1,Marcel Smith made Free Throw.
Northwestern State,Houston Baptist,43,56,17,46,1,Gary Stewart made Jumper.
Northwestern State,Houston Baptist,43,56,18,1,0,Rob Lewis missed Jumper.
Northwestern State,Houston Baptist,43,56,18,1,0,Marvin Frazier Block.
Northwestern State,Houston Baptist,43,56,18,3,0,Marvin Frazier Defensive Rebound.
Northwestern State,Houston Baptist,45,56,18,7,1,Tra'von Joseph made Layup. Assisted by Jalan West.
Northwestern State,Houston Baptist,45,56,18,28,0,Marcel Smith missed Jumper.
Northwestern State,Houston Baptist,45,56,18,28,0,Jalan West Defensive Rebound.
Northwestern State,Houston Baptist,47,56,18,37,1,Jalan West made Layup.
Northwestern State,Houston Baptist,47,56,19,1,0,Rob Lewis missed Three Point Jumper.
Northwestern State,Houston Baptist,47,56,19,1,0,Rob Lewis Offensive Rebound.
Northwestern State,Houston Baptist,47,56,19,14,0,Houston Baptist  Timeout
Northwestern State,Houston Baptist,47,56,19,26,0,Colter Lasher Turnover.
Northwestern State,Houston Baptist,47,56,19,27,0,Gary Stewart Steal.
Northwestern State,Houston Baptist,47,56,19,57,0,Jalan West missed Jumper.
Northwestern State,Houston Baptist,47,56,19,57,0,Reveal Chukwujekwu Defensive Rebound.
Northwestern State,Houston Baptist,47,56,20,0,0,End of 1st half
Northwestern State,Houston Baptist,47,56,20,23,0,Ricmonds Vilde Turnover.
Northwestern State,Houston Baptist,47,56,20,34,0,DeQuan Hicks missed Jumper.
Northwestern State,Houston Baptist,47,56,20,34,0,Dauson Womack Defensive Rebound.
Northwestern State,Houston Baptist,47,58,20,44,1,Rob Lewis made Jumper.
Northwestern State,Houston Baptist,47,58,20,51,0,Brison White missed Jumper.
Northwestern State,Houston Baptist,47,58,20,51,0,Zikiteran Woodley Offensive Rebound.
Northwestern State,Houston Baptist,47,58,20,53,0,Foul on Ricmonds Vilde.
Northwestern State,Houston Baptist,49,58,21,0,1,DeQuan Hicks made Layup. Assisted by Sabri Thompson.
Northwestern State,Houston Baptist,49,60,21,18,1,Caleb Crayton made Jumper.
Northwestern State,Houston Baptist,49,60,21,42,0,DeQuan Hicks Turnover.
Northwestern State,Houston Baptist,49,60,22,3,0,Dauson Womack Turnover.
Northwestern State,Houston Baptist,49,60,22,10,0,Jalan West missed Three Point Jumper.
Northwestern State,Houston Baptist,49,60,22,10,0,Tyler Washington Offensive Rebound.
Northwestern State,Houston Baptist,49,60,22,13,0,Tyler Washington missed Jumper.
Northwestern State,Houston Baptist,49,60,22,13,0,Dauson Womack Defensive Rebound.
Northwestern State,Houston Baptist,49,60,22,28,0,Ricmonds Vilde missed Layup.
Northwestern State,Houston Baptist,49,60,22,28,0,DeQuan Hicks Defensive Rebound.
Northwestern State,Houston Baptist,51,60,22,34,1,Jalan West made Layup. Assisted by Brison White.
Northwestern State,Houston Baptist,51,62,22,51,1,Marcel Smith made Jumper. Assisted by Rob Lewis.
Northwestern State,Houston Baptist,51,62,23,2,0,DeQuan Hicks missed Layup.
Northwestern State,Houston Baptist,51,62,23,2,0,Cody Joyce Defensive Rebound.
Northwestern State,Houston Baptist,51,64,23,10,1,Rob Lewis made Layup.
Northwestern State,Houston Baptist,51,64,23,22,0,Jalan West missed Jumper.
Northwestern State,Houston Baptist,51,64,23,22,0,Caleb Crayton Defensive Rebound.
Northwestern State,Houston Baptist,51,64,23,31,0,Caleb Crayton missed Layup.
Northwestern State,Houston Baptist,51,64,23,31,0,Cody Joyce Offensive Rebound.
Northwestern State,Houston Baptist,51,66,23,33,1,Cody Joyce made Layup.
Northwestern State,Houston Baptist,53,66,23,49,1,DeQuan Hicks made Layup. Assisted by Jalan West.
Northwestern State,Houston Baptist,53,66,23,52,0,Technical Foul on DeQuan Hicks.
Northwestern State,Houston Baptist,53,66,23,52,0,Foul on DeQuan Hicks.
Northwestern State,Houston Baptist,53,66,23,52,0,Marcel Smith missed Free Throw.
Northwestern State,Houston Baptist,53,66,23,52,0,Houston Baptist Deadball Team Rebound.
Northwestern State,Houston Baptist,53,67,23,52,1,Marcel Smith made Free Throw.
Northwestern State,Houston Baptist,53,67,24,5,0,Cody Joyce Turnover.
Northwestern State,Houston Baptist,53,67,24,5,0,Official TV Timeout
Northwestern State,Houston Baptist,55,67,24,18,1,Marvin Frazier made Layup.
Northwestern State,Houston Baptist,55,67,24,40,0,Cody Joyce missed Jumper.
Northwestern State,Houston Baptist,55,67,24,40,0,Tyler Washington Defensive Rebound.
Northwestern State,Houston Baptist,55,67,24,46,0,Tra'von Joseph Turnover.
Northwestern State,Houston Baptist,55,67,25,4,0,Dauson Womack Turnover.
Northwestern State,Houston Baptist,55,67,25,16,0,Foul on Caleb Crayton.
Northwestern State,Houston Baptist,57,67,25,17,1,Zikiteran Woodley made Jumper. Assisted by Tyler Washington.
Northwestern State,Houston Baptist,57,67,25,34,0,Caleb Crayton Turnover.
Northwestern State,Houston Baptist,57,67,25,35,0,Patrick Robinson Steal.
Northwestern State,Houston Baptist,57,67,25,37,0,Foul on Dauson Womack.
Northwestern State,Houston Baptist,58,67,25,37,1,Patrick Robinson made Free Throw.
Northwestern State,Houston Baptist,58,67,25,37,0,Patrick Robinson missed Free Throw.
Northwestern State,Houston Baptist,58,67,25,37,0,Dauson Womack Defensive Rebound.
Northwestern State,Houston Baptist,58,67,25,56,0,Marcel Smith missed Jumper.
Northwestern State,Houston Baptist,58,67,25,56,0,Marvin Frazier Defensive Rebound.
Northwestern State,Houston Baptist,60,67,26,1,1,Jalan West made Jumper.
Northwestern State,Houston Baptist,60,67,26,2,0,Foul on Tyler Russell.
Northwestern State,Houston Baptist,60,67,26,2,0,Houston Baptist  Timeout
Northwestern State,Houston Baptist,61,67,26,2,1,Jalan West made Free Throw.
Northwestern State,Houston Baptist,61,67,26,11,0,Foul on Tyler Washington.
Northwestern State,Houston Baptist,61,67,26,29,0,Cody Joyce missed Jumper.
Northwestern State,Houston Baptist,61,67,26,29,0,Marvin Frazier Defensive Rebound.
Northwestern State,Houston Baptist,61,67,26,41,0,Zikiteran Woodley missed Jumper.
Northwestern State,Houston Baptist,61,67,26,41,0,Marvin Frazier Offensive Rebound.
Northwestern State,Houston Baptist,61,67,26,47,0,Marvin Frazier missed Layup.
Northwestern State,Houston Baptist,61,67,26,47,0,Dauson Womack Defensive Rebound.
Northwestern State,Houston Baptist,61,69,26,49,1,Tyler Russell made Layup. Assisted by Dauson Womack.
Northwestern State,Houston Baptist,63,69,26,56,1,Zikiteran Woodley made Layup. Assisted by Tyler Washington.
Northwestern State,Houston Baptist,63,69,27,14,0,Tyler Russell Turnover.
Northwestern State,Houston Baptist,63,69,27,23,0,Jalan West missed Three Point Jumper.
Northwestern State,Houston Baptist,63,69,27,23,0,Patrick Robinson Offensive Rebound.
Northwestern State,Houston Baptist,63,69,27,28,0,Patrick Robinson Turnover.
Northwestern State,Houston Baptist,63,69,27,29,0,Dauson Womack Steal.
Northwestern State,Houston Baptist,63,71,27,32,1,Marcel Smith made Layup. Assisted by Dauson Womack.
Northwestern State,Houston Baptist,65,71,27,50,1,Zikiteran Woodley made Jumper. Assisted by Jalan West.
Northwestern State,Houston Baptist,65,74,28,11,1,Marcel Smith made Three Point Jumper. Assisted by Rob Lewis.
Northwestern State,Houston Baptist,65,74,28,19,0,Foul on Rob Lewis.
Northwestern State,Houston Baptist,65,74,28,19,0,Official TV Timeout
Northwestern State,Houston Baptist,66,74,28,19,1,Jalan West made Free Throw.
Northwestern State,Houston Baptist,67,74,28,19,1,Jalan West made Free Throw.
Northwestern State,Houston Baptist,67,74,28,32,0,Foul on Zikiteran Woodley.
Northwestern State,Houston Baptist,67,74,28,32,0,Cody Joyce missed Free Throw.
Northwestern State,Houston Baptist,67,74,28,32,0,Houston Baptist Deadball Team Rebound.
Northwestern State,Houston Baptist,67,74,28,32,0,Cody Joyce missed Free Throw.
Northwestern State,Houston Baptist,67,74,28,32,0,Patrick Robinson Defensive Rebound.
Northwestern State,Houston Baptist,69,74,28,52,1,Zikiteran Woodley made Layup. Assisted by Patrick Robinson.
Northwestern State,Houston Baptist,69,74,29,8,0,Cody Joyce missed Jumper.
Northwestern State,Houston Baptist,69,74,29,8,0,Marvin Frazier Block.
Northwestern State,Houston Baptist,69,74,29,10,0,Matt Killian Defensive Rebound.
Northwestern State,Houston Baptist,69,74,29,12,0,Matt Killian Turnover.
Northwestern State,Houston Baptist,69,74,29,26,0,Cody Joyce missed Jumper.
Northwestern State,Houston Baptist,69,74,29,26,0,Marvin Frazier Defensive Rebound.
Northwestern State,Houston Baptist,69,74,29,34,0,Foul on Cody Joyce.
Northwestern State,Houston Baptist,70,74,29,34,1,Zikiteran Woodley made Free Throw.
Northwestern State,Houston Baptist,71,74,29,34,1,Zikiteran Woodley made Free Throw.
Northwestern State,Houston Baptist,71,74,29,56,0,Foul on Marvin Frazier.
Northwestern State,Houston Baptist,71,74,30,8,0,Foul on Patrick Robinson.
Northwestern State,Houston Baptist,71,75,30,8,1,Rob Lewis made Free Throw.
Northwestern State,Houston Baptist,71,75,30,8,0,Rob Lewis missed Free Throw.
Northwestern State,Houston Baptist,71,75,30,8,0,Rob Lewis Offensive Rebound.
Northwestern State,Houston Baptist,71,77,30,26,1,Rob Lewis made Jumper. Assisted by Reveal Chukwujekwu.
Northwestern State,Houston Baptist,71,77,30,34,0,Foul on Tyler Russell.
Northwestern State,Houston Baptist,72,77,30,34,1,Marvin Frazier made Free Throw.
Northwestern State,Houston Baptist,73,77,30,34,1,Marvin Frazier made Free Throw.
Northwestern State,Houston Baptist,73,77,30,58,0,Reveal Chukwujekwu missed Three Point Jumper.
Northwestern State,Houston Baptist,73,77,30,58,0,Colter Lasher Offensive Rebound.
Northwestern State,Houston Baptist,73,77,31,1,0,Colter Lasher missed Jumper.
Northwestern State,Houston Baptist,73,77,31,1,0,Marvin Frazier Block.
Northwestern State,Houston Baptist,73,77,31,3,0,Patrick Robinson Defensive Rebound.
Northwestern State,Houston Baptist,73,77,31,14,0,Tyler Washington missed Three Point Jumper.
Northwestern State,Houston Baptist,73,77,31,14,0,Reveal Chukwujekwu Defensive Rebound.
Northwestern State,Houston Baptist,73,79,31,18,1,Tyler Russell made Layup. Assisted by Reveal Chukwujekwu.
Northwestern State,Houston Baptist,73,79,31,38,0,Foul on Ricmonds Vilde.
Northwestern State,Houston Baptist,74,79,31,38,1,Marvin Frazier made Free Throw.
Northwestern State,Houston Baptist,75,79,31,38,1,Marvin Frazier made Free Throw.
Northwestern State,Houston Baptist,75,82,32,1,1,Tyler Russell made Three Point Jumper. Assisted by Colter Lasher.
Northwestern State,Houston Baptist,75,82,32,16,0,Patrick Robinson Turnover.
Northwestern State,Houston Baptist,75,82,32,17,0,Tyler Russell Steal.
Northwestern State,Houston Baptist,75,82,32,20,0,Foul on Jalan West.
Northwestern State,Houston Baptist,75,82,32,20,0,Official TV Timeout
Northwestern State,Houston Baptist,75,83,32,20,1,Colter Lasher made Free Throw.
Northwestern State,Houston Baptist,75,84,32,20,1,Colter Lasher made Free Throw.
Northwestern State,Houston Baptist,75,84,32,37,0,Foul on Ricmonds Vilde.
Northwestern State,Houston Baptist,76,84,32,37,1,DeQuan Hicks made Free Throw.
Northwestern State,Houston Baptist,77,84,32,37,1,DeQuan Hicks made Free Throw.
Northwestern State,Houston Baptist,77,86,32,59,1,Colter Lasher made Jumper. Assisted by Tyler Russell.
Northwestern State,Houston Baptist,77,86,33,7,0,Jalan West missed Three Point Jumper.
Northwestern State,Houston Baptist,77,86,33,7,0,Reveal Chukwujekwu Defensive Rebound.
Northwestern State,Houston Baptist,77,86,33,14,0,Colter Lasher missed Three Point Jumper.
Northwestern State,Houston Baptist,77,86,33,14,0,Reveal Chukwujekwu Offensive Rebound.
Northwestern State,Houston Baptist,77,88,33,17,1,Reveal Chukwujekwu made Layup.
Northwestern State,Houston Baptist,77,88,33,29,0,Zikiteran Woodley missed Jumper.
Northwestern State,Houston Baptist,77,88,33,29,0,DeQuan Hicks Offensive Rebound.
Northwestern State,Houston Baptist,77,88,33,34,0,DeQuan Hicks missed Layup.
Northwestern State,Houston Baptist,77,88,33,34,0,Colter Lasher Block.
Northwestern State,Houston Baptist,77,88,33,37,0,DeQuan Hicks Offensive Rebound.
Northwestern State,Houston Baptist,79,88,33,38,1,DeQuan Hicks made Layup.
Northwestern State,Houston Baptist,79,88,34,5,0,Marcel Smith Turnover.
Northwestern State,Houston Baptist,79,88,34,6,0,Jalan West Steal.
Northwestern State,Houston Baptist,79,88,34,14,0,Foul on DeQuan Hicks.
Northwestern State,Houston Baptist,79,88,34,14,0,DeQuan Hicks Turnover.
