Away Team,Home Team,Away Score,Home Score,Minute,Second,isScoringPosession,Desc.
Nicholls,Stephen F. Austin,0,2,0,27,1,Jacob Parker made Layup. Assisted by Trey Pinkney.
Nicholls,Stephen F. Austin,0,2,0,45,0,Shane Rillieux Turnover.
Nicholls,Stephen F. Austin,0,2,1,1,0,Thomas Walkup missed Three Point Jumper.
Nicholls,Stephen F. Austin,0,2,1,1,0,Sam McBeath Defensive Rebound.
Nicholls,Stephen F. Austin,0,2,1,31,0,Jeremy Smith Turnover.
Nicholls,Stephen F. Austin,0,2,1,41,0,Jacob Parker Turnover.
Nicholls,Stephen F. Austin,0,2,1,42,0,Sam McBeath Steal.
Nicholls,Stephen F. Austin,2,2,1,45,1,Jeremy Smith made Layup. Assisted by Sam McBeath.
Nicholls,Stephen F. Austin,2,5,2,6,1,Nikola Gajic made Three Point Jumper. Assisted by Thomas Walkup.
Nicholls,Stephen F. Austin,2,5,2,34,0,Sam McBeath missed Three Point Jumper.
Nicholls,Stephen F. Austin,2,5,2,34,0,Nikola Gajic Defensive Rebound.
Nicholls,Stephen F. Austin,2,8,2,41,1,Desmond Haymon made Three Point Jumper. Assisted by Trey Pinkney.
Nicholls,Stephen F. Austin,2,8,3,4,0,Dantrell Thomas Turnover.
Nicholls,Stephen F. Austin,2,8,3,4,0,Foul on Dantrell Thomas.
Nicholls,Stephen F. Austin,2,10,3,17,1,Desmond Haymon made Layup.
Nicholls,Stephen F. Austin,2,10,3,36,0,Shane Rillieux Turnover.
Nicholls,Stephen F. Austin,2,10,3,37,0,Nikola Gajic Steal.
Nicholls,Stephen F. Austin,2,12,3,40,1,Thomas Walkup made Dunk. Assisted by Desmond Haymon.
Nicholls,Stephen F. Austin,2,12,4,9,0,Foul on Trey Pinkney.
Nicholls,Stephen F. Austin,2,12,4,9,0,Official TV Timeout
Nicholls,Stephen F. Austin,2,12,4,17,0,T.J. Carpenter Turnover.
Nicholls,Stephen F. Austin,2,12,4,18,0,Desmond Haymon Steal.
Nicholls,Stephen F. Austin,2,14,4,20,1,Desmond Haymon made Layup.
Nicholls,Stephen F. Austin,2,14,4,36,0,Dantrell Thomas missed Layup.
Nicholls,Stephen F. Austin,2,14,4,36,0,Nikola Gajic Block.
Nicholls,Stephen F. Austin,2,14,4,37,0,Jeremy Smith Offensive Rebound.
Nicholls,Stephen F. Austin,2,14,4,41,0,T.J. Carpenter missed Three Point Jumper.
Nicholls,Stephen F. Austin,2,14,4,41,0,Desmond Haymon Defensive Rebound.
Nicholls,Stephen F. Austin,2,14,4,50,0,Foul on Sam McBeath.
Nicholls,Stephen F. Austin,2,14,4,52,0,Deshaunt Walker Turnover.
Nicholls,Stephen F. Austin,2,14,4,53,0,Jeremy Smith Steal.
Nicholls,Stephen F. Austin,2,14,4,56,0,Jeremy Smith missed Layup.
Nicholls,Stephen F. Austin,2,14,4,56,0,Tanner Clayton Defensive Rebound.
Nicholls,Stephen F. Austin,2,14,5,10,0,Dallas Cameron missed Three Point Jumper.
Nicholls,Stephen F. Austin,2,14,5,10,0,Nikola Gajic Offensive Rebound.
Nicholls,Stephen F. Austin,2,14,5,13,0,Nikola Gajic missed Layup.
Nicholls,Stephen F. Austin,2,14,5,13,0,Sam McBeath Defensive Rebound.
Nicholls,Stephen F. Austin,2,14,5,25,0,Shane Rillieux Turnover.
Nicholls,Stephen F. Austin,2,14,5,26,0,Nikola Gajic Steal.
Nicholls,Stephen F. Austin,2,16,5,29,1,Dallas Cameron made Layup. Assisted by Nikola Gajic.
Nicholls,Stephen F. Austin,2,16,5,53,0,Foul on Jacob Parker.
Nicholls,Stephen F. Austin,2,16,5,53,0,Shane Rillieux missed Free Throw.
Nicholls,Stephen F. Austin,2,16,5,53,0,Nicholls St Deadball Team Rebound.
Nicholls,Stephen F. Austin,3,16,5,53,1,Shane Rillieux made Free Throw.
Nicholls,Stephen F. Austin,3,16,6,9,0,Jacob Parker missed Jumper.
Nicholls,Stephen F. Austin,3,16,6,9,0,Jeremy Smith Defensive Rebound.
Nicholls,Stephen F. Austin,3,16,6,18,0,Foul on Tanner Clayton.
Nicholls,Stephen F. Austin,3,16,6,18,0,Jeremy Smith missed Free Throw.
Nicholls,Stephen F. Austin,3,16,6,18,0,Nicholls St Deadball Team Rebound.
Nicholls,Stephen F. Austin,3,16,6,18,0,Jeremy Smith missed Free Throw.
Nicholls,Stephen F. Austin,3,16,6,18,0,Ja'Dante' Frye Offensive Rebound.
Nicholls,Stephen F. Austin,3,16,6,19,0,Ja'Dante' Frye Turnover.
Nicholls,Stephen F. Austin,3,18,6,39,1,Thomas Walkup made Layup.
Nicholls,Stephen F. Austin,3,18,6,48,0,Pedro Maciel Turnover.
Nicholls,Stephen F. Austin,3,18,6,48,0,Foul on Pedro Maciel.
Nicholls,Stephen F. Austin,3,18,7,6,0,Desmond Haymon missed Three Point Jumper.
Nicholls,Stephen F. Austin,3,18,7,6,0,Ja'Dante' Frye Defensive Rebound.
Nicholls,Stephen F. Austin,3,18,7,29,0,Dantrell Thomas Turnover.
Nicholls,Stephen F. Austin,3,18,7,29,0,Foul on Dantrell Thomas.
Nicholls,Stephen F. Austin,3,18,7,50,0,Thomas Walkup missed Jumper.
Nicholls,Stephen F. Austin,3,18,7,50,0,Desmond Haymon Offensive Rebound.
Nicholls,Stephen F. Austin,3,21,7,56,1,Deshaunt Walker made Three Point Jumper. Assisted by Desmond Haymon.
Nicholls,Stephen F. Austin,5,21,8,4,1,Luke Doyle made Layup. Assisted by Jeremy Smith.
Nicholls,Stephen F. Austin,5,23,8,17,1,Jacob Parker made Layup. Assisted by Thomas Walkup.
Nicholls,Stephen F. Austin,5,23,8,21,0,Foul on Ja'Dante' Frye.
Nicholls,Stephen F. Austin,5,23,8,21,0,Official TV Timeout
Nicholls,Stephen F. Austin,5,24,8,21,1,Jacob Parker made Free Throw.
Nicholls,Stephen F. Austin,5,24,8,30,0,Ja'Dante' Frye missed Three Point Jumper.
Nicholls,Stephen F. Austin,5,24,8,30,0,Jacob Parker Defensive Rebound.
Nicholls,Stephen F. Austin,5,24,8,49,0,Deshaunt Walker missed Jumper.
Nicholls,Stephen F. Austin,5,24,8,49,0,Nicholls St Defensive Rebound.
Nicholls,Stephen F. Austin,5,24,9,4,0,Luke Doyle missed Three Point Jumper.
Nicholls,Stephen F. Austin,5,24,9,4,0,Trey Pinkney Defensive Rebound.
Nicholls,Stephen F. Austin,5,24,9,22,0,Foul on Liam Thomas.
Nicholls,Stephen F. Austin,5,25,9,22,1,Thomas Walkup made Free Throw.
Nicholls,Stephen F. Austin,5,26,9,22,1,Thomas Walkup made Free Throw.
Nicholls,Stephen F. Austin,5,26,9,40,0,Sam McBeath missed Layup.
Nicholls,Stephen F. Austin,5,26,9,40,0,Thomas Walkup Defensive Rebound.
Nicholls,Stephen F. Austin,5,26,10,0,0,Desmond Haymon missed Three Point Jumper.
Nicholls,Stephen F. Austin,5,26,10,0,0,Tanner Clayton Offensive Rebound.
Nicholls,Stephen F. Austin,5,26,10,17,0,Desmond Haymon Turnover.
Nicholls,Stephen F. Austin,5,26,10,17,0,Foul on Desmond Haymon.
Nicholls,Stephen F. Austin,5,26,10,41,0,Sam McBeath missed Three Point Jumper.
Nicholls,Stephen F. Austin,5,26,10,41,0,Desmond Haymon Defensive Rebound.
Nicholls,Stephen F. Austin,5,26,11,2,0,Desmond Haymon missed Three Point Jumper.
Nicholls,Stephen F. Austin,5,26,11,2,0,Luke Doyle Defensive Rebound.
Nicholls,Stephen F. Austin,5,26,11,11,0,Foul on Trey Pinkney.
Nicholls,Stephen F. Austin,5,26,11,23,0,Foul on Tanner Clayton.
Nicholls,Stephen F. Austin,5,26,11,23,0,Jeremy Smith missed Free Throw.
Nicholls,Stephen F. Austin,5,26,11,23,0,Nicholls St Deadball Team Rebound.
Nicholls,Stephen F. Austin,6,26,11,23,1,Jeremy Smith made Free Throw.
Nicholls,Stephen F. Austin,6,28,11,52,1,Thomas Walkup made Jumper. Assisted by Desmond Haymon.
Nicholls,Stephen F. Austin,8,28,12,10,1,Shane Rillieux made Layup. Assisted by Sam McBeath.
Nicholls,Stephen F. Austin,8,31,12,31,1,Thomas Walkup made Three Point Jumper. Assisted by Dallas Cameron.
Nicholls,Stephen F. Austin,10,31,12,45,1,Amin Torres made Layup.
Nicholls,Stephen F. Austin,10,34,12,57,1,Nikola Gajic made Three Point Jumper. Assisted by Desmond Haymon.
Nicholls,Stephen F. Austin,10,34,13,14,0,Official TV Timeout
Nicholls,Stephen F. Austin,10,34,13,26,0,Foul on Connor Brooks.
Nicholls,Stephen F. Austin,11,34,13,26,1,Amin Torres made Free Throw.
Nicholls,Stephen F. Austin,12,34,13,26,1,Amin Torres made Free Throw.
Nicholls,Stephen F. Austin,12,37,13,51,1,Connor Brooks made Three Point Jumper. Assisted by Deshaunt Walker.
Nicholls,Stephen F. Austin,12,37,14,10,0,Foul on Dallas Cameron.
Nicholls,Stephen F. Austin,13,37,14,10,1,Amin Torres made Free Throw.
Nicholls,Stephen F. Austin,13,37,14,10,0,Amin Torres missed Free Throw.
Nicholls,Stephen F. Austin,13,37,14,10,0,Nikola Gajic Defensive Rebound.
Nicholls,Stephen F. Austin,13,37,14,29,0,Dallas Cameron missed Layup.
Nicholls,Stephen F. Austin,13,37,14,29,0,Sam McBeath Block.
Nicholls,Stephen F. Austin,13,37,14,31,0,Sam McBeath Defensive Rebound.
Nicholls,Stephen F. Austin,15,37,14,42,1,Amin Torres made Layup.
Nicholls,Stephen F. Austin,15,39,15,4,1,Deshaunt Walker made Layup.
Nicholls,Stephen F. Austin,15,39,15,15,0,Luke Doyle missed Three Point Jumper.
Nicholls,Stephen F. Austin,15,39,15,15,0,Deshaunt Walker Defensive Rebound.
Nicholls,Stephen F. Austin,15,41,15,24,1,Nikola Gajic made Layup.
Nicholls,Stephen F. Austin,15,41,15,43,0,Shane Rillieux missed Jumper.
Nicholls,Stephen F. Austin,15,41,15,43,0,Jacob Parker Defensive Rebound.
Nicholls,Stephen F. Austin,15,43,15,56,1,Connor Brooks made Jumper. Assisted by Nikola Gajic.
Nicholls,Stephen F. Austin,15,43,16,18,0,Official TV Timeout
Nicholls,Stephen F. Austin,15,43,16,24,0,Jeremy Smith Turnover.
Nicholls,Stephen F. Austin,15,43,16,54,0,Deshaunt Walker missed Three Point Jumper.
Nicholls,Stephen F. Austin,15,43,16,54,0,Desmond Haymon Offensive Rebound.
Nicholls,Stephen F. Austin,15,45,17,11,1,Jacob Parker made Layup. Assisted by Deshaunt Walker.
Nicholls,Stephen F. Austin,15,45,17,28,0,Pedro Maciel Turnover.
Nicholls,Stephen F. Austin,15,45,17,29,0,Jacob Parker Steal.
Nicholls,Stephen F. Austin,15,47,17,32,1,Desmond Haymon made Layup. Assisted by Jacob Parker.
Nicholls,Stephen F. Austin,17,47,17,47,1,Liam Thomas made Layup. Assisted by Luke Doyle.
Nicholls,Stephen F. Austin,17,47,17,59,0,Foul on T.J. Carpenter.
Nicholls,Stephen F. Austin,17,47,17,59,0,Jacob Parker missed Free Throw.
Nicholls,Stephen F. Austin,17,47,17,59,0,Thomas Walkup Offensive Rebound.
Nicholls,Stephen F. Austin,17,49,18,20,1,Deshaunt Walker made Jumper.
Nicholls,Stephen F. Austin,17,49,18,34,0,Jeremy Smith Turnover.
Nicholls,Stephen F. Austin,17,49,18,34,0,Foul on Jeremy Smith.
Nicholls,Stephen F. Austin,17,49,18,40,0,Foul on Liam Thomas.
Nicholls,Stephen F. Austin,17,50,18,40,1,Dallas Cameron made Free Throw.
Nicholls,Stephen F. Austin,17,51,18,40,1,Dallas Cameron made Free Throw.
Nicholls,Stephen F. Austin,17,51,18,49,0,Amin Torres missed Layup.
Nicholls,Stephen F. Austin,17,51,18,49,0,Dallas Cameron Defensive Rebound.
Nicholls,Stephen F. Austin,17,51,18,55,0,Deshaunt Walker missed Layup.
Nicholls,Stephen F. Austin,17,51,18,55,0,Connor Brooks Offensive Rebound.
Nicholls,Stephen F. Austin,17,53,18,58,1,Connor Brooks made Jumper.
Nicholls,Stephen F. Austin,17,53,19,2,0,Foul on Deshaunt Walker.
Nicholls,Stephen F. Austin,17,53,19,2,0,Amin Torres missed Free Throw.
Nicholls,Stephen F. Austin,17,53,19,2,0,Nikola Gajic Defensive Rebound.
Nicholls,Stephen F. Austin,17,53,19,7,0,Stephen F. Austin  Timeout
Nicholls,Stephen F. Austin,17,53,19,31,0,Dallas Cameron missed Layup.
Nicholls,Stephen F. Austin,17,53,19,31,0,Nicholls St Defensive Rebound.
Nicholls,Stephen F. Austin,17,53,19,42,0,Amin Torres Turnover.
Nicholls,Stephen F. Austin,17,55,19,54,1,Thomas Walkup made Layup. Assisted by Nikola Gajic.
Nicholls,Stephen F. Austin,17,55,20,0,0,End of 1st half
Nicholls,Stephen F. Austin,19,55,20,19,1,Dantrell Thomas made Jumper.
Nicholls,Stephen F. Austin,19,57,20,47,1,Thomas Walkup made Jumper. Assisted by Jacob Parker.
Nicholls,Stephen F. Austin,21,57,21,2,1,Jeremy Smith made Layup. Assisted by Sam McBeath.
Nicholls,Stephen F. Austin,21,59,21,31,1,Jacob Parker made Jumper.
Nicholls,Stephen F. Austin,21,59,21,41,0,Foul on Trey Pinkney.
Nicholls,Stephen F. Austin,21,59,21,58,0,Shane Rillieux missed Jumper.
Nicholls,Stephen F. Austin,21,59,21,58,0,Jacob Parker Block.
Nicholls,Stephen F. Austin,21,59,22,2,0,Jacob Parker Defensive Rebound.
Nicholls,Stephen F. Austin,21,59,22,2,0,Thomas Walkup Turnover.
Nicholls,Stephen F. Austin,21,59,22,2,0,Foul on Thomas Walkup.
Nicholls,Stephen F. Austin,21,59,22,17,0,Shane Rillieux Turnover.
Nicholls,Stephen F. Austin,21,59,22,18,0,Nikola Gajic Steal.
Nicholls,Stephen F. Austin,21,61,22,21,1,Nikola Gajic made Dunk.
Nicholls,Stephen F. Austin,23,61,22,42,1,T.J. Carpenter made Layup. Assisted by Sam McBeath.
Nicholls,Stephen F. Austin,23,64,22,57,1,Desmond Haymon made Three Point Jumper. Assisted by Dallas Cameron.
Nicholls,Stephen F. Austin,25,64,23,23,1,Sam McBeath made Layup. Assisted by T.J. Carpenter.
Nicholls,Stephen F. Austin,25,64,23,36,0,Jacob Parker missed Layup.
Nicholls,Stephen F. Austin,25,64,23,36,0,Stephen F. Austin Offensive Rebound.
Nicholls,Stephen F. Austin,25,64,23,56,0,Foul on Pedro Maciel.
Nicholls,Stephen F. Austin,25,64,23,56,0,Dallas Cameron missed Free Throw.
Nicholls,Stephen F. Austin,25,64,23,56,0,Stephen F. Austin Deadball Team Rebound.
Nicholls,Stephen F. Austin,25,65,23,56,1,Dallas Cameron made Free Throw.
Nicholls,Stephen F. Austin,25,66,23,56,1,Dallas Cameron made Free Throw.
Nicholls,Stephen F. Austin,25,66,24,6,0,Dantrell Thomas missed Layup.
Nicholls,Stephen F. Austin,25,66,24,6,0,Jacob Parker Defensive Rebound.
Nicholls,Stephen F. Austin,25,66,24,12,0,Foul on Pedro Maciel.
Nicholls,Stephen F. Austin,25,66,24,12,0,Official TV Timeout
Nicholls,Stephen F. Austin,25,66,24,32,0,Dallas Cameron missed Jumper.
Nicholls,Stephen F. Austin,25,66,24,32,0,Pedro Maciel Defensive Rebound.
Nicholls,Stephen F. Austin,25,66,24,53,0,Foul on Jacob Parker.
Nicholls,Stephen F. Austin,26,66,24,53,1,Jeremy Smith made Free Throw.
Nicholls,Stephen F. Austin,27,66,24,53,1,Jeremy Smith made Free Throw.
Nicholls,Stephen F. Austin,27,66,25,22,0,Foul on Dantrell Thomas.
Nicholls,Stephen F. Austin,27,66,25,39,0,Foul on Jeremy Smith.
Nicholls,Stephen F. Austin,27,66,25,43,0,Deshaunt Walker missed Jumper.
Nicholls,Stephen F. Austin,27,66,25,43,0,Thomas Walkup Offensive Rebound.
Nicholls,Stephen F. Austin,27,68,25,47,1,Thomas Walkup made Layup.
Nicholls,Stephen F. Austin,29,68,26,3,1,Dantrell Thomas made Layup.
Nicholls,Stephen F. Austin,29,68,26,35,0,Dallas Cameron missed Three Point Jumper.
Nicholls,Stephen F. Austin,29,68,26,35,0,Sam McBeath Defensive Rebound.
Nicholls,Stephen F. Austin,29,68,26,37,0,Foul on Tanner Clayton.
Nicholls,Stephen F. Austin,31,68,26,58,1,Amin Torres made Layup. Assisted by Dantrell Thomas.
Nicholls,Stephen F. Austin,31,68,27,11,0,Deshaunt Walker missed Jumper.
Nicholls,Stephen F. Austin,31,68,27,11,0,Dantrell Thomas Defensive Rebound.
Nicholls,Stephen F. Austin,31,68,27,19,0,Amin Torres Turnover.
Nicholls,Stephen F. Austin,31,68,27,20,0,Nikola Gajic Steal.
Nicholls,Stephen F. Austin,31,70,27,23,1,Nikola Gajic made Layup. Assisted by Connor Brooks.
Nicholls,Stephen F. Austin,31,70,27,41,0,Amin Torres missed Three Point Jumper.
Nicholls,Stephen F. Austin,31,70,27,41,0,T.J. Carpenter Offensive Rebound.
Nicholls,Stephen F. Austin,31,70,27,51,0,Foul on Tanner Clayton.
Nicholls,Stephen F. Austin,32,70,27,51,1,Dantrell Thomas made Free Throw.
Nicholls,Stephen F. Austin,33,70,27,51,1,Dantrell Thomas made Free Throw.
Nicholls,Stephen F. Austin,33,70,28,3,0,Foul on Ja'Dante' Frye.
Nicholls,Stephen F. Austin,33,70,28,3,0,Official TV Timeout
Nicholls,Stephen F. Austin,33,70,28,9,0,Desmond Haymon missed Three Point Jumper.
Nicholls,Stephen F. Austin,33,70,28,9,0,Stephen F. Austin Offensive Rebound.
Nicholls,Stephen F. Austin,33,70,28,17,0,Foul on Amin Torres.
Nicholls,Stephen F. Austin,33,70,28,33,0,Foul on Amin Torres.
Nicholls,Stephen F. Austin,33,71,28,33,1,Jacob Parker made Free Throw.
Nicholls,Stephen F. Austin,33,72,28,33,1,Jacob Parker made Free Throw.
Nicholls,Stephen F. Austin,33,72,28,51,0,Amin Torres missed Three Point Jumper.
Nicholls,Stephen F. Austin,33,72,28,51,0,Liam Thomas Offensive Rebound.
Nicholls,Stephen F. Austin,33,72,28,56,0,Foul on Nikola Gajic.
Nicholls,Stephen F. Austin,33,72,28,56,0,Liam Thomas missed Free Throw.
Nicholls,Stephen F. Austin,33,72,28,56,0,Nicholls St Deadball Team Rebound.
Nicholls,Stephen F. Austin,34,72,28,56,1,Liam Thomas made Free Throw.
Nicholls,Stephen F. Austin,34,72,29,10,0,Nikola Gajic missed Three Point Jumper.
Nicholls,Stephen F. Austin,34,72,29,10,0,Dantrell Thomas Defensive Rebound.
Nicholls,Stephen F. Austin,34,72,29,21,0,Amin Torres missed Jumper.
Nicholls,Stephen F. Austin,34,72,29,21,0,Dantrell Thomas Offensive Rebound.
Nicholls,Stephen F. Austin,34,72,29,29,0,Liam Thomas Turnover.
Nicholls,Stephen F. Austin,34,72,29,31,0,Desmond Haymon Steal.
Nicholls,Stephen F. Austin,34,72,29,34,0,Desmond Haymon Turnover.
Nicholls,Stephen F. Austin,34,72,29,35,0,Ja'Dante' Frye Steal.
Nicholls,Stephen F. Austin,34,72,29,39,0,Liam Thomas missed Layup.
Nicholls,Stephen F. Austin,34,72,29,39,0,T.J. Carpenter Offensive Rebound.
Nicholls,Stephen F. Austin,36,72,29,45,1,Jeremy Smith made Layup. Assisted by Liam Thomas.
Nicholls,Stephen F. Austin,36,72,29,48,0,Foul on Ja'Dante' Frye.
Nicholls,Stephen F. Austin,36,73,29,48,1,Deshaunt Walker made Free Throw.
Nicholls,Stephen F. Austin,36,74,29,48,1,Deshaunt Walker made Free Throw.
Nicholls,Stephen F. Austin,36,74,30,1,0,Amin Torres missed Layup.
Nicholls,Stephen F. Austin,36,74,30,1,0,Thomas Walkup Defensive Rebound.
Nicholls,Stephen F. Austin,36,74,30,21,0,Foul on Dantrell Thomas.
Nicholls,Stephen F. Austin,36,74,30,21,0,Thomas Walkup missed Free Throw.
Nicholls,Stephen F. Austin,36,74,30,21,0,Sam McBeath Defensive Rebound.
Nicholls,Stephen F. Austin,36,74,30,32,0,Pedro Maciel Turnover.
Nicholls,Stephen F. Austin,36,74,30,33,0,Jacob Parker Steal.
Nicholls,Stephen F. Austin,36,76,30,36,1,Connor Brooks made Dunk. Assisted by Thomas Walkup.
Nicholls,Stephen F. Austin,36,76,30,47,0,Sam McBeath Turnover.
Nicholls,Stephen F. Austin,36,76,31,4,0,Deshaunt Walker missed Three Point Jumper.
Nicholls,Stephen F. Austin,36,76,31,4,0,Sam McBeath Defensive Rebound.
Nicholls,Stephen F. Austin,36,76,31,16,0,Jeremy Smith missed Jumper.
Nicholls,Stephen F. Austin,36,76,31,16,0,Jacob Parker Defensive Rebound.
Nicholls,Stephen F. Austin,36,76,31,22,0,Trey Pinkney Turnover.
Nicholls,Stephen F. Austin,38,76,31,34,1,Jeremy Smith made Layup. Assisted by Pedro Maciel.
Nicholls,Stephen F. Austin,38,76,31,34,0,Foul on Deshaunt Walker.
Nicholls,Stephen F. Austin,39,76,31,34,1,Jeremy Smith made Free Throw.
Nicholls,Stephen F. Austin,39,78,31,46,1,Connor Brooks made Jumper. Assisted by Jacob Parker.
Nicholls,Stephen F. Austin,39,78,32,4,0,Foul on Justin Dotson.
Nicholls,Stephen F. Austin,39,78,32,4,0,Official TV Timeout
Nicholls,Stephen F. Austin,40,78,32,4,1,Jeremy Smith made Free Throw.
Nicholls,Stephen F. Austin,41,78,32,4,1,Jeremy Smith made Free Throw.
Nicholls,Stephen F. Austin,41,78,32,34,0,Justin Dotson missed Layup.
Nicholls,Stephen F. Austin,41,78,32,34,0,Sam McBeath Block.
Nicholls,Stephen F. Austin,41,78,32,36,0,Jeremy Smith Defensive Rebound.
Nicholls,Stephen F. Austin,41,78,32,45,0,Dantrell Thomas Turnover.
Nicholls,Stephen F. Austin,41,78,32,46,0,Patrick Costello Steal.
Nicholls,Stephen F. Austin,41,78,33,1,0,Thomas Walkup missed Layup.
Nicholls,Stephen F. Austin,41,78,33,1,0,Sam McBeath Defensive Rebound.
Nicholls,Stephen F. Austin,43,78,33,8,1,Jeremy Smith made Jumper.
Nicholls,Stephen F. Austin,43,78,33,19,0,Patrick Costello missed Layup.
Nicholls,Stephen F. Austin,43,78,33,19,0,Pedro Maciel Defensive Rebound.
Nicholls,Stephen F. Austin,43,78,33,22,0,Foul on Patrick Costello.
Nicholls,Stephen F. Austin,44,78,33,22,1,Pedro Maciel made Free Throw.
Nicholls,Stephen F. Austin,44,78,33,22,0,Pedro Maciel missed Free Throw.
Nicholls,Stephen F. Austin,44,78,33,22,0,Thomas Walkup Defensive Rebound.
Nicholls,Stephen F. Austin,44,80,33,51,1,Justin Dotson made Layup.
Nicholls,Stephen F. Austin,46,80,34,20,1,Dantrell Thomas made Jumper.
Nicholls,Stephen F. Austin,46,80,34,27,0,Foul on Pedro Maciel.
Nicholls,Stephen F. Austin,46,80,34,27,0,Technical Foul on Pedro Maciel.
Nicholls,Stephen F. Austin,46,80,34,27,0,Foul on Pedro Maciel.
Nicholls,Stephen F. Austin,46,81,34,27,1,Justin Dotson made Free Throw.
Nicholls,Stephen F. Austin,46,82,34,27,1,Justin Dotson made Free Throw.
Nicholls,Stephen F. Austin,46,83,34,27,1,Dallas Cameron made Free Throw.
Nicholls,Stephen F. Austin,46,84,34,27,1,Dallas Cameron made Free Throw.
Nicholls,Stephen F. Austin,48,84,34,43,1,Jeremy Smith made Layup. Assisted by T.J. Carpenter.
Nicholls,Stephen F. Austin,48,87,34,57,1,Justin Dotson made Three Point Jumper. Assisted by Patrick Costello.
Nicholls,Stephen F. Austin,48,87,35,12,0,Liam Thomas Turnover.
Nicholls,Stephen F. Austin,48,89,35,21,1,Nikola Gajic made Layup. Assisted by Justin Dotson.
Nicholls,Stephen F. Austin,48,89,35,56,0,Foul on Ben Brown-White.
Nicholls,Stephen F. Austin,49,89,35,56,1,Dantrell Thomas made Free Throw.
Nicholls,Stephen F. Austin,50,89,35,56,1,Dantrell Thomas made Free Throw.
Nicholls,Stephen F. Austin,50,89,36,6,0,Reed Westbrook Turnover.
Nicholls,Stephen F. Austin,50,89,36,8,0,Amin Torres Steal.
Nicholls,Stephen F. Austin,52,89,36,10,1,Dantrell Thomas made Dunk. Assisted by Amin Torres.
Nicholls,Stephen F. Austin,52,89,36,31,0,Justin Dotson Turnover.
Nicholls,Stephen F. Austin,52,89,36,31,0,Official TV Timeout
Nicholls,Stephen F. Austin,54,89,36,39,1,Dantrell Thomas made Layup. Assisted by Amin Torres.
Nicholls,Stephen F. Austin,54,89,37,2,0,Patrick Costello Turnover.
Nicholls,Stephen F. Austin,54,89,37,2,0,Foul on Patrick Costello.
Nicholls,Stephen F. Austin,57,89,37,17,1,T.J. Carpenter made Three Point Jumper. Assisted by Amin Torres.
Nicholls,Stephen F. Austin,57,89,37,43,0,Reed Westbrook missed Three Point Jumper.
Nicholls,Stephen F. Austin,57,89,37,43,0,T.J. Carpenter Defensive Rebound.
Nicholls,Stephen F. Austin,57,89,37,52,0,Ja'Dante' Frye Turnover.
Nicholls,Stephen F. Austin,57,89,37,54,0,Justin Dotson Steal.
Nicholls,Stephen F. Austin,57,89,37,57,0,Reed Westbrook missed Layup.
Nicholls,Stephen F. Austin,57,89,37,57,0,T.J. Carpenter Defensive Rebound.
Nicholls,Stephen F. Austin,59,89,38,4,1,Dantrell Thomas made Layup.
Nicholls,Stephen F. Austin,59,89,38,5,0,Foul on Jason Martin.
Nicholls,Stephen F. Austin,60,89,38,5,1,Dantrell Thomas made Free Throw.
Nicholls,Stephen F. Austin,60,89,38,21,0,Justin Dotson missed Layup.
Nicholls,Stephen F. Austin,60,89,38,21,0,Liam Thomas Block.
Nicholls,Stephen F. Austin,60,89,38,23,0,Justin Dotson Offensive Rebound.
Nicholls,Stephen F. Austin,60,91,38,27,1,Justin Dotson made Layup.
Nicholls,Stephen F. Austin,60,91,38,44,0,Foul on Ben Brown-White.
Nicholls,Stephen F. Austin,60,91,38,44,0,Liam Thomas missed Free Throw.
Nicholls,Stephen F. Austin,60,91,38,44,0,Nicholls St Deadball Team Rebound.
Nicholls,Stephen F. Austin,61,91,38,44,1,Liam Thomas made Free Throw.
Nicholls,Stephen F. Austin,61,93,39,4,1,Reed Westbrook made Jumper.
Nicholls,Stephen F. Austin,61,93,39,13,0,Piers Carroll missed Three Point Jumper.
Nicholls,Stephen F. Austin,61,93,39,13,0,Justin Dotson Defensive Rebound.
Nicholls,Stephen F. Austin,61,93,39,23,0,Sharife Sergeant Turnover.
Nicholls,Stephen F. Austin,64,93,39,31,1,Amin Torres made Three Point Jumper. Assisted by Piers Carroll.
Nicholls,Stephen F. Austin,64,93,40,0,0,End of Game
