Away Team,Home Team,Away Score,Home Score,Minute,Second,isScoringPosession,Desc.
SIU-Edwardsville,Saint Louis,0,0,0,19,0,Kris Davis missed Layup.
SIU-Edwardsville,Saint Louis,0,0,0,19,0,Keaton Jackson Offensive Rebound.
SIU-Edwardsville,Saint Louis,0,0,0,31,0,Donivine Stewart Turnover.
SIU-Edwardsville,Saint Louis,0,2,0,51,1,Austin McBroom made Jumper.
SIU-Edwardsville,Saint Louis,0,2,1,4,0,Keaton Jackson Turnover.
SIU-Edwardsville,Saint Louis,0,2,1,6,0,Austin McBroom Steal.
SIU-Edwardsville,Saint Louis,0,4,1,9,1,Achraf Yacoubou made Layup. Assisted by Milik Yarbrough.
SIU-Edwardsville,Saint Louis,0,4,1,32,0,Michael Messer missed Jumper.
SIU-Edwardsville,Saint Louis,0,4,1,32,0,Keaton Jackson Offensive Rebound.
SIU-Edwardsville,Saint Louis,0,4,1,42,0,Rozell Nunn missed Jumper.
SIU-Edwardsville,Saint Louis,0,4,1,42,0,John Manning Block.
SIU-Edwardsville,Saint Louis,0,4,1,42,0,SIU-Edwardsville Offensive Rebound.
SIU-Edwardsville,Saint Louis,0,4,1,46,0,Keaton Jackson Turnover.
SIU-Edwardsville,Saint Louis,0,4,1,47,0,Austin McBroom Steal.
SIU-Edwardsville,Saint Louis,0,4,1,49,0,Foul on Kris Davis.
SIU-Edwardsville,Saint Louis,0,4,1,50,0,Davell Roby Turnover.
SIU-Edwardsville,Saint Louis,0,4,1,50,0,Grant Fiorentinos Steal.
SIU-Edwardsville,Saint Louis,2,4,1,53,1,Donivine Stewart made Layup. Assisted by Grant Fiorentinos.
SIU-Edwardsville,Saint Louis,2,4,2,7,0,Davell Roby missed Jumper.
SIU-Edwardsville,Saint Louis,2,4,2,7,0,Rozell Nunn Defensive Rebound.
SIU-Edwardsville,Saint Louis,2,4,2,17,0,Foul on Austin McBroom.
SIU-Edwardsville,Saint Louis,3,4,2,17,1,Grant Fiorentinos made Free Throw.
SIU-Edwardsville,Saint Louis,4,4,2,17,1,Grant Fiorentinos made Free Throw.
SIU-Edwardsville,Saint Louis,4,4,2,33,0,Milik Yarbrough Turnover.
SIU-Edwardsville,Saint Louis,4,4,2,34,0,Donivine Stewart Steal.
SIU-Edwardsville,Saint Louis,4,4,2,34,0,Foul on Milik Yarbrough.
SIU-Edwardsville,Saint Louis,4,4,2,57,0,Rozell Nunn missed Three Point Jumper.
SIU-Edwardsville,Saint Louis,4,4,2,57,0,John Manning Defensive Rebound.
SIU-Edwardsville,Saint Louis,4,6,3,11,1,John Manning made Layup. Assisted by Austin McBroom.
SIU-Edwardsville,Saint Louis,4,6,3,24,0,Donivine Stewart missed Jumper.
SIU-Edwardsville,Saint Louis,4,6,3,24,0,Donivine Stewart Offensive Rebound.
SIU-Edwardsville,Saint Louis,4,6,3,28,0,Donivine Stewart missed Two Point Tip Shot.
SIU-Edwardsville,Saint Louis,4,6,3,28,0,John Manning Defensive Rebound.
SIU-Edwardsville,Saint Louis,4,8,3,34,1,Achraf Yacoubou made Layup.
SIU-Edwardsville,Saint Louis,4,8,3,36,0,SIU-Edwardsville  Timeout
SIU-Edwardsville,Saint Louis,6,8,3,49,1,Kris Davis made Layup.
SIU-Edwardsville,Saint Louis,6,8,4,1,0,Foul on Rozell Nunn.
SIU-Edwardsville,Saint Louis,6,11,4,22,1,Austin McBroom made Three Point Jumper. Assisted by Austin Gillmann.
SIU-Edwardsville,Saint Louis,9,11,4,39,1,Grant Fiorentinos made Three Point Jumper. Assisted by Donivine Stewart.
SIU-Edwardsville,Saint Louis,9,11,5,6,0,Reggie Agbeko Turnover.
SIU-Edwardsville,Saint Louis,9,11,5,6,0,Official TV Timeout
SIU-Edwardsville,Saint Louis,11,11,5,29,1,Kris Davis made Jumper.
SIU-Edwardsville,Saint Louis,11,11,5,29,0,Foul on Reggie Agbeko.
SIU-Edwardsville,Saint Louis,12,11,5,29,1,Kris Davis made Free Throw.
SIU-Edwardsville,Saint Louis,12,13,5,36,1,Marcus Bartley made Layup.
SIU-Edwardsville,Saint Louis,12,13,5,47,0,Maurice Wiltz missed Jumper.
SIU-Edwardsville,Saint Louis,12,13,5,47,0,Marcus Bartley Defensive Rebound.
SIU-Edwardsville,Saint Louis,12,15,5,58,1,Reggie Agbeko made Jumper.
SIU-Edwardsville,Saint Louis,12,15,5,58,0,Foul on Maurice Wiltz.
SIU-Edwardsville,Saint Louis,12,15,5,58,0,Reggie Agbeko missed Free Throw.
SIU-Edwardsville,Saint Louis,12,15,5,58,0,Keaton Jackson Defensive Rebound.
SIU-Edwardsville,Saint Louis,12,15,6,14,0,Jake Newton Turnover.
SIU-Edwardsville,Saint Louis,12,15,6,14,0,Mike Crawford Steal.
SIU-Edwardsville,Saint Louis,12,17,6,26,1,Reggie Agbeko made Jumper. Assisted by Austin Gillmann.
SIU-Edwardsville,Saint Louis,12,17,6,37,0,Jake Newton missed Three Point Jumper.
SIU-Edwardsville,Saint Louis,12,17,6,37,0,Davell Roby Defensive Rebound.
SIU-Edwardsville,Saint Louis,12,17,7,4,0,Foul on Keaton Jackson.
SIU-Edwardsville,Saint Louis,12,17,7,9,0,Marcus Bartley Turnover.
SIU-Edwardsville,Saint Louis,12,17,7,10,0,Maurice Wiltz Steal.
SIU-Edwardsville,Saint Louis,12,17,7,16,0,Rozell Nunn missed Layup.
SIU-Edwardsville,Saint Louis,12,17,7,16,0,Austin Gillmann Defensive Rebound.
SIU-Edwardsville,Saint Louis,12,17,7,42,0,Marcus Bartley Turnover.
SIU-Edwardsville,Saint Louis,12,17,7,43,0,C.J. Carr Steal.
SIU-Edwardsville,Saint Louis,12,17,7,46,0,Foul on Davell Roby.
SIU-Edwardsville,Saint Louis,12,17,7,46,0,C.J. Carr missed Free Throw.
SIU-Edwardsville,Saint Louis,12,17,7,46,0,SIU-Edwardsville Deadball Team Rebound.
SIU-Edwardsville,Saint Louis,13,17,7,46,1,C.J. Carr made Free Throw.
SIU-Edwardsville,Saint Louis,13,17,8,0,0,Milik Yarbrough missed Layup.
SIU-Edwardsville,Saint Louis,13,17,8,0,0,SIU-Edwardsville Defensive Rebound.
SIU-Edwardsville,Saint Louis,13,17,8,3,0,Official TV Timeout
SIU-Edwardsville,Saint Louis,13,17,8,18,0,Rozell Nunn missed Layup.
SIU-Edwardsville,Saint Louis,13,17,8,18,0,Milik Yarbrough Defensive Rebound.
SIU-Edwardsville,Saint Louis,13,17,8,24,0,Foul on Milik Yarbrough.
SIU-Edwardsville,Saint Louis,13,17,8,24,0,Milik Yarbrough Turnover.
SIU-Edwardsville,Saint Louis,13,17,8,50,0,Foul on Maurice Wiltz.
SIU-Edwardsville,Saint Louis,13,17,8,50,0,Maurice Wiltz Turnover.
SIU-Edwardsville,Saint Louis,13,17,9,0,0,Brett Jolly missed Three Point Jumper.
SIU-Edwardsville,Saint Louis,13,17,9,0,0,Donivine Stewart Defensive Rebound.
SIU-Edwardsville,Saint Louis,13,17,9,18,0,C.J. Carr Turnover.
SIU-Edwardsville,Saint Louis,13,17,9,21,0,Miles Reynolds Steal.
SIU-Edwardsville,Saint Louis,13,17,9,30,0,Miles Reynolds Turnover.
SIU-Edwardsville,Saint Louis,13,17,9,31,0,Kris Davis Steal.
SIU-Edwardsville,Saint Louis,15,17,9,36,1,Donivine Stewart made Layup. Assisted by Kris Davis.
SIU-Edwardsville,Saint Louis,15,17,9,47,0,Brett Jolly missed Jumper.
SIU-Edwardsville,Saint Louis,15,17,9,47,0,Saint Louis Offensive Rebound.
SIU-Edwardsville,Saint Louis,15,17,10,1,0,Brett Jolly missed Three Point Jumper.
SIU-Edwardsville,Saint Louis,15,17,10,1,0,Kris Davis Defensive Rebound.
SIU-Edwardsville,Saint Louis,15,17,10,18,0,C.J. Carr missed Three Point Jumper.
SIU-Edwardsville,Saint Louis,15,17,10,18,0,Tanner Lancona Defensive Rebound.
SIU-Edwardsville,Saint Louis,15,20,10,27,1,Austin McBroom made Three Point Jumper. Assisted by Tanner Lancona.
SIU-Edwardsville,Saint Louis,15,20,10,52,0,C.J. Carr Turnover.
SIU-Edwardsville,Saint Louis,15,22,11,3,1,Austin Gillmann made Layup. Assisted by Tanner Lancona.
SIU-Edwardsville,Saint Louis,15,22,11,5,0,SIU-Edwardsville  Timeout
SIU-Edwardsville,Saint Louis,15,22,11,22,0,Foul on Achraf Yacoubou.
SIU-Edwardsville,Saint Louis,15,22,11,22,0,Maurice Wiltz missed Free Throw.
SIU-Edwardsville,Saint Louis,15,22,11,22,0,SIU-Edwardsville Deadball Team Rebound.
SIU-Edwardsville,Saint Louis,16,22,11,22,1,Maurice Wiltz made Free Throw.
SIU-Edwardsville,Saint Louis,16,22,11,42,0,Davell Roby missed Layup.
SIU-Edwardsville,Saint Louis,16,22,11,42,0,Grant Fiorentinos Block.
SIU-Edwardsville,Saint Louis,16,22,11,44,0,Rozell Nunn Defensive Rebound.
SIU-Edwardsville,Saint Louis,16,22,11,49,0,Kris Davis Turnover.
SIU-Edwardsville,Saint Louis,16,22,11,50,0,Achraf Yacoubou Steal.
SIU-Edwardsville,Saint Louis,16,22,11,52,0,Foul on Donivine Stewart.
SIU-Edwardsville,Saint Louis,16,23,11,52,1,Achraf Yacoubou made Free Throw.
SIU-Edwardsville,Saint Louis,16,24,11,52,1,Achraf Yacoubou made Free Throw.
SIU-Edwardsville,Saint Louis,18,24,12,8,1,Donivine Stewart made Jumper.
SIU-Edwardsville,Saint Louis,18,24,12,19,0,Austin Gillmann Turnover.
SIU-Edwardsville,Saint Louis,18,24,12,19,0,Official TV Timeout
SIU-Edwardsville,Saint Louis,20,24,12,31,1,Donivine Stewart made Layup.
SIU-Edwardsville,Saint Louis,20,24,12,44,0,Austin Gillmann Turnover.
SIU-Edwardsville,Saint Louis,20,24,12,46,0,Donivine Stewart Steal.
SIU-Edwardsville,Saint Louis,20,24,12,51,0,Michael Messer missed Three Point Jumper.
SIU-Edwardsville,Saint Louis,20,24,12,51,0,Mike Crawford Defensive Rebound.
SIU-Edwardsville,Saint Louis,20,24,13,3,0,Reggie Agbeko missed Jumper.
SIU-Edwardsville,Saint Louis,20,24,13,3,0,Kris Davis Defensive Rebound.
SIU-Edwardsville,Saint Louis,20,24,13,18,0,Donivine Stewart missed Three Point Jumper.
SIU-Edwardsville,Saint Louis,20,24,13,18,0,Davell Roby Defensive Rebound.
SIU-Edwardsville,Saint Louis,20,24,13,29,0,Davell Roby Turnover.
SIU-Edwardsville,Saint Louis,20,24,13,38,0,Maurice Wiltz Turnover.
SIU-Edwardsville,Saint Louis,20,24,13,50,0,Foul on Maurice Wiltz.
SIU-Edwardsville,Saint Louis,20,25,13,50,1,Achraf Yacoubou made Free Throw.
SIU-Edwardsville,Saint Louis,20,26,13,50,1,Achraf Yacoubou made Free Throw.
SIU-Edwardsville,Saint Louis,20,26,14,16,0,Donivine Stewart missed Layup.
SIU-Edwardsville,Saint Louis,20,26,14,16,0,Keaton Jackson Offensive Rebound.
SIU-Edwardsville,Saint Louis,22,26,14,17,1,Keaton Jackson made Two Point Tip Shot.
SIU-Edwardsville,Saint Louis,22,26,14,17,0,Foul on John Manning.
SIU-Edwardsville,Saint Louis,23,26,14,17,1,Keaton Jackson made Free Throw.
SIU-Edwardsville,Saint Louis,23,26,14,31,0,Foul on Achraf Yacoubou.
SIU-Edwardsville,Saint Louis,23,26,14,31,0,Achraf Yacoubou Turnover.
SIU-Edwardsville,Saint Louis,25,26,14,46,1,Michael Messer made Layup.
SIU-Edwardsville,Saint Louis,25,26,15,3,0,Foul on Mike Crawford.
SIU-Edwardsville,Saint Louis,25,26,15,3,0,Mike Crawford Turnover.
SIU-Edwardsville,Saint Louis,25,26,15,15,0,Donivine Stewart Turnover.
SIU-Edwardsville,Saint Louis,25,28,15,48,1,Mike Crawford made Layup.
SIU-Edwardsville,Saint Louis,25,28,15,48,0,Foul on Jake Newton.
SIU-Edwardsville,Saint Louis,25,28,15,48,0,Mike Crawford missed Free Throw.
SIU-Edwardsville,Saint Louis,25,28,15,48,0,Keaton Jackson Defensive Rebound.
SIU-Edwardsville,Saint Louis,25,28,16,9,0,Keaton Jackson missed Jumper.
SIU-Edwardsville,Saint Louis,25,28,16,9,0,Marcus Bartley Defensive Rebound.
SIU-Edwardsville,Saint Louis,25,28,16,18,0,Foul on Keaton Jackson.
SIU-Edwardsville,Saint Louis,25,28,16,18,0,Official TV Timeout
SIU-Edwardsville,Saint Louis,25,29,16,18,1,Miles Reynolds made Free Throw.
SIU-Edwardsville,Saint Louis,25,30,16,18,1,Miles Reynolds made Free Throw.
SIU-Edwardsville,Saint Louis,27,30,16,49,1,Kris Davis made Jumper. Assisted by Donivine Stewart.
SIU-Edwardsville,Saint Louis,27,30,17,18,0,Austin McBroom missed Jumper.
SIU-Edwardsville,Saint Louis,27,30,17,18,0,Donivine Stewart Defensive Rebound.
SIU-Edwardsville,Saint Louis,27,30,17,32,0,Michael Messer missed Jumper.
SIU-Edwardsville,Saint Louis,27,30,17,32,0,John Manning Block.
SIU-Edwardsville,Saint Louis,27,30,17,34,0,John Manning Defensive Rebound.
SIU-Edwardsville,Saint Louis,27,30,17,36,0,Foul on Michael Messer.
SIU-Edwardsville,Saint Louis,27,31,17,36,1,Mike Crawford made Free Throw.
SIU-Edwardsville,Saint Louis,27,32,17,36,1,Mike Crawford made Free Throw.
SIU-Edwardsville,Saint Louis,29,32,17,52,1,Donivine Stewart made Layup.
SIU-Edwardsville,Saint Louis,29,32,18,19,0,Foul on Tanner Lancona.
SIU-Edwardsville,Saint Louis,29,32,18,19,0,Tanner Lancona Turnover.
SIU-Edwardsville,Saint Louis,32,32,18,36,1,Kris Davis made Three Point Jumper. Assisted by Donivine Stewart.
SIU-Edwardsville,Saint Louis,32,34,18,57,1,Miles Reynolds made Jumper. Assisted by Tanner Lancona.
SIU-Edwardsville,Saint Louis,32,34,18,59,0,Foul on Michael Messer.
SIU-Edwardsville,Saint Louis,32,35,18,59,1,Miles Reynolds made Free Throw.
SIU-Edwardsville,Saint Louis,34,35,19,18,1,Grant Fiorentinos made Dunk. Assisted by Kris Davis.
SIU-Edwardsville,Saint Louis,34,35,19,29,0,Saint Louis  Timeout
SIU-Edwardsville,Saint Louis,34,37,19,54,1,Austin Gillmann made Jumper. Assisted by Austin McBroom.
SIU-Edwardsville,Saint Louis,34,37,20,0,0,End of 1st half
SIU-Edwardsville,Saint Louis,34,37,20,14,0,Donivine Stewart missed Layup.
SIU-Edwardsville,Saint Louis,34,37,20,14,0,Keaton Jackson Offensive Rebound.
SIU-Edwardsville,Saint Louis,36,37,20,18,1,Keaton Jackson made Two Point Tip Shot.
SIU-Edwardsville,Saint Louis,36,39,20,34,1,Milik Yarbrough made Layup. Assisted by John Manning.
SIU-Edwardsville,Saint Louis,36,39,20,53,0,Foul on Keaton Jackson.
SIU-Edwardsville,Saint Louis,36,39,20,53,0,Keaton Jackson Turnover.
SIU-Edwardsville,Saint Louis,36,39,21,5,0,Achraf Yacoubou missed Layup.
SIU-Edwardsville,Saint Louis,36,39,21,5,0,Rozell Nunn Defensive Rebound.
SIU-Edwardsville,Saint Louis,36,39,21,20,0,Kris Davis missed Layup.
SIU-Edwardsville,Saint Louis,36,39,21,20,0,John Manning Block.
SIU-Edwardsville,Saint Louis,36,39,21,20,0,SIU-Edwardsville Offensive Rebound.
SIU-Edwardsville,Saint Louis,38,39,21,34,1,Kris Davis made Jumper.
SIU-Edwardsville,Saint Louis,38,39,21,55,0,Davell Roby Turnover.
SIU-Edwardsville,Saint Louis,38,39,21,56,0,Rozell Nunn Steal.
SIU-Edwardsville,Saint Louis,38,39,22,1,0,Michael Messer missed Jumper.
SIU-Edwardsville,Saint Louis,38,39,22,1,0,Davell Roby Defensive Rebound.
SIU-Edwardsville,Saint Louis,38,42,22,11,1,Austin McBroom made Three Point Jumper. Assisted by Davell Roby.
SIU-Edwardsville,Saint Louis,38,42,22,35,0,Michael Messer Turnover.
SIU-Edwardsville,Saint Louis,38,42,22,35,0,Austin McBroom Steal.
SIU-Edwardsville,Saint Louis,38,42,22,52,0,Foul on Grant Fiorentinos.
SIU-Edwardsville,Saint Louis,38,42,22,52,0,Milik Yarbrough missed Free Throw.
SIU-Edwardsville,Saint Louis,38,42,22,52,0,Saint Louis Deadball Team Rebound.
SIU-Edwardsville,Saint Louis,38,43,22,52,1,Milik Yarbrough made Free Throw.
SIU-Edwardsville,Saint Louis,38,43,23,8,0,Grant Fiorentinos missed Layup.
SIU-Edwardsville,Saint Louis,38,43,23,8,0,Milik Yarbrough Block.
SIU-Edwardsville,Saint Louis,38,43,23,10,0,John Manning Defensive Rebound.
SIU-Edwardsville,Saint Louis,38,45,23,23,1,Milik Yarbrough made Layup. Assisted by John Manning.
SIU-Edwardsville,Saint Louis,38,45,23,32,0,SIU-Edwardsville  Timeout
SIU-Edwardsville,Saint Louis,38,45,23,59,0,Rozell Nunn missed Layup.
SIU-Edwardsville,Saint Louis,38,45,23,59,0,Milik Yarbrough Defensive Rebound.
SIU-Edwardsville,Saint Louis,38,47,24,16,1,John Manning made Jumper. Assisted by Davell Roby.
SIU-Edwardsville,Saint Louis,41,47,24,29,1,Kris Davis made Three Point Jumper. Assisted by Donivine Stewart.
SIU-Edwardsville,Saint Louis,41,47,24,44,0,Austin McBroom missed Three Point Jumper.
SIU-Edwardsville,Saint Louis,41,47,24,44,0,Davell Roby Offensive Rebound.
SIU-Edwardsville,Saint Louis,41,49,25,2,1,Milik Yarbrough made Layup. Assisted by John Manning.
SIU-Edwardsville,Saint Louis,44,49,25,21,1,Michael Messer made Three Point Jumper. Assisted by Donivine Stewart.
SIU-Edwardsville,Saint Louis,44,49,25,56,0,John Manning missed Jumper.
SIU-Edwardsville,Saint Louis,44,49,25,56,0,Keaton Jackson Block.
SIU-Edwardsville,Saint Louis,44,49,25,56,0,Saint Louis Offensive Rebound.
SIU-Edwardsville,Saint Louis,44,49,25,56,0,Official TV Timeout
SIU-Edwardsville,Saint Louis,44,49,25,57,0,Mike Crawford missed Jumper.
SIU-Edwardsville,Saint Louis,44,49,25,57,0,Mike Crawford Offensive Rebound.
SIU-Edwardsville,Saint Louis,44,49,26,18,0,Foul on Milik Yarbrough.
SIU-Edwardsville,Saint Louis,44,49,26,18,0,Milik Yarbrough Turnover.
SIU-Edwardsville,Saint Louis,44,49,26,30,0,Kris Davis missed Layup.
SIU-Edwardsville,Saint Louis,44,49,26,30,0,Keaton Jackson Offensive Rebound.
SIU-Edwardsville,Saint Louis,46,49,26,34,1,Keaton Jackson made Dunk.
SIU-Edwardsville,Saint Louis,46,49,26,44,0,Foul on Keaton Jackson.
SIU-Edwardsville,Saint Louis,46,49,27,6,0,Foul on Michael Messer.
SIU-Edwardsville,Saint Louis,46,51,27,17,1,Reggie Agbeko made Layup. Assisted by Marcus Bartley.
SIU-Edwardsville,Saint Louis,46,51,27,17,0,Foul on Michael Messer.
SIU-Edwardsville,Saint Louis,46,51,27,17,0,Reggie Agbeko missed Free Throw.
SIU-Edwardsville,Saint Louis,46,51,27,17,0,Grant Fiorentinos Defensive Rebound.
SIU-Edwardsville,Saint Louis,48,51,27,30,1,Rozell Nunn made Jumper. Assisted by Donivine Stewart.
SIU-Edwardsville,Saint Louis,48,51,27,43,0,Achraf Yacoubou missed Layup.
SIU-Edwardsville,Saint Louis,48,51,27,43,0,Austin Gillmann Offensive Rebound.
SIU-Edwardsville,Saint Louis,48,53,27,47,1,Austin Gillmann made Two Point Tip Shot.
SIU-Edwardsville,Saint Louis,48,53,27,58,0,Foul on Marcus Bartley.
SIU-Edwardsville,Saint Louis,48,53,28,12,0,Foul on Brett Jolly.
SIU-Edwardsville,Saint Louis,48,53,28,12,0,Official TV Timeout
SIU-Edwardsville,Saint Louis,48,53,28,18,0,Rozell Nunn Turnover.
SIU-Edwardsville,Saint Louis,48,53,28,43,0,Reggie Agbeko Turnover.
SIU-Edwardsville,Saint Louis,48,53,28,45,0,Maurice Wiltz Steal.
SIU-Edwardsville,Saint Louis,48,53,28,52,0,Donivine Stewart missed Three Point Jumper.
SIU-Edwardsville,Saint Louis,48,53,28,52,0,Reggie Agbeko Defensive Rebound.
SIU-Edwardsville,Saint Louis,48,53,29,19,0,Achraf Yacoubou missed Three Point Jumper.
SIU-Edwardsville,Saint Louis,48,53,29,19,0,Saint Louis Offensive Rebound.
SIU-Edwardsville,Saint Louis,48,53,29,22,0,Foul on Maurice Wiltz.
SIU-Edwardsville,Saint Louis,48,53,29,24,0,Marcus Bartley missed Three Point Jumper.
SIU-Edwardsville,Saint Louis,48,53,29,24,0,SIU-Edwardsville Defensive Rebound.
SIU-Edwardsville,Saint Louis,48,53,29,44,0,Foul on Grant Fiorentinos.
SIU-Edwardsville,Saint Louis,48,53,29,44,0,Grant Fiorentinos Turnover.
SIU-Edwardsville,Saint Louis,48,53,29,57,0,Milik Yarbrough missed Jumper.
SIU-Edwardsville,Saint Louis,48,53,29,57,0,Grant Fiorentinos Defensive Rebound.
SIU-Edwardsville,Saint Louis,48,53,30,9,0,Foul on Brett Jolly.
SIU-Edwardsville,Saint Louis,50,53,30,26,1,Grant Fiorentinos made Dunk. Assisted by Rozell Nunn.
SIU-Edwardsville,Saint Louis,50,53,30,41,0,Foul on Grant Fiorentinos.
SIU-Edwardsville,Saint Louis,50,53,30,41,0,Technical Foul on Brett Jolly.
SIU-Edwardsville,Saint Louis,50,53,30,41,0,Foul on Brett Jolly.
SIU-Edwardsville,Saint Louis,50,53,30,41,0,Milik Yarbrough missed Free Throw.
SIU-Edwardsville,Saint Louis,50,53,30,41,0,Saint Louis Deadball Team Rebound.
SIU-Edwardsville,Saint Louis,51,53,30,41,1,Kris Davis made Free Throw.
SIU-Edwardsville,Saint Louis,51,53,30,41,0,Kris Davis missed Free Throw.
SIU-Edwardsville,Saint Louis,51,53,30,41,0,SIU-Edwardsville Deadball Team Rebound.
SIU-Edwardsville,Saint Louis,51,53,30,55,0,Jake Newton missed Jumper.
SIU-Edwardsville,Saint Louis,51,53,30,55,0,Miles Reynolds Defensive Rebound.
SIU-Edwardsville,Saint Louis,51,53,31,32,0,Davell Roby Turnover.
SIU-Edwardsville,Saint Louis,51,53,32,4,0,Donivine Stewart missed Layup.
SIU-Edwardsville,Saint Louis,51,53,32,4,0,Achraf Yacoubou Block.
SIU-Edwardsville,Saint Louis,51,53,32,4,0,SIU-Edwardsville Offensive Rebound.
SIU-Edwardsville,Saint Louis,51,53,32,4,0,Official TV Timeout
SIU-Edwardsville,Saint Louis,51,53,32,8,0,SIU-Edwardsville  Turnover.
SIU-Edwardsville,Saint Louis,51,53,32,39,0,Mike Crawford Turnover.
SIU-Edwardsville,Saint Louis,51,53,32,51,0,Rozell Nunn missed Three Point Jumper.
SIU-Edwardsville,Saint Louis,51,53,32,51,0,Milik Yarbrough Defensive Rebound.
SIU-Edwardsville,Saint Louis,51,53,33,8,0,Achraf Yacoubou missed Layup.
SIU-Edwardsville,Saint Louis,51,53,33,8,0,Milik Yarbrough Offensive Rebound.
SIU-Edwardsville,Saint Louis,51,53,33,9,0,Foul on Kris Davis.
SIU-Edwardsville,Saint Louis,51,53,33,9,0,Milik Yarbrough missed Free Throw.
SIU-Edwardsville,Saint Louis,51,53,33,9,0,Saint Louis Deadball Team Rebound.
SIU-Edwardsville,Saint Louis,51,54,33,9,1,Milik Yarbrough made Free Throw.
SIU-Edwardsville,Saint Louis,51,54,33,33,0,Foul on Mike Crawford.
SIU-Edwardsville,Saint Louis,51,54,33,33,0,Grant Fiorentinos missed Free Throw.
SIU-Edwardsville,Saint Louis,51,54,33,33,0,SIU-Edwardsville Deadball Team Rebound.
SIU-Edwardsville,Saint Louis,52,54,33,33,1,Grant Fiorentinos made Free Throw.
SIU-Edwardsville,Saint Louis,52,54,34,1,0,Foul on Rozell Nunn.
SIU-Edwardsville,Saint Louis,52,54,34,1,0,Reggie Agbeko missed Free Throw.
SIU-Edwardsville,Saint Louis,52,54,34,1,0,Saint Louis Deadball Team Rebound.
SIU-Edwardsville,Saint Louis,52,55,34,1,1,Reggie Agbeko made Free Throw.
SIU-Edwardsville,Saint Louis,52,55,34,27,0,Foul on Reggie Agbeko.
SIU-Edwardsville,Saint Louis,52,55,34,27,0,Donivine Stewart missed Free Throw.
SIU-Edwardsville,Saint Louis,52,55,34,27,0,Michael Messer Offensive Rebound.
SIU-Edwardsville,Saint Louis,54,55,34,39,1,Kris Davis made Layup.
SIU-Edwardsville,Saint Louis,54,55,34,58,0,Mike Crawford missed Three Point Jumper.
SIU-Edwardsville,Saint Louis,54,55,34,58,0,Donivine Stewart Defensive Rebound.
SIU-Edwardsville,Saint Louis,54,55,35,29,0,Donivine Stewart missed Jumper.
SIU-Edwardsville,Saint Louis,54,55,35,29,0,SIU-Edwardsville Offensive Rebound.
SIU-Edwardsville,Saint Louis,54,55,35,53,0,Michael Messer missed Three Point Jumper.
SIU-Edwardsville,Saint Louis,54,55,35,53,0,Austin Gillmann Defensive Rebound.
SIU-Edwardsville,Saint Louis,54,57,36,15,1,Tanner Lancona made Jumper. Assisted by Marcus Bartley.
SIU-Edwardsville,Saint Louis,54,57,36,25,0,SIU-Edwardsville  Timeout
SIU-Edwardsville,Saint Louis,56,57,36,47,1,Michael Messer made Layup.
SIU-Edwardsville,Saint Louis,56,57,37,3,0,Marcus Bartley missed Three Point Jumper.
SIU-Edwardsville,Saint Louis,56,57,37,3,0,Marcus Bartley Offensive Rebound.
SIU-Edwardsville,Saint Louis,56,57,37,15,0,Foul on Michael Messer.
SIU-Edwardsville,Saint Louis,56,57,37,15,0,Official TV Timeout
SIU-Edwardsville,Saint Louis,56,57,37,15,0,Tanner Lancona missed Free Throw.
SIU-Edwardsville,Saint Louis,56,57,37,15,0,Saint Louis Deadball Team Rebound.
SIU-Edwardsville,Saint Louis,56,58,37,15,1,Tanner Lancona made Free Throw.
SIU-Edwardsville,Saint Louis,56,58,37,27,0,Kris Davis Turnover.
SIU-Edwardsville,Saint Louis,56,60,37,45,1,Tanner Lancona made Layup. Assisted by Marcus Bartley.
SIU-Edwardsville,Saint Louis,56,60,37,45,0,Foul on Grant Fiorentinos.
SIU-Edwardsville,Saint Louis,56,60,37,45,0,Tanner Lancona missed Free Throw.
SIU-Edwardsville,Saint Louis,56,60,37,45,0,Rozell Nunn Defensive Rebound.
SIU-Edwardsville,Saint Louis,59,60,38,15,1,Maurice Wiltz made Three Point Jumper. Assisted by Donivine Stewart.
SIU-Edwardsville,Saint Louis,59,60,38,42,0,Foul on Maurice Wiltz.
SIU-Edwardsville,Saint Louis,59,60,38,42,0,Davell Roby missed Free Throw.
SIU-Edwardsville,Saint Louis,59,60,38,42,0,Saint Louis Deadball Team Rebound.
SIU-Edwardsville,Saint Louis,59,61,38,42,1,Davell Roby made Free Throw.
SIU-Edwardsville,Saint Louis,59,61,38,57,0,Rozell Nunn missed Jumper.
SIU-Edwardsville,Saint Louis,59,61,38,57,0,John Manning Defensive Rebound.
SIU-Edwardsville,Saint Louis,59,63,39,26,1,Achraf Yacoubou made Layup.
SIU-Edwardsville,Saint Louis,59,63,39,30,0,SIU-Edwardsville  Timeout
SIU-Edwardsville,Saint Louis,59,63,39,39,0,Foul on John Manning.
SIU-Edwardsville,Saint Louis,60,63,39,39,1,Donivine Stewart made Free Throw.
SIU-Edwardsville,Saint Louis,61,63,39,39,1,Donivine Stewart made Free Throw.
SIU-Edwardsville,Saint Louis,61,63,39,39,0,Saint Louis  Timeout
SIU-Edwardsville,Saint Louis,61,63,39,41,0,Foul on Keenan Simmons.
SIU-Edwardsville,Saint Louis,61,64,39,41,1,Austin McBroom made Free Throw.
SIU-Edwardsville,Saint Louis,61,65,39,41,1,Austin McBroom made Free Throw.
SIU-Edwardsville,Saint Louis,61,65,39,45,0,Kris Davis missed Three Point Jumper.
SIU-Edwardsville,Saint Louis,61,65,39,45,0,John Manning Defensive Rebound.
SIU-Edwardsville,Saint Louis,61,65,39,48,0,Foul on Rozell Nunn.
SIU-Edwardsville,Saint Louis,61,66,39,48,1,John Manning made Free Throw.
SIU-Edwardsville,Saint Louis,61,67,39,48,1,John Manning made Free Throw.
SIU-Edwardsville,Saint Louis,61,67,39,52,0,Donivine Stewart missed Layup.
SIU-Edwardsville,Saint Louis,61,67,39,52,0,John Manning Block.
SIU-Edwardsville,Saint Louis,61,67,39,53,0,SIU-Edwardsville Offensive Rebound.
SIU-Edwardsville,Saint Louis,61,67,39,55,0,Rozell Nunn missed Layup.
SIU-Edwardsville,Saint Louis,61,67,39,55,0,Grant Fiorentinos Offensive Rebound.
SIU-Edwardsville,Saint Louis,61,67,40,0,0,Grant Fiorentinos missed Two Point Tip Shot.
SIU-Edwardsville,Saint Louis,61,67,40,0,0,Rozell Nunn Offensive Rebound.
SIU-Edwardsville,Saint Louis,61,67,40,0,0,End of Game
