Northern New Mexico,Abilene Christian,66,90,39,8,0,Eric Coca Steal.
Northern New Mexico,Abilene Christian,68,90,39,11,1,Eric Coca made Layup.
Northern New Mexico,Abilene Christian,68,90,39,13,0,Northern New Mexico  Timeout
Northern New Mexico,Abilene Christian,68,90,39,22,0,Jadon Reynolds missed Three Point Jumper.
Northern New Mexico,Abilene Christian,68,90,39,22,0,Mikaere Watene Defensive Rebound.
Northern New Mexico,Abilene Christian,68,90,39,37,0,Augustus Cuch missed Three Point Jumper.
Northern New Mexico,Abilene Christian,68,90,39,37,0,Ezini Ugbisien Offensive Rebound.
Northern New Mexico,Abilene Christian,68,90,39,41,0,Foul on Hayden Farquhar.
Northern New Mexico,Abilene Christian,68,90,39,43,0,Ezini Ugbisien missed Free Throw.
Northern New Mexico,Abilene Christian,68,90,39,43,0,Northern New Mexico Deadball Team Rebound.
Northern New Mexico,Abilene Christian,69,90,39,43,1,Ezini Ugbisien made Free Throw.
Northern New Mexico,Abilene Christian,69,90,40,0,0,End of Game
