Away Team,Home Team,Away Score, Home Score,Minute,Second,isScoringPosession,Desc.
Northern New Mexico,Abilene Christian,0,0,0,19,0,Jaren Lewis missed Three Point Jumper.
Northern New Mexico,Abilene Christian,0,0,0,19,0,Adrian Infante Defensive Rebound.
Northern New Mexico,Abilene Christian,0,0,0,44,0,Adrian Infante missed Three Point Jumper.
Northern New Mexico,Abilene Christian,0,0,0,44,0,Jaylen Franklin Defensive Rebound.
Northern New Mexico,Abilene Christian,0,2,1,2,1,Hayden Howell made Jumper. Assisted by Jaylen Franklin.
Northern New Mexico,Abilene Christian,0,2,1,23,0,Foul on Drake Green.
Northern New Mexico,Abilene Christian,1,2,1,23,1,Austin Gibson made Free Throw.
Northern New Mexico,Abilene Christian,2,2,1,23,1,Austin Gibson made Free Throw.
Northern New Mexico,Abilene Christian,2,4,1,39,1,Jaren Lewis made Layup. Assisted by Hayden Howell.
Northern New Mexico,Abilene Christian,4,4,2,6,1,Mikaere Watene made Jumper.
Northern New Mexico,Abilene Christian,4,6,2,27,1,Jaren Lewis made Jumper.
Northern New Mexico,Abilene Christian,7,6,2,45,1,Eric Coca made Three Point Jumper. Assisted by Austin Gibson.
Northern New Mexico,Abilene Christian,7,8,3,11,1,Jaylen Franklin made Jumper. Assisted by Jovan Crnic.
Northern New Mexico,Abilene Christian,9,8,3,35,1,Adrian Infante made Layup. Assisted by Eric Coca.
Northern New Mexico,Abilene Christian,9,10,3,49,1,Hayden Howell made Jumper. Assisted by Jovan Crnic.
Northern New Mexico,Abilene Christian,12,10,4,15,1,Michael Nolan made Three Point Jumper. Assisted by Eric Coca.
Northern New Mexico,Abilene Christian,12,10,4,18,0,Official TV Timeout
Northern New Mexico,Abilene Christian,12,10,4,29,0,Hayden Howell missed Jumper.
Northern New Mexico,Abilene Christian,12,10,4,29,0,Ezini Ugbisien Defensive Rebound.
Northern New Mexico,Abilene Christian,12,10,4,59,0,Austin Gibson missed Jumper.
Northern New Mexico,Abilene Christian,12,10,4,59,0,Jaren Lewis Defensive Rebound.
Northern New Mexico,Abilene Christian,12,13,5,4,1,Jovan Crnic made Three Point Jumper. Assisted by Jaren Lewis.
Northern New Mexico,Abilene Christian,15,13,5,20,1,Michael Nolan made Three Point Jumper. Assisted by Austin Gibson.
Northern New Mexico,Abilene Christian,15,13,5,39,0,Foul on Adrian Infante.
Northern New Mexico,Abilene Christian,15,14,5,39,1,Isaiah Tripp made Free Throw.
Northern New Mexico,Abilene Christian,15,15,5,39,1,Isaiah Tripp made Free Throw.
Northern New Mexico,Abilene Christian,15,15,5,56,0,Austin Gibson missed Three Point Jumper.
Northern New Mexico,Abilene Christian,15,15,5,56,0,Jaren Lewis Defensive Rebound.
Northern New Mexico,Abilene Christian,15,15,6,11,0,Foul on Ezini Ugbisien.
Northern New Mexico,Abilene Christian,15,16,6,11,1,Jalone Friday made Free Throw.
Northern New Mexico,Abilene Christian,15,17,6,11,1,Jalone Friday made Free Throw.
Northern New Mexico,Abilene Christian,15,17,6,37,0,Foul on Jalone Friday.
Northern New Mexico,Abilene Christian,15,17,6,37,0,Ezini Ugbisien missed Free Throw.
Northern New Mexico,Abilene Christian,15,17,6,37,0,Northern New Mexico Deadball Team Rebound.
Northern New Mexico,Abilene Christian,16,17,6,37,1,Ezini Ugbisien made Free Throw.
Northern New Mexico,Abilene Christian,16,19,6,48,1,Jalone Friday made Layup. Assisted by Jaylen Franklin.
Northern New Mexico,Abilene Christian,16,19,6,48,0,Foul on Adrian Infante.
Northern New Mexico,Abilene Christian,16,20,6,48,1,Jalone Friday made Free Throw.
Northern New Mexico,Abilene Christian,16,20,6,56,0,Bryce Simmons Turnover.
Northern New Mexico,Abilene Christian,16,20,6,59,0,Jalone Friday Steal.
Northern New Mexico,Abilene Christian,16,20,7,0,0,Foul on Bryce Simmons.
Northern New Mexico,Abilene Christian,16,20,7,2,0,Jalone Friday Turnover.
Northern New Mexico,Abilene Christian,18,20,7,10,1,Ezini Ugbisien made Layup. Assisted by Eric Coca.
Northern New Mexico,Abilene Christian,18,20,7,10,0,Foul on Hayden Farquhar.
Northern New Mexico,Abilene Christian,19,20,7,10,1,Ezini Ugbisien made Free Throw.
Northern New Mexico,Abilene Christian,19,22,7,31,1,Jalone Friday made Jumper. Assisted by Hayden Farquhar.
Northern New Mexico,Abilene Christian,19,22,7,48,0,Delino Lewis missed Jumper.
Northern New Mexico,Abilene Christian,19,22,7,48,0,Jalone Friday Defensive Rebound.
Northern New Mexico,Abilene Christian,19,25,8,9,1,Hayden Farquhar made Three Point Jumper. Assisted by Trey Lenox.
Northern New Mexico,Abilene Christian,21,25,8,29,1,Ezini Ugbisien made Layup.
Northern New Mexico,Abilene Christian,21,25,8,29,0,Foul on Diamante Langston.
Northern New Mexico,Abilene Christian,21,25,8,29,0,Official TV Timeout
Northern New Mexico,Abilene Christian,22,25,8,29,1,Ezini Ugbisien made Free Throw.
Northern New Mexico,Abilene Christian,22,28,8,49,1,Trey Lenox made Three Point Jumper. Assisted by Diamante Langston.
Northern New Mexico,Abilene Christian,22,28,9,8,0,Delino Lewis Turnover.
Northern New Mexico,Abilene Christian,22,28,9,28,0,Foul on Bryce Simmons.
Northern New Mexico,Abilene Christian,22,31,9,33,1,Jovan Crnic made Three Point Jumper. Assisted by Diamante Langston.
Northern New Mexico,Abilene Christian,22,31,9,49,0,Ezini Ugbisien missed Jumper.
Northern New Mexico,Abilene Christian,22,31,9,49,0,Jovan Crnic Defensive Rebound.
Northern New Mexico,Abilene Christian,22,31,10,0,0,Trey Lenox Turnover.
Northern New Mexico,Abilene Christian,22,31,10,1,0,Ezini Ugbisien Steal.
Northern New Mexico,Abilene Christian,22,31,10,16,0,Ezini Ugbisien Turnover.
Northern New Mexico,Abilene Christian,22,31,10,17,0,Jovan Crnic Steal.
Northern New Mexico,Abilene Christian,22,33,10,35,1,Diamante Langston made Jumper.
Northern New Mexico,Abilene Christian,22,33,10,43,0,Northern New Mexico  Timeout
Northern New Mexico,Abilene Christian,22,33,10,52,0,Jeffrey Long Turnover.
Northern New Mexico,Abilene Christian,22,33,10,54,0,Jaren Lewis Steal.
Northern New Mexico,Abilene Christian,22,35,10,57,1,Jaren Lewis made Layup.
Northern New Mexico,Abilene Christian,22,35,11,17,0,Brandon Saiz missed Three Point Jumper.
Northern New Mexico,Abilene Christian,22,35,11,17,0,Jaren Lewis Defensive Rebound.
Northern New Mexico,Abilene Christian,22,35,11,24,0,Drake Green missed Layup.
Northern New Mexico,Abilene Christian,22,35,11,24,0,Mikaere Watene Defensive Rebound.
Northern New Mexico,Abilene Christian,22,35,11,49,0,Christian Owona missed Jumper.
Northern New Mexico,Abilene Christian,22,35,11,49,0,Hayden Howell Defensive Rebound.
Northern New Mexico,Abilene Christian,22,35,11,50,0,Foul on Mikaere Watene.
Northern New Mexico,Abilene Christian,22,37,11,59,1,Hayden Howell made Layup. Assisted by Jaren Lewis.
Northern New Mexico,Abilene Christian,22,37,12,30,0,Delino Lewis Turnover.
Northern New Mexico,Abilene Christian,22,37,12,31,0,Payten Ricks Steal.
Northern New Mexico,Abilene Christian,22,37,12,44,0,Foul on Mikaere Watene.
Northern New Mexico,Abilene Christian,22,37,12,44,0,Official TV Timeout
Northern New Mexico,Abilene Christian,22,38,12,44,1,Payten Ricks made Free Throw.
Northern New Mexico,Abilene Christian,22,39,12,44,1,Payten Ricks made Free Throw.
Northern New Mexico,Abilene Christian,22,39,12,53,0,Foul on Drake Green.
Northern New Mexico,Abilene Christian,22,39,13,13,0,Jeffrey Long missed Three Point Jumper.
Northern New Mexico,Abilene Christian,22,39,13,13,0,Jaylen Franklin Defensive Rebound.
Northern New Mexico,Abilene Christian,22,39,13,22,0,Payten Ricks missed Three Point Jumper.
Northern New Mexico,Abilene Christian,22,39,13,22,0,Northern New Mexico Defensive Rebound.
Northern New Mexico,Abilene Christian,22,39,13,34,0,Jeffrey Long Turnover.
Northern New Mexico,Abilene Christian,22,39,13,42,0,Foul on Jeffrey Long.
Northern New Mexico,Abilene Christian,22,39,13,42,0,Jaylen Franklin missed Free Throw.
Northern New Mexico,Abilene Christian,22,39,13,42,0,Ezini Ugbisien Defensive Rebound.
Northern New Mexico,Abilene Christian,22,39,13,49,0,Jeffrey Long Turnover.
Northern New Mexico,Abilene Christian,22,39,13,51,0,Jalone Friday Steal.
Northern New Mexico,Abilene Christian,22,39,13,58,0,Jovan Crnic Turnover.
Northern New Mexico,Abilene Christian,22,39,14,28,0,Ezini Ugbisien missed Jumper.
Northern New Mexico,Abilene Christian,22,39,14,28,0,Jalone Friday Defensive Rebound.
Northern New Mexico,Abilene Christian,22,39,14,38,0,Jalone Friday missed Three Point Jumper.
Northern New Mexico,Abilene Christian,22,39,14,38,0,Northern New Mexico Defensive Rebound.
Northern New Mexico,Abilene Christian,22,39,14,56,0,Eric Coca missed Three Point Jumper.
Northern New Mexico,Abilene Christian,22,39,14,56,0,Jaylen Franklin Defensive Rebound.
Northern New Mexico,Abilene Christian,22,39,15,6,0,Foul on Eric Coca.
Northern New Mexico,Abilene Christian,22,40,15,6,1,Jaren Lewis made Free Throw.
Northern New Mexico,Abilene Christian,22,41,15,6,1,Jaren Lewis made Free Throw.
Northern New Mexico,Abilene Christian,22,41,15,21,0,Foul on Jaren Lewis.
Northern New Mexico,Abilene Christian,22,41,15,21,0,Ezini Ugbisien missed Free Throw.
Northern New Mexico,Abilene Christian,22,41,15,21,0,Northern New Mexico Deadball Team Rebound.
Northern New Mexico,Abilene Christian,23,41,15,21,1,Ezini Ugbisien made Free Throw.
Northern New Mexico,Abilene Christian,23,41,15,39,0,Jalone Friday missed Jumper.
Northern New Mexico,Abilene Christian,23,41,15,39,0,Jeffrey Long Defensive Rebound.
Northern New Mexico,Abilene Christian,23,41,15,39,0,Foul on Jaren Lewis.
Northern New Mexico,Abilene Christian,24,41,15,39,1,Jeffrey Long made Free Throw.
Northern New Mexico,Abilene Christian,25,41,15,39,1,Jeffrey Long made Free Throw.
Northern New Mexico,Abilene Christian,25,41,15,52,0,Jaylen Franklin Turnover.
Northern New Mexico,Abilene Christian,25,41,15,53,0,Jeffrey Long Steal.
Northern New Mexico,Abilene Christian,27,41,15,55,1,Jeffrey Long made Layup.
Northern New Mexico,Abilene Christian,27,43,16,19,1,Jovan Crnic made Jumper.
Northern New Mexico,Abilene Christian,29,43,16,46,1,Jeffrey Long made Layup.
Northern New Mexico,Abilene Christian,29,43,16,46,0,Foul on Jalone Friday.
Northern New Mexico,Abilene Christian,29,43,16,46,0,Official TV Timeout
Northern New Mexico,Abilene Christian,30,43,16,46,1,Jeffrey Long made Free Throw.
Northern New Mexico,Abilene Christian,30,43,16,54,0,B.J. Maxwell Turnover.
Northern New Mexico,Abilene Christian,30,43,16,55,0,Christian Owona Steal.
Northern New Mexico,Abilene Christian,30,43,17,8,0,Jeffrey Long Turnover.
Northern New Mexico,Abilene Christian,30,45,17,21,1,Hayden Farquhar made Layup. Assisted by Jaylen Franklin.
Northern New Mexico,Abilene Christian,30,45,17,43,0,Foul on Jaylen Franklin.
Northern New Mexico,Abilene Christian,31,45,17,43,1,Jeffrey Long made Free Throw.
Northern New Mexico,Abilene Christian,31,45,17,43,0,Jeffrey Long missed Free Throw.
Northern New Mexico,Abilene Christian,31,45,17,43,0,Jaylen Franklin Defensive Rebound.
Northern New Mexico,Abilene Christian,31,48,18,8,1,Isaiah Tripp made Three Point Jumper. Assisted by Hayden Howell.
Northern New Mexico,Abilene Christian,31,48,18,28,0,Foul on Isaiah Tripp.
Northern New Mexico,Abilene Christian,31,48,18,28,0,Ezini Ugbisien missed Free Throw.
Northern New Mexico,Abilene Christian,31,48,18,28,0,Northern New Mexico Deadball Team Rebound.
Northern New Mexico,Abilene Christian,32,48,18,28,1,Ezini Ugbisien made Free Throw.
Northern New Mexico,Abilene Christian,32,48,18,47,0,Isaiah Tripp missed Three Point Jumper.
Northern New Mexico,Abilene Christian,32,48,18,47,0,Hayden Farquhar Offensive Rebound.
Northern New Mexico,Abilene Christian,32,48,18,52,0,Hayden Farquhar missed Layup.
Northern New Mexico,Abilene Christian,32,48,18,52,0,Christian Owona Defensive Rebound.
Northern New Mexico,Abilene Christian,34,48,19,4,1,Eric Coca made Jumper.
Northern New Mexico,Abilene Christian,34,48,19,18,0,Jovan Crnic missed Three Point Jumper.
Northern New Mexico,Abilene Christian,34,48,19,18,0,Ezini Ugbisien Defensive Rebound.
Northern New Mexico,Abilene Christian,34,48,19,28,0,Austin Gibson missed Three Point Jumper.
Northern New Mexico,Abilene Christian,34,48,19,28,0,Hayden Howell Defensive Rebound.
Northern New Mexico,Abilene Christian,34,51,19,59,1,Hayden Farquhar made Three Point Jumper. Assisted by Jovan Crnic.
Northern New Mexico,Abilene Christian,34,51,20,0,0,End of 1st half
Northern New Mexico,Abilene Christian,34,51,20,14,0,Foul on Hayden Howell.
Northern New Mexico,Abilene Christian,34,51,20,18,0,Michael Nolan Turnover.
Northern New Mexico,Abilene Christian,34,51,20,21,0,Jaylen Franklin Steal.
Northern New Mexico,Abilene Christian,34,53,20,23,1,Jaylen Franklin made Layup.
Northern New Mexico,Abilene Christian,34,53,20,45,0,Mikaere Watene missed Layup.
Northern New Mexico,Abilene Christian,34,53,20,45,0,Eric Coca Offensive Rebound.
Northern New Mexico,Abilene Christian,36,53,20,47,1,Eric Coca made Jumper.
Northern New Mexico,Abilene Christian,36,53,20,58,0,Foul on Mikaere Watene.
Northern New Mexico,Abilene Christian,36,53,20,58,0,Hayden Howell missed Free Throw.
Northern New Mexico,Abilene Christian,36,53,20,58,0,Abilene Christian Deadball Team Rebound.
Northern New Mexico,Abilene Christian,36,54,20,58,1,Hayden Howell made Free Throw.
Northern New Mexico,Abilene Christian,36,54,21,18,0,Mikaere Watene missed Layup.
Northern New Mexico,Abilene Christian,36,54,21,18,0,Jaren Lewis Defensive Rebound.
Northern New Mexico,Abilene Christian,36,54,21,33,0,Jaren Lewis missed Jumper.
Northern New Mexico,Abilene Christian,36,54,21,33,0,B.J. Maxwell Offensive Rebound.
Northern New Mexico,Abilene Christian,36,54,21,37,0,B.J. Maxwell missed Jumper.
Northern New Mexico,Abilene Christian,36,54,21,37,0,Mikaere Watene Defensive Rebound.
Northern New Mexico,Abilene Christian,36,54,21,46,0,Michael Nolan missed Three Point Jumper.
Northern New Mexico,Abilene Christian,36,54,21,46,0,B.J. Maxwell Defensive Rebound.
Northern New Mexico,Abilene Christian,36,56,22,0,1,Jaren Lewis made Layup.
Northern New Mexico,Abilene Christian,36,56,22,32,0,Mikaere Watene missed Jumper.
Northern New Mexico,Abilene Christian,36,56,22,32,0,Hayden Howell Defensive Rebound.
Northern New Mexico,Abilene Christian,36,56,22,47,0,Jaylen Franklin missed Layup.
Northern New Mexico,Abilene Christian,36,56,22,47,0,Eric Coca Defensive Rebound.
Northern New Mexico,Abilene Christian,38,56,23,4,1,Mikaere Watene made Layup.
Northern New Mexico,Abilene Christian,38,56,23,4,0,Foul on Hayden Howell.
Northern New Mexico,Abilene Christian,39,56,23,4,1,Mikaere Watene made Free Throw.
Northern New Mexico,Abilene Christian,39,58,23,23,1,Jaren Lewis made Jumper. Assisted by Jovan Crnic.
Northern New Mexico,Abilene Christian,42,58,23,53,1,Bryce Simmons made Three Point Jumper.
Northern New Mexico,Abilene Christian,42,58,24,15,0,Jovan Crnic missed Three Point Jumper.
Northern New Mexico,Abilene Christian,42,58,24,15,0,Austin Gibson Defensive Rebound.
Northern New Mexico,Abilene Christian,42,58,24,35,0,Adrian Infante Turnover.
Northern New Mexico,Abilene Christian,42,58,24,36,0,Jaylen Franklin Steal.
Northern New Mexico,Abilene Christian,42,60,24,38,1,Jovan Crnic made Layup. Assisted by B.J. Maxwell.
Northern New Mexico,Abilene Christian,42,60,24,58,0,Austin Gibson Turnover.
Northern New Mexico,Abilene Christian,42,60,25,4,0,Jaylen Franklin Steal.
Northern New Mexico,Abilene Christian,42,60,25,5,0,Jaylen Franklin Turnover.
Northern New Mexico,Abilene Christian,42,60,25,19,0,Adrian Infante Turnover.
Northern New Mexico,Abilene Christian,42,60,25,21,0,Drake Green Steal.
Northern New Mexico,Abilene Christian,42,62,25,29,1,Jalone Friday made Jumper. Assisted by Jaren Lewis.
Northern New Mexico,Abilene Christian,42,62,25,44,0,Delino Lewis Turnover.
Northern New Mexico,Abilene Christian,42,62,25,46,0,Jaren Lewis Steal.
Northern New Mexico,Abilene Christian,42,64,25,47,1,Jaren Lewis made Dunk.
Northern New Mexico,Abilene Christian,42,64,26,12,0,Foul on Jaylen Franklin.
Northern New Mexico,Abilene Christian,42,64,26,18,0,Ezini Ugbisien missed Jumper.
Northern New Mexico,Abilene Christian,42,64,26,18,0,Hayden Farquhar Block.
Northern New Mexico,Abilene Christian,42,64,26,18,0,Northern New Mexico Offensive Rebound.
Northern New Mexico,Abilene Christian,42,64,26,27,0,Mikaere Watene Turnover.
Northern New Mexico,Abilene Christian,42,64,26,46,0,Foul on Malik Woods-Williams.
Northern New Mexico,Abilene Christian,42,65,26,46,1,Jalone Friday made Free Throw.
Northern New Mexico,Abilene Christian,42,66,26,46,1,Jalone Friday made Free Throw.
Northern New Mexico,Abilene Christian,45,66,27,11,1,Malik Woods-Williams made Three Point Jumper. Assisted by Ezini Ugbisien.
Northern New Mexico,Abilene Christian,45,66,27,24,0,Drake Green missed Jumper.
Northern New Mexico,Abilene Christian,45,66,27,24,0,Delino Lewis Defensive Rebound.
Northern New Mexico,Abilene Christian,45,66,27,33,0,Malik Woods-Williams missed Three Point Jumper.
Northern New Mexico,Abilene Christian,45,66,27,33,0,Diamante Langston Defensive Rebound.
Northern New Mexico,Abilene Christian,45,66,27,50,0,Jalone Friday missed Layup.
Northern New Mexico,Abilene Christian,45,66,27,50,0,Jalone Friday Offensive Rebound.
Northern New Mexico,Abilene Christian,45,69,28,0,1,Drake Green made Three Point Jumper. Assisted by Hayden Farquhar.
Northern New Mexico,Abilene Christian,45,69,28,14,0,Delino Lewis missed Jumper.
Northern New Mexico,Abilene Christian,45,69,28,14,0,Abilene Christian Defensive Rebound.
Northern New Mexico,Abilene Christian,45,69,28,14,0,Official TV Timeout
Northern New Mexico,Abilene Christian,45,69,28,29,0,Diamante Langston Turnover.
Northern New Mexico,Abilene Christian,45,69,28,30,0,Jeffrey Long Steal.
Northern New Mexico,Abilene Christian,47,69,28,33,1,Jeffrey Long made Layup.
Northern New Mexico,Abilene Christian,47,69,29,3,0,Foul on Jalone Friday.
Northern New Mexico,Abilene Christian,47,69,29,3,0,Jalone Friday Turnover.
Northern New Mexico,Abilene Christian,50,69,29,15,1,Malik Woods-Williams made Three Point Jumper. Assisted by Jeffrey Long.
Northern New Mexico,Abilene Christian,50,71,29,33,1,Jalone Friday made Jumper. Assisted by Isaiah Tripp.
Northern New Mexico,Abilene Christian,50,71,29,57,0,Foul on Hayden Farquhar.
Northern New Mexico,Abilene Christian,51,71,29,59,1,Bryce Simmons made Free Throw.
Northern New Mexico,Abilene Christian,52,71,29,59,1,Bryce Simmons made Free Throw.
Northern New Mexico,Abilene Christian,52,71,30,11,0,Foul on Delino Lewis.
Northern New Mexico,Abilene Christian,52,73,30,27,1,Jalone Friday made Layup. Assisted by Payten Ricks.
Northern New Mexico,Abilene Christian,52,73,30,27,0,Foul on Ezini Ugbisien.
Northern New Mexico,Abilene Christian,52,74,30,27,1,Jalone Friday made Free Throw.
Northern New Mexico,Abilene Christian,54,74,30,39,1,Ezini Ugbisien made Layup. Assisted by Bryce Simmons.
Northern New Mexico,Abilene Christian,54,74,30,39,0,Foul on Trey Lenox.
Northern New Mexico,Abilene Christian,55,74,30,39,1,Ezini Ugbisien made Free Throw.
Northern New Mexico,Abilene Christian,55,74,30,54,0,Payten Ricks missed Three Point Jumper.
Northern New Mexico,Abilene Christian,55,74,30,54,0,Jeffrey Long Defensive Rebound.
Northern New Mexico,Abilene Christian,55,74,31,2,0,Bryce Simmons missed Three Point Jumper.
Northern New Mexico,Abilene Christian,55,74,31,2,0,Hayden Farquhar Defensive Rebound.
Northern New Mexico,Abilene Christian,55,76,31,10,1,Jaren Lewis made Layup. Assisted by Isaiah Tripp.
Northern New Mexico,Abilene Christian,55,76,31,23,0,Foul on Payten Ricks.
Northern New Mexico,Abilene Christian,55,76,31,23,0,Delino Lewis missed Free Throw.
Northern New Mexico,Abilene Christian,55,76,31,23,0,Jaren Lewis Defensive Rebound.
Northern New Mexico,Abilene Christian,55,76,31,35,0,Hayden Farquhar missed Three Point Jumper.
Northern New Mexico,Abilene Christian,55,76,31,35,0,Delino Lewis Defensive Rebound.
Northern New Mexico,Abilene Christian,55,76,31,54,0,Jeffrey Long missed Three Point Jumper.
Northern New Mexico,Abilene Christian,55,76,31,54,0,Malik Woods-Williams Offensive Rebound.
Northern New Mexico,Abilene Christian,55,76,31,57,0,Malik Woods-Williams missed Jumper.
Northern New Mexico,Abilene Christian,55,76,31,57,0,Isaiah Tripp Block.
Northern New Mexico,Abilene Christian,55,76,31,59,0,Hayden Farquhar Defensive Rebound.
Northern New Mexico,Abilene Christian,55,76,32,4,0,Foul on Delino Lewis.
Northern New Mexico,Abilene Christian,55,76,32,4,0,Official TV Timeout
Northern New Mexico,Abilene Christian,55,76,32,16,0,Jaren Lewis missed Jumper.
Northern New Mexico,Abilene Christian,55,76,32,16,0,Eric Coca Defensive Rebound.
Northern New Mexico,Abilene Christian,57,76,32,40,1,Austin Gibson made Layup.
Northern New Mexico,Abilene Christian,57,76,32,54,0,Hayden Farquhar Turnover.
Northern New Mexico,Abilene Christian,57,76,33,3,0,Foul on Trey Lenox.
Northern New Mexico,Abilene Christian,58,76,33,3,1,Bryce Simmons made Free Throw.
Northern New Mexico,Abilene Christian,58,76,33,3,0,Bryce Simmons missed Free Throw.
Northern New Mexico,Abilene Christian,58,76,33,3,0,Hayden Farquhar Defensive Rebound.
Northern New Mexico,Abilene Christian,58,76,33,14,0,Jaren Lewis Turnover.
Northern New Mexico,Abilene Christian,58,76,33,24,0,Bryce Simmons missed Jumper.
Northern New Mexico,Abilene Christian,58,76,33,24,0,Jovan Crnic Defensive Rebound.
Northern New Mexico,Abilene Christian,58,76,33,28,0,Jovan Crnic Turnover.
Northern New Mexico,Abilene Christian,58,76,33,48,0,Foul on Diamante Langston.
Northern New Mexico,Abilene Christian,58,76,33,48,0,Austin Gibson missed Free Throw.
Northern New Mexico,Abilene Christian,58,76,33,48,0,Hayden Farquhar Defensive Rebound.
Northern New Mexico,Abilene Christian,58,76,34,6,0,Hayden Farquhar missed Three Point Jumper.
Northern New Mexico,Abilene Christian,58,76,34,6,0,Jeffrey Long Defensive Rebound.
Northern New Mexico,Abilene Christian,60,76,34,14,1,Jeffrey Long made Layup.
Northern New Mexico,Abilene Christian,60,76,34,42,0,Jaylen Franklin missed Layup.
Northern New Mexico,Abilene Christian,60,76,34,42,0,Hayden Farquhar Offensive Rebound.
Northern New Mexico,Abilene Christian,60,76,34,42,0,Hayden Farquhar missed Layup.
Northern New Mexico,Abilene Christian,60,76,34,42,0,Hayden Farquhar Offensive Rebound.
Northern New Mexico,Abilene Christian,60,78,34,42,1,Hayden Farquhar made Layup.
Northern New Mexico,Abilene Christian,60,78,34,42,0,Foul on Austin Gibson.
Northern New Mexico,Abilene Christian,60,78,34,42,0,Hayden Farquhar missed Free Throw.
Northern New Mexico,Abilene Christian,60,78,34,42,0,Jeffrey Long Defensive Rebound.
Northern New Mexico,Abilene Christian,60,78,34,52,0,Foul on Hayden Farquhar.
Northern New Mexico,Abilene Christian,61,78,34,52,1,Jeffrey Long made Free Throw.
Northern New Mexico,Abilene Christian,62,78,34,52,1,Jeffrey Long made Free Throw.
Northern New Mexico,Abilene Christian,62,78,35,2,0,Diamante Langston Turnover.
Northern New Mexico,Abilene Christian,62,78,35,3,0,Jeffrey Long Steal.
Northern New Mexico,Abilene Christian,64,78,35,6,1,Jeffrey Long made Layup.
Northern New Mexico,Abilene Christian,64,78,35,24,0,Foul on Ezini Ugbisien.
Northern New Mexico,Abilene Christian,64,79,35,24,1,Jaren Lewis made Free Throw.
Northern New Mexico,Abilene Christian,64,80,35,24,1,Jaren Lewis made Free Throw.
Northern New Mexico,Abilene Christian,64,80,35,33,0,Jeffrey Long Turnover.
Northern New Mexico,Abilene Christian,64,80,35,34,0,Jaylen Franklin Steal.
Northern New Mexico,Abilene Christian,64,82,35,37,1,Jaylen Franklin made Dunk. Assisted by B.J. Maxwell.
Northern New Mexico,Abilene Christian,64,82,35,56,0,Foul on Hayden Howell.
Northern New Mexico,Abilene Christian,65,82,35,59,1,Ezini Ugbisien made Free Throw.
Northern New Mexico,Abilene Christian,66,82,35,59,1,Ezini Ugbisien made Free Throw.
Northern New Mexico,Abilene Christian,66,82,36,11,0,Jaylen Franklin missed Layup.
Northern New Mexico,Abilene Christian,66,82,36,11,0,Mikaere Watene Defensive Rebound.
Northern New Mexico,Abilene Christian,66,82,36,31,0,Bryce Simmons missed Three Point Jumper.
Northern New Mexico,Abilene Christian,66,82,36,31,0,Hayden Howell Defensive Rebound.
Northern New Mexico,Abilene Christian,66,82,36,39,0,Jaylen Franklin Turnover.
Northern New Mexico,Abilene Christian,66,82,36,40,0,Official TV Timeout
Northern New Mexico,Abilene Christian,66,82,36,50,0,Eric Coca missed Three Point Jumper.
Northern New Mexico,Abilene Christian,66,82,36,50,0,Hayden Howell Defensive Rebound.
Northern New Mexico,Abilene Christian,66,84,37,5,1,Jaylen Franklin made Layup. Assisted by Payten Ricks.
Northern New Mexico,Abilene Christian,66,84,37,23,0,Ezini Ugbisien missed Jumper.
Northern New Mexico,Abilene Christian,66,84,37,23,0,Hayden Howell Defensive Rebound.
Northern New Mexico,Abilene Christian,66,84,37,38,0,Foul on Ezini Ugbisien.
Northern New Mexico,Abilene Christian,66,85,37,38,1,Payten Ricks made Free Throw.
Northern New Mexico,Abilene Christian,66,86,37,38,1,Payten Ricks made Free Throw.
Northern New Mexico,Abilene Christian,66,86,37,51,0,Jeffrey Long Turnover.
Northern New Mexico,Abilene Christian,66,86,37,52,0,Payten Ricks Steal.
Northern New Mexico,Abilene Christian,66,86,38,2,0,Foul on Adrian Infante.
Northern New Mexico,Abilene Christian,66,87,38,2,1,Trey Lenox made Free Throw.
Northern New Mexico,Abilene Christian,66,88,38,2,1,Trey Lenox made Free Throw.
Northern New Mexico,Abilene Christian,66,88,38,17,0,Brandon Saiz missed Three Point Jumper.
Northern New Mexico,Abilene Christian,66,88,38,17,0,B.J. Maxwell Defensive Rebound.
Northern New Mexico,Abilene Christian,66,90,38,30,1,Hayden Farquhar made Jumper.
Northern New Mexico,Abilene Christian,66,90,38,48,0,Adrian Infante Turnover.
Northern New Mexico,Abilene Christian,66,90,38,49,0,Payten Ricks Steal.
Northern New Mexico,Abilene Christian,66,90,39,7,0,Jadon Reynolds Turnover.
