Away Team,Home Team,Away Score,Home Score,Minute,Second,isScoringPosession,Desc.
SIU-Edwardsville,Southeast Missouri State,0,2,0,11,1,Tony Anderson made Layup. Assisted by Antonius Cleveland.
SIU-Edwardsville,Southeast Missouri State,2,2,0,30,1,Keenan Simmons made Layup.
SIU-Edwardsville,Southeast Missouri State,2,2,0,46,0,Antonius Cleveland Turnover.
SIU-Edwardsville,Southeast Missouri State,2,2,0,58,0,Yemi Makanjuola missed Jumper.
SIU-Edwardsville,Southeast Missouri State,2,2,0,58,0,Joel Angus III Block.
SIU-Edwardsville,Southeast Missouri State,2,2,0,58,0,Yemi Makanjuola Offensive Rebound.
SIU-Edwardsville,Southeast Missouri State,2,2,0,58,0,Yemi Makanjuola Turnover.
SIU-Edwardsville,Southeast Missouri State,2,2,1,8,0,Tony Anderson Turnover.
SIU-Edwardsville,Southeast Missouri State,2,2,1,9,0,Carlos Anderson Steal.
SIU-Edwardsville,Southeast Missouri State,4,2,1,10,1,Carlos Anderson made Layup.
SIU-Edwardsville,Southeast Missouri State,4,2,1,28,0,Jamaal Calvin Turnover.
SIU-Edwardsville,Southeast Missouri State,7,2,1,41,1,Joshua White made Three Point Jumper. Assisted by Yemi Makanjuola.
SIU-Edwardsville,Southeast Missouri State,7,2,1,58,0,Joel Angus III missed Jumper.
SIU-Edwardsville,Southeast Missouri State,7,2,1,58,0,Joel Angus III Offensive Rebound.
SIU-Edwardsville,Southeast Missouri State,7,2,2,1,0,Joel Angus III missed Jumper.
SIU-Edwardsville,Southeast Missouri State,7,2,2,1,0,Yemi Makanjuola Block.
SIU-Edwardsville,Southeast Missouri State,7,2,2,2,0,Yemi Makanjuola Defensive Rebound.
SIU-Edwardsville,Southeast Missouri State,7,2,2,17,0,Keenan Simmons missed Layup.
SIU-Edwardsville,Southeast Missouri State,7,2,2,17,0,Yemi Makanjuola Offensive Rebound.
SIU-Edwardsville,Southeast Missouri State,7,2,2,18,0,Foul on Joel Angus III.
SIU-Edwardsville,Southeast Missouri State,7,2,2,39,0,Burak Eslik missed Three Point Jumper.
SIU-Edwardsville,Southeast Missouri State,7,2,2,39,0,Keenan Simmons Offensive Rebound.
SIU-Edwardsville,Southeast Missouri State,7,2,2,45,0,Joshua White missed Three Point Jumper.
SIU-Edwardsville,Southeast Missouri State,7,2,2,45,0,Tony Anderson Defensive Rebound.
SIU-Edwardsville,Southeast Missouri State,7,2,3,0,0,Antonius Cleveland missed Jumper.
SIU-Edwardsville,Southeast Missouri State,7,2,3,0,0,Jamaal Calvin Offensive Rebound.
SIU-Edwardsville,Southeast Missouri State,7,2,3,11,0,Kyle Gullett missed Layup.
SIU-Edwardsville,Southeast Missouri State,7,2,3,23,0,Yemi Makanjuola Block.
SIU-Edwardsville,Southeast Missouri State,7,2,3,25,0,Yemi Makanjuola Defensive Rebound.
SIU-Edwardsville,Southeast Missouri State,7,2,3,28,0,Burak Eslik missed Three Point Jumper.
SIU-Edwardsville,Southeast Missouri State,7,2,3,28,0,Tony Anderson Defensive Rebound.
SIU-Edwardsville,Southeast Missouri State,7,2,3,35,0,Antonius Cleveland missed Layup.
SIU-Edwardsville,Southeast Missouri State,7,2,3,35,0,SIU-Edwardsville Defensive Rebound.
SIU-Edwardsville,Southeast Missouri State,7,2,3,53,0,Carlos Anderson missed Three Point Jumper.
SIU-Edwardsville,Southeast Missouri State,7,2,3,53,0,Tony Anderson Defensive Rebound.
SIU-Edwardsville,Southeast Missouri State,7,4,4,0,1,Antonius Cleveland made Layup.
SIU-Edwardsville,Southeast Missouri State,7,4,4,1,0,Official TV Timeout
SIU-Edwardsville,Southeast Missouri State,7,4,4,26,0,Burak Eslik Turnover.
SIU-Edwardsville,Southeast Missouri State,7,6,4,54,1,Tony Anderson made Jumper.
SIU-Edwardsville,Southeast Missouri State,7,6,5,11,0,Foul on Eric McGill.
SIU-Edwardsville,Southeast Missouri State,7,6,5,16,0,Burak Eslik missed Three Point Jumper.
SIU-Edwardsville,Southeast Missouri State,7,6,5,16,0,Isiah Jones Defensive Rebound.
SIU-Edwardsville,Southeast Missouri State,7,8,5,40,1,Antonius Cleveland made Jumper. Assisted by Kyle Gullett.
SIU-Edwardsville,Southeast Missouri State,9,8,5,48,1,Jalen Henry made Jumper. Assisted by Carlos Anderson.
SIU-Edwardsville,Southeast Missouri State,9,8,6,3,0,Kyle Gullett missed Jumper.
SIU-Edwardsville,Southeast Missouri State,9,8,6,3,0,Michael Chandler Block.
SIU-Edwardsville,Southeast Missouri State,9,8,6,6,0,Jalen Henry Defensive Rebound.
SIU-Edwardsville,Southeast Missouri State,9,8,6,19,0,Jalen Henry Turnover.
SIU-Edwardsville,Southeast Missouri State,9,8,6,21,0,Kyle Gullett Steal.
SIU-Edwardsville,Southeast Missouri State,9,8,6,45,0,Tony Anderson Turnover.
SIU-Edwardsville,Southeast Missouri State,9,8,6,46,0,Burak Eslik Steal.
SIU-Edwardsville,Southeast Missouri State,9,8,7,8,0,Foul on Eric McGill.
SIU-Edwardsville,Southeast Missouri State,9,8,7,19,0,Jalen Henry missed Jumper.
SIU-Edwardsville,Southeast Missouri State,9,8,7,19,0,Isiah Jones Defensive Rebound.
SIU-Edwardsville,Southeast Missouri State,9,10,7,26,1,Antonius Cleveland made Dunk. Assisted by Isiah Jones.
SIU-Edwardsville,Southeast Missouri State,9,10,7,54,0,Carlos Anderson Turnover.
SIU-Edwardsville,Southeast Missouri State,9,10,7,56,0,Isiah Jones Steal.
SIU-Edwardsville,Southeast Missouri State,9,10,7,57,0,Isiah Jones missed Layup.
SIU-Edwardsville,Southeast Missouri State,9,10,7,57,0,Jamaal Calvin Offensive Rebound.
SIU-Edwardsville,Southeast Missouri State,9,10,8,0,0,Jamaal Calvin missed Jumper.
SIU-Edwardsville,Southeast Missouri State,9,10,8,0,0,Joel Angus III Offensive Rebound.
SIU-Edwardsville,Southeast Missouri State,9,10,8,0,0,Foul on Jake Newton.
SIU-Edwardsville,Southeast Missouri State,9,11,8,0,1,Joel Angus III made Free Throw.
SIU-Edwardsville,Southeast Missouri State,9,11,8,0,0,Joel Angus III missed Free Throw.
SIU-Edwardsville,Southeast Missouri State,9,11,8,0,0,Jake Newton Defensive Rebound.
SIU-Edwardsville,Southeast Missouri State,9,11,8,14,0,C.J. Carr Turnover.
SIU-Edwardsville,Southeast Missouri State,9,11,8,15,0,Antonius Cleveland Steal.
SIU-Edwardsville,Southeast Missouri State,9,13,8,17,1,Antonius Cleveland made Layup.
SIU-Edwardsville,Southeast Missouri State,9,13,8,22,0,SIU-Edwardsville  Timeout
SIU-Edwardsville,Southeast Missouri State,9,13,8,22,0,Official TV Timeout
SIU-Edwardsville,Southeast Missouri State,9,13,8,40,0,Jake Newton missed Three Point Jumper.
SIU-Edwardsville,Southeast Missouri State,9,13,8,40,0,Michael Chandler Offensive Rebound.
SIU-Edwardsville,Southeast Missouri State,9,13,8,44,0,Foul on Antonius Cleveland.
SIU-Edwardsville,Southeast Missouri State,9,13,8,44,0,Michael Chandler missed Free Throw.
SIU-Edwardsville,Southeast Missouri State,9,13,8,44,0,SIU-Edwardsville Deadball Team Rebound.
SIU-Edwardsville,Southeast Missouri State,9,13,8,44,0,Michael Chandler missed Free Throw.
SIU-Edwardsville,Southeast Missouri State,9,13,8,44,0,Isiah Jones Defensive Rebound.
SIU-Edwardsville,Southeast Missouri State,9,13,9,3,0,Isiah Jones missed Three Point Jumper.
SIU-Edwardsville,Southeast Missouri State,9,13,9,3,0,Grant Fiorentinos Defensive Rebound.
SIU-Edwardsville,Southeast Missouri State,9,13,9,22,0,Joshua White Turnover.
SIU-Edwardsville,Southeast Missouri State,9,13,9,24,0,Kyle Gullett Steal.
SIU-Edwardsville,Southeast Missouri State,9,13,9,30,0,Joel Angus III missed Jumper.
SIU-Edwardsville,Southeast Missouri State,9,13,9,30,0,Michael Chandler Block.
SIU-Edwardsville,Southeast Missouri State,9,13,9,32,0,Michael Chandler Defensive Rebound.
SIU-Edwardsville,Southeast Missouri State,11,13,9,48,1,Grant Fiorentinos made Jumper.
SIU-Edwardsville,Southeast Missouri State,11,16,10,7,1,Antonius Cleveland made Three Point Jumper.
SIU-Edwardsville,Southeast Missouri State,11,16,10,32,0,Grant Fiorentinos Turnover.
SIU-Edwardsville,Southeast Missouri State,11,16,10,34,0,Kyle Gullett Steal.
SIU-Edwardsville,Southeast Missouri State,11,16,10,36,0,Foul on Jake Newton.
SIU-Edwardsville,Southeast Missouri State,11,16,10,36,0,Foul on Jake Newton.
SIU-Edwardsville,Southeast Missouri State,11,17,10,36,1,Jamaal Calvin made Free Throw.
SIU-Edwardsville,Southeast Missouri State,11,18,10,36,1,Jamaal Calvin made Free Throw.
SIU-Edwardsville,Southeast Missouri State,11,19,10,36,1,Antonius Cleveland made Free Throw.
SIU-Edwardsville,Southeast Missouri State,11,16,10,36,0,Technical Foul on SIU-Edwardsville.
SIU-Edwardsville,Southeast Missouri State,11,20,10,36,1,Antonius Cleveland made Free Throw.
SIU-Edwardsville,Southeast Missouri State,11,20,10,42,0,Grant Fiorentinos missed Jumper.
SIU-Edwardsville,Southeast Missouri State,11,20,10,42,0,Tony Anderson Defensive Rebound.
SIU-Edwardsville,Southeast Missouri State,11,20,10,48,0,Jamaal Calvin missed Three Point Jumper.
SIU-Edwardsville,Southeast Missouri State,11,20,10,48,0,Joel Angus III Offensive Rebound.
SIU-Edwardsville,Southeast Missouri State,11,20,10,51,0,Foul on Carlos Anderson.
SIU-Edwardsville,Southeast Missouri State,11,21,10,57,1,Joel Angus III made Free Throw.
SIU-Edwardsville,Southeast Missouri State,11,22,10,57,1,Joel Angus III made Free Throw.
SIU-Edwardsville,Southeast Missouri State,11,22,11,15,0,Joshua White Turnover.
SIU-Edwardsville,Southeast Missouri State,11,22,11,16,0,Antonius Cleveland Steal.
SIU-Edwardsville,Southeast Missouri State,11,24,11,18,1,Antonius Cleveland made Dunk. Assisted by Jamaal Calvin.
SIU-Edwardsville,Southeast Missouri State,11,24,11,32,0,Foul on Jamaal Calvin.
SIU-Edwardsville,Southeast Missouri State,11,24,11,54,0,Foul on Jaylin Stewart.
SIU-Edwardsville,Southeast Missouri State,12,24,11,54,1,Burak Eslik made Free Throw.
SIU-Edwardsville,Southeast Missouri State,13,24,11,54,1,Burak Eslik made Free Throw.
SIU-Edwardsville,Southeast Missouri State,13,24,12,11,0,Jamaal Calvin missed Jumper.
SIU-Edwardsville,Southeast Missouri State,13,24,12,11,0,Tony Anderson Offensive Rebound.
SIU-Edwardsville,Southeast Missouri State,13,24,12,20,0,Isiah Jones Turnover.
SIU-Edwardsville,Southeast Missouri State,13,24,12,20,0,Foul on Isiah Jones.
SIU-Edwardsville,Southeast Missouri State,13,24,12,20,0,Official TV Timeout
SIU-Edwardsville,Southeast Missouri State,13,24,12,43,0,Burak Eslik missed Jumper.
SIU-Edwardsville,Southeast Missouri State,13,24,12,43,0,Jamaal Calvin Defensive Rebound.
SIU-Edwardsville,Southeast Missouri State,13,24,13,2,0,Foul on Burak Eslik.
SIU-Edwardsville,Southeast Missouri State,13,25,13,2,1,Joel Angus III made Free Throw.
SIU-Edwardsville,Southeast Missouri State,13,26,13,2,1,Joel Angus III made Free Throw.
SIU-Edwardsville,Southeast Missouri State,16,26,13,20,1,Carlos Anderson made Three Point Jumper. Assisted by Burak Eslik.
SIU-Edwardsville,Southeast Missouri State,16,26,13,48,0,Kyle Gullett missed Jumper.
SIU-Edwardsville,Southeast Missouri State,16,26,13,48,0,Kyle Gullett Offensive Rebound.
SIU-Edwardsville,Southeast Missouri State,16,26,13,53,0,Antonius Cleveland Turnover.
SIU-Edwardsville,Southeast Missouri State,16,26,14,11,0,Burak Eslik missed Three Point Jumper.
SIU-Edwardsville,Southeast Missouri State,16,26,14,11,0,Isiah Jones Defensive Rebound.
SIU-Edwardsville,Southeast Missouri State,16,26,14,20,0,Antonius Cleveland missed Three Point Jumper.
SIU-Edwardsville,Southeast Missouri State,16,26,14,20,0,Kyle Gullett Offensive Rebound.
SIU-Edwardsville,Southeast Missouri State,16,26,14,24,0,Foul on Keenan Simmons.
SIU-Edwardsville,Southeast Missouri State,16,28,14,25,1,Isiah Jones made Jumper. Assisted by Eric McGill.
SIU-Edwardsville,Southeast Missouri State,16,28,14,43,0,C.J. Carr missed Three Point Jumper.
SIU-Edwardsville,Southeast Missouri State,16,28,14,43,0,Burak Eslik Offensive Rebound.
SIU-Edwardsville,Southeast Missouri State,18,28,14,48,1,Burak Eslik made Jumper.
SIU-Edwardsville,Southeast Missouri State,18,28,14,49,0,Foul on Joel Angus III.
SIU-Edwardsville,Southeast Missouri State,18,28,14,49,0,Burak Eslik missed Free Throw.
SIU-Edwardsville,Southeast Missouri State,18,28,14,49,0,Isiah Jones Defensive Rebound.
SIU-Edwardsville,Southeast Missouri State,18,28,14,58,0,Foul on Jalen Henry.
SIU-Edwardsville,Southeast Missouri State,18,29,14,58,1,Joel Angus III made Free Throw.
SIU-Edwardsville,Southeast Missouri State,18,29,14,58,0,Joel Angus III missed Free Throw.
SIU-Edwardsville,Southeast Missouri State,18,29,14,58,0,Keenan Simmons Defensive Rebound.
SIU-Edwardsville,Southeast Missouri State,18,29,15,16,0,Carlos Anderson Turnover.
SIU-Edwardsville,Southeast Missouri State,18,29,15,17,0,Antonius Cleveland Steal.
SIU-Edwardsville,Southeast Missouri State,18,31,15,20,1,Antonius Cleveland made Layup.
SIU-Edwardsville,Southeast Missouri State,18,31,15,28,0,Foul on Isiah Jones.
SIU-Edwardsville,Southeast Missouri State,19,31,15,28,1,C.J. Carr made Free Throw.
SIU-Edwardsville,Southeast Missouri State,20,31,15,28,1,C.J. Carr made Free Throw.
SIU-Edwardsville,Southeast Missouri State,20,33,15,40,1,Kyle Gullett made Layup. Assisted by Antonius Cleveland.
SIU-Edwardsville,Southeast Missouri State,22,33,15,52,1,Jalen Henry made Jumper. Assisted by C.J. Carr.
SIU-Edwardsville,Southeast Missouri State,22,33,16,5,0,Tony Anderson missed Jumper.
SIU-Edwardsville,Southeast Missouri State,22,33,16,5,0,C.J. Carr Defensive Rebound.
SIU-Edwardsville,Southeast Missouri State,22,33,16,15,0,Foul on Kyle Gullett.
SIU-Edwardsville,Southeast Missouri State,22,33,16,15,0,Official TV Timeout
SIU-Edwardsville,Southeast Missouri State,23,33,16,15,1,Jalen Henry made Free Throw.
SIU-Edwardsville,Southeast Missouri State,23,33,16,15,0,Jalen Henry missed Free Throw.
SIU-Edwardsville,Southeast Missouri State,23,33,16,15,0,Isiah Jones Defensive Rebound.
SIU-Edwardsville,Southeast Missouri State,23,33,16,38,0,Antonius Cleveland Turnover.
SIU-Edwardsville,Southeast Missouri State,23,33,16,42,0,Joshua White Steal.
SIU-Edwardsville,Southeast Missouri State,23,33,17,2,0,C.J. Carr missed Jumper.
SIU-Edwardsville,Southeast Missouri State,23,33,17,2,0,C.J. Carr Offensive Rebound.
SIU-Edwardsville,Southeast Missouri State,25,33,17,7,1,Jalen Henry made Layup. Assisted by C.J. Carr.
SIU-Edwardsville,Southeast Missouri State,25,33,17,28,0,Jamaal Calvin missed Three Point Jumper.
SIU-Edwardsville,Southeast Missouri State,25,33,17,28,0,Joshua White Defensive Rebound.
SIU-Edwardsville,Southeast Missouri State,27,33,17,37,1,Keenan Simmons made Jumper. Assisted by C.J. Carr.
SIU-Edwardsville,Southeast Missouri State,27,33,17,37,0,SE Missouri St  Timeout
SIU-Edwardsville,Southeast Missouri State,27,33,17,52,0,Isiah Jones missed Three Point Jumper.
SIU-Edwardsville,Southeast Missouri State,27,33,17,52,0,Jalen Henry Defensive Rebound.
SIU-Edwardsville,Southeast Missouri State,29,33,18,10,1,Keenan Simmons made Jumper. Assisted by C.J. Carr.
SIU-Edwardsville,Southeast Missouri State,29,33,18,20,0,Jaylin Stewart Turnover.
SIU-Edwardsville,Southeast Missouri State,29,33,18,21,0,Foul on Jaylin Stewart.
SIU-Edwardsville,Southeast Missouri State,31,33,18,26,1,Jalen Henry made Jumper. Assisted by C.J. Carr.
SIU-Edwardsville,Southeast Missouri State,31,33,18,40,0,Foul on Devin Thornton.
SIU-Edwardsville,Southeast Missouri State,31,33,18,40,0,Antonius Cleveland missed Free Throw.
SIU-Edwardsville,Southeast Missouri State,31,33,18,40,0,Jalen Henry Defensive Rebound.
SIU-Edwardsville,Southeast Missouri State,34,33,18,51,1,Devin Thornton made Three Point Jumper.
SIU-Edwardsville,Southeast Missouri State,34,33,19,5,0,Tony Anderson missed Jumper.
SIU-Edwardsville,Southeast Missouri State,34,33,19,5,0,C.J. Carr Defensive Rebound.
SIU-Edwardsville,Southeast Missouri State,36,33,19,11,1,Joshua White made Layup. Assisted by C.J. Carr.
SIU-Edwardsville,Southeast Missouri State,36,33,19,28,0,Jamaal Calvin Turnover.
SIU-Edwardsville,Southeast Missouri State,36,33,19,29,0,C.J. Carr Steal.
SIU-Edwardsville,Southeast Missouri State,36,33,19,34,0,Keenan Simmons missed Layup.
SIU-Edwardsville,Southeast Missouri State,36,33,19,34,0,Jamaal Calvin Defensive Rebound.
SIU-Edwardsville,Southeast Missouri State,36,33,19,34,0,Foul on Jalen Henry.
SIU-Edwardsville,Southeast Missouri State,36,34,19,34,1,Jamaal Calvin made Free Throw.
SIU-Edwardsville,Southeast Missouri State,36,35,19,34,1,Jamaal Calvin made Free Throw.
SIU-Edwardsville,Southeast Missouri State,36,35,19,58,0,Joshua White missed Jumper.
SIU-Edwardsville,Southeast Missouri State,36,35,19,58,0,Antonius Cleveland Block.
SIU-Edwardsville,Southeast Missouri State,36,35,20,0,0,Jamaal Calvin Defensive Rebound.
SIU-Edwardsville,Southeast Missouri State,36,35,20,0,0,End of 1st half
SIU-Edwardsville,Southeast Missouri State,36,37,20,15,1,Joel Angus III made Jumper. Assisted by Jamaal Calvin.
SIU-Edwardsville,Southeast Missouri State,39,37,20,46,1,Burak Eslik made Three Point Jumper. Assisted by Joshua White.
SIU-Edwardsville,Southeast Missouri State,39,37,20,59,0,Tony Anderson Turnover.
SIU-Edwardsville,Southeast Missouri State,39,37,21,0,0,Joshua White Steal.
SIU-Edwardsville,Southeast Missouri State,42,37,21,27,1,Carlos Anderson made Three Point Jumper. Assisted by Joshua White.
SIU-Edwardsville,Southeast Missouri State,42,37,21,49,0,Tony Anderson Turnover.
SIU-Edwardsville,Southeast Missouri State,42,37,21,50,0,Carlos Anderson Steal.
SIU-Edwardsville,Southeast Missouri State,42,37,22,5,0,Yemi Makanjuola missed Jumper.
SIU-Edwardsville,Southeast Missouri State,42,37,22,5,0,Yemi Makanjuola Offensive Rebound.
SIU-Edwardsville,Southeast Missouri State,42,37,22,14,0,Carlos Anderson missed Jumper.
SIU-Edwardsville,Southeast Missouri State,42,37,22,14,0,Joel Angus III Block.
SIU-Edwardsville,Southeast Missouri State,42,37,22,16,0,Carlos Anderson Offensive Rebound.
SIU-Edwardsville,Southeast Missouri State,42,37,22,20,0,Foul on Joel Angus III.
SIU-Edwardsville,Southeast Missouri State,43,37,22,20,1,Keenan Simmons made Free Throw.
SIU-Edwardsville,Southeast Missouri State,44,37,22,20,1,Keenan Simmons made Free Throw.
SIU-Edwardsville,Southeast Missouri State,44,37,22,32,0,Foul on Yemi Makanjuola.
SIU-Edwardsville,Southeast Missouri State,44,37,22,35,0,Antonius Cleveland missed Jumper.
SIU-Edwardsville,Southeast Missouri State,44,37,22,35,0,Tony Anderson Offensive Rebound.
SIU-Edwardsville,Southeast Missouri State,44,37,22,37,0,Foul on Keenan Simmons.
SIU-Edwardsville,Southeast Missouri State,44,39,22,39,1,Antonius Cleveland made Layup. Assisted by Eric McGill.
SIU-Edwardsville,Southeast Missouri State,44,39,23,6,0,Keenan Simmons Turnover.
SIU-Edwardsville,Southeast Missouri State,44,39,23,23,0,Kyle Gullett missed Jumper.
SIU-Edwardsville,Southeast Missouri State,44,39,23,23,0,Michael Chandler Block.
SIU-Edwardsville,Southeast Missouri State,44,39,23,25,0,Carlos Anderson Defensive Rebound.
SIU-Edwardsville,Southeast Missouri State,47,39,23,51,1,C.J. Carr made Three Point Jumper.
SIU-Edwardsville,Southeast Missouri State,47,39,24,7,0,Isiah Jones missed Jumper.
SIU-Edwardsville,Southeast Missouri State,47,39,24,7,0,SIU-Edwardsville Defensive Rebound.
SIU-Edwardsville,Southeast Missouri State,47,39,24,9,0,Official TV Timeout
SIU-Edwardsville,Southeast Missouri State,47,39,24,30,0,Burak Eslik missed Three Point Jumper.
SIU-Edwardsville,Southeast Missouri State,47,39,24,30,0,Eric McGill Defensive Rebound.
SIU-Edwardsville,Southeast Missouri State,47,39,24,57,0,Foul on Jalen Henry.
SIU-Edwardsville,Southeast Missouri State,47,42,25,5,1,Tony Anderson made Three Point Jumper. Assisted by Joel Angus III.
SIU-Edwardsville,Southeast Missouri State,47,42,25,27,0,Burak Eslik Turnover.
SIU-Edwardsville,Southeast Missouri State,47,42,25,44,0,Eric McGill missed Three Point Jumper.
SIU-Edwardsville,Southeast Missouri State,47,42,25,44,0,SIU-Edwardsville Defensive Rebound.
SIU-Edwardsville,Southeast Missouri State,47,42,26,8,0,Foul on Antonius Cleveland.
SIU-Edwardsville,Southeast Missouri State,49,42,26,17,1,Grant Fiorentinos made Layup. Assisted by Carlos Anderson.
SIU-Edwardsville,Southeast Missouri State,49,42,26,33,0,Jamaal Calvin missed Three Point Jumper.
SIU-Edwardsville,Southeast Missouri State,49,42,26,33,0,Antonius Cleveland Offensive Rebound.
SIU-Edwardsville,Southeast Missouri State,49,42,26,39,0,Antonius Cleveland missed Jumper.
SIU-Edwardsville,Southeast Missouri State,49,42,26,39,0,Antonius Cleveland Offensive Rebound.
SIU-Edwardsville,Southeast Missouri State,49,44,26,42,1,Antonius Cleveland made Jumper.
SIU-Edwardsville,Southeast Missouri State,49,44,27,11,0,C.J. Carr Turnover.
SIU-Edwardsville,Southeast Missouri State,49,44,27,12,0,Joel Angus III Steal.
SIU-Edwardsville,Southeast Missouri State,49,46,27,19,1,Eric McGill made Jumper.
SIU-Edwardsville,Southeast Missouri State,49,46,27,20,0,Foul on Michael Chandler.
SIU-Edwardsville,Southeast Missouri State,49,46,27,20,0,Eric McGill missed Free Throw.
SIU-Edwardsville,Southeast Missouri State,49,46,27,20,0,Grant Fiorentinos Defensive Rebound.
SIU-Edwardsville,Southeast Missouri State,49,46,27,34,0,Foul on Jaylin Stewart.
SIU-Edwardsville,Southeast Missouri State,52,46,27,45,1,Burak Eslik made Three Point Jumper. Assisted by C.J. Carr.
SIU-Edwardsville,Southeast Missouri State,52,46,27,58,0,Jamaal Calvin missed Layup.
SIU-Edwardsville,Southeast Missouri State,52,46,27,58,0,Michael Chandler Block.
SIU-Edwardsville,Southeast Missouri State,52,46,28,0,0,Burak Eslik Defensive Rebound.
SIU-Edwardsville,Southeast Missouri State,54,46,28,2,1,Burak Eslik made Layup.
SIU-Edwardsville,Southeast Missouri State,54,46,28,4,0,Foul on Eric McGill.
SIU-Edwardsville,Southeast Missouri State,54,46,28,9,0,Official TV Timeout
SIU-Edwardsville,Southeast Missouri State,55,46,28,13,1,Burak Eslik made Free Throw.
SIU-Edwardsville,Southeast Missouri State,55,46,28,38,0,Antonius Cleveland missed Three Point Jumper.
SIU-Edwardsville,Southeast Missouri State,55,46,28,38,0,Jaylin Stewart Offensive Rebound.
SIU-Edwardsville,Southeast Missouri State,55,46,28,43,0,Jaylin Stewart Turnover.
SIU-Edwardsville,Southeast Missouri State,55,46,28,51,0,Burak Eslik missed Three Point Jumper.
SIU-Edwardsville,Southeast Missouri State,55,46,28,51,0,Jamaal Calvin Defensive Rebound.
SIU-Edwardsville,Southeast Missouri State,55,48,29,11,1,Joel Angus III made Jumper. Assisted by Isiah Jones.
SIU-Edwardsville,Southeast Missouri State,55,48,29,11,0,Foul on Grant Fiorentinos.
SIU-Edwardsville,Southeast Missouri State,55,49,29,11,1,Joel Angus III made Free Throw.
SIU-Edwardsville,Southeast Missouri State,55,49,29,38,0,Keenan Simmons missed Jumper.
SIU-Edwardsville,Southeast Missouri State,55,49,29,38,0,SE Missouri St Defensive Rebound.
SIU-Edwardsville,Southeast Missouri State,55,49,29,55,0,Foul on Carlos Anderson.
SIU-Edwardsville,Southeast Missouri State,55,49,30,7,0,Jamaal Calvin Turnover.
SIU-Edwardsville,Southeast Missouri State,55,49,30,31,0,Joshua White missed Jumper.
SIU-Edwardsville,Southeast Missouri State,55,49,30,31,0,Jaylin Stewart Defensive Rebound.
SIU-Edwardsville,Southeast Missouri State,55,49,30,33,0,Foul on Keenan Simmons.
SIU-Edwardsville,Southeast Missouri State,55,49,30,37,0,Jaylin Stewart missed Free Throw.
SIU-Edwardsville,Southeast Missouri State,55,49,30,37,0,Michael Chandler Defensive Rebound.
SIU-Edwardsville,Southeast Missouri State,55,49,31,7,0,Jalen Henry Turnover.
SIU-Edwardsville,Southeast Missouri State,55,52,31,20,1,Isiah Jones made Three Point Jumper. Assisted by Jamaal Calvin.
SIU-Edwardsville,Southeast Missouri State,58,52,31,53,1,Carlos Anderson made Three Point Jumper.
SIU-Edwardsville,Southeast Missouri State,58,52,31,53,0,Foul on Jamaal Calvin.
SIU-Edwardsville,Southeast Missouri State,59,52,31,53,1,Carlos Anderson made Free Throw.
SIU-Edwardsville,Southeast Missouri State,59,54,32,10,1,Jamaal Calvin made Jumper.
SIU-Edwardsville,Southeast Missouri State,62,54,32,34,1,Burak Eslik made Three Point Jumper. Assisted by Jalen Henry.
SIU-Edwardsville,Southeast Missouri State,62,54,32,47,0,SE Missouri St  Timeout
SIU-Edwardsville,Southeast Missouri State,62,54,32,47,0,Official TV Timeout
SIU-Edwardsville,Southeast Missouri State,62,54,33,2,0,Tony Anderson Turnover.
SIU-Edwardsville,Southeast Missouri State,62,54,33,3,0,C.J. Carr Steal.
SIU-Edwardsville,Southeast Missouri State,62,54,33,14,0,C.J. Carr Turnover.
SIU-Edwardsville,Southeast Missouri State,62,54,33,14,0,Foul on C.J. Carr.
SIU-Edwardsville,Southeast Missouri State,62,54,33,14,0,Official TV Timeout
SIU-Edwardsville,Southeast Missouri State,62,55,33,14,1,Isiah Jones made Free Throw.
SIU-Edwardsville,Southeast Missouri State,62,56,33,14,1,Isiah Jones made Free Throw.
SIU-Edwardsville,Southeast Missouri State,62,56,33,29,0,C.J. Carr missed Three Point Jumper.
SIU-Edwardsville,Southeast Missouri State,62,56,33,29,0,Tony Anderson Defensive Rebound.
SIU-Edwardsville,Southeast Missouri State,62,56,33,51,0,Isiah Jones Turnover.
SIU-Edwardsville,Southeast Missouri State,62,56,33,51,0,Foul on Isiah Jones.
SIU-Edwardsville,Southeast Missouri State,62,56,34,13,0,C.J. Carr missed Layup.
SIU-Edwardsville,Southeast Missouri State,62,56,34,13,0,Antonius Cleveland Block.
SIU-Edwardsville,Southeast Missouri State,62,56,34,14,0,SIU-Edwardsville Offensive Rebound.
SIU-Edwardsville,Southeast Missouri State,62,56,34,17,0,C.J. Carr missed Three Point Jumper.
SIU-Edwardsville,Southeast Missouri State,62,56,34,17,0,Michael Chandler Offensive Rebound.
SIU-Edwardsville,Southeast Missouri State,62,56,34,26,0,Jalen Henry Turnover.
SIU-Edwardsville,Southeast Missouri State,62,56,34,27,0,Joel Angus III Steal.
SIU-Edwardsville,Southeast Missouri State,62,56,34,32,0,Isiah Jones missed Three Point Jumper.
SIU-Edwardsville,Southeast Missouri State,62,56,34,32,0,Burak Eslik Defensive Rebound.
SIU-Edwardsville,Southeast Missouri State,62,56,35,1,0,Jalen Henry missed Jumper.
SIU-Edwardsville,Southeast Missouri State,62,56,35,1,0,Joel Angus III Defensive Rebound.
SIU-Edwardsville,Southeast Missouri State,62,56,35,13,0,Foul on Jalen Henry.
SIU-Edwardsville,Southeast Missouri State,62,57,35,13,1,Tony Anderson made Free Throw.
SIU-Edwardsville,Southeast Missouri State,62,58,35,13,1,Tony Anderson made Free Throw.
SIU-Edwardsville,Southeast Missouri State,62,58,35,42,0,Foul on Tony Anderson.
