Away Team,Home Team,Away Score,Home Score,Minute,Second,isScoringPosession,Desc.
SIU-Edwardsville,Southeast Missouri State,63,58,35,42,1,Burak Eslik made Free Throw.
SIU-Edwardsville,Southeast Missouri State,64,58,35,42,1,Burak Eslik made Free Throw.
SIU-Edwardsville,Southeast Missouri State,64,60,35,56,1,Antonius Cleveland made Jumper.
SIU-Edwardsville,Southeast Missouri State,64,60,36,24,0,Carlos Anderson missed Jumper.
SIU-Edwardsville,Southeast Missouri State,64,60,36,24,0,Tony Anderson Block.
SIU-Edwardsville,Southeast Missouri State,64,60,36,25,0,Joel Angus III Defensive Rebound.
SIU-Edwardsville,Southeast Missouri State,64,60,36,43,0,Tony Anderson missed Three Point Jumper.
SIU-Edwardsville,Southeast Missouri State,64,60,36,43,0,Carlos Anderson Defensive Rebound.
SIU-Edwardsville,Southeast Missouri State,64,60,36,53,0,SIU-Edwardsville  Timeout
SIU-Edwardsville,Southeast Missouri State,64,60,36,53,0,Official TV Timeout
SIU-Edwardsville,Southeast Missouri State,66,60,37,11,1,Burak Eslik made Layup.
SIU-Edwardsville,Southeast Missouri State,66,60,37,18,0,Eric McGill Turnover.
SIU-Edwardsville,Southeast Missouri State,66,60,37,19,0,Keenan Simmons Steal.
SIU-Edwardsville,Southeast Missouri State,66,60,37,31,0,Foul on Eric McGill.
SIU-Edwardsville,Southeast Missouri State,66,60,37,31,0,C.J. Carr missed Free Throw.
SIU-Edwardsville,Southeast Missouri State,66,60,37,31,0,Antonius Cleveland Defensive Rebound.
SIU-Edwardsville,Southeast Missouri State,66,60,37,42,0,Antonius Cleveland missed Jumper.
SIU-Edwardsville,Southeast Missouri State,66,60,37,42,0,Keenan Simmons Block.
SIU-Edwardsville,Southeast Missouri State,66,60,37,44,0,C.J. Carr Defensive Rebound.
SIU-Edwardsville,Southeast Missouri State,66,60,38,12,0,C.J. Carr Turnover.
SIU-Edwardsville,Southeast Missouri State,66,60,38,13,0,Antonius Cleveland Steal.
SIU-Edwardsville,Southeast Missouri State,66,60,38,18,0,Foul on Carlos Anderson.
SIU-Edwardsville,Southeast Missouri State,66,61,38,18,1,Antonius Cleveland made Free Throw.
SIU-Edwardsville,Southeast Missouri State,66,61,38,18,0,Antonius Cleveland missed Free Throw.
SIU-Edwardsville,Southeast Missouri State,66,61,38,18,0,Grant Fiorentinos Defensive Rebound.
SIU-Edwardsville,Southeast Missouri State,66,61,38,35,0,Foul on Isiah Jones.
SIU-Edwardsville,Southeast Missouri State,66,61,38,35,0,Carlos Anderson missed Free Throw.
SIU-Edwardsville,Southeast Missouri State,66,61,38,35,0,Antonius Cleveland Defensive Rebound.
SIU-Edwardsville,Southeast Missouri State,66,63,38,50,1,Joel Angus III made Jumper.
SIU-Edwardsville,Southeast Missouri State,66,63,39,22,0,C.J. Carr missed Three Point Jumper.
SIU-Edwardsville,Southeast Missouri State,66,63,39,22,0,Keenan Simmons Offensive Rebound.
SIU-Edwardsville,Southeast Missouri State,66,63,39,28,0,Foul on Eric McGill.
SIU-Edwardsville,Southeast Missouri State,67,63,39,28,1,Burak Eslik made Free Throw.
SIU-Edwardsville,Southeast Missouri State,68,63,39,28,1,Burak Eslik made Free Throw.
SIU-Edwardsville,Southeast Missouri State,68,63,39,34,0,Isiah Jones missed Three Point Jumper.
SIU-Edwardsville,Southeast Missouri State,68,63,39,34,0,Joel Angus III Offensive Rebound.
SIU-Edwardsville,Southeast Missouri State,68,66,39,40,1,Jamaal Calvin made Three Point Jumper. Assisted by Joel Angus III.
SIU-Edwardsville,Southeast Missouri State,68,66,39,44,0,SE Missouri St  Timeout
SIU-Edwardsville,Southeast Missouri State,68,66,39,44,0,Foul on Jamaal Calvin.
SIU-Edwardsville,Southeast Missouri State,69,66,39,44,1,Burak Eslik made Free Throw.
SIU-Edwardsville,Southeast Missouri State,70,66,39,44,1,Burak Eslik made Free Throw.
SIU-Edwardsville,Southeast Missouri State,70,66,39,44,0,SIU-Edwardsville  Timeout
SIU-Edwardsville,Southeast Missouri State,70,66,39,44,0,Jamaal Calvin missed Jumper.
SIU-Edwardsville,Southeast Missouri State,70,66,39,44,0,Antonius Cleveland Offensive Rebound.
SIU-Edwardsville,Southeast Missouri State,70,69,39,44,1,Isiah Jones made Three Point Jumper. Assisted by Antonius Cleveland.
SIU-Edwardsville,Southeast Missouri State,70,69,39,55,0,SE Missouri St  Timeout
SIU-Edwardsville,Southeast Missouri State,72,69,39,56,1,Keenan Simmons made Dunk. Assisted by Carlos Anderson.
SIU-Edwardsville,Southeast Missouri State,72,69,39,58,0,Isiah Jones missed Three Point Jumper.
SIU-Edwardsville,Southeast Missouri State,72,69,39,58,0,SE Missouri St Deadball Team Rebound.
SIU-Edwardsville,Southeast Missouri State,72,69,40,0,0,End of Game
