Away Team,Home Team,Away Score,Home Score,Minute,Second,isScoringPosession,Desc.
St. Francis (BKN),Coastal Carolina,0,0,0,15,0,Eric Smith Turnover.
St. Francis (BKN),Coastal Carolina,0,0,0,31,0,Jalen Cannon missed Jumper.
St. Francis (BKN),Coastal Carolina,0,0,0,31,0,Elijah Wilson Defensive Rebound.
St. Francis (BKN),Coastal Carolina,0,2,0,41,1,Elijah Wilson made Jumper.
St. Francis (BKN),Coastal Carolina,0,2,0,51,0,Jalen Cannon Turnover.
St. Francis (BKN),Coastal Carolina,0,2,1,1,0,Foul on Brent Jones.
St. Francis (BKN),Coastal Carolina,0,3,1,1,1,Eric Smith made Free Throw.
St. Francis (BKN),Coastal Carolina,0,3,1,1,0,Eric Smith missed Free Throw.
St. Francis (BKN),Coastal Carolina,0,3,1,1,0,El Hadji Ndieguene Offensive Rebound.
St. Francis (BKN),Coastal Carolina,0,3,1,3,0,El Hadji Ndieguene Turnover.
St. Francis (BKN),Coastal Carolina,0,3,1,3,0,Matt Milk Steal.
St. Francis (BKN),Coastal Carolina,0,3,1,16,0,Matt Milk Turnover.
St. Francis (BKN),Coastal Carolina,0,5,1,40,1,Michel Enanga made Jumper.
St. Francis (BKN),Coastal Carolina,0,5,2,8,0,Foul on Michel Enanga.
St. Francis (BKN),Coastal Carolina,1,5,2,8,1,Ben Mockford made Free Throw.
St. Francis (BKN),Coastal Carolina,2,5,2,8,1,Ben Mockford made Free Throw.
St. Francis (BKN),Coastal Carolina,2,7,2,19,1,Elijah Wilson made Jumper.
St. Francis (BKN),Coastal Carolina,2,7,2,38,0,Ben Mockford missed Three Point Jumper.
St. Francis (BKN),Coastal Carolina,2,7,2,38,0,Jalen Cannon Offensive Rebound.
St. Francis (BKN),Coastal Carolina,4,7,2,42,1,Jalen Cannon made Layup.
St. Francis (BKN),Coastal Carolina,4,9,2,52,1,Eric Smith made Layup.
St. Francis (BKN),Coastal Carolina,4,9,2,52,0,Foul on Matt Milk.
St. Francis (BKN),Coastal Carolina,4,10,2,52,1,Eric Smith made Free Throw.
St. Francis (BKN),Coastal Carolina,6,10,3,1,1,Amdy Fall made Layup. Assisted by Ben Mockford.
St. Francis (BKN),Coastal Carolina,6,10,3,14,0,Eric Smith Turnover.
St. Francis (BKN),Coastal Carolina,6,10,3,15,0,Jalen Cannon Steal.
St. Francis (BKN),Coastal Carolina,6,10,3,20,0,Jalen Cannon missed Layup.
St. Francis (BKN),Coastal Carolina,6,10,3,20,0,Amdy Fall Offensive Rebound.
St. Francis (BKN),Coastal Carolina,6,10,3,23,0,Amdy Fall missed Layup.
St. Francis (BKN),Coastal Carolina,6,10,3,23,0,Amdy Fall Offensive Rebound.
St. Francis (BKN),Coastal Carolina,6,10,3,27,0,Ben Mockford missed Three Point Jumper.
St. Francis (BKN),Coastal Carolina,6,10,3,27,0,Anthony White Offensive Rebound.
St. Francis (BKN),Coastal Carolina,8,10,3,33,1,Anthony White made Jumper.
St. Francis (BKN),Coastal Carolina,8,10,3,55,0,Foul on Amdy Fall.
St. Francis (BKN),Coastal Carolina,8,11,3,55,1,El Hadji Ndieguene made Free Throw.
St. Francis (BKN),Coastal Carolina,8,11,3,55,0,El Hadji Ndieguene missed Free Throw.
St. Francis (BKN),Coastal Carolina,8,11,3,55,0,Jalen Cannon Defensive Rebound.
St. Francis (BKN),Coastal Carolina,8,11,4,3,0,Jalen Cannon missed Layup.
St. Francis (BKN),Coastal Carolina,8,11,4,3,0,El Hadji Ndieguene Defensive Rebound.
St. Francis (BKN),Coastal Carolina,8,11,4,15,0,Foul on Anthony White.
St. Francis (BKN),Coastal Carolina,8,11,4,15,0,Official TV Timeout
St. Francis (BKN),Coastal Carolina,8,12,4,15,1,Michel Enanga made Free Throw.
St. Francis (BKN),Coastal Carolina,8,13,4,15,1,Michel Enanga made Free Throw.
St. Francis (BKN),Coastal Carolina,8,13,4,44,0,Anthony White Turnover.
St. Francis (BKN),Coastal Carolina,8,13,4,45,0,Josh Cameron Steal.
St. Francis (BKN),Coastal Carolina,8,15,4,47,1,Josh Cameron made Jumper.
St. Francis (BKN),Coastal Carolina,8,15,5,12,0,Wayne Martin missed Three Point Jumper.
St. Francis (BKN),Coastal Carolina,8,15,5,12,0,Colton Ray-St Cyr Defensive Rebound.
St. Francis (BKN),Coastal Carolina,8,15,5,31,0,Tristian Curtis missed Layup.
St. Francis (BKN),Coastal Carolina,8,15,5,31,0,Tristian Curtis Offensive Rebound.
St. Francis (BKN),Coastal Carolina,8,15,5,34,0,Tristian Curtis missed Layup.
St. Francis (BKN),Coastal Carolina,8,15,5,34,0,Aleksandar Isailovic Defensive Rebound.
St. Francis (BKN),Coastal Carolina,10,15,5,44,1,Wayne Martin made Layup.
St. Francis (BKN),Coastal Carolina,10,17,6,5,1,Uros Ljeskovic made Jumper.
St. Francis (BKN),Coastal Carolina,10,17,6,17,0,Ben Mockford missed Jumper.
St. Francis (BKN),Coastal Carolina,10,17,6,17,0,Elijah Wilson Defensive Rebound.
St. Francis (BKN),Coastal Carolina,10,17,6,23,0,Josh Cameron missed Three Point Jumper.
St. Francis (BKN),Coastal Carolina,10,17,6,23,0,Wayne Martin Defensive Rebound.
St. Francis (BKN),Coastal Carolina,13,17,6,35,1,Aleksandar Isailovic made Three Point Jumper. Assisted by Anthony White.
St. Francis (BKN),Coastal Carolina,13,19,7,7,1,Josh Cameron made Layup.
St. Francis (BKN),Coastal Carolina,15,19,7,19,1,Wayne Martin made Layup.
St. Francis (BKN),Coastal Carolina,15,19,7,40,0,Foul on Elijah Wilson.
St. Francis (BKN),Coastal Carolina,15,19,7,40,0,Elijah Wilson Turnover.
St. Francis (BKN),Coastal Carolina,18,19,7,48,1,Sheldon Hagigal made Three Point Jumper.
St. Francis (BKN),Coastal Carolina,18,19,8,16,0,Warren Gillis Turnover.
St. Francis (BKN),Coastal Carolina,18,19,8,18,0,Yunus Hopkinson Steal.
St. Francis (BKN),Coastal Carolina,18,19,8,22,0,Wayne Martin Turnover.
St. Francis (BKN),Coastal Carolina,18,19,8,23,0,Josh Cameron Steal.
St. Francis (BKN),Coastal Carolina,18,19,8,29,0,Warren Gillis missed Layup.
St. Francis (BKN),Coastal Carolina,18,19,8,29,0,Wayne Martin Defensive Rebound.
St. Francis (BKN),Coastal Carolina,18,19,8,46,0,Yunus Hopkinson missed Three Point Jumper.
St. Francis (BKN),Coastal Carolina,18,19,8,46,0,Michel Enanga Defensive Rebound.
St. Francis (BKN),Coastal Carolina,18,19,8,51,0,Foul on Yunus Hopkinson.
St. Francis (BKN),Coastal Carolina,18,19,8,51,0,Official TV Timeout
St. Francis (BKN),Coastal Carolina,18,19,8,55,0,Colton Ray-St Cyr Turnover.
St. Francis (BKN),Coastal Carolina,18,19,9,22,0,Jalen Cannon Turnover.
St. Francis (BKN),Coastal Carolina,18,19,9,24,0,El Hadji Ndieguene Steal.
St. Francis (BKN),Coastal Carolina,18,21,9,40,1,Josh Cameron made Layup.
St. Francis (BKN),Coastal Carolina,18,21,9,56,0,P.J. Santavenere missed Three Point Jumper.
St. Francis (BKN),Coastal Carolina,18,21,9,56,0,El Hadji Ndieguene Defensive Rebound.
St. Francis (BKN),Coastal Carolina,18,23,10,10,1,Warren Gillis made Layup. Assisted by Josh Cameron.
St. Francis (BKN),Coastal Carolina,18,23,10,47,0,Wayne Martin missed Layup.
St. Francis (BKN),Coastal Carolina,18,23,10,47,0,Jalen Cannon Offensive Rebound.
St. Francis (BKN),Coastal Carolina,20,23,10,49,1,Jalen Cannon made Layup.
St. Francis (BKN),Coastal Carolina,20,23,11,9,0,Warren Gillis Turnover.
St. Francis (BKN),Coastal Carolina,20,23,11,10,0,Wayne Martin Steal.
St. Francis (BKN),Coastal Carolina,23,23,11,14,1,Brent Jones made Three Point Jumper.
St. Francis (BKN),Coastal Carolina,23,23,11,55,0,Eric Smith missed Layup.
St. Francis (BKN),Coastal Carolina,23,23,11,55,0,Brent Jones Defensive Rebound.
St. Francis (BKN),Coastal Carolina,23,23,12,4,0,Amdy Fall missed Layup.
St. Francis (BKN),Coastal Carolina,23,23,12,4,0,Michel Enanga Defensive Rebound.
St. Francis (BKN),Coastal Carolina,23,23,12,5,0,Official TV Timeout
St. Francis (BKN),Coastal Carolina,23,23,12,22,0,Elijah Wilson Turnover.
St. Francis (BKN),Coastal Carolina,23,23,12,50,0,Jalen Cannon missed Layup.
St. Francis (BKN),Coastal Carolina,23,23,12,50,0,Warren Gillis Defensive Rebound.
St. Francis (BKN),Coastal Carolina,23,23,13,20,0,Eric Smith Turnover.
St. Francis (BKN),Coastal Carolina,23,23,13,21,0,Ben Mockford Steal.
St. Francis (BKN),Coastal Carolina,23,23,13,24,0,Brent Jones Turnover.
St. Francis (BKN),Coastal Carolina,23,25,13,44,1,El Hadji Ndieguene made Jumper.
St. Francis (BKN),Coastal Carolina,25,25,13,57,1,Jalen Cannon made Jumper.
St. Francis (BKN),Coastal Carolina,25,25,14,20,0,Warren Gillis missed Layup.
St. Francis (BKN),Coastal Carolina,25,25,14,20,0,P.J. Santavenere Defensive Rebound.
St. Francis (BKN),Coastal Carolina,25,25,14,20,0,Foul on El Hadji Ndieguene.
St. Francis (BKN),Coastal Carolina,28,25,14,43,1,P.J. Santavenere made Three Point Jumper. Assisted by Amdy Fall.
St. Francis (BKN),Coastal Carolina,28,25,15,5,0,Elijah Wilson missed Three Point Jumper.
St. Francis (BKN),Coastal Carolina,28,25,15,5,0,Brent Jones Defensive Rebound.
St. Francis (BKN),Coastal Carolina,28,25,15,12,0,Foul on Elijah Wilson.
St. Francis (BKN),Coastal Carolina,28,25,15,32,0,P.J. Santavenere missed Three Point Jumper.
St. Francis (BKN),Coastal Carolina,28,25,15,32,0,Uros Ljeskovic Defensive Rebound.
St. Francis (BKN),Coastal Carolina,28,25,15,44,0,Josh Cameron missed Three Point Jumper.
St. Francis (BKN),Coastal Carolina,28,25,15,44,0,P.J. Santavenere Defensive Rebound.
St. Francis (BKN),Coastal Carolina,28,25,15,59,0,Wayne Martin Turnover.
St. Francis (BKN),Coastal Carolina,28,25,16,9,0,Josh Cameron missed Layup.
St. Francis (BKN),Coastal Carolina,28,25,16,9,0,Amdy Fall Block.
St. Francis (BKN),Coastal Carolina,28,25,16,9,0,Coastal Carolina Offensive Rebound.
St. Francis (BKN),Coastal Carolina,28,25,16,9,0,Official TV Timeout
St. Francis (BKN),Coastal Carolina,28,27,16,26,1,Warren Gillis made Layup. Assisted by Josh Cameron.
St. Francis (BKN),Coastal Carolina,28,27,16,36,0,Wayne Martin missed Layup.
St. Francis (BKN),Coastal Carolina,28,27,16,36,0,Wayne Martin Offensive Rebound.
St. Francis (BKN),Coastal Carolina,28,27,16,39,0,Foul on Uros Ljeskovic.
St. Francis (BKN),Coastal Carolina,28,27,17,0,0,Anthony White missed Three Point Jumper.
St. Francis (BKN),Coastal Carolina,28,27,17,0,0,Colton Ray-St Cyr Defensive Rebound.
St. Francis (BKN),Coastal Carolina,28,27,17,11,0,Michel Enanga missed Three Point Jumper.
St. Francis (BKN),Coastal Carolina,28,27,17,11,0,Sheldon Hagigal Defensive Rebound.
St. Francis (BKN),Coastal Carolina,28,27,17,25,0,Sheldon Hagigal missed Three Point Jumper.
St. Francis (BKN),Coastal Carolina,28,27,17,25,0,Coastal Carolina Defensive Rebound.
St. Francis (BKN),Coastal Carolina,28,29,17,40,1,Warren Gillis made Layup. Assisted by Michel Enanga.
St. Francis (BKN),Coastal Carolina,28,29,18,3,0,Aleksandar Isailovic missed Jumper.
St. Francis (BKN),Coastal Carolina,28,29,18,3,0,Colton Ray-St Cyr Block.
St. Francis (BKN),Coastal Carolina,28,29,18,5,0,Colton Ray-St Cyr Defensive Rebound.
St. Francis (BKN),Coastal Carolina,28,31,18,10,1,Colton Ray-St Cyr made Layup.
St. Francis (BKN),Coastal Carolina,28,31,18,10,0,Foul on Aleksandar Isailovic.
St. Francis (BKN),Coastal Carolina,28,32,18,10,1,Colton Ray-St Cyr made Free Throw.
St. Francis (BKN),Coastal Carolina,28,32,18,45,0,Anthony White missed Three Point Jumper.
St. Francis (BKN),Coastal Carolina,28,32,18,45,0,Colton Ray-St Cyr Defensive Rebound.
St. Francis (BKN),Coastal Carolina,28,32,19,0,0,Uros Ljeskovic missed Layup.
St. Francis (BKN),Coastal Carolina,28,32,19,0,0,Anthony White Block.
St. Francis (BKN),Coastal Carolina,28,32,19,1,0,Uros Ljeskovic Offensive Rebound.
St. Francis (BKN),Coastal Carolina,28,32,19,1,0,Foul on Ben Mockford.
St. Francis (BKN),Coastal Carolina,28,32,19,1,0,Uros Ljeskovic missed Free Throw.
St. Francis (BKN),Coastal Carolina,28,32,19,1,0,Coastal Carolina Deadball Team Rebound.
St. Francis (BKN),Coastal Carolina,28,32,19,1,0,Uros Ljeskovic missed Free Throw.
St. Francis (BKN),Coastal Carolina,28,32,19,1,0,Kevin Douglas Defensive Rebound.
St. Francis (BKN),Coastal Carolina,28,32,19,9,0,Foul on Badou Diagne.
St. Francis (BKN),Coastal Carolina,28,32,19,34,0,Anthony White missed Jumper.
St. Francis (BKN),Coastal Carolina,28,32,19,34,0,Uros Ljeskovic Defensive Rebound.
St. Francis (BKN),Coastal Carolina,28,32,19,43,0,Coastal Carolina  Timeout
St. Francis (BKN),Coastal Carolina,28,32,20,0,0,Badou Diagne missed Layup.
St. Francis (BKN),Coastal Carolina,28,32,20,0,0,Anthony White Defensive Rebound.
St. Francis (BKN),Coastal Carolina,28,32,20,0,0,End of 1st half
St. Francis (BKN),Coastal Carolina,30,32,20,29,1,Brent Jones made Jumper.
St. Francis (BKN),Coastal Carolina,30,32,20,51,0,El Hadji Ndieguene missed Layup.
St. Francis (BKN),Coastal Carolina,30,32,20,51,0,Ben Mockford Defensive Rebound.
St. Francis (BKN),Coastal Carolina,30,32,21,2,0,Brent Jones Turnover.
St. Francis (BKN),Coastal Carolina,30,32,21,3,0,Warren Gillis Steal.
St. Francis (BKN),Coastal Carolina,30,32,21,5,0,Foul on Ben Mockford.
St. Francis (BKN),Coastal Carolina,30,33,21,5,1,Warren Gillis made Free Throw.
St. Francis (BKN),Coastal Carolina,30,34,21,5,1,Warren Gillis made Free Throw.
St. Francis (BKN),Coastal Carolina,30,34,21,16,0,Ben Mockford missed Three Point Jumper.
St. Francis (BKN),Coastal Carolina,30,34,21,16,0,Elijah Wilson Defensive Rebound.
St. Francis (BKN),Coastal Carolina,30,36,21,23,1,El Hadji Ndieguene made Dunk. Assisted by Elijah Wilson.
St. Francis (BKN),Coastal Carolina,30,36,21,48,0,Foul on El Hadji Ndieguene.
St. Francis (BKN),Coastal Carolina,30,36,21,53,0,Foul on Michel Enanga.
St. Francis (BKN),Coastal Carolina,32,36,21,55,1,Anthony White made Layup. Assisted by Brent Jones.
St. Francis (BKN),Coastal Carolina,32,36,22,17,0,Foul on Elijah Wilson.
St. Francis (BKN),Coastal Carolina,32,36,22,17,0,Elijah Wilson Turnover.
St. Francis (BKN),Coastal Carolina,32,36,22,36,0,Amdy Fall missed Layup.
St. Francis (BKN),Coastal Carolina,32,36,22,36,0,El Hadji Ndieguene Defensive Rebound.
St. Francis (BKN),Coastal Carolina,32,36,22,43,0,Eric Smith missed Layup.
St. Francis (BKN),Coastal Carolina,32,36,22,43,0,Amdy Fall Block.
St. Francis (BKN),Coastal Carolina,32,36,22,43,0,Coastal Carolina Offensive Rebound.
St. Francis (BKN),Coastal Carolina,32,36,22,54,0,El Hadji Ndieguene missed Jumper.
St. Francis (BKN),Coastal Carolina,32,36,22,54,0,Anthony White Defensive Rebound.
St. Francis (BKN),Coastal Carolina,32,36,22,59,0,Foul on Warren Gillis.
St. Francis (BKN),Coastal Carolina,32,36,23,21,0,Brent Jones missed Jumper.
St. Francis (BKN),Coastal Carolina,32,36,23,21,0,Elijah Wilson Defensive Rebound.
St. Francis (BKN),Coastal Carolina,32,36,23,31,0,Elijah Wilson missed Three Point Jumper.
St. Francis (BKN),Coastal Carolina,32,36,23,31,0,Eric Smith Offensive Rebound.
St. Francis (BKN),Coastal Carolina,32,36,23,43,0,Coastal Carolina  Timeout
St. Francis (BKN),Coastal Carolina,32,38,24,3,1,El Hadji Ndieguene made Layup.
St. Francis (BKN),Coastal Carolina,32,38,24,13,0,Ben Mockford missed Three Point Jumper.
St. Francis (BKN),Coastal Carolina,32,38,24,13,0,El Hadji Ndieguene Defensive Rebound.
St. Francis (BKN),Coastal Carolina,32,38,24,30,0,El Hadji Ndieguene missed Jumper.
St. Francis (BKN),Coastal Carolina,32,38,24,30,0,Anthony White Defensive Rebound.
St. Francis (BKN),Coastal Carolina,32,38,24,39,0,Anthony White missed Layup.
St. Francis (BKN),Coastal Carolina,32,38,24,39,0,Michel Enanga Block.
St. Francis (BKN),Coastal Carolina,32,38,24,40,0,El Hadji Ndieguene Defensive Rebound.
St. Francis (BKN),Coastal Carolina,32,38,24,43,0,Official TV Timeout
St. Francis (BKN),Coastal Carolina,32,38,24,43,0,Foul on Kevin Douglas.
St. Francis (BKN),Coastal Carolina,32,38,24,51,0,Josh Cameron missed Jumper.
St. Francis (BKN),Coastal Carolina,32,38,24,51,0,Kevin Douglas Defensive Rebound.
St. Francis (BKN),Coastal Carolina,32,38,25,11,0,Kevin Douglas missed Three Point Jumper.
St. Francis (BKN),Coastal Carolina,32,38,25,11,0,Michel Enanga Defensive Rebound.
St. Francis (BKN),Coastal Carolina,32,38,25,19,0,Josh Cameron Turnover.
St. Francis (BKN),Coastal Carolina,32,38,25,19,0,Brent Jones Steal.
St. Francis (BKN),Coastal Carolina,34,38,25,23,1,Brent Jones made Layup.
St. Francis (BKN),Coastal Carolina,34,40,25,44,1,Michel Enanga made Layup.
St. Francis (BKN),Coastal Carolina,34,40,25,44,0,Foul on Wayne Martin.
St. Francis (BKN),Coastal Carolina,34,41,25,44,1,Michel Enanga made Free Throw.
St. Francis (BKN),Coastal Carolina,34,41,26,5,0,Foul on Michel Enanga.
St. Francis (BKN),Coastal Carolina,34,41,26,30,0,Wayne Martin Turnover.
St. Francis (BKN),Coastal Carolina,34,41,26,31,0,Warren Gillis Steal.
St. Francis (BKN),Coastal Carolina,34,41,26,37,0,Warren Gillis missed Layup.
St. Francis (BKN),Coastal Carolina,34,41,26,37,0,El Hadji Ndieguene Offensive Rebound.
St. Francis (BKN),Coastal Carolina,34,41,26,39,0,Foul on P.J. Santavenere.
St. Francis (BKN),Coastal Carolina,34,43,26,40,1,Colton Ray-St Cyr made Layup. Assisted by Warren Gillis.
St. Francis (BKN),Coastal Carolina,34,43,26,52,0,Foul on Josh Cameron.
St. Francis (BKN),Coastal Carolina,36,43,27,3,1,Kevin Douglas made Layup.
St. Francis (BKN),Coastal Carolina,36,43,27,24,0,Tristian Curtis missed Jumper.
St. Francis (BKN),Coastal Carolina,36,43,27,24,0,Brent Jones Defensive Rebound.
St. Francis (BKN),Coastal Carolina,36,43,27,41,0,P.J. Santavenere missed Layup.
St. Francis (BKN),Coastal Carolina,36,43,27,41,0,Tristian Curtis Defensive Rebound.
St. Francis (BKN),Coastal Carolina,36,43,27,49,0,Foul on Brent Jones.
St. Francis (BKN),Coastal Carolina,36,44,27,49,1,Josh Cameron made Free Throw.
St. Francis (BKN),Coastal Carolina,36,44,27,49,0,Josh Cameron missed Free Throw.
St. Francis (BKN),Coastal Carolina,36,44,27,49,0,Tristian Curtis Offensive Rebound.
St. Francis (BKN),Coastal Carolina,36,44,27,49,0,Foul on Kevin Douglas.
St. Francis (BKN),Coastal Carolina,36,44,27,49,0,Tristian Curtis missed Free Throw.
St. Francis (BKN),Coastal Carolina,36,44,27,49,0,Coastal Carolina Deadball Team Rebound.
St. Francis (BKN),Coastal Carolina,36,45,27,49,1,Tristian Curtis made Free Throw.
St. Francis (BKN),Coastal Carolina,36,45,28,14,0,Matt Milk missed Layup.
St. Francis (BKN),Coastal Carolina,36,45,28,14,0,Tristian Curtis Defensive Rebound.
St. Francis (BKN),Coastal Carolina,36,45,28,27,0,Uros Ljeskovic Turnover.
St. Francis (BKN),Coastal Carolina,36,45,28,27,0,Official TV Timeout
St. Francis (BKN),Coastal Carolina,36,45,28,39,0,Kevin Douglas missed Layup.
St. Francis (BKN),Coastal Carolina,36,45,28,39,0,Matt Milk Offensive Rebound.
St. Francis (BKN),Coastal Carolina,36,45,28,42,0,P.J. Santavenere missed Three Point Jumper.
St. Francis (BKN),Coastal Carolina,36,45,28,42,0,Colton Ray-St Cyr Defensive Rebound.
St. Francis (BKN),Coastal Carolina,36,45,28,56,0,Tristian Curtis missed Layup.
St. Francis (BKN),Coastal Carolina,36,45,28,56,0,Anthony White Block.
St. Francis (BKN),Coastal Carolina,36,45,28,59,0,P.J. Santavenere Defensive Rebound.
St. Francis (BKN),Coastal Carolina,38,45,29,22,1,P.J. Santavenere made Jumper.
St. Francis (BKN),Coastal Carolina,38,45,29,39,0,Tristian Curtis Turnover.
St. Francis (BKN),Coastal Carolina,38,45,30,2,0,Kevin Douglas missed Jumper.
St. Francis (BKN),Coastal Carolina,38,45,30,2,0,Elijah Wilson Defensive Rebound.
St. Francis (BKN),Coastal Carolina,38,45,30,16,0,Elijah Wilson missed Three Point Jumper.
St. Francis (BKN),Coastal Carolina,38,45,30,16,0,Ben Mockford Defensive Rebound.
St. Francis (BKN),Coastal Carolina,38,45,30,22,0,Foul on Colton Ray-St Cyr.
St. Francis (BKN),Coastal Carolina,38,45,30,22,0,Ben Mockford missed Free Throw.
St. Francis (BKN),Coastal Carolina,38,45,30,22,0,St. Francis (BKN) Deadball Team Rebound.
St. Francis (BKN),Coastal Carolina,39,45,30,22,1,Ben Mockford made Free Throw.
St. Francis (BKN),Coastal Carolina,40,45,30,22,1,Ben Mockford made Free Throw.
St. Francis (BKN),Coastal Carolina,40,45,30,27,0,Foul on Anthony White.
St. Francis (BKN),Coastal Carolina,40,46,30,27,1,Josh Cameron made Free Throw.
St. Francis (BKN),Coastal Carolina,40,46,30,27,0,Josh Cameron missed Free Throw.
St. Francis (BKN),Coastal Carolina,40,46,30,27,0,Coastal Carolina Deadball Team Rebound.
St. Francis (BKN),Coastal Carolina,40,46,31,21,0,Anthony White missed Jumper.
St. Francis (BKN),Coastal Carolina,40,46,31,21,0,Wayne Martin Offensive Rebound.
St. Francis (BKN),Coastal Carolina,40,46,31,21,0,Ben Mockford missed Jumper.
St. Francis (BKN),Coastal Carolina,40,46,31,21,0,P.J. Santavenere Offensive Rebound.
St. Francis (BKN),Coastal Carolina,42,46,31,21,1,Anthony White made Layup. Assisted by Wayne Martin.
St. Francis (BKN),Coastal Carolina,42,46,32,1,0,Foul on Wayne Martin.
St. Francis (BKN),Coastal Carolina,42,47,32,1,1,El Hadji Ndieguene made Free Throw.
St. Francis (BKN),Coastal Carolina,42,48,32,1,1,El Hadji Ndieguene made Free Throw.
St. Francis (BKN),Coastal Carolina,42,48,32,29,0,Anthony White missed Three Point Jumper.
St. Francis (BKN),Coastal Carolina,42,48,32,29,0,El Hadji Ndieguene Defensive Rebound.
St. Francis (BKN),Coastal Carolina,42,48,32,55,0,Elijah Wilson missed Layup.
St. Francis (BKN),Coastal Carolina,42,48,32,55,0,Anthony White Block.
St. Francis (BKN),Coastal Carolina,42,48,32,57,0,El Hadji Ndieguene Offensive Rebound.
St. Francis (BKN),Coastal Carolina,42,48,32,58,0,Foul on Anthony White.
St. Francis (BKN),Coastal Carolina,42,49,32,58,1,Warren Gillis made Free Throw.
St. Francis (BKN),Coastal Carolina,42,50,32,58,1,Warren Gillis made Free Throw.
St. Francis (BKN),Coastal Carolina,42,50,33,22,0,P.J. Santavenere missed Three Point Jumper.
St. Francis (BKN),Coastal Carolina,42,50,33,22,0,El Hadji Ndieguene Defensive Rebound.
St. Francis (BKN),Coastal Carolina,42,50,33,38,0,Josh Cameron Turnover.
St. Francis (BKN),Coastal Carolina,42,50,33,39,0,Anthony White Steal.
St. Francis (BKN),Coastal Carolina,42,50,33,46,0,Anthony White Turnover.
St. Francis (BKN),Coastal Carolina,42,50,33,46,0,Warren Gillis Steal.
St. Francis (BKN),Coastal Carolina,42,50,33,46,0,Coastal Carolina  Timeout
St. Francis (BKN),Coastal Carolina,42,50,34,8,0,Foul on Anthony White.
St. Francis (BKN),Coastal Carolina,42,51,34,8,1,Elijah Wilson made Free Throw.
St. Francis (BKN),Coastal Carolina,42,52,34,8,1,Elijah Wilson made Free Throw.
St. Francis (BKN),Coastal Carolina,42,52,34,19,0,Wayne Martin missed Layup.
St. Francis (BKN),Coastal Carolina,42,52,34,19,0,Wayne Martin Offensive Rebound.
St. Francis (BKN),Coastal Carolina,42,52,34,21,0,Foul on Warren Gillis.
St. Francis (BKN),Coastal Carolina,43,52,34,24,1,Wayne Martin made Free Throw.
St. Francis (BKN),Coastal Carolina,44,52,34,24,1,Wayne Martin made Free Throw.
St. Francis (BKN),Coastal Carolina,44,52,34,35,0,Josh Cameron missed Layup.
St. Francis (BKN),Coastal Carolina,44,52,34,35,0,Coastal Carolina Offensive Rebound.
St. Francis (BKN),Coastal Carolina,44,52,34,37,0,Elijah Wilson missed Three Point Jumper.
St. Francis (BKN),Coastal Carolina,44,52,34,37,0,Michel Enanga Offensive Rebound.
St. Francis (BKN),Coastal Carolina,44,52,34,40,0,Foul on Jalen Cannon.
St. Francis (BKN),Coastal Carolina,44,53,34,40,1,Michel Enanga made Free Throw.
St. Francis (BKN),Coastal Carolina,44,53,34,40,0,Michel Enanga missed Free Throw.
St. Francis (BKN),Coastal Carolina,44,53,34,40,0,Wayne Martin Defensive Rebound.
St. Francis (BKN),Coastal Carolina,46,53,34,57,1,Jalen Cannon made Jumper.
St. Francis (BKN),Coastal Carolina,46,55,35,17,1,Warren Gillis made Layup.
St. Francis (BKN),Coastal Carolina,46,55,35,17,0,Foul on Brent Jones.
St. Francis (BKN),Coastal Carolina,46,56,35,17,1,Warren Gillis made Free Throw.
St. Francis (BKN),Coastal Carolina,46,56,35,20,0,Brent Jones Turnover.
St. Francis (BKN),Coastal Carolina,46,56,35,20,0,St. Francis (BKN)  Timeout
St. Francis (BKN),Coastal Carolina,46,56,35,31,0,El Hadji Ndieguene missed Jumper.
St. Francis (BKN),Coastal Carolina,46,56,35,31,0,Coastal Carolina Offensive Rebound.
St. Francis (BKN),Coastal Carolina,46,56,35,31,0,Foul on P.J. Santavenere.
St. Francis (BKN),Coastal Carolina,46,57,35,31,1,Elijah Wilson made Free Throw.
St. Francis (BKN),Coastal Carolina,46,58,35,31,1,Elijah Wilson made Free Throw.
St. Francis (BKN),Coastal Carolina,46,58,35,35,0,Jalen Cannon missed Three Point Jumper.
St. Francis (BKN),Coastal Carolina,46,58,35,35,0,El Hadji Ndieguene Defensive Rebound.
St. Francis (BKN),Coastal Carolina,46,58,35,50,0,Eric Smith missed Layup.
St. Francis (BKN),Coastal Carolina,46,58,35,50,0,Amdy Fall Defensive Rebound.
St. Francis (BKN),Coastal Carolina,46,58,35,58,0,Foul on Elijah Wilson.
St. Francis (BKN),Coastal Carolina,47,58,35,58,1,P.J. Santavenere made Free Throw.
St. Francis (BKN),Coastal Carolina,48,58,35,58,1,P.J. Santavenere made Free Throw.
St. Francis (BKN),Coastal Carolina,48,58,35,58,0,P.J. Santavenere missed Free Throw.
St. Francis (BKN),Coastal Carolina,48,58,35,58,0,El Hadji Ndieguene Defensive Rebound.
St. Francis (BKN),Coastal Carolina,48,61,36,23,1,Michel Enanga made Three Point Jumper. Assisted by Colton Ray-St Cyr.
St. Francis (BKN),Coastal Carolina,48,61,36,31,0,Foul on Michel Enanga.
St. Francis (BKN),Coastal Carolina,48,61,36,31,0,Official TV Timeout
St. Francis (BKN),Coastal Carolina,49,61,36,31,1,Amdy Fall made Free Throw.
St. Francis (BKN),Coastal Carolina,50,61,36,31,1,Amdy Fall made Free Throw.
St. Francis (BKN),Coastal Carolina,50,61,36,44,0,Warren Gillis Turnover.
St. Francis (BKN),Coastal Carolina,50,61,36,54,0,Foul on El Hadji Ndieguene.
St. Francis (BKN),Coastal Carolina,50,61,36,54,0,Jalen Cannon missed Free Throw.
St. Francis (BKN),Coastal Carolina,50,61,36,54,0,St. Francis (BKN) Deadball Team Rebound.
St. Francis (BKN),Coastal Carolina,51,61,36,54,1,Jalen Cannon made Free Throw.
St. Francis (BKN),Coastal Carolina,51,63,37,15,1,Michel Enanga made Layup. Assisted by Warren Gillis.
St. Francis (BKN),Coastal Carolina,51,63,37,29,0,P.J. Santavenere missed Three Point Jumper.
St. Francis (BKN),Coastal Carolina,51,63,37,29,0,Michel Enanga Defensive Rebound.
St. Francis (BKN),Coastal Carolina,51,63,37,43,0,Michel Enanga Turnover.
St. Francis (BKN),Coastal Carolina,51,63,37,48,0,P.J. Santavenere missed Three Point Jumper.
St. Francis (BKN),Coastal Carolina,51,63,37,48,0,Jalen Cannon Offensive Rebound.
St. Francis (BKN),Coastal Carolina,53,63,37,51,1,Jalen Cannon made Layup.
St. Francis (BKN),Coastal Carolina,53,63,37,51,0,St. Francis (BKN)  Timeout
St. Francis (BKN),Coastal Carolina,53,63,38,15,0,Foul on P.J. Santavenere.
