Away Team,Home Team,Away Score,Home Score,Minute,Second,isScoringPosession,Desc.
St. Francis (BKN),Coastal Carolina,53,64,38,15,1,Elijah Wilson made Free Throw.
St. Francis (BKN),Coastal Carolina,53,65,38,15,1,Elijah Wilson made Free Throw.
St. Francis (BKN),Coastal Carolina,53,65,38,19,0,Brent Jones Turnover.
St. Francis (BKN),Coastal Carolina,53,65,38,19,0,St. Francis (BKN)  Timeout
St. Francis (BKN),Coastal Carolina,53,65,38,22,0,Michel Enanga missed Layup.
St. Francis (BKN),Coastal Carolina,53,65,38,22,0,Ben Mockford Defensive Rebound.
St. Francis (BKN),Coastal Carolina,53,65,38,35,0,Anthony White missed Three Point Jumper.
St. Francis (BKN),Coastal Carolina,53,65,38,35,0,P.J. Santavenere Offensive Rebound.
St. Francis (BKN),Coastal Carolina,55,65,38,41,1,Anthony White made Layup. Assisted by P.J. Santavenere.
St. Francis (BKN),Coastal Carolina,55,65,38,43,0,St. Francis (BKN)  Timeout
St. Francis (BKN),Coastal Carolina,55,65,38,52,0,El Hadji Ndieguene missed Layup.
St. Francis (BKN),Coastal Carolina,55,65,38,52,0,Amdy Fall Defensive Rebound.
St. Francis (BKN),Coastal Carolina,55,65,38,57,0,P.J. Santavenere missed Three Point Jumper.
St. Francis (BKN),Coastal Carolina,55,65,38,57,0,El Hadji Ndieguene Defensive Rebound.
St. Francis (BKN),Coastal Carolina,55,65,39,8,0,Foul on Ben Mockford.
St. Francis (BKN),Coastal Carolina,55,66,39,9,1,Josh Cameron made Free Throw.
St. Francis (BKN),Coastal Carolina,55,66,39,9,0,Josh Cameron missed Free Throw.
St. Francis (BKN),Coastal Carolina,55,66,39,9,0,Jalen Cannon Defensive Rebound.
St. Francis (BKN),Coastal Carolina,55,66,39,15,0,Ben Mockford missed Three Point Jumper.
St. Francis (BKN),Coastal Carolina,55,66,39,15,0,El Hadji Ndieguene Defensive Rebound.
St. Francis (BKN),Coastal Carolina,55,66,39,22,0,Foul on Ben Mockford.
St. Francis (BKN),Coastal Carolina,55,67,39,22,1,Josh Cameron made Free Throw.
St. Francis (BKN),Coastal Carolina,55,68,39,22,1,Josh Cameron made Free Throw.
St. Francis (BKN),Coastal Carolina,55,68,39,28,0,Anthony White missed Three Point Jumper.
St. Francis (BKN),Coastal Carolina,55,68,39,28,0,Amdy Fall Offensive Rebound.
St. Francis (BKN),Coastal Carolina,57,68,39,33,1,Amdy Fall made Layup.
St. Francis (BKN),Coastal Carolina,57,68,39,35,0,Foul on P.J. Santavenere.
St. Francis (BKN),Coastal Carolina,57,69,39,35,1,Josh Cameron made Free Throw.
St. Francis (BKN),Coastal Carolina,57,69,39,43,0,Edon Molic missed Three Point Jumper.
St. Francis (BKN),Coastal Carolina,57,69,39,43,0,St. Francis (BKN) Offensive Rebound.
St. Francis (BKN),Coastal Carolina,59,69,39,50,1,P.J. Santavenere made Layup.
St. Francis (BKN),Coastal Carolina,59,70,40,0,1,Josh Cameron made Free Throw.
St. Francis (BKN),Coastal Carolina,59,70,40,0,0,End of Game
