Away Team,Home Team,Away Score,Home Score,Minute,Second,isScoringPosession,Desc.
Northern Arizona,Washington State,59,76,34,0,0,Josh Hawkinson Defensive Rebound.
Northern Arizona,Washington State,59,76,34,5,0,Que Johnson missed Layup.
Northern Arizona,Washington State,59,76,34,5,0,Torry Johnson Defensive Rebound.
Northern Arizona,Washington State,59,76,34,16,0,Ako Kaluna missed Layup.
Northern Arizona,Washington State,59,76,34,16,0,Valentine Izundu Block.
Northern Arizona,Washington State,59,76,34,18,0,Ny Redding Defensive Rebound.
Northern Arizona,Washington State,59,78,34,27,1,Valentine Izundu made Dunk. Assisted by Ny Redding.
Northern Arizona,Washington State,59,78,34,55,0,Ako Kaluna missed Jumper.
Northern Arizona,Washington State,59,78,34,55,0,Josh Hawkinson Defensive Rebound.
Northern Arizona,Washington State,59,78,35,5,0,Que Johnson missed Three Point Jumper.
Northern Arizona,Washington State,59,78,35,5,0,Torry Johnson Defensive Rebound.
Northern Arizona,Washington State,59,78,35,11,0,Kris Yanku missed Jumper.
Northern Arizona,Washington State,59,78,35,11,0,Josh Hawkinson Defensive Rebound.
Northern Arizona,Washington State,59,78,35,35,0,Foul on Ako Kaluna.
Northern Arizona,Washington State,59,78,35,41,0,Conor Clifford missed Layup.
Northern Arizona,Washington State,59,78,35,41,0,Ako Kaluna Defensive Rebound.
Northern Arizona,Washington State,61,78,35,57,1,Jordyn Martin made Layup. Assisted by Mike Green.
Northern Arizona,Washington State,61,78,36,24,0,Josh Hawkinson missed Three Point Jumper.
Northern Arizona,Washington State,61,78,36,24,0,Conor Clifford Offensive Rebound.
Northern Arizona,Washington State,61,80,36,28,1,Conor Clifford made Layup.
Northern Arizona,Washington State,61,80,36,35,0,Marcus DeBerry Turnover.
Northern Arizona,Washington State,61,80,36,35,0,Official TV Timeout
Northern Arizona,Washington State,61,80,36,55,0,Conor Clifford missed Layup.
Northern Arizona,Washington State,61,80,36,55,0,Mike Green Defensive Rebound.
Northern Arizona,Washington State,63,80,37,13,1,Jordyn Martin made Layup. Assisted by Mike Green.
Northern Arizona,Washington State,63,80,37,26,0,Charles Callison missed Three Point Jumper.
Northern Arizona,Washington State,63,80,37,26,0,Renard Suggs Offensive Rebound.
Northern Arizona,Washington State,63,82,37,31,1,Renard Suggs made Layup.
Northern Arizona,Washington State,63,82,37,56,0,Mike Green missed Layup.
Northern Arizona,Washington State,63,82,37,56,0,Conor Clifford Defensive Rebound.
Northern Arizona,Washington State,63,82,38,2,0,Charles Callison Turnover.
Northern Arizona,Washington State,63,82,38,3,0,Jordyn Martin Steal.
Northern Arizona,Washington State,65,82,38,6,1,Mike Green made Jumper.
Northern Arizona,Washington State,65,82,38,14,0,Washington St  Timeout
Northern Arizona,Washington State,65,82,38,28,0,Charles Callison missed Jumper.
Northern Arizona,Washington State,65,82,38,28,0,Ako Kaluna Defensive Rebound.
Northern Arizona,Washington State,65,82,38,45,0,Ako Kaluna missed Three Point Jumper.
Northern Arizona,Washington State,65,82,38,45,0,Mike Green Offensive Rebound.
Northern Arizona,Washington State,68,82,38,50,1,Mike Green made Three Point Jumper.
Northern Arizona,Washington State,68,82,39,22,0,Conor Clifford missed Jumper.
Northern Arizona,Washington State,68,82,39,22,0,Ako Kaluna Defensive Rebound.
Northern Arizona,Washington State,68,82,39,31,0,Jaleni Neely missed Three Point Jumper.
Northern Arizona,Washington State,68,82,39,31,0,Ako Kaluna Offensive Rebound.
Northern Arizona,Washington State,68,82,39,56,0,Mike Green missed Jumper.
Northern Arizona,Washington State,68,82,39,56,0,Torry Johnson Offensive Rebound.
Northern Arizona,Washington State,68,82,39,58,0,Torry Johnson missed Layup.
Northern Arizona,Washington State,68,82,39,58,0,Torry Johnson Offensive Rebound.
Northern Arizona,Washington State,70,82,39,59,1,Torry Johnson made Layup.
Northern Arizona,Washington State,70,82,40,0,0,End of Game
