Away Team,Home Team,Away Score,Home Score,Minute,Second,isScoringPosession,Desc.
Northern Arizona,Washington State,0,0,0,17,0,Que Johnson missed Jumper.
Northern Arizona,Washington State,0,0,0,17,0,Torry Johnson Defensive Rebound.
Northern Arizona,Washington State,0,0,0,33,0,Foul on Josh Hawkinson.
Northern Arizona,Washington State,0,0,0,41,0,Torry Johnson Turnover.
Northern Arizona,Washington State,0,0,0,57,0,Ike Iroegbu missed Three Point Jumper.
Northern Arizona,Washington State,0,0,0,57,0,Jaleni Neely Defensive Rebound.
Northern Arizona,Washington State,0,0,1,15,0,Kris Yanku Turnover.
Northern Arizona,Washington State,0,0,1,17,0,Junior Longrus Steal.
Northern Arizona,Washington State,0,2,1,20,1,Que Johnson made Layup. Assisted by Ike Iroegbu.
Northern Arizona,Washington State,0,2,1,38,0,Foul on Ike Iroegbu.
Northern Arizona,Washington State,0,2,1,47,0,Jordyn Martin Turnover.
Northern Arizona,Washington State,0,2,1,49,0,Que Johnson Steal.
Northern Arizona,Washington State,0,2,2,2,0,Que Johnson Turnover.
Northern Arizona,Washington State,0,2,2,4,0,Torry Johnson Steal.
Northern Arizona,Washington State,2,2,2,7,1,Torry Johnson made Layup.
Northern Arizona,Washington State,2,2,2,38,0,Foul on Isaiah Thomas.
Northern Arizona,Washington State,2,3,2,38,1,Josh Hawkinson made Free Throw.
Northern Arizona,Washington State,2,3,2,38,0,Josh Hawkinson missed Free Throw.
Northern Arizona,Washington State,2,3,2,38,0,Viont'e Daniels Offensive Rebound.
Northern Arizona,Washington State,2,3,2,50,0,Josh Hawkinson missed Layup.
Northern Arizona,Washington State,2,3,2,50,0,Ako Kaluna Block.
Northern Arizona,Washington State,2,3,2,52,0,Viont'e Daniels Offensive Rebound.
Northern Arizona,Washington State,2,6,3,0,1,Viont'e Daniels made Three Point Jumper. Assisted by Que Johnson.
Northern Arizona,Washington State,2,6,3,13,0,Jaleni Neely missed Three Point Jumper.
Northern Arizona,Washington State,2,6,3,13,0,Viont'e Daniels Defensive Rebound.
Northern Arizona,Washington State,2,8,3,19,1,Que Johnson made Layup. Assisted by Viont'e Daniels.
Northern Arizona,Washington State,2,8,3,19,0,Foul on Kris Yanku.
Northern Arizona,Washington State,2,9,3,19,1,Que Johnson made Free Throw.
Northern Arizona,Washington State,4,9,3,32,1,Jordyn Martin made Layup.
Northern Arizona,Washington State,4,12,3,45,1,Viont'e Daniels made Three Point Jumper. Assisted by Josh Hawkinson.
Northern Arizona,Washington State,4,12,3,58,0,Jordyn Martin missed Three Point Jumper.
Northern Arizona,Washington State,4,12,3,58,0,Washington St Defensive Rebound.
Northern Arizona,Washington State,4,15,4,19,1,Ny Redding made Three Point Jumper. Assisted by Josh Hawkinson.
Northern Arizona,Washington State,4,15,4,35,0,Torry Johnson Turnover.
Northern Arizona,Washington State,4,15,4,36,0,Junior Longrus Steal.
Northern Arizona,Washington State,4,15,4,40,0,Viont'e Daniels Turnover.
Northern Arizona,Washington State,4,15,4,40,0,Jaleni Neely Steal.
Northern Arizona,Washington State,4,15,4,42,0,Marcus DeBerry missed Jumper.
Northern Arizona,Washington State,4,15,4,42,0,Junior Longrus Block.
Northern Arizona,Washington State,4,15,4,42,0,Northern Arizona Offensive Rebound.
Northern Arizona,Washington State,4,15,4,54,0,Foul on Viont'e Daniels.
Northern Arizona,Washington State,5,15,4,54,1,Jaleni Neely made Free Throw.
Northern Arizona,Washington State,6,15,4,54,1,Jaleni Neely made Free Throw.
Northern Arizona,Washington State,6,17,5,14,1,Renard Suggs made Jumper.
Northern Arizona,Washington State,6,17,5,38,0,Mike Green missed Three Point Jumper.
Northern Arizona,Washington State,6,17,5,38,0,Renard Suggs Defensive Rebound.
Northern Arizona,Washington State,6,19,5,45,1,Josh Hawkinson made Dunk. Assisted by Renard Suggs.
Northern Arizona,Washington State,6,19,6,3,0,Kris Yanku missed Layup.
Northern Arizona,Washington State,6,19,6,3,0,Valentine Izundu Block.
Northern Arizona,Washington State,6,19,6,4,0,Viont'e Daniels Defensive Rebound.
Northern Arizona,Washington State,6,19,6,7,0,Foul on Mike Green.
Northern Arizona,Washington State,6,19,6,7,0,Charles Callison missed Free Throw.
Northern Arizona,Washington State,6,19,6,7,0,Washington St Deadball Team Rebound.
Northern Arizona,Washington State,6,20,6,7,1,Charles Callison made Free Throw.
Northern Arizona,Washington State,6,20,6,18,0,Jordyn Martin Turnover.
Northern Arizona,Washington State,6,20,6,20,0,Charles Callison Steal.
Northern Arizona,Washington State,6,22,6,21,1,Charles Callison made Layup.
Northern Arizona,Washington State,6,22,6,36,0,Jordyn Martin Turnover.
Northern Arizona,Washington State,6,24,6,54,1,Valentine Izundu made Dunk. Assisted by Renard Suggs.
Northern Arizona,Washington State,6,24,7,3,0,Marcus DeBerry missed Jumper.
Northern Arizona,Washington State,6,24,7,3,0,Ako Kaluna Offensive Rebound.
Northern Arizona,Washington State,6,24,7,10,0,Mike Green missed Three Point Jumper.
Northern Arizona,Washington State,6,24,7,10,0,Jordyn Martin Offensive Rebound.
Northern Arizona,Washington State,8,24,7,23,1,Jordyn Martin made Layup. Assisted by Mike Green.
Northern Arizona,Washington State,8,24,7,24,0,Northern Arizona  Timeout
Northern Arizona,Washington State,8,24,7,36,0,Renard Suggs Turnover.
Northern Arizona,Washington State,8,24,7,45,0,Kris Yanku Turnover.
Northern Arizona,Washington State,8,24,7,47,0,Viont'e Daniels Steal.
Northern Arizona,Washington State,8,24,8,8,0,Renard Suggs missed Three Point Jumper.
Northern Arizona,Washington State,8,24,8,8,0,Kris Yanku Defensive Rebound.
Northern Arizona,Washington State,10,24,8,13,1,Torry Johnson made Layup. Assisted by Kris Yanku.
Northern Arizona,Washington State,10,24,8,14,0,Washington St  Timeout
Northern Arizona,Washington State,10,24,8,45,0,Que Johnson missed Three Point Jumper.
Northern Arizona,Washington State,10,24,8,45,0,Torry Johnson Defensive Rebound.
Northern Arizona,Washington State,10,24,9,12,0,Torry Johnson missed Jumper.
Northern Arizona,Washington State,10,24,9,12,0,Josh Hawkinson Defensive Rebound.
Northern Arizona,Washington State,10,24,9,28,0,Josh Hawkinson missed Layup.
Northern Arizona,Washington State,10,24,9,28,0,Junior Longrus Offensive Rebound.
Northern Arizona,Washington State,10,26,9,30,1,Junior Longrus made Layup.
Northern Arizona,Washington State,10,26,9,45,0,Jordyn Martin missed Layup.
Northern Arizona,Washington State,10,26,9,45,0,Josh Hawkinson Defensive Rebound.
Northern Arizona,Washington State,10,26,9,45,0,Foul on Felix Rivera-Vega.
Northern Arizona,Washington State,10,26,9,59,0,Ny Redding Turnover.
Northern Arizona,Washington State,10,26,10,1,0,Torry Johnson Steal.
Northern Arizona,Washington State,12,26,10,3,1,Torry Johnson made Dunk.
Northern Arizona,Washington State,12,26,10,17,0,Foul on Jaleni Neely.
Northern Arizona,Washington State,12,26,10,28,0,Junior Longrus missed Jumper.
Northern Arizona,Washington State,12,26,10,28,0,Kris Yanku Defensive Rebound.
Northern Arizona,Washington State,12,26,10,31,0,Foul on Junior Longrus.
Northern Arizona,Washington State,12,26,10,45,0,Foul on Junior Longrus.
Northern Arizona,Washington State,13,26,10,45,1,Ako Kaluna made Free Throw.
Northern Arizona,Washington State,13,26,10,45,0,Ako Kaluna missed Free Throw.
Northern Arizona,Washington State,13,26,10,45,0,Josh Hawkinson Defensive Rebound.
Northern Arizona,Washington State,13,26,10,59,0,Josh Hawkinson missed Jumper.
Northern Arizona,Washington State,13,26,10,59,0,Northern Arizona Defensive Rebound.
Northern Arizona,Washington State,13,26,10,59,0,Foul on Robert Franks.
Northern Arizona,Washington State,15,26,11,13,1,Ako Kaluna made Jumper.
Northern Arizona,Washington State,15,28,11,21,1,Que Johnson made Jumper.
Northern Arizona,Washington State,15,28,11,21,0,Foul on Torry Johnson.
Northern Arizona,Washington State,15,29,11,21,1,Que Johnson made Free Throw.
Northern Arizona,Washington State,15,29,11,30,0,Kris Yanku missed Three Point Jumper.
Northern Arizona,Washington State,15,29,11,30,0,Junior Searcy Offensive Rebound.
Northern Arizona,Washington State,15,29,11,40,0,Foul on Que Johnson.
Northern Arizona,Washington State,16,29,11,40,1,Kris Yanku made Free Throw.
Northern Arizona,Washington State,17,29,11,40,1,Kris Yanku made Free Throw.
Northern Arizona,Washington State,17,32,11,51,1,Josh Hawkinson made Three Point Jumper. Assisted by Charles Callison.
Northern Arizona,Washington State,17,32,12,15,0,Kris Yanku missed Layup.
Northern Arizona,Washington State,17,32,12,15,0,Josh Hawkinson Block.
Northern Arizona,Washington State,17,32,12,17,0,Josh Hawkinson Defensive Rebound.
Northern Arizona,Washington State,17,32,12,23,0,Foul on Ako Kaluna.
Northern Arizona,Washington State,17,32,12,23,0,Official TV Timeout
Northern Arizona,Washington State,17,32,12,23,0,Que Johnson missed Free Throw.
Northern Arizona,Washington State,17,32,12,23,0,Washington St Deadball Team Rebound.
Northern Arizona,Washington State,17,32,12,23,0,Que Johnson missed Free Throw.
Northern Arizona,Washington State,17,32,12,23,0,Northern Arizona Defensive Rebound.
Northern Arizona,Washington State,19,32,12,33,1,Kris Yanku made Jumper. Assisted by Jaleni Neely.
Northern Arizona,Washington State,19,32,12,55,0,Charles Callison missed Three Point Jumper.
Northern Arizona,Washington State,19,32,12,55,0,Que Johnson Offensive Rebound.
Northern Arizona,Washington State,19,32,13,13,0,Charles Callison missed Jumper.
Northern Arizona,Washington State,19,32,13,13,0,Charles Callison Offensive Rebound.
Northern Arizona,Washington State,19,32,13,15,0,Charles Callison missed Layup.
Northern Arizona,Washington State,19,32,13,15,0,Jordyn Martin Defensive Rebound.
Northern Arizona,Washington State,19,32,13,21,0,Foul on Josh Hawkinson.
Northern Arizona,Washington State,20,32,13,21,1,Kris Yanku made Free Throw.
Northern Arizona,Washington State,21,32,13,21,1,Kris Yanku made Free Throw.
Northern Arizona,Washington State,21,32,13,33,0,Charles Callison missed Three Point Jumper.
Northern Arizona,Washington State,21,32,13,33,0,Torry Johnson Defensive Rebound.
Northern Arizona,Washington State,21,32,13,39,0,Foul on Kris Yanku.
Northern Arizona,Washington State,21,32,13,39,0,Kris Yanku Turnover.
Northern Arizona,Washington State,21,35,14,9,1,Viont'e Daniels made Three Point Jumper. Assisted by Ike Iroegbu.
Northern Arizona,Washington State,21,35,14,12,0,Foul on Conor Clifford.
Northern Arizona,Washington State,22,35,14,12,1,Jaleni Neely made Free Throw.
Northern Arizona,Washington State,22,35,14,12,0,Jaleni Neely missed Free Throw.
Northern Arizona,Washington State,22,35,14,12,0,Northern Arizona Deadball Team Rebound.
Northern Arizona,Washington State,22,35,14,28,0,Torry Johnson missed Jumper.
Northern Arizona,Washington State,22,35,14,28,0,Robert Franks Block.
Northern Arizona,Washington State,22,35,14,30,0,Torry Johnson Offensive Rebound.
Northern Arizona,Washington State,24,35,14,35,1,Jaleni Neely made Layup.
Northern Arizona,Washington State,24,37,14,50,1,Conor Clifford made Layup. Assisted by Ny Redding.
Northern Arizona,Washington State,24,37,15,6,0,Jaleni Neely missed Three Point Jumper.
Northern Arizona,Washington State,24,37,15,6,0,Corey Brown Offensive Rebound.
Northern Arizona,Washington State,24,37,15,15,0,Ike Iroegbu missed Layup.
Northern Arizona,Washington State,24,37,15,15,0,Conor Clifford Offensive Rebound.
Northern Arizona,Washington State,24,37,15,27,0,Ny Redding missed Three Point Jumper.
Northern Arizona,Washington State,24,37,15,27,0,Isaiah Thomas Defensive Rebound.
Northern Arizona,Washington State,24,37,15,35,0,Foul on Conor Clifford.
Northern Arizona,Washington State,25,37,15,35,1,Jordyn Martin made Free Throw.
Northern Arizona,Washington State,26,37,15,35,1,Jordyn Martin made Free Throw.
Northern Arizona,Washington State,26,37,15,50,0,Robert Franks Turnover.
Northern Arizona,Washington State,28,37,16,9,1,Mike Green made Layup.
Northern Arizona,Washington State,28,39,16,15,1,Ike Iroegbu made Layup.
Northern Arizona,Washington State,28,39,16,31,0,Marcus DeBerry missed Layup.
Northern Arizona,Washington State,28,39,16,31,0,Valentine Izundu Block.
Northern Arizona,Washington State,28,39,16,33,0,Robert Franks Defensive Rebound.
Northern Arizona,Washington State,28,39,16,39,0,Ike Iroegbu Turnover.
Northern Arizona,Washington State,28,39,16,39,0,Official TV Timeout
Northern Arizona,Washington State,28,39,16,48,0,Mike Green missed Jumper.
Northern Arizona,Washington State,28,39,16,48,0,Ike Iroegbu Defensive Rebound.
Northern Arizona,Washington State,28,39,17,4,0,Robert Franks missed Three Point Jumper.
Northern Arizona,Washington State,28,39,17,4,0,Washington St Offensive Rebound.
Northern Arizona,Washington State,28,39,17,7,0,Foul on Ako Kaluna.
Northern Arizona,Washington State,28,40,17,7,1,Valentine Izundu made Free Throw.
Northern Arizona,Washington State,28,40,17,7,0,Valentine Izundu missed Free Throw.
Northern Arizona,Washington State,28,40,17,7,0,Brady Twombly Defensive Rebound.
Northern Arizona,Washington State,28,40,17,18,0,Brady Twombly Turnover.
Northern Arizona,Washington State,28,40,17,19,0,Valentine Izundu Steal.
Northern Arizona,Washington State,28,40,17,23,0,Ny Redding missed Layup.
Northern Arizona,Washington State,28,40,17,23,0,Brady Twombly Defensive Rebound.
Northern Arizona,Washington State,28,40,17,28,0,Foul on Ike Iroegbu.
Northern Arizona,Washington State,28,40,17,28,0,Mike Green missed Free Throw.
Northern Arizona,Washington State,28,40,17,28,0,Northern Arizona Deadball Team Rebound.
Northern Arizona,Washington State,29,40,17,28,1,Mike Green made Free Throw.
Northern Arizona,Washington State,29,42,17,45,1,Valentine Izundu made Dunk. Assisted by Renard Suggs.
Northern Arizona,Washington State,29,42,17,57,0,Torry Johnson Turnover.
Northern Arizona,Washington State,29,42,18,26,0,Viont'e Daniels missed Jumper.
Northern Arizona,Washington State,29,42,18,26,0,Valentine Izundu Offensive Rebound.
Northern Arizona,Washington State,29,42,18,29,0,Valentine Izundu Turnover.
Northern Arizona,Washington State,29,42,18,44,0,Foul on Valentine Izundu.
Northern Arizona,Washington State,30,42,18,44,1,Jaleni Neely made Free Throw.
Northern Arizona,Washington State,31,42,18,44,1,Jaleni Neely made Free Throw.
Northern Arizona,Washington State,31,42,18,54,0,Renard Suggs Turnover.
Northern Arizona,Washington State,34,42,19,5,1,Mike Green made Three Point Jumper. Assisted by Jaleni Neely.
Northern Arizona,Washington State,34,45,19,12,1,Viont'e Daniels made Three Point Jumper. Assisted by Charles Callison.
Northern Arizona,Washington State,34,45,19,30,0,Foul on Mike Green.
Northern Arizona,Washington State,34,45,19,30,0,Mike Green Turnover.
Northern Arizona,Washington State,34,47,19,54,1,Renard Suggs made Layup. Assisted by Charles Callison.
Northern Arizona,Washington State,34,47,19,59,0,Jaleni Neely Turnover.
Northern Arizona,Washington State,34,47,19,59,0,Renard Suggs Steal.
Northern Arizona,Washington State,34,47,20,0,0,End of 1st half
Northern Arizona,Washington State,34,47,20,10,0,Jordyn Martin missed Layup.
Northern Arizona,Washington State,34,47,20,10,0,Junior Longrus Defensive Rebound.
Northern Arizona,Washington State,34,47,20,21,0,Que Johnson missed Jumper.
Northern Arizona,Washington State,34,47,20,21,0,Jaleni Neely Defensive Rebound.
Northern Arizona,Washington State,34,47,20,43,0,Foul on Ny Redding.
Northern Arizona,Washington State,35,47,20,43,1,Kris Yanku made Free Throw.
Northern Arizona,Washington State,36,47,20,43,1,Kris Yanku made Free Throw.
Northern Arizona,Washington State,36,47,20,52,0,Josh Hawkinson missed Jumper.
Northern Arizona,Washington State,36,47,20,52,0,Washington St Offensive Rebound.
Northern Arizona,Washington State,36,47,21,14,0,Ike Iroegbu missed Three Point Jumper.
Northern Arizona,Washington State,36,47,21,14,0,Junior Longrus Offensive Rebound.
Northern Arizona,Washington State,36,49,21,16,1,Junior Longrus made Layup.
Northern Arizona,Washington State,36,49,21,32,0,Kris Yanku Turnover.
Northern Arizona,Washington State,36,49,21,33,0,Ny Redding Steal.
Northern Arizona,Washington State,36,51,21,35,1,Ny Redding made Layup.
Northern Arizona,Washington State,39,51,21,45,1,Jaleni Neely made Three Point Jumper. Assisted by Kris Yanku.
Northern Arizona,Washington State,39,53,22,2,1,Josh Hawkinson made Jumper.
Northern Arizona,Washington State,39,53,22,16,0,Kris Yanku Turnover.
Northern Arizona,Washington State,39,53,22,18,0,Josh Hawkinson Steal.
Northern Arizona,Washington State,39,56,22,26,1,Ike Iroegbu made Three Point Jumper.
Northern Arizona,Washington State,39,56,22,30,0,Northern Arizona  Timeout
Northern Arizona,Washington State,41,56,22,52,1,Jordyn Martin made Layup.
Northern Arizona,Washington State,41,58,23,15,1,Josh Hawkinson made Jumper. Assisted by Ny Redding.
Northern Arizona,Washington State,41,58,23,34,0,Ako Kaluna Turnover.
Northern Arizona,Washington State,41,58,23,37,0,Junior Longrus Steal.
Northern Arizona,Washington State,41,58,23,47,0,Que Johnson Turnover.
Northern Arizona,Washington State,41,58,23,51,0,Foul on Ike Iroegbu.
Northern Arizona,Washington State,41,58,23,51,0,Torry Johnson missed Free Throw.
Northern Arizona,Washington State,41,58,23,51,0,Northern Arizona Deadball Team Rebound.
Northern Arizona,Washington State,42,58,23,51,1,Torry Johnson made Free Throw.
Northern Arizona,Washington State,42,58,24,4,0,Josh Hawkinson missed Jumper.
Northern Arizona,Washington State,42,58,24,4,0,Torry Johnson Defensive Rebound.
Northern Arizona,Washington State,45,58,24,12,1,Jaleni Neely made Three Point Jumper. Assisted by Kris Yanku.
Northern Arizona,Washington State,45,60,24,24,1,Josh Hawkinson made Jumper. Assisted by Viont'e Daniels.
Northern Arizona,Washington State,45,60,24,36,0,Kris Yanku missed Layup.
Northern Arizona,Washington State,45,60,24,36,0,Josh Hawkinson Defensive Rebound.
Northern Arizona,Washington State,45,60,24,47,0,Renard Suggs missed Three Point Jumper.
Northern Arizona,Washington State,45,60,24,47,0,Ako Kaluna Defensive Rebound.
Northern Arizona,Washington State,45,60,24,59,0,Foul on Junior Longrus.
Northern Arizona,Washington State,45,60,24,59,0,Official TV Timeout
Northern Arizona,Washington State,46,60,24,59,1,Ako Kaluna made Free Throw.
Northern Arizona,Washington State,46,60,24,59,0,Ako Kaluna missed Free Throw.
Northern Arizona,Washington State,46,60,24,59,0,Ny Redding Defensive Rebound.
Northern Arizona,Washington State,46,63,25,7,1,Viont'e Daniels made Three Point Jumper. Assisted by Ny Redding.
Northern Arizona,Washington State,48,63,25,25,1,Kris Yanku made Layup.
Northern Arizona,Washington State,48,65,25,41,1,Renard Suggs made Layup. Assisted by Josh Hawkinson.
Northern Arizona,Washington State,48,65,25,47,0,Jaleni Neely Turnover.
Northern Arizona,Washington State,48,65,25,49,0,Viont'e Daniels Steal.
Northern Arizona,Washington State,48,65,25,50,0,Viont'e Daniels Turnover.
Northern Arizona,Washington State,48,65,25,51,0,Torry Johnson Steal.
Northern Arizona,Washington State,48,65,26,9,0,Kris Yanku missed Layup.
Northern Arizona,Washington State,48,65,26,9,0,Torry Johnson Offensive Rebound.
Northern Arizona,Washington State,48,65,26,12,0,Torry Johnson missed Layup.
Northern Arizona,Washington State,48,65,26,12,0,Conor Clifford Defensive Rebound.
Northern Arizona,Washington State,48,65,26,22,0,Renard Suggs missed Jumper.
Northern Arizona,Washington State,48,65,26,22,0,Washington St Offensive Rebound.
Northern Arizona,Washington State,48,65,26,24,0,Viont'e Daniels Turnover.
Northern Arizona,Washington State,48,65,26,27,0,Kris Yanku Steal.
Northern Arizona,Washington State,48,65,26,28,0,Foul on Conor Clifford.
Northern Arizona,Washington State,48,65,26,28,0,Kris Yanku missed Free Throw.
Northern Arizona,Washington State,48,65,26,28,0,Northern Arizona Deadball Team Rebound.
Northern Arizona,Washington State,49,65,26,28,1,Kris Yanku made Free Throw.
Northern Arizona,Washington State,49,68,26,36,1,Renard Suggs made Three Point Jumper. Assisted by Charles Callison.
Northern Arizona,Washington State,49,68,26,39,0,Foul on Valentine Izundu.
Northern Arizona,Washington State,49,68,26,51,0,Felix Rivera-Vega missed Layup.
Northern Arizona,Washington State,49,68,26,51,0,Renard Suggs Defensive Rebound.
Northern Arizona,Washington State,49,68,27,0,0,Renard Suggs missed Layup.
Northern Arizona,Washington State,49,68,27,0,0,Renard Suggs Offensive Rebound.
Northern Arizona,Washington State,49,68,27,5,0,Renard Suggs Turnover.
Northern Arizona,Washington State,49,68,27,6,0,Mike Green Steal.
Northern Arizona,Washington State,49,68,27,8,0,Foul on Valentine Izundu.
Northern Arizona,Washington State,49,68,27,8,0,Felix Rivera-Vega missed Free Throw.
Northern Arizona,Washington State,49,68,27,8,0,Northern Arizona Deadball Team Rebound.
Northern Arizona,Washington State,50,68,27,8,1,Felix Rivera-Vega made Free Throw.
Northern Arizona,Washington State,50,68,27,36,0,Valentine Izundu Turnover.
Northern Arizona,Washington State,50,68,27,45,0,Foul on Charles Callison.
Northern Arizona,Washington State,51,68,27,45,1,Kris Yanku made Free Throw.
Northern Arizona,Washington State,52,68,27,45,1,Kris Yanku made Free Throw.
Northern Arizona,Washington State,52,68,27,53,0,Josh Hawkinson missed Jumper.
Northern Arizona,Washington State,52,68,27,53,0,Ike Iroegbu Offensive Rebound.
Northern Arizona,Washington State,52,68,28,10,0,Valentine Izundu Turnover.
Northern Arizona,Washington State,52,68,28,12,0,Mike Green Steal.
Northern Arizona,Washington State,52,68,28,16,0,Mike Green missed Jumper.
Northern Arizona,Washington State,52,68,28,16,0,Josh Hawkinson Defensive Rebound.
Northern Arizona,Washington State,52,68,28,21,0,Foul on Jaleni Neely.
Northern Arizona,Washington State,52,68,28,21,0,Official TV Timeout
Northern Arizona,Washington State,52,68,28,47,0,Renard Suggs missed Three Point Jumper.
Northern Arizona,Washington State,52,68,28,47,0,Jaleni Neely Defensive Rebound.
Northern Arizona,Washington State,54,68,28,58,1,Torry Johnson made Layup.
Northern Arizona,Washington State,54,68,29,24,0,Ike Iroegbu missed Jumper.
Northern Arizona,Washington State,54,68,29,24,0,Kris Yanku Defensive Rebound.
Northern Arizona,Washington State,54,68,29,35,0,Kris Yanku missed Layup.
Northern Arizona,Washington State,54,68,29,35,0,Renard Suggs Defensive Rebound.
Northern Arizona,Washington State,54,68,29,45,0,Washington St  Timeout
Northern Arizona,Washington State,54,68,29,57,0,Ike Iroegbu Turnover.
Northern Arizona,Washington State,54,68,29,59,0,Brady Twombly Steal.
Northern Arizona,Washington State,56,68,30,1,1,Kris Yanku made Layup.
Northern Arizona,Washington State,56,68,30,17,0,Foul on Junior Longrus.
Northern Arizona,Washington State,56,68,30,17,0,Junior Longrus Turnover.
Northern Arizona,Washington State,56,68,30,25,0,Ako Kaluna missed Three Point Jumper.
Northern Arizona,Washington State,56,68,30,25,0,Kris Yanku Offensive Rebound.
Northern Arizona,Washington State,56,68,30,32,0,Kris Yanku missed Layup.
Northern Arizona,Washington State,56,68,30,32,0,Northern Arizona Offensive Rebound.
Northern Arizona,Washington State,56,68,30,33,0,Foul on Robert Franks.
Northern Arizona,Washington State,57,68,30,33,1,Ako Kaluna made Free Throw.
Northern Arizona,Washington State,57,68,30,33,0,Ako Kaluna missed Free Throw.
Northern Arizona,Washington State,57,68,30,33,0,Josh Hawkinson Defensive Rebound.
Northern Arizona,Washington State,57,68,30,54,0,Foul on Kris Yanku.
Northern Arizona,Washington State,57,69,30,54,1,Derrien King made Free Throw.
Northern Arizona,Washington State,57,70,30,54,1,Derrien King made Free Throw.
Northern Arizona,Washington State,57,70,31,9,0,Torry Johnson missed Layup.
Northern Arizona,Washington State,57,70,31,9,0,Derrien King Defensive Rebound.
Northern Arizona,Washington State,57,70,31,14,0,Derrien King missed Layup.
Northern Arizona,Washington State,57,70,31,14,0,Kris Yanku Defensive Rebound.
Northern Arizona,Washington State,57,70,31,21,0,Jaleni Neely missed Three Point Jumper.
Northern Arizona,Washington State,57,70,31,21,0,Robert Franks Defensive Rebound.
Northern Arizona,Washington State,57,70,31,25,0,Robert Franks Turnover.
Northern Arizona,Washington State,57,70,31,27,0,Ako Kaluna Steal.
Northern Arizona,Washington State,59,70,31,29,1,Torry Johnson made Layup. Assisted by Jordyn Martin.
Northern Arizona,Washington State,59,70,31,44,0,Robert Franks missed Three Point Jumper.
Northern Arizona,Washington State,59,70,31,44,0,Jaleni Neely Defensive Rebound.
Northern Arizona,Washington State,59,70,32,0,0,Kris Yanku missed Three Point Jumper.
Northern Arizona,Washington State,59,70,32,0,0,Que Johnson Defensive Rebound.
Northern Arizona,Washington State,59,70,32,13,0,Foul on Brady Twombly.
Northern Arizona,Washington State,59,70,32,13,0,Official TV Timeout
Northern Arizona,Washington State,59,70,32,33,0,Foul on Isaiah Thomas.
Northern Arizona,Washington State,59,71,32,33,1,Que Johnson made Free Throw.
Northern Arizona,Washington State,59,71,32,33,0,Que Johnson missed Free Throw.
Northern Arizona,Washington State,59,71,32,33,0,Isaiah Thomas Defensive Rebound.
Northern Arizona,Washington State,59,71,32,47,0,Jordyn Martin Turnover.
Northern Arizona,Washington State,59,74,33,3,1,Josh Hawkinson made Three Point Jumper. Assisted by Ny Redding.
Northern Arizona,Washington State,59,74,33,27,0,Jaleni Neely missed Three Point Jumper.
Northern Arizona,Washington State,59,74,33,27,0,Josh Hawkinson Defensive Rebound.
Northern Arizona,Washington State,59,74,33,50,0,Foul on Isaiah Thomas.
Northern Arizona,Washington State,59,75,33,50,1,Que Johnson made Free Throw.
Northern Arizona,Washington State,59,76,33,50,1,Que Johnson made Free Throw.
Northern Arizona,Washington State,59,76,33,58,0,Kris Yanku missed Layup.
Northern Arizona,Washington State,59,76,33,58,0,Valentine Izundu Block.
