South Carolina Upstate,Florida Gulf Coast,54,56,37,54,1,Zach Johnson made Dunk.
South Carolina Upstate,Florida Gulf Coast,57,56,38,10,1,Ramel Thompkins made Three Point Jumper. Assisted by Michael Buchanan.
South Carolina Upstate,Florida Gulf Coast,57,56,38,30,0,Rayjon Tucker Turnover.
South Carolina Upstate,Florida Gulf Coast,57,56,38,47,0,Malik Moore missed Layup.
South Carolina Upstate,Florida Gulf Coast,57,56,38,47,0,Jure Span Offensive Rebound.
South Carolina Upstate,Florida Gulf Coast,60,56,38,51,1,Mike Cunningham made Three Point Jumper. Assisted by Jure Span.
South Carolina Upstate,Florida Gulf Coast,60,58,38,58,1,Christian Terrell made Layup.
South Carolina Upstate,Florida Gulf Coast,60,58,39,0,0,Florida Gulf Coast  Timeout
South Carolina Upstate,Florida Gulf Coast,60,58,39,27,0,Mike Cunningham missed Three Point Jumper.
South Carolina Upstate,Florida Gulf Coast,60,58,39,27,0,Christian Terrell Defensive Rebound.
South Carolina Upstate,Florida Gulf Coast,60,58,39,42,0,Foul on Mike Cunningham.
South Carolina Upstate,Florida Gulf Coast,60,59,39,42,1,Zach Johnson made Free Throw.
South Carolina Upstate,Florida Gulf Coast,60,60,39,42,1,Zach Johnson made Free Throw.
South Carolina Upstate,Florida Gulf Coast,60,60,39,57,0,Malik Moore missed Layup.
South Carolina Upstate,Florida Gulf Coast,60,60,39,57,0,Michael Buchanan Offensive Rebound.
South Carolina Upstate,Florida Gulf Coast,62,60,39,57,1,Michael Buchanan made Layup.
South Carolina Upstate,Florida Gulf Coast,62,60,40,0,0,End of Game
