Away Team,Home Team,Away Score, Home Score,Minute,Second,isScoringPosession,Desc.
South Carolina Upstate,Florida Gulf Coast,0,0,0,26,0,Philip Whittington Turnover.
South Carolina Upstate,Florida Gulf Coast,0,0,0,27,0,Antravious Simmons Steal.
South Carolina Upstate,Florida Gulf Coast,0,0,0,49,0,Christian Terrell missed Layup.
South Carolina Upstate,Florida Gulf Coast,0,0,0,49,0,Philip Whittington Block.
South Carolina Upstate,Florida Gulf Coast,0,0,0,51,0,Malik Moore Defensive Rebound.
South Carolina Upstate,Florida Gulf Coast,2,0,1,6,1,Deion Holmes made Layup.
South Carolina Upstate,Florida Gulf Coast,2,2,1,31,1,Brandon Goodwin made Jumper.
South Carolina Upstate,Florida Gulf Coast,2,2,1,56,0,Malik Moore missed Three Point Jumper.
South Carolina Upstate,Florida Gulf Coast,2,2,1,56,0,Christian Terrell Defensive Rebound.
South Carolina Upstate,Florida Gulf Coast,2,4,2,6,1,Brandon Goodwin made Layup.
South Carolina Upstate,Florida Gulf Coast,5,4,2,30,1,Jure Span made Three Point Jumper.
South Carolina Upstate,Florida Gulf Coast,5,6,2,44,1,Zach Johnson made Layup. Assisted by Brandon Goodwin.
South Carolina Upstate,Florida Gulf Coast,5,6,2,44,0,Foul on Jure Span.
South Carolina Upstate,Florida Gulf Coast,5,6,2,44,0,Zach Johnson missed Free Throw.
South Carolina Upstate,Florida Gulf Coast,5,6,2,44,0,Philip Whittington Defensive Rebound.
South Carolina Upstate,Florida Gulf Coast,5,6,3,0,0,Philip Whittington Turnover.
South Carolina Upstate,Florida Gulf Coast,5,6,3,2,0,Demetris Morant Steal.
South Carolina Upstate,Florida Gulf Coast,5,8,3,5,1,Christian Terrell made Layup.
South Carolina Upstate,Florida Gulf Coast,5,8,3,10,0,Jure Span Turnover.
South Carolina Upstate,Florida Gulf Coast,5,8,3,25,0,Zach Johnson missed Jumper.
South Carolina Upstate,Florida Gulf Coast,5,8,3,25,0,South Carolina Upstate Defensive Rebound.
South Carolina Upstate,Florida Gulf Coast,7,8,3,45,1,Ramel Thompkins made Jumper. Assisted by Jure Span.
South Carolina Upstate,Florida Gulf Coast,7,10,4,5,1,Antravious Simmons made Layup.
South Carolina Upstate,Florida Gulf Coast,7,10,4,20,0,Ramel Thompkins missed Three Point Jumper.
South Carolina Upstate,Florida Gulf Coast,7,10,4,20,0,Antravious Simmons Defensive Rebound.
South Carolina Upstate,Florida Gulf Coast,7,12,4,31,1,Demetris Morant made Dunk. Assisted by Brandon Goodwin.
South Carolina Upstate,Florida Gulf Coast,7,12,4,40,0,Michael Buchanan Turnover.
South Carolina Upstate,Florida Gulf Coast,7,12,4,42,0,Demetris Morant Steal.
South Carolina Upstate,Florida Gulf Coast,7,12,4,45,0,Official TV Timeout
South Carolina Upstate,Florida Gulf Coast,7,12,4,45,0,Foul on Ramel Thompkins.
South Carolina Upstate,Florida Gulf Coast,7,12,4,57,0,Demetris Morant missed Layup.
South Carolina Upstate,Florida Gulf Coast,7,12,4,57,0,Marc-Eddy Norelia Offensive Rebound.
South Carolina Upstate,Florida Gulf Coast,7,14,5,1,1,Marc-Eddy Norelia made Layup.
South Carolina Upstate,Florida Gulf Coast,7,14,5,18,0,Foul on Demetris Morant.
South Carolina Upstate,Florida Gulf Coast,7,14,5,20,0,Ramel Thompkins missed Three Point Jumper.
South Carolina Upstate,Florida Gulf Coast,7,14,5,20,0,Demetris Morant Defensive Rebound.
South Carolina Upstate,Florida Gulf Coast,7,17,5,44,1,Rayjon Tucker made Three Point Jumper. Assisted by Reggie Reid.
South Carolina Upstate,Florida Gulf Coast,10,17,6,12,1,Jure Span made Three Point Jumper. Assisted by Mike Cunningham.
South Carolina Upstate,Florida Gulf Coast,10,17,6,35,0,Zach Johnson missed Jumper.
South Carolina Upstate,Florida Gulf Coast,10,17,6,35,0,Demetris Morant Offensive Rebound.
South Carolina Upstate,Florida Gulf Coast,10,19,6,40,1,Demetris Morant made Two Point Tip Shot.
South Carolina Upstate,Florida Gulf Coast,10,19,6,56,0,Ramel Thompkins missed Three Point Jumper.
South Carolina Upstate,Florida Gulf Coast,10,19,6,56,0,Michael Buchanan Offensive Rebound.
South Carolina Upstate,Florida Gulf Coast,10,19,7,1,0,Michael Buchanan missed Layup.
South Carolina Upstate,Florida Gulf Coast,10,19,7,1,0,Demetris Morant Block.
South Carolina Upstate,Florida Gulf Coast,10,19,7,2,0,Michael Buchanan Offensive Rebound.
South Carolina Upstate,Florida Gulf Coast,10,19,7,3,0,Michael Buchanan missed Layup.
South Carolina Upstate,Florida Gulf Coast,10,19,7,3,0,Marc-Eddy Norelia Defensive Rebound.
South Carolina Upstate,Florida Gulf Coast,10,19,7,5,0,Foul on Michael Buchanan.
South Carolina Upstate,Florida Gulf Coast,10,19,7,23,0,Marc-Eddy Norelia missed Jumper.
South Carolina Upstate,Florida Gulf Coast,10,19,7,23,0,Florida Gulf Coast Offensive Rebound.
South Carolina Upstate,Florida Gulf Coast,10,19,7,26,0,Foul on Ramel Thompkins.
South Carolina Upstate,Florida Gulf Coast,10,19,7,27,0,Christian Terrell missed Three Point Jumper.
South Carolina Upstate,Florida Gulf Coast,10,19,7,27,0,South Carolina Upstate Defensive Rebound.
South Carolina Upstate,Florida Gulf Coast,13,19,7,53,1,Mike Cunningham made Three Point Jumper. Assisted by Michael Buchanan.
South Carolina Upstate,Florida Gulf Coast,13,19,8,17,0,Marc-Eddy Norelia missed Jumper.
South Carolina Upstate,Florida Gulf Coast,13,19,8,17,0,Michael Buchanan Defensive Rebound.
South Carolina Upstate,Florida Gulf Coast,13,19,8,33,0,Jure Span missed Three Point Jumper.
South Carolina Upstate,Florida Gulf Coast,13,19,8,33,0,Rayjon Tucker Defensive Rebound.
South Carolina Upstate,Florida Gulf Coast,13,19,9,3,0,Christian Terrell missed Layup.
South Carolina Upstate,Florida Gulf Coast,13,19,9,3,0,Florida Gulf Coast Offensive Rebound.
South Carolina Upstate,Florida Gulf Coast,13,19,9,8,0,Official TV Timeout
South Carolina Upstate,Florida Gulf Coast,13,19,9,14,0,RaySean Scott Jr. missed Jumper.
South Carolina Upstate,Florida Gulf Coast,13,19,9,14,0,South Carolina Upstate Defensive Rebound.
South Carolina Upstate,Florida Gulf Coast,13,19,9,41,0,Ramel Thompkins missed Jumper.
South Carolina Upstate,Florida Gulf Coast,13,19,9,41,0,Brandon Goodwin Defensive Rebound.
South Carolina Upstate,Florida Gulf Coast,13,19,10,1,0,Brandon Goodwin missed Jumper.
South Carolina Upstate,Florida Gulf Coast,13,19,10,1,0,South Carolina Upstate Defensive Rebound.
South Carolina Upstate,Florida Gulf Coast,13,19,10,4,0,Foul on Demetris Morant.
South Carolina Upstate,Florida Gulf Coast,13,19,10,30,0,Deion Holmes missed Jumper.
South Carolina Upstate,Florida Gulf Coast,13,19,10,30,0,Zach Johnson Block.
South Carolina Upstate,Florida Gulf Coast,13,19,10,32,0,Zach Johnson Defensive Rebound.
South Carolina Upstate,Florida Gulf Coast,13,19,10,51,0,Foul on Deion Holmes.
South Carolina Upstate,Florida Gulf Coast,13,19,10,51,0,South Carolina Upstate  Timeout
South Carolina Upstate,Florida Gulf Coast,13,21,11,1,1,Antravious Simmons made Layup. Assisted by Christian Terrell.
South Carolina Upstate,Florida Gulf Coast,13,21,11,1,0,Foul on Philip Whittington.
South Carolina Upstate,Florida Gulf Coast,13,22,11,1,1,Antravious Simmons made Free Throw.
South Carolina Upstate,Florida Gulf Coast,13,22,11,20,0,Mike Cunningham missed Three Point Jumper.
South Carolina Upstate,Florida Gulf Coast,13,22,11,20,0,Zach Johnson Defensive Rebound.
South Carolina Upstate,Florida Gulf Coast,13,24,11,24,1,Brandon Goodwin made Layup. Assisted by Zach Johnson.
South Carolina Upstate,Florida Gulf Coast,15,24,11,39,1,Malik Moore made Layup.
South Carolina Upstate,Florida Gulf Coast,15,24,11,39,0,Foul on Antravious Simmons.
South Carolina Upstate,Florida Gulf Coast,15,24,11,39,0,Malik Moore missed Free Throw.
South Carolina Upstate,Florida Gulf Coast,15,24,11,39,0,Marc-Eddy Norelia Defensive Rebound.
South Carolina Upstate,Florida Gulf Coast,15,24,11,58,0,Brandon Goodwin missed Three Point Jumper.
South Carolina Upstate,Florida Gulf Coast,15,24,11,58,0,Malik Moore Defensive Rebound.
South Carolina Upstate,Florida Gulf Coast,15,24,12,9,0,Deion Holmes missed Layup.
South Carolina Upstate,Florida Gulf Coast,15,24,12,9,0,Marc-Eddy Norelia Block.
South Carolina Upstate,Florida Gulf Coast,15,24,12,10,0,Philip Whittington Offensive Rebound.
South Carolina Upstate,Florida Gulf Coast,15,24,12,11,0,Philip Whittington missed Layup.
South Carolina Upstate,Florida Gulf Coast,15,24,12,12,0,Antravious Simmons Defensive Rebound.
South Carolina Upstate,Florida Gulf Coast,15,24,12,33,0,Foul on Philip Whittington.
South Carolina Upstate,Florida Gulf Coast,15,24,12,33,0,Official TV Timeout
South Carolina Upstate,Florida Gulf Coast,15,25,12,33,1,Brandon Goodwin made Free Throw.
South Carolina Upstate,Florida Gulf Coast,15,26,12,33,1,Brandon Goodwin made Free Throw.
South Carolina Upstate,Florida Gulf Coast,15,26,12,39,0,Foul on Marc-Eddy Norelia.
South Carolina Upstate,Florida Gulf Coast,15,26,12,55,0,Malik Moore missed Free Throw.
South Carolina Upstate,Florida Gulf Coast,15,26,12,55,0,South Carolina Upstate Deadball Team Rebound.
South Carolina Upstate,Florida Gulf Coast,16,26,12,55,1,Malik Moore made Free Throw.
South Carolina Upstate,Florida Gulf Coast,16,28,13,10,1,Antravious Simmons made Layup. Assisted by Rayjon Tucker.
South Carolina Upstate,Florida Gulf Coast,16,28,13,31,0,Malik Moore missed Three Point Jumper.
South Carolina Upstate,Florida Gulf Coast,16,28,13,31,0,Rayjon Tucker Defensive Rebound.
South Carolina Upstate,Florida Gulf Coast,16,28,13,54,0,Antravious Simmons missed Layup.
South Carolina Upstate,Florida Gulf Coast,16,28,13,54,0,Malik Moore Block.
South Carolina Upstate,Florida Gulf Coast,16,28,13,56,0,Deion Holmes Defensive Rebound.
South Carolina Upstate,Florida Gulf Coast,19,28,13,58,1,Deion Holmes made Three Point Jumper.
South Carolina Upstate,Florida Gulf Coast,19,28,14,10,0,Zach Johnson missed Three Point Jumper.
South Carolina Upstate,Florida Gulf Coast,19,28,14,10,0,Malik Moore Defensive Rebound.
South Carolina Upstate,Florida Gulf Coast,19,28,14,25,0,Malik Moore missed Three Point Jumper.
South Carolina Upstate,Florida Gulf Coast,19,28,14,25,0,Brandon Goodwin Defensive Rebound.
South Carolina Upstate,Florida Gulf Coast,19,28,14,51,0,Zach Johnson Turnover.
South Carolina Upstate,Florida Gulf Coast,19,28,14,53,0,Josh Cuthbertson Steal.
South Carolina Upstate,Florida Gulf Coast,22,28,15,4,1,Mike Cunningham made Three Point Jumper.
South Carolina Upstate,Florida Gulf Coast,22,28,15,8,0,Florida Gulf Coast  Timeout
South Carolina Upstate,Florida Gulf Coast,22,28,15,19,0,RaySean Scott Jr. Turnover.
South Carolina Upstate,Florida Gulf Coast,22,28,15,32,0,Foul on Marc-Eddy Norelia.
South Carolina Upstate,Florida Gulf Coast,24,28,15,52,1,Michael Buchanan made Layup.
South Carolina Upstate,Florida Gulf Coast,24,30,16,19,1,Rayjon Tucker made Jumper.
South Carolina Upstate,Florida Gulf Coast,24,30,16,41,0,Mike Cunningham missed Three Point Jumper.
South Carolina Upstate,Florida Gulf Coast,24,30,16,41,0,Reggie Reid Defensive Rebound.
South Carolina Upstate,Florida Gulf Coast,24,30,16,48,0,Brandon Goodwin missed Layup.
South Carolina Upstate,Florida Gulf Coast,24,30,16,48,0,Christian Carlyle Offensive Rebound.
South Carolina Upstate,Florida Gulf Coast,24,30,16,52,0,Rayjon Tucker missed Three Point Jumper.
South Carolina Upstate,Florida Gulf Coast,24,30,16,52,0,Michael Buchanan Defensive Rebound.
South Carolina Upstate,Florida Gulf Coast,24,30,16,57,0,Josh Cuthbertson missed Jumper.
South Carolina Upstate,Florida Gulf Coast,24,30,16,57,0,RaySean Scott Jr. Defensive Rebound.
South Carolina Upstate,Florida Gulf Coast,24,30,17,15,0,Reggie Reid missed Three Point Jumper.
South Carolina Upstate,Florida Gulf Coast,24,30,17,15,0,Michael Buchanan Defensive Rebound.
South Carolina Upstate,Florida Gulf Coast,24,30,17,23,0,Jure Span missed Three Point Jumper.
South Carolina Upstate,Florida Gulf Coast,24,30,17,23,0,Brandon Goodwin Defensive Rebound.
South Carolina Upstate,Florida Gulf Coast,24,30,17,33,0,RaySean Scott Jr. missed Three Point Jumper.
South Carolina Upstate,Florida Gulf Coast,24,30,17,33,0,Ramel Thompkins Defensive Rebound.
South Carolina Upstate,Florida Gulf Coast,24,30,18,1,0,Foul on Reggie Reid.
South Carolina Upstate,Florida Gulf Coast,24,30,18,1,0,Official TV Timeout
South Carolina Upstate,Florida Gulf Coast,25,30,18,1,1,Michael Buchanan made Free Throw.
South Carolina Upstate,Florida Gulf Coast,25,30,18,1,0,Michael Buchanan missed Free Throw.
South Carolina Upstate,Florida Gulf Coast,25,30,18,2,0,South Carolina Upstate Deadball Team Rebound.
South Carolina Upstate,Florida Gulf Coast,25,30,18,24,0,Zach Johnson missed Layup.
South Carolina Upstate,Florida Gulf Coast,25,30,18,24,0,Michael Buchanan Defensive Rebound.
South Carolina Upstate,Florida Gulf Coast,28,30,18,46,1,Josh Cuthbertson made Three Point Jumper. Assisted by Mike Cunningham.
South Carolina Upstate,Florida Gulf Coast,28,30,19,8,0,Brandon Goodwin missed Three Point Jumper.
South Carolina Upstate,Florida Gulf Coast,28,30,19,8,0,Malik Moore Defensive Rebound.
South Carolina Upstate,Florida Gulf Coast,30,30,19,18,1,Josh Cuthbertson made Layup. Assisted by Malik Moore.
South Carolina Upstate,Florida Gulf Coast,30,30,19,42,0,Christian Terrell missed Three Point Jumper.
South Carolina Upstate,Florida Gulf Coast,30,30,19,42,0,Michael Buchanan Defensive Rebound.
South Carolina Upstate,Florida Gulf Coast,32,30,19,59,1,Mike Cunningham made Layup.
South Carolina Upstate,Florida Gulf Coast,33,30,20,0,0,End of 1st half
South Carolina Upstate,Florida Gulf Coast,32,30,20,21,0,Antravious Simmons missed Jumper.
South Carolina Upstate,Florida Gulf Coast,32,30,20,21,0,Florida Gulf Coast Offensive Rebound.
South Carolina Upstate,Florida Gulf Coast,32,30,20,22,0,Brandon Goodwin Turnover.
South Carolina Upstate,Florida Gulf Coast,32,30,20,22,0,Mike Cunningham Steal.
South Carolina Upstate,Florida Gulf Coast,32,30,20,23,0,Josh Cuthbertson Turnover.
South Carolina Upstate,Florida Gulf Coast,32,32,20,54,1,Antravious Simmons made Jumper. Assisted by Demetris Morant.
South Carolina Upstate,Florida Gulf Coast,32,32,21,19,0,Michael Buchanan Turnover.
South Carolina Upstate,Florida Gulf Coast,32,34,21,45,1,Zach Johnson made Layup.
South Carolina Upstate,Florida Gulf Coast,32,34,21,59,0,Michael Buchanan missed Layup.
South Carolina Upstate,Florida Gulf Coast,32,34,21,59,0,Demetris Morant Defensive Rebound.
South Carolina Upstate,Florida Gulf Coast,32,36,22,5,1,Brandon Goodwin made Layup.
South Carolina Upstate,Florida Gulf Coast,32,36,22,28,0,Malik Moore missed Layup.
South Carolina Upstate,Florida Gulf Coast,32,36,22,28,0,Demetris Morant Block.
South Carolina Upstate,Florida Gulf Coast,32,36,22,29,0,South Carolina Upstate Offensive Rebound.
South Carolina Upstate,Florida Gulf Coast,34,36,22,46,1,Michael Buchanan made Layup. Assisted by Josh Cuthbertson.
South Carolina Upstate,Florida Gulf Coast,34,36,22,47,0,Foul on Antravious Simmons.
South Carolina Upstate,Florida Gulf Coast,35,36,22,47,1,Michael Buchanan made Free Throw.
South Carolina Upstate,Florida Gulf Coast,35,36,23,11,0,Antravious Simmons Turnover.
South Carolina Upstate,Florida Gulf Coast,35,36,23,12,0,Michael Buchanan Steal.
South Carolina Upstate,Florida Gulf Coast,38,36,23,23,1,Malik Moore made Three Point Jumper. Assisted by Mike Cunningham.
South Carolina Upstate,Florida Gulf Coast,38,36,23,36,0,Brandon Goodwin Turnover.
South Carolina Upstate,Florida Gulf Coast,38,36,24,2,0,Mike Cunningham missed Jumper.
South Carolina Upstate,Florida Gulf Coast,38,36,24,2,0,Antravious Simmons Defensive Rebound.
South Carolina Upstate,Florida Gulf Coast,38,36,24,10,0,Foul on Mike Cunningham.
South Carolina Upstate,Florida Gulf Coast,38,36,24,10,0,Official TV Timeout
South Carolina Upstate,Florida Gulf Coast,38,36,24,10,0,Marc-Eddy Norelia missed Layup.
South Carolina Upstate,Florida Gulf Coast,38,36,24,10,0,Antravious Simmons Offensive Rebound.
South Carolina Upstate,Florida Gulf Coast,38,38,24,10,1,Antravious Simmons made Two Point Tip Shot.
South Carolina Upstate,Florida Gulf Coast,41,38,24,10,1,Mike Cunningham made Three Point Jumper. Assisted by Jure Span.
South Carolina Upstate,Florida Gulf Coast,41,38,24,11,0,Brandon Goodwin Turnover.
South Carolina Upstate,Florida Gulf Coast,41,38,24,12,0,Josh Cuthbertson Steal.
South Carolina Upstate,Florida Gulf Coast,41,38,24,13,0,South Carolina Upstate  Timeout
South Carolina Upstate,Florida Gulf Coast,41,38,24,52,0,Official TV Timeout
South Carolina Upstate,Florida Gulf Coast,41,38,25,21,0,Philip Whittington missed Jumper.
South Carolina Upstate,Florida Gulf Coast,41,38,25,21,0,Antravious Simmons Defensive Rebound.
South Carolina Upstate,Florida Gulf Coast,41,38,25,28,0,Christian Terrell Turnover.
South Carolina Upstate,Florida Gulf Coast,43,38,25,48,1,Philip Whittington made Layup.
South Carolina Upstate,Florida Gulf Coast,43,38,26,2,0,Foul on Philip Whittington.
South Carolina Upstate,Florida Gulf Coast,43,38,26,2,0,Demetris Morant missed Free Throw.
South Carolina Upstate,Florida Gulf Coast,43,38,26,2,0,Florida Gulf Coast Deadball Team Rebound.
South Carolina Upstate,Florida Gulf Coast,43,39,26,2,1,Demetris Morant made Free Throw.
South Carolina Upstate,Florida Gulf Coast,43,39,26,16,0,Mike Cunningham missed Layup.
South Carolina Upstate,Florida Gulf Coast,43,39,26,16,0,Philip Whittington Offensive Rebound.
South Carolina Upstate,Florida Gulf Coast,45,39,26,19,1,Philip Whittington made Two Point Tip Shot.
South Carolina Upstate,Florida Gulf Coast,45,39,26,23,0,Foul on Mike Cunningham.
South Carolina Upstate,Florida Gulf Coast,45,39,26,32,0,Marc-Eddy Norelia missed Layup.
South Carolina Upstate,Florida Gulf Coast,45,39,26,32,0,Philip Whittington Defensive Rebound.
South Carolina Upstate,Florida Gulf Coast,48,39,26,38,1,Malik Moore made Three Point Jumper. Assisted by Josh Cuthbertson.
South Carolina Upstate,Florida Gulf Coast,48,39,26,49,0,Zach Johnson missed Jumper.
South Carolina Upstate,Florida Gulf Coast,48,39,26,49,0,Josh Cuthbertson Defensive Rebound.
South Carolina Upstate,Florida Gulf Coast,48,39,26,50,0,Foul on Rayjon Tucker.
South Carolina Upstate,Florida Gulf Coast,48,39,27,13,0,Ramel Thompkins missed Three Point Jumper.
South Carolina Upstate,Florida Gulf Coast,48,39,27,13,0,Philip Whittington Offensive Rebound.
South Carolina Upstate,Florida Gulf Coast,48,39,27,13,0,Foul on Demetris Morant.
South Carolina Upstate,Florida Gulf Coast,50,39,27,29,1,Philip Whittington made Jumper. Assisted by Deion Holmes.
South Carolina Upstate,Florida Gulf Coast,50,39,27,42,0,Florida Gulf Coast  Timeout
South Carolina Upstate,Florida Gulf Coast,50,39,27,42,0,Official TV Timeout
South Carolina Upstate,Florida Gulf Coast,50,39,27,42,0,Antravious Simmons Turnover.
South Carolina Upstate,Florida Gulf Coast,50,39,27,42,0,Philip Whittington Steal.
South Carolina Upstate,Florida Gulf Coast,50,39,28,7,0,Philip Whittington missed Layup.
South Carolina Upstate,Florida Gulf Coast,50,39,28,7,0,Demetris Morant Defensive Rebound.
South Carolina Upstate,Florida Gulf Coast,50,39,28,21,0,Christian Terrell missed Layup.
South Carolina Upstate,Florida Gulf Coast,50,39,28,21,0,Ramel Thompkins Block.
South Carolina Upstate,Florida Gulf Coast,50,39,28,23,0,Deion Holmes Defensive Rebound.
South Carolina Upstate,Florida Gulf Coast,50,39,28,26,0,Foul on Malik Moore.
South Carolina Upstate,Florida Gulf Coast,50,39,28,26,0,Malik Moore Turnover.
South Carolina Upstate,Florida Gulf Coast,50,39,28,46,0,Zach Johnson missed Three Point Jumper.
South Carolina Upstate,Florida Gulf Coast,50,39,28,46,0,South Carolina Upstate Defensive Rebound.
South Carolina Upstate,Florida Gulf Coast,50,39,28,49,0,Foul on Rayjon Tucker.
South Carolina Upstate,Florida Gulf Coast,50,39,28,58,0,Foul on Malik Moore.
South Carolina Upstate,Florida Gulf Coast,50,39,28,58,0,Malik Moore Turnover.
South Carolina Upstate,Florida Gulf Coast,50,39,29,10,0,Foul on Philip Whittington.
South Carolina Upstate,Florida Gulf Coast,50,42,29,15,1,Christian Terrell made Three Point Jumper. Assisted by Rayjon Tucker.
South Carolina Upstate,Florida Gulf Coast,50,42,29,43,0,Foul on Antravious Simmons.
South Carolina Upstate,Florida Gulf Coast,50,42,29,43,0,Michael Buchanan missed Free Throw.
South Carolina Upstate,Florida Gulf Coast,50,42,29,43,0,South Carolina Upstate Deadball Team Rebound.
South Carolina Upstate,Florida Gulf Coast,50,42,29,43,0,Michael Buchanan missed Free Throw.
South Carolina Upstate,Florida Gulf Coast,50,42,29,43,0,Demetris Morant Defensive Rebound.
South Carolina Upstate,Florida Gulf Coast,50,42,30,9,0,Christian Terrell missed Jumper.
South Carolina Upstate,Florida Gulf Coast,50,42,30,9,0,Brandon Goodwin Offensive Rebound.
South Carolina Upstate,Florida Gulf Coast,50,42,30,31,0,Marc-Eddy Norelia Turnover.
South Carolina Upstate,Florida Gulf Coast,50,42,30,41,0,Ramel Thompkins missed Three Point Jumper.
South Carolina Upstate,Florida Gulf Coast,50,42,30,41,0,Florida Gulf Coast Defensive Rebound.
South Carolina Upstate,Florida Gulf Coast,50,42,31,4,0,Brandon Goodwin missed Jumper.
South Carolina Upstate,Florida Gulf Coast,50,42,31,4,0,Michael Buchanan Defensive Rebound.
South Carolina Upstate,Florida Gulf Coast,50,42,31,22,0,Mike Cunningham missed Jumper.
South Carolina Upstate,Florida Gulf Coast,50,42,31,22,0,Marc-Eddy Norelia Defensive Rebound.
South Carolina Upstate,Florida Gulf Coast,50,42,31,33,0,Christian Terrell missed Layup.
South Carolina Upstate,Florida Gulf Coast,50,42,31,33,0,Demetris Morant Offensive Rebound.
South Carolina Upstate,Florida Gulf Coast,50,44,31,37,1,Demetris Morant made Dunk.
South Carolina Upstate,Florida Gulf Coast,50,44,32,2,0,Jure Span missed Three Point Jumper.
South Carolina Upstate,Florida Gulf Coast,50,44,32,2,0,Ramel Thompkins Offensive Rebound.
South Carolina Upstate,Florida Gulf Coast,50,44,32,9,0,Foul on Christian Terrell.
South Carolina Upstate,Florida Gulf Coast,50,44,32,9,0,Official TV Timeout
South Carolina Upstate,Florida Gulf Coast,50,44,32,30,0,Malik Moore missed Three Point Jumper.
South Carolina Upstate,Florida Gulf Coast,50,44,32,30,0,Demetris Morant Defensive Rebound.
South Carolina Upstate,Florida Gulf Coast,50,44,32,42,0,Demetris Morant missed Layup.
South Carolina Upstate,Florida Gulf Coast,50,44,32,42,0,Malik Moore Defensive Rebound.
South Carolina Upstate,Florida Gulf Coast,50,44,33,3,0,Michael Buchanan missed Layup.
South Carolina Upstate,Florida Gulf Coast,50,44,33,3,0,Brandon Goodwin Defensive Rebound.
South Carolina Upstate,Florida Gulf Coast,50,44,33,25,0,Brandon Goodwin missed Layup.
South Carolina Upstate,Florida Gulf Coast,50,44,33,25,0,Michael Buchanan Defensive Rebound.
South Carolina Upstate,Florida Gulf Coast,50,44,33,38,0,Michael Buchanan Turnover.
South Carolina Upstate,Florida Gulf Coast,50,44,33,52,0,Christian Terrell missed Three Point Jumper.
South Carolina Upstate,Florida Gulf Coast,50,44,33,52,0,Demetris Morant Offensive Rebound.
South Carolina Upstate,Florida Gulf Coast,50,44,34,1,0,Demetris Morant Turnover.
South Carolina Upstate,Florida Gulf Coast,50,44,34,2,0,Mike Cunningham Steal.
South Carolina Upstate,Florida Gulf Coast,50,44,34,28,0,Michael Buchanan missed Layup.
South Carolina Upstate,Florida Gulf Coast,50,44,34,28,0,Brandon Goodwin Defensive Rebound.
South Carolina Upstate,Florida Gulf Coast,50,46,34,34,1,Brandon Goodwin made Layup.
South Carolina Upstate,Florida Gulf Coast,50,46,34,52,0,Mike Cunningham missed Jumper.
South Carolina Upstate,Florida Gulf Coast,50,46,34,52,0,Demetris Morant Defensive Rebound.
South Carolina Upstate,Florida Gulf Coast,50,46,35,7,0,Foul on Brandon Goodwin.
South Carolina Upstate,Florida Gulf Coast,50,46,35,7,0,Brandon Goodwin Turnover.
South Carolina Upstate,Florida Gulf Coast,53,46,35,33,1,Ramel Thompkins made Three Point Jumper. Assisted by Mike Cunningham.
South Carolina Upstate,Florida Gulf Coast,53,46,35,50,0,Brandon Goodwin missed Layup.
South Carolina Upstate,Florida Gulf Coast,53,46,35,50,0,Ramel Thompkins Block.
South Carolina Upstate,Florida Gulf Coast,53,46,35,52,0,Philip Whittington Defensive Rebound.
South Carolina Upstate,Florida Gulf Coast,53,46,36,9,0,Foul on Antravious Simmons.
South Carolina Upstate,Florida Gulf Coast,53,46,36,9,0,Official TV Timeout
South Carolina Upstate,Florida Gulf Coast,53,46,36,9,0,Philip Whittington missed Free Throw.
South Carolina Upstate,Florida Gulf Coast,53,46,36,9,0,South Carolina Upstate Deadball Team Rebound.
South Carolina Upstate,Florida Gulf Coast,54,46,36,9,1,Philip Whittington made Free Throw.
South Carolina Upstate,Florida Gulf Coast,54,48,36,26,1,Zach Johnson made Layup.
South Carolina Upstate,Florida Gulf Coast,54,48,36,35,0,Josh Cuthbertson Turnover.
South Carolina Upstate,Florida Gulf Coast,54,48,36,35,0,Zach Johnson Steal.
South Carolina Upstate,Florida Gulf Coast,54,48,36,35,0,Zach Johnson missed Free Throw.
South Carolina Upstate,Florida Gulf Coast,54,48,36,35,0,Florida Gulf Coast Deadball Team Rebound.
South Carolina Upstate,Florida Gulf Coast,54,49,36,35,1,Zach Johnson made Free Throw.
South Carolina Upstate,Florida Gulf Coast,54,49,36,46,0,South Carolina Upstate  Timeout
South Carolina Upstate,Florida Gulf Coast,54,49,36,46,0,Foul on Philip Whittington.
South Carolina Upstate,Florida Gulf Coast,54,49,36,46,0,Philip Whittington Turnover.
South Carolina Upstate,Florida Gulf Coast,54,51,36,59,1,Demetris Morant made Layup.
South Carolina Upstate,Florida Gulf Coast,54,51,37,24,0,Ramel Thompkins Turnover.
South Carolina Upstate,Florida Gulf Coast,54,51,37,25,0,Christian Terrell Steal.
South Carolina Upstate,Florida Gulf Coast,54,51,37,25,0,Christian Terrell missed Free Throw.
South Carolina Upstate,Florida Gulf Coast,54,51,37,25,0,Rayjon Tucker Offensive Rebound.
South Carolina Upstate,Florida Gulf Coast,54,54,37,29,1,Christian Terrell made Three Point Jumper. Assisted by Zach Johnson.
South Carolina Upstate,Florida Gulf Coast,54,54,37,49,0,Ramel Thompkins Turnover.
South Carolina Upstate,Florida Gulf Coast,54,54,37,52,0,Zach Johnson Steal.
