Southern Nazarene,Wichita State,56,87,39,27,1,Chris Stephens made Free Throw.
Southern Nazarene,Wichita State,56,87,39,27,0,Chris Stephens missed Free Throw.
Southern Nazarene,Wichita State,56,87,39,27,0,Brett Barney Defensive Rebound.
Southern Nazarene,Wichita State,56,87,39,44,0,Brett Barney missed Jumper.
Southern Nazarene,Wichita State,56,87,39,44,0,Zach Johnson Defensive Rebound.
Southern Nazarene,Wichita State,56,87,39,47,0,Foul on Kaelen Malone.
Southern Nazarene,Wichita State,57,87,39,47,1,Zach Johnson made Free Throw.
Southern Nazarene,Wichita State,57,87,39,47,0,Zach Johnson missed Free Throw.
Southern Nazarene,Wichita State,57,87,39,47,0,Zach Bush Defensive Rebound.
Southern Nazarene,Wichita State,57,87,40,0,0,End of Game
