Away Team,Home Team,Away Score, Home Score,Minute,Second,isScoringPosession,Desc.
Long Beach State,Wichita State,0,0,0,15,0,Gabe Levin missed Three Point Jumper.
Long Beach State,Wichita State,0,0,0,15,0,Shaquille Morris Defensive Rebound.
Long Beach State,Wichita State,0,0,0,33,0,Zach Brown missed Three Point Jumper.
Long Beach State,Wichita State,0,0,0,33,0,Evan Payne Defensive Rebound.
Long Beach State,Wichita State,0,0,0,56,0,Foul on Rashard Kelly.
Long Beach State,Wichita State,0,0,1,18,0,Justin Bibbins Turnover.
Long Beach State,Wichita State,0,0,1,37,0,Conner Frankamp missed Three Point Jumper.
Long Beach State,Wichita State,0,0,1,37,0,Rashard Kelly Offensive Rebound.
Long Beach State,Wichita State,0,0,1,42,0,Foul on Mason Riggins.
Long Beach State,Wichita State,0,0,1,42,0,Rashard Kelly missed Free Throw.
Long Beach State,Wichita State,0,0,1,42,0,Wichita St Deadball Team Rebound.
Long Beach State,Wichita State,0,1,1,42,1,Rashard Kelly made Free Throw.
Long Beach State,Wichita State,0,1,1,56,0,Gabe Levin missed Jumper.
Long Beach State,Wichita State,0,1,1,56,0,Shaquille Morris Block.
Long Beach State,Wichita State,0,1,1,58,0,Shaquille Morris Defensive Rebound.
Long Beach State,Wichita State,0,1,2,7,0,Rashard Kelly missed Jumper.
Long Beach State,Wichita State,0,1,2,7,0,Justin Bibbins Defensive Rebound.
Long Beach State,Wichita State,0,1,2,13,0,Justin Bibbins missed Layup.
Long Beach State,Wichita State,0,1,2,13,0,Long Beach St Offensive Rebound.
Long Beach State,Wichita State,0,1,2,16,0,Justin Bibbins missed Jumper.
Long Beach State,Wichita State,0,1,2,16,0,Shaquille Morris Defensive Rebound.
Long Beach State,Wichita State,0,3,2,39,1,Shaquille Morris made Jumper.
Long Beach State,Wichita State,2,3,3,1,1,Justin Bibbins made Layup.
Long Beach State,Wichita State,2,3,3,12,0,Foul on Justin Bibbins.
Long Beach State,Wichita State,2,4,3,12,1,Landry Shamet made Free Throw.
Long Beach State,Wichita State,2,4,3,12,0,Landry Shamet missed Free Throw.
Long Beach State,Wichita State,2,4,3,12,0,Evan Payne Defensive Rebound.
Long Beach State,Wichita State,2,4,3,30,0,Evan Payne missed Three Point Jumper.
Long Beach State,Wichita State,2,4,3,30,0,Mason Riggins Offensive Rebound.
Long Beach State,Wichita State,2,4,3,48,0,Foul on Mason Riggins.
Long Beach State,Wichita State,2,4,3,48,0,Mason Riggins Turnover.
Long Beach State,Wichita State,2,4,4,4,0,Wichita St  Timeout
Long Beach State,Wichita State,2,4,4,16,0,Rauno Nurger missed Layup.
Long Beach State,Wichita State,2,4,4,16,0,Evan Payne Defensive Rebound.
Long Beach State,Wichita State,4,4,4,27,1,Gabe Levin made Layup.
Long Beach State,Wichita State,4,4,4,37,0,Daishon Smith missed Jumper.
Long Beach State,Wichita State,4,4,4,37,0,Darral Willis Jr. Offensive Rebound.
Long Beach State,Wichita State,4,4,4,41,0,Foul on LaRond Williams.
Long Beach State,Wichita State,4,5,4,41,1,Darral Willis Jr. made Free Throw.
Long Beach State,Wichita State,4,6,4,41,1,Darral Willis Jr. made Free Throw.
Long Beach State,Wichita State,4,6,4,45,0,Roschon Prince missed Jumper.
Long Beach State,Wichita State,4,6,4,45,0,Markis McDuffie Block.
Long Beach State,Wichita State,4,6,4,48,0,Barry Ogalue Offensive Rebound.
Long Beach State,Wichita State,6,6,5,5,1,Barry Ogalue made Jumper. Assisted by Jordan Griffin.
Long Beach State,Wichita State,6,6,5,16,0,Foul on Temidayo Yussuf.
Long Beach State,Wichita State,6,8,5,20,1,Markis McDuffie made Jumper. Assisted by Daishon Smith.
Long Beach State,Wichita State,6,8,5,39,0,Temidayo Yussuf Turnover.
Long Beach State,Wichita State,6,8,5,41,0,Landry Shamet Steal.
Long Beach State,Wichita State,6,8,5,43,0,Foul on Barry Ogalue.
Long Beach State,Wichita State,6,9,5,43,1,Landry Shamet made Free Throw.
Long Beach State,Wichita State,6,10,5,43,1,Landry Shamet made Free Throw.
Long Beach State,Wichita State,6,10,5,49,0,Foul on Daishon Smith.
Long Beach State,Wichita State,6,10,5,59,0,Jordan Griffin missed Jumper.
Long Beach State,Wichita State,6,10,5,59,0,Daishon Smith Defensive Rebound.
Long Beach State,Wichita State,6,10,6,16,0,Foul on Roschon Prince.
Long Beach State,Wichita State,6,10,6,16,0,Shaquille Morris missed Free Throw.
Long Beach State,Wichita State,6,10,6,16,0,Wichita St Deadball Team Rebound.
Long Beach State,Wichita State,6,11,6,16,1,Shaquille Morris made Free Throw.
Long Beach State,Wichita State,6,11,6,33,0,Foul on Shaquille Morris.
Long Beach State,Wichita State,8,11,6,47,1,Temidayo Yussuf made Jumper. Assisted by Noah Blackwell.
Long Beach State,Wichita State,8,11,7,0,0,Foul on Darral Willis Jr..
Long Beach State,Wichita State,8,11,7,0,0,Darral Willis Jr. Turnover.
Long Beach State,Wichita State,8,11,7,14,0,Loren Jackson missed Three Point Jumper.
Long Beach State,Wichita State,8,11,7,14,0,Markis McDuffie Defensive Rebound.
Long Beach State,Wichita State,8,13,7,26,1,Rashard Kelly made Layup. Assisted by Markis McDuffie.
Long Beach State,Wichita State,8,13,7,35,0,Foul on Markis McDuffie.
Long Beach State,Wichita State,10,13,7,40,1,Evan Payne made Jumper. Assisted by Justin Bibbins.
Long Beach State,Wichita State,10,15,8,4,1,Shaquille Morris made Jumper. Assisted by Markis McDuffie.
Long Beach State,Wichita State,10,15,8,8,0,Long Beach St  Timeout
Long Beach State,Wichita State,10,15,8,27,0,Evan Payne Turnover.
Long Beach State,Wichita State,10,15,8,29,0,Landry Shamet Steal.
Long Beach State,Wichita State,10,15,8,33,0,Landry Shamet missed Layup.
Long Beach State,Wichita State,10,15,8,33,0,Evan Payne Defensive Rebound.
Long Beach State,Wichita State,10,15,8,43,0,Gabe Levin missed Jumper.
Long Beach State,Wichita State,10,15,8,43,0,Long Beach St Offensive Rebound.
Long Beach State,Wichita State,10,15,8,44,0,Foul on Shaquille Morris.
Long Beach State,Wichita State,12,15,8,55,1,Gabe Levin made Jumper.
Long Beach State,Wichita State,12,15,9,23,0,Rauno Nurger missed Layup.
Long Beach State,Wichita State,12,15,9,23,0,Temidayo Yussuf Defensive Rebound.
Long Beach State,Wichita State,12,15,9,28,0,Evan Payne missed Three Point Jumper.
Long Beach State,Wichita State,12,15,9,28,0,Rauno Nurger Defensive Rebound.
Long Beach State,Wichita State,12,18,9,38,1,Conner Frankamp made Three Point Jumper.
Long Beach State,Wichita State,14,18,9,52,1,Gabe Levin made Jumper. Assisted by Justin Bibbins.
Long Beach State,Wichita State,14,18,10,2,0,Conner Frankamp missed Jumper.
Long Beach State,Wichita State,14,18,10,2,0,Javonntie Jackson Defensive Rebound.
Long Beach State,Wichita State,16,18,10,13,1,Justin Bibbins made Jumper.
Long Beach State,Wichita State,16,18,10,41,0,Landry Shamet missed Three Point Jumper.
Long Beach State,Wichita State,16,18,10,41,0,Temidayo Yussuf Defensive Rebound.
Long Beach State,Wichita State,16,18,10,44,0,Foul on Rauno Nurger.
Long Beach State,Wichita State,17,18,10,44,1,Temidayo Yussuf made Free Throw.
Long Beach State,Wichita State,17,18,10,44,0,Temidayo Yussuf missed Free Throw.
Long Beach State,Wichita State,17,18,10,44,0,Markis McDuffie Defensive Rebound.
Long Beach State,Wichita State,17,18,11,5,0,Zach Brown missed Layup.
Long Beach State,Wichita State,17,18,11,5,0,Temidayo Yussuf Defensive Rebound.
Long Beach State,Wichita State,17,18,11,12,0,Justin Bibbins missed Layup.
Long Beach State,Wichita State,17,18,11,12,0,Landry Shamet Block.
Long Beach State,Wichita State,17,18,11,14,0,Landry Shamet Defensive Rebound.
Long Beach State,Wichita State,17,18,11,30,0,Markis McDuffie missed Three Point Jumper.
Long Beach State,Wichita State,17,18,11,30,0,Markis McDuffie Offensive Rebound.
Long Beach State,Wichita State,17,20,11,35,1,Markis McDuffie made Layup.
Long Beach State,Wichita State,19,20,11,42,1,Loren Jackson made Layup.
Long Beach State,Wichita State,19,20,11,42,0,Foul on Landry Shamet.
Long Beach State,Wichita State,20,20,11,42,1,Loren Jackson made Free Throw.
Long Beach State,Wichita State,20,20,11,51,0,Foul on Loren Jackson.
Long Beach State,Wichita State,20,21,11,51,1,Conner Frankamp made Free Throw.
Long Beach State,Wichita State,20,22,11,51,1,Conner Frankamp made Free Throw.
Long Beach State,Wichita State,20,22,12,3,0,Roschon Prince Turnover.
Long Beach State,Wichita State,20,22,12,5,0,Zach Brown Steal.
Long Beach State,Wichita State,20,22,12,7,0,Foul on Noah Blackwell.
Long Beach State,Wichita State,20,22,12,7,0,Wichita St  Timeout
Long Beach State,Wichita State,20,22,12,7,0,Zach Brown missed Free Throw.
Long Beach State,Wichita State,20,22,12,7,0,Roschon Prince Defensive Rebound.
Long Beach State,Wichita State,20,22,12,20,0,Noah Blackwell missed Jumper.
Long Beach State,Wichita State,20,22,12,20,0,Rauno Nurger Defensive Rebound.
Long Beach State,Wichita State,20,22,12,37,0,Wichita St  Timeout
Long Beach State,Wichita State,20,22,12,45,0,Zach Brown missed Layup.
Long Beach State,Wichita State,20,22,12,45,0,Barry Ogalue Defensive Rebound.
Long Beach State,Wichita State,20,22,12,56,0,Evan Payne Turnover.
Long Beach State,Wichita State,20,22,12,57,0,Markis McDuffie Steal.
Long Beach State,Wichita State,20,22,13,12,0,Foul on Evan Payne.
Long Beach State,Wichita State,20,23,13,12,1,Landry Shamet made Free Throw.
Long Beach State,Wichita State,20,24,13,12,1,Landry Shamet made Free Throw.
Long Beach State,Wichita State,20,24,13,34,0,Foul on Markis McDuffie.
Long Beach State,Wichita State,21,24,13,34,1,Barry Ogalue made Free Throw.
Long Beach State,Wichita State,21,24,13,34,0,Barry Ogalue missed Free Throw.
Long Beach State,Wichita State,21,24,13,34,0,Darral Willis Jr. Defensive Rebound.
Long Beach State,Wichita State,21,26,14,3,1,Landry Shamet made Layup.
Long Beach State,Wichita State,21,26,14,19,0,Roschon Prince missed Jumper.
Long Beach State,Wichita State,21,26,14,19,0,Daishon Smith Defensive Rebound.
Long Beach State,Wichita State,21,26,14,26,0,Daishon Smith missed Layup.
Long Beach State,Wichita State,21,26,14,26,0,Temidayo Yussuf Defensive Rebound.
Long Beach State,Wichita State,21,26,14,32,0,Evan Payne missed Three Point Jumper.
Long Beach State,Wichita State,21,26,14,32,0,Daishon Smith Defensive Rebound.
Long Beach State,Wichita State,21,28,14,40,1,Darral Willis Jr. made Layup. Assisted by Landry Shamet.
Long Beach State,Wichita State,21,28,14,41,0,Long Beach St  Timeout
Long Beach State,Wichita State,21,28,14,53,0,Jordan Griffin Turnover.
Long Beach State,Wichita State,21,28,14,56,0,Eric Hamilton Steal.
Long Beach State,Wichita State,21,28,14,58,0,Foul on Daishon Smith.
Long Beach State,Wichita State,21,28,14,58,0,Daishon Smith Turnover.
Long Beach State,Wichita State,21,28,15,10,0,Justin Bibbins missed Three Point Jumper.
Long Beach State,Wichita State,21,28,15,10,0,Javonntie Jackson Offensive Rebound.
Long Beach State,Wichita State,23,28,15,14,1,Javonntie Jackson made Layup.
Long Beach State,Wichita State,23,30,15,29,1,Daishon Smith made Jumper.
Long Beach State,Wichita State,23,30,15,37,0,Foul on Eric Hamilton.
Long Beach State,Wichita State,24,30,15,37,1,Temidayo Yussuf made Free Throw.
Long Beach State,Wichita State,24,30,15,37,0,Temidayo Yussuf missed Free Throw.
Long Beach State,Wichita State,24,30,15,37,0,Wichita St Defensive Rebound.
Long Beach State,Wichita State,24,32,15,57,1,Conner Frankamp made Jumper.
Long Beach State,Wichita State,24,32,16,18,0,Gabe Levin missed Three Point Jumper.
Long Beach State,Wichita State,24,32,16,18,0,LaRond Williams Offensive Rebound.
Long Beach State,Wichita State,24,32,16,20,0,Foul on Eric Hamilton.
Long Beach State,Wichita State,24,32,16,20,0,Long Beach St  Timeout
Long Beach State,Wichita State,25,32,16,20,1,LaRond Williams made Free Throw.
Long Beach State,Wichita State,25,32,16,20,0,LaRond Williams missed Free Throw.
Long Beach State,Wichita State,25,32,16,20,0,Zach Brown Defensive Rebound.
Long Beach State,Wichita State,25,32,16,35,0,Zach Brown Turnover.
Long Beach State,Wichita State,25,32,16,35,0,Foul on Zach Brown.
Long Beach State,Wichita State,25,32,16,47,0,Foul on LaRond Williams.
Long Beach State,Wichita State,25,32,16,47,0,LaRond Williams Turnover.
Long Beach State,Wichita State,25,35,17,1,1,Landry Shamet made Three Point Jumper. Assisted by Zach Brown.
Long Beach State,Wichita State,25,35,17,27,0,Foul on Landry Shamet.
Long Beach State,Wichita State,26,35,17,27,1,Gabe Levin made Free Throw.
Long Beach State,Wichita State,27,35,17,27,1,Gabe Levin made Free Throw.
Long Beach State,Wichita State,27,38,17,40,1,Zach Brown made Three Point Jumper. Assisted by Austin Reaves.
Long Beach State,Wichita State,27,38,17,56,0,Justin Bibbins missed Layup.
Long Beach State,Wichita State,27,38,17,56,0,Gabe Levin Offensive Rebound.
Long Beach State,Wichita State,29,38,18,1,1,Gabe Levin made Two Point Tip Shot.
Long Beach State,Wichita State,29,38,18,12,0,Austin Reaves missed Three Point Jumper.
Long Beach State,Wichita State,29,38,18,12,0,Darral Willis Jr. Offensive Rebound.
Long Beach State,Wichita State,29,38,18,19,0,Rashard Kelly missed Layup.
Long Beach State,Wichita State,29,38,18,19,0,Rashard Kelly Offensive Rebound.
Long Beach State,Wichita State,29,38,18,19,0,Foul on Javonntie Jackson.
Long Beach State,Wichita State,29,38,18,19,0,Rashard Kelly missed Free Throw.
Long Beach State,Wichita State,29,38,18,19,0,Wichita St Deadball Team Rebound.
Long Beach State,Wichita State,29,39,18,19,1,Rashard Kelly made Free Throw.
Long Beach State,Wichita State,29,39,18,30,0,Gabe Levin missed Layup.
Long Beach State,Wichita State,29,39,18,30,0,Rashard Kelly Block.
Long Beach State,Wichita State,29,39,18,30,0,Long Beach St Offensive Rebound.
Long Beach State,Wichita State,29,39,18,33,0,Barry Ogalue Turnover.
Long Beach State,Wichita State,29,41,18,42,1,Darral Willis Jr. made Layup.
Long Beach State,Wichita State,31,41,18,53,1,Noah Blackwell made Jumper. Assisted by Gabe Levin.
Long Beach State,Wichita State,31,41,19,3,0,Zach Brown missed Three Point Jumper.
Long Beach State,Wichita State,31,41,19,3,0,Long Beach St Defensive Rebound.
Long Beach State,Wichita State,31,41,19,18,0,Justin Bibbins missed Layup.
Long Beach State,Wichita State,31,41,19,18,0,Darral Willis Jr. Block.
Long Beach State,Wichita State,31,41,19,19,0,Long Beach St Offensive Rebound.
Long Beach State,Wichita State,31,41,19,19,0,Justin Bibbins missed Jumper.
Long Beach State,Wichita State,31,41,19,19,0,Rashard Kelly Defensive Rebound.
Long Beach State,Wichita State,31,43,19,47,1,Conner Frankamp made Jumper.
Long Beach State,Wichita State,31,43,19,52,0,Foul on Darral Willis Jr..
Long Beach State,Wichita State,32,43,19,52,1,Evan Payne made Free Throw.
Long Beach State,Wichita State,33,43,19,52,1,Evan Payne made Free Throw.
Long Beach State,Wichita State,33,43,20,0,0,End of 1st half
Long Beach State,Wichita State,33,43,20,21,0,Evan Payne missed Three Point Jumper.
Long Beach State,Wichita State,33,43,20,21,0,Conner Frankamp Defensive Rebound.
Long Beach State,Wichita State,33,43,20,29,0,Landry Shamet missed Three Point Jumper.
Long Beach State,Wichita State,33,43,20,29,0,Gabe Levin Defensive Rebound.
Long Beach State,Wichita State,35,43,20,41,1,Mason Riggins made Layup. Assisted by Justin Bibbins.
Long Beach State,Wichita State,35,43,20,41,0,Foul on Zach Brown.
Long Beach State,Wichita State,36,43,20,41,1,Mason Riggins made Free Throw.
Long Beach State,Wichita State,36,43,20,55,0,Foul on Justin Bibbins.
Long Beach State,Wichita State,36,43,21,11,0,Rashard Kelly missed Jumper.
Long Beach State,Wichita State,36,43,21,11,0,Justin Bibbins Defensive Rebound.
Long Beach State,Wichita State,36,43,21,21,0,Evan Payne missed Three Point Jumper.
Long Beach State,Wichita State,36,43,21,21,0,Javonntie Jackson Offensive Rebound.
Long Beach State,Wichita State,38,43,21,33,1,Javonntie Jackson made Layup.
Long Beach State,Wichita State,38,46,21,50,1,Conner Frankamp made Three Point Jumper. Assisted by Landry Shamet.
Long Beach State,Wichita State,38,46,22,19,0,Justin Bibbins missed Three Point Jumper.
Long Beach State,Wichita State,38,46,22,19,0,Zach Brown Defensive Rebound.
Long Beach State,Wichita State,38,46,22,31,0,Conner Frankamp Turnover.
Long Beach State,Wichita State,38,46,22,32,0,Evan Payne Steal.
Long Beach State,Wichita State,38,46,22,49,0,Justin Bibbins missed Three Point Jumper.
Long Beach State,Wichita State,38,46,22,49,0,Wichita St Defensive Rebound.
Long Beach State,Wichita State,38,48,23,15,1,Zach Brown made Layup.
Long Beach State,Wichita State,38,48,23,36,0,Evan Payne missed Layup.
Long Beach State,Wichita State,38,48,23,36,0,Shaquille Morris Block.
Long Beach State,Wichita State,38,48,23,36,0,Evan Payne Offensive Rebound.
Long Beach State,Wichita State,38,48,23,36,0,Foul on Landry Shamet.
Long Beach State,Wichita State,38,48,23,41,0,Gabe Levin missed Layup.
Long Beach State,Wichita State,38,48,23,41,0,Shaquille Morris Block.
Long Beach State,Wichita State,38,48,23,41,0,Wichita St Defensive Rebound.
Long Beach State,Wichita State,38,48,23,46,0,Noah Blackwell Turnover.
Long Beach State,Wichita State,38,48,23,47,0,Zach Brown Steal.
Long Beach State,Wichita State,38,50,23,50,1,Zach Brown made Dunk.
Long Beach State,Wichita State,38,50,24,2,0,Long Beach St  Timeout
Long Beach State,Wichita State,38,50,24,23,0,Javonntie Jackson missed Jumper.
Long Beach State,Wichita State,38,50,24,23,0,Mason Riggins Offensive Rebound.
Long Beach State,Wichita State,38,50,24,28,0,Justin Bibbins missed Three Point Jumper.
Long Beach State,Wichita State,38,50,24,28,0,Zach Brown Defensive Rebound.
Long Beach State,Wichita State,38,50,24,38,0,Foul on Mason Riggins.
Long Beach State,Wichita State,38,50,24,38,0,Wichita St  Timeout
Long Beach State,Wichita State,38,53,24,42,1,Daishon Smith made Three Point Jumper. Assisted by Darral Willis Jr..
Long Beach State,Wichita State,38,53,24,59,0,Foul on Darral Willis Jr..
Long Beach State,Wichita State,38,53,25,2,0,Noah Blackwell missed Three Point Jumper.
Long Beach State,Wichita State,38,53,25,2,0,Eric Hamilton Defensive Rebound.
Long Beach State,Wichita State,38,53,25,23,0,Shaquille Morris Turnover.
Long Beach State,Wichita State,38,53,25,24,0,Javonntie Jackson Steal.
Long Beach State,Wichita State,38,53,25,31,0,Gabe Levin missed Three Point Jumper.
Long Beach State,Wichita State,38,53,25,31,0,Daishon Smith Defensive Rebound.
Long Beach State,Wichita State,38,56,25,44,1,Daishon Smith made Three Point Jumper.
Long Beach State,Wichita State,38,56,26,12,0,Justin Bibbins Turnover.
Long Beach State,Wichita State,38,56,26,12,0,Daishon Smith Steal.
Long Beach State,Wichita State,38,58,26,12,1,Daishon Smith made Dunk. Assisted by Zach Brown.
Long Beach State,Wichita State,38,58,26,27,0,Noah Blackwell Turnover.
Long Beach State,Wichita State,38,58,26,28,0,Shaquille Morris Steal.
Long Beach State,Wichita State,38,58,26,41,0,Eric Hamilton Turnover.
Long Beach State,Wichita State,38,58,26,54,0,Temidayo Yussuf Turnover.
Long Beach State,Wichita State,38,58,26,56,0,Daishon Smith Steal.
Long Beach State,Wichita State,38,58,26,59,0,Eric Hamilton Turnover.
Long Beach State,Wichita State,38,58,27,0,0,Jordan Griffin Steal.
Long Beach State,Wichita State,38,58,27,2,0,Loren Jackson missed Three Point Jumper.
Long Beach State,Wichita State,38,58,27,2,0,Eric Hamilton Defensive Rebound.
Long Beach State,Wichita State,38,61,27,7,1,Conner Frankamp made Three Point Jumper. Assisted by Markis McDuffie.
Long Beach State,Wichita State,38,61,27,21,0,Loren Jackson Turnover.
Long Beach State,Wichita State,38,61,27,34,0,Foul on Eric Hamilton.
Long Beach State,Wichita State,38,61,27,34,0,Eric Hamilton Turnover.
Long Beach State,Wichita State,38,61,27,45,0,Foul on Roschon Prince.
Long Beach State,Wichita State,38,61,27,45,0,Roschon Prince Turnover.
Long Beach State,Wichita State,38,61,27,51,0,Shaquille Morris Turnover.
Long Beach State,Wichita State,38,61,28,0,0,Jordan Griffin missed Three Point Jumper.
Long Beach State,Wichita State,38,61,28,0,0,Wichita St Defensive Rebound.
Long Beach State,Wichita State,38,61,28,4,0,Foul on Roschon Prince.
Long Beach State,Wichita State,38,61,28,4,0,Wichita St  Timeout
Long Beach State,Wichita State,38,64,28,14,1,Zach Brown made Three Point Jumper. Assisted by Austin Reaves.
Long Beach State,Wichita State,40,64,28,45,1,Noah Blackwell made Jumper.
Long Beach State,Wichita State,40,66,29,13,1,Austin Reaves made Jumper.
Long Beach State,Wichita State,40,66,29,24,0,Jordan Griffin Turnover.
Long Beach State,Wichita State,40,66,29,42,0,Foul on Gabe Levin.
Long Beach State,Wichita State,40,67,29,42,1,Zach Brown made Free Throw.
Long Beach State,Wichita State,40,67,29,42,0,Zach Brown missed Free Throw.
Long Beach State,Wichita State,40,67,29,42,0,Gabe Levin Defensive Rebound.
Long Beach State,Wichita State,40,67,29,57,0,Foul on Markis McDuffie.
Long Beach State,Wichita State,40,67,29,58,0,Foul on Gabe Levin.
Long Beach State,Wichita State,40,67,29,58,0,Gabe Levin Turnover.
Long Beach State,Wichita State,40,67,30,16,0,Foul on Rauno Nurger.
Long Beach State,Wichita State,40,67,30,16,0,Rauno Nurger Turnover.
Long Beach State,Wichita State,40,67,30,26,0,Evan Payne missed Jumper.
Long Beach State,Wichita State,40,67,30,26,0,Daishon Smith Defensive Rebound.
Long Beach State,Wichita State,40,67,30,36,0,Zach Brown Turnover.
Long Beach State,Wichita State,40,67,30,37,0,Mason Riggins Steal.
Long Beach State,Wichita State,40,67,30,44,0,Evan Payne missed Layup.
Long Beach State,Wichita State,40,67,30,44,0,Long Beach St Offensive Rebound.
Long Beach State,Wichita State,40,67,30,52,0,Justin Bibbins missed Jumper.
Long Beach State,Wichita State,40,67,30,52,0,Markis McDuffie Defensive Rebound.
Long Beach State,Wichita State,40,69,30,58,1,Austin Reaves made Layup.
Long Beach State,Wichita State,40,69,31,8,0,Foul on Gabe Levin.
Long Beach State,Wichita State,40,69,31,8,0,Gabe Levin Turnover.
Long Beach State,Wichita State,40,69,31,17,0,Austin Reaves Turnover.
Long Beach State,Wichita State,40,69,31,19,0,Evan Payne Steal.
Long Beach State,Wichita State,40,69,31,23,0,Evan Payne missed Jumper.
Long Beach State,Wichita State,40,69,31,23,0,Javonntie Jackson Offensive Rebound.
Long Beach State,Wichita State,40,69,31,28,0,Javonntie Jackson missed Layup.
Long Beach State,Wichita State,40,69,31,28,0,Shaquille Morris Block.
Long Beach State,Wichita State,40,69,31,30,0,Rashard Kelly Defensive Rebound.
Long Beach State,Wichita State,40,72,31,53,1,Austin Reaves made Three Point Jumper. Assisted by Daishon Smith.
Long Beach State,Wichita State,40,72,32,29,0,Justin Bibbins missed Jumper.
Long Beach State,Wichita State,40,72,32,29,0,Javonntie Jackson Offensive Rebound.
Long Beach State,Wichita State,40,72,32,31,0,Foul on Shaquille Morris.
Long Beach State,Wichita State,40,72,32,31,0,Long Beach St  Timeout
Long Beach State,Wichita State,41,72,32,31,1,Mason Riggins made Free Throw.
Long Beach State,Wichita State,41,72,32,31,0,Mason Riggins missed Free Throw.
Long Beach State,Wichita State,41,72,32,31,0,Austin Reaves Defensive Rebound.
Long Beach State,Wichita State,41,72,32,39,0,Foul on Evan Payne.
Long Beach State,Wichita State,41,72,32,39,0,Daishon Smith missed Free Throw.
Long Beach State,Wichita State,41,72,32,39,0,Wichita St Deadball Team Rebound.
Long Beach State,Wichita State,41,73,32,39,1,Daishon Smith made Free Throw.
Long Beach State,Wichita State,41,73,32,50,0,Evan Payne Turnover.
Long Beach State,Wichita State,41,73,32,51,0,Rashard Kelly Steal.
Long Beach State,Wichita State,41,73,32,55,0,C.J. Keyser Turnover.
Long Beach State,Wichita State,44,73,33,12,1,Gabe Levin made Three Point Jumper. Assisted by Evan Payne.
Long Beach State,Wichita State,44,73,33,44,0,Daishon Smith missed Three Point Jumper.
Long Beach State,Wichita State,44,73,33,44,0,C.J. Keyser Offensive Rebound.
Long Beach State,Wichita State,44,73,33,49,0,C.J. Keyser missed Layup.
Long Beach State,Wichita State,44,73,33,49,0,Mason Riggins Block.
Long Beach State,Wichita State,44,73,33,49,0,Wichita St Offensive Rebound.
Long Beach State,Wichita State,44,76,34,5,1,Austin Reaves made Three Point Jumper. Assisted by Daishon Smith.
Long Beach State,Wichita State,44,76,34,14,0,Foul on Shaquille Morris.
Long Beach State,Wichita State,45,76,34,14,1,LaRond Williams made Free Throw.
Long Beach State,Wichita State,45,76,34,14,0,LaRond Williams missed Free Throw.
Long Beach State,Wichita State,45,76,34,14,0,Darral Willis Jr. Defensive Rebound.
Long Beach State,Wichita State,45,76,34,32,0,Conner Frankamp missed Three Point Jumper.
Long Beach State,Wichita State,45,76,34,32,0,Long Beach St Defensive Rebound.
Long Beach State,Wichita State,47,76,34,52,1,Loren Jackson made Layup.
Long Beach State,Wichita State,47,76,35,6,0,Eric Hamilton missed Three Point Jumper.
Long Beach State,Wichita State,47,76,35,6,0,Anson Moye Defensive Rebound.
Long Beach State,Wichita State,47,76,35,20,0,Foul on Conner Frankamp.
Long Beach State,Wichita State,47,76,35,20,0,Loren Jackson missed Free Throw.
Long Beach State,Wichita State,47,76,35,20,0,Rauno Nurger Defensive Rebound.
Long Beach State,Wichita State,47,76,35,21,0,Foul on LaRond Williams.
Long Beach State,Wichita State,47,77,35,21,1,Rauno Nurger made Free Throw.
Long Beach State,Wichita State,47,77,35,21,0,Rauno Nurger missed Free Throw.
Long Beach State,Wichita State,47,77,35,21,0,Anson Moye Defensive Rebound.
Long Beach State,Wichita State,47,77,35,24,0,Loren Jackson missed Layup.
Long Beach State,Wichita State,47,77,35,24,0,Zach Brown Defensive Rebound.
Long Beach State,Wichita State,47,79,35,28,1,Landry Shamet made Layup. Assisted by Zach Brown.
Long Beach State,Wichita State,49,79,35,55,1,Roschon Prince made Layup.
Long Beach State,Wichita State,49,79,35,55,0,Foul on Eric Hamilton.
Long Beach State,Wichita State,50,79,35,55,1,Roschon Prince made Free Throw.
Long Beach State,Wichita State,50,79,36,15,0,Foul on LaRond Williams.
Long Beach State,Wichita State,50,79,36,15,0,Wichita St  Timeout
