Long Beach State,Wichita State,50,79,36,15,0,Darral Willis Jr. missed Free Throw.
Long Beach State,Wichita State,50,79,36,15,0,Wichita St Deadball Team Rebound.
Long Beach State,Wichita State,50,80,36,15,1,Darral Willis Jr. made Free Throw.
Long Beach State,Wichita State,50,80,36,26,0,Loren Jackson missed Jumper.
Long Beach State,Wichita State,50,80,36,26,0,Daishon Smith Defensive Rebound.
Long Beach State,Wichita State,50,82,36,30,1,Markis McDuffie made Layup. Assisted by Daishon Smith.
Long Beach State,Wichita State,52,82,36,49,1,Roschon Prince made Layup.
Long Beach State,Wichita State,52,82,36,59,0,Foul on LaRond Williams.
Long Beach State,Wichita State,52,83,36,59,1,Rauno Nurger made Free Throw.
Long Beach State,Wichita State,52,84,36,59,1,Rauno Nurger made Free Throw.
Long Beach State,Wichita State,52,84,37,5,0,Roschon Prince Turnover.
Long Beach State,Wichita State,52,84,37,9,0,Darral Willis Jr. missed Layup.
Long Beach State,Wichita State,52,84,37,9,0,Markis McDuffie Offensive Rebound.
Long Beach State,Wichita State,52,86,37,17,1,Markis McDuffie made Dunk.
Long Beach State,Wichita State,52,86,37,40,0,Foul on Daishon Smith.
Long Beach State,Wichita State,52,86,37,42,0,Anson Moye missed Free Throw.
Long Beach State,Wichita State,52,86,37,42,0,Long Beach St Deadball Team Rebound.
Long Beach State,Wichita State,52,86,37,42,0,Anson Moye missed Free Throw.
Long Beach State,Wichita State,52,86,37,42,0,Darral Willis Jr. Defensive Rebound.
Long Beach State,Wichita State,52,86,37,43,0,Foul on Roschon Prince.
Long Beach State,Wichita State,52,86,37,43,0,Rauno Nurger missed Free Throw.
Long Beach State,Wichita State,52,86,37,43,0,Wichita St Deadball Team Rebound.
Long Beach State,Wichita State,52,87,37,43,1,Rauno Nurger made Free Throw.
Long Beach State,Wichita State,55,87,37,52,1,Jordan Griffin made Three Point Jumper. Assisted by Anson Moye.
Long Beach State,Wichita State,55,87,38,12,0,John Robert Simon Turnover.
Long Beach State,Wichita State,55,87,38,13,0,Anson Moye Steal.
Long Beach State,Wichita State,55,87,38,16,0,Jordan Griffin missed Layup.
Long Beach State,Wichita State,55,87,38,16,0,Rauno Nurger Defensive Rebound.
Long Beach State,Wichita State,55,89,38,29,1,Darral Willis Jr. made Jumper. Assisted by John Robert Simon.
Long Beach State,Wichita State,55,89,38,49,0,Jordan Griffin missed Three Point Jumper.
Long Beach State,Wichita State,55,89,38,49,0,Wichita St Defensive Rebound.
Long Beach State,Wichita State,55,89,39,12,0,Brett Barney missed Jumper.
Long Beach State,Wichita State,55,89,39,12,0,Mason Riggins Defensive Rebound.
Long Beach State,Wichita State,55,89,39,31,0,Roschon Prince Turnover.
Long Beach State,Wichita State,55,89,39,32,0,Zach Bush Steal.
Long Beach State,Wichita State,55,89,39,36,0,C.J. Keyser missed Layup.
Long Beach State,Wichita State,55,89,39,36,0,Kaelen Malone Offensive Rebound.
Long Beach State,Wichita State,55,91,39,38,1,Kaelen Malone made Two Point Tip Shot.
Long Beach State,Wichita State,55,91,39,52,0,Roschon Prince missed Layup.
Long Beach State,Wichita State,55,91,39,52,0,John Robert Simon Defensive Rebound.
Long Beach State,Wichita State,55,91,39,53,0,Foul on Roschon Prince.
Long Beach State,Wichita State,55,91,39,53,0,John Robert Simon missed Free Throw.
Long Beach State,Wichita State,55,91,39,53,0,Wichita St Deadball Team Rebound.
Long Beach State,Wichita State,55,92,39,53,1,John Robert Simon made Free Throw.
Long Beach State,Wichita State,55,92,40,0,0,Jordan Griffin missed Three Point Jumper.
Long Beach State,Wichita State,55,92,40,0,0,John Robert Simon Defensive Rebound.
Long Beach State,Wichita State,55,92,40,0,0,End of Game
