Away Team,Home Team,Away Score,Home Score,Minute,Second,isScoringPosession,Desc.
Warren Wilson,Eastern Kentucky,0,3,0,18,1,Glenn Cosey made Three Point Jumper. Assisted by Marcus Lewis.
Warren Wilson,Eastern Kentucky,0,3,0,39,0,Ty Johnson Turnover.
Warren Wilson,Eastern Kentucky,0,3,0,57,0,Glenn Cosey missed Three Point Jumper.
Warren Wilson,Eastern Kentucky,0,3,0,57,0,Warren Wilson Defensive Rebound.
Warren Wilson,Eastern Kentucky,3,3,1,14,1,Ty Johnson made Three Point Jumper. Assisted by Justin Gonyea.
Warren Wilson,Eastern Kentucky,3,3,1,34,0,Glenn Cosey missed Three Point Jumper.
Warren Wilson,Eastern Kentucky,3,3,1,34,0,Rashad Ali Defensive Rebound.
Warren Wilson,Eastern Kentucky,3,3,1,47,0,Tyler Triplett missed Three Point Jumper.
Warren Wilson,Eastern Kentucky,3,3,1,47,0,Glenn Cosey Defensive Rebound.
Warren Wilson,Eastern Kentucky,3,3,1,51,0,Eastern Kentucky  Timeout
Warren Wilson,Eastern Kentucky,3,6,2,14,1,Tarius Johnson made Three Point Jumper. Assisted by Glenn Cosey.
Warren Wilson,Eastern Kentucky,3,6,2,30,0,Justin Gonyea Turnover.
Warren Wilson,Eastern Kentucky,3,6,2,31,0,Corey Walden Steal.
Warren Wilson,Eastern Kentucky,3,6,2,55,0,Eric Stutz Turnover.
Warren Wilson,Eastern Kentucky,3,6,3,2,0,Tyler Triplett Steal.
Warren Wilson,Eastern Kentucky,3,6,3,13,0,Ty Johnson Turnover.
Warren Wilson,Eastern Kentucky,3,6,3,13,0,Marcus Lewis Steal.
Warren Wilson,Eastern Kentucky,3,6,3,19,0,Marcus Lewis Turnover.
Warren Wilson,Eastern Kentucky,3,6,3,28,0,Ty Johnson Turnover.
Warren Wilson,Eastern Kentucky,3,6,3,29,0,Corey Walden Steal.
Warren Wilson,Eastern Kentucky,3,8,3,32,1,Glenn Cosey made Layup. Assisted by Corey Walden.
Warren Wilson,Eastern Kentucky,3,8,3,49,0,Ty Johnson missed Three Point Jumper.
Warren Wilson,Eastern Kentucky,3,8,3,49,0,Warren Wilson Deadball Team Rebound.
Warren Wilson,Eastern Kentucky,3,8,3,52,0,Foul on Tarius Johnson.
Warren Wilson,Eastern Kentucky,3,8,3,52,0,Warren Wilson  Turnover.
Warren Wilson,Eastern Kentucky,3,8,4,12,0,Tarius Johnson Turnover.
Warren Wilson,Eastern Kentucky,3,8,4,12,0,Official TV Timeout
Warren Wilson,Eastern Kentucky,3,8,4,30,0,Justin Gonyea Turnover.
Warren Wilson,Eastern Kentucky,3,8,4,31,0,Glenn Cosey Steal.
Warren Wilson,Eastern Kentucky,3,8,4,36,0,Foul on Justin Gonyea.
Warren Wilson,Eastern Kentucky,3,9,4,36,1,Tarius Johnson made Free Throw.
Warren Wilson,Eastern Kentucky,3,10,4,36,1,Tarius Johnson made Free Throw.
Warren Wilson,Eastern Kentucky,3,10,4,45,0,Foul on Corey Walden.
Warren Wilson,Eastern Kentucky,3,10,4,58,0,Foul on Jeff Johnson.
Warren Wilson,Eastern Kentucky,3,10,4,59,0,Tyler Triplett Turnover.
Warren Wilson,Eastern Kentucky,3,10,5,0,0,Corey Walden Steal.
Warren Wilson,Eastern Kentucky,3,12,5,3,1,Glenn Cosey made Layup. Assisted by Corey Walden.
Warren Wilson,Eastern Kentucky,3,12,5,17,0,Tyler Triplett missed Three Point Jumper.
Warren Wilson,Eastern Kentucky,3,12,5,17,0,Timmy Knipp Defensive Rebound.
Warren Wilson,Eastern Kentucky,3,14,5,37,1,Timmy Knipp made Layup. Assisted by Orlando Williams.
Warren Wilson,Eastern Kentucky,3,14,5,52,0,Timmy Johnson missed Layup.
Warren Wilson,Eastern Kentucky,3,14,5,52,0,Timmy Knipp Block.
Warren Wilson,Eastern Kentucky,3,14,5,53,0,Timmy Knipp Defensive Rebound.
Warren Wilson,Eastern Kentucky,3,16,5,57,1,Orlando Williams made Layup. Assisted by Timmy Knipp.
Warren Wilson,Eastern Kentucky,3,16,5,57,0,Foul on Tyler Triplett.
Warren Wilson,Eastern Kentucky,3,16,5,57,0,Orlando Williams missed Free Throw.
Warren Wilson,Eastern Kentucky,3,16,5,57,0,Jeff Johnson Offensive Rebound.
Warren Wilson,Eastern Kentucky,3,19,5,57,1,Glenn Cosey made Three Point Jumper. Assisted by Timmy Knipp.
Warren Wilson,Eastern Kentucky,3,19,6,14,0,Rashad Ali missed Jumper.
Warren Wilson,Eastern Kentucky,3,19,6,14,0,Corey Walden Defensive Rebound.
Warren Wilson,Eastern Kentucky,3,22,6,23,1,Orlando Williams made Three Point Jumper. Assisted by Glenn Cosey.
Warren Wilson,Eastern Kentucky,3,22,6,40,0,Justin Gonyea missed Jumper.
Warren Wilson,Eastern Kentucky,3,22,6,40,0,Orlando Williams Defensive Rebound.
Warren Wilson,Eastern Kentucky,3,25,6,49,1,Timmy Knipp made Three Point Jumper. Assisted by Glenn Cosey.
Warren Wilson,Eastern Kentucky,3,25,7,16,0,Timmy Johnson missed Layup.
Warren Wilson,Eastern Kentucky,3,25,7,16,0,Rashad Ali Offensive Rebound.
Warren Wilson,Eastern Kentucky,5,25,7,20,1,Rashad Ali made Two Point Tip Shot.
Warren Wilson,Eastern Kentucky,5,25,8,2,0,Foul on Rashad Ali.
Warren Wilson,Eastern Kentucky,5,25,8,2,0,Official TV Timeout
Warren Wilson,Eastern Kentucky,5,25,8,2,0,Eric Stutz missed Free Throw.
Warren Wilson,Eastern Kentucky,5,25,8,2,0,Eastern Kentucky Deadball Team Rebound.
Warren Wilson,Eastern Kentucky,5,26,8,2,1,Eric Stutz made Free Throw.
Warren Wilson,Eastern Kentucky,7,26,8,16,1,Rashad Ali made Layup. Assisted by Timmy Johnson.
Warren Wilson,Eastern Kentucky,7,29,8,27,1,Orlando Williams made Three Point Jumper. Assisted by Glenn Cosey.
Warren Wilson,Eastern Kentucky,9,29,8,50,1,Ty Johnson made Layup.
Warren Wilson,Eastern Kentucky,9,29,9,17,0,Timmy Knipp missed Three Point Jumper.
Warren Wilson,Eastern Kentucky,9,29,9,17,0,Warren Wilson Deadball Team Rebound.
Warren Wilson,Eastern Kentucky,9,29,9,20,0,Foul on Eric Stutz.
Warren Wilson,Eastern Kentucky,9,29,9,34,0,Warren Wilson  Timeout
Warren Wilson,Eastern Kentucky,9,29,9,34,0,Foul on Isaac McGlone.
Warren Wilson,Eastern Kentucky,9,29,9,40,0,Timmy Johnson Turnover.
Warren Wilson,Eastern Kentucky,9,29,9,40,0,Tarius Johnson Steal.
Warren Wilson,Eastern Kentucky,9,29,9,42,0,Foul on Thomas Hay.
Warren Wilson,Eastern Kentucky,9,30,9,42,1,Marcus Lewis made Free Throw.
Warren Wilson,Eastern Kentucky,9,30,9,42,0,Marcus Lewis missed Free Throw.
Warren Wilson,Eastern Kentucky,9,30,9,42,0,Justin Gonyea Defensive Rebound.
Warren Wilson,Eastern Kentucky,9,30,9,56,0,Ty Johnson Turnover.
Warren Wilson,Eastern Kentucky,9,30,9,58,0,Eric Stutz Steal.
Warren Wilson,Eastern Kentucky,9,30,9,59,0,Eric Stutz Turnover.
Warren Wilson,Eastern Kentucky,9,30,10,0,0,Justin Gonyea Steal.
Warren Wilson,Eastern Kentucky,9,30,10,14,0,Justin Gonyea Turnover.
Warren Wilson,Eastern Kentucky,9,30,10,15,0,Isaac McGlone Steal.
Warren Wilson,Eastern Kentucky,9,32,10,18,1,Orlando Williams made Layup. Assisted by Marcus Lewis.
Warren Wilson,Eastern Kentucky,9,32,10,40,0,Justin Gonyea Turnover.
Warren Wilson,Eastern Kentucky,9,32,10,42,0,Tarius Johnson Steal.
Warren Wilson,Eastern Kentucky,9,34,10,44,1,Eric Stutz made Layup. Assisted by Marcus Lewis.
Warren Wilson,Eastern Kentucky,9,34,11,6,0,Timur Oktay Turnover.
Warren Wilson,Eastern Kentucky,9,34,11,8,0,Marcus Lewis Steal.
Warren Wilson,Eastern Kentucky,9,36,11,11,1,Marcus Lewis made Dunk. Assisted by Orlando Williams.
Warren Wilson,Eastern Kentucky,9,36,11,25,0,Foul on Marcus Lewis.
Warren Wilson,Eastern Kentucky,11,36,11,30,1,Ty Johnson made Layup.
Warren Wilson,Eastern Kentucky,11,39,11,55,1,Corey Walden made Three Point Jumper. Assisted by Glenn Cosey.
Warren Wilson,Eastern Kentucky,11,39,12,24,0,Timmy Johnson Turnover.
Warren Wilson,Eastern Kentucky,11,39,12,24,0,Marcus Lewis Steal.
Warren Wilson,Eastern Kentucky,11,39,12,24,0,Foul on Timmy Johnson.
Warren Wilson,Eastern Kentucky,11,39,12,24,0,Official TV Timeout
Warren Wilson,Eastern Kentucky,11,39,12,44,0,Foul on Timur Oktay.
Warren Wilson,Eastern Kentucky,11,39,12,51,0,Tarius Johnson missed Three Point Jumper.
Warren Wilson,Eastern Kentucky,11,39,12,51,0,Timmy Johnson Defensive Rebound.
Warren Wilson,Eastern Kentucky,11,39,13,7,0,Ty Johnson Turnover.
Warren Wilson,Eastern Kentucky,11,39,13,8,0,Glenn Cosey Steal.
Warren Wilson,Eastern Kentucky,11,41,13,11,1,Deverin Muff made Dunk. Assisted by Glenn Cosey.
Warren Wilson,Eastern Kentucky,11,41,13,27,0,Ty Johnson Turnover.
Warren Wilson,Eastern Kentucky,11,41,13,27,0,Corey Walden Steal.
Warren Wilson,Eastern Kentucky,11,41,13,42,0,Marcus Lewis Turnover.
Warren Wilson,Eastern Kentucky,11,41,13,51,0,Justin Gonyea missed Jumper.
Warren Wilson,Eastern Kentucky,11,41,13,51,0,Glenn Cosey Defensive Rebound.
Warren Wilson,Eastern Kentucky,11,44,14,0,1,Glenn Cosey made Three Point Jumper.
Warren Wilson,Eastern Kentucky,11,44,14,17,0,Foul on Corey Walden.
Warren Wilson,Eastern Kentucky,11,44,14,17,0,Tyler Triplett missed Free Throw.
Warren Wilson,Eastern Kentucky,11,44,14,17,0,Warren Wilson Deadball Team Rebound.
Warren Wilson,Eastern Kentucky,11,44,14,17,0,Tyler Triplett missed Free Throw.
Warren Wilson,Eastern Kentucky,11,44,14,17,0,Orlando Williams Defensive Rebound.
Warren Wilson,Eastern Kentucky,11,46,14,36,1,Isaac McGlone made Layup.
Warren Wilson,Eastern Kentucky,11,46,14,51,0,David Grice Turnover.
Warren Wilson,Eastern Kentucky,11,49,15,10,1,Orlando Williams made Three Point Jumper.
Warren Wilson,Eastern Kentucky,13,49,15,25,1,Timur Oktay made Layup. Assisted by Timmy Johnson.
Warren Wilson,Eastern Kentucky,13,49,15,52,0,Foul on Timur Oktay.
Warren Wilson,Eastern Kentucky,13,50,15,52,1,Glenn Cosey made Free Throw.
Warren Wilson,Eastern Kentucky,13,51,15,52,1,Glenn Cosey made Free Throw.
Warren Wilson,Eastern Kentucky,13,51,16,14,0,Tyler Triplett missed Three Point Jumper.
Warren Wilson,Eastern Kentucky,13,51,16,14,0,Glenn Cosey Defensive Rebound.
Warren Wilson,Eastern Kentucky,13,51,16,25,0,Orlando Williams missed Three Point Jumper.
Warren Wilson,Eastern Kentucky,13,51,16,25,0,Deverin Muff Offensive Rebound.
Warren Wilson,Eastern Kentucky,13,54,16,45,1,Isaac McGlone made Three Point Jumper. Assisted by Orlando Williams.
Warren Wilson,Eastern Kentucky,13,54,17,3,0,Foul on Deverin Muff.
Warren Wilson,Eastern Kentucky,13,54,17,3,0,Official TV Timeout
Warren Wilson,Eastern Kentucky,13,54,17,3,0,Rashad Ali missed Free Throw.
Warren Wilson,Eastern Kentucky,13,54,17,3,0,Eastern Kentucky Defensive Rebound.
Warren Wilson,Eastern Kentucky,13,56,17,14,1,Eric Stutz made Jumper. Assisted by Timmy Knipp.
Warren Wilson,Eastern Kentucky,13,56,17,32,0,Justin Gonyea missed Three Point Jumper.
Warren Wilson,Eastern Kentucky,13,56,17,32,0,Eric Stutz Defensive Rebound.
Warren Wilson,Eastern Kentucky,13,56,17,41,0,Marcus Lewis Turnover.
Warren Wilson,Eastern Kentucky,13,56,17,42,0,Ty Johnson Steal.
Warren Wilson,Eastern Kentucky,13,56,17,53,0,Foul on Isaac McGlone.
Warren Wilson,Eastern Kentucky,13,56,17,53,0,Ty Johnson missed Free Throw.
Warren Wilson,Eastern Kentucky,13,56,17,53,0,Marcus Lewis Defensive Rebound.
Warren Wilson,Eastern Kentucky,13,56,18,1,0,Glenn Cosey missed Three Point Jumper.
Warren Wilson,Eastern Kentucky,13,56,18,1,0,Ty Johnson Defensive Rebound.
Warren Wilson,Eastern Kentucky,13,56,18,23,0,Rashad Ali Turnover.
Warren Wilson,Eastern Kentucky,13,56,18,24,0,Timmy Knipp Steal.
Warren Wilson,Eastern Kentucky,13,58,18,26,1,Glenn Cosey made Layup. Assisted by Timmy Knipp.
Warren Wilson,Eastern Kentucky,13,58,18,47,0,Foul on Isaac McGlone.
Warren Wilson,Eastern Kentucky,13,58,18,47,0,Justin Gonyea missed Free Throw.
Warren Wilson,Eastern Kentucky,13,58,18,47,0,Warren Wilson Deadball Team Rebound.
Warren Wilson,Eastern Kentucky,14,58,18,47,1,Justin Gonyea made Free Throw.
Warren Wilson,Eastern Kentucky,14,58,19,0,0,Glenn Cosey missed Three Point Jumper.
Warren Wilson,Eastern Kentucky,14,58,19,0,0,Rashad Ali Defensive Rebound.
Warren Wilson,Eastern Kentucky,14,58,19,9,0,Foul on Orlando Williams.
Warren Wilson,Eastern Kentucky,15,58,19,9,1,Ty Johnson made Free Throw.
Warren Wilson,Eastern Kentucky,15,58,19,9,0,Ty Johnson missed Free Throw.
Warren Wilson,Eastern Kentucky,15,58,19,9,0,Tyler Triplett Offensive Rebound.
Warren Wilson,Eastern Kentucky,17,58,19,9,1,Tyler Triplett made Two Point Tip Shot.
Warren Wilson,Eastern Kentucky,17,58,19,28,0,Marcus Lewis missed Three Point Jumper.
Warren Wilson,Eastern Kentucky,17,58,19,28,0,Rashad Ali Defensive Rebound.
Warren Wilson,Eastern Kentucky,17,58,19,50,0,Ty Johnson Turnover.
Warren Wilson,Eastern Kentucky,17,61,19,58,1,Orlando Williams made Three Point Jumper. Assisted by Glenn Cosey.
Warren Wilson,Eastern Kentucky,17,61,20,0,0,End of 1st half
Warren Wilson,Eastern Kentucky,19,61,20,13,1,Timur Oktay made Layup. Assisted by Tyler Triplett.
Warren Wilson,Eastern Kentucky,19,64,20,30,1,Tarius Johnson made Three Point Jumper. Assisted by Glenn Cosey.
Warren Wilson,Eastern Kentucky,21,64,20,50,1,Timur Oktay made Layup. Assisted by Ty Johnson.
Warren Wilson,Eastern Kentucky,21,64,21,15,0,Corey Walden missed Three Point Jumper.
Warren Wilson,Eastern Kentucky,21,64,21,15,0,Eric Stutz Offensive Rebound.
Warren Wilson,Eastern Kentucky,21,67,21,20,1,Glenn Cosey made Three Point Jumper. Assisted by Eric Stutz.
Warren Wilson,Eastern Kentucky,21,67,21,40,0,Justin Gonyea Turnover.
Warren Wilson,Eastern Kentucky,21,70,21,40,1,Tarius Johnson made Three Point Jumper. Assisted by Glenn Cosey.
Warren Wilson,Eastern Kentucky,21,70,21,40,0,Ty Johnson missed Jumper.
Warren Wilson,Eastern Kentucky,21,70,21,40,0,Marcus Lewis Defensive Rebound.
Warren Wilson,Eastern Kentucky,21,70,21,40,0,Tarius Johnson missed Layup.
Warren Wilson,Eastern Kentucky,21,70,21,40,0,Justin Gonyea Defensive Rebound.
Warren Wilson,Eastern Kentucky,21,70,21,40,0,Timur Oktay Turnover.
Warren Wilson,Eastern Kentucky,21,70,21,40,0,Eric Stutz Steal.
Warren Wilson,Eastern Kentucky,21,73,21,40,1,Glenn Cosey made Three Point Jumper. Assisted by Glenn Cosey.
Warren Wilson,Eastern Kentucky,21,73,21,40,0,Timur Oktay missed Three Point Jumper.
Warren Wilson,Eastern Kentucky,21,73,21,40,0,Ty Johnson Offensive Rebound.
Warren Wilson,Eastern Kentucky,23,73,21,40,1,Rashad Ali made Jumper.
Warren Wilson,Eastern Kentucky,23,73,21,40,0,Eric Stutz missed Three Point Jumper.
Warren Wilson,Eastern Kentucky,23,73,21,40,0,Tyler Triplett Defensive Rebound.
Warren Wilson,Eastern Kentucky,23,73,24,7,0,Official TV Timeout
Warren Wilson,Eastern Kentucky,23,73,24,23,0,Timmy Johnson missed Three Point Jumper.
Warren Wilson,Eastern Kentucky,23,73,24,24,0,Orlando Williams Block.
Warren Wilson,Eastern Kentucky,23,73,24,25,0,Warren Wilson Offensive Rebound.
Warren Wilson,Eastern Kentucky,23,73,24,28,0,Warren Wilson  Turnover.
Warren Wilson,Eastern Kentucky,23,73,24,53,0,Foul on Tyler Triplett.
Warren Wilson,Eastern Kentucky,23,74,24,53,1,Orlando Williams made Free Throw.
Warren Wilson,Eastern Kentucky,23,74,24,53,0,Orlando Williams missed Free Throw.
Warren Wilson,Eastern Kentucky,23,74,24,53,0,Tyler Triplett Defensive Rebound.
Warren Wilson,Eastern Kentucky,23,74,25,18,0,Foul on Tarius Johnson.
Warren Wilson,Eastern Kentucky,23,74,25,18,0,Timmy Johnson missed Free Throw.
Warren Wilson,Eastern Kentucky,23,74,25,18,0,Warren Wilson Deadball Team Rebound.
Warren Wilson,Eastern Kentucky,23,74,25,18,0,Timmy Johnson missed Free Throw.
Warren Wilson,Eastern Kentucky,23,74,25,18,0,Corey Walden Defensive Rebound.
Warren Wilson,Eastern Kentucky,23,74,25,32,0,Isaac McGlone missed Three Point Jumper.
Warren Wilson,Eastern Kentucky,23,74,25,32,0,Timmy Knipp Offensive Rebound.
Warren Wilson,Eastern Kentucky,23,74,25,35,0,Timmy Knipp missed Two Point Tip Shot.
Warren Wilson,Eastern Kentucky,23,74,25,35,0,Eastern Kentucky Offensive Rebound.
Warren Wilson,Eastern Kentucky,23,77,25,52,1,Timmy Knipp made Three Point Jumper. Assisted by Corey Walden.
Warren Wilson,Eastern Kentucky,23,77,26,6,0,Timmy Johnson missed Jumper.
Warren Wilson,Eastern Kentucky,23,77,26,6,0,Jeff Johnson Block.
Warren Wilson,Eastern Kentucky,23,77,26,8,0,Orlando Williams Defensive Rebound.
Warren Wilson,Eastern Kentucky,23,77,26,11,0,Corey Walden Turnover.
Warren Wilson,Eastern Kentucky,25,77,26,23,1,Tyler Triplett made Dunk. Assisted by Ty Johnson.
Warren Wilson,Eastern Kentucky,25,77,26,42,0,Orlando Williams missed Layup.
Warren Wilson,Eastern Kentucky,25,77,26,42,0,Thomas Hay Block.
Warren Wilson,Eastern Kentucky,25,77,26,43,0,Ty Johnson Defensive Rebound.
Warren Wilson,Eastern Kentucky,25,77,26,51,0,Tyler Triplett missed Three Point Jumper.
Warren Wilson,Eastern Kentucky,25,77,26,51,0,Isaac McGlone Defensive Rebound.
Warren Wilson,Eastern Kentucky,25,77,27,11,0,Foul on Timmy Johnson.
Warren Wilson,Eastern Kentucky,25,80,27,27,1,Timmy Knipp made Three Point Jumper. Assisted by Jeff Johnson.
Warren Wilson,Eastern Kentucky,25,80,27,29,0,Eastern Kentucky  Timeout
Warren Wilson,Eastern Kentucky,25,80,27,46,0,Ty Johnson Turnover.
Warren Wilson,Eastern Kentucky,25,80,27,47,0,Glenn Cosey Steal.
Warren Wilson,Eastern Kentucky,25,80,27,55,0,Orlando Williams missed Three Point Jumper.
Warren Wilson,Eastern Kentucky,25,80,27,55,0,Timmy Johnson Defensive Rebound.
Warren Wilson,Eastern Kentucky,25,80,28,6,0,Timmy Johnson Turnover.
Warren Wilson,Eastern Kentucky,25,80,28,7,0,Timmy Knipp Steal.
Warren Wilson,Eastern Kentucky,25,82,28,9,1,Timmy Knipp made Dunk.
Warren Wilson,Eastern Kentucky,25,82,28,20,0,Warren Wilson  Timeout
Warren Wilson,Eastern Kentucky,25,82,28,20,0,Justin Gonyea Turnover.
Warren Wilson,Eastern Kentucky,25,82,28,20,0,Official TV Timeout
Warren Wilson,Eastern Kentucky,25,85,28,33,1,Glenn Cosey made Three Point Jumper. Assisted by Isaac McGlone.
Warren Wilson,Eastern Kentucky,25,85,28,48,0,Foul on Glenn Cosey.
Warren Wilson,Eastern Kentucky,25,85,28,59,0,Foul on Deverin Muff.
Warren Wilson,Eastern Kentucky,25,85,28,59,0,Timmy Johnson missed Free Throw.
Warren Wilson,Eastern Kentucky,25,85,28,59,0,Warren Wilson Deadball Team Rebound.
Warren Wilson,Eastern Kentucky,26,85,28,59,1,Timmy Johnson made Free Throw.
Warren Wilson,Eastern Kentucky,26,87,29,16,1,Marcus Lewis made Layup. Assisted by Orlando Williams.
Warren Wilson,Eastern Kentucky,26,87,29,31,0,Timmy Johnson missed Layup.
Warren Wilson,Eastern Kentucky,26,87,29,31,0,Rashad Ali Offensive Rebound.
Warren Wilson,Eastern Kentucky,28,87,29,37,1,Rashad Ali made Two Point Tip Shot.
Warren Wilson,Eastern Kentucky,28,87,29,47,0,Isaac McGlone missed Three Point Jumper.
Warren Wilson,Eastern Kentucky,28,87,29,47,0,Orlando Williams Offensive Rebound.
Warren Wilson,Eastern Kentucky,28,89,29,59,1,Marcus Lewis made Jumper. Assisted by Isaac McGlone.
Warren Wilson,Eastern Kentucky,28,89,29,59,0,Foul on Ty Johnson.
Warren Wilson,Eastern Kentucky,28,90,29,59,1,Marcus Lewis made Free Throw.
Warren Wilson,Eastern Kentucky,28,90,30,13,0,Thomas Hay missed Layup.
Warren Wilson,Eastern Kentucky,28,90,30,13,0,Thomas Hay Offensive Rebound.
Warren Wilson,Eastern Kentucky,30,90,30,19,1,Ty Johnson made Layup.
Warren Wilson,Eastern Kentucky,30,90,30,32,0,Foul on Ty Johnson.
Warren Wilson,Eastern Kentucky,30,93,30,33,1,Orlando Williams made Three Point Jumper. Assisted by Isaac McGlone.
Warren Wilson,Eastern Kentucky,30,93,30,48,0,Ty Johnson missed Jumper.
Warren Wilson,Eastern Kentucky,30,93,30,48,0,Thomas Hay Offensive Rebound.
Warren Wilson,Eastern Kentucky,30,93,30,53,0,Thomas Hay missed Two Point Tip Shot.
Warren Wilson,Eastern Kentucky,30,93,30,53,0,Deverin Muff Block.
Warren Wilson,Eastern Kentucky,30,93,30,54,0,Tarius Johnson Defensive Rebound.
Warren Wilson,Eastern Kentucky,30,95,30,57,1,Orlando Williams made Layup. Assisted by Tarius Johnson.
Warren Wilson,Eastern Kentucky,30,95,31,6,0,Ty Johnson Turnover.
Warren Wilson,Eastern Kentucky,30,95,31,7,0,Isaac McGlone Steal.
Warren Wilson,Eastern Kentucky,30,95,31,8,0,Foul on Ty Johnson.
Warren Wilson,Eastern Kentucky,30,95,31,10,0,Foul on Thomas Hay.
Warren Wilson,Eastern Kentucky,30,96,31,10,1,Deverin Muff made Free Throw.
Warren Wilson,Eastern Kentucky,30,96,31,10,0,Deverin Muff missed Free Throw.
Warren Wilson,Eastern Kentucky,30,96,31,10,0,Rashad Ali Defensive Rebound.
Warren Wilson,Eastern Kentucky,30,96,31,22,0,David Grice Turnover.
Warren Wilson,Eastern Kentucky,30,96,31,24,0,Marcus Lewis Steal.
Warren Wilson,Eastern Kentucky,30,98,31,27,1,Marcus Lewis made Dunk.
Warren Wilson,Eastern Kentucky,30,98,31,40,0,Ty Johnson Turnover.
Warren Wilson,Eastern Kentucky,30,98,31,41,0,Tarius Johnson Steal.
Warren Wilson,Eastern Kentucky,30,98,31,47,0,Deverin Muff missed Jumper.
Warren Wilson,Eastern Kentucky,30,98,31,47,0,Warren Wilson Defensive Rebound.
Warren Wilson,Eastern Kentucky,30,98,31,51,0,Warren Wilson  Timeout
Warren Wilson,Eastern Kentucky,30,98,32,5,0,Chris Dillard missed Three Point Jumper.
Warren Wilson,Eastern Kentucky,30,98,32,5,0,Marcus Lewis Defensive Rebound.
Warren Wilson,Eastern Kentucky,30,98,32,17,0,Foul on Isaac McGlone.
Warren Wilson,Eastern Kentucky,30,98,32,17,0,Isaac McGlone Turnover.
Warren Wilson,Eastern Kentucky,30,98,32,17,0,Official TV Timeout
Warren Wilson,Eastern Kentucky,33,98,32,31,1,Timur Oktay made Three Point Jumper. Assisted by Ty Johnson.
Warren Wilson,Eastern Kentucky,33,98,32,56,0,Ryan Parsons missed Three Point Jumper.
Warren Wilson,Eastern Kentucky,33,98,32,56,0,Justin Gonyea Defensive Rebound.
Warren Wilson,Eastern Kentucky,35,98,33,7,1,Rashad Ali made Layup. Assisted by Justin Gonyea.
Warren Wilson,Eastern Kentucky,35,98,33,31,0,Foul on Chris Dillard.
Warren Wilson,Eastern Kentucky,35,99,33,31,1,Marcus Lewis made Free Throw.
Warren Wilson,Eastern Kentucky,35,100,33,31,1,Marcus Lewis made Free Throw.
Warren Wilson,Eastern Kentucky,38,100,33,42,1,Ty Johnson made Three Point Jumper. Assisted by Chris Dillard.
Warren Wilson,Eastern Kentucky,38,100,34,5,0,Foul on Rashad Ali.
Warren Wilson,Eastern Kentucky,38,101,34,5,1,Marcus Lewis made Free Throw.
Warren Wilson,Eastern Kentucky,38,101,34,5,0,Marcus Lewis missed Free Throw.
Warren Wilson,Eastern Kentucky,38,101,34,5,0,Justin Gonyea Defensive Rebound.
Warren Wilson,Eastern Kentucky,38,101,34,22,0,Chris Dillard Turnover.
Warren Wilson,Eastern Kentucky,38,101,34,25,0,Ryan Parsons Steal.
Warren Wilson,Eastern Kentucky,38,101,34,26,0,Ryan Parsons Turnover.
Warren Wilson,Eastern Kentucky,38,101,34,28,0,Justin Gonyea Steal.
Warren Wilson,Eastern Kentucky,38,101,34,31,0,Justin Gonyea missed Three Point Jumper.
Warren Wilson,Eastern Kentucky,38,101,34,31,0,Isaac McGlone Defensive Rebound.
Warren Wilson,Eastern Kentucky,38,101,34,35,0,Marcus Lewis missed Three Point Jumper.
Warren Wilson,Eastern Kentucky,38,101,34,35,0,Deverin Muff Offensive Rebound.
Warren Wilson,Eastern Kentucky,38,101,34,41,0,Deverin Muff Turnover.
Warren Wilson,Eastern Kentucky,40,101,34,52,1,Ty Johnson made Jumper.
Warren Wilson,Eastern Kentucky,40,101,35,15,0,Tommy Matthews missed Three Point Jumper.
Warren Wilson,Eastern Kentucky,40,101,35,15,0,Chris Dillard Defensive Rebound.
Warren Wilson,Eastern Kentucky,40,101,35,25,0,Ty Johnson missed Layup.
Warren Wilson,Eastern Kentucky,40,101,35,25,0,Ryan Parsons Defensive Rebound.
Warren Wilson,Eastern Kentucky,40,104,35,43,1,Timmy Knipp made Three Point Jumper. Assisted by Isaac McGlone.
Warren Wilson,Eastern Kentucky,40,104,36,0,0,Justin Gonyea missed Three Point Jumper.
Warren Wilson,Eastern Kentucky,40,104,36,0,0,Tommy Matthews Defensive Rebound.
Warren Wilson,Eastern Kentucky,40,106,36,7,1,Timmy Knipp made Layup. Assisted by Isaac McGlone.
Warren Wilson,Eastern Kentucky,40,106,36,24,0,Warren Wilson  Timeout
Warren Wilson,Eastern Kentucky,40,106,36,25,0,Justin Gonyea Turnover.
Warren Wilson,Eastern Kentucky,40,106,36,25,0,Tommy Matthews Steal.
Warren Wilson,Eastern Kentucky,40,108,36,31,1,Tommy Matthews made Dunk.
Warren Wilson,Eastern Kentucky,40,108,36,39,0,Thomas Hay Turnover.
Warren Wilson,Eastern Kentucky,40,108,36,40,0,Timmy Knipp Steal.
Warren Wilson,Eastern Kentucky,40,108,36,46,0,Foul on Ty Johnson.
Warren Wilson,Eastern Kentucky,40,108,36,46,0,Official TV Timeout
Warren Wilson,Eastern Kentucky,40,108,36,46,0,Tommy Matthews missed Free Throw.
Warren Wilson,Eastern Kentucky,40,108,36,46,0,Thomas Hay Defensive Rebound.
Warren Wilson,Eastern Kentucky,43,108,37,6,1,Timur Oktay made Three Point Jumper. Assisted by Justin Gonyea.
Warren Wilson,Eastern Kentucky,43,108,37,25,0,Isaac McGlone missed Jumper.
Warren Wilson,Eastern Kentucky,43,108,37,25,0,Herb Harrison Offensive Rebound.
Warren Wilson,Eastern Kentucky,43,108,37,25,0,Herb Harrison missed Two Point Tip Shot.
Warren Wilson,Eastern Kentucky,43,108,37,25,0,Herb Harrison Offensive Rebound.
Warren Wilson,Eastern Kentucky,43,108,37,26,0,Foul on Ty Johnson.
Warren Wilson,Eastern Kentucky,43,109,37,26,1,Herb Harrison made Free Throw.
Warren Wilson,Eastern Kentucky,43,110,37,26,1,Herb Harrison made Free Throw.
Warren Wilson,Eastern Kentucky,43,110,37,35,0,Justin Gonyea missed Jumper.
Warren Wilson,Eastern Kentucky,43,110,37,35,0,Herb Harrison Defensive Rebound.
Warren Wilson,Eastern Kentucky,43,110,37,42,0,Ryan Parsons missed Three Point Jumper.
Warren Wilson,Eastern Kentucky,43,110,37,42,0,Timur Oktay Defensive Rebound.
Warren Wilson,Eastern Kentucky,43,110,38,0,0,Timur Oktay Turnover.
Warren Wilson,Eastern Kentucky,43,110,38,1,0,Tommy Matthews Steal.
Warren Wilson,Eastern Kentucky,43,112,38,5,1,Timmy Knipp made Layup. Assisted by Tommy Matthews.
Warren Wilson,Eastern Kentucky,43,112,38,19,0,Justin Gonyea Turnover.
Warren Wilson,Eastern Kentucky,43,112,38,34,0,Ryan Parsons missed Three Point Jumper.
Warren Wilson,Eastern Kentucky,43,112,38,34,0,Timur Oktay Defensive Rebound.
Warren Wilson,Eastern Kentucky,43,112,38,59,0,Chris Dillard missed Three Point Jumper.
Warren Wilson,Eastern Kentucky,43,112,38,59,0,Timmy Knipp Defensive Rebound.
Warren Wilson,Eastern Kentucky,43,114,39,10,1,Herb Harrison made Jumper. Assisted by Timmy Knipp.
Warren Wilson,Eastern Kentucky,43,114,39,27,0,Justin Gonyea missed Jumper.
Warren Wilson,Eastern Kentucky,43,114,39,27,0,Eastern Kentucky Deadball Team Rebound.
Warren Wilson,Eastern Kentucky,43,114,39,50,0,Ryan Parsons missed Three Point Jumper.
Warren Wilson,Eastern Kentucky,43,114,39,54,0,Justin Gonyea Block.
Warren Wilson,Eastern Kentucky,43,114,39,56,0,Timur Oktay Defensive Rebound.
Warren Wilson,Eastern Kentucky,45,114,40,0,1,Chris Dillard made Jumper. Assisted by Timur Oktay.
