Away Team,Home Team,Away Score,Home Score,Minute,Second,isScoringPosession,Desc.
Maryland-Eastern Shore,High Point,61,66,39,54,0,Foul on Travis Trim.
Maryland-Eastern Shore,High Point,61,67,39,54,1,Devante Wallace made Free Throw.
Maryland-Eastern Shore,High Point,61,68,39,54,1,Devante Wallace made Free Throw.
Maryland-Eastern Shore,High Point,64,68,39,59,1,Devon Walker made Three Point Jumper. Assisted by Ishaq Pitt.
Maryland-Eastern Shore,High Point,64,68,39,59,0,Foul on Ishaq Pitt.
Maryland-Eastern Shore,High Point,64,69,39,59,1,Haiishen McIntyre made Free Throw.
Maryland-Eastern Shore,High Point,64,70,39,59,1,Haiishen McIntyre made Free Throw.
Maryland-Eastern Shore,High Point,64,68,40,0,0,End of Game
