Away Team,Home Team,Away Score,Home Score,Minute,Second,isScoringPosession,Desc.
Carroll College Montana,Utah,0,0,0,0,0,Jump Ball won by Utah
Carroll College Montana,Utah,0,2,0,17,1,Chris Reyes made Jumper. Assisted by Delon Wright.
Carroll College Montana,Utah,0,2,0,39,0,Oliver Carr missed Jumper.
Carroll College Montana,Utah,0,2,0,39,0,Chris Reyes Block.
Carroll College Montana,Utah,0,2,0,39,0,Delon Wright Defensive Rebound.
Carroll College Montana,Utah,0,4,1,3,1,Chris Reyes made Layup. Assisted by Jakob Poeltl.
Carroll College Montana,Utah,0,4,1,29,0,Zach Taylor missed Three Point Jumper.
Carroll College Montana,Utah,0,4,1,29,0,Delon Wright Defensive Rebound.
Carroll College Montana,Utah,0,6,1,41,1,Dakarai Tucker made Layup.
Carroll College Montana,Utah,0,6,1,57,0,Ryan Imhoff missed Jumper.
Carroll College Montana,Utah,0,6,1,57,0,Utah Defensive Rebound.
Carroll College Montana,Utah,0,9,2,28,1,Brandon Taylor made Three Point Jumper. Assisted by Delon Wright.
Carroll College Montana,Utah,0,9,2,54,0,Jump Ball won by Carroll (MT)
Carroll College Montana,Utah,0,9,3,9,0,Jake Hollifield missed Jumper.
Carroll College Montana,Utah,0,9,3,9,0,Brekkott Chapman Defensive Rebound.
Carroll College Montana,Utah,0,12,3,21,1,Jordan Loveridge made Three Point Jumper. Assisted by Jakob Poeltl.
Carroll College Montana,Utah,2,12,3,40,1,Jake Hollifield made Layup. Assisted by Zach Taylor.
Carroll College Montana,Utah,2,14,3,54,1,Brekkott Chapman made Jumper. Assisted by Delon Wright.
Carroll College Montana,Utah,2,14,4,12,0,Zach Taylor Turnover.
Carroll College Montana,Utah,2,14,4,12,0,Jordan Loveridge Steal.
Carroll College Montana,Utah,2,16,4,17,1,Delon Wright made Dunk.
Carroll College Montana,Utah,2,16,4,23,0,Carroll (MT)  Timeout
Carroll College Montana,Utah,4,16,4,37,1,Nick Williams made Jumper. Assisted by Zayn Kirkendoll.
Carroll College Montana,Utah,4,16,4,49,0,Foul on Brekkott Chapman.
Carroll College Montana,Utah,4,16,4,49,0,Brekkott Chapman Turnover.
Carroll College Montana,Utah,4,16,4,49,0,Official TV Timeout
Carroll College Montana,Utah,4,16,4,58,0,Nick Williams missed Jumper.
Carroll College Montana,Utah,4,16,4,58,0,Brekkott Chapman Block.
Carroll College Montana,Utah,4,16,4,58,0,Jordan Loveridge Defensive Rebound.
Carroll College Montana,Utah,4,16,5,8,0,Jordan Loveridge Turnover.
Carroll College Montana,Utah,4,16,5,8,0,Zach Taylor Steal.
Carroll College Montana,Utah,4,16,5,20,0,Jon Pulsifer missed Layup.
Carroll College Montana,Utah,4,16,5,20,0,Dallin Bachynski Defensive Rebound.
Carroll College Montana,Utah,4,16,5,45,0,Delon Wright Turnover.
Carroll College Montana,Utah,4,16,5,57,0,Zayn Kirkendoll missed Jumper.
Carroll College Montana,Utah,4,16,5,57,0,Carroll (MT) Offensive Rebound.
Carroll College Montana,Utah,4,16,6,24,0,Zach Taylor missed Jumper.
Carroll College Montana,Utah,4,16,6,24,0,Brekkott Chapman Defensive Rebound.
Carroll College Montana,Utah,4,16,6,38,0,Foul on Nick Williams.
Carroll College Montana,Utah,4,16,6,50,0,Foul on Jake Hollifield.
Carroll College Montana,Utah,4,16,6,50,0,Kenneth Ogbe missed Free Throw.
Carroll College Montana,Utah,4,16,6,50,0,Utah Deadball Team Rebound.
Carroll College Montana,Utah,4,17,6,50,1,Kenneth Ogbe made Free Throw.
Carroll College Montana,Utah,4,17,7,0,0,Jon Pulsifer missed Three Point Jumper.
Carroll College Montana,Utah,4,17,7,0,0,Kenneth Ogbe Defensive Rebound.
Carroll College Montana,Utah,4,17,7,9,0,Dallin Bachynski missed Dunk.
Carroll College Montana,Utah,4,17,7,9,0,Jake Hollifield Defensive Rebound.
Carroll College Montana,Utah,4,17,7,21,0,Zach Taylor missed Layup.
Carroll College Montana,Utah,4,17,7,21,0,Brekkott Chapman Defensive Rebound.
Carroll College Montana,Utah,4,17,7,28,0,Foul on Lorel Johnson.
Carroll College Montana,Utah,4,19,7,34,1,Brekkott Chapman made Jumper. Assisted by Isaiah Wright.
Carroll College Montana,Utah,4,19,7,58,0,Lorel Johnson missed Jumper.
Carroll College Montana,Utah,4,19,7,58,0,Kenneth Ogbe Defensive Rebound.
Carroll College Montana,Utah,4,21,8,6,1,Jeremy Olsen made Layup. Assisted by Isaiah Wright.
Carroll College Montana,Utah,4,21,8,23,0,Zach Taylor missed Jumper.
Carroll College Montana,Utah,4,21,8,23,0,Jeremy Olsen Defensive Rebound.
Carroll College Montana,Utah,4,21,8,43,0,Kenneth Ogbe missed Three Point Jumper.
Carroll College Montana,Utah,4,21,8,43,0,Brekkott Chapman Offensive Rebound.
Carroll College Montana,Utah,4,21,8,46,0,Foul on Jake Hollifield.
Carroll College Montana,Utah,4,21,8,46,0,Official TV Timeout
Carroll College Montana,Utah,4,22,8,46,1,Brekkott Chapman made Free Throw.
Carroll College Montana,Utah,4,23,8,46,1,Brekkott Chapman made Free Throw.
Carroll College Montana,Utah,6,23,9,1,1,Logan Franco da Silveira made Jumper.
Carroll College Montana,Utah,6,25,9,19,1,Chris Reyes made Layup.
Carroll College Montana,Utah,6,25,9,50,0,Zach Taylor missed Three Point Jumper.
Carroll College Montana,Utah,6,25,9,50,0,Utah Defensive Rebound.
Carroll College Montana,Utah,6,28,10,11,1,Kenneth Ogbe made Three Point Jumper. Assisted by Brandon Taylor.
Carroll College Montana,Utah,9,28,10,35,1,Alejandro Santos Piqueras made Three Point Jumper. Assisted by Logan Franco da Silveira.
Carroll College Montana,Utah,9,28,10,54,0,Kenneth Ogbe missed Three Point Jumper.
Carroll College Montana,Utah,9,28,10,54,0,Jakob Poeltl Offensive Rebound.
Carroll College Montana,Utah,9,28,10,54,0,Isaiah Wright Turnover.
Carroll College Montana,Utah,9,28,10,54,0,Alejandro Santos Piqueras Steal.
Carroll College Montana,Utah,9,28,11,12,0,Alejandro Santos Piqueras missed Layup.
Carroll College Montana,Utah,9,28,11,12,0,Chris Reyes Defensive Rebound.
Carroll College Montana,Utah,9,28,11,33,0,Foul on Lorel Johnson.
Carroll College Montana,Utah,9,31,11,42,1,Brandon Taylor made Three Point Jumper. Assisted by Delon Wright.
Carroll College Montana,Utah,12,31,11,58,1,Logan Franco da Silveira made Three Point Jumper. Assisted by Ian Lorang.
Carroll College Montana,Utah,12,31,12,10,0,Foul on Logan Franco da Silveira.
Carroll College Montana,Utah,12,31,12,10,0,Official TV Timeout
Carroll College Montana,Utah,12,31,12,41,0,Chris Reyes missed Layup.
Carroll College Montana,Utah,12,31,12,41,0,Jakob Poeltl Offensive Rebound.
Carroll College Montana,Utah,12,31,12,41,0,Jakob Poeltl missed Two Point Tip Shot.
Carroll College Montana,Utah,12,31,12,41,0,Jakob Poeltl Offensive Rebound.
Carroll College Montana,Utah,12,33,12,51,1,Jakob Poeltl made Layup.
Carroll College Montana,Utah,14,33,13,8,1,Oliver Carr made Jumper.
Carroll College Montana,Utah,14,33,13,24,0,Chris Reyes missed Jumper.
Carroll College Montana,Utah,14,33,13,24,0,Chris Reyes Offensive Rebound.
Carroll College Montana,Utah,14,35,13,31,1,Chris Reyes made Layup.
Carroll College Montana,Utah,14,35,13,50,0,Alejandro Santos Piqueras Turnover.
Carroll College Montana,Utah,14,35,13,50,0,Delon Wright Steal.
Carroll College Montana,Utah,14,37,13,57,1,Delon Wright made Layup. Assisted by Brandon Taylor.
Carroll College Montana,Utah,14,37,14,9,0,Lorel Johnson Turnover.
Carroll College Montana,Utah,14,37,14,9,0,Jordan Loveridge Steal.
Carroll College Montana,Utah,14,39,14,13,1,Jordan Loveridge made Layup.
Carroll College Montana,Utah,14,39,14,15,0,Carroll (MT)  Timeout
Carroll College Montana,Utah,14,39,14,27,0,Foul on Chris Reyes.
Carroll College Montana,Utah,14,39,14,33,0,Zach Taylor Turnover.
Carroll College Montana,Utah,14,41,14,47,1,Brekkott Chapman made Layup. Assisted by Delon Wright.
Carroll College Montana,Utah,14,41,15,6,0,Lorel Johnson missed Jumper.
Carroll College Montana,Utah,14,41,15,6,0,Logan Franco da Silveira Offensive Rebound.
Carroll College Montana,Utah,14,41,15,9,0,Foul on Brekkott Chapman.
Carroll College Montana,Utah,14,41,15,14,0,Zayn Kirkendoll missed Jumper.
Carroll College Montana,Utah,14,41,15,14,0,Delon Wright Defensive Rebound.
Carroll College Montana,Utah,14,43,15,24,1,Delon Wright made Layup.
Carroll College Montana,Utah,14,43,15,24,0,Foul on Lorel Johnson.
Carroll College Montana,Utah,14,44,15,24,1,Delon Wright made Free Throw.
Carroll College Montana,Utah,14,44,15,39,0,Zayn Kirkendoll Turnover.
Carroll College Montana,Utah,14,44,15,39,0,Delon Wright Steal.
Carroll College Montana,Utah,14,46,15,45,1,Kyle Kuzma made Dunk. Assisted by Delon Wright.
Carroll College Montana,Utah,16,46,16,9,1,Oliver Carr made Jumper. Assisted by Zach Taylor.
Carroll College Montana,Utah,16,46,16,28,0,Jakob Poeltl Turnover.
Carroll College Montana,Utah,16,46,16,28,0,Zach Taylor Steal.
Carroll College Montana,Utah,16,46,16,34,0,Lorel Johnson missed Jumper.
Carroll College Montana,Utah,16,46,16,34,0,Jakob Poeltl Defensive Rebound.
Carroll College Montana,Utah,16,48,16,43,1,Delon Wright made Layup. Assisted by Brandon Taylor.
Carroll College Montana,Utah,16,48,17,7,0,Oliver Carr Turnover.
Carroll College Montana,Utah,16,48,17,7,0,Delon Wright Steal.
Carroll College Montana,Utah,16,50,17,19,1,Kyle Kuzma made Jumper.
Carroll College Montana,Utah,16,50,17,19,0,Foul on Oliver Carr.
Carroll College Montana,Utah,16,50,17,19,0,Official TV Timeout
Carroll College Montana,Utah,16,50,17,19,0,Kyle Kuzma missed Free Throw.
Carroll College Montana,Utah,16,50,17,19,0,Jake Hollifield Defensive Rebound.
Carroll College Montana,Utah,18,50,17,35,1,Zach Taylor made Jumper.
Carroll College Montana,Utah,18,50,18,2,0,Kyle Kuzma Turnover.
Carroll College Montana,Utah,18,50,18,2,0,Zayn Kirkendoll Steal.
Carroll College Montana,Utah,18,50,18,17,0,Zach Taylor missed Layup.
Carroll College Montana,Utah,18,50,18,17,0,Isaiah Wright Defensive Rebound.
Carroll College Montana,Utah,18,50,18,24,0,Dakarai Tucker missed Layup.
Carroll College Montana,Utah,18,50,18,24,0,Jake Hollifield Block.
Carroll College Montana,Utah,18,50,18,24,0,Lorel Johnson Defensive Rebound.
Carroll College Montana,Utah,18,50,18,36,0,Lorel Johnson Turnover.
Carroll College Montana,Utah,18,50,18,36,0,Dakarai Tucker Steal.
Carroll College Montana,Utah,18,50,18,36,0,Foul on Jake Hollifield.
Carroll College Montana,Utah,18,51,18,36,1,Kyle Kuzma made Free Throw.
Carroll College Montana,Utah,18,51,18,36,0,Kyle Kuzma missed Free Throw.
Carroll College Montana,Utah,18,51,18,36,0,Jake Hollifield Defensive Rebound.
Carroll College Montana,Utah,18,51,18,40,0,Foul on Kyle Kuzma.
Carroll College Montana,Utah,19,51,18,40,1,Oliver Carr made Free Throw.
Carroll College Montana,Utah,20,51,18,40,1,Oliver Carr made Free Throw.
Carroll College Montana,Utah,20,51,18,54,0,Kyle Kuzma missed Layup.
Carroll College Montana,Utah,20,51,18,54,0,Kyle Kuzma Offensive Rebound.
Carroll College Montana,Utah,20,51,18,56,0,Foul on Zach Taylor.
Carroll College Montana,Utah,20,51,18,56,0,Kyle Kuzma missed Free Throw.
Carroll College Montana,Utah,20,51,18,56,0,Utah Deadball Team Rebound.
Carroll College Montana,Utah,20,52,18,56,1,Kyle Kuzma made Free Throw.
Carroll College Montana,Utah,23,52,19,2,1,Lorel Johnson made Three Point Jumper. Assisted by Zach Taylor.
Carroll College Montana,Utah,23,52,19,25,0,Dakarai Tucker missed Three Point Jumper.
Carroll College Montana,Utah,23,52,19,25,0,Zach Taylor Defensive Rebound.
Carroll College Montana,Utah,23,52,19,34,0,Zayn Kirkendoll Turnover.
Carroll College Montana,Utah,23,52,19,34,0,Dakarai Tucker Steal.
Carroll College Montana,Utah,23,54,19,58,1,Kenneth Ogbe made Dunk. Assisted by Isaiah Wright.
Carroll College Montana,Utah,23,54,20,0,0,End of 1st half
Carroll College Montana,Utah,23,54,20,0,0,Jump Ball won by Utah
Carroll College Montana,Utah,23,54,20,10,0,Foul on Ryan Imhoff.
Carroll College Montana,Utah,23,55,20,10,1,Jakob Poeltl made Free Throw.
Carroll College Montana,Utah,23,55,20,10,0,Jakob Poeltl missed Free Throw.
Carroll College Montana,Utah,23,55,20,10,0,Jake Hollifield Defensive Rebound.
Carroll College Montana,Utah,25,55,20,36,1,Zach Taylor made Layup. Assisted by Oliver Carr.
Carroll College Montana,Utah,25,57,21,3,1,Jakob Poeltl made Layup. Assisted by Brandon Taylor.
Carroll College Montana,Utah,25,57,21,33,0,Jake Hollifield missed Layup.
Carroll College Montana,Utah,25,57,21,33,0,Jakob Poeltl Defensive Rebound.
Carroll College Montana,Utah,25,59,21,46,1,Jakob Poeltl made Layup. Assisted by Dakarai Tucker.
Carroll College Montana,Utah,25,59,22,6,0,Ryan Imhoff missed Three Point Jumper.
Carroll College Montana,Utah,25,59,22,6,0,Jakob Poeltl Defensive Rebound.
Carroll College Montana,Utah,25,59,22,16,0,Chris Reyes Turnover.
Carroll College Montana,Utah,25,59,22,16,0,Ryan Imhoff Steal.
Carroll College Montana,Utah,25,59,22,26,0,Oliver Carr Turnover.
Carroll College Montana,Utah,25,59,22,26,0,Brandon Taylor Steal.
Carroll College Montana,Utah,25,59,22,43,0,Foul on Ryan Imhoff.
Carroll College Montana,Utah,25,60,22,43,1,Jakob Poeltl made Free Throw.
Carroll College Montana,Utah,25,61,22,43,1,Jakob Poeltl made Free Throw.
Carroll College Montana,Utah,27,61,23,1,1,Oliver Carr made Jumper. Assisted by Zayn Kirkendoll.
Carroll College Montana,Utah,27,61,23,15,0,Brandon Taylor Turnover.
Carroll College Montana,Utah,27,61,23,15,0,Zayn Kirkendoll Steal.
Carroll College Montana,Utah,30,61,23,22,1,Zach Taylor made Three Point Jumper.
Carroll College Montana,Utah,30,61,23,41,0,Foul on Logan Franco da Silveira.
Carroll College Montana,Utah,30,61,24,2,0,Jump Ball won by Carroll (MT)
Carroll College Montana,Utah,30,61,24,2,0,Isaiah Wright Turnover.
Carroll College Montana,Utah,30,61,24,2,0,Logan Franco da Silveira Steal.
Carroll College Montana,Utah,30,61,24,2,0,Official TV Timeout
Carroll College Montana,Utah,32,61,24,30,1,Oliver Carr made Layup.
Carroll College Montana,Utah,32,61,24,56,0,Brekkott Chapman Turnover.
Carroll College Montana,Utah,32,61,24,56,0,Zach Taylor Steal.
Carroll College Montana,Utah,32,61,25,0,0,Foul on Zach Taylor.
Carroll College Montana,Utah,32,61,25,0,0,Zach Taylor Turnover.
Carroll College Montana,Utah,32,61,25,16,0,Utah  Timeout
Carroll College Montana,Utah,32,61,25,16,0,Isaiah Wright Turnover.
Carroll College Montana,Utah,32,61,25,16,0,Ryan Imhoff Steal.
Carroll College Montana,Utah,32,61,25,24,0,Logan Franco da Silveira Turnover.
Carroll College Montana,Utah,32,61,25,24,0,Brandon Taylor Steal.
Carroll College Montana,Utah,32,63,25,29,1,Chris Reyes made Layup. Assisted by Jordan Loveridge.
Carroll College Montana,Utah,32,63,25,40,0,Zach Taylor missed Three Point Jumper.
Carroll College Montana,Utah,32,63,25,40,0,Jordan Loveridge Defensive Rebound.
Carroll College Montana,Utah,32,63,25,47,0,Dakarai Tucker missed Three Point Jumper.
Carroll College Montana,Utah,32,63,25,47,0,Ryan Imhoff Defensive Rebound.
Carroll College Montana,Utah,32,63,25,55,0,Ryan Imhoff Turnover.
Carroll College Montana,Utah,32,63,25,55,0,Dakarai Tucker Steal.
Carroll College Montana,Utah,32,65,26,0,1,Dakarai Tucker made Dunk.
Carroll College Montana,Utah,32,65,26,19,0,Ryan Imhoff missed Three Point Jumper.
Carroll College Montana,Utah,32,65,26,19,0,Chris Reyes Defensive Rebound.
Carroll College Montana,Utah,32,67,26,31,1,Brandon Taylor made Layup.
Carroll College Montana,Utah,32,67,26,56,0,Carroll (MT)  Timeout
Carroll College Montana,Utah,32,67,27,10,0,Nick Williams missed Jumper.
Carroll College Montana,Utah,32,67,27,10,0,Dakarai Tucker Defensive Rebound.
Carroll College Montana,Utah,32,67,27,34,0,Jordan Loveridge missed Three Point Jumper.
Carroll College Montana,Utah,32,67,27,34,0,Zayn Kirkendoll Defensive Rebound.
Carroll College Montana,Utah,32,67,27,44,0,Nick Williams Turnover.
Carroll College Montana,Utah,32,67,27,50,0,Brandon Taylor missed Jumper.
Carroll College Montana,Utah,32,67,27,50,0,Utah Offensive Rebound.
Carroll College Montana,Utah,32,67,28,7,0,Jordan Loveridge Turnover.
Carroll College Montana,Utah,32,67,28,7,0,Jon Pulsifer Steal.
Carroll College Montana,Utah,35,67,28,25,1,Patrick Colberg made Three Point Jumper. Assisted by Zach Taylor.
Carroll College Montana,Utah,35,67,28,39,0,Foul on Zach Taylor.
Carroll College Montana,Utah,35,67,28,39,0,Official TV Timeout
Carroll College Montana,Utah,35,67,28,46,0,Jeremy Olsen Turnover.
Carroll College Montana,Utah,35,67,28,46,0,Carroll (MT)  Turnover.
Carroll College Montana,Utah,35,70,29,53,1,Jordan Loveridge made Three Point Jumper. Assisted by Brekkott Chapman.
Carroll College Montana,Utah,37,70,30,15,1,Zach Taylor made Jumper.
Carroll College Montana,Utah,37,70,30,33,0,Dakarai Tucker missed Three Point Jumper.
Carroll College Montana,Utah,37,70,30,33,0,Jon Pulsifer Defensive Rebound.
Carroll College Montana,Utah,37,70,30,54,0,Zach Taylor Turnover.
Carroll College Montana,Utah,37,70,31,11,0,Brekkott Chapman Turnover.
Carroll College Montana,Utah,37,70,31,11,0,Nick Williams Steal.
Carroll College Montana,Utah,39,70,31,40,1,Jake Hollifield made Layup. Assisted by Zach Taylor.
Carroll College Montana,Utah,39,73,31,50,1,Jordan Loveridge made Three Point Jumper. Assisted by Delon Wright.
Carroll College Montana,Utah,39,73,32,17,0,Zach Taylor missed Three Point Jumper.
Carroll College Montana,Utah,39,73,32,17,0,Isaiah Wright Defensive Rebound.
Carroll College Montana,Utah,39,73,32,31,0,Foul on Jake Hollifield.
Carroll College Montana,Utah,39,73,32,31,0,Official TV Timeout
Carroll College Montana,Utah,39,73,32,44,0,Brekkott Chapman missed Three Point Jumper.
Carroll College Montana,Utah,39,73,32,44,0,Jon Pulsifer Defensive Rebound.
Carroll College Montana,Utah,39,73,33,2,0,Foul on Brekkott Chapman.
Carroll College Montana,Utah,40,73,33,2,1,Nick Williams made Free Throw.
Carroll College Montana,Utah,41,73,33,2,1,Nick Williams made Free Throw.
Carroll College Montana,Utah,41,73,33,29,0,Foul on Jordan Loveridge.
Carroll College Montana,Utah,41,73,33,29,0,Jordan Loveridge Turnover.
Carroll College Montana,Utah,43,73,33,48,1,Jon Pulsifer made Layup.
Carroll College Montana,Utah,43,73,34,0,0,Delon Wright missed Jumper.
Carroll College Montana,Utah,43,73,34,0,0,Jordan Loveridge Offensive Rebound.
Carroll College Montana,Utah,43,75,34,6,1,Jordan Loveridge made Layup.
Carroll College Montana,Utah,46,75,34,23,1,Nick Williams made Three Point Jumper. Assisted by Jon Pulsifer.
Carroll College Montana,Utah,46,75,34,34,0,Foul on Nick Williams.
Carroll College Montana,Utah,46,75,34,34,0,Jordan Loveridge missed Free Throw.
Carroll College Montana,Utah,46,75,34,34,0,Utah Deadball Team Rebound.
Carroll College Montana,Utah,46,76,34,34,1,Jordan Loveridge made Free Throw.
Carroll College Montana,Utah,46,76,34,41,0,Lorel Johnson Turnover.
Carroll College Montana,Utah,46,78,35,6,1,Dallin Bachynski made Jumper. Assisted by Isaiah Wright.
Carroll College Montana,Utah,46,78,35,28,0,Foul on Chris Reyes.
Carroll College Montana,Utah,47,78,35,28,1,Jon Pulsifer made Free Throw.
Carroll College Montana,Utah,47,78,35,28,0,Jon Pulsifer missed Free Throw.
Carroll College Montana,Utah,47,78,35,28,0,Brekkott Chapman Defensive Rebound.
Carroll College Montana,Utah,47,81,35,38,1,Brekkott Chapman made Three Point Jumper. Assisted by Isaiah Wright.
Carroll College Montana,Utah,47,81,35,51,0,Patrick Colberg missed Three Point Jumper.
Carroll College Montana,Utah,47,81,35,51,0,Jake Hollifield Offensive Rebound.
Carroll College Montana,Utah,47,81,36,3,0,Jake Hollifield missed Layup.
Carroll College Montana,Utah,47,81,36,3,0,Brekkott Chapman Defensive Rebound.
Carroll College Montana,Utah,47,81,36,9,0,Brekkott Chapman missed Three Point Jumper.
Carroll College Montana,Utah,47,81,36,9,0,Dallin Bachynski Offensive Rebound.
Carroll College Montana,Utah,47,81,36,9,0,Foul on Patrick Colberg.
Carroll College Montana,Utah,47,81,36,9,0,Official TV Timeout
Carroll College Montana,Utah,47,82,36,9,1,Dallin Bachynski made Free Throw.
Carroll College Montana,Utah,47,82,36,9,0,Dallin Bachynski missed Free Throw.
Carroll College Montana,Utah,47,82,36,9,0,Nick Williams Defensive Rebound.
Carroll College Montana,Utah,47,82,36,33,0,Oliver Carr missed Layup.
Carroll College Montana,Utah,47,82,36,33,0,Dallin Bachynski Block.
Carroll College Montana,Utah,47,82,36,33,0,Brandon Taylor Defensive Rebound.
Carroll College Montana,Utah,47,85,37,5,1,Isaiah Wright made Three Point Jumper. Assisted by Brandon Taylor.
Carroll College Montana,Utah,47,85,37,20,0,Foul on Lorel Johnson.
Carroll College Montana,Utah,47,85,37,20,0,Lorel Johnson Turnover.
Carroll College Montana,Utah,47,85,37,37,0,Austin Eastman missed Jumper.
Carroll College Montana,Utah,47,85,37,37,0,Austin Eastman Offensive Rebound.
Carroll College Montana,Utah,47,85,37,57,0,Brekkott Chapman Turnover.
Carroll College Montana,Utah,47,85,38,11,0,Ryan Imhoff missed Three Point Jumper.
Carroll College Montana,Utah,47,85,38,11,0,Jeremy Olsen Defensive Rebound.
Carroll College Montana,Utah,47,85,38,41,0,Foul on Kenneth Ogbe.
Carroll College Montana,Utah,47,85,38,41,0,Kenneth Ogbe Turnover.
Carroll College Montana,Utah,49,85,38,56,1,Nick Williams made Jumper.
Carroll College Montana,Utah,49,85,39,14,0,Brekkott Chapman missed Jumper.
Carroll College Montana,Utah,49,85,39,14,0,Ryan Imhoff Defensive Rebound.
Carroll College Montana,Utah,49,85,39,21,0,Ryan Imhoff missed Jumper.
Carroll College Montana,Utah,49,85,39,21,0,Jeremy Olsen Defensive Rebound.
Carroll College Montana,Utah,49,85,39,44,0,Jeremy Olsen Turnover.
Carroll College Montana,Utah,49,85,39,44,0,Nick Williams Steal.
Carroll College Montana,Utah,49,85,39,52,0,Oliver Carr missed Jumper.
Carroll College Montana,Utah,49,85,39,52,0,Jeremy Olsen Defensive Rebound.
Carroll College Montana,Utah,49,85,40,0,0,End of Game
