Away Team,Home Team,Away Score,Home Score,Minute,Second,isScoringPosession,Desc.
Hiwassee College,South Carolina Upstate,34,87,39,1,0,Jeremy Ford missed Jumper.
Hiwassee College,South Carolina Upstate,34,87,39,1,0,Adrian Rodgers Offensive Rebound.
Hiwassee College,South Carolina Upstate,34,87,39,7,0,Foul on Brandon Carpenter
Hiwassee College,South Carolina Upstate,34,88,39,7,1,Adrian Rodgers made Free Throw.
Hiwassee College,South Carolina Upstate,34,88,39,7,0,Adrian Rodgers missed Free Throw.
Hiwassee College,South Carolina Upstate,34,88,39,13,0,Brandon Carpenter Defensive Rebound.
Hiwassee College,South Carolina Upstate,34,88,39,21,0,Joel Bailey missed Jumper.
Hiwassee College,South Carolina Upstate,34,88,39,21,0,Tyler King Offensive Rebound.
Hiwassee College,South Carolina Upstate,36,88,39,25,1,Tyler King made Layup.
Hiwassee College,South Carolina Upstate,36,90,39,52,1,Adrian Rodgers made Layup.  Assisted by Rob Elam.
Hiwassee College,South Carolina Upstate,36,90,39,57,0,Brandon Carpenter missed Jumper.
Hiwassee College,South Carolina Upstate,36,90,39,57,0,Rob Elam Defensive Rebound.
Hiwassee College,South Carolina Upstate,36,90,40,0,0,End Game
