Away Team,Home Team,Away Score,Home Score,Minute,Second,isScoringPosession,Desc.
Clemson,Pittsburgh,0,0,0,0,0,Jump Ball won by Clemson
Clemson,Pittsburgh,2,0,0,27,1,K.J. McDaniels made Jumper. Assisted by Jaron Blossomgame.
Clemson,Pittsburgh,2,0,0,50,0,James Robinson missed Layup.
Clemson,Pittsburgh,2,0,0,50,0,Landry Nnoko Defensive Rebound.
Clemson,Pittsburgh,2,0,0,58,0,K.J. McDaniels missed Three Point Jumper.
Clemson,Pittsburgh,2,0,0,58,0,Michael Young Defensive Rebound.
Clemson,Pittsburgh,2,2,1,11,1,Talib Zanna made Layup. Assisted by Lamar Patterson.
Clemson,Pittsburgh,2,2,1,11,0,Foul on K.J. McDaniels.
Clemson,Pittsburgh,2,2,1,11,0,Talib Zanna missed Free Throw.
Clemson,Pittsburgh,2,2,1,11,0,K.J. McDaniels Defensive Rebound.
Clemson,Pittsburgh,2,2,1,42,0,Jordan Roper missed Jumper.
Clemson,Pittsburgh,2,2,1,42,0,Cameron Wright Defensive Rebound.
Clemson,Pittsburgh,2,2,2,14,0,Lamar Patterson Turnover.
Clemson,Pittsburgh,2,2,2,40,0,Jaron Blossomgame missed Jumper.
Clemson,Pittsburgh,2,2,2,40,0,Jaron Blossomgame Offensive Rebound.
Clemson,Pittsburgh,2,2,2,45,0,Jaron Blossomgame missed Jumper.
Clemson,Pittsburgh,2,2,2,45,0,Talib Zanna Block.
Clemson,Pittsburgh,2,2,2,45,0,Lamar Patterson Defensive Rebound.
Clemson,Pittsburgh,2,2,2,53,0,Foul on Jordan Roper.
Clemson,Pittsburgh,2,3,2,53,1,Talib Zanna made Free Throw.
Clemson,Pittsburgh,2,4,2,53,1,Talib Zanna made Free Throw.
Clemson,Pittsburgh,2,4,3,9,0,Landry Nnoko Turnover.
Clemson,Pittsburgh,2,7,3,36,1,Lamar Patterson made Three Point Jumper. Assisted by James Robinson.
Clemson,Pittsburgh,2,7,3,53,0,Foul on James Robinson.
Clemson,Pittsburgh,2,7,4,11,0,K.J. McDaniels Turnover.
Clemson,Pittsburgh,2,7,4,11,0,Official TV Timeout
Clemson,Pittsburgh,2,9,4,38,1,Cameron Wright made Layup. Assisted by Lamar Patterson.
Clemson,Pittsburgh,2,9,5,6,0,Adonis Filer Turnover.
Clemson,Pittsburgh,2,9,5,6,0,Cameron Wright Steal.
Clemson,Pittsburgh,2,9,5,28,0,Lamar Patterson Turnover.
Clemson,Pittsburgh,2,9,5,34,0,Adonis Filer Turnover.
Clemson,Pittsburgh,2,9,5,34,0,Talib Zanna Steal.
Clemson,Pittsburgh,2,11,5,37,1,Talib Zanna made Dunk. Assisted by Cameron Wright.
Clemson,Pittsburgh,2,11,5,47,0,Clemson  Timeout
Clemson,Pittsburgh,4,11,5,58,1,Jordan Roper made Jumper.
Clemson,Pittsburgh,4,11,5,58,0,Foul on Josh Newkirk.
Clemson,Pittsburgh,5,11,5,58,1,Jordan Roper made Free Throw.
Clemson,Pittsburgh,5,11,6,22,0,Lamar Patterson missed Jumper.
Clemson,Pittsburgh,5,11,6,22,0,Adonis Filer Defensive Rebound.
Clemson,Pittsburgh,5,11,6,32,0,Foul on Josh Newkirk.
Clemson,Pittsburgh,5,11,6,32,0,Adonis Filer missed Free Throw.
Clemson,Pittsburgh,5,11,6,32,0,Clemson Deadball Team Rebound.
Clemson,Pittsburgh,6,11,6,32,1,Adonis Filer made Free Throw.
Clemson,Pittsburgh,6,11,6,43,0,Foul on K.J. McDaniels.
Clemson,Pittsburgh,6,11,6,43,0,Cameron Wright missed Free Throw.
Clemson,Pittsburgh,6,11,6,43,0,Pittsburgh Deadball Team Rebound.
Clemson,Pittsburgh,6,12,6,43,1,Cameron Wright made Free Throw.
Clemson,Pittsburgh,6,12,6,59,0,Jordan Roper missed Three Point Jumper.
Clemson,Pittsburgh,6,12,6,59,0,James Robinson Defensive Rebound.
Clemson,Pittsburgh,6,15,7,10,1,Cameron Wright made Three Point Jumper. Assisted by Chris Jones.
Clemson,Pittsburgh,8,15,7,34,1,Damarcus Harrison made Jumper. Assisted by Jordan Roper.
Clemson,Pittsburgh,8,15,7,56,0,Foul on Josh Smith.
Clemson,Pittsburgh,8,16,7,56,1,Chris Jones made Free Throw.
Clemson,Pittsburgh,8,17,7,56,1,Chris Jones made Free Throw.
Clemson,Pittsburgh,8,17,8,3,0,Foul on Jamel Artis.
Clemson,Pittsburgh,8,17,8,3,0,Official TV Timeout
Clemson,Pittsburgh,8,17,8,6,0,Rod Hall Turnover.
Clemson,Pittsburgh,8,20,8,26,1,James Robinson made Three Point Jumper. Assisted by Chris Jones.
Clemson,Pittsburgh,10,20,8,50,1,Sidy Djitte made Jumper. Assisted by Rod Hall.
Clemson,Pittsburgh,10,20,9,19,0,Derrick Randall Turnover.
Clemson,Pittsburgh,10,20,9,36,0,Foul on Jordan Roper.
Clemson,Pittsburgh,10,20,9,36,0,Jordan Roper Turnover.
Clemson,Pittsburgh,10,20,9,52,0,Lamar Patterson missed Three Point Jumper.
Clemson,Pittsburgh,10,20,9,52,0,Jaron Blossomgame Defensive Rebound.
Clemson,Pittsburgh,10,20,9,58,0,Jaron Blossomgame Turnover.
Clemson,Pittsburgh,10,20,9,58,0,Talib Zanna Steal.
Clemson,Pittsburgh,10,22,10,2,1,Talib Zanna made Dunk. Assisted by Michael Young.
Clemson,Pittsburgh,10,22,10,27,0,Foul on Cameron Wright.
Clemson,Pittsburgh,10,22,10,39,0,K.J. McDaniels missed Three Point Jumper.
Clemson,Pittsburgh,10,22,10,39,0,Talib Zanna Defensive Rebound.
Clemson,Pittsburgh,10,22,11,6,0,Foul on Ibrahim Djambo.
Clemson,Pittsburgh,10,23,11,6,1,Lamar Patterson made Free Throw.
Clemson,Pittsburgh,10,24,11,6,1,Lamar Patterson made Free Throw.
Clemson,Pittsburgh,10,24,11,31,0,Damarcus Harrison missed Three Point Jumper.
Clemson,Pittsburgh,10,24,11,31,0,Ibrahim Djambo Offensive Rebound.
Clemson,Pittsburgh,10,24,11,38,0,Ibrahim Djambo missed Jumper.
Clemson,Pittsburgh,10,24,11,38,0,Lamar Patterson Defensive Rebound.
Clemson,Pittsburgh,10,24,11,46,0,Cameron Wright Turnover.
Clemson,Pittsburgh,13,24,11,56,1,Rod Hall made Three Point Jumper. Assisted by K.J. McDaniels.
Clemson,Pittsburgh,13,26,12,19,1,Cameron Wright made Jumper. Assisted by Lamar Patterson.
Clemson,Pittsburgh,13,26,12,46,0,Damarcus Harrison missed Jumper.
Clemson,Pittsburgh,13,26,12,46,0,Derrick Randall Block.
Clemson,Pittsburgh,13,26,12,46,0,Michael Young Defensive Rebound.
Clemson,Pittsburgh,13,26,12,59,0,Michael Young Turnover.
Clemson,Pittsburgh,13,26,12,59,0,Official TV Timeout
Clemson,Pittsburgh,13,26,13,6,0,Ibrahim Djambo missed Three Point Jumper.
Clemson,Pittsburgh,13,26,13,6,0,Cameron Wright Defensive Rebound.
Clemson,Pittsburgh,13,26,13,23,0,Michael Young missed Three Point Jumper.
Clemson,Pittsburgh,13,26,13,23,0,Rod Hall Defensive Rebound.
Clemson,Pittsburgh,15,26,13,33,1,Damarcus Harrison made Layup.
Clemson,Pittsburgh,15,28,14,3,1,Derrick Randall made Jumper. Assisted by James Robinson.
Clemson,Pittsburgh,15,28,14,25,0,Ibrahim Djambo missed Three Point Jumper.
Clemson,Pittsburgh,15,28,14,25,0,Chris Jones Defensive Rebound.
Clemson,Pittsburgh,15,28,14,58,0,Cameron Wright missed Jumper.
Clemson,Pittsburgh,15,28,14,58,0,James Robinson Offensive Rebound.
Clemson,Pittsburgh,15,28,15,27,0,Chris Jones missed Jumper.
Clemson,Pittsburgh,15,28,15,27,0,Ibrahim Djambo Block.
Clemson,Pittsburgh,15,28,15,27,0,K.J. McDaniels Defensive Rebound.
Clemson,Pittsburgh,18,28,15,34,1,Rod Hall made Three Point Jumper. Assisted by K.J. McDaniels.
Clemson,Pittsburgh,18,28,15,40,0,Pittsburgh  Timeout
Clemson,Pittsburgh,18,31,16,7,1,James Robinson made Three Point Jumper. Assisted by Chris Jones.
Clemson,Pittsburgh,18,31,16,29,0,Adonis Filer Turnover.
Clemson,Pittsburgh,18,31,16,29,0,Lamar Patterson Steal.
Clemson,Pittsburgh,18,33,16,35,1,Talib Zanna made Layup. Assisted by James Robinson.
Clemson,Pittsburgh,18,33,17,8,0,Damarcus Harrison missed Three Point Jumper.
Clemson,Pittsburgh,18,33,17,8,0,Lamar Patterson Defensive Rebound.
Clemson,Pittsburgh,18,35,17,15,1,Talib Zanna made Layup. Assisted by Lamar Patterson.
Clemson,Pittsburgh,18,35,17,21,0,Clemson  Timeout
Clemson,Pittsburgh,18,35,17,39,0,Landry Nnoko missed Jumper.
Clemson,Pittsburgh,18,35,17,39,0,Chris Jones Defensive Rebound.
Clemson,Pittsburgh,18,35,18,7,0,Jamel Artis missed Three Point Jumper.
Clemson,Pittsburgh,18,35,18,7,0,Landry Nnoko Defensive Rebound.
Clemson,Pittsburgh,18,35,18,18,0,Jordan Roper missed Jumper.
Clemson,Pittsburgh,18,35,18,18,0,Jamel Artis Defensive Rebound.
Clemson,Pittsburgh,18,35,18,28,0,Official TV Timeout
Clemson,Pittsburgh,18,35,18,53,0,Jamel Artis missed Jumper.
Clemson,Pittsburgh,18,35,18,53,0,Landry Nnoko Block.
Clemson,Pittsburgh,18,35,18,53,0,Pittsburgh Offensive Rebound.
Clemson,Pittsburgh,18,35,18,57,0,Pittsburgh  Turnover.
Clemson,Pittsburgh,18,35,19,10,0,K.J. McDaniels missed Jumper.
Clemson,Pittsburgh,18,35,19,10,0,Jamel Artis Defensive Rebound.
Clemson,Pittsburgh,18,35,19,13,0,Foul on Landry Nnoko.
Clemson,Pittsburgh,18,36,19,13,1,Jamel Artis made Free Throw.
Clemson,Pittsburgh,18,37,19,13,1,Jamel Artis made Free Throw.
Clemson,Pittsburgh,20,37,19,27,1,K.J. McDaniels made Jumper. Assisted by Josh Smith.
Clemson,Pittsburgh,20,37,19,54,0,Lamar Patterson missed Jumper.
Clemson,Pittsburgh,20,37,19,54,0,K.J. McDaniels Defensive Rebound.
Clemson,Pittsburgh,20,37,20,0,0,End of 1st half
Clemson,Pittsburgh,20,37,20,0,0,Jump Ball won by Pittsburgh
Clemson,Pittsburgh,20,40,20,34,1,Lamar Patterson made Three Point Jumper. Assisted by James Robinson.
Clemson,Pittsburgh,20,40,20,54,0,Foul on Talib Zanna.
Clemson,Pittsburgh,20,40,21,0,0,Foul on Michael Young.
Clemson,Pittsburgh,21,40,21,0,1,Landry Nnoko made Free Throw.
Clemson,Pittsburgh,21,40,21,0,0,Landry Nnoko missed Free Throw.
Clemson,Pittsburgh,21,40,21,0,0,Michael Young Defensive Rebound.
Clemson,Pittsburgh,21,40,21,13,0,Lamar Patterson missed Layup.
Clemson,Pittsburgh,21,40,21,13,0,K.J. McDaniels Defensive Rebound.
Clemson,Pittsburgh,21,40,21,24,0,K.J. McDaniels missed Layup.
Clemson,Pittsburgh,21,40,21,24,0,Lamar Patterson Block.
Clemson,Pittsburgh,21,40,21,24,0,Pittsburgh Defensive Rebound.
Clemson,Pittsburgh,21,42,21,41,1,Cameron Wright made Jumper. Assisted by Lamar Patterson.
Clemson,Pittsburgh,24,42,21,47,1,Jordan Roper made Three Point Jumper. Assisted by K.J. McDaniels.
Clemson,Pittsburgh,24,42,22,1,0,Michael Young missed Jumper.
Clemson,Pittsburgh,24,42,22,8,0,Pittsburgh Offensive Rebound.
Clemson,Pittsburgh,24,44,22,11,1,Cameron Wright made Jumper. Assisted by James Robinson.
Clemson,Pittsburgh,24,44,22,31,0,Rod Hall Turnover.
Clemson,Pittsburgh,24,44,22,31,0,James Robinson Steal.
Clemson,Pittsburgh,24,44,22,44,0,Michael Young missed Jumper.
Clemson,Pittsburgh,24,44,22,44,0,Jordan Roper Defensive Rebound.
Clemson,Pittsburgh,24,44,23,6,0,K.J. McDaniels Turnover.
Clemson,Pittsburgh,24,44,23,6,0,Lamar Patterson Steal.
Clemson,Pittsburgh,24,46,23,12,1,Talib Zanna made Layup. Assisted by James Robinson.
Clemson,Pittsburgh,24,46,23,48,0,Jaron Blossomgame missed Three Point Jumper.
Clemson,Pittsburgh,24,46,23,48,0,Lamar Patterson Defensive Rebound.
Clemson,Pittsburgh,24,46,23,57,0,Lamar Patterson Turnover.
Clemson,Pittsburgh,24,46,24,33,0,Adonis Filer missed Three Point Jumper.
Clemson,Pittsburgh,24,46,24,33,0,Clemson Deadball Team Rebound.
Clemson,Pittsburgh,24,46,24,33,0,Clemson  Turnover.
Clemson,Pittsburgh,24,46,24,33,0,Official TV Timeout
Clemson,Pittsburgh,24,48,24,59,1,James Robinson made Jumper.
Clemson,Pittsburgh,24,48,25,25,0,Damarcus Harrison missed Three Point Jumper.
Clemson,Pittsburgh,24,48,25,25,0,Pittsburgh Defensive Rebound.
Clemson,Pittsburgh,24,48,25,40,0,Foul on Austin Ajukwa.
Clemson,Pittsburgh,24,48,26,2,0,Cameron Wright missed Jumper.
Clemson,Pittsburgh,24,48,26,2,0,Adonis Filer Defensive Rebound.
Clemson,Pittsburgh,24,48,26,27,0,Josh Smith missed Jumper.
Clemson,Pittsburgh,24,48,26,27,0,Chris Jones Defensive Rebound.
Clemson,Pittsburgh,24,50,26,37,1,Josh Newkirk made Jumper.
Clemson,Pittsburgh,24,50,26,59,0,Foul on Derrick Randall.
Clemson,Pittsburgh,24,50,27,2,0,Landry Nnoko missed Jumper.
Clemson,Pittsburgh,24,50,27,2,0,Jamel Artis Defensive Rebound.
Clemson,Pittsburgh,24,52,27,32,1,Talib Zanna made Jumper. Assisted by Cameron Wright.
Clemson,Pittsburgh,24,52,27,32,0,Foul on Ibrahim Djambo.
Clemson,Pittsburgh,24,52,27,32,0,Talib Zanna missed Free Throw.
Clemson,Pittsburgh,24,52,27,32,0,Landry Nnoko Defensive Rebound.
Clemson,Pittsburgh,24,52,27,54,0,Jump Ball won by Clemson
Clemson,Pittsburgh,24,52,27,54,0,Jordan Roper Turnover.
Clemson,Pittsburgh,24,54,28,2,1,Talib Zanna made Layup. Assisted by Josh Newkirk.
Clemson,Pittsburgh,24,54,28,8,0,Clemson  Timeout
Clemson,Pittsburgh,24,54,28,25,0,Jaron Blossomgame missed Jumper.
Clemson,Pittsburgh,24,54,28,25,0,Talib Zanna Block.
Clemson,Pittsburgh,24,54,28,25,0,Pittsburgh Defensive Rebound.
Clemson,Pittsburgh,24,54,28,28,0,Official TV Timeout
Clemson,Pittsburgh,24,54,28,50,0,Cameron Wright missed Jumper.
Clemson,Pittsburgh,24,54,28,50,0,Talib Zanna Offensive Rebound.
Clemson,Pittsburgh,24,54,28,54,0,Talib Zanna missed Layup.
Clemson,Pittsburgh,24,54,28,54,0,Sidy Djitte Defensive Rebound.
Clemson,Pittsburgh,27,54,29,2,1,K.J. McDaniels made Three Point Jumper. Assisted by Rod Hall.
Clemson,Pittsburgh,27,57,29,16,1,Lamar Patterson made Three Point Jumper.
Clemson,Pittsburgh,27,57,29,36,0,Foul on Jamel Artis.
Clemson,Pittsburgh,28,57,29,36,1,K.J. McDaniels made Free Throw.
Clemson,Pittsburgh,29,57,29,36,1,K.J. McDaniels made Free Throw.
Clemson,Pittsburgh,29,59,30,2,1,Talib Zanna made Dunk. Assisted by Lamar Patterson.
Clemson,Pittsburgh,29,59,30,31,0,K.J. McDaniels missed Jumper.
Clemson,Pittsburgh,29,59,30,31,0,Jaron Blossomgame Offensive Rebound.
Clemson,Pittsburgh,29,59,30,33,0,Jaron Blossomgame missed Two Point Tip Shot.
Clemson,Pittsburgh,29,59,30,34,0,Sidy Djitte Offensive Rebound.
Clemson,Pittsburgh,29,59,30,41,0,K.J. McDaniels Turnover.
Clemson,Pittsburgh,29,59,31,2,0,Foul on Sidy Djitte.
Clemson,Pittsburgh,29,60,31,2,1,Talib Zanna made Free Throw.
Clemson,Pittsburgh,29,61,31,2,1,Talib Zanna made Free Throw.
Clemson,Pittsburgh,29,61,31,23,0,Austin Ajukwa missed Three Point Jumper.
Clemson,Pittsburgh,29,61,31,23,0,Sidy Djitte Offensive Rebound.
Clemson,Pittsburgh,29,61,31,30,0,Rod Hall missed Three Point Jumper.
Clemson,Pittsburgh,29,61,31,30,0,Josh Smith Offensive Rebound.
Clemson,Pittsburgh,29,61,31,34,0,Josh Smith missed Jumper.
Clemson,Pittsburgh,29,61,31,34,0,Sidy Djitte Offensive Rebound.
Clemson,Pittsburgh,31,61,31,38,1,Sidy Djitte made Layup.
Clemson,Pittsburgh,31,61,31,54,0,Lamar Patterson Turnover.
Clemson,Pittsburgh,31,61,31,54,0,Austin Ajukwa Steal.
Clemson,Pittsburgh,33,61,31,56,1,Austin Ajukwa made Dunk.
Clemson,Pittsburgh,33,61,31,58,0,Technical Foul on Austin Ajukwa.
Clemson,Pittsburgh,33,61,31,58,0,James Robinson missed Free Throw.
Clemson,Pittsburgh,33,61,31,58,0,Pittsburgh Deadball Team Rebound.
Clemson,Pittsburgh,33,62,31,58,1,James Robinson made Free Throw.
Clemson,Pittsburgh,33,62,32,26,0,Official TV Timeout
Clemson,Pittsburgh,33,62,32,30,0,James Robinson missed Three Point Jumper.
Clemson,Pittsburgh,33,62,32,30,0,Rod Hall Defensive Rebound.
Clemson,Pittsburgh,35,62,32,37,1,K.J. McDaniels made Dunk. Assisted by Rod Hall.
Clemson,Pittsburgh,35,62,32,55,0,Michael Young missed Jumper.
Clemson,Pittsburgh,35,62,32,55,0,Landry Nnoko Defensive Rebound.
Clemson,Pittsburgh,35,62,33,5,0,Sidy Djitte Turnover.
Clemson,Pittsburgh,35,62,33,14,0,Foul on Sidy Djitte.
Clemson,Pittsburgh,35,63,33,14,1,Lamar Patterson made Free Throw.
Clemson,Pittsburgh,35,64,33,14,1,Lamar Patterson made Free Throw.
Clemson,Pittsburgh,35,64,33,32,0,Foul on Chris Jones.
Clemson,Pittsburgh,35,64,33,50,0,Foul on Josh Newkirk.
Clemson,Pittsburgh,35,64,33,58,0,Landry Nnoko missed Jumper.
Clemson,Pittsburgh,35,64,33,58,0,Landry Nnoko Offensive Rebound.
Clemson,Pittsburgh,35,64,34,9,0,K.J. McDaniels missed Three Point Jumper.
Clemson,Pittsburgh,35,64,34,9,0,Sidy Djitte Offensive Rebound.
Clemson,Pittsburgh,35,64,34,15,0,Foul on Jamel Artis.
Clemson,Pittsburgh,35,64,34,15,0,Sidy Djitte missed Free Throw.
Clemson,Pittsburgh,35,64,34,15,0,James Robinson Defensive Rebound.
Clemson,Pittsburgh,35,66,34,43,1,Chris Jones made Layup. Assisted by Josh Newkirk.
Clemson,Pittsburgh,35,66,35,4,0,K.J. McDaniels missed Jumper.
Clemson,Pittsburgh,35,66,35,4,0,Clemson Offensive Rebound.
Clemson,Pittsburgh,35,66,35,13,0,Sidy Djitte missed Dunk.
Clemson,Pittsburgh,35,66,35,13,0,Chris Jones Defensive Rebound.
Clemson,Pittsburgh,35,68,35,29,1,Josh Newkirk made Layup. Assisted by James Robinson.
Clemson,Pittsburgh,35,68,35,42,0,Foul on Derrick Randall.
Clemson,Pittsburgh,36,68,35,42,1,Austin Ajukwa made Free Throw.
Clemson,Pittsburgh,36,68,35,42,0,Austin Ajukwa missed Free Throw.
Clemson,Pittsburgh,36,68,35,42,0,Landry Nnoko Offensive Rebound.
Clemson,Pittsburgh,38,68,35,43,1,Landry Nnoko made Jumper.
Clemson,Pittsburgh,38,71,36,3,1,Josh Newkirk made Three Point Jumper. Assisted by James Robinson.
Clemson,Pittsburgh,38,71,36,27,0,Foul on Josh Newkirk.
Clemson,Pittsburgh,38,71,36,27,0,Official TV Timeout
Clemson,Pittsburgh,38,71,36,27,0,Rod Hall missed Free Throw.
Clemson,Pittsburgh,38,71,36,27,0,Clemson Deadball Team Rebound.
Clemson,Pittsburgh,38,71,36,27,0,Rod Hall missed Free Throw.
Clemson,Pittsburgh,38,71,36,27,0,Jamel Artis Defensive Rebound.
Clemson,Pittsburgh,38,71,36,39,0,Chris Jones missed Three Point Jumper.
Clemson,Pittsburgh,38,71,36,39,0,Sidy Djitte Defensive Rebound.
Clemson,Pittsburgh,40,71,37,15,1,Sidy Djitte made Jumper.
Clemson,Pittsburgh,40,71,37,24,0,Clemson  Timeout
Clemson,Pittsburgh,40,74,37,42,1,Josh Newkirk made Three Point Jumper. Assisted by Jamel Artis.
Clemson,Pittsburgh,42,74,38,5,1,Carson Fields made Layup.
Clemson,Pittsburgh,42,76,38,20,1,Michael Young made Jumper. Assisted by Josh Newkirk.
Clemson,Pittsburgh,42,76,38,25,0,Pittsburgh  Timeout
Clemson,Pittsburgh,42,76,38,41,0,Austin Ajukwa missed Three Point Jumper.
Clemson,Pittsburgh,42,76,38,41,0,Sidy Djitte Offensive Rebound.
Clemson,Pittsburgh,42,76,38,47,0,Sidy Djitte missed Layup.
Clemson,Pittsburgh,42,76,38,47,0,Joseph Uchebo Defensive Rebound.
Clemson,Pittsburgh,42,76,38,59,0,Aron Nwankwo Turnover.
Clemson,Pittsburgh,42,76,38,59,0,Jaron Blossomgame Steal.
Clemson,Pittsburgh,42,76,39,11,0,Foul on Josh Newkirk.
Clemson,Pittsburgh,43,76,39,11,1,Austin Ajukwa made Free Throw.
Clemson,Pittsburgh,43,76,39,11,0,Austin Ajukwa missed Free Throw.
Clemson,Pittsburgh,43,76,39,11,0,Joseph Uchebo Defensive Rebound.
Clemson,Pittsburgh,43,76,39,19,0,Joshua Ko missed Three Point Jumper.
Clemson,Pittsburgh,43,76,39,19,0,Sidy Djitte Block.
Clemson,Pittsburgh,43,76,39,19,0,Chris Jones Offensive Rebound.
Clemson,Pittsburgh,43,76,39,26,0,Aron Nwankwo missed Three Point Jumper.
Clemson,Pittsburgh,43,76,39,26,0,Joseph Uchebo Offensive Rebound.
Clemson,Pittsburgh,43,76,39,30,0,Joseph Uchebo missed Jumper.
Clemson,Pittsburgh,43,76,39,30,0,Austin Ajukwa Block.
Clemson,Pittsburgh,43,76,39,30,0,Aron Nwankwo Offensive Rebound.
Clemson,Pittsburgh,43,76,39,36,0,Aron Nwankwo Turnover.
Clemson,Pittsburgh,43,76,39,49,0,Jaron Blossomgame missed Three Point Jumper.
Clemson,Pittsburgh,43,76,39,49,0,Chris Jones Defensive Rebound.
Clemson,Pittsburgh,43,76,40,0,0,End of Game
