Away Team,Home Team,Away Score,Home Score,Minute,Second,isScoringPosession,Desc.
Delaware State,UC Riverside,0,0,0,28,0,Devin Morgan Jr missed Jumper.
Delaware State,UC Riverside,0,0,0,28,0,Steven Jones Defensive Rebound.
Delaware State,UC Riverside,0,0,0,39,0,Alex Larsson missed Jumper.
Delaware State,UC Riverside,0,0,0,39,0,DeVaughn Mallory Defensive Rebound.
Delaware State,UC Riverside,2,0,0,54,1,DeAndre Haywood made Layup.
Delaware State,UC Riverside,2,0,1,3,0,Secean Johnson missed Three Point Jumper.
Delaware State,UC Riverside,2,0,1,3,0,Todd Hughes Block.
Delaware State,UC Riverside,2,0,1,9,0,DeAndre Haywood Defensive Rebound.
Delaware State,UC Riverside,2,0,1,24,0,Todd Hughes missed Jumper.
Delaware State,UC Riverside,2,0,1,24,0,Steven Jones Defensive Rebound.
Delaware State,UC Riverside,2,2,1,35,1,Robert Boezeman made Layup. Assisted by Steven Jones.
Delaware State,UC Riverside,2,2,1,46,0,Joseph Lewis Turnover.
Delaware State,UC Riverside,2,2,2,6,0,Robert Boezeman Turnover.
Delaware State,UC Riverside,2,2,2,7,0,Devin Morgan Jr Steal.
Delaware State,UC Riverside,2,2,2,10,0,Devin Morgan Jr missed Layup.
Delaware State,UC Riverside,2,2,2,10,0,Robert Boezeman Defensive Rebound.
Delaware State,UC Riverside,2,2,2,16,0,Steven Jones Turnover.
Delaware State,UC Riverside,2,2,2,18,0,Joseph Lewis Steal.
Delaware State,UC Riverside,2,2,2,18,0,Foul on Jaylen Bland.
Delaware State,UC Riverside,4,2,2,36,1,DeVaughn Mallory made Jumper. Assisted by DeAndre Haywood.
Delaware State,UC Riverside,4,2,2,44,0,Jaylen Bland Turnover.
Delaware State,UC Riverside,6,2,3,13,1,DeVaughn Mallory made Jumper.
Delaware State,UC Riverside,6,4,3,22,1,Menno Dijkstra made Layup. Assisted by Jaylen Bland.
Delaware State,UC Riverside,6,4,3,50,0,Foul on Gentrey Thomas.
Delaware State,UC Riverside,6,4,4,7,0,DeAndre Haywood missed Jumper.
Delaware State,UC Riverside,6,4,4,7,0,Robert Boezeman Defensive Rebound.
Delaware State,UC Riverside,6,7,4,21,1,Jaylen Bland made Three Point Jumper. Assisted by Robert Boezeman.
Delaware State,UC Riverside,6,7,4,36,0,Todd Hughes missed Three Point Jumper.
Delaware State,UC Riverside,6,7,4,36,0,Delaware St Offensive Rebound.
Delaware State,UC Riverside,6,7,4,38,0,Official TV Timeout
Delaware State,UC Riverside,6,7,4,55,0,DeVaughn Mallory Turnover.
Delaware State,UC Riverside,6,7,4,56,0,Gentrey Thomas Steal.
Delaware State,UC Riverside,6,7,5,8,0,Menno Dijkstra Turnover.
Delaware State,UC Riverside,6,7,5,10,0,Devin Morgan Jr Steal.
Delaware State,UC Riverside,6,7,5,13,0,DeAndre Haywood missed Layup.
Delaware State,UC Riverside,6,7,5,13,0,Gentrey Thomas Block.
Delaware State,UC Riverside,6,7,5,16,0,Gentrey Thomas Defensive Rebound.
Delaware State,UC Riverside,6,9,5,20,1,Jaylen Bland made Layup.
Delaware State,UC Riverside,6,9,5,43,0,DeAndre Haywood missed Layup.
Delaware State,UC Riverside,6,9,5,43,0,Menno Dijkstra Defensive Rebound.
Delaware State,UC Riverside,6,9,5,50,0,Gentrey Thomas missed Layup.
Delaware State,UC Riverside,6,9,5,50,0,Joseph Lewis Block.
Delaware State,UC Riverside,6,9,5,51,0,DeVaughn Mallory Defensive Rebound.
Delaware State,UC Riverside,8,9,6,1,1,DeAndre Haywood made Layup. Assisted by Todd Hughes.
Delaware State,UC Riverside,8,9,6,16,0,Steven Jones missed Three Point Jumper.
Delaware State,UC Riverside,8,9,6,16,0,Gentrey Thomas Offensive Rebound.
Delaware State,UC Riverside,8,9,6,30,0,Gentrey Thomas Turnover.
Delaware State,UC Riverside,8,9,6,31,0,Todd Hughes Steal.
Delaware State,UC Riverside,8,9,6,38,0,Foul on Steven Jones.
Delaware State,UC Riverside,10,9,6,47,1,Joseph Lewis made Jumper.
Delaware State,UC Riverside,10,9,6,52,0,Jaylen Bland missed Three Point Jumper.
Delaware State,UC Riverside,10,9,6,52,0,Joseph Lewis Defensive Rebound.
Delaware State,UC Riverside,10,9,7,10,0,Joseph Lewis missed Three Point Jumper.
Delaware State,UC Riverside,10,9,7,10,0,Malik Thames Defensive Rebound.
Delaware State,UC Riverside,10,12,7,14,1,Malik Thames made Three Point Jumper. Assisted by Gentrey Thomas.
Delaware State,UC Riverside,10,12,7,20,0,Mahir Johnson missed Layup.
Delaware State,UC Riverside,10,12,7,20,0,Primitivo Gomez Defensive Rebound.
Delaware State,UC Riverside,10,12,7,35,0,Gentrey Thomas missed Three Point Jumper.
Delaware State,UC Riverside,10,12,7,35,0,Delaware St Defensive Rebound.
Delaware State,UC Riverside,10,12,8,1,0,Official TV Timeout
Delaware State,UC Riverside,10,12,8,16,0,Mrdjan Gasevic missed Jumper.
Delaware State,UC Riverside,10,12,8,16,0,UC Riverside Defensive Rebound.
Delaware State,UC Riverside,10,12,8,30,0,Foul on Jamelle Christian.
Delaware State,UC Riverside,10,14,8,55,1,Robert Boezeman made Layup. Assisted by Malik Thames.
Delaware State,UC Riverside,10,14,9,29,0,Kavon Waller missed Three Point Jumper.
Delaware State,UC Riverside,10,14,9,29,0,Gentrey Thomas Defensive Rebound.
Delaware State,UC Riverside,10,14,9,56,0,Secean Johnson missed Jumper.
Delaware State,UC Riverside,10,14,9,56,0,Robert Boezeman Offensive Rebound.
Delaware State,UC Riverside,10,14,9,58,0,Foul on Mrdjan Gasevic.
Delaware State,UC Riverside,10,15,9,58,1,Robert Boezeman made Free Throw.
Delaware State,UC Riverside,10,16,9,58,1,Robert Boezeman made Free Throw.
Delaware State,UC Riverside,10,16,10,23,0,Jamelle Christian Turnover.
Delaware State,UC Riverside,10,16,10,24,0,Secean Johnson Steal.
Delaware State,UC Riverside,10,19,10,33,1,Gentrey Thomas made Three Point Jumper. Assisted by Malik Thames.
Delaware State,UC Riverside,10,19,11,5,0,Mrdjan Gasevic Turnover.
Delaware State,UC Riverside,10,19,11,24,0,Foul on Todd Hughes.
Delaware State,UC Riverside,10,19,11,28,0,Foul on Kavon Waller.
Delaware State,UC Riverside,10,20,11,28,1,Secean Johnson made Free Throw.
Delaware State,UC Riverside,10,20,11,28,0,Secean Johnson missed Free Throw.
Delaware State,UC Riverside,10,20,11,28,0,Demola Onifade Defensive Rebound.
Delaware State,UC Riverside,10,20,11,50,0,Todd Hughes missed Jumper.
Delaware State,UC Riverside,10,20,11,50,0,Delaware St Offensive Rebound.
Delaware State,UC Riverside,10,20,12,2,0,Kavon Waller missed Three Point Jumper.
Delaware State,UC Riverside,10,20,12,2,0,Menno Dijkstra Defensive Rebound.
Delaware State,UC Riverside,10,20,12,7,0,Foul on Devin Morgan Jr.
Delaware State,UC Riverside,10,20,12,8,0,Official TV Timeout
Delaware State,UC Riverside,10,20,12,8,0,Secean Johnson missed Free Throw.
Delaware State,UC Riverside,10,20,12,8,0,UC Riverside Deadball Team Rebound.
Delaware State,UC Riverside,10,21,12,8,1,Secean Johnson made Free Throw.
Delaware State,UC Riverside,10,21,12,33,0,Devin Morgan Jr missed Three Point Jumper.
Delaware State,UC Riverside,10,21,12,33,0,Steven Jones Defensive Rebound.
Delaware State,UC Riverside,10,21,12,40,0,Secean Johnson missed Layup.
Delaware State,UC Riverside,10,21,12,40,0,Steven Jones Offensive Rebound.
Delaware State,UC Riverside,10,21,12,44,0,Foul on Demola Onifade.
Delaware State,UC Riverside,10,22,12,44,1,Steven Jones made Free Throw.
Delaware State,UC Riverside,10,22,12,44,0,Steven Jones missed Free Throw.
Delaware State,UC Riverside,10,22,12,44,0,Demola Onifade Defensive Rebound.
Delaware State,UC Riverside,10,22,13,13,0,Todd Hughes missed Jumper.
Delaware State,UC Riverside,10,22,13,13,0,Robert Boezeman Defensive Rebound.
Delaware State,UC Riverside,10,22,13,25,0,Robert Boezeman missed Layup.
Delaware State,UC Riverside,10,22,13,25,0,Demola Onifade Block.
Delaware State,UC Riverside,10,22,13,27,0,Demola Onifade Defensive Rebound.
Delaware State,UC Riverside,13,22,13,31,1,Aric Dickerson made Three Point Jumper. Assisted by Devin Morgan Jr.
Delaware State,UC Riverside,13,22,13,47,0,Secean Johnson Turnover.
Delaware State,UC Riverside,13,22,14,14,0,Foul on Secean Johnson.
Delaware State,UC Riverside,14,22,14,14,1,Aric Dickerson made Free Throw.
Delaware State,UC Riverside,15,22,14,14,1,Aric Dickerson made Free Throw.
Delaware State,UC Riverside,15,22,14,29,0,Secean Johnson Turnover.
Delaware State,UC Riverside,15,22,14,43,0,Aric Dickerson Turnover.
Delaware State,UC Riverside,15,22,14,45,0,Gentrey Thomas Steal.
Delaware State,UC Riverside,15,24,14,46,1,Gentrey Thomas made Layup.
Delaware State,UC Riverside,15,24,15,18,0,Aric Dickerson missed Three Point Jumper.
Delaware State,UC Riverside,15,24,15,18,0,Steven Jones Defensive Rebound.
Delaware State,UC Riverside,15,24,15,21,0,Foul on Todd Hughes.
Delaware State,UC Riverside,15,25,15,21,1,Steven Jones made Free Throw.
Delaware State,UC Riverside,15,25,15,21,0,Steven Jones missed Free Throw.
Delaware State,UC Riverside,15,25,15,21,0,Demola Onifade Defensive Rebound.
Delaware State,UC Riverside,15,25,15,45,0,DeAndre Haywood Turnover.
Delaware State,UC Riverside,15,25,16,1,0,Jaylen Bland missed Three Point Jumper.
Delaware State,UC Riverside,15,25,16,1,0,Devin Morgan Jr Defensive Rebound.
Delaware State,UC Riverside,17,25,16,16,1,Malik Carter made Layup. Assisted by DeAndre Haywood.
Delaware State,UC Riverside,17,25,16,16,0,Foul on Jaylen Bland.
Delaware State,UC Riverside,17,25,16,16,0,Official TV Timeout
Delaware State,UC Riverside,18,25,16,16,1,Malik Carter made Free Throw.
Delaware State,UC Riverside,18,28,16,32,1,Jaylen Bland made Three Point Jumper. Assisted by Malik Thames.
Delaware State,UC Riverside,21,28,17,0,1,Malik Carter made Three Point Jumper. Assisted by Devin Morgan Jr.
Delaware State,UC Riverside,21,28,17,14,0,Foul on Joseph Lewis.
Delaware State,UC Riverside,21,29,17,14,1,Primitivo Gomez made Free Throw.
Delaware State,UC Riverside,21,29,17,14,0,Primitivo Gomez missed Free Throw.
Delaware State,UC Riverside,21,29,17,14,0,Gentrey Thomas Offensive Rebound.
Delaware State,UC Riverside,21,29,17,25,0,Malik Thames Turnover.
Delaware State,UC Riverside,21,29,17,52,0,Malik Carter Turnover.
Delaware State,UC Riverside,21,31,18,21,1,Gentrey Thomas made Jumper.
Delaware State,UC Riverside,21,31,18,35,0,Aric Dickerson Turnover.
Delaware State,UC Riverside,21,31,18,37,0,Gentrey Thomas Steal.
Delaware State,UC Riverside,21,33,18,40,1,Gentrey Thomas made Layup.
Delaware State,UC Riverside,23,33,19,8,1,Malik Carter made Jumper.
Delaware State,UC Riverside,23,33,19,9,0,UC Riverside  Timeout
Delaware State,UC Riverside,23,33,19,22,0,Foul on Kavon Waller.
Delaware State,UC Riverside,23,34,19,22,1,Malik Thames made Free Throw.
Delaware State,UC Riverside,23,34,19,22,0,Malik Thames missed Free Throw.
Delaware State,UC Riverside,23,34,19,22,0,Malik Carter Defensive Rebound.
Delaware State,UC Riverside,23,34,19,31,0,Delaware St  Timeout
Delaware State,UC Riverside,23,34,19,49,0,Malik Carter missed Three Point Jumper.
Delaware State,UC Riverside,23,34,19,49,0,Gentrey Thomas Defensive Rebound.
Delaware State,UC Riverside,23,34,20,0,0,End of 1st half
Delaware State,UC Riverside,23,34,20,10,0,DeVaughn Mallory Turnover.
Delaware State,UC Riverside,23,34,20,13,0,Secean Johnson Steal.
Delaware State,UC Riverside,23,36,20,20,1,Alex Larsson made Layup. Assisted by Secean Johnson.
Delaware State,UC Riverside,23,36,20,53,0,Delaware St  Turnover.
Delaware State,UC Riverside,23,36,20,58,0,Foul on Demola Onifade.
Delaware State,UC Riverside,23,37,20,58,1,Secean Johnson made Free Throw.
Delaware State,UC Riverside,23,38,20,58,1,Secean Johnson made Free Throw.
Delaware State,UC Riverside,23,38,21,16,0,Foul on Steven Jones.
Delaware State,UC Riverside,23,38,21,33,0,DeAndre Haywood missed Three Point Jumper.
Delaware State,UC Riverside,23,38,21,33,0,Alex Larsson Defensive Rebound.
Delaware State,UC Riverside,23,38,21,44,0,Robert Boezeman missed Three Point Jumper.
Delaware State,UC Riverside,23,38,21,44,0,Todd Hughes Defensive Rebound.
Delaware State,UC Riverside,25,38,22,15,1,Demola Onifade made Jumper. Assisted by Devin Morgan Jr.
Delaware State,UC Riverside,25,40,22,44,1,Secean Johnson made Jumper. Assisted by Steven Jones.
Delaware State,UC Riverside,27,40,23,14,1,Todd Hughes made Jumper.
Delaware State,UC Riverside,27,40,23,14,0,Foul on Steven Jones.
Delaware State,UC Riverside,28,40,23,14,1,Todd Hughes made Free Throw.
Delaware State,UC Riverside,28,40,23,28,0,Malik Thames Turnover.
Delaware State,UC Riverside,28,40,23,29,0,DeAndre Haywood Steal.
Delaware State,UC Riverside,28,40,23,32,0,DeAndre Haywood missed Layup.
Delaware State,UC Riverside,28,40,23,32,0,Malik Thames Defensive Rebound.
Delaware State,UC Riverside,28,43,23,43,1,Gentrey Thomas made Three Point Jumper. Assisted by Malik Thames.
Delaware State,UC Riverside,28,43,24,5,0,DeVaughn Mallory Turnover.
Delaware State,UC Riverside,28,43,24,5,0,Foul on DeVaughn Mallory.
Delaware State,UC Riverside,28,43,24,5,0,Official TV Timeout
Delaware State,UC Riverside,28,44,24,5,1,Secean Johnson made Free Throw.
Delaware State,UC Riverside,28,45,24,5,1,Secean Johnson made Free Throw.
Delaware State,UC Riverside,28,47,24,17,1,Secean Johnson made Jumper. Assisted by Gentrey Thomas.
Delaware State,UC Riverside,30,47,24,48,1,DeAndre Haywood made Layup.
Delaware State,UC Riverside,30,47,24,48,0,Foul on Menno Dijkstra.
Delaware State,UC Riverside,31,47,24,48,1,DeAndre Haywood made Free Throw.
Delaware State,UC Riverside,31,49,24,56,1,Jaylen Bland made Jumper.
Delaware State,UC Riverside,31,49,25,16,0,Devin Morgan Jr missed Three Point Jumper.
Delaware State,UC Riverside,31,49,25,16,0,Malik Thames Defensive Rebound.
Delaware State,UC Riverside,31,49,25,24,0,Jaylen Bland missed Layup.
Delaware State,UC Riverside,31,49,25,24,0,Menno Dijkstra Offensive Rebound.
Delaware State,UC Riverside,31,49,25,27,0,Menno Dijkstra missed Layup.
Delaware State,UC Riverside,31,49,25,27,0,Demola Onifade Defensive Rebound.
Delaware State,UC Riverside,31,49,25,38,0,Foul on Secean Johnson.
Delaware State,UC Riverside,31,49,25,39,0,Foul on Menno Dijkstra.
Delaware State,UC Riverside,33,49,25,43,1,DeAndre Haywood made Layup.
Delaware State,UC Riverside,33,49,25,58,0,Malik Thames missed Layup.
Delaware State,UC Riverside,33,49,25,58,0,Demola Onifade Block.
Delaware State,UC Riverside,33,49,26,2,0,Primitivo Gomez Offensive Rebound.
Delaware State,UC Riverside,33,49,26,5,0,Primitivo Gomez missed Layup.
Delaware State,UC Riverside,33,49,26,5,0,Malik Thames Offensive Rebound.
Delaware State,UC Riverside,33,51,26,12,1,Alex Larsson made Layup.
Delaware State,UC Riverside,35,51,26,22,1,DeAndre Haywood made Jumper. Assisted by Devin Morgan Jr.
Delaware State,UC Riverside,35,51,26,34,0,Foul on Demola Onifade.
Delaware State,UC Riverside,35,51,26,40,0,Gentrey Thomas missed Layup.
Delaware State,UC Riverside,35,51,26,40,0,Alex Larsson Offensive Rebound.
Delaware State,UC Riverside,35,51,26,44,0,Alex Larsson missed Layup.
Delaware State,UC Riverside,35,51,26,44,0,Kavon Waller Block.
Delaware State,UC Riverside,35,51,26,46,0,Demola Onifade Defensive Rebound.
Delaware State,UC Riverside,35,51,26,51,0,Demola Onifade Turnover.
Delaware State,UC Riverside,35,51,26,52,0,Gentrey Thomas Steal.
Delaware State,UC Riverside,35,53,26,54,1,Alex Larsson made Layup.
Delaware State,UC Riverside,35,53,27,5,0,Foul on Gentrey Thomas.
Delaware State,UC Riverside,36,53,27,5,1,DeAndre Haywood made Free Throw.
Delaware State,UC Riverside,36,53,27,5,0,DeAndre Haywood missed Free Throw.
Delaware State,UC Riverside,36,53,27,5,0,Delaware St Deadball Team Rebound.
Delaware State,UC Riverside,37,53,27,5,1,DeAndre Haywood made Free Throw.
Delaware State,UC Riverside,37,53,27,27,0,Steven Jones Turnover.
Delaware State,UC Riverside,37,53,27,36,0,Delaware St  Timeout
Delaware State,UC Riverside,37,53,27,54,0,Foul on Alex Larsson.
Delaware State,UC Riverside,38,53,27,54,1,Malik Carter made Free Throw.
Delaware State,UC Riverside,38,53,27,54,0,Malik Carter missed Free Throw.
Delaware State,UC Riverside,38,53,27,54,0,UC Riverside Deadball Team Rebound.
Delaware State,UC Riverside,38,56,28,5,1,Jaylen Bland made Three Point Jumper. Assisted by Secean Johnson.
Delaware State,UC Riverside,38,56,28,34,0,Kavon Waller missed Three Point Jumper.
Delaware State,UC Riverside,38,56,28,34,0,Todd Hughes Offensive Rebound.
Delaware State,UC Riverside,38,56,28,45,0,Demola Onifade missed Jumper.
Delaware State,UC Riverside,38,56,28,45,0,Jaylen Bland Defensive Rebound.
Delaware State,UC Riverside,38,56,29,16,0,Steven Jones missed Three Point Jumper.
Delaware State,UC Riverside,38,56,29,16,0,Alex Larsson Offensive Rebound.
Delaware State,UC Riverside,38,56,29,21,0,Steven Jones missed Jumper.
Delaware State,UC Riverside,38,56,29,21,0,Todd Hughes Defensive Rebound.
Delaware State,UC Riverside,38,56,29,51,0,DeAndre Haywood missed Layup.
Delaware State,UC Riverside,38,56,29,51,0,Alex Larsson Block.
Delaware State,UC Riverside,38,56,29,53,0,Alex Larsson Defensive Rebound.
Delaware State,UC Riverside,38,56,29,56,0,Alex Larsson Turnover.
Delaware State,UC Riverside,38,56,29,58,0,DeAndre Haywood Steal.
Delaware State,UC Riverside,40,56,30,0,1,DeAndre Haywood made Layup.
Delaware State,UC Riverside,40,59,30,17,1,Jaylen Bland made Three Point Jumper. Assisted by Alex Larsson.
Delaware State,UC Riverside,40,59,30,52,0,DeAndre Haywood missed Three Point Jumper.
Delaware State,UC Riverside,40,59,30,52,0,Alex Larsson Defensive Rebound.
Delaware State,UC Riverside,40,59,31,7,0,Foul on Steven Jones.
Delaware State,UC Riverside,40,59,31,7,0,Foul on Steven Jones.
Delaware State,UC Riverside,40,59,31,14,0,Official TV Timeout
Delaware State,UC Riverside,43,59,31,29,1,Devin Morgan Jr made Three Point Jumper. Assisted by Malik Carter.
Delaware State,UC Riverside,43,59,31,52,0,Jaylen Bland missed Three Point Jumper.
Delaware State,UC Riverside,43,59,31,52,0,Joseph Lewis Defensive Rebound.
Delaware State,UC Riverside,43,59,32,2,0,Aric Dickerson missed Three Point Jumper.
Delaware State,UC Riverside,43,59,32,2,0,Secean Johnson Defensive Rebound.
Delaware State,UC Riverside,43,62,32,27,1,Secean Johnson made Three Point Jumper. Assisted by Malik Thames.
Delaware State,UC Riverside,43,62,32,43,0,Foul on Aric Dickerson.
Delaware State,UC Riverside,43,62,32,43,0,Aric Dickerson Turnover.
Delaware State,UC Riverside,43,62,32,43,0,Official TV Timeout
Delaware State,UC Riverside,43,62,33,11,0,Jaylen Bland missed Jumper.
Delaware State,UC Riverside,43,62,33,11,0,Gentrey Thomas Offensive Rebound.
Delaware State,UC Riverside,43,62,33,16,0,Jaylen Bland missed Three Point Jumper.
Delaware State,UC Riverside,43,62,33,16,0,Jaylen Bland Offensive Rebound.
Delaware State,UC Riverside,43,64,33,20,1,Primitivo Gomez made Layup. Assisted by Jaylen Bland.
Delaware State,UC Riverside,43,64,33,29,0,Joseph Lewis missed Three Point Jumper.
Delaware State,UC Riverside,43,64,33,29,0,Menno Dijkstra Defensive Rebound.
Delaware State,UC Riverside,43,64,33,38,0,Foul on Joseph Lewis.
Delaware State,UC Riverside,43,64,33,43,0,UC Riverside  Timeout
Delaware State,UC Riverside,43,64,33,52,0,Foul on Todd Hughes.
Delaware State,UC Riverside,43,64,33,56,0,Malik Thames Turnover.
Delaware State,UC Riverside,43,64,33,58,0,Aric Dickerson Steal.
Delaware State,UC Riverside,43,64,33,59,0,Foul on Primitivo Gomez.
Delaware State,UC Riverside,44,64,33,59,1,Aric Dickerson made Free Throw.
Delaware State,UC Riverside,44,64,33,59,0,Aric Dickerson missed Free Throw.
Delaware State,UC Riverside,44,64,33,59,0,Malik Carter Offensive Rebound.
Delaware State,UC Riverside,44,64,34,3,0,Malik Carter missed Layup.
Delaware State,UC Riverside,44,64,34,3,0,Menno Dijkstra Defensive Rebound.
Delaware State,UC Riverside,44,66,34,10,1,Gentrey Thomas made Layup. Assisted by Malik Thames.
Delaware State,UC Riverside,46,66,34,22,1,Todd Hughes made Jumper.
Delaware State,UC Riverside,46,68,34,44,1,Gentrey Thomas made Layup.
Delaware State,UC Riverside,46,68,34,47,0,Demola Onifade Turnover.
Delaware State,UC Riverside,46,70,34,57,1,Menno Dijkstra made Jumper.
Delaware State,UC Riverside,46,70,35,16,0,Todd Hughes missed Layup.
Delaware State,UC Riverside,46,70,35,16,0,DJ Sylvester Defensive Rebound.
Delaware State,UC Riverside,46,70,35,35,0,Eric Rwahwire missed Three Point Jumper.
Delaware State,UC Riverside,46,70,35,35,0,Kavon Waller Defensive Rebound.
Delaware State,UC Riverside,46,70,35,42,0,Todd Hughes missed Jumper.
Delaware State,UC Riverside,46,70,35,42,0,Primitivo Gomez Defensive Rebound.
Delaware State,UC Riverside,46,70,35,44,0,Technical Foul on Primitivo Gomez.
Delaware State,UC Riverside,46,70,35,44,0,Foul on Primitivo Gomez.
Delaware State,UC Riverside,46,70,35,44,0,Technical Foul on Demola Onifade.
Delaware State,UC Riverside,46,70,35,44,0,Foul on Demola Onifade.
Delaware State,UC Riverside,46,70,36,5,0,Foul on Todd Hughes.
Delaware State,UC Riverside,46,70,36,5,0,Official TV Timeout
Delaware State,UC Riverside,46,71,36,5,1,Eric Rwahwire made Free Throw.
Delaware State,UC Riverside,46,72,36,5,1,Eric Rwahwire made Free Throw.
Delaware State,UC Riverside,46,72,36,6,0,Foul on DJ Sylvester.
Delaware State,UC Riverside,47,72,36,6,1,Devin Morgan Jr made Free Throw.
Delaware State,UC Riverside,48,72,36,6,1,Devin Morgan Jr made Free Throw.
Delaware State,UC Riverside,48,72,36,20,0,Primitivo Gomez missed Three Point Jumper.
Delaware State,UC Riverside,48,72,36,20,0,Todd Hughes Defensive Rebound.
Delaware State,UC Riverside,48,72,36,37,0,Todd Hughes missed Jumper.
Delaware State,UC Riverside,48,72,36,37,0,Devin Morgan Jr Offensive Rebound.
Delaware State,UC Riverside,50,72,36,41,1,Devin Morgan Jr made Jumper.
Delaware State,UC Riverside,50,74,36,55,1,Menno Dijkstra made Layup. Assisted by DJ Sylvester.
Delaware State,UC Riverside,50,74,36,55,0,Foul on Devin Morgan Jr.
Delaware State,UC Riverside,50,75,36,55,1,Menno Dijkstra made Free Throw.
Delaware State,UC Riverside,52,75,37,11,1,Todd Hughes made Layup. Assisted by DeAndre Haywood.
Delaware State,UC Riverside,52,75,37,19,0,Foul on DJ Sylvester.
Delaware State,UC Riverside,52,75,37,19,0,Technical Foul on DJ Sylvester.
Delaware State,UC Riverside,52,75,37,23,0,Todd Hughes missed Layup.
Delaware State,UC Riverside,52,75,37,23,0,Primitivo Gomez Defensive Rebound.
Delaware State,UC Riverside,52,77,37,28,1,DJ Sylvester made Jumper.
Delaware State,UC Riverside,52,77,37,40,0,Devin Morgan Jr missed Layup.
Delaware State,UC Riverside,52,77,37,40,0,Menno Dijkstra Defensive Rebound.
Delaware State,UC Riverside,52,77,37,44,0,Foul on DeAndre Haywood.
Delaware State,UC Riverside,52,78,37,54,1,DJ Sylvester made Free Throw.
Delaware State,UC Riverside,52,78,37,54,0,DJ Sylvester missed Free Throw.
Delaware State,UC Riverside,52,78,37,54,0,DeAndre Haywood Defensive Rebound.
Delaware State,UC Riverside,52,78,38,2,0,Foul on Koh Flippin.
Delaware State,UC Riverside,53,78,38,2,1,Demola Onifade made Free Throw.
Delaware State,UC Riverside,53,78,38,2,0,Demola Onifade missed Free Throw.
Delaware State,UC Riverside,53,78,38,2,0,Menno Dijkstra Defensive Rebound.
Delaware State,UC Riverside,53,78,38,14,0,Menno Dijkstra missed Layup.
Delaware State,UC Riverside,53,78,38,14,0,Demola Onifade Block.
Delaware State,UC Riverside,53,78,38,16,0,Demola Onifade Defensive Rebound.
Delaware State,UC Riverside,53,78,38,19,0,Todd Hughes Turnover.
Delaware State,UC Riverside,53,78,38,21,0,Koh Flippin Steal.
Delaware State,UC Riverside,53,81,38,27,1,DJ Sylvester made Three Point Jumper. Assisted by Eric Rwahwire.
Delaware State,UC Riverside,53,81,38,42,0,DeAndre Haywood missed Jumper.
Delaware State,UC Riverside,53,81,38,42,0,Menno Dijkstra Defensive Rebound.
Delaware State,UC Riverside,53,81,38,53,0,Eric Rwahwire missed Layup.
Delaware State,UC Riverside,53,81,38,53,0,Kavon Waller Defensive Rebound.
Delaware State,UC Riverside,53,81,38,59,0,Foul on Menno Dijkstra.
Delaware State,UC Riverside,54,81,38,59,1,Todd Hughes made Free Throw.
Delaware State,UC Riverside,55,81,38,59,1,Todd Hughes made Free Throw.
Delaware State,UC Riverside,55,81,39,12,0,Menno Dijkstra missed Layup.
Delaware State,UC Riverside,55,81,39,12,0,Todd Hughes Block.
Delaware State,UC Riverside,55,81,39,14,0,UC Riverside Offensive Rebound.
Delaware State,UC Riverside,55,81,39,16,0,Primitivo Gomez missed Three Point Jumper.
Delaware State,UC Riverside,55,81,39,16,0,DeAndre Haywood Defensive Rebound.
Delaware State,UC Riverside,55,81,39,24,0,DeAndre Haywood Turnover.
Delaware State,UC Riverside,55,81,39,42,0,Eric Rwahwire missed Layup.
Delaware State,UC Riverside,55,81,39,42,0,Demola Onifade Defensive Rebound.
Delaware State,UC Riverside,55,81,39,49,0,Todd Hughes missed Layup.
Delaware State,UC Riverside,55,81,39,49,0,Eric Rwahwire Defensive Rebound.
Delaware State,UC Riverside,55,81,40,0,0,End of Game
