Away Team,Home Team,Away Score, Home Score,Minute,Second,isScoringPosession,Desc.
Maryland-Eastern Shore,George Washington,0,0,0,16,0,Tyler Cavanaugh missed Three Point Jumper.
Maryland-Eastern Shore,George Washington,0,0,0,16,0,Yuta Watanabe Offensive Rebound.
Maryland-Eastern Shore,George Washington,0,0,0,21,0,Foul on Bakari Copeland.
Maryland-Eastern Shore,George Washington,0,1,0,21,1,Yuta Watanabe made Free Throw.
Maryland-Eastern Shore,George Washington,0,2,0,21,1,Yuta Watanabe made Free Throw.
Maryland-Eastern Shore,George Washington,2,2,0,41,1,Bakari Copeland made Jumper. Assisted by Derrico Peck.
Maryland-Eastern Shore,George Washington,2,2,1,13,0,George Washington  Turnover.
Maryland-Eastern Shore,George Washington,2,2,1,42,0,Isaac Taylor missed Jumper.
Maryland-Eastern Shore,George Washington,2,2,1,42,0,Derrico Peck Offensive Rebound.
Maryland-Eastern Shore,George Washington,4,2,1,46,1,Derrico Peck made Two Point Tip Shot.
Maryland-Eastern Shore,George Washington,4,2,2,0,0,Collin Smith missed Jumper.
Maryland-Eastern Shore,George Washington,4,2,2,0,0,Derrico Peck Defensive Rebound.
Maryland-Eastern Shore,George Washington,4,2,2,13,0,Bakari Copeland missed Jumper.
Maryland-Eastern Shore,George Washington,4,2,2,13,0,Matt Hart Defensive Rebound.
Maryland-Eastern Shore,George Washington,4,2,2,25,0,Tyler Cavanaugh Turnover.
Maryland-Eastern Shore,George Washington,4,2,2,44,0,Thomas Rivera missed Layup.
Maryland-Eastern Shore,George Washington,4,2,2,44,0,Tyler Cavanaugh Defensive Rebound.
Maryland-Eastern Shore,George Washington,4,2,2,51,0,Jaren Sina missed Three Point Jumper.
Maryland-Eastern Shore,George Washington,4,2,2,51,0,Bakari Copeland Defensive Rebound.
Maryland-Eastern Shore,George Washington,4,2,3,3,0,Isaac Taylor Turnover.
Maryland-Eastern Shore,George Washington,4,4,3,14,1,Collin Smith made Layup. Assisted by Jaren Sina.
Maryland-Eastern Shore,George Washington,4,4,3,34,0,Bakari Copeland Turnover.
Maryland-Eastern Shore,George Washington,4,7,3,45,1,Yuta Watanabe made Three Point Jumper. Assisted by Jaren Sina.
Maryland-Eastern Shore,George Washington,7,7,4,11,1,Bakari Copeland made Three Point Jumper. Assisted by Thomas Rivera.
Maryland-Eastern Shore,George Washington,7,10,4,31,1,Yuta Watanabe made Three Point Jumper. Assisted by Matt Hart.
Maryland-Eastern Shore,George Washington,7,10,4,52,0,Foul on Yuta Watanabe.
Maryland-Eastern Shore,George Washington,7,10,4,52,0,Official TV Timeout
Maryland-Eastern Shore,George Washington,7,10,5,13,0,Derrico Peck missed Layup.
Maryland-Eastern Shore,George Washington,7,10,5,13,0,Tyler Cavanaugh Defensive Rebound.
Maryland-Eastern Shore,George Washington,7,10,5,19,0,Foul on Thomas Rivera.
Maryland-Eastern Shore,George Washington,7,10,5,23,0,Matt Hart missed Jumper.
Maryland-Eastern Shore,George Washington,7,10,5,23,0,Collin Smith Offensive Rebound.
Maryland-Eastern Shore,George Washington,7,12,5,44,1,Yuta Watanabe made Layup.
Maryland-Eastern Shore,George Washington,10,12,6,10,1,Thomas Rivera made Three Point Jumper. Assisted by Isaac Taylor.
Maryland-Eastern Shore,George Washington,10,14,6,30,1,Collin Smith made Dunk. Assisted by Tyler Cavanaugh.
Maryland-Eastern Shore,George Washington,13,14,6,42,1,Ryan Andino made Three Point Jumper. Assisted by Thomas Rivera.
Maryland-Eastern Shore,George Washington,13,14,6,59,0,Matt Hart missed Three Point Jumper.
Maryland-Eastern Shore,George Washington,13,14,6,59,0,George Washington Offensive Rebound.
Maryland-Eastern Shore,George Washington,13,14,7,8,0,Foul on Thomas Rivera.
Maryland-Eastern Shore,George Washington,13,14,7,23,0,Arnaldo Toro Turnover.
Maryland-Eastern Shore,George Washington,13,14,7,36,0,Ryan Andino Turnover.
Maryland-Eastern Shore,George Washington,13,14,7,44,0,Yuta Watanabe Turnover.
Maryland-Eastern Shore,George Washington,13,14,8,6,0,Logan McIntosh missed Jumper.
Maryland-Eastern Shore,George Washington,13,14,8,6,0,Derrico Peck Offensive Rebound.
Maryland-Eastern Shore,George Washington,13,14,8,8,0,Derrico Peck missed Dunk.
Maryland-Eastern Shore,George Washington,13,14,8,9,0,Kevin Marfo Defensive Rebound.
Maryland-Eastern Shore,George Washington,13,14,8,11,0,Jaren Sina missed Layup.
Maryland-Eastern Shore,George Washington,13,14,8,12,0,Derrico Peck Block.
Maryland-Eastern Shore,George Washington,13,14,8,13,0,George Washington Offensive Rebound.
Maryland-Eastern Shore,George Washington,13,14,8,13,0,Official TV Timeout
Maryland-Eastern Shore,George Washington,13,17,8,15,1,Jordan Roland made Three Point Jumper. Assisted by Jair Bolden.
Maryland-Eastern Shore,George Washington,13,17,8,44,0,Foul on Kevin Marfo.
Maryland-Eastern Shore,George Washington,14,17,8,44,1,Dontae Caldwell made Free Throw.
Maryland-Eastern Shore,George Washington,15,17,8,44,1,Dontae Caldwell made Free Throw.
Maryland-Eastern Shore,George Washington,15,17,9,0,0,Jair Bolden missed Three Point Jumper.
Maryland-Eastern Shore,George Washington,15,17,9,0,0,Tyler Jones Defensive Rebound.
Maryland-Eastern Shore,George Washington,15,17,9,2,0,Foul on Kevin Marfo.
Maryland-Eastern Shore,George Washington,15,17,9,21,0,Dontae Caldwell missed Three Point Jumper.
Maryland-Eastern Shore,George Washington,15,17,9,21,0,Patrick Steeves Defensive Rebound.
Maryland-Eastern Shore,George Washington,15,17,9,46,0,Arnaldo Toro Turnover.
Maryland-Eastern Shore,George Washington,15,17,9,47,0,Deven Dorsett Steal.
Maryland-Eastern Shore,George Washington,15,17,9,51,0,Foul on Arnaldo Toro.
Maryland-Eastern Shore,George Washington,15,17,10,15,0,Dontae Caldwell Turnover.
Maryland-Eastern Shore,George Washington,15,17,10,17,0,Collin Smith Steal.
Maryland-Eastern Shore,George Washington,15,17,10,19,0,Foul on Tyler Jones.
Maryland-Eastern Shore,George Washington,15,17,10,32,0,Jair Bolden missed Three Point Jumper.
Maryland-Eastern Shore,George Washington,15,17,10,32,0,Logan McIntosh Defensive Rebound.
Maryland-Eastern Shore,George Washington,15,17,10,39,0,Foul on Jaren Sina.
Maryland-Eastern Shore,George Washington,15,17,10,40,0,Deven Dorsett missed Three Point Jumper.
Maryland-Eastern Shore,George Washington,15,17,10,40,0,Patrick Steeves Defensive Rebound.
Maryland-Eastern Shore,George Washington,15,19,10,53,1,Tyler Cavanaugh made Jumper.
Maryland-Eastern Shore,George Washington,15,19,11,0,0,Michael Chambers missed Three Point Jumper.
Maryland-Eastern Shore,George Washington,15,19,11,0,0,Tyler Cavanaugh Defensive Rebound.
Maryland-Eastern Shore,George Washington,15,19,11,24,0,Tyler Cavanaugh missed Layup.
Maryland-Eastern Shore,George Washington,15,19,11,24,0,Tyler Jones Block.
Maryland-Eastern Shore,George Washington,15,19,11,26,0,Michael Chambers Defensive Rebound.
Maryland-Eastern Shore,George Washington,17,19,11,46,1,Logan McIntosh made Jumper.
Maryland-Eastern Shore,George Washington,17,19,12,5,0,Foul on Tyler Jones.
Maryland-Eastern Shore,George Washington,17,19,12,5,0,Official TV Timeout
Maryland-Eastern Shore,George Washington,17,19,12,16,0,Jaren Sina missed Three Point Jumper.
Maryland-Eastern Shore,George Washington,17,19,12,16,0,Tyler Cavanaugh Offensive Rebound.
Maryland-Eastern Shore,George Washington,17,19,12,21,0,Tyler Cavanaugh missed Three Point Jumper.
Maryland-Eastern Shore,George Washington,17,19,12,21,0,Bakari Copeland Defensive Rebound.
Maryland-Eastern Shore,George Washington,17,19,12,49,0,Bakari Copeland missed Jumper.
Maryland-Eastern Shore,George Washington,17,19,12,49,0,Derrico Peck Offensive Rebound.
Maryland-Eastern Shore,George Washington,17,19,13,2,0,Logan McIntosh missed Jumper.
Maryland-Eastern Shore,George Washington,17,19,13,2,0,Yuta Watanabe Block.
Maryland-Eastern Shore,George Washington,17,19,13,6,0,Collin Smith Defensive Rebound.
Maryland-Eastern Shore,George Washington,17,19,13,11,0,Yuta Watanabe missed Three Point Jumper.
Maryland-Eastern Shore,George Washington,17,19,13,11,0,Logan McIntosh Defensive Rebound.
Maryland-Eastern Shore,George Washington,17,19,13,18,0,Logan McIntosh missed Layup.
Maryland-Eastern Shore,George Washington,17,19,13,18,0,Jaren Sina Defensive Rebound.
Maryland-Eastern Shore,George Washington,17,19,13,31,0,Jaren Sina missed Three Point Jumper.
Maryland-Eastern Shore,George Washington,17,19,13,31,0,Yuta Watanabe Offensive Rebound.
Maryland-Eastern Shore,George Washington,17,21,13,42,1,Collin Smith made Jumper. Assisted by Yuta Watanabe.
Maryland-Eastern Shore,George Washington,17,21,13,54,0,Michael Chambers missed Three Point Jumper.
Maryland-Eastern Shore,George Washington,17,21,13,54,0,Jaren Sina Defensive Rebound.
Maryland-Eastern Shore,George Washington,17,21,14,12,0,Collin Smith missed Jumper.
Maryland-Eastern Shore,George Washington,17,21,14,12,0,Matt Hart Offensive Rebound.
Maryland-Eastern Shore,George Washington,17,21,14,17,0,Foul on Michael Chambers.
Maryland-Eastern Shore,George Washington,17,22,14,17,1,Collin Smith made Free Throw.
Maryland-Eastern Shore,George Washington,17,22,14,17,0,Collin Smith missed Free Throw.
Maryland-Eastern Shore,George Washington,17,22,14,17,0,Maryland-Eastern Shore Defensive Rebound.
Maryland-Eastern Shore,George Washington,17,22,14,38,0,Bakari Copeland missed Jumper.
Maryland-Eastern Shore,George Washington,17,22,14,38,0,Tyler Cavanaugh Defensive Rebound.
Maryland-Eastern Shore,George Washington,17,22,14,54,0,Matt Hart missed Three Point Jumper.
Maryland-Eastern Shore,George Washington,17,22,14,54,0,Ryan Andino Defensive Rebound.
Maryland-Eastern Shore,George Washington,17,22,15,18,0,Ryan Andino missed Layup.
Maryland-Eastern Shore,George Washington,17,22,15,18,0,Bakari Copeland Offensive Rebound.
Maryland-Eastern Shore,George Washington,17,22,15,24,0,Ryan Andino missed Jumper.
Maryland-Eastern Shore,George Washington,17,22,15,24,0,George Washington Defensive Rebound.
Maryland-Eastern Shore,George Washington,17,22,15,41,0,Tyler Cavanaugh Turnover.
Maryland-Eastern Shore,George Washington,17,22,16,8,0,Isaac Taylor missed Jumper.
Maryland-Eastern Shore,George Washington,17,22,16,8,0,Matt Hart Defensive Rebound.
Maryland-Eastern Shore,George Washington,17,22,16,19,0,Patrick Steeves missed Jumper.
Maryland-Eastern Shore,George Washington,17,22,16,19,0,Arnaldo Toro Offensive Rebound.
Maryland-Eastern Shore,George Washington,17,22,16,27,0,Matt Hart Turnover.
Maryland-Eastern Shore,George Washington,17,22,16,28,0,Ryan Andino Steal.
Maryland-Eastern Shore,George Washington,17,22,16,32,0,Ryan Andino missed Layup.
Maryland-Eastern Shore,George Washington,17,22,16,32,0,Isaac Taylor Offensive Rebound.
Maryland-Eastern Shore,George Washington,17,22,16,38,0,Isaac Taylor missed Layup.
Maryland-Eastern Shore,George Washington,17,22,16,38,0,Jordan Roland Defensive Rebound.
Maryland-Eastern Shore,George Washington,17,22,16,41,0,Official TV Timeout
Maryland-Eastern Shore,George Washington,17,22,17,4,0,Jordan Roland missed Jumper.
Maryland-Eastern Shore,George Washington,17,22,17,4,0,Patrick Steeves Offensive Rebound.
Maryland-Eastern Shore,George Washington,17,25,17,14,1,Tyler Cavanaugh made Three Point Jumper. Assisted by Jordan Roland.
Maryland-Eastern Shore,George Washington,17,25,17,32,0,Foul on Patrick Steeves.
Maryland-Eastern Shore,George Washington,18,25,17,32,1,Bakari Copeland made Free Throw.
Maryland-Eastern Shore,George Washington,19,25,17,32,1,Bakari Copeland made Free Throw.
Maryland-Eastern Shore,George Washington,19,27,17,57,1,Arnaldo Toro made Jumper. Assisted by Jordan Roland.
Maryland-Eastern Shore,George Washington,19,27,18,17,0,Isaac Taylor missed Jumper.
Maryland-Eastern Shore,George Washington,19,27,18,17,0,Tyler Cavanaugh Defensive Rebound.
Maryland-Eastern Shore,George Washington,19,27,18,18,0,Foul on Dontae Caldwell.
Maryland-Eastern Shore,George Washington,19,28,18,18,1,Tyler Cavanaugh made Free Throw.
Maryland-Eastern Shore,George Washington,19,29,18,18,1,Tyler Cavanaugh made Free Throw.
Maryland-Eastern Shore,George Washington,19,29,18,33,0,Bakari Copeland missed Three Point Jumper.
Maryland-Eastern Shore,George Washington,19,29,18,33,0,Jaren Sina Defensive Rebound.
Maryland-Eastern Shore,George Washington,19,29,18,56,0,Foul on Bakari Copeland.
Maryland-Eastern Shore,George Washington,19,29,18,56,0,Collin Smith missed Free Throw.
Maryland-Eastern Shore,George Washington,19,29,18,56,0,Yuta Watanabe Offensive Rebound.
Maryland-Eastern Shore,George Washington,19,32,19,18,1,Tyler Cavanaugh made Three Point Jumper. Assisted by Jordan Roland.
Maryland-Eastern Shore,George Washington,19,32,19,31,0,Maryland-Eastern Shore  Timeout
Maryland-Eastern Shore,George Washington,22,32,19,54,1,Ryan Andino made Three Point Jumper.
Maryland-Eastern Shore,George Washington,22,32,20,0,0,End of 1st half
Maryland-Eastern Shore,George Washington,22,32,20,24,0,Ryan Andino Turnover.
Maryland-Eastern Shore,George Washington,22,32,20,24,0,Matt Hart Steal.
Maryland-Eastern Shore,George Washington,22,32,20,38,0,Tyler Cavanaugh missed Three Point Jumper.
Maryland-Eastern Shore,George Washington,22,32,20,38,0,Ryan Andino Defensive Rebound.
Maryland-Eastern Shore,George Washington,22,32,21,6,0,Isaac Taylor missed Jumper.
Maryland-Eastern Shore,George Washington,22,32,21,6,0,Tyler Cavanaugh Defensive Rebound.
Maryland-Eastern Shore,George Washington,22,32,21,12,0,Foul on Thomas Rivera.
Maryland-Eastern Shore,George Washington,22,35,21,17,1,Jaren Sina made Three Point Jumper. Assisted by Matt Hart.
Maryland-Eastern Shore,George Washington,22,35,21,41,0,Isaac Taylor missed Layup.
Maryland-Eastern Shore,George Washington,22,35,21,41,0,Collin Smith Defensive Rebound.
Maryland-Eastern Shore,George Washington,22,35,21,49,0,Jaren Sina Turnover.
Maryland-Eastern Shore,George Washington,22,35,21,51,0,Ryan Andino Steal.
Maryland-Eastern Shore,George Washington,22,35,21,57,0,Thomas Rivera missed Jumper.
Maryland-Eastern Shore,George Washington,22,35,21,57,0,Tyler Cavanaugh Defensive Rebound.
Maryland-Eastern Shore,George Washington,22,37,22,4,1,Matt Hart made Jumper. Assisted by Jaren Sina.
Maryland-Eastern Shore,George Washington,22,37,22,16,0,Maryland-Eastern Shore  Timeout
Maryland-Eastern Shore,George Washington,22,37,22,16,0,Official TV Timeout
Maryland-Eastern Shore,George Washington,24,37,22,32,1,Thomas Rivera made Jumper.
Maryland-Eastern Shore,George Washington,24,37,22,45,0,Jaren Sina missed Jumper.
Maryland-Eastern Shore,George Washington,24,37,22,45,0,Yuta Watanabe Offensive Rebound.
Maryland-Eastern Shore,George Washington,24,40,22,52,1,Tyler Cavanaugh made Three Point Jumper. Assisted by Matt Hart.
Maryland-Eastern Shore,George Washington,24,40,23,20,0,Thomas Rivera Turnover.
Maryland-Eastern Shore,George Washington,24,43,23,31,1,Jaren Sina made Three Point Jumper. Assisted by Tyler Cavanaugh.
Maryland-Eastern Shore,George Washington,24,43,23,48,0,Foul on Jordan Roland.
Maryland-Eastern Shore,George Washington,24,43,24,8,0,Ryan Andino missed Layup.
Maryland-Eastern Shore,George Washington,24,43,24,8,0,Maryland-Eastern Shore Offensive Rebound.
Maryland-Eastern Shore,George Washington,24,43,24,8,0,Official TV Timeout
Maryland-Eastern Shore,George Washington,26,43,24,11,1,Derrico Peck made Layup. Assisted by Bakari Copeland.
Maryland-Eastern Shore,George Washington,26,43,24,20,0,Jaren Sina Turnover.
Maryland-Eastern Shore,George Washington,26,43,24,21,0,Thomas Rivera Steal.
Maryland-Eastern Shore,George Washington,26,43,24,21,0,Foul on Jaren Sina.
Maryland-Eastern Shore,George Washington,27,43,24,21,1,Thomas Rivera made Free Throw.
Maryland-Eastern Shore,George Washington,28,43,24,21,1,Thomas Rivera made Free Throw.
Maryland-Eastern Shore,George Washington,28,43,24,37,0,Foul on Derrico Peck.
Maryland-Eastern Shore,George Washington,28,43,24,37,0,Jordan Roland missed Free Throw.
Maryland-Eastern Shore,George Washington,28,43,24,37,0,George Washington Deadball Team Rebound.
Maryland-Eastern Shore,George Washington,28,44,24,37,1,Jordan Roland made Free Throw.
Maryland-Eastern Shore,George Washington,28,44,24,54,0,Ryan Andino missed Three Point Jumper.
Maryland-Eastern Shore,George Washington,28,44,24,54,0,Michael Chambers Offensive Rebound.
Maryland-Eastern Shore,George Washington,31,44,25,7,1,Bakari Copeland made Three Point Jumper. Assisted by Michael Chambers.
Maryland-Eastern Shore,George Washington,31,44,25,34,0,Kevin Marfo Turnover.
Maryland-Eastern Shore,George Washington,31,44,25,42,0,Bakari Copeland missed Jumper.
Maryland-Eastern Shore,George Washington,31,44,25,42,0,Deven Dorsett Offensive Rebound.
Maryland-Eastern Shore,George Washington,31,44,25,45,0,Deven Dorsett missed Two Point Tip Shot.
Maryland-Eastern Shore,George Washington,31,44,25,45,0,Arnaldo Toro Defensive Rebound.
Maryland-Eastern Shore,George Washington,31,46,26,2,1,Tyler Cavanaugh made Layup. Assisted by Matt Hart.
Maryland-Eastern Shore,George Washington,31,46,26,2,0,Foul on Michael Chambers.
Maryland-Eastern Shore,George Washington,31,47,26,2,1,Tyler Cavanaugh made Free Throw.
Maryland-Eastern Shore,George Washington,31,47,26,31,0,Derrico Peck Turnover.
Maryland-Eastern Shore,George Washington,31,47,26,40,0,Foul on Derrico Peck.
Maryland-Eastern Shore,George Washington,31,47,26,54,0,Jair Bolden Turnover.
Maryland-Eastern Shore,George Washington,31,47,26,55,0,Derrico Peck Steal.
Maryland-Eastern Shore,George Washington,31,47,26,58,0,Derrico Peck missed Jumper.
Maryland-Eastern Shore,George Washington,31,47,26,58,0,Jair Bolden Block.
Maryland-Eastern Shore,George Washington,31,47,27,0,0,Jair Bolden Defensive Rebound.
Maryland-Eastern Shore,George Washington,31,49,27,4,1,Tyler Cavanaugh made Layup. Assisted by Jair Bolden.
Maryland-Eastern Shore,George Washington,33,49,27,27,1,Logan McIntosh made Jumper.
Maryland-Eastern Shore,George Washington,33,49,27,38,0,Tyler Cavanaugh missed Three Point Jumper.
Maryland-Eastern Shore,George Washington,33,49,27,38,0,Tyler Jones Defensive Rebound.
Maryland-Eastern Shore,George Washington,33,49,28,3,0,Logan McIntosh missed Jumper.
Maryland-Eastern Shore,George Washington,33,49,28,3,0,Yuta Watanabe Defensive Rebound.
Maryland-Eastern Shore,George Washington,33,49,28,21,0,Jair Bolden missed Three Point Jumper.
Maryland-Eastern Shore,George Washington,33,49,28,21,0,Derrico Peck Defensive Rebound.
Maryland-Eastern Shore,George Washington,33,49,28,29,0,Ryan Andino missed Three Point Jumper.
Maryland-Eastern Shore,George Washington,33,49,28,29,0,Collin Smith Defensive Rebound.
Maryland-Eastern Shore,George Washington,33,49,28,39,0,Foul on Derrico Peck.
Maryland-Eastern Shore,George Washington,33,49,28,39,0,Official TV Timeout
Maryland-Eastern Shore,George Washington,33,50,28,39,1,Jair Bolden made Free Throw.
Maryland-Eastern Shore,George Washington,33,51,28,39,1,Jair Bolden made Free Throw.
Maryland-Eastern Shore,George Washington,33,51,28,59,0,Bakari Copeland missed Jumper.
Maryland-Eastern Shore,George Washington,33,51,28,59,0,Michael Chambers Offensive Rebound.
Maryland-Eastern Shore,George Washington,33,51,29,0,0,Foul on Tyler Cavanaugh.
Maryland-Eastern Shore,George Washington,33,51,29,0,0,Michael Chambers missed Free Throw.
Maryland-Eastern Shore,George Washington,33,51,29,0,0,Maryland-Eastern Shore Deadball Team Rebound.
Maryland-Eastern Shore,George Washington,34,51,29,0,1,Michael Chambers made Free Throw.
Maryland-Eastern Shore,George Washington,34,51,29,3,0,Tyler Cavanaugh Turnover.
Maryland-Eastern Shore,George Washington,34,51,29,3,0,Logan McIntosh Steal.
Maryland-Eastern Shore,George Washington,34,51,29,3,0,Foul on Tyler Cavanaugh.
Maryland-Eastern Shore,George Washington,37,51,29,17,1,Michael Chambers made Three Point Jumper. Assisted by Bakari Copeland.
Maryland-Eastern Shore,George Washington,37,51,29,40,0,Foul on Logan McIntosh.
Maryland-Eastern Shore,George Washington,37,52,29,40,1,Arnaldo Toro made Free Throw.
Maryland-Eastern Shore,George Washington,37,53,29,40,1,Arnaldo Toro made Free Throw.
Maryland-Eastern Shore,George Washington,39,53,30,1,1,Bakari Copeland made Jumper.
Maryland-Eastern Shore,George Washington,39,53,30,18,0,Tyler Cavanaugh Turnover.
Maryland-Eastern Shore,George Washington,39,53,30,19,0,Tyler Jones Steal.
Maryland-Eastern Shore,George Washington,39,53,30,27,0,Dontae Caldwell missed Three Point Jumper.
Maryland-Eastern Shore,George Washington,39,53,30,27,0,Bakari Copeland Offensive Rebound.
Maryland-Eastern Shore,George Washington,41,53,30,31,1,Bakari Copeland made Layup.
Maryland-Eastern Shore,George Washington,41,53,30,32,0,George Washington  Timeout
Maryland-Eastern Shore,George Washington,41,53,30,45,0,Patrick Steeves missed Three Point Jumper.
Maryland-Eastern Shore,George Washington,41,53,30,45,0,Arnaldo Toro Offensive Rebound.
Maryland-Eastern Shore,George Washington,41,53,30,50,0,Arnaldo Toro Turnover.
Maryland-Eastern Shore,George Washington,41,53,30,52,0,Logan McIntosh Steal.
Maryland-Eastern Shore,George Washington,43,53,30,54,1,Dontae Caldwell made Dunk. Assisted by Michael Chambers.
Maryland-Eastern Shore,George Washington,43,53,31,20,0,Jaren Sina Turnover.
Maryland-Eastern Shore,George Washington,46,53,31,38,1,Bakari Copeland made Three Point Jumper.
Maryland-Eastern Shore,George Washington,46,53,31,52,0,Foul on Bakari Copeland.
Maryland-Eastern Shore,George Washington,46,54,31,52,1,Tyler Cavanaugh made Free Throw.
Maryland-Eastern Shore,George Washington,46,55,31,52,1,Tyler Cavanaugh made Free Throw.
Maryland-Eastern Shore,George Washington,46,55,32,10,0,Foul on Tyler Cavanaugh.
Maryland-Eastern Shore,George Washington,46,55,32,10,0,Official TV Timeout
Maryland-Eastern Shore,George Washington,46,55,32,24,0,Foul on Jaren Sina.
Maryland-Eastern Shore,George Washington,47,55,32,24,1,Bakari Copeland made Free Throw.
Maryland-Eastern Shore,George Washington,48,55,32,24,1,Bakari Copeland made Free Throw.
Maryland-Eastern Shore,George Washington,48,55,32,52,0,Matt Hart missed Jumper.
Maryland-Eastern Shore,George Washington,48,55,32,52,0,Michael Chambers Defensive Rebound.
Maryland-Eastern Shore,George Washington,48,55,33,13,0,Bakari Copeland missed Jumper.
Maryland-Eastern Shore,George Washington,48,55,33,13,0,George Washington Defensive Rebound.
Maryland-Eastern Shore,George Washington,48,55,33,19,0,Yuta Watanabe Turnover.
Maryland-Eastern Shore,George Washington,48,55,33,20,0,Derrico Peck Steal.
Maryland-Eastern Shore,George Washington,50,55,33,22,1,Derrico Peck made Dunk.
Maryland-Eastern Shore,George Washington,50,55,33,35,0,Foul on Dontae Caldwell.
Maryland-Eastern Shore,George Washington,50,56,33,35,1,Tyler Cavanaugh made Free Throw.
Maryland-Eastern Shore,George Washington,50,57,33,35,1,Tyler Cavanaugh made Free Throw.
Maryland-Eastern Shore,George Washington,50,57,33,47,0,Logan McIntosh missed Jumper.
Maryland-Eastern Shore,George Washington,50,57,33,47,0,Derrico Peck Offensive Rebound.
Maryland-Eastern Shore,George Washington,52,57,33,52,1,Derrico Peck made Dunk.
Maryland-Eastern Shore,George Washington,52,57,33,58,0,Foul on Bakari Copeland.
Maryland-Eastern Shore,George Washington,52,58,33,58,1,Yuta Watanabe made Free Throw.
Maryland-Eastern Shore,George Washington,52,59,33,58,1,Yuta Watanabe made Free Throw.
Maryland-Eastern Shore,George Washington,52,59,34,11,0,Foul on Yuta Watanabe.
Maryland-Eastern Shore,George Washington,53,59,34,11,1,Bakari Copeland made Free Throw.
Maryland-Eastern Shore,George Washington,54,59,34,11,1,Bakari Copeland made Free Throw.
Maryland-Eastern Shore,George Washington,54,59,34,33,0,Foul on Derrico Peck.
Maryland-Eastern Shore,George Washington,54,60,34,33,1,Matt Hart made Free Throw.
Maryland-Eastern Shore,George Washington,54,61,34,33,1,Matt Hart made Free Throw.
Maryland-Eastern Shore,George Washington,54,61,34,50,0,Bakari Copeland missed Jumper.
Maryland-Eastern Shore,George Washington,54,61,34,50,0,Collin Smith Defensive Rebound.
Maryland-Eastern Shore,George Washington,54,61,35,2,0,Foul on Bakari Copeland.
Maryland-Eastern Shore,George Washington,54,62,35,2,1,Tyler Cavanaugh made Free Throw.
Maryland-Eastern Shore,George Washington,54,63,35,2,1,Tyler Cavanaugh made Free Throw.
Maryland-Eastern Shore,George Washington,54,63,35,19,0,Thomas Rivera missed Three Point Jumper.
Maryland-Eastern Shore,George Washington,54,63,35,19,0,Yuta Watanabe Defensive Rebound.
Maryland-Eastern Shore,George Washington,54,63,35,23,0,Foul on Thomas Rivera.
Maryland-Eastern Shore,George Washington,54,64,35,23,1,Yuta Watanabe made Free Throw.
Maryland-Eastern Shore,George Washington,54,65,35,23,1,Yuta Watanabe made Free Throw.
Maryland-Eastern Shore,George Washington,54,65,35,37,0,Foul on Collin Smith.
Maryland-Eastern Shore,George Washington,54,65,35,37,0,Thomas Rivera missed Free Throw.
Maryland-Eastern Shore,George Washington,54,65,35,37,0,Maryland-Eastern Shore Deadball Team Rebound.
Maryland-Eastern Shore,George Washington,55,65,35,37,1,Thomas Rivera made Free Throw.
Maryland-Eastern Shore,George Washington,55,67,35,44,1,Patrick Steeves made Dunk. Assisted by Jaren Sina.
Maryland-Eastern Shore,George Washington,55,67,35,51,0,Thomas Rivera missed Layup.
Maryland-Eastern Shore,George Washington,55,67,35,51,0,Thomas Rivera Offensive Rebound.
Maryland-Eastern Shore,George Washington,57,67,36,6,1,Michael Chambers made Layup.
Maryland-Eastern Shore,George Washington,57,69,36,42,1,Patrick Steeves made Jumper.
Maryland-Eastern Shore,George Washington,57,69,36,58,0,Michael Chambers Turnover.
Maryland-Eastern Shore,George Washington,57,69,36,59,0,Arnaldo Toro Steal.
Maryland-Eastern Shore,George Washington,57,69,37,1,0,Jaren Sina missed Layup.
Maryland-Eastern Shore,George Washington,57,69,37,1,0,Thomas Rivera Defensive Rebound.
Maryland-Eastern Shore,George Washington,57,69,37,7,0,Ryan Andino missed Three Point Jumper.
Maryland-Eastern Shore,George Washington,57,69,37,7,0,Thomas Rivera Offensive Rebound.
Maryland-Eastern Shore,George Washington,57,69,37,13,0,Official TV Timeout
