Maryland-Eastern Shore,George Washington,57,69,37,24,0,Deven Dorsett missed Three Point Jumper.
Maryland-Eastern Shore,George Washington,57,69,37,24,0,Ryan Andino Offensive Rebound.
Maryland-Eastern Shore,George Washington,59,69,37,32,1,Ryan Andino made Layup.
Maryland-Eastern Shore,George Washington,59,69,37,33,0,Maryland-Eastern Shore  Timeout
Maryland-Eastern Shore,George Washington,59,69,37,33,0,George Washington  Turnover.
Maryland-Eastern Shore,George Washington,62,69,37,36,1,Tyler Jones made Three Point Jumper. Assisted by Logan McIntosh.
Maryland-Eastern Shore,George Washington,62,69,37,47,0,Foul on Logan McIntosh.
Maryland-Eastern Shore,George Washington,62,70,37,47,1,Jaren Sina made Free Throw.
Maryland-Eastern Shore,George Washington,62,71,37,47,1,Jaren Sina made Free Throw.
Maryland-Eastern Shore,George Washington,64,71,37,55,1,Logan McIntosh made Layup.
Maryland-Eastern Shore,George Washington,64,71,38,4,0,Jaren Sina Turnover.
Maryland-Eastern Shore,George Washington,64,71,38,5,0,Logan McIntosh Steal.
Maryland-Eastern Shore,George Washington,64,71,38,8,0,Logan McIntosh missed Layup.
Maryland-Eastern Shore,George Washington,64,71,38,8,0,Yuta Watanabe Block.
Maryland-Eastern Shore,George Washington,64,71,38,9,0,Maryland-Eastern Shore Offensive Rebound.
Maryland-Eastern Shore,George Washington,64,71,38,26,0,Logan McIntosh missed Jumper.
Maryland-Eastern Shore,George Washington,64,71,38,26,0,Collin Smith Defensive Rebound.
Maryland-Eastern Shore,George Washington,64,71,38,31,0,Collin Smith Turnover.
Maryland-Eastern Shore,George Washington,64,71,38,32,0,Dontae Caldwell Steal.
Maryland-Eastern Shore,George Washington,67,71,38,34,1,Ryan Andino made Three Point Jumper. Assisted by Dontae Caldwell.
Maryland-Eastern Shore,George Washington,67,71,38,35,0,Maryland-Eastern Shore  Timeout
Maryland-Eastern Shore,George Washington,67,71,38,40,0,Matt Hart Turnover.
Maryland-Eastern Shore,George Washington,67,71,38,49,0,Tyler Jones missed Three Point Jumper.
Maryland-Eastern Shore,George Washington,67,71,38,49,0,Tyler Cavanaugh Defensive Rebound.
Maryland-Eastern Shore,George Washington,67,71,39,19,0,Jaren Sina missed Jumper.
Maryland-Eastern Shore,George Washington,67,71,39,19,0,Tyler Cavanaugh Offensive Rebound.
Maryland-Eastern Shore,George Washington,67,71,39,23,0,George Washington  Timeout
Maryland-Eastern Shore,George Washington,67,71,39,27,0,Tyler Cavanaugh missed Jumper.
Maryland-Eastern Shore,George Washington,67,71,39,27,0,Dontae Caldwell Defensive Rebound.
Maryland-Eastern Shore,George Washington,67,71,39,33,0,Logan McIntosh Turnover.
Maryland-Eastern Shore,George Washington,67,71,39,37,0,Foul on Michael Chambers.
Maryland-Eastern Shore,George Washington,67,72,39,37,1,Yuta Watanabe made Free Throw.
Maryland-Eastern Shore,George Washington,67,73,39,37,1,Yuta Watanabe made Free Throw.
Maryland-Eastern Shore,George Washington,69,73,39,45,1,Dontae Caldwell made Layup. Assisted by Thomas Rivera.
Maryland-Eastern Shore,George Washington,69,73,39,49,0,Foul on Ryan Andino.
Maryland-Eastern Shore,George Washington,69,73,39,49,0,Yuta Watanabe missed Free Throw.
Maryland-Eastern Shore,George Washington,69,73,39,49,0,George Washington Deadball Team Rebound.
Maryland-Eastern Shore,George Washington,69,74,39,49,1,Yuta Watanabe made Free Throw.
Maryland-Eastern Shore,George Washington,71,74,39,55,1,Thomas Rivera made Layup.
Maryland-Eastern Shore,George Washington,71,74,39,56,0,Foul on Dontae Caldwell.
Maryland-Eastern Shore,George Washington,71,75,39,56,1,Yuta Watanabe made Free Throw.
Maryland-Eastern Shore,George Washington,71,75,39,56,0,Yuta Watanabe missed Free Throw.
Maryland-Eastern Shore,George Washington,71,75,39,56,0,George Washington Deadball Team Rebound.
Maryland-Eastern Shore,George Washington,71,75,39,56,0,Dontae Caldwell Turnover.
Maryland-Eastern Shore,George Washington,71,75,40,0,0,End of Game
