Loyola Marymount,San Francisco,59,69,38,32,1,Ronnie Boyce made Free Throw.
Loyola Marymount,San Francisco,59,69,38,32,0,Ronnie Boyce missed Free Throw.
Loyola Marymount,San Francisco,59,69,38,32,0,Shamar Johnson Defensive Rebound.
Loyola Marymount,San Francisco,59,69,38,38,0,Steven Haney missed Three Point Jumper.
Loyola Marymount,San Francisco,59,69,38,38,0,Ronnie Boyce Defensive Rebound.
Loyola Marymount,San Francisco,59,72,39,3,1,Remu Raitanen made Three Point Jumper. Assisted by Chase Foster.
Loyola Marymount,San Francisco,62,72,39,28,1,Buay Tuach made Three Point Jumper. Assisted by Brandon Brown.
Loyola Marymount,San Francisco,62,72,39,29,0,Charles Minlend Turnover.
Loyola Marymount,San Francisco,62,72,39,30,0,Loyola Marymount  Timeout
Loyola Marymount,San Francisco,62,72,39,44,0,Shamar Johnson missed Jumper.
Loyola Marymount,San Francisco,62,72,39,44,0,Ronnie Boyce Defensive Rebound.
Loyola Marymount,San Francisco,64,72,39,49,1,Brandon Brown made Layup.
Loyola Marymount,San Francisco,64,72,39,49,0,Loyola Marymount  Timeout
Loyola Marymount,San Francisco,64,72,39,49,0,Ronnie Boyce Turnover.
Loyola Marymount,San Francisco,64,72,39,49,0,San Francisco  Timeout
Loyola Marymount,San Francisco,64,72,39,49,0,Foul on Shamar Johnson.
Loyola Marymount,San Francisco,64,73,39,49,1,Ronnie Boyce made Free Throw.
Loyola Marymount,San Francisco,64,74,39,49,1,Ronnie Boyce made Free Throw.
Loyola Marymount,San Francisco,64,72,39,51,0,Brandon Brown Steal.
Loyola Marymount,San Francisco,64,74,39,52,0,Steven Haney missed Three Point Jumper.
Loyola Marymount,San Francisco,64,74,39,52,0,Matt McCarthy Defensive Rebound.
Loyola Marymount,San Francisco,64,74,40,0,0,Official TV Timeout
Loyola Marymount,San Francisco,64,74,40,0,0,End of Game
