Away Team,Home Team,Away Score,Home Score,Minute,Second,isScoringPosession,Desc.
Mississippi State,Saint Louis,0,0,0,11,0,Foul on Achraf Yacoubou.
Mississippi State,Saint Louis,0,0,0,22,0,Gavin Ware Turnover.
Mississippi State,Saint Louis,0,0,0,47,0,Achraf Yacoubou Turnover.
Mississippi State,Saint Louis,0,0,1,4,0,Trivante Bloodman Turnover.
Mississippi State,Saint Louis,0,0,1,5,0,Austin McBroom Steal.
Mississippi State,Saint Louis,0,0,1,39,0,Tanner Lancona missed Jumper.
Mississippi State,Saint Louis,0,0,1,39,0,Gavin Ware Defensive Rebound.
Mississippi State,Saint Louis,3,0,1,46,1,Fred Thomas made Three Point Jumper. Assisted by Gavin Ware.
Mississippi State,Saint Louis,3,0,2,1,0,John Manning missed Layup.
Mississippi State,Saint Louis,3,0,2,1,0,Trivante Bloodman Defensive Rebound.
Mississippi State,Saint Louis,6,0,2,9,1,Travis Daniels made Three Point Jumper. Assisted by Trivante Bloodman.
Mississippi State,Saint Louis,6,0,2,14,0,Saint Louis  Timeout
Mississippi State,Saint Louis,6,0,2,47,0,Davell Roby missed Three Point Jumper.
Mississippi State,Saint Louis,6,0,2,47,0,Mississippi St Defensive Rebound.
Mississippi State,Saint Louis,9,0,2,59,1,Fred Thomas made Three Point Jumper. Assisted by Roquez Johnson.
Mississippi State,Saint Louis,9,0,3,13,0,Foul on Fred Thomas.
Mississippi State,Saint Louis,9,2,3,25,1,Austin McBroom made Jumper.
Mississippi State,Saint Louis,11,2,3,43,1,Gavin Ware made Jumper. Assisted by Fred Thomas.
Mississippi State,Saint Louis,11,5,4,3,1,Brett Jolly made Three Point Jumper.
Mississippi State,Saint Louis,13,5,4,29,1,Travis Daniels made Jumper.
Mississippi State,Saint Louis,13,5,5,1,0,Brett Jolly missed Three Point Jumper.
Mississippi State,Saint Louis,13,5,5,1,0,Travis Daniels Defensive Rebound.
Mississippi State,Saint Louis,13,5,5,12,0,Foul on Marcus Bartley.
Mississippi State,Saint Louis,13,5,5,12,0,Official TV Timeout
Mississippi State,Saint Louis,14,5,5,12,1,Fred Thomas made Free Throw.
Mississippi State,Saint Louis,15,5,5,12,1,Fred Thomas made Free Throw.
Mississippi State,Saint Louis,16,5,5,12,1,Fred Thomas made Free Throw.
Mississippi State,Saint Louis,16,5,5,45,0,Miles Reynolds missed Jumper.
Mississippi State,Saint Louis,16,5,5,45,0,Travis Daniels Defensive Rebound.
Mississippi State,Saint Louis,18,5,5,56,1,Roquez Johnson made Jumper.
Mississippi State,Saint Louis,18,5,6,17,0,Foul on Fallou Ndoye.
Mississippi State,Saint Louis,18,7,6,19,1,Reggie Agbeko made Layup. Assisted by Marcus Bartley.
Mississippi State,Saint Louis,18,7,6,38,0,Craig Sword Turnover.
Mississippi State,Saint Louis,18,7,6,38,0,Foul on Craig Sword.
Mississippi State,Saint Louis,18,7,7,5,0,Marcus Bartley missed Three Point Jumper.
Mississippi State,Saint Louis,18,7,7,5,0,Craig Sword Defensive Rebound.
Mississippi State,Saint Louis,18,7,7,18,0,Gavin Ware missed Jumper.
Mississippi State,Saint Louis,18,7,7,18,0,Austin Gillmann Defensive Rebound.
Mississippi State,Saint Louis,18,7,7,31,0,Foul on Fallou Ndoye.
Mississippi State,Saint Louis,18,8,7,31,1,Reggie Agbeko made Free Throw.
Mississippi State,Saint Louis,18,9,7,31,1,Reggie Agbeko made Free Throw.
Mississippi State,Saint Louis,18,9,7,45,0,Roquez Johnson Turnover.
Mississippi State,Saint Louis,18,9,7,45,0,Milik Yarbrough Steal.
Mississippi State,Saint Louis,18,9,7,50,0,Milik Yarbrough missed Layup.
Mississippi State,Saint Louis,18,9,7,50,0,Craig Sword Defensive Rebound.
Mississippi State,Saint Louis,20,9,7,56,1,Roquez Johnson made Layup. Assisted by I.J. Ready.
Mississippi State,Saint Louis,20,9,8,13,0,Austin McBroom missed Three Point Jumper.
Mississippi State,Saint Louis,20,9,8,13,0,Demetrius Houston Defensive Rebound.
Mississippi State,Saint Louis,22,9,8,20,1,Gavin Ware made Jumper. Assisted by Demetrius Houston.
Mississippi State,Saint Louis,22,11,8,33,1,Achraf Yacoubou made Jumper.
Mississippi State,Saint Louis,24,11,8,50,1,Gavin Ware made Jumper. Assisted by Craig Sword.
Mississippi State,Saint Louis,24,11,9,6,0,Milik Yarbrough missed Layup.
Mississippi State,Saint Louis,24,11,9,6,0,Gavin Ware Block.
Mississippi State,Saint Louis,24,11,9,8,0,Gavin Ware Defensive Rebound.
Mississippi State,Saint Louis,26,11,9,14,1,Gavin Ware made Jumper. Assisted by I.J. Ready.
Mississippi State,Saint Louis,26,11,9,22,0,Saint Louis  Timeout
Mississippi State,Saint Louis,26,13,9,35,1,Achraf Yacoubou made Jumper.
Mississippi State,Saint Louis,28,13,9,46,1,Trivante Bloodman made Layup.
Mississippi State,Saint Louis,28,13,9,46,0,Foul on Achraf Yacoubou.
Mississippi State,Saint Louis,28,13,9,46,0,Official TV Timeout
Mississippi State,Saint Louis,29,13,9,46,1,Trivante Bloodman made Free Throw.
Mississippi State,Saint Louis,29,13,10,8,0,Achraf Yacoubou missed Three Point Jumper.
Mississippi State,Saint Louis,29,13,10,8,0,Roquez Johnson Defensive Rebound.
Mississippi State,Saint Louis,29,13,10,17,0,Gavin Ware missed Jumper.
Mississippi State,Saint Louis,29,13,10,17,0,Achraf Yacoubou Defensive Rebound.
Mississippi State,Saint Louis,29,13,10,24,0,Austin McBroom missed Three Point Jumper.
Mississippi State,Saint Louis,29,13,10,24,0,Trivante Bloodman Defensive Rebound.
Mississippi State,Saint Louis,29,13,10,27,0,Foul on Austin McBroom.
Mississippi State,Saint Louis,29,13,10,54,0,Gavin Ware Turnover.
Mississippi State,Saint Louis,29,16,11,9,1,Marcus Bartley made Three Point Jumper. Assisted by John Manning.
Mississippi State,Saint Louis,31,16,11,34,1,Travis Daniels made Jumper.
Mississippi State,Saint Louis,31,18,11,53,1,Austin McBroom made Jumper.
Mississippi State,Saint Louis,31,18,12,12,0,Oliver Black missed Layup.
Mississippi State,Saint Louis,31,18,12,12,0,Austin McBroom Defensive Rebound.
Mississippi State,Saint Louis,31,18,12,37,0,Foul on Oliver Black.
Mississippi State,Saint Louis,31,18,12,37,0,Official TV Timeout
Mississippi State,Saint Louis,31,18,12,37,0,Davell Roby missed Free Throw.
Mississippi State,Saint Louis,31,18,12,37,0,Saint Louis Deadball Team Rebound.
Mississippi State,Saint Louis,31,18,12,37,0,Davell Roby missed Free Throw.
Mississippi State,Saint Louis,31,18,12,37,0,Roquez Johnson Defensive Rebound.
Mississippi State,Saint Louis,33,18,13,4,1,Fred Thomas made Jumper. Assisted by Oliver Black.
Mississippi State,Saint Louis,33,18,13,34,0,Foul on Fred Thomas.
Mississippi State,Saint Louis,33,18,13,38,0,Austin McBroom missed Jumper.
Mississippi State,Saint Louis,33,18,13,38,0,Gavin Ware Defensive Rebound.
Mississippi State,Saint Louis,33,18,14,1,0,Roquez Johnson missed Layup.
Mississippi State,Saint Louis,33,18,14,1,0,Saint Louis Defensive Rebound.
Mississippi State,Saint Louis,33,18,14,25,0,Marcus Bartley missed Jumper.
Mississippi State,Saint Louis,33,18,14,25,0,Craig Sword Block.
Mississippi State,Saint Louis,33,18,14,27,0,Roquez Johnson Defensive Rebound.
Mississippi State,Saint Louis,36,18,14,32,1,Travis Daniels made Three Point Jumper. Assisted by Trivante Bloodman.
Mississippi State,Saint Louis,36,18,14,52,0,Reggie Agbeko Turnover.
Mississippi State,Saint Louis,36,18,14,53,0,Trivante Bloodman Steal.
Mississippi State,Saint Louis,36,18,14,58,0,Trivante Bloodman Turnover.
Mississippi State,Saint Louis,36,18,14,58,0,Foul on Trivante Bloodman.
Mississippi State,Saint Louis,36,18,15,7,0,Miles Reynolds Turnover.
Mississippi State,Saint Louis,36,18,15,21,0,Gavin Ware missed Jumper.
Mississippi State,Saint Louis,36,18,15,21,0,Travis Daniels Offensive Rebound.
Mississippi State,Saint Louis,36,18,15,27,0,I.J. Ready missed Three Point Jumper.
Mississippi State,Saint Louis,36,18,15,27,0,Miles Reynolds Defensive Rebound.
Mississippi State,Saint Louis,36,18,15,49,0,Foul on Gavin Ware.
Mississippi State,Saint Louis,36,18,15,49,0,Miles Reynolds missed Free Throw.
Mississippi State,Saint Louis,36,18,15,49,0,Saint Louis Deadball Team Rebound.
Mississippi State,Saint Louis,36,18,15,49,0,Miles Reynolds missed Free Throw.
Mississippi State,Saint Louis,36,18,15,49,0,I.J. Ready Defensive Rebound.
Mississippi State,Saint Louis,36,18,16,8,0,Craig Sword Turnover.
Mississippi State,Saint Louis,36,18,16,8,0,Official TV Timeout
Mississippi State,Saint Louis,36,20,16,33,1,Milik Yarbrough made Jumper.
Mississippi State,Saint Louis,36,20,16,58,0,Foul on Brett Jolly.
Mississippi State,Saint Louis,36,20,16,58,0,Craig Sword Turnover.
Mississippi State,Saint Louis,36,20,16,58,0,Foul on Craig Sword.
Mississippi State,Saint Louis,36,20,17,20,0,Austin McBroom missed Three Point Jumper.
Mississippi State,Saint Louis,36,20,17,20,0,Tanner Lancona Offensive Rebound.
Mississippi State,Saint Louis,36,22,17,24,1,Tanner Lancona made Layup.
Mississippi State,Saint Louis,36,22,17,36,0,Foul on Milik Yarbrough.
Mississippi State,Saint Louis,36,22,17,46,0,Trivante Bloodman missed Jumper.
Mississippi State,Saint Louis,36,22,17,46,0,Miles Reynolds Defensive Rebound.
Mississippi State,Saint Louis,36,24,17,58,1,Milik Yarbrough made Layup.
Mississippi State,Saint Louis,36,24,17,58,0,Foul on Gavin Ware.
Mississippi State,Saint Louis,36,24,17,58,0,Mississippi St  Timeout
Mississippi State,Saint Louis,36,24,17,58,0,Milik Yarbrough missed Free Throw.
Mississippi State,Saint Louis,36,24,17,58,0,Roquez Johnson Defensive Rebound.
Mississippi State,Saint Louis,36,24,18,19,0,I.J. Ready missed Jumper.
Mississippi State,Saint Louis,36,24,18,19,0,Brett Jolly Defensive Rebound.
Mississippi State,Saint Louis,36,24,18,34,0,Tanner Lancona missed Three Point Jumper.
Mississippi State,Saint Louis,36,24,18,34,0,Trivante Bloodman Defensive Rebound.
Mississippi State,Saint Louis,36,24,18,46,0,Foul on Milik Yarbrough.
Mississippi State,Saint Louis,36,24,18,46,0,Roquez Johnson missed Free Throw.
Mississippi State,Saint Louis,36,24,18,46,0,Mississippi St Deadball Team Rebound.
Mississippi State,Saint Louis,37,24,18,46,1,Roquez Johnson made Free Throw.
Mississippi State,Saint Louis,37,24,19,16,0,Austin McBroom missed Jumper.
Mississippi State,Saint Louis,37,24,19,16,0,I.J. Ready Defensive Rebound.
Mississippi State,Saint Louis,37,24,19,33,0,Roquez Johnson Turnover.
Mississippi State,Saint Louis,37,27,20,0,1,Austin McBroom made Three Point Jumper.
Mississippi State,Saint Louis,37,27,20,0,0,End of 1st half
Mississippi State,Saint Louis,37,29,20,9,1,Achraf Yacoubou made Layup.
Mississippi State,Saint Louis,37,29,20,26,0,Roquez Johnson Turnover.
Mississippi State,Saint Louis,37,29,20,27,0,Austin McBroom Steal.
Mississippi State,Saint Louis,37,29,20,32,0,Foul on Gavin Ware.
Mississippi State,Saint Louis,37,29,20,54,0,John Manning Turnover.
Mississippi State,Saint Louis,37,29,20,55,0,Fallou Ndoye Steal.
Mississippi State,Saint Louis,39,29,20,59,1,Trivante Bloodman made Layup. Assisted by Fred Thomas.
Mississippi State,Saint Louis,39,31,21,16,1,John Manning made Jumper. Assisted by Austin McBroom.
Mississippi State,Saint Louis,39,31,21,40,0,Mississippi St  Timeout
Mississippi State,Saint Louis,42,31,21,51,1,Travis Daniels made Three Point Jumper.
Mississippi State,Saint Louis,42,33,22,19,1,Achraf Yacoubou made Layup.
Mississippi State,Saint Louis,42,33,22,34,0,Fred Thomas Turnover.
Mississippi State,Saint Louis,42,33,22,34,0,Milik Yarbrough Steal.
Mississippi State,Saint Louis,42,33,22,44,0,Austin McBroom missed Jumper.
Mississippi State,Saint Louis,42,33,22,44,0,Fred Thomas Defensive Rebound.
Mississippi State,Saint Louis,42,33,22,56,0,Travis Daniels missed Layup.
Mississippi State,Saint Louis,42,33,22,56,0,Achraf Yacoubou Defensive Rebound.
Mississippi State,Saint Louis,42,33,23,3,0,Milik Yarbrough missed Layup.
Mississippi State,Saint Louis,42,33,23,3,0,Milik Yarbrough Offensive Rebound.
Mississippi State,Saint Louis,42,35,23,6,1,Milik Yarbrough made Layup.
Mississippi State,Saint Louis,42,35,23,21,0,Fallou Ndoye missed Jumper.
Mississippi State,Saint Louis,42,35,23,21,0,Roquez Johnson Offensive Rebound.
Mississippi State,Saint Louis,42,35,23,24,0,Roquez Johnson missed Layup.
Mississippi State,Saint Louis,42,35,23,24,0,John Manning Block.
Mississippi State,Saint Louis,42,35,23,26,0,Austin McBroom Defensive Rebound.
Mississippi State,Saint Louis,42,35,23,29,0,Achraf Yacoubou missed Layup.
Mississippi State,Saint Louis,42,35,23,29,0,John Manning Offensive Rebound.
Mississippi State,Saint Louis,42,35,23,32,0,John Manning missed Layup.
Mississippi State,Saint Louis,42,35,23,32,0,Travis Daniels Defensive Rebound.
Mississippi State,Saint Louis,44,35,23,41,1,Travis Daniels made Jumper.
Mississippi State,Saint Louis,44,35,23,41,0,Foul on Milik Yarbrough.
Mississippi State,Saint Louis,45,35,23,41,1,Travis Daniels made Free Throw.
Mississippi State,Saint Louis,45,35,23,51,0,Milik Yarbrough missed Layup.
Mississippi State,Saint Louis,45,35,23,51,0,Fallou Ndoye Defensive Rebound.
Mississippi State,Saint Louis,48,35,23,56,1,Fred Thomas made Three Point Jumper. Assisted by Trivante Bloodman.
Mississippi State,Saint Louis,48,35,24,15,0,Achraf Yacoubou Turnover.
Mississippi State,Saint Louis,48,35,24,15,0,Official TV Timeout
Mississippi State,Saint Louis,48,35,24,24,0,Fred Thomas missed Three Point Jumper.
Mississippi State,Saint Louis,48,35,24,24,0,Oliver Black Offensive Rebound.
Mississippi State,Saint Louis,48,35,24,31,0,Travis Daniels missed Three Point Jumper.
Mississippi State,Saint Louis,48,35,24,31,0,Reggie Agbeko Defensive Rebound.
Mississippi State,Saint Louis,48,35,24,33,0,Foul on Fallou Ndoye.
Mississippi State,Saint Louis,48,35,24,39,0,Austin McBroom missed Three Point Jumper.
Mississippi State,Saint Louis,48,35,24,39,0,Travis Daniels Defensive Rebound.
Mississippi State,Saint Louis,50,35,24,56,1,Travis Daniels made Layup.
Mississippi State,Saint Louis,50,37,25,11,1,Reggie Agbeko made Layup.
Mississippi State,Saint Louis,50,37,25,38,0,Foul on Davell Roby.
Mississippi State,Saint Louis,52,37,25,55,1,Fallou Ndoye made Layup.
Mississippi State,Saint Louis,52,37,26,10,0,Brett Jolly Turnover.
Mississippi State,Saint Louis,52,37,26,10,0,Foul on Brett Jolly.
Mississippi State,Saint Louis,54,37,26,20,1,I.J. Ready made Layup.
Mississippi State,Saint Louis,54,37,26,29,0,Saint Louis  Timeout
Mississippi State,Saint Louis,54,37,26,52,0,Tanner Lancona missed Jumper.
Mississippi State,Saint Louis,54,37,26,52,0,Austin Gillmann Offensive Rebound.
Mississippi State,Saint Louis,54,37,26,57,0,Saint Louis  Turnover.
Mississippi State,Saint Louis,54,37,27,28,0,I.J. Ready missed Three Point Jumper.
Mississippi State,Saint Louis,54,37,27,28,0,Oliver Black Offensive Rebound.
Mississippi State,Saint Louis,54,37,27,48,0,Oliver Black Turnover.
Mississippi State,Saint Louis,54,37,28,9,0,Official TV Timeout
Mississippi State,Saint Louis,54,37,28,11,0,Austin Gillmann missed Jumper.
Mississippi State,Saint Louis,54,37,28,11,0,Gavin Ware Defensive Rebound.
Mississippi State,Saint Louis,56,37,28,37,1,Gavin Ware made Layup. Assisted by I.J. Ready.
Mississippi State,Saint Louis,56,37,28,50,0,Tanner Lancona missed Three Point Jumper.
Mississippi State,Saint Louis,56,37,28,50,0,Mississippi St Defensive Rebound.
Mississippi State,Saint Louis,56,37,29,17,0,Demetrius Houston missed Three Point Jumper.
Mississippi State,Saint Louis,56,37,29,17,0,Gavin Ware Offensive Rebound.
Mississippi State,Saint Louis,56,37,29,22,0,Demetrius Houston missed Layup.
Mississippi State,Saint Louis,56,37,29,22,0,Tanner Lancona Defensive Rebound.
Mississippi State,Saint Louis,56,37,29,30,0,Milik Yarbrough missed Jumper.
Mississippi State,Saint Louis,56,37,29,30,0,Gavin Ware Block.
Mississippi State,Saint Louis,56,37,29,30,0,Saint Louis Offensive Rebound.
Mississippi State,Saint Louis,56,37,29,47,0,Mike Crawford Turnover.
Mississippi State,Saint Louis,56,37,29,48,0,I.J. Ready Steal.
Mississippi State,Saint Louis,58,37,29,52,1,Gavin Ware made Dunk. Assisted by I.J. Ready.
Mississippi State,Saint Louis,58,37,30,14,0,Mike Crawford missed Three Point Jumper.
Mississippi State,Saint Louis,58,37,30,14,0,Fred Thomas Defensive Rebound.
Mississippi State,Saint Louis,58,37,30,48,0,Oliver Black missed Jumper.
Mississippi State,Saint Louis,58,37,30,48,0,Austin McBroom Defensive Rebound.
Mississippi State,Saint Louis,58,37,30,57,0,Mike Crawford missed Three Point Jumper.
Mississippi State,Saint Louis,58,37,30,57,0,Demetrius Houston Block.
Mississippi State,Saint Louis,58,37,31,1,0,Demetrius Houston Defensive Rebound.
Mississippi State,Saint Louis,60,37,31,10,1,Gavin Ware made Dunk.
Mississippi State,Saint Louis,60,37,31,15,0,Austin McBroom missed Three Point Jumper.
Mississippi State,Saint Louis,60,37,31,15,0,Reggie Agbeko Offensive Rebound.
Mississippi State,Saint Louis,60,37,31,38,0,Davell Roby Turnover.
Mississippi State,Saint Louis,60,37,31,40,0,Demetrius Houston Steal.
Mississippi State,Saint Louis,60,37,31,45,0,Demetrius Houston missed Jumper.
Mississippi State,Saint Louis,60,37,31,45,0,Davell Roby Defensive Rebound.
Mississippi State,Saint Louis,60,40,31,55,1,Davell Roby made Three Point Jumper.
Mississippi State,Saint Louis,60,40,31,57,0,Mississippi St  Timeout
Mississippi State,Saint Louis,60,40,32,11,0,Trivante Bloodman Turnover.
Mississippi State,Saint Louis,60,40,32,11,0,Official TV Timeout
Mississippi State,Saint Louis,60,40,32,33,0,Davell Roby missed Three Point Jumper.
Mississippi State,Saint Louis,60,40,32,33,0,Mississippi St Defensive Rebound.
Mississippi State,Saint Louis,63,40,32,52,1,Travis Daniels made Three Point Jumper.
Mississippi State,Saint Louis,63,40,33,20,0,Foul on Fallou Ndoye.
Mississippi State,Saint Louis,63,40,33,44,0,John Manning missed Layup.
Mississippi State,Saint Louis,63,40,33,44,0,Gavin Ware Block.
Mississippi State,Saint Louis,63,40,33,45,0,Fred Thomas Defensive Rebound.
Mississippi State,Saint Louis,63,40,34,6,0,Trivante Bloodman Turnover.
Mississippi State,Saint Louis,63,43,34,21,1,Austin McBroom made Three Point Jumper. Assisted by Marcus Bartley.
Mississippi State,Saint Louis,63,43,34,40,0,Fred Thomas missed Three Point Jumper.
Mississippi State,Saint Louis,63,43,34,40,0,Marcus Bartley Defensive Rebound.
Mississippi State,Saint Louis,63,43,34,47,0,Austin McBroom missed Layup.
Mississippi State,Saint Louis,63,43,34,47,0,Achraf Yacoubou Offensive Rebound.
Mississippi State,Saint Louis,63,43,34,51,0,Foul on Oliver Black.
Mississippi State,Saint Louis,63,43,34,51,0,Achraf Yacoubou missed Free Throw.
Mississippi State,Saint Louis,63,43,34,51,0,Saint Louis Deadball Team Rebound.
Mississippi State,Saint Louis,63,43,34,51,0,Achraf Yacoubou missed Free Throw.
Mississippi State,Saint Louis,63,43,34,51,0,Maurice Dunlap Defensive Rebound.
Mississippi State,Saint Louis,63,43,35,8,0,Travis Daniels missed Layup.
Mississippi State,Saint Louis,63,43,35,8,0,Brett Jolly Block.
Mississippi State,Saint Louis,63,43,35,10,0,Travis Daniels Offensive Rebound.
Mississippi State,Saint Louis,66,43,35,12,1,I.J. Ready made Three Point Jumper. Assisted by Travis Daniels.
Mississippi State,Saint Louis,66,43,35,18,0,Austin McBroom Turnover.
Mississippi State,Saint Louis,66,43,35,45,0,I.J. Ready missed Jumper.
Mississippi State,Saint Louis,66,43,35,45,0,Milik Yarbrough Block.
Mississippi State,Saint Louis,66,43,35,47,0,Miles Reynolds Defensive Rebound.
Mississippi State,Saint Louis,66,43,36,0,0,Marcus Bartley Turnover.
Mississippi State,Saint Louis,68,43,36,13,1,Gavin Ware made Jumper.
Mississippi State,Saint Louis,68,43,36,31,0,Official TV Timeout
Mississippi State,Saint Louis,68,45,36,36,1,Brett Jolly made Jumper.
Mississippi State,Saint Louis,68,45,36,56,0,Maurice Dunlap missed Three Point Jumper.
Mississippi State,Saint Louis,68,45,36,56,0,Demetrius Houston Offensive Rebound.
Mississippi State,Saint Louis,70,45,36,59,1,Demetrius Houston made Layup.
Mississippi State,Saint Louis,70,45,37,14,0,Miles Reynolds missed Three Point Jumper.
Mississippi State,Saint Louis,70,45,37,14,0,Fallou Ndoye Defensive Rebound.
Mississippi State,Saint Louis,70,45,37,35,0,Foul on Miles Reynolds.
Mississippi State,Saint Louis,72,45,37,37,1,Maurice Dunlap made Jumper. Assisted by I.J. Ready.
Mississippi State,Saint Louis,72,45,37,54,0,Milik Yarbrough missed Jumper.
Mississippi State,Saint Louis,72,45,37,54,0,Oliver Black Defensive Rebound.
Mississippi State,Saint Louis,72,45,38,7,0,Maurice Dunlap missed Three Point Jumper.
Mississippi State,Saint Louis,72,45,38,7,0,Oliver Black Offensive Rebound.
Mississippi State,Saint Louis,72,45,38,11,0,Foul on Milik Yarbrough.
Mississippi State,Saint Louis,72,45,38,11,0,Oliver Black missed Free Throw.
Mississippi State,Saint Louis,72,45,38,11,0,Mississippi St Deadball Team Rebound.
Mississippi State,Saint Louis,73,45,38,11,1,Oliver Black made Free Throw.
Mississippi State,Saint Louis,73,45,38,32,0,Foul on Fallou Ndoye.
Mississippi State,Saint Louis,73,45,38,32,0,Milik Yarbrough missed Free Throw.
Mississippi State,Saint Louis,73,45,38,32,0,Saint Louis Deadball Team Rebound.
Mississippi State,Saint Louis,73,46,38,32,1,Milik Yarbrough made Free Throw.
Mississippi State,Saint Louis,75,46,38,54,1,Demetrius Houston made Jumper. Assisted by Isaiah Butler.
Mississippi State,Saint Louis,75,46,39,12,0,Foul on Maurice Dunlap.
Mississippi State,Saint Louis,75,47,39,12,1,Miles Reynolds made Free Throw.
Mississippi State,Saint Louis,75,48,39,12,1,Miles Reynolds made Free Throw.
Mississippi State,Saint Louis,75,48,39,42,0,Maurice Dunlap missed Three Point Jumper.
Mississippi State,Saint Louis,75,48,39,42,0,Marcus Bartley Defensive Rebound.
Mississippi State,Saint Louis,75,48,39,52,0,Miles Reynolds missed Layup.
Mississippi State,Saint Louis,75,48,39,52,0,Mike Crawford Offensive Rebound.
Mississippi State,Saint Louis,75,50,39,54,1,Mike Crawford made Two Point Tip Shot.
Mississippi State,Saint Louis,75,50,40,0,0,End of Game
