Away Team,Home Team,Away Score,Home Score,Minute,Second,isScoringPosession,Desc.
Montana State,San Jose State,84,81,38,29,1,Princeton Onwas made Layup.
Montana State,San Jose State,84,81,38,29,0,Foul on Tyler Hall.
Montana State,San Jose State,84,81,38,29,0,Princeton Onwas missed Free Throw.
Montana State,San Jose State,84,81,38,29,0,Frank Rogers Offensive Rebound.
Montana State,San Jose State,84,81,38,32,0,Cody Schwartz missed Three Point Jumper.
Montana State,San Jose State,84,81,38,32,0,Montana St Defensive Rebound.
Montana State,San Jose State,84,81,38,37,0,San Jos St  Timeout
Montana State,San Jose State,84,81,38,49,0,Foul on Princeton Onwas.
Montana State,San Jose State,84,81,38,49,0,Tyler Hall missed Free Throw.
Montana State,San Jose State,84,81,38,49,0,Montana St Deadball Team Rebound.
Montana State,San Jose State,85,81,38,49,1,Tyler Hall made Free Throw.
Montana State,San Jose State,85,81,38,58,0,Princeton Onwas missed Layup.
Montana State,San Jose State,85,81,38,58,0,Isaac Thornton Offensive Rebound.
Montana State,San Jose State,85,81,39,4,0,Isaac Thornton Turnover.
Montana State,San Jose State,85,81,39,5,0,Marcus Colbert Steal.
Montana State,San Jose State,85,81,39,10,0,Foul on Frank Rogers.
Montana State,San Jose State,85,81,39,10,0,Marcus Colbert missed Free Throw.
Montana State,San Jose State,85,81,39,10,0,Montana St Deadball Team Rebound.
Montana State,San Jose State,86,81,39,10,1,Marcus Colbert made Free Throw.
Montana State,San Jose State,86,81,39,19,0,Ryan Welage missed Three Point Jumper.
Montana State,San Jose State,86,81,39,19,0,Montana St Defensive Rebound.
Montana State,San Jose State,86,81,39,22,0,Foul on Brandon Clarke.
Montana State,San Jose State,86,81,39,22,0,Tyler Hall missed Free Throw.
Montana State,San Jose State,86,81,39,22,0,Montana St Deadball Team Rebound.
Montana State,San Jose State,87,81,39,22,1,Tyler Hall made Free Throw.
Montana State,San Jose State,87,81,39,27,0,Foul on Marcus Colbert.
Montana State,San Jose State,87,82,39,27,1,Jalen James made Free Throw.
Montana State,San Jose State,87,83,39,27,1,Jalen James made Free Throw.
Montana State,San Jose State,87,83,39,31,0,Foul on Isaac Thornton.
Montana State,San Jose State,88,83,39,31,1,Tyler Hall made Free Throw.
Montana State,San Jose State,89,83,39,31,1,Tyler Hall made Free Throw.
Montana State,San Jose State,89,83,39,36,0,Jalen James missed Layup.
Montana State,San Jose State,89,83,39,36,0,Tyler Hall Defensive Rebound.
Montana State,San Jose State,89,83,39,39,0,Foul on Ryan Welage.
Montana State,San Jose State,90,83,39,39,1,Tyler Hall made Free Throw.
Montana State,San Jose State,91,83,39,39,1,Tyler Hall made Free Throw.
Montana State,San Jose State,91,83,39,42,0,Ryan Welage missed Three Point Jumper.
Montana State,San Jose State,91,83,39,42,0,Tyler Hall Defensive Rebound.
Montana State,San Jose State,91,83,40,0,0,End of Game
