Away Team,Home Team,Away Score,Home Score,Minute,Second,isScoringPosession,Desc.
Montana State,San Jose State,0,0,0,27,0,Marcus Colbert missed Three Point Jumper.
Montana State,San Jose State,0,0,0,27,0,Isaac Thornton Defensive Rebound.
Montana State,San Jose State,0,2,0,34,1,Princeton Onwas made Layup. Assisted by Isaac Thornton.
Montana State,San Jose State,3,2,0,56,1,Tyler Hall made Three Point Jumper. Assisted by Marcus Colbert.
Montana State,San Jose State,3,2,1,4,0,Princeton Onwas Turnover.
Montana State,San Jose State,3,2,1,4,0,Foul on Princeton Onwas.
Montana State,San Jose State,6,2,1,32,1,Tyler Hall made Three Point Jumper. Assisted by Danny Robison.
Montana State,San Jose State,6,2,1,58,0,Frank Rogers Turnover.
Montana State,San Jose State,6,2,1,59,0,Marcus Colbert Steal.
Montana State,San Jose State,9,2,2,6,1,Tyler Hall made Three Point Jumper.
Montana State,San Jose State,9,2,2,27,0,Foul on Quinn Price.
Montana State,San Jose State,9,3,2,27,1,Isaac Thornton made Free Throw.
Montana State,San Jose State,9,3,2,27,0,Isaac Thornton missed Free Throw.
Montana State,San Jose State,9,3,2,27,0,Sarp Gobeloglu Defensive Rebound.
Montana State,San Jose State,9,3,2,57,0,Quinton Everett missed Three Point Jumper.
Montana State,San Jose State,9,3,2,57,0,Ryan Welage Defensive Rebound.
Montana State,San Jose State,9,6,3,5,1,Ryan Welage made Three Point Jumper. Assisted by Isaac Thornton.
Montana State,San Jose State,9,6,3,13,0,Sarp Gobeloglu Turnover.
Montana State,San Jose State,9,6,3,24,0,Ryan Welage missed Three Point Jumper.
Montana State,San Jose State,9,6,3,24,0,Montana St Deadball Team Rebound.
Montana State,San Jose State,11,6,3,43,1,Tyler Hall made Jumper.
Montana State,San Jose State,11,6,3,56,0,Foul on Danny Robison.
Montana State,San Jose State,11,7,3,56,1,Princeton Onwas made Free Throw.
Montana State,San Jose State,11,7,3,56,0,Princeton Onwas missed Free Throw.
Montana State,San Jose State,11,7,3,56,0,Danny Robison Defensive Rebound.
Montana State,San Jose State,11,7,4,7,0,Foul on Frank Rogers.
Montana State,San Jose State,11,7,4,7,0,Official TV Timeout
Montana State,San Jose State,11,7,4,7,0,Danny Robison missed Free Throw.
Montana State,San Jose State,11,7,4,7,0,Montana St Deadball Team Rebound.
Montana State,San Jose State,11,7,4,7,0,Danny Robison missed Free Throw.
Montana State,San Jose State,11,7,4,7,0,Ryan Welage Defensive Rebound.
Montana State,San Jose State,11,7,4,32,0,Cody Schwartz missed Three Point Jumper.
Montana State,San Jose State,11,7,4,32,0,Quinton Everett Defensive Rebound.
Montana State,San Jose State,11,7,4,45,0,Stephan Holm missed Layup.
Montana State,San Jose State,11,7,4,45,0,Stephan Holm Offensive Rebound.
Montana State,San Jose State,11,7,4,52,0,Stephan Holm Turnover.
Montana State,San Jose State,11,7,4,57,0,Gary Williams Jr. Turnover.
Montana State,San Jose State,11,7,5,15,0,Stephan Holm missed Three Point Jumper.
Montana State,San Jose State,11,7,5,15,0,Quinton Everett Offensive Rebound.
Montana State,San Jose State,11,7,5,19,0,Quinton Everett missed Layup.
Montana State,San Jose State,11,7,5,19,0,Gary Williams Jr. Defensive Rebound.
Montana State,San Jose State,11,9,5,36,1,Frank Rogers made Jumper. Assisted by Gary Williams Jr..
Montana State,San Jose State,11,9,5,56,0,Quinton Everett missed Layup.
Montana State,San Jose State,11,9,5,56,0,San Jos St Deadball Team Rebound.
Montana State,San Jose State,11,9,5,57,0,Foul on Shikei Blake.
Montana State,San Jose State,11,9,6,8,0,Frank Rogers missed Jumper.
Montana State,San Jose State,11,9,6,8,0,Nahjee Matlock Defensive Rebound.
Montana State,San Jose State,14,9,6,37,1,Stephan Holm made Three Point Jumper.
Montana State,San Jose State,14,9,6,48,0,Foul on Quinn Price.
Montana State,San Jose State,14,9,6,55,0,Princeton Onwas missed Layup.
Montana State,San Jose State,14,9,6,55,0,Princeton Onwas Offensive Rebound.
Montana State,San Jose State,14,9,6,58,0,Princeton Onwas missed Layup.
Montana State,San Jose State,14,9,6,58,0,Princeton Onwas Offensive Rebound.
Montana State,San Jose State,14,11,7,2,1,Princeton Onwas made Layup.
Montana State,San Jose State,14,11,7,15,0,Sam Neumann missed Three Point Jumper.
Montana State,San Jose State,14,11,7,15,0,Jalen James Defensive Rebound.
Montana State,San Jose State,14,11,7,26,0,Gary Williams Jr. missed Jumper.
Montana State,San Jose State,14,11,7,26,0,Brandon Clarke Offensive Rebound.
Montana State,San Jose State,14,13,7,29,1,Brandon Clarke made Layup.
Montana State,San Jose State,14,13,7,29,0,Foul on Sam Neumann.
Montana State,San Jose State,14,14,7,29,1,Brandon Clarke made Free Throw.
Montana State,San Jose State,14,14,7,45,0,Sarp Gobeloglu missed Three Point Jumper.
Montana State,San Jose State,14,14,7,45,0,Quinn Price Offensive Rebound.
Montana State,San Jose State,14,14,7,49,0,Quinn Price missed Layup.
Montana State,San Jose State,14,14,7,49,0,Montana St Offensive Rebound.
Montana State,San Jose State,14,14,7,58,0,Nahjee Matlock missed Layup.
Montana State,San Jose State,14,14,7,58,0,Brandon Clarke Block.
Montana State,San Jose State,14,14,7,58,0,Montana St Offensive Rebound.
Montana State,San Jose State,14,14,8,22,0,Nahjee Matlock missed Jumper.
Montana State,San Jose State,14,14,8,22,0,Princeton Onwas Defensive Rebound.
Montana State,San Jose State,14,14,8,29,0,Foul on Zach Green.
Montana State,San Jose State,14,14,8,29,0,Official TV Timeout
Montana State,San Jose State,14,15,8,29,1,Brandon Clarke made Free Throw.
Montana State,San Jose State,14,16,8,29,1,Brandon Clarke made Free Throw.
Montana State,San Jose State,14,16,8,54,0,Foul on Jalen James.
Montana State,San Jose State,14,16,9,3,0,Zach Green Turnover.
Montana State,San Jose State,14,16,9,12,0,Jalen James Turnover.
Montana State,San Jose State,14,16,9,23,0,Foul on Princeton Onwas.
Montana State,San Jose State,16,16,9,34,1,Zach Green made Jumper. Assisted by Marcus Colbert.
Montana State,San Jose State,16,16,9,46,0,Isaac Thornton Turnover.
Montana State,San Jose State,16,16,9,56,0,Foul on Gary Williams Jr..
Montana State,San Jose State,18,16,10,9,1,Shikei Blake made Layup.
Montana State,San Jose State,18,18,10,27,1,Gary Williams Jr. made Jumper.
Montana State,San Jose State,21,18,10,37,1,Tyler Hall made Three Point Jumper.
Montana State,San Jose State,21,18,10,45,0,Isaac Thornton Turnover.
Montana State,San Jose State,21,18,10,45,0,Foul on Isaac Thornton.
Montana State,San Jose State,21,18,10,53,0,Zach Green Turnover.
Montana State,San Jose State,21,18,10,58,0,Gary Williams Jr. missed Three Point Jumper.
Montana State,San Jose State,21,18,10,58,0,Tyler Hall Defensive Rebound.
Montana State,San Jose State,21,18,11,6,0,Foul on Cody Schwartz.
Montana State,San Jose State,21,18,11,6,0,Quinton Everett missed Free Throw.
Montana State,San Jose State,21,18,11,6,0,Montana St Deadball Team Rebound.
Montana State,San Jose State,21,18,11,6,0,Quinton Everett missed Free Throw.
Montana State,San Jose State,21,18,11,6,0,San Jos St Deadball Team Rebound.
Montana State,San Jose State,21,18,11,7,0,Foul on Sarp Gobeloglu.
Montana State,San Jose State,21,19,11,7,1,Cody Schwartz made Free Throw.
Montana State,San Jose State,21,20,11,7,1,Cody Schwartz made Free Throw.
Montana State,San Jose State,21,20,11,13,0,Quinton Everett Turnover.
Montana State,San Jose State,21,22,11,25,1,Leon Bahner made Layup. Assisted by Gary Williams Jr..
Montana State,San Jose State,21,22,11,41,0,Stephan Holm missed Layup.
Montana State,San Jose State,21,22,11,41,0,Gary Williams Jr. Defensive Rebound.
Montana State,San Jose State,21,22,11,43,0,Foul on Stephan Holm.
Montana State,San Jose State,21,22,11,43,0,Gary Williams Jr. missed Free Throw.
Montana State,San Jose State,21,22,11,43,0,Stephan Holm Defensive Rebound.
Montana State,San Jose State,24,22,11,52,1,Stephan Holm made Three Point Jumper. Assisted by Tyler Hall.
Montana State,San Jose State,24,24,12,10,1,Gary Williams Jr. made Jumper. Assisted by Leon Bahner.
Montana State,San Jose State,26,24,12,30,1,Marcus Colbert made Jumper.
Montana State,San Jose State,26,24,12,41,0,Gary Williams Jr. missed Jumper.
Montana State,San Jose State,26,24,12,41,0,Gary Williams Jr. Offensive Rebound.
Montana State,San Jose State,26,24,12,45,0,Gary Williams Jr. missed Layup.
Montana State,San Jose State,26,24,12,45,0,Sarp Gobeloglu Defensive Rebound.
Montana State,San Jose State,29,24,12,55,1,Sarp Gobeloglu made Three Point Jumper. Assisted by Marcus Colbert.
Montana State,San Jose State,29,24,13,7,0,Jalen James Turnover.
Montana State,San Jose State,29,24,13,7,0,Official TV Timeout
Montana State,San Jose State,31,24,13,17,1,Danny Robison made Layup. Assisted by Tyler Hall.
Montana State,San Jose State,31,24,13,43,0,Jalen James missed Jumper.
Montana State,San Jose State,31,24,13,43,0,Danny Robison Defensive Rebound.
Montana State,San Jose State,33,24,13,53,1,Sarp Gobeloglu made Jumper. Assisted by Marcus Colbert.
Montana State,San Jose State,33,24,14,5,0,Brandon Clarke missed Jumper.
Montana State,San Jose State,33,24,14,5,0,Stephan Holm Defensive Rebound.
Montana State,San Jose State,33,24,14,16,0,Danny Robison missed Three Point Jumper.
Montana State,San Jose State,33,24,14,16,0,Isaac Thornton Defensive Rebound.
Montana State,San Jose State,33,24,14,25,0,Ryan Welage Turnover.
Montana State,San Jose State,33,24,14,25,0,Foul on Ryan Welage.
Montana State,San Jose State,33,24,14,32,0,Foul on Ryan Welage.
Montana State,San Jose State,34,24,14,32,1,Danny Robison made Free Throw.
Montana State,San Jose State,35,24,14,32,1,Danny Robison made Free Throw.
Montana State,San Jose State,35,24,14,43,0,Ryan Welage missed Jumper.
Montana State,San Jose State,35,24,14,43,0,Stephan Holm Defensive Rebound.
Montana State,San Jose State,37,24,14,51,1,Stephan Holm made Layup.
Montana State,San Jose State,37,24,14,51,0,Foul on Cody Schwartz.
Montana State,San Jose State,37,24,14,51,0,Stephan Holm missed Free Throw.
Montana State,San Jose State,37,24,14,51,0,Isaac Thornton Defensive Rebound.
Montana State,San Jose State,37,27,15,2,1,Cody Schwartz made Three Point Jumper. Assisted by Princeton Onwas.
Montana State,San Jose State,37,27,15,17,0,Zach Green Turnover.
Montana State,San Jose State,37,27,15,17,0,Foul on Zach Green.
Montana State,San Jose State,37,27,15,41,0,Frank Rogers missed Jumper.
Montana State,San Jose State,37,27,15,41,0,Nahjee Matlock Defensive Rebound.
Montana State,San Jose State,37,27,15,59,0,Shikei Blake missed Jumper.
Montana State,San Jose State,37,27,15,59,0,Sarp Gobeloglu Offensive Rebound.
Montana State,San Jose State,39,27,16,6,1,Sarp Gobeloglu made Two Point Tip Shot.
Montana State,San Jose State,39,27,16,20,0,Ryan Welage Turnover.
Montana State,San Jose State,39,27,16,20,0,Official TV Timeout
Montana State,San Jose State,39,27,16,28,0,Sarp Gobeloglu Turnover.
Montana State,San Jose State,39,27,16,30,0,Frank Rogers Steal.
Montana State,San Jose State,39,27,16,33,0,Foul on Marcus Colbert.
Montana State,San Jose State,39,28,16,33,1,Isaac Thornton made Free Throw.
Montana State,San Jose State,39,28,16,33,0,Isaac Thornton missed Free Throw.
Montana State,San Jose State,39,28,16,33,0,Tyler Hall Defensive Rebound.
Montana State,San Jose State,39,28,16,44,0,Marcus Colbert Turnover.
Montana State,San Jose State,39,28,17,1,0,Foul on Shikei Blake.
Montana State,San Jose State,39,28,17,1,0,Brandon Clarke missed Free Throw.
Montana State,San Jose State,39,28,17,1,0,San Jos St Deadball Team Rebound.
Montana State,San Jose State,39,28,17,1,0,Brandon Clarke missed Free Throw.
Montana State,San Jose State,39,28,17,1,0,Tyler Hall Defensive Rebound.
Montana State,San Jose State,39,28,17,18,0,Marcus Colbert missed Three Point Jumper.
Montana State,San Jose State,39,28,17,18,0,Tyler Hall Offensive Rebound.
Montana State,San Jose State,39,28,17,45,0,Shikei Blake missed Jumper.
Montana State,San Jose State,39,28,17,45,0,Zach Green Offensive Rebound.
Montana State,San Jose State,39,28,17,48,0,Foul on Leon Bahner.
Montana State,San Jose State,39,28,17,48,0,Zach Green missed Free Throw.
Montana State,San Jose State,39,28,17,48,0,Montana St Deadball Team Rebound.
Montana State,San Jose State,40,28,17,48,1,Zach Green made Free Throw.
Montana State,San Jose State,40,28,17,56,0,Gary Williams Jr. missed Three Point Jumper.
Montana State,San Jose State,40,28,17,56,0,Zach Green Defensive Rebound.
Montana State,San Jose State,40,28,18,11,0,Zach Green missed Jumper.
Montana State,San Jose State,40,28,18,11,0,Sarp Gobeloglu Offensive Rebound.
Montana State,San Jose State,43,28,18,15,1,Marcus Colbert made Three Point Jumper. Assisted by Sarp Gobeloglu.
Montana State,San Jose State,43,31,18,45,1,Gary Williams Jr. made Three Point Jumper. Assisted by Jaycee Hillsman.
Montana State,San Jose State,43,31,18,56,0,Foul on Leon Bahner.
Montana State,San Jose State,44,31,18,56,1,Danny Robison made Free Throw.
Montana State,San Jose State,44,31,18,56,0,Danny Robison missed Free Throw.
Montana State,San Jose State,44,31,18,56,0,Leon Bahner Defensive Rebound.
Montana State,San Jose State,44,31,19,6,0,Foul on Marcus Colbert.
Montana State,San Jose State,44,32,19,6,1,Gary Williams Jr. made Free Throw.
Montana State,San Jose State,44,33,19,6,1,Gary Williams Jr. made Free Throw.
Montana State,San Jose State,44,33,19,25,0,Stephan Holm missed Three Point Jumper.
Montana State,San Jose State,44,33,19,25,0,Gary Williams Jr. Defensive Rebound.
Montana State,San Jose State,44,35,19,31,1,Jaycee Hillsman made Layup. Assisted by Gary Williams Jr..
Montana State,San Jose State,47,35,19,57,1,Danny Robison made Three Point Jumper. Assisted by Tyler Hall.
Montana State,San Jose State,47,35,20,0,0,End of 1st half
Montana State,San Jose State,47,37,20,9,1,Frank Rogers made Layup. Assisted by Ryan Welage.
Montana State,San Jose State,49,37,20,22,1,Danny Robison made Layup. Assisted by Zach Green.
Montana State,San Jose State,49,40,20,34,1,Cody Schwartz made Three Point Jumper. Assisted by Ryan Welage.
Montana State,San Jose State,49,40,21,9,0,Danny Robison Turnover.
Montana State,San Jose State,49,40,21,10,0,Frank Rogers Steal.
Montana State,San Jose State,49,40,21,12,0,Frank Rogers Turnover.
Montana State,San Jose State,49,40,21,13,0,Zach Green Steal.
Montana State,San Jose State,49,40,21,20,0,Danny Robison missed Three Point Jumper.
Montana State,San Jose State,49,40,21,20,0,Zach Green Offensive Rebound.
Montana State,San Jose State,51,40,21,24,1,Zach Green made Layup.
Montana State,San Jose State,51,40,21,36,0,Foul on Danny Robison.
Montana State,San Jose State,51,42,21,47,1,Princeton Onwas made Layup. Assisted by Isaac Thornton.
Montana State,San Jose State,53,42,21,55,1,Zach Green made Jumper.
Montana State,San Jose State,53,42,22,9,0,Foul on Tyler Hall.
Montana State,San Jose State,53,43,22,9,1,Jalen James made Free Throw.
Montana State,San Jose State,53,44,22,9,1,Jalen James made Free Throw.
Montana State,San Jose State,53,44,22,21,0,Shikei Blake Turnover.
Montana State,San Jose State,53,44,22,40,0,Princeton Onwas missed Jumper.
Montana State,San Jose State,53,44,22,40,0,Princeton Onwas Offensive Rebound.
Montana State,San Jose State,53,44,22,43,0,Princeton Onwas missed Two Point Tip Shot.
Montana State,San Jose State,53,44,22,43,0,San Jos St Offensive Rebound.
Montana State,San Jose State,53,44,22,47,0,Cody Schwartz missed Three Point Jumper.
Montana State,San Jose State,53,44,22,47,0,Zach Green Defensive Rebound.
Montana State,San Jose State,53,44,22,56,0,Foul on Jalen James.
Montana State,San Jose State,53,44,23,2,0,Marcus Colbert Turnover.
Montana State,San Jose State,53,44,23,28,0,Ryan Welage missed Three Point Jumper.
Montana State,San Jose State,53,44,23,28,0,Montana St Defensive Rebound.
Montana State,San Jose State,55,44,23,56,1,Tyler Hall made Layup. Assisted by Zach Green.
Montana State,San Jose State,55,46,24,15,1,Jalen James made Jumper. Assisted by Brandon Clarke.
Montana State,San Jose State,55,46,24,24,0,Sarp Gobeloglu missed Three Point Jumper.
Montana State,San Jose State,55,46,24,24,0,Princeton Onwas Defensive Rebound.
Montana State,San Jose State,55,46,24,34,0,Jalen James missed Layup.
Montana State,San Jose State,55,46,24,34,0,Tyler Hall Defensive Rebound.
Montana State,San Jose State,55,46,24,43,0,Sarp Gobeloglu missed Jumper.
Montana State,San Jose State,55,46,24,43,0,Danny Robison Offensive Rebound.
Montana State,San Jose State,55,46,24,46,0,Danny Robison missed Layup.
Montana State,San Jose State,55,46,24,46,0,San Jos St Defensive Rebound.
Montana State,San Jose State,55,46,24,49,0,Official TV Timeout
Montana State,San Jose State,55,48,25,12,1,Frank Rogers made Layup. Assisted by Princeton Onwas.
Montana State,San Jose State,55,48,25,31,0,Marcus Colbert Turnover.
Montana State,San Jose State,55,48,25,32,0,Princeton Onwas Steal.
Montana State,San Jose State,55,50,25,35,1,Jalen James made Layup. Assisted by Princeton Onwas.
Montana State,San Jose State,55,50,25,47,0,Sarp Gobeloglu missed Three Point Jumper.
Montana State,San Jose State,55,50,25,47,0,Danny Robison Offensive Rebound.
Montana State,San Jose State,55,50,25,51,0,Foul on Princeton Onwas.
Montana State,San Jose State,55,50,25,51,0,Danny Robison missed Free Throw.
Montana State,San Jose State,55,50,25,51,0,Montana St Deadball Team Rebound.
Montana State,San Jose State,56,50,25,51,1,Danny Robison made Free Throw.
Montana State,San Jose State,56,50,26,0,0,Foul on Sarp Gobeloglu.
Montana State,San Jose State,56,50,26,7,0,Foul on Quinton Everett.
Montana State,San Jose State,56,51,26,7,1,Brandon Clarke made Free Throw.
Montana State,San Jose State,56,52,26,7,1,Brandon Clarke made Free Throw.
Montana State,San Jose State,56,52,26,17,0,Danny Robison missed Three Point Jumper.
Montana State,San Jose State,56,52,26,17,0,Montana St Offensive Rebound.
Montana State,San Jose State,58,52,26,31,1,Quinton Everett made Layup. Assisted by Marcus Colbert.
Montana State,San Jose State,58,52,26,45,0,Foul on Sarp Gobeloglu.
Montana State,San Jose State,58,53,26,45,1,Cody Schwartz made Free Throw.
Montana State,San Jose State,58,54,26,45,1,Cody Schwartz made Free Throw.
Montana State,San Jose State,60,54,26,58,1,Marcus Colbert made Layup.
Montana State,San Jose State,60,57,27,24,1,Cody Schwartz made Three Point Jumper. Assisted by Leon Bahner.
Montana State,San Jose State,62,57,27,37,1,Danny Robison made Layup.
Montana State,San Jose State,62,57,27,37,0,Foul on Frank Rogers.
Montana State,San Jose State,63,57,27,37,1,Danny Robison made Free Throw.
Montana State,San Jose State,63,59,27,52,1,Isaac Thornton made Jumper.
Montana State,San Jose State,63,59,28,0,0,Technical Foul on San Jos St.
Montana State,San Jose State,64,59,28,0,1,Marcus Colbert made Free Throw.
Montana State,San Jose State,64,59,28,11,0,Tyler Hall missed Jumper.
Montana State,San Jose State,64,59,28,15,0,Frank Rogers Defensive Rebound.
Montana State,San Jose State,64,59,28,15,0,Foul on Cody Schwartz.
Montana State,San Jose State,64,59,28,15,0,Cody Schwartz Turnover.
Montana State,San Jose State,64,59,28,15,0,Official TV Timeout
Montana State,San Jose State,64,59,28,31,0,Marcus Colbert missed Jumper.
Montana State,San Jose State,64,59,28,31,0,Frank Rogers Defensive Rebound.
Montana State,San Jose State,64,59,28,44,0,Foul on Danny Robison.
Montana State,San Jose State,64,60,28,44,1,Isaac Thornton made Free Throw.
Montana State,San Jose State,64,61,28,44,1,Isaac Thornton made Free Throw.
Montana State,San Jose State,64,61,29,1,0,Tyler Hall Turnover.
Montana State,San Jose State,64,61,29,3,0,Isaac Thornton Steal.
Montana State,San Jose State,64,64,29,5,1,Cody Schwartz made Three Point Jumper. Assisted by Isaac Thornton.
Montana State,San Jose State,64,64,29,29,0,Marcus Colbert missed Three Point Jumper.
Montana State,San Jose State,64,64,29,29,0,Brandon Clarke Defensive Rebound.
Montana State,San Jose State,64,64,29,36,0,Brandon Clarke Turnover.
Montana State,San Jose State,64,64,29,36,0,Foul on Brandon Clarke.
Montana State,San Jose State,64,64,29,57,0,Sarp Gobeloglu missed Three Point Jumper.
Montana State,San Jose State,64,64,29,57,0,Quinton Everett Offensive Rebound.
Montana State,San Jose State,64,64,30,0,0,Foul on Isaac Thornton.
Montana State,San Jose State,64,64,30,1,0,Marcus Colbert Turnover.
Montana State,San Jose State,64,64,30,2,0,Isaac Thornton Steal.
Montana State,San Jose State,64,66,30,4,1,Isaac Thornton made Dunk.
Montana State,San Jose State,64,66,30,31,0,Quinton Everett Turnover.
Montana State,San Jose State,64,66,30,37,0,Cody Schwartz missed Three Point Jumper.
Montana State,San Jose State,64,66,30,37,0,San Jos St Deadball Team Rebound.
Montana State,San Jose State,64,66,30,40,0,Foul on Shikei Blake.
Montana State,San Jose State,64,66,30,40,0,Leon Bahner missed Free Throw.
Montana State,San Jose State,64,66,30,40,0,Shikei Blake Defensive Rebound.
Montana State,San Jose State,64,66,30,56,0,Quinton Everett Turnover.
Montana State,San Jose State,64,66,31,13,0,Frank Rogers Turnover.
Montana State,San Jose State,64,66,31,15,0,Foul on Leon Bahner.
Montana State,San Jose State,64,66,31,15,0,Quinton Everett missed Free Throw.
Montana State,San Jose State,64,66,31,15,0,Cody Schwartz Defensive Rebound.
Montana State,San Jose State,64,66,31,46,0,Isaac Thornton missed Jumper.
Montana State,San Jose State,64,66,31,46,0,Montana St Deadball Team Rebound.
Montana State,San Jose State,64,66,31,49,0,Foul on Cody Schwartz.
Montana State,San Jose State,64,66,31,49,0,Zach Green missed Free Throw.
Montana State,San Jose State,64,66,31,49,0,Montana St Offensive Rebound.
Montana State,San Jose State,64,66,31,58,0,Shikei Blake missed Layup.
Montana State,San Jose State,64,66,31,58,0,Shikei Blake Offensive Rebound.
Montana State,San Jose State,66,66,32,4,1,Shikei Blake made Two Point Tip Shot.
Montana State,San Jose State,66,68,32,21,1,Leon Bahner made Dunk. Assisted by Frank Rogers.
Montana State,San Jose State,68,68,32,47,1,Shikei Blake made Layup. Assisted by Marcus Colbert.
Montana State,San Jose State,68,68,32,59,0,Official TV Timeout
Montana State,San Jose State,68,68,33,4,0,Foul on Shikei Blake.
Montana State,San Jose State,68,68,33,4,0,Official TV Timeout
Montana State,San Jose State,68,69,33,4,1,Frank Rogers made Free Throw.
Montana State,San Jose State,68,70,33,4,1,Frank Rogers made Free Throw.
Montana State,San Jose State,68,70,33,27,0,Marcus Colbert missed Jumper.
Montana State,San Jose State,68,70,33,27,0,Leon Bahner Defensive Rebound.
Montana State,San Jose State,68,70,33,56,0,Leon Bahner missed Jumper.
Montana State,San Jose State,68,70,33,56,0,Princeton Onwas Offensive Rebound.
Montana State,San Jose State,68,70,34,2,0,Gary Williams Jr. missed Three Point Jumper.
Montana State,San Jose State,68,70,34,2,0,Shikei Blake Defensive Rebound.
Montana State,San Jose State,70,70,34,14,1,Shikei Blake made Layup. Assisted by Marcus Colbert.
Montana State,San Jose State,70,70,34,38,0,Foul on Shikei Blake.
Montana State,San Jose State,70,70,34,38,0,Jalen James missed Free Throw.
Montana State,San Jose State,70,70,34,38,0,San Jos St Deadball Team Rebound.
Montana State,San Jose State,70,71,34,38,1,Jalen James made Free Throw.
Montana State,San Jose State,70,71,34,53,0,Tyler Hall missed Jumper.
Montana State,San Jose State,70,71,34,53,0,Tyler Hall Offensive Rebound.
Montana State,San Jose State,70,71,34,56,0,Tyler Hall missed Layup.
Montana State,San Jose State,70,71,34,56,0,Leon Bahner Defensive Rebound.
Montana State,San Jose State,70,71,35,23,0,Foul on Danny Robison.
Montana State,San Jose State,70,71,35,23,0,Isaac Thornton missed Free Throw.
Montana State,San Jose State,70,71,35,23,0,San Jos St Deadball Team Rebound.
Montana State,San Jose State,70,72,35,23,1,Isaac Thornton made Free Throw.
Montana State,San Jose State,73,72,35,34,1,Sarp Gobeloglu made Three Point Jumper. Assisted by Marcus Colbert.
Montana State,San Jose State,73,74,36,1,1,Princeton Onwas made Jumper. Assisted by Jalen James.
Montana State,San Jose State,73,74,36,11,0,Marcus Colbert missed Jumper.
Montana State,San Jose State,73,74,36,11,0,Jalen James Defensive Rebound.
Montana State,San Jose State,73,74,36,18,0,Jalen James Turnover.
Montana State,San Jose State,73,74,36,18,0,Official TV Timeout
Montana State,San Jose State,76,74,36,28,1,Sarp Gobeloglu made Three Point Jumper. Assisted by Marcus Colbert.
Montana State,San Jose State,76,74,36,43,0,Foul on Sarp Gobeloglu.
Montana State,San Jose State,76,75,36,43,1,Princeton Onwas made Free Throw.
Montana State,San Jose State,76,76,36,43,1,Princeton Onwas made Free Throw.
Montana State,San Jose State,78,76,37,1,1,Marcus Colbert made Layup.
Montana State,San Jose State,78,76,37,2,0,Foul on Isaac Thornton.
Montana State,San Jose State,79,76,37,2,1,Marcus Colbert made Free Throw.
Montana State,San Jose State,79,76,37,14,0,Frank Rogers missed Three Point Jumper.
Montana State,San Jose State,79,76,37,14,0,San Jos St Deadball Team Rebound.
Montana State,San Jose State,79,76,37,17,0,Foul on Marcus Colbert.
Montana State,San Jose State,79,76,37,17,0,Leon Bahner missed Free Throw.
Montana State,San Jose State,79,76,37,17,0,San Jos St Deadball Team Rebound.
Montana State,San Jose State,79,77,37,17,1,Leon Bahner made Free Throw.
Montana State,San Jose State,82,77,37,26,1,Sarp Gobeloglu made Three Point Jumper. Assisted by Danny Robison.
Montana State,San Jose State,82,77,37,42,0,Frank Rogers missed Three Point Jumper.
Montana State,San Jose State,82,77,37,42,0,San Jos St Offensive Rebound.
Montana State,San Jose State,82,79,37,52,1,Brandon Clarke made Layup.
Montana State,San Jose State,84,79,38,12,1,Tyler Hall made Layup.
Montana State,San Jose State,84,79,38,28,0,Princeton Onwas missed Jumper.
Montana State,San Jose State,84,79,38,28,0,Princeton Onwas Offensive Rebound.
