Away Team,Home Team,Away Score, Home Score,Minute,Second,isScoringPosession,Desc.
Northern Arizona,Eastern Washington,0,0,0,12,0,Felix Von Hofe missed Three Point Jumper.
Northern Arizona,Eastern Washington,0,0,0,12,0,Marcus DeBerry Defensive Rebound.
Northern Arizona,Eastern Washington,0,0,0,39,0,Mike Green missed Three Point Jumper.
Northern Arizona,Eastern Washington,0,0,0,39,0,Jacob Wiley Defensive Rebound.
Northern Arizona,Eastern Washington,0,0,0,51,0,Bogdan Bliznyuk missed Layup.
Northern Arizona,Eastern Washington,0,0,0,51,0,Ako Kaluna Block.
Northern Arizona,Eastern Washington,0,0,0,53,0,Mike Green Defensive Rebound.
Northern Arizona,Eastern Washington,2,0,1,3,1,Ako Kaluna made Jumper.
Northern Arizona,Eastern Washington,2,0,1,4,0,Eastern Washington  Timeout
Northern Arizona,Eastern Washington,2,2,1,21,1,Jacob Wiley made Jumper.
Northern Arizona,Eastern Washington,2,2,1,47,0,Ako Kaluna missed Jumper.
Northern Arizona,Eastern Washington,2,2,1,47,0,Felix Von Hofe Defensive Rebound.
Northern Arizona,Eastern Washington,2,2,2,5,0,Bogdan Bliznyuk missed Three Point Jumper.
Northern Arizona,Eastern Washington,2,2,2,5,0,Kye de Laveaga Defensive Rebound.
Northern Arizona,Eastern Washington,5,2,2,19,1,Kye de Laveaga made Three Point Jumper. Assisted by Mike Green.
Northern Arizona,Eastern Washington,5,2,2,30,0,Bogdan Bliznyuk missed Layup.
Northern Arizona,Eastern Washington,5,2,2,30,0,Jordyn Martin Defensive Rebound.
Northern Arizona,Eastern Washington,8,2,2,42,1,Ako Kaluna made Three Point Jumper. Assisted by Kye de Laveaga.
Northern Arizona,Eastern Washington,8,5,2,55,1,Felix Von Hofe made Three Point Jumper. Assisted by Bogdan Bliznyuk.
Northern Arizona,Eastern Washington,8,5,2,55,0,Foul on Marcus DeBerry.
Northern Arizona,Eastern Washington,8,6,2,55,1,Felix Von Hofe made Free Throw.
Northern Arizona,Eastern Washington,11,6,3,22,1,Marcus DeBerry made Three Point Jumper. Assisted by Mike Green.
Northern Arizona,Eastern Washington,11,8,3,48,1,Bogdan Bliznyuk made Layup.
Northern Arizona,Eastern Washington,11,8,4,18,0,Mike Green missed Three Point Jumper.
Northern Arizona,Eastern Washington,11,8,4,18,0,Felix Von Hofe Defensive Rebound.
Northern Arizona,Eastern Washington,11,8,4,29,0,Bogdan Bliznyuk missed Three Point Jumper.
Northern Arizona,Eastern Washington,11,8,4,29,0,Jacob Wiley Offensive Rebound.
Northern Arizona,Eastern Washington,11,8,4,53,0,Bogdan Bliznyuk Turnover.
Northern Arizona,Eastern Washington,11,8,4,54,0,Marcus DeBerry Steal.
Northern Arizona,Eastern Washington,11,8,4,55,0,Foul on Felix Von Hofe.
Northern Arizona,Eastern Washington,11,8,4,55,0,Official TV Timeout
Northern Arizona,Eastern Washington,14,8,5,7,1,Chris Bowling made Three Point Jumper. Assisted by Brooks DeBisschop.
Northern Arizona,Eastern Washington,14,8,5,23,0,Felix Von Hofe missed Three Point Jumper.
Northern Arizona,Eastern Washington,14,8,5,23,0,Sir Washington Offensive Rebound.
Northern Arizona,Eastern Washington,14,10,5,38,1,Jacob Wiley made Layup.
Northern Arizona,Eastern Washington,16,10,5,57,1,Jordyn Martin made Jumper.
Northern Arizona,Eastern Washington,16,12,6,12,1,Jacob Wiley made Layup. Assisted by Bogdan Bliznyuk.
Northern Arizona,Eastern Washington,16,12,6,44,0,JoJo Anderson missed Layup.
Northern Arizona,Eastern Washington,16,12,6,44,0,Brooks DeBisschop Offensive Rebound.
Northern Arizona,Eastern Washington,16,12,6,46,0,Brooks DeBisschop missed Layup.
Northern Arizona,Eastern Washington,16,12,6,46,0,Sir Washington Defensive Rebound.
Northern Arizona,Eastern Washington,16,12,7,7,0,Sir Washington missed Three Point Jumper.
Northern Arizona,Eastern Washington,16,12,7,7,0,Brooks DeBisschop Defensive Rebound.
Northern Arizona,Eastern Washington,16,12,7,19,0,Brooks DeBisschop missed Layup.
Northern Arizona,Eastern Washington,16,12,7,19,0,Bogdan Bliznyuk Defensive Rebound.
Northern Arizona,Eastern Washington,16,12,7,39,0,Jacob Wiley Turnover.
Northern Arizona,Eastern Washington,16,12,7,48,0,Foul on Jacob Wiley.
Northern Arizona,Eastern Washington,19,12,8,1,1,Mike Green made Three Point Jumper.
Northern Arizona,Eastern Washington,19,15,8,15,1,Bogdan Bliznyuk made Three Point Jumper. Assisted by Sir Washington.
Northern Arizona,Eastern Washington,19,15,8,37,0,Chris Bowling missed Jumper.
Northern Arizona,Eastern Washington,19,15,8,37,0,Brooks DeBisschop Offensive Rebound.
Northern Arizona,Eastern Washington,19,15,9,9,0,Mike Green missed Jumper.
Northern Arizona,Eastern Washington,19,15,9,9,0,Jesse Hunt Defensive Rebound.
Northern Arizona,Eastern Washington,19,15,9,9,0,Official TV Timeout
Northern Arizona,Eastern Washington,19,17,9,22,1,Jacob Wiley made Jumper.
Northern Arizona,Eastern Washington,19,17,9,34,0,Foul on JoJo Anderson.
Northern Arizona,Eastern Washington,19,17,9,34,0,JoJo Anderson Turnover.
Northern Arizona,Eastern Washington,19,17,9,47,0,Cody Benzel missed Three Point Jumper.
Northern Arizona,Eastern Washington,19,17,9,47,0,Jesse Hunt Offensive Rebound.
Northern Arizona,Eastern Washington,19,19,9,50,1,Jesse Hunt made Layup.
Northern Arizona,Eastern Washington,19,19,10,3,0,Foul on Ako Kaluna.
Northern Arizona,Eastern Washington,19,19,10,3,0,Ako Kaluna Turnover.
Northern Arizona,Eastern Washington,19,19,10,20,0,Cody Benzel missed Three Point Jumper.
Northern Arizona,Eastern Washington,19,19,10,20,0,Mike Green Defensive Rebound.
Northern Arizona,Eastern Washington,19,19,10,28,0,Foul on Cody Benzel.
Northern Arizona,Eastern Washington,20,19,10,28,1,Ako Kaluna made Free Throw.
Northern Arizona,Eastern Washington,20,19,10,28,0,Ako Kaluna missed Free Throw.
Northern Arizona,Eastern Washington,20,19,10,28,0,Felix Von Hofe Defensive Rebound.
Northern Arizona,Eastern Washington,20,19,10,46,0,Felix Von Hofe missed Three Point Jumper.
Northern Arizona,Eastern Washington,20,19,10,46,0,Ako Kaluna Defensive Rebound.
Northern Arizona,Eastern Washington,20,19,10,58,0,Mike Green missed Three Point Jumper.
Northern Arizona,Eastern Washington,20,19,10,59,0,Ako Kaluna Offensive Rebound.
Northern Arizona,Eastern Washington,20,19,11,0,0,Foul on Jesse Hunt.
Northern Arizona,Eastern Washington,20,19,11,10,0,Mike Green Turnover.
Northern Arizona,Eastern Washington,20,21,11,21,1,Sir Washington made Layup.
Northern Arizona,Eastern Washington,20,21,11,46,0,Ako Kaluna missed Jumper.
Northern Arizona,Eastern Washington,20,21,11,46,0,Jacob Wiley Defensive Rebound.
Northern Arizona,Eastern Washington,20,23,12,6,1,Jacob Wiley made Layup.
Northern Arizona,Eastern Washington,20,23,12,37,0,JoJo Anderson missed Jumper.
Northern Arizona,Eastern Washington,20,23,12,37,0,Felix Von Hofe Defensive Rebound.
Northern Arizona,Eastern Washington,20,23,12,53,0,Felix Von Hofe missed Three Point Jumper.
Northern Arizona,Eastern Washington,20,23,12,53,0,Kye de Laveaga Defensive Rebound.
Northern Arizona,Eastern Washington,20,23,12,55,0,Foul on Sir Washington.
Northern Arizona,Eastern Washington,20,23,13,8,0,Marcus DeBerry missed Three Point Jumper.
Northern Arizona,Eastern Washington,20,23,13,8,0,Sir Washington Defensive Rebound.
Northern Arizona,Eastern Washington,20,25,13,15,1,Sir Washington made Layup.
Northern Arizona,Eastern Washington,23,25,13,29,1,Kye de Laveaga made Three Point Jumper. Assisted by Marcus DeBerry.
Northern Arizona,Eastern Washington,23,25,13,48,0,Ty Gibson missed Three Point Jumper.
Northern Arizona,Eastern Washington,23,25,13,48,0,Marcus DeBerry Defensive Rebound.
Northern Arizona,Eastern Washington,23,25,14,6,0,Kye de Laveaga missed Three Point Jumper.
Northern Arizona,Eastern Washington,23,25,14,6,0,Ty Gibson Defensive Rebound.
Northern Arizona,Eastern Washington,23,25,14,23,0,Felix Von Hofe missed Three Point Jumper.
Northern Arizona,Eastern Washington,23,25,14,23,0,Brooks DeBisschop Defensive Rebound.
Northern Arizona,Eastern Washington,23,25,14,35,0,JoJo Anderson missed Jumper.
Northern Arizona,Eastern Washington,23,25,14,35,0,Jacob Wiley Block.
Northern Arizona,Eastern Washington,23,25,14,39,0,Brooks DeBisschop Offensive Rebound.
Northern Arizona,Eastern Washington,25,25,14,41,1,JoJo Anderson made Jumper. Assisted by Brooks DeBisschop.
Northern Arizona,Eastern Washington,25,25,14,57,0,Jacob Wiley missed Jumper.
Northern Arizona,Eastern Washington,25,25,14,57,0,Marcus DeBerry Defensive Rebound.
Northern Arizona,Eastern Washington,25,25,15,22,0,JoJo Anderson missed Three Point Jumper.
Northern Arizona,Eastern Washington,25,25,15,22,0,Eastern Washington Defensive Rebound.
Northern Arizona,Eastern Washington,25,27,15,30,1,Jacob Wiley made Layup. Assisted by Felix Von Hofe.
Northern Arizona,Eastern Washington,25,27,15,56,0,Foul on Cody Benzel.
Northern Arizona,Eastern Washington,25,27,16,5,0,Chris Bowling missed Three Point Jumper.
Northern Arizona,Eastern Washington,25,27,16,5,0,Bogdan Bliznyuk Defensive Rebound.
Northern Arizona,Eastern Washington,25,27,16,16,0,Foul on Marcus DeBerry.
Northern Arizona,Eastern Washington,25,27,16,16,0,Official TV Timeout
Northern Arizona,Eastern Washington,25,27,16,24,0,Bogdan Bliznyuk missed Jumper.
Northern Arizona,Eastern Washington,25,27,16,24,0,Aziz Seck Defensive Rebound.
Northern Arizona,Eastern Washington,25,27,16,24,0,Foul on Sir Washington.
Northern Arizona,Eastern Washington,26,27,16,24,1,Jordyn Martin made Free Throw.
Northern Arizona,Eastern Washington,26,27,16,24,0,Jordyn Martin missed Free Throw.
Northern Arizona,Eastern Washington,26,27,16,24,0,Jacob Wiley Defensive Rebound.
Northern Arizona,Eastern Washington,26,30,16,34,1,Cody Benzel made Three Point Jumper. Assisted by Bogdan Bliznyuk.
Northern Arizona,Eastern Washington,26,30,16,52,0,Foul on Bogdan Bliznyuk.
Northern Arizona,Eastern Washington,26,30,16,52,0,Ako Kaluna missed Free Throw.
Northern Arizona,Eastern Washington,26,30,16,52,0,Northern Arizona Deadball Team Rebound.
Northern Arizona,Eastern Washington,27,30,16,52,1,Ako Kaluna made Free Throw.
Northern Arizona,Eastern Washington,27,30,17,18,0,Bogdan Bliznyuk missed Three Point Jumper.
Northern Arizona,Eastern Washington,27,30,17,18,0,JoJo Anderson Defensive Rebound.
Northern Arizona,Eastern Washington,27,30,17,39,0,Jordyn Martin missed Three Point Jumper.
Northern Arizona,Eastern Washington,27,30,17,39,0,Steven Stanley Offensive Rebound.
Northern Arizona,Eastern Washington,27,30,17,53,0,Jordyn Martin Turnover.
Northern Arizona,Eastern Washington,27,30,17,54,0,Bogdan Bliznyuk Steal.
Northern Arizona,Eastern Washington,27,32,18,7,1,Luka Vulikic made Layup. Assisted by Jacob Wiley.
Northern Arizona,Eastern Washington,29,32,18,23,1,Mike Green made Jumper. Assisted by Kye de Laveaga.
Northern Arizona,Eastern Washington,29,32,18,51,0,Foul on Jordyn Martin.
Northern Arizona,Eastern Washington,29,33,18,51,1,Jacob Wiley made Free Throw.
Northern Arizona,Eastern Washington,29,34,18,51,1,Jacob Wiley made Free Throw.
Northern Arizona,Eastern Washington,29,34,18,59,0,Mike Green Turnover.
Northern Arizona,Eastern Washington,29,34,19,1,0,Cody Benzel Steal.
Northern Arizona,Eastern Washington,29,36,19,2,1,Cody Benzel made Layup.
Northern Arizona,Eastern Washington,29,36,19,2,0,Foul on Kye de Laveaga.
Northern Arizona,Eastern Washington,29,37,19,2,1,Cody Benzel made Free Throw.
Northern Arizona,Eastern Washington,29,37,19,18,0,Chris Bowling missed Jumper.
Northern Arizona,Eastern Washington,29,37,19,18,0,Ty Gibson Defensive Rebound.
Northern Arizona,Eastern Washington,29,37,19,35,0,Mason Peatling missed Three Point Jumper.
Northern Arizona,Eastern Washington,29,37,19,35,0,Chris Bowling Defensive Rebound.
Northern Arizona,Eastern Washington,31,37,19,52,1,Mike Green made Jumper.
Northern Arizona,Eastern Washington,31,37,20,0,0,Felix Von Hofe missed Three Point Jumper.
Northern Arizona,Eastern Washington,31,37,20,0,0,Eastern Washington Deadball Team Rebound.
Northern Arizona,Eastern Washington,31,37,20,0,0,End of 1st half
Northern Arizona,Eastern Washington,33,37,20,18,1,Ako Kaluna made Jumper.
Northern Arizona,Eastern Washington,33,39,20,33,1,Luka Vulikic made Layup.
Northern Arizona,Eastern Washington,33,39,20,49,0,Mike Green missed Jumper.
Northern Arizona,Eastern Washington,33,39,20,49,0,Jacob Wiley Block.
Northern Arizona,Eastern Washington,33,39,20,51,0,Jacob Wiley Defensive Rebound.
Northern Arizona,Eastern Washington,33,41,20,54,1,Jacob Wiley made Dunk. Assisted by Bogdan Bliznyuk.
Northern Arizona,Eastern Washington,33,41,20,57,0,Northern Arizona  Timeout
Northern Arizona,Eastern Washington,35,41,21,12,1,Ako Kaluna made Layup. Assisted by Mike Green.
Northern Arizona,Eastern Washington,35,43,21,31,1,Luka Vulikic made Dunk. Assisted by Jacob Wiley.
Northern Arizona,Eastern Washington,35,43,21,49,0,Kye de Laveaga Turnover.
Northern Arizona,Eastern Washington,35,43,21,50,0,Jacob Wiley Steal.
Northern Arizona,Eastern Washington,35,45,22,5,1,Bogdan Bliznyuk made Layup. Assisted by Mason Peatling.
Northern Arizona,Eastern Washington,35,45,22,5,0,Foul on Kye de Laveaga.
Northern Arizona,Eastern Washington,35,45,22,5,0,Bogdan Bliznyuk missed Free Throw.
Northern Arizona,Eastern Washington,35,45,22,5,0,Marcus DeBerry Defensive Rebound.
Northern Arizona,Eastern Washington,35,45,22,21,0,Mike Green Turnover.
Northern Arizona,Eastern Washington,35,47,22,38,1,Jacob Wiley made Jumper.
Northern Arizona,Eastern Washington,35,47,22,50,0,Chris Bowling Turnover.
Northern Arizona,Eastern Washington,35,47,22,51,0,Mason Peatling Steal.
Northern Arizona,Eastern Washington,35,47,23,7,0,Foul on Ako Kaluna.
Northern Arizona,Eastern Washington,35,47,23,7,0,Felix Von Hofe missed Free Throw.
Northern Arizona,Eastern Washington,35,47,23,7,0,Eastern Washington Deadball Team Rebound.
Northern Arizona,Eastern Washington,35,48,23,7,1,Felix Von Hofe made Free Throw.
Northern Arizona,Eastern Washington,35,48,23,17,0,Foul on Luka Vulikic.
Northern Arizona,Eastern Washington,35,48,23,24,0,Jordyn Martin missed Layup.
Northern Arizona,Eastern Washington,35,48,23,24,0,Jacob Wiley Block.
Northern Arizona,Eastern Washington,35,48,23,25,0,Bogdan Bliznyuk Defensive Rebound.
Northern Arizona,Eastern Washington,35,50,23,43,1,Mason Peatling made Layup. Assisted by Jacob Wiley.
Northern Arizona,Eastern Washington,38,50,24,1,1,Marcus DeBerry made Three Point Jumper.
Northern Arizona,Eastern Washington,38,50,24,2,0,Official TV Timeout
Northern Arizona,Eastern Washington,38,52,24,23,1,Jacob Wiley made Jumper.
Northern Arizona,Eastern Washington,38,52,24,39,0,Foul on Jordyn Martin.
Northern Arizona,Eastern Washington,38,52,24,39,0,Jordyn Martin Turnover.
Northern Arizona,Eastern Washington,38,54,24,56,1,Mason Peatling made Layup. Assisted by Jacob Wiley.
Northern Arizona,Eastern Washington,41,54,25,10,1,Marcus DeBerry made Three Point Jumper. Assisted by Mike Green.
Northern Arizona,Eastern Washington,41,56,25,26,1,Jacob Wiley made Jumper.
Northern Arizona,Eastern Washington,41,56,25,41,0,Mike Green missed Jumper.
Northern Arizona,Eastern Washington,41,56,25,41,0,Jacob Wiley Block.
Northern Arizona,Eastern Washington,41,56,25,42,0,Mason Peatling Defensive Rebound.
Northern Arizona,Eastern Washington,41,56,25,56,0,Foul on Chris Bowling.
Northern Arizona,Eastern Washington,41,56,26,11,0,Jacob Wiley Turnover.
Northern Arizona,Eastern Washington,44,56,26,41,1,Mike Green made Three Point Jumper.
Northern Arizona,Eastern Washington,44,56,26,58,0,Mason Peatling Turnover.
Northern Arizona,Eastern Washington,44,56,27,19,0,Mike Green Turnover.
Northern Arizona,Eastern Washington,44,59,27,30,1,Ty Gibson made Three Point Jumper. Assisted by Sir Washington.
Northern Arizona,Eastern Washington,44,59,27,54,0,Corey Brown missed Jumper.
Northern Arizona,Eastern Washington,44,59,27,54,0,Corey Brown Offensive Rebound.
Northern Arizona,Eastern Washington,44,59,28,2,0,Marcus DeBerry missed Three Point Jumper.
Northern Arizona,Eastern Washington,44,59,28,2,0,Sir Washington Defensive Rebound.
Northern Arizona,Eastern Washington,44,59,28,10,0,Ty Gibson missed Layup.
Northern Arizona,Eastern Washington,44,59,28,10,0,Jacob Wiley Offensive Rebound.
Northern Arizona,Eastern Washington,44,61,28,13,1,Jacob Wiley made Layup.
Northern Arizona,Eastern Washington,44,61,28,40,0,Foul on Ty Gibson.
Northern Arizona,Eastern Washington,44,61,28,40,0,Official TV Timeout
Northern Arizona,Eastern Washington,44,61,28,50,0,Foul on Cody Benzel.
Northern Arizona,Eastern Washington,46,61,29,0,1,Mike Green made Layup.
Northern Arizona,Eastern Washington,46,61,29,26,0,Jacob Wiley missed Jumper.
Northern Arizona,Eastern Washington,46,61,29,26,0,Marcus DeBerry Defensive Rebound.
Northern Arizona,Eastern Washington,46,61,29,50,0,Jordyn Martin missed Jumper.
Northern Arizona,Eastern Washington,46,61,29,50,0,Jacob Wiley Defensive Rebound.
Northern Arizona,Eastern Washington,46,63,30,7,1,Jacob Wiley made Layup.
Northern Arizona,Eastern Washington,46,63,30,15,0,Foul on Sir Washington.
Northern Arizona,Eastern Washington,46,63,30,15,0,JoJo Anderson missed Free Throw.
Northern Arizona,Eastern Washington,46,63,30,15,0,Northern Arizona Deadball Team Rebound.
Northern Arizona,Eastern Washington,47,63,30,15,1,JoJo Anderson made Free Throw.
Northern Arizona,Eastern Washington,47,63,30,31,0,Foul on Corey Brown.
Northern Arizona,Eastern Washington,47,65,30,52,1,Jacob Wiley made Dunk.
Northern Arizona,Eastern Washington,47,65,31,4,0,Foul on Jesse Hunt.
Northern Arizona,Eastern Washington,47,65,31,11,0,Foul on Ty Gibson.
Northern Arizona,Eastern Washington,47,65,31,15,0,Marcus DeBerry missed Jumper.
Northern Arizona,Eastern Washington,47,65,31,15,0,Jacob Wiley Defensive Rebound.
Northern Arizona,Eastern Washington,47,65,31,28,0,Jesse Hunt missed Three Point Jumper.
Northern Arizona,Eastern Washington,47,65,31,28,0,Corey Brown Defensive Rebound.
Northern Arizona,Eastern Washington,47,65,31,36,0,JoJo Anderson missed Jumper.
Northern Arizona,Eastern Washington,47,65,31,36,0,Jesse Hunt Block.
Northern Arizona,Eastern Washington,47,65,31,38,0,JoJo Anderson Offensive Rebound.
Northern Arizona,Eastern Washington,47,65,31,39,0,JoJo Anderson missed Jumper.
Northern Arizona,Eastern Washington,47,65,31,39,0,Mario Soto Defensive Rebound.
Northern Arizona,Eastern Washington,47,67,31,46,1,Jacob Wiley made Layup. Assisted by Bogdan Bliznyuk.
Northern Arizona,Eastern Washington,47,67,31,46,0,Official TV Timeout
Northern Arizona,Eastern Washington,49,67,31,58,1,Marcus DeBerry made Jumper.
Northern Arizona,Eastern Washington,49,67,31,58,0,Foul on Felix Von Hofe.
Northern Arizona,Eastern Washington,49,67,31,58,0,Marcus DeBerry missed Free Throw.
Northern Arizona,Eastern Washington,49,67,31,58,0,Jesse Hunt Defensive Rebound.
Northern Arizona,Eastern Washington,49,67,32,27,0,Jesse Hunt missed Jumper.
Northern Arizona,Eastern Washington,49,67,32,27,0,Mason Peatling Offensive Rebound.
Northern Arizona,Eastern Washington,49,69,32,30,1,Mason Peatling made Layup.
Northern Arizona,Eastern Washington,49,69,33,0,0,Foul on Corey Brown.
Northern Arizona,Eastern Washington,49,69,33,0,0,Corey Brown Turnover.
Northern Arizona,Eastern Washington,49,69,33,18,0,Mason Peatling missed Layup.
Northern Arizona,Eastern Washington,49,69,33,18,0,Mason Peatling Offensive Rebound.
Northern Arizona,Eastern Washington,49,72,33,22,1,Mario Soto made Three Point Jumper. Assisted by Mason Peatling.
Northern Arizona,Eastern Washington,49,72,33,38,0,Foul on Mason Peatling.
Northern Arizona,Eastern Washington,50,72,33,38,1,Mike Green made Free Throw.
Northern Arizona,Eastern Washington,51,72,33,38,1,Mike Green made Free Throw.
Northern Arizona,Eastern Washington,51,72,34,5,0,Felix Von Hofe missed Jumper.
Northern Arizona,Eastern Washington,51,72,34,5,0,Mike Green Defensive Rebound.
Northern Arizona,Eastern Washington,51,72,34,28,0,Ako Kaluna missed Jumper.
Northern Arizona,Eastern Washington,51,72,34,28,0,Ako Kaluna Offensive Rebound.
Northern Arizona,Eastern Washington,51,72,34,28,0,Foul on Jesse Hunt.
Northern Arizona,Eastern Washington,51,72,34,28,0,Ako Kaluna missed Free Throw.
Northern Arizona,Eastern Washington,51,72,34,28,0,Northern Arizona Deadball Team Rebound.
Northern Arizona,Eastern Washington,52,72,34,28,1,Ako Kaluna made Free Throw.
Northern Arizona,Eastern Washington,52,74,34,49,1,Mason Peatling made Layup.
Northern Arizona,Eastern Washington,52,74,34,49,0,Foul on Ako Kaluna.
Northern Arizona,Eastern Washington,52,74,34,49,0,Mason Peatling missed Free Throw.
Northern Arizona,Eastern Washington,52,74,34,49,0,Jordyn Martin Defensive Rebound.
Northern Arizona,Eastern Washington,52,74,35,3,0,Ako Kaluna missed Layup.
Northern Arizona,Eastern Washington,52,74,35,3,0,Jesse Hunt Block.
Northern Arizona,Eastern Washington,52,74,35,3,0,Northern Arizona Offensive Rebound.
Northern Arizona,Eastern Washington,52,74,35,9,0,Foul on Jesse Hunt.
Northern Arizona,Eastern Washington,53,74,35,9,1,Jordyn Martin made Free Throw.
Northern Arizona,Eastern Washington,54,74,35,9,1,Jordyn Martin made Free Throw.
Northern Arizona,Eastern Washington,54,74,35,16,0,Eastern Washington  Timeout
Northern Arizona,Eastern Washington,54,74,35,33,0,Foul on Ako Kaluna.
Northern Arizona,Eastern Washington,54,75,35,33,1,Jesse Hunt made Free Throw.
Northern Arizona,Eastern Washington,54,76,35,33,1,Jesse Hunt made Free Throw.
Northern Arizona,Eastern Washington,54,76,35,50,0,Ako Kaluna missed Three Point Jumper.
Northern Arizona,Eastern Washington,54,76,35,50,0,Jordyn Martin Offensive Rebound.
Northern Arizona,Eastern Washington,54,76,36,1,0,Mike Green Turnover.
Northern Arizona,Eastern Washington,54,76,36,2,0,Luka Vulikic Steal.
Northern Arizona,Eastern Washington,54,78,36,6,1,Jesse Hunt made Layup. Assisted by Luka Vulikic.
Northern Arizona,Eastern Washington,54,78,36,14,0,Foul on Sir Washington.
Northern Arizona,Eastern Washington,54,78,36,14,0,Official TV Timeout
Northern Arizona,Eastern Washington,54,78,36,14,0,Mike Green missed Free Throw.
Northern Arizona,Eastern Washington,54,78,36,14,0,Northern Arizona Deadball Team Rebound.
Northern Arizona,Eastern Washington,55,78,36,14,1,Mike Green made Free Throw.
Northern Arizona,Eastern Washington,55,78,36,41,0,Mario Soto missed Three Point Jumper.
Northern Arizona,Eastern Washington,55,78,36,41,0,Mike Green Defensive Rebound.
Northern Arizona,Eastern Washington,55,78,36,47,0,Mike Green missed Layup.
Northern Arizona,Eastern Washington,55,78,36,47,0,Sir Washington Defensive Rebound.
Northern Arizona,Eastern Washington,55,78,36,54,0,Jesse Hunt missed Layup.
Northern Arizona,Eastern Washington,55,78,36,54,0,Mason Peatling Offensive Rebound.
Northern Arizona,Eastern Washington,55,78,36,56,0,Mason Peatling missed Layup.
Northern Arizona,Eastern Washington,55,78,36,56,0,Eastern Washington Offensive Rebound.
Northern Arizona,Eastern Washington,55,78,37,17,0,Mason Peatling Turnover.
Northern Arizona,Eastern Washington,55,78,37,27,0,Mike Green Turnover.
Northern Arizona,Eastern Washington,55,78,37,28,0,Mason Peatling Steal.
Northern Arizona,Eastern Washington,55,78,37,34,0,Sir Washington missed Dunk.
Northern Arizona,Eastern Washington,55,78,37,34,0,Ako Kaluna Defensive Rebound.
Northern Arizona,Eastern Washington,55,78,37,43,0,Chris Bowling missed Three Point Jumper.
Northern Arizona,Eastern Washington,55,78,37,43,0,Mario Soto Defensive Rebound.
Northern Arizona,Eastern Washington,55,78,38,0,0,Foul on Chris Bowling.
Northern Arizona,Eastern Washington,55,79,38,0,1,Luka Vulikic made Free Throw.
Northern Arizona,Eastern Washington,55,79,38,0,0,Luka Vulikic missed Free Throw.
Northern Arizona,Eastern Washington,55,79,38,0,0,Aziz Seck Defensive Rebound.
Northern Arizona,Eastern Washington,55,79,38,15,0,Brooks DeBisschop Turnover.
Northern Arizona,Eastern Washington,55,79,38,15,0,Grant Gibb Steal.
Northern Arizona,Eastern Washington,55,79,38,23,0,Foul on Brooks DeBisschop.
Northern Arizona,Eastern Washington,55,80,38,23,1,Grant Gibb made Free Throw.
Northern Arizona,Eastern Washington,55,80,38,23,0,Grant Gibb missed Free Throw.
Northern Arizona,Eastern Washington,55,80,38,23,0,Jordyn Martin Defensive Rebound.
Northern Arizona,Eastern Washington,57,80,38,32,1,Aziz Seck made Layup. Assisted by JoJo Anderson.
Northern Arizona,Eastern Washington,57,80,38,42,0,Mario Soto missed Layup.
Northern Arizona,Eastern Washington,57,80,38,42,0,Aziz Seck Block.
Northern Arizona,Eastern Washington,57,80,38,44,0,Mason Peatling Offensive Rebound.
Northern Arizona,Eastern Washington,57,82,38,46,1,Mason Peatling made Layup.
Northern Arizona,Eastern Washington,59,82,39,0,1,Aziz Seck made Layup.
Northern Arizona,Eastern Washington,59,82,39,14,0,Mario Soto Turnover.
Northern Arizona,Eastern Washington,59,82,39,16,0,Kye de Laveaga Steal.
Northern Arizona,Eastern Washington,61,82,39,18,1,Steven Stanley made Layup. Assisted by JoJo Anderson.
Northern Arizona,Eastern Washington,61,82,39,33,0,Grant Gibb missed Jumper.
Northern Arizona,Eastern Washington,61,82,39,33,0,Luka Vulikic Offensive Rebound.
Northern Arizona,Eastern Washington,61,84,39,35,1,Luka Vulikic made Layup.
Northern Arizona,Eastern Washington,61,84,39,46,0,Foul on Michael Wearne.
Northern Arizona,Eastern Washington,62,84,39,46,1,JoJo Anderson made Free Throw.
Northern Arizona,Eastern Washington,62,84,39,46,0,JoJo Anderson missed Free Throw.
Northern Arizona,Eastern Washington,62,84,39,46,0,Grant Gibb Defensive Rebound.
Northern Arizona,Eastern Washington,62,84,40,0,0,End of Game
