Away Team,Home Team,Away Score,Home Score,Minute,Second,isScoringPosession,Desc.
Pennsylvania,Princeton,0,0,0,9,0,Spencer Weisz Turnover.
Pennsylvania,Princeton,0,0,0,9,0,Matt Howard Steal.
Pennsylvania,Princeton,2,0,0,32,1,Darien Nelson-Henry made Layup.
Pennsylvania,Princeton,2,0,0,43,0,Steven Cook Turnover.
Pennsylvania,Princeton,2,0,0,56,0,Matt Howard missed Three Point Jumper.
Pennsylvania,Princeton,2,0,0,56,0,Amir Bell Defensive Rebound.
Pennsylvania,Princeton,2,2,1,10,1,Spencer Weisz made Layup. Assisted by Steven Cook.
Pennsylvania,Princeton,4,2,1,40,1,Jackson Donahue made Jumper.
Pennsylvania,Princeton,4,5,1,55,1,Henry Caruso made Three Point Jumper. Assisted by Pete Miller.
Pennsylvania,Princeton,4,5,2,17,0,Jackson Donahue missed Layup.
Pennsylvania,Princeton,4,5,2,17,0,Tyler Hamilton Offensive Rebound.
Pennsylvania,Princeton,4,5,2,30,0,Pennsylvania  Turnover.
Pennsylvania,Princeton,4,5,2,45,0,Spencer Weisz Turnover.
Pennsylvania,Princeton,6,5,2,57,1,Darien Nelson-Henry made Layup. Assisted by Jackson Donahue.
Pennsylvania,Princeton,6,5,3,12,0,Henry Caruso missed Jumper.
Pennsylvania,Princeton,6,5,3,12,0,Jackson Donahue Defensive Rebound.
Pennsylvania,Princeton,8,5,3,25,1,Darien Nelson-Henry made Layup. Assisted by Jake Silpe.
Pennsylvania,Princeton,8,7,3,43,1,Pete Miller made Layup.
Pennsylvania,Princeton,8,7,3,58,0,Matt Howard missed Layup.
Pennsylvania,Princeton,8,7,3,58,0,Pete Miller Defensive Rebound.
Pennsylvania,Princeton,8,7,4,9,0,Amir Bell missed Three Point Jumper.
Pennsylvania,Princeton,8,7,4,9,0,Princeton Offensive Rebound.
Pennsylvania,Princeton,8,7,4,11,0,Official TV Timeout
Pennsylvania,Princeton,8,9,4,25,1,Spencer Weisz made Jumper.
Pennsylvania,Princeton,8,9,4,46,0,Darien Nelson-Henry Turnover.
Pennsylvania,Princeton,8,9,4,47,0,Alec Brennan Steal.
Pennsylvania,Princeton,8,9,4,51,0,Spencer Weisz missed Three Point Jumper.
Pennsylvania,Princeton,8,9,4,51,0,Tyler Hamilton Defensive Rebound.
Pennsylvania,Princeton,8,9,5,12,0,Foul on Steven Cook.
Pennsylvania,Princeton,8,9,5,26,0,Tyler Hamilton missed Three Point Jumper.
Pennsylvania,Princeton,8,9,5,26,0,Steven Cook Defensive Rebound.
Pennsylvania,Princeton,8,9,5,45,0,Amir Bell missed Layup.
Pennsylvania,Princeton,8,9,5,45,0,Pennsylvania Defensive Rebound.
Pennsylvania,Princeton,8,9,6,8,0,Jackson Donahue missed Three Point Jumper.
Pennsylvania,Princeton,8,9,6,8,0,Myles Stephens Defensive Rebound.
Pennsylvania,Princeton,8,11,6,26,1,Steven Cook made Jumper.
Pennsylvania,Princeton,8,11,6,42,0,Darnell Foreman missed Layup.
Pennsylvania,Princeton,8,11,6,42,0,Max Rothschild Offensive Rebound.
Pennsylvania,Princeton,10,11,6,44,1,Max Rothschild made Layup.
Pennsylvania,Princeton,10,11,7,1,0,Myles Stephens Turnover.
Pennsylvania,Princeton,10,11,7,1,0,Tyler Hamilton Steal.
Pennsylvania,Princeton,10,11,7,14,0,Jackson Donahue missed Three Point Jumper.
Pennsylvania,Princeton,10,11,7,14,0,Steven Cook Defensive Rebound.
Pennsylvania,Princeton,10,11,7,24,0,Foul on Jackson Donahue.
Pennsylvania,Princeton,10,11,7,33,0,Foul on Myles Stephens.
Pennsylvania,Princeton,10,11,7,33,0,Myles Stephens Turnover.
Pennsylvania,Princeton,10,11,7,43,0,Darnell Foreman missed Layup.
Pennsylvania,Princeton,10,11,7,43,0,Henry Caruso Defensive Rebound.
Pennsylvania,Princeton,10,11,7,44,0,Foul on Max Rothschild.
Pennsylvania,Princeton,10,11,7,53,0,Steven Cook missed Three Point Jumper.
Pennsylvania,Princeton,10,11,7,53,0,Myles Stephens Offensive Rebound.
Pennsylvania,Princeton,10,13,7,56,1,Myles Stephens made Layup.
Pennsylvania,Princeton,10,13,8,17,0,Foul on Max Rothschild.
Pennsylvania,Princeton,10,13,8,17,0,Max Rothschild Turnover.
Pennsylvania,Princeton,10,13,8,17,0,Official TV Timeout
Pennsylvania,Princeton,10,15,8,35,1,Henry Caruso made Jumper.
Pennsylvania,Princeton,10,15,8,51,0,Matt Howard Turnover.
Pennsylvania,Princeton,10,15,8,52,0,Devin Cannady Steal.
Pennsylvania,Princeton,10,15,8,56,0,Devin Cannady missed Layup.
Pennsylvania,Princeton,10,15,8,56,0,Henry Caruso Offensive Rebound.
Pennsylvania,Princeton,10,15,8,59,0,Foul on Dan Dwyer.
Pennsylvania,Princeton,10,16,8,59,1,Steven Cook made Free Throw.
Pennsylvania,Princeton,10,17,8,59,1,Steven Cook made Free Throw.
Pennsylvania,Princeton,10,17,9,18,0,Foul on Henry Caruso.
Pennsylvania,Princeton,10,17,9,23,0,Darien Nelson-Henry missed Layup.
Pennsylvania,Princeton,10,17,9,23,0,Pete Miller Defensive Rebound.
Pennsylvania,Princeton,10,17,9,44,0,Henry Caruso missed Jumper.
Pennsylvania,Princeton,10,17,9,44,0,Pete Miller Offensive Rebound.
Pennsylvania,Princeton,10,19,9,46,1,Pete Miller made Layup.
Pennsylvania,Princeton,10,19,10,1,0,Foul on Jake Silpe.
Pennsylvania,Princeton,10,19,10,1,0,Jake Silpe Turnover.
Pennsylvania,Princeton,10,22,10,15,1,Devin Cannady made Three Point Jumper. Assisted by Spencer Weisz.
Pennsylvania,Princeton,10,22,10,19,0,Pennsylvania  Timeout
Pennsylvania,Princeton,10,22,10,39,0,Darien Nelson-Henry Turnover.
Pennsylvania,Princeton,10,22,10,55,0,Foul on Jake Silpe.
Pennsylvania,Princeton,10,23,10,55,1,Devin Cannady made Free Throw.
Pennsylvania,Princeton,10,24,10,55,1,Devin Cannady made Free Throw.
Pennsylvania,Princeton,12,24,11,5,1,Matt Howard made Layup.
Pennsylvania,Princeton,12,24,11,24,0,Foul on Tyler Hamilton.
Pennsylvania,Princeton,12,25,11,24,1,Spencer Weisz made Free Throw.
Pennsylvania,Princeton,12,26,11,24,1,Spencer Weisz made Free Throw.
Pennsylvania,Princeton,12,26,11,36,0,Foul on Devin Cannady.
Pennsylvania,Princeton,13,26,11,36,1,Matt Howard made Free Throw.
Pennsylvania,Princeton,14,26,11,36,1,Matt Howard made Free Throw.
Pennsylvania,Princeton,14,26,11,41,0,Foul on Amir Bell.
Pennsylvania,Princeton,14,26,11,41,0,Amir Bell Turnover.
Pennsylvania,Princeton,14,26,12,6,0,Darnell Foreman missed Layup.
Pennsylvania,Princeton,14,26,12,6,0,Pete Miller Defensive Rebound.
Pennsylvania,Princeton,14,26,12,16,0,Foul on Steven Cook.
Pennsylvania,Princeton,14,26,12,16,0,Steven Cook Turnover.
Pennsylvania,Princeton,14,26,12,16,0,Official TV Timeout
Pennsylvania,Princeton,14,26,12,39,0,Tyler Hamilton Turnover.
Pennsylvania,Princeton,14,26,12,41,0,Myles Stephens Steal.
Pennsylvania,Princeton,14,26,12,41,0,Foul on Darnell Foreman.
Pennsylvania,Princeton,14,26,12,41,0,Amir Bell missed Free Throw.
Pennsylvania,Princeton,14,26,12,41,0,Darien Nelson-Henry Defensive Rebound.
Pennsylvania,Princeton,14,26,12,57,0,Matt Howard missed Layup.
Pennsylvania,Princeton,14,26,12,57,0,Matt Howard Offensive Rebound.
Pennsylvania,Princeton,14,26,13,0,0,Darnell Foreman missed Three Point Jumper.
Pennsylvania,Princeton,14,26,13,0,0,Matt Howard Offensive Rebound.
Pennsylvania,Princeton,14,26,13,10,0,Foul on Jackson Donahue.
Pennsylvania,Princeton,14,26,13,10,0,Jackson Donahue Turnover.
Pennsylvania,Princeton,14,26,13,22,0,Alec Brennan missed Three Point Jumper.
Pennsylvania,Princeton,14,26,13,22,0,Jamal Lewis Defensive Rebound.
Pennsylvania,Princeton,14,26,13,32,0,Darnell Foreman missed Layup.
Pennsylvania,Princeton,14,26,13,32,0,Alec Brennan Defensive Rebound.
Pennsylvania,Princeton,14,26,13,48,0,Devin Cannady missed Layup.
Pennsylvania,Princeton,14,26,13,48,0,Darien Nelson-Henry Defensive Rebound.
Pennsylvania,Princeton,14,26,14,4,0,Darien Nelson-Henry Turnover.
Pennsylvania,Princeton,14,26,14,5,0,Devin Cannady Steal.
Pennsylvania,Princeton,14,26,14,10,0,Henry Caruso missed Layup.
Pennsylvania,Princeton,14,26,14,10,0,Henry Caruso Offensive Rebound.
Pennsylvania,Princeton,14,26,14,14,0,Henry Caruso missed Layup.
Pennsylvania,Princeton,14,26,14,14,0,Darnell Foreman Defensive Rebound.
Pennsylvania,Princeton,17,26,14,33,1,Matt Howard made Three Point Jumper. Assisted by Darnell Foreman.
Pennsylvania,Princeton,17,26,14,35,0,Princeton  Timeout
Pennsylvania,Princeton,17,26,14,49,0,Amir Bell Turnover.
Pennsylvania,Princeton,17,26,14,50,0,Darnell Foreman Steal.
Pennsylvania,Princeton,17,26,15,2,0,Jake Silpe Turnover.
Pennsylvania,Princeton,17,26,15,3,0,Henry Caruso Steal.
Pennsylvania,Princeton,17,28,15,20,1,Amir Bell made Jumper.
Pennsylvania,Princeton,17,28,15,39,0,Tyler Hamilton missed Three Point Jumper.
Pennsylvania,Princeton,17,28,15,39,0,Henry Caruso Defensive Rebound.
Pennsylvania,Princeton,17,28,15,56,0,Spencer Weisz missed Layup.
Pennsylvania,Princeton,17,28,15,56,0,Sam Jones Defensive Rebound.
Pennsylvania,Princeton,19,28,16,16,1,Jake Silpe made Layup.
Pennsylvania,Princeton,19,28,16,33,0,Pete Miller missed Layup.
Pennsylvania,Princeton,19,28,16,33,0,Darien Nelson-Henry Defensive Rebound.
Pennsylvania,Princeton,19,28,16,33,0,Official TV Timeout
Pennsylvania,Princeton,19,28,16,41,0,Tyler Hamilton missed Layup.
Pennsylvania,Princeton,19,28,16,41,0,Pete Miller Block.
Pennsylvania,Princeton,19,28,16,43,0,Darien Nelson-Henry Offensive Rebound.
Pennsylvania,Princeton,21,28,16,45,1,Darien Nelson-Henry made Layup.
Pennsylvania,Princeton,21,28,17,0,0,Amir Bell missed Jumper.
Pennsylvania,Princeton,21,28,17,0,0,Darien Nelson-Henry Defensive Rebound.
Pennsylvania,Princeton,21,28,17,17,0,Matt Howard missed Layup.
Pennsylvania,Princeton,21,28,17,17,0,Pete Miller Block.
Pennsylvania,Princeton,21,28,17,18,0,Matt Howard Offensive Rebound.
Pennsylvania,Princeton,21,28,17,23,0,Foul on Darnell Foreman.
Pennsylvania,Princeton,21,28,17,23,0,Darnell Foreman Turnover.
Pennsylvania,Princeton,21,28,17,34,0,Devin Cannady Turnover.
Pennsylvania,Princeton,21,28,17,35,0,Matt Howard Steal.
Pennsylvania,Princeton,23,28,17,37,1,Tyler Hamilton made Layup.
Pennsylvania,Princeton,23,31,17,55,1,Myles Stephens made Three Point Jumper. Assisted by Amir Bell.
Pennsylvania,Princeton,23,31,18,19,0,Jamal Lewis missed Layup.
Pennsylvania,Princeton,23,31,18,19,0,Princeton Defensive Rebound.
Pennsylvania,Princeton,23,31,18,26,0,Foul on Amir Bell.
Pennsylvania,Princeton,23,31,18,26,0,Amir Bell Turnover.
Pennsylvania,Princeton,25,31,18,36,1,Jackson Donahue made Layup.
Pennsylvania,Princeton,25,31,18,46,0,Myles Stephens Turnover.
Pennsylvania,Princeton,25,31,18,47,0,Matt Howard Steal.
Pennsylvania,Princeton,25,31,18,51,0,Tyler Hamilton missed Layup.
Pennsylvania,Princeton,25,31,18,51,0,Pete Miller Defensive Rebound.
Pennsylvania,Princeton,25,34,19,9,1,Spencer Weisz made Three Point Jumper. Assisted by Devin Cannady.
Pennsylvania,Princeton,25,34,19,38,0,Darien Nelson-Henry Turnover.
Pennsylvania,Princeton,25,34,19,39,0,Henry Caruso Steal.
Pennsylvania,Princeton,25,36,19,58,1,Pete Miller made Layup. Assisted by Spencer Weisz.
Pennsylvania,Princeton,25,36,20,0,0,End of 1st half
