Away Team,Home Team,Away Score,Home Score,Minute,Second,isScoringPosession,Desc.
Stephen F. Austin,Appalachian State,94,79,39,11,0,Ty Charles Turnover.
Stephen F. Austin,Appalachian State,94,79,39,13,0,Griffin Kinney Steal.
Stephen F. Austin,Appalachian State,94,81,39,15,1,Griffin Kinney made Layup.
Stephen F. Austin,Appalachian State,94,81,39,15,0,Foul on Thomas Walkup.
Stephen F. Austin,Appalachian State,94,82,39,15,1,Griffin Kinney made Free Throw.
Stephen F. Austin,Appalachian State,94,82,39,19,0,Foul on Emarius Logan.
Stephen F. Austin,Appalachian State,94,82,39,19,0,Trey Pinkney missed Free Throw.
Stephen F. Austin,Appalachian State,94,82,39,19,0,Stephen F. Austin Deadball Team Rebound.
Stephen F. Austin,Appalachian State,94,82,39,19,0,Trey Pinkney missed Free Throw.
Stephen F. Austin,Appalachian State,94,82,39,19,0,Griffin Kinney Defensive Rebound.
Stephen F. Austin,Appalachian State,94,84,39,34,1,Griffin Kinney made Jumper. Assisted by Dustin Clarke.
Stephen F. Austin,Appalachian State,94,84,40,0,0,End of Game
