Away Team,Home Team,Away Score,Home Score,Minute,Second,isScoringPosession,Desc.
Stephen F. Austin,Appalachian State,0,2,0,26,1,Chris Burgess made Jumper.
Stephen F. Austin,Appalachian State,0,2,0,48,0,Foul on Frank Eaves.
Stephen F. Austin,Appalachian State,1,2,0,48,1,T.J. Holyfield made Free Throw.
Stephen F. Austin,Appalachian State,2,2,0,48,1,T.J. Holyfield made Free Throw.
Stephen F. Austin,Appalachian State,2,2,0,49,0,Appalachian St  Turnover.
Stephen F. Austin,Appalachian State,2,2,0,51,0,T.J. Holyfield missed Three Point Jumper.
Stephen F. Austin,Appalachian State,2,2,0,51,0,Thomas Walkup Offensive Rebound.
Stephen F. Austin,Appalachian State,4,2,0,55,1,Thomas Walkup made Layup.
Stephen F. Austin,Appalachian State,4,2,1,34,0,Frank Eaves missed Layup.
Stephen F. Austin,Appalachian State,4,2,1,34,0,T.J. Holyfield Block.
Stephen F. Austin,Appalachian State,4,2,1,34,0,Appalachian St Offensive Rebound.
Stephen F. Austin,Appalachian State,4,2,1,35,0,Ronshad Shabazz missed Three Point Jumper.
Stephen F. Austin,Appalachian State,4,2,1,35,0,Ty Charles Defensive Rebound.
Stephen F. Austin,Appalachian State,6,2,1,50,1,T.J. Holyfield made Jumper. Assisted by Trey Pinkney.
Stephen F. Austin,Appalachian State,6,4,2,7,1,Jacob Lawson made Layup. Assisted by Griffin Kinney.
Stephen F. Austin,Appalachian State,6,4,2,23,0,Foul on Jacob Lawson.
Stephen F. Austin,Appalachian State,6,4,2,23,0,Thomas Walkup missed Free Throw.
Stephen F. Austin,Appalachian State,6,4,2,23,0,Stephen F. Austin Deadball Team Rebound.
Stephen F. Austin,Appalachian State,7,4,2,23,1,Thomas Walkup made Free Throw.
Stephen F. Austin,Appalachian State,7,4,2,23,0,Foul on Jacob Lawson.
Stephen F. Austin,Appalachian State,7,4,2,23,0,Jacob Lawson Turnover.
Stephen F. Austin,Appalachian State,9,4,2,25,1,Ty Charles made Layup. Assisted by Thomas Walkup.
Stephen F. Austin,Appalachian State,9,6,2,55,1,Chris Burgess made Layup. Assisted by Frank Eaves.
Stephen F. Austin,Appalachian State,9,6,3,14,0,Ty Charles missed Jumper.
Stephen F. Austin,Appalachian State,9,6,3,14,0,Griffin Kinney Defensive Rebound.
Stephen F. Austin,Appalachian State,9,8,3,22,1,Frank Eaves made Jumper.
Stephen F. Austin,Appalachian State,9,8,3,48,0,Demetrious Floyd missed Three Point Jumper.
Stephen F. Austin,Appalachian State,9,8,3,48,0,Griffin Kinney Defensive Rebound.
Stephen F. Austin,Appalachian State,9,8,4,0,0,Foul on Trey Pinkney.
Stephen F. Austin,Appalachian State,53,48,4,20,0,Foul on Frank Eaves.
Stephen F. Austin,Appalachian State,9,10,4,21,1,Chris Burgess made Jumper. Assisted by Emarius Logan.
Stephen F. Austin,Appalachian State,11,10,4,47,1,Nathan Bain made Layup. Assisted by Dallas Cameron.
Stephen F. Austin,Appalachian State,11,12,4,59,1,Emarius Logan made Layup.
Stephen F. Austin,Appalachian State,11,12,4,59,0,Foul on Nathan Bain.
Stephen F. Austin,Appalachian State,11,13,4,59,1,Emarius Logan made Free Throw.
Stephen F. Austin,Appalachian State,13,13,5,14,1,T.J. Holyfield made Jumper. Assisted by Clide Geffrard.
Stephen F. Austin,Appalachian State,13,13,5,47,0,Frank Eaves missed Three Point Jumper.
Stephen F. Austin,Appalachian State,13,13,5,47,0,Dallas Cameron Defensive Rebound.
Stephen F. Austin,Appalachian State,13,13,5,52,0,Foul on Emarius Logan.
Stephen F. Austin,Appalachian State,13,13,5,52,0,Jared Johnson missed Free Throw.
Stephen F. Austin,Appalachian State,13,13,5,52,0,Stephen F. Austin Deadball Team Rebound.
Stephen F. Austin,Appalachian State,14,13,5,52,1,Jared Johnson made Free Throw.
Stephen F. Austin,Appalachian State,14,13,6,3,0,Frank Eaves Turnover.
Stephen F. Austin,Appalachian State,16,13,6,27,1,Clide Geffrard made Jumper. Assisted by Jovan Grujic.
Stephen F. Austin,Appalachian State,16,13,6,43,0,Foul on Clide Geffrard.
Stephen F. Austin,Appalachian State,16,13,6,45,0,Jake Babic Turnover.
Stephen F. Austin,Appalachian State,16,13,6,47,0,Ty Charles Steal.
Stephen F. Austin,Appalachian State,18,13,6,49,1,Thomas Walkup made Layup. Assisted by Ty Charles.
Stephen F. Austin,Appalachian State,18,13,7,1,0,Foul on Dallas Cameron.
Stephen F. Austin,Appalachian State,18,13,7,8,0,Foul on Dallas Cameron.
Stephen F. Austin,Appalachian State,18,15,7,19,1,Ronshad Shabazz made Jumper.
Stephen F. Austin,Appalachian State,21,15,7,27,1,Jared Johnson made Three Point Jumper. Assisted by Trey Pinkney.
Stephen F. Austin,Appalachian State,21,18,7,45,1,Ronshad Shabazz made Three Point Jumper. Assisted by Emarius Logan.
Stephen F. Austin,Appalachian State,23,18,8,2,1,Jared Johnson made Jumper.
Stephen F. Austin,Appalachian State,23,18,8,2,0,Foul on Emarius Logan.
Stephen F. Austin,Appalachian State,24,18,8,2,1,Jared Johnson made Free Throw.
Stephen F. Austin,Appalachian State,24,18,8,18,0,Chris Burgess Turnover.
Stephen F. Austin,Appalachian State,24,18,8,18,0,Foul on Chris Burgess.
Stephen F. Austin,Appalachian State,24,18,8,37,0,Trey Pinkney missed Three Point Jumper.
Stephen F. Austin,Appalachian State,24,18,8,37,0,Tyrell Johnson Defensive Rebound.
Stephen F. Austin,Appalachian State,24,20,8,52,1,Ronshad Shabazz made Jumper.
Stephen F. Austin,Appalachian State,24,20,9,20,0,Thomas Walkup missed Jumper.
Stephen F. Austin,Appalachian State,24,20,9,20,0,T.J. Holyfield Offensive Rebound.
Stephen F. Austin,Appalachian State,26,20,9,37,1,Clide Geffrard made Jumper.
Stephen F. Austin,Appalachian State,26,20,9,49,0,Ronshad Shabazz Turnover.
Stephen F. Austin,Appalachian State,26,20,9,51,0,Clide Geffrard Steal.
Stephen F. Austin,Appalachian State,28,20,10,5,1,Thomas Walkup made Layup. Assisted by Ty Charles.
Stephen F. Austin,Appalachian State,28,20,10,41,0,Foul on Trey Pinkney.
Stephen F. Austin,Appalachian State,28,22,11,0,1,Chris Burgess made Jumper.
Stephen F. Austin,Appalachian State,28,22,11,5,0,Foul on Matt O'Boyle.
Stephen F. Austin,Appalachian State,29,22,11,5,1,Nathan Bain made Free Throw.
Stephen F. Austin,Appalachian State,29,22,11,6,0,Nathan Bain missed Free Throw.
Stephen F. Austin,Appalachian State,29,22,11,6,0,T.J. Holyfield Offensive Rebound.
Stephen F. Austin,Appalachian State,29,22,11,6,0,Foul on Jacob Lawson.
Stephen F. Austin,Appalachian State,30,22,11,6,1,T.J. Holyfield made Free Throw.
Stephen F. Austin,Appalachian State,31,22,11,6,1,T.J. Holyfield made Free Throw.
Stephen F. Austin,Appalachian State,31,22,11,24,0,Foul on Ty Charles.
Stephen F. Austin,Appalachian State,31,23,11,24,1,Ronshad Shabazz made Free Throw.
Stephen F. Austin,Appalachian State,31,24,11,24,1,Ronshad Shabazz made Free Throw.
Stephen F. Austin,Appalachian State,31,24,11,31,0,Ty Charles Turnover.
Stephen F. Austin,Appalachian State,31,24,11,32,0,Ronshad Shabazz Steal.
Stephen F. Austin,Appalachian State,31,26,11,35,1,Dustin Clarke made Jumper. Assisted by Ronshad Shabazz.
Stephen F. Austin,Appalachian State,33,26,11,51,1,T.J. Holyfield made Layup. Assisted by Clide Geffrard.
Stephen F. Austin,Appalachian State,33,28,12,8,1,Ronshad Shabazz made Layup.
Stephen F. Austin,Appalachian State,33,28,12,8,0,Foul on T.J. Holyfield.
Stephen F. Austin,Appalachian State,33,28,12,8,0,Official TV Timeout
Stephen F. Austin,Appalachian State,33,28,12,8,0,Ronshad Shabazz missed Free Throw.
Stephen F. Austin,Appalachian State,33,28,12,8,0,Griffin Kinney Offensive Rebound.
Stephen F. Austin,Appalachian State,33,28,12,11,0,Foul on Clide Geffrard.
Stephen F. Austin,Appalachian State,33,29,12,11,1,Griffin Kinney made Free Throw.
Stephen F. Austin,Appalachian State,33,30,12,11,1,Griffin Kinney made Free Throw.
Stephen F. Austin,Appalachian State,33,30,12,28,0,Ty Charles missed Three Point Jumper.
Stephen F. Austin,Appalachian State,33,30,12,28,0,Jared Johnson Offensive Rebound.
Stephen F. Austin,Appalachian State,35,30,12,28,1,Jared Johnson made Layup.
Stephen F. Austin,Appalachian State,35,30,12,49,0,Griffin Kinney Turnover.
Stephen F. Austin,Appalachian State,35,30,12,49,0,Foul on Griffin Kinney.
Stephen F. Austin,Appalachian State,37,30,13,9,1,Jovan Grujic made Layup. Assisted by Jared Johnson.
Stephen F. Austin,Appalachian State,37,30,13,27,0,Michael Obacha Turnover.
Stephen F. Austin,Appalachian State,37,30,13,28,0,Jovan Grujic Steal.
Stephen F. Austin,Appalachian State,37,30,13,30,0,Demetrious Floyd missed Layup.
Stephen F. Austin,Appalachian State,37,30,13,30,0,Dustin Clarke Defensive Rebound.
Stephen F. Austin,Appalachian State,37,30,13,39,0,Chris Burgess missed Jumper.
Stephen F. Austin,Appalachian State,37,30,13,39,0,Griffin Kinney Offensive Rebound.
Stephen F. Austin,Appalachian State,37,33,13,56,1,Chris Burgess made Three Point Jumper. Assisted by Dustin Clarke.
Stephen F. Austin,Appalachian State,39,33,14,14,1,Thomas Walkup made Jumper. Assisted by Jared Johnson.
Stephen F. Austin,Appalachian State,39,33,14,30,0,Griffin Kinney Turnover.
Stephen F. Austin,Appalachian State,39,33,14,45,0,Demetrious Floyd missed Jumper.
Stephen F. Austin,Appalachian State,39,33,14,45,0,Tyrell Johnson Defensive Rebound.
Stephen F. Austin,Appalachian State,39,33,15,3,0,Foul on Jovan Grujic.
Stephen F. Austin,Appalachian State,39,34,15,3,1,Frank Eaves made Free Throw.
Stephen F. Austin,Appalachian State,39,35,15,3,1,Frank Eaves made Free Throw.
Stephen F. Austin,Appalachian State,42,35,15,14,1,Demetrious Floyd made Three Point Jumper. Assisted by Ty Charles.
Stephen F. Austin,Appalachian State,42,35,15,31,0,Dustin Clarke Turnover.
Stephen F. Austin,Appalachian State,42,35,15,31,0,Foul on Dustin Clarke.
Stephen F. Austin,Appalachian State,44,35,15,45,1,Ty Charles made Jumper.
Stephen F. Austin,Appalachian State,44,38,16,1,1,Frank Eaves made Three Point Jumper.
Stephen F. Austin,Appalachian State,44,38,16,12,0,T.J. Holyfield Turnover.
Stephen F. Austin,Appalachian State,44,38,16,12,0,Foul on T.J. Holyfield.
Stephen F. Austin,Appalachian State,44,38,16,26,0,Frank Eaves missed Three Point Jumper.
Stephen F. Austin,Appalachian State,44,38,16,26,0,Tyrell Johnson Offensive Rebound.
Stephen F. Austin,Appalachian State,44,38,16,32,0,Mike Kobani Turnover.
Stephen F. Austin,Appalachian State,44,38,16,34,0,Thomas Walkup Steal.
Stephen F. Austin,Appalachian State,46,38,16,36,1,Thomas Walkup made Dunk.
Stephen F. Austin,Appalachian State,46,40,16,43,1,Tyrell Johnson made Layup. Assisted by Frank Eaves.
Stephen F. Austin,Appalachian State,46,40,16,43,0,Foul on Thomas Walkup.
Stephen F. Austin,Appalachian State,46,40,16,43,0,Tyrell Johnson missed Free Throw.
Stephen F. Austin,Appalachian State,46,40,16,43,0,Ty Charles Defensive Rebound.
Stephen F. Austin,Appalachian State,48,40,17,8,1,Ty Charles made Dunk. Assisted by Thomas Walkup.
Stephen F. Austin,Appalachian State,48,40,17,36,0,Frank Eaves Turnover.
Stephen F. Austin,Appalachian State,48,40,17,38,0,Thomas Walkup Steal.
Stephen F. Austin,Appalachian State,50,40,17,40,1,Jared Johnson made Dunk.
Stephen F. Austin,Appalachian State,50,42,18,2,1,Ronshad Shabazz made Layup. Assisted by Griffin Kinney.
Stephen F. Austin,Appalachian State,50,42,18,37,0,Jared Johnson missed Three Point Jumper.
Stephen F. Austin,Appalachian State,50,42,18,37,0,Frank Eaves Defensive Rebound.
Stephen F. Austin,Appalachian State,50,44,18,42,1,Ronshad Shabazz made Layup.
Stephen F. Austin,Appalachian State,50,44,18,42,0,Foul on Jovan Grujic.
Stephen F. Austin,Appalachian State,50,45,18,42,1,Ronshad Shabazz made Free Throw.
Stephen F. Austin,Appalachian State,50,45,18,51,0,Ty Charles missed Three Point Jumper.
Stephen F. Austin,Appalachian State,50,45,18,51,0,Frank Eaves Defensive Rebound.
Stephen F. Austin,Appalachian State,50,48,18,59,1,Frank Eaves made Three Point Jumper. Assisted by Ronshad Shabazz.
Stephen F. Austin,Appalachian State,50,48,19,2,0,Stephen F. Austin  Timeout
Stephen F. Austin,Appalachian State,53,48,19,25,1,Ty Charles made Three Point Jumper. Assisted by Thomas Walkup.
Stephen F. Austin,Appalachian State,53,48,19,34,0,Appalachian St  Timeout
Stephen F. Austin,Appalachian State,53,48,19,55,0,Ronshad Shabazz missed Jumper.
Stephen F. Austin,Appalachian State,53,48,19,55,0,Thomas Walkup Defensive Rebound.
Stephen F. Austin,Appalachian State,53,48,20,0,0,End of 1st half
Stephen F. Austin,Appalachian State,53,48,20,9,0,Thomas Walkup Turnover.
Stephen F. Austin,Appalachian State,53,48,20,11,0,Frank Eaves Steal.
Stephen F. Austin,Appalachian State,53,50,20,13,1,Frank Eaves made Layup.
Stephen F. Austin,Appalachian State,53,50,20,32,0,Dallas Cameron missed Three Point Jumper.
Stephen F. Austin,Appalachian State,53,50,20,32,0,Ronshad Shabazz Defensive Rebound.
Stephen F. Austin,Appalachian State,53,50,20,49,0,Griffin Kinney Turnover.
Stephen F. Austin,Appalachian State,53,50,20,49,0,Foul on Griffin Kinney.
Stephen F. Austin,Appalachian State,53,50,20,57,0,Foul on Ronshad Shabazz.
Stephen F. Austin,Appalachian State,53,50,21,5,0,T.J. Holyfield Turnover.
Stephen F. Austin,Appalachian State,53,50,21,7,0,Ronshad Shabazz Steal.
Stephen F. Austin,Appalachian State,53,52,21,11,1,Ronshad Shabazz made Layup.
Stephen F. Austin,Appalachian State,53,52,21,28,0,T.J. Holyfield missed Layup.
Stephen F. Austin,Appalachian State,53,52,21,28,0,Frank Eaves Defensive Rebound.
Stephen F. Austin,Appalachian State,53,52,21,43,0,Chris Burgess Turnover.
Stephen F. Austin,Appalachian State,53,52,21,43,0,Thomas Walkup Steal.
Stephen F. Austin,Appalachian State,55,52,21,46,1,Thomas Walkup made Layup.
Stephen F. Austin,Appalachian State,55,52,22,7,0,Foul on Trey Pinkney.
Stephen F. Austin,Appalachian State,55,52,22,7,0,Appalachian St  Turnover.
Stephen F. Austin,Appalachian State,55,52,22,22,0,T.J. Holyfield Turnover.
Stephen F. Austin,Appalachian State,55,52,22,45,0,Ronshad Shabazz missed Three Point Jumper.
Stephen F. Austin,Appalachian State,55,52,22,45,0,Trey Pinkney Defensive Rebound.
Stephen F. Austin,Appalachian State,57,52,22,53,1,Ty Charles made Layup. Assisted by Thomas Walkup.
Stephen F. Austin,Appalachian State,57,52,22,53,0,Foul on Chris Burgess.
Stephen F. Austin,Appalachian State,58,52,22,53,1,Ty Charles made Free Throw.
Stephen F. Austin,Appalachian State,58,52,22,58,0,Frank Eaves missed Layup.
Stephen F. Austin,Appalachian State,58,52,22,59,0,Michael Obacha Offensive Rebound.
Stephen F. Austin,Appalachian State,58,52,22,59,0,Foul on Thomas Walkup.
Stephen F. Austin,Appalachian State,58,53,22,59,1,Michael Obacha made Free Throw.
Stephen F. Austin,Appalachian State,58,53,22,59,0,Michael Obacha missed Free Throw.
Stephen F. Austin,Appalachian State,58,53,22,59,0,Thomas Walkup Defensive Rebound.
Stephen F. Austin,Appalachian State,58,53,23,17,0,Ty Charles Turnover.
Stephen F. Austin,Appalachian State,58,53,23,22,0,Foul on T.J. Holyfield.
Stephen F. Austin,Appalachian State,58,53,23,34,0,Frank Eaves Turnover.
Stephen F. Austin,Appalachian State,58,53,23,35,0,Clide Geffrard Steal.
Stephen F. Austin,Appalachian State,58,53,23,39,0,T.J. Holyfield missed Layup.
Stephen F. Austin,Appalachian State,58,53,23,39,0,Clide Geffrard Offensive Rebound.
Stephen F. Austin,Appalachian State,58,53,23,40,0,Foul on Griffin Kinney.
Stephen F. Austin,Appalachian State,59,53,23,40,1,Clide Geffrard made Free Throw.
Stephen F. Austin,Appalachian State,60,53,23,40,1,Clide Geffrard made Free Throw.
Stephen F. Austin,Appalachian State,60,53,23,50,0,Emarius Logan Turnover.
Stephen F. Austin,Appalachian State,63,53,24,14,1,Ty Charles made Three Point Jumper. Assisted by Dallas Cameron.
Stephen F. Austin,Appalachian State,63,53,24,19,0,Official TV Timeout
Stephen F. Austin,Appalachian State,63,53,24,42,0,Tyrell Johnson missed Layup.
Stephen F. Austin,Appalachian State,63,53,24,42,0,Clide Geffrard Defensive Rebound.
Stephen F. Austin,Appalachian State,63,53,24,55,0,Foul on Tyrell Johnson.
Stephen F. Austin,Appalachian State,63,53,25,3,0,Foul on Tyrell Johnson.
Stephen F. Austin,Appalachian State,63,53,25,3,0,Jovan Grujic missed Free Throw.
Stephen F. Austin,Appalachian State,63,53,25,3,0,Stephen F. Austin Deadball Team Rebound.
Stephen F. Austin,Appalachian State,64,53,25,3,1,Jovan Grujic made Free Throw.
Stephen F. Austin,Appalachian State,64,53,25,16,0,Chris Burgess missed Three Point Jumper.
Stephen F. Austin,Appalachian State,64,53,25,16,0,Jovan Grujic Defensive Rebound.
Stephen F. Austin,Appalachian State,64,53,25,25,0,Jared Johnson missed Three Point Jumper.
Stephen F. Austin,Appalachian State,64,53,25,25,0,Jacob Lawson Defensive Rebound.
Stephen F. Austin,Appalachian State,64,55,25,39,1,Griffin Kinney made Jumper.
Stephen F. Austin,Appalachian State,64,55,26,2,0,Jovan Grujic missed Jumper.
Stephen F. Austin,Appalachian State,64,55,26,2,0,Griffin Kinney Defensive Rebound.
Stephen F. Austin,Appalachian State,64,55,26,13,0,Griffin Kinney missed Jumper.
Stephen F. Austin,Appalachian State,64,55,26,13,0,Thomas Walkup Defensive Rebound.
Stephen F. Austin,Appalachian State,64,55,26,35,0,Jovan Grujic Turnover.
Stephen F. Austin,Appalachian State,64,55,26,35,0,Foul on Jovan Grujic.
Stephen F. Austin,Appalachian State,64,55,26,58,0,Emarius Logan missed Layup.
Stephen F. Austin,Appalachian State,64,55,26,58,0,Griffin Kinney Offensive Rebound.
Stephen F. Austin,Appalachian State,64,55,27,1,0,Griffin Kinney missed Layup.
Stephen F. Austin,Appalachian State,64,55,27,1,0,T.J. Holyfield Block.
Stephen F. Austin,Appalachian State,64,55,27,2,0,T.J. Holyfield Defensive Rebound.
Stephen F. Austin,Appalachian State,64,55,27,4,0,T.J. Holyfield Turnover.
Stephen F. Austin,Appalachian State,64,55,27,5,0,Michael Obacha Steal.
Stephen F. Austin,Appalachian State,64,57,27,7,1,Griffin Kinney made Layup. Assisted by Michael Obacha.
Stephen F. Austin,Appalachian State,64,57,27,25,0,Foul on Chris Burgess.
Stephen F. Austin,Appalachian State,65,57,27,25,1,Ty Charles made Free Throw.
Stephen F. Austin,Appalachian State,65,57,27,25,0,Ty Charles missed Free Throw.
Stephen F. Austin,Appalachian State,65,57,27,25,0,Clide Geffrard Offensive Rebound.
Stephen F. Austin,Appalachian State,65,57,27,33,0,Clide Geffrard Turnover.
Stephen F. Austin,Appalachian State,65,57,27,33,0,Foul on Clide Geffrard.
Stephen F. Austin,Appalachian State,65,57,27,48,0,Frank Eaves Turnover.
Stephen F. Austin,Appalachian State,65,57,27,48,0,Clide Geffrard Steal.
Stephen F. Austin,Appalachian State,65,57,27,53,0,Jared Johnson Turnover.
Stephen F. Austin,Appalachian State,65,57,27,53,0,Griffin Kinney Steal.
Stephen F. Austin,Appalachian State,65,57,28,3,0,Foul on T.J. Holyfield.
Stephen F. Austin,Appalachian State,65,57,28,3,0,Official TV Timeout
Stephen F. Austin,Appalachian State,65,57,28,3,0,Appalachian St  Turnover.
Stephen F. Austin,Appalachian State,65,57,28,20,0,Foul on Michael Obacha.
Stephen F. Austin,Appalachian State,65,57,28,20,0,Clide Geffrard missed Free Throw.
Stephen F. Austin,Appalachian State,65,57,28,20,0,Thomas Walkup Offensive Rebound.
Stephen F. Austin,Appalachian State,65,57,28,38,0,Jared Johnson missed Three Point Jumper.
Stephen F. Austin,Appalachian State,65,57,28,38,0,Thomas Walkup Offensive Rebound.
Stephen F. Austin,Appalachian State,65,57,28,49,0,Thomas Walkup missed Jumper.
Stephen F. Austin,Appalachian State,65,57,28,49,0,Frank Eaves Defensive Rebound.
Stephen F. Austin,Appalachian State,65,59,28,57,1,Frank Eaves made Jumper.
Stephen F. Austin,Appalachian State,65,59,29,14,0,Clide Geffrard missed Jumper.
Stephen F. Austin,Appalachian State,65,59,29,14,0,Ty Charles Offensive Rebound.
Stephen F. Austin,Appalachian State,65,59,29,16,0,Foul on Ronshad Shabazz.
Stephen F. Austin,Appalachian State,66,59,29,16,1,Ty Charles made Free Throw.
Stephen F. Austin,Appalachian State,67,59,29,16,1,Ty Charles made Free Throw.
Stephen F. Austin,Appalachian State,67,59,29,29,0,Frank Eaves Turnover.
Stephen F. Austin,Appalachian State,69,59,29,44,1,Ty Charles made Jumper.
Stephen F. Austin,Appalachian State,69,59,29,54,0,Emarius Logan Turnover.
Stephen F. Austin,Appalachian State,69,59,30,18,0,Thomas Walkup missed Jumper.
Stephen F. Austin,Appalachian State,69,59,30,18,0,Griffin Kinney Defensive Rebound.
Stephen F. Austin,Appalachian State,69,59,30,27,0,Frank Eaves Turnover.
Stephen F. Austin,Appalachian State,69,59,30,36,0,Foul on Griffin Kinney.
Stephen F. Austin,Appalachian State,69,59,30,36,0,Thomas Walkup missed Free Throw.
Stephen F. Austin,Appalachian State,69,59,30,36,0,Stephen F. Austin Deadball Team Rebound.
Stephen F. Austin,Appalachian State,70,59,30,36,1,Thomas Walkup made Free Throw.
Stephen F. Austin,Appalachian State,70,59,31,1,0,Jacob Lawson Turnover.
Stephen F. Austin,Appalachian State,70,59,31,2,0,Trey Pinkney Steal.
Stephen F. Austin,Appalachian State,72,59,31,5,1,Trey Pinkney made Layup.
Stephen F. Austin,Appalachian State,72,61,31,26,1,Jacob Lawson made Jumper. Assisted by Ronshad Shabazz.
Stephen F. Austin,Appalachian State,72,61,31,26,0,Foul on Ty Charles.
Stephen F. Austin,Appalachian State,72,62,31,26,1,Jacob Lawson made Free Throw.
Stephen F. Austin,Appalachian State,74,62,31,38,1,Nathan Bain made Layup.
Stephen F. Austin,Appalachian State,74,62,31,53,0,Emarius Logan Turnover.
Stephen F. Austin,Appalachian State,74,62,31,54,0,Jared Johnson Steal.
Stephen F. Austin,Appalachian State,74,62,32,0,0,Foul on Emarius Logan.
Stephen F. Austin,Appalachian State,74,62,32,0,0,Nathan Bain missed Free Throw.
Stephen F. Austin,Appalachian State,74,62,32,0,0,Stephen F. Austin Deadball Team Rebound.
Stephen F. Austin,Appalachian State,75,62,32,0,1,Nathan Bain made Free Throw.
Stephen F. Austin,Appalachian State,75,64,32,9,1,Chris Burgess made Layup.
Stephen F. Austin,Appalachian State,75,64,32,15,0,Jared Johnson missed Three Point Jumper.
Stephen F. Austin,Appalachian State,75,64,32,15,0,Nathan Bain Offensive Rebound.
Stephen F. Austin,Appalachian State,77,64,32,20,1,Nathan Bain made Layup.
Stephen F. Austin,Appalachian State,77,64,32,20,0,Stephen F. Austin  Timeout
Stephen F. Austin,Appalachian State,77,64,32,20,0,Official TV Timeout
Stephen F. Austin,Appalachian State,77,64,32,42,0,Official TV Timeout
Stephen F. Austin,Appalachian State,77,64,32,42,0,Foul on Jacob Lawson.
Stephen F. Austin,Appalachian State,77,64,32,42,0,Jacob Lawson Turnover.
Stephen F. Austin,Appalachian State,77,64,33,2,0,Jovan Grujic Turnover.
Stephen F. Austin,Appalachian State,77,66,33,16,1,Chris Burgess made Layup.
Stephen F. Austin,Appalachian State,77,66,33,16,0,Foul on Jared Johnson.
Stephen F. Austin,Appalachian State,77,67,33,16,1,Chris Burgess made Free Throw.
Stephen F. Austin,Appalachian State,80,67,33,27,1,Jared Johnson made Three Point Jumper. Assisted by Ty Charles.
Stephen F. Austin,Appalachian State,80,67,33,44,0,Chris Burgess Turnover.
Stephen F. Austin,Appalachian State,80,67,33,44,0,Trey Pinkney Steal.
Stephen F. Austin,Appalachian State,80,67,33,47,0,Foul on Frank Eaves.
Stephen F. Austin,Appalachian State,81,67,33,47,1,Jared Johnson made Free Throw.
Stephen F. Austin,Appalachian State,82,67,33,47,1,Jared Johnson made Free Throw.
Stephen F. Austin,Appalachian State,82,67,34,3,0,Griffin Kinney missed Jumper.
Stephen F. Austin,Appalachian State,82,67,34,3,0,Thomas Walkup Defensive Rebound.
Stephen F. Austin,Appalachian State,84,67,34,11,1,Thomas Walkup made Layup. Assisted by Trey Pinkney.
Stephen F. Austin,Appalachian State,84,70,34,29,1,Frank Eaves made Three Point Jumper.
Stephen F. Austin,Appalachian State,86,70,34,54,1,Ty Charles made Jumper. Assisted by Thomas Walkup.
Stephen F. Austin,Appalachian State,86,70,35,8,0,Foul on Clide Geffrard.
Stephen F. Austin,Appalachian State,86,71,35,8,1,Frank Eaves made Free Throw.
Stephen F. Austin,Appalachian State,86,72,35,8,1,Frank Eaves made Free Throw.
Stephen F. Austin,Appalachian State,86,72,35,21,0,Ty Charles missed Three Point Jumper.
Stephen F. Austin,Appalachian State,86,72,35,21,0,Thomas Walkup Offensive Rebound.
Stephen F. Austin,Appalachian State,86,72,35,46,0,Clide Geffrard Turnover.
Stephen F. Austin,Appalachian State,86,72,35,46,0,Foul on Clide Geffrard.
Stephen F. Austin,Appalachian State,86,72,36,4,0,Emarius Logan Turnover.
Stephen F. Austin,Appalachian State,86,72,36,4,0,Foul on Emarius Logan.
Stephen F. Austin,Appalachian State,88,72,36,26,1,Thomas Walkup made Jumper.
Stephen F. Austin,Appalachian State,88,74,36,52,1,Emarius Logan made Jumper.
Stephen F. Austin,Appalachian State,88,74,37,14,0,T.J. Holyfield Turnover.
Stephen F. Austin,Appalachian State,88,74,37,14,0,Foul on T.J. Holyfield.
Stephen F. Austin,Appalachian State,88,74,37,21,0,Foul on Thomas Walkup.
Stephen F. Austin,Appalachian State,88,75,37,21,1,Chris Burgess made Free Throw.
Stephen F. Austin,Appalachian State,88,76,37,21,1,Chris Burgess made Free Throw.
Stephen F. Austin,Appalachian State,90,76,37,47,1,Thomas Walkup made Jumper.
Stephen F. Austin,Appalachian State,90,76,37,50,0,Stephen F. Austin  Timeout
Stephen F. Austin,Appalachian State,90,78,38,9,1,Griffin Kinney made Jumper.
Stephen F. Austin,Appalachian State,90,78,38,9,0,Foul on Thomas Walkup.
Stephen F. Austin,Appalachian State,90,79,38,9,1,Griffin Kinney made Free Throw.
Stephen F. Austin,Appalachian State,92,79,38,25,1,Thomas Walkup made Layup. Assisted by Ty Charles.
Stephen F. Austin,Appalachian State,92,79,38,32,0,Emarius Logan Turnover.
Stephen F. Austin,Appalachian State,94,79,39,1,1,Thomas Walkup made Jumper.
Stephen F. Austin,Appalachian State,94,79,39,8,0,Frank Eaves missed Three Point Jumper.
Stephen F. Austin,Appalachian State,94,79,39,8,0,Ty Charles Defensive Rebound.
Stephen F. Austin,Appalachian State,94,79,39,11,0,Foul on Frank Eaves.
Stephen F. Austin,Appalachian State,94,79,39,11,0,Technical Foul on Frank Eaves.
Stephen F. Austin,Appalachian State,94,79,39,11,0,Nathan Bain missed Free Throw.
Stephen F. Austin,Appalachian State,94,79,39,11,0,Stephen F. Austin Deadball Team Rebound.
Stephen F. Austin,Appalachian State,94,79,39,11,0,Nathan Bain missed Free Throw.
Stephen F. Austin,Appalachian State,94,79,39,11,0,Stephen F. Austin Deadball Team Rebound.
