Away Team,Home Team,Away Score,Home Score,Minute,Second,isScoringPosession,Desc.
Bowling Green,Northern Illinois,0,2,0,21,1,Marin Maric made Layup.
Bowling Green,Northern Illinois,2,2,0,56,1,Spencer Parker made Layup.
Bowling Green,Northern Illinois,2,5,1,4,1,Marshawn Wilson made Three Point Jumper. Assisted by Travon Baker.
Bowling Green,Northern Illinois,2,5,1,33,0,Rasheed Worrell missed Jumper.
Bowling Green,Northern Illinois,2,5,1,33,0,Marin Maric Defensive Rebound.
Bowling Green,Northern Illinois,2,5,1,48,0,Travon Baker missed Three Point Jumper.
Bowling Green,Northern Illinois,2,5,1,48,0,Spencer Parker Defensive Rebound.
Bowling Green,Northern Illinois,5,5,2,13,1,Zack Denny made Three Point Jumper. Assisted by David Joseph.
Bowling Green,Northern Illinois,5,8,2,26,1,Marshawn Wilson made Three Point Jumper.
Bowling Green,Northern Illinois,5,8,2,53,0,Wesley Alcegaire Turnover.
Bowling Green,Northern Illinois,5,8,2,55,0,Marshawn Wilson Steal.
Bowling Green,Northern Illinois,5,11,2,58,1,Aaric Armstead made Three Point Jumper. Assisted by Marshawn Wilson.
Bowling Green,Northern Illinois,5,11,3,10,0,David Joseph Turnover.
Bowling Green,Northern Illinois,5,11,3,10,0,Foul on David Joseph.
Bowling Green,Northern Illinois,5,11,3,19,0,Jaylen Key missed Jumper.
Bowling Green,Northern Illinois,5,11,3,19,0,Rasheed Worrell Defensive Rebound.
Bowling Green,Northern Illinois,5,11,3,26,0,Spencer Parker missed Layup.
Bowling Green,Northern Illinois,5,11,3,26,0,Marin Maric Block.
Bowling Green,Northern Illinois,5,11,3,28,0,Jaylen Key Defensive Rebound.
Bowling Green,Northern Illinois,5,11,3,32,0,Michael Orris Turnover.
Bowling Green,Northern Illinois,5,11,3,34,0,Rasheed Worrell Steal.
Bowling Green,Northern Illinois,5,11,3,39,0,Wesley Alcegaire Turnover.
Bowling Green,Northern Illinois,5,11,3,40,0,Marshawn Wilson Steal.
Bowling Green,Northern Illinois,5,11,3,58,0,Marin Maric missed Jumper.
Bowling Green,Northern Illinois,5,11,3,58,0,Rasheed Worrell Defensive Rebound.
Bowling Green,Northern Illinois,5,11,4,13,0,Foul on Marin Maric.
Bowling Green,Northern Illinois,5,11,4,13,0,Official TV Timeout
Bowling Green,Northern Illinois,5,11,4,23,0,Foul on Laytwan Porter.
Bowling Green,Northern Illinois,5,11,4,25,0,Demajeo Wiggins Turnover.
Bowling Green,Northern Illinois,5,11,4,28,0,Austin Pauga Steal.
Bowling Green,Northern Illinois,5,13,4,47,1,Andrew Zelis made Jumper. Assisted by Laytwan Porter.
Bowling Green,Northern Illinois,5,13,5,12,0,Ismail Ali missed Three Point Jumper.
Bowling Green,Northern Illinois,5,13,5,12,0,Laytwan Porter Defensive Rebound.
Bowling Green,Northern Illinois,5,13,5,32,0,Andrew Zelis missed Jumper.
Bowling Green,Northern Illinois,5,13,5,32,0,Antwon Lillard Defensive Rebound.
Bowling Green,Northern Illinois,7,13,5,41,1,Antwon Lillard made Jumper. Assisted by Spencer Parker.
Bowling Green,Northern Illinois,7,13,5,58,0,Foul on Zack Denny.
Bowling Green,Northern Illinois,7,13,5,59,0,Michael Orris missed Jumper.
Bowling Green,Northern Illinois,7,13,5,59,0,Antwon Lillard Defensive Rebound.
Bowling Green,Northern Illinois,10,13,6,19,1,Wesley Alcegaire made Three Point Jumper. Assisted by Ismail Ali.
Bowling Green,Northern Illinois,10,13,6,33,0,Laytwan Porter missed Three Point Jumper.
Bowling Green,Northern Illinois,10,13,6,33,0,Wesley Alcegaire Defensive Rebound.
Bowling Green,Northern Illinois,10,13,6,51,0,Ismail Ali Turnover.
Bowling Green,Northern Illinois,10,13,6,53,0,Levi Bradley Steal.
Bowling Green,Northern Illinois,10,16,6,55,1,Austin Pauga made Three Point Jumper. Assisted by Levi Bradley.
Bowling Green,Northern Illinois,10,16,7,19,0,Foul on Laytwan Porter.
Bowling Green,Northern Illinois,10,16,7,30,0,Garrett Mayleben missed Layup.
Bowling Green,Northern Illinois,10,16,7,30,0,Marin Maric Block.
Bowling Green,Northern Illinois,10,16,7,32,0,Levi Bradley Defensive Rebound.
Bowling Green,Northern Illinois,10,16,7,36,0,Foul on Ismail Ali.
Bowling Green,Northern Illinois,10,16,7,36,0,Travon Baker missed Free Throw.
Bowling Green,Northern Illinois,10,16,7,36,0,Northern Illinois Deadball Team Rebound.
Bowling Green,Northern Illinois,10,17,7,36,1,Travon Baker made Free Throw.
Bowling Green,Northern Illinois,10,17,7,48,0,Rasheed Worrell Turnover.
Bowling Green,Northern Illinois,10,17,7,48,0,Marshawn Wilson Steal.
Bowling Green,Northern Illinois,10,17,7,56,0,Travon Baker missed Three Point Jumper.
Bowling Green,Northern Illinois,10,17,7,56,0,Northern Illinois Offensive Rebound.
Bowling Green,Northern Illinois,10,17,8,6,0,Official TV Timeout
Bowling Green,Northern Illinois,10,17,8,11,0,Aaric Armstead Turnover.
Bowling Green,Northern Illinois,10,17,8,13,0,Rasheed Worrell Steal.
Bowling Green,Northern Illinois,13,17,8,26,1,David Joseph made Three Point Jumper. Assisted by Spencer Parker.
Bowling Green,Northern Illinois,13,17,8,40,0,Marin Maric missed Three Point Jumper.
Bowling Green,Northern Illinois,13,17,8,40,0,David Joseph Defensive Rebound.
Bowling Green,Northern Illinois,13,17,9,6,0,Rasheed Worrell missed Layup.
Bowling Green,Northern Illinois,13,17,9,6,0,David Joseph Offensive Rebound.
Bowling Green,Northern Illinois,13,17,9,9,0,David Joseph missed Three Point Jumper.
Bowling Green,Northern Illinois,13,17,9,9,0,Wesley Alcegaire Offensive Rebound.
Bowling Green,Northern Illinois,13,17,9,14,0,Wesley Alcegaire missed Layup.
Bowling Green,Northern Illinois,13,17,9,14,0,Marin Maric Defensive Rebound.
Bowling Green,Northern Illinois,13,17,9,14,0,Foul on Wesley Alcegaire.
Bowling Green,Northern Illinois,13,20,9,26,1,Travon Baker made Three Point Jumper.
Bowling Green,Northern Illinois,13,20,9,53,0,David Joseph Turnover.
Bowling Green,Northern Illinois,13,20,10,4,0,Marshawn Wilson Turnover.
Bowling Green,Northern Illinois,13,20,10,19,0,Rasheed Worrell missed Layup.
Bowling Green,Northern Illinois,13,20,10,19,0,Aaric Armstead Defensive Rebound.
Bowling Green,Northern Illinois,13,22,10,33,1,Jaylen Key made Layup. Assisted by Marshawn Wilson.
Bowling Green,Northern Illinois,13,22,11,2,0,Zack Denny missed Layup.
Bowling Green,Northern Illinois,13,22,11,2,0,Aaric Armstead Block.
Bowling Green,Northern Illinois,13,22,11,3,0,Northern Illinois Defensive Rebound.
Bowling Green,Northern Illinois,13,24,11,18,1,Jaylen Key made Layup.
Bowling Green,Northern Illinois,13,24,11,45,0,Spencer Parker missed Three Point Jumper.
Bowling Green,Northern Illinois,13,24,11,45,0,Ismail Ali Offensive Rebound.
Bowling Green,Northern Illinois,15,24,11,50,1,Zack Denny made Layup. Assisted by Ismail Ali.
Bowling Green,Northern Illinois,15,24,12,8,0,Travon Baker missed Three Point Jumper.
Bowling Green,Northern Illinois,15,24,12,8,0,Zack Denny Defensive Rebound.
Bowling Green,Northern Illinois,15,24,12,32,0,Foul on Jaylen Key.
Bowling Green,Northern Illinois,15,24,12,32,0,Official TV Timeout
Bowling Green,Northern Illinois,15,24,12,36,0,Zack Denny missed Three Point Jumper.
Bowling Green,Northern Illinois,15,24,12,36,0,Marin Maric Defensive Rebound.
Bowling Green,Northern Illinois,15,24,13,4,0,Levi Bradley Turnover.
Bowling Green,Northern Illinois,15,24,13,11,0,Foul on Marshawn Wilson.
Bowling Green,Northern Illinois,18,24,13,23,1,Wesley Alcegaire made Three Point Jumper. Assisted by Ismail Ali.
Bowling Green,Northern Illinois,18,24,13,47,0,Levi Bradley missed Jumper.
Bowling Green,Northern Illinois,18,24,13,47,0,Levi Bradley Offensive Rebound.
Bowling Green,Northern Illinois,18,24,13,51,0,Levi Bradley missed Layup.
Bowling Green,Northern Illinois,18,24,13,51,0,Bowling Green Defensive Rebound.
Bowling Green,Northern Illinois,18,24,13,52,0,Foul on Marin Maric.
Bowling Green,Northern Illinois,18,24,14,10,0,Demajeo Wiggins Turnover.
Bowling Green,Northern Illinois,18,24,14,11,0,Aaric Armstead Steal.
Bowling Green,Northern Illinois,18,26,14,16,1,Michael Orris made Layup. Assisted by Aaric Armstead.
Bowling Green,Northern Illinois,18,26,14,34,0,Spencer Parker missed Jumper.
Bowling Green,Northern Illinois,18,26,14,34,0,Andrew Zelis Defensive Rebound.
Bowling Green,Northern Illinois,18,26,14,47,0,Austin Pauga missed Three Point Jumper.
Bowling Green,Northern Illinois,18,26,14,47,0,Ismail Ali Defensive Rebound.
Bowling Green,Northern Illinois,18,26,15,4,0,Foul on Andrew Zelis.
Bowling Green,Northern Illinois,19,26,15,4,1,Spencer Parker made Free Throw.
Bowling Green,Northern Illinois,20,26,15,4,1,Spencer Parker made Free Throw.
Bowling Green,Northern Illinois,20,26,15,13,0,Aaric Armstead missed Jumper.
Bowling Green,Northern Illinois,20,26,15,13,0,Zack Denny Defensive Rebound.
Bowling Green,Northern Illinois,20,26,15,43,0,Ismail Ali missed Layup.
Bowling Green,Northern Illinois,20,26,15,43,0,Andrew Zelis Block.
Bowling Green,Northern Illinois,20,26,15,45,0,Rasheed Worrell Offensive Rebound.
Bowling Green,Northern Illinois,20,26,15,46,0,Foul on Andrew Zelis.
Bowling Green,Northern Illinois,21,26,15,46,1,Rasheed Worrell made Free Throw.
Bowling Green,Northern Illinois,21,26,15,46,0,Rasheed Worrell missed Free Throw.
Bowling Green,Northern Illinois,21,26,15,46,0,Aaric Armstead Defensive Rebound.
Bowling Green,Northern Illinois,21,28,16,1,1,Michael Orris made Layup.
Bowling Green,Northern Illinois,23,28,16,21,1,Wesley Alcegaire made Layup. Assisted by Spencer Parker.
Bowling Green,Northern Illinois,23,28,16,37,0,Michael Orris missed Layup.
Bowling Green,Northern Illinois,23,28,16,37,0,Bowling Green Defensive Rebound.
Bowling Green,Northern Illinois,23,28,16,40,0,Official TV Timeout
Bowling Green,Northern Illinois,23,28,17,3,0,Antwon Lillard missed Three Point Jumper.
Bowling Green,Northern Illinois,23,28,17,3,0,Rasheed Worrell Offensive Rebound.
Bowling Green,Northern Illinois,25,28,17,10,1,Ismail Ali made Jumper. Assisted by Rasheed Worrell.
Bowling Green,Northern Illinois,25,28,17,30,0,Foul on Rasheed Worrell.
Bowling Green,Northern Illinois,25,28,17,30,0,Jaylen Key missed Free Throw.
Bowling Green,Northern Illinois,25,28,17,30,0,Northern Illinois Deadball Team Rebound.
Bowling Green,Northern Illinois,25,29,17,30,1,Jaylen Key made Free Throw.
Bowling Green,Northern Illinois,25,29,17,45,0,Wesley Alcegaire missed Three Point Jumper.
Bowling Green,Northern Illinois,25,29,17,45,0,Marshawn Wilson Defensive Rebound.
Bowling Green,Northern Illinois,25,29,17,54,0,Foul on Ismail Ali.
Bowling Green,Northern Illinois,25,30,17,54,1,Marshawn Wilson made Free Throw.
Bowling Green,Northern Illinois,25,31,17,54,1,Marshawn Wilson made Free Throw.
Bowling Green,Northern Illinois,25,32,17,54,1,Marshawn Wilson made Free Throw.
Bowling Green,Northern Illinois,25,32,18,6,0,Wesley Alcegaire missed Three Point Jumper.
Bowling Green,Northern Illinois,25,32,18,6,0,Antwon Lillard Offensive Rebound.
Bowling Green,Northern Illinois,25,32,18,10,0,Foul on Chuks Iroegbu.
Bowling Green,Northern Illinois,26,32,18,10,1,Antwon Lillard made Free Throw.
Bowling Green,Northern Illinois,27,32,18,10,1,Antwon Lillard made Free Throw.
Bowling Green,Northern Illinois,27,35,18,20,1,Marshawn Wilson made Three Point Jumper.
Bowling Green,Northern Illinois,30,35,18,41,1,Antwon Lillard made Three Point Jumper. Assisted by David Joseph.
Bowling Green,Northern Illinois,30,35,18,46,0,Northern Illinois  Timeout
Bowling Green,Northern Illinois,30,35,19,0,0,Jaylen Key missed Jumper.
Bowling Green,Northern Illinois,30,35,19,0,0,David Joseph Defensive Rebound.
Bowling Green,Northern Illinois,30,35,19,9,0,Spencer Parker missed Jumper.
Bowling Green,Northern Illinois,30,35,19,9,0,Aaric Armstead Defensive Rebound.
Bowling Green,Northern Illinois,30,38,19,21,1,Levi Bradley made Three Point Jumper. Assisted by Travon Baker.
Bowling Green,Northern Illinois,30,38,19,26,0,Bowling Green  Timeout
Bowling Green,Northern Illinois,30,38,19,49,0,Antwon Lillard missed Jumper.
Bowling Green,Northern Illinois,30,38,19,49,0,Spencer Parker Offensive Rebound.
Bowling Green,Northern Illinois,32,38,19,56,1,Rasheed Worrell made Layup. Assisted by Spencer Parker.
Bowling Green,Northern Illinois,32,38,20,0,0,End of 1st half
Bowling Green,Northern Illinois,32,38,20,12,0,Travon Baker Turnover.
Bowling Green,Northern Illinois,32,38,20,12,0,Foul on Travon Baker.
Bowling Green,Northern Illinois,32,38,20,30,0,Foul on Jaylen Key.
Bowling Green,Northern Illinois,32,38,20,33,0,Wesley Alcegaire missed Three Point Jumper.
Bowling Green,Northern Illinois,32,38,20,33,0,Spencer Parker Offensive Rebound.
Bowling Green,Northern Illinois,32,38,20,39,0,Zack Denny missed Three Point Jumper.
Bowling Green,Northern Illinois,32,38,20,39,0,Marshawn Wilson Defensive Rebound.
Bowling Green,Northern Illinois,32,38,20,42,0,Foul on Rasheed Worrell.
Bowling Green,Northern Illinois,32,40,21,5,1,Aaric Armstead made Jumper.
Bowling Green,Northern Illinois,32,40,21,24,0,Spencer Parker missed Three Point Jumper.
Bowling Green,Northern Illinois,32,40,21,24,0,Marin Maric Defensive Rebound.
Bowling Green,Northern Illinois,32,40,21,31,0,Foul on Spencer Parker.
Bowling Green,Northern Illinois,32,42,21,39,1,Marin Maric made Layup.
Bowling Green,Northern Illinois,32,42,22,11,0,David Joseph missed Jumper.
Bowling Green,Northern Illinois,32,42,22,11,0,Aaric Armstead Defensive Rebound.
Bowling Green,Northern Illinois,32,44,22,32,1,Travon Baker made Jumper. Assisted by Marshawn Wilson.
Bowling Green,Northern Illinois,32,44,22,47,0,Bowling Green  Timeout
Bowling Green,Northern Illinois,32,44,22,47,0,Official TV Timeout
Bowling Green,Northern Illinois,32,44,22,58,0,Rasheed Worrell missed Layup.
Bowling Green,Northern Illinois,32,44,22,58,0,Marin Maric Defensive Rebound.
Bowling Green,Northern Illinois,32,44,23,15,0,Marshawn Wilson missed Layup.
Bowling Green,Northern Illinois,32,44,23,15,0,Spencer Parker Defensive Rebound.
Bowling Green,Northern Illinois,32,44,23,23,0,Foul on Travon Baker.
Bowling Green,Northern Illinois,32,44,23,23,0,Wesley Alcegaire missed Free Throw.
Bowling Green,Northern Illinois,32,44,23,23,0,Bowling Green Deadball Team Rebound.
Bowling Green,Northern Illinois,33,44,23,23,1,Wesley Alcegaire made Free Throw.
Bowling Green,Northern Illinois,33,44,23,36,0,Travon Baker missed Jumper.
Bowling Green,Northern Illinois,33,44,23,36,0,Marin Maric Offensive Rebound.
Bowling Green,Northern Illinois,33,44,23,39,0,Foul on Rasheed Worrell.
Bowling Green,Northern Illinois,33,44,23,42,0,Marshawn Wilson missed Jumper.
Bowling Green,Northern Illinois,33,44,23,42,0,Zack Denny Defensive Rebound.
Bowling Green,Northern Illinois,33,44,24,2,0,Zack Denny missed Jumper.
Bowling Green,Northern Illinois,33,44,24,2,0,Marin Maric Block.
Bowling Green,Northern Illinois,33,44,24,4,0,Aaric Armstead Defensive Rebound.
Bowling Green,Northern Illinois,33,44,24,11,0,Aaric Armstead missed Three Point Jumper.
Bowling Green,Northern Illinois,33,44,24,11,0,Marin Maric Offensive Rebound.
Bowling Green,Northern Illinois,33,44,24,14,0,Foul on Demajeo Wiggins.
Bowling Green,Northern Illinois,33,44,24,14,0,Official TV Timeout
Bowling Green,Northern Illinois,33,46,24,22,1,Aaric Armstead made Layup.
Bowling Green,Northern Illinois,33,46,24,45,0,Foul on Levi Bradley.
Bowling Green,Northern Illinois,33,46,24,55,0,Ismail Ali Turnover.
Bowling Green,Northern Illinois,33,46,25,1,0,Laytwan Porter missed Layup.
Bowling Green,Northern Illinois,33,46,25,1,0,Bowling Green Defensive Rebound.
Bowling Green,Northern Illinois,33,46,25,25,0,Demajeo Wiggins Turnover.
Bowling Green,Northern Illinois,33,46,25,26,0,Jaylen Key Steal.
Bowling Green,Northern Illinois,33,46,25,35,0,Levi Bradley missed Jumper.
Bowling Green,Northern Illinois,33,46,25,35,0,Demajeo Wiggins Defensive Rebound.
Bowling Green,Northern Illinois,33,46,25,43,0,Wesley Alcegaire Turnover.
Bowling Green,Northern Illinois,33,46,25,43,0,Foul on Wesley Alcegaire.
Bowling Green,Northern Illinois,33,46,25,53,0,Levi Bradley Turnover.
Bowling Green,Northern Illinois,33,46,25,54,0,Ismail Ali Steal.
Bowling Green,Northern Illinois,33,46,25,58,0,Wesley Alcegaire missed Layup.
Bowling Green,Northern Illinois,33,46,25,58,0,Demajeo Wiggins Offensive Rebound.
Bowling Green,Northern Illinois,33,46,26,3,0,Demajeo Wiggins missed Layup.
Bowling Green,Northern Illinois,33,46,26,3,0,Levi Bradley Block.
Bowling Green,Northern Illinois,33,46,26,4,0,Laytwan Porter Defensive Rebound.
Bowling Green,Northern Illinois,33,46,26,8,0,Jaylen Key missed Layup.
Bowling Green,Northern Illinois,33,46,26,8,0,Bowling Green Defensive Rebound.
Bowling Green,Northern Illinois,33,46,26,29,0,Foul on Chuks Iroegbu.
Bowling Green,Northern Illinois,34,46,26,29,1,Spencer Parker made Free Throw.
Bowling Green,Northern Illinois,34,46,26,29,0,Spencer Parker missed Free Throw.
Bowling Green,Northern Illinois,34,46,26,29,0,Antwon Lillard Offensive Rebound.
Bowling Green,Northern Illinois,34,46,26,32,0,Wesley Alcegaire missed Three Point Jumper.
Bowling Green,Northern Illinois,34,46,26,32,0,Chuks Iroegbu Defensive Rebound.
Bowling Green,Northern Illinois,34,46,26,40,0,Chuks Iroegbu Turnover.
Bowling Green,Northern Illinois,34,46,26,40,0,Rasheed Worrell Steal.
Bowling Green,Northern Illinois,34,46,26,41,0,Antwon Lillard Turnover.
Bowling Green,Northern Illinois,34,46,26,41,0,Michael Orris Steal.
Bowling Green,Northern Illinois,34,46,26,41,0,Foul on Antwon Lillard.
Bowling Green,Northern Illinois,34,46,26,55,0,Laytwan Porter missed Layup.
Bowling Green,Northern Illinois,34,46,26,55,0,Marin Maric Offensive Rebound.
Bowling Green,Northern Illinois,34,48,26,58,1,Marin Maric made Layup.
Bowling Green,Northern Illinois,34,48,27,14,0,Spencer Parker missed Jumper.
Bowling Green,Northern Illinois,34,48,27,14,0,Marin Maric Defensive Rebound.
Bowling Green,Northern Illinois,34,51,27,42,1,Laytwan Porter made Three Point Jumper. Assisted by Michael Orris.
Bowling Green,Northern Illinois,34,51,27,55,0,Bowling Green  Timeout
Bowling Green,Northern Illinois,34,51,27,55,0,Official TV Timeout
Bowling Green,Northern Illinois,37,51,28,11,1,Wesley Alcegaire made Three Point Jumper. Assisted by Ismail Ali.
Bowling Green,Northern Illinois,37,53,28,30,1,Marin Maric made Layup. Assisted by Laytwan Porter.
Bowling Green,Northern Illinois,40,53,28,44,1,Spencer Parker made Three Point Jumper. Assisted by Ismail Ali.
Bowling Green,Northern Illinois,40,53,29,1,0,Levi Bradley missed Jumper.
Bowling Green,Northern Illinois,40,53,29,1,0,Ismail Ali Defensive Rebound.
Bowling Green,Northern Illinois,40,53,29,19,0,Foul on Michael Orris.
Bowling Green,Northern Illinois,40,53,29,31,0,Rasheed Worrell missed Layup.
Bowling Green,Northern Illinois,40,53,29,31,0,Northern Illinois Defensive Rebound.
Bowling Green,Northern Illinois,40,53,29,39,0,Jaylen Key missed Layup.
Bowling Green,Northern Illinois,40,53,29,39,0,Jaylen Key Offensive Rebound.
Bowling Green,Northern Illinois,40,53,29,44,0,Jaylen Key Turnover.
Bowling Green,Northern Illinois,40,53,29,45,0,Wesley Alcegaire Steal.
Bowling Green,Northern Illinois,40,53,29,52,0,Spencer Parker missed Three Point Jumper.
Bowling Green,Northern Illinois,40,53,29,52,0,Rasheed Worrell Offensive Rebound.
Bowling Green,Northern Illinois,40,53,29,56,0,Rasheed Worrell Turnover.
Bowling Green,Northern Illinois,40,55,30,7,1,Marin Maric made Layup. Assisted by Travon Baker.
Bowling Green,Northern Illinois,40,55,30,26,0,Foul on Aaric Armstead.
Bowling Green,Northern Illinois,41,55,30,26,1,David Joseph made Free Throw.
Bowling Green,Northern Illinois,41,55,30,34,0,David Joseph missed Free Throw.
Bowling Green,Northern Illinois,41,55,30,35,0,Antwon Lillard Offensive Rebound.
Bowling Green,Northern Illinois,43,55,30,36,1,Antwon Lillard made Layup.
Bowling Green,Northern Illinois,43,55,30,47,0,Foul on David Joseph.
Bowling Green,Northern Illinois,43,56,30,47,1,Laytwan Porter made Free Throw.
Bowling Green,Northern Illinois,43,57,30,47,1,Laytwan Porter made Free Throw.
Bowling Green,Northern Illinois,45,57,30,52,1,Antwon Lillard made Layup. Assisted by David Joseph.
Bowling Green,Northern Illinois,45,60,31,12,1,Aaric Armstead made Three Point Jumper. Assisted by Laytwan Porter.
Bowling Green,Northern Illinois,45,60,31,14,0,Northern Illinois  Timeout
Bowling Green,Northern Illinois,45,60,31,25,0,David Joseph missed Layup.
Bowling Green,Northern Illinois,45,60,31,25,0,Marin Maric Defensive Rebound.
Bowling Green,Northern Illinois,45,62,31,33,1,Laytwan Porter made Layup. Assisted by Travon Baker.
Bowling Green,Northern Illinois,45,62,31,46,0,David Joseph Turnover.
Bowling Green,Northern Illinois,45,62,31,47,0,Aaric Armstead Steal.
Bowling Green,Northern Illinois,45,62,31,51,0,Laytwan Porter Turnover.
Bowling Green,Northern Illinois,45,62,32,9,0,Zack Denny missed Three Point Jumper.
Bowling Green,Northern Illinois,45,62,32,9,0,Marin Maric Defensive Rebound.
Bowling Green,Northern Illinois,45,62,32,33,0,Travon Baker missed Jumper.
Bowling Green,Northern Illinois,45,62,32,33,0,Zack Denny Block.
Bowling Green,Northern Illinois,45,62,32,35,0,Ismail Ali Defensive Rebound.
Bowling Green,Northern Illinois,47,62,32,41,1,Ismail Ali made Layup.
Bowling Green,Northern Illinois,47,62,32,44,0,Foul on Laytwan Porter.
Bowling Green,Northern Illinois,47,62,32,44,0,Official TV Timeout
Bowling Green,Northern Illinois,47,62,32,44,0,Ismail Ali missed Free Throw.
Bowling Green,Northern Illinois,47,62,32,44,0,Marin Maric Defensive Rebound.
Bowling Green,Northern Illinois,47,62,33,14,0,Marin Maric missed Jumper.
Bowling Green,Northern Illinois,47,62,33,14,0,Antwon Lillard Defensive Rebound.
Bowling Green,Northern Illinois,47,62,33,37,0,Rasheed Worrell missed Layup.
Bowling Green,Northern Illinois,47,62,33,37,0,Chuks Iroegbu Defensive Rebound.
Bowling Green,Northern Illinois,47,62,33,42,0,Chuks Iroegbu Turnover.
Bowling Green,Northern Illinois,47,62,33,43,0,Rasheed Worrell Steal.
Bowling Green,Northern Illinois,47,62,33,47,0,Zack Denny missed Layup.
Bowling Green,Northern Illinois,47,62,33,47,0,Spencer Parker Offensive Rebound.
Bowling Green,Northern Illinois,47,62,33,49,0,Foul on Chuks Iroegbu.
Bowling Green,Northern Illinois,48,62,33,49,1,Spencer Parker made Free Throw.
Bowling Green,Northern Illinois,49,62,33,49,1,Spencer Parker made Free Throw.
Bowling Green,Northern Illinois,49,64,33,55,1,Levi Bradley made Layup. Assisted by Travon Baker.
Bowling Green,Northern Illinois,49,64,34,20,0,Ismail Ali Turnover.
Bowling Green,Northern Illinois,49,64,34,22,0,Jaylen Key Steal.
Bowling Green,Northern Illinois,49,64,34,42,0,Michael Orris missed Layup.
Bowling Green,Northern Illinois,49,64,34,42,0,Levi Bradley Offensive Rebound.
Bowling Green,Northern Illinois,49,66,34,48,1,Levi Bradley made Layup.
Bowling Green,Northern Illinois,49,66,34,48,0,Foul on Ismail Ali.
Bowling Green,Northern Illinois,49,67,34,48,1,Levi Bradley made Free Throw.
Bowling Green,Northern Illinois,49,67,35,10,0,Foul on Jaylen Key.
Bowling Green,Northern Illinois,50,67,35,10,1,Spencer Parker made Free Throw.
Bowling Green,Northern Illinois,51,67,35,10,1,Spencer Parker made Free Throw.
Bowling Green,Northern Illinois,51,69,35,31,1,Aaric Armstead made Layup.
Bowling Green,Northern Illinois,54,69,36,1,1,Zack Denny made Three Point Jumper. Assisted by Ismail Ali.
Bowling Green,Northern Illinois,54,69,36,19,0,Levi Bradley missed Three Point Jumper.
Bowling Green,Northern Illinois,54,69,36,19,0,Zack Denny Defensive Rebound.
Bowling Green,Northern Illinois,54,69,36,35,0,Zack Denny missed Layup.
Bowling Green,Northern Illinois,54,69,36,35,0,Jaylen Key Defensive Rebound.
Bowling Green,Northern Illinois,54,69,36,58,0,Aaric Armstead missed Three Point Jumper.
Bowling Green,Northern Illinois,54,69,36,58,0,Spencer Parker Defensive Rebound.
Bowling Green,Northern Illinois,54,69,37,7,0,Foul on Levi Bradley.
Bowling Green,Northern Illinois,54,69,37,7,0,Official TV Timeout
Bowling Green,Northern Illinois,55,69,37,7,1,Spencer Parker made Free Throw.
Bowling Green,Northern Illinois,56,69,37,7,1,Spencer Parker made Free Throw.
Bowling Green,Northern Illinois,56,71,37,27,1,Aaric Armstead made Layup.
Bowling Green,Northern Illinois,56,71,37,44,0,Spencer Parker missed Layup.
Bowling Green,Northern Illinois,56,71,37,44,0,Chuks Iroegbu Block.
Bowling Green,Northern Illinois,56,71,37,46,0,Chuks Iroegbu Defensive Rebound.
Bowling Green,Northern Illinois,56,71,37,51,0,Aaric Armstead missed Three Point Jumper.
Bowling Green,Northern Illinois,56,71,37,51,0,Michael Orris Offensive Rebound.
Bowling Green,Northern Illinois,56,71,38,17,0,Jaylen Key missed Layup.
Bowling Green,Northern Illinois,56,71,38,17,0,Wesley Alcegaire Block.
Bowling Green,Northern Illinois,56,71,38,18,0,Aaric Armstead Offensive Rebound.
Bowling Green,Northern Illinois,56,71,38,24,0,Aaric Armstead Turnover.
Bowling Green,Northern Illinois,56,71,38,26,0,Wesley Alcegaire Steal.
Bowling Green,Northern Illinois,58,71,38,29,1,Wesley Alcegaire made Layup.
Bowling Green,Northern Illinois,58,71,38,29,0,Foul on Chuks Iroegbu.
Bowling Green,Northern Illinois,58,71,38,29,0,Wesley Alcegaire missed Free Throw.
Bowling Green,Northern Illinois,58,71,38,29,0,Chuks Iroegbu Defensive Rebound.
Bowling Green,Northern Illinois,58,71,38,38,0,Austin Pauga missed Jumper.
Bowling Green,Northern Illinois,58,71,38,38,0,Austin Pauga Offensive Rebound.
Bowling Green,Northern Illinois,58,71,39,10,0,Michael Orris missed Layup.
Bowling Green,Northern Illinois,58,71,39,10,0,Antwon Lillard Defensive Rebound.
Bowling Green,Northern Illinois,58,71,39,21,0,Foul on Jaylen Key.
Bowling Green,Northern Illinois,59,71,39,21,1,Antwon Lillard made Free Throw.
Bowling Green,Northern Illinois,60,71,39,21,1,Antwon Lillard made Free Throw.
Bowling Green,Northern Illinois,60,71,39,28,0,Chuks Iroegbu missed Layup.
Bowling Green,Northern Illinois,60,71,39,28,0,David Joseph Defensive Rebound.
Bowling Green,Northern Illinois,60,71,39,40,0,Matt Fox missed Three Point Jumper.
Bowling Green,Northern Illinois,60,71,39,40,0,Jordan Thomas Defensive Rebound.
