Away Team,Home Team,Away Score,Home Score,Minute,Second,isScoringPosession,Desc.
Mississippi Valley State,Washington State,39,65,32,28,0,Foul on Jordan Railey.
Mississippi Valley State,Washington State,39,65,32,28,0,Official TV Timeout
Mississippi Valley State,Washington State,42,65,32,41,1,Cameron Dobbs made Three Point Jumper. Assisted by Darryl Marshall.
Mississippi Valley State,Washington State,42,68,33,0,1,Que Johnson made Three Point Jumper. Assisted by Royce Woolridge.
Mississippi Valley State,Washington State,42,68,33,19,0,Cameron Dobbs missed Layup.
Mississippi Valley State,Washington State,42,68,33,19,0,D.J. Shelton Defensive Rebound.
Mississippi Valley State,Washington State,42,68,33,57,0,Washington St  Turnover.
Mississippi Valley State,Washington State,45,68,34,7,1,Daniel Hurtt made Three Point Jumper. Assisted by Cameron Dobbs.
Mississippi Valley State,Washington State,45,68,34,29,0,Foul on Daniel Hurtt.
Mississippi Valley State,Washington State,45,69,34,29,1,D.J. Shelton made Free Throw.
Mississippi Valley State,Washington State,45,70,34,29,1,D.J. Shelton made Free Throw.
Mississippi Valley State,Washington State,45,70,34,43,0,Anthony McDonald Turnover.
Mississippi Valley State,Washington State,45,70,34,45,0,Junior Longrus Steal.
Mississippi Valley State,Washington State,45,73,34,59,1,Que Johnson made Three Point Jumper. Assisted by Royce Woolridge.
Mississippi Valley State,Washington State,45,73,35,29,0,Anthony McDonald missed Three Point Jumper.
Mississippi Valley State,Washington State,45,73,35,29,0,Miss Valley St Offensive Rebound.
Mississippi Valley State,Washington State,45,73,35,33,0,Darryl Marshall Turnover.
Mississippi Valley State,Washington State,45,73,35,33,0,D.J. Shelton Steal.
Mississippi Valley State,Washington State,45,75,35,40,1,D.J. Shelton made Dunk. Assisted by Royce Woolridge.
Mississippi Valley State,Washington State,45,75,35,47,0,Cameron Dobbs missed Three Point Jumper.
Mississippi Valley State,Washington State,45,75,35,47,0,Ike Iroegbu Defensive Rebound.
Mississippi Valley State,Washington State,45,77,36,1,1,Royce Woolridge made Layup.
Mississippi Valley State,Washington State,45,77,36,4,0,Miss Valley St  Timeout
Mississippi Valley State,Washington State,45,77,36,13,0,Cameron Dobbs missed Jumper.
Mississippi Valley State,Washington State,45,77,36,13,0,Ike Iroegbu Defensive Rebound.
Mississippi Valley State,Washington State,45,79,36,33,1,Brett Boese made Layup. Assisted by Dominic Ballard.
Mississippi Valley State,Washington State,45,79,36,58,0,Daniel Hurtt missed Jumper.
Mississippi Valley State,Washington State,45,79,36,58,0,Josh Hawkinson Defensive Rebound.
Mississippi Valley State,Washington State,45,79,37,2,0,Washington St  Timeout
Mississippi Valley State,Washington State,45,79,37,2,0,Official TV Timeout
Mississippi Valley State,Washington State,45,81,37,29,1,Dominic Ballard made Layup.
Mississippi Valley State,Washington State,45,81,37,44,0,Cortland Henry Turnover.
Mississippi Valley State,Washington State,45,81,38,2,0,Foul on Ben Milshtein.
Mississippi Valley State,Washington State,45,81,38,2,0,James Hunter missed Free Throw.
Mississippi Valley State,Washington State,45,81,38,2,0,Washington St Deadball Team Rebound.
Mississippi Valley State,Washington State,45,82,38,2,1,James Hunter made Free Throw.
Mississippi Valley State,Washington State,48,82,38,28,1,Jeffrey Simmons made Three Point Jumper. Assisted by Anthony McDonald.
Mississippi Valley State,Washington State,48,82,38,39,0,Foul on Vacha Vaughn.
Mississippi Valley State,Washington State,48,82,38,39,0,Will DiIorio missed Free Throw.
Mississippi Valley State,Washington State,48,82,38,39,0,Washington St Deadball Team Rebound.
Mississippi Valley State,Washington State,48,83,38,39,1,Will DiIorio made Free Throw.
Mississippi Valley State,Washington State,48,83,38,51,0,Jeffrey Simmons missed Jumper.
Mississippi Valley State,Washington State,48,83,38,51,0,Will DiIorio Defensive Rebound.
Mississippi Valley State,Washington State,48,83,38,59,0,Brett Boese Turnover.
Mississippi Valley State,Washington State,48,83,39,4,0,Jeffrey Simmons Turnover.
Mississippi Valley State,Washington State,48,83,39,6,0,James Hunter Steal.
Mississippi Valley State,Washington State,48,85,39,33,1,James Hunter made Dunk. Assisted by Dominic Ballard.
Mississippi Valley State,Washington State,48,85,39,43,0,Ben Milshtein missed Layup.
Mississippi Valley State,Washington State,48,85,39,43,0,James Hunter Block.
Mississippi Valley State,Washington State,48,85,39,46,0,Thaddeus Fauntleroy Offensive Rebound.
Mississippi Valley State,Washington State,48,85,39,59,0,Anthony McDonald missed Three Point Jumper.
Mississippi Valley State,Washington State,48,85,39,59,0,Josh Hawkinson Defensive Rebound.
Mississippi Valley State,Washington State,48,85,40,0,0,End of Game
