Away Team,Home Team,Away Score,Home Score,Minute,Second,isScoringPosession,Desc.
Mississippi Valley State,Washington State,0,0,0,17,0,Jordan Railey missed Jumper.
Mississippi Valley State,Washington State,0,0,0,17,0,D.J. Shelton Offensive Rebound.
Mississippi Valley State,Washington State,0,2,0,20,1,D.J. Shelton made Layup.
Mississippi Valley State,Washington State,0,2,0,36,0,James Currington missed Jumper.
Mississippi Valley State,Washington State,0,2,0,36,0,Dexter Kernich-Drew Defensive Rebound.
Mississippi Valley State,Washington State,0,4,0,59,1,Royce Woolridge made Layup.
Mississippi Valley State,Washington State,0,4,1,22,0,Foul on Que Johnson.
Mississippi Valley State,Washington State,1,4,1,22,1,DeAngelo Priar made Free Throw.
Mississippi Valley State,Washington State,1,4,1,22,0,DeAngelo Priar missed Free Throw.
Mississippi Valley State,Washington State,1,4,1,22,0,D.J. Shelton Defensive Rebound.
Mississippi Valley State,Washington State,1,4,1,26,0,D.J. Shelton Turnover.
Mississippi Valley State,Washington State,1,4,1,27,0,James Currington Steal.
Mississippi Valley State,Washington State,1,4,1,30,0,James Currington missed Layup.
Mississippi Valley State,Washington State,1,4,1,30,0,D.J. Shelton Block.
Mississippi Valley State,Washington State,1,4,1,30,0,DeAngelo Priar Offensive Rebound.
Mississippi Valley State,Washington State,3,4,1,34,1,DeAngelo Priar made Layup.
Mississippi Valley State,Washington State,3,7,1,47,1,Que Johnson made Three Point Jumper. Assisted by D.J. Shelton.
Mississippi Valley State,Washington State,3,7,2,19,0,Anthony McDonald missed Three Point Jumper.
Mississippi Valley State,Washington State,3,7,2,19,0,D.J. Shelton Defensive Rebound.
Mississippi Valley State,Washington State,3,7,2,27,0,D.J. Shelton missed Three Point Jumper.
Mississippi Valley State,Washington State,3,7,2,27,0,James Currington Defensive Rebound.
Mississippi Valley State,Washington State,3,7,2,36,0,DeAngelo Priar missed Three Point Jumper.
Mississippi Valley State,Washington State,3,7,2,36,0,Dexter Kernich-Drew Defensive Rebound.
Mississippi Valley State,Washington State,3,9,2,43,1,Que Johnson made Layup. Assisted by Dexter Kernich-Drew.
Mississippi Valley State,Washington State,3,9,2,43,0,Miss Valley St  Timeout
Mississippi Valley State,Washington State,3,9,2,49,0,Foul on Royce Woolridge.
Mississippi Valley State,Washington State,3,9,2,55,0,Anthony McDonald missed Three Point Jumper.
Mississippi Valley State,Washington State,3,9,2,55,0,D.J. Shelton Defensive Rebound.
Mississippi Valley State,Washington State,3,11,3,22,1,D.J. Shelton made Layup.
Mississippi Valley State,Washington State,3,11,3,39,0,Jeffrey Simmons missed Jumper.
Mississippi Valley State,Washington State,3,11,3,39,0,Que Johnson Defensive Rebound.
Mississippi Valley State,Washington State,3,11,3,52,0,Foul on Julius Francis.
Mississippi Valley State,Washington State,3,11,3,52,0,Royce Woolridge missed Free Throw.
Mississippi Valley State,Washington State,3,11,3,52,0,Washington St Deadball Team Rebound.
Mississippi Valley State,Washington State,3,11,3,52,0,Royce Woolridge missed Free Throw.
Mississippi Valley State,Washington State,3,11,3,52,0,D.J. Shelton Offensive Rebound.
Mississippi Valley State,Washington State,3,13,3,55,1,D.J. Shelton made Layup.
Mississippi Valley State,Washington State,3,13,4,7,0,Jeffrey Simmons missed Layup.
Mississippi Valley State,Washington State,3,13,4,7,0,D.J. Shelton Defensive Rebound.
Mississippi Valley State,Washington State,3,13,4,14,0,Que Johnson missed Three Point Jumper.
Mississippi Valley State,Washington State,3,13,4,14,0,Jeffrey Simmons Defensive Rebound.
Mississippi Valley State,Washington State,3,13,4,16,0,Foul on D.J. Shelton.
Mississippi Valley State,Washington State,3,13,4,16,0,Official TV Timeout
Mississippi Valley State,Washington State,3,13,4,46,0,Anthony McDonald Turnover.
Mississippi Valley State,Washington State,3,13,4,47,0,Royce Woolridge Steal.
Mississippi Valley State,Washington State,3,13,4,53,0,Royce Woolridge missed Layup.
Mississippi Valley State,Washington State,3,13,4,53,0,Miss Valley St Defensive Rebound.
Mississippi Valley State,Washington State,3,13,5,8,0,Jordan Washington Turnover.
Mississippi Valley State,Washington State,3,13,5,37,0,Junior Longrus missed Layup.
Mississippi Valley State,Washington State,3,13,5,37,0,Que Johnson Offensive Rebound.
Mississippi Valley State,Washington State,3,13,5,41,0,Que Johnson missed Layup.
Mississippi Valley State,Washington State,3,13,5,41,0,Ike Iroegbu Offensive Rebound.
Mississippi Valley State,Washington State,3,13,5,45,0,Washington St  Turnover.
Mississippi Valley State,Washington State,3,13,6,6,0,Jeffrey Simmons missed Jumper.
Mississippi Valley State,Washington State,3,13,6,6,0,Que Johnson Defensive Rebound.
Mississippi Valley State,Washington State,3,13,6,20,0,Que Johnson Turnover.
Mississippi Valley State,Washington State,3,13,6,23,0,James Currington Steal.
Mississippi Valley State,Washington State,3,13,6,31,0,Jordan Washington missed Three Point Jumper.
Mississippi Valley State,Washington State,3,13,6,31,0,James Currington Offensive Rebound.
Mississippi Valley State,Washington State,3,13,6,35,0,James Currington missed Layup.
Mississippi Valley State,Washington State,3,13,6,35,0,James Currington Offensive Rebound.
Mississippi Valley State,Washington State,3,13,6,39,0,James Currington Turnover.
Mississippi Valley State,Washington State,3,13,6,41,0,Ike Iroegbu Steal.
Mississippi Valley State,Washington State,3,13,6,50,0,Dexter Kernich-Drew missed Three Point Jumper.
Mississippi Valley State,Washington State,3,13,6,50,0,Miss Valley St Defensive Rebound.
Mississippi Valley State,Washington State,3,13,7,14,0,Jeffrey Simmons Turnover.
Mississippi Valley State,Washington State,3,13,7,17,0,Dexter Kernich-Drew Steal.
Mississippi Valley State,Washington State,3,13,7,19,0,Dexter Kernich-Drew Turnover.
Mississippi Valley State,Washington State,3,13,7,20,0,Jordan Washington Steal.
Mississippi Valley State,Washington State,3,13,7,36,0,James Currington missed Jumper.
Mississippi Valley State,Washington State,3,13,7,36,0,Junior Longrus Defensive Rebound.
Mississippi Valley State,Washington State,3,13,8,0,0,Ike Iroegbu missed Jumper.
Mississippi Valley State,Washington State,3,13,8,0,0,Miss Valley St Defensive Rebound.
Mississippi Valley State,Washington State,3,13,8,1,0,Foul on Jordan Railey.
Mississippi Valley State,Washington State,3,13,8,13,0,Jordan Washington missed Layup.
Mississippi Valley State,Washington State,3,13,8,13,0,Will DiIorio Defensive Rebound.
Mississippi Valley State,Washington State,3,13,8,30,0,Foul on Darryl Marshall.
Mississippi Valley State,Washington State,3,13,8,30,0,Official TV Timeout
Mississippi Valley State,Washington State,3,13,9,5,0,Ike Iroegbu missed Three Point Jumper.
Mississippi Valley State,Washington State,3,13,9,5,0,D.J. Shelton Offensive Rebound.
Mississippi Valley State,Washington State,3,13,9,12,0,Royce Woolridge Turnover.
Mississippi Valley State,Washington State,3,13,9,32,0,DeAngelo Priar missed Layup.
Mississippi Valley State,Washington State,3,13,9,32,0,Ike Iroegbu Defensive Rebound.
Mississippi Valley State,Washington State,3,13,9,42,0,Foul on Cortland Henry.
Mississippi Valley State,Washington State,3,13,9,42,0,Junior Longrus missed Free Throw.
Mississippi Valley State,Washington State,3,13,9,42,0,Washington St Deadball Team Rebound.
Mississippi Valley State,Washington State,3,14,9,42,1,Junior Longrus made Free Throw.
Mississippi Valley State,Washington State,3,14,10,3,0,Cortland Henry Turnover.
Mississippi Valley State,Washington State,3,14,10,5,0,Dexter Kernich-Drew Steal.
Mississippi Valley State,Washington State,3,16,10,7,1,Dexter Kernich-Drew made Dunk.
Mississippi Valley State,Washington State,3,16,10,22,0,Julius Francis missed Jumper.
Mississippi Valley State,Washington State,3,16,10,22,0,Will DiIorio Defensive Rebound.
Mississippi Valley State,Washington State,3,18,10,41,1,D.J. Shelton made Jumper.
Mississippi Valley State,Washington State,3,18,11,3,0,Cameron Dobbs missed Three Point Jumper.
Mississippi Valley State,Washington State,3,18,11,3,0,D.J. Shelton Defensive Rebound.
Mississippi Valley State,Washington State,3,21,11,23,1,Que Johnson made Three Point Jumper. Assisted by Dexter Kernich-Drew.
Mississippi Valley State,Washington State,3,21,11,25,0,Miss Valley St  Timeout
Mississippi Valley State,Washington State,3,21,11,32,0,Cameron Dobbs missed Layup.
Mississippi Valley State,Washington State,3,21,11,32,0,Que Johnson Defensive Rebound.
Mississippi Valley State,Washington State,3,21,11,53,0,Que Johnson missed Three Point Jumper.
Mississippi Valley State,Washington State,3,21,11,53,0,Will DiIorio Offensive Rebound.
Mississippi Valley State,Washington State,3,21,12,0,0,Foul on Ben Milshtein.
Mississippi Valley State,Washington State,3,21,12,0,0,Will DiIorio missed Free Throw.
Mississippi Valley State,Washington State,3,21,12,0,0,Washington St Deadball Team Rebound.
Mississippi Valley State,Washington State,3,21,12,0,0,Will DiIorio missed Free Throw.
Mississippi Valley State,Washington State,3,21,12,0,0,Ben Milshtein Defensive Rebound.
Mississippi Valley State,Washington State,3,21,12,10,0,Cameron Dobbs Turnover.
Mississippi Valley State,Washington State,3,21,12,10,0,Dexter Kernich-Drew Turnover.
Mississippi Valley State,Washington State,3,21,12,10,0,Cameron Dobbs Steal.
Mississippi Valley State,Washington State,3,21,12,15,0,Foul on Dexter Kernich-Drew.
Mississippi Valley State,Washington State,5,21,12,15,1,Cameron Dobbs made Layup.
Mississippi Valley State,Washington State,5,21,12,15,0,Cameron Dobbs missed Free Throw.
Mississippi Valley State,Washington State,5,21,12,15,0,Ben Milshtein Offensive Rebound.
Mississippi Valley State,Washington State,5,21,12,21,0,Foul on D.J. Shelton.
Mississippi Valley State,Washington State,5,21,12,25,0,Foul on Cordarius Samples.
Mississippi Valley State,Washington State,5,21,12,25,0,Cordarius Samples Turnover.
Mississippi Valley State,Washington State,5,21,12,37,0,Que Johnson Turnover.
Mississippi Valley State,Washington State,5,21,12,55,0,Ben Milshtein Turnover.
Mississippi Valley State,Washington State,5,21,13,6,0,Que Johnson missed Three Point Jumper.
Mississippi Valley State,Washington State,5,21,13,6,0,Jeffrey Simmons Defensive Rebound.
Mississippi Valley State,Washington State,5,21,13,18,0,Julius Francis missed Jumper.
Mississippi Valley State,Washington State,5,21,13,18,0,Dexter Kernich-Drew Defensive Rebound.
Mississippi Valley State,Washington State,5,21,13,32,0,Junior Longrus missed Jumper.
Mississippi Valley State,Washington State,5,21,13,32,0,Thaddeus Fauntleroy Defensive Rebound.
Mississippi Valley State,Washington State,7,21,13,40,1,Thaddeus Fauntleroy made Layup.
Mississippi Valley State,Washington State,7,21,13,55,0,Que Johnson missed Jumper.
Mississippi Valley State,Washington State,7,21,13,55,0,Miss Valley St Defensive Rebound.
Mississippi Valley State,Washington State,10,21,14,15,1,Anthony McDonald made Three Point Jumper. Assisted by Thaddeus Fauntleroy.
Mississippi Valley State,Washington State,10,23,14,51,1,Jordan Railey made Layup. Assisted by Ike Iroegbu.
Mississippi Valley State,Washington State,10,23,14,51,0,Foul on Julius Francis.
Mississippi Valley State,Washington State,10,24,14,51,1,Jordan Railey made Free Throw.
Mississippi Valley State,Washington State,10,24,14,51,0,Technical Foul on Dexter Kernich-Drew.
Mississippi Valley State,Washington State,10,24,14,51,0,Foul on Dexter Kernich-Drew.
Mississippi Valley State,Washington State,10,24,14,51,0,Anthony McDonald missed Free Throw.
Mississippi Valley State,Washington State,10,24,14,51,0,Miss Valley St Deadball Team Rebound.
Mississippi Valley State,Washington State,11,24,14,51,1,Anthony McDonald made Free Throw.
Mississippi Valley State,Washington State,11,24,15,1,0,Foul on Jordan Railey.
Mississippi Valley State,Washington State,12,24,15,1,1,Anthony McDonald made Free Throw.
Mississippi Valley State,Washington State,13,24,15,1,1,Anthony McDonald made Free Throw.
Mississippi Valley State,Washington State,13,24,15,10,0,Will DiIorio Turnover.
Mississippi Valley State,Washington State,13,24,15,12,0,Jeffrey Simmons Steal.
Mississippi Valley State,Washington State,15,24,15,13,1,Jeffrey Simmons made Dunk.
Mississippi Valley State,Washington State,15,24,15,35,0,Will DiIorio Turnover.
Mississippi Valley State,Washington State,15,24,15,35,0,Thaddeus Fauntleroy Steal.
Mississippi Valley State,Washington State,15,24,15,35,0,Foul on Will DiIorio.
Mississippi Valley State,Washington State,16,24,15,35,1,Thaddeus Fauntleroy made Free Throw.
Mississippi Valley State,Washington State,17,24,15,35,1,Thaddeus Fauntleroy made Free Throw.
Mississippi Valley State,Washington State,17,26,15,47,1,Royce Woolridge made Layup.
Mississippi Valley State,Washington State,17,26,16,4,0,Thaddeus Fauntleroy missed Three Point Jumper.
Mississippi Valley State,Washington State,17,26,16,4,0,Royce Woolridge Defensive Rebound.
Mississippi Valley State,Washington State,17,26,16,14,0,Ike Iroegbu missed Jumper.
Mississippi Valley State,Washington State,17,26,16,14,0,Julius Francis Defensive Rebound.
Mississippi Valley State,Washington State,17,26,16,22,0,Anthony McDonald Turnover.
Mississippi Valley State,Washington State,17,26,16,22,0,Official TV Timeout
Mississippi Valley State,Washington State,17,26,16,40,0,Que Johnson missed Three Point Jumper.
Mississippi Valley State,Washington State,17,26,16,40,0,Washington St Offensive Rebound.
Mississippi Valley State,Washington State,17,26,16,59,0,Royce Woolridge missed Three Point Jumper.
Mississippi Valley State,Washington State,17,26,16,59,0,Will DiIorio Offensive Rebound.
Mississippi Valley State,Washington State,17,28,17,3,1,Will DiIorio made Layup.
Mississippi Valley State,Washington State,19,28,17,22,1,Jeffrey Simmons made Jumper.
Mississippi Valley State,Washington State,19,28,17,55,0,Que Johnson missed Jumper.
Mississippi Valley State,Washington State,19,28,17,55,0,Anthony McDonald Defensive Rebound.
Mississippi Valley State,Washington State,21,28,18,0,0,Foul on Ike Iroegbu.
Mississippi Valley State,Washington State,22,28,18,0,1,Thaddeus Fauntleroy made Free Throw.
Mississippi Valley State,Washington State,21,28,18,0,1,Thaddeus Fauntleroy made Jumper.
Mississippi Valley State,Washington State,22,28,18,32,0,Royce Woolridge Turnover.
Mississippi Valley State,Washington State,22,28,18,32,0,Daniel Hurtt Steal.
Mississippi Valley State,Washington State,22,28,18,50,0,Anthony McDonald Turnover.
Mississippi Valley State,Washington State,22,28,19,0,0,Que Johnson missed Layup.
Mississippi Valley State,Washington State,22,28,19,0,0,D.J. Shelton Offensive Rebound.
Mississippi Valley State,Washington State,22,30,19,2,1,D.J. Shelton made Dunk.
Mississippi Valley State,Washington State,22,30,19,24,0,Jordan Washington missed Layup.
Mississippi Valley State,Washington State,22,30,19,24,0,Junior Longrus Block.
Mississippi Valley State,Washington State,22,30,19,33,0,D.J. Shelton Defensive Rebound.
Mississippi Valley State,Washington State,22,32,19,56,1,Royce Woolridge made Layup.
Mississippi Valley State,Washington State,20,34,20,0,0,End of 1st half
Mississippi Valley State,Washington State,22,32,20,22,0,James Currington missed Layup.
Mississippi Valley State,Washington State,22,32,20,22,0,D.J. Shelton Defensive Rebound.
Mississippi Valley State,Washington State,22,32,20,28,0,D.J. Shelton Turnover.
Mississippi Valley State,Washington State,22,32,20,30,0,James Currington Steal.
Mississippi Valley State,Washington State,24,32,20,31,1,James Currington made Layup.
Mississippi Valley State,Washington State,24,34,20,54,1,Dexter Kernich-Drew made Jumper. Assisted by Royce Woolridge.
Mississippi Valley State,Washington State,24,34,21,6,0,DeAngelo Priar Turnover.
Mississippi Valley State,Washington State,24,34,21,8,0,Royce Woolridge Steal.
Mississippi Valley State,Washington State,24,36,21,9,1,Dexter Kernich-Drew made Layup. Assisted by Royce Woolridge.
Mississippi Valley State,Washington State,24,36,21,9,0,Foul on Darryl Marshall.
Mississippi Valley State,Washington State,24,37,21,9,1,Dexter Kernich-Drew made Free Throw.
Mississippi Valley State,Washington State,24,37,21,26,0,Darryl Marshall missed Three Point Jumper.
Mississippi Valley State,Washington State,24,37,21,26,0,James Currington Offensive Rebound.
Mississippi Valley State,Washington State,24,37,21,28,0,Foul on D.J. Shelton.
Mississippi Valley State,Washington State,24,37,21,28,0,James Currington missed Free Throw.
Mississippi Valley State,Washington State,24,37,21,28,0,Miss Valley St Deadball Team Rebound.
Mississippi Valley State,Washington State,24,37,21,28,0,James Currington missed Free Throw.
Mississippi Valley State,Washington State,24,37,21,28,0,Junior Longrus Defensive Rebound.
Mississippi Valley State,Washington State,24,37,21,40,0,Jordan Railey Turnover.
Mississippi Valley State,Washington State,24,37,21,41,0,James Currington Steal.
Mississippi Valley State,Washington State,24,37,21,45,0,Anthony McDonald missed Layup.
Mississippi Valley State,Washington State,24,37,21,45,0,Anthony McDonald Offensive Rebound.
Mississippi Valley State,Washington State,24,37,21,56,0,James Currington missed Jumper.
Mississippi Valley State,Washington State,24,37,21,56,0,Junior Longrus Block.
Mississippi Valley State,Washington State,24,37,21,57,0,James Currington Offensive Rebound.
Mississippi Valley State,Washington State,24,37,21,59,0,James Currington Turnover.
Mississippi Valley State,Washington State,24,37,22,0,0,Jordan Railey Steal.
Mississippi Valley State,Washington State,24,39,22,3,1,Royce Woolridge made Layup. Assisted by Que Johnson.
Mississippi Valley State,Washington State,24,39,22,25,0,Foul on Junior Longrus.
Mississippi Valley State,Washington State,25,39,22,25,1,Julius Francis made Free Throw.
Mississippi Valley State,Washington State,26,39,22,25,1,Julius Francis made Free Throw.
Mississippi Valley State,Washington State,26,41,22,34,1,Jordan Railey made Layup. Assisted by Royce Woolridge.
Mississippi Valley State,Washington State,26,41,22,34,0,Foul on Darryl Marshall.
Mississippi Valley State,Washington State,26,41,22,34,0,Jordan Railey missed Free Throw.
Mississippi Valley State,Washington State,26,41,22,34,0,Daniel Hurtt Defensive Rebound.
Mississippi Valley State,Washington State,28,41,22,46,1,James Currington made Jumper. Assisted by Anthony McDonald.
Mississippi Valley State,Washington State,28,41,23,17,0,Que Johnson missed Three Point Jumper.
Mississippi Valley State,Washington State,28,41,23,17,0,Junior Longrus Offensive Rebound.
Mississippi Valley State,Washington State,28,43,23,19,1,Junior Longrus made Dunk.
Mississippi Valley State,Washington State,28,43,23,19,0,Foul on James Currington.
Mississippi Valley State,Washington State,28,44,23,19,1,Junior Longrus made Free Throw.
Mississippi Valley State,Washington State,28,44,23,41,0,Cortland Henry missed Layup.
Mississippi Valley State,Washington State,28,44,23,41,0,Cortland Henry Offensive Rebound.
Mississippi Valley State,Washington State,28,44,23,43,0,Cortland Henry missed Layup.
Mississippi Valley State,Washington State,28,44,23,43,0,Jordan Railey Block.
Mississippi Valley State,Washington State,28,44,23,45,0,Jordan Railey Defensive Rebound.
Mississippi Valley State,Washington State,28,44,23,48,0,Royce Woolridge Turnover.
Mississippi Valley State,Washington State,28,44,24,4,0,Daniel Hurtt missed Jumper.
Mississippi Valley State,Washington State,28,44,24,4,0,Ike Iroegbu Defensive Rebound.
Mississippi Valley State,Washington State,28,46,24,10,1,Ike Iroegbu made Layup.
Mississippi Valley State,Washington State,28,46,24,10,0,Foul on Daniel Hurtt.
Mississippi Valley State,Washington State,28,46,24,10,0,Official TV Timeout
Mississippi Valley State,Washington State,28,46,24,10,0,Ike Iroegbu missed Free Throw.
Mississippi Valley State,Washington State,28,46,24,10,0,James Currington Defensive Rebound.
Mississippi Valley State,Washington State,28,46,24,46,0,Jeffrey Simmons missed Three Point Jumper.
Mississippi Valley State,Washington State,28,46,24,46,0,Royce Woolridge Defensive Rebound.
Mississippi Valley State,Washington State,28,46,24,48,0,Foul on Cortland Henry.
Mississippi Valley State,Washington State,28,46,24,51,0,Junior Longrus Turnover.
Mississippi Valley State,Washington State,28,46,24,53,0,Thaddeus Fauntleroy Steal.
Mississippi Valley State,Washington State,30,46,24,54,1,James Currington made Layup.
Mississippi Valley State,Washington State,30,49,25,14,1,Royce Woolridge made Three Point Jumper. Assisted by Jordan Railey.
Mississippi Valley State,Washington State,33,49,25,38,1,Cortland Henry made Three Point Jumper. Assisted by Jeffrey Simmons.
Mississippi Valley State,Washington State,33,51,25,52,1,Ike Iroegbu made Layup.
Mississippi Valley State,Washington State,33,51,26,0,0,Thaddeus Fauntleroy missed Jumper.
Mississippi Valley State,Washington State,33,51,26,0,0,Daniel Hurtt Offensive Rebound.
Mississippi Valley State,Washington State,35,51,26,7,1,Jeffrey Simmons made Jumper.
Mississippi Valley State,Washington State,35,51,26,31,0,Que Johnson missed Three Point Jumper.
Mississippi Valley State,Washington State,35,51,26,31,0,Miss Valley St Defensive Rebound.
Mississippi Valley State,Washington State,35,51,26,54,0,Jeffrey Simmons missed Layup.
Mississippi Valley State,Washington State,35,51,26,54,0,Daniel Hurtt Offensive Rebound.
Mississippi Valley State,Washington State,37,51,26,59,1,Daniel Hurtt made Layup.
Mississippi Valley State,Washington State,37,53,27,6,1,Junior Longrus made Dunk. Assisted by Ike Iroegbu.
Mississippi Valley State,Washington State,37,53,27,6,0,Washington St  Timeout
Mississippi Valley State,Washington State,37,53,27,20,0,Jeffrey Simmons Turnover.
Mississippi Valley State,Washington State,37,53,27,21,0,Ike Iroegbu Steal.
Mississippi Valley State,Washington State,37,53,27,23,0,Foul on Jeffrey Simmons.
Mississippi Valley State,Washington State,37,54,27,23,1,Ike Iroegbu made Free Throw.
Mississippi Valley State,Washington State,37,55,27,23,1,Ike Iroegbu made Free Throw.
Mississippi Valley State,Washington State,37,55,27,33,0,Cordarius Samples Turnover.
Mississippi Valley State,Washington State,37,55,27,35,0,Royce Woolridge Steal.
Mississippi Valley State,Washington State,37,55,27,37,0,Foul on Cordarius Samples.
Mississippi Valley State,Washington State,37,55,27,37,0,Washington St Deadball Team Rebound.
Mississippi Valley State,Washington State,37,56,27,37,1,Royce Woolridge made Free Throw.
Mississippi Valley State,Washington State,37,56,27,59,0,Jeffrey Simmons missed Three Point Jumper.
Mississippi Valley State,Washington State,37,56,27,59,0,Dexter Kernich-Drew Defensive Rebound.
Mississippi Valley State,Washington State,37,58,28,8,1,Que Johnson made Layup. Assisted by Ike Iroegbu.
Mississippi Valley State,Washington State,37,58,28,32,0,Thaddeus Fauntleroy missed Jumper.
Mississippi Valley State,Washington State,37,58,28,32,0,Junior Longrus Block.
Mississippi Valley State,Washington State,37,58,28,34,0,Washington St Defensive Rebound.
Mississippi Valley State,Washington State,37,58,28,34,0,Official TV Timeout
Mississippi Valley State,Washington State,37,58,29,11,0,Ike Iroegbu missed Layup.
Mississippi Valley State,Washington State,37,58,29,11,0,D.J. Shelton Offensive Rebound.
Mississippi Valley State,Washington State,37,61,29,14,1,Que Johnson made Three Point Jumper. Assisted by D.J. Shelton.
Mississippi Valley State,Washington State,37,61,29,23,0,James Currington missed Layup.
Mississippi Valley State,Washington State,37,61,29,23,0,Vacha Vaughn Offensive Rebound.
Mississippi Valley State,Washington State,37,61,29,25,0,Foul on Junior Longrus.
Mississippi Valley State,Washington State,37,61,29,28,0,Jeffrey Simmons missed Layup.
Mississippi Valley State,Washington State,37,61,29,28,0,Washington St Defensive Rebound.
Mississippi Valley State,Washington State,37,61,29,40,0,Junior Longrus Turnover.
Mississippi Valley State,Washington State,37,61,30,7,0,Thaddeus Fauntleroy missed Three Point Jumper.
Mississippi Valley State,Washington State,37,61,30,7,0,Junior Longrus Defensive Rebound.
Mississippi Valley State,Washington State,37,63,30,29,1,Junior Longrus made Jumper.
Mississippi Valley State,Washington State,37,63,30,48,0,Foul on James Currington.
Mississippi Valley State,Washington State,37,63,30,48,0,James Currington Turnover.
Mississippi Valley State,Washington State,37,63,31,1,0,Dexter Kernich-Drew Turnover.
Mississippi Valley State,Washington State,37,63,31,1,0,James Currington Steal.
Mississippi Valley State,Washington State,37,63,31,1,0,James Currington missed Dunk.
Mississippi Valley State,Washington State,37,63,31,1,0,Royce Woolridge Block.
Mississippi Valley State,Washington State,37,63,31,1,0,Miss Valley St Offensive Rebound.
Mississippi Valley State,Washington State,37,63,31,7,0,Jeffrey Simmons missed Jumper.
Mississippi Valley State,Washington State,37,63,31,7,0,Que Johnson Defensive Rebound.
Mississippi Valley State,Washington State,37,63,31,39,0,Foul on Jeffrey Simmons.
Mississippi Valley State,Washington State,37,64,31,39,1,Royce Woolridge made Free Throw.
Mississippi Valley State,Washington State,37,65,31,39,1,Royce Woolridge made Free Throw.
Mississippi Valley State,Washington State,37,65,31,56,0,Cameron Dobbs missed Three Point Jumper.
Mississippi Valley State,Washington State,37,65,31,56,0,Daniel Hurtt Offensive Rebound.
Mississippi Valley State,Washington State,39,65,32,2,1,James Currington made Layup.
Mississippi Valley State,Washington State,39,65,32,26,0,Dexter Kernich-Drew missed Three Point Jumper.
Mississippi Valley State,Washington State,39,65,32,26,0,James Currington Defensive Rebound.
