Hannibal-LaGrange,Southeast Missouri State,48,78,36,47,0,Denzel Mahoney Defensive Rebound.
Hannibal-LaGrange,Southeast Missouri State,48,80,36,59,1,Daniel Simmons made Layup.
Hannibal-LaGrange,Southeast Missouri State,50,80,37,16,1,Trevor Ison made Jumper.
Hannibal-LaGrange,Southeast Missouri State,50,82,37,31,1,Denzel Mahoney made Layup.
Hannibal-LaGrange,Southeast Missouri State,50,82,37,40,0,Hannibal-Lagrange  Timeout
Hannibal-LaGrange,Southeast Missouri State,50,82,37,51,0,Reed Plunkett missed Three Point Jumper.
Hannibal-LaGrange,Southeast Missouri State,50,82,37,51,0,Trevor Ison Offensive Rebound.
Hannibal-LaGrange,Southeast Missouri State,52,82,37,55,1,Trevor Ison made Jumper.
Hannibal-LaGrange,Southeast Missouri State,52,82,38,11,0,Daniel Simmons missed Jumper.
Hannibal-LaGrange,Southeast Missouri State,52,82,38,11,0,Tyler Hill Defensive Rebound.
Hannibal-LaGrange,Southeast Missouri State,52,82,38,25,0,Trevor Ison missed Three Point Jumper.
Hannibal-LaGrange,Southeast Missouri State,52,82,38,25,0,Daniel Simmons Defensive Rebound.
Hannibal-LaGrange,Southeast Missouri State,52,82,38,39,0,Foul on Clay Thebeau.
Hannibal-LaGrange,Southeast Missouri State,52,83,38,39,1,Jaylen Benton made Free Throw.
Hannibal-LaGrange,Southeast Missouri State,52,84,38,39,1,Jaylen Benton made Free Throw.
Hannibal-LaGrange,Southeast Missouri State,52,84,38,48,0,Clay Thebeau Turnover.
Hannibal-LaGrange,Southeast Missouri State,52,84,38,49,0,Jaylen Benton Steal.
Hannibal-LaGrange,Southeast Missouri State,52,86,38,50,1,Jaylen Benton made Layup.
Hannibal-LaGrange,Southeast Missouri State,52,86,39,20,0,Trevor Ison Turnover.
Hannibal-LaGrange,Southeast Missouri State,52,86,39,22,0,Jaylen Benton Steal.
Hannibal-LaGrange,Southeast Missouri State,52,86,39,23,0,Tahj Eaddy Turnover.
Hannibal-LaGrange,Southeast Missouri State,54,86,39,23,1,Clay Thebeau made Layup. Assisted by Tyler Hill.
Hannibal-LaGrange,Southeast Missouri State,54,86,40,0,0,End of Game
