Away Team,Home Team,Away Score, Home Score,Minute,Second,isScoringPosession,Desc.
Hannibal-LaGrange,Southeast Missouri State,0,0,0,22,0,Jaylen Benton missed Three Point Jumper.
Hannibal-LaGrange,Southeast Missouri State,0,0,0,22,0,Trey Kellum Offensive Rebound.
Hannibal-LaGrange,Southeast Missouri State,0,0,0,37,0,Antonius Cleveland missed Three Point Jumper.
Hannibal-LaGrange,Southeast Missouri State,0,0,0,37,0,Denzel Mahoney Offensive Rebound.
Hannibal-LaGrange,Southeast Missouri State,0,0,0,45,0,Jaylen Benton missed Layup.
Hannibal-LaGrange,Southeast Missouri State,0,0,0,45,0,Trey Kellum Offensive Rebound.
Hannibal-LaGrange,Southeast Missouri State,0,0,0,46,0,Foul on Tyler Hill.
Hannibal-LaGrange,Southeast Missouri State,0,3,0,53,1,Jamaal Calvin made Three Point Jumper. Assisted by Jaylen Benton.
Hannibal-LaGrange,Southeast Missouri State,0,3,1,15,0,Demetrius Early missed Layup.
Hannibal-LaGrange,Southeast Missouri State,0,3,1,15,0,Antonius Cleveland Block.
Hannibal-LaGrange,Southeast Missouri State,0,3,1,17,0,Tyler Hill Offensive Rebound.
Hannibal-LaGrange,Southeast Missouri State,0,3,1,20,0,Tyler Hill missed Jumper.
Hannibal-LaGrange,Southeast Missouri State,0,3,1,20,0,Denzel Mahoney Defensive Rebound.
Hannibal-LaGrange,Southeast Missouri State,0,3,1,29,0,Antonius Cleveland missed Jumper.
Hannibal-LaGrange,Southeast Missouri State,0,3,1,29,0,Greg Nicoll Defensive Rebound.
Hannibal-LaGrange,Southeast Missouri State,2,3,1,42,1,Tim Pace made Jumper.
Hannibal-LaGrange,Southeast Missouri State,2,5,1,55,1,Trey Kellum made Layup.
Hannibal-LaGrange,Southeast Missouri State,2,5,1,55,0,Foul on Greg Nicoll.
Hannibal-LaGrange,Southeast Missouri State,2,6,1,55,1,Trey Kellum made Free Throw.
Hannibal-LaGrange,Southeast Missouri State,2,6,2,14,0,Greg Nicoll Turnover.
Hannibal-LaGrange,Southeast Missouri State,2,6,2,15,0,Trey Kellum Steal.
Hannibal-LaGrange,Southeast Missouri State,2,6,2,16,0,Foul on Tim Pace.
Hannibal-LaGrange,Southeast Missouri State,2,7,2,16,1,Denzel Mahoney made Free Throw.
Hannibal-LaGrange,Southeast Missouri State,2,8,2,16,1,Denzel Mahoney made Free Throw.
Hannibal-LaGrange,Southeast Missouri State,2,8,2,43,0,Tyler Hill missed Three Point Jumper.
Hannibal-LaGrange,Southeast Missouri State,2,8,2,43,0,Jamaal Calvin Defensive Rebound.
Hannibal-LaGrange,Southeast Missouri State,2,8,2,57,0,Trey Kellum missed Jumper.
Hannibal-LaGrange,Southeast Missouri State,2,8,2,57,0,Tim Pace Defensive Rebound.
Hannibal-LaGrange,Southeast Missouri State,2,8,3,1,0,Tim Pace Turnover.
Hannibal-LaGrange,Southeast Missouri State,2,8,3,3,0,Jaylen Benton Steal.
Hannibal-LaGrange,Southeast Missouri State,2,8,3,8,0,Foul on Greg Nicoll.
Hannibal-LaGrange,Southeast Missouri State,2,9,3,11,1,Trey Kellum made Free Throw.
Hannibal-LaGrange,Southeast Missouri State,2,10,3,11,1,Trey Kellum made Free Throw.
Hannibal-LaGrange,Southeast Missouri State,2,10,3,33,0,Foul on Jaylen Benton.
Hannibal-LaGrange,Southeast Missouri State,2,10,3,53,0,Tyler Hill Turnover.
Hannibal-LaGrange,Southeast Missouri State,2,10,4,10,0,SE Missouri St  Timeout
Hannibal-LaGrange,Southeast Missouri State,2,10,4,19,0,Milos Vranes missed Three Point Jumper.
Hannibal-LaGrange,Southeast Missouri State,2,10,4,19,0,Demetrius Early Defensive Rebound.
Hannibal-LaGrange,Southeast Missouri State,2,10,4,42,0,Demetrius Early Turnover.
Hannibal-LaGrange,Southeast Missouri State,2,10,4,44,0,Antonius Cleveland Steal.
Hannibal-LaGrange,Southeast Missouri State,2,12,4,47,1,Trey Kellum made Jumper. Assisted by Antonius Cleveland.
Hannibal-LaGrange,Southeast Missouri State,5,12,5,4,1,Tim Pace made Three Point Jumper. Assisted by Demetrius Early.
Hannibal-LaGrange,Southeast Missouri State,5,12,5,30,0,Dondre Duffus missed Layup.
Hannibal-LaGrange,Southeast Missouri State,5,12,5,30,0,Tyler Hill Defensive Rebound.
Hannibal-LaGrange,Southeast Missouri State,5,12,5,36,0,Demetrius Early Turnover.
Hannibal-LaGrange,Southeast Missouri State,5,12,5,38,0,Tahj Eaddy Steal.
Hannibal-LaGrange,Southeast Missouri State,5,15,5,48,1,Tahj Eaddy made Three Point Jumper. Assisted by Daniel Simmons.
Hannibal-LaGrange,Southeast Missouri State,7,15,6,8,1,D'Avonte Garland made Jumper. Assisted by Demetrius Early.
Hannibal-LaGrange,Southeast Missouri State,7,15,6,22,0,Tahj Eaddy missed Jumper.
Hannibal-LaGrange,Southeast Missouri State,7,15,6,22,0,Hannibal-Lagrange Defensive Rebound.
Hannibal-LaGrange,Southeast Missouri State,10,15,6,34,1,Demetrius Early made Three Point Jumper. Assisted by D'Avonte Garland.
Hannibal-LaGrange,Southeast Missouri State,10,15,6,57,0,Milos Vranes missed Three Point Jumper.
Hannibal-LaGrange,Southeast Missouri State,10,15,6,57,0,De'Shawn Terrell Defensive Rebound.
Hannibal-LaGrange,Southeast Missouri State,10,15,7,14,0,Tim Pace Turnover.
Hannibal-LaGrange,Southeast Missouri State,10,15,7,23,0,Dondre Duffus missed Layup.
Hannibal-LaGrange,Southeast Missouri State,10,15,7,23,0,Dondre Duffus Offensive Rebound.
Hannibal-LaGrange,Southeast Missouri State,10,17,7,26,1,Dondre Duffus made Jumper.
Hannibal-LaGrange,Southeast Missouri State,12,17,7,43,1,Tim Pace made Jumper.
Hannibal-LaGrange,Southeast Missouri State,12,17,8,3,0,Denzel Mahoney missed Three Point Jumper.
Hannibal-LaGrange,Southeast Missouri State,12,17,8,3,0,Denzel Mahoney Offensive Rebound.
Hannibal-LaGrange,Southeast Missouri State,12,17,8,7,0,Denzel Mahoney missed Jumper.
Hannibal-LaGrange,Southeast Missouri State,12,17,8,7,0,Milos Vranes Offensive Rebound.
Hannibal-LaGrange,Southeast Missouri State,12,17,8,7,0,Foul on Demetrius Early.
Hannibal-LaGrange,Southeast Missouri State,12,17,8,15,0,SE Missouri St  Timeout
Hannibal-LaGrange,Southeast Missouri State,12,18,8,18,1,Milos Vranes made Free Throw.
Hannibal-LaGrange,Southeast Missouri State,12,19,8,18,1,Milos Vranes made Free Throw.
Hannibal-LaGrange,Southeast Missouri State,15,19,8,36,1,Demetrius Early made Three Point Jumper. Assisted by De'Shawn Terrell.
Hannibal-LaGrange,Southeast Missouri State,15,19,8,57,0,Daniel Simmons missed Three Point Jumper.
Hannibal-LaGrange,Southeast Missouri State,15,19,8,57,0,Tim Pace Defensive Rebound.
Hannibal-LaGrange,Southeast Missouri State,15,19,8,59,0,Foul on Trey Kellum.
Hannibal-LaGrange,Southeast Missouri State,15,19,9,11,0,De'Shawn Terrell Turnover.
Hannibal-LaGrange,Southeast Missouri State,15,21,9,43,1,Jonathan Dalton made Layup.
Hannibal-LaGrange,Southeast Missouri State,15,21,10,11,0,D'Avonte Garland missed Three Point Jumper.
Hannibal-LaGrange,Southeast Missouri State,15,21,10,11,0,Jordan Hickman Offensive Rebound.
Hannibal-LaGrange,Southeast Missouri State,17,21,10,14,1,Jordan Hickman made Jumper.
Hannibal-LaGrange,Southeast Missouri State,17,21,10,30,0,Antonius Cleveland missed Jumper.
Hannibal-LaGrange,Southeast Missouri State,17,21,10,30,0,D'Avonte Garland Defensive Rebound.
Hannibal-LaGrange,Southeast Missouri State,17,21,10,51,0,De'Shawn Terrell Turnover.
Hannibal-LaGrange,Southeast Missouri State,17,21,10,51,0,Foul on De'Shawn Terrell.
Hannibal-LaGrange,Southeast Missouri State,17,21,11,16,0,Jonathan Dalton missed Three Point Jumper.
Hannibal-LaGrange,Southeast Missouri State,17,21,11,16,0,Tim Pace Defensive Rebound.
Hannibal-LaGrange,Southeast Missouri State,19,21,11,27,1,Tim Pace made Layup. Assisted by D'Avonte Garland.
Hannibal-LaGrange,Southeast Missouri State,19,23,11,52,1,Antonius Cleveland made Dunk. Assisted by Jonathan Dalton.
Hannibal-LaGrange,Southeast Missouri State,19,23,12,15,0,Foul on Jonathan Dalton.
Hannibal-LaGrange,Southeast Missouri State,19,23,12,15,0,Hannibal-Lagrange  Timeout
Hannibal-LaGrange,Southeast Missouri State,19,23,12,36,0,De'Shawn Terrell missed Jumper.
Hannibal-LaGrange,Southeast Missouri State,19,23,12,36,0,Trey Kellum Defensive Rebound.
Hannibal-LaGrange,Southeast Missouri State,19,23,12,43,0,Jaylen Benton missed Three Point Jumper.
Hannibal-LaGrange,Southeast Missouri State,19,23,12,43,0,Hannibal-Lagrange Defensive Rebound.
Hannibal-LaGrange,Southeast Missouri State,19,23,12,59,0,Adam Ingle missed Three Point Jumper.
Hannibal-LaGrange,Southeast Missouri State,19,23,12,59,0,Antonius Cleveland Defensive Rebound.
Hannibal-LaGrange,Southeast Missouri State,19,23,13,6,0,Antonius Cleveland Turnover.
Hannibal-LaGrange,Southeast Missouri State,19,23,13,36,0,Foul on Denzel Mahoney.
Hannibal-LaGrange,Southeast Missouri State,19,23,13,41,0,De'Shawn Terrell Turnover.
Hannibal-LaGrange,Southeast Missouri State,19,23,13,43,0,Jamaal Calvin Steal.
Hannibal-LaGrange,Southeast Missouri State,19,25,13,45,1,Antonius Cleveland made Dunk. Assisted by Jamaal Calvin.
Hannibal-LaGrange,Southeast Missouri State,19,25,14,6,0,Trevor Ison missed Three Point Jumper.
Hannibal-LaGrange,Southeast Missouri State,19,25,14,6,0,Adam Ingle Offensive Rebound.
Hannibal-LaGrange,Southeast Missouri State,22,25,14,11,1,De'Shawn Terrell made Three Point Jumper. Assisted by Adam Ingle.
Hannibal-LaGrange,Southeast Missouri State,22,25,14,23,0,Trey Kellum Turnover.
Hannibal-LaGrange,Southeast Missouri State,22,25,14,23,0,Foul on Trey Kellum.
Hannibal-LaGrange,Southeast Missouri State,25,25,14,38,1,Tim Pace made Three Point Jumper.
Hannibal-LaGrange,Southeast Missouri State,25,27,14,54,1,Antonius Cleveland made Layup. Assisted by Tahj Eaddy.
Hannibal-LaGrange,Southeast Missouri State,25,27,15,18,0,Trevor Ison missed Jumper.
Hannibal-LaGrange,Southeast Missouri State,25,27,15,18,0,Jamaal Calvin Defensive Rebound.
Hannibal-LaGrange,Southeast Missouri State,25,27,15,23,0,Tahj Eaddy missed Three Point Jumper.
Hannibal-LaGrange,Southeast Missouri State,25,27,15,23,0,Izack Hively Defensive Rebound.
Hannibal-LaGrange,Southeast Missouri State,28,27,15,43,1,Izack Hively made Three Point Jumper. Assisted by Adam Ingle.
Hannibal-LaGrange,Southeast Missouri State,28,29,16,0,1,Milos Vranes made Jumper. Assisted by Tahj Eaddy.
Hannibal-LaGrange,Southeast Missouri State,28,29,16,9,0,Foul on Jamaal Calvin.
Hannibal-LaGrange,Southeast Missouri State,28,29,16,13,0,Hannibal-Lagrange  Timeout
Hannibal-LaGrange,Southeast Missouri State,28,29,16,31,0,Adam Ingle Turnover.
Hannibal-LaGrange,Southeast Missouri State,28,29,16,32,0,Denzel Mahoney Steal.
Hannibal-LaGrange,Southeast Missouri State,28,29,16,49,0,Tahj Eaddy missed Layup.
Hannibal-LaGrange,Southeast Missouri State,28,29,16,49,0,Demetrius Early Defensive Rebound.
Hannibal-LaGrange,Southeast Missouri State,28,29,16,49,0,Foul on Tahj Eaddy.
Hannibal-LaGrange,Southeast Missouri State,28,29,16,49,0,Demetrius Early missed Free Throw.
Hannibal-LaGrange,Southeast Missouri State,28,29,16,49,0,Milos Vranes Defensive Rebound.
Hannibal-LaGrange,Southeast Missouri State,28,31,17,5,1,Denzel Mahoney made Jumper.
Hannibal-LaGrange,Southeast Missouri State,31,31,17,23,1,Demetrius Early made Three Point Jumper. Assisted by Trevor Ison.
Hannibal-LaGrange,Southeast Missouri State,31,34,17,41,1,Denzel Mahoney made Three Point Jumper. Assisted by Dondre Duffus.
Hannibal-LaGrange,Southeast Missouri State,31,34,18,0,0,Trevor Ison missed Three Point Jumper.
Hannibal-LaGrange,Southeast Missouri State,31,34,18,0,0,Daniel Simmons Defensive Rebound.
Hannibal-LaGrange,Southeast Missouri State,31,34,18,6,0,Jonathan Dalton Turnover.
Hannibal-LaGrange,Southeast Missouri State,31,34,18,7,0,Demetrius Early Steal.
Hannibal-LaGrange,Southeast Missouri State,31,34,18,9,0,Adam Ingle Turnover.
Hannibal-LaGrange,Southeast Missouri State,31,34,18,10,0,Dondre Duffus Steal.
Hannibal-LaGrange,Southeast Missouri State,31,36,18,13,1,Milos Vranes made Layup.
Hannibal-LaGrange,Southeast Missouri State,31,36,18,40,0,Demetrius Early missed Three Point Jumper.
Hannibal-LaGrange,Southeast Missouri State,31,36,18,40,0,Trevor Ison Offensive Rebound.
Hannibal-LaGrange,Southeast Missouri State,31,36,18,44,0,Trevor Ison missed Jumper.
Hannibal-LaGrange,Southeast Missouri State,31,36,18,44,0,Izack Hively Offensive Rebound.
Hannibal-LaGrange,Southeast Missouri State,31,36,18,51,0,Demetrius Early Turnover.
Hannibal-LaGrange,Southeast Missouri State,31,36,18,52,0,Milos Vranes Steal.
Hannibal-LaGrange,Southeast Missouri State,31,36,19,14,0,Daniel Simmons missed Three Point Jumper.
Hannibal-LaGrange,Southeast Missouri State,31,36,19,14,0,Hannibal-Lagrange Defensive Rebound.
Hannibal-LaGrange,Southeast Missouri State,31,36,19,18,0,D'Avonte Garland missed Three Point Jumper.
Hannibal-LaGrange,Southeast Missouri State,31,36,19,18,0,Denzel Mahoney Defensive Rebound.
Hannibal-LaGrange,Southeast Missouri State,31,38,19,44,1,Jonathan Dalton made Jumper.
Hannibal-LaGrange,Southeast Missouri State,31,38,20,0,0,End of 1st half
Hannibal-LaGrange,Southeast Missouri State,31,38,20,13,0,D'Avonte Garland Turnover.
Hannibal-LaGrange,Southeast Missouri State,31,38,20,15,0,Jamaal Calvin Steal.
Hannibal-LaGrange,Southeast Missouri State,31,38,20,31,0,Antonius Cleveland missed Jumper.
Hannibal-LaGrange,Southeast Missouri State,31,38,20,31,0,Tim Pace Defensive Rebound.
Hannibal-LaGrange,Southeast Missouri State,31,38,20,42,0,Foul on Denzel Mahoney.
Hannibal-LaGrange,Southeast Missouri State,31,38,20,42,0,Hannibal-Lagrange  Turnover.
Hannibal-LaGrange,Southeast Missouri State,31,38,20,59,0,Trey Kellum missed Jumper.
Hannibal-LaGrange,Southeast Missouri State,31,38,20,59,0,Greg Nicoll Defensive Rebound.
Hannibal-LaGrange,Southeast Missouri State,31,38,21,14,0,Greg Nicoll Turnover.
Hannibal-LaGrange,Southeast Missouri State,31,38,21,36,0,Foul on D'Avonte Garland.
Hannibal-LaGrange,Southeast Missouri State,31,39,21,36,1,Dondre Duffus made Free Throw.
Hannibal-LaGrange,Southeast Missouri State,31,40,21,38,1,Dondre Duffus made Free Throw.
Hannibal-LaGrange,Southeast Missouri State,31,40,21,40,0,Demetrius Early Turnover.
Hannibal-LaGrange,Southeast Missouri State,31,40,21,40,0,Jamaal Calvin Steal.
Hannibal-LaGrange,Southeast Missouri State,31,40,21,41,0,Foul on D'Avonte Garland.
Hannibal-LaGrange,Southeast Missouri State,31,40,21,42,0,Trey Kellum Turnover.
Hannibal-LaGrange,Southeast Missouri State,31,40,22,5,0,Foul on Jamaal Calvin.
Hannibal-LaGrange,Southeast Missouri State,33,40,22,27,1,D'Avonte Garland made Jumper. Assisted by Demetrius Early.
Hannibal-LaGrange,Southeast Missouri State,33,40,22,27,0,Foul on Denzel Mahoney.
Hannibal-LaGrange,Southeast Missouri State,33,40,22,27,0,D'Avonte Garland missed Free Throw.
Hannibal-LaGrange,Southeast Missouri State,33,40,22,27,0,Antonius Cleveland Defensive Rebound.
Hannibal-LaGrange,Southeast Missouri State,33,42,22,33,1,Denzel Mahoney made Jumper.
Hannibal-LaGrange,Southeast Missouri State,33,42,22,54,0,D'Avonte Garland Turnover.
Hannibal-LaGrange,Southeast Missouri State,33,42,22,56,0,Dondre Duffus Steal.
Hannibal-LaGrange,Southeast Missouri State,33,42,23,2,0,Foul on D'Avonte Garland.
Hannibal-LaGrange,Southeast Missouri State,33,43,23,2,1,Denzel Mahoney made Free Throw.
Hannibal-LaGrange,Southeast Missouri State,33,44,23,2,1,Denzel Mahoney made Free Throw.
Hannibal-LaGrange,Southeast Missouri State,33,44,23,19,0,Demetrius Early Turnover.
Hannibal-LaGrange,Southeast Missouri State,33,44,23,20,0,Jamaal Calvin Steal.
Hannibal-LaGrange,Southeast Missouri State,33,46,23,23,1,Antonius Cleveland made Dunk. Assisted by Dondre Duffus.
Hannibal-LaGrange,Southeast Missouri State,36,46,23,36,1,Tim Pace made Three Point Jumper. Assisted by De'Shawn Terrell.
Hannibal-LaGrange,Southeast Missouri State,36,46,23,54,0,Jamaal Calvin missed Three Point Jumper.
Hannibal-LaGrange,Southeast Missouri State,36,46,23,54,0,Hannibal-Lagrange Defensive Rebound.
Hannibal-LaGrange,Southeast Missouri State,36,46,23,57,0,Foul on Trey Kellum.
Hannibal-LaGrange,Southeast Missouri State,36,46,24,17,0,Tyler Hill missed Jumper.
Hannibal-LaGrange,Southeast Missouri State,36,46,24,17,0,Tim Pace Offensive Rebound.
Hannibal-LaGrange,Southeast Missouri State,36,46,24,21,0,De'Shawn Terrell missed Three Point Jumper.
Hannibal-LaGrange,Southeast Missouri State,36,46,24,21,0,Jamaal Calvin Defensive Rebound.
Hannibal-LaGrange,Southeast Missouri State,36,48,24,27,1,Antonius Cleveland made Jumper. Assisted by Jamaal Calvin.
Hannibal-LaGrange,Southeast Missouri State,36,48,24,35,0,Foul on Dondre Duffus.
Hannibal-LaGrange,Southeast Missouri State,36,48,24,35,0,Hannibal-Lagrange  Timeout
Hannibal-LaGrange,Southeast Missouri State,39,48,25,1,1,Greg Nicoll made Three Point Jumper.
Hannibal-LaGrange,Southeast Missouri State,39,48,25,30,0,Jamaal Calvin missed Layup.
Hannibal-LaGrange,Southeast Missouri State,39,48,25,30,0,Tim Pace Defensive Rebound.
Hannibal-LaGrange,Southeast Missouri State,41,48,25,37,1,Greg Nicoll made Jumper. Assisted by Tim Pace.
Hannibal-LaGrange,Southeast Missouri State,41,48,25,54,0,Foul on Demetrius Early.
Hannibal-LaGrange,Southeast Missouri State,41,48,26,9,0,Foul on Jordan Hickman.
Hannibal-LaGrange,Southeast Missouri State,41,48,26,19,0,Antonius Cleveland missed Three Point Jumper.
Hannibal-LaGrange,Southeast Missouri State,41,48,26,19,0,Demetrius Early Defensive Rebound.
Hannibal-LaGrange,Southeast Missouri State,41,48,26,44,0,De'Shawn Terrell Turnover.
Hannibal-LaGrange,Southeast Missouri State,41,48,27,6,0,Foul on Tim Pace.
Hannibal-LaGrange,Southeast Missouri State,41,49,27,6,1,Daniel Simmons made Free Throw.
Hannibal-LaGrange,Southeast Missouri State,41,49,27,6,0,Daniel Simmons missed Free Throw.
Hannibal-LaGrange,Southeast Missouri State,41,49,27,6,0,Jordan Hickman Defensive Rebound.
Hannibal-LaGrange,Southeast Missouri State,43,49,27,19,1,Tim Pace made Layup.
Hannibal-LaGrange,Southeast Missouri State,43,51,27,34,1,Daniel Simmons made Layup.
Hannibal-LaGrange,Southeast Missouri State,43,51,27,49,0,Foul on Antonius Cleveland.
Hannibal-LaGrange,Southeast Missouri State,43,51,27,52,0,Jordan Hickman Turnover.
Hannibal-LaGrange,Southeast Missouri State,43,51,27,52,0,Denzel Mahoney Steal.
Hannibal-LaGrange,Southeast Missouri State,43,51,27,53,0,Denzel Mahoney Turnover.
Hannibal-LaGrange,Southeast Missouri State,43,51,27,53,0,Foul on Denzel Mahoney.
Hannibal-LaGrange,Southeast Missouri State,43,51,28,9,0,Foul on Milos Vranes.
Hannibal-LaGrange,Southeast Missouri State,43,51,28,9,0,Hannibal-Lagrange  Timeout
Hannibal-LaGrange,Southeast Missouri State,43,51,28,9,0,De'Shawn Terrell missed Free Throw.
Hannibal-LaGrange,Southeast Missouri State,43,51,28,9,0,Hannibal-Lagrange Deadball Team Rebound.
Hannibal-LaGrange,Southeast Missouri State,44,51,28,9,1,De'Shawn Terrell made Free Throw.
Hannibal-LaGrange,Southeast Missouri State,44,51,28,32,0,Milos Vranes missed Three Point Jumper.
Hannibal-LaGrange,Southeast Missouri State,44,51,28,32,0,Jordan Hickman Defensive Rebound.
Hannibal-LaGrange,Southeast Missouri State,44,51,28,41,0,De'Shawn Terrell Turnover.
Hannibal-LaGrange,Southeast Missouri State,44,51,28,42,0,Jonathan Dalton Steal.
Hannibal-LaGrange,Southeast Missouri State,44,51,28,44,0,Foul on Greg Nicoll.
Hannibal-LaGrange,Southeast Missouri State,44,51,28,44,0,Jonathan Dalton missed Free Throw.
Hannibal-LaGrange,Southeast Missouri State,44,51,28,44,0,SE Missouri St Deadball Team Rebound.
Hannibal-LaGrange,Southeast Missouri State,44,52,28,44,1,Jonathan Dalton made Free Throw.
Hannibal-LaGrange,Southeast Missouri State,44,52,29,7,0,Foul on Jonathan Dalton.
Hannibal-LaGrange,Southeast Missouri State,45,52,29,10,1,De'Shawn Terrell made Free Throw.
Hannibal-LaGrange,Southeast Missouri State,45,52,29,10,0,De'Shawn Terrell missed Free Throw.
Hannibal-LaGrange,Southeast Missouri State,45,52,29,10,0,Trey Kellum Defensive Rebound.
Hannibal-LaGrange,Southeast Missouri State,45,52,29,34,0,Trey Kellum missed Layup.
Hannibal-LaGrange,Southeast Missouri State,45,52,29,34,0,Trey Kellum Offensive Rebound.
Hannibal-LaGrange,Southeast Missouri State,45,52,29,37,0,Jonathan Dalton Turnover.
Hannibal-LaGrange,Southeast Missouri State,45,52,29,37,0,Jordan Hickman Steal.
Hannibal-LaGrange,Southeast Missouri State,45,52,29,56,0,Tim Pace missed Three Point Jumper.
Hannibal-LaGrange,Southeast Missouri State,45,52,29,56,0,Milos Vranes Defensive Rebound.
Hannibal-LaGrange,Southeast Missouri State,45,52,30,6,0,Daniel Simmons missed Layup.
Hannibal-LaGrange,Southeast Missouri State,45,52,30,6,0,Tim Pace Block.
Hannibal-LaGrange,Southeast Missouri State,45,52,30,6,0,SE Missouri St Offensive Rebound.
Hannibal-LaGrange,Southeast Missouri State,45,52,30,17,0,Jaylen Benton Turnover.
Hannibal-LaGrange,Southeast Missouri State,45,52,30,32,0,Jordan Hickman Turnover.
Hannibal-LaGrange,Southeast Missouri State,45,52,30,32,0,Milos Vranes Steal.
Hannibal-LaGrange,Southeast Missouri State,45,52,30,32,0,Foul on Jordan Hickman.
Hannibal-LaGrange,Southeast Missouri State,45,53,30,34,1,Milos Vranes made Free Throw.
Hannibal-LaGrange,Southeast Missouri State,45,54,30,34,1,Milos Vranes made Free Throw.
Hannibal-LaGrange,Southeast Missouri State,47,54,30,55,1,Tim Pace made Layup. Assisted by De'Shawn Terrell.
Hannibal-LaGrange,Southeast Missouri State,47,57,31,13,1,Milos Vranes made Three Point Jumper. Assisted by Jamaal Calvin.
Hannibal-LaGrange,Southeast Missouri State,47,57,31,36,0,Izack Hively missed Layup.
Hannibal-LaGrange,Southeast Missouri State,47,57,31,36,0,Dondre Duffus Block.
Hannibal-LaGrange,Southeast Missouri State,47,57,31,36,0,Jamaal Calvin Defensive Rebound.
Hannibal-LaGrange,Southeast Missouri State,47,57,31,43,0,Trey Kellum missed Layup.
Hannibal-LaGrange,Southeast Missouri State,47,57,31,43,0,Milos Vranes Offensive Rebound.
Hannibal-LaGrange,Southeast Missouri State,47,59,31,58,1,Dondre Duffus made Jumper.
Hannibal-LaGrange,Southeast Missouri State,47,59,32,12,0,Jordan Hickman Turnover.
Hannibal-LaGrange,Southeast Missouri State,47,59,32,12,0,Jamaal Calvin Steal.
Hannibal-LaGrange,Southeast Missouri State,47,61,32,13,1,Antonius Cleveland made Layup. Assisted by Milos Vranes.
Hannibal-LaGrange,Southeast Missouri State,47,61,32,17,0,Foul on Izack Hively.
Hannibal-LaGrange,Southeast Missouri State,47,61,32,18,0,SE Missouri St  Timeout
Hannibal-LaGrange,Southeast Missouri State,47,62,32,18,1,Antonius Cleveland made Free Throw.
Hannibal-LaGrange,Southeast Missouri State,47,62,32,28,0,Demetrius Early Turnover.
Hannibal-LaGrange,Southeast Missouri State,47,62,32,28,0,Antonius Cleveland Steal.
Hannibal-LaGrange,Southeast Missouri State,47,62,32,28,0,Foul on Tim Pace.
Hannibal-LaGrange,Southeast Missouri State,47,63,32,28,1,Antonius Cleveland made Free Throw.
Hannibal-LaGrange,Southeast Missouri State,47,63,32,28,0,Antonius Cleveland missed Free Throw.
Hannibal-LaGrange,Southeast Missouri State,47,63,32,28,0,Tim Pace Defensive Rebound.
Hannibal-LaGrange,Southeast Missouri State,47,63,32,44,0,Tim Pace Turnover.
Hannibal-LaGrange,Southeast Missouri State,47,63,32,45,0,Jamaal Calvin Steal.
Hannibal-LaGrange,Southeast Missouri State,47,65,32,51,1,Trey Kellum made Jumper. Assisted by Dondre Duffus.
Hannibal-LaGrange,Southeast Missouri State,47,65,33,5,0,Tim Pace missed Three Point Jumper.
Hannibal-LaGrange,Southeast Missouri State,47,65,33,5,0,Milos Vranes Defensive Rebound.
Hannibal-LaGrange,Southeast Missouri State,47,67,33,13,1,Antonius Cleveland made Layup. Assisted by Jamaal Calvin.
Hannibal-LaGrange,Southeast Missouri State,47,67,33,15,0,Hannibal-Lagrange  Timeout
Hannibal-LaGrange,Southeast Missouri State,47,67,33,30,0,Izack Hively Turnover.
Hannibal-LaGrange,Southeast Missouri State,47,67,33,32,0,Dondre Duffus Steal.
Hannibal-LaGrange,Southeast Missouri State,47,69,33,33,1,Dondre Duffus made Layup.
Hannibal-LaGrange,Southeast Missouri State,47,69,33,55,0,Demetrius Early Turnover.
Hannibal-LaGrange,Southeast Missouri State,47,69,33,56,0,Dondre Duffus Steal.
Hannibal-LaGrange,Southeast Missouri State,47,71,34,5,1,Dondre Duffus made Layup. Assisted by Jamaal Calvin.
Hannibal-LaGrange,Southeast Missouri State,47,71,34,25,0,Adam Ingle Turnover.
Hannibal-LaGrange,Southeast Missouri State,47,71,34,27,0,Antonius Cleveland Steal.
Hannibal-LaGrange,Southeast Missouri State,47,73,34,31,1,Dondre Duffus made Dunk. Assisted by Antonius Cleveland.
Hannibal-LaGrange,Southeast Missouri State,47,73,34,42,0,Trevor Ison missed Jumper.
Hannibal-LaGrange,Southeast Missouri State,47,73,34,42,0,Dondre Duffus Defensive Rebound.
Hannibal-LaGrange,Southeast Missouri State,47,73,34,57,0,Jamaal Calvin missed Three Point Jumper.
Hannibal-LaGrange,Southeast Missouri State,47,73,34,57,0,Trey Kellum Offensive Rebound.
Hannibal-LaGrange,Southeast Missouri State,47,75,35,1,1,Trey Kellum made Jumper.
Hannibal-LaGrange,Southeast Missouri State,47,75,35,19,0,Foul on Jamaal Calvin.
Hannibal-LaGrange,Southeast Missouri State,47,75,35,19,0,Demetrius Early missed Free Throw.
Hannibal-LaGrange,Southeast Missouri State,47,75,35,19,0,Hannibal-Lagrange Deadball Team Rebound.
Hannibal-LaGrange,Southeast Missouri State,48,75,35,21,1,Demetrius Early made Free Throw.
Hannibal-LaGrange,Southeast Missouri State,48,75,35,21,0,Daniel Simmons missed Three Point Jumper.
Hannibal-LaGrange,Southeast Missouri State,48,75,35,21,0,Trey Kellum Offensive Rebound.
Hannibal-LaGrange,Southeast Missouri State,48,78,35,21,1,Tahj Eaddy made Three Point Jumper. Assisted by Jaylen Benton.
Hannibal-LaGrange,Southeast Missouri State,48,78,36,1,0,Izack Hively missed Jumper.
Hannibal-LaGrange,Southeast Missouri State,48,78,36,1,0,Trey Kellum Block.
Hannibal-LaGrange,Southeast Missouri State,48,78,36,3,0,Jaylen Benton Defensive Rebound.
Hannibal-LaGrange,Southeast Missouri State,48,78,36,6,0,Tahj Eaddy missed Three Point Jumper.
Hannibal-LaGrange,Southeast Missouri State,48,78,36,6,0,SE Missouri St Offensive Rebound.
Hannibal-LaGrange,Southeast Missouri State,48,78,36,12,0,SE Missouri St  Timeout
Hannibal-LaGrange,Southeast Missouri State,48,78,36,26,0,Eli Sample missed Jumper.
Hannibal-LaGrange,Southeast Missouri State,48,78,36,26,0,Trevor Ison Defensive Rebound.
Hannibal-LaGrange,Southeast Missouri State,48,78,36,47,0,Trevor Ison missed Jumper.
