Away Team,Home Team,Away Score,Home Score,Minute,Second,isScoringPosession,Desc.
Chadron State,South Dakota State,48,82,36,40,1,Tevin King made Layup.
Chadron State,South Dakota State,48,82,36,40,0,Foul on Sharif Black.
Chadron State,South Dakota State,48,83,36,40,1,Tevin King made Free Throw.
Chadron State,South Dakota State,48,83,37,2,0,Foul on Connor Devine.
Chadron State,South Dakota State,48,83,37,2,0,Jordan Perry missed Free Throw.
Chadron State,South Dakota State,48,83,37,2,0,Chadron St Deadball Team Rebound.
Chadron State,South Dakota State,48,83,37,2,0,Jordan Perry missed Free Throw.
Chadron State,South Dakota State,48,83,37,2,0,Lane Severyn Defensive Rebound.
Chadron State,South Dakota State,48,83,37,15,0,Foul on Davante McCallam.
Chadron State,South Dakota State,48,84,37,15,1,Tevin King made Free Throw.
Chadron State,South Dakota State,48,85,37,15,1,Tevin King made Free Throw.
Chadron State,South Dakota State,48,85,37,35,0,Justyn Anderson Turnover.
Chadron State,South Dakota State,48,85,37,35,0,Logan Doyle Steal.
Chadron State,South Dakota State,48,85,37,51,0,Cory Jacobsen missed Three Point Jumper.
Chadron State,South Dakota State,48,85,37,51,0,Chadron St Defensive Rebound.
Chadron State,South Dakota State,48,85,38,9,0,Leigh Saffin missed Layup.
Chadron State,South Dakota State,48,85,38,9,0,Connor Devine Block.
Chadron State,South Dakota State,48,85,38,11,0,Justyn Anderson Offensive Rebound.
Chadron State,South Dakota State,50,85,38,14,1,Justyn Anderson made Layup.
Chadron State,South Dakota State,50,85,38,26,0,Lane Severyn Turnover.
Chadron State,South Dakota State,50,85,38,27,0,Leigh Saffin Steal.
Chadron State,South Dakota State,50,85,38,32,0,Jordan Perry Turnover.
Chadron State,South Dakota State,50,85,38,32,0,Foul on Jordan Perry.
Chadron State,South Dakota State,50,85,38,49,0,Logan Doyle missed Layup.
Chadron State,South Dakota State,50,85,38,49,0,Jay Feltson Defensive Rebound.
Chadron State,South Dakota State,50,85,39,0,0,Jay Feltson missed Jumper.
Chadron State,South Dakota State,50,85,39,0,0,Andre Miller Offensive Rebound.
Chadron State,South Dakota State,50,85,39,4,0,Andre Miller missed Layup.
Chadron State,South Dakota State,50,85,39,4,0,Lane Severyn Defensive Rebound.
Chadron State,South Dakota State,50,85,39,13,0,Lane Severyn missed Three Point Jumper.
Chadron State,South Dakota State,50,85,39,13,0,Logan Doyle Offensive Rebound.
Chadron State,South Dakota State,50,85,39,17,0,Logan Doyle missed Layup.
Chadron State,South Dakota State,50,85,39,17,0,Andre Miller Defensive Rebound.
Chadron State,South Dakota State,50,85,39,19,0,Foul on Lane Severyn.
Chadron State,South Dakota State,51,85,39,19,1,Andre Miller made Free Throw.
Chadron State,South Dakota State,52,85,39,19,1,Andre Miller made Free Throw.
Chadron State,South Dakota State,52,87,39,37,1,Logan Doyle made Layup. Assisted by Lane Severyn.
Chadron State,South Dakota State,52,87,39,49,0,Justyn Anderson Turnover.
Chadron State,South Dakota State,52,87,39,49,0,Foul on Justyn Anderson.
Chadron State,South Dakota State,52,87,40,0,0,End of Game
