Away Team,Home Team,Away Score,Home Score,Minute,Second,isScoringPosession,Desc.
Harvard,Columbia,0,0,0,32,0,Maodo Lo missed Three Point Jumper.
Harvard,Columbia,0,0,0,32,0,Harvard Defensive Rebound.
Harvard,Columbia,0,0,0,41,0,Evan Cummins Turnover.
Harvard,Columbia,0,2,1,1,1,Alex Rosenberg made Layup. Assisted by Jeff Coby.
Harvard,Columbia,0,2,1,1,0,Foul on Agunwa Okolie.
Harvard,Columbia,0,3,1,1,1,Alex Rosenberg made Free Throw.
Harvard,Columbia,2,3,1,15,1,Tommy McCarthy made Jumper. Assisted by Zena Edosomwan.
Harvard,Columbia,2,5,1,22,1,Luke Petrasek made Layup. Assisted by Maodo Lo.
Harvard,Columbia,4,5,1,33,1,Evan Cummins made Layup. Assisted by Tommy McCarthy.
Harvard,Columbia,4,5,1,54,0,Jeff Coby missed Dunk.
Harvard,Columbia,4,5,1,54,0,Zena Edosomwan Defensive Rebound.
Harvard,Columbia,6,5,2,23,1,Agunwa Okolie made Jumper. Assisted by Zena Edosomwan.
Harvard,Columbia,6,5,2,34,0,Foul on Zena Edosomwan.
Harvard,Columbia,6,6,2,34,1,Jeff Coby made Free Throw.
Harvard,Columbia,6,7,2,34,1,Jeff Coby made Free Throw.
Harvard,Columbia,6,7,2,47,0,Tommy McCarthy Turnover.
Harvard,Columbia,6,7,2,48,0,Maodo Lo Steal.
Harvard,Columbia,6,9,2,51,1,Alex Rosenberg made Layup. Assisted by Maodo Lo.
Harvard,Columbia,6,9,3,3,0,Zena Edosomwan missed Layup.
Harvard,Columbia,6,9,3,3,0,Jeff Coby Block.
Harvard,Columbia,6,9,3,4,0,Alex Rosenberg Defensive Rebound.
Harvard,Columbia,6,9,3,16,0,Maodo Lo Turnover.
Harvard,Columbia,6,9,3,17,0,Corbin Miller Steal.
Harvard,Columbia,6,9,3,27,0,Corey Johnson Turnover.
Harvard,Columbia,6,9,3,27,0,Grant Mullins Steal.
Harvard,Columbia,6,11,3,36,1,Grant Mullins made Layup.
Harvard,Columbia,6,11,3,54,0,Zena Edosomwan Turnover.
Harvard,Columbia,6,11,3,56,0,Jeff Coby Steal.
Harvard,Columbia,6,14,4,10,1,Alex Rosenberg made Three Point Jumper. Assisted by Luke Petrasek.
Harvard,Columbia,6,14,4,13,0,Official TV Timeout
Harvard,Columbia,6,14,4,45,0,Harvard  Turnover.
Harvard,Columbia,6,14,4,58,0,Luke Petrasek Turnover.
Harvard,Columbia,6,14,4,58,0,Foul on Luke Petrasek.
Harvard,Columbia,6,14,5,14,0,Weisner Perez missed Jumper.
Harvard,Columbia,6,14,5,14,0,Maodo Lo Defensive Rebound.
Harvard,Columbia,6,16,5,21,1,Lukas Meisner made Layup. Assisted by Maodo Lo.
Harvard,Columbia,8,16,5,46,1,Patrick Steeves made Jumper.
Harvard,Columbia,8,16,6,20,0,Alex Rosenberg missed Layup.
Harvard,Columbia,8,16,6,20,0,Lukas Meisner Offensive Rebound.
Harvard,Columbia,8,16,6,21,0,Columbia  Turnover.
Harvard,Columbia,8,16,6,30,0,Weisner Perez missed Three Point Jumper.
Harvard,Columbia,8,16,6,30,0,Grant Mullins Defensive Rebound.
Harvard,Columbia,8,16,6,51,0,Chris McComber missed Three Point Jumper.
Harvard,Columbia,8,16,6,51,0,Agunwa Okolie Defensive Rebound.
Harvard,Columbia,10,16,7,22,1,Agunwa Okolie made Jumper.
Harvard,Columbia,10,16,7,22,0,Foul on Isaac Cohen.
Harvard,Columbia,11,16,7,22,1,Agunwa Okolie made Free Throw.
Harvard,Columbia,11,19,7,34,1,Lukas Meisner made Three Point Jumper. Assisted by CJ Davis.
Harvard,Columbia,11,19,7,45,0,Corbin Miller missed Jumper.
Harvard,Columbia,11,19,7,45,0,CJ Davis Defensive Rebound.
Harvard,Columbia,11,19,8,8,0,CJ Davis missed Three Point Jumper.
Harvard,Columbia,11,19,8,8,0,Chris Egi Defensive Rebound.
Harvard,Columbia,11,19,8,31,0,Corbin Miller missed Three Point Jumper.
Harvard,Columbia,11,19,8,31,0,CJ Davis Defensive Rebound.
Harvard,Columbia,11,19,8,54,0,Chris McComber missed Three Point Jumper.
Harvard,Columbia,11,19,8,54,0,CJ Davis Offensive Rebound.
Harvard,Columbia,11,19,8,58,0,Foul on Chris Egi.
Harvard,Columbia,11,19,8,58,0,Official TV Timeout
Harvard,Columbia,11,19,9,13,0,Maodo Lo missed Three Point Jumper.
Harvard,Columbia,11,19,9,13,0,Lukas Meisner Offensive Rebound.
Harvard,Columbia,11,19,9,33,0,CJ Davis missed Three Point Jumper.
Harvard,Columbia,11,19,9,33,0,Weisner Perez Defensive Rebound.
Harvard,Columbia,11,19,9,50,0,Foul on CJ Davis.
Harvard,Columbia,11,19,9,56,0,Foul on Jeff Coby.
Harvard,Columbia,11,19,9,56,0,Agunwa Okolie missed Free Throw.
Harvard,Columbia,11,19,9,56,0,Harvard Deadball Team Rebound.
Harvard,Columbia,12,19,9,56,1,Agunwa Okolie made Free Throw.
Harvard,Columbia,12,19,10,23,0,Foul on Tommy McCarthy.
Harvard,Columbia,12,19,10,23,0,Nate Hickman missed Free Throw.
Harvard,Columbia,12,19,10,23,0,Columbia Deadball Team Rebound.
Harvard,Columbia,12,20,10,23,1,Nate Hickman made Free Throw.
Harvard,Columbia,14,20,10,37,1,Agunwa Okolie made Dunk. Assisted by Zena Edosomwan.
Harvard,Columbia,14,20,10,37,0,Foul on Luke Petrasek.
Harvard,Columbia,15,20,10,37,1,Agunwa Okolie made Free Throw.
Harvard,Columbia,15,20,10,55,0,Foul on Evan Cummins.
Harvard,Columbia,15,21,10,55,1,Jeff Coby made Free Throw.
Harvard,Columbia,15,22,10,55,1,Jeff Coby made Free Throw.
Harvard,Columbia,17,22,11,8,1,Zena Edosomwan made Dunk. Assisted by Agunwa Okolie.
Harvard,Columbia,17,22,11,32,0,Alex Rosenberg missed Layup.
Harvard,Columbia,17,22,11,32,0,Agunwa Okolie Defensive Rebound.
Harvard,Columbia,19,22,11,53,1,Tommy McCarthy made Jumper. Assisted by Evan Cummins.
Harvard,Columbia,19,22,12,24,0,Alex Rosenberg missed Three Point Jumper.
Harvard,Columbia,19,22,12,24,0,Harvard Defensive Rebound.
Harvard,Columbia,19,22,12,25,0,Foul on Jeff Coby.
Harvard,Columbia,19,22,12,25,0,Official TV Timeout
Harvard,Columbia,19,22,12,45,0,Patrick Steeves missed Layup.
Harvard,Columbia,19,22,12,45,0,Alex Rosenberg Defensive Rebound.
Harvard,Columbia,19,25,13,7,1,Alex Rosenberg made Three Point Jumper.
Harvard,Columbia,19,25,13,18,0,Corey Johnson missed Three Point Jumper.
Harvard,Columbia,19,25,13,18,0,Zena Edosomwan Offensive Rebound.
Harvard,Columbia,21,25,13,24,1,Zena Edosomwan made Layup.
Harvard,Columbia,21,27,13,46,1,Maodo Lo made Layup.
Harvard,Columbia,24,27,14,14,1,Corey Johnson made Three Point Jumper. Assisted by Tommy McCarthy.
Harvard,Columbia,24,27,14,32,0,Alex Rosenberg missed Layup.
Harvard,Columbia,24,27,14,32,0,Evan Cummins Block.
Harvard,Columbia,24,27,14,34,0,Tommy McCarthy Defensive Rebound.
Harvard,Columbia,26,27,14,37,1,Tommy McCarthy made Layup.
Harvard,Columbia,26,27,14,56,0,Grant Mullins missed Three Point Jumper.
Harvard,Columbia,26,27,14,56,0,Tommy McCarthy Defensive Rebound.
Harvard,Columbia,26,27,15,2,0,Foul on Maodo Lo.
Harvard,Columbia,26,27,15,2,0,Zena Edosomwan missed Free Throw.
Harvard,Columbia,26,27,15,2,0,Grant Mullins Defensive Rebound.
Harvard,Columbia,26,29,15,15,1,Grant Mullins made Layup.
Harvard,Columbia,26,29,15,45,0,Foul on Chris McComber.
Harvard,Columbia,27,29,15,45,1,Zena Edosomwan made Free Throw.
Harvard,Columbia,28,29,15,45,1,Zena Edosomwan made Free Throw.
Harvard,Columbia,28,29,16,5,0,CJ Davis Turnover.
Harvard,Columbia,28,29,16,5,0,Official TV Timeout
Harvard,Columbia,28,29,16,21,0,Agunwa Okolie Turnover.
Harvard,Columbia,28,29,16,22,0,Alex Rosenberg Steal.
Harvard,Columbia,28,32,16,35,1,Grant Mullins made Three Point Jumper. Assisted by Alex Rosenberg.
Harvard,Columbia,28,32,17,5,0,Tommy McCarthy missed Layup.
Harvard,Columbia,28,32,17,5,0,Grant Mullins Defensive Rebound.
Harvard,Columbia,28,32,17,23,0,Foul on Corey Johnson.
Harvard,Columbia,28,32,17,23,0,Kyle Castlin missed Free Throw.
Harvard,Columbia,28,32,17,23,0,Columbia Deadball Team Rebound.
Harvard,Columbia,28,33,17,23,1,Kyle Castlin made Free Throw.
Harvard,Columbia,28,33,17,43,0,Foul on Nate Hickman.
Harvard,Columbia,29,33,17,43,1,Tommy McCarthy made Free Throw.
Harvard,Columbia,30,33,17,43,1,Tommy McCarthy made Free Throw.
Harvard,Columbia,30,33,18,11,0,Alex Rosenberg missed Jumper.
Harvard,Columbia,30,33,18,11,0,Tommy McCarthy Defensive Rebound.
Harvard,Columbia,30,33,18,31,0,Tommy McCarthy missed Layup.
Harvard,Columbia,30,33,18,31,0,Alex Rosenberg Defensive Rebound.
Harvard,Columbia,30,33,18,48,0,Kyle Castlin Turnover.
Harvard,Columbia,30,33,18,49,0,Corey Johnson Steal.
Harvard,Columbia,30,33,18,53,0,Agunwa Okolie missed Layup.
Harvard,Columbia,30,33,18,53,0,Nate Hickman Defensive Rebound.
Harvard,Columbia,30,33,19,0,0,Grant Mullins missed Three Point Jumper.
Harvard,Columbia,30,33,19,0,0,Chris Egi Defensive Rebound.
Harvard,Columbia,32,33,19,15,1,Chris Egi made Layup. Assisted by Evan Cummins.
Harvard,Columbia,32,36,19,31,1,Alex Rosenberg made Three Point Jumper.
Harvard,Columbia,32,36,19,35,0,Columbia  Timeout
Harvard,Columbia,34,36,19,55,1,Agunwa Okolie made Jumper.
Harvard,Columbia,34,39,20,0,1,Maodo Lo made Three Point Jumper.
Harvard,Columbia,34,39,20,0,0,End of 1st half
Harvard,Columbia,36,39,20,21,1,Zena Edosomwan made Jumper.
Harvard,Columbia,36,41,20,36,1,Jeff Coby made Layup. Assisted by Maodo Lo.
Harvard,Columbia,36,41,20,36,0,Foul on Zena Edosomwan.
Harvard,Columbia,36,42,20,36,1,Jeff Coby made Free Throw.
Harvard,Columbia,39,42,21,3,1,Tommy McCarthy made Three Point Jumper. Assisted by Agunwa Okolie.
Harvard,Columbia,39,42,21,18,0,Foul on Corey Johnson.
Harvard,Columbia,39,42,21,18,0,Maodo Lo missed Free Throw.
Harvard,Columbia,39,42,21,18,0,Columbia Deadball Team Rebound.
Harvard,Columbia,39,43,21,18,1,Maodo Lo made Free Throw.
Harvard,Columbia,39,43,21,37,0,Agunwa Okolie missed Jumper.
Harvard,Columbia,39,43,21,37,0,Evan Cummins Offensive Rebound.
Harvard,Columbia,41,43,21,39,1,Evan Cummins made Layup.
Harvard,Columbia,41,45,21,58,1,Luke Petrasek made Layup.
Harvard,Columbia,41,45,22,6,0,Agunwa Okolie missed Layup.
Harvard,Columbia,41,45,22,6,0,Jeff Coby Block.
Harvard,Columbia,41,45,22,6,0,Harvard Offensive Rebound.
Harvard,Columbia,41,45,22,15,0,Foul on Grant Mullins.
Harvard,Columbia,41,45,22,24,0,Zena Edosomwan Turnover.
Harvard,Columbia,41,45,22,24,0,Foul on Zena Edosomwan.
Harvard,Columbia,41,45,22,42,0,Alex Rosenberg missed Layup.
Harvard,Columbia,41,45,22,42,0,Harvard Defensive Rebound.
Harvard,Columbia,41,45,22,52,0,Corey Johnson missed Three Point Jumper.
Harvard,Columbia,41,45,22,52,0,Maodo Lo Defensive Rebound.
Harvard,Columbia,41,45,22,58,0,Foul on Tommy McCarthy.
Harvard,Columbia,41,47,23,0,1,Alex Rosenberg made Dunk. Assisted by Grant Mullins.
Harvard,Columbia,44,47,23,22,1,Corey Johnson made Three Point Jumper. Assisted by Agunwa Okolie.
Harvard,Columbia,44,47,23,47,0,Grant Mullins missed Layup.
Harvard,Columbia,44,47,23,47,0,Jeff Coby Offensive Rebound.
Harvard,Columbia,44,47,23,54,0,Maodo Lo missed Three Point Jumper.
Harvard,Columbia,44,47,23,54,0,Evan Cummins Defensive Rebound.
Harvard,Columbia,44,47,23,59,0,Foul on Tommy McCarthy.
Harvard,Columbia,44,47,24,0,0,Tommy McCarthy Turnover.
Harvard,Columbia,44,47,24,23,0,Foul on Chris Egi.
Harvard,Columbia,44,47,24,23,0,Official TV Timeout
Harvard,Columbia,44,47,24,37,0,Maodo Lo missed Layup.
Harvard,Columbia,44,47,24,37,0,Agunwa Okolie Defensive Rebound.
Harvard,Columbia,44,47,24,54,0,Weisner Perez missed Three Point Jumper.
Harvard,Columbia,44,47,24,54,0,Isaac Cohen Defensive Rebound.
Harvard,Columbia,44,49,25,18,1,Nate Hickman made Layup.
Harvard,Columbia,47,49,25,38,1,Corey Johnson made Three Point Jumper. Assisted by Patrick Steeves.
Harvard,Columbia,47,49,25,52,0,Maodo Lo missed Three Point Jumper.
Harvard,Columbia,47,49,25,52,0,Corbin Miller Defensive Rebound.
Harvard,Columbia,47,49,26,8,0,Foul on Isaac Cohen.
Harvard,Columbia,47,49,26,8,0,Patrick Steeves missed Free Throw.
Harvard,Columbia,47,49,26,8,0,Harvard Deadball Team Rebound.
Harvard,Columbia,47,49,26,8,0,Patrick Steeves missed Free Throw.
Harvard,Columbia,47,49,26,8,0,Chris McComber Defensive Rebound.
Harvard,Columbia,47,51,26,23,1,Lukas Meisner made Layup. Assisted by Isaac Cohen.
Harvard,Columbia,47,51,26,55,0,Chris Egi missed Layup.
Harvard,Columbia,47,51,26,55,0,Isaac Cohen Defensive Rebound.
Harvard,Columbia,47,51,27,13,0,Lukas Meisner Turnover.
Harvard,Columbia,47,51,27,15,0,Patrick Steeves Steal.
Harvard,Columbia,49,51,27,31,1,Agunwa Okolie made Jumper.
Harvard,Columbia,49,53,27,49,1,Chris McComber made Layup. Assisted by Grant Mullins.
Harvard,Columbia,49,53,27,49,0,Foul on Patrick Steeves.
Harvard,Columbia,49,54,27,49,1,Chris McComber made Free Throw.
Harvard,Columbia,49,54,27,51,0,Foul on Kendall Jackson.
Harvard,Columbia,49,54,27,55,0,Foul on Kendall Jackson.
Harvard,Columbia,49,54,28,13,0,Official TV Timeout
Harvard,Columbia,51,54,28,23,1,Zena Edosomwan made Jumper.
Harvard,Columbia,51,56,28,50,1,Maodo Lo made Jumper.
Harvard,Columbia,53,56,29,9,1,Agunwa Okolie made Layup. Assisted by Zena Edosomwan.
Harvard,Columbia,53,58,29,30,1,Alex Rosenberg made Layup.
Harvard,Columbia,56,58,29,43,1,Patrick Steeves made Three Point Jumper. Assisted by Agunwa Okolie.
Harvard,Columbia,56,58,29,45,0,Official TV Timeout
Harvard,Columbia,56,61,30,5,1,Chris McComber made Three Point Jumper. Assisted by Maodo Lo.
Harvard,Columbia,56,61,30,23,0,Tommy McCarthy missed Jumper.
Harvard,Columbia,56,61,30,23,0,Zena Edosomwan Offensive Rebound.
Harvard,Columbia,56,61,30,30,0,Zena Edosomwan missed Layup.
Harvard,Columbia,56,61,30,30,0,Harvard Offensive Rebound.
Harvard,Columbia,56,61,30,39,0,Agunwa Okolie Turnover.
Harvard,Columbia,56,61,30,39,0,Alex Rosenberg Steal.
Harvard,Columbia,56,61,30,39,0,Foul on Patrick Steeves.
Harvard,Columbia,56,62,30,39,1,Alex Rosenberg made Free Throw.
Harvard,Columbia,56,63,30,39,1,Alex Rosenberg made Free Throw.
Harvard,Columbia,56,63,30,51,0,Zena Edosomwan Turnover.
Harvard,Columbia,56,63,30,52,0,Kendall Jackson Steal.
Harvard,Columbia,56,66,30,57,1,Maodo Lo made Three Point Jumper. Assisted by Alex Rosenberg.
Harvard,Columbia,56,66,31,28,0,Corey Johnson missed Three Point Jumper.
Harvard,Columbia,56,66,31,28,0,Agunwa Okolie Offensive Rebound.
Harvard,Columbia,59,66,31,35,1,Tommy McCarthy made Three Point Jumper. Assisted by Agunwa Okolie.
Harvard,Columbia,59,66,31,36,0,Official TV Timeout
Harvard,Columbia,59,66,31,58,0,Alex Rosenberg missed Three Point Jumper.
Harvard,Columbia,59,66,31,58,0,Zena Edosomwan Defensive Rebound.
Harvard,Columbia,59,66,32,5,0,Zena Edosomwan Turnover.
Harvard,Columbia,59,66,32,6,0,Isaac Cohen Steal.
Harvard,Columbia,59,69,32,29,1,Alex Rosenberg made Three Point Jumper. Assisted by Isaac Cohen.
Harvard,Columbia,59,69,32,48,0,Zena Edosomwan missed Layup.
Harvard,Columbia,59,69,32,48,0,Agunwa Okolie Offensive Rebound.
Harvard,Columbia,61,69,32,50,1,Agunwa Okolie made Layup.
Harvard,Columbia,61,69,33,14,0,Kendall Jackson missed Three Point Jumper.
Harvard,Columbia,61,69,33,17,0,Chris McComber Offensive Rebound.
Harvard,Columbia,61,72,33,17,1,Chris McComber made Three Point Jumper. Assisted by Grant Mullins.
Harvard,Columbia,61,72,33,48,0,Agunwa Okolie Turnover.
Harvard,Columbia,61,72,33,48,0,Luke Petrasek Steal.
Harvard,Columbia,61,74,33,52,1,Maodo Lo made Layup.
Harvard,Columbia,64,74,34,5,1,Corey Johnson made Three Point Jumper.
Harvard,Columbia,64,76,34,20,1,Maodo Lo made Layup.
Harvard,Columbia,64,76,34,34,0,Agunwa Okolie missed Jumper.
Harvard,Columbia,64,76,34,34,0,Jeff Coby Defensive Rebound.
Harvard,Columbia,64,78,34,38,1,Jeff Coby made Dunk. Assisted by Grant Mullins.
Harvard,Columbia,67,78,35,37,1,Agunwa Okolie made Three Point Jumper. Assisted by Corbin Miller.
Harvard,Columbia,67,80,35,56,1,Maodo Lo made Jumper.
Harvard,Columbia,67,80,36,2,0,Official TV Timeout
Harvard,Columbia,67,80,36,8,0,Agunwa Okolie Turnover.
Harvard,Columbia,67,80,36,9,0,Jeff Coby Steal.
Harvard,Columbia,67,80,36,34,0,Foul on Corbin Miller.
Harvard,Columbia,67,81,36,34,1,Grant Mullins made Free Throw.
Harvard,Columbia,67,82,36,34,1,Grant Mullins made Free Throw.
Harvard,Columbia,70,82,36,56,1,Tommy McCarthy made Three Point Jumper.
Harvard,Columbia,70,84,37,26,1,Jeff Coby made Layup. Assisted by Alex Rosenberg.
Harvard,Columbia,70,84,37,37,0,Tommy McCarthy missed Three Point Jumper.
Harvard,Columbia,70,84,37,37,0,Luke Petrasek Defensive Rebound.
Harvard,Columbia,70,84,38,2,0,Luke Petrasek missed Three Point Jumper.
Harvard,Columbia,70,84,38,2,0,Jeff Coby Offensive Rebound.
Harvard,Columbia,70,84,38,5,0,Foul on Weisner Perez.
Harvard,Columbia,70,84,38,5,0,Jeff Coby missed Free Throw.
Harvard,Columbia,70,84,38,5,0,Columbia Deadball Team Rebound.
Harvard,Columbia,70,85,38,5,1,Jeff Coby made Free Throw.
Harvard,Columbia,73,85,38,21,1,Weisner Perez made Three Point Jumper. Assisted by Corey Johnson.
Harvard,Columbia,73,85,38,51,0,Luke Petrasek missed Three Point Jumper.
Harvard,Columbia,73,85,38,51,0,Jeff Coby Offensive Rebound.
Harvard,Columbia,73,85,39,10,0,Foul on Tommy McCarthy.
Harvard,Columbia,73,86,39,10,1,Maodo Lo made Free Throw.
Harvard,Columbia,73,87,39,10,1,Maodo Lo made Free Throw.
Harvard,Columbia,73,87,39,19,0,Foul on Alex Rosenberg.
Harvard,Columbia,73,87,39,21,0,Balsa Dragovic missed Layup.
Harvard,Columbia,73,87,39,21,0,Luke Petrasek Block.
Harvard,Columbia,73,87,39,23,0,Luke Petrasek Defensive Rebound.
Harvard,Columbia,73,90,39,50,1,Maodo Lo made Three Point Jumper.
Harvard,Columbia,76,90,40,0,1,Corey Johnson made Three Point Jumper. Assisted by Tommy McCarthy.
Harvard,Columbia,76,90,40,0,0,End of Game
