Away Team,Home Team,Away Score,Home Score,Minute,Second,isScoringPosession,Desc.
Morehead State,Eastern Kentucky,0,0,0,14,0,Angelo Warner missed Jumper.
Morehead State,Eastern Kentucky,0,0,0,14,0,Tarius Johnson Defensive Rebound.
Morehead State,Eastern Kentucky,0,0,0,34,0,Mike DiNunno Turnover.
Morehead State,Eastern Kentucky,2,0,1,8,1,Drew Kelly made Jumper.
Morehead State,Eastern Kentucky,2,0,1,37,0,Mike DiNunno missed Three Point Jumper.
Morehead State,Eastern Kentucky,2,0,1,37,0,Devon Atkinson Defensive Rebound.
Morehead State,Eastern Kentucky,2,0,1,46,0,Angelo Warner Turnover.
Morehead State,Eastern Kentucky,2,2,2,2,1,Eric Stutz made Jumper.
Morehead State,Eastern Kentucky,2,2,2,2,0,Foul on Drew Kelly
Morehead State,Eastern Kentucky,2,2,2,2,0,Eric Stutz missed Free Throw.
Morehead State,Eastern Kentucky,2,2,2,2,0,Deverin Muff Offensive Rebound.
Morehead State,Eastern Kentucky,2,2,2,5,0,Corey Walden missed Three Point Jumper.
Morehead State,Eastern Kentucky,2,2,2,5,0,Milton Chavis Defensive Rebound.
Morehead State,Eastern Kentucky,2,2,2,17,0,Foul on Angelo Warner
Morehead State,Eastern Kentucky,2,2,2,17,0,Angelo Warner Turnover.
Morehead State,Eastern Kentucky,2,2,2,28,0,Corey Walden missed Jumper.
Morehead State,Eastern Kentucky,2,2,2,28,0,Chad Posthumus Block.
Morehead State,Eastern Kentucky,2,2,2,28,0,Eastern Kentucky Offensive Rebou.
Morehead State,Eastern Kentucky,2,2,2,30,0,Tarius Johnson missed Jumper.
Morehead State,Eastern Kentucky,2,2,2,30,0,Bakari Turner Defensive Rebound.
Morehead State,Eastern Kentucky,4,2,2,42,1,Bakari Turner made Layup.
Morehead State,Eastern Kentucky,4,2,3,17,0,Corey Walden missed Jumper.
Morehead State,Eastern Kentucky,4,2,3,17,0,Drew Kelly Defensive Rebound.
Morehead State,Eastern Kentucky,7,2,3,36,1,Drew Kelly made Three Point Jumper.  Assisted by Devon Atkinson.
Morehead State,Eastern Kentucky,7,2,3,58,0,Tarius Johnson missed Three Point Jumper.
Morehead State,Eastern Kentucky,7,2,3,58,0,Chad Posthumus Defensive Rebound.
Morehead State,Eastern Kentucky,7,2,4,8,0,Bakari Turner missed Three Point Jumper.
Morehead State,Eastern Kentucky,7,2,4,8,0,Eric Stutz Defensive Rebound.
Morehead State,Eastern Kentucky,7,2,4,22,0,Mike DiNunno missed Layup.
Morehead State,Eastern Kentucky,7,2,4,22,0,Chad Posthumus Defensive Rebound.
Morehead State,Eastern Kentucky,7,2,4,31,0,Milton Chavis Turnover.
Morehead State,Eastern Kentucky,7,2,4,31,0,Official TV Timeout.
Morehead State,Eastern Kentucky,7,2,4,46,0,Mike DiNunno missed Layup.
Morehead State,Eastern Kentucky,7,2,4,46,0,Drew Kelly Defensive Rebound.
Morehead State,Eastern Kentucky,7,2,5,5,0,Devon Atkinson Turnover.
Morehead State,Eastern Kentucky,7,2,5,7,0,Orlando Williams Steal.
Morehead State,Eastern Kentucky,7,4,5,10,1,Corey Walden made Layup.  Assisted by Mike DiNunno.
Morehead State,Eastern Kentucky,9,4,5,29,1,Chad Posthumus made Jumper.  Assisted by Devon Atkinson.
Morehead State,Eastern Kentucky,9,4,6,5,0,Orlando Williams missed Three Point Jumper.
Morehead State,Eastern Kentucky,9,4,6,5,0,Eastern Kentucky Offensive Rebou.
Morehead State,Eastern Kentucky,9,4,6,17,0,Jeff Johnson missed Layup.
Morehead State,Eastern Kentucky,9,4,6,17,0,Drew Kelly Defensive Rebound.
Morehead State,Eastern Kentucky,9,4,6,27,0,Bakari Turner missed Three Point Jumper.
Morehead State,Eastern Kentucky,9,4,6,27,0,Corey Walden Defensive Rebound.
Morehead State,Eastern Kentucky,9,6,6,45,1,Mike DiNunno made Layup.
Morehead State,Eastern Kentucky,9,6,7,21,0,Jason Holmes missed Three Point Jumper.
Morehead State,Eastern Kentucky,9,6,7,21,0,Corey Walden Defensive Rebound.
Morehead State,Eastern Kentucky,9,6,7,43,0,Orlando Williams missed Three Point Jumper.
Morehead State,Eastern Kentucky,9,6,7,43,0,Bakari Turner Defensive Rebound.
Morehead State,Eastern Kentucky,9,6,7,54,0,Foul on Bakari Turner
Morehead State,Eastern Kentucky,9,6,7,54,0,Bakari Turner Turnover.
Morehead State,Eastern Kentucky,9,9,8,26,1,Mike DiNunno made Three Point Jumper.
Morehead State,Eastern Kentucky,9,9,8,49,0,Foul on Jason Holmes
Morehead State,Eastern Kentucky,9,9,8,49,0,Jason Holmes Turnover.
Morehead State,Eastern Kentucky,9,9,8,49,0,Official TV Timeout.
Morehead State,Eastern Kentucky,9,9,9,20,0,Orlando Williams Turnover.
Morehead State,Eastern Kentucky,9,9,9,32,0,Foul on Marcus Lewis
Morehead State,Eastern Kentucky,9,9,9,32,0,Angelo Warner missed Free Throw.
Morehead State,Eastern Kentucky,9,9,9,32,0,null
Morehead State,Eastern Kentucky,10,9,9,32,1,Angelo Warner made Free Throw.
Morehead State,Eastern Kentucky,10,9,9,55,0,Eric Stutz missed Jumper.
Morehead State,Eastern Kentucky,10,9,9,55,0,Maurice Lewis-Briggs Defensive Rebound.
Morehead State,Eastern Kentucky,10,9,10,2,0,Angelo Warner missed Three Point Jumper.
Morehead State,Eastern Kentucky,10,9,10,2,0,Tarius Johnson Defensive Rebound.
Morehead State,Eastern Kentucky,10,9,10,11,0,Foul on Marcus Lewis
Morehead State,Eastern Kentucky,10,9,10,11,0,Marcus Lewis Turnover.
Morehead State,Eastern Kentucky,12,9,10,22,1,Maurice Lewis-Briggs made Layup.  Assisted by Devon Atkinson.
Morehead State,Eastern Kentucky,12,9,10,41,0,Tarius Johnson missed Three Point Jumper.
Morehead State,Eastern Kentucky,12,9,10,41,0,Angelo Warner Defensive Rebound.
Morehead State,Eastern Kentucky,12,9,10,50,0,Maurice Lewis-Briggs missed Three Point Jumper.
Morehead State,Eastern Kentucky,12,9,10,50,0,null
Morehead State,Eastern Kentucky,12,9,10,53,0,Foul on Eric Stutz
Morehead State,Eastern Kentucky,14,9,11,13,1,Jason Holmes made Jumper.  Assisted by Maurice Lewis-Briggs.
Morehead State,Eastern Kentucky,14,9,11,46,0,Orlando Williams Turnover.
Morehead State,Eastern Kentucky,14,9,11,47,0,Angelo Warner Steal.
Morehead State,Eastern Kentucky,14,9,11,50,0,Taariq Muhammad Turnover.
Morehead State,Eastern Kentucky,14,9,11,53,0,Jeff Johnson Steal.
Morehead State,Eastern Kentucky,14,11,11,54,1,Tarius Johnson made Layup.  Assisted by Jeff Johnson.
Morehead State,Eastern Kentucky,14,11,12,2,0,Foul on Jeff Johnson
Morehead State,Eastern Kentucky,14,11,12,2,0,Official TV Timeout.
Morehead State,Eastern Kentucky,14,11,12,2,0,Jason Holmes missed Free Throw.
Morehead State,Eastern Kentucky,14,11,12,2,0,null
Morehead State,Eastern Kentucky,15,11,12,2,1,Jason Holmes made Free Throw.
Morehead State,Eastern Kentucky,15,11,12,21,0,Jeff Johnson missed Three Point Jumper.
Morehead State,Eastern Kentucky,15,11,12,21,0,Tarius Johnson Offensive Rebound.
Morehead State,Eastern Kentucky,15,14,12,27,1,Mike DiNunno made Three Point Jumper.  Assisted by Tarius Johnson.
Morehead State,Eastern Kentucky,18,14,12,49,1,Milton Chavis made Three Point Jumper.  Assisted by Angelo Warner.
Morehead State,Eastern Kentucky,18,14,13,16,0,Robbie Stenzel missed Three Point Jumper.
Morehead State,Eastern Kentucky,18,14,13,16,0,Devon Atkinson Defensive Rebound.
Morehead State,Eastern Kentucky,18,14,13,39,0,Foul on Jeff Johnson
Morehead State,Eastern Kentucky,18,14,13,50,0,Milton Chavis missed Jumper.
Morehead State,Eastern Kentucky,18,14,13,50,0,Robbie Stenzel Defensive Rebound.
Morehead State,Eastern Kentucky,18,14,13,57,0,Tarius Johnson missed Jumper.
Morehead State,Eastern Kentucky,18,14,13,57,0,Tarius Johnson Offensive Rebound.
Morehead State,Eastern Kentucky,18,14,14,0,0,Tarius Johnson missed Tip Shot.
Morehead State,Eastern Kentucky,18,14,14,0,0,Taariq Muhammad Defensive Rebound.
Morehead State,Eastern Kentucky,18,14,14,7,0,Taariq Muhammad missed Jumper.
Morehead State,Eastern Kentucky,18,14,14,7,0,Morehead State Offensive Rebound.
Morehead State,Eastern Kentucky,18,14,14,31,0,Foul on Drew Kelly
Morehead State,Eastern Kentucky,18,14,14,31,0,Drew Kelly Turnover.
Morehead State,Eastern Kentucky,18,14,14,43,0,Mike DiNunno missed Three Point Jumper.
Morehead State,Eastern Kentucky,18,14,14,43,0,Maurice Lewis-Briggs Defensive Rebound.
Morehead State,Eastern Kentucky,20,14,14,53,1,Maurice Lewis-Briggs made Jumper.  Assisted by Bakari Turner.
Morehead State,Eastern Kentucky,20,16,15,7,1,Tarius Johnson made Layup.  Assisted by Mike DiNunno.
Morehead State,Eastern Kentucky,20,16,15,7,0,Foul on Taariq Muhammad
Morehead State,Eastern Kentucky,20,17,15,7,1,Tarius Johnson made Free Throw.
Morehead State,Eastern Kentucky,20,17,15,20,0,Devon Atkinson Turnover.
Morehead State,Eastern Kentucky,20,17,15,21,0,Mike DiNunno Steal.
Morehead State,Eastern Kentucky,20,17,15,25,0,Mike DiNunno Turnover.
Morehead State,Eastern Kentucky,20,17,15,26,0,Devon Atkinson Steal.
Morehead State,Eastern Kentucky,20,17,15,28,0,Devon Atkinson Turnover.
Morehead State,Eastern Kentucky,20,17,15,29,0,Corey Walden Steal.
Morehead State,Eastern Kentucky,20,17,15,31,0,Foul on Angelo Warner
Morehead State,Eastern Kentucky,20,18,15,31,1,Orlando Williams made Free Throw.
Morehead State,Eastern Kentucky,20,19,15,31,1,Orlando Williams made Free Throw.
Morehead State,Eastern Kentucky,20,19,15,48,0,Milton Chavis missed Jumper.
Morehead State,Eastern Kentucky,20,19,15,48,0,Marcus Lewis Block.
Morehead State,Eastern Kentucky,20,19,15,51,0,Milton Chavis Offensive Rebound.
Morehead State,Eastern Kentucky,20,19,15,51,0,Milton Chavis Turnover.
Morehead State,Eastern Kentucky,20,21,16,19,1,Corey Walden made Layup.  Assisted by Orlando Williams.
Morehead State,Eastern Kentucky,20,21,16,36,0,Bakari Turner Turnover.
Morehead State,Eastern Kentucky,20,21,16,41,0,Marcus Lewis Steal.
Morehead State,Eastern Kentucky,20,21,16,44,0,Orlando Williams missed Layup.
Morehead State,Eastern Kentucky,20,21,16,44,0,Orlando Williams Offensive Rebound.
Morehead State,Eastern Kentucky,20,21,16,47,0,Corey Walden missed Three Point Jumper.
Morehead State,Eastern Kentucky,20,21,16,47,0,Deverin Muff Offensive Rebound.
Morehead State,Eastern Kentucky,20,21,16,49,0,Foul on Chad Posthumus
Morehead State,Eastern Kentucky,20,21,16,49,0,Official TV Timeout.
Morehead State,Eastern Kentucky,20,22,16,49,1,Deverin Muff made Free Throw.
Morehead State,Eastern Kentucky,20,22,16,49,0,Deverin Muff missed Free Throw.
Morehead State,Eastern Kentucky,20,22,16,49,0,Chad Posthumus Defensive Rebound.
Morehead State,Eastern Kentucky,20,22,17,2,0,Bakari Turner missed Jumper.
Morehead State,Eastern Kentucky,20,22,17,4,0,Eastern Kentucky Defensive Rebou.
Morehead State,Eastern Kentucky,20,22,17,14,0,Mike DiNunno Turnover.
Morehead State,Eastern Kentucky,20,22,17,15,0,Chad Posthumus Steal.
Morehead State,Eastern Kentucky,20,22,17,24,0,Devon Atkinson missed Jumper.
Morehead State,Eastern Kentucky,20,22,17,24,0,Mike DiNunno Defensive Rebound.
Morehead State,Eastern Kentucky,20,24,17,34,1,Tarius Johnson made Layup.  Assisted by Corey Walden.
Morehead State,Eastern Kentucky,20,24,18,2,0,Milton Chavis missed Three Point Jumper.
Morehead State,Eastern Kentucky,20,24,18,2,0,Eric Stutz Defensive Rebound.
Morehead State,Eastern Kentucky,20,26,18,26,1,Orlando Williams made Jumper.
Morehead State,Eastern Kentucky,20,26,18,45,0,Foul on Tarius Johnson
Morehead State,Eastern Kentucky,20,26,18,45,0,Chad Posthumus missed Free Throw.
Morehead State,Eastern Kentucky,20,26,18,45,0,null
Morehead State,Eastern Kentucky,21,26,18,45,1,Chad Posthumus made Free Throw.
Morehead State,Eastern Kentucky,21,26,19,0,0,Foul on Bruce Reed
Morehead State,Eastern Kentucky,21,27,19,0,1,Tarius Johnson made Free Throw.
Morehead State,Eastern Kentucky,21,27,19,0,0,Morehead State Full Timeout.
Morehead State,Eastern Kentucky,21,27,19,0,0,Tarius Johnson missed Free Throw.
Morehead State,Eastern Kentucky,21,27,19,0,0,Chad Posthumus Defensive Rebound.
Morehead State,Eastern Kentucky,21,27,19,3,0,Jarrett Stokes missed Three Point Jumper.
Morehead State,Eastern Kentucky,21,27,19,3,0,Orlando Williams Defensive Rebound.
Morehead State,Eastern Kentucky,21,30,19,21,1,Orlando Williams made Three Point Jumper.  Assisted by Eric Stutz.
Morehead State,Eastern Kentucky,21,30,19,35,0,Milton Chavis Turnover.
Morehead State,Eastern Kentucky,21,30,19,39,0,Tarius Johnson Steal.
Morehead State,Eastern Kentucky,21,32,19,43,1,Mike DiNunno made Layup.  Assisted by Tarius Johnson.
Morehead State,Eastern Kentucky,21,32,19,58,0,Devon Atkinson missed Three Point Jumper.
Morehead State,Eastern Kentucky,21,32,19,58,0,Eric Stutz Defensive Rebound.
Morehead State,Eastern Kentucky,21,32,20,0,0,End of the 1st Half.
Morehead State,Eastern Kentucky,21,34,20,13,1,Deverin Muff made Jumper.
Morehead State,Eastern Kentucky,21,34,20,29,0,Angelo Warner missed Jumper.
Morehead State,Eastern Kentucky,21,34,20,29,0,Eric Stutz Defensive Rebound.
Morehead State,Eastern Kentucky,21,34,20,53,0,Foul on Chad Posthumus
Morehead State,Eastern Kentucky,21,35,20,53,1,Tarius Johnson made Free Throw.
Morehead State,Eastern Kentucky,21,35,20,53,0,Tarius Johnson missed Free Throw.
Morehead State,Eastern Kentucky,21,35,20,53,0,Morehead State Defensive Rebound.
Morehead State,Eastern Kentucky,21,35,21,7,0,Chad Posthumus missed Layup.
Morehead State,Eastern Kentucky,21,35,21,7,0,Corey Walden Defensive Rebound.
Morehead State,Eastern Kentucky,21,35,21,25,0,Mike DiNunno Turnover.
Morehead State,Eastern Kentucky,21,35,21,26,0,Drew Kelly Steal.
Morehead State,Eastern Kentucky,21,35,21,46,0,Milton Chavis missed Layup.
Morehead State,Eastern Kentucky,21,35,21,46,0,Corey Walden Defensive Rebound.
Morehead State,Eastern Kentucky,21,35,21,53,0,Corey Walden missed Layup.
Morehead State,Eastern Kentucky,21,35,21,53,0,Deverin Muff Offensive Rebound.
Morehead State,Eastern Kentucky,21,35,21,58,0,Deverin Muff Turnover.
Morehead State,Eastern Kentucky,21,35,22,0,0,Chad Posthumus Steal.
Morehead State,Eastern Kentucky,21,35,22,34,0,Drew Kelly missed Jumper.
Morehead State,Eastern Kentucky,21,35,22,34,0,Chad Posthumus Offensive Rebound.
Morehead State,Eastern Kentucky,21,35,22,37,0,Chad Posthumus Turnover.
Morehead State,Eastern Kentucky,21,35,22,39,0,Foul on Chad Posthumus
Morehead State,Eastern Kentucky,21,36,22,39,1,Tarius Johnson made Free Throw.
Morehead State,Eastern Kentucky,21,37,22,39,1,Tarius Johnson made Free Throw.
Morehead State,Eastern Kentucky,21,37,22,52,0,Drew Kelly missed Jumper.
Morehead State,Eastern Kentucky,21,37,22,52,0,Tarius Johnson Defensive Rebound.
Morehead State,Eastern Kentucky,21,37,23,14,0,Eric Stutz Turnover.
Morehead State,Eastern Kentucky,24,37,23,33,1,Devon Atkinson made Three Point Jumper.  Assisted by Angelo Warner.
Morehead State,Eastern Kentucky,24,37,24,3,0,Mike DiNunno missed Three Point Jumper.
Morehead State,Eastern Kentucky,24,37,24,3,0,Deverin Muff Offensive Rebound.
Morehead State,Eastern Kentucky,24,37,24,6,0,Deverin Muff missed Tip Shot.
Morehead State,Eastern Kentucky,24,37,24,6,0,Drew Kelly Block.
Morehead State,Eastern Kentucky,24,37,24,6,0,Eastern Kentucky Offensive Rebou.
Morehead State,Eastern Kentucky,24,37,24,8,0,Official TV Timeout.
Morehead State,Eastern Kentucky,24,37,24,27,0,Marcus Lewis missed Dunk.
Morehead State,Eastern Kentucky,24,37,24,27,0,Orlando Williams Offensive Rebound.
Morehead State,Eastern Kentucky,24,39,24,33,1,Marcus Lewis made Layup.
Morehead State,Eastern Kentucky,26,39,24,56,1,Jason Holmes made Layup.
Morehead State,Eastern Kentucky,26,39,25,16,0,Foul on Jarrett Stokes
Morehead State,Eastern Kentucky,26,39,25,18,0,Marcus Lewis missed Layup.
Morehead State,Eastern Kentucky,26,39,25,18,0,Jason Holmes Block.
Morehead State,Eastern Kentucky,26,39,25,20,0,Taariq Muhammad Defensive Rebound.
Morehead State,Eastern Kentucky,26,39,25,24,0,Bakari Turner missed Three Point Jumper.
Morehead State,Eastern Kentucky,26,39,25,24,0,Drew Kelly Offensive Rebound.
Morehead State,Eastern Kentucky,26,39,25,29,0,Drew Kelly Turnover.
Morehead State,Eastern Kentucky,26,42,25,46,1,Orlando Williams made Three Point Jumper.  Assisted by Corey Walden.
Morehead State,Eastern Kentucky,26,42,26,8,0,Foul on Orlando Williams
Morehead State,Eastern Kentucky,26,42,26,8,0,Drew Kelly missed Free Throw.
Morehead State,Eastern Kentucky,26,42,26,8,0,null
Morehead State,Eastern Kentucky,27,42,26,8,1,Drew Kelly made Free Throw.
Morehead State,Eastern Kentucky,27,42,26,24,0,Orlando Williams missed Jumper.
Morehead State,Eastern Kentucky,27,42,26,24,0,Maurice Lewis-Briggs Defensive Rebound.
Morehead State,Eastern Kentucky,27,42,26,35,0,Foul on Corey Walden
Morehead State,Eastern Kentucky,27,42,26,47,0,Maurice Lewis-Briggs Turnover.
Morehead State,Eastern Kentucky,27,44,27,12,1,Eric Stutz made Layup.  Assisted by Marcus Lewis.
Morehead State,Eastern Kentucky,27,44,27,19,0,Maurice Lewis-Briggs missed Jumper.
Morehead State,Eastern Kentucky,27,44,27,19,0,Orlando Williams Defensive Rebound.
Morehead State,Eastern Kentucky,27,46,27,25,1,Marcus Lewis made Dunk.  Assisted by Orlando Williams.
Morehead State,Eastern Kentucky,27,46,27,30,0,Morehead State Full Timeout.
Morehead State,Eastern Kentucky,27,46,27,56,0,Drew Kelly missed Three Point Jumper.
Morehead State,Eastern Kentucky,27,46,27,56,0,Marcus Lewis Defensive Rebound.
Morehead State,Eastern Kentucky,27,46,28,8,0,Foul on Tarius Johnson
Morehead State,Eastern Kentucky,27,46,28,8,0,Tarius Johnson Turnover.
Morehead State,Eastern Kentucky,27,46,28,8,0,Official TV Timeout.
Morehead State,Eastern Kentucky,29,46,28,16,1,Bakari Turner made Jumper.
Morehead State,Eastern Kentucky,29,48,28,46,1,Eric Stutz made Layup.  Assisted by Mike DiNunno.
Morehead State,Eastern Kentucky,29,48,29,1,0,Drew Kelly missed Jumper.
Morehead State,Eastern Kentucky,29,48,29,1,0,Eric Stutz Block.
Morehead State,Eastern Kentucky,29,48,29,3,0,Eric Stutz Defensive Rebound.
Morehead State,Eastern Kentucky,29,48,29,24,0,Marcus Lewis missed Three Point Jumper.
Morehead State,Eastern Kentucky,29,48,29,24,0,Chad Posthumus Defensive Rebound.
Morehead State,Eastern Kentucky,29,48,29,35,0,Devon Atkinson Turnover.
Morehead State,Eastern Kentucky,29,48,29,45,0,Foul on Cordell James
Morehead State,Eastern Kentucky,29,48,30,8,0,Eric Stutz missed Jumper.
Morehead State,Eastern Kentucky,29,48,30,8,0,Bakari Turner Defensive Rebound.
Morehead State,Eastern Kentucky,29,48,30,29,0,Cordell James Turnover.
Morehead State,Eastern Kentucky,29,48,30,29,0,Mike DiNunno Steal.
Morehead State,Eastern Kentucky,29,48,30,29,0,Foul on Taariq Muhammad
Morehead State,Eastern Kentucky,29,48,30,31,0,Eric Stutz Turnover.
Morehead State,Eastern Kentucky,29,48,30,32,0,Angelo Warner Steal.
Morehead State,Eastern Kentucky,29,48,30,40,0,Foul on Tarius Johnson
Morehead State,Eastern Kentucky,29,48,30,43,0,Foul on Corey Walden
Morehead State,Eastern Kentucky,29,48,30,44,0,Angelo Warner missed Three Point Jumper.
Morehead State,Eastern Kentucky,29,48,30,44,0,Tarius Johnson Defensive Rebound.
Morehead State,Eastern Kentucky,29,48,31,7,0,Orlando Williams Turnover.
Morehead State,Eastern Kentucky,29,48,31,7,0,Taariq Muhammad Steal.
Morehead State,Eastern Kentucky,29,48,31,9,0,Foul on Eric Stutz
Morehead State,Eastern Kentucky,32,48,31,25,1,Bakari Turner made Three Point Jumper.  Assisted by Taariq Muhammad.
Morehead State,Eastern Kentucky,32,50,31,44,1,Eric Stutz made Layup.  Assisted by Tarius Johnson.
Morehead State,Eastern Kentucky,32,50,32,16,0,Taariq Muhammad Turnover.
Morehead State,Eastern Kentucky,32,50,32,16,0,Official TV Timeout.
Morehead State,Eastern Kentucky,32,50,32,47,0,Corey Walden Turnover.
Morehead State,Eastern Kentucky,32,50,32,57,0,Angelo Warner missed Layup.
Morehead State,Eastern Kentucky,32,50,32,57,0,Corey Walden Defensive Rebound.
Morehead State,Eastern Kentucky,32,50,33,18,0,Orlando Williams missed Jumper.
Morehead State,Eastern Kentucky,32,50,33,18,0,Maurice Lewis-Briggs Defensive Rebound.
Morehead State,Eastern Kentucky,32,50,33,39,0,Maurice Lewis-Briggs Turnover.
Morehead State,Eastern Kentucky,32,52,34,0,1,Mike DiNunno made Jumper.
Morehead State,Eastern Kentucky,32,52,34,17,0,Drew Kelly missed Layup.
Morehead State,Eastern Kentucky,32,52,34,17,0,Marcus Lewis Block.
Morehead State,Eastern Kentucky,32,52,34,20,0,Drew Kelly Offensive Rebound.
Morehead State,Eastern Kentucky,34,52,34,22,1,Drew Kelly made Tip Shot.
Morehead State,Eastern Kentucky,34,52,34,28,0,Eastern Kentucky Full Timeout.
Morehead State,Eastern Kentucky,34,52,34,43,0,Jeff Johnson Turnover.
Morehead State,Eastern Kentucky,34,52,34,53,0,Devon Atkinson missed Three Point Jumper.
Morehead State,Eastern Kentucky,34,52,34,53,0,Eastern Kentucky Defensive Rebou.
Morehead State,Eastern Kentucky,34,54,35,10,1,Eric Stutz made Layup.  Assisted by Orlando Williams.
Morehead State,Eastern Kentucky,34,54,35,24,0,Drew Kelly missed Jumper.
Morehead State,Eastern Kentucky,34,54,35,24,0,Milton Chavis Offensive Rebound.
Morehead State,Eastern Kentucky,34,54,35,28,0,Milton Chavis missed Tip Shot.
Morehead State,Eastern Kentucky,34,54,35,28,0,Drew Kelly Offensive Rebound.
Morehead State,Eastern Kentucky,34,54,35,31,0,Foul on Orlando Williams
Morehead State,Eastern Kentucky,34,54,35,31,0,Drew Kelly missed Free Throw.
Morehead State,Eastern Kentucky,34,54,35,31,0,null
Morehead State,Eastern Kentucky,35,54,35,31,1,Drew Kelly made Free Throw.
Morehead State,Eastern Kentucky,35,54,35,41,0,Eastern Kentucky Full Timeout.
Morehead State,Eastern Kentucky,35,54,35,57,0,Orlando Williams missed Jumper.
Morehead State,Eastern Kentucky,35,54,35,57,0,Drew Kelly Defensive Rebound.
Morehead State,Eastern Kentucky,35,54,36,3,0,Bakari Turner missed Three Point Jumper.
Morehead State,Eastern Kentucky,35,54,36,3,0,null
Morehead State,Eastern Kentucky,35,54,36,6,0,Foul on Marcus Lewis
Morehead State,Eastern Kentucky,36,54,36,6,1,Jarrett Stokes made Free Throw.
Morehead State,Eastern Kentucky,36,54,36,6,0,Jarrett Stokes missed Free Throw.
Morehead State,Eastern Kentucky,36,54,36,6,0,Drew Kelly Offensive Rebound.
Morehead State,Eastern Kentucky,36,54,36,19,0,Foul on Corey Walden
Morehead State,Eastern Kentucky,37,54,36,19,1,Angelo Warner made Free Throw.
Morehead State,Eastern Kentucky,37,54,36,19,0,Angelo Warner missed Free Throw.
Morehead State,Eastern Kentucky,37,54,36,19,0,Tarius Johnson Defensive Rebound.
Morehead State,Eastern Kentucky,37,54,36,45,0,Mike DiNunno missed Layup.
Morehead State,Eastern Kentucky,37,54,36,45,0,Angelo Warner Defensive Rebound.
Morehead State,Eastern Kentucky,39,54,37,10,1,Bakari Turner made Jumper.
Morehead State,Eastern Kentucky,39,54,37,22,0,Foul on Devon Atkinson
Morehead State,Eastern Kentucky,39,54,37,50,0,Jeff Johnson missed Layup.
Morehead State,Eastern Kentucky,39,54,37,50,0,Bruce Reed Block.
Morehead State,Eastern Kentucky,39,54,37,51,0,Jeff Johnson Offensive Rebound.
Morehead State,Eastern Kentucky,39,54,37,52,0,Jeff Johnson Turnover.
Morehead State,Eastern Kentucky,39,54,37,59,0,Foul on Orlando Williams
Morehead State,Eastern Kentucky,40,54,37,59,1,Bakari Turner made Free Throw.
Morehead State,Eastern Kentucky,41,54,37,59,1,Bakari Turner made Free Throw.
Morehead State,Eastern Kentucky,41,54,38,6,0,Mike DiNunno Turnover.
Morehead State,Eastern Kentucky,41,54,38,6,0,Angelo Warner Steal.
Morehead State,Eastern Kentucky,41,54,38,6,0,Morehead State Full Timeout.
Morehead State,Eastern Kentucky,43,54,38,20,1,Angelo Warner made Jumper.
Morehead State,Eastern Kentucky,43,54,38,38,0,Foul on Bruce Reed
Morehead State,Eastern Kentucky,43,54,38,38,0,Orlando Williams missed Free Throw.
Morehead State,Eastern Kentucky,43,54,38,38,0,Angelo Warner Defensive Rebound.
Morehead State,Eastern Kentucky,43,54,38,54,0,Devon Atkinson Turnover.
Morehead State,Eastern Kentucky,43,54,38,54,0,Orlando Williams Steal.
Morehead State,Eastern Kentucky,43,54,38,54,0,Eastern Kentucky Full Timeout.
Morehead State,Eastern Kentucky,43,54,39,0,0,Foul on Bakari Turner
Morehead State,Eastern Kentucky,43,55,39,0,1,Mike DiNunno made Free Throw.
Morehead State,Eastern Kentucky,43,55,39,0,0,Mike DiNunno missed Free Throw.
Morehead State,Eastern Kentucky,43,55,39,0,0,Drew Kelly Defensive Rebound.
Morehead State,Eastern Kentucky,43,55,39,6,0,Devon Atkinson Turnover.
Morehead State,Eastern Kentucky,43,55,39,7,0,Mike DiNunno Steal.
Morehead State,Eastern Kentucky,43,55,39,9,0,Foul on Devon Atkinson
Morehead State,Eastern Kentucky,43,55,39,9,0,Mike DiNunno missed Free Throw.
Morehead State,Eastern Kentucky,43,55,39,9,0,Maurice Lewis-Briggs Defensive Rebound.
Morehead State,Eastern Kentucky,45,55,39,15,1,Drew Kelly made Layup.  Assisted by Bakari Turner.
Morehead State,Eastern Kentucky,45,55,39,18,0,Morehead State Full Timeout.
Morehead State,Eastern Kentucky,45,55,39,20,0,Eric Stutz Turnover.
Morehead State,Eastern Kentucky,45,55,39,27,0,Angelo Warner missed Layup.
Morehead State,Eastern Kentucky,45,55,39,27,0,Eric Stutz Defensive Rebound.
Morehead State,Eastern Kentucky,45,55,39,32,0,Eric Stutz Turnover.
Morehead State,Eastern Kentucky,45,55,39,33,0,Angelo Warner Steal.
Morehead State,Eastern Kentucky,45,55,39,40,0,Angelo Warner missed Jumper.
Morehead State,Eastern Kentucky,45,55,39,40,0,Drew Kelly Offensive Rebound.
Morehead State,Eastern Kentucky,47,55,39,40,1,Drew Kelly made Tip Shot.
Morehead State,Eastern Kentucky,47,55,39,42,0,Foul on Devon Atkinson
Morehead State,Eastern Kentucky,47,56,39,42,1,Corey Walden made Free Throw.
Morehead State,Eastern Kentucky,47,57,39,42,1,Corey Walden made Free Throw.
Morehead State,Eastern Kentucky,50,57,39,46,1,Angelo Warner made Three Point Jumper.  Assisted by Devon Atkinson.
Morehead State,Eastern Kentucky,50,57,39,48,0,Morehead State Full Timeout.
Morehead State,Eastern Kentucky,50,57,39,56,0,Foul on Maurice Lewis-Briggs
Morehead State,Eastern Kentucky,50,58,39,56,1,Corey Walden made Free Throw.
Morehead State,Eastern Kentucky,50,59,39,56,1,Corey Walden made Free Throw.
Morehead State,Eastern Kentucky,52,59,39,58,1,Devon Atkinson made Layup.
Morehead State,Eastern Kentucky,52,59,40,0,0,End Game
