Away Team,Home Team,Away Score,Home Score,Minute,Second,isScoringPosession,Desc.
Sul Ross,Sam Houston State,0,2,0,12,1,Dakarai Henderson made Dunk. Assisted by Torry Butler.
Sul Ross,Sam Houston State,0,2,0,27,0,Jacob Dawson missed Three Point Jumper.
Sul Ross,Sam Houston State,0,2,0,27,0,Jalin Barnes Defensive Rebound.
Sul Ross,Sam Houston State,0,4,0,36,1,Jamal Williams made Layup. Assisted by Jalin Barnes.
Sul Ross,Sam Houston State,0,4,0,36,0,Foul on Jacob Dawson.
Sul Ross,Sam Houston State,0,4,0,36,0,Jamal Williams missed Free Throw.
Sul Ross,Sam Houston State,0,4,0,36,0,Damien Rhodriquez Defensive Rebound.
Sul Ross,Sam Houston State,3,4,0,56,1,Rocky Feliciano made Three Point Jumper. Assisted by Mike Huffman.
Sul Ross,Sam Houston State,3,4,1,15,0,Aurimas Majauskas missed Layup.
Sul Ross,Sam Houston State,3,4,1,15,0,Aurimas Majauskas Offensive Rebound.
Sul Ross,Sam Houston State,3,4,1,17,0,Foul on Damien Rhodriquez.
Sul Ross,Sam Houston State,3,5,1,17,1,Aurimas Majauskas made Free Throw.
Sul Ross,Sam Houston State,3,6,1,17,1,Aurimas Majauskas made Free Throw.
Sul Ross,Sam Houston State,5,6,1,32,1,Mike Huffman made Jumper. Assisted by Jacob Dawson.
Sul Ross,Sam Houston State,5,8,1,48,1,Jalin Barnes made Jumper.
Sul Ross,Sam Houston State,5,8,2,0,0,Mike Huffman missed Jumper.
Sul Ross,Sam Houston State,5,8,2,0,0,Jalin Barnes Defensive Rebound.
Sul Ross,Sam Houston State,5,10,2,12,1,Aurimas Majauskas made Layup. Assisted by Torry Butler.
Sul Ross,Sam Houston State,5,10,2,24,0,Foul on Damien Rhodriquez.
Sul Ross,Sam Houston State,5,10,2,24,0,Damien Rhodriquez Turnover.
Sul Ross,Sam Houston State,5,10,2,35,0,Foul on Caleb Thomasson.
Sul Ross,Sam Houston State,5,10,2,40,0,Dakarai Henderson missed Three Point Jumper.
Sul Ross,Sam Houston State,5,10,2,40,0,Alex Harrison Defensive Rebound.
Sul Ross,Sam Houston State,5,10,2,55,0,Alex Harrison missed Jumper.
Sul Ross,Sam Houston State,5,10,2,55,0,Jalin Barnes Defensive Rebound.
Sul Ross,Sam Houston State,5,10,3,4,0,Jamal Williams missed Three Point Jumper.
Sul Ross,Sam Houston State,5,10,3,4,0,Torry Butler Offensive Rebound.
Sul Ross,Sam Houston State,5,10,3,22,0,Dakarai Henderson missed Three Point Jumper.
Sul Ross,Sam Houston State,5,10,3,22,0,Jamal Williams Offensive Rebound.
Sul Ross,Sam Houston State,5,10,3,28,0,Torry Butler missed Layup.
Sul Ross,Sam Houston State,5,10,3,28,0,Alex Harrison Defensive Rebound.
Sul Ross,Sam Houston State,5,10,3,45,0,Foul on Jamal Williams.
Sul Ross,Sam Houston State,6,10,3,45,1,Rocky Feliciano made Free Throw.
Sul Ross,Sam Houston State,7,10,3,45,1,Rocky Feliciano made Free Throw.
Sul Ross,Sam Houston State,7,10,4,3,0,Jalin Barnes missed Three Point Jumper.
Sul Ross,Sam Houston State,7,10,4,3,0,Jovante' Spivey Offensive Rebound.
Sul Ross,Sam Houston State,7,10,4,5,0,Foul on Jovante' Spivey.
Sul Ross,Sam Houston State,7,10,4,5,0,Jovante' Spivey Turnover.
Sul Ross,Sam Houston State,7,10,4,6,0,Foul on Aurimas Majauskas.
Sul Ross,Sam Houston State,8,10,4,6,1,Alex Harrison made Free Throw.
Sul Ross,Sam Houston State,9,10,4,6,1,Alex Harrison made Free Throw.
Sul Ross,Sam Houston State,9,10,4,31,0,Jovante' Spivey missed Three Point Jumper.
Sul Ross,Sam Houston State,9,10,4,31,0,Jamal Williams Offensive Rebound.
Sul Ross,Sam Houston State,9,12,4,36,1,Jamal Williams made Layup.
Sul Ross,Sam Houston State,9,12,4,53,0,Caleb Thomasson missed Three Point Jumper.
Sul Ross,Sam Houston State,9,12,4,53,0,Torry Butler Defensive Rebound.
Sul Ross,Sam Houston State,9,12,5,4,0,Aurimas Majauskas missed Layup.
Sul Ross,Sam Houston State,9,12,5,4,0,Xavier Webb Defensive Rebound.
Sul Ross,Sam Houston State,12,12,5,19,1,Rocky Feliciano made Three Point Jumper. Assisted by Caleb Thomasson.
Sul Ross,Sam Houston State,12,14,5,36,1,Aurimas Majauskas made Jumper. Assisted by Jamal Williams.
Sul Ross,Sam Houston State,12,14,5,47,0,Foul on Torry Butler.
Sul Ross,Sam Houston State,12,14,5,47,0,Alex Harrison missed Free Throw.
Sul Ross,Sam Houston State,12,14,5,47,0,Sul Ross State Deadball Team Rebound.
Sul Ross,Sam Houston State,13,14,5,47,1,Alex Harrison made Free Throw.
Sul Ross,Sam Houston State,13,14,6,10,0,Andre Sands Turnover.
Sul Ross,Sam Houston State,13,14,6,11,0,Rocky Feliciano Steal.
Sul Ross,Sam Houston State,16,14,6,31,1,Xavier Webb made Three Point Jumper. Assisted by Rocky Feliciano.
Sul Ross,Sam Houston State,16,14,6,47,0,Albert Almanza missed Three Point Jumper.
Sul Ross,Sam Houston State,16,14,6,47,0,Rocky Feliciano Defensive Rebound.
Sul Ross,Sam Houston State,18,14,7,10,1,Rocky Feliciano made Layup. Assisted by Caleb Thomasson.
Sul Ross,Sam Houston State,18,16,7,40,1,Andre Sands made Jumper. Assisted by Josh Delaney.
Sul Ross,Sam Houston State,20,16,7,59,1,Caleb Thomasson made Layup. Assisted by Alex Harrison.
Sul Ross,Sam Houston State,20,16,7,59,0,Foul on Andre Sands.
Sul Ross,Sam Houston State,21,16,7,59,1,Caleb Thomasson made Free Throw.
Sul Ross,Sam Houston State,21,16,8,11,0,Foul on Xavier Webb.
Sul Ross,Sam Houston State,21,16,8,23,0,Marc Andre Fortin missed Jumper.
Sul Ross,Sam Houston State,21,16,8,23,0,Caleb Thomasson Defensive Rebound.
Sul Ross,Sam Houston State,21,16,8,55,0,Caleb Thomasson missed Jumper.
Sul Ross,Sam Houston State,21,16,8,55,0,Dakarai Henderson Defensive Rebound.
Sul Ross,Sam Houston State,21,16,9,19,0,Jovante' Spivey missed Layup.
Sul Ross,Sam Houston State,21,16,9,19,0,Brock Anders Defensive Rebound.
Sul Ross,Sam Houston State,21,16,9,31,0,Rocky Feliciano missed Three Point Jumper.
Sul Ross,Sam Houston State,21,16,9,31,0,Josh Delaney Defensive Rebound.
Sul Ross,Sam Houston State,21,16,9,51,0,Josh Delaney missed Layup.
Sul Ross,Sam Houston State,21,16,9,51,0,Caleb Thomasson Block.
Sul Ross,Sam Houston State,21,16,9,53,0,Alex Harrison Defensive Rebound.
Sul Ross,Sam Houston State,24,16,10,6,1,Jacob Dawson made Three Point Jumper. Assisted by Brock Anders.
Sul Ross,Sam Houston State,24,16,10,22,0,Aurimas Majauskas missed Three Point Jumper.
Sul Ross,Sam Houston State,24,16,10,22,0,Stephon Holland Defensive Rebound.
Sul Ross,Sam Houston State,24,16,10,46,0,Brock Anders missed Three Point Jumper.
Sul Ross,Sam Houston State,24,16,10,46,0,Jalin Barnes Defensive Rebound.
Sul Ross,Sam Houston State,24,16,10,49,0,Foul on Damien Rhodriquez.
Sul Ross,Sam Houston State,24,16,10,55,0,Jamal Williams missed Layup.
Sul Ross,Sam Houston State,24,16,10,55,0,Jacob Caloss Defensive Rebound.
Sul Ross,Sam Houston State,24,16,11,8,0,Caleb Thomasson Turnover.
Sul Ross,Sam Houston State,24,16,11,21,0,Aurimas Majauskas missed Three Point Jumper.
Sul Ross,Sam Houston State,24,16,11,21,0,Sam Houston St Offensive Rebound.
Sul Ross,Sam Houston State,24,19,11,27,1,Dakarai Henderson made Three Point Jumper. Assisted by Jalin Barnes.
Sul Ross,Sam Houston State,24,19,11,42,0,Stephon Holland missed Three Point Jumper.
Sul Ross,Sam Houston State,24,19,11,42,0,Dakarai Henderson Defensive Rebound.
Sul Ross,Sam Houston State,24,19,11,49,0,Torry Butler missed Three Point Jumper.
Sul Ross,Sam Houston State,24,19,11,49,0,Aurimas Majauskas Offensive Rebound.
Sul Ross,Sam Houston State,24,19,11,52,0,Foul on Jacob Caloss.
Sul Ross,Sam Houston State,24,20,11,52,1,Aurimas Majauskas made Free Throw.
Sul Ross,Sam Houston State,24,20,11,52,0,Aurimas Majauskas missed Free Throw.
Sul Ross,Sam Houston State,24,20,11,52,0,Stephon Holland Defensive Rebound.
Sul Ross,Sam Houston State,24,20,12,6,0,Jacob Dawson missed Jumper.
Sul Ross,Sam Houston State,24,20,12,6,0,Jalin Barnes Defensive Rebound.
Sul Ross,Sam Houston State,24,20,12,10,0,Jalin Barnes Turnover.
Sul Ross,Sam Houston State,24,20,12,18,0,Caleb Thomasson missed Layup.
Sul Ross,Sam Houston State,24,20,12,18,0,Aurimas Majauskas Block.
Sul Ross,Sam Houston State,24,20,12,20,0,Dakarai Henderson Defensive Rebound.
Sul Ross,Sam Houston State,24,23,12,27,1,Dakarai Henderson made Three Point Jumper. Assisted by Torry Butler.
Sul Ross,Sam Houston State,24,23,12,40,0,Stephon Holland missed Layup.
Sul Ross,Sam Houston State,24,23,12,40,0,Aurimas Majauskas Defensive Rebound.
Sul Ross,Sam Houston State,24,23,12,52,0,Jamal Williams missed Three Point Jumper.
Sul Ross,Sam Houston State,24,23,12,52,0,Jalin Barnes Offensive Rebound.
Sul Ross,Sam Houston State,24,23,13,3,0,Foul on Dakarai Henderson.
Sul Ross,Sam Houston State,24,23,13,3,0,Dakarai Henderson Turnover.
Sul Ross,Sam Houston State,24,23,13,30,0,Jacob Dawson missed Three Point Jumper.
Sul Ross,Sam Houston State,24,23,13,30,0,Sam Houston St Defensive Rebound.
Sul Ross,Sam Houston State,24,25,13,58,1,Torry Butler made Layup. Assisted by Jamal Williams.
Sul Ross,Sam Houston State,24,25,14,17,0,Brock Anders missed Three Point Jumper.
Sul Ross,Sam Houston State,24,25,14,17,0,Caleb Thomasson Offensive Rebound.
Sul Ross,Sam Houston State,26,25,14,22,1,Caleb Thomasson made Two Point Tip Shot.
Sul Ross,Sam Houston State,26,25,14,36,0,Foul on Brock Anders.
Sul Ross,Sam Houston State,26,26,14,36,1,Dakarai Henderson made Free Throw.
Sul Ross,Sam Houston State,26,26,14,36,0,Dakarai Henderson missed Free Throw.
Sul Ross,Sam Houston State,26,26,14,36,0,Patrick Mound Defensive Rebound.
Sul Ross,Sam Houston State,26,26,14,51,0,Foul on Torry Butler.
Sul Ross,Sam Houston State,27,26,14,51,1,Stephon Holland made Free Throw.
Sul Ross,Sam Houston State,28,26,14,51,1,Stephon Holland made Free Throw.
Sul Ross,Sam Houston State,28,26,14,59,0,Aurimas Majauskas Turnover.
Sul Ross,Sam Houston State,30,26,15,23,1,Rocky Feliciano made Jumper.
Sul Ross,Sam Houston State,30,26,15,40,0,Jalin Barnes missed Three Point Jumper.
Sul Ross,Sam Houston State,30,26,15,40,0,Torry Butler Offensive Rebound.
Sul Ross,Sam Houston State,30,26,15,44,0,Foul on Caleb Thomasson.
Sul Ross,Sam Houston State,30,27,15,44,1,Torry Butler made Free Throw.
Sul Ross,Sam Houston State,30,28,15,44,1,Torry Butler made Free Throw.
Sul Ross,Sam Houston State,30,28,15,59,0,Alex Harrison missed Layup.
Sul Ross,Sam Houston State,30,28,15,59,0,Mike Huffman Offensive Rebound.
Sul Ross,Sam Houston State,32,28,16,3,1,Mike Huffman made Two Point Tip Shot.
Sul Ross,Sam Houston State,32,31,16,8,1,Josh Delaney made Three Point Jumper. Assisted by Dakarai Henderson.
Sul Ross,Sam Houston State,32,31,16,31,0,Rocky Feliciano missed Three Point Jumper.
Sul Ross,Sam Houston State,32,31,16,31,0,Josh Delaney Defensive Rebound.
Sul Ross,Sam Houston State,32,31,16,40,0,Josh Delaney missed Three Point Jumper.
Sul Ross,Sam Houston State,32,31,16,40,0,Aurimas Majauskas Offensive Rebound.
Sul Ross,Sam Houston State,32,31,16,45,0,Aurimas Majauskas missed Layup.
Sul Ross,Sam Houston State,32,31,16,45,0,Mike Huffman Defensive Rebound.
Sul Ross,Sam Houston State,32,31,16,55,0,Foul on Stephon Holland.
Sul Ross,Sam Houston State,32,31,17,9,0,Dakarai Henderson missed Three Point Jumper.
Sul Ross,Sam Houston State,32,31,17,9,0,Torry Butler Offensive Rebound.
Sul Ross,Sam Houston State,32,33,17,15,1,Jamal Williams made Layup. Assisted by Torry Butler.
Sul Ross,Sam Houston State,32,33,17,25,0,Rocky Feliciano missed Jumper.
Sul Ross,Sam Houston State,32,33,17,25,0,Dakarai Henderson Defensive Rebound.
Sul Ross,Sam Houston State,32,33,17,27,0,Foul on Alex Harrison.
Sul Ross,Sam Houston State,32,34,17,27,1,Dakarai Henderson made Free Throw.
Sul Ross,Sam Houston State,32,35,17,27,1,Dakarai Henderson made Free Throw.
Sul Ross,Sam Houston State,32,35,17,57,0,Jacob Caloss missed Three Point Jumper.
Sul Ross,Sam Houston State,32,35,17,57,0,Aurimas Majauskas Defensive Rebound.
Sul Ross,Sam Houston State,32,35,18,18,0,Torry Butler missed Layup.
Sul Ross,Sam Houston State,32,35,18,18,0,Sul Ross State Defensive Rebound.
Sul Ross,Sam Houston State,32,35,18,53,0,Jacob Caloss Turnover.
Sul Ross,Sam Houston State,32,35,18,53,0,Foul on Jacob Caloss.
Sul Ross,Sam Houston State,32,35,19,12,0,Jamal Williams missed Jumper.
Sul Ross,Sam Houston State,32,35,19,12,0,Marc Andre Fortin Offensive Rebound.
Sul Ross,Sam Houston State,32,35,19,15,0,Marc Andre Fortin missed Layup.
Sul Ross,Sam Houston State,32,35,19,15,0,Alex Harrison Block.
Sul Ross,Sam Houston State,32,35,19,15,0,Sam Houston St Offensive Rebound.
Sul Ross,Sam Houston State,32,35,19,17,0,Foul on Marc Andre Fortin.
Sul Ross,Sam Houston State,32,35,19,17,0,Marc Andre Fortin Turnover.
Sul Ross,Sam Houston State,32,35,19,39,0,Alex Harrison Turnover.
Sul Ross,Sam Houston State,32,35,19,41,0,Josh Delaney Steal.
Sul Ross,Sam Houston State,32,37,19,44,1,Dakarai Henderson made Dunk. Assisted by Torry Butler.
Sul Ross,Sam Houston State,35,37,20,0,0,End of 1st half
Sul Ross,Sam Houston State,32,37,20,19,0,Alex Harrison Turnover.
Sul Ross,Sam Houston State,32,37,20,21,0,Jalin Barnes Steal.
Sul Ross,Sam Houston State,32,39,20,33,1,Torry Butler made Layup. Assisted by Jalin Barnes.
Sul Ross,Sam Houston State,34,39,20,53,1,Damien Rhodriquez made Layup. Assisted by Mike Huffman.
Sul Ross,Sam Houston State,34,39,21,13,0,Aurimas Majauskas missed Three Point Jumper.
Sul Ross,Sam Houston State,34,39,21,13,0,Damien Rhodriquez Defensive Rebound.
Sul Ross,Sam Houston State,36,39,21,27,1,Alex Harrison made Jumper. Assisted by Rocky Feliciano.
Sul Ross,Sam Houston State,36,39,21,41,0,Jamal Williams missed Layup.
Sul Ross,Sam Houston State,36,39,21,41,0,Damien Rhodriquez Defensive Rebound.
Sul Ross,Sam Houston State,38,39,21,46,1,Alex Harrison made Layup. Assisted by Rocky Feliciano.
Sul Ross,Sam Houston State,38,42,22,8,1,Jalin Barnes made Three Point Jumper. Assisted by Jamal Williams.
Sul Ross,Sam Houston State,38,42,22,29,0,Alex Harrison Turnover.
Sul Ross,Sam Houston State,38,42,22,31,0,Torry Butler Steal.
Sul Ross,Sam Houston State,38,44,22,35,1,Jalin Barnes made Jumper. Assisted by Torry Butler.
Sul Ross,Sam Houston State,38,44,22,53,0,Jacob Dawson missed Three Point Jumper.
Sul Ross,Sam Houston State,38,44,22,53,0,Dakarai Henderson Defensive Rebound.
Sul Ross,Sam Houston State,38,46,23,4,1,Dakarai Henderson made Layup. Assisted by Jamal Williams.
Sul Ross,Sam Houston State,38,46,23,4,0,Foul on Alex Harrison.
Sul Ross,Sam Houston State,38,47,23,4,1,Dakarai Henderson made Free Throw.
Sul Ross,Sam Houston State,38,47,23,32,0,Jacob Dawson missed Three Point Jumper.
Sul Ross,Sam Houston State,38,47,23,32,0,Jamal Williams Defensive Rebound.
Sul Ross,Sam Houston State,38,47,23,42,0,Foul on Rocky Feliciano.
Sul Ross,Sam Houston State,38,50,23,49,1,Dakarai Henderson made Three Point Jumper. Assisted by Josh Delaney.
Sul Ross,Sam Houston State,38,50,23,54,0,Foul on Josh Delaney.
Sul Ross,Sam Houston State,38,50,24,6,0,Alex Harrison Turnover.
Sul Ross,Sam Houston State,38,50,24,7,0,Dakarai Henderson Steal.
Sul Ross,Sam Houston State,38,52,24,13,1,Aurimas Majauskas made Jumper. Assisted by Dakarai Henderson.
Sul Ross,Sam Houston State,38,52,24,30,0,Rocky Feliciano missed Three Point Jumper.
Sul Ross,Sam Houston State,38,52,24,30,0,Josh Delaney Defensive Rebound.
Sul Ross,Sam Houston State,38,52,24,37,0,Dakarai Henderson missed Three Point Jumper.
Sul Ross,Sam Houston State,38,52,24,37,0,Albert Almanza Offensive Rebound.
Sul Ross,Sam Houston State,38,52,24,39,0,Foul on Damien Rhodriquez.
Sul Ross,Sam Houston State,38,54,24,54,1,Aurimas Majauskas made Layup. Assisted by Josh Delaney.
Sul Ross,Sam Houston State,38,54,25,7,0,Foul on Josh Delaney.
Sul Ross,Sam Houston State,41,54,25,14,1,Patrick Mound made Three Point Jumper. Assisted by Caleb Thomasson.
Sul Ross,Sam Houston State,41,57,25,26,1,Jovante' Spivey made Three Point Jumper. Assisted by Josh Delaney.
Sul Ross,Sam Houston State,41,57,25,39,0,Xavier Webb missed Three Point Jumper.
Sul Ross,Sam Houston State,41,57,25,39,0,Dakarai Henderson Defensive Rebound.
Sul Ross,Sam Houston State,41,60,25,47,1,Josh Delaney made Three Point Jumper.
Sul Ross,Sam Houston State,41,60,26,11,0,Caleb Thomasson Turnover.
Sul Ross,Sam Houston State,41,60,26,29,0,Albert Almanza Turnover.
Sul Ross,Sam Houston State,41,60,26,29,0,Stephon Holland Steal.
Sul Ross,Sam Houston State,41,60,26,36,0,Foul on Stephon Holland.
Sul Ross,Sam Houston State,41,60,26,36,0,Stephon Holland Turnover.
Sul Ross,Sam Houston State,41,60,26,46,0,Josh Delaney missed Three Point Jumper.
Sul Ross,Sam Houston State,41,60,26,46,0,Xavier Webb Defensive Rebound.
Sul Ross,Sam Houston State,41,60,27,0,0,Xavier Webb Turnover.
Sul Ross,Sam Houston State,41,60,27,1,0,Josh Delaney Steal.
Sul Ross,Sam Houston State,41,62,27,4,1,Josh Delaney made Layup.
Sul Ross,Sam Houston State,41,62,27,22,0,Brock Anders Turnover.
Sul Ross,Sam Houston State,41,62,27,24,0,Jamal Williams Steal.
Sul Ross,Sam Houston State,41,62,27,26,0,Foul on Patrick Mound.
Sul Ross,Sam Houston State,41,62,27,26,0,Marc Andre Fortin missed Free Throw.
Sul Ross,Sam Houston State,41,62,27,26,0,Sam Houston St Deadball Team Rebound.
Sul Ross,Sam Houston State,41,62,27,26,0,Marc Andre Fortin missed Free Throw.
Sul Ross,Sam Houston State,41,62,27,26,0,Caleb Thomasson Defensive Rebound.
Sul Ross,Sam Houston State,41,62,27,44,0,Foul on Albert Almanza.
Sul Ross,Sam Houston State,41,62,27,50,0,Caleb Thomasson Turnover.
Sul Ross,Sam Houston State,41,62,27,52,0,Jovante' Spivey Steal.
Sul Ross,Sam Houston State,41,62,27,55,0,Foul on Xavier Webb.
Sul Ross,Sam Houston State,41,63,27,55,1,Jovante' Spivey made Free Throw.
Sul Ross,Sam Houston State,41,64,27,55,1,Jovante' Spivey made Free Throw.
Sul Ross,Sam Houston State,43,64,28,3,1,Alex Harrison made Jumper.
Sul Ross,Sam Houston State,43,66,28,17,1,Jamal Williams made Layup.
Sul Ross,Sam Houston State,43,66,28,19,0,Foul on Mike Huffman.
Sul Ross,Sam Houston State,43,66,28,19,0,Jamal Williams missed Free Throw.
Sul Ross,Sam Houston State,43,66,28,19,0,Alex Harrison Defensive Rebound.
Sul Ross,Sam Houston State,43,66,28,30,0,Mike Huffman Turnover.
Sul Ross,Sam Houston State,43,69,28,38,1,Albert Almanza made Three Point Jumper. Assisted by Jamal Williams.
Sul Ross,Sam Houston State,43,69,29,9,0,Rocky Feliciano missed Jumper.
Sul Ross,Sam Houston State,43,69,29,9,0,Albert Almanza Defensive Rebound.
Sul Ross,Sam Houston State,43,69,29,17,0,Jamal Williams missed Three Point Jumper.
Sul Ross,Sam Houston State,43,69,29,17,0,Mike Huffman Defensive Rebound.
Sul Ross,Sam Houston State,43,69,29,26,0,Rocky Feliciano missed Three Point Jumper.
Sul Ross,Sam Houston State,43,69,29,26,0,Jovante' Spivey Defensive Rebound.
Sul Ross,Sam Houston State,43,71,29,36,1,Jamal Williams made Layup. Assisted by Jovante' Spivey.
Sul Ross,Sam Houston State,43,71,29,57,0,Alex Harrison Turnover.
Sul Ross,Sam Houston State,43,71,29,58,0,Jalin Barnes Steal.
Sul Ross,Sam Houston State,43,71,30,9,0,Dakarai Henderson missed Three Point Jumper.
Sul Ross,Sam Houston State,43,71,30,9,0,Dakarai Henderson Offensive Rebound.
Sul Ross,Sam Houston State,43,73,30,13,1,Aurimas Majauskas made Layup. Assisted by Dakarai Henderson.
Sul Ross,Sam Houston State,43,73,30,22,0,Rocky Feliciano missed Layup.
Sul Ross,Sam Houston State,43,73,30,22,0,Dakarai Henderson Block.
Sul Ross,Sam Houston State,43,73,30,24,0,Aurimas Majauskas Defensive Rebound.
Sul Ross,Sam Houston State,43,73,30,30,0,Jalin Barnes missed Jumper.
Sul Ross,Sam Houston State,43,73,30,30,0,Jamal Williams Offensive Rebound.
Sul Ross,Sam Houston State,43,75,30,33,1,Jamal Williams made Two Point Tip Shot.
Sul Ross,Sam Houston State,43,75,30,51,0,Mike Huffman missed Layup.
Sul Ross,Sam Houston State,43,75,30,51,0,Torry Butler Block.
Sul Ross,Sam Houston State,43,75,30,53,0,Aurimas Majauskas Defensive Rebound.
Sul Ross,Sam Houston State,43,77,30,58,1,Torry Butler made Layup.
Sul Ross,Sam Houston State,43,77,31,11,0,Foul on Jalin Barnes.
Sul Ross,Sam Houston State,43,77,31,24,0,Jacob Caloss missed Three Point Jumper.
Sul Ross,Sam Houston State,43,77,31,24,0,Torry Butler Defensive Rebound.
Sul Ross,Sam Houston State,43,79,31,37,1,Aurimas Majauskas made Layup. Assisted by Josh Delaney.
Sul Ross,Sam Houston State,43,79,31,52,0,Rocky Feliciano Turnover.
Sul Ross,Sam Houston State,43,79,31,53,0,Aurimas Majauskas Steal.
Sul Ross,Sam Houston State,43,79,31,59,0,Foul on Dakarai Henderson.
Sul Ross,Sam Houston State,43,79,31,59,0,Dakarai Henderson Turnover.
Sul Ross,Sam Houston State,43,79,32,12,0,Caleb Thomasson Turnover.
Sul Ross,Sam Houston State,43,79,32,13,0,Jalin Barnes Steal.
Sul Ross,Sam Houston State,43,81,32,16,1,Jalin Barnes made Layup.
Sul Ross,Sam Houston State,43,81,32,38,0,Xavier Webb missed Three Point Jumper.
Sul Ross,Sam Houston State,43,81,32,38,0,Rocky Feliciano Offensive Rebound.
Sul Ross,Sam Houston State,43,81,32,44,0,Rocky Feliciano missed Layup.
Sul Ross,Sam Houston State,43,81,32,44,0,Torry Butler Defensive Rebound.
Sul Ross,Sam Houston State,43,84,32,50,1,Dakarai Henderson made Three Point Jumper. Assisted by Josh Delaney.
Sul Ross,Sam Houston State,43,84,33,6,0,Jacob Caloss missed Layup.
Sul Ross,Sam Houston State,43,84,33,6,0,Jalin Barnes Block.
Sul Ross,Sam Houston State,43,84,33,8,0,Jalin Barnes Defensive Rebound.
Sul Ross,Sam Houston State,43,84,33,12,0,Dakarai Henderson missed Layup.
Sul Ross,Sam Houston State,43,84,33,12,0,Rocky Feliciano Defensive Rebound.
Sul Ross,Sam Houston State,43,84,33,20,0,Foul on Josh Delaney.
Sul Ross,Sam Houston State,44,84,33,20,1,Caleb Thomasson made Free Throw.
Sul Ross,Sam Houston State,44,84,33,20,0,Caleb Thomasson missed Free Throw.
Sul Ross,Sam Houston State,44,84,33,20,0,Caleb Thomasson Offensive Rebound.
Sul Ross,Sam Houston State,46,84,33,24,1,Caleb Thomasson made Jumper. Assisted by Xavier Webb.
Sul Ross,Sam Houston State,46,84,33,39,0,Foul on Caleb Thomasson.
Sul Ross,Sam Houston State,46,84,33,39,0,Aurimas Majauskas missed Free Throw.
Sul Ross,Sam Houston State,46,84,33,39,0,Sam Houston St Deadball Team Rebound.
Sul Ross,Sam Houston State,46,85,33,39,1,Aurimas Majauskas made Free Throw.
Sul Ross,Sam Houston State,46,85,33,43,0,Stephon Holland Turnover.
Sul Ross,Sam Houston State,46,85,33,44,0,Jalin Barnes Steal.
Sul Ross,Sam Houston State,46,87,33,45,1,Jamal Williams made Layup. Assisted by Jalin Barnes.
Sul Ross,Sam Houston State,46,87,33,56,0,Patrick Mound missed Three Point Jumper.
Sul Ross,Sam Houston State,46,87,33,56,0,Jamal Williams Defensive Rebound.
Sul Ross,Sam Houston State,46,87,33,57,0,Foul on Aurimas Majauskas.
Sul Ross,Sam Houston State,46,87,33,57,0,Aurimas Majauskas Turnover.
Sul Ross,Sam Houston State,47,87,33,57,1,Caleb Thomasson made Free Throw.
Sul Ross,Sam Houston State,48,87,33,57,1,Caleb Thomasson made Free Throw.
Sul Ross,Sam Houston State,48,87,34,10,0,Dakarai Henderson missed Jumper.
Sul Ross,Sam Houston State,48,87,34,10,0,Dakarai Henderson Offensive Rebound.
Sul Ross,Sam Houston State,48,87,34,14,0,Dakarai Henderson missed Layup.
Sul Ross,Sam Houston State,48,87,34,14,0,Sam Houston St Offensive Rebound.
Sul Ross,Sam Houston State,48,89,34,30,1,Aurimas Majauskas made Layup. Assisted by Albert Almanza.
Sul Ross,Sam Houston State,48,89,34,50,0,Foul on Jalin Barnes.
Sul Ross,Sam Houston State,49,89,34,51,1,Xavier Webb made Free Throw.
Sul Ross,Sam Houston State,50,89,34,51,1,Xavier Webb made Free Throw.
Sul Ross,Sam Houston State,50,91,35,2,1,Jamal Williams made Layup.
Sul Ross,Sam Houston State,50,91,35,16,0,Xavier Webb missed Three Point Jumper.
Sul Ross,Sam Houston State,50,91,35,16,0,Jovante' Spivey Defensive Rebound.
Sul Ross,Sam Houston State,50,94,35,25,1,Jovante' Spivey made Three Point Jumper. Assisted by Albert Almanza.
Sul Ross,Sam Houston State,50,94,35,39,0,Jacob Caloss missed Layup.
Sul Ross,Sam Houston State,50,94,35,39,0,Andre Sands Defensive Rebound.
Sul Ross,Sam Houston State,50,94,35,50,0,Albert Almanza missed Three Point Jumper.
Sul Ross,Sam Houston State,50,94,35,50,0,Andre Sands Offensive Rebound.
Sul Ross,Sam Houston State,50,97,35,55,1,Dakarai Henderson made Three Point Jumper. Assisted by Andre Sands.
Sul Ross,Sam Houston State,50,97,36,9,0,Patrick Mound missed Three Point Jumper.
Sul Ross,Sam Houston State,50,97,36,9,0,Albert Almanza Defensive Rebound.
Sul Ross,Sam Houston State,50,97,36,21,0,Jovante' Spivey Turnover.
Sul Ross,Sam Houston State,52,97,36,38,1,Stephon Holland made Layup. Assisted by Patrick Mound.
Sul Ross,Sam Houston State,52,97,36,50,0,Josh Delaney missed Three Point Jumper.
Sul Ross,Sam Houston State,52,97,36,50,0,Andre Sands Offensive Rebound.
Sul Ross,Sam Houston State,52,99,36,54,1,Andre Sands made Layup.
Sul Ross,Sam Houston State,52,99,36,56,0,Foul on Caleb Thomasson.
Sul Ross,Sam Houston State,52,100,37,0,1,Andre Sands made Free Throw.
Sul Ross,Sam Houston State,52,100,37,9,0,Patrick Mound missed Three Point Jumper.
Sul Ross,Sam Houston State,52,100,37,9,0,Andre Sands Defensive Rebound.
Sul Ross,Sam Houston State,52,100,37,18,0,Foul on Patrick Mound.
Sul Ross,Sam Houston State,52,101,37,18,1,Josh Delaney made Free Throw.
Sul Ross,Sam Houston State,52,102,37,18,1,Josh Delaney made Free Throw.
Sul Ross,Sam Houston State,52,102,37,41,0,Jacob Caloss Turnover.
Sul Ross,Sam Houston State,52,102,37,43,0,Jesse Lopez Steal.
Sul Ross,Sam Houston State,52,104,37,45,1,Andre Sands made Dunk. Assisted by Josh Delaney.
Sul Ross,Sam Houston State,52,104,38,1,0,Foul on Andre Sands.
Sul Ross,Sam Houston State,53,104,38,1,1,Stephon Holland made Free Throw.
Sul Ross,Sam Houston State,54,104,38,1,1,Stephon Holland made Free Throw.
Sul Ross,Sam Houston State,54,104,38,19,0,Andre Sands missed Layup.
Sul Ross,Sam Houston State,54,104,38,19,0,Andre Sands Offensive Rebound.
Sul Ross,Sam Houston State,54,106,38,21,1,Andre Sands made Two Point Tip Shot.
Sul Ross,Sam Houston State,54,106,38,30,0,Stephon Holland missed Jumper.
Sul Ross,Sam Houston State,54,106,38,30,0,Xavier Webb Offensive Rebound.
Sul Ross,Sam Houston State,54,106,38,39,0,Xavier Webb missed Three Point Jumper.
Sul Ross,Sam Houston State,54,106,38,39,0,Andre Sands Defensive Rebound.
