Away Team,Home Team,Away Score,Home Score,Minute,Second,isScoringPosession,Desc.
Sul Ross,Sam Houston State,54,109,38,48,1,Mitch McCormick made Three Point Jumper. Assisted by Josh Delaney.
Sul Ross,Sam Houston State,54,109,38,50,0,Foul on Patrick Mound.
Sul Ross,Sam Houston State,54,109,38,50,0,Mitch McCormick missed Free Throw.
Sul Ross,Sam Houston State,54,109,38,50,0,Xavier Webb Defensive Rebound.
Sul Ross,Sam Houston State,57,109,39,3,1,Jacob Caloss made Three Point Jumper. Assisted by Xavier Webb.
Sul Ross,Sam Houston State,57,109,39,19,0,Jovante' Spivey missed Three Point Jumper.
Sul Ross,Sam Houston State,57,109,39,19,0,Patrick Mound Defensive Rebound.
Sul Ross,Sam Houston State,57,109,39,27,0,Foul on Jovante' Spivey.
Sul Ross,Sam Houston State,58,109,39,27,1,Xavier Webb made Free Throw.
Sul Ross,Sam Houston State,59,109,39,27,1,Xavier Webb made Free Throw.
Sul Ross,Sam Houston State,59,109,39,33,0,Josh Delaney missed Three Point Jumper.
Sul Ross,Sam Houston State,59,109,39,33,0,Jesse Lopez Offensive Rebound.
Sul Ross,Sam Houston State,59,109,39,37,0,Jesse Lopez missed Layup.
Sul Ross,Sam Houston State,59,109,39,37,0,Jacob Caloss Defensive Rebound.
Sul Ross,Sam Houston State,61,109,39,48,1,Stephon Holland made Jumper. Assisted by Jacob Caloss.
Sul Ross,Sam Houston State,61,109,40,0,0,End of Game
