Away Team,Home Team,Away Score,Home Score,Minute,Second,isScoringPosession,Desc.
FDU-Florham,Fairleigh Dickinson,61,100,34,35,0,Fairleigh Dickinson Deadball Team Rebound.
FDU-Florham,Fairleigh Dickinson,61,100,34,36,0,Foul on James Moran.
FDU-Florham,Fairleigh Dickinson,61,102,35,0,1,Ghassan Nehme made Jumper.
FDU-Florham,Fairleigh Dickinson,61,102,35,19,0,Jayson Hughes Turnover.
FDU-Florham,Fairleigh Dickinson,61,102,35,20,0,Ghassan Nehme Steal.
FDU-Florham,Fairleigh Dickinson,61,102,35,23,0,Ghassan Nehme missed Three Point Jumper.
FDU-Florham,Fairleigh Dickinson,61,102,35,23,0,Veon Lassiter Defensive Rebound.
FDU-Florham,Fairleigh Dickinson,61,102,35,27,0,Foul on Malik Miller.
FDU-Florham,Fairleigh Dickinson,61,102,35,27,0,Veon Lassiter missed Free Throw.
FDU-Florham,Fairleigh Dickinson,61,102,35,27,0,FDU Florham Deadball Team Rebound.
FDU-Florham,Fairleigh Dickinson,62,102,35,27,1,Veon Lassiter made Free Throw.
FDU-Florham,Fairleigh Dickinson,62,102,35,43,0,Malik Miller missed Three Point Jumper.
FDU-Florham,Fairleigh Dickinson,62,102,35,43,0,Derek Leohner Defensive Rebound.
FDU-Florham,Fairleigh Dickinson,62,102,35,52,0,Anthony Mitchell missed Three Point Jumper.
FDU-Florham,Fairleigh Dickinson,62,102,35,52,0,Veon Lassiter Offensive Rebound.
FDU-Florham,Fairleigh Dickinson,62,102,35,56,0,Veon Lassiter missed Dunk.
FDU-Florham,Fairleigh Dickinson,62,102,35,56,0,Dondre Rhoden Defensive Rebound.
FDU-Florham,Fairleigh Dickinson,62,102,36,2,0,Official TV Timeout
FDU-Florham,Fairleigh Dickinson,62,104,36,3,1,Dondre Rhoden made Layup. Assisted by Mike Schroback.
FDU-Florham,Fairleigh Dickinson,62,104,36,22,0,Foul on Dondre Rhoden.
FDU-Florham,Fairleigh Dickinson,62,104,36,22,0,Donte Ali missed Free Throw.
FDU-Florham,Fairleigh Dickinson,62,104,36,22,0,FDU Florham Deadball Team Rebound.
FDU-Florham,Fairleigh Dickinson,63,104,36,22,1,Donte Ali made Free Throw.
FDU-Florham,Fairleigh Dickinson,63,104,36,37,0,Myles Mann missed Jumper.
FDU-Florham,Fairleigh Dickinson,63,104,36,37,0,Darnell Edge Offensive Rebound.
FDU-Florham,Fairleigh Dickinson,63,106,36,40,1,Darnell Edge made Layup.
FDU-Florham,Fairleigh Dickinson,63,106,36,54,0,Steve Herdman Turnover.
FDU-Florham,Fairleigh Dickinson,63,106,36,56,0,Mike Schroback Steal.
FDU-Florham,Fairleigh Dickinson,63,108,36,59,1,Mike Schroback made Layup.
FDU-Florham,Fairleigh Dickinson,63,108,36,59,0,Foul on Jayson Hughes.
FDU-Florham,Fairleigh Dickinson,63,109,36,59,1,Mike Schroback made Free Throw.
FDU-Florham,Fairleigh Dickinson,63,109,37,7,0,Charlie Slack missed Three Point Jumper.
FDU-Florham,Fairleigh Dickinson,63,109,37,7,0,Tyler Christie Offensive Rebound.
FDU-Florham,Fairleigh Dickinson,63,109,37,15,0,James Moran missed Three Point Jumper.
FDU-Florham,Fairleigh Dickinson,63,109,37,15,0,Eric Ray Offensive Rebound.
FDU-Florham,Fairleigh Dickinson,63,109,37,20,0,Eric Ray missed Layup.
FDU-Florham,Fairleigh Dickinson,63,109,37,20,0,Dondre Rhoden Block.
FDU-Florham,Fairleigh Dickinson,63,109,37,20,0,FDU Florham Offensive Rebound.
FDU-Florham,Fairleigh Dickinson,63,109,37,21,0,James Moran missed Jumper.
FDU-Florham,Fairleigh Dickinson,63,109,37,21,0,Myles Mann Defensive Rebound.
FDU-Florham,Fairleigh Dickinson,63,111,37,37,1,Myles Mann made Layup.
FDU-Florham,Fairleigh Dickinson,66,111,37,50,1,Tyler Christie made Three Point Jumper. Assisted by Anthony Mitchell.
FDU-Florham,Fairleigh Dickinson,66,111,38,12,0,Ghassan Nehme missed Jumper.
FDU-Florham,Fairleigh Dickinson,66,111,38,12,0,Anthony Mitchell Defensive Rebound.
FDU-Florham,Fairleigh Dickinson,66,111,38,29,0,Eric Ray missed Jumper.
FDU-Florham,Fairleigh Dickinson,66,111,38,29,0,Eric Ray Offensive Rebound.
FDU-Florham,Fairleigh Dickinson,68,111,38,31,1,Eric Ray made Layup.
FDU-Florham,Fairleigh Dickinson,68,111,38,51,0,Myles Mann missed Jumper.
FDU-Florham,Fairleigh Dickinson,68,111,38,55,0,Myles Mann missed Layup.
FDU-Florham,Fairleigh Dickinson,68,111,38,55,0,Tyler Christie Defensive Rebound.
FDU-Florham,Fairleigh Dickinson,68,111,39,1,0,Eric Ray missed Three Point Jumper.
FDU-Florham,Fairleigh Dickinson,68,111,39,1,0,Ghassan Nehme Defensive Rebound.
FDU-Florham,Fairleigh Dickinson,68,111,39,28,0,Myles Mann missed Layup.
FDU-Florham,Fairleigh Dickinson,68,111,39,28,0,Eric Ray Defensive Rebound.
FDU-Florham,Fairleigh Dickinson,70,111,39,41,1,Tyler Christie made Jumper.
FDU-Florham,Fairleigh Dickinson,70,111,40,0,0,End of Game
