Away Team,Home Team,Away Score,Home Score,Minute,Second,isScoringPosession,Desc.
Bucknell,Holy Cross,0,0,0,22,0,John Azzinaro missed Jumper.
Bucknell,Holy Cross,0,0,0,22,0,Malcolm Miller Defensive Rebound.
Bucknell,Holy Cross,0,0,0,42,0,Matt Husek missed Jumper.
Bucknell,Holy Cross,0,0,0,42,0,Malachi Alexander Offensive Rebound.
Bucknell,Holy Cross,0,0,0,45,0,Malachi Alexander missed Layup.
Bucknell,Holy Cross,0,0,0,45,0,Cory Starkey Defensive Rebound.
Bucknell,Holy Cross,0,0,1,0,0,J.C. Show Turnover.
Bucknell,Holy Cross,0,0,1,17,0,Malcolm Miller missed Layup.
Bucknell,Holy Cross,0,0,1,17,0,Nana Foulland Block.
Bucknell,Holy Cross,0,0,1,19,0,John Azzinaro Defensive Rebound.
Bucknell,Holy Cross,2,0,1,22,1,Cory Starkey made Layup. Assisted by John Azzinaro.
Bucknell,Holy Cross,2,0,1,40,0,Matt Husek missed Three Point Jumper.
Bucknell,Holy Cross,2,0,1,40,0,Bucknell Defensive Rebound.
Bucknell,Holy Cross,2,0,2,3,0,Foul on Malachi Alexander.
Bucknell,Holy Cross,2,0,2,15,0,Nana Foulland missed Jumper.
Bucknell,Holy Cross,2,0,2,15,0,Malachi Alexander Defensive Rebound.
Bucknell,Holy Cross,2,3,2,40,1,Justin Burrell made Three Point Jumper. Assisted by Matt Husek.
Bucknell,Holy Cross,2,3,3,8,0,Cory Starkey missed Layup.
Bucknell,Holy Cross,2,3,3,8,0,Malachi Alexander Defensive Rebound.
Bucknell,Holy Cross,2,5,3,41,1,Justin Burrell made Layup.
Bucknell,Holy Cross,2,5,3,55,0,John Azzinaro Turnover.
Bucknell,Holy Cross,2,5,3,55,0,Foul on John Azzinaro.
Bucknell,Holy Cross,2,8,4,10,1,Malcolm Miller made Three Point Jumper.
Bucknell,Holy Cross,2,8,4,36,0,Chris Hass Turnover.
Bucknell,Holy Cross,2,8,4,36,0,Holy Cross  Timeout
Bucknell,Holy Cross,2,8,4,48,0,Mitchell Hahn Turnover.
Bucknell,Holy Cross,2,8,5,4,0,Foul on Taylor Abt.
Bucknell,Holy Cross,4,8,5,7,1,Nana Foulland made Jumper.
Bucknell,Holy Cross,4,11,5,27,1,Mitchell Hahn made Three Point Jumper. Assisted by Eric Green.
Bucknell,Holy Cross,6,11,5,53,1,Dom Hoffman made Layup. Assisted by Nana Foulland.
Bucknell,Holy Cross,6,11,6,17,0,Malcolm Miller missed Layup.
Bucknell,Holy Cross,6,11,6,17,0,Anthony Thompson Offensive Rebound.
Bucknell,Holy Cross,6,13,6,49,1,Eric Green made Jumper. Assisted by Anthony Thompson.
Bucknell,Holy Cross,6,13,7,24,0,Nana Foulland Turnover.
Bucknell,Holy Cross,6,13,7,27,0,Eric Green Turnover.
Bucknell,Holy Cross,6,13,7,29,0,J.C. Show Steal.
Bucknell,Holy Cross,6,13,7,50,0,Foul on Taylor Abt.
Bucknell,Holy Cross,6,13,7,50,0,J.C. Show missed Free Throw.
Bucknell,Holy Cross,6,13,7,50,0,Bucknell Deadball Team Rebound.
Bucknell,Holy Cross,7,13,7,50,1,J.C. Show made Free Throw.
Bucknell,Holy Cross,7,15,8,5,1,Eric Green made Jumper.
Bucknell,Holy Cross,7,15,8,25,0,Dom Hoffman missed Jumper.
Bucknell,Holy Cross,7,15,8,25,0,D.J. MacLeay Offensive Rebound.
Bucknell,Holy Cross,7,15,8,31,0,Dom Hoffman missed Layup.
Bucknell,Holy Cross,7,15,8,31,0,Dom Hoffman Offensive Rebound.
Bucknell,Holy Cross,9,15,8,37,1,D.J. MacLeay made Layup.
Bucknell,Holy Cross,9,17,8,53,1,Matt Husek made Jumper. Assisted by Cullen Hamilton.
Bucknell,Holy Cross,9,17,9,21,0,D.J. MacLeay missed Layup.
Bucknell,Holy Cross,9,17,9,21,0,Eric Green Block.
Bucknell,Holy Cross,9,17,9,23,0,Mitchell Hahn Defensive Rebound.
Bucknell,Holy Cross,9,17,9,28,0,Mitchell Hahn Turnover.
Bucknell,Holy Cross,9,17,9,29,0,D.J. MacLeay Steal.
Bucknell,Holy Cross,9,17,9,40,0,Bucknell  Timeout
Bucknell,Holy Cross,9,17,9,41,0,J.C. Show Turnover.
Bucknell,Holy Cross,9,17,9,42,0,Cullen Hamilton Steal.
Bucknell,Holy Cross,9,17,9,59,0,Cullen Hamilton missed Jumper.
Bucknell,Holy Cross,9,17,9,59,0,Malachi Alexander Offensive Rebound.
Bucknell,Holy Cross,9,19,10,3,1,Malachi Alexander made Layup.
Bucknell,Holy Cross,9,19,10,26,0,Chris Hass missed Three Point Jumper.
Bucknell,Holy Cross,9,19,10,26,0,Malachi Alexander Defensive Rebound.
Bucknell,Holy Cross,9,22,10,45,1,Cullen Hamilton made Three Point Jumper. Assisted by Justin Burrell.
Bucknell,Holy Cross,9,22,10,50,0,Bucknell  Timeout
Bucknell,Holy Cross,9,22,11,6,0,John Azzinaro missed Jumper.
Bucknell,Holy Cross,9,22,11,6,0,Cullen Hamilton Defensive Rebound.
Bucknell,Holy Cross,9,24,11,38,1,Cullen Hamilton made Jumper.
Bucknell,Holy Cross,9,24,11,56,0,John Azzinaro Turnover.
Bucknell,Holy Cross,9,24,12,8,0,Cullen Hamilton Turnover.
Bucknell,Holy Cross,9,24,12,8,0,Bucknell  Timeout
Bucknell,Holy Cross,9,24,12,26,0,Chris Hass missed Jumper.
Bucknell,Holy Cross,9,24,12,26,0,Malachi Alexander Defensive Rebound.
Bucknell,Holy Cross,9,24,12,43,0,Robert Champion missed Three Point Jumper.
Bucknell,Holy Cross,9,24,12,43,0,Bucknell Defensive Rebound.
Bucknell,Holy Cross,11,24,13,12,1,Nana Foulland made Layup. Assisted by Stephen Brown.
Bucknell,Holy Cross,11,24,13,12,0,Foul on Christopher Morgan.
Bucknell,Holy Cross,12,24,13,12,1,Nana Foulland made Free Throw.
Bucknell,Holy Cross,12,24,13,26,0,Foul on Dom Hoffman.
Bucknell,Holy Cross,12,24,13,26,0,Malachi Alexander missed Free Throw.
Bucknell,Holy Cross,12,24,13,26,0,Holy Cross Deadball Team Rebound.
Bucknell,Holy Cross,12,25,13,26,1,Malachi Alexander made Free Throw.
Bucknell,Holy Cross,14,25,13,57,1,Ryan Frazier made Jumper. Assisted by J.C. Show.
Bucknell,Holy Cross,14,28,14,14,1,Malachi Alexander made Three Point Jumper. Assisted by Eric Green.
Bucknell,Holy Cross,17,28,14,56,1,J.C. Show made Three Point Jumper. Assisted by D.J. MacLeay.
Bucknell,Holy Cross,17,28,15,33,0,Malcolm Miller missed Three Point Jumper.
Bucknell,Holy Cross,17,28,15,33,0,Malcolm Miller Offensive Rebound.
Bucknell,Holy Cross,17,28,15,37,0,Foul on D.J. MacLeay.
Bucknell,Holy Cross,17,28,15,39,0,Foul on Ryan Frazier.
Bucknell,Holy Cross,17,28,16,0,0,Christopher Morgan Turnover.
Bucknell,Holy Cross,17,28,16,0,0,Foul on Christopher Morgan.
Bucknell,Holy Cross,17,28,16,19,0,J.C. Show missed Three Point Jumper.
Bucknell,Holy Cross,17,28,16,19,0,Malcolm Miller Defensive Rebound.
Bucknell,Holy Cross,17,28,16,39,0,Cullen Hamilton missed Jumper.
Bucknell,Holy Cross,17,28,16,39,0,Cory Starkey Defensive Rebound.
Bucknell,Holy Cross,17,28,16,56,0,Foul on Christopher Morgan.
Bucknell,Holy Cross,17,28,16,56,0,Bucknell  Timeout
Bucknell,Holy Cross,17,28,17,13,0,Cory Starkey Turnover.
Bucknell,Holy Cross,17,28,17,30,0,Malachi Alexander missed Jumper.
Bucknell,Holy Cross,17,28,17,30,0,Bucknell Defensive Rebound.
Bucknell,Holy Cross,17,28,17,32,0,Foul on Malcolm Miller.
Bucknell,Holy Cross,18,28,17,32,1,Steven Kaspar made Free Throw.
Bucknell,Holy Cross,19,28,17,32,1,Steven Kaspar made Free Throw.
Bucknell,Holy Cross,19,30,17,57,1,Mitchell Hahn made Jumper.
Bucknell,Holy Cross,19,30,18,17,0,Stephen Brown Turnover.
Bucknell,Holy Cross,19,30,18,32,0,Justin Burrell Turnover.
Bucknell,Holy Cross,19,30,18,52,0,Dom Hoffman missed Layup.
Bucknell,Holy Cross,19,30,18,52,0,Mitchell Hahn Defensive Rebound.
Bucknell,Holy Cross,19,32,19,15,1,Malachi Alexander made Layup.
Bucknell,Holy Cross,21,32,19,49,1,Dom Hoffman made Layup. Assisted by Stephen Brown.
Bucknell,Holy Cross,21,32,19,50,0,Holy Cross  Timeout
Bucknell,Holy Cross,21,32,19,57,0,Anthony Thompson Turnover.
Bucknell,Holy Cross,21,32,19,58,0,Steven Kaspar Steal.
Bucknell,Holy Cross,23,32,19,59,1,Stephen Brown made Layup.
Bucknell,Holy Cross,23,32,20,0,0,End of 1st half
Bucknell,Holy Cross,23,34,20,13,1,Malcolm Miller made Jumper. Assisted by Justin Burrell.
Bucknell,Holy Cross,23,34,20,41,0,Chris Hass missed Jumper.
Bucknell,Holy Cross,23,34,20,41,0,Justin Burrell Defensive Rebound.
Bucknell,Holy Cross,23,34,20,50,0,Matt Husek missed Jumper.
Bucknell,Holy Cross,23,34,20,50,0,Nana Foulland Defensive Rebound.
Bucknell,Holy Cross,23,34,21,6,0,J.C. Show missed Jumper.
Bucknell,Holy Cross,23,34,21,6,0,Anthony Thompson Defensive Rebound.
Bucknell,Holy Cross,23,34,21,25,0,Matt Husek missed Three Point Jumper.
Bucknell,Holy Cross,23,34,21,25,0,Cory Starkey Defensive Rebound.
Bucknell,Holy Cross,23,34,21,53,0,Foul on Matt Husek.
Bucknell,Holy Cross,25,34,21,59,1,Nana Foulland made Jumper.
Bucknell,Holy Cross,25,36,22,17,1,Justin Burrell made Jumper. Assisted by Anthony Thompson.
Bucknell,Holy Cross,25,36,22,47,0,Nana Foulland Turnover.
Bucknell,Holy Cross,25,36,22,47,0,Foul on Nana Foulland.
Bucknell,Holy Cross,25,36,23,7,0,Malcolm Miller missed Three Point Jumper.
Bucknell,Holy Cross,25,36,23,7,0,John Azzinaro Defensive Rebound.
Bucknell,Holy Cross,27,36,23,20,1,Chris Hass made Jumper.
Bucknell,Holy Cross,27,39,23,38,1,Justin Burrell made Three Point Jumper. Assisted by Anthony Thompson.
Bucknell,Holy Cross,27,39,23,57,0,Foul on Taylor Abt.
Bucknell,Holy Cross,27,39,24,8,0,J.C. Show missed Jumper.
Bucknell,Holy Cross,27,39,24,8,0,Nana Foulland Offensive Rebound.
Bucknell,Holy Cross,29,39,24,10,1,Nana Foulland made Layup.
Bucknell,Holy Cross,29,41,24,30,1,Christopher Morgan made Jumper. Assisted by Eric Green.
Bucknell,Holy Cross,29,41,24,58,0,Nana Foulland missed Layup.
Bucknell,Holy Cross,29,41,24,58,0,Eric Green Defensive Rebound.
Bucknell,Holy Cross,29,41,25,3,0,Foul on Chris Hass.
Bucknell,Holy Cross,29,41,25,3,0,Cullen Hamilton missed Free Throw.
Bucknell,Holy Cross,29,41,25,3,0,Holy Cross Deadball Team Rebound.
Bucknell,Holy Cross,29,42,25,3,1,Cullen Hamilton made Free Throw.
Bucknell,Holy Cross,31,42,25,30,1,Stephen Brown made Layup.
Bucknell,Holy Cross,31,42,25,59,0,Justin Burrell missed Three Point Jumper.
Bucknell,Holy Cross,31,42,25,59,0,D.J. MacLeay Defensive Rebound.
Bucknell,Holy Cross,31,42,26,8,0,Foul on Mitchell Hahn.
Bucknell,Holy Cross,32,42,26,8,1,Dom Hoffman made Free Throw.
Bucknell,Holy Cross,32,42,26,8,0,Dom Hoffman missed Free Throw.
Bucknell,Holy Cross,32,42,26,8,0,Eric Green Defensive Rebound.
Bucknell,Holy Cross,32,42,26,25,0,Eric Green missed Layup.
Bucknell,Holy Cross,32,42,26,25,0,D.J. MacLeay Defensive Rebound.
Bucknell,Holy Cross,32,42,26,29,0,Chris Hass missed Three Point Jumper.
Bucknell,Holy Cross,32,42,26,29,0,Holy Cross Defensive Rebound.
Bucknell,Holy Cross,32,42,26,55,0,Matt Husek missed Three Point Jumper.
Bucknell,Holy Cross,32,42,26,55,0,Bucknell Defensive Rebound.
Bucknell,Holy Cross,32,42,26,57,0,Foul on Eric Green.
Bucknell,Holy Cross,32,42,27,16,0,Foul on Matt Husek.
Bucknell,Holy Cross,33,42,27,16,1,Stephen Brown made Free Throw.
Bucknell,Holy Cross,33,42,27,16,0,Stephen Brown missed Free Throw.
Bucknell,Holy Cross,33,42,27,16,0,Cullen Hamilton Defensive Rebound.
Bucknell,Holy Cross,33,42,27,32,0,Malcolm Miller missed Jumper.
Bucknell,Holy Cross,33,42,27,32,0,D.J. MacLeay Defensive Rebound.
Bucknell,Holy Cross,35,42,27,47,1,Dom Hoffman made Layup. Assisted by Steven Kaspar.
Bucknell,Holy Cross,35,42,27,49,0,Holy Cross  Timeout
Bucknell,Holy Cross,35,42,28,5,0,Malachi Alexander missed Layup.
Bucknell,Holy Cross,35,42,28,5,0,Steven Kaspar Defensive Rebound.
Bucknell,Holy Cross,35,42,28,34,0,D.J. MacLeay missed Jumper.
Bucknell,Holy Cross,35,42,28,34,0,Malachi Alexander Defensive Rebound.
Bucknell,Holy Cross,35,42,28,54,0,Cullen Hamilton missed Jumper.
Bucknell,Holy Cross,35,42,28,54,0,Steven Kaspar Defensive Rebound.
Bucknell,Holy Cross,35,42,29,3,0,Foul on Malcolm Miller.
Bucknell,Holy Cross,35,42,29,3,0,Bucknell  Timeout
Bucknell,Holy Cross,37,42,29,25,1,Chris Hass made Jumper. Assisted by Steven Kaspar.
Bucknell,Holy Cross,37,42,29,53,0,Malachi Alexander missed Three Point Jumper.
Bucknell,Holy Cross,37,42,29,53,0,Malachi Alexander Offensive Rebound.
Bucknell,Holy Cross,37,44,30,8,1,Christopher Morgan made Jumper. Assisted by Anthony Thompson.
Bucknell,Holy Cross,37,44,30,34,0,Chris Hass Turnover.
Bucknell,Holy Cross,37,44,30,35,0,Anthony Thompson Steal.
Bucknell,Holy Cross,37,44,31,1,0,Foul on Steven Kaspar.
Bucknell,Holy Cross,37,44,31,9,0,Malcolm Miller missed Layup.
Bucknell,Holy Cross,37,44,31,9,0,Steven Kaspar Block.
Bucknell,Holy Cross,37,44,31,10,0,Holy Cross Offensive Rebound.
Bucknell,Holy Cross,37,44,31,37,0,Christopher Morgan missed Jumper.
Bucknell,Holy Cross,37,44,31,37,0,Steven Kaspar Defensive Rebound.
Bucknell,Holy Cross,39,44,31,55,1,J.C. Show made Layup.
Bucknell,Holy Cross,39,44,32,17,0,Malachi Alexander missed Three Point Jumper.
Bucknell,Holy Cross,39,44,32,17,0,Malachi Alexander Offensive Rebound.
Bucknell,Holy Cross,39,44,32,22,0,Malachi Alexander missed Layup.
Bucknell,Holy Cross,39,44,32,22,0,Nana Foulland Block.
Bucknell,Holy Cross,39,44,32,22,0,Bucknell Defensive Rebound.
Bucknell,Holy Cross,39,44,32,22,0,Bucknell  Timeout
Bucknell,Holy Cross,42,44,32,39,1,J.C. Show made Three Point Jumper. Assisted by Stephen Brown.
Bucknell,Holy Cross,42,44,32,59,0,Foul on Stephen Brown.
Bucknell,Holy Cross,42,47,33,16,1,Justin Burrell made Three Point Jumper. Assisted by Cullen Hamilton.
Bucknell,Holy Cross,44,47,33,42,1,Stephen Brown made Jumper.
Bucknell,Holy Cross,44,47,34,3,0,Mitchell Hahn missed Three Point Jumper.
Bucknell,Holy Cross,44,47,34,3,0,Bucknell Defensive Rebound.
Bucknell,Holy Cross,44,47,34,5,0,Foul on Taylor Abt.
Bucknell,Holy Cross,44,47,34,5,0,Cory Starkey missed Free Throw.
Bucknell,Holy Cross,44,47,34,5,0,Cullen Hamilton Defensive Rebound.
Bucknell,Holy Cross,44,47,34,20,0,Eric Green Turnover.
Bucknell,Holy Cross,44,47,34,20,0,Bucknell  Timeout
Bucknell,Holy Cross,46,47,34,48,1,Nana Foulland made Layup.
Bucknell,Holy Cross,46,47,34,48,0,Foul on Christopher Morgan.
Bucknell,Holy Cross,47,47,34,48,1,Nana Foulland made Free Throw.
Bucknell,Holy Cross,47,47,35,6,0,Foul on J.C. Show.
Bucknell,Holy Cross,47,47,35,11,0,Foul on Cory Starkey.
Bucknell,Holy Cross,47,47,35,26,0,Justin Burrell Turnover.
Bucknell,Holy Cross,47,47,35,27,0,J.C. Show Steal.
Bucknell,Holy Cross,47,47,35,34,0,Steven Kaspar Turnover.
Bucknell,Holy Cross,47,47,35,35,0,Malachi Alexander Steal.
Bucknell,Holy Cross,47,47,35,57,0,Malachi Alexander Turnover.
Bucknell,Holy Cross,47,47,35,57,0,Foul on Malachi Alexander.
Bucknell,Holy Cross,49,47,36,16,1,Steven Kaspar made Layup.
Bucknell,Holy Cross,49,47,36,35,0,Cullen Hamilton Turnover.
Bucknell,Holy Cross,49,47,36,37,0,Chris Hass Steal.
Bucknell,Holy Cross,51,47,36,40,1,Chris Hass made Layup.
Bucknell,Holy Cross,51,47,36,51,0,Foul on Steven Kaspar.
Bucknell,Holy Cross,51,47,36,51,0,Holy Cross  Timeout
Bucknell,Holy Cross,51,48,36,51,1,Anthony Thompson made Free Throw.
Bucknell,Holy Cross,51,48,36,51,0,Anthony Thompson missed Free Throw.
Bucknell,Holy Cross,51,48,36,51,0,Steven Kaspar Defensive Rebound.
Bucknell,Holy Cross,51,48,37,4,0,Foul on Malachi Alexander.
Bucknell,Holy Cross,51,48,37,4,0,Dom Hoffman missed Free Throw.
Bucknell,Holy Cross,51,48,37,4,0,Bucknell Deadball Team Rebound.
Bucknell,Holy Cross,52,48,37,4,1,Dom Hoffman made Free Throw.
Bucknell,Holy Cross,52,50,37,33,1,Mitchell Hahn made Layup.
Bucknell,Holy Cross,52,50,37,55,0,Steven Kaspar Turnover.
Bucknell,Holy Cross,52,50,38,25,0,Foul on Nana Foulland.
Bucknell,Holy Cross,52,51,38,25,1,Malcolm Miller made Free Throw.
Bucknell,Holy Cross,52,52,38,25,1,Malcolm Miller made Free Throw.
Bucknell,Holy Cross,52,52,38,33,0,Bucknell  Timeout
Bucknell,Holy Cross,52,52,38,57,0,Chris Hass missed Jumper.
Bucknell,Holy Cross,52,52,38,57,0,Dom Hoffman Offensive Rebound.
Bucknell,Holy Cross,54,52,39,2,1,Dom Hoffman made Layup.
Bucknell,Holy Cross,54,52,39,4,0,Holy Cross  Timeout
Bucknell,Holy Cross,54,52,39,19,0,Foul on Steven Kaspar.
Bucknell,Holy Cross,54,53,39,19,1,Malachi Alexander made Free Throw.
Bucknell,Holy Cross,54,54,39,19,1,Malachi Alexander made Free Throw.
Bucknell,Holy Cross,54,54,39,27,0,Bucknell  Timeout
Bucknell,Holy Cross,54,54,39,53,0,J.C. Show missed Three Point Jumper.
Bucknell,Holy Cross,54,54,39,54,0,Bucknell Deadball Team Rebound.
Bucknell,Holy Cross,54,54,39,54,0,Bucknell  Turnover.
Bucknell,Holy Cross,54,54,39,54,0,Holy Cross  Timeout
Bucknell,Holy Cross,54,54,40,0,0,End of 2nd half
