Away Team,Home Team,Away Score,Home Score,Minute,Second,isScoringPosession,Desc.
Central Arkansas,Texas Tech,0,0,0,36,0,Robert Turner missed Jumper.
Central Arkansas,Texas Tech,0,0,0,36,0,Texas Tech Deadball Team Rebound.
Central Arkansas,Texas Tech,0,0,0,37,0,Texas Tech  Turnover.
Central Arkansas,Texas Tech,0,0,0,50,0,Foul on Jordan Tolbert.
Central Arkansas,Texas Tech,0,0,1,5,0,Foul on Daouda Berete.
Central Arkansas,Texas Tech,0,0,1,5,0,Daouda Berete Turnover.
Central Arkansas,Texas Tech,0,0,1,21,0,Jordan Tolbert missed Layup.
Central Arkansas,Texas Tech,0,0,1,21,0,Jalen Jackson Block.
Central Arkansas,Texas Tech,0,0,1,24,0,Phabian Glasco Defensive Rebound.
Central Arkansas,Texas Tech,3,0,1,27,1,DeShone McClure made Three Point Jumper. Assisted by Oliver Wells.
Central Arkansas,Texas Tech,3,0,1,56,0,Foul on Ethan Lee.
Central Arkansas,Texas Tech,3,0,1,57,0,Foul on Kader Tapsoba.
Central Arkansas,Texas Tech,3,0,1,57,0,Kader Tapsoba Turnover.
Central Arkansas,Texas Tech,3,0,2,8,0,DeShone McClure missed Three Point Jumper.
Central Arkansas,Texas Tech,3,0,2,8,0,Ethan Lee Offensive Rebound.
Central Arkansas,Texas Tech,3,0,2,14,0,Phabian Glasco missed Layup.
Central Arkansas,Texas Tech,3,0,2,14,0,Jaye Crockett Defensive Rebound.
Central Arkansas,Texas Tech,3,0,2,17,0,Foul on Phabian Glasco.
Central Arkansas,Texas Tech,3,0,2,35,0,Robert Turner missed Three Point Jumper.
Central Arkansas,Texas Tech,3,0,2,35,0,Jordan Tolbert Offensive Rebound.
Central Arkansas,Texas Tech,3,0,2,38,0,Jordan Tolbert missed Layup.
Central Arkansas,Texas Tech,3,0,2,38,0,Phabian Glasco Block.
Central Arkansas,Texas Tech,3,0,2,41,0,Ethan Lee Defensive Rebound.
Central Arkansas,Texas Tech,6,0,2,48,1,DeShone McClure made Three Point Jumper. Assisted by Jalen Jackson.
Central Arkansas,Texas Tech,6,0,2,55,0,Jaye Crockett missed Three Point Jumper.
Central Arkansas,Texas Tech,6,0,2,55,0,Dusty Hannahs Offensive Rebound.
Central Arkansas,Texas Tech,6,0,3,0,0,Foul on Ethan Lee.
Central Arkansas,Texas Tech,6,1,3,0,1,Dusty Hannahs made Free Throw.
Central Arkansas,Texas Tech,6,2,3,0,1,Dusty Hannahs made Free Throw.
Central Arkansas,Texas Tech,6,2,3,15,0,DeShone McClure missed Three Point Jumper.
Central Arkansas,Texas Tech,6,2,3,15,0,Jeff Drew Offensive Rebound.
Central Arkansas,Texas Tech,6,2,3,21,0,Foul on Jaye Crockett.
Central Arkansas,Texas Tech,6,2,3,40,0,DeShone McClure Turnover.
Central Arkansas,Texas Tech,6,2,3,41,0,Dusty Hannahs Steal.
Central Arkansas,Texas Tech,6,4,3,45,1,Jordan Tolbert made Dunk. Assisted by Dusty Hannahs.
Central Arkansas,Texas Tech,6,4,4,6,0,Phabian Glasco missed Layup.
Central Arkansas,Texas Tech,6,4,4,6,0,Robert Turner Defensive Rebound.
Central Arkansas,Texas Tech,6,4,4,16,0,Jordan Tolbert missed Three Point Jumper.
Central Arkansas,Texas Tech,6,4,4,16,0,Lenell Brown Defensive Rebound.
Central Arkansas,Texas Tech,6,4,4,42,0,Phabian Glasco missed Layup.
Central Arkansas,Texas Tech,6,4,4,42,0,Jordan Tolbert Defensive Rebound.
Central Arkansas,Texas Tech,6,4,4,48,0,Foul on Jeff Drew.
Central Arkansas,Texas Tech,6,4,4,48,0,Official TV Timeout
Central Arkansas,Texas Tech,6,4,4,48,0,Robert Turner missed Free Throw.
Central Arkansas,Texas Tech,6,4,4,48,0,Texas Tech Deadball Team Rebound.
Central Arkansas,Texas Tech,6,4,4,48,0,Robert Turner missed Free Throw.
Central Arkansas,Texas Tech,6,4,4,48,0,Dejan Kravic Offensive Rebound.
Central Arkansas,Texas Tech,6,6,5,5,1,Dejan Kravic made Layup.
Central Arkansas,Texas Tech,6,6,5,23,0,Lenell Brown Turnover.
Central Arkansas,Texas Tech,6,6,5,24,0,Randy Onwuasor Steal.
Central Arkansas,Texas Tech,6,6,5,27,0,Foul on Lenell Brown.
Central Arkansas,Texas Tech,6,6,5,27,0,Randy Onwuasor missed Free Throw.
Central Arkansas,Texas Tech,6,6,5,27,0,Texas Tech Deadball Team Rebound.
Central Arkansas,Texas Tech,6,6,5,27,0,Randy Onwuasor missed Free Throw.
Central Arkansas,Texas Tech,6,6,5,27,0,Texas Tech Deadball Team Rebound.
Central Arkansas,Texas Tech,6,6,5,27,0,Foul on Aaron Ross.
Central Arkansas,Texas Tech,6,6,5,31,0,Daouda Berete Turnover.
Central Arkansas,Texas Tech,6,6,5,32,0,Jamal Williams Steal.
Central Arkansas,Texas Tech,6,6,5,33,0,Randy Onwuasor Turnover.
Central Arkansas,Texas Tech,6,6,5,54,0,Chasen Williamson missed Jumper.
Central Arkansas,Texas Tech,6,6,5,54,0,Dejan Kravic Block.
Central Arkansas,Texas Tech,6,6,5,55,0,Chasen Williamson Offensive Rebound.
Central Arkansas,Texas Tech,9,6,6,4,1,Oliver Wells made Three Point Jumper.
Central Arkansas,Texas Tech,9,6,6,23,0,Dejan Kravic Turnover.
Central Arkansas,Texas Tech,9,6,6,25,0,Jalen Jackson Steal.
Central Arkansas,Texas Tech,11,6,6,37,1,Oliver Wells made Jumper.
Central Arkansas,Texas Tech,11,6,6,44,0,Randy Onwuasor Turnover.
Central Arkansas,Texas Tech,11,6,6,46,0,Daouda Berete Steal.
Central Arkansas,Texas Tech,11,6,7,11,0,Daouda Berete missed Three Point Jumper.
Central Arkansas,Texas Tech,11,6,7,11,0,Dejan Kravic Defensive Rebound.
Central Arkansas,Texas Tech,11,6,7,16,0,Foul on Jalen Jackson.
Central Arkansas,Texas Tech,11,7,7,16,1,Dejan Kravic made Free Throw.
Central Arkansas,Texas Tech,11,7,7,16,0,Dejan Kravic missed Free Throw.
Central Arkansas,Texas Tech,11,7,7,16,0,Jalen Jackson Defensive Rebound.
Central Arkansas,Texas Tech,11,7,7,25,0,Jalen Jackson Turnover.
Central Arkansas,Texas Tech,11,7,7,45,0,Dusty Hannahs missed Jumper.
Central Arkansas,Texas Tech,11,7,7,45,0,Jaye Crockett Offensive Rebound.
Central Arkansas,Texas Tech,11,7,7,48,0,Jaye Crockett missed Jumper.
Central Arkansas,Texas Tech,11,7,7,48,0,Central Arkansas Defensive Rebound.
Central Arkansas,Texas Tech,11,7,8,9,0,Jeff Drew missed Jumper.
Central Arkansas,Texas Tech,11,7,8,9,0,Dusty Hannahs Defensive Rebound.
Central Arkansas,Texas Tech,11,7,8,28,0,Jordan Tolbert Turnover.
Central Arkansas,Texas Tech,11,7,8,29,0,Jeff Drew Steal.
Central Arkansas,Texas Tech,11,7,8,30,0,Jeff Drew Turnover.
Central Arkansas,Texas Tech,11,7,8,31,0,Jordan Tolbert Steal.
Central Arkansas,Texas Tech,11,10,8,33,1,Dusty Hannahs made Three Point Jumper. Assisted by Jordan Tolbert.
Central Arkansas,Texas Tech,11,10,8,45,0,Foul on Dusty Hannahs.
Central Arkansas,Texas Tech,11,10,8,45,0,Official TV Timeout
Central Arkansas,Texas Tech,11,10,9,0,0,Oliver Wells missed Three Point Jumper.
Central Arkansas,Texas Tech,11,10,9,0,0,Jaye Crockett Defensive Rebound.
Central Arkansas,Texas Tech,11,10,9,10,0,Dusty Hannahs missed Three Point Jumper.
Central Arkansas,Texas Tech,11,10,9,10,0,Jaye Crockett Offensive Rebound.
Central Arkansas,Texas Tech,11,10,9,16,0,Foul on Jeff Drew.
Central Arkansas,Texas Tech,11,11,9,16,1,Jaye Crockett made Free Throw.
Central Arkansas,Texas Tech,11,12,9,16,1,Jaye Crockett made Free Throw.
Central Arkansas,Texas Tech,13,12,9,34,1,DeShone McClure made Jumper.
Central Arkansas,Texas Tech,13,12,10,4,0,Robert Turner Turnover.
Central Arkansas,Texas Tech,16,12,10,17,1,Aubrey Ball made Three Point Jumper. Assisted by Phabian Glasco.
Central Arkansas,Texas Tech,16,14,10,33,1,Jaye Crockett made Layup.
Central Arkansas,Texas Tech,16,14,10,57,0,Aubrey Ball Turnover.
Central Arkansas,Texas Tech,16,14,10,59,0,Luke Adams Steal.
Central Arkansas,Texas Tech,16,16,11,2,1,Toddrick Gotcher made Layup. Assisted by Luke Adams.
Central Arkansas,Texas Tech,16,16,11,16,0,Oliver Wells missed Jumper.
Central Arkansas,Texas Tech,16,16,11,16,0,Texas Tech Defensive Rebound.
Central Arkansas,Texas Tech,16,19,11,24,1,Toddrick Gotcher made Three Point Jumper. Assisted by Jordan Tolbert.
Central Arkansas,Texas Tech,16,19,11,34,0,Central Arkansas  Timeout
Central Arkansas,Texas Tech,16,19,11,40,0,Lenell Brown Turnover.
Central Arkansas,Texas Tech,16,19,11,41,0,Luke Adams Steal.
Central Arkansas,Texas Tech,16,21,11,45,1,Jaye Crockett made Dunk.
Central Arkansas,Texas Tech,19,21,12,0,1,Aubrey Ball made Three Point Jumper. Assisted by DeShone McClure.
Central Arkansas,Texas Tech,19,21,12,32,0,Jaye Crockett missed Three Point Jumper.
Central Arkansas,Texas Tech,19,21,12,32,0,Kader Tapsoba Offensive Rebound.
Central Arkansas,Texas Tech,19,21,12,35,0,Official TV Timeout
Central Arkansas,Texas Tech,19,21,12,38,0,Kader Tapsoba Turnover.
Central Arkansas,Texas Tech,19,21,12,39,0,DeShone McClure Steal.
Central Arkansas,Texas Tech,19,21,12,40,0,Foul on Luke Adams.
Central Arkansas,Texas Tech,19,21,13,9,0,Ethan Lee missed Three Point Jumper.
Central Arkansas,Texas Tech,19,21,13,9,0,Toddrick Gotcher Defensive Rebound.
Central Arkansas,Texas Tech,19,21,13,17,0,Kader Tapsoba missed Layup.
Central Arkansas,Texas Tech,19,21,13,17,0,Phabian Glasco Block.
Central Arkansas,Texas Tech,19,21,13,19,0,Phabian Glasco Defensive Rebound.
Central Arkansas,Texas Tech,22,21,13,22,1,Aubrey Ball made Three Point Jumper. Assisted by DeShone McClure.
Central Arkansas,Texas Tech,22,23,13,52,1,Kader Tapsoba made Jumper. Assisted by Jaye Crockett.
Central Arkansas,Texas Tech,22,23,14,10,0,Foul on Ethan Lee.
Central Arkansas,Texas Tech,22,23,14,10,0,Ethan Lee Turnover.
Central Arkansas,Texas Tech,22,23,14,21,0,Luke Adams missed Three Point Jumper.
Central Arkansas,Texas Tech,22,23,14,21,0,Aubrey Ball Defensive Rebound.
Central Arkansas,Texas Tech,22,23,14,28,0,DeShone McClure missed Three Point Jumper.
Central Arkansas,Texas Tech,22,23,14,28,0,Toddrick Gotcher Defensive Rebound.
Central Arkansas,Texas Tech,22,25,14,38,1,Jaye Crockett made Jumper.
Central Arkansas,Texas Tech,22,25,15,10,0,Phabian Glasco missed Jumper.
Central Arkansas,Texas Tech,22,25,15,10,0,Phabian Glasco Offensive Rebound.
Central Arkansas,Texas Tech,22,25,15,12,0,Phabian Glasco missed Jumper.
Central Arkansas,Texas Tech,22,25,15,12,0,Aaron Ross Defensive Rebound.
Central Arkansas,Texas Tech,22,25,15,35,0,Aaron Ross missed Three Point Jumper.
Central Arkansas,Texas Tech,22,25,15,35,0,Robert Turner Offensive Rebound.
Central Arkansas,Texas Tech,22,27,15,38,1,Robert Turner made Jumper.
Central Arkansas,Texas Tech,24,27,16,10,1,Jalen Jackson made Jumper.
Central Arkansas,Texas Tech,24,27,16,21,0,Foul on DeShone McClure.
Central Arkansas,Texas Tech,24,27,16,21,0,Official TV Timeout
Central Arkansas,Texas Tech,24,28,16,21,1,Aaron Ross made Free Throw.
Central Arkansas,Texas Tech,24,29,16,21,1,Aaron Ross made Free Throw.
Central Arkansas,Texas Tech,24,29,16,51,0,Oliver Wells missed Jumper.
Central Arkansas,Texas Tech,24,29,16,51,0,Alex Foster Defensive Rebound.
Central Arkansas,Texas Tech,24,31,17,12,1,Aaron Ross made Jumper. Assisted by Toddrick Gotcher.
Central Arkansas,Texas Tech,24,31,17,31,0,Jalen Jackson Turnover.
Central Arkansas,Texas Tech,24,34,17,48,1,Robert Turner made Three Point Jumper. Assisted by Toddrick Gotcher.
Central Arkansas,Texas Tech,24,34,18,9,0,Central Arkansas  Timeout
Central Arkansas,Texas Tech,24,34,18,18,0,Aubrey Ball missed Layup.
Central Arkansas,Texas Tech,24,34,18,18,0,Alex Foster Block.
Central Arkansas,Texas Tech,24,34,18,20,0,Alex Foster Defensive Rebound.
Central Arkansas,Texas Tech,24,36,18,40,1,Robert Turner made Jumper.
Central Arkansas,Texas Tech,26,36,19,0,1,Jalen Jackson made Jumper.
Central Arkansas,Texas Tech,26,39,19,14,1,Toddrick Gotcher made Three Point Jumper. Assisted by Robert Turner.
Central Arkansas,Texas Tech,26,39,19,31,0,Phabian Glasco missed Jumper.
Central Arkansas,Texas Tech,26,39,19,31,0,Phabian Glasco Offensive Rebound.
Central Arkansas,Texas Tech,26,39,19,54,0,Central Arkansas  Turnover.
Central Arkansas,Texas Tech,26,39,19,54,0,Texas Tech  Timeout
Central Arkansas,Texas Tech,26,39,20,0,0,End of 1st half
Central Arkansas,Texas Tech,26,39,20,18,0,Jordan Tolbert missed Jumper.
Central Arkansas,Texas Tech,26,39,20,18,0,Jeff Drew Defensive Rebound.
Central Arkansas,Texas Tech,28,39,20,33,1,Phabian Glasco made Layup. Assisted by DeShone McClure.
Central Arkansas,Texas Tech,28,39,20,50,0,Jaye Crockett missed Layup.
Central Arkansas,Texas Tech,28,39,20,50,0,Daouda Berete Block.
Central Arkansas,Texas Tech,28,39,20,53,0,Daouda Berete Defensive Rebound.
Central Arkansas,Texas Tech,31,39,21,3,1,Oliver Wells made Three Point Jumper. Assisted by Phabian Glasco.
Central Arkansas,Texas Tech,31,39,21,28,0,Jordan Tolbert Turnover.
Central Arkansas,Texas Tech,31,39,21,29,0,Daouda Berete Steal.
Central Arkansas,Texas Tech,31,39,22,2,0,Oliver Wells Turnover.
Central Arkansas,Texas Tech,31,39,22,23,0,Foul on Dusty Hannahs.
Central Arkansas,Texas Tech,31,39,22,23,0,Dusty Hannahs Turnover.
Central Arkansas,Texas Tech,32,39,22,23,1,Daouda Berete made Free Throw.
Central Arkansas,Texas Tech,33,39,22,23,1,Daouda Berete made Free Throw.
Central Arkansas,Texas Tech,33,39,22,41,0,Foul on Jamal Williams.
Central Arkansas,Texas Tech,34,39,22,41,1,DeShone McClure made Free Throw.
Central Arkansas,Texas Tech,34,39,22,41,0,DeShone McClure missed Free Throw.
Central Arkansas,Texas Tech,34,39,22,41,0,Aaron Ross Defensive Rebound.
Central Arkansas,Texas Tech,34,39,22,53,0,Jamal Williams missed Three Point Jumper.
Central Arkansas,Texas Tech,34,39,22,53,0,Randy Onwuasor Offensive Rebound.
Central Arkansas,Texas Tech,34,39,22,58,0,Randy Onwuasor missed Jumper.
Central Arkansas,Texas Tech,34,39,22,58,0,Phabian Glasco Block.
Central Arkansas,Texas Tech,34,39,23,0,0,Randy Onwuasor Offensive Rebound.
Central Arkansas,Texas Tech,34,39,23,1,0,Foul on Daouda Berete.
Central Arkansas,Texas Tech,34,40,23,1,1,Dejan Kravic made Free Throw.
Central Arkansas,Texas Tech,34,41,23,1,1,Dejan Kravic made Free Throw.
Central Arkansas,Texas Tech,34,41,23,13,0,DeShone McClure Turnover.
Central Arkansas,Texas Tech,34,41,23,15,0,Toddrick Gotcher Steal.
Central Arkansas,Texas Tech,34,43,23,18,1,Dejan Kravic made Layup. Assisted by Randy Onwuasor.
Central Arkansas,Texas Tech,34,43,23,34,0,Phabian Glasco missed Layup.
Central Arkansas,Texas Tech,34,43,23,34,0,Dejan Kravic Block.
Central Arkansas,Texas Tech,34,43,23,35,0,Texas Tech Defensive Rebound.
Central Arkansas,Texas Tech,34,43,23,49,0,Foul on DeShone McClure.
Central Arkansas,Texas Tech,34,45,23,50,1,Dejan Kravic made Layup. Assisted by Jamal Williams.
Central Arkansas,Texas Tech,34,45,24,8,0,Daouda Berete Turnover.
Central Arkansas,Texas Tech,34,45,24,8,0,Official TV Timeout
Central Arkansas,Texas Tech,34,45,24,31,0,Toddrick Gotcher missed Three Point Jumper.
Central Arkansas,Texas Tech,34,45,24,31,0,Dejan Kravic Offensive Rebound.
Central Arkansas,Texas Tech,34,45,24,34,0,Dejan Kravic missed Two Point Tip Shot.
Central Arkansas,Texas Tech,34,45,24,34,0,Dejan Kravic Offensive Rebound.
Central Arkansas,Texas Tech,34,45,24,35,0,Foul on Jeff Drew.
Central Arkansas,Texas Tech,34,46,24,35,1,Dejan Kravic made Free Throw.
Central Arkansas,Texas Tech,34,47,24,35,1,Dejan Kravic made Free Throw.
Central Arkansas,Texas Tech,34,47,24,54,0,Foul on Aaron Ross.
Central Arkansas,Texas Tech,35,47,24,54,1,Jalen Jackson made Free Throw.
Central Arkansas,Texas Tech,35,47,24,54,0,Jalen Jackson missed Free Throw.
Central Arkansas,Texas Tech,35,47,24,54,0,Aaron Ross Defensive Rebound.
Central Arkansas,Texas Tech,35,47,25,2,0,Dejan Kravic missed Layup.
Central Arkansas,Texas Tech,35,47,25,2,0,Phabian Glasco Block.
Central Arkansas,Texas Tech,35,47,25,4,0,Jalen Jackson Defensive Rebound.
Central Arkansas,Texas Tech,35,47,25,18,0,Jalen Jackson Turnover.
Central Arkansas,Texas Tech,35,49,25,34,1,Randy Onwuasor made Jumper. Assisted by Aaron Ross.
Central Arkansas,Texas Tech,35,49,25,55,0,Aubrey Ball missed Three Point Jumper.
Central Arkansas,Texas Tech,35,49,25,55,0,Central Arkansas Deadball Team Rebound.
Central Arkansas,Texas Tech,35,49,25,56,0,Foul on Phabian Glasco.
Central Arkansas,Texas Tech,35,49,26,19,0,Randy Onwuasor missed Three Point Jumper.
Central Arkansas,Texas Tech,35,49,26,19,0,DeShone McClure Defensive Rebound.
Central Arkansas,Texas Tech,35,49,26,26,0,DeShone McClure Turnover.
Central Arkansas,Texas Tech,35,49,26,28,0,Dejan Kravic Steal.
Central Arkansas,Texas Tech,35,49,26,30,0,Jamal Williams Turnover.
Central Arkansas,Texas Tech,35,49,26,55,0,Oliver Wells missed Three Point Jumper.
Central Arkansas,Texas Tech,35,49,26,55,0,Dejan Kravic Defensive Rebound.
Central Arkansas,Texas Tech,35,49,27,5,0,Dejan Kravic missed Jumper.
Central Arkansas,Texas Tech,35,49,27,5,0,Aaron Ross Offensive Rebound.
Central Arkansas,Texas Tech,35,49,27,8,0,Foul on Aubrey Ball.
Central Arkansas,Texas Tech,35,49,27,22,0,Foul on Phabian Glasco.
Central Arkansas,Texas Tech,35,49,27,22,0,Toddrick Gotcher missed Free Throw.
Central Arkansas,Texas Tech,35,49,27,22,0,Texas Tech Deadball Team Rebound.
Central Arkansas,Texas Tech,35,49,27,22,0,Toddrick Gotcher missed Free Throw.
Central Arkansas,Texas Tech,35,49,27,22,0,Texas Tech Deadball Team Rebound.
Central Arkansas,Texas Tech,35,49,27,23,0,Dejan Kravic Turnover.
Central Arkansas,Texas Tech,37,49,27,34,1,Jalen Jackson made Jumper.
Central Arkansas,Texas Tech,37,51,27,56,1,Jamal Williams made Layup.
Central Arkansas,Texas Tech,37,51,28,11,0,Oliver Wells missed Jumper.
Central Arkansas,Texas Tech,37,51,28,11,0,Aaron Ross Defensive Rebound.
Central Arkansas,Texas Tech,37,53,28,17,1,Dejan Kravic made Layup. Assisted by Toddrick Gotcher.
Central Arkansas,Texas Tech,37,53,28,25,0,Central Arkansas  Timeout
Central Arkansas,Texas Tech,39,53,28,40,1,DeShone McClure made Layup.
Central Arkansas,Texas Tech,39,53,28,47,0,Foul on Phabian Glasco.
Central Arkansas,Texas Tech,39,53,28,47,0,Official TV Timeout
Central Arkansas,Texas Tech,39,54,28,47,1,Kader Tapsoba made Free Throw.
Central Arkansas,Texas Tech,39,55,28,47,1,Kader Tapsoba made Free Throw.
Central Arkansas,Texas Tech,39,55,29,0,0,Foul on DeShone McClure.
Central Arkansas,Texas Tech,39,55,29,0,0,DeShone McClure Turnover.
Central Arkansas,Texas Tech,39,57,29,8,1,Jordan Tolbert made Dunk. Assisted by Jaye Crockett.
Central Arkansas,Texas Tech,39,57,29,28,0,Ethan Lee missed Layup.
Central Arkansas,Texas Tech,39,57,29,28,0,Kader Tapsoba Block.
Central Arkansas,Texas Tech,39,57,29,30,0,Central Arkansas Deadball Team Rebound.
Central Arkansas,Texas Tech,39,57,29,30,0,Foul on Jordan Tolbert.
Central Arkansas,Texas Tech,39,57,29,43,0,Jalen Jackson missed Jumper.
Central Arkansas,Texas Tech,39,57,29,43,0,Ethan Lee Offensive Rebound.
Central Arkansas,Texas Tech,39,57,29,48,0,Ethan Lee missed Layup.
Central Arkansas,Texas Tech,39,57,29,48,0,Jalen Jackson Offensive Rebound.
Central Arkansas,Texas Tech,39,57,29,52,0,Jalen Jackson missed Layup.
Central Arkansas,Texas Tech,39,57,29,52,0,Jordan Tolbert Defensive Rebound.
Central Arkansas,Texas Tech,39,57,29,57,0,Robert Turner missed Layup.
Central Arkansas,Texas Tech,39,57,29,57,0,Kader Tapsoba Offensive Rebound.
Central Arkansas,Texas Tech,39,57,30,7,0,Robert Turner missed Layup.
Central Arkansas,Texas Tech,39,57,30,7,0,Aubrey Ball Defensive Rebound.
Central Arkansas,Texas Tech,39,57,30,34,0,Aubrey Ball Turnover.
Central Arkansas,Texas Tech,39,59,30,53,1,Jordan Tolbert made Layup. Assisted by Kader Tapsoba.
Central Arkansas,Texas Tech,39,59,31,4,0,Lenell Brown Turnover.
Central Arkansas,Texas Tech,39,59,31,25,0,Jaye Crockett missed Jumper.
Central Arkansas,Texas Tech,39,59,31,25,0,Jordan Tolbert Offensive Rebound.
Central Arkansas,Texas Tech,39,59,31,29,0,Foul on Jeff Drew.
Central Arkansas,Texas Tech,39,60,31,29,1,Jordan Tolbert made Free Throw.
Central Arkansas,Texas Tech,39,61,31,29,1,Jordan Tolbert made Free Throw.
Central Arkansas,Texas Tech,41,61,31,44,1,Ethan Lee made Layup.
Central Arkansas,Texas Tech,41,61,31,44,0,Foul on Kader Tapsoba.
Central Arkansas,Texas Tech,41,61,31,44,0,Ethan Lee missed Free Throw.
Central Arkansas,Texas Tech,41,61,31,44,0,Central Arkansas Offensive Rebound.
Central Arkansas,Texas Tech,43,61,31,47,1,Ethan Lee made Layup. Assisted by Aubrey Ball.
Central Arkansas,Texas Tech,43,61,31,59,0,Jaye Crockett missed Layup.
Central Arkansas,Texas Tech,43,61,31,59,0,Jordan Tolbert Offensive Rebound.
Central Arkansas,Texas Tech,43,63,32,3,1,Kader Tapsoba made Dunk.
Central Arkansas,Texas Tech,43,63,32,21,0,Lenell Brown Turnover.
Central Arkansas,Texas Tech,43,63,32,26,0,Jordan Tolbert Steal.
Central Arkansas,Texas Tech,43,65,32,31,1,Randy Onwuasor made Layup.
Central Arkansas,Texas Tech,43,65,32,53,0,Aubrey Ball Turnover.
Central Arkansas,Texas Tech,43,65,32,56,0,Jaye Crockett Steal.
Central Arkansas,Texas Tech,43,65,33,1,0,Foul on Ethan Lee.
Central Arkansas,Texas Tech,43,65,33,1,0,Official TV Timeout
Central Arkansas,Texas Tech,43,66,33,1,1,Jordan Tolbert made Free Throw.
Central Arkansas,Texas Tech,43,67,33,1,1,Jordan Tolbert made Free Throw.
Central Arkansas,Texas Tech,43,67,33,36,0,Central Arkansas  Turnover.
Central Arkansas,Texas Tech,43,69,33,59,1,Kader Tapsoba made Dunk. Assisted by Toddrick Gotcher.
Central Arkansas,Texas Tech,43,69,34,28,0,Jalen Jackson Turnover.
Central Arkansas,Texas Tech,43,69,34,33,0,Randy Onwuasor Turnover.
Central Arkansas,Texas Tech,43,69,34,35,0,Jalen Jackson Steal.
Central Arkansas,Texas Tech,45,69,34,36,1,Jalen Jackson made Dunk.
Central Arkansas,Texas Tech,45,71,34,52,1,Jaye Crockett made Dunk. Assisted by Randy Onwuasor.
Central Arkansas,Texas Tech,45,71,35,24,0,Jeff Drew missed Layup.
Central Arkansas,Texas Tech,45,71,35,24,0,Ethan Lee Offensive Rebound.
Central Arkansas,Texas Tech,47,71,35,26,1,Ethan Lee made Dunk.
Central Arkansas,Texas Tech,47,71,35,53,0,Jordan Tolbert missed Three Point Jumper.
Central Arkansas,Texas Tech,47,71,35,53,0,Jalen Jackson Defensive Rebound.
Central Arkansas,Texas Tech,47,71,36,1,0,Foul on Randy Onwuasor.
Central Arkansas,Texas Tech,47,71,36,1,0,Official TV Timeout
Central Arkansas,Texas Tech,48,71,36,1,1,Ethan Lee made Free Throw.
Central Arkansas,Texas Tech,49,71,36,1,1,Ethan Lee made Free Throw.
Central Arkansas,Texas Tech,49,71,36,8,0,Foul on DeShone McClure.
Central Arkansas,Texas Tech,49,72,36,8,1,Jamal Williams made Free Throw.
Central Arkansas,Texas Tech,49,73,36,8,1,Jamal Williams made Free Throw.
Central Arkansas,Texas Tech,49,73,36,18,0,Oliver Wells Turnover.
Central Arkansas,Texas Tech,49,73,36,26,0,Kader Tapsoba Turnover.
Central Arkansas,Texas Tech,52,73,36,37,1,Oliver Wells made Three Point Jumper. Assisted by DeShone McClure.
Central Arkansas,Texas Tech,52,73,36,43,0,Foul on Ethan Lee.
Central Arkansas,Texas Tech,52,74,36,43,1,Robert Turner made Free Throw.
Central Arkansas,Texas Tech,52,75,36,43,1,Robert Turner made Free Throw.
Central Arkansas,Texas Tech,52,75,36,59,0,DeShone McClure missed Jumper.
Central Arkansas,Texas Tech,52,75,36,59,0,Jamal Williams Defensive Rebound.
Central Arkansas,Texas Tech,52,77,37,6,1,Toddrick Gotcher made Layup.
Central Arkansas,Texas Tech,52,77,37,31,0,DeShone McClure missed Three Point Jumper.
Central Arkansas,Texas Tech,52,77,37,31,0,Jalen Jackson Offensive Rebound.
Central Arkansas,Texas Tech,54,77,37,35,1,Jalen Jackson made Layup.
Central Arkansas,Texas Tech,54,77,38,7,0,Jamal Williams missed Layup.
Central Arkansas,Texas Tech,54,77,38,7,0,Phabian Glasco Defensive Rebound.
Central Arkansas,Texas Tech,54,77,38,12,0,DeShone McClure Turnover.
Central Arkansas,Texas Tech,54,77,38,13,0,Toddrick Gotcher Steal.
Central Arkansas,Texas Tech,54,79,38,17,1,Jamal Williams made Dunk. Assisted by Toddrick Gotcher.
Central Arkansas,Texas Tech,54,79,38,23,0,Central Arkansas  Timeout
Central Arkansas,Texas Tech,54,79,38,47,0,Aubrey Ball missed Three Point Jumper.
Central Arkansas,Texas Tech,54,79,38,47,0,Alex Foster Defensive Rebound.
Central Arkansas,Texas Tech,54,79,38,55,0,Stan Mays missed Three Point Jumper.
Central Arkansas,Texas Tech,54,79,38,55,0,Jeff Drew Defensive Rebound.
Central Arkansas,Texas Tech,57,79,39,11,1,Oliver Wells made Three Point Jumper.
Central Arkansas,Texas Tech,57,79,39,35,0,Jamal Williams missed Jumper.
Central Arkansas,Texas Tech,57,79,39,35,0,Stan Mays Offensive Rebound.
Central Arkansas,Texas Tech,57,79,40,0,0,End of Game
