Away Team,Home Team,Away Score,Home Score,Minute,Second,isScoringPosession,Desc.
Randall University,Abilene Christian,50,85,33,51,0,Julian Edmonson missed Three Point Jumper.
Randall University,Abilene Christian,50,85,33,51,0,Garrett White Defensive Rebound.
Randall University,Abilene Christian,50,85,34,4,0,Derrick Allen missed Layup.
Randall University,Abilene Christian,50,85,34,4,0,Jacob Lancaster Defensive Rebound.
Randall University,Abilene Christian,50,87,34,15,1,Harrison Hawkins made Jumper.
Randall University,Abilene Christian,50,87,34,28,0,Garrett White Turnover.
Randall University,Abilene Christian,50,87,34,29,0,Julian Edmonson Steal.
Randall University,Abilene Christian,50,87,34,32,0,Julian Edmonson missed Layup.
Randall University,Abilene Christian,50,87,34,32,0,Jacob Lancaster Offensive Rebound.
Randall University,Abilene Christian,50,89,34,35,1,Jacob Lancaster made Layup.
Randall University,Abilene Christian,50,89,34,47,0,Derrick Allen missed Layup.
Randall University,Abilene Christian,50,89,34,47,0,Jacob Lancaster Defensive Rebound.
Randall University,Abilene Christian,50,89,34,57,0,Harrison Hawkins Turnover.
Randall University,Abilene Christian,50,89,35,2,0,Tyler Lindsey missed Three Point Jumper.
Randall University,Abilene Christian,50,89,35,2,0,Parker Wentz Defensive Rebound.
Randall University,Abilene Christian,50,91,35,7,1,Parker Wentz made Dunk. Assisted by Parker Wentz.
Randall University,Abilene Christian,52,91,35,34,1,Garrett White made Jumper.
Randall University,Abilene Christian,52,91,36,9,0,Foul on Derrick Allen.
Randall University,Abilene Christian,52,91,36,11,0,Official TV Timeout
Randall University,Abilene Christian,52,92,36,11,1,LaDarrien Williams made Free Throw.
Randall University,Abilene Christian,52,93,36,11,1,LaDarrien Williams made Free Throw.
Randall University,Abilene Christian,52,93,36,33,0,Garrett White missed Jumper.
Randall University,Abilene Christian,52,93,36,33,0,Rafael Farley Defensive Rebound.
Randall University,Abilene Christian,52,93,36,41,0,LaDarrien Williams missed Layup.
Randall University,Abilene Christian,52,93,36,41,0,Ryan Hickerson Defensive Rebound.
Randall University,Abilene Christian,52,93,36,58,0,Ryan Hickerson missed Three Point Jumper.
Randall University,Abilene Christian,52,93,36,58,0,Derrick Allen Offensive Rebound.
Randall University,Abilene Christian,52,93,37,12,0,Foul on Derrick Allen.
Randall University,Abilene Christian,52,93,37,12,0,Derrick Allen Turnover.
Randall University,Abilene Christian,52,93,37,24,0,Alexsander Milosavljevic missed Layup.
Randall University,Abilene Christian,52,93,37,24,0,Derrick Allen Defensive Rebound.
Randall University,Abilene Christian,52,93,37,32,0,Derrick Allen Turnover.
Randall University,Abilene Christian,52,93,37,33,0,Parker Wentz Steal.
Randall University,Abilene Christian,52,93,37,41,0,Michael Grant missed Jumper.
Randall University,Abilene Christian,52,93,37,41,0,Omarkio Collins Block.
Randall University,Abilene Christian,52,93,37,46,0,Omarkio Collins Defensive Rebound.
Randall University,Abilene Christian,52,93,37,58,0,Garrett White Turnover.
Randall University,Abilene Christian,52,93,38,20,0,Ryan Hickerson missed Three Point Jumper.
Randall University,Abilene Christian,52,93,38,20,0,Chris Blakeley Defensive Rebound.
Randall University,Abilene Christian,52,93,38,23,0,Foul on Chris Hobgood.
Randall University,Abilene Christian,52,93,38,23,0,Michael Grant missed Free Throw.
Randall University,Abilene Christian,52,93,38,23,0,Abilene Christian Deadball Team Rebound.
Randall University,Abilene Christian,52,93,38,23,0,Michael Grant missed Free Throw.
Randall University,Abilene Christian,52,93,38,23,0,Abilene Christian Offensive Rebound.
Randall University,Abilene Christian,52,93,38,23,0,Alexsander Milosavljevic Turnover.
Randall University,Abilene Christian,52,93,38,34,0,Ryan Hickerson missed Three Point Jumper.
Randall University,Abilene Christian,52,93,38,34,0,Chris Blakeley Defensive Rebound.
Randall University,Abilene Christian,52,93,38,41,0,Chris Blakeley Turnover.
Randall University,Abilene Christian,52,93,38,50,0,Garrett White missed Jumper.
Randall University,Abilene Christian,52,93,38,50,0,Riley Payne Block.
Randall University,Abilene Christian,52,93,38,52,0,Chris Blakeley Defensive Rebound.
Randall University,Abilene Christian,52,93,38,59,0,Michael Grant missed Jumper.
Randall University,Abilene Christian,52,93,38,59,0,Alexsander Milosavljevic Offensive Rebound.
Randall University,Abilene Christian,52,93,39,17,0,Chris Blakeley Turnover.
Randall University,Abilene Christian,52,93,39,30,0,Foul on Michael Grant.
Randall University,Abilene Christian,52,93,39,30,0,Ryan Hickerson missed Free Throw.
Randall University,Abilene Christian,52,93,39,30,0,Hillsdale Baptist Deadball Team Rebound.
Randall University,Abilene Christian,53,93,39,30,1,Ryan Hickerson made Free Throw.
Randall University,Abilene Christian,53,93,40,0,0,End of Game
