Away Team,Home Team,Away Score,Home Score,Minute,Second,isScoringPosession,Desc.
Randall University,Abilene Christian,0,2,0,21,1,Jacob Lancaster made Dunk. Assisted by LaDarrien Williams.
Randall University,Abilene Christian,0,2,0,35,0,Marquis Burden missed Layup.
Randall University,Abilene Christian,0,2,0,35,0,Jacob Lancaster Block.
Randall University,Abilene Christian,0,2,0,37,0,Chris Williams Offensive Rebound.
Randall University,Abilene Christian,2,2,0,40,1,Chris Williams made Jumper.
Randall University,Abilene Christian,2,2,1,9,0,LaDarrien Williams missed Jumper.
Randall University,Abilene Christian,2,2,1,9,0,Jacob Lancaster Offensive Rebound.
Randall University,Abilene Christian,2,4,1,15,1,Jacob Lancaster made Layup.
Randall University,Abilene Christian,2,4,1,22,0,Phil Carey missed Three Point Jumper.
Randall University,Abilene Christian,2,4,1,22,0,Jacob Lancaster Defensive Rebound.
Randall University,Abilene Christian,2,6,1,29,1,Harrison Hawkins made Layup.
Randall University,Abilene Christian,2,6,1,50,0,Randall Henderson missed Jumper.
Randall University,Abilene Christian,2,6,1,50,0,Jacob Lancaster Block.
Randall University,Abilene Christian,2,6,1,52,0,Randall Henderson Offensive Rebound.
Randall University,Abilene Christian,2,6,1,54,0,Randall Henderson missed Jumper.
Randall University,Abilene Christian,2,6,1,54,0,Austin Cooke Defensive Rebound.
Randall University,Abilene Christian,2,6,2,10,0,Jacob Lancaster missed Jumper.
Randall University,Abilene Christian,2,6,2,10,0,Phil Carey Defensive Rebound.
Randall University,Abilene Christian,2,6,2,20,0,Phil Carey missed Jumper.
Randall University,Abilene Christian,2,6,2,20,0,Jacob Lancaster Block.
Randall University,Abilene Christian,2,6,2,20,0,Hillsdale Baptist Offensive Rebound.
Randall University,Abilene Christian,4,6,2,25,1,Chris Williams made Jumper.
Randall University,Abilene Christian,4,6,2,42,0,LaDarrien Williams missed Jumper.
Randall University,Abilene Christian,4,6,2,42,0,Hillsdale Baptist Defensive Rebound.
Randall University,Abilene Christian,4,6,2,42,0,Foul on Riley Payne.
Randall University,Abilene Christian,4,6,3,10,0,Brandon Powell Turnover.
Randall University,Abilene Christian,4,6,3,11,0,Austin Cooke Steal.
Randall University,Abilene Christian,4,8,3,13,1,Parker Wentz made Layup. Assisted by Austin Cooke.
Randall University,Abilene Christian,4,8,3,23,0,Phil Carey missed Jumper.
Randall University,Abilene Christian,4,8,3,23,0,LaDarrien Williams Defensive Rebound.
Randall University,Abilene Christian,4,8,3,30,0,Harrison Hawkins missed Three Point Jumper.
Randall University,Abilene Christian,4,8,3,30,0,Brandon Powell Defensive Rebound.
Randall University,Abilene Christian,4,8,3,47,0,Marquis Burden missed Three Point Jumper.
Randall University,Abilene Christian,4,8,3,47,0,LaDarrien Williams Defensive Rebound.
Randall University,Abilene Christian,4,8,3,57,0,Parker Wentz missed Three Point Jumper.
Randall University,Abilene Christian,4,8,3,57,0,Austin Cooke Offensive Rebound.
Randall University,Abilene Christian,4,8,4,1,0,Parker Wentz Turnover.
Randall University,Abilene Christian,4,8,4,21,0,Marquis Burden Turnover.
Randall University,Abilene Christian,4,10,4,33,1,Michael Grant made Layup. Assisted by Parker Wentz.
Randall University,Abilene Christian,4,10,5,3,0,Marquis Burden missed Three Point Jumper.
Randall University,Abilene Christian,4,10,5,3,0,Jacob Lancaster Defensive Rebound.
Randall University,Abilene Christian,4,13,5,21,1,LaDarrien Williams made Three Point Jumper. Assisted by Michael Grant.
Randall University,Abilene Christian,4,13,5,46,0,Phil Carey missed Three Point Jumper.
Randall University,Abilene Christian,4,13,5,46,0,Jacob Lancaster Defensive Rebound.
Randall University,Abilene Christian,4,15,6,2,1,Jacob Lancaster made Dunk. Assisted by Austin Cooke.
Randall University,Abilene Christian,4,15,6,22,0,Phil Carey missed Layup.
Randall University,Abilene Christian,4,15,6,22,0,Phil Carey Offensive Rebound.
Randall University,Abilene Christian,6,15,6,26,1,Phil Carey made Jumper.
Randall University,Abilene Christian,6,15,6,42,0,Foul on Chris Williams.
Randall University,Abilene Christian,6,16,6,42,1,Jacob Lancaster made Free Throw.
Randall University,Abilene Christian,6,16,6,42,0,Jacob Lancaster missed Free Throw.
Randall University,Abilene Christian,6,16,6,42,0,Austin Cooke Offensive Rebound.
Randall University,Abilene Christian,6,16,6,57,0,Jacob Lancaster missed Jumper.
Randall University,Abilene Christian,6,16,6,57,0,Chris Hobgood Defensive Rebound.
Randall University,Abilene Christian,6,16,7,8,0,Brandon Powell missed Three Point Jumper.
Randall University,Abilene Christian,6,16,7,8,0,Jacob Lancaster Defensive Rebound.
Randall University,Abilene Christian,6,16,7,24,0,Julian Edmonson missed Three Point Jumper.
Randall University,Abilene Christian,6,16,7,24,0,Jacob Lancaster Offensive Rebound.
Randall University,Abilene Christian,6,16,7,38,0,Foul on Chris Hobgood.
Randall University,Abilene Christian,6,16,7,48,0,Foul on Jacob Lancaster.
Randall University,Abilene Christian,6,16,7,48,0,Jacob Lancaster Turnover.
Randall University,Abilene Christian,6,16,8,11,0,Chris Hobgood missed Three Point Jumper.
Randall University,Abilene Christian,6,16,8,11,0,Harrison Hawkins Defensive Rebound.
Randall University,Abilene Christian,6,18,8,17,1,Harrison Hawkins made Layup.
Randall University,Abilene Christian,6,18,8,20,0,Brandon Powell Turnover.
Randall University,Abilene Christian,6,18,8,31,0,Official TV Timeout
Randall University,Abilene Christian,6,18,8,38,0,Harrison Hawkins Turnover.
Randall University,Abilene Christian,6,18,8,39,0,Levi Lum Steal.
Randall University,Abilene Christian,6,18,8,51,0,Levi Lum missed Three Point Jumper.
Randall University,Abilene Christian,6,18,8,51,0,Julian Edmonson Defensive Rebound.
Randall University,Abilene Christian,6,18,9,23,0,Julian Edmonson missed Layup.
Randall University,Abilene Christian,6,18,9,23,0,Randall Henderson Block.
Randall University,Abilene Christian,6,18,9,25,0,Tyler Lindsey Defensive Rebound.
Randall University,Abilene Christian,6,18,9,27,0,Foul on James Pegues.
Randall University,Abilene Christian,8,18,9,36,1,Chris Hobgood made Layup. Assisted by Phil Carey.
Randall University,Abilene Christian,8,18,10,7,0,LaDarrien Williams missed Jumper.
Randall University,Abilene Christian,8,18,10,7,0,Randall Henderson Defensive Rebound.
Randall University,Abilene Christian,8,18,10,19,0,Levi Lum missed Layup.
Randall University,Abilene Christian,8,18,10,19,0,Jacob Lancaster Defensive Rebound.
Randall University,Abilene Christian,8,18,10,34,0,Jacob Lancaster missed Layup.
Randall University,Abilene Christian,8,18,10,34,0,Phil Carey Defensive Rebound.
Randall University,Abilene Christian,8,18,10,49,0,Tyler Lindsey missed Three Point Jumper.
Randall University,Abilene Christian,8,18,10,49,0,James Pegues Defensive Rebound.
Randall University,Abilene Christian,8,20,11,2,1,Jacob Lancaster made Layup. Assisted by Harrison Hawkins.
Randall University,Abilene Christian,8,20,11,16,0,Levi Lum Turnover.
Randall University,Abilene Christian,8,20,11,17,0,LaDarrien Williams Steal.
Randall University,Abilene Christian,8,22,11,21,1,James Pegues made Dunk. Assisted by Parker Wentz.
Randall University,Abilene Christian,8,22,11,25,0,Hillsdale Baptist  Timeout
Randall University,Abilene Christian,8,22,11,35,0,Chris Hobgood missed Jumper.
Randall University,Abilene Christian,8,22,11,35,0,LaDarrien Williams Defensive Rebound.
Randall University,Abilene Christian,8,24,11,40,1,LaDarrien Williams made Layup.
Randall University,Abilene Christian,10,24,11,52,1,Phil Carey made Layup.
Randall University,Abilene Christian,10,24,12,12,0,Alexsander Milosavljevic missed Layup.
Randall University,Abilene Christian,10,24,12,12,0,Levi Lum Block.
Randall University,Abilene Christian,10,24,12,15,0,Phil Carey Defensive Rebound.
Randall University,Abilene Christian,10,24,12,19,0,Phil Carey Turnover.
Randall University,Abilene Christian,10,24,12,20,0,Parker Wentz Steal.
Randall University,Abilene Christian,10,26,12,24,1,Parker Wentz made Layup.
Randall University,Abilene Christian,10,26,12,35,0,Foul on Austin Cooke.
Randall University,Abilene Christian,10,26,12,35,0,Official TV Timeout
Randall University,Abilene Christian,10,26,12,38,0,Levi Lum Turnover.
Randall University,Abilene Christian,10,26,12,58,0,Alexsander Milosavljevic Turnover.
Randall University,Abilene Christian,10,26,12,59,0,Tyler Lindsey Steal.
Randall University,Abilene Christian,10,26,13,12,0,Phil Carey Turnover.
Randall University,Abilene Christian,10,26,13,12,0,Austin Cooke Steal.
Randall University,Abilene Christian,10,26,13,27,0,Harrison Hawkins missed Jumper.
Randall University,Abilene Christian,10,26,13,27,0,Austin Cooke Offensive Rebound.
Randall University,Abilene Christian,10,28,13,30,1,Austin Cooke made Layup.
Randall University,Abilene Christian,10,28,13,47,0,Phil Carey Turnover.
Randall University,Abilene Christian,10,28,13,48,0,Parker Wentz Steal.
Randall University,Abilene Christian,10,28,13,50,0,LaDarrien Williams Turnover.
Randall University,Abilene Christian,10,28,14,2,0,Phil Carey Turnover.
Randall University,Abilene Christian,10,28,14,4,0,Harrison Hawkins Steal.
Randall University,Abilene Christian,10,31,14,9,1,Parker Wentz made Three Point Jumper. Assisted by Harrison Hawkins.
Randall University,Abilene Christian,12,31,14,25,1,Phil Carey made Jumper.
Randall University,Abilene Christian,12,31,14,53,0,Parker Wentz missed Three Point Jumper.
Randall University,Abilene Christian,12,31,14,53,0,Phil Carey Defensive Rebound.
Randall University,Abilene Christian,12,31,15,1,0,Phil Carey missed Three Point Jumper.
Randall University,Abilene Christian,12,31,15,1,0,Parker Wentz Defensive Rebound.
Randall University,Abilene Christian,12,33,15,8,1,Harrison Hawkins made Layup. Assisted by Parker Wentz.
Randall University,Abilene Christian,12,33,15,14,0,Phil Carey missed Jumper.
Randall University,Abilene Christian,12,33,15,14,0,Alexsander Milosavljevic Defensive Rebound.
Randall University,Abilene Christian,12,36,15,31,1,Parker Wentz made Three Point Jumper. Assisted by Austin Cooke.
Randall University,Abilene Christian,12,36,15,46,0,Marquis Burden missed Jumper.
Randall University,Abilene Christian,12,36,15,46,0,Austin Cooke Defensive Rebound.
Randall University,Abilene Christian,12,36,15,55,0,Foul on LaDarrien Williams.
Randall University,Abilene Christian,12,36,15,55,0,LaDarrien Williams Turnover.
Randall University,Abilene Christian,12,36,15,58,0,Phil Carey missed Jumper.
Randall University,Abilene Christian,12,36,15,58,0,Hillsdale Baptist Offensive Rebound.
Randall University,Abilene Christian,12,36,16,7,0,Official TV Timeout
Randall University,Abilene Christian,12,36,16,10,0,Foul on Randall Henderson.
Randall University,Abilene Christian,12,36,16,10,0,Randall Henderson Turnover.
Randall University,Abilene Christian,12,38,16,20,1,James Pegues made Layup. Assisted by Michael Grant.
Randall University,Abilene Christian,12,38,16,39,0,Brandon Powell Turnover.
Randall University,Abilene Christian,12,38,16,40,0,James Pegues Steal.
Randall University,Abilene Christian,12,41,16,50,1,Julian Edmonson made Three Point Jumper. Assisted by Harrison Hawkins.
Randall University,Abilene Christian,12,41,17,4,0,Marquis Burden missed Layup.
Randall University,Abilene Christian,12,41,17,4,0,Julian Edmonson Defensive Rebound.
Randall University,Abilene Christian,12,41,17,6,0,Foul on Chris Williams.
Randall University,Abilene Christian,12,41,17,33,0,Julian Edmonson missed Three Point Jumper.
Randall University,Abilene Christian,12,41,17,33,0,Marquis Burden Defensive Rebound.
Randall University,Abilene Christian,12,41,17,41,0,Foul on James Pegues.
Randall University,Abilene Christian,12,41,17,41,0,Randall Henderson missed Free Throw.
Randall University,Abilene Christian,12,41,17,41,0,Hillsdale Baptist Deadball Team Rebound.
Randall University,Abilene Christian,13,41,17,41,1,Randall Henderson made Free Throw.
Randall University,Abilene Christian,13,41,17,52,0,Foul on Brandon Powell.
Randall University,Abilene Christian,13,41,17,52,0,Riley Payne missed Free Throw.
Randall University,Abilene Christian,13,41,17,52,0,Abilene Christian Deadball Team Rebound.
Randall University,Abilene Christian,13,42,17,52,1,Riley Payne made Free Throw.
Randall University,Abilene Christian,13,42,17,59,0,Foul on Chris Blakeley.
Randall University,Abilene Christian,14,42,17,59,1,Brandon Powell made Free Throw.
Randall University,Abilene Christian,15,42,17,59,1,Brandon Powell made Free Throw.
Randall University,Abilene Christian,15,44,18,11,1,Riley Payne made Jumper. Assisted by James Pegues.
Randall University,Abilene Christian,15,44,18,23,0,Foul on Michael Grant.
Randall University,Abilene Christian,15,44,18,23,0,Chris Williams missed Free Throw.
Randall University,Abilene Christian,15,44,18,23,0,Julian Edmonson Defensive Rebound.
Randall University,Abilene Christian,15,44,18,39,0,Julian Edmonson missed Three Point Jumper.
Randall University,Abilene Christian,15,44,18,39,0,Marquis Burden Defensive Rebound.
Randall University,Abilene Christian,15,44,18,48,0,Chris Williams missed Jumper.
Randall University,Abilene Christian,15,44,18,48,0,Hillsdale Baptist Offensive Rebound.
Randall University,Abilene Christian,15,44,18,55,0,Foul on James Pegues.
Randall University,Abilene Christian,16,44,18,55,1,Garrett White made Free Throw.
Randall University,Abilene Christian,17,44,18,55,1,Garrett White made Free Throw.
Randall University,Abilene Christian,17,44,19,10,0,Chris Blakeley Turnover.
Randall University,Abilene Christian,17,44,19,12,0,Chris Williams Steal.
Randall University,Abilene Christian,17,44,19,14,0,Garrett White Turnover.
Randall University,Abilene Christian,17,44,19,15,0,Michael Grant Steal.
Randall University,Abilene Christian,17,46,19,18,1,Michael Grant made Layup.
Randall University,Abilene Christian,20,46,19,39,1,Brandon Powell made Three Point Jumper. Assisted by Chris Williams.
Randall University,Abilene Christian,20,46,19,59,0,Chris Blakeley missed Three Point Jumper.
Randall University,Abilene Christian,20,46,19,59,0,Abilene Christian Offensive Rebound.
Randall University,Abilene Christian,20,46,20,0,0,End of 1st half
Randall University,Abilene Christian,20,49,20,39,1,LaDarrien Williams made Three Point Jumper.
Randall University,Abilene Christian,20,49,20,52,0,Phil Carey missed Layup.
Randall University,Abilene Christian,20,49,20,52,0,Austin Cooke Defensive Rebound.
Randall University,Abilene Christian,20,49,21,23,0,Austin Cooke missed Jumper.
Randall University,Abilene Christian,20,49,21,23,0,Marquis Burden Defensive Rebound.
Randall University,Abilene Christian,20,49,21,28,0,Randall Henderson missed Jumper.
Randall University,Abilene Christian,20,49,21,28,0,LaDarrien Williams Block.
Randall University,Abilene Christian,20,49,21,31,0,Randall Henderson Offensive Rebound.
Randall University,Abilene Christian,22,49,21,40,1,Randall Henderson made Jumper.
Randall University,Abilene Christian,22,49,21,48,0,Foul on Brandon Powell.
Randall University,Abilene Christian,22,51,21,57,1,Austin Cooke made Jumper.
Randall University,Abilene Christian,22,51,22,10,0,Brandon Powell missed Jumper.
Randall University,Abilene Christian,22,51,22,10,0,Randall Henderson Offensive Rebound.
Randall University,Abilene Christian,22,51,22,13,0,Randall Henderson missed Jumper.
Randall University,Abilene Christian,22,51,22,13,0,Jacob Lancaster Defensive Rebound.
Randall University,Abilene Christian,22,51,22,20,0,LaDarrien Williams missed Three Point Jumper.
Randall University,Abilene Christian,22,51,22,20,0,Brandon Powell Defensive Rebound.
Randall University,Abilene Christian,22,51,22,40,0,Phil Carey Turnover.
Randall University,Abilene Christian,22,51,22,41,0,LaDarrien Williams Steal.
Randall University,Abilene Christian,22,53,22,44,1,Harrison Hawkins made Layup. Assisted by LaDarrien Williams.
Randall University,Abilene Christian,22,53,23,1,0,Chris Williams missed Three Point Jumper.
Randall University,Abilene Christian,22,53,23,1,0,Jacob Lancaster Defensive Rebound.
Randall University,Abilene Christian,22,55,23,14,1,Jacob Lancaster made Layup. Assisted by LaDarrien Williams.
Randall University,Abilene Christian,22,55,23,32,0,Chris Williams Turnover.
Randall University,Abilene Christian,22,55,23,34,0,Parker Wentz Steal.
Randall University,Abilene Christian,22,57,23,38,1,Parker Wentz made Layup.
Randall University,Abilene Christian,22,57,23,49,0,Randall Henderson missed Jumper.
Randall University,Abilene Christian,22,57,23,49,0,Jacob Lancaster Block.
Randall University,Abilene Christian,22,57,23,50,0,Jacob Lancaster Defensive Rebound.
Randall University,Abilene Christian,22,57,23,59,0,LaDarrien Williams missed Jumper.
Randall University,Abilene Christian,22,57,23,59,0,Austin Cooke Offensive Rebound.
Randall University,Abilene Christian,22,59,24,23,1,Harrison Hawkins made Layup.
Randall University,Abilene Christian,25,59,24,34,1,Phil Carey made Three Point Jumper.
Randall University,Abilene Christian,25,59,24,47,0,Austin Cooke missed Three Point Jumper.
Randall University,Abilene Christian,25,59,24,47,0,Chris Williams Defensive Rebound.
Randall University,Abilene Christian,25,59,24,59,0,Chris Williams missed Three Point Jumper.
Randall University,Abilene Christian,25,59,24,59,0,Randall Henderson Offensive Rebound.
Randall University,Abilene Christian,25,59,24,59,0,Foul on Brandon Powell.
Randall University,Abilene Christian,25,59,24,59,0,Brandon Powell Turnover.
Randall University,Abilene Christian,25,59,24,59,0,Official TV Timeout
Randall University,Abilene Christian,25,59,25,15,0,LaDarrien Williams missed Three Point Jumper.
Randall University,Abilene Christian,25,59,25,15,0,Riley Payne Offensive Rebound.
Randall University,Abilene Christian,25,59,25,18,0,Riley Payne missed Jumper.
Randall University,Abilene Christian,25,59,25,18,0,Riley Payne Offensive Rebound.
Randall University,Abilene Christian,25,61,25,22,1,Riley Payne made Jumper.
Randall University,Abilene Christian,27,61,25,35,1,Chris Williams made Layup.
Randall University,Abilene Christian,27,61,25,51,0,Foul on Chris Williams.
Randall University,Abilene Christian,27,61,26,0,0,Foul on Phil Carey.
Randall University,Abilene Christian,27,61,26,0,0,Rafael Farley missed Free Throw.
Randall University,Abilene Christian,27,61,26,0,0,Abilene Christian Deadball Team Rebound.
Randall University,Abilene Christian,27,62,26,0,1,Rafael Farley made Free Throw.
Randall University,Abilene Christian,30,62,26,6,1,Chris Hobgood made Three Point Jumper.
Randall University,Abilene Christian,30,62,26,28,0,Riley Payne Turnover.
Randall University,Abilene Christian,33,62,26,46,1,Phil Carey made Three Point Jumper.
Randall University,Abilene Christian,33,65,27,19,1,Rafael Farley made Three Point Jumper. Assisted by LaDarrien Williams.
Randall University,Abilene Christian,36,65,27,30,1,Phil Carey made Three Point Jumper.
Randall University,Abilene Christian,36,67,27,40,1,Riley Payne made Layup. Assisted by Austin Cooke.
Randall University,Abilene Christian,36,67,27,51,0,Phil Carey Turnover.
Randall University,Abilene Christian,36,67,27,52,0,Riley Payne Steal.
Randall University,Abilene Christian,36,69,27,55,1,LaDarrien Williams made Layup. Assisted by Austin Cooke.
Randall University,Abilene Christian,38,69,28,1,1,Phil Carey made Layup. Assisted by Marquis Burden.
Randall University,Abilene Christian,38,71,28,19,1,LaDarrien Williams made Layup.
Randall University,Abilene Christian,38,71,28,19,0,Official TV Timeout
Randall University,Abilene Christian,38,71,28,19,0,Foul on Chris Hobgood.
Randall University,Abilene Christian,38,71,28,19,0,LaDarrien Williams missed Free Throw.
Randall University,Abilene Christian,38,71,28,19,0,Derrick Allen Defensive Rebound.
Randall University,Abilene Christian,38,71,28,19,0,Foul on James Pegues.
Randall University,Abilene Christian,38,71,28,30,0,Foul on Riley Payne.
Randall University,Abilene Christian,38,71,28,45,0,Phil Carey Turnover.
Randall University,Abilene Christian,38,71,28,47,0,Harrison Hawkins Steal.
Randall University,Abilene Christian,38,71,28,59,0,Foul on James Pegues.
Randall University,Abilene Christian,38,71,28,59,0,James Pegues Turnover.
Randall University,Abilene Christian,38,71,29,13,0,Foul on Michael Grant.
Randall University,Abilene Christian,39,71,29,13,1,Derrick Allen made Free Throw.
Randall University,Abilene Christian,40,71,29,13,1,Derrick Allen made Free Throw.
Randall University,Abilene Christian,40,71,29,31,0,Foul on Chris Hobgood.
Randall University,Abilene Christian,40,71,29,41,0,Foul on Phil Carey.
Randall University,Abilene Christian,40,71,29,41,0,Harrison Hawkins missed Free Throw.
Randall University,Abilene Christian,40,71,29,41,0,Abilene Christian Deadball Team Rebound.
Randall University,Abilene Christian,40,72,29,41,1,Harrison Hawkins made Free Throw.
Randall University,Abilene Christian,42,72,29,44,1,Chris Hobgood made Layup. Assisted by Phil Carey.
Randall University,Abilene Christian,42,72,29,59,0,Foul on Derrick Allen.
Randall University,Abilene Christian,42,72,29,59,0,Julian Edmonson missed Free Throw.
Randall University,Abilene Christian,42,72,29,59,0,Phil Carey Defensive Rebound.
Randall University,Abilene Christian,44,72,30,2,1,Phil Carey made Jumper.
Randall University,Abilene Christian,44,74,30,15,1,Riley Payne made Jumper. Assisted by Austin Cooke.
Randall University,Abilene Christian,44,74,30,26,0,Phil Carey missed Jumper.
Randall University,Abilene Christian,44,74,30,26,0,Riley Payne Defensive Rebound.
Randall University,Abilene Christian,44,74,30,35,0,Foul on Levi Lum.
Randall University,Abilene Christian,44,75,30,35,1,Austin Cooke made Free Throw.
Randall University,Abilene Christian,44,76,30,35,1,Austin Cooke made Free Throw.
Randall University,Abilene Christian,44,76,30,45,0,Foul on Riley Payne.
Randall University,Abilene Christian,44,76,30,45,0,Levi Lum missed Free Throw.
Randall University,Abilene Christian,44,76,30,45,0,Hillsdale Baptist Deadball Team Rebound.
Randall University,Abilene Christian,45,76,30,45,1,Levi Lum made Free Throw.
Randall University,Abilene Christian,45,78,30,56,1,Julian Edmonson made Layup.
Randall University,Abilene Christian,45,78,31,8,0,Levi Lum missed Three Point Jumper.
Randall University,Abilene Christian,45,78,31,8,0,Harrison Hawkins Defensive Rebound.
Randall University,Abilene Christian,45,78,31,17,0,Riley Payne missed Layup.
Randall University,Abilene Christian,45,78,31,17,0,Austin Cooke Offensive Rebound.
Randall University,Abilene Christian,45,78,31,17,0,Foul on Levi Lum.
Randall University,Abilene Christian,45,78,31,17,0,Austin Cooke missed Free Throw.
Randall University,Abilene Christian,45,78,31,17,0,Abilene Christian Deadball Team Rebound.
Randall University,Abilene Christian,45,78,31,17,0,Austin Cooke missed Free Throw.
Randall University,Abilene Christian,45,78,31,17,0,Abilene Christian Offensive Rebound.
Randall University,Abilene Christian,45,78,31,25,0,Foul on Levi Lum.
Randall University,Abilene Christian,45,78,31,25,0,Austin Cooke missed Free Throw.
Randall University,Abilene Christian,45,78,31,25,0,Abilene Christian Deadball Team Rebound.
Randall University,Abilene Christian,45,79,31,25,1,Austin Cooke made Free Throw.
Randall University,Abilene Christian,45,79,31,33,0,Phil Carey missed Three Point Jumper.
Randall University,Abilene Christian,45,79,31,33,0,Julian Edmonson Defensive Rebound.
Randall University,Abilene Christian,45,79,31,39,0,Foul on Derrick Allen.
Randall University,Abilene Christian,45,79,31,39,0,Julian Edmonson missed Free Throw.
Randall University,Abilene Christian,45,79,31,39,0,Abilene Christian Deadball Team Rebound.
Randall University,Abilene Christian,45,80,31,39,1,Julian Edmonson made Free Throw.
Randall University,Abilene Christian,45,80,32,4,0,Foul on Parker Wentz.
Randall University,Abilene Christian,45,80,32,4,0,Official TV Timeout
Randall University,Abilene Christian,46,80,32,4,1,Derrick Allen made Free Throw.
Randall University,Abilene Christian,47,80,32,4,1,Derrick Allen made Free Throw.
Randall University,Abilene Christian,47,80,32,22,0,Austin Cooke missed Layup.
Randall University,Abilene Christian,47,80,32,22,0,Austin Cooke Offensive Rebound.
Randall University,Abilene Christian,47,83,32,26,1,Harrison Hawkins made Three Point Jumper. Assisted by Austin Cooke.
Randall University,Abilene Christian,47,83,32,41,0,Foul on Julian Edmonson.
Randall University,Abilene Christian,48,83,32,41,1,Garrett White made Free Throw.
Randall University,Abilene Christian,48,83,32,41,0,Garrett White missed Free Throw.
Randall University,Abilene Christian,48,83,32,41,0,Jacob Lancaster Defensive Rebound.
Randall University,Abilene Christian,48,83,32,56,0,Austin Cooke missed Layup.
Randall University,Abilene Christian,48,83,32,56,0,Garrett White Defensive Rebound.
Randall University,Abilene Christian,48,83,33,3,0,Foul on Harrison Hawkins.
Randall University,Abilene Christian,49,83,33,3,1,Chris Williams made Free Throw.
Randall University,Abilene Christian,50,83,33,3,1,Chris Williams made Free Throw.
Randall University,Abilene Christian,50,83,33,17,0,Foul on Chris Williams.
Randall University,Abilene Christian,50,84,33,17,1,Julian Edmonson made Free Throw.
Randall University,Abilene Christian,50,85,33,17,1,Julian Edmonson made Free Throw.
Randall University,Abilene Christian,50,85,33,28,0,Tyler Lindsey Turnover.
Randall University,Abilene Christian,50,85,33,29,0,Harrison Hawkins Steal.
Randall University,Abilene Christian,50,85,33,35,0,Harrison Hawkins missed Layup.
Randall University,Abilene Christian,50,85,33,35,0,Jacob Lancaster Offensive Rebound.
