Away Team,Home Team,Away Score,Home Score,Minute,Second,isScoringPosession,Desc.
George Mason,George Washington,0,0,0,15,0,Otis Livingston II Turnover.
George Mason,George Washington,0,0,0,15,0,Alex Mitola Steal.
George Mason,George Washington,0,0,0,16,0,Foul on Otis Livingston II.
George Mason,George Washington,0,0,0,36,0,Alex Mitola missed Three Point Jumper.
George Mason,George Washington,0,0,0,36,0,Kevin Larsen Offensive Rebound.
George Mason,George Washington,0,0,0,45,0,Tyler Cavanaugh missed Layup.
George Mason,George Washington,0,0,0,45,0,Patricio Garino Offensive Rebound.
George Mason,George Washington,0,0,1,3,0,Joe McDonald missed Jumper.
George Mason,George Washington,0,0,1,3,0,Shevon Thompson Defensive Rebound.
George Mason,George Washington,0,0,1,22,0,Marko Gujanicic missed Jumper.
George Mason,George Washington,0,0,1,24,0,Shevon Thompson Offensive Rebound.
George Mason,George Washington,0,0,1,27,0,Shevon Thompson Turnover.
George Mason,George Washington,0,0,1,46,0,Joe McDonald missed Three Point Jumper.
George Mason,George Washington,0,0,1,46,0,Shevon Thompson Defensive Rebound.
George Mason,George Washington,0,0,2,11,0,Marko Gujanicic missed Layup.
George Mason,George Washington,0,0,2,11,0,Tyler Cavanaugh Defensive Rebound.
George Mason,George Washington,0,0,2,33,0,Patricio Garino missed Layup.
George Mason,George Washington,0,0,2,33,0,Marquise Moore Block.
George Mason,George Washington,0,0,2,34,0,George Washington Offensive Rebound.
George Mason,George Washington,0,0,2,39,0,Foul on Marko Gujanicic.
George Mason,George Washington,0,1,2,39,1,Tyler Cavanaugh made Free Throw.
George Mason,George Washington,0,2,2,39,1,Tyler Cavanaugh made Free Throw.
George Mason,George Washington,2,2,2,55,1,Marquise Moore made Jumper.
George Mason,George Washington,2,2,3,13,0,Kevin Larsen missed Jumper.
George Mason,George Washington,2,2,3,13,0,Marquise Moore Defensive Rebound.
George Mason,George Washington,2,2,3,30,0,Marquise Moore missed Jumper.
George Mason,George Washington,2,2,3,30,0,Marko Gujanicic Offensive Rebound.
George Mason,George Washington,4,2,3,32,1,Marko Gujanicic made Layup.
George Mason,George Washington,4,2,3,46,0,Tyler Cavanaugh missed Jumper.
George Mason,George Washington,4,2,3,46,0,Marko Gujanicic Block.
George Mason,George Washington,4,2,3,48,0,Marquise Moore Defensive Rebound.
George Mason,George Washington,4,2,4,5,0,Official TV Timeout
George Mason,George Washington,4,2,4,17,0,Marquise Moore missed Jumper.
George Mason,George Washington,4,2,4,17,0,Jaire Grayer Offensive Rebound.
George Mason,George Washington,4,2,4,29,0,Marko Gujanicic missed Jumper.
George Mason,George Washington,4,2,4,29,0,Tyler Cavanaugh Defensive Rebound.
George Mason,George Washington,4,5,4,56,1,Tyler Cavanaugh made Three Point Jumper. Assisted by Patricio Garino.
George Mason,George Washington,4,5,5,22,0,Marko Gujanicic missed Three Point Jumper.
George Mason,George Washington,4,5,5,22,0,Tyler Cavanaugh Defensive Rebound.
George Mason,George Washington,4,7,5,31,1,Patricio Garino made Layup.
George Mason,George Washington,6,7,5,45,1,Jaire Grayer made Layup. Assisted by Marko Gujanicic.
George Mason,George Washington,6,7,5,59,0,Foul on Jalen Jenkins.
George Mason,George Washington,6,10,6,13,1,Paul Jorgensen made Three Point Jumper. Assisted by Yuta Watanabe.
George Mason,George Washington,8,10,6,32,1,Otis Livingston II made Jumper.
George Mason,George Washington,8,10,6,44,0,Yuta Watanabe missed Jumper.
George Mason,George Washington,8,10,6,44,0,Jaire Grayer Block.
George Mason,George Washington,8,10,6,44,0,George Washington Offensive Rebound.
George Mason,George Washington,8,12,6,54,1,Kevin Larsen made Layup.
George Mason,George Washington,8,12,7,9,0,DeAndre Abram missed Three Point Jumper.
George Mason,George Washington,8,12,7,9,0,Paul Jorgensen Defensive Rebound.
George Mason,George Washington,8,14,7,16,1,Patricio Garino made Layup. Assisted by Paul Jorgensen.
George Mason,George Washington,8,14,7,19,0,George Mason  Timeout
George Mason,George Washington,10,14,7,34,1,Jaire Grayer made Jumper. Assisted by Jalen Jenkins.
George Mason,George Washington,10,14,7,55,0,Matt Hart missed Layup.
George Mason,George Washington,10,14,7,55,0,Shevon Thompson Defensive Rebound.
George Mason,George Washington,13,14,8,1,1,Jaire Grayer made Three Point Jumper. Assisted by Otis Livingston II.
George Mason,George Washington,13,14,8,21,0,Paul Jorgensen missed Three Point Jumper.
George Mason,George Washington,13,14,8,21,0,Shevon Thompson Defensive Rebound.
George Mason,George Washington,13,14,8,35,0,Foul on Patricio Garino.
George Mason,George Washington,13,14,8,35,0,Official TV Timeout
George Mason,George Washington,13,14,8,51,0,Jaire Grayer missed Three Point Jumper.
George Mason,George Washington,13,14,8,51,0,Shevon Thompson Offensive Rebound.
George Mason,George Washington,15,14,8,55,1,Shevon Thompson made Dunk.
George Mason,George Washington,15,17,9,18,1,Patricio Garino made Three Point Jumper. Assisted by Joe McDonald.
George Mason,George Washington,15,17,9,40,0,DeAndre Abram Turnover.
George Mason,George Washington,15,17,9,57,0,Joe McDonald missed Three Point Jumper.
George Mason,George Washington,15,17,9,57,0,Kevin Larsen Offensive Rebound.
George Mason,George Washington,15,17,10,1,0,Foul on Shevon Thompson.
George Mason,George Washington,15,18,10,1,1,Kevin Larsen made Free Throw.
George Mason,George Washington,15,19,10,1,1,Kevin Larsen made Free Throw.
George Mason,George Washington,17,19,10,13,1,Shevon Thompson made Dunk. Assisted by Jalen Jenkins.
George Mason,George Washington,17,19,10,27,0,Jordan Roland missed Jumper.
George Mason,George Washington,17,19,10,27,0,Jalen Jenkins Defensive Rebound.
George Mason,George Washington,17,19,10,42,0,Shevon Thompson Turnover.
George Mason,George Washington,17,21,10,56,1,Patricio Garino made Jumper.
George Mason,George Washington,17,21,11,7,0,Foul on Jordan Roland.
George Mason,George Washington,17,21,11,17,0,Marko Gujanicic Turnover.
George Mason,George Washington,17,21,11,32,0,Jordan Roland missed Three Point Jumper.
George Mason,George Washington,17,21,11,32,0,Marquise Moore Defensive Rebound.
George Mason,George Washington,17,21,11,44,0,Foul on Jordan Roland.
George Mason,George Washington,17,21,11,57,0,Marquise Moore missed Jumper.
George Mason,George Washington,17,21,12,0,0,George Washington Defensive Rebound.
George Mason,George Washington,17,24,12,21,1,Tyler Cavanaugh made Three Point Jumper. Assisted by Joe McDonald.
George Mason,George Washington,17,24,12,45,0,Official TV Timeout
George Mason,George Washington,17,24,12,55,0,Otis Livingston II missed Jumper.
George Mason,George Washington,17,24,12,56,0,Marko Gujanicic Offensive Rebound.
George Mason,George Washington,17,24,12,59,0,Foul on Jordan Roland.
George Mason,George Washington,18,24,12,59,1,Marko Gujanicic made Free Throw.
George Mason,George Washington,18,24,12,59,0,Marko Gujanicic missed Free Throw.
George Mason,George Washington,18,24,12,59,0,Kevin Larsen Defensive Rebound.
George Mason,George Washington,18,24,13,24,0,Yuta Watanabe missed Jumper.
George Mason,George Washington,18,24,13,26,0,Kevin Larsen Offensive Rebound.
George Mason,George Washington,18,24,13,27,0,Foul on Tyler Cavanaugh.
George Mason,George Washington,18,24,13,27,0,Tyler Cavanaugh Turnover.
George Mason,George Washington,18,24,13,42,0,Otis Livingston II Turnover.
George Mason,George Washington,18,26,14,6,1,Patricio Garino made Jumper. Assisted by Alex Mitola.
George Mason,George Washington,20,26,14,24,1,Marquise Moore made Layup.
George Mason,George Washington,20,28,14,37,1,Kevin Larsen made Jumper.
George Mason,George Washington,20,28,14,37,0,Foul on Jalen Jenkins.
George Mason,George Washington,20,29,14,37,1,Kevin Larsen made Free Throw.
George Mason,George Washington,20,29,15,3,0,Jaire Grayer missed Layup.
George Mason,George Washington,20,29,15,3,0,Patricio Garino Block.
George Mason,George Washington,20,29,15,5,0,Marquise Moore Offensive Rebound.
George Mason,George Washington,20,29,15,8,0,Marquise Moore missed Jumper.
George Mason,George Washington,20,29,15,8,0,Shevon Thompson Offensive Rebound.
George Mason,George Washington,23,29,15,12,1,Otis Livingston II made Three Point Jumper. Assisted by Shevon Thompson.
George Mason,George Washington,23,29,15,32,0,Kevin Larsen missed Jumper.
George Mason,George Washington,23,29,15,32,0,Yuta Watanabe Offensive Rebound.
George Mason,George Washington,23,32,15,46,1,Kevin Larsen made Three Point Jumper. Assisted by Alex Mitola.
George Mason,George Washington,23,32,16,8,0,Jaire Grayer Turnover.
George Mason,George Washington,23,32,16,9,0,Kevin Larsen Steal.
George Mason,George Washington,23,34,16,13,1,Yuta Watanabe made Dunk. Assisted by Joe McDonald.
George Mason,George Washington,23,34,16,14,0,George Mason  Timeout
George Mason,George Washington,23,34,16,14,0,Official TV Timeout
George Mason,George Washington,23,34,16,24,0,Otis Livingston II missed Jumper.
George Mason,George Washington,23,34,16,25,0,Tyler Cavanaugh Defensive Rebound.
George Mason,George Washington,23,34,16,26,0,Foul on Shevon Thompson.
George Mason,George Washington,23,34,16,43,0,Patricio Garino missed Jumper.
George Mason,George Washington,23,34,16,43,0,Marko Gujanicic Defensive Rebound.
George Mason,George Washington,23,34,17,0,0,Danny Dixon missed Jumper.
George Mason,George Washington,23,34,17,0,0,Tyler Cavanaugh Defensive Rebound.
George Mason,George Washington,23,34,17,17,0,Patricio Garino missed Three Point Jumper.
George Mason,George Washington,23,34,17,17,0,Kameron Murrell Defensive Rebound.
George Mason,George Washington,23,34,17,32,0,Jaire Grayer Turnover.
George Mason,George Washington,23,34,17,33,0,Joe McDonald Steal.
George Mason,George Washington,23,36,17,36,1,Patricio Garino made Dunk. Assisted by Joe McDonald.
George Mason,George Washington,23,36,17,55,0,Danny Dixon Turnover.
George Mason,George Washington,23,36,18,8,0,Patricio Garino missed Layup.
George Mason,George Washington,23,36,18,8,0,Otis Livingston II Defensive Rebound.
George Mason,George Washington,23,36,18,18,0,Jaire Grayer missed Three Point Jumper.
George Mason,George Washington,23,36,18,18,0,George Mason Offensive Rebound.
George Mason,George Washington,23,36,18,28,0,Foul on Patricio Garino.
George Mason,George Washington,23,36,18,39,0,Marko Gujanicic missed Jumper.
George Mason,George Washington,23,36,18,39,0,Yuta Watanabe Defensive Rebound.
George Mason,George Washington,23,36,18,46,0,Yuta Watanabe missed Layup.
George Mason,George Washington,23,36,18,46,0,Kevin Larsen Offensive Rebound.
George Mason,George Washington,23,38,19,4,1,Kevin Larsen made Layup. Assisted by Yuta Watanabe.
George Mason,George Washington,23,38,19,4,0,Foul on Jalen Jenkins.
George Mason,George Washington,23,39,19,4,1,Kevin Larsen made Free Throw.
George Mason,George Washington,23,39,19,17,0,Otis Livingston II missed Jumper.
George Mason,George Washington,23,39,19,17,0,Tyler Cavanaugh Defensive Rebound.
George Mason,George Washington,23,39,19,21,0,George Washington  Timeout
George Mason,George Washington,23,39,19,29,0,Paul Jorgensen Turnover.
George Mason,George Washington,23,39,19,56,0,Otis Livingston II missed Jumper.
George Mason,George Washington,23,39,19,56,0,Yuta Watanabe Block.
George Mason,George Washington,23,39,19,57,0,Joe McDonald Defensive Rebound.
George Mason,George Washington,23,39,19,59,0,Joe McDonald missed Three Point Jumper.
George Mason,George Washington,23,39,20,0,0,George Mason Deadball Team Rebound.
George Mason,George Washington,23,39,20,0,0,End of 1st half
George Mason,George Washington,25,39,20,14,1,Marko Gujanicic made Jumper. Assisted by Otis Livingston II.
George Mason,George Washington,25,41,20,31,1,Joe McDonald made Layup. Assisted by Kevin Larsen.
George Mason,George Washington,25,41,20,40,0,Otis Livingston II missed Jumper.
George Mason,George Washington,25,41,20,40,0,Patricio Garino Defensive Rebound.
George Mason,George Washington,25,43,20,51,1,Joe McDonald made Layup.
George Mason,George Washington,25,43,21,12,0,Shevon Thompson missed Jumper.
George Mason,George Washington,25,43,21,16,0,George Mason Offensive Rebound.
George Mason,George Washington,28,43,21,36,1,Jaire Grayer made Three Point Jumper. Assisted by DeAndre Abram.
George Mason,George Washington,28,43,21,50,0,Patricio Garino missed Jumper.
George Mason,George Washington,28,43,21,50,0,Jaire Grayer Defensive Rebound.
George Mason,George Washington,30,43,22,1,1,Jaire Grayer made Jumper. Assisted by Otis Livingston II.
George Mason,George Washington,30,43,22,25,0,Tyler Cavanaugh missed Layup.
George Mason,George Washington,30,43,22,25,0,Shevon Thompson Block.
George Mason,George Washington,30,43,22,26,0,Otis Livingston II Defensive Rebound.
George Mason,George Washington,30,43,22,31,0,Foul on Patricio Garino.
George Mason,George Washington,31,43,22,31,1,Jaire Grayer made Free Throw.
George Mason,George Washington,32,43,22,31,1,Jaire Grayer made Free Throw.
George Mason,George Washington,32,45,22,58,1,Yuta Watanabe made Jumper.
George Mason,George Washington,32,45,23,16,0,Jaire Grayer missed Jumper.
George Mason,George Washington,32,45,23,16,0,Yuta Watanabe Block.
George Mason,George Washington,32,45,23,17,0,Yuta Watanabe Defensive Rebound.
George Mason,George Washington,32,47,23,27,1,Kevin Larsen made Layup. Assisted by Joe McDonald.
George Mason,George Washington,32,47,23,39,0,Foul on Alex Mitola.
George Mason,George Washington,32,47,23,44,0,Otis Livingston II missed Jumper.
George Mason,George Washington,32,47,23,44,0,Tyler Cavanaugh Defensive Rebound.
George Mason,George Washington,32,49,23,59,1,Joe McDonald made Layup.
George Mason,George Washington,32,49,24,17,0,DeAndre Abram missed Jumper.
George Mason,George Washington,32,49,24,17,0,Kevin Larsen Defensive Rebound.
George Mason,George Washington,32,49,24,28,0,Kevin Larsen missed Layup.
George Mason,George Washington,32,49,24,28,0,Jaire Grayer Block.
George Mason,George Washington,32,49,24,30,0,DeAndre Abram Defensive Rebound.
George Mason,George Washington,34,49,24,36,1,Shevon Thompson made Layup. Assisted by Otis Livingston II.
George Mason,George Washington,34,49,24,52,0,Yuta Watanabe missed Three Point Jumper.
George Mason,George Washington,34,49,24,54,0,Shevon Thompson Defensive Rebound.
George Mason,George Washington,34,49,24,55,0,Shevon Thompson Turnover.
George Mason,George Washington,34,49,24,56,0,Alex Mitola Steal.
George Mason,George Washington,34,52,24,58,1,Alex Mitola made Three Point Jumper.
George Mason,George Washington,34,52,25,20,0,Otis Livingston II missed Three Point Jumper.
George Mason,George Washington,34,52,25,29,0,Alex Mitola Defensive Rebound.
George Mason,George Washington,34,52,25,29,0,Official TV Timeout
George Mason,George Washington,34,52,25,54,0,Patricio Garino missed Jumper.
George Mason,George Washington,34,52,25,54,0,Paul Jorgensen Offensive Rebound.
George Mason,George Washington,34,55,25,58,1,Alex Mitola made Three Point Jumper. Assisted by Paul Jorgensen.
George Mason,George Washington,34,55,26,24,0,Danny Dixon Turnover.
George Mason,George Washington,34,55,26,25,0,Paul Jorgensen Steal.
George Mason,George Washington,34,55,26,44,0,Alex Mitola missed Three Point Jumper.
George Mason,George Washington,34,55,26,46,0,George Mason Defensive Rebound.
George Mason,George Washington,34,55,27,2,0,Foul on Kevin Larsen.
George Mason,George Washington,34,55,27,12,0,Jaire Grayer missed Three Point Jumper.
George Mason,George Washington,34,55,27,12,0,Tyler Cavanaugh Defensive Rebound.
George Mason,George Washington,34,55,27,20,0,Alex Mitola Turnover.
George Mason,George Washington,34,55,27,21,0,Jalen Jenkins Steal.
George Mason,George Washington,36,55,27,41,1,Jalen Jenkins made Jumper.
George Mason,George Washington,36,55,28,5,0,Foul on Kameron Murrell.
George Mason,George Washington,36,55,28,5,0,Official TV Timeout
George Mason,George Washington,36,56,28,5,1,Patricio Garino made Free Throw.
George Mason,George Washington,36,57,28,5,1,Patricio Garino made Free Throw.
George Mason,George Washington,36,57,28,15,0,Foul on Yuta Watanabe.
George Mason,George Washington,36,57,28,15,0,DeAndre Abram missed Free Throw.
George Mason,George Washington,36,57,28,15,0,George Mason Deadball Team Rebound.
George Mason,George Washington,37,57,28,15,1,DeAndre Abram made Free Throw.
George Mason,George Washington,37,59,28,38,1,Tyler Cavanaugh made Jumper. Assisted by Kevin Larsen.
George Mason,George Washington,39,59,29,1,1,Shevon Thompson made Jumper.
George Mason,George Washington,39,61,29,15,1,Yuta Watanabe made Layup.
George Mason,George Washington,39,61,29,28,0,Shevon Thompson Turnover.
George Mason,George Washington,39,61,29,51,0,Matt Hart missed Jumper.
George Mason,George Washington,39,61,29,51,0,Paul Jorgensen Offensive Rebound.
George Mason,George Washington,39,64,30,9,1,Tyler Cavanaugh made Three Point Jumper. Assisted by Paul Jorgensen.
George Mason,George Washington,39,64,30,28,0,Foul on Joe McDonald.
George Mason,George Washington,39,64,30,44,0,Kameron Murrell Turnover.
George Mason,George Washington,39,64,30,45,0,Joe McDonald Steal.
George Mason,George Washington,39,66,30,52,1,Joe McDonald made Layup.
George Mason,George Washington,39,66,30,52,0,Foul on Jaire Grayer.
George Mason,George Washington,39,67,30,52,1,Joe McDonald made Free Throw.
George Mason,George Washington,39,67,31,11,0,Otis Livingston II missed Jumper.
George Mason,George Washington,39,67,31,14,0,George Mason Offensive Rebound.
George Mason,George Washington,39,67,31,16,0,DeAndre Abram missed Jumper.
George Mason,George Washington,39,67,31,16,0,Kevin Larsen Block.
George Mason,George Washington,39,67,31,17,0,Tyler Cavanaugh Defensive Rebound.
George Mason,George Washington,39,67,31,23,0,Tyler Cavanaugh missed Three Point Jumper.
George Mason,George Washington,39,67,31,23,0,Kameron Murrell Defensive Rebound.
George Mason,George Washington,41,67,31,30,1,DeAndre Abram made Layup. Assisted by Otis Livingston II.
George Mason,George Washington,41,69,31,55,1,Kevin Larsen made Jumper.
George Mason,George Washington,43,69,32,12,1,DeAndre Abram made Jumper.
George Mason,George Washington,43,69,32,37,0,Yuta Watanabe missed Three Point Jumper.
George Mason,George Washington,43,69,32,38,0,Tyler Cavanaugh Offensive Rebound.
George Mason,George Washington,43,71,32,41,1,Tyler Cavanaugh made Layup.
George Mason,George Washington,43,71,32,41,0,Foul on Danny Dixon.
George Mason,George Washington,43,71,32,41,0,Official TV Timeout
George Mason,George Washington,43,72,32,41,1,Tyler Cavanaugh made Free Throw.
George Mason,George Washington,43,72,32,57,0,DeAndre Abram missed Three Point Jumper.
George Mason,George Washington,43,72,32,57,0,Kevin Larsen Defensive Rebound.
George Mason,George Washington,43,72,33,21,0,Kevin Larsen missed Three Point Jumper.
George Mason,George Washington,43,72,33,21,0,George Mason Defensive Rebound.
George Mason,George Washington,43,72,33,33,0,DeAndre Abram missed Three Point Jumper.
George Mason,George Washington,43,72,33,33,0,Yuta Watanabe Defensive Rebound.
George Mason,George Washington,43,72,33,48,0,Yuta Watanabe missed Three Point Jumper.
George Mason,George Washington,43,72,33,48,0,Jaire Grayer Defensive Rebound.
George Mason,George Washington,43,72,33,59,0,Danny Dixon missed Jumper.
George Mason,George Washington,43,72,33,59,0,Patricio Garino Defensive Rebound.
George Mason,George Washington,43,72,34,20,0,Patricio Garino missed Three Point Jumper.
George Mason,George Washington,43,72,34,20,0,Danny Dixon Defensive Rebound.
George Mason,George Washington,46,72,34,41,1,Kameron Murrell made Three Point Jumper. Assisted by Danny Dixon.
George Mason,George Washington,46,72,35,6,0,Foul on Anthony Swan.
George Mason,George Washington,46,72,35,6,0,Anthony Swan Turnover.
George Mason,George Washington,46,72,35,20,0,Danny Dixon missed Jumper.
George Mason,George Washington,46,72,35,20,0,Alex Mitola Defensive Rebound.
George Mason,George Washington,46,72,35,31,0,Paul Jorgensen missed Three Point Jumper.
George Mason,George Washington,46,72,35,31,0,Jaire Grayer Defensive Rebound.
George Mason,George Washington,46,72,35,43,0,Jaire Grayer missed Jumper.
George Mason,George Washington,46,72,35,45,0,George Mason Offensive Rebound.
George Mason,George Washington,46,72,35,53,0,Kameron Murrell missed Three Point Jumper.
George Mason,George Washington,46,72,35,53,0,Danny Dixon Offensive Rebound.
George Mason,George Washington,48,72,35,57,1,Danny Dixon made Layup.
George Mason,George Washington,48,72,36,19,0,Matt Hart missed Jumper.
George Mason,George Washington,48,72,36,19,0,Paul Jorgensen Offensive Rebound.
George Mason,George Washington,48,72,36,21,0,Paul Jorgensen missed Two Point Tip Shot.
George Mason,George Washington,48,72,36,21,0,Danny Dixon Defensive Rebound.
George Mason,George Washington,48,72,36,26,0,Foul on Jordan Roland.
George Mason,George Washington,48,72,36,26,0,Official TV Timeout
George Mason,George Washington,49,72,36,26,1,Otis Livingston II made Free Throw.
George Mason,George Washington,50,72,36,26,1,Otis Livingston II made Free Throw.
George Mason,George Washington,50,72,36,39,0,Joe McDonald missed Jumper.
George Mason,George Washington,50,72,36,39,0,Jaire Grayer Defensive Rebound.
George Mason,George Washington,50,72,36,58,0,Kameron Murrell missed Three Point Jumper.
George Mason,George Washington,50,72,36,58,0,Jaire Grayer Offensive Rebound.
George Mason,George Washington,50,72,37,1,0,Jaire Grayer missed Layup.
George Mason,George Washington,50,72,37,1,0,Patricio Garino Block.
George Mason,George Washington,50,72,37,3,0,Jaire Grayer missed Layup.
George Mason,George Washington,50,72,37,3,0,Jaire Grayer Offensive Rebound.
George Mason,George Washington,50,72,37,4,0,Kevin Larsen Defensive Rebound.
George Mason,George Washington,50,72,37,4,0,Foul on Jaire Grayer.
George Mason,George Washington,50,72,37,22,0,Alex Mitola missed Three Point Jumper.
George Mason,George Washington,50,72,37,22,0,Jaire Grayer Defensive Rebound.
George Mason,George Washington,50,72,37,43,0,Otis Livingston II missed Three Point Jumper.
George Mason,George Washington,50,72,37,43,0,Anthony Swan Defensive Rebound.
George Mason,George Washington,50,72,37,56,0,Anthony Swan missed Three Point Jumper.
George Mason,George Washington,50,72,37,56,0,DeAndre Abram Defensive Rebound.
George Mason,George Washington,50,72,38,15,0,Otis Livingston II Turnover.
George Mason,George Washington,50,72,38,16,0,Patricio Garino Steal.
George Mason,George Washington,50,74,38,18,1,Patricio Garino made Dunk.
George Mason,George Washington,50,74,38,19,0,George Washington  Timeout
George Mason,George Washington,50,74,38,19,0,Official TV Timeout
George Mason,George Washington,50,74,38,37,0,Foul on Matt Hart.
George Mason,George Washington,51,74,38,37,1,Kameron Murrell made Free Throw.
George Mason,George Washington,52,74,38,37,1,Kameron Murrell made Free Throw.
George Mason,George Washington,52,74,38,50,0,Matt Hart Turnover.
George Mason,George Washington,52,74,38,50,0,Myles Tate Steal.
George Mason,George Washington,52,74,39,0,0,Julian Royal Turnover.
George Mason,George Washington,52,74,39,2,0,Paul Jorgensen Steal.
George Mason,George Washington,52,74,39,29,0,Jordan Roland missed Three Point Jumper.
George Mason,George Washington,52,74,39,29,0,Danny Dixon Defensive Rebound.
George Mason,George Washington,52,74,39,42,0,Myles Tate Turnover.
George Mason,George Washington,52,74,39,43,0,Matt Hart Steal.
George Mason,George Washington,52,74,40,0,0,End of Game
