Away Team,Home Team,Away Score,Home Score,Minute,Second,isScoringPosession,Desc.
Drexel,Colorado,0,0,0,26,0,Damion Lee missed Three Point Jumper.
Drexel,Colorado,0,0,0,26,0,Dustin Thomas Defensive Rebound.
Drexel,Colorado,0,0,0,36,0,Tre'Shaun Fletcher missed Layup.
Drexel,Colorado,0,0,0,36,0,Damion Lee Block.
Drexel,Colorado,0,0,0,38,0,Jaron Hopkins Offensive Rebound.
Drexel,Colorado,0,2,0,47,1,Josh Scott made Dunk. Assisted by Dustin Thomas.
Drexel,Colorado,0,2,1,7,0,Freddie Wilson missed Layup.
Drexel,Colorado,0,2,1,7,0,Rodney Williams Offensive Rebound.
Drexel,Colorado,0,2,1,11,0,Rodney Williams missed Layup.
Drexel,Colorado,0,2,1,11,0,Josh Scott Block.
Drexel,Colorado,0,2,1,12,0,Josh Scott Defensive Rebound.
Drexel,Colorado,0,2,1,33,0,Dustin Thomas missed Jumper.
Drexel,Colorado,0,2,1,33,0,Damion Lee Defensive Rebound.
Drexel,Colorado,0,2,1,53,0,Damion Lee missed Jumper.
Drexel,Colorado,0,2,1,53,0,Freddie Wilson Offensive Rebound.
Drexel,Colorado,0,2,2,0,0,Damion Lee missed Three Point Jumper.
Drexel,Colorado,0,2,2,0,0,Dustin Thomas Defensive Rebound.
Drexel,Colorado,0,5,2,19,1,Xavier Talton made Three Point Jumper. Assisted by Dustin Thomas.
Drexel,Colorado,0,5,2,54,0,Rashann London missed Jumper.
Drexel,Colorado,0,5,2,54,0,Josh Scott Defensive Rebound.
Drexel,Colorado,0,5,3,7,0,Xavier Talton missed Jumper.
Drexel,Colorado,0,5,3,7,0,Rodney Williams Defensive Rebound.
Drexel,Colorado,3,5,3,14,1,Freddie Wilson made Three Point Jumper.
Drexel,Colorado,3,5,3,33,0,Foul on Mohamed Bah.
Drexel,Colorado,3,5,3,37,0,Tre'Shaun Fletcher missed Jumper.
Drexel,Colorado,3,5,3,37,0,Rashann London Defensive Rebound.
Drexel,Colorado,3,5,3,54,0,Rodney Williams missed Jumper.
Drexel,Colorado,3,5,3,54,0,Josh Scott Defensive Rebound.
Drexel,Colorado,3,5,4,2,0,Tre'Shaun Fletcher missed Three Point Jumper.
Drexel,Colorado,3,5,4,2,0,Josh Scott Offensive Rebound.
Drexel,Colorado,3,7,4,6,1,Josh Scott made Layup.
Drexel,Colorado,3,7,4,39,0,Damion Lee Turnover.
Drexel,Colorado,3,7,4,40,0,Xavier Talton Steal.
Drexel,Colorado,3,9,4,43,1,Xavier Talton made Dunk.
Drexel,Colorado,3,9,5,4,0,Freddie Wilson missed Three Point Jumper.
Drexel,Colorado,3,9,5,4,0,Dustin Thomas Defensive Rebound.
Drexel,Colorado,3,11,5,28,1,Josh Scott made Dunk. Assisted by Dustin Thomas.
Drexel,Colorado,3,11,5,30,0,Drexel  Timeout
Drexel,Colorado,3,11,5,41,0,Freddie Wilson missed Three Point Jumper.
Drexel,Colorado,3,11,5,41,0,Wesley Gordon Defensive Rebound.
Drexel,Colorado,3,11,5,43,0,Foul on Damion Lee.
Drexel,Colorado,3,11,5,43,0,Official TV Timeout
Drexel,Colorado,3,11,5,54,0,Foul on Austin Williams.
Drexel,Colorado,3,12,5,54,1,Askia Booker made Free Throw.
Drexel,Colorado,3,12,5,54,0,Askia Booker missed Free Throw.
Drexel,Colorado,3,12,5,54,0,Austin Williams Defensive Rebound.
Drexel,Colorado,3,12,6,16,0,Rashann London missed Three Point Jumper.
Drexel,Colorado,3,12,6,16,0,Xavier Johnson Defensive Rebound.
Drexel,Colorado,3,12,6,45,0,Eli Stalzer Turnover.
Drexel,Colorado,3,12,6,47,0,Rodney Williams Steal.
Drexel,Colorado,3,12,6,54,0,Damion Lee missed Three Point Jumper.
Drexel,Colorado,3,12,6,54,0,Eli Stalzer Defensive Rebound.
Drexel,Colorado,3,12,7,3,0,Askia Booker missed Layup.
Drexel,Colorado,3,12,7,3,0,Rashann London Block.
Drexel,Colorado,3,12,7,3,0,Colorado Offensive Rebound.
Drexel,Colorado,3,12,7,9,0,Xavier Johnson missed Jumper.
Drexel,Colorado,3,12,7,9,0,Austin Williams Defensive Rebound.
Drexel,Colorado,3,12,7,31,0,Austin Williams Turnover.
Drexel,Colorado,3,12,7,53,0,Eli Stalzer Turnover.
Drexel,Colorado,3,12,7,55,0,Damion Lee Steal.
Drexel,Colorado,5,12,7,57,1,Rodney Williams made Dunk. Assisted by Damion Lee.
Drexel,Colorado,5,12,8,15,0,Xavier Johnson Turnover.
Drexel,Colorado,5,12,8,15,0,Official TV Timeout
Drexel,Colorado,5,12,9,8,0,Eli Stalzer missed Three Point Jumper.
Drexel,Colorado,5,12,9,8,0,Josh Scott Offensive Rebound.
Drexel,Colorado,5,12,9,12,0,Josh Scott missed Layup.
Drexel,Colorado,5,12,9,12,0,Austin Williams Block.
Drexel,Colorado,5,12,9,14,0,Austin Williams Defensive Rebound.
Drexel,Colorado,5,12,9,18,0,Tavon Allen missed Three Point Jumper.
Drexel,Colorado,5,12,9,18,0,Eli Stalzer Defensive Rebound.
Drexel,Colorado,5,12,9,26,0,Eli Stalzer Turnover.
Drexel,Colorado,8,12,9,52,1,Damion Lee made Three Point Jumper. Assisted by Freddie Wilson.
Drexel,Colorado,8,12,10,0,0,Foul on Rodney Williams.
Drexel,Colorado,8,13,10,0,1,Xavier Johnson made Free Throw.
Drexel,Colorado,8,14,10,0,1,Xavier Johnson made Free Throw.
Drexel,Colorado,8,14,10,18,0,Foul on Jaron Hopkins.
Drexel,Colorado,8,14,10,27,0,Tavon Allen Turnover.
Drexel,Colorado,8,14,10,28,0,Askia Booker Steal.
Drexel,Colorado,8,14,10,31,0,Xavier Talton missed Three Point Jumper.
Drexel,Colorado,8,14,10,31,0,Austin Williams Defensive Rebound.
Drexel,Colorado,8,14,10,56,0,Tavon Allen missed Jumper.
Drexel,Colorado,8,14,10,56,0,Askia Booker Defensive Rebound.
Drexel,Colorado,8,16,11,4,1,Josh Scott made Dunk. Assisted by Askia Booker.
Drexel,Colorado,8,16,11,40,0,Freddie Wilson missed Three Point Jumper.
Drexel,Colorado,8,16,11,40,0,Austin Williams Offensive Rebound.
Drexel,Colorado,11,16,11,45,1,Tavon Allen made Three Point Jumper. Assisted by Austin Williams.
Drexel,Colorado,11,16,11,53,0,Askia Booker missed Jumper.
Drexel,Colorado,11,16,11,53,0,Freddie Wilson Defensive Rebound.
Drexel,Colorado,11,16,12,1,0,Foul on Jaron Hopkins.
Drexel,Colorado,11,16,12,4,0,Foul on Xavier Johnson.
Drexel,Colorado,11,16,12,4,0,Official TV Timeout
Drexel,Colorado,12,16,12,4,1,Damion Lee made Free Throw.
Drexel,Colorado,13,16,12,4,1,Damion Lee made Free Throw.
Drexel,Colorado,13,16,12,17,0,Foul on Austin Williams.
Drexel,Colorado,13,17,12,17,1,Dustin Thomas made Free Throw.
Drexel,Colorado,13,17,12,17,0,Dustin Thomas missed Free Throw.
Drexel,Colorado,13,17,12,17,0,Mohamed Bah Defensive Rebound.
Drexel,Colorado,16,17,12,41,1,Damion Lee made Three Point Jumper.
Drexel,Colorado,16,20,12,50,1,Xavier Johnson made Three Point Jumper. Assisted by Xavier Talton.
Drexel,Colorado,16,20,13,14,0,Foul on Damion Lee.
Drexel,Colorado,16,20,13,14,0,Damion Lee Turnover.
Drexel,Colorado,16,20,13,33,0,Josh Scott missed Layup.
Drexel,Colorado,16,20,13,33,0,Rodney Williams Block.
Drexel,Colorado,16,20,13,34,0,Tavon Allen Defensive Rebound.
Drexel,Colorado,18,20,13,38,1,Tavon Allen made Layup.
Drexel,Colorado,18,20,13,47,0,Foul on Mohamed Bah.
Drexel,Colorado,18,21,13,47,1,Josh Scott made Free Throw.
Drexel,Colorado,18,22,13,47,1,Josh Scott made Free Throw.
Drexel,Colorado,18,22,14,3,0,Tavon Allen missed Three Point Jumper.
Drexel,Colorado,18,22,14,3,0,Dustin Thomas Defensive Rebound.
Drexel,Colorado,18,24,14,22,1,Tory Miller made Dunk. Assisted by Dustin Thomas.
Drexel,Colorado,21,24,14,43,1,Tavon Allen made Three Point Jumper. Assisted by Freddie Wilson.
Drexel,Colorado,21,27,15,14,1,Xavier Johnson made Three Point Jumper.
Drexel,Colorado,21,27,15,31,0,Foul on Tre'Shaun Fletcher.
Drexel,Colorado,22,27,15,31,1,Tavon Allen made Free Throw.
Drexel,Colorado,22,27,15,31,0,Tavon Allen missed Free Throw.
Drexel,Colorado,22,27,15,31,0,Drexel Offensive Rebound.
Drexel,Colorado,22,27,15,48,0,Foul on Jaron Hopkins.
Drexel,Colorado,25,27,15,58,1,Freddie Wilson made Three Point Jumper. Assisted by Rodney Williams.
Drexel,Colorado,25,27,16,10,0,Askia Booker missed Layup.
Drexel,Colorado,25,27,16,10,0,Austin Williams Block.
Drexel,Colorado,25,27,16,12,0,Rodney Williams Defensive Rebound.
Drexel,Colorado,25,27,16,16,0,Tavon Allen missed Layup.
Drexel,Colorado,25,27,16,16,0,Josh Scott Block.
Drexel,Colorado,25,27,16,16,0,Drexel Offensive Rebound.
Drexel,Colorado,25,27,16,16,0,Official TV Timeout
Drexel,Colorado,25,27,16,26,0,Freddie Wilson missed Three Point Jumper.
Drexel,Colorado,25,27,16,26,0,Xavier Talton Defensive Rebound.
Drexel,Colorado,25,29,16,40,1,Wesley Gordon made Layup. Assisted by Askia Booker.
Drexel,Colorado,25,29,16,40,0,Foul on Freddie Wilson.
Drexel,Colorado,25,30,16,40,1,Wesley Gordon made Free Throw.
Drexel,Colorado,25,30,17,15,0,Tavon Allen missed Three Point Jumper.
Drexel,Colorado,25,30,17,15,0,Josh Scott Defensive Rebound.
Drexel,Colorado,25,30,17,29,0,Foul on Austin Williams.
Drexel,Colorado,25,31,17,29,1,Wesley Gordon made Free Throw.
Drexel,Colorado,25,32,17,29,1,Wesley Gordon made Free Throw.
Drexel,Colorado,27,32,17,45,1,Tavon Allen made Jumper.
Drexel,Colorado,27,32,18,0,0,Josh Scott missed Jumper.
Drexel,Colorado,27,32,18,0,0,Damion Lee Defensive Rebound.
Drexel,Colorado,27,32,18,27,0,Foul on Wesley Gordon.
Drexel,Colorado,28,32,18,27,1,Rashann London made Free Throw.
Drexel,Colorado,29,32,18,27,1,Rashann London made Free Throw.
Drexel,Colorado,29,32,18,51,0,Askia Booker missed Three Point Jumper.
Drexel,Colorado,29,32,18,51,0,Drexel Defensive Rebound.
Drexel,Colorado,29,32,19,8,0,Tavon Allen missed Three Point Jumper.
Drexel,Colorado,29,32,19,8,0,Sooren Derboghosian Offensive Rebound.
Drexel,Colorado,29,32,19,12,0,Sooren Derboghosian Turnover.
Drexel,Colorado,29,32,19,13,0,Xavier Talton Steal.
Drexel,Colorado,29,32,19,17,0,Foul on Tavon Allen.
Drexel,Colorado,29,32,19,17,0,Josh Scott missed Free Throw.
Drexel,Colorado,29,32,19,17,0,Colorado Deadball Team Rebound.
Drexel,Colorado,29,33,19,17,1,Josh Scott made Free Throw.
Drexel,Colorado,29,33,19,42,0,Rashann London missed Jumper.
Drexel,Colorado,29,33,19,42,0,Josh Scott Defensive Rebound.
Drexel,Colorado,29,33,19,54,0,Colorado  Timeout
Drexel,Colorado,29,33,19,58,0,Xavier Talton missed Jumper.
Drexel,Colorado,29,33,19,58,0,Sooren Derboghosian Defensive Rebound.
Drexel,Colorado,29,33,20,0,0,End of 1st half
