Away Team,Home Team,Away Score,Home Score,Minute,Second,isScoringPosession,Desc.
Dillard,McNeese,0,2,0,28,1,Tevin Jackson made Layup.
Dillard,McNeese,0,2,0,41,0,Ramon Johnson Turnover.
Dillard,McNeese,0,2,0,43,0,Austin Lewis Steal.
Dillard,McNeese,0,2,0,47,0,Austin Lewis Turnover.
Dillard,McNeese,2,2,1,10,1,Ramon Johnson made Layup.
Dillard,McNeese,2,2,1,26,0,Shaun Johnson missed Three Point Jumper.
Dillard,McNeese,2,2,1,26,0,Austin Lewis Offensive Rebound.
Dillard,McNeese,2,2,1,30,0,Austin Lewis missed Jumper.
Dillard,McNeese,2,2,1,30,0,Tevin Jackson Offensive Rebound.
Dillard,McNeese,2,2,1,32,0,Tevin Jackson missed Two Point Tip Shot.
Dillard,McNeese,2,2,1,32,0,McNeese St Offensive Rebound.
Dillard,McNeese,2,2,1,47,0,Jamaya Burr missed Three Point Jumper.
Dillard,McNeese,2,2,1,47,0,Montrey Thomas Defensive Rebound.
Dillard,McNeese,2,2,2,4,0,Kristian Clark missed Jumper.
Dillard,McNeese,2,2,2,4,0,Ramon Johnson Offensive Rebound.
Dillard,McNeese,4,2,2,8,1,Ramon Johnson made Layup.
Dillard,McNeese,4,2,2,32,0,Jamaya Burr missed Three Point Jumper.
Dillard,McNeese,4,2,2,32,0,Dillard Defensive Rebound.
Dillard,McNeese,4,2,2,53,0,Ramon Johnson missed Jumper.
Dillard,McNeese,4,2,2,53,0,Jamaya Burr Defensive Rebound.
Dillard,McNeese,4,4,3,3,1,Jamaya Burr made Layup. Assisted by Tevin Jackson.
Dillard,McNeese,7,4,3,29,1,Montrey Thomas made Three Point Jumper. Assisted by Ramon Johnson.
Dillard,McNeese,7,4,3,40,0,Shaun Johnson missed Three Point Jumper.
Dillard,McNeese,7,4,3,40,0,Tevin Jackson Offensive Rebound.
Dillard,McNeese,7,6,3,44,1,Tevin Jackson made Layup.
Dillard,McNeese,7,6,3,55,0,Demetric Austin Turnover.
Dillard,McNeese,7,6,3,56,0,Lance Potier Steal.
Dillard,McNeese,7,8,3,58,1,Lance Potier made Dunk.
Dillard,McNeese,9,8,4,13,1,Demetric Austin made Jumper.
Dillard,McNeese,9,8,4,28,0,Shaun Johnson missed Layup.
Dillard,McNeese,9,8,4,28,0,Austin Lewis Offensive Rebound.
Dillard,McNeese,9,10,4,31,1,Austin Lewis made Layup.
Dillard,McNeese,11,10,4,40,1,Demetric Austin made Layup. Assisted by Montrey Thomas.
Dillard,McNeese,11,10,4,56,0,Tevin Jackson missed Jumper.
Dillard,McNeese,11,10,4,56,0,Montrey Thomas Defensive Rebound.
Dillard,McNeese,11,10,5,5,0,Kristian Clark missed Layup.
Dillard,McNeese,11,10,5,5,0,Austin Lewis Block.
Dillard,McNeese,11,10,5,8,0,Jamaya Burr Defensive Rebound.
Dillard,McNeese,11,10,5,11,0,Jamaya Burr missed Layup.
Dillard,McNeese,11,10,5,11,0,Demetric Austin Defensive Rebound.
Dillard,McNeese,14,10,5,17,1,Jesse Ward made Three Point Jumper. Assisted by Kristian Clark.
Dillard,McNeese,14,10,5,25,0,McNeese St  Timeout
Dillard,McNeese,14,10,5,49,0,Lance Potier missed Jumper.
Dillard,McNeese,14,10,5,49,0,Dennis Hightower Defensive Rebound.
Dillard,McNeese,16,10,5,56,1,Sean Burrell made Layup. Assisted by Dennis Hightower.
Dillard,McNeese,16,10,6,8,0,Lance Potier missed Layup.
Dillard,McNeese,16,10,6,8,0,Sean Burrell Block.
Dillard,McNeese,16,10,6,11,0,Jamaya Burr Offensive Rebound.
Dillard,McNeese,16,10,6,13,0,Jamaya Burr Turnover.
Dillard,McNeese,16,10,6,14,0,Dennis Hightower Steal.
Dillard,McNeese,18,10,6,16,1,Jesse Ward made Layup. Assisted by Dennis Hightower.
Dillard,McNeese,18,13,6,37,1,Jarren Greenwood made Three Point Jumper.
Dillard,McNeese,20,13,7,0,1,Demetric Austin made Jumper. Assisted by Dennis Hightower.
Dillard,McNeese,20,13,7,16,0,Tevin Jackson missed Three Point Jumper.
Dillard,McNeese,20,13,7,16,0,Lance Potier Offensive Rebound.
Dillard,McNeese,20,15,7,19,1,Lance Potier made Jumper.
Dillard,McNeese,20,15,7,44,0,Demetric Austin Turnover.
Dillard,McNeese,20,15,7,45,0,Jamaya Burr Steal.
Dillard,McNeese,20,17,7,46,1,Jamaya Burr made Layup.
Dillard,McNeese,23,17,8,6,1,Dennis Hightower made Three Point Jumper. Assisted by Jesse Ward.
Dillard,McNeese,23,17,8,29,0,Foul on Demetric Austin.
Dillard,McNeese,23,17,8,30,0,Official TV Timeout
Dillard,McNeese,23,17,8,34,0,Jarren Greenwood missed Three Point Jumper.
Dillard,McNeese,23,17,8,34,0,Kristian Clark Defensive Rebound.
Dillard,McNeese,23,17,8,48,0,Foul on Craig McFerrin.
Dillard,McNeese,24,17,8,48,1,Demetric Austin made Free Throw.
Dillard,McNeese,25,17,8,48,1,Demetric Austin made Free Throw.
Dillard,McNeese,25,17,8,59,0,Lance Potier missed Three Point Jumper.
Dillard,McNeese,25,17,8,59,0,Demetric Austin Defensive Rebound.
Dillard,McNeese,25,17,9,16,0,Sean Burrell Turnover.
Dillard,McNeese,25,17,9,18,0,Jarren Greenwood Steal.
Dillard,McNeese,25,17,9,26,0,Craig McFerrin missed Layup.
Dillard,McNeese,25,17,9,26,0,Dennis Hightower Defensive Rebound.
Dillard,McNeese,27,17,9,32,1,Dennis Hightower made Jumper.
Dillard,McNeese,27,19,9,58,1,Tevin Jackson made Layup. Assisted by Lance Potier.
Dillard,McNeese,30,19,10,16,1,Jesse Ward made Three Point Jumper.
Dillard,McNeese,30,19,10,27,0,Jarren Greenwood missed Jumper.
Dillard,McNeese,30,19,10,27,0,Sean Burrell Defensive Rebound.
Dillard,McNeese,30,19,10,39,0,Sean Burrell missed Jumper.
Dillard,McNeese,30,19,10,39,0,Demetric Austin Offensive Rebound.
Dillard,McNeese,32,19,10,44,1,Demetric Austin made Layup.
Dillard,McNeese,32,19,11,5,0,Jarren Greenwood missed Layup.
Dillard,McNeese,32,19,11,5,0,Sean Burrell Defensive Rebound.
Dillard,McNeese,32,19,11,14,0,Kristian Clark missed Three Point Jumper.
Dillard,McNeese,32,19,11,14,0,Lance Potier Defensive Rebound.
Dillard,McNeese,32,21,11,22,1,Lance Potier made Layup.
Dillard,McNeese,34,21,11,39,1,Demetric Austin made Layup. Assisted by Dennis Hightower.
Dillard,McNeese,34,21,11,54,0,Foul on Demetric Austin.
Dillard,McNeese,34,22,11,54,1,Craig McFerrin made Free Throw.
Dillard,McNeese,34,23,11,54,1,Craig McFerrin made Free Throw.
Dillard,McNeese,34,23,12,23,0,Dennis Hightower missed Three Point Jumper.
Dillard,McNeese,34,23,12,23,0,Jamaya Burr Defensive Rebound.
Dillard,McNeese,34,23,12,29,0,Foul on Jesse Ward.
Dillard,McNeese,34,23,12,29,0,Official TV Timeout
Dillard,McNeese,34,26,12,36,1,James Harvey made Three Point Jumper. Assisted by Jarren Greenwood.
Dillard,McNeese,34,26,13,6,0,Jesse Ward missed Three Point Jumper.
Dillard,McNeese,34,26,13,6,0,Patrick Thompson Offensive Rebound.
Dillard,McNeese,34,26,13,11,0,Patrick Thompson missed Two Point Tip Shot.
Dillard,McNeese,34,26,13,11,0,Dexter Porchia Offensive Rebound.
Dillard,McNeese,34,26,13,14,0,Dexter Porchia missed Layup.
Dillard,McNeese,34,26,13,14,0,Craig McFerrin Defensive Rebound.
Dillard,McNeese,34,26,13,18,0,Foul on Jesse Ward.
Dillard,McNeese,34,26,13,37,0,Craig McFerrin missed Jumper.
Dillard,McNeese,34,26,13,37,0,Lance Potier Offensive Rebound.
Dillard,McNeese,34,26,13,39,0,Foul on Patrick Thompson.
Dillard,McNeese,34,28,13,50,1,Jarren Greenwood made Jumper.
Dillard,McNeese,34,28,14,24,0,Ramon Johnson missed Layup.
Dillard,McNeese,34,28,14,24,0,Lance Potier Defensive Rebound.
Dillard,McNeese,34,30,14,34,1,Lance Potier made Layup. Assisted by Craig McFerrin.
Dillard,McNeese,36,30,14,58,1,Ramon Johnson made Layup. Assisted by Patrick Thompson.
Dillard,McNeese,36,32,15,24,1,Lance Potier made Layup.
Dillard,McNeese,36,32,15,42,0,Ramon Johnson missed Layup.
Dillard,McNeese,36,32,15,42,0,Lance Potier Defensive Rebound.
Dillard,McNeese,36,32,15,50,0,Foul on Jamaya Burr.
Dillard,McNeese,36,32,15,50,0,Jamaya Burr Turnover.
Dillard,McNeese,38,32,16,6,1,Demetric Austin made Jumper.
Dillard,McNeese,38,34,16,30,1,Matthew Moss made Jumper. Assisted by Jarren Greenwood.
Dillard,McNeese,38,34,16,47,0,Foul on Jarren Greenwood.
Dillard,McNeese,38,34,16,47,0,Official TV Timeout
Dillard,McNeese,41,34,17,4,1,Kristian Clark made Three Point Jumper. Assisted by Demetric Austin.
Dillard,McNeese,41,37,17,14,1,Matthew Moss made Three Point Jumper.
Dillard,McNeese,43,37,17,28,1,Tydrick King made Layup.
Dillard,McNeese,43,37,17,39,0,Matthew Moss missed Three Point Jumper.
Dillard,McNeese,43,37,17,39,0,Demetric Austin Defensive Rebound.
Dillard,McNeese,43,37,17,52,0,Tydrick King Turnover.
Dillard,McNeese,43,37,17,54,0,Matthew Moss Steal.
Dillard,McNeese,43,37,18,1,0,James Harvey missed Three Point Jumper.
Dillard,McNeese,43,37,18,1,0,Tydrick King Defensive Rebound.
Dillard,McNeese,46,37,18,22,1,Demetric Austin made Three Point Jumper. Assisted by Houston Chatman.
Dillard,McNeese,46,37,18,43,0,James Harvey missed Three Point Jumper.
Dillard,McNeese,46,37,18,43,0,Kristian Clark Defensive Rebound.
Dillard,McNeese,46,37,18,52,0,Demetric Austin missed Three Point Jumper.
Dillard,McNeese,46,37,18,52,0,Craig McFerrin Defensive Rebound.
Dillard,McNeese,46,37,19,18,0,Shaun Johnson missed Three Point Jumper.
Dillard,McNeese,46,37,19,18,0,Dillard Defensive Rebound.
Dillard,McNeese,48,37,19,40,1,Tydrick King made Layup. Assisted by Dennis Hightower.
Dillard,McNeese,48,40,19,56,1,Shaun Johnson made Three Point Jumper. Assisted by Jarren Greenwood.
Dillard,McNeese,48,40,20,0,0,End of 1st half
Dillard,McNeese,48,40,20,19,0,Demetric Austin missed Jumper.
Dillard,McNeese,48,40,20,19,0,Craig McFerrin Defensive Rebound.
Dillard,McNeese,48,40,20,39,0,Lance Potier missed Jumper.
Dillard,McNeese,48,40,20,39,0,Demetric Austin Defensive Rebound.
Dillard,McNeese,48,40,20,47,0,Jesse Ward missed Layup.
Dillard,McNeese,48,40,20,47,0,Jarren Greenwood Defensive Rebound.
Dillard,McNeese,48,40,21,2,0,Foul on Demetric Austin.
Dillard,McNeese,48,40,21,6,0,Tevin Jackson missed Layup.
Dillard,McNeese,48,40,21,6,0,Craig McFerrin Offensive Rebound.
Dillard,McNeese,48,42,21,11,1,Craig McFerrin made Layup.
Dillard,McNeese,48,42,21,33,0,Jesse Ward missed Three Point Jumper.
Dillard,McNeese,48,42,21,33,0,Lance Potier Defensive Rebound.
Dillard,McNeese,48,45,21,43,1,Jarren Greenwood made Three Point Jumper. Assisted by Tevin Jackson.
Dillard,McNeese,48,45,21,48,0,Dillard  Timeout
Dillard,McNeese,51,45,22,0,1,Demetric Austin made Three Point Jumper. Assisted by Kristian Clark.
Dillard,McNeese,51,45,22,22,0,Jarren Greenwood missed Jumper.
Dillard,McNeese,51,45,22,22,0,Demetric Austin Defensive Rebound.
Dillard,McNeese,51,45,22,45,0,Kristian Clark missed Three Point Jumper.
Dillard,McNeese,51,45,22,45,0,Demetric Austin Offensive Rebound.
Dillard,McNeese,51,45,22,50,0,Demetric Austin missed Layup.
Dillard,McNeese,51,45,22,50,0,Demetric Austin Offensive Rebound.
Dillard,McNeese,51,45,22,50,0,Foul on Craig McFerrin.
Dillard,McNeese,51,45,22,50,0,Demetric Austin missed Free Throw.
Dillard,McNeese,51,45,22,50,0,Dillard Deadball Team Rebound.
Dillard,McNeese,52,45,22,50,1,Demetric Austin made Free Throw.
Dillard,McNeese,52,48,23,13,1,Jamaya Burr made Three Point Jumper. Assisted by Jarren Greenwood.
Dillard,McNeese,54,48,23,37,1,Demetric Austin made Layup. Assisted by Kristian Clark.
Dillard,McNeese,54,51,23,50,1,Lance Potier made Three Point Jumper. Assisted by Craig McFerrin.
Dillard,McNeese,57,51,24,3,1,Dennis Hightower made Three Point Jumper.
Dillard,McNeese,57,51,24,23,0,Foul on Dennis Hightower.
Dillard,McNeese,57,51,24,23,0,Official TV Timeout
Dillard,McNeese,57,52,24,23,1,Craig McFerrin made Free Throw.
Dillard,McNeese,57,53,24,23,1,Craig McFerrin made Free Throw.
Dillard,McNeese,60,53,24,51,1,Dennis Hightower made Three Point Jumper. Assisted by Kristian Clark.
Dillard,McNeese,60,56,25,17,1,Jarren Greenwood made Three Point Jumper. Assisted by Jamaya Burr.
Dillard,McNeese,63,56,25,40,1,Kristian Clark made Three Point Jumper. Assisted by Demetric Austin.
Dillard,McNeese,63,56,25,54,0,Craig McFerrin missed Layup.
Dillard,McNeese,63,56,25,54,0,Kristian Clark Defensive Rebound.
Dillard,McNeese,63,56,25,55,0,Foul on Craig McFerrin.
Dillard,McNeese,63,56,26,22,0,Dennis Hightower missed Three Point Jumper.
Dillard,McNeese,63,56,26,22,0,Craig McFerrin Defensive Rebound.
Dillard,McNeese,63,56,26,35,0,Stephen Ugochukwu missed Jumper.
Dillard,McNeese,63,56,26,35,0,Tydrick King Defensive Rebound.
Dillard,McNeese,63,56,26,57,0,Tydrick King missed Layup.
Dillard,McNeese,63,56,26,57,0,Stephen Ugochukwu Block.
Dillard,McNeese,63,56,26,59,0,Tydrick King Offensive Rebound.
Dillard,McNeese,63,56,27,1,0,Tydrick King missed Layup.
Dillard,McNeese,63,56,27,1,0,Stephen Ugochukwu Defensive Rebound.
Dillard,McNeese,63,56,27,16,0,Lance Potier Turnover.
Dillard,McNeese,65,56,27,41,1,Ramon Johnson made Layup. Assisted by Dennis Hightower.
Dillard,McNeese,65,58,27,57,1,Austin Lewis made Layup.
Dillard,McNeese,65,58,28,17,0,Jesse Ward missed Jumper.
Dillard,McNeese,65,58,28,17,0,Lance Potier Defensive Rebound.
Dillard,McNeese,65,58,28,26,0,Jarren Greenwood Turnover.
Dillard,McNeese,65,58,28,26,0,Official TV Timeout
Dillard,McNeese,65,58,28,49,0,Kristian Clark missed Three Point Jumper.
Dillard,McNeese,65,58,28,49,0,Austin Lewis Defensive Rebound.
Dillard,McNeese,65,58,28,56,0,Foul on Jesse Ward.
Dillard,McNeese,65,59,28,56,1,Jarren Greenwood made Free Throw.
Dillard,McNeese,65,60,28,56,1,Jarren Greenwood made Free Throw.
Dillard,McNeese,65,60,29,24,0,Ramon Johnson Turnover.
Dillard,McNeese,65,60,29,25,0,Austin Lewis Steal.
Dillard,McNeese,65,60,29,33,0,Foul on Ramon Johnson.
Dillard,McNeese,65,62,29,49,1,Austin Lewis made Layup. Assisted by Lance Potier.
Dillard,McNeese,65,62,30,10,0,Foul on Austin Lewis.
Dillard,McNeese,65,62,30,13,0,Demetric Austin missed Three Point Jumper.
Dillard,McNeese,65,62,30,13,0,Jamaya Burr Defensive Rebound.
Dillard,McNeese,65,62,30,28,0,Jarren Greenwood missed Three Point Jumper.
Dillard,McNeese,65,62,30,28,0,Dennis Hightower Defensive Rebound.
Dillard,McNeese,65,62,30,52,0,Foul on Jarren Greenwood.
Dillard,McNeese,65,62,31,9,0,Tydrick King missed Layup.
Dillard,McNeese,65,62,31,9,0,Austin Lewis Block.
Dillard,McNeese,65,62,31,10,0,Tydrick King Offensive Rebound.
Dillard,McNeese,67,62,31,13,1,Tydrick King made Jumper.
Dillard,McNeese,67,65,31,36,1,James Harvey made Three Point Jumper. Assisted by Lance Potier.
Dillard,McNeese,70,65,31,53,1,Dexter Porchia made Three Point Jumper. Assisted by Dennis Hightower.
Dillard,McNeese,70,65,32,4,0,Foul on Matthew Moss.
Dillard,McNeese,70,65,32,4,0,Matthew Moss Turnover.
Dillard,McNeese,70,65,32,4,0,Official TV Timeout
Dillard,McNeese,70,65,32,13,0,Kristian Clark Turnover.
Dillard,McNeese,70,65,32,15,0,Adrian Brown Steal.
Dillard,McNeese,70,68,32,25,1,Jamaya Burr made Three Point Jumper. Assisted by Adrian Brown.
Dillard,McNeese,72,68,32,59,1,Kristian Clark made Layup. Assisted by Patrick Thompson.
Dillard,McNeese,72,68,33,13,0,Lance Potier missed Three Point Jumper.
Dillard,McNeese,72,68,33,13,0,James Harvey Offensive Rebound.
Dillard,McNeese,72,70,33,16,1,James Harvey made Jumper.
Dillard,McNeese,72,70,33,35,0,Foul on Austin Lewis.
Dillard,McNeese,72,70,33,38,0,Kristian Clark Turnover.
Dillard,McNeese,72,70,33,39,0,Lance Potier Steal.
Dillard,McNeese,72,70,33,43,0,James Harvey missed Three Point Jumper.
Dillard,McNeese,72,70,33,43,0,Dexter Porchia Defensive Rebound.
Dillard,McNeese,72,70,33,59,0,Dennis Hightower Turnover.
Dillard,McNeese,72,70,34,0,0,Adrian Brown Steal.
Dillard,McNeese,72,70,34,23,0,Lance Potier Turnover.
Dillard,McNeese,74,70,34,37,1,Patrick Thompson made Jumper. Assisted by Dennis Hightower.
Dillard,McNeese,74,70,35,2,0,James Harvey missed Three Point Jumper.
Dillard,McNeese,74,70,35,2,0,Kristian Clark Defensive Rebound.
Dillard,McNeese,74,70,35,35,0,Kristian Clark Turnover.
Dillard,McNeese,74,70,35,36,0,Jamaya Burr Steal.
Dillard,McNeese,74,72,36,1,1,James Harvey made Layup.
Dillard,McNeese,77,72,36,7,1,Dennis Hightower made Three Point Jumper. Assisted by Dexter Porchia.
Dillard,McNeese,77,72,36,7,0,Foul on Adrian Brown.
Dillard,McNeese,77,72,36,7,0,Adrian Brown Turnover.
Dillard,McNeese,77,72,36,7,0,Official TV Timeout
Dillard,McNeese,77,72,36,8,0,Patrick Thompson missed Free Throw.
Dillard,McNeese,77,72,36,8,0,Dexter Porchia Offensive Rebound.
Dillard,McNeese,77,72,36,36,0,Dexter Porchia missed Three Point Jumper.
Dillard,McNeese,77,72,36,36,0,Patrick Thompson Offensive Rebound.
Dillard,McNeese,77,72,36,40,0,Patrick Thompson missed Layup.
Dillard,McNeese,77,72,36,40,0,Tevin Jackson Block.
Dillard,McNeese,77,72,36,40,0,Dillard Offensive Rebound.
Dillard,McNeese,77,72,37,3,0,Tydrick King missed Layup.
Dillard,McNeese,77,72,37,3,0,Craig McFerrin Block.
Dillard,McNeese,77,72,37,5,0,Jamaya Burr Defensive Rebound.
Dillard,McNeese,77,75,37,34,1,Jamaya Burr made Three Point Jumper.
Dillard,McNeese,79,75,38,2,1,Dexter Porchia made Layup. Assisted by Dennis Hightower.
Dillard,McNeese,79,78,38,25,1,Jarren Greenwood made Three Point Jumper. Assisted by Jamaya Burr.
Dillard,McNeese,79,78,38,36,0,McNeese St  Timeout
Dillard,McNeese,79,78,38,46,0,Demetric Austin missed Layup.
Dillard,McNeese,79,78,38,46,0,Austin Lewis Block.
Dillard,McNeese,79,78,38,48,0,Austin Lewis Defensive Rebound.
Dillard,McNeese,79,78,38,51,0,Foul on Kristian Clark.
Dillard,McNeese,79,78,38,51,0,Jamaya Burr missed Free Throw.
Dillard,McNeese,79,78,38,51,0,McNeese St Deadball Team Rebound.
Dillard,McNeese,79,78,38,51,0,Jamaya Burr missed Free Throw.
Dillard,McNeese,79,78,38,51,0,Dennis Hightower Defensive Rebound.
Dillard,McNeese,79,78,39,4,0,Dillard  Timeout
Dillard,McNeese,79,78,39,7,0,Kristian Clark Turnover.
Dillard,McNeese,79,78,39,32,0,Jarren Greenwood Turnover.
Dillard,McNeese,79,78,39,33,0,Jesse Ward Steal.
Dillard,McNeese,79,78,39,33,0,Jesse Ward Turnover.
Dillard,McNeese,79,78,39,33,0,Austin Lewis Steal.
Dillard,McNeese,79,78,39,34,0,McNeese St  Timeout
Dillard,McNeese,79,78,39,34,0,McNeese St  Timeout
Dillard,McNeese,79,80,39,50,1,Craig McFerrin made Layup. Assisted by Lance Potier.
Dillard,McNeese,79,80,39,50,0,Dillard  Timeout
Dillard,McNeese,79,80,40,0,0,Dexter Porchia missed Jumper.
Dillard,McNeese,79,80,40,0,0,McNeese St Defensive Rebound.
Dillard,McNeese,79,80,40,0,0,End of Game
