North Carolina Central,McNeese,70,63,38,7,1,Kalob Ledoux made Three Point Jumper.
North Carolina Central,McNeese,70,63,38,26,0,Patrick Cole Turnover.
North Carolina Central,McNeese,70,63,38,33,0,Jamaya Burr missed Layup.
North Carolina Central,McNeese,70,63,38,33,0,Jamaya Burr Offensive Rebound.
North Carolina Central,McNeese,70,63,38,35,0,Jamaya Burr missed Layup.
North Carolina Central,McNeese,70,63,38,35,0,Pablo Rivas Block.
North Carolina Central,McNeese,70,63,38,37,0,Pablo Rivas Defensive Rebound.
North Carolina Central,McNeese,70,63,38,45,0,North Carolina Central  Timeout
North Carolina Central,McNeese,70,63,38,59,0,Foul on Kalob Ledoux.
North Carolina Central,McNeese,71,63,38,59,1,Patrick Cole made Free Throw.
North Carolina Central,McNeese,72,63,38,59,1,Patrick Cole made Free Throw.
North Carolina Central,McNeese,72,66,39,5,1,Kalob Ledoux made Three Point Jumper.
North Carolina Central,McNeese,72,66,39,11,0,North Carolina Central  Timeout
North Carolina Central,McNeese,74,66,39,15,1,Patrick Cole made Layup. Assisted by Rashaun Madison.
North Carolina Central,McNeese,74,66,39,22,0,Jamaya Burr missed Three Point Jumper.
North Carolina Central,McNeese,74,66,39,22,0,C.J. Wiggins Defensive Rebound.
North Carolina Central,McNeese,74,66,39,46,0,Patrick Cole missed Jumper.
North Carolina Central,McNeese,74,66,39,46,0,Stephen Ugochukwu Defensive Rebound.
North Carolina Central,McNeese,74,66,39,52,0,James Harvey missed Three Point Jumper.
North Carolina Central,McNeese,74,66,39,52,0,Patrick Cole Defensive Rebound.
North Carolina Central,McNeese,74,66,40,0,0,End of Game
