Away Team,Home Team,Away Score, Home Score,Minute,Second,isScoringPosession,Desc.
North Carolina Central,McNeese,0,3,0,20,1,Jamaya Burr made Three Point Jumper. Assisted by Stephen Ugochukwu.
North Carolina Central,McNeese,3,3,0,44,1,Del'Vin Dickerson made Three Point Jumper. Assisted by Dajuan Graf.
North Carolina Central,McNeese,3,3,1,9,0,LaBarrius Hill Turnover.
North Carolina Central,McNeese,3,3,1,24,0,Patrick Cole missed Layup.
North Carolina Central,McNeese,3,3,1,24,0,Will Ransom Offensive Rebound.
North Carolina Central,McNeese,5,3,1,29,1,Will Ransom made Layup.
North Carolina Central,McNeese,5,3,1,37,0,Jamaya Burr Turnover.
North Carolina Central,McNeese,5,3,1,40,0,Will Ransom Steal.
North Carolina Central,McNeese,7,3,1,42,1,Patrick Cole made Layup. Assisted by Dajuan Graf.
North Carolina Central,McNeese,7,5,2,6,1,Jarren Greenwood made Layup.
North Carolina Central,McNeese,7,5,2,34,0,Rashaun Madison missed Three Point Jumper.
North Carolina Central,McNeese,7,5,2,34,0,Lance Potier Defensive Rebound.
North Carolina Central,McNeese,7,7,2,41,1,Jamaya Burr made Layup. Assisted by Lance Potier.
North Carolina Central,McNeese,7,7,2,52,0,Foul on Will Ransom.
North Carolina Central,McNeese,7,7,2,52,0,Will Ransom Turnover.
North Carolina Central,McNeese,7,7,3,18,0,Jarren Greenwood missed Three Point Jumper.
North Carolina Central,McNeese,7,7,3,18,0,Lance Potier Offensive Rebound.
North Carolina Central,McNeese,7,7,3,29,0,Foul on Del'Vin Dickerson.
North Carolina Central,McNeese,7,7,3,37,0,LaBarrius Hill Turnover.
North Carolina Central,McNeese,7,7,3,39,0,Dajuan Graf Steal.
North Carolina Central,McNeese,7,7,3,41,0,Rashaun Madison missed Layup.
North Carolina Central,McNeese,7,7,3,41,0,Rashaun Madison Offensive Rebound.
North Carolina Central,McNeese,7,7,4,0,0,Foul on LaBarrius Hill.
North Carolina Central,McNeese,10,7,4,20,1,Rashaun Madison made Three Point Jumper. Assisted by Dajuan Graf.
North Carolina Central,McNeese,10,7,4,37,0,Official TV Timeout
North Carolina Central,McNeese,10,7,4,41,0,Foul on Dajuan Graf.
North Carolina Central,McNeese,10,8,4,41,1,Jarren Greenwood made Free Throw.
North Carolina Central,McNeese,10,9,4,41,1,Jarren Greenwood made Free Throw.
North Carolina Central,McNeese,10,9,4,44,0,Foul on Lance Potier.
North Carolina Central,McNeese,10,9,5,6,0,Patrick Cole missed Layup.
North Carolina Central,McNeese,10,9,5,6,0,McNeese Defensive Rebound.
North Carolina Central,McNeese,10,9,5,22,0,Foul on Pablo Rivas.
North Carolina Central,McNeese,10,9,5,24,0,James Harvey Turnover.
North Carolina Central,McNeese,10,9,5,26,0,Rashaun Madison Steal.
North Carolina Central,McNeese,12,9,5,27,1,Rashaun Madison made Layup.
North Carolina Central,McNeese,12,9,5,36,0,Jamaya Burr Turnover.
North Carolina Central,McNeese,12,9,5,36,0,McNeese  Timeout
North Carolina Central,McNeese,12,9,5,47,0,Patrick Cole missed Layup.
North Carolina Central,McNeese,12,9,5,47,0,LaBarrius Hill Defensive Rebound.
North Carolina Central,McNeese,12,9,5,51,0,Foul on Patrick Cole.
North Carolina Central,McNeese,12,9,6,4,0,James Harvey missed Three Point Jumper.
North Carolina Central,McNeese,12,9,6,4,0,Stephen Ugochukwu Offensive Rebound.
North Carolina Central,McNeese,12,9,6,7,0,Foul on Patrick Cole.
North Carolina Central,McNeese,12,10,6,7,1,Stephen Ugochukwu made Free Throw.
North Carolina Central,McNeese,12,11,6,7,1,Stephen Ugochukwu made Free Throw.
North Carolina Central,McNeese,14,11,6,12,1,Patrick Cole made Layup.
North Carolina Central,McNeese,14,11,6,44,0,LaBarrius Hill missed Layup.
North Carolina Central,McNeese,14,11,6,44,0,Pablo Rivas Defensive Rebound.
North Carolina Central,McNeese,16,11,6,57,1,Dajuan Graf made Layup.
North Carolina Central,McNeese,16,11,7,10,0,Stephen Ugochukwu missed Layup.
North Carolina Central,McNeese,16,11,7,10,0,McNeese Offensive Rebound.
North Carolina Central,McNeese,16,11,7,15,0,Stephen Ugochukwu Turnover.
North Carolina Central,McNeese,16,11,7,34,0,Rashaun Madison missed Three Point Jumper.
North Carolina Central,McNeese,16,11,7,34,0,Jarren Greenwood Defensive Rebound.
North Carolina Central,McNeese,16,13,7,46,1,Stephen Ugochukwu made Dunk. Assisted by Jarren Greenwood.
North Carolina Central,McNeese,16,13,8,8,0,Ron Trapps missed Three Point Jumper.
North Carolina Central,McNeese,16,13,8,8,0,Rashaun Madison Offensive Rebound.
North Carolina Central,McNeese,16,13,8,21,0,Foul on Stephen Ugochukwu.
North Carolina Central,McNeese,16,13,8,21,0,Official TV Timeout
North Carolina Central,McNeese,17,13,8,21,1,Pablo Rivas made Free Throw.
North Carolina Central,McNeese,18,13,8,21,1,Pablo Rivas made Free Throw.
North Carolina Central,McNeese,18,15,8,33,1,Kalob Ledoux made Jumper. Assisted by Jarren Greenwood.
North Carolina Central,McNeese,20,15,9,2,1,Ron Trapps made Jumper. Assisted by Dajuan Graf.
North Carolina Central,McNeese,20,17,9,9,1,LaBarrius Hill made Dunk. Assisted by Jarren Greenwood.
North Carolina Central,McNeese,20,17,9,25,0,Rashaun Madison missed Jumper.
North Carolina Central,McNeese,20,17,9,25,0,LaBarrius Hill Defensive Rebound.
North Carolina Central,McNeese,20,17,9,29,0,Foul on Pablo Rivas.
North Carolina Central,McNeese,20,17,9,29,0,LaBarrius Hill missed Free Throw.
North Carolina Central,McNeese,20,17,9,29,0,Will Ransom Defensive Rebound.
North Carolina Central,McNeese,22,17,9,51,1,Dajuan Graf made Layup.
North Carolina Central,McNeese,22,17,10,5,0,Jarren Greenwood Turnover.
North Carolina Central,McNeese,22,17,10,19,0,Del'Vin Dickerson missed Three Point Jumper.
North Carolina Central,McNeese,22,17,10,19,0,Will Ransom Offensive Rebound.
North Carolina Central,McNeese,22,17,10,21,0,Foul on Stephen Ugochukwu.
North Carolina Central,McNeese,22,17,10,38,0,C.J. Wiggins missed Jumper.
North Carolina Central,McNeese,22,17,10,38,0,Jamaya Burr Defensive Rebound.
North Carolina Central,McNeese,22,17,10,46,0,Jamaya Burr missed Layup.
North Carolina Central,McNeese,22,17,10,46,0,Del'Vin Dickerson Defensive Rebound.
North Carolina Central,McNeese,22,17,10,58,0,Dajuan Graf missed Layup.
North Carolina Central,McNeese,22,17,10,58,0,Jamaya Burr Defensive Rebound.
North Carolina Central,McNeese,22,19,11,3,1,Kalob Ledoux made Layup. Assisted by Jamaya Burr.
North Carolina Central,McNeese,22,19,11,3,0,Foul on C.J. Wiggins.
North Carolina Central,McNeese,22,20,11,3,1,Kalob Ledoux made Free Throw.
North Carolina Central,McNeese,24,20,11,16,1,C.J. Wiggins made Layup.
North Carolina Central,McNeese,24,22,11,33,1,Jamaya Burr made Layup.
North Carolina Central,McNeese,24,22,11,46,0,Foul on James Harvey.
North Carolina Central,McNeese,24,22,12,3,0,Dajuan Graf missed Layup.
North Carolina Central,McNeese,24,22,12,3,0,Howard Thomas Defensive Rebound.
North Carolina Central,McNeese,24,22,12,20,0,Foul on Del'Vin Dickerson.
North Carolina Central,McNeese,24,22,12,20,0,Official TV Timeout
North Carolina Central,McNeese,24,22,12,21,0,James Harvey missed Free Throw.
North Carolina Central,McNeese,24,22,12,21,0,Marius McAllister Defensive Rebound.
North Carolina Central,McNeese,26,22,12,47,1,Dajuan Graf made Jumper.
North Carolina Central,McNeese,26,22,12,47,0,Foul on Marius McAllister.
North Carolina Central,McNeese,26,22,12,47,0,Adrian Brown missed Free Throw.
North Carolina Central,McNeese,26,22,12,47,0,McNeese Deadball Team Rebound.
North Carolina Central,McNeese,26,23,12,47,1,Adrian Brown made Free Throw.
North Carolina Central,McNeese,28,23,13,2,1,Will Ransom made Dunk. Assisted by Dajuan Graf.
North Carolina Central,McNeese,28,23,13,27,0,Howard Thomas Turnover.
North Carolina Central,McNeese,28,23,13,44,0,Foul on Will Ransom.
North Carolina Central,McNeese,28,23,13,44,0,Will Ransom Turnover.
North Carolina Central,McNeese,28,23,14,0,0,Foul on Stephen Ugochukwu.
North Carolina Central,McNeese,28,23,14,0,0,Stephen Ugochukwu Turnover.
North Carolina Central,McNeese,28,23,14,10,0,Rashaun Madison missed Three Point Jumper.
North Carolina Central,McNeese,28,23,14,10,0,North Carolina Central Offensive Rebound.
North Carolina Central,McNeese,28,23,14,26,0,Ron Trapps missed Jumper.
North Carolina Central,McNeese,28,23,14,26,0,Marius McAllister Offensive Rebound.
North Carolina Central,McNeese,28,23,14,31,0,Foul on Ron Trapps.
North Carolina Central,McNeese,28,23,14,31,0,Ron Trapps Turnover.
North Carolina Central,McNeese,28,23,14,44,0,Jamaya Burr Turnover.
North Carolina Central,McNeese,28,23,14,46,0,Dajuan Graf Steal.
North Carolina Central,McNeese,28,23,14,49,0,Foul on Dajuan Graf.
North Carolina Central,McNeese,28,23,14,49,0,Dajuan Graf Turnover.
North Carolina Central,McNeese,28,25,14,59,1,Jamaya Burr made Jumper.
North Carolina Central,McNeese,31,25,15,28,1,Ron Trapps made Three Point Jumper. Assisted by Rashaun Madison.
North Carolina Central,McNeese,31,27,15,47,1,LaBarrius Hill made Layup.
North Carolina Central,McNeese,31,27,16,8,0,Ron Trapps missed Jumper.
North Carolina Central,McNeese,31,27,16,8,0,Marius McAllister Offensive Rebound.
North Carolina Central,McNeese,31,27,16,11,0,Marius McAllister Turnover.
North Carolina Central,McNeese,31,27,16,11,0,Official TV Timeout
North Carolina Central,McNeese,31,29,16,25,1,Jarren Greenwood made Jumper. Assisted by Jamaya Burr.
North Carolina Central,McNeese,31,29,16,43,0,Foul on Jamaya Burr.
North Carolina Central,McNeese,31,29,16,43,0,C.J. Wiggins missed Free Throw.
North Carolina Central,McNeese,31,29,16,43,0,North Carolina Central Deadball Team Rebound.
North Carolina Central,McNeese,31,29,16,43,0,C.J. Wiggins missed Free Throw.
North Carolina Central,McNeese,31,29,16,43,0,Lance Potier Defensive Rebound.
North Carolina Central,McNeese,31,31,17,0,1,LaBarrius Hill made Layup. Assisted by Jarren Greenwood.
North Carolina Central,McNeese,31,31,17,21,0,Michael Wolfe missed Three Point Jumper.
North Carolina Central,McNeese,31,31,17,21,0,Jamaya Burr Defensive Rebound.
North Carolina Central,McNeese,31,32,17,36,1,Jarren Greenwood made Free Throw.
North Carolina Central,McNeese,31,32,17,39,0,Foul on C.J. Wiggins.
North Carolina Central,McNeese,31,33,17,47,1,Jarren Greenwood made Free Throw.
North Carolina Central,McNeese,31,33,18,2,0,Marius McAllister missed Jumper.
North Carolina Central,McNeese,31,33,18,2,0,Ron Trapps Offensive Rebound.
North Carolina Central,McNeese,31,33,18,6,0,Ron Trapps missed Jumper.
North Carolina Central,McNeese,31,33,18,6,0,Lance Potier Defensive Rebound.
North Carolina Central,McNeese,31,33,18,7,0,Foul on LaBarrius Hill.
North Carolina Central,McNeese,31,33,18,7,0,LaBarrius Hill Turnover.
North Carolina Central,McNeese,32,33,18,7,1,Michael Wolfe made Free Throw.
North Carolina Central,McNeese,33,33,18,7,1,Michael Wolfe made Free Throw.
North Carolina Central,McNeese,33,33,18,26,0,Lance Potier Turnover.
North Carolina Central,McNeese,33,33,18,28,0,Michael Wolfe Steal.
North Carolina Central,McNeese,33,33,18,43,0,Rashaun Madison missed Layup.
North Carolina Central,McNeese,33,33,18,43,0,Marius McAllister Offensive Rebound.
North Carolina Central,McNeese,35,33,18,46,1,Marius McAllister made Two Point Tip Shot.
North Carolina Central,McNeese,35,33,18,58,0,Lance Potier missed Jumper.
North Carolina Central,McNeese,35,33,18,58,0,Ron Trapps Defensive Rebound.
North Carolina Central,McNeese,35,33,19,9,0,North Carolina Central  Timeout
North Carolina Central,McNeese,35,33,19,23,0,C.J. Wiggins missed Layup.
North Carolina Central,McNeese,35,33,19,23,0,Adrian Brown Block.
North Carolina Central,McNeese,35,33,19,25,0,Adrian Brown Defensive Rebound.
North Carolina Central,McNeese,35,35,19,31,1,Jacob Ledoux made Dunk. Assisted by Adrian Brown.
North Carolina Central,McNeese,35,35,19,55,0,C.J. Wiggins missed Jumper.
North Carolina Central,McNeese,35,35,19,55,0,Jacob Ledoux Defensive Rebound.
North Carolina Central,McNeese,35,35,19,56,0,Foul on Marius McAllister.
North Carolina Central,McNeese,35,35,19,56,0,Jacob Ledoux missed Free Throw.
North Carolina Central,McNeese,35,35,19,56,0,McNeese Deadball Team Rebound.
North Carolina Central,McNeese,35,36,19,56,1,Jacob Ledoux made Free Throw.
North Carolina Central,McNeese,35,36,20,0,0,End of 1st half
North Carolina Central,McNeese,35,36,20,26,0,Jamaya Burr missed Jumper.
North Carolina Central,McNeese,35,36,20,26,0,Will Ransom Defensive Rebound.
North Carolina Central,McNeese,35,36,20,36,0,Patrick Cole missed Jumper.
North Carolina Central,McNeese,35,36,20,36,0,LaBarrius Hill Defensive Rebound.
North Carolina Central,McNeese,35,36,20,45,0,Stephen Ugochukwu missed Jumper.
North Carolina Central,McNeese,35,36,20,45,0,Del'Vin Dickerson Defensive Rebound.
North Carolina Central,McNeese,35,36,20,55,0,Dajuan Graf missed Jumper.
North Carolina Central,McNeese,35,36,20,55,0,Stephen Ugochukwu Defensive Rebound.
North Carolina Central,McNeese,35,36,21,8,0,Jarren Greenwood Turnover.
North Carolina Central,McNeese,35,36,21,9,0,Rashaun Madison Steal.
North Carolina Central,McNeese,35,36,21,12,0,Patrick Cole missed Layup.
North Carolina Central,McNeese,35,36,21,12,0,Lance Potier Defensive Rebound.
North Carolina Central,McNeese,35,38,21,22,1,LaBarrius Hill made Jumper. Assisted by Jarren Greenwood.
North Carolina Central,McNeese,37,38,21,51,1,Patrick Cole made Jumper.
North Carolina Central,McNeese,37,40,22,16,1,Stephen Ugochukwu made Layup.
North Carolina Central,McNeese,37,40,22,38,0,Patrick Cole missed Three Point Jumper.
North Carolina Central,McNeese,37,40,22,38,0,LaBarrius Hill Defensive Rebound.
North Carolina Central,McNeese,37,40,22,48,0,Jamaya Burr Turnover.
North Carolina Central,McNeese,37,40,22,50,0,Rashaun Madison Steal.
North Carolina Central,McNeese,39,40,22,52,1,Dajuan Graf made Layup.
North Carolina Central,McNeese,39,40,23,10,0,Stephen Ugochukwu missed Layup.
North Carolina Central,McNeese,39,40,23,10,0,Will Ransom Defensive Rebound.
North Carolina Central,McNeese,39,40,23,24,0,Dajuan Graf missed Jumper.
North Carolina Central,McNeese,39,40,23,24,0,Stephen Ugochukwu Defensive Rebound.
North Carolina Central,McNeese,39,40,23,29,0,Stephen Ugochukwu Turnover.
North Carolina Central,McNeese,39,40,23,30,0,Will Ransom Steal.
North Carolina Central,McNeese,39,40,23,39,0,Patrick Cole missed Three Point Jumper.
North Carolina Central,McNeese,39,40,23,39,0,Stephen Ugochukwu Defensive Rebound.
North Carolina Central,McNeese,39,40,23,39,0,Foul on Will Ransom.
North Carolina Central,McNeese,39,42,23,59,1,Jarren Greenwood made Layup. Assisted by Stephen Ugochukwu.
North Carolina Central,McNeese,41,42,24,4,1,Will Ransom made Layup. Assisted by Del'Vin Dickerson.
North Carolina Central,McNeese,41,42,24,14,0,Lance Potier missed Layup.
North Carolina Central,McNeese,41,42,24,14,0,Del'Vin Dickerson Defensive Rebound.
North Carolina Central,McNeese,41,42,24,19,0,Rashaun Madison missed Three Point Jumper.
North Carolina Central,McNeese,41,42,24,19,0,Ron Trapps Offensive Rebound.
North Carolina Central,McNeese,43,42,24,24,1,Ron Trapps made Two Point Tip Shot.
North Carolina Central,McNeese,43,42,24,30,0,McNeese  Timeout
North Carolina Central,McNeese,43,42,24,40,0,Adrian Brown missed Jumper.
North Carolina Central,McNeese,43,42,24,40,0,Del'Vin Dickerson Defensive Rebound.
North Carolina Central,McNeese,43,42,24,49,0,Foul on Dajuan Graf.
North Carolina Central,McNeese,43,42,24,49,0,Dajuan Graf Turnover.
North Carolina Central,McNeese,43,42,24,49,0,Official TV Timeout
North Carolina Central,McNeese,43,42,25,15,0,Jarren Greenwood missed Layup.
North Carolina Central,McNeese,43,42,25,15,0,Will Ransom Defensive Rebound.
North Carolina Central,McNeese,43,42,25,18,0,Will Ransom Turnover.
North Carolina Central,McNeese,43,42,25,20,0,Stephen Ugochukwu Steal.
North Carolina Central,McNeese,43,42,25,22,0,Stephen Ugochukwu missed Dunk.
North Carolina Central,McNeese,43,42,25,22,0,Adrian Brown Offensive Rebound.
North Carolina Central,McNeese,43,44,25,26,1,Adrian Brown made Layup.
North Carolina Central,McNeese,43,44,25,43,0,Foul on Kalob Ledoux.
North Carolina Central,McNeese,44,44,25,43,1,Del'Vin Dickerson made Free Throw.
North Carolina Central,McNeese,45,44,25,43,1,Del'Vin Dickerson made Free Throw.
North Carolina Central,McNeese,45,44,25,56,0,Kalob Ledoux missed Jumper.
North Carolina Central,McNeese,45,44,25,56,0,Stephen Ugochukwu Offensive Rebound.
North Carolina Central,McNeese,45,44,26,0,0,Stephen Ugochukwu Turnover.
North Carolina Central,McNeese,45,44,26,1,0,Del'Vin Dickerson Steal.
North Carolina Central,McNeese,45,44,26,5,0,Ron Trapps missed Jumper.
North Carolina Central,McNeese,45,44,26,5,0,Del'Vin Dickerson Offensive Rebound.
North Carolina Central,McNeese,45,44,26,9,0,Del'Vin Dickerson missed Dunk.
North Carolina Central,McNeese,45,44,26,9,0,Stephen Ugochukwu Defensive Rebound.
North Carolina Central,McNeese,45,44,26,11,0,Foul on Will Ransom.
North Carolina Central,McNeese,45,45,26,11,1,Jamaya Burr made Free Throw.
North Carolina Central,McNeese,45,45,26,11,0,Jamaya Burr missed Free Throw.
North Carolina Central,McNeese,45,45,26,11,0,Del'Vin Dickerson Defensive Rebound.
North Carolina Central,McNeese,45,45,26,32,0,Del'Vin Dickerson missed Layup.
North Carolina Central,McNeese,45,45,26,32,0,Adrian Brown Defensive Rebound.
North Carolina Central,McNeese,45,45,26,39,0,Jamaya Burr Turnover.
North Carolina Central,McNeese,45,45,26,52,0,Dajuan Graf missed Layup.
North Carolina Central,McNeese,45,45,26,52,0,Stephen Ugochukwu Defensive Rebound.
North Carolina Central,McNeese,45,45,26,59,0,Kalob Ledoux missed Layup.
North Carolina Central,McNeese,45,45,26,59,0,Patrick Cole Defensive Rebound.
North Carolina Central,McNeese,47,45,27,8,1,Patrick Cole made Layup.
North Carolina Central,McNeese,47,45,27,27,0,Kalob Ledoux missed Three Point Jumper.
North Carolina Central,McNeese,47,45,27,27,0,Patrick Cole Defensive Rebound.
North Carolina Central,McNeese,49,45,27,34,1,Patrick Cole made Jumper.
North Carolina Central,McNeese,49,45,28,5,0,Stephen Ugochukwu missed Layup.
North Carolina Central,McNeese,49,45,28,5,0,Stephen Ugochukwu Offensive Rebound.
North Carolina Central,McNeese,49,45,28,9,0,Stephen Ugochukwu missed Two Point Tip Shot.
North Carolina Central,McNeese,49,45,28,9,0,Del'Vin Dickerson Defensive Rebound.
North Carolina Central,McNeese,51,45,28,14,1,Dajuan Graf made Layup.
North Carolina Central,McNeese,51,45,28,23,0,Official TV Timeout
North Carolina Central,McNeese,51,45,28,42,0,Jamaya Burr missed Three Point Jumper.
North Carolina Central,McNeese,51,45,28,42,0,North Carolina Central Defensive Rebound.
North Carolina Central,McNeese,53,45,28,55,1,Dajuan Graf made Layup. Assisted by Patrick Cole.
North Carolina Central,McNeese,53,45,29,3,0,Foul on Jacob Ledoux.
North Carolina Central,McNeese,53,45,29,3,0,Jacob Ledoux Turnover.
North Carolina Central,McNeese,53,45,29,5,0,Del'Vin Dickerson Turnover.
North Carolina Central,McNeese,53,45,29,15,0,Foul on Rashaun Madison.
North Carolina Central,McNeese,53,45,29,19,0,James Harvey missed Three Point Jumper.
North Carolina Central,McNeese,53,45,29,19,0,Patrick Cole Defensive Rebound.
North Carolina Central,McNeese,53,45,29,28,0,Patrick Cole missed Layup.
North Carolina Central,McNeese,53,45,29,28,0,Jacob Ledoux Defensive Rebound.
North Carolina Central,McNeese,53,48,29,55,1,Jacob Ledoux made Three Point Jumper.
North Carolina Central,McNeese,53,48,30,11,0,Patrick Cole missed Three Point Jumper.
North Carolina Central,McNeese,53,48,30,11,0,Del'Vin Dickerson Offensive Rebound.
North Carolina Central,McNeese,53,48,30,13,0,Foul on Lance Potier.
North Carolina Central,McNeese,54,48,30,13,1,Del'Vin Dickerson made Free Throw.
North Carolina Central,McNeese,55,48,30,13,1,Del'Vin Dickerson made Free Throw.
North Carolina Central,McNeese,55,48,30,15,0,Dajuan Graf Turnover.
North Carolina Central,McNeese,57,48,30,30,1,Pablo Rivas made Layup. Assisted by Dajuan Graf.
North Carolina Central,McNeese,57,48,30,35,0,Jacob Ledoux missed Layup.
North Carolina Central,McNeese,57,48,30,35,0,Dajuan Graf Defensive Rebound.
North Carolina Central,McNeese,59,48,30,42,1,Del'Vin Dickerson made Layup. Assisted by Patrick Cole.
North Carolina Central,McNeese,59,48,31,7,0,Stephen Ugochukwu missed Layup.
North Carolina Central,McNeese,59,48,31,7,0,Lance Potier Offensive Rebound.
North Carolina Central,McNeese,59,48,31,7,0,Foul on Del'Vin Dickerson.
North Carolina Central,McNeese,59,48,31,22,0,James Harvey missed Three Point Jumper.
North Carolina Central,McNeese,59,48,31,22,0,Jamaya Burr Offensive Rebound.
North Carolina Central,McNeese,59,48,31,27,0,Foul on Dajuan Graf.
North Carolina Central,McNeese,59,48,31,27,0,Jamaya Burr missed Free Throw.
North Carolina Central,McNeese,59,48,31,27,0,McNeese Deadball Team Rebound.
North Carolina Central,McNeese,59,49,31,27,1,Jamaya Burr made Free Throw.
North Carolina Central,McNeese,59,49,31,43,0,Foul on Lance Potier.
North Carolina Central,McNeese,60,49,31,43,1,Patrick Cole made Free Throw.
North Carolina Central,McNeese,60,49,31,43,0,Patrick Cole missed Free Throw.
North Carolina Central,McNeese,60,49,31,43,0,Lance Potier Defensive Rebound.
North Carolina Central,McNeese,60,49,31,58,0,James Harvey missed Three Point Jumper.
North Carolina Central,McNeese,60,49,31,58,0,Del'Vin Dickerson Defensive Rebound.
North Carolina Central,McNeese,60,49,32,5,0,Foul on Lance Potier.
North Carolina Central,McNeese,60,49,32,5,0,Official TV Timeout
North Carolina Central,McNeese,61,49,32,5,1,Patrick Cole made Free Throw.
North Carolina Central,McNeese,62,49,32,5,1,Patrick Cole made Free Throw.
North Carolina Central,McNeese,62,49,32,30,0,Jamaya Burr Turnover.
North Carolina Central,McNeese,62,49,32,31,0,Pablo Rivas Steal.
North Carolina Central,McNeese,62,49,32,50,0,Patrick Cole missed Jumper.
North Carolina Central,McNeese,62,49,32,50,0,Jarren Greenwood Defensive Rebound.
North Carolina Central,McNeese,62,49,32,59,0,Jarren Greenwood missed Layup.
North Carolina Central,McNeese,62,49,32,59,0,C.J. Wiggins Defensive Rebound.
North Carolina Central,McNeese,62,49,33,7,0,Rashaun Madison missed Three Point Jumper.
North Carolina Central,McNeese,62,49,33,7,0,Pablo Rivas Offensive Rebound.
North Carolina Central,McNeese,62,49,33,8,0,Foul on Lance Potier.
North Carolina Central,McNeese,62,49,33,33,0,Del'Vin Dickerson missed Layup.
North Carolina Central,McNeese,62,49,33,33,0,James Harvey Block.
North Carolina Central,McNeese,62,49,33,35,0,Kalob Ledoux Defensive Rebound.
North Carolina Central,McNeese,62,49,33,36,0,Kalob Ledoux Turnover.
North Carolina Central,McNeese,62,49,34,0,0,Rashaun Madison missed Jumper.
North Carolina Central,McNeese,62,49,34,0,0,North Carolina Central Offensive Rebound.
North Carolina Central,McNeese,62,49,34,14,0,Foul on Jarren Greenwood.
North Carolina Central,McNeese,63,49,34,14,1,C.J. Wiggins made Free Throw.
North Carolina Central,McNeese,64,49,34,14,1,C.J. Wiggins made Free Throw.
North Carolina Central,McNeese,64,49,34,28,0,Stephen Ugochukwu missed Three Point Jumper.
North Carolina Central,McNeese,64,49,34,28,0,Rashaun Madison Defensive Rebound.
North Carolina Central,McNeese,64,49,34,36,0,C.J. Wiggins Turnover.
North Carolina Central,McNeese,64,49,34,37,0,Jarren Greenwood Steal.
North Carolina Central,McNeese,64,51,34,40,1,Jarren Greenwood made Layup.
North Carolina Central,McNeese,64,51,35,10,0,Patrick Cole missed Jumper.
North Carolina Central,McNeese,64,51,35,10,0,Stephen Ugochukwu Defensive Rebound.
North Carolina Central,McNeese,64,53,35,22,1,Adrian Brown made Jumper. Assisted by Jarren Greenwood.
North Carolina Central,McNeese,64,53,35,31,0,North Carolina Central  Timeout
North Carolina Central,McNeese,64,53,35,43,0,Foul on Del'Vin Dickerson.
North Carolina Central,McNeese,64,53,35,43,0,Del'Vin Dickerson Turnover.
North Carolina Central,McNeese,64,55,35,51,1,Jarren Greenwood made Jumper. Assisted by Jamaya Burr.
North Carolina Central,McNeese,64,55,36,4,0,Foul on Dajuan Graf.
North Carolina Central,McNeese,64,55,36,4,0,Dajuan Graf Turnover.
North Carolina Central,McNeese,64,55,36,10,0,Foul on C.J. Wiggins.
North Carolina Central,McNeese,64,56,36,10,1,Jarren Greenwood made Free Throw.
North Carolina Central,McNeese,64,56,36,10,0,Jarren Greenwood missed Free Throw.
North Carolina Central,McNeese,64,56,36,10,0,Pablo Rivas Defensive Rebound.
North Carolina Central,McNeese,64,56,36,21,0,Foul on Jamaya Burr.
North Carolina Central,McNeese,65,56,36,21,1,C.J. Wiggins made Free Throw.
North Carolina Central,McNeese,66,56,36,21,1,C.J. Wiggins made Free Throw.
North Carolina Central,McNeese,66,58,36,31,1,Jamaya Burr made Layup.
North Carolina Central,McNeese,68,58,36,55,1,Patrick Cole made Layup.
North Carolina Central,McNeese,68,58,37,6,0,Kalob Ledoux missed Three Point Jumper.
North Carolina Central,McNeese,68,58,37,6,0,Del'Vin Dickerson Defensive Rebound.
North Carolina Central,McNeese,68,58,37,29,0,Foul on Patrick Cole.
North Carolina Central,McNeese,68,58,37,29,0,Patrick Cole Turnover.
North Carolina Central,McNeese,68,58,37,43,0,Jamaya Burr missed Jumper.
North Carolina Central,McNeese,68,58,37,43,0,Stephen Ugochukwu Offensive Rebound.
North Carolina Central,McNeese,68,58,37,46,0,Foul on Del'Vin Dickerson.
North Carolina Central,McNeese,68,59,37,46,1,Stephen Ugochukwu made Free Throw.
North Carolina Central,McNeese,68,60,37,46,1,Stephen Ugochukwu made Free Throw.
North Carolina Central,McNeese,68,60,37,47,0,Foul on Kalob Ledoux.
North Carolina Central,McNeese,69,60,37,47,1,Patrick Cole made Free Throw.
North Carolina Central,McNeese,70,60,37,47,1,Patrick Cole made Free Throw.
North Carolina Central,McNeese,70,60,37,55,0,Jamaya Burr missed Layup.
North Carolina Central,McNeese,70,60,37,55,0,Patrick Cole Defensive Rebound.
North Carolina Central,McNeese,70,60,38,4,0,Patrick Cole Turnover.
North Carolina Central,McNeese,70,60,38,5,0,James Harvey Steal.
