Away Team,Home Team,Away Score,Home Score,Minute,Second,isScoringPosession,Desc.
Lafayette,Boston University,2,0,0,29,1,Nathaniel Musters made Layup. Assisted by Joey Ptasinski.
Lafayette,Boston University,2,3,0,53,1,Nathan Dieudonne made Three Point Jumper. Assisted by D.J. Irving.
Lafayette,Boston University,5,3,1,11,1,Joey Ptasinski made Three Point Jumper. Assisted by Nathaniel Musters.
Lafayette,Boston University,5,5,1,38,1,Maurice Watson Jr. made Jumper.
Lafayette,Boston University,5,5,1,56,0,Nick Lindner Turnover.
Lafayette,Boston University,5,8,2,12,1,Maurice Watson Jr. made Three Point Jumper. Assisted by Dom Morris.
Lafayette,Boston University,5,8,2,26,0,Nathaniel Musters Turnover.
Lafayette,Boston University,5,8,2,27,0,D.J. Irving Steal.
Lafayette,Boston University,5,10,2,29,1,D.J. Irving made Layup.
Lafayette,Boston University,8,10,2,49,1,Bryce Scott made Three Point Jumper. Assisted by Nick Lindner.
Lafayette,Boston University,8,10,3,15,0,Maurice Watson Jr. missed Three Point Jumper.
Lafayette,Boston University,8,10,3,15,0,Nathaniel Musters Defensive Rebound.
Lafayette,Boston University,8,10,3,50,0,Nick Lindner missed Layup.
Lafayette,Boston University,8,10,3,50,0,Lafayette Offensive Rebound.
Lafayette,Boston University,8,10,3,53,0,Foul on D.J. Irving.
Lafayette,Boston University,8,10,4,13,0,Bryce Scott Turnover.
Lafayette,Boston University,8,10,4,14,0,John Papale Steal.
Lafayette,Boston University,8,12,4,18,1,Maurice Watson Jr. made Layup.
Lafayette,Boston University,8,12,4,18,0,Foul on Nick Lindner.
Lafayette,Boston University,8,12,4,18,0,Official TV Timeout
Lafayette,Boston University,8,13,4,18,1,Maurice Watson Jr. made Free Throw.
Lafayette,Boston University,8,13,4,36,0,Joey Ptasinski Turnover.
Lafayette,Boston University,8,13,4,46,0,D.J. Irving missed Three Point Jumper.
Lafayette,Boston University,8,13,4,46,0,John Papale Offensive Rebound.
Lafayette,Boston University,8,13,5,11,0,Maurice Watson Jr. missed Jumper.
Lafayette,Boston University,8,13,5,11,0,Nick Lindner Defensive Rebound.
Lafayette,Boston University,8,13,5,23,0,Dan Trist Turnover.
Lafayette,Boston University,8,13,5,24,0,Maurice Watson Jr. Steal.
Lafayette,Boston University,8,15,5,28,1,Malik Thomas made Layup. Assisted by Maurice Watson Jr..
Lafayette,Boston University,8,15,5,51,0,Seth Hinrichs missed Jumper.
Lafayette,Boston University,8,15,5,51,0,D.J. Irving Defensive Rebound.
Lafayette,Boston University,8,17,6,15,1,D.J. Irving made Jumper. Assisted by Justin Alston.
Lafayette,Boston University,8,17,6,38,0,Foul on Justin Alston.
Lafayette,Boston University,8,17,6,42,0,Dan Trist missed Layup.
Lafayette,Boston University,8,17,6,42,0,Malik Thomas Defensive Rebound.
Lafayette,Boston University,8,17,6,58,0,Foul on Justin Alston.
Lafayette,Boston University,8,17,6,58,0,Justin Alston Turnover.
Lafayette,Boston University,8,17,7,17,0,Joey Ptasinski missed Layup.
Lafayette,Boston University,8,17,7,17,0,Nathan Dieudonne Block.
Lafayette,Boston University,8,17,7,19,0,Lafayette Offensive Rebound.
Lafayette,Boston University,10,17,7,35,1,Nick Lindner made Jumper.
Lafayette,Boston University,10,17,7,47,0,Foul on Nathan Dieudonne.
Lafayette,Boston University,10,17,7,47,0,Nathan Dieudonne Turnover.
Lafayette,Boston University,10,17,7,53,0,Nick Lindner missed Jumper.
Lafayette,Boston University,10,17,7,53,0,Malik Thomas Defensive Rebound.
Lafayette,Boston University,10,17,7,58,0,Malik Thomas Turnover.
Lafayette,Boston University,10,17,8,0,0,Seth Hinrichs Steal.
Lafayette,Boston University,13,17,8,4,1,Seth Hinrichs made Three Point Jumper.
Lafayette,Boston University,13,17,8,25,0,D.J. Irving missed Jumper.
Lafayette,Boston University,13,17,8,25,0,Seth Hinrichs Defensive Rebound.
Lafayette,Boston University,13,17,8,45,0,Foul on Malik Thomas.
Lafayette,Boston University,13,17,8,45,0,Official TV Timeout
Lafayette,Boston University,13,17,9,6,0,Nick Lindner missed Jumper.
Lafayette,Boston University,13,17,9,6,0,Seth Hinrichs Offensive Rebound.
Lafayette,Boston University,13,17,9,7,0,Seth Hinrichs Turnover.
Lafayette,Boston University,13,17,9,20,0,Maurice Watson Jr. Turnover.
Lafayette,Boston University,13,17,9,39,0,Bryce Scott missed Three Point Jumper.
Lafayette,Boston University,13,17,9,39,0,Malik Thomas Defensive Rebound.
Lafayette,Boston University,13,19,9,48,1,Maurice Watson Jr. made Layup.
Lafayette,Boston University,13,19,10,4,0,Bryce Scott Turnover.
Lafayette,Boston University,13,19,10,19,0,Dom Morris missed Layup.
Lafayette,Boston University,13,19,10,19,0,Zach Rufer Defensive Rebound.
Lafayette,Boston University,13,19,10,31,0,Nick Lindner missed Three Point Jumper.
Lafayette,Boston University,13,19,10,31,0,Cedric Hankerson Defensive Rebound.
Lafayette,Boston University,13,22,10,39,1,Cedric Hankerson made Three Point Jumper. Assisted by Maurice Watson Jr..
Lafayette,Boston University,13,22,11,12,0,Seth Hinrichs missed Three Point Jumper.
Lafayette,Boston University,13,22,11,12,0,Travis Robinson Defensive Rebound.
Lafayette,Boston University,13,22,11,22,0,Malik Thomas Turnover.
Lafayette,Boston University,13,22,11,24,0,Nick Lindner Steal.
Lafayette,Boston University,15,22,11,26,1,Nick Lindner made Layup.
Lafayette,Boston University,15,24,11,54,1,Maurice Watson Jr. made Jumper.
Lafayette,Boston University,15,24,12,22,0,Dan Trist missed Jumper.
Lafayette,Boston University,15,24,12,22,0,Maurice Watson Jr. Defensive Rebound.
Lafayette,Boston University,15,27,12,29,1,Travis Robinson made Three Point Jumper. Assisted by Maurice Watson Jr..
Lafayette,Boston University,15,27,12,40,0,Lafayette  Timeout
Lafayette,Boston University,17,27,12,52,1,Dan Trist made Layup.
Lafayette,Boston University,17,27,13,7,0,Travis Robinson Turnover.
Lafayette,Boston University,17,27,13,7,0,Official TV Timeout
Lafayette,Boston University,19,27,13,25,1,Bryce Scott made Jumper.
Lafayette,Boston University,19,29,13,52,1,Cedric Hankerson made Jumper.
Lafayette,Boston University,19,29,14,6,0,Foul on Dom Morris.
Lafayette,Boston University,19,29,14,28,0,Dan Trist missed Jumper.
Lafayette,Boston University,19,29,14,28,0,Nathan Dieudonne Defensive Rebound.
Lafayette,Boston University,19,32,14,47,1,D.J. Irving made Three Point Jumper. Assisted by Cedric Hankerson.
Lafayette,Boston University,19,32,15,5,0,Seth Hinrichs missed Layup.
Lafayette,Boston University,19,32,15,5,0,Cedric Hankerson Defensive Rebound.
Lafayette,Boston University,19,32,15,16,0,D.J. Irving Turnover.
Lafayette,Boston University,19,32,15,17,0,Seth Hinrichs Steal.
Lafayette,Boston University,22,32,15,20,1,Seth Hinrichs made Three Point Jumper.
Lafayette,Boston University,22,32,15,46,0,Cedric Hankerson missed Layup.
Lafayette,Boston University,22,32,15,46,0,Cedric Hankerson Offensive Rebound.
Lafayette,Boston University,22,34,15,50,1,Cedric Hankerson made Layup.
Lafayette,Boston University,22,34,16,5,0,Seth Hinrichs missed Layup.
Lafayette,Boston University,22,34,16,5,0,Seth Hinrichs Offensive Rebound.
Lafayette,Boston University,22,34,16,13,0,Seth Hinrichs Turnover.
Lafayette,Boston University,22,34,16,13,0,Cedric Hankerson Steal.
Lafayette,Boston University,22,34,16,15,0,Nathan Dieudonne Turnover.
Lafayette,Boston University,22,34,16,15,0,Official TV Timeout
Lafayette,Boston University,22,34,16,33,0,Foul on Dan Trist.
Lafayette,Boston University,22,34,16,33,0,Dan Trist Turnover.
Lafayette,Boston University,22,36,16,41,1,D.J. Irving made Jumper.
Lafayette,Boston University,22,36,17,1,0,Zach Rufer missed Three Point Jumper.
Lafayette,Boston University,22,36,17,1,0,Nathaniel Musters Offensive Rebound.
Lafayette,Boston University,22,36,17,4,0,Nick Lindner missed Three Point Jumper.
Lafayette,Boston University,22,36,17,4,0,Maurice Watson Jr. Defensive Rebound.
Lafayette,Boston University,22,36,17,33,0,Maurice Watson Jr. missed Layup.
Lafayette,Boston University,22,36,17,33,0,Lafayette Defensive Rebound.
Lafayette,Boston University,24,36,17,46,1,Joey Ptasinski made Layup. Assisted by Seth Hinrichs.
Lafayette,Boston University,24,39,18,19,1,Nathan Dieudonne made Three Point Jumper. Assisted by Maurice Watson Jr..
Lafayette,Boston University,27,39,18,50,1,Bryce Scott made Three Point Jumper. Assisted by Nick Lindner.
Lafayette,Boston University,27,39,19,0,0,Boston Univ.  Timeout
Lafayette,Boston University,27,42,19,18,1,Maurice Watson Jr. made Three Point Jumper. Assisted by John Papale.
Lafayette,Boston University,27,42,19,36,0,Dan Trist Turnover.
Lafayette,Boston University,27,42,20,0,0,Maurice Watson Jr. missed Layup.
Lafayette,Boston University,27,42,20,0,0,Zach Rufer Defensive Rebound.
Lafayette,Boston University,27,42,20,0,0,End of 1st half
Lafayette,Boston University,27,42,20,13,0,Bryce Scott missed Three Point Jumper.
Lafayette,Boston University,27,42,20,13,0,Maurice Watson Jr. Defensive Rebound.
Lafayette,Boston University,27,44,20,40,1,Dom Morris made Layup. Assisted by D.J. Irving.
Lafayette,Boston University,27,44,21,1,0,Joey Ptasinski missed Three Point Jumper.
Lafayette,Boston University,27,44,21,1,0,Dom Morris Defensive Rebound.
Lafayette,Boston University,27,44,21,9,0,Nathan Dieudonne missed Three Point Jumper.
Lafayette,Boston University,27,44,21,9,0,Seth Hinrichs Defensive Rebound.
Lafayette,Boston University,27,44,21,45,0,Nick Lindner missed Layup.
Lafayette,Boston University,27,44,21,45,0,Maurice Watson Jr. Defensive Rebound.
Lafayette,Boston University,27,44,21,52,0,John Papale missed Three Point Jumper.
Lafayette,Boston University,27,44,21,52,0,Joey Ptasinski Defensive Rebound.
Lafayette,Boston University,29,44,22,7,1,Bryce Scott made Layup.
Lafayette,Boston University,29,44,22,22,0,Foul on Bryce Scott.
Lafayette,Boston University,29,46,22,40,1,Dom Morris made Layup. Assisted by Maurice Watson Jr..
Lafayette,Boston University,31,46,22,56,1,Seth Hinrichs made Layup.
Lafayette,Boston University,31,48,23,7,1,Maurice Watson Jr. made Jumper.
Lafayette,Boston University,31,48,23,26,0,Bryce Scott missed Three Point Jumper.
Lafayette,Boston University,31,48,23,26,0,Maurice Watson Jr. Defensive Rebound.
Lafayette,Boston University,31,50,23,38,1,Maurice Watson Jr. made Layup. Assisted by John Papale.
Lafayette,Boston University,31,50,23,42,0,Lafayette  Timeout
Lafayette,Boston University,31,50,23,42,0,Official TV Timeout
Lafayette,Boston University,31,50,23,54,0,Seth Hinrichs Turnover.
Lafayette,Boston University,31,50,23,55,0,Justin Alston Steal.
Lafayette,Boston University,31,52,24,8,1,Nathan Dieudonne made Dunk. Assisted by Maurice Watson Jr..
Lafayette,Boston University,31,52,24,20,0,Zach Rufer missed Three Point Jumper.
Lafayette,Boston University,31,52,24,20,0,Dan Trist Offensive Rebound.
Lafayette,Boston University,31,52,24,26,0,Foul on Nathan Dieudonne.
Lafayette,Boston University,31,52,24,26,0,Official TV Timeout
Lafayette,Boston University,32,52,24,26,1,Dan Trist made Free Throw.
Lafayette,Boston University,33,52,24,26,1,Dan Trist made Free Throw.
Lafayette,Boston University,33,54,24,35,1,D.J. Irving made Layup.
Lafayette,Boston University,33,54,25,15,0,Lafayette  Turnover.
Lafayette,Boston University,33,54,25,36,0,D.J. Irving missed Three Point Jumper.
Lafayette,Boston University,33,54,25,36,0,Justin Alston Offensive Rebound.
Lafayette,Boston University,33,56,25,42,1,Justin Alston made Two Point Tip Shot.
Lafayette,Boston University,33,56,26,0,0,Foul on Justin Alston.
Lafayette,Boston University,34,56,26,0,1,Dan Trist made Free Throw.
Lafayette,Boston University,35,56,26,0,1,Dan Trist made Free Throw.
Lafayette,Boston University,35,58,26,19,1,Dom Morris made Layup.
Lafayette,Boston University,35,58,26,44,0,Bryce Scott missed Three Point Jumper.
Lafayette,Boston University,35,58,26,44,0,Maurice Watson Jr. Defensive Rebound.
Lafayette,Boston University,35,58,26,54,0,Dom Morris Turnover.
Lafayette,Boston University,35,58,26,55,0,Nathaniel Musters Steal.
Lafayette,Boston University,35,58,26,58,0,Nathaniel Musters Turnover.
Lafayette,Boston University,35,58,26,59,0,Maurice Watson Jr. Steal.
Lafayette,Boston University,35,58,27,3,0,Dom Morris missed Layup.
Lafayette,Boston University,35,58,27,3,0,Nathaniel Musters Block.
Lafayette,Boston University,35,58,27,5,0,Lafayette Defensive Rebound.
Lafayette,Boston University,35,58,27,21,0,Nick Lindner missed Three Point Jumper.
Lafayette,Boston University,35,58,27,21,0,Seth Hinrichs Offensive Rebound.
Lafayette,Boston University,38,58,27,26,1,Zach Rufer made Three Point Jumper. Assisted by Nick Lindner.
Lafayette,Boston University,38,58,27,48,0,Malik Thomas missed Jumper.
Lafayette,Boston University,38,58,27,48,0,Travis Robinson Offensive Rebound.
Lafayette,Boston University,38,58,28,1,0,Travis Robinson Turnover.
Lafayette,Boston University,38,58,28,1,0,Official TV Timeout
Lafayette,Boston University,38,58,28,11,0,Zach Rufer missed Three Point Jumper.
Lafayette,Boston University,38,58,28,11,0,D.J. Irving Defensive Rebound.
Lafayette,Boston University,38,58,28,20,0,Foul on Dan Trist.
Lafayette,Boston University,38,58,28,25,0,Foul on Nick Lindner.
Lafayette,Boston University,38,58,28,25,0,Cedric Hankerson missed Free Throw.
Lafayette,Boston University,38,58,28,25,0,Boston Univ. Deadball Team Rebound.
Lafayette,Boston University,38,59,28,25,1,Cedric Hankerson made Free Throw.
Lafayette,Boston University,38,59,28,30,0,Nick Lindner Turnover.
Lafayette,Boston University,38,59,28,31,0,D.J. Irving Steal.
Lafayette,Boston University,38,61,28,33,1,D.J. Irving made Layup.
Lafayette,Boston University,38,61,28,56,0,Foul on Cedric Hankerson.
Lafayette,Boston University,39,61,28,56,1,Nick Lindner made Free Throw.
Lafayette,Boston University,39,61,28,56,0,Nick Lindner missed Free Throw.
Lafayette,Boston University,39,61,28,56,0,Malik Thomas Defensive Rebound.
Lafayette,Boston University,39,63,29,5,1,D.J. Irving made Jumper.
Lafayette,Boston University,39,63,29,25,0,Bryce Scott missed Jumper.
Lafayette,Boston University,39,63,29,25,0,Seth Hinrichs Offensive Rebound.
Lafayette,Boston University,41,63,29,29,1,Seth Hinrichs made Layup.
Lafayette,Boston University,41,63,29,45,0,Foul on Seth Hinrichs.
Lafayette,Boston University,41,65,29,52,1,D.J. Irving made Layup.
Lafayette,Boston University,44,65,30,9,1,Bryce Scott made Three Point Jumper. Assisted by Dan Trist.
Lafayette,Boston University,44,65,30,32,0,Cedric Hankerson missed Three Point Jumper.
Lafayette,Boston University,44,65,30,32,0,Malik Thomas Offensive Rebound.
Lafayette,Boston University,44,67,30,38,1,Malik Thomas made Two Point Tip Shot.
Lafayette,Boston University,44,67,30,46,0,Bryce Scott missed Three Point Jumper.
Lafayette,Boston University,44,67,30,46,0,Cedric Hankerson Defensive Rebound.
Lafayette,Boston University,44,69,30,55,1,Dom Morris made Layup. Assisted by D.J. Irving.
Lafayette,Boston University,44,69,30,55,0,Foul on Dan Trist.
Lafayette,Boston University,44,70,30,55,1,Dom Morris made Free Throw.
Lafayette,Boston University,46,70,31,3,1,Michael Hoffman made Layup.
Lafayette,Boston University,46,73,31,22,1,Travis Robinson made Three Point Jumper. Assisted by Dom Morris.
Lafayette,Boston University,48,73,31,48,1,Michael Hoffman made Layup. Assisted by Zach Rufer.
Lafayette,Boston University,48,73,31,48,0,Foul on Dom Morris.
Lafayette,Boston University,49,73,31,48,1,Michael Hoffman made Free Throw.
Lafayette,Boston University,49,73,32,2,0,Maurice Watson Jr. missed Three Point Jumper.
Lafayette,Boston University,49,73,32,2,0,Jack Detmer Defensive Rebound.
Lafayette,Boston University,49,73,32,33,0,Alan Flannigan missed Jumper.
Lafayette,Boston University,49,73,32,33,0,Maurice Watson Jr. Defensive Rebound.
Lafayette,Boston University,49,75,32,40,1,Justin Alston made Layup. Assisted by Maurice Watson Jr..
Lafayette,Boston University,49,75,32,40,0,Foul on Les Smith.
Lafayette,Boston University,49,75,32,40,0,Official TV Timeout
Lafayette,Boston University,49,76,32,40,1,Justin Alston made Free Throw.
Lafayette,Boston University,49,76,32,53,0,Les Smith Turnover.
Lafayette,Boston University,49,76,32,54,0,Maurice Watson Jr. Steal.
Lafayette,Boston University,49,78,32,57,1,Justin Alston made Dunk. Assisted by Maurice Watson Jr..
Lafayette,Boston University,52,78,33,25,1,Seth Hinrichs made Three Point Jumper. Assisted by Les Smith.
Lafayette,Boston University,52,78,33,41,0,Foul on Les Smith.
Lafayette,Boston University,52,79,33,41,1,Nathan Dieudonne made Free Throw.
Lafayette,Boston University,52,79,33,41,0,Nathan Dieudonne missed Free Throw.
Lafayette,Boston University,52,79,33,41,0,Dan Trist Defensive Rebound.
Lafayette,Boston University,52,79,33,51,0,Nick Lindner missed Jumper.
Lafayette,Boston University,52,79,33,51,0,Seth Hinrichs Offensive Rebound.
Lafayette,Boston University,52,79,33,55,0,Seth Hinrichs missed Layup.
Lafayette,Boston University,52,79,33,55,0,Justin Alston Defensive Rebound.
Lafayette,Boston University,52,79,33,58,0,Maurice Watson Jr. Turnover.
Lafayette,Boston University,52,79,33,59,0,Bryce Scott Steal.
Lafayette,Boston University,52,79,34,28,0,Nick Lindner Turnover.
Lafayette,Boston University,52,79,34,30,0,Maurice Watson Jr. Steal.
Lafayette,Boston University,52,79,34,33,0,Travis Robinson missed Three Point Jumper.
Lafayette,Boston University,52,79,34,33,0,Seth Hinrichs Defensive Rebound.
Lafayette,Boston University,52,79,34,48,0,Dan Trist missed Layup.
Lafayette,Boston University,52,79,34,48,0,Justin Alston Defensive Rebound.
Lafayette,Boston University,52,79,34,57,0,Boston Univ.  Timeout
Lafayette,Boston University,52,79,35,9,0,Dylan Haines Turnover.
Lafayette,Boston University,52,79,35,11,0,Seth Hinrichs Steal.
Lafayette,Boston University,54,79,35,19,1,Dan Trist made Layup. Assisted by Bryce Scott.
Lafayette,Boston University,54,81,35,35,1,Travis Robinson made Dunk. Assisted by Nathan Dieudonne.
Lafayette,Boston University,54,81,35,44,0,Dan Trist missed Jumper.
Lafayette,Boston University,54,81,35,44,0,Dylan Brossman Defensive Rebound.
Lafayette,Boston University,54,81,36,5,0,Dylan Haines missed Three Point Jumper.
Lafayette,Boston University,54,81,36,5,0,Travis Robinson Offensive Rebound.
Lafayette,Boston University,54,83,36,13,1,Maurice Watson Jr. made Layup.
Lafayette,Boston University,54,83,36,27,0,Bryce Scott missed Three Point Jumper.
Lafayette,Boston University,54,83,36,27,0,Nathan Dieudonne Defensive Rebound.
Lafayette,Boston University,54,83,36,40,0,Dylan Brossman missed Three Point Jumper.
Lafayette,Boston University,54,83,36,40,0,Dan Trist Defensive Rebound.
Lafayette,Boston University,54,83,36,50,0,Joey Ptasinski missed Three Point Jumper.
Lafayette,Boston University,54,83,36,50,0,Lafayette Offensive Rebound.
Lafayette,Boston University,54,83,36,51,0,Foul on Maurice Watson Jr..
Lafayette,Boston University,54,83,36,52,0,Official TV Timeout
Lafayette,Boston University,54,83,37,7,0,Seth Hinrichs missed Three Point Jumper.
Lafayette,Boston University,54,83,37,7,0,Dylan Haines Defensive Rebound.
Lafayette,Boston University,54,86,37,26,1,Travis Robinson made Three Point Jumper. Assisted by Dylan Haines.
Lafayette,Boston University,54,86,37,41,0,Foul on Braiten Madrigal.
Lafayette,Boston University,54,86,37,46,0,Jake Newman Turnover.
Lafayette,Boston University,54,86,37,48,0,Dylan Brossman Steal.
Lafayette,Boston University,54,86,37,50,0,Foul on Alan Flannigan.
Lafayette,Boston University,54,87,37,50,1,Dylan Brossman made Free Throw.
Lafayette,Boston University,54,88,37,50,1,Dylan Brossman made Free Throw.
Lafayette,Boston University,54,88,38,21,0,Michael Hoffman missed Jumper.
Lafayette,Boston University,54,88,38,21,0,Travis Robinson Defensive Rebound.
Lafayette,Boston University,54,88,38,41,0,Braiten Madrigal missed Three Point Jumper.
Lafayette,Boston University,54,88,38,41,0,Nick Lindner Defensive Rebound.
Lafayette,Boston University,54,88,38,55,0,Alan Flannigan missed Jumper.
Lafayette,Boston University,54,88,38,55,0,Travis Robinson Defensive Rebound.
Lafayette,Boston University,54,91,39,7,1,Travis Robinson made Three Point Jumper. Assisted by Cameron Curry.
Lafayette,Boston University,54,91,39,27,0,Billy Murphy missed Jumper.
Lafayette,Boston University,54,91,39,27,0,Dylan Haines Defensive Rebound.
Lafayette,Boston University,54,91,40,0,0,End of Game
