Away Team,Home Team,Away Score,Home Score,Minute,Second,isScoringPosession,Desc.
Northern Colorado,Mississippi State,0,0,0,0,0,Jump Ball won by Mississippi St
Northern Colorado,Mississippi State,0,0,0,13,0,I.J. Ready missed Three Point Jumper.
Northern Colorado,Mississippi State,0,0,0,13,0,Ibrahim Sylla Defensive Rebound.
Northern Colorado,Mississippi State,0,0,0,15,0,Foul on Gavin Ware.
Northern Colorado,Mississippi State,3,0,0,34,1,Dallas Anglin made Three Point Jumper. Assisted by Miles Seward.
Northern Colorado,Mississippi State,3,0,0,45,0,Travis Daniels Turnover.
Northern Colorado,Mississippi State,3,0,0,45,0,Ibrahim Sylla Steal.
Northern Colorado,Mississippi State,3,0,0,51,0,Foul on Travis Daniels.
Northern Colorado,Mississippi State,4,0,0,51,1,Dallas Anglin made Free Throw.
Northern Colorado,Mississippi State,5,0,0,51,1,Dallas Anglin made Free Throw.
Northern Colorado,Mississippi State,5,0,1,0,0,Craig Sword missed Three Point Jumper.
Northern Colorado,Mississippi State,5,0,1,0,0,Gavin Ware Offensive Rebound.
Northern Colorado,Mississippi State,5,2,1,5,1,Gavin Ware made Layup.
Northern Colorado,Mississippi State,5,2,1,23,0,Tanner Morgan missed Jumper.
Northern Colorado,Mississippi State,5,2,1,23,0,Gavin Ware Block.
Northern Colorado,Mississippi State,5,2,1,23,0,Gavin Ware Defensive Rebound.
Northern Colorado,Mississippi State,5,2,1,31,0,Malik Newman missed Three Point Jumper.
Northern Colorado,Mississippi State,5,2,1,31,0,Travis Daniels Offensive Rebound.
Northern Colorado,Mississippi State,5,4,1,36,1,Travis Daniels made Layup.
Northern Colorado,Mississippi State,5,4,1,56,0,Dallas Anglin missed Three Point Jumper.
Northern Colorado,Mississippi State,5,4,1,56,0,Malik Newman Defensive Rebound.
Northern Colorado,Mississippi State,5,4,2,10,0,Gavin Ware missed Jumper.
Northern Colorado,Mississippi State,5,4,2,10,0,Ibrahim Sylla Defensive Rebound.
Northern Colorado,Mississippi State,5,4,2,22,0,Ibrahim Sylla missed Dunk.
Northern Colorado,Mississippi State,5,4,2,22,0,Travis Daniels Block.
Northern Colorado,Mississippi State,5,4,2,22,0,Craig Sword Defensive Rebound.
Northern Colorado,Mississippi State,5,4,2,30,0,Foul on Miles Seward.
Northern Colorado,Mississippi State,5,5,2,30,1,Malik Newman made Free Throw.
Northern Colorado,Mississippi State,5,6,2,30,1,Malik Newman made Free Throw.
Northern Colorado,Mississippi State,7,6,2,50,1,Tanner Morgan made Layup. Assisted by Jordan Davis.
Northern Colorado,Mississippi State,7,6,2,56,0,Gavin Ware Turnover.
Northern Colorado,Mississippi State,7,6,2,56,0,Jordan Davis Steal.
Northern Colorado,Mississippi State,7,6,3,6,0,Dallas Anglin Turnover.
Northern Colorado,Mississippi State,7,6,3,6,0,I.J. Ready Steal.
Northern Colorado,Mississippi State,7,6,3,12,0,Foul on Miles Seward.
Northern Colorado,Mississippi State,7,7,3,12,1,Craig Sword made Free Throw.
Northern Colorado,Mississippi State,7,8,3,12,1,Craig Sword made Free Throw.
Northern Colorado,Mississippi State,7,8,3,36,0,Jamal Evans missed Layup.
Northern Colorado,Mississippi State,7,8,3,36,0,Jamal Evans Offensive Rebound.
Northern Colorado,Mississippi State,9,8,3,41,1,Jamal Evans made Layup.
Northern Colorado,Mississippi State,9,10,3,45,1,Gavin Ware made Dunk. Assisted by I.J. Ready.
Northern Colorado,Mississippi State,9,10,4,6,0,Jamal Evans missed Jumper.
Northern Colorado,Mississippi State,9,10,4,6,0,I.J. Ready Defensive Rebound.
Northern Colorado,Mississippi State,9,13,4,12,1,Malik Newman made Three Point Jumper. Assisted by I.J. Ready.
Northern Colorado,Mississippi State,9,13,4,32,0,Official TV Timeout
Northern Colorado,Mississippi State,9,13,4,32,0,Foul on Johnny Zuppardo.
Northern Colorado,Mississippi State,9,13,4,47,0,Jordan Wilson missed Three Point Jumper.
Northern Colorado,Mississippi State,9,13,4,47,0,Mississippi St Defensive Rebound.
Northern Colorado,Mississippi State,9,13,5,3,0,Malik Newman Offensive Rebound.
Northern Colorado,Mississippi State,9,13,5,3,0,Malik Newman missed Jumper.
Northern Colorado,Mississippi State,9,16,5,11,1,Malik Newman made Three Point Jumper. Assisted by I.J. Ready.
Northern Colorado,Mississippi State,9,16,5,28,0,Anthony Johnson Turnover.
Northern Colorado,Mississippi State,9,16,5,37,0,Malik Newman Turnover.
Northern Colorado,Mississippi State,12,16,5,53,1,Anthony Johnson made Three Point Jumper. Assisted by Jordan Wilson.
Northern Colorado,Mississippi State,12,18,6,13,1,Johnny Zuppardo made Jumper. Assisted by Craig Sword.
Northern Colorado,Mississippi State,14,18,6,34,1,Jeremy Verhagen made Jumper.
Northern Colorado,Mississippi State,14,18,6,54,0,Foul on Anthony Johnson.
Northern Colorado,Mississippi State,14,20,6,54,1,Gavin Ware made Jumper. Assisted by I.J. Ready.
Northern Colorado,Mississippi State,14,20,7,24,0,Anthony Johnson Turnover.
Northern Colorado,Mississippi State,14,22,7,30,1,Gavin Ware made Layup. Assisted by Craig Sword.
Northern Colorado,Mississippi State,16,22,7,53,1,Jordan Davis made Jumper.
Northern Colorado,Mississippi State,16,22,7,53,0,Foul on Quinndary Weatherspoon.
Northern Colorado,Mississippi State,17,22,7,53,1,Jordan Davis made Free Throw.
Northern Colorado,Mississippi State,17,22,8,7,0,Foul on Spencer Mathis.
Northern Colorado,Mississippi State,17,22,8,7,0,Official TV Timeout
Northern Colorado,Mississippi State,17,23,8,7,1,Fred Thomas made Free Throw.
Northern Colorado,Mississippi State,17,24,8,7,1,Fred Thomas made Free Throw.
Northern Colorado,Mississippi State,17,24,8,25,0,Jordan Wilson missed Jumper.
Northern Colorado,Mississippi State,17,24,8,25,0,Quinndary Weatherspoon Defensive Rebound.
Northern Colorado,Mississippi State,17,24,8,34,0,Foul on Jordan Davis.
Northern Colorado,Mississippi State,17,24,9,3,0,Foul on Jordan Davis.
Northern Colorado,Mississippi State,17,25,9,3,1,Travis Daniels made Free Throw.
Northern Colorado,Mississippi State,17,26,9,3,1,Travis Daniels made Free Throw.
Northern Colorado,Mississippi State,17,26,9,17,0,Jamal Evans missed Jumper.
Northern Colorado,Mississippi State,17,26,9,17,0,Mississippi St Deadball Team Rebound.
Northern Colorado,Mississippi State,17,26,9,40,0,Aric Holman missed Jumper.
Northern Colorado,Mississippi State,17,26,9,40,0,Jamal Evans Block.
Northern Colorado,Mississippi State,17,26,9,40,0,Dallas Anglin Defensive Rebound.
Northern Colorado,Mississippi State,17,26,9,43,0,Foul on Malik Newman.
Northern Colorado,Mississippi State,17,26,9,54,0,Jordan Wilson missed Jumper.
Northern Colorado,Mississippi State,17,26,9,54,0,Ibrahim Sylla Offensive Rebound.
Northern Colorado,Mississippi State,19,26,9,54,1,Ibrahim Sylla made Two Point Tip Shot.
Northern Colorado,Mississippi State,19,26,10,15,0,Craig Sword missed Jumper.
Northern Colorado,Mississippi State,19,26,10,15,0,Northern Colorado Defensive Rebound.
Northern Colorado,Mississippi State,19,26,10,37,0,Foul on Fred Thomas.
Northern Colorado,Mississippi State,22,26,10,45,1,Jordan Wilson made Three Point Jumper.
Northern Colorado,Mississippi State,22,29,10,51,1,Fred Thomas made Three Point Jumper. Assisted by Malik Newman.
Northern Colorado,Mississippi State,22,29,11,5,0,Tanner Morgan Turnover.
Northern Colorado,Mississippi State,22,29,11,5,0,Foul on Tanner Morgan.
Northern Colorado,Mississippi State,22,32,11,10,1,Fred Thomas made Three Point Jumper. Assisted by Gavin Ware.
Northern Colorado,Mississippi State,24,32,11,41,1,Jordan Wilson made Jumper.
Northern Colorado,Mississippi State,24,32,11,57,0,I.J. Ready missed Three Point Jumper.
Northern Colorado,Mississippi State,24,32,11,57,0,Jordan Wilson Defensive Rebound.
Northern Colorado,Mississippi State,24,32,12,6,0,Dallas Anglin missed Three Point Jumper.
Northern Colorado,Mississippi State,24,32,12,6,0,Gavin Ware Defensive Rebound.
Northern Colorado,Mississippi State,24,32,12,13,0,Malik Newman missed Three Point Jumper.
Northern Colorado,Mississippi State,24,32,12,13,0,Ibrahim Sylla Defensive Rebound.
Northern Colorado,Mississippi State,24,32,12,29,0,Jordan Wilson Turnover.
Northern Colorado,Mississippi State,24,32,12,29,0,Gavin Ware Steal.
Northern Colorado,Mississippi State,24,32,12,45,0,Foul on Miles Seward.
Northern Colorado,Mississippi State,24,32,12,45,0,Official TV Timeout
Northern Colorado,Mississippi State,24,33,12,45,1,Fred Thomas made Free Throw.
Northern Colorado,Mississippi State,24,33,12,45,0,Fred Thomas missed Free Throw.
Northern Colorado,Mississippi State,24,33,12,45,0,Dallas Anglin Defensive Rebound.
Northern Colorado,Mississippi State,24,33,12,57,0,Dallas Anglin Turnover.
Northern Colorado,Mississippi State,24,33,12,57,0,Malik Newman Steal.
Northern Colorado,Mississippi State,24,35,13,1,1,Quinndary Weatherspoon made Dunk. Assisted by Malik Newman.
Northern Colorado,Mississippi State,24,35,13,32,0,Anthony Johnson missed Three Point Jumper.
Northern Colorado,Mississippi State,24,35,13,32,0,Mississippi St Defensive Rebound.
Northern Colorado,Mississippi State,24,35,13,58,0,Fred Thomas missed Three Point Jumper.
Northern Colorado,Mississippi State,24,35,13,58,0,Jordan Davis Defensive Rebound.
Northern Colorado,Mississippi State,24,35,14,14,0,Jordan Davis missed Layup.
Northern Colorado,Mississippi State,24,35,14,14,0,Tanner Morgan Offensive Rebound.
Northern Colorado,Mississippi State,26,35,14,20,1,Tanner Morgan made Layup.
Northern Colorado,Mississippi State,26,37,14,29,1,Gavin Ware made Layup. Assisted by I.J. Ready.
Northern Colorado,Mississippi State,26,37,14,48,0,Dallas Anglin missed Jumper.
Northern Colorado,Mississippi State,26,37,14,48,0,Gavin Ware Defensive Rebound.
Northern Colorado,Mississippi State,26,37,14,50,0,Foul on Gavin Ware.
Northern Colorado,Mississippi State,26,37,14,50,0,Gavin Ware Turnover.
Northern Colorado,Mississippi State,26,37,15,11,0,Jeremy Verhagen Turnover.
Northern Colorado,Mississippi State,26,37,15,11,0,Craig Sword Steal.
Northern Colorado,Mississippi State,26,39,15,18,1,Quinndary Weatherspoon made Layup. Assisted by Craig Sword.
Northern Colorado,Mississippi State,26,39,15,39,0,Jordan Davis Turnover.
Northern Colorado,Mississippi State,26,39,15,39,0,Johnny Zuppardo Steal.
Northern Colorado,Mississippi State,26,39,15,55,0,Quinndary Weatherspoon Turnover.
Northern Colorado,Mississippi State,26,39,15,55,0,Dallas Anglin Steal.
Northern Colorado,Mississippi State,28,39,15,59,1,Dallas Anglin made Dunk.
Northern Colorado,Mississippi State,28,39,16,21,0,Foul on Craig Sword.
Northern Colorado,Mississippi State,28,39,16,21,0,Craig Sword Turnover.
Northern Colorado,Mississippi State,28,39,16,21,0,Official TV Timeout
Northern Colorado,Mississippi State,28,39,16,40,0,Ibrahim Sylla missed Jumper.
Northern Colorado,Mississippi State,28,39,16,40,0,Jordan Davis Offensive Rebound.
Northern Colorado,Mississippi State,28,39,16,40,0,Foul on Fred Thomas.
Northern Colorado,Mississippi State,28,39,16,40,0,Jordan Davis missed Free Throw.
Northern Colorado,Mississippi State,28,39,16,40,0,Craig Sword Defensive Rebound.
Northern Colorado,Mississippi State,28,39,16,52,0,Foul on Jordan Davis.
Northern Colorado,Mississippi State,28,39,16,52,0,Craig Sword missed Free Throw.
Northern Colorado,Mississippi State,28,39,16,52,0,Ibrahim Sylla Defensive Rebound.
Northern Colorado,Mississippi State,28,39,17,8,0,Jordan Wilson Turnover.
Northern Colorado,Mississippi State,28,39,17,8,0,Craig Sword Steal.
Northern Colorado,Mississippi State,28,41,17,18,1,Quinndary Weatherspoon made Layup.
Northern Colorado,Mississippi State,28,41,17,33,0,Foul on Travis Daniels.
Northern Colorado,Mississippi State,28,41,17,33,0,Ibrahim Sylla missed Free Throw.
Northern Colorado,Mississippi State,28,41,17,33,0,Northern Colorado Deadball Team Rebound.
Northern Colorado,Mississippi State,29,41,17,33,1,Ibrahim Sylla made Free Throw.
Northern Colorado,Mississippi State,29,43,17,55,1,Malik Newman made Jumper.
Northern Colorado,Mississippi State,29,43,18,9,0,Foul on Craig Sword.
Northern Colorado,Mississippi State,29,43,18,9,0,Dallas Anglin missed Free Throw.
Northern Colorado,Mississippi State,29,43,18,9,0,Northern Colorado Deadball Team Rebound.
Northern Colorado,Mississippi State,30,43,18,9,1,Dallas Anglin made Free Throw.
Northern Colorado,Mississippi State,31,43,18,9,1,Dallas Anglin made Free Throw.
Northern Colorado,Mississippi State,31,45,18,33,1,Quinndary Weatherspoon made Layup.
Northern Colorado,Mississippi State,34,45,18,40,1,Anthony Johnson made Three Point Jumper.
Northern Colorado,Mississippi State,34,45,19,6,0,Malik Newman missed Three Point Jumper.
Northern Colorado,Mississippi State,34,45,19,6,0,Dallas Anglin Defensive Rebound.
Northern Colorado,Mississippi State,34,45,19,16,0,Dallas Anglin missed Jumper.
Northern Colorado,Mississippi State,34,45,19,16,0,Malik Newman Defensive Rebound.
Northern Colorado,Mississippi State,34,47,19,21,1,I.J. Ready made Layup. Assisted by Quinndary Weatherspoon.
Northern Colorado,Mississippi State,34,47,19,44,0,Anthony Johnson Turnover.
Northern Colorado,Mississippi State,34,47,19,48,0,Mississippi St  Timeout
Northern Colorado,Mississippi State,34,49,19,53,1,I.J. Ready made Layup.
Northern Colorado,Mississippi State,34,49,20,0,0,End of 1st half
Northern Colorado,Mississippi State,34,49,20,0,0,Jump Ball won by Northern Colorado
Northern Colorado,Mississippi State,36,49,20,17,1,Ibrahim Sylla made Layup.
Northern Colorado,Mississippi State,36,49,20,30,0,Foul on Ibrahim Sylla.
Northern Colorado,Mississippi State,36,49,20,30,0,Craig Sword missed Free Throw.
Northern Colorado,Mississippi State,36,49,20,30,0,Mississippi St Deadball Team Rebound.
Northern Colorado,Mississippi State,36,49,20,30,0,Craig Sword missed Free Throw.
Northern Colorado,Mississippi State,36,49,20,30,0,Tanner Morgan Defensive Rebound.
Northern Colorado,Mississippi State,36,49,20,36,0,Dallas Anglin missed Layup.
Northern Colorado,Mississippi State,36,49,20,36,0,Gavin Ware Defensive Rebound.
Northern Colorado,Mississippi State,36,51,20,40,1,Malik Newman made Jumper. Assisted by I.J. Ready.
Northern Colorado,Mississippi State,39,51,21,1,1,Jordan Davis made Three Point Jumper. Assisted by Tanner Morgan.
Northern Colorado,Mississippi State,39,51,21,22,0,Foul on Tanner Morgan.
Northern Colorado,Mississippi State,39,52,21,22,1,Malik Newman made Free Throw.
Northern Colorado,Mississippi State,39,53,21,22,1,Malik Newman made Free Throw.
Northern Colorado,Mississippi State,39,53,21,39,0,Miles Seward missed Three Point Jumper.
Northern Colorado,Mississippi State,39,53,21,39,0,Miles Seward Offensive Rebound.
Northern Colorado,Mississippi State,39,53,21,43,0,Miles Seward Turnover.
Northern Colorado,Mississippi State,39,53,21,43,0,Gavin Ware Steal.
Northern Colorado,Mississippi State,39,56,21,48,1,Malik Newman made Three Point Jumper. Assisted by I.J. Ready.
Northern Colorado,Mississippi State,39,56,22,9,0,Tanner Morgan missed Layup.
Northern Colorado,Mississippi State,39,56,22,9,0,Gavin Ware Block.
Northern Colorado,Mississippi State,39,56,22,9,0,Mississippi St Defensive Rebound.
Northern Colorado,Mississippi State,39,59,22,27,1,Malik Newman made Three Point Jumper. Assisted by I.J. Ready.
Northern Colorado,Mississippi State,41,59,22,51,1,Jordan Davis made Layup.
Northern Colorado,Mississippi State,41,59,23,1,0,Malik Newman missed Three Point Jumper.
Northern Colorado,Mississippi State,41,59,23,1,0,Gavin Ware Offensive Rebound.
Northern Colorado,Mississippi State,41,59,23,6,0,Gavin Ware Turnover.
Northern Colorado,Mississippi State,41,59,23,6,0,Jordan Davis Steal.
Northern Colorado,Mississippi State,41,59,23,19,0,Foul on Craig Sword.
Northern Colorado,Mississippi State,41,59,23,27,0,Foul on Travis Daniels.
Northern Colorado,Mississippi State,41,59,23,50,0,Dallas Anglin Turnover.
Northern Colorado,Mississippi State,41,59,23,50,0,Quinndary Weatherspoon Steal.
Northern Colorado,Mississippi State,41,59,24,2,0,Fred Thomas missed Three Point Jumper.
Northern Colorado,Mississippi State,41,59,24,2,0,Tanner Morgan Defensive Rebound.
Northern Colorado,Mississippi State,41,59,24,7,0,Northern Colorado  Timeout
Northern Colorado,Mississippi State,43,59,24,23,1,Miles Seward made Jumper.
Northern Colorado,Mississippi State,43,61,24,41,1,Gavin Ware made Dunk. Assisted by I.J. Ready.
Northern Colorado,Mississippi State,45,61,25,11,1,Dallas Anglin made Layup.
Northern Colorado,Mississippi State,45,63,25,23,1,Gavin Ware made Dunk. Assisted by I.J. Ready.
Northern Colorado,Mississippi State,45,63,25,37,0,Dallas Anglin missed Three Point Jumper.
Northern Colorado,Mississippi State,45,63,25,37,0,Malik Newman Defensive Rebound.
Northern Colorado,Mississippi State,45,63,25,48,0,Malik Newman Turnover.
Northern Colorado,Mississippi State,45,63,25,48,0,Official TV Timeout
Northern Colorado,Mississippi State,45,63,26,5,0,Foul on I.J. Ready.
Northern Colorado,Mississippi State,45,63,26,6,0,Dallas Anglin Turnover.
Northern Colorado,Mississippi State,45,65,26,20,1,Gavin Ware made Layup.
Northern Colorado,Mississippi State,48,65,26,39,1,Anthony Johnson made Three Point Jumper. Assisted by Dallas Anglin.
Northern Colorado,Mississippi State,48,65,27,10,0,Gavin Ware missed Layup.
Northern Colorado,Mississippi State,48,65,27,10,0,Jamal Evans Defensive Rebound.
Northern Colorado,Mississippi State,48,65,27,31,0,Dallas Anglin missed Jumper.
Northern Colorado,Mississippi State,48,65,27,31,0,Craig Sword Block.
Northern Colorado,Mississippi State,48,65,27,31,0,Johnny Zuppardo Defensive Rebound.
Northern Colorado,Mississippi State,48,65,27,44,0,Foul on Jamal Evans.
Northern Colorado,Mississippi State,48,65,27,52,0,Foul on Jordan Davis.
Northern Colorado,Mississippi State,48,68,28,5,1,Johnny Zuppardo made Three Point Jumper. Assisted by Craig Sword.
Northern Colorado,Mississippi State,48,68,28,25,0,Ibrahim Sylla Turnover.
Northern Colorado,Mississippi State,48,68,28,25,0,Quinndary Weatherspoon Steal.
Northern Colorado,Mississippi State,48,68,28,28,0,Malik Newman Turnover.
Northern Colorado,Mississippi State,48,68,28,28,0,Official TV Timeout
Northern Colorado,Mississippi State,48,68,28,41,0,Ibrahim Sylla Turnover.
Northern Colorado,Mississippi State,48,68,28,41,0,Craig Sword Steal.
Northern Colorado,Mississippi State,48,68,29,5,0,Foul on Ibrahim Sylla.
Northern Colorado,Mississippi State,48,69,29,5,1,Quinndary Weatherspoon made Free Throw.
Northern Colorado,Mississippi State,48,70,29,5,1,Quinndary Weatherspoon made Free Throw.
Northern Colorado,Mississippi State,48,70,29,19,0,Ibrahim Sylla missed Jumper.
Northern Colorado,Mississippi State,48,70,29,19,0,Craig Sword Defensive Rebound.
Northern Colorado,Mississippi State,48,72,29,34,1,Fred Thomas made Layup.
Northern Colorado,Mississippi State,50,72,30,0,1,Anthony Johnson made Jumper.
Northern Colorado,Mississippi State,50,74,30,11,1,Craig Sword made Dunk.
Northern Colorado,Mississippi State,50,74,30,26,0,Anthony Johnson missed Three Point Jumper.
Northern Colorado,Mississippi State,50,74,30,26,0,Johnny Zuppardo Defensive Rebound.
Northern Colorado,Mississippi State,50,74,30,38,0,Fred Thomas missed Three Point Jumper.
Northern Colorado,Mississippi State,50,74,30,38,0,Jordan Davis Defensive Rebound.
Northern Colorado,Mississippi State,50,74,30,46,0,Ibrahim Sylla Turnover.
Northern Colorado,Mississippi State,50,74,30,46,0,Foul on Ibrahim Sylla.
Northern Colorado,Mississippi State,50,74,30,54,0,Foul on Aric Holman.
Northern Colorado,Mississippi State,50,74,30,54,0,Aric Holman Turnover.
Northern Colorado,Mississippi State,50,74,31,6,0,Jordan Wilson missed Three Point Jumper.
Northern Colorado,Mississippi State,50,74,31,6,0,Miles Seward Offensive Rebound.
Northern Colorado,Mississippi State,50,74,31,13,0,Miles Seward Turnover.
Northern Colorado,Mississippi State,50,74,31,13,0,Gavin Ware Steal.
Northern Colorado,Mississippi State,50,74,31,31,0,Foul on Spencer Mathis.
Northern Colorado,Mississippi State,50,75,31,31,1,I.J. Ready made Free Throw.
Northern Colorado,Mississippi State,50,76,31,31,1,I.J. Ready made Free Throw.
Northern Colorado,Mississippi State,50,76,31,51,0,Foul on Aric Holman.
Northern Colorado,Mississippi State,50,76,31,51,0,Jeremy Verhagen missed Free Throw.
Northern Colorado,Mississippi State,50,76,31,51,0,Northern Colorado Deadball Team Rebound.
Northern Colorado,Mississippi State,51,76,31,51,1,Jeremy Verhagen made Free Throw.
Northern Colorado,Mississippi State,51,76,32,12,0,Foul on Miles Seward.
Northern Colorado,Mississippi State,51,76,32,12,0,Official TV Timeout
Northern Colorado,Mississippi State,51,76,32,12,0,Gavin Ware missed Free Throw.
Northern Colorado,Mississippi State,51,76,32,12,0,Mississippi St Deadball Team Rebound.
Northern Colorado,Mississippi State,51,77,32,12,1,Gavin Ware made Free Throw.
Northern Colorado,Mississippi State,51,77,32,33,0,Anthony Johnson missed Three Point Jumper.
Northern Colorado,Mississippi State,51,77,32,33,0,Aric Holman Defensive Rebound.
Northern Colorado,Mississippi State,51,79,32,42,1,I.J. Ready made Layup.
Northern Colorado,Mississippi State,53,79,33,2,1,Jordan Wilson made Jumper.
Northern Colorado,Mississippi State,53,79,33,19,0,I.J. Ready missed Three Point Jumper.
Northern Colorado,Mississippi State,53,79,33,19,0,Anthony Johnson Defensive Rebound.
Northern Colorado,Mississippi State,55,79,33,34,1,Jordan Wilson made Jumper.
Northern Colorado,Mississippi State,55,81,34,7,1,Aric Holman made Dunk. Assisted by I.J. Ready.
Northern Colorado,Mississippi State,57,81,34,32,1,Jordan Wilson made Jumper.
Northern Colorado,Mississippi State,57,81,34,46,0,Mississippi St  Timeout
Northern Colorado,Mississippi State,57,81,35,2,0,Craig Sword missed Jumper.
Northern Colorado,Mississippi State,57,81,35,2,0,Travis Daniels Offensive Rebound.
Northern Colorado,Mississippi State,57,81,35,9,0,Foul on Tanner Morgan.
Northern Colorado,Mississippi State,57,82,35,9,1,Travis Daniels made Free Throw.
Northern Colorado,Mississippi State,57,83,35,9,1,Travis Daniels made Free Throw.
Northern Colorado,Mississippi State,57,83,35,21,0,Jordan Davis Turnover.
Northern Colorado,Mississippi State,57,83,35,21,0,Travis Daniels Steal.
Northern Colorado,Mississippi State,57,83,35,23,0,Foul on Dallas Anglin.
Northern Colorado,Mississippi State,57,84,35,23,1,Gavin Ware made Free Throw.
Northern Colorado,Mississippi State,57,85,35,23,1,Gavin Ware made Free Throw.
Northern Colorado,Mississippi State,57,85,35,36,0,Jordan Wilson missed Three Point Jumper.
Northern Colorado,Mississippi State,57,85,35,36,0,Travis Daniels Defensive Rebound.
Northern Colorado,Mississippi State,57,87,36,3,1,Fred Thomas made Layup.
Northern Colorado,Mississippi State,57,87,36,37,0,Ibrahim Sylla missed Jumper.
Northern Colorado,Mississippi State,57,87,36,37,0,Travis Daniels Defensive Rebound.
Northern Colorado,Mississippi State,57,87,36,50,0,Mississippi St  Timeout
Northern Colorado,Mississippi State,57,87,36,50,0,Official TV Timeout
Northern Colorado,Mississippi State,57,87,36,56,0,Aric Holman missed Three Point Jumper.
Northern Colorado,Mississippi State,57,87,36,56,0,Johnny Zuppardo Offensive Rebound.
Northern Colorado,Mississippi State,57,87,37,1,0,Fred Thomas missed Three Point Jumper.
Northern Colorado,Mississippi State,57,87,37,1,0,Quinndary Weatherspoon Offensive Rebound.
Northern Colorado,Mississippi State,57,87,37,12,0,Quinndary Weatherspoon missed Three Point Jumper.
Northern Colorado,Mississippi State,57,87,37,12,0,Dallas Anglin Defensive Rebound.
Northern Colorado,Mississippi State,59,87,37,25,1,Dallas Anglin made Jumper. Assisted by Jordan Davis.
Northern Colorado,Mississippi State,59,90,37,38,1,Johnny Zuppardo made Three Point Jumper. Assisted by Quinndary Weatherspoon.
Northern Colorado,Mississippi State,59,90,37,53,0,Foul on Craig Sword.
Northern Colorado,Mississippi State,59,90,38,7,0,Miles Seward missed Three Point Jumper.
Northern Colorado,Mississippi State,59,90,38,7,0,Jett Jobe Defensive Rebound.
Northern Colorado,Mississippi State,59,90,38,13,0,Reggie Patterson Turnover.
Northern Colorado,Mississippi State,59,90,38,13,0,Jordan Davis Steal.
Northern Colorado,Mississippi State,59,90,38,24,0,Miles Seward missed Jumper.
Northern Colorado,Mississippi State,59,90,38,24,0,Johnny Zuppardo Block.
Northern Colorado,Mississippi State,59,90,38,24,0,Aric Holman Defensive Rebound.
Northern Colorado,Mississippi State,59,90,38,33,0,Johnny Zuppardo missed Three Point Jumper.
Northern Colorado,Mississippi State,59,90,38,33,0,Miles Seward Defensive Rebound.
Northern Colorado,Mississippi State,62,90,38,45,1,Jordan Davis made Three Point Jumper. Assisted by Tyler Loose.
Northern Colorado,Mississippi State,62,90,39,4,0,Johnny Zuppardo missed Jumper.
Northern Colorado,Mississippi State,62,90,39,4,0,Miles Seward Defensive Rebound.
Northern Colorado,Mississippi State,62,90,39,4,0,Foul on Reggie Patterson.
Northern Colorado,Mississippi State,63,90,39,4,1,Miles Seward made Free Throw.
Northern Colorado,Mississippi State,64,90,39,4,1,Miles Seward made Free Throw.
Northern Colorado,Mississippi State,64,90,39,4,0,Johnny Zuppardo Turnover.
Northern Colorado,Mississippi State,64,90,39,4,0,Jordan Davis Steal.
Northern Colorado,Mississippi State,64,90,39,8,0,Jordan Davis missed Jumper.
Northern Colorado,Mississippi State,64,90,39,8,0,Johnny Zuppardo Defensive Rebound.
Northern Colorado,Mississippi State,64,90,39,16,0,Reggie Patterson missed Jumper.
Northern Colorado,Mississippi State,64,90,39,16,0,Jordan Davis Block.
Northern Colorado,Mississippi State,64,90,39,16,0,Jordan Davis Defensive Rebound.
Northern Colorado,Mississippi State,66,90,39,21,1,Miles Seward made Layup.
Northern Colorado,Mississippi State,66,92,39,39,1,Reggie Patterson made Layup. Assisted by Jett Jobe.
Northern Colorado,Mississippi State,66,92,39,39,0,Foul on Jamal Evans.
Northern Colorado,Mississippi State,66,93,39,39,1,Reggie Patterson made Free Throw.
