Away Team,Home Team,Away Score,Home Score,Minute,Second,isScoringPosession,Desc.
UConn,South Florida,0,0,0,0,0,Jump Ball won by Connecticut
UConn,South Florida,0,0,0,19,0,Rodney Purvis missed Layup.
UConn,South Florida,0,0,0,19,0,Chris Perry Block.
UConn,South Florida,0,0,0,19,0,Chris Perry Defensive Rebound.
UConn,South Florida,0,0,0,56,0,South Florida  Turnover.
UConn,South Florida,0,0,1,24,0,Rodney Purvis missed Three Point Jumper.
UConn,South Florida,0,0,1,24,0,Corey Allen Jr. Defensive Rebound.
UConn,South Florida,0,0,1,58,0,Corey Allen Jr. missed Layup.
UConn,South Florida,0,0,1,58,0,Amida Brimah Block.
UConn,South Florida,0,0,1,58,0,Corey Allen Jr. Offensive Rebound.
UConn,South Florida,0,0,2,3,0,Corey Allen Jr. missed Layup.
UConn,South Florida,0,0,2,3,0,Amida Brimah Block.
UConn,South Florida,0,0,2,3,0,Amida Brimah Defensive Rebound.
UConn,South Florida,0,0,2,14,0,Foul on Ryan Boatright.
UConn,South Florida,0,0,2,14,0,Ryan Boatright Turnover.
UConn,South Florida,0,0,2,30,0,Foul on Kentan Facey.
UConn,South Florida,0,1,2,30,1,Chris Perry made Free Throw.
UConn,South Florida,0,1,2,30,0,Chris Perry missed Free Throw.
UConn,South Florida,0,1,2,30,0,Ruben Guerrero Offensive Rebound.
UConn,South Florida,0,1,2,31,0,Ruben Guerrero missed Layup.
UConn,South Florida,0,1,2,31,0,Chris Perry Offensive Rebound.
UConn,South Florida,0,1,2,31,0,Chris Perry missed Layup.
UConn,South Florida,0,1,2,31,0,Amida Brimah Block.
UConn,South Florida,0,1,2,31,0,Ryan Boatright Defensive Rebound.
UConn,South Florida,2,1,2,42,1,Rodney Purvis made Layup. Assisted by Ryan Boatright.
UConn,South Florida,2,1,2,57,0,Anthony Collins missed Jumper.
UConn,South Florida,2,1,2,57,0,Kentan Facey Defensive Rebound.
UConn,South Florida,2,1,3,8,0,Daniel Hamilton missed Three Point Jumper.
UConn,South Florida,2,1,3,8,0,Ruben Guerrero Defensive Rebound.
UConn,South Florida,2,1,3,17,0,Corey Allen Jr. missed Jumper.
UConn,South Florida,2,1,3,17,0,Daniel Hamilton Defensive Rebound.
UConn,South Florida,2,1,3,48,0,Foul on Anthony Collins.
UConn,South Florida,2,1,4,0,0,Rodney Purvis Turnover.
UConn,South Florida,2,3,4,16,1,Anthony Collins made Jumper.
UConn,South Florida,2,3,4,50,0,Ryan Boatright missed Three Point Jumper.
UConn,South Florida,2,3,4,50,0,Nehemias Morillo Defensive Rebound.
UConn,South Florida,2,3,5,8,0,Foul on Daniel Hamilton.
UConn,South Florida,2,3,5,8,0,Official TV Timeout
UConn,South Florida,2,5,5,41,1,Nehemias Morillo made Jumper.
UConn,South Florida,2,5,6,1,0,Daniel Hamilton missed Jumper.
UConn,South Florida,2,5,6,1,0,Nehemias Morillo Block.
UConn,South Florida,2,5,6,1,0,Daniel Hamilton Offensive Rebound.
UConn,South Florida,4,5,6,4,1,Daniel Hamilton made Layup.
UConn,South Florida,4,5,6,15,0,Foul on Daniel Hamilton.
UConn,South Florida,4,7,6,21,1,Bo Zeigler made Layup. Assisted by Anthony Collins.
UConn,South Florida,4,7,6,52,0,Terrence Samuel missed Three Point Jumper.
UConn,South Florida,4,7,6,52,0,Bo Zeigler Defensive Rebound.
UConn,South Florida,4,7,7,14,0,Anthony Collins missed Layup.
UConn,South Florida,4,7,7,14,0,Bo Zeigler Offensive Rebound.
UConn,South Florida,4,9,7,14,1,Bo Zeigler made Two Point Tip Shot.
UConn,South Florida,4,9,7,42,0,Omar Calhoun Turnover.
UConn,South Florida,4,11,7,52,1,Chris Perry made Jumper.
UConn,South Florida,4,11,7,57,0,Connecticut  Timeout
UConn,South Florida,4,11,8,20,0,Official TV Timeout
UConn,South Florida,4,11,8,27,0,Omar Calhoun missed Three Point Jumper.
UConn,South Florida,4,11,8,27,0,Chris Perry Defensive Rebound.
UConn,South Florida,4,11,8,41,0,Corey Allen Jr. Turnover.
UConn,South Florida,4,11,8,52,0,Foul on Nehemias Morillo.
UConn,South Florida,4,11,8,52,0,Omar Calhoun missed Free Throw.
UConn,South Florida,4,11,8,52,0,Connecticut Deadball Team Rebound.
UConn,South Florida,4,11,8,52,0,Omar Calhoun missed Free Throw.
UConn,South Florida,4,11,8,52,0,Rodney Purvis Offensive Rebound.
UConn,South Florida,6,11,9,17,1,Kentan Facey made Layup. Assisted by Omar Calhoun.
UConn,South Florida,6,11,9,49,0,Troy Holston Jr. missed Three Point Jumper.
UConn,South Florida,6,11,9,49,0,Kentan Facey Defensive Rebound.
UConn,South Florida,6,11,10,3,0,Omar Calhoun missed Three Point Jumper.
UConn,South Florida,6,11,10,3,0,Phillip Nolan Offensive Rebound.
UConn,South Florida,6,11,10,11,0,Phillip Nolan missed Layup.
UConn,South Florida,6,11,10,11,0,Chris Perry Block.
UConn,South Florida,6,11,10,11,0,Troy Holston Jr. Defensive Rebound.
UConn,South Florida,6,11,10,22,0,Chris Perry missed Jumper.
UConn,South Florida,6,11,10,22,0,Rodney Purvis Defensive Rebound.
UConn,South Florida,6,11,10,30,0,Ryan Boatright missed Three Point Jumper.
UConn,South Florida,6,11,10,30,0,Chris Perry Defensive Rebound.
UConn,South Florida,6,13,10,42,1,Chris Perry made Jumper. Assisted by Anthony Collins.
UConn,South Florida,6,13,10,59,0,Phillip Nolan missed Jumper.
UConn,South Florida,6,13,10,59,0,Chris Perry Defensive Rebound.
UConn,South Florida,6,13,11,9,0,Dinero Mercurius missed Layup.
UConn,South Florida,6,13,11,9,0,Troy Holston Jr. Offensive Rebound.
UConn,South Florida,6,13,11,31,0,Anthony Collins missed Jumper.
UConn,South Florida,6,13,11,31,0,Omar Calhoun Defensive Rebound.
UConn,South Florida,6,13,11,54,0,Ryan Boatright missed Layup.
UConn,South Florida,6,13,11,54,0,Amida Brimah Offensive Rebound.
UConn,South Florida,6,13,11,57,0,Foul on Dinero Mercurius.
UConn,South Florida,7,13,11,57,1,Amida Brimah made Free Throw.
UConn,South Florida,8,13,11,57,1,Amida Brimah made Free Throw.
UConn,South Florida,8,13,12,16,0,Dinero Mercurius Turnover.
UConn,South Florida,10,13,12,20,1,Ryan Boatright made Layup.
UConn,South Florida,10,13,12,23,0,South Florida  Timeout
UConn,South Florida,10,13,12,58,0,Jaleel Cousins Turnover.
UConn,South Florida,10,13,12,58,0,Terrence Samuel Steal.
UConn,South Florida,10,13,13,15,0,Sam Cassell Jr. missed Three Point Jumper.
UConn,South Florida,10,13,13,15,0,Chris Perry Defensive Rebound.
UConn,South Florida,10,13,13,24,0,Foul on Amida Brimah.
UConn,South Florida,10,13,13,24,0,Official TV Timeout
UConn,South Florida,10,13,13,24,0,Anthony Collins missed Free Throw.
UConn,South Florida,10,13,13,24,0,South Florida Deadball Team Rebound.
UConn,South Florida,10,14,13,24,1,Anthony Collins made Free Throw.
UConn,South Florida,12,14,13,39,1,Terrence Samuel made Layup.
UConn,South Florida,12,16,14,14,1,Ruben Guerrero made Jumper.
UConn,South Florida,12,16,14,49,0,Terrence Samuel missed Layup.
UConn,South Florida,12,16,14,49,0,Nehemias Morillo Defensive Rebound.
UConn,South Florida,12,18,14,56,1,Nehemias Morillo made Layup. Assisted by Corey Allen Jr..
UConn,South Florida,14,18,15,7,1,Rakim Lubin made Jumper. Assisted by Ryan Boatright.
UConn,South Florida,14,18,15,26,0,Anthony Collins missed Jumper.
UConn,South Florida,14,18,15,26,0,Rakim Lubin Defensive Rebound.
UConn,South Florida,16,18,15,37,1,Sam Cassell Jr. made Jumper. Assisted by Ryan Boatright.
UConn,South Florida,16,18,15,37,0,Foul on Corey Allen Jr..
UConn,South Florida,17,18,15,37,1,Sam Cassell Jr. made Free Throw.
UConn,South Florida,17,20,15,46,1,Corey Allen Jr. made Layup.
UConn,South Florida,17,20,16,3,0,Omar Calhoun missed Three Point Jumper.
UConn,South Florida,17,20,16,3,0,Sam Cassell Jr. Offensive Rebound.
UConn,South Florida,19,20,16,9,1,Amida Brimah made Layup. Assisted by Sam Cassell Jr..
UConn,South Florida,19,22,16,38,1,Corey Allen Jr. made Jumper. Assisted by Anthony Collins.
UConn,South Florida,19,22,17,3,0,Rakim Lubin Turnover.
UConn,South Florida,19,22,17,3,0,Nehemias Morillo Steal.
UConn,South Florida,19,24,17,11,1,Bo Zeigler made Layup. Assisted by Anthony Collins.
UConn,South Florida,19,24,17,29,0,Sam Cassell Jr. missed Jumper.
UConn,South Florida,19,24,17,29,0,Amida Brimah Offensive Rebound.
UConn,South Florida,21,24,17,37,1,Amida Brimah made Dunk.
UConn,South Florida,21,24,17,40,0,Corey Allen Jr. missed Layup.
UConn,South Florida,21,24,17,40,0,Rakim Lubin Defensive Rebound.
UConn,South Florida,24,24,17,58,1,Omar Calhoun made Three Point Jumper. Assisted by Sam Cassell Jr..
UConn,South Florida,24,24,18,18,0,Nehemias Morillo missed Three Point Jumper.
UConn,South Florida,24,24,18,18,0,Amida Brimah Defensive Rebound.
UConn,South Florida,24,24,18,51,0,Sam Cassell Jr. missed Jumper.
UConn,South Florida,24,24,18,51,0,Amida Brimah Offensive Rebound.
UConn,South Florida,26,24,18,56,1,Omar Calhoun made Jumper.
UConn,South Florida,26,24,19,17,0,Anthony Collins Turnover.
UConn,South Florida,26,24,19,51,0,Sam Cassell Jr. missed Jumper.
UConn,South Florida,26,24,19,51,0,Rakim Lubin Offensive Rebound.
UConn,South Florida,28,24,19,51,1,Rakim Lubin made Two Point Tip Shot.
UConn,South Florida,28,24,19,59,0,Foul on Omar Calhoun.
UConn,South Florida,28,24,19,59,0,Official TV Timeout
UConn,South Florida,28,24,20,0,0,End of 1st half
UConn,South Florida,28,24,20,0,0,Jump Ball won by South Florida
UConn,South Florida,28,26,20,18,1,Ruben Guerrero made Layup.
UConn,South Florida,28,26,20,53,0,Ryan Boatright missed Layup.
UConn,South Florida,28,26,20,53,0,Ruben Guerrero Block.
UConn,South Florida,28,26,20,53,0,Connecticut Offensive Rebound.
UConn,South Florida,28,26,20,55,0,Foul on Corey Allen Jr..
UConn,South Florida,30,26,21,5,1,Ryan Boatright made Jumper.
UConn,South Florida,30,26,21,17,0,Anthony Collins Turnover.
UConn,South Florida,30,26,21,17,0,Ryan Boatright Steal.
UConn,South Florida,30,26,21,17,0,Connecticut  Timeout
UConn,South Florida,32,26,21,34,1,Daniel Hamilton made Jumper.
UConn,South Florida,32,26,21,57,0,Corey Allen Jr. missed Jumper.
UConn,South Florida,32,26,21,57,0,Amida Brimah Block.
UConn,South Florida,32,26,21,57,0,Kentan Facey Defensive Rebound.
UConn,South Florida,32,26,22,29,0,Foul on Nehemias Morillo.
UConn,South Florida,32,26,22,29,0,Daniel Hamilton missed Free Throw.
UConn,South Florida,32,26,22,29,0,Connecticut Deadball Team Rebound.
UConn,South Florida,33,26,22,29,1,Daniel Hamilton made Free Throw.
UConn,South Florida,33,26,22,40,0,Anthony Collins missed Jumper.
UConn,South Florida,33,26,22,40,0,Amida Brimah Defensive Rebound.
UConn,South Florida,35,26,23,1,1,Rodney Purvis made Layup.
UConn,South Florida,35,26,23,8,0,South Florida  Timeout
UConn,South Florida,35,26,23,33,0,Dinero Mercurius Turnover.
UConn,South Florida,38,26,23,48,1,Ryan Boatright made Three Point Jumper. Assisted by Kentan Facey.
UConn,South Florida,38,26,24,7,0,Foul on Rodney Purvis.
UConn,South Florida,38,26,24,7,0,Official TV Timeout
UConn,South Florida,38,26,24,39,0,Anthony Collins missed Jumper.
UConn,South Florida,38,26,24,39,0,Chris Perry Offensive Rebound.
UConn,South Florida,38,26,24,42,0,Chris Perry missed Jumper.
UConn,South Florida,38,26,24,42,0,Amida Brimah Defensive Rebound.
UConn,South Florida,38,26,25,4,0,Rodney Purvis missed Jumper.
UConn,South Florida,38,26,25,4,0,Kentan Facey Offensive Rebound.
UConn,South Florida,40,26,25,7,1,Kentan Facey made Layup.
UConn,South Florida,40,26,25,7,0,Foul on Chris Perry.
UConn,South Florida,40,26,25,7,0,Kentan Facey missed Free Throw.
UConn,South Florida,40,26,25,7,0,Dinero Mercurius Defensive Rebound.
UConn,South Florida,40,26,25,21,0,Corey Allen Jr. missed Three Point Jumper.
UConn,South Florida,40,26,25,21,0,Kentan Facey Defensive Rebound.
UConn,South Florida,40,26,25,35,0,Daniel Hamilton missed Jumper.
UConn,South Florida,40,26,25,35,0,Dinero Mercurius Defensive Rebound.
UConn,South Florida,40,26,26,3,0,Foul on Ryan Boatright.
UConn,South Florida,40,26,26,5,0,Anthony Collins missed Three Point Jumper.
UConn,South Florida,40,26,26,5,0,Ruben Guerrero Offensive Rebound.
UConn,South Florida,40,28,26,10,1,Ruben Guerrero made Layup.
UConn,South Florida,42,28,26,26,1,Daniel Hamilton made Jumper.
UConn,South Florida,42,28,26,59,0,Anthony Collins Turnover.
UConn,South Florida,42,28,26,59,0,Ryan Boatright Steal.
UConn,South Florida,42,28,27,5,0,Foul on Dinero Mercurius.
UConn,South Florida,43,28,27,5,1,Rodney Purvis made Free Throw.
UConn,South Florida,43,28,27,5,0,Rodney Purvis missed Free Throw.
UConn,South Florida,43,28,27,5,0,Bo Zeigler Defensive Rebound.
UConn,South Florida,43,30,27,31,1,Corey Allen Jr. made Jumper.
UConn,South Florida,46,30,27,59,1,Omar Calhoun made Three Point Jumper. Assisted by Terrence Samuel.
UConn,South Florida,46,33,28,30,1,Troy Holston Jr. made Three Point Jumper. Assisted by Corey Allen Jr..
UConn,South Florida,46,33,29,4,0,Foul on Rodney Purvis.
UConn,South Florida,46,33,29,4,0,Rodney Purvis Turnover.
UConn,South Florida,46,33,29,4,0,Official TV Timeout
UConn,South Florida,46,33,29,13,0,Foul on Terrence Samuel.
UConn,South Florida,46,33,29,14,0,Bo Zeigler missed Layup.
UConn,South Florida,46,33,29,14,0,Amida Brimah Block.
UConn,South Florida,46,33,29,14,0,Terrence Samuel Defensive Rebound.
UConn,South Florida,48,33,29,24,1,Amida Brimah made Dunk. Assisted by Daniel Hamilton.
UConn,South Florida,48,33,29,44,0,Foul on Chris Perry.
UConn,South Florida,48,33,29,44,0,Chris Perry Turnover.
UConn,South Florida,48,33,30,14,0,Sam Cassell Jr. missed Jumper.
UConn,South Florida,48,33,30,14,0,Corey Allen Jr. Defensive Rebound.
UConn,South Florida,48,33,30,33,0,Foul on Amida Brimah.
UConn,South Florida,48,33,30,35,0,Troy Holston Jr. missed Three Point Jumper.
UConn,South Florida,48,33,30,35,0,Terrence Samuel Defensive Rebound.
UConn,South Florida,51,33,31,8,1,Ryan Boatright made Three Point Jumper. Assisted by Terrence Samuel.
UConn,South Florida,51,35,31,40,1,Anthony Collins made Layup.
UConn,South Florida,51,35,32,11,0,Terrence Samuel Turnover.
UConn,South Florida,51,35,32,11,0,Official TV Timeout
UConn,South Florida,51,35,32,41,0,Nehemias Morillo missed Jumper.
UConn,South Florida,51,35,32,41,0,Terrence Samuel Defensive Rebound.
UConn,South Florida,51,35,32,58,0,Rodney Purvis missed Jumper.
UConn,South Florida,51,35,32,58,0,Corey Allen Jr. Defensive Rebound.
UConn,South Florida,51,35,33,8,0,Corey Allen Jr. missed Layup.
UConn,South Florida,51,35,33,8,0,Ruben Guerrero Offensive Rebound.
UConn,South Florida,51,35,33,8,0,Ruben Guerrero missed Two Point Tip Shot.
UConn,South Florida,51,35,33,8,0,Terrence Samuel Defensive Rebound.
UConn,South Florida,51,35,33,41,0,Foul on Corey Allen Jr..
UConn,South Florida,51,35,33,54,0,Amida Brimah Turnover.
UConn,South Florida,51,35,33,54,0,Nehemias Morillo Steal.
UConn,South Florida,51,35,34,0,0,Foul on Ryan Boatright.
UConn,South Florida,51,35,34,3,0,Foul on Ryan Boatright.
UConn,South Florida,51,35,34,3,0,Ruben Guerrero missed Free Throw.
UConn,South Florida,51,35,34,3,0,Terrence Samuel Defensive Rebound.
UConn,South Florida,53,35,34,16,1,Amida Brimah made Layup. Assisted by Terrence Samuel.
UConn,South Florida,53,35,34,16,0,Foul on Ruben Guerrero.
UConn,South Florida,54,35,34,16,1,Amida Brimah made Free Throw.
UConn,South Florida,54,35,34,32,0,Ruben Guerrero missed Jumper.
UConn,South Florida,54,35,34,32,0,Amida Brimah Defensive Rebound.
UConn,South Florida,54,35,35,8,0,Rodney Purvis missed Layup.
UConn,South Florida,54,35,35,8,0,Chris Perry Defensive Rebound.
UConn,South Florida,54,35,35,16,0,Anthony Collins Turnover.
UConn,South Florida,54,35,35,16,0,Omar Calhoun Steal.
UConn,South Florida,56,35,35,30,1,Kentan Facey made Dunk. Assisted by Terrence Samuel.
UConn,South Florida,56,35,35,38,0,South Florida  Timeout
UConn,South Florida,56,35,35,48,0,Foul on Daniel Hamilton.
UConn,South Florida,56,36,35,48,1,Corey Allen Jr. made Free Throw.
UConn,South Florida,56,37,35,48,1,Corey Allen Jr. made Free Throw.
UConn,South Florida,56,37,36,6,0,Daniel Hamilton missed Jumper.
UConn,South Florida,56,37,36,6,0,Nehemias Morillo Defensive Rebound.
UConn,South Florida,56,37,36,12,0,Official TV Timeout
UConn,South Florida,56,39,36,16,1,Corey Allen Jr. made Jumper.
UConn,South Florida,56,39,36,52,0,Amida Brimah missed Jumper.
UConn,South Florida,56,39,36,52,0,Terrence Samuel Offensive Rebound.
UConn,South Florida,56,39,37,12,0,Rodney Purvis Turnover.
UConn,South Florida,56,39,37,12,0,Ruben Guerrero Steal.
UConn,South Florida,56,39,37,19,0,Foul on Kentan Facey.
UConn,South Florida,56,40,37,19,1,Corey Allen Jr. made Free Throw.
UConn,South Florida,56,41,37,19,1,Corey Allen Jr. made Free Throw.
UConn,South Florida,56,41,37,41,0,Rodney Purvis missed Three Point Jumper.
UConn,South Florida,56,41,37,41,0,Corey Allen Jr. Defensive Rebound.
UConn,South Florida,56,41,37,53,0,Corey Allen Jr. missed Layup.
UConn,South Florida,56,41,37,53,0,Amida Brimah Block.
UConn,South Florida,56,41,37,53,0,South Florida Offensive Rebound.
UConn,South Florida,56,44,38,10,1,Dinero Mercurius made Three Point Jumper. Assisted by Anthony Collins.
UConn,South Florida,58,44,38,45,1,Amida Brimah made Dunk. Assisted by Daniel Hamilton.
UConn,South Florida,58,44,39,4,0,Troy Holston Jr. missed Three Point Jumper.
UConn,South Florida,58,44,39,4,0,Daniel Hamilton Defensive Rebound.
UConn,South Florida,58,44,39,20,0,Foul on Dinero Mercurius.
UConn,South Florida,58,44,39,20,0,Daniel Hamilton missed Free Throw.
UConn,South Florida,58,44,39,20,0,Corey Allen Jr. Defensive Rebound.
UConn,South Florida,58,44,39,25,0,Dinero Mercurius missed Three Point Jumper.
UConn,South Florida,58,44,39,25,0,Terrence Samuel Defensive Rebound.
UConn,South Florida,58,44,40,0,0,End of Game
