Away Team,Home Team,Away Score,Home Score,Minute,Second,isScoringPosession,Desc.
Maryland-Eastern Shore,North Carolina Central,0,0,0,14,0,Dante Holmes missed Three Point Jumper.
Maryland-Eastern Shore,North Carolina Central,0,0,0,14,0,Jay Copeland Offensive Rebound.
Maryland-Eastern Shore,North Carolina Central,0,0,0,18,0,Jay Copeland Turnover.
Maryland-Eastern Shore,North Carolina Central,0,0,0,46,0,Dominique Elliott missed Three Point Jumper.
Maryland-Eastern Shore,North Carolina Central,0,0,0,46,0,Joshu'a Warren Offensive Rebound.
Maryland-Eastern Shore,North Carolina Central,0,0,0,54,0,Foul on Jay Copeland.
Maryland-Eastern Shore,North Carolina Central,0,0,0,54,0,Joshu'a Warren missed Free Throw.
Maryland-Eastern Shore,North Carolina Central,0,0,0,54,0,Maryland-Eastern Shore Deadball Team Rebound.
Maryland-Eastern Shore,North Carolina Central,0,0,0,54,0,Joshu'a Warren missed Free Throw.
Maryland-Eastern Shore,North Carolina Central,0,0,0,54,0,Jamal Ferguson Defensive Rebound.
Maryland-Eastern Shore,North Carolina Central,0,2,1,3,1,Dante Holmes made Jumper.
Maryland-Eastern Shore,North Carolina Central,0,2,1,31,0,Dominique Elliott Turnover.
Maryland-Eastern Shore,North Carolina Central,0,2,1,33,0,Dante Holmes Steal.
Maryland-Eastern Shore,North Carolina Central,0,2,1,52,0,Jamal Ferguson missed Jumper.
Maryland-Eastern Shore,North Carolina Central,0,2,1,52,0,Bakari Copeland Defensive Rebound.
Maryland-Eastern Shore,North Carolina Central,0,2,1,58,0,Foul on Jamal Ferguson.
Maryland-Eastern Shore,North Carolina Central,1,2,1,58,1,Bakari Copeland made Free Throw.
Maryland-Eastern Shore,North Carolina Central,1,2,1,58,0,Bakari Copeland missed Free Throw.
Maryland-Eastern Shore,North Carolina Central,1,2,1,58,0,North Carolina Central Defensive Rebound.
Maryland-Eastern Shore,North Carolina Central,1,4,2,16,1,Jay Copeland made Layup. Assisted by Dante Holmes.
Maryland-Eastern Shore,North Carolina Central,1,4,2,38,0,Devin Martin missed Three Point Jumper.
Maryland-Eastern Shore,North Carolina Central,1,4,2,38,0,Jamal Ferguson Defensive Rebound.
Maryland-Eastern Shore,North Carolina Central,1,4,2,45,0,Foul on Ahmad Frost.
Maryland-Eastern Shore,North Carolina Central,1,4,3,6,0,Dante Holmes missed Three Point Jumper.
Maryland-Eastern Shore,North Carolina Central,1,4,3,6,0,Jay Copeland Offensive Rebound.
Maryland-Eastern Shore,North Carolina Central,1,4,3,10,0,Jay Copeland missed Layup.
Maryland-Eastern Shore,North Carolina Central,1,4,3,10,0,Joshu'a Warren Block.
Maryland-Eastern Shore,North Carolina Central,1,4,3,12,0,Ahmad Frost Defensive Rebound.
Maryland-Eastern Shore,North Carolina Central,1,4,3,15,0,Ahmad Frost missed Layup.
Maryland-Eastern Shore,North Carolina Central,1,4,3,15,0,Dajuan Graf Defensive Rebound.
Maryland-Eastern Shore,North Carolina Central,1,4,3,25,0,Jeremiah Ingram Turnover.
Maryland-Eastern Shore,North Carolina Central,1,4,3,27,0,Dominique Elliott Steal.
Maryland-Eastern Shore,North Carolina Central,1,4,3,55,0,Bakari Copeland Turnover.
Maryland-Eastern Shore,North Carolina Central,1,6,4,14,1,Dajuan Graf made Jumper.
Maryland-Eastern Shore,North Carolina Central,1,6,4,41,0,Thomas Rivera Turnover.
Maryland-Eastern Shore,North Carolina Central,1,6,4,43,0,Dante Holmes Steal.
Maryland-Eastern Shore,North Carolina Central,1,8,4,44,1,Dante Holmes made Layup.
Maryland-Eastern Shore,North Carolina Central,1,8,4,48,0,Maryland-Eastern Shore  Timeout
Maryland-Eastern Shore,North Carolina Central,1,8,4,48,0,Official TV Timeout
Maryland-Eastern Shore,North Carolina Central,3,8,5,10,1,Devin Martin made Layup.
Maryland-Eastern Shore,North Carolina Central,3,8,5,33,0,Dajuan Graf missed Three Point Jumper.
Maryland-Eastern Shore,North Carolina Central,3,8,5,33,0,Thomas Rivera Defensive Rebound.
Maryland-Eastern Shore,North Carolina Central,3,8,5,40,0,Thomas Rivera missed Layup.
Maryland-Eastern Shore,North Carolina Central,3,8,5,40,0,Jeremiah Ingram Defensive Rebound.
Maryland-Eastern Shore,North Carolina Central,3,10,5,46,1,Jamal Ferguson made Layup. Assisted by Dajuan Graf.
Maryland-Eastern Shore,North Carolina Central,3,10,5,59,0,Devin Martin missed Three Point Jumper.
Maryland-Eastern Shore,North Carolina Central,3,10,5,59,0,Dominique Elliott Offensive Rebound.
Maryland-Eastern Shore,North Carolina Central,5,10,6,3,1,Joshu'a Warren made Layup. Assisted by Dominique Elliott.
Maryland-Eastern Shore,North Carolina Central,5,10,6,23,0,Foul on Joshu'a Warren.
Maryland-Eastern Shore,North Carolina Central,5,10,6,43,0,Dajuan Graf missed Layup.
Maryland-Eastern Shore,North Carolina Central,5,10,6,43,0,Dominique Elliott Block.
Maryland-Eastern Shore,North Carolina Central,5,10,6,45,0,Enoch Hood Offensive Rebound.
Maryland-Eastern Shore,North Carolina Central,5,10,6,45,0,Jeremiah Ingram missed Layup.
Maryland-Eastern Shore,North Carolina Central,5,10,6,45,0,Joshu'a Warren Block.
Maryland-Eastern Shore,North Carolina Central,5,10,6,45,0,Jeremiah Ingram Offensive Rebound.
Maryland-Eastern Shore,North Carolina Central,5,10,6,58,0,Dajuan Graf missed Three Point Jumper.
Maryland-Eastern Shore,North Carolina Central,5,10,6,58,0,Joshu'a Warren Defensive Rebound.
Maryland-Eastern Shore,North Carolina Central,7,10,7,15,1,Devin Martin made Layup. Assisted by Thomas Rivera.
Maryland-Eastern Shore,North Carolina Central,7,12,7,34,1,Dante Holmes made Jumper.
Maryland-Eastern Shore,North Carolina Central,7,12,7,49,0,Foul on Enoch Hood.
Maryland-Eastern Shore,North Carolina Central,9,12,8,3,1,Devin Martin made Layup. Assisted by Dontae Caldwell.
Maryland-Eastern Shore,North Carolina Central,9,14,8,34,1,Jeremiah Ingram made Layup. Assisted by Dajuan Graf.
Maryland-Eastern Shore,North Carolina Central,9,14,8,34,0,Foul on Dominique Elliott.
Maryland-Eastern Shore,North Carolina Central,9,14,8,34,0,Official TV Timeout
Maryland-Eastern Shore,North Carolina Central,9,15,8,34,1,Jeremiah Ingram made Free Throw.
Maryland-Eastern Shore,North Carolina Central,9,15,8,48,0,Dominique Elliott missed Jumper.
Maryland-Eastern Shore,North Carolina Central,9,15,8,48,0,Dontae Caldwell Offensive Rebound.
Maryland-Eastern Shore,North Carolina Central,11,15,8,55,1,Dontae Caldwell made Two Point Tip Shot.
Maryland-Eastern Shore,North Carolina Central,11,17,9,8,1,Dajuan Graf made Layup.
Maryland-Eastern Shore,North Carolina Central,11,17,9,36,0,Thomas Rivera Turnover.
Maryland-Eastern Shore,North Carolina Central,11,17,9,45,0,Dante Holmes missed Jumper.
Maryland-Eastern Shore,North Carolina Central,11,17,9,45,0,Jeremiah Ingram Offensive Rebound.
Maryland-Eastern Shore,North Carolina Central,11,19,9,49,1,Jeremiah Ingram made Layup.
Maryland-Eastern Shore,North Carolina Central,11,19,10,9,0,Foul on Jay Copeland.
Maryland-Eastern Shore,North Carolina Central,11,19,10,9,0,Ahmad Frost Turnover.
Maryland-Eastern Shore,North Carolina Central,11,19,10,10,0,Rashaun Madison Steal.
Maryland-Eastern Shore,North Carolina Central,11,21,10,11,1,Rashaun Madison made Layup.
Maryland-Eastern Shore,North Carolina Central,11,21,10,26,0,Dontae Caldwell missed Jumper.
Maryland-Eastern Shore,North Carolina Central,11,21,10,26,0,Dante Holmes Defensive Rebound.
Maryland-Eastern Shore,North Carolina Central,11,21,10,33,0,Rashaun Madison missed Three Point Jumper.
Maryland-Eastern Shore,North Carolina Central,11,21,10,33,0,Ryan Andino Defensive Rebound.
Maryland-Eastern Shore,North Carolina Central,11,21,10,58,0,Bakari Copeland missed Three Point Jumper.
Maryland-Eastern Shore,North Carolina Central,11,21,10,58,0,Dontae Caldwell Offensive Rebound.
Maryland-Eastern Shore,North Carolina Central,11,21,11,14,0,Dontae Caldwell Turnover.
Maryland-Eastern Shore,North Carolina Central,11,21,11,14,0,Foul on Dontae Caldwell.
Maryland-Eastern Shore,North Carolina Central,11,23,11,31,1,Kyle Benton made Layup. Assisted by Jeremiah Ingram.
Maryland-Eastern Shore,North Carolina Central,14,23,11,45,1,Dontae Caldwell made Three Point Jumper. Assisted by Ahmad Frost.
Maryland-Eastern Shore,North Carolina Central,14,23,12,7,0,Dante Holmes missed Layup.
Maryland-Eastern Shore,North Carolina Central,14,23,12,7,0,Isaac Taylor Block.
Maryland-Eastern Shore,North Carolina Central,14,23,12,9,0,Ahmad Frost Defensive Rebound.
Maryland-Eastern Shore,North Carolina Central,16,23,12,12,1,Dontae Caldwell made Layup.
Maryland-Eastern Shore,North Carolina Central,16,23,12,17,0,North Carolina Central  Timeout
Maryland-Eastern Shore,North Carolina Central,16,23,12,17,0,Official TV Timeout
Maryland-Eastern Shore,North Carolina Central,16,23,12,33,0,Kyle Benton missed Layup.
Maryland-Eastern Shore,North Carolina Central,16,23,12,33,0,Kyle Benton Offensive Rebound.
Maryland-Eastern Shore,North Carolina Central,16,23,12,35,0,Kyle Benton missed Layup.
Maryland-Eastern Shore,North Carolina Central,16,23,12,35,0,Kyle Benton Offensive Rebound.
Maryland-Eastern Shore,North Carolina Central,16,25,12,38,1,Kyle Benton made Two Point Tip Shot.
Maryland-Eastern Shore,North Carolina Central,16,25,12,53,0,Mark Blackmon Turnover.
Maryland-Eastern Shore,North Carolina Central,16,25,12,55,0,Rashaun Madison Steal.
Maryland-Eastern Shore,North Carolina Central,16,25,13,8,0,Foul on Mark Blackmon.
Maryland-Eastern Shore,North Carolina Central,16,25,13,12,0,Kyle Benton missed Layup.
Maryland-Eastern Shore,North Carolina Central,16,25,13,12,0,Dominique Elliott Block.
Maryland-Eastern Shore,North Carolina Central,16,25,13,14,0,Rashaun Madison Offensive Rebound.
Maryland-Eastern Shore,North Carolina Central,16,25,13,16,0,Jeremiah Ingram Turnover.
Maryland-Eastern Shore,North Carolina Central,18,25,13,42,1,Ahmad Frost made Jumper.
Maryland-Eastern Shore,North Carolina Central,18,25,14,9,0,Dante Holmes missed Three Point Jumper.
Maryland-Eastern Shore,North Carolina Central,18,25,14,9,0,Dontae Caldwell Defensive Rebound.
Maryland-Eastern Shore,North Carolina Central,18,25,14,15,0,Bakari Copeland Turnover.
Maryland-Eastern Shore,North Carolina Central,18,25,14,31,0,Dajuan Graf missed Jumper.
Maryland-Eastern Shore,North Carolina Central,18,25,14,31,0,North Carolina Central Offensive Rebound.
Maryland-Eastern Shore,North Carolina Central,18,25,14,44,0,Jeremiah Ingram Turnover.
Maryland-Eastern Shore,North Carolina Central,18,25,14,57,0,Foul on Dajuan Graf.
Maryland-Eastern Shore,North Carolina Central,19,25,14,57,1,Dontae Caldwell made Free Throw.
Maryland-Eastern Shore,North Carolina Central,20,25,14,57,1,Dontae Caldwell made Free Throw.
Maryland-Eastern Shore,North Carolina Central,21,25,14,57,1,Dontae Caldwell made Free Throw.
Maryland-Eastern Shore,North Carolina Central,21,25,15,14,0,Dante Holmes missed Three Point Jumper.
Maryland-Eastern Shore,North Carolina Central,21,25,15,14,0,Dominique Elliott Defensive Rebound.
Maryland-Eastern Shore,North Carolina Central,21,25,15,25,0,Foul on Jeremiah Worthem.
Maryland-Eastern Shore,North Carolina Central,21,25,15,44,0,Ahmad Frost missed Three Point Jumper.
Maryland-Eastern Shore,North Carolina Central,21,25,15,44,0,Jeremiah Worthem Defensive Rebound.
Maryland-Eastern Shore,North Carolina Central,21,27,15,52,1,Jamal Ferguson made Layup. Assisted by Dante Holmes.
Maryland-Eastern Shore,North Carolina Central,21,27,16,8,0,Dominique Elliott Turnover.
Maryland-Eastern Shore,North Carolina Central,21,27,16,8,0,Foul on Dominique Elliott.
Maryland-Eastern Shore,North Carolina Central,21,27,16,8,0,Official TV Timeout
Maryland-Eastern Shore,North Carolina Central,21,27,16,28,0,Dante Holmes missed Layup.
Maryland-Eastern Shore,North Carolina Central,21,27,16,28,0,Derrico Peck Block.
Maryland-Eastern Shore,North Carolina Central,21,27,16,33,0,Derrico Peck Defensive Rebound.
Maryland-Eastern Shore,North Carolina Central,21,27,16,36,0,Dontae Caldwell missed Layup.
Maryland-Eastern Shore,North Carolina Central,21,27,16,36,0,Derrico Peck Offensive Rebound.
Maryland-Eastern Shore,North Carolina Central,23,27,16,38,1,Derrico Peck made Two Point Tip Shot.
Maryland-Eastern Shore,North Carolina Central,23,27,16,58,0,Foul on Devin Martin.
Maryland-Eastern Shore,North Carolina Central,23,28,16,58,1,Jeremiah Worthem made Free Throw.
Maryland-Eastern Shore,North Carolina Central,23,29,16,58,1,Jeremiah Worthem made Free Throw.
Maryland-Eastern Shore,North Carolina Central,23,29,17,22,0,Joshu'a Warren missed Jumper.
Maryland-Eastern Shore,North Carolina Central,23,29,17,22,0,Dontae Caldwell Offensive Rebound.
Maryland-Eastern Shore,North Carolina Central,23,29,17,33,0,Ryan Andino Turnover.
Maryland-Eastern Shore,North Carolina Central,23,31,17,56,1,Dajuan Graf made Jumper.
Maryland-Eastern Shore,North Carolina Central,23,31,18,12,0,Ryan Andino missed Three Point Jumper.
Maryland-Eastern Shore,North Carolina Central,23,31,18,12,0,Dontae Caldwell Offensive Rebound.
Maryland-Eastern Shore,North Carolina Central,23,31,18,30,0,Ryan Andino missed Three Point Jumper.
Maryland-Eastern Shore,North Carolina Central,23,31,18,30,0,Joshu'a Warren Offensive Rebound.
Maryland-Eastern Shore,North Carolina Central,23,31,18,34,0,Joshu'a Warren Turnover.
Maryland-Eastern Shore,North Carolina Central,23,34,19,1,1,Dante Holmes made Three Point Jumper.
Maryland-Eastern Shore,North Carolina Central,23,34,19,16,0,Ryan Andino missed Three Point Jumper.
Maryland-Eastern Shore,North Carolina Central,23,34,19,16,0,Dajuan Graf Defensive Rebound.
Maryland-Eastern Shore,North Carolina Central,23,36,19,23,1,Jamal Ferguson made Layup. Assisted by Dajuan Graf.
Maryland-Eastern Shore,North Carolina Central,23,36,19,52,0,Devin Martin missed Three Point Jumper.
Maryland-Eastern Shore,North Carolina Central,23,36,19,52,0,Jeremiah Ingram Defensive Rebound.
Maryland-Eastern Shore,North Carolina Central,23,36,19,59,0,Dajuan Graf missed Three Point Jumper.
Maryland-Eastern Shore,North Carolina Central,23,36,19,59,0,Maryland-Eastern Shore Defensive Rebound.
Maryland-Eastern Shore,North Carolina Central,23,36,20,0,0,End of 1st half
Maryland-Eastern Shore,North Carolina Central,23,36,20,30,0,Bakari Copeland missed Three Point Jumper.
Maryland-Eastern Shore,North Carolina Central,23,36,20,30,0,North Carolina Central Deadball Team Rebound.
Maryland-Eastern Shore,North Carolina Central,23,36,20,54,0,Dante Holmes missed Three Point Jumper.
Maryland-Eastern Shore,North Carolina Central,23,36,20,54,0,Ahmad Frost Defensive Rebound.
Maryland-Eastern Shore,North Carolina Central,23,36,21,7,0,Dominique Elliott missed Jumper.
Maryland-Eastern Shore,North Carolina Central,23,36,21,7,0,Jeremiah Ingram Defensive Rebound.
Maryland-Eastern Shore,North Carolina Central,23,38,21,16,1,Dante Holmes made Jumper.
Maryland-Eastern Shore,North Carolina Central,23,38,21,37,0,Devin Martin Turnover.
Maryland-Eastern Shore,North Carolina Central,23,38,21,38,0,Jay Copeland Steal.
Maryland-Eastern Shore,North Carolina Central,23,38,21,48,0,Dajuan Graf Turnover.
Maryland-Eastern Shore,North Carolina Central,23,38,21,56,0,Devin Martin Turnover.
Maryland-Eastern Shore,North Carolina Central,23,38,21,57,0,Jamal Ferguson Steal.
Maryland-Eastern Shore,North Carolina Central,23,40,22,0,1,Jamal Ferguson made Dunk.
Maryland-Eastern Shore,North Carolina Central,23,40,22,15,0,Devin Martin missed Layup.
Maryland-Eastern Shore,North Carolina Central,23,40,22,15,0,Dominique Elliott Offensive Rebound.
Maryland-Eastern Shore,North Carolina Central,25,40,22,20,1,Dominique Elliott made Two Point Tip Shot.
Maryland-Eastern Shore,North Carolina Central,25,40,22,37,0,Jeremiah Ingram missed Jumper.
Maryland-Eastern Shore,North Carolina Central,25,40,22,37,0,Jay Copeland Offensive Rebound.
Maryland-Eastern Shore,North Carolina Central,25,40,22,40,0,Jay Copeland missed Jumper.
Maryland-Eastern Shore,North Carolina Central,25,40,22,40,0,Bakari Copeland Defensive Rebound.
Maryland-Eastern Shore,North Carolina Central,25,40,22,46,0,Ahmad Frost Turnover.
Maryland-Eastern Shore,North Carolina Central,25,40,23,3,0,Jay Copeland missed Layup.
Maryland-Eastern Shore,North Carolina Central,25,40,23,3,0,Jay Copeland Offensive Rebound.
Maryland-Eastern Shore,North Carolina Central,25,42,23,5,1,Jay Copeland made Layup.
Maryland-Eastern Shore,North Carolina Central,25,42,23,31,0,Dominique Elliott Turnover.
Maryland-Eastern Shore,North Carolina Central,25,42,23,31,0,Foul on Dominique Elliott.
Maryland-Eastern Shore,North Carolina Central,25,42,23,48,0,Dajuan Graf missed Three Point Jumper.
Maryland-Eastern Shore,North Carolina Central,25,42,23,48,0,Thomas Rivera Defensive Rebound.
Maryland-Eastern Shore,North Carolina Central,28,42,23,55,1,Ryan Andino made Three Point Jumper. Assisted by Thomas Rivera.
Maryland-Eastern Shore,North Carolina Central,28,42,24,16,0,Jeremiah Ingram missed Layup.
Maryland-Eastern Shore,North Carolina Central,28,42,24,16,0,Jay Copeland Offensive Rebound.
Maryland-Eastern Shore,North Carolina Central,28,42,24,22,0,Official TV Timeout
Maryland-Eastern Shore,North Carolina Central,28,42,24,39,0,Foul on Derrico Peck.
Maryland-Eastern Shore,North Carolina Central,28,43,24,39,1,Jeremiah Ingram made Free Throw.
Maryland-Eastern Shore,North Carolina Central,28,43,24,39,0,Jeremiah Ingram missed Free Throw.
Maryland-Eastern Shore,North Carolina Central,28,43,24,39,0,Derrico Peck Defensive Rebound.
Maryland-Eastern Shore,North Carolina Central,28,43,24,55,0,Foul on Jamal Ferguson.
Maryland-Eastern Shore,North Carolina Central,28,43,25,8,0,Dontae Caldwell missed Three Point Jumper.
Maryland-Eastern Shore,North Carolina Central,28,43,25,8,0,Joshu'a Warren Offensive Rebound.
Maryland-Eastern Shore,North Carolina Central,28,43,25,16,0,Dontae Caldwell missed Layup.
Maryland-Eastern Shore,North Carolina Central,28,43,25,16,0,Jay Copeland Defensive Rebound.
Maryland-Eastern Shore,North Carolina Central,28,43,25,19,0,Jay Copeland Turnover.
Maryland-Eastern Shore,North Carolina Central,28,43,25,19,0,Joshu'a Warren Steal.
Maryland-Eastern Shore,North Carolina Central,28,43,25,19,0,Joshu'a Warren Turnover.
Maryland-Eastern Shore,North Carolina Central,28,43,25,26,0,Foul on Derrico Peck.
Maryland-Eastern Shore,North Carolina Central,28,43,25,44,0,Jeremiah Ingram missed Jumper.
Maryland-Eastern Shore,North Carolina Central,28,43,25,44,0,Jay Copeland Offensive Rebound.
Maryland-Eastern Shore,North Carolina Central,28,45,25,53,1,Jay Copeland made Layup. Assisted by Dajuan Graf.
Maryland-Eastern Shore,North Carolina Central,30,45,26,20,1,Devin Martin made Jumper.
Maryland-Eastern Shore,North Carolina Central,30,45,26,46,0,Foul on Derrico Peck.
Maryland-Eastern Shore,North Carolina Central,30,45,26,46,0,Jamal Ferguson missed Free Throw.
Maryland-Eastern Shore,North Carolina Central,30,45,26,46,0,North Carolina Central Deadball Team Rebound.
Maryland-Eastern Shore,North Carolina Central,30,45,26,46,0,Jamal Ferguson missed Free Throw.
Maryland-Eastern Shore,North Carolina Central,30,45,26,46,0,Dominique Elliott Defensive Rebound.
Maryland-Eastern Shore,North Carolina Central,30,45,27,2,0,Dontae Caldwell missed Three Point Jumper.
Maryland-Eastern Shore,North Carolina Central,30,45,27,2,0,Derrico Peck Offensive Rebound.
Maryland-Eastern Shore,North Carolina Central,32,45,27,7,1,Derrico Peck made Dunk.
Maryland-Eastern Shore,North Carolina Central,32,45,27,21,0,Foul on Thomas Rivera.
Maryland-Eastern Shore,North Carolina Central,32,45,27,30,0,Jay Copeland Turnover.
Maryland-Eastern Shore,North Carolina Central,32,45,27,30,0,Foul on Jay Copeland.
Maryland-Eastern Shore,North Carolina Central,32,45,27,56,0,Derrico Peck Turnover.
Maryland-Eastern Shore,North Carolina Central,32,45,28,22,0,Foul on Derrico Peck.
Maryland-Eastern Shore,North Carolina Central,32,45,28,22,0,Official TV Timeout
Maryland-Eastern Shore,North Carolina Central,32,45,28,27,0,Jeremiah Ingram Turnover.
Maryland-Eastern Shore,North Carolina Central,32,45,28,42,0,Dominique Elliott Turnover.
Maryland-Eastern Shore,North Carolina Central,32,45,28,44,0,Dajuan Graf Turnover.
Maryland-Eastern Shore,North Carolina Central,35,45,28,59,1,Devin Martin made Three Point Jumper. Assisted by Dominique Elliott.
Maryland-Eastern Shore,North Carolina Central,35,45,29,12,0,Jeremiah Ingram Turnover.
Maryland-Eastern Shore,North Carolina Central,35,45,29,13,0,Devin Martin Steal.
Maryland-Eastern Shore,North Carolina Central,35,45,29,22,0,Thomas Rivera missed Layup.
Maryland-Eastern Shore,North Carolina Central,35,45,29,22,0,North Carolina Central Defensive Rebound.
Maryland-Eastern Shore,North Carolina Central,35,47,29,48,1,Jeremiah Ingram made Layup.
Maryland-Eastern Shore,North Carolina Central,35,47,30,3,0,Devin Martin missed Three Point Jumper.
Maryland-Eastern Shore,North Carolina Central,35,47,30,3,0,Maryland-Eastern Shore Offensive Rebound.
Maryland-Eastern Shore,North Carolina Central,35,47,30,4,0,Foul on Dante Holmes.
Maryland-Eastern Shore,North Carolina Central,35,47,30,16,0,Devin Martin missed Three Point Jumper.
Maryland-Eastern Shore,North Carolina Central,35,47,30,16,0,Rashaun Madison Defensive Rebound.
Maryland-Eastern Shore,North Carolina Central,35,49,30,36,1,Dajuan Graf made Layup.
Maryland-Eastern Shore,North Carolina Central,35,49,30,56,0,Foul on Dominique Elliott.
Maryland-Eastern Shore,North Carolina Central,35,49,30,56,0,Dominique Elliott Turnover.
Maryland-Eastern Shore,North Carolina Central,35,51,31,20,1,Dajuan Graf made Layup.
Maryland-Eastern Shore,North Carolina Central,37,51,31,37,1,Devin Martin made Layup.
Maryland-Eastern Shore,North Carolina Central,37,51,31,51,0,North Carolina Central  Timeout
Maryland-Eastern Shore,North Carolina Central,37,51,31,51,0,Official TV Timeout
Maryland-Eastern Shore,North Carolina Central,37,51,32,0,0,Dante Holmes Turnover.
Maryland-Eastern Shore,North Carolina Central,37,51,32,9,0,Foul on Jay Copeland.
Maryland-Eastern Shore,North Carolina Central,37,51,32,9,0,Official TV Timeout
Maryland-Eastern Shore,North Carolina Central,37,51,32,13,0,Foul on Dante Holmes.
Maryland-Eastern Shore,North Carolina Central,38,51,32,13,1,Devin Martin made Free Throw.
Maryland-Eastern Shore,North Carolina Central,38,51,32,13,0,Devin Martin missed Free Throw.
Maryland-Eastern Shore,North Carolina Central,38,51,32,13,0,Jeremiah Ingram Defensive Rebound.
Maryland-Eastern Shore,North Carolina Central,38,51,32,34,0,Foul on Bakari Copeland.
Maryland-Eastern Shore,North Carolina Central,38,52,32,34,1,Dajuan Graf made Free Throw.
Maryland-Eastern Shore,North Carolina Central,38,53,32,34,1,Dajuan Graf made Free Throw.
Maryland-Eastern Shore,North Carolina Central,38,53,32,44,0,Foul on Dante Holmes.
Maryland-Eastern Shore,North Carolina Central,41,53,32,48,1,Ryan Andino made Three Point Jumper. Assisted by Devin Martin.
Maryland-Eastern Shore,North Carolina Central,41,53,32,50,0,Maryland-Eastern Shore  Timeout
Maryland-Eastern Shore,North Carolina Central,41,53,33,13,0,Jeremiah Ingram missed Layup.
Maryland-Eastern Shore,North Carolina Central,41,53,33,13,0,Devin Martin Defensive Rebound.
Maryland-Eastern Shore,North Carolina Central,41,53,33,40,0,Devin Martin missed Jumper.
Maryland-Eastern Shore,North Carolina Central,41,53,33,40,0,Jeremiah Ingram Defensive Rebound.
Maryland-Eastern Shore,North Carolina Central,41,55,34,7,1,Dajuan Graf made Layup.
Maryland-Eastern Shore,North Carolina Central,41,55,34,15,0,Mark Blackmon missed Layup.
Maryland-Eastern Shore,North Carolina Central,41,55,34,15,0,Kyle Benton Block.
Maryland-Eastern Shore,North Carolina Central,41,55,34,18,0,Rashaun Madison Defensive Rebound.
Maryland-Eastern Shore,North Carolina Central,41,55,34,22,0,Foul on Mark Blackmon.
Maryland-Eastern Shore,North Carolina Central,41,56,34,22,1,Dajuan Graf made Free Throw.
Maryland-Eastern Shore,North Carolina Central,41,56,34,22,0,Dajuan Graf missed Free Throw.
Maryland-Eastern Shore,North Carolina Central,41,56,34,22,0,Ahmad Frost Defensive Rebound.
Maryland-Eastern Shore,North Carolina Central,44,56,34,39,1,Dontae Caldwell made Three Point Jumper. Assisted by Ahmad Frost.
Maryland-Eastern Shore,North Carolina Central,44,56,34,52,0,Foul on Devin Martin.
Maryland-Eastern Shore,North Carolina Central,44,57,34,52,1,Dajuan Graf made Free Throw.
Maryland-Eastern Shore,North Carolina Central,44,58,34,52,1,Dajuan Graf made Free Throw.
Maryland-Eastern Shore,North Carolina Central,44,58,34,58,0,Ryan Andino missed Three Point Jumper.
Maryland-Eastern Shore,North Carolina Central,44,58,34,58,0,Kyle Benton Defensive Rebound.
Maryland-Eastern Shore,North Carolina Central,44,58,35,27,0,Dajuan Graf Turnover.
Maryland-Eastern Shore,North Carolina Central,44,58,35,28,0,Devin Martin Steal.
Maryland-Eastern Shore,North Carolina Central,44,58,35,30,0,Foul on Jeremiah Ingram.
Maryland-Eastern Shore,North Carolina Central,45,58,35,30,1,Devin Martin made Free Throw.
Maryland-Eastern Shore,North Carolina Central,46,58,35,30,1,Devin Martin made Free Throw.
Maryland-Eastern Shore,North Carolina Central,46,60,35,59,1,Jeremiah Ingram made Layup.
Maryland-Eastern Shore,North Carolina Central,46,60,36,2,0,Official TV Timeout
Maryland-Eastern Shore,North Carolina Central,46,60,36,19,0,Ryan Andino Turnover.
Maryland-Eastern Shore,North Carolina Central,46,60,36,23,0,Jeremiah Ingram Turnover.
Maryland-Eastern Shore,North Carolina Central,46,60,36,25,0,Devin Martin Steal.
Maryland-Eastern Shore,North Carolina Central,48,60,36,30,1,Devin Martin made Layup.
Maryland-Eastern Shore,North Carolina Central,48,60,36,30,0,Foul on Jeremiah Ingram.
Maryland-Eastern Shore,North Carolina Central,49,60,36,30,1,Devin Martin made Free Throw.
Maryland-Eastern Shore,North Carolina Central,49,60,36,34,0,Kyle Benton missed Layup.
Maryland-Eastern Shore,North Carolina Central,49,60,36,34,0,Derrico Peck Defensive Rebound.
Maryland-Eastern Shore,North Carolina Central,49,60,36,47,0,Devin Martin missed Layup.
Maryland-Eastern Shore,North Carolina Central,49,60,36,47,0,Kyle Benton Block.
