Away Team,Home Team,Away Score,Home Score,Minute,Second,isScoringPosession,Desc.
Maryland-Eastern Shore,North Carolina Central,49,60,36,48,0,Rashaun Madison Defensive Rebound.
Maryland-Eastern Shore,North Carolina Central,49,60,36,51,0,Technical Foul on North Carolina Central.
Maryland-Eastern Shore,North Carolina Central,49,60,36,51,0,North Carolina Central  Timeout
Maryland-Eastern Shore,North Carolina Central,49,60,36,51,0,Dajuan Graf missed Free Throw.
Maryland-Eastern Shore,North Carolina Central,49,60,36,51,0,North Carolina Central Deadball Team Rebound.
Maryland-Eastern Shore,North Carolina Central,49,60,36,51,0,Dajuan Graf missed Free Throw.
Maryland-Eastern Shore,North Carolina Central,49,60,36,51,0,North Carolina Central Deadball Team Rebound.
Maryland-Eastern Shore,North Carolina Central,49,60,36,59,0,Jeremiah Ingram Turnover.
Maryland-Eastern Shore,North Carolina Central,51,60,37,11,1,Dominique Elliott made Layup. Assisted by Devin Martin.
Maryland-Eastern Shore,North Carolina Central,51,60,37,41,0,Rashaun Madison missed Jumper.
Maryland-Eastern Shore,North Carolina Central,51,60,37,41,0,Dominique Elliott Block.
Maryland-Eastern Shore,North Carolina Central,51,60,37,43,0,Dajuan Graf Offensive Rebound.
Maryland-Eastern Shore,North Carolina Central,51,60,37,47,0,Dajuan Graf missed Three Point Jumper.
Maryland-Eastern Shore,North Carolina Central,51,60,37,47,0,Maryland-Eastern Shore Defensive Rebound.
Maryland-Eastern Shore,North Carolina Central,51,60,37,58,0,Foul on Rashaun Madison.
Maryland-Eastern Shore,North Carolina Central,52,60,37,58,1,Devin Martin made Free Throw.
Maryland-Eastern Shore,North Carolina Central,53,60,37,58,1,Devin Martin made Free Throw.
Maryland-Eastern Shore,North Carolina Central,53,62,38,5,1,Kyle Benton made Dunk. Assisted by Jeremiah Ingram.
Maryland-Eastern Shore,North Carolina Central,53,62,38,22,0,Mark Blackmon Turnover.
Maryland-Eastern Shore,North Carolina Central,53,62,38,23,0,Rashaun Madison Steal.
Maryland-Eastern Shore,North Carolina Central,53,62,38,26,0,Foul on Ahmad Frost.
Maryland-Eastern Shore,North Carolina Central,53,63,38,26,1,Dajuan Graf made Free Throw.
Maryland-Eastern Shore,North Carolina Central,53,64,38,26,1,Dajuan Graf made Free Throw.
Maryland-Eastern Shore,North Carolina Central,53,64,38,33,0,Foul on Dajuan Graf.
Maryland-Eastern Shore,North Carolina Central,54,64,38,33,1,Devin Martin made Free Throw.
Maryland-Eastern Shore,North Carolina Central,55,64,38,33,1,Devin Martin made Free Throw.
Maryland-Eastern Shore,North Carolina Central,55,64,38,42,0,Foul on Ahmad Frost.
Maryland-Eastern Shore,North Carolina Central,55,65,38,42,1,Kyle Benton made Free Throw.
Maryland-Eastern Shore,North Carolina Central,55,66,38,42,1,Kyle Benton made Free Throw.
Maryland-Eastern Shore,North Carolina Central,55,66,38,49,0,Devin Martin missed Layup.
Maryland-Eastern Shore,North Carolina Central,55,66,38,49,0,North Carolina Central Defensive Rebound.
Maryland-Eastern Shore,North Carolina Central,55,66,38,54,0,Foul on Ahmad Frost.
Maryland-Eastern Shore,North Carolina Central,55,67,38,54,1,Jeremiah Ingram made Free Throw.
Maryland-Eastern Shore,North Carolina Central,55,68,38,54,1,Jeremiah Ingram made Free Throw.
Maryland-Eastern Shore,North Carolina Central,55,68,39,3,0,Devin Martin Turnover.
Maryland-Eastern Shore,North Carolina Central,55,68,39,24,0,Foul on Ahmad Frost.
Maryland-Eastern Shore,North Carolina Central,55,69,39,24,1,Dajuan Graf made Free Throw.
Maryland-Eastern Shore,North Carolina Central,55,70,39,24,1,Dajuan Graf made Free Throw.
Maryland-Eastern Shore,North Carolina Central,57,70,39,34,1,Devin Martin made Layup.
Maryland-Eastern Shore,North Carolina Central,57,70,39,36,0,Jeremiah Ingram Turnover.
Maryland-Eastern Shore,North Carolina Central,57,70,39,38,0,Mark Blackmon Steal.
Maryland-Eastern Shore,North Carolina Central,59,70,39,41,1,Derrico Peck made Dunk. Assisted by Mark Blackmon.
Maryland-Eastern Shore,North Carolina Central,59,70,40,0,0,End of Game
