Away Team,Home Team,Away Score,Home Score,Minute,Second,isScoringPosession,Desc.
Detroit Mercy,Youngstown State,94,92,39,55,1,Brett Frantz made Three Point Jumper. Assisted by Latin Davis.
Detroit Mercy,Youngstown State,94,92,39,56,0,Foul on Brett Frantz.
Detroit Mercy,Youngstown State,94,92,39,56,0,Josh McFolley missed Free Throw.
Detroit Mercy,Youngstown State,94,92,39,56,0,Detroit Deadball Team Rebound.
Detroit Mercy,Youngstown State,94,92,39,56,0,Josh McFolley missed Free Throw.
Detroit Mercy,Youngstown State,94,92,39,56,0,Jordan Andrews Defensive Rebound.
Detroit Mercy,Youngstown State,94,92,40,0,0,Jordan Andrews missed Three Point Jumper.
Detroit Mercy,Youngstown State,94,92,40,0,0,Detroit Deadball Team Rebound.
Detroit Mercy,Youngstown State,94,92,40,0,0,End of Game
