Away Team,Home Team,Away Score,Home Score,Minute,Second,isScoringPosession,Desc.
Detroit Mercy,Youngstown State,2,0,0,18,1,Jaleel Hogan made Jumper.
Detroit Mercy,Youngstown State,2,0,0,25,0,Jordan Andrews missed Three Point Jumper.
Detroit Mercy,Youngstown State,2,0,0,25,0,Devin Haygood Offensive Rebound.
Detroit Mercy,Youngstown State,2,0,0,30,0,Devin Haygood missed Jumper.
Detroit Mercy,Youngstown State,2,0,0,30,0,Paris Bass Defensive Rebound.
Detroit Mercy,Youngstown State,2,0,0,47,0,Anton Wilson Turnover.
Detroit Mercy,Youngstown State,2,0,1,3,0,Cameron Morse Turnover.
Detroit Mercy,Youngstown State,2,0,1,5,0,Josh McFolley Steal.
Detroit Mercy,Youngstown State,2,0,1,15,0,Paris Bass missed Three Point Jumper.
Detroit Mercy,Youngstown State,2,0,1,15,0,Chris Jenkins Offensive Rebound.
Detroit Mercy,Youngstown State,4,0,1,20,1,Chris Jenkins made Two Point Tip Shot.
Detroit Mercy,Youngstown State,4,3,1,38,1,Matt Donlan made Three Point Jumper. Assisted by Cameron Morse.
Detroit Mercy,Youngstown State,4,3,2,7,0,Jaleel Hogan missed Jumper.
Detroit Mercy,Youngstown State,4,3,2,7,0,Jordan Andrews Defensive Rebound.
Detroit Mercy,Youngstown State,4,3,2,24,0,Jordan Andrews missed Jumper.
Detroit Mercy,Youngstown State,4,3,2,24,0,Detroit Deadball Team Rebound.
Detroit Mercy,Youngstown State,4,3,2,24,0,Foul on Devin Haygood.
Detroit Mercy,Youngstown State,4,3,2,42,0,Foul on Devin Haygood.
Detroit Mercy,Youngstown State,4,3,2,52,0,Chris Jenkins missed Jumper.
Detroit Mercy,Youngstown State,4,3,2,52,0,Matt Donlan Defensive Rebound.
Detroit Mercy,Youngstown State,4,6,3,3,1,Jordan Andrews made Three Point Jumper. Assisted by Francisco Santiago.
Detroit Mercy,Youngstown State,4,6,3,27,0,Josh McFolley Turnover.
Detroit Mercy,Youngstown State,4,8,3,41,1,Jorden Kaufman made Layup. Assisted by Matt Donlan.
Detroit Mercy,Youngstown State,7,8,3,50,1,Josh McFolley made Three Point Jumper.
Detroit Mercy,Youngstown State,7,8,4,8,0,Jordan Andrews missed Three Point Jumper.
Detroit Mercy,Youngstown State,7,8,4,8,0,Josh McFolley Defensive Rebound.
Detroit Mercy,Youngstown State,7,8,4,14,0,Official TV Timeout
Detroit Mercy,Youngstown State,10,8,4,24,1,Anton Wilson made Three Point Jumper. Assisted by Josh McFolley.
Detroit Mercy,Youngstown State,10,11,4,41,1,Cameron Morse made Three Point Jumper. Assisted by Francisco Santiago.
Detroit Mercy,Youngstown State,12,11,4,57,1,Chris Jenkins made Layup. Assisted by Josh McFolley.
Detroit Mercy,Youngstown State,12,11,4,57,0,Foul on Jorden Kaufman.
Detroit Mercy,Youngstown State,13,11,4,57,1,Chris Jenkins made Free Throw.
Detroit Mercy,Youngstown State,13,11,5,4,0,Foul on Jaleel Hogan.
Detroit Mercy,Youngstown State,13,13,5,13,1,Francisco Santiago made Jumper.
Detroit Mercy,Youngstown State,16,13,5,20,1,Anton Wilson made Three Point Jumper. Assisted by Josh McFolley.
Detroit Mercy,Youngstown State,16,13,5,43,0,Matt Donlan Turnover.
Detroit Mercy,Youngstown State,16,13,6,6,0,Paris Bass missed Jumper.
Detroit Mercy,Youngstown State,16,13,6,6,0,Jorden Kaufman Defensive Rebound.
Detroit Mercy,Youngstown State,16,15,6,14,1,Jorden Kaufman made Layup. Assisted by Francisco Santiago.
Detroit Mercy,Youngstown State,18,15,6,25,1,Jaleel Hogan made Layup. Assisted by Josh McFolley.
Detroit Mercy,Youngstown State,18,15,6,26,0,Foul on Jorden Kaufman.
Detroit Mercy,Youngstown State,19,15,6,26,1,Jaleel Hogan made Free Throw.
Detroit Mercy,Youngstown State,19,18,6,40,1,Cameron Morse made Three Point Jumper.
Detroit Mercy,Youngstown State,19,18,7,0,0,Jarod Williams missed Jumper.
Detroit Mercy,Youngstown State,19,18,7,0,0,Francisco Santiago Defensive Rebound.
Detroit Mercy,Youngstown State,19,18,7,6,0,Matt Donlan missed Three Point Jumper.
Detroit Mercy,Youngstown State,19,18,7,6,0,Anton Wilson Defensive Rebound.
Detroit Mercy,Youngstown State,19,18,7,29,0,Jarod Williams missed Three Point Jumper.
Detroit Mercy,Youngstown State,19,18,7,29,0,Youngstown St Defensive Rebound.
Detroit Mercy,Youngstown State,19,18,7,42,0,Cameron Morse missed Three Point Jumper.
Detroit Mercy,Youngstown State,19,18,7,42,0,Gerald Blackshear Defensive Rebound.
Detroit Mercy,Youngstown State,22,18,8,0,1,Chris Jenkins made Three Point Jumper. Assisted by Matthew Grant.
Detroit Mercy,Youngstown State,22,18,8,22,0,Cameron Morse missed Layup.
Detroit Mercy,Youngstown State,22,18,8,22,0,Bryce Nickels Offensive Rebound.
Detroit Mercy,Youngstown State,22,20,8,26,1,Bryce Nickels made Layup.
Detroit Mercy,Youngstown State,22,20,8,40,0,Anton Wilson missed Three Point Jumper.
Detroit Mercy,Youngstown State,22,20,8,40,0,Matt Donlan Defensive Rebound.
Detroit Mercy,Youngstown State,22,20,8,52,0,Cameron Morse Turnover.
Detroit Mercy,Youngstown State,22,20,8,53,0,Anton Wilson Steal.
Detroit Mercy,Youngstown State,24,20,9,0,1,Chris Jenkins made Jumper.
Detroit Mercy,Youngstown State,24,22,9,16,1,Francisco Santiago made Layup.
Detroit Mercy,Youngstown State,24,22,9,16,0,Foul on Matthew Grant.
Detroit Mercy,Youngstown State,24,22,9,16,0,Official TV Timeout
Detroit Mercy,Youngstown State,24,22,9,16,0,Francisco Santiago missed Free Throw.
Detroit Mercy,Youngstown State,24,22,9,16,0,Bryce Nickels Offensive Rebound.
Detroit Mercy,Youngstown State,24,22,9,43,0,Francisco Santiago missed Jumper.
Detroit Mercy,Youngstown State,24,22,9,43,0,Jarod Williams Defensive Rebound.
Detroit Mercy,Youngstown State,24,22,10,5,0,Chris Jenkins missed Three Point Jumper.
Detroit Mercy,Youngstown State,24,22,10,5,0,Bryce Nickels Defensive Rebound.
Detroit Mercy,Youngstown State,24,24,10,16,1,Cameron Morse made Layup.
Detroit Mercy,Youngstown State,24,24,10,29,0,Jarod Williams missed Layup.
Detroit Mercy,Youngstown State,24,24,10,29,0,Cameron Morse Defensive Rebound.
Detroit Mercy,Youngstown State,24,24,10,35,0,Cameron Morse missed Three Point Jumper.
Detroit Mercy,Youngstown State,24,24,10,35,0,Jarod Williams Defensive Rebound.
Detroit Mercy,Youngstown State,24,24,10,45,0,Matthew Grant missed Jumper.
Detroit Mercy,Youngstown State,24,24,10,45,0,Gerald Blackshear Offensive Rebound.
Detroit Mercy,Youngstown State,24,24,10,47,0,Gerald Blackshear missed Two Point Tip Shot.
Detroit Mercy,Youngstown State,24,24,10,47,0,Detroit Deadball Team Rebound.
Detroit Mercy,Youngstown State,24,24,10,47,0,Foul on Francisco Santiago.
Detroit Mercy,Youngstown State,24,24,10,47,0,Gerald Blackshear missed Free Throw.
Detroit Mercy,Youngstown State,24,24,10,47,0,Detroit Deadball Team Rebound.
Detroit Mercy,Youngstown State,24,24,10,47,0,Gerald Blackshear missed Free Throw.
Detroit Mercy,Youngstown State,24,24,10,47,0,Aaron Foster-Smith Offensive Rebound.
Detroit Mercy,Youngstown State,26,24,10,49,1,Aaron Foster-Smith made Jumper.
Detroit Mercy,Youngstown State,26,24,11,11,0,Bryce Nickels missed Jumper.
Detroit Mercy,Youngstown State,26,24,11,11,0,Carlton Brundidge Defensive Rebound.
Detroit Mercy,Youngstown State,26,24,11,20,0,Carlton Brundidge missed Jumper.
Detroit Mercy,Youngstown State,26,24,11,20,0,Bryce Nickels Defensive Rebound.
Detroit Mercy,Youngstown State,26,24,11,30,0,Jordan Andrews missed Three Point Jumper.
Detroit Mercy,Youngstown State,26,24,11,30,0,Anton Wilson Defensive Rebound.
Detroit Mercy,Youngstown State,26,24,11,47,0,Foul on Brett Frantz.
Detroit Mercy,Youngstown State,26,24,11,55,0,Foul on Bryce Nickels.
Detroit Mercy,Youngstown State,27,24,11,55,1,Anton Wilson made Free Throw.
Detroit Mercy,Youngstown State,28,24,11,55,1,Anton Wilson made Free Throw.
Detroit Mercy,Youngstown State,29,24,11,55,1,Anton Wilson made Free Throw.
Detroit Mercy,Youngstown State,29,24,12,10,0,Bryce Nickels missed Jumper.
Detroit Mercy,Youngstown State,29,24,12,10,0,Detroit Defensive Rebound.
Detroit Mercy,Youngstown State,29,24,12,17,0,Official TV Timeout
Detroit Mercy,Youngstown State,29,24,12,33,0,Detroit  Timeout
Detroit Mercy,Youngstown State,29,24,12,41,0,Matthew Grant missed Three Point Jumper.
Detroit Mercy,Youngstown State,29,24,12,41,0,Cameron Morse Defensive Rebound.
Detroit Mercy,Youngstown State,29,24,13,0,0,Matt Donlan missed Jumper.
Detroit Mercy,Youngstown State,29,24,13,0,0,Matthew Grant Defensive Rebound.
Detroit Mercy,Youngstown State,31,24,13,3,1,Anton Wilson made Layup. Assisted by Matthew Grant.
Detroit Mercy,Youngstown State,31,24,13,20,0,Francisco Santiago Turnover.
Detroit Mercy,Youngstown State,31,24,13,21,0,Anton Wilson Steal.
Detroit Mercy,Youngstown State,31,24,13,40,0,Paris Bass missed Jumper.
Detroit Mercy,Youngstown State,31,24,13,40,0,Jordan Andrews Defensive Rebound.
Detroit Mercy,Youngstown State,31,27,13,54,1,Matt Donlan made Three Point Jumper. Assisted by Francisco Santiago.
Detroit Mercy,Youngstown State,33,27,14,18,1,Jaleel Hogan made Jumper.
Detroit Mercy,Youngstown State,33,29,14,34,1,Cameron Morse made Layup.
Detroit Mercy,Youngstown State,35,29,14,49,1,Anton Wilson made Jumper.
Detroit Mercy,Youngstown State,35,29,15,11,0,Foul on Paris Bass.
Detroit Mercy,Youngstown State,35,30,15,11,1,Cameron Morse made Free Throw.
Detroit Mercy,Youngstown State,35,31,15,11,1,Cameron Morse made Free Throw.
Detroit Mercy,Youngstown State,35,31,15,19,0,Anton Wilson Turnover.
Detroit Mercy,Youngstown State,35,31,15,21,0,Devin Haygood Steal.
Detroit Mercy,Youngstown State,35,31,15,26,0,Devin Haygood missed Dunk.
Detroit Mercy,Youngstown State,35,31,15,26,0,Latin Davis Offensive Rebound.
Detroit Mercy,Youngstown State,35,34,15,29,1,Brett Frantz made Three Point Jumper. Assisted by Latin Davis.
Detroit Mercy,Youngstown State,35,34,15,46,0,Foul on Cameron Morse.
Detroit Mercy,Youngstown State,36,34,15,46,1,Paris Bass made Free Throw.
Detroit Mercy,Youngstown State,37,34,15,46,1,Paris Bass made Free Throw.
Detroit Mercy,Youngstown State,37,34,16,3,0,Foul on Jaleel Hogan.
Detroit Mercy,Youngstown State,37,34,16,3,0,Official TV Timeout
Detroit Mercy,Youngstown State,37,34,16,3,0,Latin Davis missed Free Throw.
Detroit Mercy,Youngstown State,37,34,16,3,0,Youngstown St Deadball Team Rebound.
Detroit Mercy,Youngstown State,37,34,16,3,0,Latin Davis missed Free Throw.
Detroit Mercy,Youngstown State,37,34,16,3,0,Chris Jenkins Defensive Rebound.
Detroit Mercy,Youngstown State,37,34,16,17,0,Jaleel Hogan Turnover.
Detroit Mercy,Youngstown State,37,36,16,37,1,Cameron Morse made Jumper.
Detroit Mercy,Youngstown State,37,36,16,49,0,Josh McFolley missed Three Point Jumper.
Detroit Mercy,Youngstown State,37,36,16,49,0,Brett Frantz Defensive Rebound.
Detroit Mercy,Youngstown State,37,38,16,57,1,Bryce Nickels made Layup. Assisted by Latin Davis.
Detroit Mercy,Youngstown State,39,38,17,11,1,Jaleel Hogan made Jumper.
Detroit Mercy,Youngstown State,39,38,17,31,0,Foul on Paris Bass.
Detroit Mercy,Youngstown State,39,38,17,31,0,Cameron Morse missed Free Throw.
Detroit Mercy,Youngstown State,39,38,17,31,0,Youngstown St Deadball Team Rebound.
Detroit Mercy,Youngstown State,39,39,17,31,1,Cameron Morse made Free Throw.
Detroit Mercy,Youngstown State,41,39,17,48,1,Jaleel Hogan made Jumper.
Detroit Mercy,Youngstown State,41,39,18,5,0,Latin Davis missed Three Point Jumper.
Detroit Mercy,Youngstown State,41,39,18,5,0,Chris Jenkins Defensive Rebound.
Detroit Mercy,Youngstown State,41,39,18,15,0,Chris Jenkins Turnover.
Detroit Mercy,Youngstown State,41,42,18,27,1,Cameron Morse made Three Point Jumper. Assisted by Bryce Nickels.
Detroit Mercy,Youngstown State,43,42,18,49,1,Carlton Brundidge made Layup.
Detroit Mercy,Youngstown State,43,44,18,58,1,Bryce Nickels made Dunk. Assisted by Brett Frantz.
Detroit Mercy,Youngstown State,45,44,19,16,1,Anton Wilson made Jumper.
Detroit Mercy,Youngstown State,45,44,19,35,0,Bryce Nickels Turnover.
Detroit Mercy,Youngstown State,45,44,19,37,0,Matthew Grant Steal.
Detroit Mercy,Youngstown State,45,44,19,41,0,Matthew Grant Turnover.
Detroit Mercy,Youngstown State,45,44,19,42,0,Brett Frantz Steal.
Detroit Mercy,Youngstown State,45,44,19,47,0,Youngstown St  Timeout
Detroit Mercy,Youngstown State,45,44,20,0,0,Cameron Morse missed Three Point Jumper.
Detroit Mercy,Youngstown State,45,44,20,0,0,Youngstown St Deadball Team Rebound.
Detroit Mercy,Youngstown State,45,44,20,0,0,End of 1st half
Detroit Mercy,Youngstown State,45,44,20,7,0,Foul on Jaleel Hogan.
Detroit Mercy,Youngstown State,45,44,20,9,0,Francisco Santiago missed Three Point Jumper.
Detroit Mercy,Youngstown State,45,44,20,9,0,Chris Jenkins Defensive Rebound.
Detroit Mercy,Youngstown State,45,44,20,25,0,Gerald Blackshear Turnover.
Detroit Mercy,Youngstown State,45,44,20,27,0,Devin Haygood Steal.
Detroit Mercy,Youngstown State,45,47,20,31,1,Matt Donlan made Three Point Jumper. Assisted by Francisco Santiago.
Detroit Mercy,Youngstown State,45,47,20,56,0,Paris Bass Turnover.
Detroit Mercy,Youngstown State,45,47,20,57,0,Cameron Morse Steal.
Detroit Mercy,Youngstown State,45,49,20,59,1,Cameron Morse made Layup. Assisted by Francisco Santiago.
Detroit Mercy,Youngstown State,48,49,21,16,1,Josh McFolley made Three Point Jumper. Assisted by Chris Jenkins.
Detroit Mercy,Youngstown State,48,51,21,38,1,Devin Haygood made Layup. Assisted by Francisco Santiago.
Detroit Mercy,Youngstown State,50,51,21,57,1,Paris Bass made Jumper. Assisted by Gerald Blackshear.
Detroit Mercy,Youngstown State,50,51,22,15,0,Francisco Santiago Turnover.
Detroit Mercy,Youngstown State,50,51,22,17,0,Josh McFolley Steal.
Detroit Mercy,Youngstown State,50,51,22,21,0,Josh McFolley missed Layup.
Detroit Mercy,Youngstown State,50,51,22,21,0,Cameron Morse Defensive Rebound.
Detroit Mercy,Youngstown State,50,54,22,27,1,Jordan Andrews made Three Point Jumper. Assisted by Matt Donlan.
Detroit Mercy,Youngstown State,52,54,22,48,1,Paris Bass made Jumper.
Detroit Mercy,Youngstown State,52,54,22,48,0,Foul on Matt Donlan.
Detroit Mercy,Youngstown State,53,54,22,48,1,Paris Bass made Free Throw.
Detroit Mercy,Youngstown State,53,54,22,58,0,Jordan Andrews missed Three Point Jumper.
Detroit Mercy,Youngstown State,53,54,22,58,0,Anton Wilson Block.
Detroit Mercy,Youngstown State,53,54,23,1,0,Gerald Blackshear Defensive Rebound.
Detroit Mercy,Youngstown State,53,54,23,6,0,Foul on Paris Bass.
Detroit Mercy,Youngstown State,53,54,23,6,0,Paris Bass Turnover.
Detroit Mercy,Youngstown State,53,54,23,21,0,Foul on Carlton Brundidge.
Detroit Mercy,Youngstown State,53,56,23,31,1,Matt Donlan made Layup.
Detroit Mercy,Youngstown State,53,56,23,44,0,Josh McFolley Turnover.
Detroit Mercy,Youngstown State,53,56,24,10,0,Cameron Morse Turnover.
Detroit Mercy,Youngstown State,53,56,24,12,0,Anton Wilson Steal.
Detroit Mercy,Youngstown State,53,56,24,14,0,Official TV Timeout
Detroit Mercy,Youngstown State,55,56,24,30,1,Carlton Brundidge made Layup. Assisted by Anton Wilson.
Detroit Mercy,Youngstown State,55,56,24,45,0,Matt Donlan Turnover.
Detroit Mercy,Youngstown State,55,56,24,47,0,Gerald Blackshear Steal.
Detroit Mercy,Youngstown State,55,56,24,49,0,Foul on Chris Jenkins.
Detroit Mercy,Youngstown State,55,56,24,49,0,Chris Jenkins Turnover.
Detroit Mercy,Youngstown State,55,56,25,2,0,Francisco Santiago Turnover.
Detroit Mercy,Youngstown State,58,56,25,28,1,Josh McFolley made Three Point Jumper.
Detroit Mercy,Youngstown State,58,56,25,50,0,Foul on Josh McFolley.
Detroit Mercy,Youngstown State,58,59,25,52,1,Matt Donlan made Three Point Jumper. Assisted by Francisco Santiago.
Detroit Mercy,Youngstown State,58,59,26,10,0,Anton Wilson missed Three Point Jumper.
Detroit Mercy,Youngstown State,58,59,26,10,0,Matt Donlan Defensive Rebound.
Detroit Mercy,Youngstown State,58,59,26,18,0,Francisco Santiago Turnover.
Detroit Mercy,Youngstown State,58,59,26,19,0,Josh McFolley Steal.
Detroit Mercy,Youngstown State,58,59,26,30,0,Carlton Brundidge missed Layup.
Detroit Mercy,Youngstown State,58,59,26,30,0,Francisco Santiago Block.
Detroit Mercy,Youngstown State,58,59,26,32,0,Devin Haygood Defensive Rebound.
Detroit Mercy,Youngstown State,58,59,26,35,0,Matt Donlan missed Three Point Jumper.
Detroit Mercy,Youngstown State,58,59,26,35,0,Gerald Blackshear Defensive Rebound.
Detroit Mercy,Youngstown State,60,59,26,48,1,Josh McFolley made Layup.
Detroit Mercy,Youngstown State,60,59,26,48,0,Foul on Cameron Morse.
Detroit Mercy,Youngstown State,61,59,26,48,1,Josh McFolley made Free Throw.
Detroit Mercy,Youngstown State,61,59,26,50,0,Youngstown St  Timeout
Detroit Mercy,Youngstown State,61,61,27,3,1,Devin Haygood made Dunk. Assisted by Cameron Morse.
Detroit Mercy,Youngstown State,61,61,27,23,0,Foul on Matt Donlan.
Detroit Mercy,Youngstown State,61,61,27,23,0,Chris Jenkins missed Free Throw.
Detroit Mercy,Youngstown State,61,61,27,23,0,Detroit Deadball Team Rebound.
Detroit Mercy,Youngstown State,61,61,27,23,0,Chris Jenkins missed Free Throw.
Detroit Mercy,Youngstown State,61,61,27,23,0,Jordan Andrews Defensive Rebound.
Detroit Mercy,Youngstown State,61,61,27,31,0,Cameron Morse missed Layup.
Detroit Mercy,Youngstown State,61,61,27,31,0,Devin Haygood Offensive Rebound.
Detroit Mercy,Youngstown State,61,63,27,37,1,Devin Haygood made Two Point Tip Shot.
Detroit Mercy,Youngstown State,61,63,27,48,0,Chris Jenkins missed Three Point Jumper.
Detroit Mercy,Youngstown State,61,63,27,48,0,Cameron Morse Defensive Rebound.
Detroit Mercy,Youngstown State,61,63,27,59,0,Foul on Josh McFolley.
Detroit Mercy,Youngstown State,61,64,27,59,1,Jordan Andrews made Free Throw.
Detroit Mercy,Youngstown State,61,64,27,59,0,Jordan Andrews missed Free Throw.
Detroit Mercy,Youngstown State,61,64,27,59,0,Aaron Foster-Smith Defensive Rebound.
Detroit Mercy,Youngstown State,61,64,28,18,0,Carlton Brundidge missed Jumper.
Detroit Mercy,Youngstown State,61,64,28,18,0,Detroit Offensive Rebound.
Detroit Mercy,Youngstown State,61,64,28,21,0,Official TV Timeout
Detroit Mercy,Youngstown State,64,64,28,42,1,Aaron Foster-Smith made Three Point Jumper. Assisted by Carlton Brundidge.
Detroit Mercy,Youngstown State,64,64,29,3,0,Foul on Aaron Foster-Smith.
Detroit Mercy,Youngstown State,64,64,29,3,0,Matt Donlan missed Free Throw.
Detroit Mercy,Youngstown State,64,64,29,3,0,Jaleel Hogan Defensive Rebound.
Detroit Mercy,Youngstown State,64,64,29,21,0,Foul on Devin Haygood.
Detroit Mercy,Youngstown State,64,64,29,21,0,Jaleel Hogan missed Free Throw.
Detroit Mercy,Youngstown State,64,64,29,21,0,Detroit Deadball Team Rebound.
Detroit Mercy,Youngstown State,65,64,29,21,1,Jaleel Hogan made Free Throw.
Detroit Mercy,Youngstown State,65,64,29,32,0,Cameron Morse missed Jumper.
Detroit Mercy,Youngstown State,65,64,29,32,0,Jaleel Hogan Block.
Detroit Mercy,Youngstown State,65,64,29,34,0,Matthew Grant Defensive Rebound.
Detroit Mercy,Youngstown State,67,64,29,39,1,Carlton Brundidge made Layup. Assisted by Anton Wilson.
Detroit Mercy,Youngstown State,67,64,29,56,0,Jordan Andrews missed Three Point Jumper.
Detroit Mercy,Youngstown State,67,64,29,56,0,Latin Davis Offensive Rebound.
Detroit Mercy,Youngstown State,67,67,30,10,1,Cameron Morse made Three Point Jumper.
Detroit Mercy,Youngstown State,67,67,30,31,0,Carlton Brundidge missed Layup.
Detroit Mercy,Youngstown State,67,67,30,31,0,Latin Davis Defensive Rebound.
Detroit Mercy,Youngstown State,67,69,30,37,1,Latin Davis made Layup.
Detroit Mercy,Youngstown State,67,69,30,57,0,Anton Wilson missed Three Point Jumper.
Detroit Mercy,Youngstown State,67,69,30,57,0,Matthew Grant Offensive Rebound.
Detroit Mercy,Youngstown State,67,69,31,9,0,Jaleel Hogan missed Layup.
Detroit Mercy,Youngstown State,67,69,31,9,0,Carlton Brundidge Offensive Rebound.
Detroit Mercy,Youngstown State,69,69,31,13,1,Carlton Brundidge made Two Point Tip Shot.
Detroit Mercy,Youngstown State,69,69,31,21,0,Foul on Matthew Grant.
Detroit Mercy,Youngstown State,69,70,31,21,1,Cameron Morse made Free Throw.
Detroit Mercy,Youngstown State,69,70,31,21,0,Cameron Morse missed Free Throw.
Detroit Mercy,Youngstown State,69,70,31,21,0,Jaleel Hogan Defensive Rebound.
Detroit Mercy,Youngstown State,69,70,31,41,0,Jaleel Hogan missed Jumper.
Detroit Mercy,Youngstown State,69,70,31,41,0,Devin Haygood Block.
Detroit Mercy,Youngstown State,69,70,31,44,0,Devin Haygood Defensive Rebound.
Detroit Mercy,Youngstown State,69,70,31,58,0,Matt Donlan missed Jumper.
Detroit Mercy,Youngstown State,69,70,31,58,0,Aaron Foster-Smith Defensive Rebound.
Detroit Mercy,Youngstown State,71,70,32,15,1,Carlton Brundidge made Jumper.
Detroit Mercy,Youngstown State,71,70,32,37,0,Devin Haygood Turnover.
Detroit Mercy,Youngstown State,71,70,32,37,0,Official TV Timeout
Detroit Mercy,Youngstown State,71,70,32,47,0,Foul on Jaleel Hogan.
Detroit Mercy,Youngstown State,71,70,32,47,0,Jaleel Hogan Turnover.
Detroit Mercy,Youngstown State,71,72,32,56,1,Cameron Morse made Layup.
Detroit Mercy,Youngstown State,73,72,33,11,1,Carlton Brundidge made Layup.
Detroit Mercy,Youngstown State,73,72,33,33,0,Foul on Paris Bass.
Detroit Mercy,Youngstown State,73,73,33,33,1,Latin Davis made Free Throw.
Detroit Mercy,Youngstown State,73,74,33,33,1,Latin Davis made Free Throw.
Detroit Mercy,Youngstown State,73,74,33,47,0,Foul on Devin Haygood.
Detroit Mercy,Youngstown State,73,74,33,50,0,Carlton Brundidge missed Jumper.
Detroit Mercy,Youngstown State,73,74,33,50,0,Carlton Brundidge Offensive Rebound.
Detroit Mercy,Youngstown State,76,74,33,55,1,Anton Wilson made Three Point Jumper. Assisted by Carlton Brundidge.
Detroit Mercy,Youngstown State,76,76,34,9,1,Latin Davis made Layup.
Detroit Mercy,Youngstown State,76,76,34,9,0,Foul on Matthew Grant.
Detroit Mercy,Youngstown State,76,76,34,9,0,Latin Davis missed Free Throw.
Detroit Mercy,Youngstown State,76,76,34,9,0,Paris Bass Defensive Rebound.
Detroit Mercy,Youngstown State,76,76,34,19,0,Paris Bass missed Jumper.
Detroit Mercy,Youngstown State,76,76,34,19,0,Brett Frantz Defensive Rebound.
Detroit Mercy,Youngstown State,76,76,34,23,0,Brett Frantz Turnover.
Detroit Mercy,Youngstown State,76,76,34,24,0,Matthew Grant Steal.
Detroit Mercy,Youngstown State,78,76,34,27,1,Paris Bass made Dunk. Assisted by Anton Wilson.
Detroit Mercy,Youngstown State,78,76,34,42,0,Foul on Anton Wilson.
Detroit Mercy,Youngstown State,78,77,34,42,1,Cameron Morse made Free Throw.
Detroit Mercy,Youngstown State,78,78,34,42,1,Cameron Morse made Free Throw.
Detroit Mercy,Youngstown State,80,78,34,58,1,Paris Bass made Jumper.
Detroit Mercy,Youngstown State,80,78,34,59,0,Detroit  Timeout
Detroit Mercy,Youngstown State,80,78,35,17,0,Matt Donlan missed Three Point Jumper.
Detroit Mercy,Youngstown State,80,78,35,17,0,Paris Bass Defensive Rebound.
Detroit Mercy,Youngstown State,80,78,35,26,0,Paris Bass missed Jumper.
Detroit Mercy,Youngstown State,80,78,35,26,0,Paris Bass Offensive Rebound.
Detroit Mercy,Youngstown State,80,78,35,31,0,Paris Bass missed Two Point Tip Shot.
Detroit Mercy,Youngstown State,80,78,35,31,0,Cameron Morse Defensive Rebound.
Detroit Mercy,Youngstown State,80,81,35,45,1,Brett Frantz made Three Point Jumper. Assisted by Latin Davis.
Detroit Mercy,Youngstown State,80,81,36,4,0,Paris Bass missed Jumper.
Detroit Mercy,Youngstown State,80,81,36,4,0,Detroit Offensive Rebound.
Detroit Mercy,Youngstown State,80,81,36,7,0,Official TV Timeout
Detroit Mercy,Youngstown State,80,81,36,11,0,Foul on Matt Donlan.
Detroit Mercy,Youngstown State,80,81,36,18,0,Foul on Matt Donlan.
Detroit Mercy,Youngstown State,81,81,36,18,1,Paris Bass made Free Throw.
Detroit Mercy,Youngstown State,82,81,36,18,1,Paris Bass made Free Throw.
Detroit Mercy,Youngstown State,82,81,36,27,0,Foul on Bryce Nickels.
Detroit Mercy,Youngstown State,82,81,36,27,0,Bryce Nickels Turnover.
Detroit Mercy,Youngstown State,84,81,36,38,1,Paris Bass made Jumper.
Detroit Mercy,Youngstown State,84,81,36,48,0,Youngstown St  Timeout
Detroit Mercy,Youngstown State,84,83,37,2,1,Brett Frantz made Layup.
Detroit Mercy,Youngstown State,86,83,37,13,1,Paris Bass made Layup. Assisted by Josh McFolley.
Detroit Mercy,Youngstown State,86,85,37,39,1,Cameron Morse made Layup.
Detroit Mercy,Youngstown State,86,85,38,1,0,Foul on Devin Haygood.
Detroit Mercy,Youngstown State,87,85,38,1,1,Chris Jenkins made Free Throw.
Detroit Mercy,Youngstown State,87,85,38,1,0,Chris Jenkins missed Free Throw.
Detroit Mercy,Youngstown State,87,85,38,1,0,Latin Davis Defensive Rebound.
Detroit Mercy,Youngstown State,87,87,38,14,1,Brett Frantz made Layup. Assisted by Cameron Morse.
Detroit Mercy,Youngstown State,89,87,38,28,1,Josh McFolley made Jumper.
Detroit Mercy,Youngstown State,89,87,38,32,0,Detroit  Timeout
Detroit Mercy,Youngstown State,89,87,38,44,0,Matt Donlan missed Three Point Jumper.
Detroit Mercy,Youngstown State,89,87,38,44,0,Carlton Brundidge Defensive Rebound.
Detroit Mercy,Youngstown State,91,87,38,51,1,Paris Bass made Dunk. Assisted by Anton Wilson.
Detroit Mercy,Youngstown State,91,87,39,4,0,Brett Frantz missed Layup.
Detroit Mercy,Youngstown State,91,87,39,4,0,Bryce Nickels Offensive Rebound.
Detroit Mercy,Youngstown State,91,87,39,7,0,Bryce Nickels missed Two Point Tip Shot.
Detroit Mercy,Youngstown State,91,87,39,7,0,Anton Wilson Defensive Rebound.
Detroit Mercy,Youngstown State,91,87,39,12,0,Carlton Brundidge missed Layup.
Detroit Mercy,Youngstown State,91,87,39,12,0,Brett Frantz Defensive Rebound.
Detroit Mercy,Youngstown State,91,89,39,24,1,Latin Davis made Layup. Assisted by Brett Frantz.
Detroit Mercy,Youngstown State,91,89,39,27,0,Youngstown St  Timeout
Detroit Mercy,Youngstown State,91,89,39,48,0,Foul on Matt Donlan.
Detroit Mercy,Youngstown State,91,89,39,48,0,Paris Bass missed Free Throw.
Detroit Mercy,Youngstown State,91,89,39,48,0,Detroit Deadball Team Rebound.
Detroit Mercy,Youngstown State,92,89,39,48,1,Paris Bass made Free Throw.
Detroit Mercy,Youngstown State,92,89,39,50,0,Foul on Latin Davis.
Detroit Mercy,Youngstown State,93,89,39,50,1,Josh McFolley made Free Throw.
Detroit Mercy,Youngstown State,94,89,39,50,1,Josh McFolley made Free Throw.
