Away Team,Home Team,Away Score,Home Score,Minute,Second,isScoringPosession,Desc.
Huston-Tillotson,Sam Houston State,0,0,0,9,0,Anthony Carroll missed Jumper.
Huston-Tillotson,Sam Houston State,0,0,0,9,0,Calvin McGhee Offensive Rebound.
Huston-Tillotson,Sam Houston State,2,0,0,17,1,Ronzelle Fort made Layup.  Assisted by Calvin McGhee.
Huston-Tillotson,Sam Houston State,2,0,0,38,0,Michael Holyfield Turnover.
Huston-Tillotson,Sam Houston State,2,0,0,40,0,Calvin McGhee Steal.
Huston-Tillotson,Sam Houston State,2,0,0,43,0,Calvin McGhee missed Layup.
Huston-Tillotson,Sam Houston State,2,0,0,43,0,Darius Gatson Defensive Rebound.
Huston-Tillotson,Sam Houston State,2,0,0,51,0,Demarcus Gatlin missed Layup.
Huston-Tillotson,Sam Houston State,2,0,0,51,0,Ronzelle Fort Block.
Huston-Tillotson,Sam Houston State,2,0,0,51,0,Sam Houston State Offensive Rebo.
Huston-Tillotson,Sam Houston State,2,0,1,2,0,Foul on Ronzelle Fort
Huston-Tillotson,Sam Houston State,2,3,1,20,1,Marquel McKinney made Three Point Jumper.  Assisted by Demarcus Gatlin.
Huston-Tillotson,Sam Houston State,2,3,1,29,0,Foul on Marquel McKinney
Huston-Tillotson,Sam Houston State,2,3,1,48,0,Demetrius Smith Turnover.
Huston-Tillotson,Sam Houston State,2,3,1,50,0,Marquel McKinney Steal.
Huston-Tillotson,Sam Houston State,2,3,1,53,0,Darius Gatson Turnover.
Huston-Tillotson,Sam Houston State,2,3,1,56,0,Demetrius Smith Steal.
Huston-Tillotson,Sam Houston State,2,3,2,7,0,Demetrius Smith missed Three Point Jumper.
Huston-Tillotson,Sam Houston State,2,3,2,7,0,Darius Gatson Defensive Rebound.
Huston-Tillotson,Sam Houston State,2,5,2,14,1,Darius Gatson made Jumper.  Assisted by Demarcus Gatlin.
Huston-Tillotson,Sam Houston State,4,5,2,36,1,Ronzelle Fort made Jumper.  Assisted by Calvin McGhee.
Huston-Tillotson,Sam Houston State,4,5,2,53,0,Demarcus Gatlin Turnover.
Huston-Tillotson,Sam Houston State,4,5,2,54,0,Demetrius Smith Steal.
Huston-Tillotson,Sam Houston State,6,5,2,56,1,Demetrius Smith made Dunk.
Huston-Tillotson,Sam Houston State,6,7,3,16,1,Demarcus Gatlin made Layup.
Huston-Tillotson,Sam Houston State,8,7,3,28,1,Ronzelle Fort made Jumper.  Assisted by Anthony Carroll.
Huston-Tillotson,Sam Houston State,8,7,3,55,0,Terrance Motley missed Jumper.
Huston-Tillotson,Sam Houston State,8,7,3,55,0,Marquel McKinney Offensive Rebound.
Huston-Tillotson,Sam Houston State,8,7,4,2,0,Darius Gatson missed Three Point Jumper.
Huston-Tillotson,Sam Houston State,8,7,4,2,0,Demetrius Smith Defensive Rebound.
Huston-Tillotson,Sam Houston State,8,7,4,9,0,Demetrius Smith Turnover.
Huston-Tillotson,Sam Houston State,8,7,4,9,0,Foul on Demetrius Smith
Huston-Tillotson,Sam Houston State,8,7,4,10,0,Darius Gatson Turnover.
Huston-Tillotson,Sam Houston State,8,7,4,10,0,Demetrius Smith Steal.
Huston-Tillotson,Sam Houston State,10,7,4,10,1,Demetrius Smith made Layup.
Huston-Tillotson,Sam Houston State,10,7,4,11,0,Nathaniel Mason Turnover.
Huston-Tillotson,Sam Houston State,10,7,4,37,0,Ronzelle Fort missed Layup.
Huston-Tillotson,Sam Houston State,10,7,4,37,0,Michael Holyfield Defensive Rebound.
Huston-Tillotson,Sam Houston State,10,9,4,45,1,Aaron Harwell made Jumper.  Assisted by Michael Holyfield.
Huston-Tillotson,Sam Houston State,10,9,4,59,0,Christopher Edwards Turnover.
Huston-Tillotson,Sam Houston State,10,9,5,1,0,James Thomas Steal.
Huston-Tillotson,Sam Houston State,10,11,5,3,1,Aaron Harwell made Jumper.  Assisted by James Thomas.
Huston-Tillotson,Sam Houston State,10,11,5,15,0,Calvin McGhee Turnover.
Huston-Tillotson,Sam Houston State,10,11,5,17,0,Nathaniel Mason Steal.
Huston-Tillotson,Sam Houston State,10,13,5,19,1,Nathaniel Mason made Layup.
Huston-Tillotson,Sam Houston State,10,13,5,45,0,Calvin McGhee Turnover.
Huston-Tillotson,Sam Houston State,10,13,5,45,0,Aaron Harwell Steal.
Huston-Tillotson,Sam Houston State,10,13,6,15,0,Michael Holyfield Turnover.
Huston-Tillotson,Sam Houston State,10,13,6,15,0,Demetrius Smith Steal.
Huston-Tillotson,Sam Houston State,10,13,6,15,0,Demetrius Smith Turnover.
Huston-Tillotson,Sam Houston State,10,15,6,19,1,James Thomas made Layup.  Assisted by Will Bond.
Huston-Tillotson,Sam Houston State,10,15,6,26,0,Lance Richardson Turnover.
Huston-Tillotson,Sam Houston State,10,17,6,29,1,James Thomas made Layup.  Assisted by Aaron Harwell.
Huston-Tillotson,Sam Houston State,10,17,6,39,0,Tyrice Hill missed Layup.
Huston-Tillotson,Sam Houston State,10,17,6,39,0,Demetrius Smith Offensive Rebound.
Huston-Tillotson,Sam Houston State,12,17,6,44,1,Demetrius Smith made Dunk.
Huston-Tillotson,Sam Houston State,12,17,6,56,0,Foul on Tyrice Hill
Huston-Tillotson,Sam Houston State,12,17,7,2,0,Jeremy McKay missed Three Point Jumper.
Huston-Tillotson,Sam Houston State,12,17,7,2,0,Will Bond Offensive Rebound.
Huston-Tillotson,Sam Houston State,12,17,7,24,0,Will Bond missed Jumper.
Huston-Tillotson,Sam Houston State,12,17,7,24,0,Michael Holyfield Offensive Rebound.
Huston-Tillotson,Sam Houston State,12,17,7,29,0,James Thomas Turnover.
Huston-Tillotson,Sam Houston State,12,17,7,30,0,Marquavius James Steal.
Huston-Tillotson,Sam Houston State,12,17,7,33,0,Marquavius James Turnover.
Huston-Tillotson,Sam Houston State,12,17,7,33,0,Foul on Marquavius James
Huston-Tillotson,Sam Houston State,12,17,7,44,0,Marquel McKinney missed Three Point Jumper.
Huston-Tillotson,Sam Houston State,12,17,7,44,0,Calvin McGhee Defensive Rebound.
Huston-Tillotson,Sam Houston State,14,17,7,52,1,Lance Richardson made Layup.  Assisted by Tyrice Hill.
Huston-Tillotson,Sam Houston State,14,17,8,14,0,Terrance Motley missed Layup.
Huston-Tillotson,Sam Houston State,14,17,8,14,0,Jamal Scantlebury Defensive Rebound.
Huston-Tillotson,Sam Houston State,14,17,8,39,0,Tyrice Hill missed Jumper.
Huston-Tillotson,Sam Houston State,14,17,8,39,0,Jeremy McKay Defensive Rebound.
Huston-Tillotson,Sam Houston State,14,19,8,56,1,Marquel McKinney made Layup.  Assisted by Paul Baxter.
Huston-Tillotson,Sam Houston State,14,19,9,10,0,Calvin McGhee Turnover.
Huston-Tillotson,Sam Houston State,14,19,9,21,0,Will Bond missed Three Point Jumper.
Huston-Tillotson,Sam Houston State,14,19,9,21,0,Calvin McGhee Defensive Rebound.
Huston-Tillotson,Sam Houston State,14,19,9,49,0,Lance Richardson missed Jumper.
Huston-Tillotson,Sam Houston State,14,19,9,49,0,Demetrius Smith Offensive Rebound.
Huston-Tillotson,Sam Houston State,14,19,10,1,0,Foul on Darius Gatson
Huston-Tillotson,Sam Houston State,15,19,10,1,1,Demetrius Smith made Free Throw.
Huston-Tillotson,Sam Houston State,16,19,10,1,1,Demetrius Smith made Free Throw.
Huston-Tillotson,Sam Houston State,16,19,10,14,0,Terrance Motley missed Layup.
Huston-Tillotson,Sam Houston State,16,19,10,14,0,Marquel McKinney Offensive Rebound.
Huston-Tillotson,Sam Houston State,16,19,10,15,0,Foul on Christopher Edwards
Huston-Tillotson,Sam Houston State,16,20,10,15,1,Terrance Motley made Free Throw.
Huston-Tillotson,Sam Houston State,16,20,10,15,0,Terrance Motley missed Free Throw.
Huston-Tillotson,Sam Houston State,16,20,10,15,0,Christopher Edwards Defensive Rebound.
Huston-Tillotson,Sam Houston State,16,20,10,28,0,Anthony Carroll Turnover.
Huston-Tillotson,Sam Houston State,16,20,10,30,0,Demarcus Gatlin Steal.
Huston-Tillotson,Sam Houston State,16,20,10,33,0,Paul Baxter missed Layup.
Huston-Tillotson,Sam Houston State,16,20,10,33,0,Calvin McGhee Defensive Rebound.
Huston-Tillotson,Sam Houston State,16,20,10,52,0,Christopher Edwards missed Layup.
Huston-Tillotson,Sam Houston State,16,20,10,52,0,Demarcus Gatlin Defensive Rebound.
Huston-Tillotson,Sam Houston State,16,20,11,8,0,Darius Gatson Turnover.
Huston-Tillotson,Sam Houston State,16,20,11,23,0,Marquavius James missed Jumper.
Huston-Tillotson,Sam Houston State,16,20,11,23,0,Terrance Motley Defensive Rebound.
Huston-Tillotson,Sam Houston State,16,20,11,33,0,Demarcus Gatlin missed Jumper.
Huston-Tillotson,Sam Houston State,16,20,11,33,0,Demetrius Smith Defensive Rebound.
Huston-Tillotson,Sam Houston State,16,20,11,59,0,Foul on Terrance Motley
Huston-Tillotson,Sam Houston State,17,20,11,59,1,Ronzelle Fort made Free Throw.
Huston-Tillotson,Sam Houston State,17,20,11,59,0,Ronzelle Fort missed Free Throw.
Huston-Tillotson,Sam Houston State,17,20,11,59,0,Marquel McKinney Defensive Rebound.
Huston-Tillotson,Sam Houston State,17,20,12,16,0,Foul on Jonathan Douglas
Huston-Tillotson,Sam Houston State,17,22,12,33,1,Nathaniel Mason made Jumper.  Assisted by Aaron Harwell.
Huston-Tillotson,Sam Houston State,17,22,12,52,0,Demetrius Smith missed Three Point Jumper.
Huston-Tillotson,Sam Houston State,17,22,12,52,0,Sam Houston State Defensive Rebo.
Huston-Tillotson,Sam Houston State,17,22,13,14,0,Foul on Ronzelle Fort
Huston-Tillotson,Sam Houston State,17,23,13,14,1,Nathaniel Mason made Free Throw.
Huston-Tillotson,Sam Houston State,17,24,13,14,1,Nathaniel Mason made Free Throw.
Huston-Tillotson,Sam Houston State,17,24,13,22,0,Marquavius James Turnover.
Huston-Tillotson,Sam Houston State,17,24,13,24,0,Marquel McKinney Steal.
Huston-Tillotson,Sam Houston State,17,24,13,28,0,Darius Gatson missed Three Point Jumper.
Huston-Tillotson,Sam Houston State,17,24,13,28,0,Lance Richardson Defensive Rebound.
Huston-Tillotson,Sam Houston State,17,24,13,46,0,Marquavius James missed Jumper.
Huston-Tillotson,Sam Houston State,17,24,13,46,0,Darius Gatson Defensive Rebound.
Huston-Tillotson,Sam Houston State,17,24,13,51,0,Foul on Calvin McGhee
Huston-Tillotson,Sam Houston State,17,25,13,51,1,James Thomas made Free Throw.
Huston-Tillotson,Sam Houston State,17,25,13,51,0,James Thomas missed Free Throw.
Huston-Tillotson,Sam Houston State,17,25,13,51,0,Lance Richardson Defensive Rebound.
Huston-Tillotson,Sam Houston State,17,25,13,52,0,Foul on James Thomas
Huston-Tillotson,Sam Houston State,19,25,14,6,1,Lance Richardson made Jumper.  Assisted by Calvin McGhee.
Huston-Tillotson,Sam Houston State,19,25,14,29,0,Nathaniel Mason missed Jumper.
Huston-Tillotson,Sam Houston State,19,25,14,29,0,Demetrius Smith Defensive Rebound.
Huston-Tillotson,Sam Houston State,21,25,14,39,1,Demetrius Smith made Layup.  Assisted by Calvin McGhee.
Huston-Tillotson,Sam Houston State,21,25,14,57,0,Darius Gatson missed Three Point Jumper.
Huston-Tillotson,Sam Houston State,21,25,14,57,0,Demarcus Gatlin Offensive Rebound.
Huston-Tillotson,Sam Houston State,21,25,15,1,0,Foul on Demetrius Smith
Huston-Tillotson,Sam Houston State,21,25,15,1,0,Demarcus Gatlin missed Free Throw.
Huston-Tillotson,Sam Houston State,21,25,15,1,0,null
Huston-Tillotson,Sam Houston State,21,26,15,4,1,Demarcus Gatlin made Free Throw.
Huston-Tillotson,Sam Houston State,21,26,15,8,0,Foul on Demarcus Gatlin
Huston-Tillotson,Sam Houston State,21,26,15,10,0,Anthony Carroll Turnover.
Huston-Tillotson,Sam Houston State,21,26,15,17,0,Aaron Harwell missed Three Point Jumper.
Huston-Tillotson,Sam Houston State,21,26,15,17,0,Tyrice Hill Defensive Rebound.
Huston-Tillotson,Sam Houston State,24,26,15,31,1,Tyrice Hill made Three Point Jumper.  Assisted by Tyrice Hill.
Huston-Tillotson,Sam Houston State,24,26,15,43,0,Aaron Harwell missed Jumper.
Huston-Tillotson,Sam Houston State,24,26,15,43,0,Aaron Harwell Offensive Rebound.
Huston-Tillotson,Sam Houston State,24,26,16,3,0,Michael Holyfield missed Layup.
Huston-Tillotson,Sam Houston State,24,26,16,3,0,Jamal Scantlebury Block.
Huston-Tillotson,Sam Houston State,24,26,16,5,0,James Thomas Offensive Rebound.
Huston-Tillotson,Sam Houston State,24,28,16,9,1,James Thomas made Tip Shot.
Huston-Tillotson,Sam Houston State,24,28,16,27,0,Tyrice Hill missed Three Point Jumper.
Huston-Tillotson,Sam Houston State,24,28,16,27,0,Aaron Harwell Defensive Rebound.
Huston-Tillotson,Sam Houston State,24,31,16,49,1,Jeremy McKay made Three Point Jumper.  Assisted by James Thomas.
Huston-Tillotson,Sam Houston State,24,31,17,2,0,Foul on Jeremy McKay
Huston-Tillotson,Sam Houston State,24,31,17,9,0,Tyrice Hill missed Three Point Jumper.
Huston-Tillotson,Sam Houston State,24,31,17,9,0,Demarcus Gatlin Defensive Rebound.
Huston-Tillotson,Sam Houston State,24,31,17,12,0,Foul on Christopher Edwards
Huston-Tillotson,Sam Houston State,24,31,17,12,0,Demarcus Gatlin missed Free Throw.
Huston-Tillotson,Sam Houston State,24,31,17,12,0,null
Huston-Tillotson,Sam Houston State,24,31,17,12,0,Demarcus Gatlin missed Free Throw.
Huston-Tillotson,Sam Houston State,24,31,17,12,0,Lance Richardson Defensive Rebound.
Huston-Tillotson,Sam Houston State,24,31,17,22,0,Tyrice Hill missed Layup.
Huston-Tillotson,Sam Houston State,24,31,17,22,0,Michael Holyfield Block.
Huston-Tillotson,Sam Houston State,24,31,17,22,0,Tyrice Hill Offensive Rebound.
Huston-Tillotson,Sam Houston State,24,31,17,27,0,Foul on Terrance Motley
Huston-Tillotson,Sam Houston State,25,31,17,30,1,Lance Richardson made Free Throw.
Huston-Tillotson,Sam Houston State,26,31,17,30,1,Lance Richardson made Free Throw.
Huston-Tillotson,Sam Houston State,26,33,17,51,1,Demarcus Gatlin made Layup.  Assisted by Marquel McKinney.
Huston-Tillotson,Sam Houston State,26,33,17,51,0,Foul on Tyrice Hill
Huston-Tillotson,Sam Houston State,26,34,17,51,1,Demarcus Gatlin made Free Throw.
Huston-Tillotson,Sam Houston State,26,34,17,59,0,Calvin McGhee Turnover.
Huston-Tillotson,Sam Houston State,26,34,18,1,0,Paul Baxter Steal.
Huston-Tillotson,Sam Houston State,26,34,18,13,0,Demarcus Gatlin missed Layup.
Huston-Tillotson,Sam Houston State,26,34,18,13,0,Fidelis Ifeanyi Defensive Rebound.
Huston-Tillotson,Sam Houston State,26,34,18,14,0,Foul on Marquel McKinney
Huston-Tillotson,Sam Houston State,27,34,18,14,1,Fidelis Ifeanyi made Free Throw.
Huston-Tillotson,Sam Houston State,28,34,18,14,1,Fidelis Ifeanyi made Free Throw.
Huston-Tillotson,Sam Houston State,28,34,18,20,0,Foul on Fidelis Ifeanyi
Huston-Tillotson,Sam Houston State,28,35,18,20,1,Michael Holyfield made Free Throw.
Huston-Tillotson,Sam Houston State,28,35,18,20,0,Michael Holyfield missed Free Throw.
Huston-Tillotson,Sam Houston State,28,35,18,20,0,Lance Richardson Defensive Rebound.
Huston-Tillotson,Sam Houston State,28,35,18,39,0,Anthony Carroll missed Jumper.
Huston-Tillotson,Sam Houston State,28,35,18,39,0,Michael Holyfield Block.
Huston-Tillotson,Sam Houston State,28,35,18,40,0,Michael Holyfield Defensive Rebound.
Huston-Tillotson,Sam Houston State,28,35,18,44,0,Paul Baxter missed Dunk.
Huston-Tillotson,Sam Houston State,28,35,18,44,0,Jonathan Douglas Defensive Rebound.
Huston-Tillotson,Sam Houston State,28,35,19,7,0,Marquavius James Turnover.
Huston-Tillotson,Sam Houston State,28,35,19,8,0,Paul Baxter Steal.
Huston-Tillotson,Sam Houston State,28,37,19,11,1,Paul Baxter made Layup.
Huston-Tillotson,Sam Houston State,28,37,19,22,0,Foul on Will Bond
Huston-Tillotson,Sam Houston State,29,37,19,22,1,Lance Richardson made Free Throw.
Huston-Tillotson,Sam Houston State,30,37,19,22,1,Lance Richardson made Free Throw.
Huston-Tillotson,Sam Houston State,30,37,19,28,0,Foul on Marquavius James
Huston-Tillotson,Sam Houston State,30,37,19,28,0,Paul Baxter missed Free Throw.
Huston-Tillotson,Sam Houston State,30,37,19,28,0,null
Huston-Tillotson,Sam Houston State,30,38,19,28,1,Paul Baxter made Free Throw.
Huston-Tillotson,Sam Houston State,30,38,19,58,0,Tyrice Hill missed Layup.
Huston-Tillotson,Sam Houston State,30,38,19,58,0,Will Bond Block.
Huston-Tillotson,Sam Houston State,30,38,20,0,0,Jeremy McKay Defensive Rebound.
Huston-Tillotson,Sam Houston State,30,38,20,0,0,End of the 1st Half.
Huston-Tillotson,Sam Houston State,30,38,20,12,0,Nathaniel Mason missed Jumper.
Huston-Tillotson,Sam Houston State,30,38,20,12,0,Nathaniel Mason Offensive Rebound.
Huston-Tillotson,Sam Houston State,30,38,20,16,0,Marquel McKinney Turnover.
Huston-Tillotson,Sam Houston State,30,38,20,16,0,Demetrius Smith Steal.
Huston-Tillotson,Sam Houston State,30,38,20,20,0,Christopher Edwards Turnover.
Huston-Tillotson,Sam Houston State,30,40,20,38,1,Darius Gatson made Layup.  Assisted by Demarcus Gatlin.
Huston-Tillotson,Sam Houston State,30,40,20,53,0,Christopher Edwards missed Layup.
Huston-Tillotson,Sam Houston State,30,40,20,53,0,Michael Holyfield Defensive Rebound.
Huston-Tillotson,Sam Houston State,30,42,21,2,1,Darius Gatson made Jumper.  Assisted by Demarcus Gatlin.
Huston-Tillotson,Sam Houston State,30,42,21,18,0,Demetrius Smith Turnover.
Huston-Tillotson,Sam Houston State,30,42,21,18,0,Darius Gatson Steal.
Huston-Tillotson,Sam Houston State,30,42,21,18,0,Foul on Demetrius Smith
Huston-Tillotson,Sam Houston State,30,42,21,36,0,Nathaniel Mason missed Layup.
Huston-Tillotson,Sam Houston State,30,42,21,36,0,Ronzelle Fort Defensive Rebound.
Huston-Tillotson,Sam Houston State,30,42,21,37,0,Foul on Michael Holyfield
Huston-Tillotson,Sam Houston State,30,42,21,56,0,Ronzelle Fort missed Layup.
Huston-Tillotson,Sam Houston State,30,42,21,56,0,Michael Holyfield Defensive Rebound.
Huston-Tillotson,Sam Houston State,30,42,22,23,0,Demarcus Gatlin missed Layup.
Huston-Tillotson,Sam Houston State,30,42,22,23,0,Demarcus Gatlin Offensive Rebound.
Huston-Tillotson,Sam Houston State,30,42,22,23,0,Demarcus Gatlin Turnover.
Huston-Tillotson,Sam Houston State,30,42,22,33,0,Foul on Darius Gatson
Huston-Tillotson,Sam Houston State,30,42,22,44,0,Lance Richardson Turnover.
Huston-Tillotson,Sam Houston State,30,42,22,54,0,Foul on Marquavius James
Huston-Tillotson,Sam Houston State,30,45,22,57,1,Darius Gatson made Three Point Jumper.  Assisted by Marquel McKinney.
Huston-Tillotson,Sam Houston State,33,45,23,23,1,Tyrice Hill made Three Point Jumper.  Assisted by Jonathan Douglas.
Huston-Tillotson,Sam Houston State,33,47,23,33,1,Will Bond made Jumper.  Assisted by Darius Gatson.
Huston-Tillotson,Sam Houston State,33,47,23,44,0,Tyrice Hill missed Jumper.
Huston-Tillotson,Sam Houston State,33,47,23,44,0,Will Bond Defensive Rebound.
Huston-Tillotson,Sam Houston State,33,50,23,52,1,Marquel McKinney made Three Point Jumper.  Assisted by Darius Gatson.
Huston-Tillotson,Sam Houston State,33,50,24,11,0,Lance Richardson Turnover.
Huston-Tillotson,Sam Houston State,33,52,24,28,1,Marquel McKinney made Jumper.  Assisted by Aaron Harwell.
Huston-Tillotson,Sam Houston State,36,52,25,2,1,Tyrice Hill made Three Point Jumper.  Assisted by Lance Richardson.
Huston-Tillotson,Sam Houston State,36,54,25,10,1,Terrance Motley made Layup.  Assisted by Aaron Harwell.
Huston-Tillotson,Sam Houston State,36,54,25,31,0,Marquavius James missed Layup.
Huston-Tillotson,Sam Houston State,36,54,25,31,0,Aaron Harwell Defensive Rebound.
Huston-Tillotson,Sam Houston State,36,56,25,40,1,Jeremy McKay made Layup.  Assisted by Will Bond.
Huston-Tillotson,Sam Houston State,36,56,25,55,0,Foul on James Thomas
Huston-Tillotson,Sam Houston State,37,56,25,55,1,Lance Richardson made Free Throw.
Huston-Tillotson,Sam Houston State,37,56,25,55,0,Lance Richardson missed Free Throw.
Huston-Tillotson,Sam Houston State,37,56,25,55,0,Terrance Motley Defensive Rebound.
Huston-Tillotson,Sam Houston State,37,56,26,6,0,Will Bond missed Three Point Jumper.
Huston-Tillotson,Sam Houston State,37,56,26,6,0,Demetrius Smith Defensive Rebound.
Huston-Tillotson,Sam Houston State,37,56,26,12,0,Demetrius Smith missed Three Point Jumper.
Huston-Tillotson,Sam Houston State,37,56,26,12,0,Lance Richardson Offensive Rebound.
Huston-Tillotson,Sam Houston State,37,56,26,16,0,Lance Richardson Turnover.
Huston-Tillotson,Sam Houston State,37,56,26,18,0,Aaron Harwell Steal.
Huston-Tillotson,Sam Houston State,37,58,26,28,1,Jeremy McKay made Jumper.  Assisted by Aaron Harwell.
Huston-Tillotson,Sam Houston State,37,58,26,35,0,Justin King Turnover.
Huston-Tillotson,Sam Houston State,37,58,26,36,0,Aaron Harwell Steal.
Huston-Tillotson,Sam Houston State,37,58,26,38,0,Foul on Tyrice Hill
Huston-Tillotson,Sam Houston State,37,58,26,39,0,Jeremy McKay missed Three Point Jumper.
Huston-Tillotson,Sam Houston State,37,58,26,39,0,Demetrius Smith Defensive Rebound.
Huston-Tillotson,Sam Houston State,37,58,26,41,0,Foul on Terrance Motley
Huston-Tillotson,Sam Houston State,37,58,26,53,0,Justin King Turnover.
Huston-Tillotson,Sam Houston State,37,58,26,54,0,James Thomas Steal.
Huston-Tillotson,Sam Houston State,37,60,27,2,1,Terrance Motley made Layup.  Assisted by James Thomas.
Huston-Tillotson,Sam Houston State,37,60,27,22,0,Foul on Terrance Motley
Huston-Tillotson,Sam Houston State,38,60,27,22,1,Demetrius Smith made Free Throw.
Huston-Tillotson,Sam Houston State,39,60,27,22,1,Demetrius Smith made Free Throw.
Huston-Tillotson,Sam Houston State,39,60,27,47,0,Marquel McKinney missed Jumper.
Huston-Tillotson,Sam Houston State,39,60,27,47,0,Demetrius Smith Defensive Rebound.
Huston-Tillotson,Sam Houston State,39,60,27,53,0,Tyrice Hill missed Three Point Jumper.
Huston-Tillotson,Sam Houston State,39,60,27,53,0,Will Bond Defensive Rebound.
Huston-Tillotson,Sam Houston State,39,60,28,2,0,Will Bond missed Layup.
Huston-Tillotson,Sam Houston State,39,60,28,2,0,Will Bond Offensive Rebound.
Huston-Tillotson,Sam Houston State,39,60,28,6,0,Marquel McKinney Turnover.
Huston-Tillotson,Sam Houston State,39,60,28,15,0,Marquavius James missed Jumper.
Huston-Tillotson,Sam Houston State,39,60,28,15,0,Paul Baxter Defensive Rebound.
Huston-Tillotson,Sam Houston State,39,60,28,24,0,Foul on Fidelis Ifeanyi
Huston-Tillotson,Sam Houston State,39,61,28,32,1,Will Bond made Free Throw.
Huston-Tillotson,Sam Houston State,39,64,28,50,1,Jeremy McKay made Three Point Jumper.  Assisted by Paul Baxter.
Huston-Tillotson,Sam Houston State,39,64,28,57,0,Foul on Will Bond
Huston-Tillotson,Sam Houston State,39,64,28,57,0,Will Bond missed Free Throw.
Huston-Tillotson,Sam Houston State,39,64,28,57,0,Jeremy McKay Offensive Rebound.
Huston-Tillotson,Sam Houston State,40,64,28,57,1,Demetrius Smith made Free Throw.
Huston-Tillotson,Sam Houston State,41,64,28,57,1,Demetrius Smith made Free Throw.
Huston-Tillotson,Sam Houston State,41,64,28,59,0,Marquel McKinney Turnover.
Huston-Tillotson,Sam Houston State,41,64,29,0,0,Demetrius Smith Steal.
Huston-Tillotson,Sam Houston State,41,64,29,2,0,Foul on Marquel McKinney
Huston-Tillotson,Sam Houston State,41,64,29,2,0,Demetrius Smith missed Free Throw.
Huston-Tillotson,Sam Houston State,41,64,29,2,0,null
Huston-Tillotson,Sam Houston State,42,64,29,2,1,Demetrius Smith made Free Throw.
Huston-Tillotson,Sam Houston State,42,64,29,22,0,James Thomas missed Layup.
Huston-Tillotson,Sam Houston State,42,64,29,22,0,Demarcus Gatlin Offensive Rebound.
Huston-Tillotson,Sam Houston State,42,64,29,27,0,Demarcus Gatlin missed Layup.
Huston-Tillotson,Sam Houston State,42,64,29,27,0,Sam Houston State Offensive Rebo.
Huston-Tillotson,Sam Houston State,42,67,29,29,1,Jeremy McKay made Three Point Jumper.  Assisted by Paul Baxter.
Huston-Tillotson,Sam Houston State,42,67,29,51,0,Fidelis Ifeanyi Turnover.
Huston-Tillotson,Sam Houston State,42,67,29,51,0,Foul on Fidelis Ifeanyi
Huston-Tillotson,Sam Houston State,42,70,30,5,1,Jeremy McKay made Three Point Jumper.  Assisted by Paul Baxter.
Huston-Tillotson,Sam Houston State,42,70,30,22,0,Demetrius Smith missed Layup.
Huston-Tillotson,Sam Houston State,42,70,30,22,0,James Thomas Block.
Huston-Tillotson,Sam Houston State,42,70,30,22,0,Huston-Tillotson Offensive Rebou.
Huston-Tillotson,Sam Houston State,42,70,30,27,0,Ronzelle Fort Turnover.
Huston-Tillotson,Sam Houston State,42,70,30,29,0,Marquel McKinney Steal.
Huston-Tillotson,Sam Houston State,42,72,30,33,1,James Thomas made Layup.  Assisted by Marquel McKinney.
Huston-Tillotson,Sam Houston State,42,72,30,33,0,Foul on Fidelis Ifeanyi
Huston-Tillotson,Sam Houston State,42,72,30,33,0,James Thomas missed Free Throw.
Huston-Tillotson,Sam Houston State,42,72,30,33,0,Demarcus Gatlin Offensive Rebound.
Huston-Tillotson,Sam Houston State,42,74,31,8,1,Marquel McKinney made Layup.  Assisted by Jeremy McKay.
Huston-Tillotson,Sam Houston State,42,74,31,33,0,Calvin McGhee missed Jumper.
Huston-Tillotson,Sam Houston State,42,74,31,33,0,Marquel McKinney Defensive Rebound.
Huston-Tillotson,Sam Houston State,42,74,31,55,0,Demetrius Smith missed Three Point Jumper.
Huston-Tillotson,Sam Houston State,42,74,31,55,0,Jeremy McKay Defensive Rebound.
Huston-Tillotson,Sam Houston State,42,74,32,5,0,Jeremy McKay missed Three Point Jumper.
Huston-Tillotson,Sam Houston State,42,74,32,5,0,Demarcus Gatlin Offensive Rebound.
Huston-Tillotson,Sam Houston State,42,74,32,10,0,Demarcus Gatlin missed Layup.
Huston-Tillotson,Sam Houston State,42,74,32,10,0,Huston-Tillotson Defensive Rebou.
Huston-Tillotson,Sam Houston State,42,74,32,39,0,Jonathan Douglas Turnover.
Huston-Tillotson,Sam Houston State,42,76,32,52,1,Terrance Motley made Dunk.  Assisted by Darius Gatson.
Huston-Tillotson,Sam Houston State,42,76,33,11,0,Demetrius Smith missed Jumper.
Huston-Tillotson,Sam Houston State,42,76,33,11,0,Aaron Harwell Defensive Rebound.
Huston-Tillotson,Sam Houston State,42,78,33,25,1,Terrance Motley made Layup.  Assisted by Marquel McKinney.
Huston-Tillotson,Sam Houston State,42,78,33,45,0,Ronzelle Fort Turnover.
Huston-Tillotson,Sam Houston State,42,78,33,46,0,Marquel McKinney Steal.
Huston-Tillotson,Sam Houston State,44,78,33,58,1,Justin King made Layup.
Huston-Tillotson,Sam Houston State,44,80,34,13,1,Darius Gatson made Layup.  Assisted by Terrance Motley.
Huston-Tillotson,Sam Houston State,44,80,34,22,0,Marquavius James Turnover.
Huston-Tillotson,Sam Houston State,44,80,34,54,0,Will Bond missed Three Point Jumper.
Huston-Tillotson,Sam Houston State,44,80,34,54,0,Marquel McKinney Offensive Rebound.
Huston-Tillotson,Sam Houston State,44,83,35,15,1,Mitch McCormick made Three Point Jumper.  Assisted by Aaron Harwell.
Huston-Tillotson,Sam Houston State,46,83,35,30,1,Justin King made Jumper.  Assisted by Marquavius James.
Huston-Tillotson,Sam Houston State,46,83,35,58,0,Terrance Motley missed Layup.
Huston-Tillotson,Sam Houston State,46,83,35,58,0,Will Bond Offensive Rebound.
