Away Team,Home Team,Away Score,Home Score,Minute,Second,isScoringPosession,Desc.
Huston-Tillotson,Sam Houston State,46,85,36,4,1,Will Bond made Tip Shot.
Huston-Tillotson,Sam Houston State,46,85,36,17,0,Anthony Carroll missed Three Point Jumper.
Huston-Tillotson,Sam Houston State,46,85,36,17,0,Aaron Harwell Defensive Rebound.
Huston-Tillotson,Sam Houston State,46,87,36,26,1,Terrance Motley made Layup.  Assisted by Aaron Harwell.
Huston-Tillotson,Sam Houston State,48,87,36,48,1,Marquavius James made Layup.
Huston-Tillotson,Sam Houston State,48,87,37,21,0,Michael Holyfield missed Layup.
Huston-Tillotson,Sam Houston State,48,87,37,21,0,Michael Holyfield Offensive Rebound.
Huston-Tillotson,Sam Houston State,48,87,37,24,0,Michael Holyfield missed Layup.
Huston-Tillotson,Sam Houston State,48,87,37,24,0,Terrance Cooper Defensive Rebound.
Huston-Tillotson,Sam Houston State,48,87,37,30,0,Justin King missed Three Point Jumper.
Huston-Tillotson,Sam Houston State,48,87,37,30,0,Sam Houston State Defensive Rebo.
Huston-Tillotson,Sam Houston State,48,87,37,45,0,Michael Holyfield Turnover.
Huston-Tillotson,Sam Houston State,48,87,38,11,0,Foul on Will Bond
Huston-Tillotson,Sam Houston State,49,87,38,11,1,Justin King made Free Throw.
Huston-Tillotson,Sam Houston State,50,87,38,11,1,Justin King made Free Throw.
Huston-Tillotson,Sam Houston State,50,87,38,29,0,Will Bond missed Three Point Jumper.
Huston-Tillotson,Sam Houston State,50,87,38,29,0,Lance Richardson Defensive Rebound.
Huston-Tillotson,Sam Houston State,50,87,39,14,0,Jonathan Douglas missed Three Point Jumper.
Huston-Tillotson,Sam Houston State,50,87,39,14,0,Sam Houston State Defensive Rebo.
Huston-Tillotson,Sam Houston State,50,89,39,19,1,Paul Baxter made Layup.
Huston-Tillotson,Sam Houston State,53,89,39,47,1,Terrance Cooper made Three Point Jumper.  Assisted by Lance Richardson.
Huston-Tillotson,Sam Houston State,53,89,40,0,0,End Game
Huston-Tillotson,Sam Houston State,53,89,40,0,0,End Game
