Montreat College,Appalachian State,44,97,33,23,0,Jake Wilson Turnover.
Montreat College,Appalachian State,44,97,33,40,0,Austin Butler missed Three Point Jumper.
Montreat College,Appalachian State,44,97,33,40,0,Jordan Eaton Offensive Rebound.
Montreat College,Appalachian State,44,97,33,45,0,Jordan Eaton Turnover.
Montreat College,Appalachian State,44,99,33,58,1,Kevin Kerley made Jumper. Assisted by Zach Cottrell.
Montreat College,Appalachian State,47,99,34,13,1,Austin Butler made Three Point Jumper. Assisted by Isaiah Williams.
Montreat College,Appalachian State,47,102,34,22,1,Bennett Holley made Three Point Jumper. Assisted by Patrick Good.
Montreat College,Appalachian State,49,102,34,57,1,Austin Butler made Jumper. Assisted by Jordan Eaton.
Montreat College,Appalachian State,49,102,34,57,0,Foul on Kevin Kerley.
Montreat College,Appalachian State,49,102,34,57,0,Austin Butler missed Free Throw.
Montreat College,Appalachian State,49,102,34,57,0,Bennett Holley Defensive Rebound.
Montreat College,Appalachian State,49,104,35,2,1,Zach Cottrell made Layup. Assisted by Kevin Kerley.
Montreat College,Appalachian State,49,104,35,15,0,Andrew McGuire missed Three Point Jumper.
Montreat College,Appalachian State,49,104,35,15,0,Jordan Eaton Offensive Rebound.
Montreat College,Appalachian State,49,104,35,21,0,Isaiah Williams missed Three Point Jumper.
Montreat College,Appalachian State,49,104,35,21,0,Bennett Holley Defensive Rebound.
Montreat College,Appalachian State,49,104,35,31,0,Kevin Kerley Turnover.
Montreat College,Appalachian State,49,104,35,44,0,Andrew McGuire Turnover.
Montreat College,Appalachian State,49,104,35,46,0,Bennett Holley Steal.
Montreat College,Appalachian State,49,104,36,3,0,Foul on Austin Butler.
Montreat College,Appalachian State,49,104,36,3,0,Official TV Timeout
Montreat College,Appalachian State,49,104,36,3,0,Jake Wilson missed Free Throw.
Montreat College,Appalachian State,49,104,36,3,0,Appalachian St Deadball Team Rebound.
Montreat College,Appalachian State,49,105,36,3,1,Jake Wilson made Free Throw.
Montreat College,Appalachian State,49,105,36,18,0,Foul on Jake Wilson.
Montreat College,Appalachian State,50,105,36,18,1,Andrew McGuire made Free Throw.
Montreat College,Appalachian State,50,105,36,18,0,Andrew McGuire missed Free Throw.
Montreat College,Appalachian State,50,105,36,18,0,Cody Miller Offensive Rebound.
Montreat College,Appalachian State,50,105,36,18,0,Foul on Jake Wilson.
Montreat College,Appalachian State,50,105,36,18,0,Cody Miller missed Free Throw.
Montreat College,Appalachian State,50,105,36,18,0,Jake Wilson Defensive Rebound.
Montreat College,Appalachian State,50,105,36,31,0,Trey Ford missed Three Point Jumper.
Montreat College,Appalachian State,50,105,36,31,0,Bennett Holley Offensive Rebound.
Montreat College,Appalachian State,50,105,36,38,0,Foul on Cody Miller.
Montreat College,Appalachian State,50,106,36,38,1,Bennett Holley made Free Throw.
Montreat College,Appalachian State,50,107,36,38,1,Bennett Holley made Free Throw.
Montreat College,Appalachian State,50,107,36,50,0,Jordan Eaton missed Jumper.
Montreat College,Appalachian State,50,107,36,50,0,Jake Wilson Defensive Rebound.
Montreat College,Appalachian State,50,110,37,1,1,Zach Cottrell made Three Point Jumper. Assisted by Kevin Kerley.
Montreat College,Appalachian State,50,110,37,30,0,Austin Butler missed Jumper.
Montreat College,Appalachian State,50,110,37,30,0,Jake Wilson Block.
Montreat College,Appalachian State,50,110,37,32,0,Montreat Offensive Rebound.
Montreat College,Appalachian State,50,110,37,34,0,Andrew McGuire Turnover.
Montreat College,Appalachian State,50,110,37,36,0,Bennett Holley Steal.
Montreat College,Appalachian State,50,113,37,41,1,Bennett Holley made Three Point Jumper. Assisted by Kevin Kerley.
Montreat College,Appalachian State,50,113,37,55,0,Isaiah Williams missed Three Point Jumper.
Montreat College,Appalachian State,50,113,37,55,0,Kristian Williams Offensive Rebound.
Montreat College,Appalachian State,50,113,38,3,0,Austin Butler missed Three Point Jumper.
Montreat College,Appalachian State,50,113,38,3,0,Montreat Offensive Rebound.
Montreat College,Appalachian State,52,113,38,14,1,Jordan Eaton made Layup. Assisted by Austin Butler.
Montreat College,Appalachian State,52,113,38,20,0,Zach Cottrell missed Three Point Jumper.
Montreat College,Appalachian State,52,113,38,20,0,Kristian Williams Defensive Rebound.
Montreat College,Appalachian State,52,113,38,31,0,Kristian Williams missed Layup.
Montreat College,Appalachian State,52,113,38,31,0,Jordan Eaton Offensive Rebound.
Montreat College,Appalachian State,55,113,38,40,1,Isaiah Williams made Three Point Jumper. Assisted by Jordan Eaton.
Montreat College,Appalachian State,55,116,39,9,1,Kevin Kerley made Three Point Jumper.
Montreat College,Appalachian State,55,116,39,22,0,Andrew McGuire missed Three Point Jumper.
Montreat College,Appalachian State,55,116,39,22,0,Jordan Eaton Offensive Rebound.
Montreat College,Appalachian State,55,116,39,26,0,Jordan Eaton missed Layup.
Montreat College,Appalachian State,55,116,39,26,0,Montreat Offensive Rebound.
Montreat College,Appalachian State,55,116,39,35,0,Foul on Zach Cottrell.
Montreat College,Appalachian State,56,116,39,35,1,Andrew McGuire made Free Throw.
Montreat College,Appalachian State,57,116,39,35,1,Andrew McGuire made Free Throw.
Montreat College,Appalachian State,57,116,40,0,0,End of Game
