Away Team,Home Team,Away Score,Home Score,Minute,Second,isScoringPosession,Desc.
Blue Mountain College,New Orleans,0,0,0,14,0,Travin Thibodeaux missed Jumper.
Blue Mountain College,New Orleans,0,0,0,14,0,New Orleans Offensive Rebound.
Blue Mountain College,New Orleans,0,2,0,26,1,Travin Thibodeaux made Layup. Assisted by Erik Thomas.
Blue Mountain College,New Orleans,0,2,0,51,0,Vladimir Filipovic missed Jumper.
Blue Mountain College,New Orleans,0,2,0,51,0,Christavious Gill Defensive Rebound.
Blue Mountain College,New Orleans,0,2,1,15,0,Christavious Gill missed Three Point Jumper.
Blue Mountain College,New Orleans,0,2,1,15,0,DeAundre Smith Defensive Rebound.
Blue Mountain College,New Orleans,0,2,1,37,0,Foul on Tevin Broyles.
Blue Mountain College,New Orleans,0,2,1,41,0,Justin McClellon Turnover.
Blue Mountain College,New Orleans,0,2,1,43,0,Foul on Justin McClellon.
Blue Mountain College,New Orleans,0,3,1,43,1,Tevin Broyles made Free Throw.
Blue Mountain College,New Orleans,0,3,1,43,0,Tevin Broyles missed Free Throw.
Blue Mountain College,New Orleans,0,3,1,43,0,Chase Brittingham Defensive Rebound.
Blue Mountain College,New Orleans,0,3,1,44,0,Tevin Broyles Steal.
Blue Mountain College,New Orleans,0,3,2,2,0,Chase Brittingham Turnover.
Blue Mountain College,New Orleans,0,3,2,20,0,Foul on Justin McClellon.
Blue Mountain College,New Orleans,0,4,2,20,1,Tevin Broyles made Free Throw.
Blue Mountain College,New Orleans,0,4,2,20,0,Tevin Broyles missed Free Throw.
Blue Mountain College,New Orleans,0,4,2,20,0,DeAundre Smith Defensive Rebound.
Blue Mountain College,New Orleans,2,4,2,32,1,C.J. Barnes made Layup. Assisted by Vladimir Filipovic.
Blue Mountain College,New Orleans,2,6,2,49,1,Christavious Gill made Layup. Assisted by Nate Frye.
Blue Mountain College,New Orleans,2,6,3,13,0,Pierre Garel Turnover.
Blue Mountain College,New Orleans,2,6,3,23,0,Kevin Hill missed Layup.
Blue Mountain College,New Orleans,2,6,3,23,0,Michael Zeno Offensive Rebound.
Blue Mountain College,New Orleans,2,6,3,26,0,Michael Zeno missed Layup.
Blue Mountain College,New Orleans,2,6,3,26,0,DeAundre Smith Block.
Blue Mountain College,New Orleans,2,6,3,28,0,Kevin Hill Offensive Rebound.
Blue Mountain College,New Orleans,2,6,3,30,0,Kevin Hill missed Layup.
Blue Mountain College,New Orleans,2,6,3,30,0,Michael Zeno Offensive Rebound.
Blue Mountain College,New Orleans,2,8,3,33,1,Michael Zeno made Layup.
Blue Mountain College,New Orleans,2,8,3,33,0,Foul on Tucker Trumbo.
Blue Mountain College,New Orleans,2,9,3,33,1,Michael Zeno made Free Throw.
Blue Mountain College,New Orleans,2,9,3,45,0,DeAundre Smith missed Three Point Jumper.
Blue Mountain College,New Orleans,2,9,3,45,0,Vladimir Filipovic Offensive Rebound.
Blue Mountain College,New Orleans,2,9,3,59,0,Vladimir Filipovic missed Layup.
Blue Mountain College,New Orleans,2,9,3,59,0,Kevin Hill Defensive Rebound.
Blue Mountain College,New Orleans,2,9,4,7,0,Michael Zeno Turnover.
Blue Mountain College,New Orleans,2,9,4,7,0,Official TV Timeout
Blue Mountain College,New Orleans,2,9,4,25,0,Denio Chirindza missed Jumper.
Blue Mountain College,New Orleans,2,9,4,25,0,Blue Mountain Offensive Rebound.
Blue Mountain College,New Orleans,2,9,4,38,0,Denio Chirindza missed Layup.
Blue Mountain College,New Orleans,2,9,4,38,0,Vladimir Filipovic Offensive Rebound.
Blue Mountain College,New Orleans,4,9,4,41,1,Vladimir Filipovic made Layup.
Blue Mountain College,New Orleans,4,9,4,56,0,Michael Zeno Turnover.
Blue Mountain College,New Orleans,4,9,4,57,0,DeAundre Smith Steal.
Blue Mountain College,New Orleans,4,9,5,3,0,Foul on Michael Zeno.
Blue Mountain College,New Orleans,4,9,5,6,0,Foul on Danny Cohen.
Blue Mountain College,New Orleans,4,9,5,13,0,DeAundre Smith missed Three Point Jumper.
Blue Mountain College,New Orleans,4,9,5,13,0,Michael Zeno Defensive Rebound.
Blue Mountain College,New Orleans,4,11,5,25,1,Kevin Hill made Layup.
Blue Mountain College,New Orleans,6,11,5,39,1,C.J. Barnes made Dunk. Assisted by Vladimir Filipovic.
Blue Mountain College,New Orleans,6,11,5,47,0,Matthew Jiles Turnover.
Blue Mountain College,New Orleans,6,11,5,54,0,Pierre Garel Turnover.
Blue Mountain College,New Orleans,6,11,5,56,0,Nate Frye Steal.
Blue Mountain College,New Orleans,6,13,5,57,1,Tevin Broyles made Layup. Assisted by Christavious Gill.
Blue Mountain College,New Orleans,6,13,6,5,0,Conner Helvig Turnover.
Blue Mountain College,New Orleans,6,13,6,5,0,Erik Thomas Steal.
Blue Mountain College,New Orleans,6,15,6,5,1,Tevin Broyles made Layup.
Blue Mountain College,New Orleans,6,15,6,48,0,Blue Mountain  Turnover.
Blue Mountain College,New Orleans,6,15,7,3,0,Foul on Austen Burton.
Blue Mountain College,New Orleans,6,16,7,3,1,Travin Thibodeaux made Free Throw.
Blue Mountain College,New Orleans,6,16,7,3,0,Travin Thibodeaux Turnover.
Blue Mountain College,New Orleans,6,16,7,12,0,Travin Thibodeaux Steal.
Blue Mountain College,New Orleans,6,16,7,12,0,Pierre Garel Turnover.
Blue Mountain College,New Orleans,6,16,7,25,0,Pierre Garel Steal.
Blue Mountain College,New Orleans,6,16,7,25,0,Travin Thibodeaux Turnover.
Blue Mountain College,New Orleans,6,16,7,30,0,Christavious Gill Steal.
Blue Mountain College,New Orleans,6,16,7,30,0,Pierre Garel Turnover.
Blue Mountain College,New Orleans,6,16,7,39,0,Pierre Garel Steal.
Blue Mountain College,New Orleans,6,16,7,39,0,Christavious Gill Turnover.
Blue Mountain College,New Orleans,6,16,7,43,0,Christavious Gill Steal.
Blue Mountain College,New Orleans,6,16,7,43,0,Pierre Garel Turnover.
Blue Mountain College,New Orleans,6,18,7,46,1,Erik Thomas made Layup. Assisted by Nate Frye.
Blue Mountain College,New Orleans,6,18,7,56,0,Denio Chirindza Turnover.
Blue Mountain College,New Orleans,6,18,8,0,0,Nate Frye Steal.
Blue Mountain College,New Orleans,6,18,8,1,0,Erik Thomas Turnover.
Blue Mountain College,New Orleans,6,18,8,1,0,Denio Chirindza Steal.
Blue Mountain College,New Orleans,6,18,8,17,0,Denio Chirindza Turnover.
Blue Mountain College,New Orleans,6,18,8,18,0,Tevin Broyles Steal.
Blue Mountain College,New Orleans,6,18,8,21,0,Foul on Justin McClellon.
Blue Mountain College,New Orleans,6,19,8,21,1,Christavious Gill made Free Throw.
Blue Mountain College,New Orleans,6,20,8,21,1,Christavious Gill made Free Throw.
Blue Mountain College,New Orleans,6,20,8,31,0,Justin McClellon Turnover.
Blue Mountain College,New Orleans,6,20,8,43,0,Tevin Broyles missed Three Point Jumper.
Blue Mountain College,New Orleans,6,20,8,43,0,Velibor Njegovanovic Defensive Rebound.
Blue Mountain College,New Orleans,6,20,9,10,0,Dominic Hudson missed Three Point Jumper.
Blue Mountain College,New Orleans,6,20,9,10,0,Denio Chirindza Offensive Rebound.
Blue Mountain College,New Orleans,9,20,9,28,1,Justin McClellon made Three Point Jumper. Assisted by Dominic Hudson.
Blue Mountain College,New Orleans,9,23,9,43,1,Christavious Gill made Three Point Jumper. Assisted by Michael Zeno.
Blue Mountain College,New Orleans,9,23,10,6,0,Harrison Fancher Turnover.
Blue Mountain College,New Orleans,9,23,10,34,0,Christavious Gill Turnover.
Blue Mountain College,New Orleans,9,23,10,35,0,Denio Chirindza Steal.
Blue Mountain College,New Orleans,9,23,10,37,0,Harrison Fancher missed Layup.
Blue Mountain College,New Orleans,9,23,10,37,0,Harrison Fancher Offensive Rebound.
Blue Mountain College,New Orleans,11,23,10,42,1,Harrison Fancher made Layup.
Blue Mountain College,New Orleans,11,23,10,45,0,New Orleans  Timeout
Blue Mountain College,New Orleans,11,25,10,54,1,Michael Zeno made Layup.
Blue Mountain College,New Orleans,11,25,10,55,0,Foul on Denio Chirindza.
Blue Mountain College,New Orleans,11,25,10,55,0,Michael Zeno missed Free Throw.
Blue Mountain College,New Orleans,11,25,10,55,0,Denio Chirindza Defensive Rebound.
Blue Mountain College,New Orleans,11,25,11,14,0,Foul on Nate Frye.
Blue Mountain College,New Orleans,13,25,11,29,1,Harrison Fancher made Jumper.
Blue Mountain College,New Orleans,13,27,11,46,1,Michael Zeno made Jumper. Assisted by Christavious Gill.
Blue Mountain College,New Orleans,13,27,12,8,0,Justin McClellon Turnover.
Blue Mountain College,New Orleans,13,27,12,9,0,Matthew Jiles Steal.
Blue Mountain College,New Orleans,13,27,12,11,0,New Orleans  Timeout
Blue Mountain College,New Orleans,13,27,12,11,0,Official TV Timeout
Blue Mountain College,New Orleans,13,27,12,35,0,Christavious Gill missed Jumper.
Blue Mountain College,New Orleans,13,27,12,35,0,DeAundre Smith Defensive Rebound.
Blue Mountain College,New Orleans,13,27,12,38,0,Foul on Nate Frye.
Blue Mountain College,New Orleans,16,27,12,50,1,DeAundre Smith made Three Point Jumper. Assisted by Justin McClellon.
Blue Mountain College,New Orleans,16,27,13,5,0,Danny Cohen missed Three Point Jumper.
Blue Mountain College,New Orleans,16,27,13,5,0,Chase Brittingham Defensive Rebound.
Blue Mountain College,New Orleans,16,27,13,39,0,Vladimir Filipovic missed Layup.
Blue Mountain College,New Orleans,16,27,13,39,0,Erik Thomas Defensive Rebound.
Blue Mountain College,New Orleans,16,27,13,59,0,Tevin Broyles Turnover.
Blue Mountain College,New Orleans,16,27,14,0,0,Vladimir Filipovic Steal.
Blue Mountain College,New Orleans,18,27,14,2,1,Vladimir Filipovic made Layup.
Blue Mountain College,New Orleans,18,27,14,21,0,Foul on Chase Brittingham.
Blue Mountain College,New Orleans,18,27,14,21,0,Erik Thomas missed Free Throw.
Blue Mountain College,New Orleans,18,27,14,21,0,New Orleans Deadball Team Rebound.
Blue Mountain College,New Orleans,18,28,14,21,1,Erik Thomas made Free Throw.
Blue Mountain College,New Orleans,20,28,14,36,1,C.J. Barnes made Layup. Assisted by Justin McClellon.
Blue Mountain College,New Orleans,20,28,14,53,0,Foul on Chase Brittingham.
Blue Mountain College,New Orleans,20,29,14,53,1,Tevin Broyles made Free Throw.
Blue Mountain College,New Orleans,20,29,14,53,0,Tevin Broyles missed Free Throw.
Blue Mountain College,New Orleans,20,29,14,53,0,Christavious Gill Offensive Rebound.
Blue Mountain College,New Orleans,20,32,15,6,1,Christavious Gill made Three Point Jumper. Assisted by Erik Thomas.
Blue Mountain College,New Orleans,20,32,15,33,0,Justin McClellon Turnover.
Blue Mountain College,New Orleans,20,32,15,36,0,Matthew Jiles missed Three Point Jumper.
Blue Mountain College,New Orleans,20,32,15,36,0,DeAundre Smith Defensive Rebound.
Blue Mountain College,New Orleans,20,32,15,58,0,Foul on Christavious Gill.
Blue Mountain College,New Orleans,21,32,15,58,1,DeAundre Smith made Free Throw.
Blue Mountain College,New Orleans,22,32,15,58,1,DeAundre Smith made Free Throw.
Blue Mountain College,New Orleans,22,32,16,9,0,Foul on C.J. Barnes.
Blue Mountain College,New Orleans,22,32,16,9,0,Official TV Timeout
Blue Mountain College,New Orleans,22,33,16,9,1,Christavious Gill made Free Throw.
Blue Mountain College,New Orleans,22,34,16,9,1,Christavious Gill made Free Throw.
Blue Mountain College,New Orleans,22,34,16,20,0,Vladimir Filipovic Turnover.
Blue Mountain College,New Orleans,22,34,16,21,0,Matthew Jiles Steal.
Blue Mountain College,New Orleans,22,37,16,23,1,Tevin Broyles made Three Point Jumper. Assisted by Christavious Gill.
Blue Mountain College,New Orleans,22,37,16,37,0,Pierre Garel Turnover.
Blue Mountain College,New Orleans,22,37,16,37,0,Christavious Gill Steal.
Blue Mountain College,New Orleans,22,39,16,39,1,Tevin Broyles made Layup. Assisted by Christavious Gill.
Blue Mountain College,New Orleans,22,39,16,39,0,Blue Mountain  Timeout
Blue Mountain College,New Orleans,22,39,16,58,0,Pierre Garel Turnover.
Blue Mountain College,New Orleans,22,39,16,59,0,Tevin Broyles Steal.
Blue Mountain College,New Orleans,22,41,17,0,1,Tevin Broyles made Layup.
Blue Mountain College,New Orleans,22,41,17,24,0,DeAundre Smith missed Three Point Jumper.
Blue Mountain College,New Orleans,22,41,17,24,0,Christavious Gill Defensive Rebound.
Blue Mountain College,New Orleans,22,44,17,34,1,Christavious Gill made Three Point Jumper.
Blue Mountain College,New Orleans,22,44,17,55,0,Foul on Travis Avery.
Blue Mountain College,New Orleans,22,44,17,55,0,Austen Burton missed Free Throw.
Blue Mountain College,New Orleans,22,44,17,55,0,Blue Mountain Deadball Team Rebound.
Blue Mountain College,New Orleans,22,44,17,55,0,Austen Burton missed Free Throw.
Blue Mountain College,New Orleans,22,44,17,55,0,Travis Avery Defensive Rebound.
Blue Mountain College,New Orleans,22,44,18,10,0,Foul on C.J. Barnes.
Blue Mountain College,New Orleans,22,45,18,10,1,Christavious Gill made Free Throw.
Blue Mountain College,New Orleans,22,46,18,10,1,Christavious Gill made Free Throw.
Blue Mountain College,New Orleans,22,46,18,21,0,Pierre Garel Turnover.
Blue Mountain College,New Orleans,22,46,18,23,0,Travis Avery Steal.
Blue Mountain College,New Orleans,22,46,18,26,0,Coleman Edwards missed Jumper.
Blue Mountain College,New Orleans,22,46,18,26,0,DeAundre Smith Defensive Rebound.
Blue Mountain College,New Orleans,22,46,18,41,0,Foul on Danny Cohen.
Blue Mountain College,New Orleans,23,46,18,41,1,DeAundre Smith made Free Throw.
Blue Mountain College,New Orleans,23,46,18,41,0,DeAundre Smith missed Free Throw.
Blue Mountain College,New Orleans,23,46,18,41,0,Matthew Jiles Defensive Rebound.
Blue Mountain College,New Orleans,23,49,19,6,1,Coleman Edwards made Three Point Jumper. Assisted by Travis Avery.
Blue Mountain College,New Orleans,25,49,19,23,1,Denio Chirindza made Layup.
Blue Mountain College,New Orleans,25,49,19,51,0,Danny Cohen missed Three Point Jumper.
Blue Mountain College,New Orleans,25,49,19,51,0,Matthew Jiles Offensive Rebound.
Blue Mountain College,New Orleans,25,49,19,56,0,Matthew Jiles missed Jumper.
Blue Mountain College,New Orleans,25,49,19,56,0,Blue Mountain Defensive Rebound.
Blue Mountain College,New Orleans,25,49,20,0,0,End of 1st half
Blue Mountain College,New Orleans,25,51,20,9,1,Erik Thomas made Jumper. Assisted by Tevin Broyles.
Blue Mountain College,New Orleans,25,51,20,37,0,Erik Thomas Defensive Rebound.
Blue Mountain College,New Orleans,25,51,20,37,0,Vladimir Filipovic missed Layup.
Blue Mountain College,New Orleans,25,51,21,4,0,Travin Thibodeaux Turnover.
Blue Mountain College,New Orleans,25,51,21,16,0,DeAundre Smith missed Three Point Jumper.
Blue Mountain College,New Orleans,25,51,21,16,0,Tevin Broyles Defensive Rebound.
Blue Mountain College,New Orleans,25,53,21,36,1,Nate Frye made Layup.
Blue Mountain College,New Orleans,25,53,22,9,0,Foul on Erik Thomas.
Blue Mountain College,New Orleans,25,53,22,9,0,Chase Brittingham missed Free Throw.
Blue Mountain College,New Orleans,25,53,22,9,0,Blue Mountain Deadball Team Rebound.
Blue Mountain College,New Orleans,25,53,22,9,0,Chase Brittingham missed Free Throw.
Blue Mountain College,New Orleans,25,53,22,9,0,Travin Thibodeaux Defensive Rebound.
Blue Mountain College,New Orleans,25,53,22,9,0,Foul on Vladimir Filipovic.
Blue Mountain College,New Orleans,25,53,22,19,0,Foul on Vladimir Filipovic.
Blue Mountain College,New Orleans,25,53,22,29,0,Travin Thibodeaux Turnover.
Blue Mountain College,New Orleans,25,53,22,29,0,Foul on Travin Thibodeaux.
Blue Mountain College,New Orleans,25,53,22,29,0,DeAundre Smith Turnover.
Blue Mountain College,New Orleans,25,53,22,31,0,Tevin Broyles Steal.
Blue Mountain College,New Orleans,25,53,22,34,0,Travin Thibodeaux missed Layup.
Blue Mountain College,New Orleans,25,53,22,34,0,Tevin Broyles Offensive Rebound.
Blue Mountain College,New Orleans,25,53,22,34,0,Foul on DeAundre Smith.
Blue Mountain College,New Orleans,25,53,22,40,0,Foul on Chase Brittingham.
Blue Mountain College,New Orleans,25,56,22,40,1,Christavious Gill made Three Point Jumper. Assisted by Nate Frye.
Blue Mountain College,New Orleans,25,56,23,7,0,Blue Mountain  Timeout
Blue Mountain College,New Orleans,28,56,23,10,1,Vladimir Filipovic made Three Point Jumper.
Blue Mountain College,New Orleans,28,56,23,24,0,Foul on Chase Brittingham.
Blue Mountain College,New Orleans,28,56,23,30,0,Foul on DeAundre Smith.
Blue Mountain College,New Orleans,28,57,23,30,1,Nate Frye made Free Throw.
Blue Mountain College,New Orleans,28,58,23,30,1,Nate Frye made Free Throw.
Blue Mountain College,New Orleans,31,58,23,49,1,Tucker Trumbo made Three Point Jumper. Assisted by DeAundre Smith.
Blue Mountain College,New Orleans,31,58,24,6,0,Foul on Vladimir Filipovic.
Blue Mountain College,New Orleans,31,58,24,6,0,Official TV Timeout
Blue Mountain College,New Orleans,31,58,24,6,0,Travin Thibodeaux missed Free Throw.
Blue Mountain College,New Orleans,31,58,24,6,0,Denio Chirindza Defensive Rebound.
Blue Mountain College,New Orleans,31,58,24,23,0,DeAundre Smith missed Jumper.
Blue Mountain College,New Orleans,31,58,24,23,0,Kevin Hill Defensive Rebound.
Blue Mountain College,New Orleans,31,58,24,42,0,Foul on Tucker Trumbo.
Blue Mountain College,New Orleans,31,58,24,42,0,Travin Thibodeaux missed Free Throw.
Blue Mountain College,New Orleans,31,58,24,42,0,Tucker Trumbo Defensive Rebound.
Blue Mountain College,New Orleans,31,58,24,52,0,Justin McClellon missed Jumper.
Blue Mountain College,New Orleans,31,58,24,52,0,Kevin Hill Block.
Blue Mountain College,New Orleans,31,58,24,53,0,Justin McClellon Offensive Rebound.
Blue Mountain College,New Orleans,31,58,24,57,0,Tucker Trumbo missed Three Point Jumper.
Blue Mountain College,New Orleans,31,58,24,57,0,New Orleans Defensive Rebound.
Blue Mountain College,New Orleans,31,58,25,8,0,Foul on Tucker Trumbo.
Blue Mountain College,New Orleans,31,58,25,8,0,Kevin Hill missed Free Throw.
Blue Mountain College,New Orleans,31,58,25,8,0,Tucker Trumbo Defensive Rebound.
Blue Mountain College,New Orleans,31,58,25,27,0,Denio Chirindza Turnover.
Blue Mountain College,New Orleans,31,58,25,27,0,Matthew Jiles Steal.
Blue Mountain College,New Orleans,31,58,25,38,0,Michael Zeno missed Layup.
Blue Mountain College,New Orleans,31,58,25,38,0,Michael Zeno Offensive Rebound.
Blue Mountain College,New Orleans,31,60,25,43,1,Michael Zeno made Layup.
Blue Mountain College,New Orleans,31,60,25,58,0,C.J. Barnes missed Three Point Jumper.
Blue Mountain College,New Orleans,31,60,25,58,0,Coleman Edwards Defensive Rebound.
Blue Mountain College,New Orleans,31,60,26,6,0,Coleman Edwards Turnover.
Blue Mountain College,New Orleans,31,60,26,7,0,C.J. Barnes Steal.
Blue Mountain College,New Orleans,33,60,26,10,1,C.J. Barnes made Layup. Assisted by Justin McClellon.
Blue Mountain College,New Orleans,33,60,26,30,0,Kevin Hill Turnover.
Blue Mountain College,New Orleans,33,60,26,31,0,Tucker Trumbo Steal.
Blue Mountain College,New Orleans,33,60,26,42,0,Denio Chirindza missed Layup.
Blue Mountain College,New Orleans,33,60,26,42,0,Kevin Hill Defensive Rebound.
Blue Mountain College,New Orleans,33,60,26,58,0,Foul on Tucker Trumbo.
Blue Mountain College,New Orleans,33,61,26,58,1,Kevin Hill made Free Throw.
Blue Mountain College,New Orleans,33,62,26,58,1,Kevin Hill made Free Throw.
Blue Mountain College,New Orleans,33,62,27,7,0,Tucker Trumbo missed Three Point Jumper.
Blue Mountain College,New Orleans,33,62,27,7,0,Denio Chirindza Offensive Rebound.
Blue Mountain College,New Orleans,35,62,27,12,1,Denio Chirindza made Layup.
Blue Mountain College,New Orleans,35,62,27,24,0,Michael Zeno missed Layup.
Blue Mountain College,New Orleans,35,62,27,24,0,Dominic Hudson Defensive Rebound.
Blue Mountain College,New Orleans,35,62,27,28,0,Foul on Kevin Hill.
Blue Mountain College,New Orleans,35,62,27,34,0,Tucker Trumbo Turnover.
Blue Mountain College,New Orleans,35,62,27,34,0,Kevin Hill Steal.
Blue Mountain College,New Orleans,35,64,27,38,1,Michael Zeno made Layup. Assisted by Kevin Hill.
Blue Mountain College,New Orleans,35,64,27,38,0,Foul on Tucker Trumbo.
Blue Mountain College,New Orleans,35,65,27,38,1,Michael Zeno made Free Throw.
Blue Mountain College,New Orleans,37,65,27,40,1,C.J. Barnes made Dunk. Assisted by Dominic Hudson.
Blue Mountain College,New Orleans,37,65,27,54,0,Danny Cohen Turnover.
Blue Mountain College,New Orleans,37,65,27,57,0,C.J. Barnes Steal.
Blue Mountain College,New Orleans,37,65,28,3,0,Dominic Hudson Turnover.
Blue Mountain College,New Orleans,37,65,28,4,0,Michael Zeno Steal.
Blue Mountain College,New Orleans,37,65,28,8,0,Foul on Harrison Fancher.
Blue Mountain College,New Orleans,37,65,28,8,0,Official TV Timeout
Blue Mountain College,New Orleans,37,66,28,8,1,Nate Frye made Free Throw.
Blue Mountain College,New Orleans,37,66,28,8,0,Nate Frye missed Free Throw.
Blue Mountain College,New Orleans,37,66,28,8,0,Erik Thomas Offensive Rebound.
Blue Mountain College,New Orleans,37,66,28,11,0,Foul on Dominic Hudson.
Blue Mountain College,New Orleans,37,66,28,11,0,Erik Thomas missed Free Throw.
Blue Mountain College,New Orleans,37,66,28,11,0,New Orleans Deadball Team Rebound.
Blue Mountain College,New Orleans,37,67,28,11,1,Erik Thomas made Free Throw.
Blue Mountain College,New Orleans,37,67,28,19,0,Conner Helvig Turnover.
Blue Mountain College,New Orleans,37,67,28,19,0,Foul on Conner Helvig.
Blue Mountain College,New Orleans,37,67,28,31,0,Tevin Broyles Turnover.
Blue Mountain College,New Orleans,37,67,28,31,0,Denio Chirindza Steal.
Blue Mountain College,New Orleans,37,67,28,36,0,Foul on Tevin Broyles.
Blue Mountain College,New Orleans,37,67,28,55,0,Austen Burton missed Jumper.
Blue Mountain College,New Orleans,37,67,28,55,0,Christavious Gill Defensive Rebound.
Blue Mountain College,New Orleans,37,67,29,13,0,Erik Thomas Turnover.
Blue Mountain College,New Orleans,37,67,29,13,0,Foul on Erik Thomas.
Blue Mountain College,New Orleans,37,67,29,31,0,Foul on Christavious Gill.
Blue Mountain College,New Orleans,38,67,29,31,1,Harrison Fancher made Free Throw.
Blue Mountain College,New Orleans,38,67,29,31,0,Harrison Fancher missed Free Throw.
Blue Mountain College,New Orleans,38,67,29,31,0,Erik Thomas Defensive Rebound.
Blue Mountain College,New Orleans,38,67,29,49,0,Tevin Broyles Turnover.
Blue Mountain College,New Orleans,38,67,29,50,0,Conner Helvig Steal.
Blue Mountain College,New Orleans,38,67,29,53,0,Foul on Tevin Broyles.
Blue Mountain College,New Orleans,39,67,29,53,1,Denio Chirindza made Free Throw.
Blue Mountain College,New Orleans,40,67,29,53,1,Denio Chirindza made Free Throw.
Blue Mountain College,New Orleans,40,67,30,9,0,Tevin Broyles Turnover.
Blue Mountain College,New Orleans,40,67,30,15,0,Harrison Fancher missed Three Point Jumper.
Blue Mountain College,New Orleans,40,67,30,15,0,Travin Thibodeaux Defensive Rebound.
Blue Mountain College,New Orleans,40,69,30,22,1,Christavious Gill made Layup.
Blue Mountain College,New Orleans,40,69,30,41,0,Dominic Hudson missed Jumper.
Blue Mountain College,New Orleans,40,69,30,41,0,Erik Thomas Defensive Rebound.
Blue Mountain College,New Orleans,40,69,30,54,0,Foul on Austen Burton.
Blue Mountain College,New Orleans,40,70,30,54,1,Erik Thomas made Free Throw.
Blue Mountain College,New Orleans,40,71,30,54,1,Erik Thomas made Free Throw.
Blue Mountain College,New Orleans,40,71,30,54,0,Foul on Travin Thibodeaux.
Blue Mountain College,New Orleans,41,71,30,54,1,Austen Burton made Free Throw.
Blue Mountain College,New Orleans,42,71,30,54,1,Austen Burton made Free Throw.
Blue Mountain College,New Orleans,42,71,31,2,0,Foul on Austen Burton.
Blue Mountain College,New Orleans,42,72,31,2,1,Danny Cohen made Free Throw.
Blue Mountain College,New Orleans,42,73,31,2,1,Danny Cohen made Free Throw.
Blue Mountain College,New Orleans,44,73,31,9,1,Austen Burton made Layup. Assisted by Denio Chirindza.
Blue Mountain College,New Orleans,44,73,31,27,0,Coleman Edwards missed Three Point Jumper.
Blue Mountain College,New Orleans,44,73,31,27,0,Erik Thomas Offensive Rebound.
Blue Mountain College,New Orleans,44,75,31,31,1,Erik Thomas made Layup.
Blue Mountain College,New Orleans,44,75,31,47,0,Austen Burton missed Jumper.
Blue Mountain College,New Orleans,44,75,31,47,0,Erik Thomas Block.
Blue Mountain College,New Orleans,44,75,31,48,0,Travin Thibodeaux Defensive Rebound.
Blue Mountain College,New Orleans,44,77,31,54,1,Erik Thomas made Jumper. Assisted by Danny Cohen.
Blue Mountain College,New Orleans,44,77,32,14,0,Dominic Hudson missed Three Point Jumper.
Blue Mountain College,New Orleans,44,77,32,14,0,Travin Thibodeaux Defensive Rebound.
Blue Mountain College,New Orleans,44,77,32,23,0,Nate Frye missed Layup.
Blue Mountain College,New Orleans,44,77,32,23,0,Denio Chirindza Block.
Blue Mountain College,New Orleans,44,77,32,23,0,New Orleans Offensive Rebound.
Blue Mountain College,New Orleans,44,77,32,23,0,Official TV Timeout
Blue Mountain College,New Orleans,44,79,32,27,1,Travin Thibodeaux made Dunk. Assisted by Erik Thomas.
Blue Mountain College,New Orleans,46,79,32,43,1,Austen Burton made Layup. Assisted by Denio Chirindza.
Blue Mountain College,New Orleans,46,81,32,55,1,Erik Thomas made Layup. Assisted by Nate Frye.
Blue Mountain College,New Orleans,46,81,33,12,0,Austen Burton missed Layup.
Blue Mountain College,New Orleans,46,81,33,12,0,Conner Helvig Offensive Rebound.
Blue Mountain College,New Orleans,46,81,33,16,0,Conner Helvig Offensive Rebound.
Blue Mountain College,New Orleans,46,81,33,17,0,Travin Thibodeaux Defensive Rebound.
Blue Mountain College,New Orleans,46,81,33,24,0,Foul on DeAundre Smith.
Blue Mountain College,New Orleans,46,82,33,24,1,Erik Thomas made Free Throw.
Blue Mountain College,New Orleans,46,83,33,24,1,Erik Thomas made Free Throw.
Blue Mountain College,New Orleans,46,83,33,34,0,Harrison Fancher missed Three Point Jumper.
Blue Mountain College,New Orleans,46,83,33,34,0,Velibor Njegovanovic Offensive Rebound.
Blue Mountain College,New Orleans,46,83,33,42,0,DeAundre Smith missed Three Point Jumper.
Blue Mountain College,New Orleans,46,83,33,42,0,Velibor Njegovanovic Offensive Rebound.
Blue Mountain College,New Orleans,46,83,33,52,0,Foul on Matthew Jiles.
Blue Mountain College,New Orleans,47,83,33,52,1,DeAundre Smith made Free Throw.
