Away Team,Home Team,Away Score,Home Score,Minute,Second,isScoringPosession,Desc.
Blue Mountain College,New Orleans,48,83,33,52,1,DeAundre Smith made Free Throw.
Blue Mountain College,New Orleans,48,83,34,7,0,Foul on Pierre Garel.
Blue Mountain College,New Orleans,48,83,34,7,0,Coleman Edwards missed Free Throw.
Blue Mountain College,New Orleans,48,83,34,7,0,New Orleans Deadball Team Rebound.
Blue Mountain College,New Orleans,48,83,34,7,0,Coleman Edwards missed Free Throw.
Blue Mountain College,New Orleans,48,83,34,7,0,New Orleans Offensive Rebound.
Blue Mountain College,New Orleans,48,83,34,11,0,Coleman Edwards missed Three Point Jumper.
Blue Mountain College,New Orleans,48,83,34,11,0,Kevin Hill Offensive Rebound.
Blue Mountain College,New Orleans,48,83,34,15,0,Foul on Harrison Fancher.
Blue Mountain College,New Orleans,48,84,34,15,1,Kevin Hill made Free Throw.
Blue Mountain College,New Orleans,48,84,34,15,0,Kevin Hill missed Free Throw.
Blue Mountain College,New Orleans,48,84,34,15,0,DeAundre Smith Defensive Rebound.
Blue Mountain College,New Orleans,48,84,34,36,0,Pierre Garel missed Three Point Jumper.
Blue Mountain College,New Orleans,48,84,34,36,0,Coleman Edwards Defensive Rebound.
Blue Mountain College,New Orleans,48,84,34,49,0,Kevin Hill Turnover.
Blue Mountain College,New Orleans,48,84,34,49,0,Foul on Kevin Hill.
Blue Mountain College,New Orleans,48,84,35,2,0,Harrison Fancher missed Three Point Jumper.
Blue Mountain College,New Orleans,48,84,35,2,0,Matthew Jiles Defensive Rebound.
Blue Mountain College,New Orleans,48,84,35,10,0,Foul on Pierre Garel.
Blue Mountain College,New Orleans,48,85,35,10,1,Matthew Jiles made Free Throw.
Blue Mountain College,New Orleans,48,86,35,10,1,Matthew Jiles made Free Throw.
Blue Mountain College,New Orleans,48,86,35,21,0,Velibor Njegovanovic missed Three Point Jumper.
Blue Mountain College,New Orleans,48,86,35,21,0,Austen Burton Offensive Rebound.
Blue Mountain College,New Orleans,50,86,35,26,1,Austen Burton made Jumper.
Blue Mountain College,New Orleans,50,86,35,36,0,Lamine Mbodj Turnover.
Blue Mountain College,New Orleans,50,86,35,36,0,Foul on Lamine Mbodj.
Blue Mountain College,New Orleans,50,86,35,47,0,DeAundre Smith missed Three Point Jumper.
Blue Mountain College,New Orleans,50,86,35,47,0,Danny Cohen Defensive Rebound.
Blue Mountain College,New Orleans,50,89,35,55,1,Danny Cohen made Three Point Jumper.
Blue Mountain College,New Orleans,50,89,36,5,0,Foul on Coleman Edwards.
Blue Mountain College,New Orleans,50,89,36,5,0,Official TV Timeout
Blue Mountain College,New Orleans,51,89,36,5,1,DeAundre Smith made Free Throw.
Blue Mountain College,New Orleans,51,89,36,5,0,DeAundre Smith missed Free Throw.
Blue Mountain College,New Orleans,51,89,36,5,0,Matthew Jiles Defensive Rebound.
Blue Mountain College,New Orleans,51,91,36,29,1,Danny Cohen made Jumper. Assisted by Coleman Edwards.
Blue Mountain College,New Orleans,54,91,36,58,1,Harrison Fancher made Three Point Jumper.
Blue Mountain College,New Orleans,54,91,37,19,0,Travis Avery missed Jumper.
Blue Mountain College,New Orleans,54,91,37,19,0,DeAundre Smith Defensive Rebound.
Blue Mountain College,New Orleans,54,91,37,27,0,Foul on Matthew Jiles.
Blue Mountain College,New Orleans,55,91,37,27,1,Pierre Garel made Free Throw.
Blue Mountain College,New Orleans,55,91,37,27,0,Pierre Garel missed Free Throw.
Blue Mountain College,New Orleans,55,91,37,27,0,Travis Avery Defensive Rebound.
Blue Mountain College,New Orleans,55,91,37,34,0,Danny Cohen missed Three Point Jumper.
Blue Mountain College,New Orleans,55,91,37,34,0,Harrison Fancher Defensive Rebound.
Blue Mountain College,New Orleans,58,91,37,44,1,Cody Berry made Three Point Jumper. Assisted by Harrison Fancher.
Blue Mountain College,New Orleans,58,91,37,59,0,Foul on Austen Burton.
Blue Mountain College,New Orleans,58,91,37,59,0,Coleman Edwards missed Free Throw.
Blue Mountain College,New Orleans,58,91,37,59,0,New Orleans Deadball Team Rebound.
Blue Mountain College,New Orleans,58,92,37,59,1,Coleman Edwards made Free Throw.
Blue Mountain College,New Orleans,58,92,38,23,0,Foul on Travis Avery.
Blue Mountain College,New Orleans,58,92,38,23,0,Austen Burton missed Free Throw.
Blue Mountain College,New Orleans,58,92,38,23,0,Blue Mountain Deadball Team Rebound.
Blue Mountain College,New Orleans,59,92,38,23,1,Austen Burton made Free Throw.
Blue Mountain College,New Orleans,59,94,38,31,1,Travis Avery made Jumper. Assisted by Coleman Edwards.
Blue Mountain College,New Orleans,59,94,38,46,0,Harrison Fancher missed Three Point Jumper.
Blue Mountain College,New Orleans,59,94,38,46,0,Lamine Mbodj Defensive Rebound.
Blue Mountain College,New Orleans,59,94,39,3,0,Velibor Njegovanovic Defensive Rebound.
Blue Mountain College,New Orleans,59,94,39,3,0,Foul on Travis Avery.
Blue Mountain College,New Orleans,60,94,39,3,1,Velibor Njegovanovic made Free Throw.
Blue Mountain College,New Orleans,60,94,39,3,0,Velibor Njegovanovic missed Free Throw.
Blue Mountain College,New Orleans,60,94,39,3,0,Danny Cohen Defensive Rebound.
Blue Mountain College,New Orleans,60,94,39,8,0,Travis Avery Turnover.
Blue Mountain College,New Orleans,60,94,39,8,0,Foul on Travis Avery.
Blue Mountain College,New Orleans,60,94,39,8,0,Technical Foul on Travis Avery.
Blue Mountain College,New Orleans,60,94,39,8,0,Harrison Fancher missed Free Throw.
Blue Mountain College,New Orleans,60,94,39,8,0,Blue Mountain Deadball Team Rebound.
Blue Mountain College,New Orleans,61,94,39,8,1,Harrison Fancher made Free Throw.
Blue Mountain College,New Orleans,61,94,39,19,0,Danny Cohen Turnover.
Blue Mountain College,New Orleans,61,94,39,31,0,Cody Berry Turnover.
Blue Mountain College,New Orleans,61,94,39,32,0,Matthew Jiles Steal.
Blue Mountain College,New Orleans,61,94,39,35,0,Coleman Edwards missed Three Point Jumper.
Blue Mountain College,New Orleans,61,94,39,35,0,Lamine Mbodj Offensive Rebound.
Blue Mountain College,New Orleans,61,94,39,40,0,Lamine Mbodj missed Layup.
Blue Mountain College,New Orleans,61,94,39,40,0,Austen Burton Block.
Blue Mountain College,New Orleans,61,94,39,41,0,Austen Burton Defensive Rebound.
Blue Mountain College,New Orleans,61,94,39,52,0,Austen Burton missed Dunk.
Blue Mountain College,New Orleans,61,94,39,52,0,Coleman Edwards Defensive Rebound.
Blue Mountain College,New Orleans,61,94,40,0,0,End of Game
