Away Team,Home Team,Away Score,Home Score,Minute,Second,isScoringPosession,Desc.
Florida State,Mississippi State,0,0,0,0,0,Jump Ball won by Mississippi St
Florida State,Mississippi State,0,0,0,28,0,Craig Sword missed Jumper.
Florida State,Mississippi State,0,0,0,28,0,Devon Bookert Block.
Florida State,Mississippi State,0,0,0,28,0,Florida St Defensive Rebound.
Florida State,Mississippi State,0,0,0,57,0,Xavier Rathan-Mayes missed Jumper.
Florida State,Mississippi State,0,0,0,57,0,Travis Daniels Defensive Rebound.
Florida State,Mississippi State,0,0,1,12,0,Foul on Devon Bookert.
Florida State,Mississippi State,0,2,1,25,1,Craig Sword made Layup.
Florida State,Mississippi State,0,2,1,48,0,Michael Ojo Turnover.
Florida State,Mississippi State,0,2,2,14,0,Travis Daniels missed Three Point Jumper.
Florida State,Mississippi State,0,2,2,14,0,Devon Bookert Defensive Rebound.
Florida State,Mississippi State,3,2,2,34,1,Devon Bookert made Three Point Jumper. Assisted by Xavier Rathan-Mayes.
Florida State,Mississippi State,3,4,2,57,1,Fallou Ndoye made Layup.
Florida State,Mississippi State,3,4,3,22,0,Michael Ojo Turnover.
Florida State,Mississippi State,3,6,3,42,1,Oliver Black made Jumper. Assisted by Craig Sword.
Florida State,Mississippi State,3,6,4,12,0,Foul on I.J. Ready.
Florida State,Mississippi State,3,6,4,12,0,Official TV Timeout
Florida State,Mississippi State,3,6,4,20,0,Xavier Rathan-Mayes missed Jumper.
Florida State,Mississippi State,3,6,4,20,0,Trivante Bloodman Defensive Rebound.
Florida State,Mississippi State,3,8,4,44,1,Travis Daniels made Jumper.
Florida State,Mississippi State,3,8,5,18,0,Jarquez Smith missed Jumper.
Florida State,Mississippi State,3,8,5,18,0,Travis Daniels Defensive Rebound.
Florida State,Mississippi State,3,8,5,18,0,Foul on Kiel Turpin.
Florida State,Mississippi State,3,8,5,38,0,Craig Sword missed Jumper.
Florida State,Mississippi State,3,8,5,38,0,Fallou Ndoye Offensive Rebound.
Florida State,Mississippi State,3,8,5,44,0,Fallou Ndoye missed Jumper.
Florida State,Mississippi State,3,8,5,44,0,Boris Bojanovsky Defensive Rebound.
Florida State,Mississippi State,3,8,5,52,0,Xavier Rathan-Mayes Turnover.
Florida State,Mississippi State,3,8,6,13,0,Craig Sword missed Three Point Jumper.
Florida State,Mississippi State,3,8,6,13,0,Xavier Rathan-Mayes Defensive Rebound.
Florida State,Mississippi State,3,8,6,26,0,Foul on Fallou Ndoye.
Florida State,Mississippi State,3,8,6,28,0,Jarquez Smith Turnover.
Florida State,Mississippi State,3,8,6,43,0,Gavin Ware missed Jumper.
Florida State,Mississippi State,3,8,6,43,0,Mississippi St Offensive Rebound.
Florida State,Mississippi State,3,8,6,49,0,Demetrius Houston missed Three Point Jumper.
Florida State,Mississippi State,3,8,6,49,0,Xavier Rathan-Mayes Defensive Rebound.
Florida State,Mississippi State,3,8,7,9,0,Foul on Roquez Johnson.
Florida State,Mississippi State,4,8,7,9,1,Boris Bojanovsky made Free Throw.
Florida State,Mississippi State,4,8,7,9,0,Boris Bojanovsky missed Free Throw.
Florida State,Mississippi State,4,8,7,9,0,Gavin Ware Defensive Rebound.
Florida State,Mississippi State,4,10,7,32,1,Trivante Bloodman made Jumper.
Florida State,Mississippi State,4,10,7,43,0,Montay Brandon missed Layup.
Florida State,Mississippi State,4,10,7,43,0,Gavin Ware Defensive Rebound.
Florida State,Mississippi State,4,10,7,50,0,Foul on Roquez Johnson.
Florida State,Mississippi State,4,10,7,50,0,Roquez Johnson Turnover.
Florida State,Mississippi State,6,10,8,12,1,Phil Cofer made Layup. Assisted by Montay Brandon.
Florida State,Mississippi State,6,10,8,12,0,Foul on Fred Thomas.
Florida State,Mississippi State,6,10,8,12,0,Official TV Timeout
Florida State,Mississippi State,7,10,8,12,1,Phil Cofer made Free Throw.
Florida State,Mississippi State,7,10,8,30,0,Fred Thomas missed Jumper.
Florida State,Mississippi State,7,10,8,30,0,Florida St Defensive Rebound.
Florida State,Mississippi State,7,10,8,58,0,Boris Bojanovsky Turnover.
Florida State,Mississippi State,7,10,8,58,0,Gavin Ware Steal.
Florida State,Mississippi State,7,10,9,9,0,Trivante Bloodman missed Three Point Jumper.
Florida State,Mississippi State,7,10,9,9,0,Florida St Defensive Rebound.
Florida State,Mississippi State,9,10,9,21,1,Phil Cofer made Dunk. Assisted by Devon Bookert.
Florida State,Mississippi State,9,10,9,36,0,Fred Thomas missed Three Point Jumper.
Florida State,Mississippi State,9,10,9,36,0,Xavier Rathan-Mayes Defensive Rebound.
Florida State,Mississippi State,11,10,9,43,1,Devon Bookert made Layup. Assisted by Xavier Rathan-Mayes.
Florida State,Mississippi State,11,12,9,59,1,Gavin Ware made Jumper. Assisted by Travis Daniels.
Florida State,Mississippi State,11,12,10,23,0,Jump Ball won by Florida St
Florida State,Mississippi State,11,12,10,32,0,Foul on Fallou Ndoye.
Florida State,Mississippi State,11,12,10,43,0,Boris Bojanovsky Turnover.
Florida State,Mississippi State,11,12,10,43,0,Oliver Black Steal.
Florida State,Mississippi State,11,14,11,6,1,Gavin Ware made Jumper.
Florida State,Mississippi State,11,14,11,30,0,Montay Brandon missed Jumper.
Florida State,Mississippi State,11,14,11,30,0,Gavin Ware Defensive Rebound.
Florida State,Mississippi State,11,16,11,40,1,I.J. Ready made Jumper.
Florida State,Mississippi State,11,16,12,1,0,Foul on Oliver Black.
Florida State,Mississippi State,11,16,12,1,0,Official TV Timeout
Florida State,Mississippi State,11,16,12,1,0,Xavier Rathan-Mayes missed Free Throw.
Florida State,Mississippi State,11,16,12,1,0,Craig Sword Defensive Rebound.
Florida State,Mississippi State,11,16,12,14,0,I.J. Ready Turnover.
Florida State,Mississippi State,11,16,12,42,0,Jarquez Smith missed Jumper.
Florida State,Mississippi State,11,16,12,42,0,Gavin Ware Block.
Florida State,Mississippi State,11,16,12,42,0,Travis Daniels Defensive Rebound.
Florida State,Mississippi State,11,16,12,57,0,Oliver Black Turnover.
Florida State,Mississippi State,11,16,12,57,0,Devon Bookert Steal.
Florida State,Mississippi State,13,16,13,2,1,Montay Brandon made Layup.
Florida State,Mississippi State,13,16,13,6,0,I.J. Ready Turnover.
Florida State,Mississippi State,13,16,13,6,0,Jarquez Smith Steal.
Florida State,Mississippi State,13,16,13,12,0,Devon Bookert missed Three Point Jumper.
Florida State,Mississippi State,13,16,13,12,0,Travis Daniels Defensive Rebound.
Florida State,Mississippi State,13,16,13,32,0,Foul on Robbie Berwick.
Florida State,Mississippi State,13,19,13,37,1,Fred Thomas made Three Point Jumper. Assisted by Trivante Bloodman.
Florida State,Mississippi State,13,19,14,10,0,Robbie Berwick missed Three Point Jumper.
Florida State,Mississippi State,13,19,14,10,0,Fred Thomas Block.
Florida State,Mississippi State,13,19,14,10,0,Florida St Offensive Rebound.
Florida State,Mississippi State,16,19,14,13,1,Devon Bookert made Three Point Jumper.
Florida State,Mississippi State,16,19,14,52,0,Trivante Bloodman Turnover.
Florida State,Mississippi State,16,19,15,3,0,Jarquez Smith Turnover.
Florida State,Mississippi State,16,19,15,3,0,Fred Thomas Steal.
Florida State,Mississippi State,16,19,15,19,0,Jump Ball won by Mississippi St
Florida State,Mississippi State,16,19,15,39,0,Fred Thomas missed Three Point Jumper.
Florida State,Mississippi State,16,19,15,39,0,Roquez Johnson Offensive Rebound.
Florida State,Mississippi State,16,19,15,47,0,Foul on Jarquez Smith.
Florida State,Mississippi State,16,19,15,47,0,Roquez Johnson missed Free Throw.
Florida State,Mississippi State,16,19,15,47,0,Mississippi St Deadball Team Rebound.
Florida State,Mississippi State,16,20,15,47,1,Roquez Johnson made Free Throw.
Florida State,Mississippi State,16,20,16,5,0,Kiel Turpin missed Dunk.
Florida State,Mississippi State,16,20,16,5,0,Demetrius Houston Block.
Florida State,Mississippi State,16,20,16,5,0,Roquez Johnson Defensive Rebound.
Florida State,Mississippi State,16,20,16,12,0,Demetrius Houston missed Three Point Jumper.
Florida State,Mississippi State,16,20,16,12,0,Mississippi St Offensive Rebound.
Florida State,Mississippi State,16,20,16,15,0,Official TV Timeout
Florida State,Mississippi State,16,20,16,33,0,Foul on Travis Daniels.
Florida State,Mississippi State,16,20,16,33,0,Travis Daniels Turnover.
Florida State,Mississippi State,16,20,16,44,0,Dayshawn Watkins Turnover.
Florida State,Mississippi State,16,20,16,44,0,Gavin Ware Steal.
Florida State,Mississippi State,16,20,16,44,0,Foul on Kiel Turpin.
Florida State,Mississippi State,16,20,16,51,0,Oliver Black missed Jumper.
Florida State,Mississippi State,16,20,16,51,0,Travis Daniels Offensive Rebound.
Florida State,Mississippi State,16,22,16,51,1,Travis Daniels made Two Point Tip Shot.
Florida State,Mississippi State,16,22,17,4,0,Foul on Trivante Bloodman.
Florida State,Mississippi State,16,22,17,4,0,Dayshawn Watkins missed Free Throw.
Florida State,Mississippi State,16,22,17,4,0,Gavin Ware Defensive Rebound.
Florida State,Mississippi State,16,22,17,15,0,Fred Thomas missed Jumper.
Florida State,Mississippi State,16,22,17,15,0,Montay Brandon Defensive Rebound.
Florida State,Mississippi State,16,22,17,27,0,Phil Cofer missed Jumper.
Florida State,Mississippi State,16,22,17,27,0,Boris Bojanovsky Offensive Rebound.
Florida State,Mississippi State,16,22,17,27,0,Foul on Travis Daniels.
Florida State,Mississippi State,17,22,17,27,1,Boris Bojanovsky made Free Throw.
Florida State,Mississippi State,17,22,17,27,0,Boris Bojanovsky missed Free Throw.
Florida State,Mississippi State,17,22,17,27,0,Trivante Bloodman Defensive Rebound.
Florida State,Mississippi State,17,22,17,33,0,Trivante Bloodman Turnover.
Florida State,Mississippi State,17,22,17,33,0,Xavier Rathan-Mayes Steal.
Florida State,Mississippi State,17,22,17,37,0,Xavier Rathan-Mayes missed Layup.
Florida State,Mississippi State,17,22,17,37,0,Boris Bojanovsky Offensive Rebound.
Florida State,Mississippi State,20,22,17,44,1,Devon Bookert made Three Point Jumper.
Florida State,Mississippi State,20,22,17,50,0,Craig Sword Turnover.
Florida State,Mississippi State,20,22,18,13,0,Foul on Demetrius Houston.
Florida State,Mississippi State,21,22,18,13,1,Montay Brandon made Free Throw.
Florida State,Mississippi State,22,22,18,13,1,Montay Brandon made Free Throw.
Florida State,Mississippi State,22,22,18,40,0,Trivante Bloodman missed Jumper.
Florida State,Mississippi State,22,22,18,40,0,Montay Brandon Defensive Rebound.
Florida State,Mississippi State,25,22,18,58,1,Xavier Rathan-Mayes made Three Point Jumper. Assisted by Montay Brandon.
Florida State,Mississippi State,25,22,19,11,0,Mississippi St  Timeout
Florida State,Mississippi State,25,22,19,21,0,Trivante Bloodman Turnover.
Florida State,Mississippi State,25,22,19,56,0,Florida St  Turnover.
Florida State,Mississippi State,25,22,19,59,0,Craig Sword missed Three Point Jumper.
Florida State,Mississippi State,25,22,19,59,0,Florida St Defensive Rebound.
Florida State,Mississippi State,25,22,20,0,0,End of 1st half
Florida State,Mississippi State,25,22,20,0,0,Jump Ball won by Florida St
Florida State,Mississippi State,27,22,20,15,1,Phil Cofer made Layup. Assisted by Boris Bojanovsky.
Florida State,Mississippi State,27,24,20,49,1,I.J. Ready made Jumper.
Florida State,Mississippi State,27,24,21,18,0,Xavier Rathan-Mayes Turnover.
Florida State,Mississippi State,27,24,21,18,0,I.J. Ready Steal.
Florida State,Mississippi State,27,24,21,25,0,Travis Daniels missed Layup.
Florida State,Mississippi State,27,24,21,25,0,Boris Bojanovsky Block.
Florida State,Mississippi State,27,24,21,25,0,Florida St Defensive Rebound.
Florida State,Mississippi State,27,24,21,32,0,Foul on I.J. Ready.
Florida State,Mississippi State,27,24,21,50,0,Foul on Fallou Ndoye.
Florida State,Mississippi State,27,24,21,50,0,Xavier Rathan-Mayes Turnover.
Florida State,Mississippi State,27,24,21,50,0,I.J. Ready Steal.
Florida State,Mississippi State,27,26,21,50,1,I.J. Ready made Jumper.
Florida State,Mississippi State,27,26,22,3,0,Phil Cofer Turnover.
Florida State,Mississippi State,27,26,22,3,0,I.J. Ready Steal.
Florida State,Mississippi State,27,28,22,7,1,I.J. Ready made Layup.
Florida State,Mississippi State,29,28,22,22,1,Phil Cofer made Dunk. Assisted by Xavier Rathan-Mayes.
Florida State,Mississippi State,29,28,22,44,0,Foul on Phil Cofer.
Florida State,Mississippi State,29,28,22,47,0,Gavin Ware missed Jumper.
Florida State,Mississippi State,29,28,22,47,0,Phil Cofer Block.
Florida State,Mississippi State,29,28,22,47,0,Gavin Ware Offensive Rebound.
Florida State,Mississippi State,29,30,22,53,1,Gavin Ware made Jumper.
Florida State,Mississippi State,29,30,22,57,0,Florida St  Timeout
Florida State,Mississippi State,32,30,23,13,1,Xavier Rathan-Mayes made Three Point Jumper. Assisted by Boris Bojanovsky.
Florida State,Mississippi State,32,32,23,39,1,Gavin Ware made Jumper. Assisted by Oliver Black.
Florida State,Mississippi State,32,32,24,4,0,Montay Brandon Turnover.
Florida State,Mississippi State,32,32,24,4,0,Travis Daniels Steal.
Florida State,Mississippi State,32,34,24,16,1,Travis Daniels made Layup.
Florida State,Mississippi State,32,34,24,46,0,Florida St  Timeout
Florida State,Mississippi State,32,34,24,53,0,Xavier Rathan-Mayes missed Three Point Jumper.
Florida State,Mississippi State,32,34,24,53,0,Montay Brandon Offensive Rebound.
Florida State,Mississippi State,32,34,25,15,0,Boris Bojanovsky missed Jumper.
Florida State,Mississippi State,32,34,25,15,0,Roquez Johnson Defensive Rebound.
Florida State,Mississippi State,32,34,25,21,0,Roquez Johnson Turnover.
Florida State,Mississippi State,32,34,25,21,0,Xavier Rathan-Mayes Steal.
Florida State,Mississippi State,32,34,25,21,0,Foul on Trivante Bloodman.
Florida State,Mississippi State,32,34,25,21,0,Official TV Timeout
Florida State,Mississippi State,35,34,25,30,1,Devon Bookert made Three Point Jumper. Assisted by Xavier Rathan-Mayes.
Florida State,Mississippi State,35,34,26,2,0,Foul on Montay Brandon.
Florida State,Mississippi State,35,34,26,2,0,Fred Thomas missed Three Point Jumper.
Florida State,Mississippi State,35,34,26,2,0,Devon Bookert Defensive Rebound.
Florida State,Mississippi State,35,34,26,3,0,Devon Bookert missed Three Point Jumper.
Florida State,Mississippi State,35,34,26,3,0,Michael Ojo Offensive Rebound.
Florida State,Mississippi State,37,34,26,8,1,Michael Ojo made Layup.
Florida State,Mississippi State,37,34,26,46,0,Foul on Michael Ojo.
Florida State,Mississippi State,37,35,26,46,1,Gavin Ware made Free Throw.
Florida State,Mississippi State,37,36,26,46,1,Gavin Ware made Free Throw.
Florida State,Mississippi State,37,36,27,8,0,Foul on Fallou Ndoye.
Florida State,Mississippi State,37,36,27,25,0,Montay Brandon Turnover.
Florida State,Mississippi State,37,36,27,40,0,I.J. Ready missed Jumper.
Florida State,Mississippi State,37,36,27,40,0,Montay Brandon Block.
Florida State,Mississippi State,37,36,27,40,0,I.J. Ready Offensive Rebound.
Florida State,Mississippi State,37,38,27,45,1,I.J. Ready made Layup.
Florida State,Mississippi State,37,38,28,9,0,Jarquez Smith missed Three Point Jumper.
Florida State,Mississippi State,37,38,28,9,0,Fred Thomas Defensive Rebound.
Florida State,Mississippi State,37,38,28,17,0,Fred Thomas missed Three Point Jumper.
Florida State,Mississippi State,37,38,28,17,0,Devon Bookert Defensive Rebound.
Florida State,Mississippi State,39,38,28,40,1,Montay Brandon made Dunk. Assisted by Devon Bookert.
Florida State,Mississippi State,39,40,29,8,1,Roquez Johnson made Layup. Assisted by I.J. Ready.
Florida State,Mississippi State,39,40,29,30,0,Foul on Michael Ojo.
Florida State,Mississippi State,39,40,29,30,0,Michael Ojo Turnover.
Florida State,Mississippi State,39,40,29,30,0,Official TV Timeout
Florida State,Mississippi State,39,40,29,41,0,Fred Thomas missed Jumper.
Florida State,Mississippi State,39,40,29,41,0,Roquez Johnson Offensive Rebound.
Florida State,Mississippi State,39,42,29,41,1,Roquez Johnson made Two Point Tip Shot.
Florida State,Mississippi State,41,42,30,7,1,Jarquez Smith made Layup.
Florida State,Mississippi State,41,44,30,15,1,I.J. Ready made Layup.
Florida State,Mississippi State,41,44,30,52,0,Xavier Rathan-Mayes missed Three Point Jumper.
Florida State,Mississippi State,41,44,30,52,0,Kiel Turpin Offensive Rebound.
Florida State,Mississippi State,41,44,31,8,0,Foul on Oliver Black.
Florida State,Mississippi State,41,44,31,17,0,Foul on Xavier Rathan-Mayes.
Florida State,Mississippi State,41,44,31,17,0,Xavier Rathan-Mayes Turnover.
Florida State,Mississippi State,41,44,31,37,0,Travis Daniels missed Three Point Jumper.
Florida State,Mississippi State,41,44,31,37,0,Florida St Defensive Rebound.
Florida State,Mississippi State,41,44,31,53,0,Devon Bookert missed Jumper.
Florida State,Mississippi State,41,44,31,53,0,Devon Bookert Offensive Rebound.
Florida State,Mississippi State,41,44,31,58,0,Devon Bookert missed Jumper.
Florida State,Mississippi State,41,44,31,58,0,Gavin Ware Defensive Rebound.
Florida State,Mississippi State,41,44,32,10,0,Foul on Devon Bookert.
Florida State,Mississippi State,41,44,32,10,0,Official TV Timeout
Florida State,Mississippi State,41,44,32,38,0,Travis Daniels missed Three Point Jumper.
Florida State,Mississippi State,41,44,32,38,0,Roquez Johnson Offensive Rebound.
Florida State,Mississippi State,41,47,32,54,1,Travis Daniels made Three Point Jumper. Assisted by Craig Sword.
Florida State,Mississippi State,43,47,33,14,1,Xavier Rathan-Mayes made Layup.
Florida State,Mississippi State,43,49,33,36,1,Craig Sword made Layup. Assisted by Trivante Bloodman.
Florida State,Mississippi State,45,49,34,5,1,Boris Bojanovsky made Layup.
Florida State,Mississippi State,45,49,34,24,0,Foul on Gavin Ware.
Florida State,Mississippi State,45,49,34,24,0,Gavin Ware Turnover.
Florida State,Mississippi State,45,49,34,31,0,Foul on Craig Sword.
Florida State,Mississippi State,46,49,34,31,1,Devon Bookert made Free Throw.
Florida State,Mississippi State,47,49,34,31,1,Devon Bookert made Free Throw.
Florida State,Mississippi State,47,49,34,51,0,Craig Sword missed Layup.
Florida State,Mississippi State,47,49,34,51,0,Jarquez Smith Block.
Florida State,Mississippi State,47,49,34,51,0,Jarquez Smith Defensive Rebound.
Florida State,Mississippi State,49,49,34,59,1,Montay Brandon made Layup.
Florida State,Mississippi State,49,49,35,5,0,Mississippi St  Timeout
Florida State,Mississippi State,49,49,35,15,0,Foul on Boris Bojanovsky.
Florida State,Mississippi State,49,50,35,15,1,Craig Sword made Free Throw.
Florida State,Mississippi State,49,51,35,15,1,Craig Sword made Free Throw.
Florida State,Mississippi State,49,51,35,15,0,Xavier Rathan-Mayes missed Jumper.
Florida State,Mississippi State,49,51,35,15,0,Montay Brandon Offensive Rebound.
Florida State,Mississippi State,49,51,35,15,0,Foul on I.J. Ready.
Florida State,Mississippi State,49,51,35,15,0,Jarquez Smith missed Free Throw.
Florida State,Mississippi State,49,51,35,15,0,Florida St Deadball Team Rebound.
Florida State,Mississippi State,49,51,35,15,0,Jarquez Smith missed Free Throw.
Florida State,Mississippi State,49,51,35,15,0,Roquez Johnson Defensive Rebound.
Florida State,Mississippi State,49,51,35,39,0,Craig Sword missed Jumper.
Florida State,Mississippi State,49,51,35,39,0,Xavier Rathan-Mayes Defensive Rebound.
Florida State,Mississippi State,49,51,36,8,0,Foul on I.J. Ready.
Florida State,Mississippi State,49,51,36,8,0,Official TV Timeout
Florida State,Mississippi State,49,51,36,8,0,Xavier Rathan-Mayes missed Free Throw.
Florida State,Mississippi State,49,51,36,8,0,Florida St Deadball Team Rebound.
Florida State,Mississippi State,50,51,36,8,1,Xavier Rathan-Mayes made Free Throw.
Florida State,Mississippi State,50,51,36,35,0,Gavin Ware missed Layup.
Florida State,Mississippi State,50,51,36,35,0,Montay Brandon Defensive Rebound.
Florida State,Mississippi State,50,51,36,35,0,Montay Brandon Turnover.
Florida State,Mississippi State,50,51,36,35,0,Travis Daniels Steal.
Florida State,Mississippi State,50,53,36,35,1,Travis Daniels made Layup.
Florida State,Mississippi State,50,53,36,35,0,Foul on Boris Bojanovsky.
Florida State,Mississippi State,50,54,36,35,1,Travis Daniels made Free Throw.
Florida State,Mississippi State,50,54,36,48,0,Boris Bojanovsky missed Layup.
Florida State,Mississippi State,50,54,36,48,0,Xavier Rathan-Mayes Offensive Rebound.
Florida State,Mississippi State,50,54,36,51,0,Foul on Fallou Ndoye.
Florida State,Mississippi State,51,54,36,51,1,Xavier Rathan-Mayes made Free Throw.
Florida State,Mississippi State,51,54,36,51,0,Xavier Rathan-Mayes missed Free Throw.
Florida State,Mississippi State,51,54,36,51,0,Gavin Ware Defensive Rebound.
Florida State,Mississippi State,51,54,37,20,0,Roquez Johnson missed Jumper.
Florida State,Mississippi State,51,54,37,20,0,Xavier Rathan-Mayes Defensive Rebound.
Florida State,Mississippi State,53,54,37,49,1,Xavier Rathan-Mayes made Layup.
Florida State,Mississippi State,53,54,38,27,0,Foul on Travis Daniels.
Florida State,Mississippi State,53,54,38,27,0,Travis Daniels Turnover.
Florida State,Mississippi State,53,54,38,42,0,Boris Bojanovsky missed Jumper.
Florida State,Mississippi State,53,54,38,42,0,Gavin Ware Block.
Florida State,Mississippi State,53,54,38,42,0,Boris Bojanovsky Offensive Rebound.
Florida State,Mississippi State,53,54,38,53,0,Boris Bojanovsky missed Layup.
Florida State,Mississippi State,53,54,38,53,0,Fred Thomas Defensive Rebound.
Florida State,Mississippi State,53,54,38,53,0,Mississippi St  Timeout
Florida State,Mississippi State,53,56,39,6,1,Craig Sword made Layup.
Florida State,Mississippi State,53,56,39,13,0,Florida St  Timeout
Florida State,Mississippi State,53,56,39,13,0,Florida St  Timeout
Florida State,Mississippi State,53,56,39,21,0,Jarquez Smith Turnover.
Florida State,Mississippi State,53,56,39,21,0,Foul on Jarquez Smith.
Florida State,Mississippi State,53,56,39,23,0,Foul on Xavier Rathan-Mayes.
Florida State,Mississippi State,53,57,39,23,1,Roquez Johnson made Free Throw.
Florida State,Mississippi State,53,58,39,23,1,Roquez Johnson made Free Throw.
Florida State,Mississippi State,53,58,39,30,0,Xavier Rathan-Mayes missed Three Point Jumper.
Florida State,Mississippi State,53,58,39,30,0,Jarquez Smith Offensive Rebound.
Florida State,Mississippi State,53,58,39,35,0,Foul on Roquez Johnson.
Florida State,Mississippi State,54,58,39,35,1,Jarquez Smith made Free Throw.
Florida State,Mississippi State,55,58,39,35,1,Jarquez Smith made Free Throw.
Florida State,Mississippi State,55,58,39,38,0,Foul on Montay Brandon.
Florida State,Mississippi State,55,59,39,38,1,I.J. Ready made Free Throw.
Florida State,Mississippi State,55,60,39,38,1,I.J. Ready made Free Throw.
Florida State,Mississippi State,55,60,39,43,0,Xavier Rathan-Mayes missed Three Point Jumper.
Florida State,Mississippi State,55,60,39,43,0,Gavin Ware Defensive Rebound.
Florida State,Mississippi State,55,60,39,51,0,Foul on Devon Bookert.
Florida State,Mississippi State,55,61,39,51,1,Fred Thomas made Free Throw.
Florida State,Mississippi State,55,62,39,51,1,Fred Thomas made Free Throw.
Florida State,Mississippi State,55,62,39,54,0,Xavier Rathan-Mayes Turnover.
Florida State,Mississippi State,55,62,39,54,0,Trivante Bloodman Steal.
Florida State,Mississippi State,55,62,40,0,0,End of Game
