Away Team,Home Team,Away Score,Home Score,Minute,Second,isScoringPosession,Desc.
Long Beach State,Pepperdine,0,3,0,30,1,Jeremy Major made Three Point Jumper.
Long Beach State,Pepperdine,0,3,0,54,0,Gabe Levin Turnover.
Long Beach State,Pepperdine,0,3,1,11,0,Stacy Davis missed Jumper.
Long Beach State,Pepperdine,0,3,1,11,0,Nick Faust Defensive Rebound.
Long Beach State,Pepperdine,0,3,1,19,0,Nick Faust missed Layup.
Long Beach State,Pepperdine,0,3,1,19,0,Kameron Edwards Defensive Rebound.
Long Beach State,Pepperdine,0,3,1,23,0,Foul on Nick Faust.
Long Beach State,Pepperdine,0,3,1,43,0,Jett Raines missed Layup.
Long Beach State,Pepperdine,0,3,1,43,0,Travis Hammonds Block.
Long Beach State,Pepperdine,0,3,1,43,0,Travis Hammonds Defensive Rebound.
Long Beach State,Pepperdine,3,3,2,3,1,A.J. Spencer made Three Point Jumper. Assisted by Justin Bibbins.
Long Beach State,Pepperdine,3,5,2,19,1,Lamond Murray Jr. made Jumper. Assisted by Jeremy Major.
Long Beach State,Pepperdine,5,5,2,36,1,Gabe Levin made Dunk. Assisted by Justin Bibbins.
Long Beach State,Pepperdine,5,5,2,52,0,Jett Raines missed Three Point Jumper.
Long Beach State,Pepperdine,5,5,2,52,0,Jeremy Major Offensive Rebound.
Long Beach State,Pepperdine,5,5,2,58,0,Lamond Murray Jr. missed Three Point Jumper.
Long Beach State,Pepperdine,5,5,2,58,0,Stacy Davis Offensive Rebound.
Long Beach State,Pepperdine,5,5,3,2,0,Stacy Davis missed Jumper.
Long Beach State,Pepperdine,5,5,3,2,0,Jett Raines Offensive Rebound.
Long Beach State,Pepperdine,5,7,3,4,1,Jett Raines made Two Point Tip Shot.
Long Beach State,Pepperdine,7,7,3,9,1,Gabe Levin made Dunk. Assisted by Justin Bibbins.
Long Beach State,Pepperdine,7,7,3,32,0,Foul on A.J. Spencer.
Long Beach State,Pepperdine,7,7,3,32,0,Jett Raines missed Free Throw.
Long Beach State,Pepperdine,7,7,3,32,0,Pepperdine Deadball Team Rebound.
Long Beach State,Pepperdine,7,8,3,32,1,Jett Raines made Free Throw.
Long Beach State,Pepperdine,7,8,3,42,0,Justin Bibbins Turnover.
Long Beach State,Pepperdine,7,8,3,44,0,Jeremy Major Steal.
Long Beach State,Pepperdine,7,8,3,59,0,Kameron Edwards missed Jumper.
Long Beach State,Pepperdine,7,8,3,59,0,Nick Faust Defensive Rebound.
Long Beach State,Pepperdine,7,8,4,1,0,Foul on Kameron Edwards.
Long Beach State,Pepperdine,7,8,4,1,0,Official TV Timeout
Long Beach State,Pepperdine,7,8,4,13,0,Justin Bibbins Turnover.
Long Beach State,Pepperdine,7,8,4,14,0,Jeremy Major Steal.
Long Beach State,Pepperdine,7,8,4,20,0,Jeremy Major missed Three Point Jumper.
Long Beach State,Pepperdine,7,8,4,20,0,Lamond Murray Jr. Offensive Rebound.
Long Beach State,Pepperdine,7,10,4,24,1,Lamond Murray Jr. made Layup.
Long Beach State,Pepperdine,7,10,4,46,0,Foul on Shawn Olden.
Long Beach State,Pepperdine,8,10,4,46,1,A.J. Spencer made Free Throw.
Long Beach State,Pepperdine,8,10,4,46,0,A.J. Spencer missed Free Throw.
Long Beach State,Pepperdine,8,10,4,46,0,Lamond Murray Jr. Defensive Rebound.
Long Beach State,Pepperdine,8,12,5,12,1,Lamond Murray Jr. made Jumper. Assisted by Amadi Udenyi.
Long Beach State,Pepperdine,8,12,5,24,0,Travis Hammonds missed Three Point Jumper.
Long Beach State,Pepperdine,8,12,5,24,0,Justin Bibbins Offensive Rebound.
Long Beach State,Pepperdine,8,12,5,44,0,Roschon Prince missed Jumper.
Long Beach State,Pepperdine,8,12,5,44,0,Stacy Davis Block.
Long Beach State,Pepperdine,8,12,5,45,0,Lamond Murray Jr. Defensive Rebound.
Long Beach State,Pepperdine,8,14,5,50,1,Lamond Murray Jr. made Jumper.
Long Beach State,Pepperdine,8,14,5,57,0,Foul on Shawn Olden.
Long Beach State,Pepperdine,8,14,5,58,0,Justin Bibbins missed Three Point Jumper.
Long Beach State,Pepperdine,8,14,5,58,0,Roschon Prince Offensive Rebound.
Long Beach State,Pepperdine,8,14,6,4,0,Nick Faust missed Three Point Jumper.
Long Beach State,Pepperdine,8,14,6,4,0,Travis Hammonds Offensive Rebound.
Long Beach State,Pepperdine,8,14,6,30,0,Travis Hammonds missed Jumper.
Long Beach State,Pepperdine,8,14,6,30,0,Stacy Davis Defensive Rebound.
Long Beach State,Pepperdine,8,14,6,52,0,Lamond Murray Jr. missed Jumper.
Long Beach State,Pepperdine,8,14,6,52,0,Roschon Prince Defensive Rebound.
Long Beach State,Pepperdine,8,14,7,11,0,A.J. Spencer missed Layup.
Long Beach State,Pepperdine,8,14,7,11,0,A.J. Spencer Offensive Rebound.
Long Beach State,Pepperdine,10,14,7,13,1,A.J. Spencer made Layup.
Long Beach State,Pepperdine,10,14,7,34,0,Amadi Udenyi missed Three Point Jumper.
Long Beach State,Pepperdine,10,14,7,34,0,Long Beach St Defensive Rebound.
Long Beach State,Pepperdine,10,14,7,38,0,Foul on Kameron Edwards.
Long Beach State,Pepperdine,10,14,7,50,0,Noah Blackwell missed Layup.
Long Beach State,Pepperdine,10,14,7,50,0,Pepperdine Defensive Rebound.
Long Beach State,Pepperdine,10,16,8,18,1,Lamond Murray Jr. made Jumper. Assisted by Jett Raines.
Long Beach State,Pepperdine,12,16,8,36,1,Nick Faust made Layup.
Long Beach State,Pepperdine,12,16,8,51,0,Foul on Roschon Prince.
Long Beach State,Pepperdine,12,16,8,51,0,Official TV Timeout
Long Beach State,Pepperdine,12,17,8,51,1,Lamond Murray Jr. made Free Throw.
Long Beach State,Pepperdine,12,18,8,51,1,Lamond Murray Jr. made Free Throw.
Long Beach State,Pepperdine,12,18,9,10,0,Branford Jones Turnover.
Long Beach State,Pepperdine,12,18,9,19,0,Foul on Justin Bibbins.
Long Beach State,Pepperdine,12,18,9,30,0,A.J. John missed Jumper.
Long Beach State,Pepperdine,12,18,9,30,0,Roschon Prince Defensive Rebound.
Long Beach State,Pepperdine,12,18,9,54,0,Foul on Stacy Davis.
Long Beach State,Pepperdine,12,18,9,54,0,Gabe Levin missed Free Throw.
Long Beach State,Pepperdine,12,18,9,54,0,Long Beach St Deadball Team Rebound.
Long Beach State,Pepperdine,13,18,9,54,1,Gabe Levin made Free Throw.
Long Beach State,Pepperdine,13,18,10,15,0,Jeremy Major missed Three Point Jumper.
Long Beach State,Pepperdine,13,18,10,15,0,Pepperdine Offensive Rebound.
Long Beach State,Pepperdine,13,18,10,33,0,Jett Raines missed Layup.
Long Beach State,Pepperdine,13,18,10,33,0,Roschon Prince Defensive Rebound.
Long Beach State,Pepperdine,13,18,10,42,0,Branford Jones missed Three Point Jumper.
Long Beach State,Pepperdine,13,18,10,42,0,Stacy Davis Defensive Rebound.
Long Beach State,Pepperdine,13,18,10,54,0,Stacy Davis missed Three Point Jumper.
Long Beach State,Pepperdine,13,18,10,54,0,A.J. Lapray Offensive Rebound.
Long Beach State,Pepperdine,13,21,11,13,1,A.J. Lapray made Three Point Jumper. Assisted by Amadi Udenyi.
Long Beach State,Pepperdine,13,21,11,23,0,Justin Bibbins missed Three Point Jumper.
Long Beach State,Pepperdine,13,21,11,23,0,Jeremy Major Defensive Rebound.
Long Beach State,Pepperdine,13,21,11,29,0,Foul on Justin Bibbins.
Long Beach State,Pepperdine,13,21,11,35,0,Jeremy Major missed Three Point Jumper.
Long Beach State,Pepperdine,13,21,11,35,0,Stacy Davis Offensive Rebound.
Long Beach State,Pepperdine,13,24,12,4,1,Amadi Udenyi made Three Point Jumper.
Long Beach State,Pepperdine,13,24,12,13,0,Long Beach St  Timeout
Long Beach State,Pepperdine,16,24,12,21,1,Noah Blackwell made Three Point Jumper.
Long Beach State,Pepperdine,16,24,12,35,0,Foul on Noah Blackwell.
Long Beach State,Pepperdine,16,24,12,35,0,Jett Raines missed Free Throw.
Long Beach State,Pepperdine,16,24,12,35,0,Pepperdine Deadball Team Rebound.
Long Beach State,Pepperdine,16,24,12,35,0,Jett Raines missed Free Throw.
Long Beach State,Pepperdine,16,24,12,35,0,Nick Faust Defensive Rebound.
Long Beach State,Pepperdine,16,24,12,53,0,Foul on A.J. Lapray.
Long Beach State,Pepperdine,16,24,12,54,0,Noah Blackwell missed Three Point Jumper.
Long Beach State,Pepperdine,16,24,12,54,0,Gabe Levin Offensive Rebound.
Long Beach State,Pepperdine,16,24,12,59,0,A.J. Spencer missed Three Point Jumper.
Long Beach State,Pepperdine,16,24,12,59,0,Stacy Davis Defensive Rebound.
Long Beach State,Pepperdine,16,24,13,13,0,Stacy Davis missed Jumper.
Long Beach State,Pepperdine,16,24,13,13,0,Nick Faust Defensive Rebound.
Long Beach State,Pepperdine,18,24,13,29,1,Gabe Levin made Dunk. Assisted by Noah Blackwell.
Long Beach State,Pepperdine,18,24,13,54,0,Jeremy Major missed Layup.
Long Beach State,Pepperdine,18,24,13,54,0,Gabe Levin Block.
Long Beach State,Pepperdine,18,24,13,54,0,Pepperdine Offensive Rebound.
Long Beach State,Pepperdine,18,27,13,55,1,A.J. Lapray made Three Point Jumper. Assisted by Jeremy Major.
Long Beach State,Pepperdine,18,27,14,13,0,Nick Faust missed Layup.
Long Beach State,Pepperdine,18,27,14,13,0,Mason Riggins Offensive Rebound.
Long Beach State,Pepperdine,20,27,14,15,1,Mason Riggins made Two Point Tip Shot.
Long Beach State,Pepperdine,20,27,14,39,0,Jett Raines missed Layup.
Long Beach State,Pepperdine,20,27,14,39,0,A.J. Spencer Defensive Rebound.
Long Beach State,Pepperdine,20,27,14,45,0,A.J. Spencer missed Layup.
Long Beach State,Pepperdine,20,27,14,45,0,A.J. Lapray Block.
Long Beach State,Pepperdine,20,27,14,46,0,A.J. Lapray Defensive Rebound.
Long Beach State,Pepperdine,20,29,14,56,1,Stacy Davis made Layup. Assisted by Lamond Murray Jr..
Long Beach State,Pepperdine,20,29,15,8,0,Mason Riggins missed Layup.
Long Beach State,Pepperdine,20,29,15,8,0,Lamond Murray Jr. Defensive Rebound.
Long Beach State,Pepperdine,20,29,15,24,0,Foul on A.J. Spencer.
Long Beach State,Pepperdine,20,29,15,24,0,Stacy Davis missed Free Throw.
Long Beach State,Pepperdine,20,29,15,24,0,Travis Hammonds Defensive Rebound.
Long Beach State,Pepperdine,20,29,15,42,0,Mason Riggins Turnover.
Long Beach State,Pepperdine,20,29,16,2,0,A.J. Lapray missed Three Point Jumper.
Long Beach State,Pepperdine,20,29,16,2,0,Long Beach St Defensive Rebound.
Long Beach State,Pepperdine,20,29,16,6,0,Official TV Timeout
Long Beach State,Pepperdine,20,29,16,17,0,Foul on A.J. John.
Long Beach State,Pepperdine,20,29,16,17,0,Roschon Prince missed Free Throw.
Long Beach State,Pepperdine,20,29,16,17,0,Stacy Davis Defensive Rebound.
Long Beach State,Pepperdine,20,29,16,33,0,Stacy Davis Turnover.
Long Beach State,Pepperdine,20,29,16,35,0,Roschon Prince Steal.
Long Beach State,Pepperdine,22,29,16,38,1,Nick Faust made Dunk. Assisted by Branford Jones.
Long Beach State,Pepperdine,22,29,16,54,0,Jeremy Major Turnover.
Long Beach State,Pepperdine,22,29,16,55,0,Branford Jones Steal.
Long Beach State,Pepperdine,24,29,16,57,1,Noah Blackwell made Layup. Assisted by Branford Jones.
Long Beach State,Pepperdine,24,29,17,34,0,Foul on Lamond Murray Jr..
Long Beach State,Pepperdine,24,29,17,34,0,Lamond Murray Jr. Turnover.
Long Beach State,Pepperdine,26,29,17,48,1,Travis Hammonds made Jumper.
Long Beach State,Pepperdine,26,29,18,12,0,Stacy Davis Turnover.
Long Beach State,Pepperdine,26,29,18,13,0,Roschon Prince Steal.
Long Beach State,Pepperdine,28,29,18,15,1,Branford Jones made Layup. Assisted by Roschon Prince.
Long Beach State,Pepperdine,28,29,18,16,0,Pepperdine  Timeout
Long Beach State,Pepperdine,28,32,18,33,1,Jeremy Major made Three Point Jumper. Assisted by Lamond Murray Jr..
Long Beach State,Pepperdine,31,32,18,43,1,Noah Blackwell made Three Point Jumper. Assisted by Nick Faust.
Long Beach State,Pepperdine,31,32,18,59,0,Amadi Udenyi Turnover.
Long Beach State,Pepperdine,31,32,19,14,0,Branford Jones Turnover.
Long Beach State,Pepperdine,31,32,19,15,0,Amadi Udenyi Steal.
Long Beach State,Pepperdine,31,32,19,19,0,Foul on Lamond Murray Jr..
Long Beach State,Pepperdine,31,32,19,19,0,Lamond Murray Jr. Turnover.
Long Beach State,Pepperdine,31,32,19,36,0,Travis Hammonds missed Jumper.
Long Beach State,Pepperdine,31,32,19,36,0,Roschon Prince Offensive Rebound.
Long Beach State,Pepperdine,31,32,19,38,0,Roschon Prince missed Layup.
Long Beach State,Pepperdine,31,32,19,38,0,A.J. John Defensive Rebound.
Long Beach State,Pepperdine,31,32,19,40,0,Foul on Roschon Prince.
Long Beach State,Pepperdine,31,32,19,40,0,A.J. John missed Free Throw.
Long Beach State,Pepperdine,31,32,19,40,0,Branford Jones Defensive Rebound.
Long Beach State,Pepperdine,31,32,19,58,0,Travis Hammonds missed Three Point Jumper.
Long Beach State,Pepperdine,31,32,19,58,0,A.J. John Defensive Rebound.
Long Beach State,Pepperdine,31,32,20,0,0,End of 1st half
Long Beach State,Pepperdine,31,34,20,18,1,Jett Raines made Jumper. Assisted by Jeremy Major.
Long Beach State,Pepperdine,31,34,20,30,0,Foul on Kameron Edwards.
Long Beach State,Pepperdine,33,34,20,38,1,Nick Faust made Jumper.
Long Beach State,Pepperdine,33,34,20,58,0,Stacy Davis missed Jumper.
Long Beach State,Pepperdine,33,34,20,58,0,Jett Raines Offensive Rebound.
Long Beach State,Pepperdine,33,34,21,3,0,Jett Raines Turnover.
Long Beach State,Pepperdine,33,34,21,3,0,Branford Jones Steal.
Long Beach State,Pepperdine,35,34,21,14,1,Travis Hammonds made Jumper. Assisted by Branford Jones.
Long Beach State,Pepperdine,35,34,21,28,0,Kameron Edwards missed Jumper.
Long Beach State,Pepperdine,35,34,21,28,0,Branford Jones Defensive Rebound.
Long Beach State,Pepperdine,38,34,21,46,1,Branford Jones made Three Point Jumper. Assisted by Noah Blackwell.
Long Beach State,Pepperdine,38,36,22,3,1,Lamond Murray Jr. made Jumper. Assisted by Jeremy Major.
Long Beach State,Pepperdine,38,36,22,20,0,Branford Jones missed Layup.
Long Beach State,Pepperdine,38,36,22,20,0,Stacy Davis Block.
Long Beach State,Pepperdine,38,36,22,21,0,Travis Hammonds Offensive Rebound.
Long Beach State,Pepperdine,38,36,22,38,0,Long Beach St  Turnover.
Long Beach State,Pepperdine,38,36,22,54,0,Foul on Travis Hammonds.
Long Beach State,Pepperdine,38,38,23,10,1,Lamond Murray Jr. made Jumper. Assisted by Amadi Udenyi.
Long Beach State,Pepperdine,40,38,23,27,1,Roschon Prince made Layup. Assisted by Noah Blackwell.
Long Beach State,Pepperdine,40,41,23,42,1,Jett Raines made Three Point Jumper. Assisted by Kameron Edwards.
Long Beach State,Pepperdine,40,41,23,59,0,Branford Jones missed Three Point Jumper.
Long Beach State,Pepperdine,40,41,23,59,0,Kameron Edwards Defensive Rebound.
Long Beach State,Pepperdine,40,41,24,5,0,Foul on Kameron Edwards.
Long Beach State,Pepperdine,40,41,24,5,0,Kameron Edwards Turnover.
Long Beach State,Pepperdine,40,41,24,5,0,Official TV Timeout
Long Beach State,Pepperdine,40,41,24,35,0,Foul on Amadi Udenyi.
Long Beach State,Pepperdine,40,41,24,40,0,Foul on Amadi Udenyi.
Long Beach State,Pepperdine,40,41,24,43,0,Roschon Prince missed Layup.
Long Beach State,Pepperdine,40,41,24,43,0,Lamond Murray Jr. Block.
Long Beach State,Pepperdine,40,41,24,43,0,Long Beach St Offensive Rebound.
Long Beach State,Pepperdine,42,41,24,45,1,Justin Bibbins made Jumper. Assisted by Nick Faust.
Long Beach State,Pepperdine,42,44,25,8,1,Stacy Davis made Three Point Jumper. Assisted by Shawn Olden.
Long Beach State,Pepperdine,42,44,25,21,0,Roschon Prince missed Layup.
Long Beach State,Pepperdine,42,44,25,21,0,Lamond Murray Jr. Defensive Rebound.
Long Beach State,Pepperdine,42,44,25,35,0,Foul on Jett Raines.
Long Beach State,Pepperdine,42,44,25,35,0,Jett Raines Turnover.
Long Beach State,Pepperdine,42,44,25,45,0,Justin Bibbins Turnover.
Long Beach State,Pepperdine,42,44,25,46,0,Lamond Murray Jr. Steal.
Long Beach State,Pepperdine,42,46,25,48,1,Lamond Murray Jr. made Dunk.
Long Beach State,Pepperdine,42,46,25,59,0,Foul on Lamond Murray Jr..
Long Beach State,Pepperdine,45,46,26,9,1,Justin Bibbins made Three Point Jumper. Assisted by Gabe Levin.
Long Beach State,Pepperdine,45,46,26,22,0,Amadi Udenyi missed Jumper.
Long Beach State,Pepperdine,45,46,26,22,0,Nick Faust Defensive Rebound.
Long Beach State,Pepperdine,45,46,26,29,0,Nick Faust missed Three Point Jumper.
Long Beach State,Pepperdine,45,46,26,29,0,A.J. Lapray Defensive Rebound.
Long Beach State,Pepperdine,45,48,26,36,1,Amadi Udenyi made Layup. Assisted by A.J. Lapray.
Long Beach State,Pepperdine,47,48,26,59,1,Mason Riggins made Layup. Assisted by Gabe Levin.
Long Beach State,Pepperdine,47,48,27,18,0,Foul on A.J. Lapray.
Long Beach State,Pepperdine,47,48,27,18,0,A.J. Lapray Turnover.
Long Beach State,Pepperdine,47,48,27,27,0,Foul on A.J. Lapray.
Long Beach State,Pepperdine,48,48,27,27,1,Mason Riggins made Free Throw.
Long Beach State,Pepperdine,49,48,27,27,1,Mason Riggins made Free Throw.
Long Beach State,Pepperdine,49,48,27,40,0,A.J. John missed Jumper.
Long Beach State,Pepperdine,49,48,27,40,0,Noah Blackwell Defensive Rebound.
Long Beach State,Pepperdine,49,48,27,49,0,Noah Blackwell Turnover.
Long Beach State,Pepperdine,49,48,27,49,0,Jeremy Major Steal.
Long Beach State,Pepperdine,49,50,27,50,1,Shawn Olden made Jumper. Assisted by Jeremy Major.
Long Beach State,Pepperdine,49,50,28,2,0,Foul on Jeremy Major.
Long Beach State,Pepperdine,49,50,28,2,0,Official TV Timeout
Long Beach State,Pepperdine,50,50,28,2,1,Justin Bibbins made Free Throw.
Long Beach State,Pepperdine,51,50,28,2,1,Justin Bibbins made Free Throw.
Long Beach State,Pepperdine,51,50,28,28,0,Jeremy Major missed Three Point Jumper.
Long Beach State,Pepperdine,51,50,28,28,0,Stacy Davis Offensive Rebound.
Long Beach State,Pepperdine,51,50,28,36,0,Foul on Mason Riggins.
Long Beach State,Pepperdine,51,51,28,36,1,Stacy Davis made Free Throw.
Long Beach State,Pepperdine,51,52,28,36,1,Stacy Davis made Free Throw.
Long Beach State,Pepperdine,51,52,28,55,0,Justin Bibbins missed Three Point Jumper.
Long Beach State,Pepperdine,51,52,28,55,0,Travis Hammonds Offensive Rebound.
Long Beach State,Pepperdine,53,52,29,0,1,A.J. Spencer made Layup. Assisted by Travis Hammonds.
Long Beach State,Pepperdine,53,54,29,21,1,A.J. John made Layup. Assisted by Stacy Davis.
Long Beach State,Pepperdine,53,54,29,39,0,Justin Bibbins missed Jumper.
Long Beach State,Pepperdine,53,54,29,39,0,Stacy Davis Defensive Rebound.
Long Beach State,Pepperdine,53,57,29,49,1,Shawn Olden made Three Point Jumper.
Long Beach State,Pepperdine,53,57,29,58,0,Long Beach St  Timeout
Long Beach State,Pepperdine,53,57,30,8,0,Gabe Levin Turnover.
Long Beach State,Pepperdine,53,57,30,9,0,A.J. Lapray Steal.
Long Beach State,Pepperdine,53,57,30,20,0,Jeremy Major Turnover.
Long Beach State,Pepperdine,53,57,30,21,0,Gabe Levin Steal.
Long Beach State,Pepperdine,55,57,30,23,1,Gabe Levin made Dunk.
Long Beach State,Pepperdine,55,60,30,44,1,A.J. Lapray made Three Point Jumper. Assisted by Jeremy Major.
Long Beach State,Pepperdine,55,60,31,2,0,Nick Faust Turnover.
Long Beach State,Pepperdine,55,62,31,21,1,Stacy Davis made Jumper. Assisted by A.J. Lapray.
Long Beach State,Pepperdine,55,62,31,32,0,Noah Blackwell missed Three Point Jumper.
Long Beach State,Pepperdine,55,62,31,32,0,A.J. John Defensive Rebound.
Long Beach State,Pepperdine,55,62,31,45,0,Foul on Amadi Udenyi.
Long Beach State,Pepperdine,55,62,31,45,0,Amadi Udenyi Turnover.
Long Beach State,Pepperdine,58,62,31,54,1,Travis Hammonds made Three Point Jumper. Assisted by Justin Bibbins.
Long Beach State,Pepperdine,58,62,32,10,0,Foul on Travis Hammonds.
Long Beach State,Pepperdine,58,62,32,10,0,Official TV Timeout
Long Beach State,Pepperdine,58,62,32,10,0,A.J. John missed Free Throw.
Long Beach State,Pepperdine,58,62,32,10,0,Pepperdine Deadball Team Rebound.
Long Beach State,Pepperdine,58,62,32,10,0,A.J. John missed Free Throw.
Long Beach State,Pepperdine,58,62,32,10,0,Travis Hammonds Defensive Rebound.
Long Beach State,Pepperdine,58,62,32,21,0,Foul on Lamond Murray Jr..
Long Beach State,Pepperdine,59,62,32,21,1,Branford Jones made Free Throw.
Long Beach State,Pepperdine,59,62,32,21,0,Branford Jones missed Free Throw.
Long Beach State,Pepperdine,59,62,32,21,0,Stacy Davis Defensive Rebound.
Long Beach State,Pepperdine,59,64,32,41,1,Stacy Davis made Jumper.
Long Beach State,Pepperdine,59,64,33,0,0,Nick Faust missed Jumper.
Long Beach State,Pepperdine,59,64,33,0,0,Travis Hammonds Offensive Rebound.
Long Beach State,Pepperdine,59,64,33,5,0,Justin Bibbins missed Three Point Jumper.
Long Beach State,Pepperdine,59,64,33,5,0,Nick Faust Offensive Rebound.
Long Beach State,Pepperdine,61,64,33,11,1,Nick Faust made Jumper.
Long Beach State,Pepperdine,61,66,33,36,1,Jett Raines made Layup.
Long Beach State,Pepperdine,61,66,34,1,0,Nick Faust missed Jumper.
Long Beach State,Pepperdine,61,66,34,1,0,Roschon Prince Offensive Rebound.
Long Beach State,Pepperdine,61,66,34,3,0,Foul on Amadi Udenyi.
Long Beach State,Pepperdine,62,66,34,3,1,Roschon Prince made Free Throw.
Long Beach State,Pepperdine,63,66,34,3,1,Roschon Prince made Free Throw.
Long Beach State,Pepperdine,63,68,34,32,1,Jett Raines made Jumper.
Long Beach State,Pepperdine,65,68,34,43,1,Gabe Levin made Dunk. Assisted by Travis Hammonds.
Long Beach State,Pepperdine,65,70,35,2,1,Kameron Edwards made Jumper.
Long Beach State,Pepperdine,67,70,35,16,1,Branford Jones made Jumper. Assisted by Travis Hammonds.
Long Beach State,Pepperdine,67,72,35,39,1,Stacy Davis made Layup. Assisted by Shawn Olden.
Long Beach State,Pepperdine,67,72,35,50,0,Gabe Levin Turnover.
Long Beach State,Pepperdine,67,72,35,51,0,Jett Raines Steal.
Long Beach State,Pepperdine,67,72,36,8,0,Shawn Olden missed Three Point Jumper.
Long Beach State,Pepperdine,67,72,36,8,0,Justin Bibbins Defensive Rebound.
Long Beach State,Pepperdine,69,72,36,13,1,Nick Faust made Dunk. Assisted by Justin Bibbins.
Long Beach State,Pepperdine,69,72,36,43,0,Jeremy Major missed Three Point Jumper.
Long Beach State,Pepperdine,69,72,36,43,0,Travis Hammonds Defensive Rebound.
Long Beach State,Pepperdine,71,72,36,53,1,Branford Jones made Layup. Assisted by Justin Bibbins.
Long Beach State,Pepperdine,71,72,36,59,0,Pepperdine  Timeout
Long Beach State,Pepperdine,71,72,37,18,0,Foul on Gabe Levin.
Long Beach State,Pepperdine,71,72,37,38,0,Stacy Davis missed Jumper.
Long Beach State,Pepperdine,71,72,37,38,0,Jett Raines Offensive Rebound.
Long Beach State,Pepperdine,71,72,37,38,0,Foul on Nick Faust.
Long Beach State,Pepperdine,71,72,37,48,0,Shawn Olden missed Jumper.
Long Beach State,Pepperdine,71,72,37,48,0,Jett Raines Offensive Rebound.
Long Beach State,Pepperdine,71,72,38,0,0,Stacy Davis missed Jumper.
Long Beach State,Pepperdine,71,72,38,0,0,Jett Raines Offensive Rebound.
Long Beach State,Pepperdine,71,74,38,3,1,Jett Raines made Two Point Tip Shot.
Long Beach State,Pepperdine,71,74,38,21,0,Nick Faust Turnover.
Long Beach State,Pepperdine,71,74,38,32,0,Amadi Udenyi Turnover.
Long Beach State,Pepperdine,71,74,38,33,0,Branford Jones Steal.
Long Beach State,Pepperdine,71,74,38,34,0,Branford Jones missed Layup.
Long Beach State,Pepperdine,71,74,38,34,0,Shawn Olden Block.
Long Beach State,Pepperdine,71,74,38,35,0,Gabe Levin Offensive Rebound.
Long Beach State,Pepperdine,71,74,38,36,0,Foul on Gabe Levin.
Long Beach State,Pepperdine,71,74,38,36,0,Gabe Levin Turnover.
Long Beach State,Pepperdine,71,74,39,1,0,Foul on Justin Bibbins.
Long Beach State,Pepperdine,71,74,39,1,0,Jeremy Major missed Free Throw.
Long Beach State,Pepperdine,71,74,39,1,0,Stacy Davis Offensive Rebound.
Long Beach State,Pepperdine,71,74,39,15,0,Foul on Branford Jones.
Long Beach State,Pepperdine,71,75,39,15,1,Stacy Davis made Free Throw.
Long Beach State,Pepperdine,71,75,39,15,0,Stacy Davis missed Free Throw.
Long Beach State,Pepperdine,71,75,39,15,0,Travis Hammonds Defensive Rebound.
Long Beach State,Pepperdine,73,75,39,30,1,Nick Faust made Layup.
Long Beach State,Pepperdine,73,75,39,30,0,Long Beach St  Timeout
Long Beach State,Pepperdine,73,75,39,39,0,Lamond Murray Jr. Turnover.
Long Beach State,Pepperdine,73,75,39,40,0,A.J. Spencer Steal.
Long Beach State,Pepperdine,75,75,39,41,1,Nick Faust made Dunk.
Long Beach State,Pepperdine,75,75,39,55,0,Jeremy Major missed Jumper.
Long Beach State,Pepperdine,75,75,39,55,0,Jett Raines Offensive Rebound.
Long Beach State,Pepperdine,75,77,39,57,1,Jett Raines made Two Point Tip Shot.
Long Beach State,Pepperdine,75,77,40,0,0,Justin Bibbins missed Three Point Jumper.
Long Beach State,Pepperdine,75,77,40,0,0,Pepperdine Deadball Team Rebound.
Long Beach State,Pepperdine,75,77,40,0,0,End of Game
