Away Team,Home Team,Away Score, Home Score,Minute,Second,isScoringPosession,Desc.
SE Oklahoma State,UT San Antonio,0,0,0,14,0,Giovanni De Nicolao missed Layup.
SE Oklahoma State,UT San Antonio,0,0,0,14,0,Southeastern OK State Deadball Team Rebound.
SE Oklahoma State,UT San Antonio,3,0,0,38,1,Jett Jobe made Three Point Jumper. Assisted by Gianpalo Riccio.
SE Oklahoma State,UT San Antonio,3,0,1,1,0,Foul on Jose Libiano.
SE Oklahoma State,UT San Antonio,3,0,1,6,0,Giovanni De Nicolao Turnover.
SE Oklahoma State,UT San Antonio,3,0,1,7,0,Jett Jobe Steal.
SE Oklahoma State,UT San Antonio,5,0,1,8,1,Gianpalo Riccio made Layup. Assisted by Jett Jobe.
SE Oklahoma State,UT San Antonio,5,3,1,35,1,Jeff Beverly made Three Point Jumper. Assisted by Giovanni De Nicolao.
SE Oklahoma State,UT San Antonio,5,3,1,58,0,Marti Fonolla missed Three Point Jumper.
SE Oklahoma State,UT San Antonio,5,3,1,58,0,Nick Allen Defensive Rebound.
SE Oklahoma State,UT San Antonio,5,5,2,8,1,Jeff Beverly made Layup. Assisted by Byron Frohnen.
SE Oklahoma State,UT San Antonio,7,5,2,26,1,Jose Libiano made Jumper.
SE Oklahoma State,UT San Antonio,7,5,2,34,0,Foul on Gianpalo Riccio.
SE Oklahoma State,UT San Antonio,7,5,2,46,0,Nick Allen missed Jumper.
SE Oklahoma State,UT San Antonio,7,5,2,46,0,Kevin Buckingham Defensive Rebound.
SE Oklahoma State,UT San Antonio,9,5,2,55,1,Jose Libiano made Layup. Assisted by Kevin Buckingham.
SE Oklahoma State,UT San Antonio,9,5,3,7,0,Nick Allen missed Three Point Jumper.
SE Oklahoma State,UT San Antonio,9,5,3,7,0,Kevin Buckingham Defensive Rebound.
SE Oklahoma State,UT San Antonio,9,5,3,34,0,Gianpalo Riccio missed Three Point Jumper.
SE Oklahoma State,UT San Antonio,9,5,3,34,0,Jeff Beverly Defensive Rebound.
SE Oklahoma State,UT San Antonio,9,5,3,47,0,Jeff Beverly Turnover.
SE Oklahoma State,UT San Antonio,9,5,4,1,0,Jett Jobe Turnover.
SE Oklahoma State,UT San Antonio,9,5,4,8,0,Foul on Jett Jobe.
SE Oklahoma State,UT San Antonio,9,5,4,8,0,Official TV Timeout
SE Oklahoma State,UT San Antonio,9,6,4,8,1,Nick Billingsley made Free Throw.
SE Oklahoma State,UT San Antonio,9,7,4,8,1,Nick Billingsley made Free Throw.
SE Oklahoma State,UT San Antonio,9,7,4,19,0,Jose Libiano Turnover.
SE Oklahoma State,UT San Antonio,9,7,4,29,0,Foul on Giovanni De Nicolao.
SE Oklahoma State,UT San Antonio,9,7,4,29,0,Giovanni De Nicolao Turnover.
SE Oklahoma State,UT San Antonio,9,7,4,40,0,Jose Libiano missed Layup.
SE Oklahoma State,UT San Antonio,9,7,4,40,0,Jeff Beverly Defensive Rebound.
SE Oklahoma State,UT San Antonio,9,7,4,46,0,Nick Billingsley Turnover.
SE Oklahoma State,UT San Antonio,9,7,4,58,0,Kevin Buckingham missed Layup.
SE Oklahoma State,UT San Antonio,9,7,4,58,0,Jeff Beverly Defensive Rebound.
SE Oklahoma State,UT San Antonio,9,10,5,14,1,Jeff Beverly made Three Point Jumper. Assisted by Gino Littles.
SE Oklahoma State,UT San Antonio,12,10,5,34,1,Kevin Buckingham made Three Point Jumper.
SE Oklahoma State,UT San Antonio,12,13,5,54,1,Nick Billingsley made Three Point Jumper.
SE Oklahoma State,UT San Antonio,12,13,6,17,0,Nathan Jackson Turnover.
SE Oklahoma State,UT San Antonio,12,13,6,18,0,Austin Karrer Steal.
SE Oklahoma State,UT San Antonio,12,16,6,26,1,Nick Billingsley made Three Point Jumper. Assisted by Jeff Beverly.
SE Oklahoma State,UT San Antonio,12,16,6,40,0,Nathan Jackson missed Jumper.
SE Oklahoma State,UT San Antonio,12,16,6,40,0,Austin Karrer Defensive Rebound.
SE Oklahoma State,UT San Antonio,12,16,6,48,0,Jeff Beverly missed Three Point Jumper.
SE Oklahoma State,UT San Antonio,12,16,6,48,0,Tyler Lonzie Defensive Rebound.
SE Oklahoma State,UT San Antonio,12,16,6,57,0,Foul on Austin Karrer.
SE Oklahoma State,UT San Antonio,13,16,6,57,1,Nathan Jackson made Free Throw.
SE Oklahoma State,UT San Antonio,13,16,6,57,0,Nathan Jackson missed Free Throw.
SE Oklahoma State,UT San Antonio,13,16,6,57,0,Austin Karrer Defensive Rebound.
SE Oklahoma State,UT San Antonio,13,16,7,14,0,Jeff Beverly missed Layup.
SE Oklahoma State,UT San Antonio,13,16,7,14,0,Nathan Jackson Defensive Rebound.
SE Oklahoma State,UT San Antonio,13,16,7,22,0,Foul on Nathan Jackson.
SE Oklahoma State,UT San Antonio,13,16,7,22,0,Nathan Jackson Turnover.
SE Oklahoma State,UT San Antonio,13,18,7,30,1,Nick Billingsley made Jumper.
SE Oklahoma State,UT San Antonio,13,18,7,44,0,Foul on Gino Littles.
SE Oklahoma State,UT San Antonio,13,18,7,49,0,Gianpalo Riccio missed Three Point Jumper.
SE Oklahoma State,UT San Antonio,13,18,7,49,0,Nathan Jackson Offensive Rebound.
SE Oklahoma State,UT San Antonio,13,18,8,4,0,Kevin Buckingham missed Jumper.
SE Oklahoma State,UT San Antonio,13,18,8,4,0,Austin Karrer Defensive Rebound.
SE Oklahoma State,UT San Antonio,13,18,8,8,0,UT San Antonio  Timeout
SE Oklahoma State,UT San Antonio,13,18,8,8,0,Official TV Timeout
SE Oklahoma State,UT San Antonio,13,18,8,19,0,Nick Billingsley missed Three Point Jumper.
SE Oklahoma State,UT San Antonio,13,18,8,19,0,Gianpalo Riccio Defensive Rebound.
SE Oklahoma State,UT San Antonio,13,18,8,22,0,Foul on Austin Karrer.
SE Oklahoma State,UT San Antonio,13,18,8,37,0,Jose Libiano Turnover.
SE Oklahoma State,UT San Antonio,13,18,8,37,0,George Willborn III Steal.
SE Oklahoma State,UT San Antonio,13,20,8,41,1,Nick Billingsley made Layup. Assisted by George Willborn III.
SE Oklahoma State,UT San Antonio,13,20,9,8,0,Jett Jobe missed Three Point Jumper.
SE Oklahoma State,UT San Antonio,13,20,9,8,0,Nick Billingsley Defensive Rebound.
SE Oklahoma State,UT San Antonio,13,20,9,30,0,Mitar Stanojevic Turnover.
SE Oklahoma State,UT San Antonio,13,20,9,38,0,Foul on Tyler Lonzie.
SE Oklahoma State,UT San Antonio,13,20,9,38,0,Tyler Lonzie Turnover.
SE Oklahoma State,UT San Antonio,13,20,9,58,0,George Willborn III missed Jumper.
SE Oklahoma State,UT San Antonio,13,20,9,58,0,Bobby Johnson Defensive Rebound.
SE Oklahoma State,UT San Antonio,16,20,10,7,1,Dino Muminovic made Three Point Jumper. Assisted by Gianpalo Riccio.
SE Oklahoma State,UT San Antonio,16,22,10,33,1,George Willborn III made Jumper. Assisted by Byron Frohnen.
SE Oklahoma State,UT San Antonio,16,22,10,51,0,Dino Muminovic missed Three Point Jumper.
SE Oklahoma State,UT San Antonio,16,22,10,51,0,Giovanni De Nicolao Defensive Rebound.
SE Oklahoma State,UT San Antonio,16,22,10,58,0,George Willborn III missed Three Point Jumper.
SE Oklahoma State,UT San Antonio,16,22,10,58,0,Tyler Lonzie Defensive Rebound.
SE Oklahoma State,UT San Antonio,16,22,11,9,0,Foul on George Willborn III.
SE Oklahoma State,UT San Antonio,17,22,11,9,1,Jett Jobe made Free Throw.
SE Oklahoma State,UT San Antonio,18,22,11,9,1,Jett Jobe made Free Throw.
SE Oklahoma State,UT San Antonio,18,22,11,9,0,Foul on Marti Fonolla.
SE Oklahoma State,UT San Antonio,18,22,11,21,0,Foul on Nick Allen.
SE Oklahoma State,UT San Antonio,18,22,11,21,0,Nick Allen Turnover.
SE Oklahoma State,UT San Antonio,18,22,11,32,0,Foul on Giovanni De Nicolao.
SE Oklahoma State,UT San Antonio,19,22,11,32,1,Tyler Lonzie made Free Throw.
SE Oklahoma State,UT San Antonio,20,22,11,32,1,Tyler Lonzie made Free Throw.
SE Oklahoma State,UT San Antonio,20,24,11,47,1,Nick Allen made Layup.
SE Oklahoma State,UT San Antonio,23,24,12,4,1,Marti Fonolla made Three Point Jumper. Assisted by Jose Libiano.
SE Oklahoma State,UT San Antonio,23,24,12,23,0,Nick Allen missed Layup.
SE Oklahoma State,UT San Antonio,23,24,12,23,0,Byron Frohnen Offensive Rebound.
SE Oklahoma State,UT San Antonio,23,27,12,35,1,Gino Littles made Three Point Jumper.
SE Oklahoma State,UT San Antonio,23,27,12,54,0,Bobby Johnson Turnover.
SE Oklahoma State,UT San Antonio,23,27,12,56,0,Jeff Beverly Steal.
SE Oklahoma State,UT San Antonio,23,29,12,57,1,Jeff Beverly made Dunk. Assisted by Nick Allen.
SE Oklahoma State,UT San Antonio,25,29,13,16,1,Jose Libiano made Jumper.
SE Oklahoma State,UT San Antonio,25,29,13,39,0,Jeff Beverly missed Jumper.
SE Oklahoma State,UT San Antonio,25,29,13,39,0,George Willborn III Offensive Rebound.
SE Oklahoma State,UT San Antonio,25,31,13,42,1,George Willborn III made Two Point Tip Shot.
SE Oklahoma State,UT San Antonio,25,31,14,12,0,Bobby Johnson missed Three Point Jumper.
SE Oklahoma State,UT San Antonio,25,31,14,12,0,Gino Littles Defensive Rebound.
SE Oklahoma State,UT San Antonio,25,33,14,20,1,Jeff Beverly made Jumper. Assisted by Gino Littles.
SE Oklahoma State,UT San Antonio,25,33,14,22,0,Southeastern OK State  Timeout
SE Oklahoma State,UT San Antonio,25,33,14,22,0,Official TV Timeout
SE Oklahoma State,UT San Antonio,25,33,14,41,0,Foul on Jeff Beverly.
SE Oklahoma State,UT San Antonio,25,33,14,41,0,Jose Libiano missed Free Throw.
SE Oklahoma State,UT San Antonio,25,33,14,41,0,Mitar Stanojevic Defensive Rebound.
SE Oklahoma State,UT San Antonio,25,33,14,56,0,Nick Billingsley missed Three Point Jumper.
SE Oklahoma State,UT San Antonio,25,33,14,56,0,Jeff Beverly Offensive Rebound.
SE Oklahoma State,UT San Antonio,25,33,15,1,0,Jeff Beverly Turnover.
SE Oklahoma State,UT San Antonio,25,33,15,1,0,Marti Fonolla Steal.
SE Oklahoma State,UT San Antonio,25,33,15,8,0,Gianpalo Riccio Turnover.
SE Oklahoma State,UT San Antonio,25,33,15,8,0,Nick Billingsley Steal.
SE Oklahoma State,UT San Antonio,25,35,15,27,1,Byron Frohnen made Jumper.
SE Oklahoma State,UT San Antonio,25,35,15,49,0,Kevin Buckingham missed Layup.
SE Oklahoma State,UT San Antonio,25,35,15,49,0,Kevin Buckingham Offensive Rebound.
SE Oklahoma State,UT San Antonio,25,35,15,52,0,Foul on Nick Billingsley.
SE Oklahoma State,UT San Antonio,25,35,15,52,0,Kevin Buckingham missed Free Throw.
SE Oklahoma State,UT San Antonio,25,35,15,52,0,Jeff Beverly Defensive Rebound.
SE Oklahoma State,UT San Antonio,25,35,16,9,0,Official TV Timeout
SE Oklahoma State,UT San Antonio,25,35,16,14,0,Gino Littles missed Three Point Jumper.
SE Oklahoma State,UT San Antonio,25,35,16,14,0,Jose Libiano Defensive Rebound.
SE Oklahoma State,UT San Antonio,25,35,16,46,0,Jett Jobe Turnover.
SE Oklahoma State,UT San Antonio,25,35,16,46,0,Gino Littles Steal.
SE Oklahoma State,UT San Antonio,25,38,17,0,1,Gino Littles made Three Point Jumper. Assisted by Jeff Beverly.
SE Oklahoma State,UT San Antonio,25,38,17,22,0,Foul on Byron Frohnen.
SE Oklahoma State,UT San Antonio,26,38,17,22,1,Marti Fonolla made Free Throw.
SE Oklahoma State,UT San Antonio,27,38,17,22,1,Marti Fonolla made Free Throw.
SE Oklahoma State,UT San Antonio,27,40,17,52,1,Jeff Beverly made Layup.
SE Oklahoma State,UT San Antonio,27,40,18,14,0,Jett Jobe missed Three Point Jumper.
SE Oklahoma State,UT San Antonio,27,40,18,14,0,Gino Littles Defensive Rebound.
SE Oklahoma State,UT San Antonio,27,40,18,19,0,Nick Billingsley missed Three Point Jumper.
SE Oklahoma State,UT San Antonio,27,40,18,19,0,Jett Jobe Defensive Rebound.
SE Oklahoma State,UT San Antonio,27,40,18,28,0,Kyle Roberts Turnover.
SE Oklahoma State,UT San Antonio,27,40,18,32,0,Nick Billingsley Turnover.
SE Oklahoma State,UT San Antonio,27,40,18,33,0,Kyle Roberts Steal.
SE Oklahoma State,UT San Antonio,27,40,18,37,0,Marti Fonolla Turnover.
SE Oklahoma State,UT San Antonio,27,40,18,38,0,Byron Frohnen Steal.
SE Oklahoma State,UT San Antonio,27,40,18,41,0,Nick Allen missed Jumper.
SE Oklahoma State,UT San Antonio,27,40,18,41,0,Kevin Buckingham Defensive Rebound.
SE Oklahoma State,UT San Antonio,27,40,18,51,0,Foul on Gino Littles.
SE Oklahoma State,UT San Antonio,28,40,18,51,1,Jett Jobe made Free Throw.
SE Oklahoma State,UT San Antonio,29,40,18,51,1,Jett Jobe made Free Throw.
SE Oklahoma State,UT San Antonio,29,42,19,18,1,Byron Frohnen made Jumper.
SE Oklahoma State,UT San Antonio,31,42,19,46,1,Jett Jobe made Layup.
SE Oklahoma State,UT San Antonio,31,42,19,53,0,George Willborn III Turnover.
SE Oklahoma State,UT San Antonio,31,42,19,54,0,Kevin Buckingham Steal.
SE Oklahoma State,UT San Antonio,34,42,19,56,1,Kevin Buckingham made Three Point Jumper.
SE Oklahoma State,UT San Antonio,34,42,20,0,0,End of 1st half
SE Oklahoma State,UT San Antonio,34,42,20,12,0,Marti Fonolla Turnover.
SE Oklahoma State,UT San Antonio,34,42,20,13,0,Gino Littles Steal.
SE Oklahoma State,UT San Antonio,34,44,20,34,1,Jeff Beverly made Jumper. Assisted by Byron Frohnen.
SE Oklahoma State,UT San Antonio,36,44,20,57,1,Jose Libiano made Jumper.
SE Oklahoma State,UT San Antonio,36,47,21,20,1,Gino Littles made Three Point Jumper. Assisted by Giovanni De Nicolao.
SE Oklahoma State,UT San Antonio,39,47,21,35,1,Gianpalo Riccio made Three Point Jumper. Assisted by Jose Libiano.
SE Oklahoma State,UT San Antonio,39,47,22,8,0,Foul on Gianpalo Riccio.
SE Oklahoma State,UT San Antonio,39,47,22,12,0,Gino Littles missed Three Point Jumper.
SE Oklahoma State,UT San Antonio,39,47,22,12,0,Kevin Buckingham Defensive Rebound.
SE Oklahoma State,UT San Antonio,42,47,22,21,1,Gianpalo Riccio made Three Point Jumper. Assisted by Kevin Buckingham.
SE Oklahoma State,UT San Antonio,42,47,22,53,0,Jeff Beverly missed Jumper.
SE Oklahoma State,UT San Antonio,42,47,22,53,0,Kevin Buckingham Defensive Rebound.
SE Oklahoma State,UT San Antonio,42,47,23,6,0,Foul on Jeff Beverly.
SE Oklahoma State,UT San Antonio,42,47,23,15,0,Marti Fonolla missed Jumper.
SE Oklahoma State,UT San Antonio,42,47,23,15,0,Jose Libiano Offensive Rebound.
SE Oklahoma State,UT San Antonio,45,47,23,23,1,Gianpalo Riccio made Three Point Jumper. Assisted by Kevin Buckingham.
SE Oklahoma State,UT San Antonio,45,47,23,49,0,Foul on Jett Jobe.
SE Oklahoma State,UT San Antonio,45,49,24,6,1,Jeff Beverly made Layup. Assisted by Giovanni De Nicolao.
SE Oklahoma State,UT San Antonio,45,49,24,6,0,Foul on Marti Fonolla.
SE Oklahoma State,UT San Antonio,45,49,24,6,0,Official TV Timeout
SE Oklahoma State,UT San Antonio,45,50,24,6,1,Jeff Beverly made Free Throw.
SE Oklahoma State,UT San Antonio,45,50,24,23,0,Nathan Jackson Turnover.
SE Oklahoma State,UT San Antonio,45,50,24,27,0,Giovanni De Nicolao Steal.
SE Oklahoma State,UT San Antonio,45,50,24,27,0,Nick Allen Turnover.
SE Oklahoma State,UT San Antonio,45,50,24,41,0,Foul on Giovanni De Nicolao.
SE Oklahoma State,UT San Antonio,45,50,24,45,0,Gianpalo Riccio Turnover.
SE Oklahoma State,UT San Antonio,45,53,25,6,1,Nick Billingsley made Three Point Jumper. Assisted by Jeff Beverly.
SE Oklahoma State,UT San Antonio,45,53,25,35,0,Nathan Jackson missed Layup.
SE Oklahoma State,UT San Antonio,45,53,25,35,0,Jeff Beverly Defensive Rebound.
SE Oklahoma State,UT San Antonio,45,56,25,46,1,Nick Billingsley made Three Point Jumper. Assisted by Gino Littles.
SE Oklahoma State,UT San Antonio,45,56,26,6,0,Kevin Buckingham Turnover.
SE Oklahoma State,UT San Antonio,45,56,26,6,0,Gino Littles Steal.
SE Oklahoma State,UT San Antonio,45,58,26,10,1,Nick Billingsley made Layup. Assisted by Gino Littles.
SE Oklahoma State,UT San Antonio,45,58,26,13,0,Southeastern OK State  Timeout
SE Oklahoma State,UT San Antonio,45,58,26,21,0,Foul on Jeff Beverly.
SE Oklahoma State,UT San Antonio,45,58,26,21,0,Southeastern OK State  Turnover.
SE Oklahoma State,UT San Antonio,45,58,26,33,0,Austin Karrer missed Jumper.
SE Oklahoma State,UT San Antonio,45,58,26,33,0,Lucas O'Brien Offensive Rebound.
SE Oklahoma State,UT San Antonio,45,58,26,54,0,Foul on Kevin Buckingham.
SE Oklahoma State,UT San Antonio,45,58,26,54,0,Lucas O'Brien missed Free Throw.
SE Oklahoma State,UT San Antonio,45,58,26,54,0,UT San Antonio Deadball Team Rebound.
SE Oklahoma State,UT San Antonio,45,58,26,54,0,Lucas O'Brien missed Free Throw.
SE Oklahoma State,UT San Antonio,45,58,26,54,0,Kevin Buckingham Defensive Rebound.
SE Oklahoma State,UT San Antonio,45,58,27,14,0,Tyler Lonzie missed Layup.
SE Oklahoma State,UT San Antonio,45,58,27,14,0,Nick Billingsley Defensive Rebound.
SE Oklahoma State,UT San Antonio,45,58,27,34,0,Nick Billingsley missed Three Point Jumper.
SE Oklahoma State,UT San Antonio,45,58,27,34,0,Tyler Lonzie Defensive Rebound.
SE Oklahoma State,UT San Antonio,47,58,27,43,1,Gianpalo Riccio made Layup.
SE Oklahoma State,UT San Antonio,47,58,27,52,0,Foul on Jett Jobe.
SE Oklahoma State,UT San Antonio,47,60,28,4,1,Lucas O'Brien made Jumper. Assisted by George Willborn III.
SE Oklahoma State,UT San Antonio,49,60,28,21,1,Bobby Johnson made Jumper.
SE Oklahoma State,UT San Antonio,49,62,28,45,1,Gino Littles made Jumper.
SE Oklahoma State,UT San Antonio,49,62,28,58,0,Foul on Mitar Stanojevic.
SE Oklahoma State,UT San Antonio,49,62,28,58,0,Official TV Timeout
SE Oklahoma State,UT San Antonio,49,62,29,7,0,Dino Muminovic missed Layup.
SE Oklahoma State,UT San Antonio,49,62,29,7,0,Nick Billingsley Block.
SE Oklahoma State,UT San Antonio,49,62,29,8,0,Nick Billingsley Defensive Rebound.
SE Oklahoma State,UT San Antonio,49,62,29,25,0,George Willborn III missed Jumper.
SE Oklahoma State,UT San Antonio,49,62,29,25,0,Gino Littles Offensive Rebound.
SE Oklahoma State,UT San Antonio,49,62,29,55,0,Foul on James Donelan.
SE Oklahoma State,UT San Antonio,49,63,29,55,1,Lucas O'Brien made Free Throw.
SE Oklahoma State,UT San Antonio,49,64,29,55,1,Lucas O'Brien made Free Throw.
SE Oklahoma State,UT San Antonio,49,64,30,9,0,Bobby Johnson missed Layup.
SE Oklahoma State,UT San Antonio,49,64,30,9,0,Mitar Stanojevic Defensive Rebound.
SE Oklahoma State,UT San Antonio,49,67,30,21,1,Lucas O'Brien made Three Point Jumper. Assisted by Byron Frohnen.
SE Oklahoma State,UT San Antonio,49,67,30,42,0,Foul on Mitar Stanojevic.
SE Oklahoma State,UT San Antonio,49,67,30,42,0,Dino Muminovic missed Free Throw.
SE Oklahoma State,UT San Antonio,49,67,30,42,0,Southeastern OK State Deadball Team Rebound.
SE Oklahoma State,UT San Antonio,50,67,30,42,1,Dino Muminovic made Free Throw.
SE Oklahoma State,UT San Antonio,51,67,30,42,1,Dino Muminovic made Free Throw.
SE Oklahoma State,UT San Antonio,51,67,30,55,0,George Willborn III Turnover.
SE Oklahoma State,UT San Antonio,51,67,30,56,0,Jett Jobe Steal.
SE Oklahoma State,UT San Antonio,54,67,31,1,1,Bobby Johnson made Three Point Jumper. Assisted by Kevin Buckingham.
SE Oklahoma State,UT San Antonio,54,70,31,25,1,Lucas O'Brien made Three Point Jumper. Assisted by George Willborn III.
SE Oklahoma State,UT San Antonio,54,70,31,52,0,Foul on Giovanni De Nicolao.
SE Oklahoma State,UT San Antonio,54,70,31,53,0,Bobby Johnson missed Jumper.
SE Oklahoma State,UT San Antonio,54,70,31,53,0,Dino Muminovic Offensive Rebound.
SE Oklahoma State,UT San Antonio,54,70,32,1,0,Dino Muminovic Turnover.
SE Oklahoma State,UT San Antonio,54,70,32,3,0,Nick Billingsley Steal.
SE Oklahoma State,UT San Antonio,54,70,32,15,0,Nick Billingsley missed Three Point Jumper.
SE Oklahoma State,UT San Antonio,54,70,32,15,0,Lucas O'Brien Offensive Rebound.
SE Oklahoma State,UT San Antonio,54,72,32,19,1,Lucas O'Brien made Two Point Tip Shot.
SE Oklahoma State,UT San Antonio,54,72,32,30,0,Bobby Johnson Turnover.
SE Oklahoma State,UT San Antonio,54,72,32,31,0,Nick Billingsley Steal.
SE Oklahoma State,UT San Antonio,54,74,32,33,1,Nick Billingsley made Dunk.
SE Oklahoma State,UT San Antonio,54,74,32,53,0,Bobby Johnson missed Jumper.
SE Oklahoma State,UT San Antonio,54,74,32,53,0,UT San Antonio Defensive Rebound.
SE Oklahoma State,UT San Antonio,54,74,32,54,0,Official TV Timeout
SE Oklahoma State,UT San Antonio,54,74,33,14,0,Foul on Jett Jobe.
SE Oklahoma State,UT San Antonio,54,74,33,14,0,Nick Billingsley missed Free Throw.
SE Oklahoma State,UT San Antonio,54,74,33,14,0,UT San Antonio Deadball Team Rebound.
SE Oklahoma State,UT San Antonio,54,75,33,14,1,Nick Billingsley made Free Throw.
SE Oklahoma State,UT San Antonio,54,75,33,28,0,Foul on Nick Billingsley.
SE Oklahoma State,UT San Antonio,54,75,33,28,0,Tyler Lonzie missed Free Throw.
SE Oklahoma State,UT San Antonio,54,75,33,28,0,Jeff Beverly Defensive Rebound.
SE Oklahoma State,UT San Antonio,54,78,33,45,1,Nick Billingsley made Three Point Jumper. Assisted by Austin Karrer.
SE Oklahoma State,UT San Antonio,54,78,34,8,0,Marti Fonolla missed Three Point Jumper.
SE Oklahoma State,UT San Antonio,54,78,34,8,0,Austin Karrer Defensive Rebound.
SE Oklahoma State,UT San Antonio,54,78,34,31,0,Austin Karrer missed Layup.
SE Oklahoma State,UT San Antonio,54,78,34,31,0,Tyler Lonzie Block.
SE Oklahoma State,UT San Antonio,54,78,34,33,0,Kevin Buckingham Defensive Rebound.
SE Oklahoma State,UT San Antonio,54,78,34,41,0,Gianpalo Riccio Turnover.
SE Oklahoma State,UT San Antonio,54,78,34,42,0,Gino Littles Steal.
SE Oklahoma State,UT San Antonio,54,78,34,46,0,Nick Billingsley missed Three Point Jumper.
SE Oklahoma State,UT San Antonio,54,78,34,46,0,Nick Allen Offensive Rebound.
SE Oklahoma State,UT San Antonio,54,78,34,50,0,Foul on Gianpalo Riccio.
SE Oklahoma State,UT San Antonio,54,79,34,50,1,Nick Allen made Free Throw.
SE Oklahoma State,UT San Antonio,54,79,34,50,0,UT San Antonio  Timeout
SE Oklahoma State,UT San Antonio,54,80,34,50,1,Nick Allen made Free Throw.
SE Oklahoma State,UT San Antonio,56,80,35,5,1,Tyler Lonzie made Layup. Assisted by Gianpalo Riccio.
SE Oklahoma State,UT San Antonio,56,80,35,23,0,Nick Billingsley missed Jumper.
SE Oklahoma State,UT San Antonio,56,80,35,23,0,Nick Allen Offensive Rebound.
SE Oklahoma State,UT San Antonio,56,80,35,28,0,Nick Allen missed Jumper.
SE Oklahoma State,UT San Antonio,56,80,35,28,0,Tyler Lonzie Defensive Rebound.
SE Oklahoma State,UT San Antonio,59,80,35,47,1,Jett Jobe made Three Point Jumper. Assisted by Kevin Buckingham.
SE Oklahoma State,UT San Antonio,59,80,36,13,0,Nick Allen missed Jumper.
SE Oklahoma State,UT San Antonio,59,80,36,13,0,Nick Allen Offensive Rebound.
SE Oklahoma State,UT San Antonio,59,80,36,19,0,Nick Allen missed Layup.
SE Oklahoma State,UT San Antonio,59,80,36,19,0,Gianpalo Riccio Block.
SE Oklahoma State,UT San Antonio,59,80,36,20,0,Gianpalo Riccio Defensive Rebound.
SE Oklahoma State,UT San Antonio,59,80,36,29,0,Jett Jobe missed Three Point Jumper.
SE Oklahoma State,UT San Antonio,59,80,36,29,0,Jeff Beverly Defensive Rebound.
SE Oklahoma State,UT San Antonio,59,82,36,40,1,Austin Karrer made Layup.
SE Oklahoma State,UT San Antonio,61,82,36,47,1,Marti Fonolla made Jumper. Assisted by Jett Jobe.
SE Oklahoma State,UT San Antonio,61,82,36,53,0,Southeastern OK State  Timeout
SE Oklahoma State,UT San Antonio,61,82,36,53,0,Official TV Timeout
SE Oklahoma State,UT San Antonio,61,82,37,6,0,Foul on Kevin Buckingham.
SE Oklahoma State,UT San Antonio,61,82,37,6,0,Mitar Stanojevic missed Free Throw.
SE Oklahoma State,UT San Antonio,61,82,37,6,0,UT San Antonio Deadball Team Rebound.
SE Oklahoma State,UT San Antonio,61,83,37,6,1,Mitar Stanojevic made Free Throw.
SE Oklahoma State,UT San Antonio,61,83,37,22,0,Kevin Buckingham missed Three Point Jumper.
SE Oklahoma State,UT San Antonio,61,83,37,22,0,Mitar Stanojevic Defensive Rebound.
SE Oklahoma State,UT San Antonio,61,83,37,42,0,Gino Littles missed Layup.
SE Oklahoma State,UT San Antonio,61,83,37,42,0,Jett Jobe Block.
SE Oklahoma State,UT San Antonio,61,83,37,44,0,Gianpalo Riccio Defensive Rebound.
SE Oklahoma State,UT San Antonio,63,83,37,48,1,Kevin Buckingham made Jumper.
SE Oklahoma State,UT San Antonio,63,83,37,48,0,Foul on Nick Billingsley.
SE Oklahoma State,UT San Antonio,64,83,37,48,1,Kevin Buckingham made Free Throw.
SE Oklahoma State,UT San Antonio,64,83,38,8,0,Foul on Tyler Lonzie.
SE Oklahoma State,UT San Antonio,64,83,38,8,0,Nick Billingsley missed Free Throw.
SE Oklahoma State,UT San Antonio,64,83,38,8,0,UT San Antonio Deadball Team Rebound.
SE Oklahoma State,UT San Antonio,64,83,38,8,0,Nick Billingsley missed Free Throw.
SE Oklahoma State,UT San Antonio,64,83,38,8,0,Gianpalo Riccio Defensive Rebound.
SE Oklahoma State,UT San Antonio,64,83,38,23,0,Gianpalo Riccio missed Layup.
SE Oklahoma State,UT San Antonio,64,83,38,23,0,James Ringholt Defensive Rebound.
SE Oklahoma State,UT San Antonio,64,86,38,38,1,Nick Billingsley made Three Point Jumper.
SE Oklahoma State,UT San Antonio,64,86,38,52,0,Foul on Bola Alade.
SE Oklahoma State,UT San Antonio,64,86,38,52,0,Tyler Lonzie missed Free Throw.
SE Oklahoma State,UT San Antonio,64,86,38,52,0,Southeastern OK State Deadball Team Rebound.
SE Oklahoma State,UT San Antonio,64,86,38,52,0,Tyler Lonzie missed Free Throw.
SE Oklahoma State,UT San Antonio,64,86,38,52,0,Southeastern OK State Offensive Rebound.
SE Oklahoma State,UT San Antonio,66,86,39,4,1,Jose Libiano made Jumper.
SE Oklahoma State,UT San Antonio,66,88,39,16,1,Mitar Stanojevic made Layup. Assisted by Kyle Massie.
SE Oklahoma State,UT San Antonio,69,88,39,35,1,Gianpalo Riccio made Three Point Jumper. Assisted by Jett Jobe.
SE Oklahoma State,UT San Antonio,69,88,40,0,0,End of Game
