Charleston Southern,Florida State,61,80,37,4,0,Ugo Mmonu missed Three Point Jumper.
Charleston Southern,Florida State,61,80,37,4,0,Terance Mann Defensive Rebound.
Charleston Southern,Florida State,61,80,37,37,0,Christ Koumadje missed Jumper.
Charleston Southern,Florida State,61,80,37,37,0,Ugo Mmonu Defensive Rebound.
Charleston Southern,Florida State,61,80,37,48,0,Raemond Robinson missed Three Point Jumper.
Charleston Southern,Florida State,61,80,37,48,0,Christian Keeling Offensive Rebound.
Charleston Southern,Florida State,63,80,37,48,1,Christian Keeling made Layup.
Charleston Southern,Florida State,63,80,37,48,0,Foul on Terance Mann.
Charleston Southern,Florida State,64,80,37,48,1,Christian Keeling made Free Throw.
Charleston Southern,Florida State,64,82,38,6,1,Terance Mann made Layup.
Charleston Southern,Florida State,66,82,38,15,1,Armel Potter made Jumper.
Charleston Southern,Florida State,66,82,38,20,0,Charleston Southern  Timeout
Charleston Southern,Florida State,66,82,38,28,0,Christ Koumadje missed Dunk.
Charleston Southern,Florida State,66,82,38,28,0,Christ Koumadje Offensive Rebound.
Charleston Southern,Florida State,66,84,38,30,1,Christ Koumadje made Layup.
Charleston Southern,Florida State,66,84,38,41,0,Jamar Martin missed Three Point Jumper.
Charleston Southern,Florida State,66,84,38,41,0,CJ Walker Defensive Rebound.
Charleston Southern,Florida State,66,86,38,47,1,Trent Forrest made Layup.
Charleston Southern,Florida State,66,86,38,58,0,Jamar Martin missed Three Point Jumper.
Charleston Southern,Florida State,66,86,38,58,0,Christ Koumadje Defensive Rebound.
Charleston Southern,Florida State,66,88,39,23,1,Christ Koumadje made Layup. Assisted by Braian Angola-Rodas.
Charleston Southern,Florida State,66,88,39,41,0,Foul on Braian Angola-Rodas.
Charleston Southern,Florida State,67,88,39,41,1,Christian Keeling made Free Throw.
Charleston Southern,Florida State,67,88,39,41,0,Christian Keeling missed Free Throw.
Charleston Southern,Florida State,67,88,39,41,0,Trent Forrest Defensive Rebound.
Charleston Southern,Florida State,67,88,40,0,0,End of Game
