Away Team,Home Team,Away Score, Home Score,Minute,Second,isScoringPosession,Desc.
Charleston Southern,Florida State,2,0,0,18,1,Christian Keeling made Jumper. Assisted by Armel Potter.
Charleston Southern,Florida State,2,0,0,29,0,Dwayne Bacon missed Three Point Jumper.
Charleston Southern,Florida State,2,0,0,29,0,Charleston Southern Defensive Rebound.
Charleston Southern,Florida State,2,0,0,55,0,Foul on Ugo Mmonu.
Charleston Southern,Florida State,2,0,0,55,0,Ugo Mmonu Turnover.
Charleston Southern,Florida State,2,0,1,5,0,Michael Ojo Turnover.
Charleston Southern,Florida State,2,0,1,7,0,Cortez Mitchell Steal.
Charleston Southern,Florida State,2,0,1,9,0,Cortez Mitchell missed Layup.
Charleston Southern,Florida State,2,0,1,9,0,Michael Ojo Block.
Charleston Southern,Florida State,2,0,1,10,0,Jonathan Isaac Defensive Rebound.
Charleston Southern,Florida State,2,0,1,15,0,Terance Mann Turnover.
Charleston Southern,Florida State,2,0,1,32,0,Christian Keeling Turnover.
Charleston Southern,Florida State,2,0,1,33,0,Jonathan Isaac Steal.
Charleston Southern,Florida State,2,2,1,35,1,Xavier Rathan-Mayes made Layup.
Charleston Southern,Florida State,2,2,1,48,0,Armel Potter Turnover.
Charleston Southern,Florida State,2,2,1,51,0,Xavier Rathan-Mayes Steal.
Charleston Southern,Florida State,2,4,1,52,1,Xavier Rathan-Mayes made Layup. Assisted by Dwayne Bacon.
Charleston Southern,Florida State,2,4,2,8,0,Cortez Mitchell missed Three Point Jumper.
Charleston Southern,Florida State,2,4,2,8,0,Michael Ojo Defensive Rebound.
Charleston Southern,Florida State,2,4,2,16,0,Dwayne Bacon missed Jumper.
Charleston Southern,Florida State,2,4,2,16,0,Javis Howard Defensive Rebound.
Charleston Southern,Florida State,2,4,2,35,0,Armel Potter missed Jumper.
Charleston Southern,Florida State,2,4,2,35,0,Xavier Rathan-Mayes Defensive Rebound.
Charleston Southern,Florida State,2,6,2,47,1,Michael Ojo made Dunk. Assisted by Xavier Rathan-Mayes.
Charleston Southern,Florida State,4,6,3,7,1,Cortez Mitchell made Layup.
Charleston Southern,Florida State,4,6,3,16,0,Foul on Armel Potter.
Charleston Southern,Florida State,4,6,3,31,0,Terance Mann missed Three Point Jumper.
Charleston Southern,Florida State,4,6,3,31,0,Charleston Southern Deadball Team Rebound.
Charleston Southern,Florida State,4,6,3,31,0,Foul on Phil Cofer.
Charleston Southern,Florida State,4,6,3,59,0,Cortez Mitchell missed Three Point Jumper.
Charleston Southern,Florida State,4,6,3,59,0,Jarquez Smith Defensive Rebound.
Charleston Southern,Florida State,4,6,4,9,0,Xavier Rathan-Mayes missed Three Point Jumper.
Charleston Southern,Florida State,4,6,4,9,0,Raemond Robinson Defensive Rebound.
Charleston Southern,Florida State,4,6,4,14,0,Cortez Mitchell missed Layup.
Charleston Southern,Florida State,4,6,4,14,0,Jarquez Smith Block.
Charleston Southern,Florida State,4,6,4,17,0,Jamal Thomas Offensive Rebound.
Charleston Southern,Florida State,4,6,4,20,0,Foul on Terance Mann.
Charleston Southern,Florida State,4,6,4,20,0,Official TV Timeout
Charleston Southern,Florida State,5,6,4,20,1,Cortez Mitchell made Free Throw.
Charleston Southern,Florida State,6,6,4,20,1,Cortez Mitchell made Free Throw.
Charleston Southern,Florida State,6,6,4,34,0,Terance Mann missed Jumper.
Charleston Southern,Florida State,6,6,4,34,0,Jamar Martin Defensive Rebound.
Charleston Southern,Florida State,9,6,4,53,1,Jamar Martin made Three Point Jumper. Assisted by Raemond Robinson.
Charleston Southern,Florida State,9,6,5,19,0,Foul on Jamal Thomas.
Charleston Southern,Florida State,9,6,5,19,0,Dwayne Bacon missed Free Throw.
Charleston Southern,Florida State,9,6,5,19,0,Florida St Deadball Team Rebound.
Charleston Southern,Florida State,9,7,5,19,1,Dwayne Bacon made Free Throw.
Charleston Southern,Florida State,9,7,5,44,0,Jamal Thomas Turnover.
Charleston Southern,Florida State,9,7,5,47,0,Jonathan Isaac Steal.
Charleston Southern,Florida State,9,7,5,49,0,Foul on Jamal Thomas.
Charleston Southern,Florida State,9,7,5,56,0,Foul on Raemond Robinson.
Charleston Southern,Florida State,9,8,5,56,1,Braian Angola-Rodas made Free Throw.
Charleston Southern,Florida State,9,9,5,56,1,Braian Angola-Rodas made Free Throw.
Charleston Southern,Florida State,9,10,5,56,1,Braian Angola-Rodas made Free Throw.
Charleston Southern,Florida State,11,10,6,8,1,Jordan Jones made Layup. Assisted by Raemond Robinson.
Charleston Southern,Florida State,11,12,6,21,1,Jarquez Smith made Layup.
Charleston Southern,Florida State,11,12,6,37,0,Jamar Martin missed Three Point Jumper.
Charleston Southern,Florida State,11,12,6,37,0,Charleston Southern Deadball Team Rebound.
Charleston Southern,Florida State,11,12,6,38,0,Foul on Jarquez Smith.
Charleston Southern,Florida State,14,12,7,2,1,Jamar Martin made Three Point Jumper. Assisted by Cortez Mitchell.
Charleston Southern,Florida State,14,12,7,17,0,Phil Cofer Turnover.
Charleston Southern,Florida State,14,12,7,18,0,Jamar Martin Steal.
Charleston Southern,Florida State,17,12,7,32,1,Cortez Mitchell made Three Point Jumper.
Charleston Southern,Florida State,17,14,7,54,1,Braian Angola-Rodas made Layup.
Charleston Southern,Florida State,17,14,8,11,0,Cortez Mitchell Turnover.
Charleston Southern,Florida State,17,14,8,11,0,Braian Angola-Rodas Steal.
Charleston Southern,Florida State,17,14,8,11,0,Official TV Timeout
Charleston Southern,Florida State,17,14,8,32,0,Christ Koumadje missed Jumper.
Charleston Southern,Florida State,17,14,8,32,0,Jonathan Isaac Offensive Rebound.
Charleston Southern,Florida State,17,14,8,35,0,Jonathan Isaac missed Layup.
Charleston Southern,Florida State,17,14,8,35,0,Christ Koumadje Offensive Rebound.
Charleston Southern,Florida State,17,14,8,37,0,Christ Koumadje missed Two Point Tip Shot.
Charleston Southern,Florida State,17,14,8,37,0,Trent Forrest Offensive Rebound.
Charleston Southern,Florida State,17,16,8,53,1,Christ Koumadje made Jumper.
Charleston Southern,Florida State,17,16,9,9,0,Foul on Christ Koumadje.
Charleston Southern,Florida State,17,16,9,16,0,Ugo Mmonu missed Layup.
Charleston Southern,Florida State,17,16,9,16,0,Christ Koumadje Block.
Charleston Southern,Florida State,17,16,9,17,0,Charleston Southern Offensive Rebound.
Charleston Southern,Florida State,17,16,9,37,0,Ugo Mmonu missed Jumper.
Charleston Southern,Florida State,17,16,9,37,0,Braian Angola-Rodas Defensive Rebound.
Charleston Southern,Florida State,17,16,9,52,0,Jonathan Isaac missed Three Point Jumper.
Charleston Southern,Florida State,17,16,9,52,0,Armel Potter Defensive Rebound.
Charleston Southern,Florida State,17,16,10,15,0,Jamal Thomas missed Three Point Jumper.
Charleston Southern,Florida State,17,16,10,15,0,Dwayne Bacon Defensive Rebound.
Charleston Southern,Florida State,17,16,10,24,0,Braian Angola-Rodas missed Three Point Jumper.
Charleston Southern,Florida State,17,16,10,24,0,Trent Forrest Offensive Rebound.
Charleston Southern,Florida State,17,19,10,45,1,Dwayne Bacon made Three Point Jumper.
Charleston Southern,Florida State,17,19,10,58,0,Armel Potter missed Jumper.
Charleston Southern,Florida State,17,19,10,58,0,Dwayne Bacon Defensive Rebound.
Charleston Southern,Florida State,17,21,11,4,1,Trent Forrest made Layup.
Charleston Southern,Florida State,17,21,11,13,0,Charleston Southern  Timeout
Charleston Southern,Florida State,19,21,11,19,1,Javis Howard made Jumper.
Charleston Southern,Florida State,19,23,11,34,1,Christ Koumadje made Layup. Assisted by Trent Forrest.
Charleston Southern,Florida State,19,23,11,34,0,Foul on Javis Howard.
Charleston Southern,Florida State,19,24,11,34,1,Christ Koumadje made Free Throw.
Charleston Southern,Florida State,21,24,12,2,1,Javis Howard made Jumper.
Charleston Southern,Florida State,21,26,12,26,1,Trent Forrest made Jumper.
Charleston Southern,Florida State,21,26,12,36,0,Cortez Mitchell Turnover.
Charleston Southern,Florida State,21,26,12,37,0,Dwayne Bacon Steal.
Charleston Southern,Florida State,21,26,12,41,0,Official TV Timeout
Charleston Southern,Florida State,21,26,12,45,0,Foul on Christ Koumadje.
Charleston Southern,Florida State,21,26,12,45,0,Christ Koumadje Turnover.
Charleston Southern,Florida State,21,26,13,1,0,Raemond Robinson missed Three Point Jumper.
Charleston Southern,Florida State,21,26,13,1,0,Dwayne Bacon Defensive Rebound.
Charleston Southern,Florida State,21,26,13,9,0,Xavier Rathan-Mayes missed Three Point Jumper.
Charleston Southern,Florida State,21,26,13,9,0,Dwayne Bacon Offensive Rebound.
Charleston Southern,Florida State,21,28,13,11,1,Dwayne Bacon made Layup.
Charleston Southern,Florida State,21,28,13,18,0,Foul on Cortez Mitchell.
Charleston Southern,Florida State,21,28,13,18,0,Cortez Mitchell Turnover.
Charleston Southern,Florida State,21,30,13,30,1,Dwayne Bacon made Jumper. Assisted by CJ Walker.
Charleston Southern,Florida State,21,30,14,1,0,Christian Keeling missed Three Point Jumper.
Charleston Southern,Florida State,21,30,14,1,0,Florida St Defensive Rebound.
Charleston Southern,Florida State,21,30,14,19,0,Michael Ojo missed Dunk.
Charleston Southern,Florida State,21,30,14,19,0,Javis Howard Defensive Rebound.
Charleston Southern,Florida State,21,30,14,52,0,Armel Potter missed Three Point Jumper.
Charleston Southern,Florida State,21,30,14,52,0,Terance Mann Defensive Rebound.
Charleston Southern,Florida State,21,32,15,3,1,Terance Mann made Layup.
Charleston Southern,Florida State,21,32,15,25,0,Jamar Martin Turnover.
Charleston Southern,Florida State,21,32,15,28,0,CJ Walker Turnover.
Charleston Southern,Florida State,21,32,15,39,0,Ugo Mmonu missed Layup.
Charleston Southern,Florida State,21,32,15,39,0,Michael Ojo Defensive Rebound.
Charleston Southern,Florida State,21,32,15,46,0,Xavier Rathan-Mayes missed Jumper.
Charleston Southern,Florida State,21,32,15,46,0,Ugo Mmonu Defensive Rebound.
Charleston Southern,Florida State,21,32,16,5,0,Patrick Wallace missed Three Point Jumper.
Charleston Southern,Florida State,21,32,16,5,0,Michael Ojo Defensive Rebound.
Charleston Southern,Florida State,21,32,16,16,0,Michael Ojo Turnover.
Charleston Southern,Florida State,21,32,16,16,0,Official TV Timeout
Charleston Southern,Florida State,23,32,16,31,1,Cortez Mitchell made Jumper.
Charleston Southern,Florida State,23,34,16,51,1,Jonathan Isaac made Dunk. Assisted by Xavier Rathan-Mayes.
Charleston Southern,Florida State,26,34,17,22,1,Cortez Mitchell made Three Point Jumper.
Charleston Southern,Florida State,26,34,17,41,0,Foul on Ugo Mmonu.
Charleston Southern,Florida State,26,35,17,41,1,Michael Ojo made Free Throw.
Charleston Southern,Florida State,26,36,17,41,1,Michael Ojo made Free Throw.
Charleston Southern,Florida State,28,36,17,59,1,Christian Keeling made Layup.
Charleston Southern,Florida State,28,36,17,59,0,Foul on Braian Angola-Rodas.
Charleston Southern,Florida State,28,36,17,59,0,Christian Keeling missed Free Throw.
Charleston Southern,Florida State,28,36,17,59,0,Phil Cofer Defensive Rebound.
Charleston Southern,Florida State,28,36,18,5,0,Foul on Xavier Rathan-Mayes.
Charleston Southern,Florida State,28,36,18,5,0,Xavier Rathan-Mayes Turnover.
Charleston Southern,Florida State,28,36,18,33,0,Christian Keeling missed Jumper.
Charleston Southern,Florida State,28,36,18,33,0,Florida St Deadball Team Rebound.
Charleston Southern,Florida State,28,36,18,34,0,Foul on Javis Howard.
Charleston Southern,Florida State,28,36,18,34,0,Braian Angola-Rodas missed Free Throw.
Charleston Southern,Florida State,28,36,18,34,0,Charleston Southern Deadball Team Rebound.
Charleston Southern,Florida State,28,36,18,34,0,Foul on Jarquez Smith.
Charleston Southern,Florida State,29,36,18,34,1,Antwan Maxwell made Free Throw.
Charleston Southern,Florida State,30,36,18,34,1,Antwan Maxwell made Free Throw.
Charleston Southern,Florida State,30,36,18,46,0,Phil Cofer missed Layup.
Charleston Southern,Florida State,30,36,18,47,0,Antwan Maxwell Block.
Charleston Southern,Florida State,30,36,18,48,0,Antwan Maxwell Defensive Rebound.
Charleston Southern,Florida State,32,36,18,56,1,Christian Keeling made Layup. Assisted by Armel Potter.
Charleston Southern,Florida State,32,36,19,9,0,Foul on Jamar Martin.
Charleston Southern,Florida State,32,37,19,9,1,Dwayne Bacon made Free Throw.
Charleston Southern,Florida State,32,38,19,9,1,Dwayne Bacon made Free Throw.
Charleston Southern,Florida State,32,38,19,29,0,Raemond Robinson missed Three Point Jumper.
Charleston Southern,Florida State,32,38,19,29,0,Dwayne Bacon Defensive Rebound.
Charleston Southern,Florida State,32,38,19,42,0,Florida St  Timeout
Charleston Southern,Florida State,32,38,19,56,0,Braian Angola-Rodas missed Three Point Jumper.
Charleston Southern,Florida State,32,38,19,56,0,Antwan Maxwell Defensive Rebound.
Charleston Southern,Florida State,32,38,20,0,0,End of 1st half
Charleston Southern,Florida State,32,38,20,17,0,Armel Potter missed Three Point Jumper.
Charleston Southern,Florida State,32,38,20,17,0,Jonathan Isaac Defensive Rebound.
Charleston Southern,Florida State,32,38,20,28,0,Dwayne Bacon missed Jumper.
Charleston Southern,Florida State,32,38,20,28,0,Javis Howard Defensive Rebound.
Charleston Southern,Florida State,32,38,20,34,0,Armel Potter missed Layup.
Charleston Southern,Florida State,32,38,20,34,0,Dwayne Bacon Block.
Charleston Southern,Florida State,32,38,20,36,0,Xavier Rathan-Mayes Defensive Rebound.
Charleston Southern,Florida State,32,40,20,40,1,Terance Mann made Dunk. Assisted by Xavier Rathan-Mayes.
Charleston Southern,Florida State,32,40,21,0,0,Cortez Mitchell missed Layup.
Charleston Southern,Florida State,32,40,21,0,0,Jarquez Smith Block.
Charleston Southern,Florida State,32,40,21,1,0,Dwayne Bacon Defensive Rebound.
Charleston Southern,Florida State,32,40,21,2,0,Xavier Rathan-Mayes missed Layup.
Charleston Southern,Florida State,32,40,21,2,0,Ugo Mmonu Block.
Charleston Southern,Florida State,32,40,21,5,0,Christian Keeling Defensive Rebound.
Charleston Southern,Florida State,32,40,21,29,0,Foul on Jarquez Smith.
Charleston Southern,Florida State,32,40,21,29,0,Christian Keeling missed Free Throw.
Charleston Southern,Florida State,32,40,21,29,0,Charleston Southern Deadball Team Rebound.
Charleston Southern,Florida State,32,40,21,29,0,Christian Keeling missed Free Throw.
Charleston Southern,Florida State,32,40,21,29,0,Florida St Defensive Rebound.
Charleston Southern,Florida State,32,43,21,54,1,Jonathan Isaac made Three Point Jumper. Assisted by Xavier Rathan-Mayes.
Charleston Southern,Florida State,32,43,22,17,0,Cortez Mitchell Turnover.
Charleston Southern,Florida State,32,43,22,17,0,Terance Mann Steal.
Charleston Southern,Florida State,32,45,22,19,1,Jonathan Isaac made Dunk. Assisted by Terance Mann.
Charleston Southern,Florida State,32,45,22,21,0,Charleston Southern  Timeout
Charleston Southern,Florida State,32,45,22,46,0,Ugo Mmonu missed Jumper.
Charleston Southern,Florida State,32,45,22,46,0,Terance Mann Defensive Rebound.
Charleston Southern,Florida State,32,47,22,51,1,Dwayne Bacon made Layup. Assisted by Terance Mann.
Charleston Southern,Florida State,32,47,23,10,0,Christian Keeling missed Layup.
Charleston Southern,Florida State,32,47,23,10,0,Christ Koumadje Block.
Charleston Southern,Florida State,32,47,23,11,0,Terance Mann Defensive Rebound.
Charleston Southern,Florida State,32,47,23,17,0,Dwayne Bacon missed Jumper.
Charleston Southern,Florida State,32,47,23,17,0,Javis Howard Block.
Charleston Southern,Florida State,32,47,23,19,0,Dwayne Bacon Offensive Rebound.
Charleston Southern,Florida State,32,47,23,21,0,Dwayne Bacon missed Layup.
Charleston Southern,Florida State,32,47,23,21,0,Patrick Wallace Defensive Rebound.
Charleston Southern,Florida State,32,47,23,40,0,Christian Keeling Turnover.
Charleston Southern,Florida State,32,47,23,41,0,Dwayne Bacon Steal.
Charleston Southern,Florida State,32,49,23,43,1,Xavier Rathan-Mayes made Layup.
Charleston Southern,Florida State,34,49,23,58,1,Patrick Wallace made Layup.
Charleston Southern,Florida State,34,52,24,11,1,Xavier Rathan-Mayes made Three Point Jumper. Assisted by Terance Mann.
Charleston Southern,Florida State,34,52,24,27,0,Javis Howard missed Jumper.
Charleston Southern,Florida State,34,52,24,27,0,Christ Koumadje Block.
Charleston Southern,Florida State,34,52,24,29,0,Javis Howard Offensive Rebound.
Charleston Southern,Florida State,36,52,24,35,1,Christian Keeling made Layup. Assisted by Javis Howard.
Charleston Southern,Florida State,36,52,24,44,0,Terance Mann missed Three Point Jumper.
Charleston Southern,Florida State,36,52,24,44,0,Xavier Rathan-Mayes Offensive Rebound.
Charleston Southern,Florida State,36,52,24,48,0,Xavier Rathan-Mayes missed Layup.
Charleston Southern,Florida State,36,52,24,48,0,Ugo Mmonu Block.
Charleston Southern,Florida State,36,52,24,49,0,Patrick Wallace Defensive Rebound.
Charleston Southern,Florida State,36,52,24,55,0,Patrick Wallace Turnover.
Charleston Southern,Florida State,36,52,24,55,0,Official TV Timeout
Charleston Southern,Florida State,36,52,25,23,0,CJ Walker missed Three Point Jumper.
Charleston Southern,Florida State,36,52,25,23,0,Jamar Martin Defensive Rebound.
Charleston Southern,Florida State,36,52,25,43,0,Armel Potter Turnover.
Charleston Southern,Florida State,36,52,25,51,0,Braian Angola-Rodas missed Three Point Jumper.
Charleston Southern,Florida State,36,52,25,51,0,Armel Potter Defensive Rebound.
Charleston Southern,Florida State,39,52,26,3,1,Jamar Martin made Three Point Jumper. Assisted by Cortez Mitchell.
Charleston Southern,Florida State,39,52,26,23,0,Foul on Jamar Martin.
Charleston Southern,Florida State,39,53,26,23,1,CJ Walker made Free Throw.
Charleston Southern,Florida State,39,54,26,23,1,CJ Walker made Free Throw.
Charleston Southern,Florida State,42,54,26,36,1,Jamal Thomas made Three Point Jumper. Assisted by Cortez Mitchell.
Charleston Southern,Florida State,42,54,27,2,0,Foul on Cortez Mitchell.
Charleston Southern,Florida State,42,54,27,21,0,Dwayne Bacon missed Layup.
Charleston Southern,Florida State,42,54,27,21,0,Javis Howard Block.
Charleston Southern,Florida State,42,54,27,22,0,Dwayne Bacon Offensive Rebound.
Charleston Southern,Florida State,42,54,27,22,0,Foul on Jamal Thomas.
Charleston Southern,Florida State,42,55,27,22,1,Dwayne Bacon made Free Throw.
Charleston Southern,Florida State,42,56,27,22,1,Dwayne Bacon made Free Throw.
Charleston Southern,Florida State,45,56,27,36,1,Jamar Martin made Three Point Jumper. Assisted by Cortez Mitchell.
Charleston Southern,Florida State,45,59,27,49,1,Jonathan Isaac made Three Point Jumper.
Charleston Southern,Florida State,45,59,28,8,0,Foul on Xavier Rathan-Mayes.
Charleston Southern,Florida State,45,59,28,8,0,Official TV Timeout
Charleston Southern,Florida State,46,59,28,8,1,Armel Potter made Free Throw.
Charleston Southern,Florida State,47,59,28,8,1,Armel Potter made Free Throw.
Charleston Southern,Florida State,47,59,28,16,0,Foul on Jamar Martin.
Charleston Southern,Florida State,47,59,28,22,0,Xavier Rathan-Mayes missed Three Point Jumper.
Charleston Southern,Florida State,47,59,28,22,0,Florida St Deadball Team Rebound.
Charleston Southern,Florida State,47,59,28,22,0,Foul on Ugo Mmonu.
Charleston Southern,Florida State,47,59,28,37,0,Jonathan Isaac missed Three Point Jumper.
Charleston Southern,Florida State,47,59,28,37,0,Terance Mann Offensive Rebound.
Charleston Southern,Florida State,47,59,28,42,0,Xavier Rathan-Mayes Turnover.
Charleston Southern,Florida State,47,59,28,56,0,Foul on Phil Cofer.
Charleston Southern,Florida State,48,59,28,56,1,Cortez Mitchell made Free Throw.
Charleston Southern,Florida State,49,59,28,56,1,Cortez Mitchell made Free Throw.
Charleston Southern,Florida State,49,61,29,11,1,Phil Cofer made Dunk. Assisted by Jonathan Isaac.
Charleston Southern,Florida State,49,61,29,29,0,Foul on Dwayne Bacon.
Charleston Southern,Florida State,49,61,29,47,0,Armel Potter missed Free Throw.
Charleston Southern,Florida State,49,61,29,47,0,Foul on Jonathan Isaac.
Charleston Southern,Florida State,49,61,29,47,0,Charleston Southern Deadball Team Rebound.
Charleston Southern,Florida State,50,61,29,48,1,Armel Potter made Free Throw.
Charleston Southern,Florida State,50,63,30,9,1,Phil Cofer made Jumper.
Charleston Southern,Florida State,50,63,30,34,0,Cortez Mitchell missed Layup.
Charleston Southern,Florida State,50,63,30,34,0,Christian Keeling Offensive Rebound.
Charleston Southern,Florida State,52,63,30,34,1,Christian Keeling made Layup.
Charleston Southern,Florida State,52,63,30,49,0,Phil Cofer missed Dunk.
Charleston Southern,Florida State,52,63,30,49,0,Ugo Mmonu Block.
Charleston Southern,Florida State,52,63,30,50,0,Cortez Mitchell Defensive Rebound.
Charleston Southern,Florida State,54,63,31,1,1,Patrick Wallace made Layup.
Charleston Southern,Florida State,54,65,31,9,1,Terance Mann made Layup. Assisted by Xavier Rathan-Mayes.
Charleston Southern,Florida State,54,65,31,23,0,Foul on Dwayne Bacon.
Charleston Southern,Florida State,56,65,31,40,1,Patrick Wallace made Layup.
Charleston Southern,Florida State,56,68,31,51,1,Dwayne Bacon made Three Point Jumper. Assisted by Xavier Rathan-Mayes.
Charleston Southern,Florida State,56,68,32,5,0,Patrick Wallace missed Three Point Jumper.
Charleston Southern,Florida State,56,68,32,5,0,Trent Forrest Defensive Rebound.
Charleston Southern,Florida State,56,71,32,10,1,Dwayne Bacon made Three Point Jumper. Assisted by Xavier Rathan-Mayes.
Charleston Southern,Florida State,56,71,32,23,0,Armel Potter missed Three Point Jumper.
Charleston Southern,Florida State,56,71,32,23,0,Terance Mann Defensive Rebound.
Charleston Southern,Florida State,56,71,32,31,0,Dwayne Bacon missed Three Point Jumper.
Charleston Southern,Florida State,56,71,32,31,0,Javis Howard Defensive Rebound.
Charleston Southern,Florida State,58,71,32,42,1,Christian Keeling made Layup.
Charleston Southern,Florida State,58,71,32,42,0,Official TV Timeout
Charleston Southern,Florida State,58,71,33,2,0,Jarquez Smith missed Layup.
Charleston Southern,Florida State,58,71,33,2,0,Cortez Mitchell Defensive Rebound.
Charleston Southern,Florida State,58,71,33,7,0,Patrick Wallace Turnover.
Charleston Southern,Florida State,58,71,33,21,0,Foul on Antwan Maxwell.
Charleston Southern,Florida State,58,71,33,24,0,Xavier Rathan-Mayes Turnover.
Charleston Southern,Florida State,58,71,33,40,0,Christian Keeling missed Jumper.
Charleston Southern,Florida State,58,71,33,40,0,Jamar Martin Offensive Rebound.
Charleston Southern,Florida State,58,71,33,46,0,Patrick Wallace missed Three Point Jumper.
Charleston Southern,Florida State,58,71,33,46,0,Xavier Rathan-Mayes Defensive Rebound.
Charleston Southern,Florida State,58,73,33,51,1,Xavier Rathan-Mayes made Layup.
Charleston Southern,Florida State,58,73,33,51,0,Foul on Cortez Mitchell.
Charleston Southern,Florida State,58,74,33,51,1,Xavier Rathan-Mayes made Free Throw.
Charleston Southern,Florida State,58,74,34,8,0,Christian Keeling missed Layup.
Charleston Southern,Florida State,58,74,34,8,0,Antwan Maxwell Offensive Rebound.
Charleston Southern,Florida State,58,74,34,10,0,Antwan Maxwell missed Layup.
Charleston Southern,Florida State,58,74,34,10,0,Xavier Rathan-Mayes Defensive Rebound.
Charleston Southern,Florida State,58,74,34,16,0,Foul on Patrick Wallace.
Charleston Southern,Florida State,58,74,34,16,0,Trent Forrest missed Free Throw.
Charleston Southern,Florida State,58,74,34,16,0,Florida St Deadball Team Rebound.
Charleston Southern,Florida State,58,75,34,16,1,Trent Forrest made Free Throw.
Charleston Southern,Florida State,58,75,34,37,0,Armel Potter missed Layup.
Charleston Southern,Florida State,58,75,34,37,0,Trent Forrest Defensive Rebound.
Charleston Southern,Florida State,58,75,34,45,0,CJ Walker missed Three Point Jumper.
Charleston Southern,Florida State,58,75,34,45,0,Jamar Martin Defensive Rebound.
Charleston Southern,Florida State,58,75,35,0,0,Jamar Martin missed Three Point Jumper.
Charleston Southern,Florida State,58,75,35,0,0,Javis Howard Offensive Rebound.
Charleston Southern,Florida State,58,75,35,1,0,Foul on Terance Mann.
Charleston Southern,Florida State,59,75,35,1,1,Javis Howard made Free Throw.
Charleston Southern,Florida State,59,75,35,1,0,Javis Howard missed Free Throw.
Charleston Southern,Florida State,59,75,35,1,0,Dwayne Bacon Defensive Rebound.
Charleston Southern,Florida State,59,75,35,21,0,Trent Forrest Turnover.
Charleston Southern,Florida State,59,75,35,24,0,Jamar Martin Steal.
Charleston Southern,Florida State,59,75,35,26,0,Foul on CJ Walker.
Charleston Southern,Florida State,59,75,35,26,0,Jamal Thomas missed Free Throw.
Charleston Southern,Florida State,59,75,35,26,0,Trent Forrest Defensive Rebound.
Charleston Southern,Florida State,59,75,35,38,0,Jonathan Isaac missed Jumper.
Charleston Southern,Florida State,59,75,35,38,0,Jamar Martin Defensive Rebound.
Charleston Southern,Florida State,59,75,35,47,0,Jamar Martin Turnover.
Charleston Southern,Florida State,59,75,35,47,0,Jonathan Isaac Steal.
Charleston Southern,Florida State,59,75,35,47,0,Foul on Jamar Martin.
Charleston Southern,Florida State,59,75,35,47,0,Jonathan Isaac missed Free Throw.
Charleston Southern,Florida State,59,75,35,47,0,Christian Keeling Defensive Rebound.
Charleston Southern,Florida State,59,75,36,15,0,Ugo Mmonu Turnover.
Charleston Southern,Florida State,59,75,36,16,0,CJ Walker Steal.
Charleston Southern,Florida State,59,75,36,18,0,Trent Forrest missed Layup.
Charleston Southern,Florida State,59,75,36,18,0,CJ Walker Offensive Rebound.
Charleston Southern,Florida State,59,77,36,23,1,CJ Walker made Two Point Tip Shot.
Charleston Southern,Florida State,61,77,36,27,1,Raemond Robinson made Layup. Assisted by Javis Howard.
Charleston Southern,Florida State,61,80,36,46,1,Dwayne Bacon made Three Point Jumper.
Charleston Southern,Florida State,61,80,36,51,0,Florida St  Timeout
Charleston Southern,Florida State,61,80,36,51,0,Official TV Timeout
